auto_log/((1, 192, 8, 8, 8), (192, 192, 3, 3, 3), (1, 192, 8, 8, 8), (1, 1, 1), (1, 1, 1), 1, 1, None)_fwd.log
{"i": ["cuda", "schedule_direct_3d_cuda", [[1, 192, 8, 8, 8], [192, 192, 3, 3, 3], [1, 1, 1], [1, 1, 1], 1], {}, ["schedule_direct_3d_cuda", [1, 192, 8, 8, 8], [192, 192, 3, 3, 3], [1, 1, 1], [1, 1, 1], 1], {"i": 1713787859, "t": "", "c": null, "e": [["tile_f", "sp", [-1, 3, 4, 1]], ["tile_d", "sp", [-1, 1, 1, 8]], ["tile_y", "sp", [-1, 1, 4, 1]], ["tile_x", "sp", [-1, 2, 1, 2]], ["tile_rc", "sp", [-1, 16]], ["tile_rd", "sp", [-1, 3]], ["tile_ry", "sp", [-1, 1]], ["tile_rx", "sp", [-1, 3]], ["auto_unroll_max_step", "ot", 1500], ["unroll_explicit", "ot", 1]]}], "r": [[0.00170109, 0.0017012595], 0, 2.3525123596191406, 1578559516.4949586], "v": 0.1}
{"i": ["cuda", "schedule_direct_3d_cuda", [[1, 192, 8, 8, 8], [192, 192, 3, 3, 3], [1, 1, 1], [1, 1, 1], 1], {}, ["schedule_direct_3d_cuda", [1, 192, 8, 8, 8], [192, 192, 3, 3, 3], [1, 1, 1], [1, 1, 1], 1], {"i": 866530507, "t": "", "c": null, "e": [["tile_f", "sp", [-1, 1, 8, 12]], ["tile_d", "sp", [-1, 1, 1, 8]], ["tile_y", "sp", [-1, 1, 4, 1]], ["tile_x", "sp", [-1, 1, 4, 1]], ["tile_rc", "sp", [-1, 1]], ["tile_rd", "sp", [-1, 3]], ["tile_ry", "sp", [-1, 3]], ["tile_rx", "sp", [-1, 3]], ["auto_unroll_max_step", "ot", 1500], ["unroll_explicit", "ot", 0]]}], "r": [[0.00312351775, 0.00345266725], 0, 1.2136125564575195, 1578559517.3647435], "v": 0.1}
{"i": ["cuda", "schedule_direct_3d_cuda", [[1, 192, 8, 8, 8], [192, 192, 3, 3, 3], [1, 1, 1], [1, 1, 1], 1], {}, ["schedule_direct_3d_cuda", [1, 192, 8, 8, 8], [192, 192, 3, 3, 3], [1, 1, 1], [1, 1, 1], 1], {"i": 790398386, "t": "", "c": null, "e": [["tile_f", "sp", [-1, 2, 8, 1]], ["tile_d", "sp", [-1, 1, 1, 4]], ["tile_y", "sp", [-1, 1, 2, 4]], ["tile_x", "sp", [-1, 1, 1, 1]], ["tile_rc", "sp", [-1, 1]], ["tile_rd", "sp", [-1, 3]], ["tile_ry", "sp", [-1, 1]], ["tile_rx", "sp", [-1, 3]], ["auto_unroll_max_step", "ot", 1500], ["unroll_explicit", "ot", 0]]}], "r": [[0.00076670525, 0.00076654975], 0, 0.9412562847137451, 1578559517.968903], "v": 0.1}
{"i": ["cuda", "schedule_direct_3d_cuda", [[1, 192, 8, 8, 8], [192, 192, 3, 3, 3], [1, 1, 1], [1, 1, 1], 1], {}, ["schedule_direct_3d_cuda", [1, 192, 8, 8, 8], [192, 192, 3, 3, 3], [1, 1, 1], [1, 1, 1], 1], {"i": 82770274, "t": "", "c": null, "e": [["tile_f", "sp", [-1, 2, 4, 1]], ["tile_d", "sp", [-1, 1, 1, 1]], ["tile_y", "sp", [-1, 2, 1, 4]], ["tile_x", "sp", [-1, 1, 4, 2]], ["tile_rc", "sp", [-1, 3]], ["tile_rd", "sp", [-1, 1]], ["tile_ry", "sp", [-1, 3]], ["tile_rx", "sp", [-1, 1]], ["auto_unroll_max_step", "ot", 0], ["unroll_explicit", "ot", 0]]}], "r": [[0.00150694225, 0.00150748025], 0, 1.031914472579956, 1578559526.1524158], "v": 0.1}
{"i": ["cuda", "schedule_direct_3d_cuda", [[1, 192, 8, 8, 8], [192, 192, 3, 3, 3], [1, 1, 1], [1, 1, 1], 1], {}, ["schedule_direct_3d_cuda", [1, 192, 8, 8, 8], [192, 192, 3, 3, 3], [1, 1, 1], [1, 1, 1], 1], {"i": 779224438, "t": "", "c": null, "e": [["tile_f", "sp", [-1, 12, 4, 2]], ["tile_d", "sp", [-1, 1, 1, 1]], ["tile_y", "sp", [-1, 1, 1, 4]], ["tile_x", "sp", [-1, 2, 1, 4]], ["tile_rc", "sp", [-1, 32]], ["tile_rd", "sp", [-1, 1]], ["tile_ry", "sp", [-1, 1]], ["tile_rx", "sp", [-1, 3]], ["auto_unroll_max_step", "ot", 1500], ["unroll_explicit", "ot", 0]]}], "r": [[0.07041720475, 0.07079382575], 0, 4.358643531799316, 1578559528.0281615], "v": 0.1}
{"i": ["cuda", "schedule_direct_3d_cuda", [[1, 192, 8, 8, 8], [192, 192, 3, 3, 3], [1, 1, 1], [1, 1, 1], 1], {}, ["schedule_direct_3d_cuda", [1, 192, 8, 8, 8], [192, 192, 3, 3, 3], [1, 1, 1], [1, 1, 1], 1], {"i": 1233422714, "t": "", "c": null, "e": [["tile_f", "sp", [-1, 1, 1, 32]], ["tile_d", "sp", [-1, 1, 1, 1]], ["tile_y", "sp", [-1, 2, 2, 1]], ["tile_x", "sp", [-1, 2, 1, 4]], ["tile_rc", "sp", [-1, 48]], ["tile_rd", "sp", [-1, 1]], ["tile_ry", "sp", [-1, 1]], ["tile_rx", "sp", [-1, 1]], ["auto_unroll_max_step", "ot", 512], ["unroll_explicit", "ot", 1]]}], "r": [[0.08751863175, 0.08723288825], 0, 3.2274556159973145, 1578559529.6007001], "v": 0.1}
{"i": ["cuda", "schedule_direct_3d_cuda", [[1, 192, 8, 8, 8], [192, 192, 3, 3, 3], [1, 1, 1], [1, 1, 1], 1], {}, ["schedule_direct_3d_cuda", [1, 192, 8, 8, 8], [192, 192, 3, 3, 3], [1, 1, 1], [1, 1, 1], 1], {"i": 702885576, "t": "", "c": null, "e": [["tile_f", "sp", [-1, 1, 6, 2]], ["tile_d", "sp", [-1, 2, 1, 1]], ["tile_y", "sp", [-1, 1, 1, 4]], ["tile_x", "sp", [-1, 1, 8, 1]], ["tile_rc", "sp", [-1, 32]], ["tile_rd", "sp", [-1, 1]], ["tile_ry", "sp", [-1, 3]], ["tile_rx", "sp", [-1, 1]], ["auto_unroll_max_step", "ot", 1500], ["unroll_explicit", "ot", 0]]}], "r": [[0.000966413, 0.00097154375], 0, 1.0365502834320068, 1578559530.151734], "v": 0.1}
{"i": ["cuda", "schedule_direct_3d_cuda", [[1, 192, 8, 8, 8], [192, 192, 3, 3, 3], [1, 1, 1], [1, 1, 1], 1], {}, ["schedule_direct_3d_cuda", [1, 192, 8, 8, 8], [192, 192, 3, 3, 3], [1, 1, 1], [1, 1, 1], 1], {"i": 1514203977, "t": "", "c": null, "e": [["tile_f", "sp", [-1, 64, 1, 3]], ["tile_d", "sp", [-1, 1, 1, 8]], ["tile_y", "sp", [-1, 1, 4, 1]], ["tile_x", "sp", [-1, 4, 2, 1]], ["tile_rc", "sp", [-1, 4]], ["tile_rd", "sp", [-1, 1]], ["tile_ry", "sp", [-1, 1]], ["tile_rx", "sp", [-1, 1]], ["auto_unroll_max_step", "ot", 1500], ["unroll_explicit", "ot", 1]]}], "r": [[0.27529263075, 0.275286806], 0, 5.722228050231934, 1578559533.381106], "v": 0.1}
{"i": ["cuda", "schedule_direct_3d_cuda", [[1, 192, 8, 8, 8], [192, 192, 3, 3, 3], [1, 1, 1], [1, 1, 1], 1], {}, ["schedule_direct_3d_cuda", [1, 192, 8, 8, 8], [192, 192, 3, 3, 3], [1, 1, 1], [1, 1, 1], 1], {"i": 831818804, "t": "", "c": null, "e": [["tile_f", "sp", [-1, 1, 24, 1]], ["tile_d", "sp", [-1, 2, 1, 2]], ["tile_y", "sp", [-1, 4, 1, 1]], ["tile_x", "sp", [-1, 1, 8, 1]], ["tile_rc", "sp", [-1, 2]], ["tile_rd", "sp", [-1, 1]], ["tile_ry", "sp", [-1, 3]], ["tile_rx", "sp", [-1, 3]], ["auto_unroll_max_step", "ot", 1500], ["unroll_explicit", "ot", 0]]}], "r": [[0.00054723475, 0.00054784875], 0, 1.0129656791687012, 1578559534.0034268], "v": 0.1}
{"i": ["cuda", "schedule_direct_3d_cuda", [[1, 192, 8, 8, 8], [192, 192, 3, 3, 3], [1, 1, 1], [1, 1, 1], 1], {}, ["schedule_direct_3d_cuda", [1, 192, 8, 8, 8], [192, 192, 3, 3, 3], [1, 1, 1], [1, 1, 1], 1], {"i": 1438751164, "t": "", "c": null, "e": [["tile_f", "sp", [-1, 1, 32, 3]], ["tile_d", "sp", [-1, 2, 1, 4]], ["tile_y", "sp", [-1, 1, 1, 8]], ["tile_x", "sp", [-1, 1, 2, 1]], ["tile_rc", "sp", [-1, 4]], ["tile_rd", "sp", [-1, 1]], ["tile_ry", "sp", [-1, 3]], ["tile_rx", "sp", [-1, 3]], ["auto_unroll_max_step", "ot", 512], ["unroll_explicit", "ot", 1]]}], "r": [[0.00386053675, 0.003860259], 0, 1.4871366024017334, 1578559536.3560693], "v": 0.1}
{"i": ["cuda", "schedule_direct_3d_cuda", [[1, 192, 8, 8, 8], [192, 192, 3, 3, 3], [1, 1, 1], [1, 1, 1], 1], {}, ["schedule_direct_3d_cuda", [1, 192, 8, 8, 8], [192, 192, 3, 3, 3], [1, 1, 1], [1, 1, 1], 1], {"i": 402380511, "t": "", "c": null, "e": [["tile_f", "sp", [-1, 2, 2, 1]], ["tile_d", "sp", [-1, 2, 1, 1]], ["tile_y", "sp", [-1, 1, 2, 4]], ["tile_x", "sp", [-1, 1, 2, 2]], ["tile_rc", "sp", [-1, 32]], ["tile_rd", "sp", [-1, 1]], ["tile_ry", "sp", [-1, 3]], ["tile_rx", "sp", [-1, 1]], ["auto_unroll_max_step", "ot", 512], ["unroll_explicit", "ot", 0]]}], "r": [[0.003695426, 0.003686454], 0, 2.2188098430633545, 1578559537.2623646], "v": 0.1}
{"i": ["cuda", "schedule_direct_3d_cuda", [[1, 192, 8, 8, 8], [192, 192, 3, 3, 3], [1, 1, 1], [1, 1, 1], 1], {}, ["schedule_direct_3d_cuda", [1, 192, 8, 8, 8], [192, 192, 3, 3, 3], [1, 1, 1], [1, 1, 1], 1], {"i": 69888147, "t": "", "c": null, "e": [["tile_f", "sp", [-1, 1, 1, 3]], ["tile_d", "sp", [-1, 1, 1, 1]], ["tile_y", "sp", [-1, 1, 1, 1]], ["tile_x", "sp", [-1, 1, 1, 1]], ["tile_rc", "sp", [-1, 96]], ["tile_rd", "sp", [-1, 3]], ["tile_ry", "sp", [-1, 1]], ["tile_rx", "sp", [-1, 1]], ["auto_unroll_max_step", "ot", 0], ["unroll_explicit", "ot", 0]]}], "r": [[0.07344657325, 0.0734052925], 0, 1.3947579860687256, 1578559538.4508653], "v": 0.1}
{"i": ["cuda", "schedule_direct_3d_cuda", [[1, 192, 8, 8, 8], [192, 192, 3, 3, 3], [1, 1, 1], [1, 1, 1], 1], {}, ["schedule_direct_3d_cuda", [1, 192, 8, 8, 8], [192, 192, 3, 3, 3], [1, 1, 1], [1, 1, 1], 1], {"i": 208751309, "t": "", "c": null, "e": [["tile_f", "sp", [-1, 2, 1, 6]], ["tile_d", "sp", [-1, 8, 1, 1]], ["tile_y", "sp", [-1, 1, 2, 1]], ["tile_x", "sp", [-1, 1, 2, 2]], ["tile_rc", "sp", [-1, 16]], ["tile_rd", "sp", [-1, 3]], ["tile_ry", "sp", [-1, 1]], ["tile_rx", "sp", [-1, 3]], ["auto_unroll_max_step", "ot", 0], ["unroll_explicit", "ot", 0]]}], "r": [[0.00650661625, 0.006421545], 0, 1.354041576385498, 1578559545.7300756], "v": 0.1}
{"i": ["cuda", "schedule_direct_3d_cuda", [[1, 192, 8, 8, 8], [192, 192, 3, 3, 3], [1, 1, 1], [1, 1, 1], 1], {}, ["schedule_direct_3d_cuda", [1, 192, 8, 8, 8], [192, 192, 3, 3, 3], [1, 1, 1], [1, 1, 1], 1], {"i": 760293201, "t": "", "c": null, "e": [["tile_f", "sp", [-1, 6, 8, 2]], ["tile_d", "sp", [-1, 2, 1, 4]], ["tile_y", "sp", [-1, 1, 2, 4]], ["tile_x", "sp", [-1, 1, 1, 4]], ["tile_rc", "sp", [-1, 3]], ["tile_rd", "sp", [-1, 1]], ["tile_ry", "sp", [-1, 1]], ["tile_rx", "sp", [-1, 3]], ["auto_unroll_max_step", "ot", 1500], ["unroll_explicit", "ot", 0]]}], "r": [[0.10060188325, 0.09226173175], 0, 7.700690031051636, 1578559553.65356], "v": 0.1}
{"i": ["cuda", "schedule_direct_3d_cuda", [[1, 192, 8, 8, 8], [192, 192, 3, 3, 3], [1, 1, 1], [1, 1, 1], 1], {}, ["schedule_direct_3d_cuda", [1, 192, 8, 8, 8], [192, 192, 3, 3, 3], [1, 1, 1], [1, 1, 1], 1], {"i": 16817212, "t": "", "c": null, "e": [["tile_f", "sp", [-1, 1, 48, 1]], ["tile_d", "sp", [-1, 2, 1, 2]], ["tile_y", "sp", [-1, 4, 1, 1]], ["tile_x", "sp", [-1, 2, 2, 1]], ["tile_rc", "sp", [-1, 12]], ["tile_rd", "sp", [-1, 1]], ["tile_ry", "sp", [-1, 1]], ["tile_rx", "sp", [-1, 1]], ["auto_unroll_max_step", "ot", 0], ["unroll_explicit", "ot", 0]]}], "r": [[0.001560807, 0.0015606655], 0, 0.7438554763793945, 1578559554.1721244], "v": 0.1}
{"i": ["cuda", "schedule_direct_3d_cuda", [[1, 192, 8, 8, 8], [192, 192, 3, 3, 3], [1, 1, 1], [1, 1, 1], 1], {}, ["schedule_direct_3d_cuda", [1, 192, 8, 8, 8], [192, 192, 3, 3, 3], [1, 1, 1], [1, 1, 1], 1], {"i": 493318672, "t": "", "c": null, "e": [["tile_f", "sp", [-1, 1, 4, 2]], ["tile_d", "sp", [-1, 1, 1, 2]], ["tile_y", "sp", [-1, 1, 1, 2]], ["tile_x", "sp", [-1, 1, 1, 2]], ["tile_rc", "sp", [-1, 2]], ["tile_rd", "sp", [-1, 3]], ["tile_ry", "sp", [-1, 1]], ["tile_rx", "sp", [-1, 3]], ["auto_unroll_max_step", "ot", 512], ["unroll_explicit", "ot", 0]]}], "r": [[0.00177920475, 0.00177840325], 0, 0.8770997524261475, 1578559554.7652004], "v": 0.1}
{"i": ["cuda", "schedule_direct_3d_cuda", [[1, 192, 8, 8, 8], [192, 192, 3, 3, 3], [1, 1, 1], [1, 1, 1], 1], {}, ["schedule_direct_3d_cuda", [1, 192, 8, 8, 8], [192, 192, 3, 3, 3], [1, 1, 1], [1, 1, 1], 1], {"i": 650508136, "t": "", "c": null, "e": [["tile_f", "sp", [-1, 16, 4, 1]], ["tile_d", "sp", [-1, 1, 1, 4]], ["tile_y", "sp", [-1, 2, 1, 1]], ["tile_x", "sp", [-1, 1, 1, 1]], ["tile_rc", "sp", [-1, 6]], ["tile_rd", "sp", [-1, 3]], ["tile_ry", "sp", [-1, 1]], ["tile_rx", "sp", [-1, 1]], ["auto_unroll_max_step", "ot", 1500], ["unroll_explicit", "ot", 0]]}], "r": [[0.00208058875, 0.00207235875], 0, 1.344839096069336, 1578559556.8239753], "v": 0.1}
{"i": ["cuda", "schedule_direct_3d_cuda", [[1, 192, 8, 8, 8], [192, 192, 3, 3, 3], [1, 1, 1], [1, 1, 1], 1], {}, ["schedule_direct_3d_cuda", [1, 192, 8, 8, 8], [192, 192, 3, 3, 3], [1, 1, 1], [1, 1, 1], 1], {"i": 923049264, "t": "", "c": null, "e": [["tile_f", "sp", [-1, 1, 48, 2]], ["tile_d", "sp", [-1, 1, 1, 2]], ["tile_y", "sp", [-1, 1, 2, 4]], ["tile_x", "sp", [-1, 1, 4, 1]], ["tile_rc", "sp", [-1, 16]], ["tile_rd", "sp", [-1, 1]], ["tile_ry", "sp", [-1, 1]], ["tile_rx", "sp", [-1, 1]], ["auto_unroll_max_step", "ot", 0], ["unroll_explicit", "ot", 1]]}], "r": [[0.001136182, 0.00113561225], 0, 0.7047529220581055, 1578559557.3281782], "v": 0.1}
{"i": ["cuda", "schedule_direct_3d_cuda", [[1, 192, 8, 8, 8], [192, 192, 3, 3, 3], [1, 1, 1], [1, 1, 1], 1], {}, ["schedule_direct_3d_cuda", [1, 192, 8, 8, 8], [192, 192, 3, 3, 3], [1, 1, 1], [1, 1, 1], 1], {"i": 1592243263, "t": "", "c": null, "e": [["tile_f", "sp", [-1, 1, 64, 1]], ["tile_d", "sp", [-1, 1, 1, 8]], ["tile_y", "sp", [-1, 1, 1, 1]], ["tile_x", "sp", [-1, 1, 4, 1]], ["tile_rc", "sp", [-1, 6]], ["tile_rd", "sp", [-1, 1]], ["tile_ry", "sp", [-1, 3]], ["tile_rx", "sp", [-1, 1]], ["auto_unroll_max_step", "ot", 1500], ["unroll_explicit", "ot", 1]]}], "r": [[0.00070273125, 0.00070260625], 0, 2.8858799934387207, 1578559815.5373588], "v": 0.1}
{"i": ["cuda", "schedule_direct_3d_cuda", [[1, 192, 8, 8, 8], [192, 192, 3, 3, 3], [1, 1, 1], [1, 1, 1], 1], {}, ["schedule_direct_3d_cuda", [1, 192, 8, 8, 8], [192, 192, 3, 3, 3], [1, 1, 1], [1, 1, 1], 1], {"i": 990130591, "t": "", "c": null, "e": [["tile_f", "sp", [-1, 1, 64, 1]], ["tile_d", "sp", [-1, 2, 1, 4]], ["tile_y", "sp", [-1, 1, 1, 1]], ["tile_x", "sp", [-1, 1, 4, 1]], ["tile_rc", "sp", [-1, 6]], ["tile_rd", "sp", [-1, 1]], ["tile_ry", "sp", [-1, 3]], ["tile_rx", "sp", [-1, 1]], ["auto_unroll_max_step", "ot", 0], ["unroll_explicit", "ot", 1]]}], "r": [[0.00132268725, 0.00133947075], 0, 1.0111873149871826, 1578559816.0723445], "v": 0.1}
{"i": ["cuda", "schedule_direct_3d_cuda", [[1, 192, 8, 8, 8], [192, 192, 3, 3, 3], [1, 1, 1], [1, 1, 1], 1], {}, ["schedule_direct_3d_cuda", [1, 192, 8, 8, 8], [192, 192, 3, 3, 3], [1, 1, 1], [1, 1, 1], 1], {"i": 1592242591, "t": "", "c": null, "e": [["tile_f", "sp", [-1, 1, 64, 1]], ["tile_d", "sp", [-1, 2, 1, 4]], ["tile_y", "sp", [-1, 1, 1, 1]], ["tile_x", "sp", [-1, 1, 4, 1]], ["tile_rc", "sp", [-1, 6]], ["tile_rd", "sp", [-1, 1]], ["tile_ry", "sp", [-1, 3]], ["tile_rx", "sp", [-1, 1]], ["auto_unroll_max_step", "ot", 1500], ["unroll_explicit", "ot", 1]]}], "r": [[0.00078563175, 0.0007816075], 0, 2.8154194355010986, 1578559816.8951273], "v": 0.1}
{"i": ["cuda", "schedule_direct_3d_cuda", [[1, 192, 8, 8, 8], [192, 192, 3, 3, 3], [1, 1, 1], [1, 1, 1], 1], {}, ["schedule_direct_3d_cuda", [1, 192, 8, 8, 8], [192, 192, 3, 3, 3], [1, 1, 1], [1, 1, 1], 1], {"i": 388018591, "t": "", "c": null, "e": [["tile_f", "sp", [-1, 1, 64, 1]], ["tile_d", "sp", [-1, 2, 1, 4]], ["tile_y", "sp", [-1, 1, 1, 1]], ["tile_x", "sp", [-1, 1, 4, 1]], ["tile_rc", "sp", [-1, 6]], ["tile_rd", "sp", [-1, 1]], ["tile_ry", "sp", [-1, 3]], ["tile_rx", "sp", [-1, 1]], ["auto_unroll_max_step", "ot", 512], ["unroll_explicit", "ot", 0]]}], "r": [[0.00088272975, 0.00088079225], 0, 1.2015013694763184, 1578559817.6011765], "v": 0.1}
{"i": ["cuda", "schedule_direct_3d_cuda", [[1, 192, 8, 8, 8], [192, 192, 3, 3, 3], [1, 1, 1], [1, 1, 1], 1], {}, ["schedule_direct_3d_cuda", [1, 192, 8, 8, 8], [192, 192, 3, 3, 3], [1, 1, 1], [1, 1, 1], 1], {"i": 689074591, "t": "", "c": null, "e": [["tile_f", "sp", [-1, 1, 64, 1]], ["tile_d", "sp", [-1, 2, 1, 4]], ["tile_y", "sp", [-1, 1, 1, 1]], ["tile_x", "sp", [-1, 1, 4, 1]], ["tile_rc", "sp", [-1, 6]], ["tile_rd", "sp", [-1, 1]], ["tile_ry", "sp", [-1, 3]], ["tile_rx", "sp", [-1, 1]], ["auto_unroll_max_step", "ot", 1500], ["unroll_explicit", "ot", 0]]}], "r": [[0.001055292, 0.00105041025], 0, 1.9204347133636475, 1578559818.4934144], "v": 0.1}
{"i": ["cuda", "schedule_direct_3d_cuda", [[1, 192, 8, 8, 8], [192, 192, 3, 3, 3], [1, 1, 1], [1, 1, 1], 1], {}, ["schedule_direct_3d_cuda", [1, 192, 8, 8, 8], [192, 192, 3, 3, 3], [1, 1, 1], [1, 1, 1], 1], {"i": 86962591, "t": "", "c": null, "e": [["tile_f", "sp", [-1, 1, 64, 1]], ["tile_d", "sp", [-1, 2, 1, 4]], ["tile_y", "sp", [-1, 1, 1, 1]], ["tile_x", "sp", [-1, 1, 4, 1]], ["tile_rc", "sp", [-1, 6]], ["tile_rd", "sp", [-1, 1]], ["tile_ry", "sp", [-1, 3]], ["tile_rx", "sp", [-1, 1]], ["auto_unroll_max_step", "ot", 0], ["unroll_explicit", "ot", 0]]}], "r": [[0.00131159175, 0.00143715125], 0, 0.9746553897857666, 1578559818.9732876], "v": 0.1}
{"i": ["cuda", "schedule_direct_3d_cuda", [[1, 192, 8, 8, 8], [192, 192, 3, 3, 3], [1, 1, 1], [1, 1, 1], 1], {}, ["schedule_direct_3d_cuda", [1, 192, 8, 8, 8], [192, 192, 3, 3, 3], [1, 1, 1], [1, 1, 1], 1], {"i": 1291186591, "t": "", "c": null, "e": [["tile_f", "sp", [-1, 1, 64, 1]], ["tile_d", "sp", [-1, 2, 1, 4]], ["tile_y", "sp", [-1, 1, 1, 1]], ["tile_x", "sp", [-1, 1, 4, 1]], ["tile_rc", "sp", [-1, 6]], ["tile_rd", "sp", [-1, 1]], ["tile_ry", "sp", [-1, 3]], ["tile_rx", "sp", [-1, 1]], ["auto_unroll_max_step", "ot", 512], ["unroll_explicit", "ot", 1]]}], "r": [[0.00080084525, 0.0008031155], 0, 1.602348804473877, 1578559819.6416576], "v": 0.1}
{"i": ["cuda", "schedule_direct_3d_cuda", [[1, 192, 8, 8, 8], [192, 192, 3, 3, 3], [1, 1, 1], [1, 1, 1], 1], {}, ["schedule_direct_3d_cuda", [1, 192, 8, 8, 8], [192, 192, 3, 3, 3], [1, 1, 1], [1, 1, 1], 1], {"i": 1057045964, "t": "", "c": null, "e": [["tile_f", "sp", [-1, 2, 6, 1]], ["tile_d", "sp", [-1, 1, 1, 2]], ["tile_y", "sp", [-1, 1, 2, 4]], ["tile_x", "sp", [-1, 1, 2, 1]], ["tile_rc", "sp", [-1, 2]], ["tile_rd", "sp", [-1, 1]], ["tile_ry", "sp", [-1, 1]], ["tile_rx", "sp", [-1, 3]], ["auto_unroll_max_step", "ot", 0], ["unroll_explicit", "ot", 1]]}], "r": [[0.00202093025, 0.0020028135], 0, 1.1192140579223633, 1578559820.2636597], "v": 0.1}
{"i": ["cuda", "schedule_direct_3d_cuda", [[1, 192, 8, 8, 8], [192, 192, 3, 3, 3], [1, 1, 1], [1, 1, 1], 1], {}, ["schedule_direct_3d_cuda", [1, 192, 8, 8, 8], [192, 192, 3, 3, 3], [1, 1, 1], [1, 1, 1], 1], {"i": 380061746, "t": "", "c": null, "e": [["tile_f", "sp", [-1, 2, 8, 1]], ["tile_d", "sp", [-1, 1, 1, 4]], ["tile_y", "sp", [-1, 1, 1, 4]], ["tile_x", "sp", [-1, 1, 4, 1]], ["tile_rc", "sp", [-1, 2]], ["tile_rd", "sp", [-1, 1]], ["tile_ry", "sp", [-1, 3]], ["tile_rx", "sp", [-1, 1]], ["auto_unroll_max_step", "ot", 512], ["unroll_explicit", "ot", 0]]}], "r": [[0.00186200475, 0.001842499], 0, 1.1773967742919922, 1578559820.9280627], "v": 0.1}
{"i": ["cuda", "schedule_direct_3d_cuda", [[1, 192, 8, 8, 8], [192, 192, 3, 3, 3], [1, 1, 1], [1, 1, 1], 1], {}, ["schedule_direct_3d_cuda", [1, 192, 8, 8, 8], [192, 192, 3, 3, 3], [1, 1, 1], [1, 1, 1], 1], {"i": 681117746, "t": "", "c": null, "e": [["tile_f", "sp", [-1, 2, 8, 1]], ["tile_d", "sp", [-1, 1, 1, 4]], ["tile_y", "sp", [-1, 1, 1, 4]], ["tile_x", "sp", [-1, 1, 4, 1]], ["tile_rc", "sp", [-1, 2]], ["tile_rd", "sp", [-1, 1]], ["tile_ry", "sp", [-1, 3]], ["tile_rx", "sp", [-1, 1]], ["auto_unroll_max_step", "ot", 1500], ["unroll_explicit", "ot", 0]]}], "r": [[0.00164810975, 0.0016305475], 0, 1.3598301410675049, 1578559821.7109325], "v": 0.1}
{"i": ["cuda", "schedule_direct_3d_cuda", [[1, 192, 8, 8, 8], [192, 192, 3, 3, 3], [1, 1, 1], [1, 1, 1], 1], {}, ["schedule_direct_3d_cuda", [1, 192, 8, 8, 8], [192, 192, 3, 3, 3], [1, 1, 1], [1, 1, 1], 1], {"i": 153877964, "t": "", "c": null, "e": [["tile_f", "sp", [-1, 2, 6, 1]], ["tile_d", "sp", [-1, 1, 1, 2]], ["tile_y", "sp", [-1, 1, 2, 4]], ["tile_x", "sp", [-1, 1, 2, 1]], ["tile_rc", "sp", [-1, 2]], ["tile_rd", "sp", [-1, 1]], ["tile_ry", "sp", [-1, 1]], ["tile_rx", "sp", [-1, 3]], ["auto_unroll_max_step", "ot", 0], ["unroll_explicit", "ot", 0]]}], "r": [[0.0020361645, 0.002019674], 0, 0.9755122661590576, 1578559822.1979876], "v": 0.1}
{"i": ["cuda", "schedule_direct_3d_cuda", [[1, 192, 8, 8, 8], [192, 192, 3, 3, 3], [1, 1, 1], [1, 1, 1], 1], {}, ["schedule_direct_3d_cuda", [1, 192, 8, 8, 8], [192, 192, 3, 3, 3], [1, 1, 1], [1, 1, 1], 1], {"i": 755989964, "t": "", "c": null, "e": [["tile_f", "sp", [-1, 2, 6, 1]], ["tile_d", "sp", [-1, 1, 1, 2]], ["tile_y", "sp", [-1, 1, 2, 4]], ["tile_x", "sp", [-1, 1, 2, 1]], ["tile_rc", "sp", [-1, 2]], ["tile_rd", "sp", [-1, 1]], ["tile_ry", "sp", [-1, 1]], ["tile_rx", "sp", [-1, 3]], ["auto_unroll_max_step", "ot", 1500], ["unroll_explicit", "ot", 0]]}], "r": [[0.001959445, 0.0019544575], 0, 1.6208672523498535, 1578559823.005292], "v": 0.1}
{"i": ["cuda", "schedule_direct_3d_cuda", [[1, 192, 8, 8, 8], [192, 192, 3, 3, 3], [1, 1, 1], [1, 1, 1], 1], {}, ["schedule_direct_3d_cuda", [1, 192, 8, 8, 8], [192, 192, 3, 3, 3], [1, 1, 1], [1, 1, 1], 1], {"i": 1358101964, "t": "", "c": null, "e": [["tile_f", "sp", [-1, 2, 6, 1]], ["tile_d", "sp", [-1, 1, 1, 2]], ["tile_y", "sp", [-1, 1, 2, 4]], ["tile_x", "sp", [-1, 1, 2, 1]], ["tile_rc", "sp", [-1, 2]], ["tile_rd", "sp", [-1, 1]], ["tile_ry", "sp", [-1, 1]], ["tile_rx", "sp", [-1, 3]], ["auto_unroll_max_step", "ot", 512], ["unroll_explicit", "ot", 1]]}], "r": [[0.001254949, 0.00125401175], 0, 1.463700532913208, 1578559825.609595], "v": 0.1}
{"i": ["cuda", "schedule_direct_3d_cuda", [[1, 192, 8, 8, 8], [192, 192, 3, 3, 3], [1, 1, 1], [1, 1, 1], 1], {}, ["schedule_direct_3d_cuda", [1, 192, 8, 8, 8], [192, 192, 3, 3, 3], [1, 1, 1], [1, 1, 1], 1], {"i": 1283229746, "t": "", "c": null, "e": [["tile_f", "sp", [-1, 2, 8, 1]], ["tile_d", "sp", [-1, 1, 1, 4]], ["tile_y", "sp", [-1, 1, 1, 4]], ["tile_x", "sp", [-1, 1, 4, 1]], ["tile_rc", "sp", [-1, 2]], ["tile_rd", "sp", [-1, 1]], ["tile_ry", "sp", [-1, 3]], ["tile_rx", "sp", [-1, 1]], ["auto_unroll_max_step", "ot", 512], ["unroll_explicit", "ot", 1]]}], "r": [[0.00178664425, 0.00197210175], 0, 1.2840700149536133, 1578559826.2770245], "v": 0.1}
{"i": ["cuda", "schedule_direct_3d_cuda", [[1, 192, 8, 8, 8], [192, 192, 3, 3, 3], [1, 1, 1], [1, 1, 1], 1], {}, ["schedule_direct_3d_cuda", [1, 192, 8, 8, 8], [192, 192, 3, 3, 3], [1, 1, 1], [1, 1, 1], 1], {"i": 454933964, "t": "", "c": null, "e": [["tile_f", "sp", [-1, 2, 6, 1]], ["tile_d", "sp", [-1, 1, 1, 2]], ["tile_y", "sp", [-1, 1, 2, 4]], ["tile_x", "sp", [-1, 1, 2, 1]], ["tile_rc", "sp", [-1, 2]], ["tile_rd", "sp", [-1, 1]], ["tile_ry", "sp", [-1, 1]], ["tile_rx", "sp", [-1, 3]], ["auto_unroll_max_step", "ot", 512], ["unroll_explicit", "ot", 0]]}], "r": [[0.001480035, 0.00146665425], 0, 1.282609462738037, 1578559826.9385417], "v": 0.1}
{"i": ["cuda", "schedule_direct_3d_cuda", [[1, 192, 8, 8, 8], [192, 192, 3, 3, 3], [1, 1, 1], [1, 1, 1], 1], {}, ["schedule_direct_3d_cuda", [1, 192, 8, 8, 8], [192, 192, 3, 3, 3], [1, 1, 1], [1, 1, 1], 1], {"i": 1659157964, "t": "", "c": null, "e": [["tile_f", "sp", [-1, 2, 6, 1]], ["tile_d", "sp", [-1, 1, 1, 2]], ["tile_y", "sp", [-1, 1, 2, 4]], ["tile_x", "sp", [-1, 1, 2, 1]], ["tile_rc", "sp", [-1, 2]], ["tile_rd", "sp", [-1, 1]], ["tile_ry", "sp", [-1, 1]], ["tile_rx", "sp", [-1, 3]], ["auto_unroll_max_step", "ot", 1500], ["unroll_explicit", "ot", 1]]}], "r": [[0.00134631375, 0.00118156075], 0, 2.335294723510742, 1578559827.6639], "v": 0.1}
{"i": ["cuda", "schedule_direct_3d_cuda", [[1, 192, 8, 8, 8], [192, 192, 3, 3, 3], [1, 1, 1], [1, 1, 1], 1], {}, ["schedule_direct_3d_cuda", [1, 192, 8, 8, 8], [192, 192, 3, 3, 3], [1, 1, 1], [1, 1, 1], 1], {"i": 79005746, "t": "", "c": null, "e": [["tile_f", "sp", [-1, 2, 8, 1]], ["tile_d", "sp", [-1, 1, 1, 4]], ["tile_y", "sp", [-1, 1, 1, 4]], ["tile_x", "sp", [-1, 1, 4, 1]], ["tile_rc", "sp", [-1, 2]], ["tile_rd", "sp", [-1, 1]], ["tile_ry", "sp", [-1, 3]], ["tile_rx", "sp", [-1, 1]], ["auto_unroll_max_step", "ot", 0], ["unroll_explicit", "ot", 0]]}], "r": [[0.00178309875, 0.001783933], 0, 1.1676530838012695, 1578559828.3397653], "v": 0.1}
{"i": ["cuda", "schedule_direct_3d_cuda", [[1, 192, 8, 8, 8], [192, 192, 3, 3, 3], [1, 1, 1], [1, 1, 1], 1], {}, ["schedule_direct_3d_cuda", [1, 192, 8, 8, 8], [192, 192, 3, 3, 3], [1, 1, 1], [1, 1, 1], 1], {"i": 982173746, "t": "", "c": null, "e": [["tile_f", "sp", [-1, 2, 8, 1]], ["tile_d", "sp", [-1, 1, 1, 4]], ["tile_y", "sp", [-1, 1, 1, 4]], ["tile_x", "sp", [-1, 1, 4, 1]], ["tile_rc", "sp", [-1, 2]], ["tile_rd", "sp", [-1, 1]], ["tile_ry", "sp", [-1, 3]], ["tile_rx", "sp", [-1, 1]], ["auto_unroll_max_step", "ot", 0], ["unroll_explicit", "ot", 1]]}], "r": [[0.00179668425, 0.001797367], 0, 0.9903414249420166, 1578559828.8167155], "v": 0.1}
{"i": ["cuda", "schedule_direct_3d_cuda", [[1, 192, 8, 8, 8], [192, 192, 3, 3, 3], [1, 1, 1], [1, 1, 1], 1], {}, ["schedule_direct_3d_cuda", [1, 192, 8, 8, 8], [192, 192, 3, 3, 3], [1, 1, 1], [1, 1, 1], 1], {"i": 1017252153, "t": "", "c": null, "e": [["tile_f", "sp", [-1, 1, 12, 1]], ["tile_d", "sp", [-1, 1, 1, 4]], ["tile_y", "sp", [-1, 1, 1, 4]], ["tile_x", "sp", [-1, 2, 4, 1]], ["tile_rc", "sp", [-1, 1]], ["tile_rd", "sp", [-1, 3]], ["tile_ry", "sp", [-1, 3]], ["tile_rx", "sp", [-1, 1]], ["auto_unroll_max_step", "ot", 0], ["unroll_explicit", "ot", 1]]}], "r": [[0.000895141, 0.0008951735], 0, 1.0985817909240723, 1578559829.3438077], "v": 0.1}
{"i": ["cuda", "schedule_direct_3d_cuda", [[1, 192, 8, 8, 8], [192, 192, 3, 3, 3], [1, 1, 1], [1, 1, 1], 1], {}, ["schedule_direct_3d_cuda", [1, 192, 8, 8, 8], [192, 192, 3, 3, 3], [1, 1, 1], [1, 1, 1], 1], {"i": 345117821, "t": "", "c": null, "e": [["tile_f", "sp", [-1, 1, 8, 2]], ["tile_d", "sp", [-1, 1, 1, 4]], ["tile_y", "sp", [-1, 1, 1, 4]], ["tile_x", "sp", [-1, 1, 4, 1]], ["tile_rc", "sp", [-1, 3]], ["tile_rd", "sp", [-1, 3]], ["tile_ry", "sp", [-1, 1]], ["tile_rx", "sp", [-1, 1]], ["auto_unroll_max_step", "ot", 512], ["unroll_explicit", "ot", 0]]}], "r": [[0.00134145625, 0.0013408975], 0, 1.170914888381958, 1578559829.9778132], "v": 0.1}
{"i": ["cuda", "schedule_direct_3d_cuda", [[1, 192, 8, 8, 8], [192, 192, 3, 3, 3], [1, 1, 1], [1, 1, 1], 1], {}, ["schedule_direct_3d_cuda", [1, 192, 8, 8, 8], [192, 192, 3, 3, 3], [1, 1, 1], [1, 1, 1], 1], {"i": 683805746, "t": "", "c": null, "e": [["tile_f", "sp", [-1, 2, 8, 1]], ["tile_d", "sp", [-1, 1, 1, 4]], ["tile_y", "sp", [-1, 1, 1, 4]], ["tile_x", "sp", [-1, 1, 4, 1]], ["tile_rc", "sp", [-1, 3]], ["tile_rd", "sp", [-1, 1]], ["tile_ry", "sp", [-1, 3]], ["tile_rx", "sp", [-1, 1]], ["auto_unroll_max_step", "ot", 1500], ["unroll_explicit", "ot", 0]]}], "r": [[0.0022011575, 0.0021974535], 0, 1.8398590087890625, 1578559831.105271], "v": 0.1}
{"i": ["cuda", "schedule_direct_3d_cuda", [[1, 192, 8, 8, 8], [192, 192, 3, 3, 3], [1, 1, 1], [1, 1, 1], 1], {}, ["schedule_direct_3d_cuda", [1, 192, 8, 8, 8], [192, 192, 3, 3, 3], [1, 1, 1], [1, 1, 1], 1], {"i": 1248285821, "t": "", "c": null, "e": [["tile_f", "sp", [-1, 1, 8, 2]], ["tile_d", "sp", [-1, 1, 1, 4]], ["tile_y", "sp", [-1, 1, 1, 4]], ["tile_x", "sp", [-1, 1, 4, 1]], ["tile_rc", "sp", [-1, 3]], ["tile_rd", "sp", [-1, 3]], ["tile_ry", "sp", [-1, 1]], ["tile_rx", "sp", [-1, 1]], ["auto_unroll_max_step", "ot", 512], ["unroll_explicit", "ot", 1]]}], "r": [[0.00129222525, 0.00126409975], 0, 1.3999881744384766, 1578559831.7448695], "v": 0.1}
{"i": ["cuda", "schedule_direct_3d_cuda", [[1, 192, 8, 8, 8], [192, 192, 3, 3, 3], [1, 1, 1], [1, 1, 1], 1], {}, ["schedule_direct_3d_cuda", [1, 192, 8, 8, 8], [192, 192, 3, 3, 3], [1, 1, 1], [1, 1, 1], 1], {"i": 947229821, "t": "", "c": null, "e": [["tile_f", "sp", [-1, 1, 8, 2]], ["tile_d", "sp", [-1, 1, 1, 4]], ["tile_y", "sp", [-1, 1, 1, 4]], ["tile_x", "sp", [-1, 1, 4, 1]], ["tile_rc", "sp", [-1, 3]], ["tile_rd", "sp", [-1, 3]], ["tile_ry", "sp", [-1, 1]], ["tile_rx", "sp", [-1, 1]], ["auto_unroll_max_step", "ot", 0], ["unroll_explicit", "ot", 1]]}], "r": [[0.00223184925, 0.0021262455], 0, 1.3766083717346191, 1578559832.5690198], "v": 0.1}
{"i": ["cuda", "schedule_direct_3d_cuda", [[1, 192, 8, 8, 8], [192, 192, 3, 3, 3], [1, 1, 1], [1, 1, 1], 1], {}, ["schedule_direct_3d_cuda", [1, 192, 8, 8, 8], [192, 192, 3, 3, 3], [1, 1, 1], [1, 1, 1], 1], {"i": 1285514546, "t": "", "c": null, "e": [["tile_f", "sp", [-1, 2, 8, 1]], ["tile_d", "sp", [-1, 1, 1, 4]], ["tile_y", "sp", [-1, 1, 1, 4]], ["tile_x", "sp", [-1, 1, 2, 1]], ["tile_rc", "sp", [-1, 3]], ["tile_rd", "sp", [-1, 1]], ["tile_ry", "sp", [-1, 3]], ["tile_rx", "sp", [-1, 1]], ["auto_unroll_max_step", "ot", 512], ["unroll_explicit", "ot", 1]]}], "r": [[0.00157659225, 0.0015965215], 0, 1.3758246898651123, 1578559833.2181616], "v": 0.1}
{"i": ["cuda", "schedule_direct_3d_cuda", [[1, 192, 8, 8, 8], [192, 192, 3, 3, 3], [1, 1, 1], [1, 1, 1], 1], {}, ["schedule_direct_3d_cuda", [1, 192, 8, 8, 8], [192, 192, 3, 3, 3], [1, 1, 1], [1, 1, 1], 1], {"i": 380847985, "t": "", "c": null, "e": [["tile_f", "sp", [-1, 1, 8, 1]], ["tile_d", "sp", [-1, 1, 1, 4]], ["tile_y", "sp", [-1, 1, 2, 2]], ["tile_x", "sp", [-1, 1, 2, 2]], ["tile_rc", "sp", [-1, 2]], ["tile_rd", "sp", [-1, 1]], ["tile_ry", "sp", [-1, 3]], ["tile_rx", "sp", [-1, 1]], ["auto_unroll_max_step", "ot", 512], ["unroll_explicit", "ot", 0]]}], "r": [[0.001412397, 0.0014136525], 0, 1.2054333686828613, 1578559836.485535], "v": 0.1}
{"i": ["cuda", "schedule_direct_3d_cuda", [[1, 192, 8, 8, 8], [192, 192, 3, 3, 3], [1, 1, 1], [1, 1, 1], 1], {}, ["schedule_direct_3d_cuda", [1, 192, 8, 8, 8], [192, 192, 3, 3, 3], [1, 1, 1], [1, 1, 1], 1], {"i": 760467506, "t": "", "c": null, "e": [["tile_f", "sp", [-1, 2, 8, 1]], ["tile_d", "sp", [-1, 1, 1, 4]], ["tile_y", "sp", [-1, 1, 2, 1]], ["tile_x", "sp", [-1, 1, 2, 4]], ["tile_rc", "sp", [-1, 3]], ["tile_rd", "sp", [-1, 1]], ["tile_ry", "sp", [-1, 1]], ["tile_rx", "sp", [-1, 3]], ["auto_unroll_max_step", "ot", 1500], ["unroll_explicit", "ot", 0]]}], "r": [[0.00248146375, 0.00248005575], 0, 1.5365259647369385, 1578559837.3499079], "v": 0.1}
{"i": ["cuda", "schedule_direct_3d_cuda", [[1, 192, 8, 8, 8], [192, 192, 3, 3, 3], [1, 1, 1], [1, 1, 1], 1], {}, ["schedule_direct_3d_cuda", [1, 192, 8, 8, 8], [192, 192, 3, 3, 3], [1, 1, 1], [1, 1, 1], 1], {"i": 158355506, "t": "", "c": null, "e": [["tile_f", "sp", [-1, 2, 8, 1]], ["tile_d", "sp", [-1, 1, 1, 4]], ["tile_y", "sp", [-1, 1, 2, 1]], ["tile_x", "sp", [-1, 1, 2, 4]], ["tile_rc", "sp", [-1, 3]], ["tile_rd", "sp", [-1, 1]], ["tile_ry", "sp", [-1, 1]], ["tile_rx", "sp", [-1, 3]], ["auto_unroll_max_step", "ot", 0], ["unroll_explicit", "ot", 0]]}], "r": [[0.00193870725, 0.00193866575], 0, 1.070786714553833, 1578559837.878179], "v": 0.1}
{"i": ["cuda", "schedule_direct_3d_cuda", [[1, 192, 8, 8, 8], [192, 192, 3, 3, 3], [1, 1, 1], [1, 1, 1], 1], {}, ["schedule_direct_3d_cuda", [1, 192, 8, 8, 8], [192, 192, 3, 3, 3], [1, 1, 1], [1, 1, 1], 1], {"i": 418479985, "t": "", "c": null, "e": [["tile_f", "sp", [-1, 1, 8, 1]], ["tile_d", "sp", [-1, 1, 1, 4]], ["tile_y", "sp", [-1, 1, 2, 2]], ["tile_x", "sp", [-1, 1, 2, 2]], ["tile_rc", "sp", [-1, 2]], ["tile_rd", "sp", [-1, 3]], ["tile_ry", "sp", [-1, 3]], ["tile_rx", "sp", [-1, 1]], ["auto_unroll_max_step", "ot", 512], ["unroll_explicit", "ot", 0]]}], "r": [[0.000709693, 0.00070937325], 0, 1.1884372234344482, 1578559838.519682], "v": 0.1}
{"i": ["cuda", "schedule_direct_3d_cuda", [[1, 192, 8, 8, 8], [192, 192, 3, 3, 3], [1, 1, 1], [1, 1, 1], 1], {}, ["schedule_direct_3d_cuda", [1, 192, 8, 8, 8], [192, 192, 3, 3, 3], [1, 1, 1], [1, 1, 1], 1], {"i": 1321647985, "t": "", "c": null, "e": [["tile_f", "sp", [-1, 1, 8, 1]], ["tile_d", "sp", [-1, 1, 1, 4]], ["tile_y", "sp", [-1, 1, 2, 2]], ["tile_x", "sp", [-1, 1, 2, 2]], ["tile_rc", "sp", [-1, 2]], ["tile_rd", "sp", [-1, 3]], ["tile_ry", "sp", [-1, 3]], ["tile_rx", "sp", [-1, 1]], ["auto_unroll_max_step", "ot", 512], ["unroll_explicit", "ot", 1]]}], "r": [[0.00068280975, 0.0006808715], 0, 1.381155014038086, 1578559839.1285007], "v": 0.1}
{"i": ["cuda", "schedule_direct_3d_cuda", [[1, 192, 8, 8, 8], [192, 192, 3, 3, 3], [1, 1, 1], [1, 1, 1], 1], {}, ["schedule_direct_3d_cuda", [1, 192, 8, 8, 8], [192, 192, 3, 3, 3], [1, 1, 1], [1, 1, 1], 1], {"i": 45096626, "t": "", "c": null, "e": [["tile_f", "sp", [-1, 2, 8, 1]], ["tile_d", "sp", [-1, 1, 1, 4]], ["tile_y", "sp", [-1, 1, 1, 2]], ["tile_x", "sp", [-1, 1, 4, 2]], ["tile_rc", "sp", [-1, 3]], ["tile_rd", "sp", [-1, 3]], ["tile_ry", "sp", [-1, 1]], ["tile_rx", "sp", [-1, 1]], ["auto_unroll_max_step", "ot", 0], ["unroll_explicit", "ot", 0]]}], "r": [[0.001749135, 0.00174881025], 0, 1.3625874519348145, 1578559839.9733894], "v": 0.1}
{"i": ["cuda", "schedule_direct_3d_cuda", [[1, 192, 8, 8, 8], [192, 192, 3, 3, 3], [1, 1, 1], [1, 1, 1], 1], {}, ["schedule_direct_3d_cuda", [1, 192, 8, 8, 8], [192, 192, 3, 3, 3], [1, 1, 1], [1, 1, 1], 1], {"i": 647208625, "t": "", "c": null, "e": [["tile_f", "sp", [-1, 1, 8, 1]], ["tile_d", "sp", [-1, 1, 1, 4]], ["tile_y", "sp", [-1, 1, 1, 2]], ["tile_x", "sp", [-1, 1, 4, 2]], ["tile_rc", "sp", [-1, 3]], ["tile_rd", "sp", [-1, 3]], ["tile_ry", "sp", [-1, 1]], ["tile_rx", "sp", [-1, 1]], ["auto_unroll_max_step", "ot", 1500], ["unroll_explicit", "ot", 0]]}], "r": [[0.00087293125, 0.000873901], 0, 1.7936396598815918, 1578559840.9002185], "v": 0.1}
{"i": ["cuda", "schedule_direct_3d_cuda", [[1, 192, 8, 8, 8], [192, 192, 3, 3, 3], [1, 1, 1], [1, 1, 1], 1], {}, ["schedule_direct_3d_cuda", [1, 192, 8, 8, 8], [192, 192, 3, 3, 3], [1, 1, 1], [1, 1, 1], 1], {"i": 948264626, "t": "", "c": null, "e": [["tile_f", "sp", [-1, 2, 8, 1]], ["tile_d", "sp", [-1, 1, 1, 4]], ["tile_y", "sp", [-1, 1, 1, 2]], ["tile_x", "sp", [-1, 1, 4, 2]], ["tile_rc", "sp", [-1, 3]], ["tile_rd", "sp", [-1, 3]], ["tile_ry", "sp", [-1, 1]], ["tile_rx", "sp", [-1, 1]], ["auto_unroll_max_step", "ot", 0], ["unroll_explicit", "ot", 1]]}], "r": [[0.00174917825, 0.00174883225], 0, 1.0075042247772217, 1578559841.3867497], "v": 0.1}
{"i": ["cuda", "schedule_direct_3d_cuda", [[1, 192, 8, 8, 8], [192, 192, 3, 3, 3], [1, 1, 1], [1, 1, 1], 1], {}, ["schedule_direct_3d_cuda", [1, 192, 8, 8, 8], [192, 192, 3, 3, 3], [1, 1, 1], [1, 1, 1], 1], {"i": 1550376625, "t": "", "c": null, "e": [["tile_f", "sp", [-1, 1, 8, 1]], ["tile_d", "sp", [-1, 1, 1, 4]], ["tile_y", "sp", [-1, 1, 1, 2]], ["tile_x", "sp", [-1, 1, 4, 2]], ["tile_rc", "sp", [-1, 3]], ["tile_rd", "sp", [-1, 3]], ["tile_ry", "sp", [-1, 1]], ["tile_rx", "sp", [-1, 1]], ["auto_unroll_max_step", "ot", 1500], ["unroll_explicit", "ot", 1]]}], "r": [[0.00046516125, 0.00046473], 0, 2.9223580360412598, 1578559842.2200933], "v": 0.1}
{"i": ["cuda", "schedule_direct_3d_cuda", [[1, 192, 8, 8, 8], [192, 192, 3, 3, 3], [1, 1, 1], [1, 1, 1], 1], {}, ["schedule_direct_3d_cuda", [1, 192, 8, 8, 8], [192, 192, 3, 3, 3], [1, 1, 1], [1, 1, 1], 1], {"i": 533416868, "t": "", "c": null, "e": [["tile_f", "sp", [-1, 1, 24, 1]], ["tile_d", "sp", [-1, 1, 1, 2]], ["tile_y", "sp", [-1, 2, 1, 4]], ["tile_x", "sp", [-1, 2, 4, 1]], ["tile_rc", "sp", [-1, 3]], ["tile_rd", "sp", [-1, 1]], ["tile_ry", "sp", [-1, 3]], ["tile_rx", "sp", [-1, 3]], ["auto_unroll_max_step", "ot", 512], ["unroll_explicit", "ot", 0]]}], "r": [[0.0010679395, 0.00106715975], 0, 1.178243637084961, 1578559842.8434396], "v": 0.1}
{"i": ["cuda", "schedule_direct_3d_cuda", [[1, 192, 8, 8, 8], [192, 192, 3, 3, 3], [1, 1, 1], [1, 1, 1], 1], {}, ["schedule_direct_3d_cuda", [1, 192, 8, 8, 8], [192, 192, 3, 3, 3], [1, 1, 1], [1, 1, 1], 1], {"i": 87904063, "t": "", "c": null, "e": [["tile_f", "sp", [-1, 1, 64, 1]], ["tile_d", "sp", [-1, 1, 1, 8]], ["tile_y", "sp", [-1, 1, 1, 1]], ["tile_x", "sp", [-1, 2, 2, 2]], ["tile_rc", "sp", [-1, 6]], ["tile_rd", "sp", [-1, 1]], ["tile_ry", "sp", [-1, 3]], ["tile_rx", "sp", [-1, 1]], ["auto_unroll_max_step", "ot", 0], ["unroll_explicit", "ot", 0]]}], "r": [[0.000822669, 0.00082008925], 0, 1.0011239051818848, 1578559843.395876], "v": 0.1}
{"i": ["cuda", "schedule_direct_3d_cuda", [[1, 192, 8, 8, 8], [192, 192, 3, 3, 3], [1, 1, 1], [1, 1, 1], 1], {}, ["schedule_direct_3d_cuda", [1, 192, 8, 8, 8], [192, 192, 3, 3, 3], [1, 1, 1], [1, 1, 1], 1], {"i": 690015391, "t": "", "c": null, "e": [["tile_f", "sp", [-1, 1, 64, 1]], ["tile_d", "sp", [-1, 2, 1, 4]], ["tile_y", "sp", [-1, 1, 1, 1]], ["tile_x", "sp", [-1, 2, 2, 2]], ["tile_rc", "sp", [-1, 6]], ["tile_rd", "sp", [-1, 1]], ["tile_ry", "sp", [-1, 3]], ["tile_rx", "sp", [-1, 1]], ["auto_unroll_max_step", "ot", 1500], ["unroll_explicit", "ot", 0]]}], "r": [[0.0016193235, 0.00162141025], 0, 1.653146743774414, 1578559844.3239489], "v": 0.1}
{"i": ["cuda", "schedule_direct_3d_cuda", [[1, 192, 8, 8, 8], [192, 192, 3, 3, 3], [1, 1, 1], [1, 1, 1], 1], {}, ["schedule_direct_3d_cuda", [1, 192, 8, 8, 8], [192, 192, 3, 3, 3], [1, 1, 1], [1, 1, 1], 1], {"i": 1593183391, "t": "", "c": null, "e": [["tile_f", "sp", [-1, 1, 64, 1]], ["tile_d", "sp", [-1, 2, 1, 4]], ["tile_y", "sp", [-1, 1, 1, 1]], ["tile_x", "sp", [-1, 2, 2, 2]], ["tile_rc", "sp", [-1, 6]], ["tile_rd", "sp", [-1, 1]], ["tile_ry", "sp", [-1, 3]], ["tile_rx", "sp", [-1, 1]], ["auto_unroll_max_step", "ot", 1500], ["unroll_explicit", "ot", 1]]}], "r": [[0.002080083, 0.00207906275], 0, 2.002485513687134, 1578559846.6892498], "v": 0.1}
{"i": ["cuda", "schedule_direct_3d_cuda", [[1, 192, 8, 8, 8], [192, 192, 3, 3, 3], [1, 1, 1], [1, 1, 1], 1], {}, ["schedule_direct_3d_cuda", [1, 192, 8, 8, 8], [192, 192, 3, 3, 3], [1, 1, 1], [1, 1, 1], 1], {"i": 989996191, "t": "", "c": null, "e": [["tile_f", "sp", [-1, 1, 64, 1]], ["tile_d", "sp", [-1, 2, 1, 4]], ["tile_y", "sp", [-1, 1, 1, 1]], ["tile_x", "sp", [-1, 4, 2, 1]], ["tile_rc", "sp", [-1, 6]], ["tile_rd", "sp", [-1, 1]], ["tile_ry", "sp", [-1, 3]], ["tile_rx", "sp", [-1, 1]], ["auto_unroll_max_step", "ot", 0], ["unroll_explicit", "ot", 1]]}], "r": [[0.0010987895, 0.00109811075], 0, 0.9655494689941406, 1578559847.237002], "v": 0.1}
{"i": ["cuda", "schedule_direct_3d_cuda", [[1, 192, 8, 8, 8], [192, 192, 3, 3, 3], [1, 1, 1], [1, 1, 1], 1], {}, ["schedule_direct_3d_cuda", [1, 192, 8, 8, 8], [192, 192, 3, 3, 3], [1, 1, 1], [1, 1, 1], 1], {"i": 1592108191, "t": "", "c": null, "e": [["tile_f", "sp", [-1, 1, 64, 1]], ["tile_d", "sp", [-1, 2, 1, 4]], ["tile_y", "sp", [-1, 1, 1, 1]], ["tile_x", "sp", [-1, 4, 2, 1]], ["tile_rc", "sp", [-1, 6]], ["tile_rd", "sp", [-1, 1]], ["tile_ry", "sp", [-1, 3]], ["tile_rx", "sp", [-1, 1]], ["auto_unroll_max_step", "ot", 1500], ["unroll_explicit", "ot", 1]]}], "r": [[0.00257704475, 0.0025757045], 0, 2.1087982654571533, 1578559848.1306036], "v": 0.1}
{"i": ["cuda", "schedule_direct_3d_cuda", [[1, 192, 8, 8, 8], [192, 192, 3, 3, 3], [1, 1, 1], [1, 1, 1], 1], {}, ["schedule_direct_3d_cuda", [1, 192, 8, 8, 8], [192, 192, 3, 3, 3], [1, 1, 1], [1, 1, 1], 1], {"i": 387884863, "t": "", "c": null, "e": [["tile_f", "sp", [-1, 1, 64, 1]], ["tile_d", "sp", [-1, 1, 1, 8]], ["tile_y", "sp", [-1, 1, 1, 1]], ["tile_x", "sp", [-1, 4, 2, 1]], ["tile_rc", "sp", [-1, 6]], ["tile_rd", "sp", [-1, 1]], ["tile_ry", "sp", [-1, 3]], ["tile_rx", "sp", [-1, 1]], ["auto_unroll_max_step", "ot", 512], ["unroll_explicit", "ot", 0]]}], "r": [[0.0010989175, 0.0010972305], 0, 1.033160924911499, 1578559848.6583693], "v": 0.1}
{"i": ["cuda", "schedule_direct_3d_cuda", [[1, 192, 8, 8, 8], [192, 192, 3, 3, 3], [1, 1, 1], [1, 1, 1], 1], {}, ["schedule_direct_3d_cuda", [1, 192, 8, 8, 8], [192, 192, 3, 3, 3], [1, 1, 1], [1, 1, 1], 1], {"i": 1291052863, "t": "", "c": null, "e": [["tile_f", "sp", [-1, 1, 64, 1]], ["tile_d", "sp", [-1, 1, 1, 8]], ["tile_y", "sp", [-1, 1, 1, 1]], ["tile_x", "sp", [-1, 4, 2, 1]], ["tile_rc", "sp", [-1, 6]], ["tile_rd", "sp", [-1, 1]], ["tile_ry", "sp", [-1, 3]], ["tile_rx", "sp", [-1, 1]], ["auto_unroll_max_step", "ot", 512], ["unroll_explicit", "ot", 1]]}], "r": [[0.00308823575, 0.00308876675], 0, 1.2865474224090576, 1578559849.2392294], "v": 0.1}
{"i": ["cuda", "schedule_direct_3d_cuda", [[1, 192, 8, 8, 8], [192, 192, 3, 3, 3], [1, 1, 1], [1, 1, 1], 1], {}, ["schedule_direct_3d_cuda", [1, 192, 8, 8, 8], [192, 192, 3, 3, 3], [1, 1, 1], [1, 1, 1], 1], {"i": 1592108863, "t": "", "c": null, "e": [["tile_f", "sp", [-1, 1, 64, 1]], ["tile_d", "sp", [-1, 1, 1, 8]], ["tile_y", "sp", [-1, 1, 1, 1]], ["tile_x", "sp", [-1, 4, 2, 1]], ["tile_rc", "sp", [-1, 6]], ["tile_rd", "sp", [-1, 1]], ["tile_ry", "sp", [-1, 3]], ["tile_rx", "sp", [-1, 1]], ["auto_unroll_max_step", "ot", 1500], ["unroll_explicit", "ot", 1]]}], "r": [[0.00257600525, 0.00257573725], 0, 2.008270502090454, 1578559850.1461406], "v": 0.1}
{"i": ["cuda", "schedule_direct_3d_cuda", [[1, 192, 8, 8, 8], [192, 192, 3, 3, 3], [1, 1, 1], [1, 1, 1], 1], {}, ["schedule_direct_3d_cuda", [1, 192, 8, 8, 8], [192, 192, 3, 3, 3], [1, 1, 1], [1, 1, 1], 1], {"i": 86828863, "t": "", "c": null, "e": [["tile_f", "sp", [-1, 1, 64, 1]], ["tile_d", "sp", [-1, 1, 1, 8]], ["tile_y", "sp", [-1, 1, 1, 1]], ["tile_x", "sp", [-1, 4, 2, 1]], ["tile_rc", "sp", [-1, 6]], ["tile_rd", "sp", [-1, 1]], ["tile_ry", "sp", [-1, 3]], ["tile_rx", "sp", [-1, 1]], ["auto_unroll_max_step", "ot", 0], ["unroll_explicit", "ot", 0]]}], "r": [[0.001097967, 0.00109741825], 0, 1.0283117294311523, 1578559850.6976995], "v": 0.1}
{"i": ["cuda", "schedule_direct_3d_cuda", [[1, 192, 8, 8, 8], [192, 192, 3, 3, 3], [1, 1, 1], [1, 1, 1], 1], {}, ["schedule_direct_3d_cuda", [1, 192, 8, 8, 8], [192, 192, 3, 3, 3], [1, 1, 1], [1, 1, 1], 1], {"i": 415974433, "t": "", "c": null, "e": [["tile_f", "sp", [-1, 1, 8, 1]], ["tile_d", "sp", [-1, 1, 1, 8]], ["tile_y", "sp", [-1, 1, 1, 1]], ["tile_x", "sp", [-1, 1, 4, 2]], ["tile_rc", "sp", [-1, 1]], ["tile_rd", "sp", [-1, 3]], ["tile_ry", "sp", [-1, 3]], ["tile_rx", "sp", [-1, 1]], ["auto_unroll_max_step", "ot", 512], ["unroll_explicit", "ot", 0]]}], "r": [[0.0013150345, 0.0013136005], 0, 1.2300174236297607, 1578559851.3286717], "v": 0.1}
{"i": ["cuda", "schedule_direct_3d_cuda", [[1, 192, 8, 8, 8], [192, 192, 3, 3, 3], [1, 1, 1], [1, 1, 1], 1], {}, ["schedule_direct_3d_cuda", [1, 192, 8, 8, 8], [192, 192, 3, 3, 3], [1, 1, 1], [1, 1, 1], 1], {"i": 1620198433, "t": "", "c": null, "e": [["tile_f", "sp", [-1, 1, 8, 1]], ["tile_d", "sp", [-1, 1, 1, 8]], ["tile_y", "sp", [-1, 1, 1, 1]], ["tile_x", "sp", [-1, 1, 4, 2]], ["tile_rc", "sp", [-1, 1]], ["tile_rd", "sp", [-1, 3]], ["tile_ry", "sp", [-1, 3]], ["tile_rx", "sp", [-1, 1]], ["auto_unroll_max_step", "ot", 1500], ["unroll_explicit", "ot", 1]]}], "r": [[0.00055127525, 0.00055047], 0, 1.3979744911193848, 1578559851.9185514], "v": 0.1}
{"i": ["cuda", "schedule_direct_3d_cuda", [[1, 192, 8, 8, 8], [192, 192, 3, 3, 3], [1, 1, 1], [1, 1, 1], 1], {}, ["schedule_direct_3d_cuda", [1, 192, 8, 8, 8], [192, 192, 3, 3, 3], [1, 1, 1], [1, 1, 1], 1], {"i": 717030433, "t": "", "c": null, "e": [["tile_f", "sp", [-1, 1, 8, 1]], ["tile_d", "sp", [-1, 1, 1, 8]], ["tile_y", "sp", [-1, 1, 1, 1]], ["tile_x", "sp", [-1, 1, 4, 2]], ["tile_rc", "sp", [-1, 1]], ["tile_rd", "sp", [-1, 3]], ["tile_ry", "sp", [-1, 3]], ["tile_rx", "sp", [-1, 1]], ["auto_unroll_max_step", "ot", 1500], ["unroll_explicit", "ot", 0]]}], "r": [[0.001312597, 0.00131267675], 0, 1.168527364730835, 1578559852.465737], "v": 0.1}
{"i": ["cuda", "schedule_direct_3d_cuda", [[1, 192, 8, 8, 8], [192, 192, 3, 3, 3], [1, 1, 1], [1, 1, 1], 1], {}, ["schedule_direct_3d_cuda", [1, 192, 8, 8, 8], [192, 192, 3, 3, 3], [1, 1, 1], [1, 1, 1], 1], {"i": 1318306465, "t": "", "c": null, "e": [["tile_f", "sp", [-1, 1, 8, 1]], ["tile_d", "sp", [-1, 2, 1, 2]], ["tile_y", "sp", [-1, 1, 1, 4]], ["tile_x", "sp", [-1, 2, 4, 1]], ["tile_rc", "sp", [-1, 1]], ["tile_rd", "sp", [-1, 3]], ["tile_ry", "sp", [-1, 3]], ["tile_rx", "sp", [-1, 1]], ["auto_unroll_max_step", "ot", 512], ["unroll_explicit", "ot", 1]]}], "r": [[0.00127701425, 0.001276899], 0, 1.317760944366455, 1578559853.0933247], "v": 0.1}
{"i": ["cuda", "schedule_direct_3d_cuda", [[1, 192, 8, 8, 8], [192, 192, 3, 3, 3], [1, 1, 1], [1, 1, 1], 1], {}, ["schedule_direct_3d_cuda", [1, 192, 8, 8, 8], [192, 192, 3, 3, 3], [1, 1, 1], [1, 1, 1], 1], {"i": 420516145, "t": "", "c": null, "e": [["tile_f", "sp", [-1, 1, 8, 1]], ["tile_d", "sp", [-1, 1, 1, 4]], ["tile_y", "sp", [-1, 1, 1, 4]], ["tile_x", "sp", [-1, 2, 4, 1]], ["tile_rc", "sp", [-1, 3]], ["tile_rd", "sp", [-1, 3]], ["tile_ry", "sp", [-1, 3]], ["tile_rx", "sp", [-1, 1]], ["auto_unroll_max_step", "ot", 512], ["unroll_explicit", "ot", 0]]}], "r": [[0.00088905, 0.0008877505], 0, 1.261195421218872, 1578559853.7717102], "v": 0.1}
{"i": ["cuda", "schedule_direct_3d_cuda", [[1, 192, 8, 8, 8], [192, 192, 3, 3, 3], [1, 1, 1], [1, 1, 1], 1], {}, ["schedule_direct_3d_cuda", [1, 192, 8, 8, 8], [192, 192, 3, 3, 3], [1, 1, 1], [1, 1, 1], 1], {"i": 1624740145, "t": "", "c": null, "e": [["tile_f", "sp", [-1, 1, 8, 1]], ["tile_d", "sp", [-1, 1, 1, 4]], ["tile_y", "sp", [-1, 1, 1, 4]], ["tile_x", "sp", [-1, 2, 4, 1]], ["tile_rc", "sp", [-1, 3]], ["tile_rd", "sp", [-1, 3]], ["tile_ry", "sp", [-1, 3]], ["tile_rx", "sp", [-1, 1]], ["auto_unroll_max_step", "ot", 1500], ["unroll_explicit", "ot", 1]]}], "r": [[0.00194667125, 0.001945368], 0, 2.34719181060791, 1578559856.4029708], "v": 0.1}
{"i": ["cuda", "schedule_direct_3d_cuda", [[1, 192, 8, 8, 8], [192, 192, 3, 3, 3], [1, 1, 1], [1, 1, 1], 1], {}, ["schedule_direct_3d_cuda", [1, 192, 8, 8, 8], [192, 192, 3, 3, 3], [1, 1, 1], [1, 1, 1], 1], {"i": 119460145, "t": "", "c": null, "e": [["tile_f", "sp", [-1, 1, 8, 1]], ["tile_d", "sp", [-1, 1, 1, 4]], ["tile_y", "sp", [-1, 1, 1, 4]], ["tile_x", "sp", [-1, 2, 4, 1]], ["tile_rc", "sp", [-1, 3]], ["tile_rd", "sp", [-1, 3]], ["tile_ry", "sp", [-1, 3]], ["tile_rx", "sp", [-1, 1]], ["auto_unroll_max_step", "ot", 0], ["unroll_explicit", "ot", 0]]}], "r": [[0.00174121075, 0.0017393095], 0, 0.9818737506866455, 1578559856.9436505], "v": 0.1}
{"i": ["cuda", "schedule_direct_3d_cuda", [[1, 192, 8, 8, 8], [192, 192, 3, 3, 3], [1, 1, 1], [1, 1, 1], 1], {}, ["schedule_direct_3d_cuda", [1, 192, 8, 8, 8], [192, 192, 3, 3, 3], [1, 1, 1], [1, 1, 1], 1], {"i": 1022628145, "t": "", "c": null, "e": [["tile_f", "sp", [-1, 1, 8, 1]], ["tile_d", "sp", [-1, 1, 1, 4]], ["tile_y", "sp", [-1, 1, 1, 4]], ["tile_x", "sp", [-1, 2, 4, 1]], ["tile_rc", "sp", [-1, 3]], ["tile_rd", "sp", [-1, 3]], ["tile_ry", "sp", [-1, 3]], ["tile_rx", "sp", [-1, 1]], ["auto_unroll_max_step", "ot", 0], ["unroll_explicit", "ot", 1]]}], "r": [[0.00174003825, 0.0017407185], 0, 0.9340946674346924, 1578559857.4258077], "v": 0.1}
{"i": ["cuda", "schedule_direct_3d_cuda", [[1, 192, 8, 8, 8], [192, 192, 3, 3, 3], [1, 1, 1], [1, 1, 1], 1], {}, ["schedule_direct_3d_cuda", [1, 192, 8, 8, 8], [192, 192, 3, 3, 3], [1, 1, 1], [1, 1, 1], 1], {"i": 194724132, "t": "", "c": null, "e": [["tile_f", "sp", [-1, 4, 4, 1]], ["tile_d", "sp", [-1, 1, 1, 4]], ["tile_y", "sp", [-1, 1, 1, 4]], ["tile_x", "sp", [-1, 2, 4, 1]], ["tile_rc", "sp", [-1, 3]], ["tile_rd", "sp", [-1, 3]], ["tile_ry", "sp", [-1, 1]], ["tile_rx", "sp", [-1, 3]], ["auto_unroll_max_step", "ot", 0], ["unroll_explicit", "ot", 0]]}], "r": [[0.00448312375, 0.004482049], 0, 1.2635693550109863, 1578559858.1246388], "v": 0.1}
{"i": ["cuda", "schedule_direct_3d_cuda", [[1, 192, 8, 8, 8], [192, 192, 3, 3, 3], [1, 1, 1], [1, 1, 1], 1], {}, ["schedule_direct_3d_cuda", [1, 192, 8, 8, 8], [192, 192, 3, 3, 3], [1, 1, 1], [1, 1, 1], 1], {"i": 495780132, "t": "", "c": null, "e": [["tile_f", "sp", [-1, 4, 4, 1]], ["tile_d", "sp", [-1, 1, 1, 4]], ["tile_y", "sp", [-1, 1, 1, 4]], ["tile_x", "sp", [-1, 2, 4, 1]], ["tile_rc", "sp", [-1, 3]], ["tile_rd", "sp", [-1, 3]], ["tile_ry", "sp", [-1, 1]], ["tile_rx", "sp", [-1, 3]], ["auto_unroll_max_step", "ot", 512], ["unroll_explicit", "ot", 0]]}], "r": [[0.005722146, 0.00572060475], 0, 1.9048690795898438, 1578559859.1490088], "v": 0.1}
{"i": ["cuda", "schedule_direct_3d_cuda", [[1, 192, 8, 8, 8], [192, 192, 3, 3, 3], [1, 1, 1], [1, 1, 1], 1], {}, ["schedule_direct_3d_cuda", [1, 192, 8, 8, 8], [192, 192, 3, 3, 3], [1, 1, 1], [1, 1, 1], 1], {"i": 43685425, "t": "", "c": null, "e": [["tile_f", "sp", [-1, 1, 8, 1]], ["tile_d", "sp", [-1, 1, 1, 4]], ["tile_y", "sp", [-1, 1, 1, 1]], ["tile_x", "sp", [-1, 2, 2, 1]], ["tile_rc", "sp", [-1, 3]], ["tile_rd", "sp", [-1, 3]], ["tile_ry", "sp", [-1, 1]], ["tile_rx", "sp", [-1, 1]], ["auto_unroll_max_step", "ot", 0], ["unroll_explicit", "ot", 0]]}], "r": [[0.00253541175, 0.0025336135], 0, 1.0667304992675781, 1578559859.743991], "v": 0.1}
{"i": ["cuda", "schedule_direct_3d_cuda", [[1, 192, 8, 8, 8], [192, 192, 3, 3, 3], [1, 1, 1], [1, 1, 1], 1], {}, ["schedule_direct_3d_cuda", [1, 192, 8, 8, 8], [192, 192, 3, 3, 3], [1, 1, 1], [1, 1, 1], 1], {"i": 645797425, "t": "", "c": null, "e": [["tile_f", "sp", [-1, 1, 8, 1]], ["tile_d", "sp", [-1, 1, 1, 4]], ["tile_y", "sp", [-1, 1, 1, 1]], ["tile_x", "sp", [-1, 2, 2, 1]], ["tile_rc", "sp", [-1, 3]], ["tile_rd", "sp", [-1, 3]], ["tile_ry", "sp", [-1, 1]], ["tile_rx", "sp", [-1, 1]], ["auto_unroll_max_step", "ot", 1500], ["unroll_explicit", "ot", 0]]}], "r": [[0.00161905325, 0.00161279225], 0, 1.4695725440979004, 1578559860.485691], "v": 0.1}
{"i": ["cuda", "schedule_direct_3d_cuda", [[1, 192, 8, 8, 8], [192, 192, 3, 3, 3], [1, 1, 1], [1, 1, 1], 1], {}, ["schedule_direct_3d_cuda", [1, 192, 8, 8, 8], [192, 192, 3, 3, 3], [1, 1, 1], [1, 1, 1], 1], {"i": 344741425, "t": "", "c": null, "e": [["tile_f", "sp", [-1, 1, 8, 1]], ["tile_d", "sp", [-1, 1, 1, 4]], ["tile_y", "sp", [-1, 1, 1, 1]], ["tile_x", "sp", [-1, 2, 2, 1]], ["tile_rc", "sp", [-1, 3]], ["tile_rd", "sp", [-1, 3]], ["tile_ry", "sp", [-1, 1]], ["tile_rx", "sp", [-1, 1]], ["auto_unroll_max_step", "ot", 512], ["unroll_explicit", "ot", 0]]}], "r": [[0.001778149, 0.00177561825], 0, 1.1573400497436523, 1578559861.135226], "v": 0.1}
{"i": ["cuda", "schedule_direct_3d_cuda", [[1, 192, 8, 8, 8], [192, 192, 3, 3, 3], [1, 1, 1], [1, 1, 1], 1], {}, ["schedule_direct_3d_cuda", [1, 192, 8, 8, 8], [192, 192, 3, 3, 3], [1, 1, 1], [1, 1, 1], 1], {"i": 1548965425, "t": "", "c": null, "e": [["tile_f", "sp", [-1, 1, 8, 1]], ["tile_d", "sp", [-1, 1, 1, 4]], ["tile_y", "sp", [-1, 1, 1, 1]], ["tile_x", "sp", [-1, 2, 2, 1]], ["tile_rc", "sp", [-1, 3]], ["tile_rd", "sp", [-1, 3]], ["tile_ry", "sp", [-1, 1]], ["tile_rx", "sp", [-1, 1]], ["auto_unroll_max_step", "ot", 1500], ["unroll_explicit", "ot", 1]]}], "r": [[0.00163198525, 0.0016242045], 0, 1.7000224590301514, 1578559861.7878647], "v": 0.1}
{"i": ["cuda", "schedule_direct_3d_cuda", [[1, 192, 8, 8, 8], [192, 192, 3, 3, 3], [1, 1, 1], [1, 1, 1], 1], {}, ["schedule_direct_3d_cuda", [1, 192, 8, 8, 8], [192, 192, 3, 3, 3], [1, 1, 1], [1, 1, 1], 1], {"i": 1247909425, "t": "", "c": null, "e": [["tile_f", "sp", [-1, 1, 8, 1]], ["tile_d", "sp", [-1, 1, 1, 4]], ["tile_y", "sp", [-1, 1, 1, 1]], ["tile_x", "sp", [-1, 2, 2, 1]], ["tile_rc", "sp", [-1, 3]], ["tile_rd", "sp", [-1, 3]], ["tile_ry", "sp", [-1, 1]], ["tile_rx", "sp", [-1, 1]], ["auto_unroll_max_step", "ot", 512], ["unroll_explicit", "ot", 1]]}], "r": [[0.00148153025, 0.00148113075], 0, 1.2379307746887207, 1578559862.3800519], "v": 0.1}
{"i": ["cuda", "schedule_direct_3d_cuda", [[1, 192, 8, 8, 8], [192, 192, 3, 3, 3], [1, 1, 1], [1, 1, 1], 1], {}, ["schedule_direct_3d_cuda", [1, 192, 8, 8, 8], [192, 192, 3, 3, 3], [1, 1, 1], [1, 1, 1], 1], {"i": 909595845, "t": "", "c": null, "e": [["tile_f", "sp", [-1, 1, 8, 3]], ["tile_d", "sp", [-1, 1, 1, 2]], ["tile_y", "sp", [-1, 1, 1, 4]], ["tile_x", "sp", [-1, 1, 4, 1]], ["tile_rc", "sp", [-1, 3]], ["tile_rd", "sp", [-1, 1]], ["tile_ry", "sp", [-1, 1]], ["tile_rx", "sp", [-1, 1]], ["auto_unroll_max_step", "ot", 0], ["unroll_explicit", "ot", 1]]}], "r": [[0.00175282225, 0.00175681875], 0, 1.0818490982055664, 1578559862.964838], "v": 0.1}
{"i": ["cuda", "schedule_direct_3d_cuda", [[1, 192, 8, 8, 8], [192, 192, 3, 3, 3], [1, 1, 1], [1, 1, 1], 1], {}, ["schedule_direct_3d_cuda", [1, 192, 8, 8, 8], [192, 192, 3, 3, 3], [1, 1, 1], [1, 1, 1], 1], {"i": 382757872, "t": "", "c": null, "e": [["tile_f", "sp", [-1, 1, 4, 2]], ["tile_d", "sp", [-1, 1, 1, 1]], ["tile_y", "sp", [-1, 1, 2, 4]], ["tile_x", "sp", [-1, 1, 4, 1]], ["tile_rc", "sp", [-1, 3]], ["tile_rd", "sp", [-1, 1]], ["tile_ry", "sp", [-1, 3]], ["tile_rx", "sp", [-1, 1]], ["auto_unroll_max_step", "ot", 512], ["unroll_explicit", "ot", 0]]}], "r": [[0.00087473375, 0.00086644875], 0, 1.130828857421875, 1578559863.6030557], "v": 0.1}
{"i": ["cuda", "schedule_direct_3d_cuda", [[1, 192, 8, 8, 8], [192, 192, 3, 3, 3], [1, 1, 1], [1, 1, 1], 1], {}, ["schedule_direct_3d_cuda", [1, 192, 8, 8, 8], [192, 192, 3, 3, 3], [1, 1, 1], [1, 1, 1], 1], {"i": 389182137, "t": "", "c": null, "e": [["tile_f", "sp", [-1, 1, 12, 1]], ["tile_d", "sp", [-1, 1, 1, 1]], ["tile_y", "sp", [-1, 2, 2, 2]], ["tile_x", "sp", [-1, 1, 4, 2]], ["tile_rc", "sp", [-1, 6]], ["tile_rd", "sp", [-1, 1]], ["tile_ry", "sp", [-1, 3]], ["tile_rx", "sp", [-1, 1]], ["auto_unroll_max_step", "ot", 512], ["unroll_explicit", "ot", 0]]}], "r": [[0.000704076, 0.00070168775], 0, 1.2685012817382812, 1578560104.5774655], "v": 0.1}
{"i": ["cuda", "schedule_direct_3d_cuda", [[1, 192, 8, 8, 8], [192, 192, 3, 3, 3], [1, 1, 1], [1, 1, 1], 1], {}, ["schedule_direct_3d_cuda", [1, 192, 8, 8, 8], [192, 192, 3, 3, 3], [1, 1, 1], [1, 1, 1], 1], {"i": 385707889, "t": "", "c": null, "e": [["tile_f", "sp", [-1, 1, 8, 1]], ["tile_d", "sp", [-1, 1, 1, 1]], ["tile_y", "sp", [-1, 2, 1, 4]], ["tile_x", "sp", [-1, 1, 8, 1]], ["tile_rc", "sp", [-1, 4]], ["tile_rd", "sp", [-1, 1]], ["tile_ry", "sp", [-1, 3]], ["tile_rx", "sp", [-1, 1]], ["auto_unroll_max_step", "ot", 512], ["unroll_explicit", "ot", 0]]}], "r": [[0.00070848625, 0.000708329], 0, 1.1595935821533203, 1578560105.202221], "v": 0.1}
{"i": ["cuda", "schedule_direct_3d_cuda", [[1, 192, 8, 8, 8], [192, 192, 3, 3, 3], [1, 1, 1], [1, 1, 1], 1], {}, ["schedule_direct_3d_cuda", [1, 192, 8, 8, 8], [192, 192, 3, 3, 3], [1, 1, 1], [1, 1, 1], 1], {"i": 389175409, "t": "", "c": null, "e": [["tile_f", "sp", [-1, 1, 8, 1]], ["tile_d", "sp", [-1, 1, 1, 1]], ["tile_y", "sp", [-1, 1, 2, 2]], ["tile_x", "sp", [-1, 1, 4, 2]], ["tile_rc", "sp", [-1, 6]], ["tile_rd", "sp", [-1, 1]], ["tile_ry", "sp", [-1, 3]], ["tile_rx", "sp", [-1, 1]], ["auto_unroll_max_step", "ot", 512], ["unroll_explicit", "ot", 0]]}], "r": [[0.00060396575, 0.00060741725], 0, 1.226423740386963, 1578560105.8422518], "v": 0.1}
{"i": ["cuda", "schedule_direct_3d_cuda", [[1, 192, 8, 8, 8], [192, 192, 3, 3, 3], [1, 1, 1], [1, 1, 1], 1], {}, ["schedule_direct_3d_cuda", [1, 192, 8, 8, 8], [192, 192, 3, 3, 3], [1, 1, 1], [1, 1, 1], 1], {"i": 385707902, "t": "", "c": null, "e": [["tile_f", "sp", [-1, 1, 16, 1]], ["tile_d", "sp", [-1, 1, 1, 1]], ["tile_y", "sp", [-1, 2, 1, 4]], ["tile_x", "sp", [-1, 1, 8, 1]], ["tile_rc", "sp", [-1, 4]], ["tile_rd", "sp", [-1, 1]], ["tile_ry", "sp", [-1, 3]], ["tile_rx", "sp", [-1, 1]], ["auto_unroll_max_step", "ot", 512], ["unroll_explicit", "ot", 0]]}], "r": [[0.0005689895, 0.000570382], 0, 1.172102689743042, 1578560106.4780366], "v": 0.1}
{"i": ["cuda", "schedule_direct_3d_cuda", [[1, 192, 8, 8, 8], [192, 192, 3, 3, 3], [1, 1, 1], [1, 1, 1], 1], {}, ["schedule_direct_3d_cuda", [1, 192, 8, 8, 8], [192, 192, 3, 3, 3], [1, 1, 1], [1, 1, 1], 1], {"i": 1292343409, "t": "", "c": null, "e": [["tile_f", "sp", [-1, 1, 8, 1]], ["tile_d", "sp", [-1, 1, 1, 1]], ["tile_y", "sp", [-1, 1, 2, 2]], ["tile_x", "sp", [-1, 1, 4, 2]], ["tile_rc", "sp", [-1, 6]], ["tile_rd", "sp", [-1, 1]], ["tile_ry", "sp", [-1, 3]], ["tile_rx", "sp", [-1, 1]], ["auto_unroll_max_step", "ot", 512], ["unroll_explicit", "ot", 1]]}], "r": [[0.00050978075, 0.00050948275], 0, 1.3262598514556885, 1578560107.0699446], "v": 0.1}
{"i": ["cuda", "schedule_direct_3d_cuda", [[1, 192, 8, 8, 8], [192, 192, 3, 3, 3], [1, 1, 1], [1, 1, 1], 1], {}, ["schedule_direct_3d_cuda", [1, 192, 8, 8, 8], [192, 192, 3, 3, 3], [1, 1, 1], [1, 1, 1], 1], {"i": 417930308, "t": "", "c": null, "e": [["tile_f", "sp", [-1, 1, 24, 1]], ["tile_d", "sp", [-1, 1, 1, 1]], ["tile_y", "sp", [-1, 4, 1, 2]], ["tile_x", "sp", [-1, 1, 8, 1]], ["tile_rc", "sp", [-1, 2]], ["tile_rd", "sp", [-1, 3]], ["tile_ry", "sp", [-1, 3]], ["tile_rx", "sp", [-1, 1]], ["auto_unroll_max_step", "ot", 512], ["unroll_explicit", "ot", 0]]}], "r": [[0.000439036, 0.00043898775], 0, 1.193636417388916, 1578560107.6732495], "v": 0.1}
{"i": ["cuda", "schedule_direct_3d_cuda", [[1, 192, 8, 8, 8], [192, 192, 3, 3, 3], [1, 1, 1], [1, 1, 1], 1], {}, ["schedule_direct_3d_cuda", [1, 192, 8, 8, 8], [192, 192, 3, 3, 3], [1, 1, 1], [1, 1, 1], 1], {"i": 116618601, "t": "", "c": null, "e": [["tile_f", "sp", [-1, 1, 12, 1]], ["tile_d", "sp", [-1, 1, 1, 8]], ["tile_y", "sp", [-1, 1, 2, 2]], ["tile_x", "sp", [-1, 1, 4, 1]], ["tile_rc", "sp", [-1, 2]], ["tile_rd", "sp", [-1, 3]], ["tile_ry", "sp", [-1, 3]], ["tile_rx", "sp", [-1, 1]], ["auto_unroll_max_step", "ot", 0], ["unroll_explicit", "ot", 0]]}], "r": [[0.000559909, 0.00055878775], 0, 1.11057448387146, 1578560108.284421], "v": 0.1}
{"i": ["cuda", "schedule_direct_3d_cuda", [[1, 192, 8, 8, 8], [192, 192, 3, 3, 3], [1, 1, 1], [1, 1, 1], 1], {}, ["schedule_direct_3d_cuda", [1, 192, 8, 8, 8], [192, 192, 3, 3, 3], [1, 1, 1], [1, 1, 1], 1], {"i": 388110297, "t": "", "c": null, "e": [["tile_f", "sp", [-1, 1, 12, 1]], ["tile_d", "sp", [-1, 1, 1, 2]], ["tile_y", "sp", [-1, 2, 2, 2]], ["tile_x", "sp", [-1, 1, 4, 1]], ["tile_rc", "sp", [-1, 6]], ["tile_rd", "sp", [-1, 1]], ["tile_ry", "sp", [-1, 3]], ["tile_rx", "sp", [-1, 1]], ["auto_unroll_max_step", "ot", 512], ["unroll_explicit", "ot", 0]]}], "r": [[0.00079233775, 0.00079082625], 0, 1.3274617195129395, 1578560108.9904542], "v": 0.1}
{"i": ["cuda", "schedule_direct_3d_cuda", [[1, 192, 8, 8, 8], [192, 192, 3, 3, 3], [1, 1, 1], [1, 1, 1], 1], {}, ["schedule_direct_3d_cuda", [1, 192, 8, 8, 8], [192, 192, 3, 3, 3], [1, 1, 1], [1, 1, 1], 1], {"i": 386487409, "t": "", "c": null, "e": [["tile_f", "sp", [-1, 1, 8, 1]], ["tile_d", "sp", [-1, 1, 1, 1]], ["tile_y", "sp", [-1, 1, 2, 2]], ["tile_x", "sp", [-1, 1, 4, 2]], ["tile_rc", "sp", [-1, 4]], ["tile_rd", "sp", [-1, 1]], ["tile_ry", "sp", [-1, 3]], ["tile_rx", "sp", [-1, 1]], ["auto_unroll_max_step", "ot", 512], ["unroll_explicit", "ot", 0]]}], "r": [[0.000484597, 0.00048195575], 0, 1.3277580738067627, 1578560109.644981], "v": 0.1}
{"i": ["cuda", "schedule_direct_3d_cuda", [[1, 192, 8, 8, 8], [192, 192, 3, 3, 3], [1, 1, 1], [1, 1, 1], 1], {}, ["schedule_direct_3d_cuda", [1, 192, 8, 8, 8], [192, 192, 3, 3, 3], [1, 1, 1], [1, 1, 1], 1], {"i": 1292350137, "t": "", "c": null, "e": [["tile_f", "sp", [-1, 1, 12, 1]], ["tile_d", "sp", [-1, 1, 1, 1]], ["tile_y", "sp", [-1, 2, 2, 2]], ["tile_x", "sp", [-1, 1, 4, 2]], ["tile_rc", "sp", [-1, 6]], ["tile_rd", "sp", [-1, 1]], ["tile_ry", "sp", [-1, 3]], ["tile_rx", "sp", [-1, 1]], ["auto_unroll_max_step", "ot", 512], ["unroll_explicit", "ot", 1]]}], "r": [[0.0004549545, 0.00045361325], 0, 1.468700885772705, 1578560110.3107362], "v": 0.1}
{"i": ["cuda", "schedule_direct_3d_cuda", [[1, 192, 8, 8, 8], [192, 192, 3, 3, 3], [1, 1, 1], [1, 1, 1], 1], {}, ["schedule_direct_3d_cuda", [1, 192, 8, 8, 8], [192, 192, 3, 3, 3], [1, 1, 1], [1, 1, 1], 1], {"i": 417674601, "t": "", "c": null, "e": [["tile_f", "sp", [-1, 1, 12, 1]], ["tile_d", "sp", [-1, 1, 1, 8]], ["tile_y", "sp", [-1, 1, 2, 2]], ["tile_x", "sp", [-1, 1, 4, 1]], ["tile_rc", "sp", [-1, 2]], ["tile_rd", "sp", [-1, 3]], ["tile_ry", "sp", [-1, 3]], ["tile_rx", "sp", [-1, 1]], ["auto_unroll_max_step", "ot", 512], ["unroll_explicit", "ot", 0]]}], "r": [[0.0004838, 0.00048203775], 0, 1.1286873817443848, 1578560110.902559], "v": 0.1}
{"i": ["cuda", "schedule_direct_3d_cuda", [[1, 192, 8, 8, 8], [192, 192, 3, 3, 3], [1, 1, 1], [1, 1, 1], 1], {}, ["schedule_direct_3d_cuda", [1, 192, 8, 8, 8], [192, 192, 3, 3, 3], [1, 1, 1], [1, 1, 1], 1], {"i": 493187246, "t": "", "c": null, "e": [["tile_f", "sp", [-1, 1, 16, 1]], ["tile_d", "sp", [-1, 1, 1, 8]], ["tile_y", "sp", [-1, 1, 1, 2]], ["tile_x", "sp", [-1, 1, 8, 1]], ["tile_rc", "sp", [-1, 2]], ["tile_rd", "sp", [-1, 3]], ["tile_ry", "sp", [-1, 1]], ["tile_rx", "sp", [-1, 3]], ["auto_unroll_max_step", "ot", 512], ["unroll_explicit", "ot", 0]]}], "r": [[0.0006973525, 0.00069638025], 0, 1.1223878860473633, 1578560111.5158474], "v": 0.1}
{"i": ["cuda", "schedule_direct_3d_cuda", [[1, 192, 8, 8, 8], [192, 192, 3, 3, 3], [1, 1, 1], [1, 1, 1], 1], {}, ["schedule_direct_3d_cuda", [1, 192, 8, 8, 8], [192, 192, 3, 3, 3], [1, 1, 1], [1, 1, 1], 1], {"i": 690238137, "t": "", "c": null, "e": [["tile_f", "sp", [-1, 1, 12, 1]], ["tile_d", "sp", [-1, 1, 1, 1]], ["tile_y", "sp", [-1, 2, 2, 2]], ["tile_x", "sp", [-1, 1, 4, 2]], ["tile_rc", "sp", [-1, 6]], ["tile_rd", "sp", [-1, 1]], ["tile_ry", "sp", [-1, 3]], ["tile_rx", "sp", [-1, 1]], ["auto_unroll_max_step", "ot", 1500], ["unroll_explicit", "ot", 0]]}], "r": [[0.00044824875, 0.00044435275], 0, 1.7129795551300049, 1578560113.7146745], "v": 0.1}
{"i": ["cuda", "schedule_direct_3d_cuda", [[1, 192, 8, 8, 8], [192, 192, 3, 3, 3], [1, 1, 1], [1, 1, 1], 1], {}, ["schedule_direct_3d_cuda", [1, 192, 8, 8, 8], [192, 192, 3, 3, 3], [1, 1, 1], [1, 1, 1], 1], {"i": 1019786601, "t": "", "c": null, "e": [["tile_f", "sp", [-1, 1, 12, 1]], ["tile_d", "sp", [-1, 1, 1, 8]], ["tile_y", "sp", [-1, 1, 2, 2]], ["tile_x", "sp", [-1, 1, 4, 1]], ["tile_rc", "sp", [-1, 2]], ["tile_rd", "sp", [-1, 3]], ["tile_ry", "sp", [-1, 3]], ["tile_rx", "sp", [-1, 1]], ["auto_unroll_max_step", "ot", 0], ["unroll_explicit", "ot", 1]]}], "r": [[0.00055859525, 0.0005584465], 0, 0.925818920135498, 1578560114.1869588], "v": 0.1}
{"i": ["cuda", "schedule_direct_3d_cuda", [[1, 192, 8, 8, 8], [192, 192, 3, 3, 3], [1, 1, 1], [1, 1, 1], 1], {}, ["schedule_direct_3d_cuda", [1, 192, 8, 8, 8], [192, 192, 3, 3, 3], [1, 1, 1], [1, 1, 1], 1], {"i": 794243246, "t": "", "c": null, "e": [["tile_f", "sp", [-1, 1, 16, 1]], ["tile_d", "sp", [-1, 1, 1, 8]], ["tile_y", "sp", [-1, 1, 1, 2]], ["tile_x", "sp", [-1, 1, 8, 1]], ["tile_rc", "sp", [-1, 2]], ["tile_rd", "sp", [-1, 3]], ["tile_ry", "sp", [-1, 1]], ["tile_rx", "sp", [-1, 3]], ["auto_unroll_max_step", "ot", 1500], ["unroll_explicit", "ot", 0]]}], "r": [[0.00060415475, 0.0006034955], 0, 1.3776307106018066, 1578560114.8683364], "v": 0.1}
{"i": ["cuda", "schedule_direct_3d_cuda", [[1, 192, 8, 8, 8], [192, 192, 3, 3, 3], [1, 1, 1], [1, 1, 1], 1], {}, ["schedule_direct_3d_cuda", [1, 192, 8, 8, 8], [192, 192, 3, 3, 3], [1, 1, 1], [1, 1, 1], 1], {"i": 88126137, "t": "", "c": null, "e": [["tile_f", "sp", [-1, 1, 12, 1]], ["tile_d", "sp", [-1, 1, 1, 1]], ["tile_y", "sp", [-1, 2, 2, 2]], ["tile_x", "sp", [-1, 1, 4, 2]], ["tile_rc", "sp", [-1, 6]], ["tile_rd", "sp", [-1, 1]], ["tile_ry", "sp", [-1, 3]], ["tile_rx", "sp", [-1, 1]], ["auto_unroll_max_step", "ot", 0], ["unroll_explicit", "ot", 0]]}], "r": [[0.0004321295, 0.00043095775], 0, 1.0880200862884521, 1578560115.5247061], "v": 0.1}
{"i": ["cuda", "schedule_direct_3d_cuda", [[1, 192, 8, 8, 8], [192, 192, 3, 3, 3], [1, 1, 1], [1, 1, 1], 1], {}, ["schedule_direct_3d_cuda", [1, 192, 8, 8, 8], [192, 192, 3, 3, 3], [1, 1, 1], [1, 1, 1], 1], {"i": 388103569, "t": "", "c": null, "e": [["tile_f", "sp", [-1, 1, 8, 1]], ["tile_d", "sp", [-1, 1, 1, 2]], ["tile_y", "sp", [-1, 1, 2, 2]], ["tile_x", "sp", [-1, 1, 4, 1]], ["tile_rc", "sp", [-1, 6]], ["tile_rd", "sp", [-1, 1]], ["tile_ry", "sp", [-1, 3]], ["tile_rx", "sp", [-1, 1]], ["auto_unroll_max_step", "ot", 512], ["unroll_explicit", "ot", 0]]}], "r": [[0.00117219575, 0.0011425985], 0, 1.2767739295959473, 1578560116.1863363], "v": 0.1}
{"i": ["cuda", "schedule_direct_3d_cuda", [[1, 192, 8, 8, 8], [192, 192, 3, 3, 3], [1, 1, 1], [1, 1, 1], 1], {}, ["schedule_direct_3d_cuda", [1, 192, 8, 8, 8], [192, 192, 3, 3, 3], [1, 1, 1], [1, 1, 1], 1], {"i": 388241337, "t": "", "c": null, "e": [["tile_f", "sp", [-1, 1, 12, 1]], ["tile_d", "sp", [-1, 1, 1, 1]], ["tile_y", "sp", [-1, 2, 2, 2]], ["tile_x", "sp", [-1, 2, 4, 1]], ["tile_rc", "sp", [-1, 6]], ["tile_rd", "sp", [-1, 1]], ["tile_ry", "sp", [-1, 3]], ["tile_rx", "sp", [-1, 1]], ["auto_unroll_max_step", "ot", 512], ["unroll_explicit", "ot", 0]]}], "r": [[0.0007908805, 0.0007905105], 0, 1.3078982830047607, 1578560116.9145043], "v": 0.1}
{"i": ["cuda", "schedule_direct_3d_cuda", [[1, 192, 8, 8, 8], [192, 192, 3, 3, 3], [1, 1, 1], [1, 1, 1], 1], {}, ["schedule_direct_3d_cuda", [1, 192, 8, 8, 8], [192, 192, 3, 3, 3], [1, 1, 1], [1, 1, 1], 1], {"i": 689297337, "t": "", "c": null, "e": [["tile_f", "sp", [-1, 1, 12, 1]], ["tile_d", "sp", [-1, 1, 1, 1]], ["tile_y", "sp", [-1, 2, 2, 2]], ["tile_x", "sp", [-1, 2, 4, 1]], ["tile_rc", "sp", [-1, 6]], ["tile_rd", "sp", [-1, 1]], ["tile_ry", "sp", [-1, 3]], ["tile_rx", "sp", [-1, 1]], ["auto_unroll_max_step", "ot", 1500], ["unroll_explicit", "ot", 0]]}], "r": [[0.00045962675, 0.00046314975], 0, 1.711083173751831, 1578560117.7638602], "v": 0.1}
