auto_log/((1, 24, 64, 128, 128), (12, 24, 1, 1, 1), (1, 12, 64, 128, 128), (1, 1, 1), (0, 0, 0), 1, 1, None)_fwd.log
{"i": ["cuda", "schedule_direct_3d_cuda", [[1, 24, 64, 128, 128], [12, 24, 1, 1, 1], [1, 1, 1], [0, 0, 0], 1], {}, ["schedule_direct_3d_cuda", [1, 24, 64, 128, 128], [12, 24, 1, 1, 1], [1, 1, 1], [0, 0, 0], 1], {"i": 34320256, "t": "", "c": null, "e": [["tile_f", "sp", [-1, 2, 6, 1]], ["tile_d", "sp", [-1, 4, 1, 2]], ["tile_y", "sp", [-1, 64, 2, 1]], ["tile_x", "sp", [-1, 1, 1, 8]], ["tile_rc", "sp", [-1, 1]], ["tile_rd", "sp", [-1, 1]], ["tile_ry", "sp", [-1, 1]], ["tile_rx", "sp", [-1, 1]], ["auto_unroll_max_step", "ot", 0], ["unroll_explicit", "ot", 0]]}], "r": [[0.065287753, 0.064926534], 0, 2.2918429374694824, 1578497650.664192], "v": 0.1}
{"i": ["cuda", "schedule_direct_3d_cuda", [[1, 24, 64, 128, 128], [12, 24, 1, 1, 1], [1, 1, 1], [0, 0, 0], 1], {}, ["schedule_direct_3d_cuda", [1, 24, 64, 128, 128], [12, 24, 1, 1, 1], [1, 1, 1], [0, 0, 0], 1], {"i": 14898105, "t": "", "c": null, "e": [["tile_f", "sp", [-1, 2, 3, 2]], ["tile_d", "sp", [-1, 1, 1, 32]], ["tile_y", "sp", [-1, 1, 2, 32]], ["tile_x", "sp", [-1, 1, 1, 2]], ["tile_rc", "sp", [-1, 1]], ["tile_rd", "sp", [-1, 1]], ["tile_ry", "sp", [-1, 1]], ["tile_rx", "sp", [-1, 1]], ["auto_unroll_max_step", "ot", 0], ["unroll_explicit", "ot", 0]]}], "r": [[0.0328107545, 0.031599035], 0, 2.456040143966675, 1578497685.9670696], "v": 0.1}
{"i": ["cuda", "schedule_direct_3d_cuda", [[1, 24, 64, 128, 128], [12, 24, 1, 1, 1], [1, 1, 1], [0, 0, 0], 1], {}, ["schedule_direct_3d_cuda", [1, 24, 64, 128, 128], [12, 24, 1, 1, 1], [1, 1, 1], [0, 0, 0], 1], {"i": 583868, "t": "", "c": null, "e": [["tile_f", "sp", [-1, 2, 1, 3]], ["tile_d", "sp", [-1, 1, 1, 8]], ["tile_y", "sp", [-1, 16, 4, 2]], ["tile_x", "sp", [-1, 2, 1, 1]], ["tile_rc", "sp", [-1, 1]], ["tile_rd", "sp", [-1, 1]], ["tile_ry", "sp", [-1, 1]], ["tile_rx", "sp", [-1, 1]], ["auto_unroll_max_step", "ot", 0], ["unroll_explicit", "ot", 0]]}], "r": [[0.09658192525, 0.09618412175], 0, 2.158174514770508, 1578497687.4904864], "v": 0.1}
{"i": ["cuda", "schedule_direct_3d_cuda", [[1, 24, 64, 128, 128], [12, 24, 1, 1, 1], [1, 1, 1], [0, 0, 0], 1], {}, ["schedule_direct_3d_cuda", [1, 24, 64, 128, 128], [12, 24, 1, 1, 1], [1, 1, 1], [0, 0, 0], 1], {"i": 498368505, "t": "", "c": null, "e": [["tile_f", "sp", [-1, 2, 3, 2]], ["tile_d", "sp", [-1, 1, 1, 32]], ["tile_y", "sp", [-1, 8, 1, 1]], ["tile_x", "sp", [-1, 1, 1, 2]], ["tile_rc", "sp", [-1, 3]], ["tile_rd", "sp", [-1, 1]], ["tile_ry", "sp", [-1, 1]], ["tile_rx", "sp", [-1, 1]], ["auto_unroll_max_step", "ot", 512], ["unroll_explicit", "ot", 0]]}], "r": [[0.070874262, 0.07091473075], 0, 2.4504456520080566, 1578497689.353769], "v": 0.1}
{"i": ["cuda", "schedule_direct_3d_cuda", [[1, 24, 64, 128, 128], [12, 24, 1, 1, 1], [1, 1, 1], [0, 0, 0], 1], {}, ["schedule_direct_3d_cuda", [1, 24, 64, 128, 128], [12, 24, 1, 1, 1], [1, 1, 1], [0, 0, 0], 1], {"i": 3881949, "t": "", "c": null, "e": [["tile_f", "sp", [-1, 4, 1, 3]], ["tile_d", "sp", [-1, 1, 1, 2]], ["tile_y", "sp", [-1, 1, 4, 4]], ["tile_x", "sp", [-1, 2, 2, 1]], ["tile_rc", "sp", [-1, 1]], ["tile_rd", "sp", [-1, 1]], ["tile_ry", "sp", [-1, 1]], ["tile_rx", "sp", [-1, 1]], ["auto_unroll_max_step", "ot", 0], ["unroll_explicit", "ot", 0]]}], "r": [[0.00128976125, 0.0012893295], 0, 0.9909143447875977, 1578497701.2651784], "v": 0.1}
{"i": ["cuda", "schedule_direct_3d_cuda", [[1, 24, 64, 128, 128], [12, 24, 1, 1, 1], [1, 1, 1], [0, 0, 0], 1], {}, ["schedule_direct_3d_cuda", [1, 24, 64, 128, 128], [12, 24, 1, 1, 1], [1, 1, 1], [0, 0, 0], 1], {"i": 778025949, "t": "", "c": null, "e": [["tile_f", "sp", [-1, 4, 1, 3]], ["tile_d", "sp", [-1, 1, 1, 2]], ["tile_y", "sp", [-1, 1, 4, 4]], ["tile_x", "sp", [-1, 2, 2, 1]], ["tile_rc", "sp", [-1, 1]], ["tile_rd", "sp", [-1, 1]], ["tile_ry", "sp", [-1, 1]], ["tile_rx", "sp", [-1, 1]], ["auto_unroll_max_step", "ot", 1500], ["unroll_explicit", "ot", 0]]}], "r": [[0.00129326475, 0.001289116], 0, 1.0324184894561768, 1578497702.1091957], "v": 0.1}
{"i": ["cuda", "schedule_direct_3d_cuda", [[1, 24, 64, 128, 128], [12, 24, 1, 1, 1], [1, 1, 1], [0, 0, 0], 1], {}, ["schedule_direct_3d_cuda", [1, 24, 64, 128, 128], [12, 24, 1, 1, 1], [1, 1, 1], [0, 0, 0], 1], {"i": 1161799868, "t": "", "c": null, "e": [["tile_f", "sp", [-1, 2, 1, 3]], ["tile_d", "sp", [-1, 1, 1, 8]], ["tile_y", "sp", [-1, 16, 4, 2]], ["tile_x", "sp", [-1, 2, 1, 1]], ["tile_rc", "sp", [-1, 1]], ["tile_rd", "sp", [-1, 1]], ["tile_ry", "sp", [-1, 1]], ["tile_rx", "sp", [-1, 1]], ["auto_unroll_max_step", "ot", 0], ["unroll_explicit", "ot", 1]]}], "r": [[0.09644925575, 0.09643404375], 0, 2.05969500541687, 1578497703.540466], "v": 0.1}
{"i": ["cuda", "schedule_direct_3d_cuda", [[1, 24, 64, 128, 128], [12, 24, 1, 1, 1], [1, 1, 1], [0, 0, 0], 1], {}, ["schedule_direct_3d_cuda", [1, 24, 64, 128, 128], [12, 24, 1, 1, 1], [1, 1, 1], [0, 0, 0], 1], {"i": 401970105, "t": "", "c": null, "e": [["tile_f", "sp", [-1, 2, 3, 2]], ["tile_d", "sp", [-1, 1, 1, 32]], ["tile_y", "sp", [-1, 1, 2, 32]], ["tile_x", "sp", [-1, 1, 1, 2]], ["tile_rc", "sp", [-1, 1]], ["tile_rd", "sp", [-1, 1]], ["tile_ry", "sp", [-1, 1]], ["tile_rx", "sp", [-1, 1]], ["auto_unroll_max_step", "ot", 512], ["unroll_explicit", "ot", 0]]}], "r": [[0.02976900975, 0.0297308995], 0, 2.38493275642395, 1578497704.8612266], "v": 0.1}
{"i": ["cuda", "schedule_direct_3d_cuda", [[1, 24, 64, 128, 128], [12, 24, 1, 1, 1], [1, 1, 1], [0, 0, 0], 1], {}, ["schedule_direct_3d_cuda", [1, 24, 64, 128, 128], [12, 24, 1, 1, 1], [1, 1, 1], [0, 0, 0], 1], {"i": 401600505, "t": "", "c": null, "e": [["tile_f", "sp", [-1, 2, 3, 2]], ["tile_d", "sp", [-1, 1, 1, 32]], ["tile_y", "sp", [-1, 8, 1, 1]], ["tile_x", "sp", [-1, 1, 1, 2]], ["tile_rc", "sp", [-1, 1]], ["tile_rd", "sp", [-1, 1]], ["tile_ry", "sp", [-1, 1]], ["tile_rx", "sp", [-1, 1]], ["auto_unroll_max_step", "ot", 512], ["unroll_explicit", "ot", 0]]}], "r": [[0.06807061, 0.06778629425], 0, 2.2737903594970703, 1578497714.8748024], "v": 0.1}
{"i": ["cuda", "schedule_direct_3d_cuda", [[1, 24, 64, 128, 128], [12, 24, 1, 1, 1], [1, 1, 1], [0, 0, 0], 1], {}, ["schedule_direct_3d_cuda", [1, 24, 64, 128, 128], [12, 24, 1, 1, 1], [1, 1, 1], [0, 0, 0], 1], {"i": 1161799848, "t": "", "c": null, "e": [["tile_f", "sp", [-1, 3, 2, 1]], ["tile_d", "sp", [-1, 1, 1, 8]], ["tile_y", "sp", [-1, 16, 4, 2]], ["tile_x", "sp", [-1, 2, 1, 1]], ["tile_rc", "sp", [-1, 1]], ["tile_rd", "sp", [-1, 1]], ["tile_ry", "sp", [-1, 1]], ["tile_rx", "sp", [-1, 1]], ["auto_unroll_max_step", "ot", 0], ["unroll_explicit", "ot", 1]]}], "r": [[0.051021892, 0.05110272775], 0, 1.8498504161834717, 1578497716.3192992], "v": 0.1}
{"i": ["cuda", "schedule_direct_3d_cuda", [[1, 24, 64, 128, 128], [12, 24, 1, 1, 1], [1, 1, 1], [0, 0, 0], 1], {}, ["schedule_direct_3d_cuda", [1, 24, 64, 128, 128], [12, 24, 1, 1, 1], [1, 1, 1], [0, 0, 0], 1], {"i": 6599292, "t": "", "c": null, "e": [["tile_f", "sp", [-1, 4, 3, 1]], ["tile_d", "sp", [-1, 64, 1, 1]], ["tile_y", "sp", [-1, 2, 2, 2]], ["tile_x", "sp", [-1, 2, 4, 1]], ["tile_rc", "sp", [-1, 1]], ["tile_rd", "sp", [-1, 1]], ["tile_ry", "sp", [-1, 1]], ["tile_rx", "sp", [-1, 1]], ["auto_unroll_max_step", "ot", 0], ["unroll_explicit", "ot", 0]]}], "r": [[0.01804483775, 0.01805776525], 0, 2.5452728271484375, 1578497717.4424262], "v": 0.1}
{"i": ["cuda", "schedule_direct_3d_cuda", [[1, 24, 64, 128, 128], [12, 24, 1, 1, 1], [1, 1, 1], [0, 0, 0], 1], {}, ["schedule_direct_3d_cuda", [1, 24, 64, 128, 128], [12, 24, 1, 1, 1], [1, 1, 1], [0, 0, 0], 1], {"i": 780743292, "t": "", "c": null, "e": [["tile_f", "sp", [-1, 4, 3, 1]], ["tile_d", "sp", [-1, 64, 1, 1]], ["tile_y", "sp", [-1, 2, 2, 2]], ["tile_x", "sp", [-1, 2, 4, 1]], ["tile_rc", "sp", [-1, 1]], ["tile_rd", "sp", [-1, 1]], ["tile_ry", "sp", [-1, 1]], ["tile_rx", "sp", [-1, 1]], ["auto_unroll_max_step", "ot", 1500], ["unroll_explicit", "ot", 0]]}], "r": [[0.0171992165, 0.0172465475], 0, 9.934182405471802, 1578497719.7535632], "v": 0.1}
{"i": ["cuda", "schedule_direct_3d_cuda", [[1, 24, 64, 128, 128], [12, 24, 1, 1, 1], [1, 1, 1], [0, 0, 0], 1], {}, ["schedule_direct_3d_cuda", [1, 24, 64, 128, 128], [12, 24, 1, 1, 1], [1, 1, 1], [0, 0, 0], 1], {"i": 1939135309, "t": "", "c": null, "e": [["tile_f", "sp", [-1, 4, 1, 3]], ["tile_d", "sp", [-1, 2, 1, 4]], ["tile_y", "sp", [-1, 1, 2, 2]], ["tile_x", "sp", [-1, 2, 2, 1]], ["tile_rc", "sp", [-1, 1]], ["tile_rd", "sp", [-1, 1]], ["tile_ry", "sp", [-1, 1]], ["tile_rx", "sp", [-1, 1]], ["auto_unroll_max_step", "ot", 1500], ["unroll_explicit", "ot", 1]]}], "r": [[0.03235732975, 0.032331944], 0, 2.1724252700805664, 1578497721.0570598], "v": 0.1}
{"i": ["cuda", "schedule_direct_3d_cuda", [[1, 24, 64, 128, 128], [12, 24, 1, 1, 1], [1, 1, 1], [0, 0, 0], 1], {}, ["schedule_direct_3d_cuda", [1, 24, 64, 128, 128], [12, 24, 1, 1, 1], [1, 1, 1], [0, 0, 0], 1], {"i": 1563327557, "t": "", "c": null, "e": [["tile_f", "sp", [-1, 2, 1, 6]], ["tile_d", "sp", [-1, 16, 1, 1]], ["tile_y", "sp", [-1, 1, 1, 2]], ["tile_x", "sp", [-1, 2, 1, 2]], ["tile_rc", "sp", [-1, 1]], ["tile_rd", "sp", [-1, 1]], ["tile_ry", "sp", [-1, 1]], ["tile_rx", "sp", [-1, 1]], ["auto_unroll_max_step", "ot", 512], ["unroll_explicit", "ot", 1]]}], "r": [[0.2289052945, 0.22889136075], 0, 4.460995197296143, 1578497734.9551883], "v": 0.1}
{"i": ["cuda", "schedule_direct_3d_cuda", [[1, 24, 64, 128, 128], [12, 24, 1, 1, 1], [1, 1, 1], [0, 0, 0], 1], {}, ["schedule_direct_3d_cuda", [1, 24, 64, 128, 128], [12, 24, 1, 1, 1], [1, 1, 1], [0, 0, 0], 1], {"i": 789042105, "t": "", "c": null, "e": [["tile_f", "sp", [-1, 2, 3, 2]], ["tile_d", "sp", [-1, 1, 1, 32]], ["tile_y", "sp", [-1, 1, 2, 32]], ["tile_x", "sp", [-1, 1, 1, 2]], ["tile_rc", "sp", [-1, 1]], ["tile_rd", "sp", [-1, 1]], ["tile_ry", "sp", [-1, 1]], ["tile_rx", "sp", [-1, 1]], ["auto_unroll_max_step", "ot", 1500], ["unroll_explicit", "ot", 0]]}], "r": [[0.02829328575, 0.0281605535], 0, 6.4661948680877686, 1578497737.6701658], "v": 0.1}
{"i": ["cuda", "schedule_direct_3d_cuda", [[1, 24, 64, 128, 128], [12, 24, 1, 1, 1], [1, 1, 1], [0, 0, 0], 1], {}, ["schedule_direct_3d_cuda", [1, 24, 64, 128, 128], [12, 24, 1, 1, 1], [1, 1, 1], [0, 0, 0], 1], {"i": 1563314108, "t": "", "c": null, "e": [["tile_f", "sp", [-1, 2, 1, 3]], ["tile_d", "sp", [-1, 16, 1, 1]], ["tile_y", "sp", [-1, 4, 32, 1]], ["tile_x", "sp", [-1, 2, 1, 2]], ["tile_rc", "sp", [-1, 1]], ["tile_rd", "sp", [-1, 1]], ["tile_ry", "sp", [-1, 1]], ["tile_rx", "sp", [-1, 1]], ["auto_unroll_max_step", "ot", 512], ["unroll_explicit", "ot", 1]]}], "r": [[0.01757325775, 0.01695821425], 0, 6.389765024185181, 1578497739.0736523], "v": 0.1}
{"i": ["cuda", "schedule_direct_3d_cuda", [[1, 24, 64, 128, 128], [12, 24, 1, 1, 1], [1, 1, 1], [0, 0, 0], 1], {}, ["schedule_direct_3d_cuda", [1, 24, 64, 128, 128], [12, 24, 1, 1, 1], [1, 1, 1], [0, 0, 0], 1], {"i": 393671292, "t": "", "c": null, "e": [["tile_f", "sp", [-1, 4, 3, 1]], ["tile_d", "sp", [-1, 64, 1, 1]], ["tile_y", "sp", [-1, 2, 2, 2]], ["tile_x", "sp", [-1, 2, 4, 1]], ["tile_rc", "sp", [-1, 1]], ["tile_rd", "sp", [-1, 1]], ["tile_ry", "sp", [-1, 1]], ["tile_rx", "sp", [-1, 1]], ["auto_unroll_max_step", "ot", 512], ["unroll_explicit", "ot", 0]]}], "r": [[0.017163256, 0.01724775575], 0, 9.203571557998657, 1578497740.5252175], "v": 0.1}
{"i": ["cuda", "schedule_direct_3d_cuda", [[1, 24, 64, 128, 128], [12, 24, 1, 1, 1], [1, 1, 1], [0, 0, 0], 1], {}, ["schedule_direct_3d_cuda", [1, 24, 64, 128, 128], [12, 24, 1, 1, 1], [1, 1, 1], [0, 0, 0], 1], {"i": 780743309, "t": "", "c": null, "e": [["tile_f", "sp", [-1, 4, 1, 3]], ["tile_d", "sp", [-1, 64, 1, 1]], ["tile_y", "sp", [-1, 2, 2, 2]], ["tile_x", "sp", [-1, 2, 4, 1]], ["tile_rc", "sp", [-1, 1]], ["tile_rd", "sp", [-1, 1]], ["tile_ry", "sp", [-1, 1]], ["tile_rx", "sp", [-1, 1]], ["auto_unroll_max_step", "ot", 1500], ["unroll_explicit", "ot", 0]]}], "r": [[0.04523357025, 0.0452226725], 0, 11.958783149719238, 1578497743.008914], "v": 0.1}
{"i": ["cuda", "schedule_direct_3d_cuda", [[1, 24, 64, 128, 128], [12, 24, 1, 1, 1], [1, 1, 1], [0, 0, 0], 1], {}, ["schedule_direct_3d_cuda", [1, 24, 64, 128, 128], [12, 24, 1, 1, 1], [1, 1, 1], [0, 0, 0], 1], {"i": 1563328677, "t": "", "c": null, "e": [["tile_f", "sp", [-1, 2, 1, 6]], ["tile_d", "sp", [-1, 16, 1, 2]], ["tile_y", "sp", [-1, 1, 1, 2]], ["tile_x", "sp", [-1, 2, 1, 2]], ["tile_rc", "sp", [-1, 1]], ["tile_rd", "sp", [-1, 1]], ["tile_ry", "sp", [-1, 1]], ["tile_rx", "sp", [-1, 1]], ["auto_unroll_max_step", "ot", 512], ["unroll_explicit", "ot", 1]]}], "r": [[0.321185086, 0.3212957925], 0, 8.653108358383179, 1578497747.170991], "v": 0.1}
{"i": ["cuda", "schedule_direct_3d_cuda", [[1, 24, 64, 128, 128], [12, 24, 1, 1, 1], [1, 1, 1], [0, 0, 0], 1], {}, ["schedule_direct_3d_cuda", [1, 24, 64, 128, 128], [12, 24, 1, 1, 1], [1, 1, 1], [0, 0, 0], 1], {"i": 1963767469, "t": "", "c": null, "e": [["tile_f", "sp", [-1, 4, 1, 3]], ["tile_d", "sp", [-1, 2, 1, 4]], ["tile_y", "sp", [-1, 1, 8, 2]], ["tile_x", "sp", [-1, 1, 2, 4]], ["tile_rc", "sp", [-1, 1]], ["tile_rd", "sp", [-1, 1]], ["tile_ry", "sp", [-1, 1]], ["tile_rx", "sp", [-1, 1]], ["auto_unroll_max_step", "ot", 1500], ["unroll_explicit", "ot", 1]]}], "r": [[0.0154117415, 0.01540492375], 0, 4.412221193313599, 1578497755.411533], "v": 0.1}
{"i": ["cuda", "schedule_direct_3d_cuda", [[1, 24, 64, 128, 128], [12, 24, 1, 1, 1], [1, 1, 1], [0, 0, 0], 1], {}, ["schedule_direct_3d_cuda", [1, 24, 64, 128, 128], [12, 24, 1, 1, 1], [1, 1, 1], [0, 0, 0], 1], {"i": 1939168909, "t": "", "c": null, "e": [["tile_f", "sp", [-1, 4, 1, 3]], ["tile_d", "sp", [-1, 2, 1, 4]], ["tile_y", "sp", [-1, 16, 4, 2]], ["tile_x", "sp", [-1, 2, 2, 1]], ["tile_rc", "sp", [-1, 1]], ["tile_rd", "sp", [-1, 1]], ["tile_ry", "sp", [-1, 1]], ["tile_rx", "sp", [-1, 1]], ["auto_unroll_max_step", "ot", 1500], ["unroll_explicit", "ot", 1]]}], "r": [[0.04847067275, 0.048569692], 0, 8.246259689331055, 1578497757.0676496], "v": 0.1}
{"i": ["cuda", "schedule_direct_3d_cuda", [[1, 24, 64, 128, 128], [12, 24, 1, 1, 1], [1, 1, 1], [0, 0, 0], 1], {}, ["schedule_direct_3d_cuda", [1, 24, 64, 128, 128], [12, 24, 1, 1, 1], [1, 1, 1], [0, 0, 0], 1], {"i": 1939241949, "t": "", "c": null, "e": [["tile_f", "sp", [-1, 4, 1, 3]], ["tile_d", "sp", [-1, 1, 1, 2]], ["tile_y", "sp", [-1, 1, 4, 4]], ["tile_x", "sp", [-1, 2, 2, 1]], ["tile_rc", "sp", [-1, 1]], ["tile_rd", "sp", [-1, 1]], ["tile_ry", "sp", [-1, 1]], ["tile_rx", "sp", [-1, 1]], ["auto_unroll_max_step", "ot", 1500], ["unroll_explicit", "ot", 1]]}], "r": [[0.00095556625, 0.00095015225], 0, 1.2297132015228271, 1578497757.6906183], "v": 0.1}
{"i": ["cuda", "schedule_direct_3d_cuda", [[1, 24, 64, 128, 128], [12, 24, 1, 1, 1], [1, 1, 1], [0, 0, 0], 1], {}, ["schedule_direct_3d_cuda", [1, 24, 64, 128, 128], [12, 24, 1, 1, 1], [1, 1, 1], [0, 0, 0], 1], {"i": 1235654585, "t": "", "c": null, "e": [["tile_f", "sp", [-1, 2, 3, 2]], ["tile_d", "sp", [-1, 1, 1, 2]], ["tile_y", "sp", [-1, 16, 2, 4]], ["tile_x", "sp", [-1, 1, 1, 4]], ["tile_rc", "sp", [-1, 2]], ["tile_rd", "sp", [-1, 1]], ["tile_ry", "sp", [-1, 1]], ["tile_rx", "sp", [-1, 1]], ["auto_unroll_max_step", "ot", 0], ["unroll_explicit", "ot", 1]]}], "r": [[0.03880533, 0.03877670825], 0, 3.3869969844818115, 1578497759.153359], "v": 0.1}
{"i": ["cuda", "schedule_direct_3d_cuda", [[1, 24, 64, 128, 128], [12, 24, 1, 1, 1], [1, 1, 1], [0, 0, 0], 1], {}, ["schedule_direct_3d_cuda", [1, 24, 64, 128, 128], [12, 24, 1, 1, 1], [1, 1, 1], [0, 0, 0], 1], {"i": 1563314117, "t": "", "c": null, "e": [["tile_f", "sp", [-1, 2, 1, 6]], ["tile_d", "sp", [-1, 16, 1, 1]], ["tile_y", "sp", [-1, 4, 32, 1]], ["tile_x", "sp", [-1, 2, 1, 2]], ["tile_rc", "sp", [-1, 1]], ["tile_rd", "sp", [-1, 1]], ["tile_ry", "sp", [-1, 1]], ["tile_rx", "sp", [-1, 1]], ["auto_unroll_max_step", "ot", 512], ["unroll_explicit", "ot", 1]]}], "r": [[0.01704216575, 0.01696217775], 0, 6.159241437911987, 1578497760.5793393], "v": 0.1}
{"i": ["cuda", "schedule_direct_3d_cuda", [[1, 24, 64, 128, 128], [12, 24, 1, 1, 1], [1, 1, 1], [0, 0, 0], 1], {}, ["schedule_direct_3d_cuda", [1, 24, 64, 128, 128], [12, 24, 1, 1, 1], [1, 1, 1], [0, 0, 0], 1], {"i": 1554502629, "t": "", "c": null, "e": [["tile_f", "sp", [-1, 4, 1, 3]], ["tile_d", "sp", [-1, 1, 1, 4]], ["tile_y", "sp", [-1, 1, 4, 2]], ["tile_x", "sp", [-1, 1, 4, 1]], ["tile_rc", "sp", [-1, 1]], ["tile_rd", "sp", [-1, 1]], ["tile_ry", "sp", [-1, 1]], ["tile_rx", "sp", [-1, 1]], ["auto_unroll_max_step", "ot", 512], ["unroll_explicit", "ot", 1]]}], "r": [[0.000872186, 0.0008708935], 0, 1.1763558387756348, 1578497975.1130404], "v": 0.1}
{"i": ["cuda", "schedule_direct_3d_cuda", [[1, 24, 64, 128, 128], [12, 24, 1, 1, 1], [1, 1, 1], [0, 0, 0], 1], {}, ["schedule_direct_3d_cuda", [1, 24, 64, 128, 128], [12, 24, 1, 1, 1], [1, 1, 1], [0, 0, 0], 1], {"i": 393286629, "t": "", "c": null, "e": [["tile_f", "sp", [-1, 4, 1, 3]], ["tile_d", "sp", [-1, 1, 1, 4]], ["tile_y", "sp", [-1, 1, 4, 2]], ["tile_x", "sp", [-1, 1, 4, 1]], ["tile_rc", "sp", [-1, 1]], ["tile_rd", "sp", [-1, 1]], ["tile_ry", "sp", [-1, 1]], ["tile_rx", "sp", [-1, 1]], ["auto_unroll_max_step", "ot", 512], ["unroll_explicit", "ot", 0]]}], "r": [[0.00087444175, 0.00086572875], 0, 1.0507221221923828, 1578497975.75002], "v": 0.1}
{"i": ["cuda", "schedule_direct_3d_cuda", [[1, 24, 64, 128, 128], [12, 24, 1, 1, 1], [1, 1, 1], [0, 0, 0], 1], {}, ["schedule_direct_3d_cuda", [1, 24, 64, 128, 128], [12, 24, 1, 1, 1], [1, 1, 1], [0, 0, 0], 1], {"i": 1941574629, "t": "", "c": null, "e": [["tile_f", "sp", [-1, 4, 1, 3]], ["tile_d", "sp", [-1, 1, 1, 4]], ["tile_y", "sp", [-1, 1, 4, 2]], ["tile_x", "sp", [-1, 1, 4, 1]], ["tile_rc", "sp", [-1, 1]], ["tile_rd", "sp", [-1, 1]], ["tile_ry", "sp", [-1, 1]], ["tile_rx", "sp", [-1, 1]], ["auto_unroll_max_step", "ot", 1500], ["unroll_explicit", "ot", 1]]}], "r": [[0.000886751, 0.00087171375], 0, 1.049457311630249, 1578497976.319239], "v": 0.1}
{"i": ["cuda", "schedule_direct_3d_cuda", [[1, 24, 64, 128, 128], [12, 24, 1, 1, 1], [1, 1, 1], [0, 0, 0], 1], {}, ["schedule_direct_3d_cuda", [1, 24, 64, 128, 128], [12, 24, 1, 1, 1], [1, 1, 1], [0, 0, 0], 1], {"i": 780358629, "t": "", "c": null, "e": [["tile_f", "sp", [-1, 4, 1, 3]], ["tile_d", "sp", [-1, 1, 1, 4]], ["tile_y", "sp", [-1, 1, 4, 2]], ["tile_x", "sp", [-1, 1, 4, 1]], ["tile_rc", "sp", [-1, 1]], ["tile_rd", "sp", [-1, 1]], ["tile_ry", "sp", [-1, 1]], ["tile_rx", "sp", [-1, 1]], ["auto_unroll_max_step", "ot", 1500], ["unroll_explicit", "ot", 0]]}], "r": [[0.000879441, 0.00086833025], 0, 1.0322675704956055, 1578497976.888597], "v": 0.1}
{"i": ["cuda", "schedule_direct_3d_cuda", [[1, 24, 64, 128, 128], [12, 24, 1, 1, 1], [1, 1, 1], [0, 0, 0], 1], {}, ["schedule_direct_3d_cuda", [1, 24, 64, 128, 128], [12, 24, 1, 1, 1], [1, 1, 1], [0, 0, 0], 1], {"i": 1551683589, "t": "", "c": null, "e": [["tile_f", "sp", [-1, 4, 1, 3]], ["tile_d", "sp", [-1, 1, 1, 4]], ["tile_y", "sp", [-1, 2, 4, 2]], ["tile_x", "sp", [-1, 1, 2, 1]], ["tile_rc", "sp", [-1, 1]], ["tile_rd", "sp", [-1, 1]], ["tile_ry", "sp", [-1, 1]], ["tile_rx", "sp", [-1, 1]], ["auto_unroll_max_step", "ot", 512], ["unroll_explicit", "ot", 1]]}], "r": [[0.00118931675, 0.00118960825], 0, 1.50201416015625, 1578497977.5637617], "v": 0.1}
{"i": ["cuda", "schedule_direct_3d_cuda", [[1, 24, 64, 128, 128], [12, 24, 1, 1, 1], [1, 1, 1], [0, 0, 0], 1], {}, ["schedule_direct_3d_cuda", [1, 24, 64, 128, 128], [12, 24, 1, 1, 1], [1, 1, 1], [0, 0, 0], 1], {"i": 1551680229, "t": "", "c": null, "e": [["tile_f", "sp", [-1, 4, 1, 3]], ["tile_d", "sp", [-1, 1, 1, 4]], ["tile_y", "sp", [-1, 1, 4, 2]], ["tile_x", "sp", [-1, 1, 2, 1]], ["tile_rc", "sp", [-1, 1]], ["tile_rd", "sp", [-1, 1]], ["tile_ry", "sp", [-1, 1]], ["tile_rx", "sp", [-1, 1]], ["auto_unroll_max_step", "ot", 512], ["unroll_explicit", "ot", 1]]}], "r": [[0.00118490025, 0.0011839865], 0, 1.2335667610168457, 1578497978.1830301], "v": 0.1}
{"i": ["cuda", "schedule_direct_3d_cuda", [[1, 24, 64, 128, 128], [12, 24, 1, 1, 1], [1, 1, 1], [0, 0, 0], 1], {}, ["schedule_direct_3d_cuda", [1, 24, 64, 128, 128], [12, 24, 1, 1, 1], [1, 1, 1], [0, 0, 0], 1], {"i": 1566081189, "t": "", "c": null, "e": [["tile_f", "sp", [-1, 4, 1, 3]], ["tile_d", "sp", [-1, 1, 1, 4]], ["tile_y", "sp", [-1, 1, 4, 1]], ["tile_x", "sp", [-1, 2, 2, 2]], ["tile_rc", "sp", [-1, 1]], ["tile_rd", "sp", [-1, 1]], ["tile_ry", "sp", [-1, 1]], ["tile_rx", "sp", [-1, 1]], ["auto_unroll_max_step", "ot", 512], ["unroll_explicit", "ot", 1]]}], "r": [[0.00114623575, 0.00114256925], 0, 1.5848207473754883, 1578497978.8741863], "v": 0.1}
{"i": ["cuda", "schedule_direct_3d_cuda", [[1, 24, 64, 128, 128], [12, 24, 1, 1, 1], [1, 1, 1], [0, 0, 0], 1], {}, ["schedule_direct_3d_cuda", [1, 24, 64, 128, 128], [12, 24, 1, 1, 1], [1, 1, 1], [0, 0, 0], 1], {"i": 1952953069, "t": "", "c": null, "e": [["tile_f", "sp", [-1, 4, 1, 3]], ["tile_d", "sp", [-1, 4, 1, 1]], ["tile_y", "sp", [-1, 2, 4, 4]], ["tile_x", "sp", [-1, 1, 2, 2]], ["tile_rc", "sp", [-1, 1]], ["tile_rd", "sp", [-1, 1]], ["tile_ry", "sp", [-1, 1]], ["tile_rx", "sp", [-1, 1]], ["auto_unroll_max_step", "ot", 1500], ["unroll_explicit", "ot", 1]]}], "r": [[0.0315435755, 0.031485268], 0, 4.771641254425049, 1578497980.2595322], "v": 0.1}
{"i": ["cuda", "schedule_direct_3d_cuda", [[1, 24, 64, 128, 128], [12, 24, 1, 1, 1], [1, 1, 1], [0, 0, 0], 1], {}, ["schedule_direct_3d_cuda", [1, 24, 64, 128, 128], [12, 24, 1, 1, 1], [1, 1, 1], [0, 0, 0], 1], {"i": 777637629, "t": "", "c": null, "e": [["tile_f", "sp", [-1, 4, 1, 3]], ["tile_d", "sp", [-1, 1, 1, 8]], ["tile_y", "sp", [-1, 1, 8, 4]], ["tile_x", "sp", [-1, 1, 2, 1]], ["tile_rc", "sp", [-1, 1]], ["tile_rd", "sp", [-1, 1]], ["tile_ry", "sp", [-1, 1]], ["tile_rx", "sp", [-1, 1]], ["auto_unroll_max_step", "ot", 1500], ["unroll_explicit", "ot", 0]]}], "r": [[0.00848915075, 0.00844599875], 0, 1.6680073738098145, 1578497981.1001523], "v": 0.1}
{"i": ["cuda", "schedule_direct_3d_cuda", [[1, 24, 64, 128, 128], [12, 24, 1, 1, 1], [1, 1, 1], [0, 0, 0], 1], {}, ["schedule_direct_3d_cuda", [1, 24, 64, 128, 128], [12, 24, 1, 1, 1], [1, 1, 1], [0, 0, 0], 1], {"i": 1955372269, "t": "", "c": null, "e": [["tile_f", "sp", [-1, 4, 1, 3]], ["tile_d", "sp", [-1, 4, 1, 1]], ["tile_y", "sp", [-1, 2, 4, 4]], ["tile_x", "sp", [-1, 1, 4, 2]], ["tile_rc", "sp", [-1, 1]], ["tile_rd", "sp", [-1, 1]], ["tile_ry", "sp", [-1, 1]], ["tile_rx", "sp", [-1, 1]], ["auto_unroll_max_step", "ot", 1500], ["unroll_explicit", "ot", 1]]}], "r": [[0.0172078775, 0.0165282485], 0, 4.681193828582764, 1578497982.3139129], "v": 0.1}
{"i": ["cuda", "schedule_direct_3d_cuda", [[1, 24, 64, 128, 128], [12, 24, 1, 1, 1], [1, 1, 1], [0, 0, 0], 1], {}, ["schedule_direct_3d_cuda", [1, 24, 64, 128, 128], [12, 24, 1, 1, 1], [1, 1, 1], [0, 0, 0], 1], {"i": 1565791429, "t": "", "c": null, "e": [["tile_f", "sp", [-1, 4, 1, 3]], ["tile_d", "sp", [-1, 2, 1, 2]], ["tile_y", "sp", [-1, 1, 4, 2]], ["tile_x", "sp", [-1, 1, 2, 2]], ["tile_rc", "sp", [-1, 1]], ["tile_rd", "sp", [-1, 1]], ["tile_ry", "sp", [-1, 1]], ["tile_rx", "sp", [-1, 1]], ["auto_unroll_max_step", "ot", 512], ["unroll_explicit", "ot", 1]]}], "r": [[0.00096535475, 0.00096745175], 0, 1.311805009841919, 1578497982.9849625], "v": 0.1}
{"i": ["cuda", "schedule_direct_3d_cuda", [[1, 24, 64, 128, 128], [12, 24, 1, 1, 1], [1, 1, 1], [0, 0, 0], 1], {}, ["schedule_direct_3d_cuda", [1, 24, 64, 128, 128], [12, 24, 1, 1, 1], [1, 1, 1], [0, 0, 0], 1], {"i": 1938853629, "t": "", "c": null, "e": [["tile_f", "sp", [-1, 4, 1, 3]], ["tile_d", "sp", [-1, 1, 1, 8]], ["tile_y", "sp", [-1, 1, 8, 4]], ["tile_x", "sp", [-1, 1, 2, 1]], ["tile_rc", "sp", [-1, 1]], ["tile_rd", "sp", [-1, 1]], ["tile_ry", "sp", [-1, 1]], ["tile_rx", "sp", [-1, 1]], ["auto_unroll_max_step", "ot", 1500], ["unroll_explicit", "ot", 1]]}], "r": [[0.0085910745, 0.00867066875], 0, 2.1388559341430664, 1578497983.8486607], "v": 0.1}
{"i": ["cuda", "schedule_direct_3d_cuda", [[1, 24, 64, 128, 128], [12, 24, 1, 1, 1], [1, 1, 1], [0, 0, 0], 1], {}, ["schedule_direct_3d_cuda", [1, 24, 64, 128, 128], [12, 24, 1, 1, 1], [1, 1, 1], [0, 0, 0], 1], {"i": 1938755589, "t": "", "c": null, "e": [["tile_f", "sp", [-1, 4, 1, 3]], ["tile_d", "sp", [-1, 1, 1, 4]], ["tile_y", "sp", [-1, 2, 4, 2]], ["tile_x", "sp", [-1, 1, 2, 1]], ["tile_rc", "sp", [-1, 1]], ["tile_rd", "sp", [-1, 1]], ["tile_ry", "sp", [-1, 1]], ["tile_rx", "sp", [-1, 1]], ["auto_unroll_max_step", "ot", 1500], ["unroll_explicit", "ot", 1]]}], "r": [[0.0012072745, 0.00119494225], 0, 1.4720230102539062, 1578497988.8257997], "v": 0.1}
{"i": ["cuda", "schedule_direct_3d_cuda", [[1, 24, 64, 128, 128], [12, 24, 1, 1, 1], [1, 1, 1], [0, 0, 0], 1], {}, ["schedule_direct_3d_cuda", [1, 24, 64, 128, 128], [12, 24, 1, 1, 1], [1, 1, 1], [0, 0, 0], 1], {"i": 1938752229, "t": "", "c": null, "e": [["tile_f", "sp", [-1, 4, 1, 3]], ["tile_d", "sp", [-1, 1, 1, 4]], ["tile_y", "sp", [-1, 1, 4, 2]], ["tile_x", "sp", [-1, 1, 2, 1]], ["tile_rc", "sp", [-1, 1]], ["tile_rd", "sp", [-1, 1]], ["tile_ry", "sp", [-1, 1]], ["tile_rx", "sp", [-1, 1]], ["auto_unroll_max_step", "ot", 1500], ["unroll_explicit", "ot", 1]]}], "r": [[0.001194204, 0.001183641], 0, 1.0950756072998047, 1578497989.4072921], "v": 0.1}
{"i": ["cuda", "schedule_direct_3d_cuda", [[1, 24, 64, 128, 128], [12, 24, 1, 1, 1], [1, 1, 1], [0, 0, 0], 1], {}, ["schedule_direct_3d_cuda", [1, 24, 64, 128, 128], [12, 24, 1, 1, 1], [1, 1, 1], [0, 0, 0], 1], {"i": 417476749, "t": "", "c": null, "e": [["tile_f", "sp", [-1, 4, 1, 3]], ["tile_d", "sp", [-1, 4, 1, 1]], ["tile_y", "sp", [-1, 1, 4, 2]], ["tile_x", "sp", [-1, 1, 4, 4]], ["tile_rc", "sp", [-1, 1]], ["tile_rd", "sp", [-1, 1]], ["tile_ry", "sp", [-1, 1]], ["tile_rx", "sp", [-1, 1]], ["auto_unroll_max_step", "ot", 512], ["unroll_explicit", "ot", 0]]}], "r": [[0.00855537225, 0.00857518], 0, 1.8713972568511963, 1578497990.2460575], "v": 0.1}
{"i": ["cuda", "schedule_direct_3d_cuda", [[1, 24, 64, 128, 128], [12, 24, 1, 1, 1], [1, 1, 1], [0, 0, 0], 1], {}, ["schedule_direct_3d_cuda", [1, 24, 64, 128, 128], [12, 24, 1, 1, 1], [1, 1, 1], [0, 0, 0], 1], {"i": 789246429, "t": "", "c": null, "e": [["tile_f", "sp", [-1, 4, 1, 3]], ["tile_d", "sp", [-1, 1, 1, 8]], ["tile_y", "sp", [-1, 1, 8, 2]], ["tile_x", "sp", [-1, 2, 1, 2]], ["tile_rc", "sp", [-1, 1]], ["tile_rd", "sp", [-1, 1]], ["tile_ry", "sp", [-1, 1]], ["tile_rx", "sp", [-1, 1]], ["auto_unroll_max_step", "ot", 1500], ["unroll_explicit", "ot", 0]]}], "r": [[0.03018227625, 0.03027454725], 0, 3.460287570953369, 1578497991.60559], "v": 0.1}
{"i": ["cuda", "schedule_direct_3d_cuda", [[1, 24, 64, 128, 128], [12, 24, 1, 1, 1], [1, 1, 1], [0, 0, 0], 1], {}, ["schedule_direct_3d_cuda", [1, 24, 64, 128, 128], [12, 24, 1, 1, 1], [1, 1, 1], [0, 0, 0], 1], {"i": 1565882949, "t": "", "c": null, "e": [["tile_f", "sp", [-1, 4, 1, 3]], ["tile_d", "sp", [-1, 1, 1, 4]], ["tile_y", "sp", [-1, 2, 4, 4]], ["tile_x", "sp", [-1, 1, 2, 2]], ["tile_rc", "sp", [-1, 1]], ["tile_rd", "sp", [-1, 1]], ["tile_ry", "sp", [-1, 1]], ["tile_rx", "sp", [-1, 1]], ["auto_unroll_max_step", "ot", 512], ["unroll_explicit", "ot", 1]]}], "r": [[0.025781751, 0.0249570305], 0, 2.8764398097991943, 1578497992.5366569], "v": 0.1}
{"i": ["cuda", "schedule_direct_3d_cuda", [[1, 24, 64, 128, 128], [12, 24, 1, 1, 1], [1, 1, 1], [0, 0, 0], 1], {}, ["schedule_direct_3d_cuda", [1, 24, 64, 128, 128], [12, 24, 1, 1, 1], [1, 1, 1], [0, 0, 0], 1], {"i": 1953153189, "t": "", "c": null, "e": [["tile_f", "sp", [-1, 4, 1, 3]], ["tile_d", "sp", [-1, 1, 1, 4]], ["tile_y", "sp", [-1, 1, 4, 1]], ["tile_x", "sp", [-1, 2, 2, 2]], ["tile_rc", "sp", [-1, 1]], ["tile_rd", "sp", [-1, 1]], ["tile_ry", "sp", [-1, 1]], ["tile_rx", "sp", [-1, 1]], ["auto_unroll_max_step", "ot", 1500], ["unroll_explicit", "ot", 1]]}], "r": [[0.00096231225, 0.0009541875], 0, 1.5666885375976562, 1578497993.1219435], "v": 0.1}
{"i": ["cuda", "schedule_direct_3d_cuda", [[1, 24, 64, 128, 128], [12, 24, 1, 1, 1], [1, 1, 1], [0, 0, 0], 1], {}, ["schedule_direct_3d_cuda", [1, 24, 64, 128, 128], [12, 24, 1, 1, 1], [1, 1, 1], [0, 0, 0], 1], {"i": 794156269, "t": "", "c": null, "e": [["tile_f", "sp", [-1, 4, 1, 3]], ["tile_d", "sp", [-1, 4, 1, 1]], ["tile_y", "sp", [-1, 2, 4, 4]], ["tile_x", "sp", [-1, 1, 4, 2]], ["tile_rc", "sp", [-1, 1]], ["tile_rd", "sp", [-1, 1]], ["tile_ry", "sp", [-1, 1]], ["tile_rx", "sp", [-1, 1]], ["auto_unroll_max_step", "ot", 1500], ["unroll_explicit", "ot", 0]]}], "r": [[0.01641447125, 0.0163832195], 0, 3.0742440223693848, 1578497994.355394], "v": 0.1}
{"i": ["cuda", "schedule_direct_3d_cuda", [[1, 24, 64, 128, 128], [12, 24, 1, 1, 1], [1, 1, 1], [0, 0, 0], 1], {}, ["schedule_direct_3d_cuda", [1, 24, 64, 128, 128], [12, 24, 1, 1, 1], [1, 1, 1], [0, 0, 0], 1], {"i": 1565881069, "t": "", "c": null, "e": [["tile_f", "sp", [-1, 4, 1, 3]], ["tile_d", "sp", [-1, 4, 1, 1]], ["tile_y", "sp", [-1, 2, 4, 4]], ["tile_x", "sp", [-1, 1, 2, 2]], ["tile_rc", "sp", [-1, 1]], ["tile_rd", "sp", [-1, 1]], ["tile_ry", "sp", [-1, 1]], ["tile_rx", "sp", [-1, 1]], ["auto_unroll_max_step", "ot", 512], ["unroll_explicit", "ot", 1]]}], "r": [[0.027511912, 0.027511722], 0, 3.083134174346924, 1578497995.3365655], "v": 0.1}
{"i": ["cuda", "schedule_direct_3d_cuda", [[1, 24, 64, 128, 128], [12, 24, 1, 1, 1], [1, 1, 1], [0, 0, 0], 1], {}, ["schedule_direct_3d_cuda", [1, 24, 64, 128, 128], [12, 24, 1, 1, 1], [1, 1, 1], [0, 0, 0], 1], {"i": 390565629, "t": "", "c": null, "e": [["tile_f", "sp", [-1, 4, 1, 3]], ["tile_d", "sp", [-1, 1, 1, 8]], ["tile_y", "sp", [-1, 1, 8, 4]], ["tile_x", "sp", [-1, 1, 2, 1]], ["tile_rc", "sp", [-1, 1]], ["tile_rd", "sp", [-1, 1]], ["tile_ry", "sp", [-1, 1]], ["tile_rx", "sp", [-1, 1]], ["auto_unroll_max_step", "ot", 512], ["unroll_explicit", "ot", 0]]}], "r": [[0.00855485775, 0.00851316575], 0, 1.7841465473175049, 1578497996.0331318], "v": 0.1}
{"i": ["cuda", "schedule_direct_3d_cuda", [[1, 24, 64, 128, 128], [12, 24, 1, 1, 1], [1, 1, 1], [0, 0, 0], 1], {}, ["schedule_direct_3d_cuda", [1, 24, 64, 128, 128], [12, 24, 1, 1, 1], [1, 1, 1], [0, 0, 0], 1], {"i": 1950462429, "t": "", "c": null, "e": [["tile_f", "sp", [-1, 4, 1, 3]], ["tile_d", "sp", [-1, 1, 1, 8]], ["tile_y", "sp", [-1, 1, 8, 2]], ["tile_x", "sp", [-1, 2, 1, 2]], ["tile_rc", "sp", [-1, 1]], ["tile_rd", "sp", [-1, 1]], ["tile_ry", "sp", [-1, 1]], ["tile_rx", "sp", [-1, 1]], ["auto_unroll_max_step", "ot", 1500], ["unroll_explicit", "ot", 1]]}], "r": [[0.02986646525, 0.0298760655], 0, 4.544825077056885, 1578497997.3734345], "v": 0.1}
{"i": ["cuda", "schedule_direct_3d_cuda", [[1, 24, 64, 128, 128], [12, 24, 1, 1, 1], [1, 1, 1], [0, 0, 0], 1], {}, ["schedule_direct_3d_cuda", [1, 24, 64, 128, 128], [12, 24, 1, 1, 1], [1, 1, 1], [0, 0, 0], 1], {"i": 1565792229, "t": "", "c": null, "e": [["tile_f", "sp", [-1, 4, 1, 3]], ["tile_d", "sp", [-1, 1, 1, 4]], ["tile_y", "sp", [-1, 1, 4, 2]], ["tile_x", "sp", [-1, 1, 2, 2]], ["tile_rc", "sp", [-1, 1]], ["tile_rd", "sp", [-1, 1]], ["tile_ry", "sp", [-1, 1]], ["tile_rx", "sp", [-1, 1]], ["auto_unroll_max_step", "ot", 512], ["unroll_explicit", "ot", 1]]}], "r": [[0.00096777975, 0.0009695235], 0, 1.6329340934753418, 1578497998.0306895], "v": 0.1}
{"i": ["cuda", "schedule_direct_3d_cuda", [[1, 24, 64, 128, 128], [12, 24, 1, 1, 1], [1, 1, 1], [0, 0, 0], 1], {}, ["schedule_direct_3d_cuda", [1, 24, 64, 128, 128], [12, 24, 1, 1, 1], [1, 1, 1], [0, 0, 0], 1], {"i": 1568193789, "t": "", "c": null, "e": [["tile_f", "sp", [-1, 4, 1, 3]], ["tile_d", "sp", [-1, 1, 1, 2]], ["tile_y", "sp", [-1, 2, 2, 2]], ["tile_x", "sp", [-1, 1, 4, 2]], ["tile_rc", "sp", [-1, 1]], ["tile_rd", "sp", [-1, 1]], ["tile_ry", "sp", [-1, 1]], ["tile_rx", "sp", [-1, 1]], ["auto_unroll_max_step", "ot", 512], ["unroll_explicit", "ot", 1]]}], "r": [[0.00086124875, 0.00086014425], 0, 1.5694301128387451, 1578497998.6948154], "v": 0.1}
{"i": ["cuda", "schedule_direct_3d_cuda", [[1, 24, 64, 128, 128], [12, 24, 1, 1, 1], [1, 1, 1], [0, 0, 0], 1], {}, ["schedule_direct_3d_cuda", [1, 24, 64, 128, 128], [12, 24, 1, 1, 1], [1, 1, 1], [0, 0, 0], 1], {"i": 1952863429, "t": "", "c": null, "e": [["tile_f", "sp", [-1, 4, 1, 3]], ["tile_d", "sp", [-1, 2, 1, 2]], ["tile_y", "sp", [-1, 1, 4, 2]], ["tile_x", "sp", [-1, 1, 2, 2]], ["tile_rc", "sp", [-1, 1]], ["tile_rd", "sp", [-1, 1]], ["tile_ry", "sp", [-1, 1]], ["tile_rx", "sp", [-1, 1]], ["auto_unroll_max_step", "ot", 1500], ["unroll_explicit", "ot", 1]]}], "r": [[0.0009778795, 0.00097375575], 0, 1.5000102519989014, 1578498004.994329], "v": 0.1}
{"i": ["cuda", "schedule_direct_3d_cuda", [[1, 24, 64, 128, 128], [12, 24, 1, 1, 1], [1, 1, 1], [0, 0, 0], 1], {}, ["schedule_direct_3d_cuda", [1, 24, 64, 128, 128], [12, 24, 1, 1, 1], [1, 1, 1], [0, 0, 0], 1], {"i": 1551781629, "t": "", "c": null, "e": [["tile_f", "sp", [-1, 4, 1, 3]], ["tile_d", "sp", [-1, 1, 1, 8]], ["tile_y", "sp", [-1, 1, 8, 4]], ["tile_x", "sp", [-1, 1, 2, 1]], ["tile_rc", "sp", [-1, 1]], ["tile_rd", "sp", [-1, 1]], ["tile_ry", "sp", [-1, 1]], ["tile_rx", "sp", [-1, 1]], ["auto_unroll_max_step", "ot", 512], ["unroll_explicit", "ot", 1]]}], "r": [[0.00864311125, 0.00872403325], 0, 2.3331730365753174, 1578498005.6895666], "v": 0.1}
{"i": ["cuda", "schedule_direct_3d_cuda", [[1, 24, 64, 128, 128], [12, 24, 1, 1, 1], [1, 1, 1], [0, 0, 0], 1], {}, ["schedule_direct_3d_cuda", [1, 24, 64, 128, 128], [12, 24, 1, 1, 1], [1, 1, 1], [0, 0, 0], 1], {"i": 1554638469, "t": "", "c": null, "e": [["tile_f", "sp", [-1, 4, 1, 3]], ["tile_d", "sp", [-1, 2, 1, 1]], ["tile_y", "sp", [-1, 1, 2, 8]], ["tile_x", "sp", [-1, 1, 4, 1]], ["tile_rc", "sp", [-1, 1]], ["tile_rd", "sp", [-1, 1]], ["tile_ry", "sp", [-1, 1]], ["tile_rx", "sp", [-1, 1]], ["auto_unroll_max_step", "ot", 512], ["unroll_explicit", "ot", 1]]}], "r": [[0.000870687, 0.0008702625], 0, 1.4716660976409912, 1578498006.3749268], "v": 0.1}
{"i": ["cuda", "schedule_direct_3d_cuda", [[1, 24, 64, 128, 128], [12, 24, 1, 1, 1], [1, 1, 1], [0, 0, 0], 1], {}, ["schedule_direct_3d_cuda", [1, 24, 64, 128, 128], [12, 24, 1, 1, 1], [1, 1, 1], [0, 0, 0], 1], {"i": 1568280069, "t": "", "c": null, "e": [["tile_f", "sp", [-1, 4, 1, 3]], ["tile_d", "sp", [-1, 2, 1, 1]], ["tile_y", "sp", [-1, 1, 2, 4]], ["tile_x", "sp", [-1, 1, 4, 2]], ["tile_rc", "sp", [-1, 1]], ["tile_rd", "sp", [-1, 1]], ["tile_ry", "sp", [-1, 1]], ["tile_rx", "sp", [-1, 1]], ["auto_unroll_max_step", "ot", 512], ["unroll_explicit", "ot", 1]]}], "r": [[0.00086701725, 0.0008658445], 0, 1.5439903736114502, 1578498007.0414355], "v": 0.1}
{"i": ["cuda", "schedule_direct_3d_cuda", [[1, 24, 64, 128, 128], [12, 24, 1, 1, 1], [1, 1, 1], [0, 0, 0], 1], {}, ["schedule_direct_3d_cuda", [1, 24, 64, 128, 128], [12, 24, 1, 1, 1], [1, 1, 1], [0, 0, 0], 1], {"i": 804548749, "t": "", "c": null, "e": [["tile_f", "sp", [-1, 4, 1, 3]], ["tile_d", "sp", [-1, 4, 1, 1]], ["tile_y", "sp", [-1, 1, 4, 2]], ["tile_x", "sp", [-1, 1, 4, 4]], ["tile_rc", "sp", [-1, 1]], ["tile_rd", "sp", [-1, 1]], ["tile_ry", "sp", [-1, 1]], ["tile_rx", "sp", [-1, 1]], ["auto_unroll_max_step", "ot", 1500], ["unroll_explicit", "ot", 0]]}], "r": [[0.0084518675, 0.008465384], 0, 1.7581307888031006, 1578498007.740249], "v": 0.1}
{"i": ["cuda", "schedule_direct_3d_cuda", [[1, 24, 64, 128, 128], [12, 24, 1, 1, 1], [1, 1, 1], [0, 0, 0], 1], {}, ["schedule_direct_3d_cuda", [1, 24, 64, 128, 128], [12, 24, 1, 1, 1], [1, 1, 1], [0, 0, 0], 1], {"i": 1963755469, "t": "", "c": null, "e": [["tile_f", "sp", [-1, 4, 1, 3]], ["tile_d", "sp", [-1, 4, 1, 1]], ["tile_y", "sp", [-1, 4, 4, 2]], ["tile_x", "sp", [-1, 1, 2, 4]], ["tile_rc", "sp", [-1, 1]], ["tile_rd", "sp", [-1, 1]], ["tile_ry", "sp", [-1, 1]], ["tile_rx", "sp", [-1, 1]], ["auto_unroll_max_step", "ot", 1500], ["unroll_explicit", "ot", 1]]}], "r": [[0.04250508675, 0.04254793125], 0, 6.369593620300293, 1578498009.1859477], "v": 0.1}
{"i": ["cuda", "schedule_direct_3d_cuda", [[1, 24, 64, 128, 128], [12, 24, 1, 1, 1], [1, 1, 1], [0, 0, 0], 1], {}, ["schedule_direct_3d_cuda", [1, 24, 64, 128, 128], [12, 24, 1, 1, 1], [1, 1, 1], [0, 0, 0], 1], {"i": 402174429, "t": "", "c": null, "e": [["tile_f", "sp", [-1, 4, 1, 3]], ["tile_d", "sp", [-1, 1, 1, 8]], ["tile_y", "sp", [-1, 1, 8, 2]], ["tile_x", "sp", [-1, 2, 1, 2]], ["tile_rc", "sp", [-1, 1]], ["tile_rd", "sp", [-1, 1]], ["tile_ry", "sp", [-1, 1]], ["tile_rx", "sp", [-1, 1]], ["auto_unroll_max_step", "ot", 512], ["unroll_explicit", "ot", 0]]}], "r": [[0.03057474025, 0.03090605075], 0, 2.425966501235962, 1578498010.1563747], "v": 0.1}
{"i": ["cuda", "schedule_direct_3d_cuda", [[1, 24, 64, 128, 128], [12, 24, 1, 1, 1], [1, 1, 1], [0, 0, 0], 1], {}, ["schedule_direct_3d_cuda", [1, 24, 64, 128, 128], [12, 24, 1, 1, 1], [1, 1, 1], [0, 0, 0], 1], {"i": 390467589, "t": "", "c": null, "e": [["tile_f", "sp", [-1, 4, 1, 3]], ["tile_d", "sp", [-1, 1, 1, 4]], ["tile_y", "sp", [-1, 2, 4, 2]], ["tile_x", "sp", [-1, 1, 2, 1]], ["tile_rc", "sp", [-1, 1]], ["tile_rd", "sp", [-1, 1]], ["tile_ry", "sp", [-1, 1]], ["tile_rx", "sp", [-1, 1]], ["auto_unroll_max_step", "ot", 512], ["unroll_explicit", "ot", 0]]}], "r": [[0.0010162515, 0.00101686225], 0, 1.3498997688293457, 1578498010.8326218], "v": 0.1}
{"i": ["cuda", "schedule_direct_3d_cuda", [[1, 24, 64, 128, 128], [12, 24, 1, 1, 1], [1, 1, 1], [0, 0, 0], 1], {}, ["schedule_direct_3d_cuda", [1, 24, 64, 128, 128], [12, 24, 1, 1, 1], [1, 1, 1], [0, 0, 0], 1], {"i": 390464229, "t": "", "c": null, "e": [["tile_f", "sp", [-1, 4, 1, 3]], ["tile_d", "sp", [-1, 1, 1, 4]], ["tile_y", "sp", [-1, 1, 4, 2]], ["tile_x", "sp", [-1, 1, 2, 1]], ["tile_rc", "sp", [-1, 1]], ["tile_rd", "sp", [-1, 1]], ["tile_ry", "sp", [-1, 1]], ["tile_rx", "sp", [-1, 1]], ["auto_unroll_max_step", "ot", 512], ["unroll_explicit", "ot", 0]]}], "r": [[0.0012433415, 0.00123957225], 0, 1.2039949893951416, 1578498011.4498386], "v": 0.1}
{"i": ["cuda", "schedule_direct_3d_cuda", [[1, 24, 64, 128, 128], [12, 24, 1, 1, 1], [1, 1, 1], [0, 0, 0], 1], {}, ["schedule_direct_3d_cuda", [1, 24, 64, 128, 128], [12, 24, 1, 1, 1], [1, 1, 1], [0, 0, 0], 1], {"i": 1552086789, "t": "", "c": null, "e": [["tile_f", "sp", [-1, 4, 1, 3]], ["tile_d", "sp", [-1, 1, 1, 4]], ["tile_y", "sp", [-1, 2, 4, 2]], ["tile_x", "sp", [-1, 2, 2, 1]], ["tile_rc", "sp", [-1, 1]], ["tile_rd", "sp", [-1, 1]], ["tile_ry", "sp", [-1, 1]], ["tile_rx", "sp", [-1, 1]], ["auto_unroll_max_step", "ot", 512], ["unroll_explicit", "ot", 1]]}], "r": [[0.01722294775, 0.017218918], 0, 2.3449931144714355, 1578498012.3807964], "v": 0.1}
{"i": ["cuda", "schedule_direct_3d_cuda", [[1, 24, 64, 128, 128], [12, 24, 1, 1, 1], [1, 1, 1], [0, 0, 0], 1], {}, ["schedule_direct_3d_cuda", [1, 24, 64, 128, 128], [12, 24, 1, 1, 1], [1, 1, 1], [0, 0, 0], 1], {"i": 1941663469, "t": "", "c": null, "e": [["tile_f", "sp", [-1, 4, 1, 3]], ["tile_d", "sp", [-1, 4, 1, 1]], ["tile_y", "sp", [-1, 2, 4, 4]], ["tile_x", "sp", [-1, 1, 4, 1]], ["tile_rc", "sp", [-1, 1]], ["tile_rd", "sp", [-1, 1]], ["tile_ry", "sp", [-1, 1]], ["tile_rx", "sp", [-1, 1]], ["auto_unroll_max_step", "ot", 1500], ["unroll_explicit", "ot", 1]]}], "r": [[0.008685128, 0.00868204975], 0, 2.3011157512664795, 1578498013.2246237], "v": 0.1}
{"i": ["cuda", "schedule_direct_3d_cuda", [[1, 24, 64, 128, 128], [12, 24, 1, 1, 1], [1, 1, 1], [0, 0, 0], 1], {}, ["schedule_direct_3d_cuda", [1, 24, 64, 128, 128], [12, 24, 1, 1, 1], [1, 1, 1], [0, 0, 0], 1], {"i": 1955265789, "t": "", "c": null, "e": [["tile_f", "sp", [-1, 4, 1, 3]], ["tile_d", "sp", [-1, 1, 1, 2]], ["tile_y", "sp", [-1, 2, 2, 2]], ["tile_x", "sp", [-1, 1, 4, 2]], ["tile_rc", "sp", [-1, 1]], ["tile_rd", "sp", [-1, 1]], ["tile_ry", "sp", [-1, 1]], ["tile_rx", "sp", [-1, 1]], ["auto_unroll_max_step", "ot", 1500], ["unroll_explicit", "ot", 1]]}], "r": [[0.00086922775, 0.00085975075], 0, 1.2947008609771729, 1578498013.805476], "v": 0.1}
{"i": ["cuda", "schedule_direct_3d_cuda", [[1, 24, 64, 128, 128], [12, 24, 1, 1, 1], [1, 1, 1], [0, 0, 0], 1], {}, ["schedule_direct_3d_cuda", [1, 24, 64, 128, 128], [12, 24, 1, 1, 1], [1, 1, 1], [0, 0, 0], 1], {"i": 404865189, "t": "", "c": null, "e": [["tile_f", "sp", [-1, 4, 1, 3]], ["tile_d", "sp", [-1, 1, 1, 4]], ["tile_y", "sp", [-1, 1, 4, 1]], ["tile_x", "sp", [-1, 2, 2, 2]], ["tile_rc", "sp", [-1, 1]], ["tile_rd", "sp", [-1, 1]], ["tile_ry", "sp", [-1, 1]], ["tile_rx", "sp", [-1, 1]], ["auto_unroll_max_step", "ot", 512], ["unroll_explicit", "ot", 0]]}], "r": [[0.00095568725, 0.0009566185], 0, 1.27278470993042, 1578498020.2155871], "v": 0.1}
{"i": ["cuda", "schedule_direct_3d_cuda", [[1, 24, 64, 128, 128], [12, 24, 1, 1, 1], [1, 1, 1], [0, 0, 0], 1], {}, ["schedule_direct_3d_cuda", [1, 24, 64, 128, 128], [12, 24, 1, 1, 1], [1, 1, 1], [0, 0, 0], 1], {"i": 1941710469, "t": "", "c": null, "e": [["tile_f", "sp", [-1, 4, 1, 3]], ["tile_d", "sp", [-1, 2, 1, 1]], ["tile_y", "sp", [-1, 1, 2, 8]], ["tile_x", "sp", [-1, 1, 4, 1]], ["tile_rc", "sp", [-1, 1]], ["tile_rd", "sp", [-1, 1]], ["tile_ry", "sp", [-1, 1]], ["tile_rx", "sp", [-1, 1]], ["auto_unroll_max_step", "ot", 1500], ["unroll_explicit", "ot", 1]]}], "r": [[0.0008784935, 0.00086914575], 0, 1.3572356700897217, 1578498020.8094893], "v": 0.1}
{"i": ["cuda", "schedule_direct_3d_cuda", [[1, 24, 64, 128, 128], [12, 24, 1, 1, 1], [1, 1, 1], [0, 0, 0], 1], {}, ["schedule_direct_3d_cuda", [1, 24, 64, 128, 128], [12, 24, 1, 1, 1], [1, 1, 1], [0, 0, 0], 1], {"i": 1955352069, "t": "", "c": null, "e": [["tile_f", "sp", [-1, 4, 1, 3]], ["tile_d", "sp", [-1, 2, 1, 1]], ["tile_y", "sp", [-1, 1, 2, 4]], ["tile_x", "sp", [-1, 1, 4, 2]], ["tile_rc", "sp", [-1, 1]], ["tile_rd", "sp", [-1, 1]], ["tile_ry", "sp", [-1, 1]], ["tile_rx", "sp", [-1, 1]], ["auto_unroll_max_step", "ot", 1500], ["unroll_explicit", "ot", 1]]}], "r": [[0.000875932, 0.00086563825], 0, 1.4125828742980957, 1578498021.409918], "v": 0.1}
{"i": ["cuda", "schedule_direct_3d_cuda", [[1, 24, 64, 128, 128], [12, 24, 1, 1, 1], [1, 1, 1], [0, 0, 0], 1], {}, ["schedule_direct_3d_cuda", [1, 24, 64, 128, 128], [12, 24, 1, 1, 1], [1, 1, 1], [0, 0, 0], 1], {"i": 791737069, "t": "", "c": null, "e": [["tile_f", "sp", [-1, 4, 1, 3]], ["tile_d", "sp", [-1, 4, 1, 1]], ["tile_y", "sp", [-1, 2, 4, 4]], ["tile_x", "sp", [-1, 1, 2, 2]], ["tile_rc", "sp", [-1, 1]], ["tile_rd", "sp", [-1, 1]], ["tile_ry", "sp", [-1, 1]], ["tile_rx", "sp", [-1, 1]], ["auto_unroll_max_step", "ot", 1500], ["unroll_explicit", "ot", 0]]}], "r": [[0.03154608325, 0.03150182175], 0, 3.4623172283172607, 1578498022.8055005], "v": 0.1}
{"i": ["cuda", "schedule_direct_3d_cuda", [[1, 24, 64, 128, 128], [12, 24, 1, 1, 1], [1, 1, 1], [0, 0, 0], 1], {}, ["schedule_direct_3d_cuda", [1, 24, 64, 128, 128], [12, 24, 1, 1, 1], [1, 1, 1], [0, 0, 0], 1], {"i": 1576683469, "t": "", "c": null, "e": [["tile_f", "sp", [-1, 4, 1, 3]], ["tile_d", "sp", [-1, 4, 1, 1]], ["tile_y", "sp", [-1, 4, 4, 2]], ["tile_x", "sp", [-1, 1, 2, 4]], ["tile_rc", "sp", [-1, 1]], ["tile_rd", "sp", [-1, 1]], ["tile_ry", "sp", [-1, 1]], ["tile_rx", "sp", [-1, 1]], ["auto_unroll_max_step", "ot", 512], ["unroll_explicit", "ot", 1]]}], "r": [[0.04255629625, 0.042525856], 0, 6.112333536148071, 1578498023.9140613], "v": 0.1}
{"i": ["cuda", "schedule_direct_3d_cuda", [[1, 24, 64, 128, 128], [12, 24, 1, 1, 1], [1, 1, 1], [0, 0, 0], 1], {}, ["schedule_direct_3d_cuda", [1, 24, 64, 128, 128], [12, 24, 1, 1, 1], [1, 1, 1], [0, 0, 0], 1], {"i": 777636269, "t": "", "c": null, "e": [["tile_f", "sp", [-1, 4, 1, 3]], ["tile_d", "sp", [-1, 4, 1, 2]], ["tile_y", "sp", [-1, 1, 8, 4]], ["tile_x", "sp", [-1, 1, 2, 1]], ["tile_rc", "sp", [-1, 1]], ["tile_rd", "sp", [-1, 1]], ["tile_ry", "sp", [-1, 1]], ["tile_rx", "sp", [-1, 1]], ["auto_unroll_max_step", "ot", 1500], ["unroll_explicit", "ot", 0]]}], "r": [[0.010657527, 0.010580629], 0, 2.0110976696014404, 1578498024.7503572], "v": 0.1}
{"i": ["cuda", "schedule_direct_3d_cuda", [[1, 24, 64, 128, 128], [12, 24, 1, 1, 1], [1, 1, 1], [0, 0, 0], 1], {}, ["schedule_direct_3d_cuda", [1, 24, 64, 128, 128], [12, 24, 1, 1, 1], [1, 1, 1], [0, 0, 0], 1], {"i": 1570299429, "t": "", "c": null, "e": [["tile_f", "sp", [-1, 4, 1, 3]], ["tile_d", "sp", [-1, 2, 1, 1]], ["tile_y", "sp", [-1, 2, 2, 4]], ["tile_x", "sp", [-1, 1, 8, 2]], ["tile_rc", "sp", [-1, 1]], ["tile_rd", "sp", [-1, 1]], ["tile_ry", "sp", [-1, 1]], ["tile_rx", "sp", [-1, 1]], ["auto_unroll_max_step", "ot", 512], ["unroll_explicit", "ot", 1]]}], "r": [[0.008870288, 0.008861512], 0, 2.3357863426208496, 1578498025.5994077], "v": 0.1}
{"i": ["cuda", "schedule_direct_3d_cuda", [[1, 24, 64, 128, 128], [12, 24, 1, 1, 1], [1, 1, 1], [0, 0, 0], 1], {}, ["schedule_direct_3d_cuda", [1, 24, 64, 128, 128], [12, 24, 1, 1, 1], [1, 1, 1], [0, 0, 0], 1], {"i": 1565932509, "t": "", "c": null, "e": [["tile_f", "sp", [-1, 4, 1, 3]], ["tile_d", "sp", [-1, 1, 1, 2]], ["tile_y", "sp", [-1, 2, 2, 8]], ["tile_x", "sp", [-1, 1, 2, 2]], ["tile_rc", "sp", [-1, 1]], ["tile_rd", "sp", [-1, 1]], ["tile_ry", "sp", [-1, 1]], ["tile_rx", "sp", [-1, 1]], ["auto_unroll_max_step", "ot", 512], ["unroll_explicit", "ot", 1]]}], "r": [[0.04715675925, 0.0473447225], 0, 3.250300407409668, 1578498026.726445], "v": 0.1}
{"i": ["cuda", "schedule_direct_3d_cuda", [[1, 24, 64, 128, 128], [12, 24, 1, 1, 1], [1, 1, 1], [0, 0, 0], 1], {}, ["schedule_direct_3d_cuda", [1, 24, 64, 128, 128], [12, 24, 1, 1, 1], [1, 1, 1], [0, 0, 0], 1], {"i": 1565929149, "t": "", "c": null, "e": [["tile_f", "sp", [-1, 4, 1, 3]], ["tile_d", "sp", [-1, 1, 1, 2]], ["tile_y", "sp", [-1, 1, 2, 8]], ["tile_x", "sp", [-1, 1, 2, 2]], ["tile_rc", "sp", [-1, 1]], ["tile_rd", "sp", [-1, 1]], ["tile_ry", "sp", [-1, 1]], ["tile_rx", "sp", [-1, 1]], ["auto_unroll_max_step", "ot", 512], ["unroll_explicit", "ot", 1]]}], "r": [[0.02611525575, 0.0260937315], 0, 2.5288827419281006, 1578498027.7343235], "v": 0.1}
{"i": ["cuda", "schedule_direct_3d_cuda", [[1, 24, 64, 128, 128], [12, 24, 1, 1, 1], [1, 1, 1], [0, 0, 0], 1], {}, ["schedule_direct_3d_cuda", [1, 24, 64, 128, 128], [12, 24, 1, 1, 1], [1, 1, 1], [0, 0, 0], 1], {"i": 1576681989, "t": "", "c": null, "e": [["tile_f", "sp", [-1, 4, 1, 3]], ["tile_d", "sp", [-1, 1, 1, 4]], ["tile_y", "sp", [-1, 2, 4, 2]], ["tile_x", "sp", [-1, 1, 2, 4]], ["tile_rc", "sp", [-1, 1]], ["tile_rd", "sp", [-1, 1]], ["tile_ry", "sp", [-1, 1]], ["tile_rx", "sp", [-1, 1]], ["auto_unroll_max_step", "ot", 512], ["unroll_explicit", "ot", 1]]}], "r": [[0.023125613, 0.02316378675], 0, 2.80778431892395, 1578498028.6523995], "v": 0.1}
{"i": ["cuda", "schedule_direct_3d_cuda", [[1, 24, 64, 128, 128], [12, 24, 1, 1, 1], [1, 1, 1], [0, 0, 0], 1], {}, ["schedule_direct_3d_cuda", [1, 24, 64, 128, 128], [12, 24, 1, 1, 1], [1, 1, 1], [0, 0, 0], 1], {"i": 404575429, "t": "", "c": null, "e": [["tile_f", "sp", [-1, 4, 1, 3]], ["tile_d", "sp", [-1, 2, 1, 2]], ["tile_y", "sp", [-1, 1, 4, 2]], ["tile_x", "sp", [-1, 1, 2, 2]], ["tile_rc", "sp", [-1, 1]], ["tile_rd", "sp", [-1, 1]], ["tile_ry", "sp", [-1, 1]], ["tile_rx", "sp", [-1, 1]], ["auto_unroll_max_step", "ot", 512], ["unroll_explicit", "ot", 0]]}], "r": [[0.00097064725, 0.000970366], 0, 1.4073283672332764, 1578498029.3198478], "v": 0.1}
{"i": ["cuda", "schedule_direct_3d_cuda", [[1, 24, 64, 128, 128], [12, 24, 1, 1, 1], [1, 1, 1], [0, 0, 0], 1], {}, ["schedule_direct_3d_cuda", [1, 24, 64, 128, 128], [12, 24, 1, 1, 1], [1, 1, 1], [0, 0, 0], 1], {"i": 1565774589, "t": "", "c": null, "e": [["tile_f", "sp", [-1, 4, 1, 3]], ["tile_d", "sp", [-1, 1, 1, 2]], ["tile_y", "sp", [-1, 2, 2, 2]], ["tile_x", "sp", [-1, 1, 2, 2]], ["tile_rc", "sp", [-1, 1]], ["tile_rd", "sp", [-1, 1]], ["tile_ry", "sp", [-1, 1]], ["tile_rx", "sp", [-1, 1]], ["auto_unroll_max_step", "ot", 512], ["unroll_explicit", "ot", 1]]}], "r": [[0.00145659625, 0.0014561035], 0, 1.4945709705352783, 1578498030.0014672], "v": 0.1}
{"i": ["cuda", "schedule_direct_3d_cuda", [[1, 24, 64, 128, 128], [12, 24, 1, 1, 1], [1, 1, 1], [0, 0, 0], 1], {}, ["schedule_direct_3d_cuda", [1, 24, 64, 128, 128], [12, 24, 1, 1, 1], [1, 1, 1], [0, 0, 0], 1], {"i": 1971718709, "t": "", "c": null, "e": [["tile_f", "sp", [-1, 4, 1, 3]], ["tile_d", "sp", [-1, 8, 1, 1]], ["tile_y", "sp", [-1, 1, 8, 1]], ["tile_x", "sp", [-1, 1, 2, 8]], ["tile_rc", "sp", [-1, 1]], ["tile_rd", "sp", [-1, 1]], ["tile_ry", "sp", [-1, 1]], ["tile_rx", "sp", [-1, 1]], ["auto_unroll_max_step", "ot", 1500], ["unroll_explicit", "ot", 1]]}], "r": [[0.01789293775, 0.0178817125], 0, 5.033476114273071, 1578498035.950517], "v": 0.1}
{"i": ["cuda", "schedule_direct_3d_cuda", [[1, 24, 64, 128, 128], [12, 24, 1, 1, 1], [1, 1, 1], [0, 0, 0], 1], {}, ["schedule_direct_3d_cuda", [1, 24, 64, 128, 128], [12, 24, 1, 1, 1], [1, 1, 1], [0, 0, 0], 1], {"i": 788843229, "t": "", "c": null, "e": [["tile_f", "sp", [-1, 4, 1, 3]], ["tile_d", "sp", [-1, 1, 1, 8]], ["tile_y", "sp", [-1, 1, 8, 2]], ["tile_x", "sp", [-1, 1, 1, 2]], ["tile_rc", "sp", [-1, 1]], ["tile_rd", "sp", [-1, 1]], ["tile_ry", "sp", [-1, 1]], ["tile_rx", "sp", [-1, 1]], ["auto_unroll_max_step", "ot", 1500], ["unroll_explicit", "ot", 0]]}], "r": [[0.015061368, 0.015001103], 0, 2.016522169113159, 1578498036.8564136], "v": 0.1}
{"i": ["cuda", "schedule_direct_3d_cuda", [[1, 24, 64, 128, 128], [12, 24, 1, 1, 1], [1, 1, 1], [0, 0, 0], 1], {}, ["schedule_direct_3d_cuda", [1, 24, 64, 128, 128], [12, 24, 1, 1, 1], [1, 1, 1], [0, 0, 0], 1], {"i": 788846589, "t": "", "c": null, "e": [["tile_f", "sp", [-1, 4, 1, 3]], ["tile_d", "sp", [-1, 1, 1, 8]], ["tile_y", "sp", [-1, 2, 8, 2]], ["tile_x", "sp", [-1, 1, 1, 2]], ["tile_rc", "sp", [-1, 1]], ["tile_rd", "sp", [-1, 1]], ["tile_ry", "sp", [-1, 1]], ["tile_rx", "sp", [-1, 1]], ["auto_unroll_max_step", "ot", 1500], ["unroll_explicit", "ot", 0]]}], "r": [[0.02995575525, 0.02984281525], 0, 3.726891040802002, 1578498038.2049284], "v": 0.1}
{"i": ["cuda", "schedule_direct_3d_cuda", [[1, 24, 64, 128, 128], [12, 24, 1, 1, 1], [1, 1, 1], [0, 0, 0], 1], {}, ["schedule_direct_3d_cuda", [1, 24, 64, 128, 128], [12, 24, 1, 1, 1], [1, 1, 1], [0, 0, 0], 1], {"i": 1574259429, "t": "", "c": null, "e": [["tile_f", "sp", [-1, 4, 1, 3]], ["tile_d", "sp", [-1, 1, 1, 4]], ["tile_y", "sp", [-1, 1, 4, 2]], ["tile_x", "sp", [-1, 1, 1, 4]], ["tile_rc", "sp", [-1, 1]], ["tile_rd", "sp", [-1, 1]], ["tile_ry", "sp", [-1, 1]], ["tile_rx", "sp", [-1, 1]], ["auto_unroll_max_step", "ot", 512], ["unroll_explicit", "ot", 1]]}], "r": [[0.02716697575, 0.02717390375], 0, 2.7431185245513916, 1578498039.1930645], "v": 0.1}
{"i": ["cuda", "schedule_direct_3d_cuda", [[1, 24, 64, 128, 128], [12, 24, 1, 1, 1], [1, 1, 1], [0, 0, 0], 1], {}, ["schedule_direct_3d_cuda", [1, 24, 64, 128, 128], [12, 24, 1, 1, 1], [1, 1, 1], [0, 0, 0], 1], {"i": 774419709, "t": "", "c": null, "e": [["tile_f", "sp", [-1, 4, 1, 3]], ["tile_d", "sp", [-1, 16, 1, 1]], ["tile_y", "sp", [-1, 1, 16, 4]], ["tile_x", "sp", [-1, 1, 1, 1]], ["tile_rc", "sp", [-1, 1]], ["tile_rd", "sp", [-1, 1]], ["tile_ry", "sp", [-1, 1]], ["tile_rx", "sp", [-1, 1]], ["auto_unroll_max_step", "ot", 1500], ["unroll_explicit", "ot", 0]]}], "r": [[0.01899603925, 0.0188745505], 0, 3.4671642780303955, 1578498040.4054976], "v": 0.1}
{"i": ["cuda", "schedule_direct_3d_cuda", [[1, 24, 64, 128, 128], [12, 24, 1, 1, 1], [1, 1, 1], [0, 0, 0], 1], {}, ["schedule_direct_3d_cuda", [1, 24, 64, 128, 128], [12, 24, 1, 1, 1], [1, 1, 1], [0, 0, 0], 1], {"i": 409083429, "t": "", "c": null, "e": [["tile_f", "sp", [-1, 4, 1, 3]], ["tile_d", "sp", [-1, 2, 1, 1]], ["tile_y", "sp", [-1, 2, 2, 4]], ["tile_x", "sp", [-1, 1, 8, 2]], ["tile_rc", "sp", [-1, 1]], ["tile_rd", "sp", [-1, 1]], ["tile_ry", "sp", [-1, 1]], ["tile_rx", "sp", [-1, 1]], ["auto_unroll_max_step", "ot", 512], ["unroll_explicit", "ot", 0]]}], "r": [[0.00894860125, 0.0089504795], 0, 1.9867122173309326, 1578498041.2587025], "v": 0.1}
{"i": ["cuda", "schedule_direct_3d_cuda", [[1, 24, 64, 128, 128], [12, 24, 1, 1, 1], [1, 1, 1], [0, 0, 0], 1], {}, ["schedule_direct_3d_cuda", [1, 24, 64, 128, 128], [12, 24, 1, 1, 1], [1, 1, 1], [0, 0, 0], 1], {"i": 1950059229, "t": "", "c": null, "e": [["tile_f", "sp", [-1, 4, 1, 3]], ["tile_d", "sp", [-1, 1, 1, 8]], ["tile_y", "sp", [-1, 1, 8, 2]], ["tile_x", "sp", [-1, 1, 1, 2]], ["tile_rc", "sp", [-1, 1]], ["tile_rd", "sp", [-1, 1]], ["tile_ry", "sp", [-1, 1]], ["tile_rx", "sp", [-1, 1]], ["auto_unroll_max_step", "ot", 1500], ["unroll_explicit", "ot", 1]]}], "r": [[0.0158665115, 0.01590164525], 0, 2.6847832202911377, 1578498042.1657956], "v": 0.1}
{"i": ["cuda", "schedule_direct_3d_cuda", [[1, 24, 64, 128, 128], [12, 24, 1, 1, 1], [1, 1, 1], [0, 0, 0], 1], {}, ["schedule_direct_3d_cuda", [1, 24, 64, 128, 128], [12, 24, 1, 1, 1], [1, 1, 1], [0, 0, 0], 1], {"i": 1950062589, "t": "", "c": null, "e": [["tile_f", "sp", [-1, 4, 1, 3]], ["tile_d", "sp", [-1, 1, 1, 8]], ["tile_y", "sp", [-1, 2, 8, 2]], ["tile_x", "sp", [-1, 1, 1, 2]], ["tile_rc", "sp", [-1, 1]], ["tile_rd", "sp", [-1, 1]], ["tile_ry", "sp", [-1, 1]], ["tile_rx", "sp", [-1, 1]], ["auto_unroll_max_step", "ot", 1500], ["unroll_explicit", "ot", 1]]}], "r": [[0.03069571375, 0.0307622715], 0, 4.8692193031311035, 1578498043.5305066], "v": 0.1}
{"i": ["cuda", "schedule_direct_3d_cuda", [[1, 24, 64, 128, 128], [12, 24, 1, 1, 1], [1, 1, 1], [0, 0, 0], 1], {}, ["schedule_direct_3d_cuda", [1, 24, 64, 128, 128], [12, 24, 1, 1, 1], [1, 1, 1], [0, 0, 0], 1], {"i": 1938851189, "t": "", "c": null, "e": [["tile_f", "sp", [-1, 4, 1, 3]], ["tile_d", "sp", [-1, 8, 1, 1]], ["tile_y", "sp", [-1, 1, 8, 4]], ["tile_x", "sp", [-1, 1, 2, 1]], ["tile_rc", "sp", [-1, 1]], ["tile_rd", "sp", [-1, 1]], ["tile_ry", "sp", [-1, 1]], ["tile_rx", "sp", [-1, 1]], ["auto_unroll_max_step", "ot", 1500], ["unroll_explicit", "ot", 1]]}], "r": [[0.00998921, 0.010012207], 0, 2.6120784282684326, 1578498044.4001615], "v": 0.1}
{"i": ["cuda", "schedule_direct_3d_cuda", [[1, 24, 64, 128, 128], [12, 24, 1, 1, 1], [1, 1, 1], [0, 0, 0], 1], {}, ["schedule_direct_3d_cuda", [1, 24, 64, 128, 128], [12, 24, 1, 1, 1], [1, 1, 1], [0, 0, 0], 1], {"i": 1957371429, "t": "", "c": null, "e": [["tile_f", "sp", [-1, 4, 1, 3]], ["tile_d", "sp", [-1, 2, 1, 1]], ["tile_y", "sp", [-1, 2, 2, 4]], ["tile_x", "sp", [-1, 1, 8, 2]], ["tile_rc", "sp", [-1, 1]], ["tile_rd", "sp", [-1, 1]], ["tile_ry", "sp", [-1, 1]], ["tile_rx", "sp", [-1, 1]], ["auto_unroll_max_step", "ot", 1500], ["unroll_explicit", "ot", 1]]}], "r": [[0.00887595525, 0.0088656255], 0, 2.5445330142974854, 1578498045.0974908], "v": 0.1}
{"i": ["cuda", "schedule_direct_3d_cuda", [[1, 24, 64, 128, 128], [12, 24, 1, 1, 1], [1, 1, 1], [0, 0, 0], 1], {}, ["schedule_direct_3d_cuda", [1, 24, 64, 128, 128], [12, 24, 1, 1, 1], [1, 1, 1], [0, 0, 0], 1], {"i": 1953001149, "t": "", "c": null, "e": [["tile_f", "sp", [-1, 4, 1, 3]], ["tile_d", "sp", [-1, 1, 1, 2]], ["tile_y", "sp", [-1, 1, 2, 8]], ["tile_x", "sp", [-1, 1, 2, 2]], ["tile_rc", "sp", [-1, 1]], ["tile_rd", "sp", [-1, 1]], ["tile_ry", "sp", [-1, 1]], ["tile_rx", "sp", [-1, 1]], ["auto_unroll_max_step", "ot", 1500], ["unroll_explicit", "ot", 1]]}], "r": [[0.026110435, 0.026083148], 0, 2.8481643199920654, 1578498045.954842], "v": 0.1}
{"i": ["cuda", "schedule_direct_3d_cuda", [[1, 24, 64, 128, 128], [12, 24, 1, 1, 1], [1, 1, 1], [0, 0, 0], 1], {}, ["schedule_direct_3d_cuda", [1, 24, 64, 128, 128], [12, 24, 1, 1, 1], [1, 1, 1], [0, 0, 0], 1], {"i": 1935635709, "t": "", "c": null, "e": [["tile_f", "sp", [-1, 4, 1, 3]], ["tile_d", "sp", [-1, 16, 1, 1]], ["tile_y", "sp", [-1, 1, 16, 4]], ["tile_x", "sp", [-1, 1, 1, 1]], ["tile_rc", "sp", [-1, 1]], ["tile_rd", "sp", [-1, 1]], ["tile_ry", "sp", [-1, 1]], ["tile_rx", "sp", [-1, 1]], ["auto_unroll_max_step", "ot", 1500], ["unroll_explicit", "ot", 1]]}], "r": [[0.018775735, 0.01882521], 0, 4.627826929092407, 1578498047.1913989], "v": 0.1}
{"i": ["cuda", "schedule_direct_3d_cuda", [[1, 24, 64, 128, 128], [12, 24, 1, 1, 1], [1, 1, 1], [0, 0, 0], 1], {}, ["schedule_direct_3d_cuda", [1, 24, 64, 128, 128], [12, 24, 1, 1, 1], [1, 1, 1], [0, 0, 0], 1], {"i": 780358637, "t": "", "c": null, "e": [["tile_f", "sp", [-1, 2, 1, 6]], ["tile_d", "sp", [-1, 1, 1, 4]], ["tile_y", "sp", [-1, 1, 4, 2]], ["tile_x", "sp", [-1, 1, 4, 1]], ["tile_rc", "sp", [-1, 1]], ["tile_rd", "sp", [-1, 1]], ["tile_ry", "sp", [-1, 1]], ["tile_rx", "sp", [-1, 1]], ["auto_unroll_max_step", "ot", 1500], ["unroll_explicit", "ot", 0]]}], "r": [[0.00086579325, 0.00087266925], 0, 1.0008540153503418, 1578498255.7575393], "v": 0.1}
{"i": ["cuda", "schedule_direct_3d_cuda", [[1, 24, 64, 128, 128], [12, 24, 1, 1, 1], [1, 1, 1], [0, 0, 0], 1], {}, ["schedule_direct_3d_cuda", [1, 24, 64, 128, 128], [12, 24, 1, 1, 1], [1, 1, 1], [0, 0, 0], 1], {"i": 780358634, "t": "", "c": null, "e": [["tile_f", "sp", [-1, 3, 1, 4]], ["tile_d", "sp", [-1, 1, 1, 4]], ["tile_y", "sp", [-1, 1, 4, 2]], ["tile_x", "sp", [-1, 1, 4, 1]], ["tile_rc", "sp", [-1, 1]], ["tile_rd", "sp", [-1, 1]], ["tile_ry", "sp", [-1, 1]], ["tile_rx", "sp", [-1, 1]], ["auto_unroll_max_step", "ot", 1500], ["unroll_explicit", "ot", 0]]}], "r": [[0.00087432675, 0.000866808], 0, 1.052299976348877, 1578498256.3674967], "v": 0.1}
{"i": ["cuda", "schedule_direct_3d_cuda", [[1, 24, 64, 128, 128], [12, 24, 1, 1, 1], [1, 1, 1], [0, 0, 0], 1], {}, ["schedule_direct_3d_cuda", [1, 24, 64, 128, 128], [12, 24, 1, 1, 1], [1, 1, 1], [0, 0, 0], 1], {"i": 1941574637, "t": "", "c": null, "e": [["tile_f", "sp", [-1, 2, 1, 6]], ["tile_d", "sp", [-1, 1, 1, 4]], ["tile_y", "sp", [-1, 1, 4, 2]], ["tile_x", "sp", [-1, 1, 4, 1]], ["tile_rc", "sp", [-1, 1]], ["tile_rd", "sp", [-1, 1]], ["tile_ry", "sp", [-1, 1]], ["tile_rx", "sp", [-1, 1]], ["auto_unroll_max_step", "ot", 1500], ["unroll_explicit", "ot", 1]]}], "r": [[0.00086352575, 0.00086802325], 0, 1.2525708675384521, 1578498256.9752405], "v": 0.1}
{"i": ["cuda", "schedule_direct_3d_cuda", [[1, 24, 64, 128, 128], [12, 24, 1, 1, 1], [1, 1, 1], [0, 0, 0], 1], {}, ["schedule_direct_3d_cuda", [1, 24, 64, 128, 128], [12, 24, 1, 1, 1], [1, 1, 1], [0, 0, 0], 1], {"i": 393286637, "t": "", "c": null, "e": [["tile_f", "sp", [-1, 2, 1, 6]], ["tile_d", "sp", [-1, 1, 1, 4]], ["tile_y", "sp", [-1, 1, 4, 2]], ["tile_x", "sp", [-1, 1, 4, 1]], ["tile_rc", "sp", [-1, 1]], ["tile_rd", "sp", [-1, 1]], ["tile_ry", "sp", [-1, 1]], ["tile_rx", "sp", [-1, 1]], ["auto_unroll_max_step", "ot", 512], ["unroll_explicit", "ot", 0]]}], "r": [[0.00087848375, 0.0008711225], 0, 1.1222312450408936, 1578498257.5741715], "v": 0.1}
{"i": ["cuda", "schedule_direct_3d_cuda", [[1, 24, 64, 128, 128], [12, 24, 1, 1, 1], [1, 1, 1], [0, 0, 0], 1], {}, ["schedule_direct_3d_cuda", [1, 24, 64, 128, 128], [12, 24, 1, 1, 1], [1, 1, 1], [0, 0, 0], 1], {"i": 1941574634, "t": "", "c": null, "e": [["tile_f", "sp", [-1, 3, 1, 4]], ["tile_d", "sp", [-1, 1, 1, 4]], ["tile_y", "sp", [-1, 1, 4, 2]], ["tile_x", "sp", [-1, 1, 4, 1]], ["tile_rc", "sp", [-1, 1]], ["tile_rd", "sp", [-1, 1]], ["tile_ry", "sp", [-1, 1]], ["tile_rx", "sp", [-1, 1]], ["auto_unroll_max_step", "ot", 1500], ["unroll_explicit", "ot", 1]]}], "r": [[0.0008710925, 0.0008695095], 0, 1.2141666412353516, 1578498258.2051673], "v": 0.1}
{"i": ["cuda", "schedule_direct_3d_cuda", [[1, 24, 64, 128, 128], [12, 24, 1, 1, 1], [1, 1, 1], [0, 0, 0], 1], {}, ["schedule_direct_3d_cuda", [1, 24, 64, 128, 128], [12, 24, 1, 1, 1], [1, 1, 1], [0, 0, 0], 1], {"i": 393286634, "t": "", "c": null, "e": [["tile_f", "sp", [-1, 3, 1, 4]], ["tile_d", "sp", [-1, 1, 1, 4]], ["tile_y", "sp", [-1, 1, 4, 2]], ["tile_x", "sp", [-1, 1, 4, 1]], ["tile_rc", "sp", [-1, 1]], ["tile_rd", "sp", [-1, 1]], ["tile_ry", "sp", [-1, 1]], ["tile_rx", "sp", [-1, 1]], ["auto_unroll_max_step", "ot", 512], ["unroll_explicit", "ot", 0]]}], "r": [[0.0008796865, 0.000863554], 0, 1.0217385292053223, 1578498258.8145845], "v": 0.1}
{"i": ["cuda", "schedule_direct_3d_cuda", [[1, 24, 64, 128, 128], [12, 24, 1, 1, 1], [1, 1, 1], [0, 0, 0], 1], {}, ["schedule_direct_3d_cuda", [1, 24, 64, 128, 128], [12, 24, 1, 1, 1], [1, 1, 1], [0, 0, 0], 1], {"i": 6214637, "t": "", "c": null, "e": [["tile_f", "sp", [-1, 2, 1, 6]], ["tile_d", "sp", [-1, 1, 1, 4]], ["tile_y", "sp", [-1, 1, 4, 2]], ["tile_x", "sp", [-1, 1, 4, 1]], ["tile_rc", "sp", [-1, 1]], ["tile_rd", "sp", [-1, 1]], ["tile_ry", "sp", [-1, 1]], ["tile_rx", "sp", [-1, 1]], ["auto_unroll_max_step", "ot", 0], ["unroll_explicit", "ot", 0]]}], "r": [[0.000880239, 0.0008673665], 0, 1.117260456085205, 1578498259.405014], "v": 0.1}
{"i": ["cuda", "schedule_direct_3d_cuda", [[1, 24, 64, 128, 128], [12, 24, 1, 1, 1], [1, 1, 1], [0, 0, 0], 1], {}, ["schedule_direct_3d_cuda", [1, 24, 64, 128, 128], [12, 24, 1, 1, 1], [1, 1, 1], [0, 0, 0], 1], {"i": 6214629, "t": "", "c": null, "e": [["tile_f", "sp", [-1, 4, 1, 3]], ["tile_d", "sp", [-1, 1, 1, 4]], ["tile_y", "sp", [-1, 1, 4, 2]], ["tile_x", "sp", [-1, 1, 4, 1]], ["tile_rc", "sp", [-1, 1]], ["tile_rd", "sp", [-1, 1]], ["tile_ry", "sp", [-1, 1]], ["tile_rx", "sp", [-1, 1]], ["auto_unroll_max_step", "ot", 0], ["unroll_explicit", "ot", 0]]}], "r": [[0.00087943725, 0.00086616], 0, 1.1043493747711182, 1578498259.9954114], "v": 0.1}
{"i": ["cuda", "schedule_direct_3d_cuda", [[1, 24, 64, 128, 128], [12, 24, 1, 1, 1], [1, 1, 1], [0, 0, 0], 1], {}, ["schedule_direct_3d_cuda", [1, 24, 64, 128, 128], [12, 24, 1, 1, 1], [1, 1, 1], [0, 0, 0], 1], {"i": 393359714, "t": "", "c": null, "e": [["tile_f", "sp", [-1, 3, 1, 4]], ["tile_d", "sp", [-1, 1, 1, 2]], ["tile_y", "sp", [-1, 2, 2, 4]], ["tile_x", "sp", [-1, 1, 4, 1]], ["tile_rc", "sp", [-1, 1]], ["tile_rd", "sp", [-1, 1]], ["tile_ry", "sp", [-1, 1]], ["tile_rx", "sp", [-1, 1]], ["auto_unroll_max_step", "ot", 512], ["unroll_explicit", "ot", 0]]}], "r": [[0.0010262715, 0.00102600075], 0, 1.2571008205413818, 1578498260.7052138], "v": 0.1}
{"i": ["cuda", "schedule_direct_3d_cuda", [[1, 24, 64, 128, 128], [12, 24, 1, 1, 1], [1, 1, 1], [0, 0, 0], 1], {}, ["schedule_direct_3d_cuda", [1, 24, 64, 128, 128], [12, 24, 1, 1, 1], [1, 1, 1], [0, 0, 0], 1], {"i": 1554575717, "t": "", "c": null, "e": [["tile_f", "sp", [-1, 2, 1, 6]], ["tile_d", "sp", [-1, 1, 1, 2]], ["tile_y", "sp", [-1, 2, 2, 4]], ["tile_x", "sp", [-1, 1, 4, 1]], ["tile_rc", "sp", [-1, 1]], ["tile_rd", "sp", [-1, 1]], ["tile_ry", "sp", [-1, 1]], ["tile_rx", "sp", [-1, 1]], ["auto_unroll_max_step", "ot", 512], ["unroll_explicit", "ot", 1]]}], "r": [[0.00102255675, 0.00102253025], 0, 1.366265058517456, 1578498261.4062262], "v": 0.1}
{"i": ["cuda", "schedule_direct_3d_cuda", [[1, 24, 64, 128, 128], [12, 24, 1, 1, 1], [1, 1, 1], [0, 0, 0], 1], {}, ["schedule_direct_3d_cuda", [1, 24, 64, 128, 128], [12, 24, 1, 1, 1], [1, 1, 1], [0, 0, 0], 1], {"i": 393359717, "t": "", "c": null, "e": [["tile_f", "sp", [-1, 2, 1, 6]], ["tile_d", "sp", [-1, 1, 1, 2]], ["tile_y", "sp", [-1, 2, 2, 4]], ["tile_x", "sp", [-1, 1, 4, 1]], ["tile_rc", "sp", [-1, 1]], ["tile_rd", "sp", [-1, 1]], ["tile_ry", "sp", [-1, 1]], ["tile_rx", "sp", [-1, 1]], ["auto_unroll_max_step", "ot", 512], ["unroll_explicit", "ot", 0]]}], "r": [[0.001024022, 0.0010269965], 0, 1.1371996402740479, 1578498262.097173], "v": 0.1}
{"i": ["cuda", "schedule_direct_3d_cuda", [[1, 24, 64, 128, 128], [12, 24, 1, 1, 1], [1, 1, 1], [0, 0, 0], 1], {}, ["schedule_direct_3d_cuda", [1, 24, 64, 128, 128], [12, 24, 1, 1, 1], [1, 1, 1], [0, 0, 0], 1], {"i": 6214634, "t": "", "c": null, "e": [["tile_f", "sp", [-1, 3, 1, 4]], ["tile_d", "sp", [-1, 1, 1, 4]], ["tile_y", "sp", [-1, 1, 4, 2]], ["tile_x", "sp", [-1, 1, 4, 1]], ["tile_rc", "sp", [-1, 1]], ["tile_rd", "sp", [-1, 1]], ["tile_ry", "sp", [-1, 1]], ["tile_rx", "sp", [-1, 1]], ["auto_unroll_max_step", "ot", 0], ["unroll_explicit", "ot", 0]]}], "r": [[0.0008836235, 0.00086785075], 0, 0.9874565601348877, 1578498262.71612], "v": 0.1}
{"i": ["cuda", "schedule_direct_3d_cuda", [[1, 24, 64, 128, 128], [12, 24, 1, 1, 1], [1, 1, 1], [0, 0, 0], 1], {}, ["schedule_direct_3d_cuda", [1, 24, 64, 128, 128], [12, 24, 1, 1, 1], [1, 1, 1], [0, 0, 0], 1], {"i": 393286621, "t": "", "c": null, "e": [["tile_f", "sp", [-1, 6, 1, 2]], ["tile_d", "sp", [-1, 1, 1, 4]], ["tile_y", "sp", [-1, 1, 4, 2]], ["tile_x", "sp", [-1, 1, 4, 1]], ["tile_rc", "sp", [-1, 1]], ["tile_rd", "sp", [-1, 1]], ["tile_ry", "sp", [-1, 1]], ["tile_rx", "sp", [-1, 1]], ["auto_unroll_max_step", "ot", 512], ["unroll_explicit", "ot", 0]]}], "r": [[0.00087293725, 0.000873996], 0, 1.1089797019958496, 1578498265.2154214], "v": 0.1}
