auto_log/((1, 1, 64, 128, 128), (24, 1, 1, 5, 5), (1, 24, 64, 64, 64), (1, 2, 2), (0, 2, 2), 1, 1, None)_bwd_wei_grad.log
{"i": ["cuda", "schedule_conv3d_nchw_cuda", [[1, 1, 64, 128, 128], [24, 1, 64, 64, 64], 1, [0, 2, 2], [1, 2, 2], 1], {}, ["schedule_conv3d_nchw_cuda", [1, 1, 64, 128, 128], [24, 1, 64, 64, 64], 1, [0, 2, 2], [1, 2, 2], 1], {"i": 65017822, "t": "", "c": null, "e": [["tile_n", "sp", [-1, 1, 1, 1]], ["tile_f", "sp", [-1, 1, 2, 4]], ["tile_d", "sp", [-1, 1, 1, 1]], ["tile_y", "sp", [-1, 3, 1, 1]], ["tile_x", "sp", [-1, 1, 3, 2]], ["tile_rc", "sp", [-1, 1]], ["tile_rd", "sp", [-1, 8]], ["tile_ry", "sp", [-1, 32]], ["tile_rx", "sp", [-1, 2]], ["auto_unroll_max_step", "ot", 0], ["unroll_explicit", "ot", 1], ["fuse_yx", "ot", 1]]}], "r": [[0.1745294935, 0.1705687265], 0, 2.562835454940796, 1578494522.3451924], "v": 0.1}
{"i": ["cuda", "schedule_conv3d_nchw_cuda", [[1, 1, 64, 128, 128], [24, 1, 64, 64, 64], 1, [0, 2, 2], [1, 2, 2], 1], {}, ["schedule_conv3d_nchw_cuda", [1, 1, 64, 128, 128], [24, 1, 64, 64, 64], 1, [0, 2, 2], [1, 2, 2], 1], {"i": 49424904, "t": "", "c": null, "e": [["tile_n", "sp", [-1, 1, 1, 1]], ["tile_f", "sp", [-1, 4, 6, 1]], ["tile_d", "sp", [-1, 1, 1, 1]], ["tile_y", "sp", [-1, 6, 1, 1]], ["tile_x", "sp", [-1, 3, 2, 1]], ["tile_rc", "sp", [-1, 1]], ["tile_rd", "sp", [-1, 32]], ["tile_ry", "sp", [-1, 2]], ["tile_rx", "sp", [-1, 1]], ["auto_unroll_max_step", "ot", 512], ["unroll_explicit", "ot", 0], ["fuse_yx", "ot", 1]]}], "r": [[0.12531937725, 0.12533661325], 0, 4.559091329574585, 1578494530.65716], "v": 0.1}
{"i": ["cuda", "schedule_conv3d_nchw_cuda", [[1, 1, 64, 128, 128], [24, 1, 64, 64, 64], 1, [0, 2, 2], [1, 2, 2], 1], {}, ["schedule_conv3d_nchw_cuda", [1, 1, 64, 128, 128], [24, 1, 64, 64, 64], 1, [0, 2, 2], [1, 2, 2], 1], {"i": 66556587, "t": "", "c": null, "e": [["tile_n", "sp", [-1, 1, 1, 1]], ["tile_f", "sp", [-1, 1, 12, 1]], ["tile_d", "sp", [-1, 1, 1, 1]], ["tile_y", "sp", [-1, 3, 2, 1]], ["tile_x", "sp", [-1, 2, 1, 3]], ["tile_rc", "sp", [-1, 1]], ["tile_rd", "sp", [-1, 2]], ["tile_ry", "sp", [-1, 4]], ["tile_rx", "sp", [-1, 8]], ["auto_unroll_max_step", "ot", 0], ["unroll_explicit", "ot", 1], ["fuse_yx", "ot", 1]]}], "r": [[0.02927814175, 0.029276422], 0, 1.1876957416534424, 1578494536.153166], "v": 0.1}
{"i": ["cuda", "schedule_conv3d_nchw_cuda", [[1, 1, 64, 128, 128], [24, 1, 64, 64, 64], 1, [0, 2, 2], [1, 2, 2], 1], {}, ["schedule_conv3d_nchw_cuda", [1, 1, 64, 128, 128], [24, 1, 64, 64, 64], 1, [0, 2, 2], [1, 2, 2], 1], {"i": 21483774, "t": "", "c": null, "e": [["tile_n", "sp", [-1, 1, 1, 1]], ["tile_f", "sp", [-1, 1, 3, 1]], ["tile_d", "sp", [-1, 1, 1, 1]], ["tile_y", "sp", [-1, 6, 1, 1]], ["tile_x", "sp", [-1, 1, 1, 1]], ["tile_rc", "sp", [-1, 1]], ["tile_rd", "sp", [-1, 64]], ["tile_ry", "sp", [-1, 4]], ["tile_rx", "sp", [-1, 1]], ["auto_unroll_max_step", "ot", 0], ["unroll_explicit", "ot", 1], ["fuse_yx", "ot", 0]]}], "r": [[0.17354701375, 0.17354030975], 0, 2.4915974140167236, 1578494557.7680602], "v": 0.1}
{"i": ["cuda", "schedule_conv3d_nchw_cuda", [[1, 1, 64, 128, 128], [24, 1, 64, 64, 64], 1, [0, 2, 2], [1, 2, 2], 1], {}, ["schedule_conv3d_nchw_cuda", [1, 1, 64, 128, 128], [24, 1, 64, 64, 64], 1, [0, 2, 2], [1, 2, 2], 1], {"i": 58446525, "t": "", "c": null, "e": [["tile_n", "sp", [-1, 1, 1, 1]], ["tile_f", "sp", [-1, 1, 6, 2]], ["tile_d", "sp", [-1, 1, 1, 1]], ["tile_y", "sp", [-1, 3, 2, 1]], ["tile_x", "sp", [-1, 2, 1, 3]], ["tile_rc", "sp", [-1, 1]], ["tile_rd", "sp", [-1, 16]], ["tile_ry", "sp", [-1, 2]], ["tile_rx", "sp", [-1, 4]], ["auto_unroll_max_step", "ot", 1500], ["unroll_explicit", "ot", 0], ["fuse_yx", "ot", 1]]}], "r": [[0.0556059805, 0.05561146625], 0, 3.9981448650360107, 1578494561.3182724], "v": 0.1}
{"i": ["cuda", "schedule_conv3d_nchw_cuda", [[1, 1, 64, 128, 128], [24, 1, 64, 64, 64], 1, [0, 2, 2], [1, 2, 2], 1], {}, ["schedule_conv3d_nchw_cuda", [1, 1, 64, 128, 128], [24, 1, 64, 64, 64], 1, [0, 2, 2], [1, 2, 2], 1], {"i": 24676981, "t": "", "c": null, "e": [["tile_n", "sp", [-1, 1, 1, 1]], ["tile_f", "sp", [-1, 6, 4, 1]], ["tile_d", "sp", [-1, 1, 1, 1]], ["tile_y", "sp", [-1, 1, 2, 3]], ["tile_x", "sp", [-1, 1, 2, 3]], ["tile_rc", "sp", [-1, 1]], ["tile_rd", "sp", [-1, 1]], ["tile_ry", "sp", [-1, 16]], ["tile_rx", "sp", [-1, 8]], ["auto_unroll_max_step", "ot", 0], ["unroll_explicit", "ot", 1], ["fuse_yx", "ot", 0]]}], "r": [[0.08896462425, 0.088967945], 0, 1.6933982372283936, 1578494562.712611], "v": 0.1}
{"i": ["cuda", "schedule_conv3d_nchw_cuda", [[1, 1, 64, 128, 128], [24, 1, 64, 64, 64], 1, [0, 2, 2], [1, 2, 2], 1], {}, ["schedule_conv3d_nchw_cuda", [1, 1, 64, 128, 128], [24, 1, 64, 64, 64], 1, [0, 2, 2], [1, 2, 2], 1], {"i": 44204595, "t": "", "c": null, "e": [["tile_n", "sp", [-1, 1, 1, 1]], ["tile_f", "sp", [-1, 12, 1, 2]], ["tile_d", "sp", [-1, 1, 1, 1]], ["tile_y", "sp", [-1, 2, 1, 3]], ["tile_x", "sp", [-1, 1, 3, 1]], ["tile_rc", "sp", [-1, 1]], ["tile_rd", "sp", [-1, 4]], ["tile_ry", "sp", [-1, 1]], ["tile_rx", "sp", [-1, 4]], ["auto_unroll_max_step", "ot", 0], ["unroll_explicit", "ot", 0], ["fuse_yx", "ot", 1]]}], "r": [[0.22828948325, 0.22589282975], 0, 3.4167182445526123, 1578494569.8591971], "v": 0.1}
{"i": ["cuda", "schedule_conv3d_nchw_cuda", [[1, 1, 64, 128, 128], [24, 1, 64, 64, 64], 1, [0, 2, 2], [1, 2, 2], 1], {}, ["schedule_conv3d_nchw_cuda", [1, 1, 64, 128, 128], [24, 1, 64, 64, 64], 1, [0, 2, 2], [1, 2, 2], 1], {"i": 9056342, "t": "", "c": null, "e": [["tile_n", "sp", [-1, 1, 1, 1]], ["tile_f", "sp", [-1, 1, 6, 1]], ["tile_d", "sp", [-1, 1, 1, 1]], ["tile_y", "sp", [-1, 1, 2, 1]], ["tile_x", "sp", [-1, 6, 1, 1]], ["tile_rc", "sp", [-1, 1]], ["tile_rd", "sp", [-1, 2]], ["tile_ry", "sp", [-1, 1]], ["tile_rx", "sp", [-1, 4]], ["auto_unroll_max_step", "ot", 512], ["unroll_explicit", "ot", 0], ["fuse_yx", "ot", 0]]}], "r": [[0.020525072, 0.02053141925], 0, 1.009842872619629, 1578494584.3553884], "v": 0.1}
{"i": ["cuda", "schedule_conv3d_nchw_cuda", [[1, 1, 64, 128, 128], [24, 1, 64, 64, 64], 1, [0, 2, 2], [1, 2, 2], 1], {}, ["schedule_conv3d_nchw_cuda", [1, 1, 64, 128, 128], [24, 1, 64, 64, 64], 1, [0, 2, 2], [1, 2, 2], 1], {"i": 63230788, "t": "", "c": null, "e": [["tile_n", "sp", [-1, 1, 1, 1]], ["tile_f", "sp", [-1, 2, 1, 6]], ["tile_d", "sp", [-1, 1, 1, 1]], ["tile_y", "sp", [-1, 1, 1, 1]], ["tile_x", "sp", [-1, 2, 3, 1]], ["tile_rc", "sp", [-1, 1]], ["tile_rd", "sp", [-1, 1]], ["tile_ry", "sp", [-1, 1]], ["tile_rx", "sp", [-1, 1]], ["auto_unroll_max_step", "ot", 0], ["unroll_explicit", "ot", 1], ["fuse_yx", "ot", 1]]}], "r": [[0.08055359275, 0.080556113], 0, 1.5150978565216064, 1578494585.6079288], "v": 0.1}
{"i": ["cuda", "schedule_conv3d_nchw_cuda", [[1, 1, 64, 128, 128], [24, 1, 64, 64, 64], 1, [0, 2, 2], [1, 2, 2], 1], {}, ["schedule_conv3d_nchw_cuda", [1, 1, 64, 128, 128], [24, 1, 64, 64, 64], 1, [0, 2, 2], [1, 2, 2], 1], {"i": 22811031, "t": "", "c": null, "e": [["tile_n", "sp", [-1, 1, 1, 1]], ["tile_f", "sp", [-1, 2, 2, 6]], ["tile_d", "sp", [-1, 1, 1, 1]], ["tile_y", "sp", [-1, 2, 1, 1]], ["tile_x", "sp", [-1, 2, 1, 3]], ["tile_rc", "sp", [-1, 1]], ["tile_rd", "sp", [-1, 1]], ["tile_ry", "sp", [-1, 32]], ["tile_rx", "sp", [-1, 2]], ["auto_unroll_max_step", "ot", 0], ["unroll_explicit", "ot", 1], ["fuse_yx", "ot", 0]]}], "r": [[0.23337081075, 0.23439679575], 0, 3.1365158557891846, 1578494598.4938345], "v": 0.1}
{"i": ["cuda", "schedule_conv3d_nchw_cuda", [[1, 1, 64, 128, 128], [24, 1, 64, 64, 64], 1, [0, 2, 2], [1, 2, 2], 1], {}, ["schedule_conv3d_nchw_cuda", [1, 1, 64, 128, 128], [24, 1, 64, 64, 64], 1, [0, 2, 2], [1, 2, 2], 1], {"i": 35462557, "t": "", "c": null, "e": [["tile_n", "sp", [-1, 1, 1, 1]], ["tile_f", "sp", [-1, 2, 1, 12]], ["tile_d", "sp", [-1, 1, 1, 1]], ["tile_y", "sp", [-1, 2, 1, 1]], ["tile_x", "sp", [-1, 1, 1, 2]], ["tile_rc", "sp", [-1, 1]], ["tile_rd", "sp", [-1, 4]], ["tile_ry", "sp", [-1, 4]], ["tile_rx", "sp", [-1, 1]], ["auto_unroll_max_step", "ot", 1500], ["unroll_explicit", "ot", 1], ["fuse_yx", "ot", 0]]}], "r": [[0.17427706775, 0.17427833975], 0, 4.3006980419158936, 1578494605.5501506], "v": 0.1}
{"i": ["cuda", "schedule_conv3d_nchw_cuda", [[1, 1, 64, 128, 128], [24, 1, 64, 64, 64], 1, [0, 2, 2], [1, 2, 2], 1], {}, ["schedule_conv3d_nchw_cuda", [1, 1, 64, 128, 128], [24, 1, 64, 64, 64], 1, [0, 2, 2], [1, 2, 2], 1], {"i": 73856664, "t": "", "c": null, "e": [["tile_n", "sp", [-1, 1, 1, 1]], ["tile_f", "sp", [-1, 4, 6, 1]], ["tile_d", "sp", [-1, 1, 1, 1]], ["tile_y", "sp", [-1, 1, 6, 1]], ["tile_x", "sp", [-1, 1, 2, 1]], ["tile_rc", "sp", [-1, 1]], ["tile_rd", "sp", [-1, 2]], ["tile_ry", "sp", [-1, 16]], ["tile_rx", "sp", [-1, 8]], ["auto_unroll_max_step", "ot", 512], ["unroll_explicit", "ot", 1], ["fuse_yx", "ot", 1]]}], "r": [[0.01008832425, 0.010087771], 0, 2.9796972274780273, 1578494606.3930962], "v": 0.1}
{"i": ["cuda", "schedule_conv3d_nchw_cuda", [[1, 1, 64, 128, 128], [24, 1, 64, 64, 64], 1, [0, 2, 2], [1, 2, 2], 1], {}, ["schedule_conv3d_nchw_cuda", [1, 1, 64, 128, 128], [24, 1, 64, 64, 64], 1, [0, 2, 2], [1, 2, 2], 1], {"i": 8202577, "t": "", "c": null, "e": [["tile_n", "sp", [-1, 1, 1, 1]], ["tile_f", "sp", [-1, 8, 3, 1]], ["tile_d", "sp", [-1, 1, 1, 1]], ["tile_y", "sp", [-1, 1, 2, 1]], ["tile_x", "sp", [-1, 1, 6, 1]], ["tile_rc", "sp", [-1, 1]], ["tile_rd", "sp", [-1, 2]], ["tile_ry", "sp", [-1, 2]], ["tile_rx", "sp", [-1, 2]], ["auto_unroll_max_step", "ot", 512], ["unroll_explicit", "ot", 0], ["fuse_yx", "ot", 0]]}], "r": [[0.0359114025, 0.03591844875], 0, 1.4061288833618164, 1578494607.765303], "v": 0.1}
{"i": ["cuda", "schedule_conv3d_nchw_cuda", [[1, 1, 64, 128, 128], [24, 1, 64, 64, 64], 1, [0, 2, 2], [1, 2, 2], 1], {}, ["schedule_conv3d_nchw_cuda", [1, 1, 64, 128, 128], [24, 1, 64, 64, 64], 1, [0, 2, 2], [1, 2, 2], 1], {"i": 5322031, "t": "", "c": null, "e": [["tile_n", "sp", [-1, 1, 1, 1]], ["tile_f", "sp", [-1, 2, 1, 2]], ["tile_d", "sp", [-1, 1, 1, 1]], ["tile_y", "sp", [-1, 2, 1, 3]], ["tile_x", "sp", [-1, 2, 1, 3]], ["tile_rc", "sp", [-1, 1]], ["tile_rd", "sp", [-1, 1]], ["tile_ry", "sp", [-1, 4]], ["tile_rx", "sp", [-1, 32]], ["auto_unroll_max_step", "ot", 0], ["unroll_explicit", "ot", 0], ["fuse_yx", "ot", 0]]}], "r": [[0.26848715075, 0.2649601775], 0, 3.51302433013916, 1578494614.2475157], "v": 0.1}
{"i": ["cuda", "schedule_conv3d_nchw_cuda", [[1, 1, 64, 128, 128], [24, 1, 64, 64, 64], 1, [0, 2, 2], [1, 2, 2], 1], {}, ["schedule_conv3d_nchw_cuda", [1, 1, 64, 128, 128], [24, 1, 64, 64, 64], 1, [0, 2, 2], [1, 2, 2], 1], {"i": 80497089, "t": "", "c": null, "e": [["tile_n", "sp", [-1, 1, 1, 1]], ["tile_f", "sp", [-1, 2, 1, 3]], ["tile_d", "sp", [-1, 1, 1, 1]], ["tile_y", "sp", [-1, 3, 2, 1]], ["tile_x", "sp", [-1, 1, 6, 1]], ["tile_rc", "sp", [-1, 1]], ["tile_rd", "sp", [-1, 8]], ["tile_ry", "sp", [-1, 2]], ["tile_rx", "sp", [-1, 8]], ["auto_unroll_max_step", "ot", 1500], ["unroll_explicit", "ot", 1], ["fuse_yx", "ot", 1]]}], "r": [[0.0457138705, 0.04571184075], 0, 2.590583086013794, 1578494615.6885242], "v": 0.1}
{"i": ["cuda", "schedule_conv3d_nchw_cuda", [[1, 1, 64, 128, 128], [24, 1, 64, 64, 64], 1, [0, 2, 2], [1, 2, 2], 1], {}, ["schedule_conv3d_nchw_cuda", [1, 1, 64, 128, 128], [24, 1, 64, 64, 64], 1, [0, 2, 2], [1, 2, 2], 1], {"i": 11104003, "t": "", "c": null, "e": [["tile_n", "sp", [-1, 1, 1, 1]], ["tile_f", "sp", [-1, 4, 1, 1]], ["tile_d", "sp", [-1, 1, 1, 1]], ["tile_y", "sp", [-1, 1, 1, 1]], ["tile_x", "sp", [-1, 6, 1, 1]], ["tile_rc", "sp", [-1, 1]], ["tile_rd", "sp", [-1, 8]], ["tile_ry", "sp", [-1, 1]], ["tile_rx", "sp", [-1, 16]], ["auto_unroll_max_step", "ot", 512], ["unroll_explicit", "ot", 0], ["fuse_yx", "ot", 0]]}], "r": [[0.2546210785, 0.2562527405], 0, 4.409156084060669, 1578494618.9064853], "v": 0.1}
{"i": ["cuda", "schedule_conv3d_nchw_cuda", [[1, 1, 64, 128, 128], [24, 1, 64, 64, 64], 1, [0, 2, 2], [1, 2, 2], 1], {}, ["schedule_conv3d_nchw_cuda", [1, 1, 64, 128, 128], [24, 1, 64, 64, 64], 1, [0, 2, 2], [1, 2, 2], 1], {"i": 44590448, "t": "", "c": null, "e": [["tile_n", "sp", [-1, 1, 1, 1]], ["tile_f", "sp", [-1, 1, 1, 3]], ["tile_d", "sp", [-1, 1, 1, 1]], ["tile_y", "sp", [-1, 1, 2, 1]], ["tile_x", "sp", [-1, 1, 2, 1]], ["tile_rc", "sp", [-1, 1]], ["tile_rd", "sp", [-1, 1]], ["tile_ry", "sp", [-1, 8]], ["tile_rx", "sp", [-1, 4]], ["auto_unroll_max_step", "ot", 0], ["unroll_explicit", "ot", 0], ["fuse_yx", "ot", 1]]}], "r": [[0.03424763325, 0.03424916525], 0, 1.2874767780303955, 1578494619.8547022], "v": 0.1}
{"i": ["cuda", "schedule_conv3d_nchw_cuda", [[1, 1, 64, 128, 128], [24, 1, 64, 64, 64], 1, [0, 2, 2], [1, 2, 2], 1], {}, ["schedule_conv3d_nchw_cuda", [1, 1, 64, 128, 128], [24, 1, 64, 64, 64], 1, [0, 2, 2], [1, 2, 2], 1], {"i": 65430347, "t": "", "c": null, "e": [["tile_n", "sp", [-1, 1, 1, 1]], ["tile_f", "sp", [-1, 1, 12, 1]], ["tile_d", "sp", [-1, 1, 1, 1]], ["tile_y", "sp", [-1, 2, 3, 1]], ["tile_x", "sp", [-1, 2, 1, 3]], ["tile_rc", "sp", [-1, 1]], ["tile_rd", "sp", [-1, 4]], ["tile_ry", "sp", [-1, 2]], ["tile_rx", "sp", [-1, 4]], ["auto_unroll_max_step", "ot", 0], ["unroll_explicit", "ot", 1], ["fuse_yx", "ot", 1]]}], "r": [[0.0343431955, 0.0343440355], 0, 1.1695098876953125, 1578494625.3226433], "v": 0.1}
{"i": ["cuda", "schedule_conv3d_nchw_cuda", [[1, 1, 64, 128, 128], [24, 1, 64, 64, 64], 1, [0, 2, 2], [1, 2, 2], 1], {}, ["schedule_conv3d_nchw_cuda", [1, 1, 64, 128, 128], [24, 1, 64, 64, 64], 1, [0, 2, 2], [1, 2, 2], 1], {"i": 25130620, "t": "", "c": null, "e": [["tile_n", "sp", [-1, 1, 1, 1]], ["tile_f", "sp", [-1, 3, 1, 4]], ["tile_d", "sp", [-1, 1, 1, 1]], ["tile_y", "sp", [-1, 1, 2, 1]], ["tile_x", "sp", [-1, 2, 1, 1]], ["tile_rc", "sp", [-1, 1]], ["tile_rd", "sp", [-1, 4]], ["tile_ry", "sp", [-1, 1]], ["tile_rx", "sp", [-1, 16]], ["auto_unroll_max_step", "ot", 0], ["unroll_explicit", "ot", 1], ["fuse_yx", "ot", 0]]}], "r": [[0.08390269025, 0.0839022575], 0, 1.657067060470581, 1578494626.6924489], "v": 0.1}
{"i": ["cuda", "schedule_conv3d_nchw_cuda", [[1, 1, 64, 128, 128], [24, 1, 64, 64, 64], 1, [0, 2, 2], [1, 2, 2], 1], {}, ["schedule_conv3d_nchw_cuda", [1, 1, 64, 128, 128], [24, 1, 64, 64, 64], 1, [0, 2, 2], [1, 2, 2], 1], {"i": 64694745, "t": "", "c": null, "e": [["tile_n", "sp", [-1, 1, 1, 1]], ["tile_f", "sp", [-1, 1, 8, 1]], ["tile_d", "sp", [-1, 1, 1, 1]], ["tile_y", "sp", [-1, 1, 1, 3]], ["tile_x", "sp", [-1, 1, 2, 3]], ["tile_rc", "sp", [-1, 1]], ["tile_rd", "sp", [-1, 2]], ["tile_ry", "sp", [-1, 8]], ["tile_rx", "sp", [-1, 2]], ["auto_unroll_max_step", "ot", 0], ["unroll_explicit", "ot", 1], ["fuse_yx", "ot", 1]]}], "r": [[0.0472780605, 0.047305918], 0, 1.3106069564819336, 1578494632.0520585], "v": 0.1}
{"i": ["cuda", "schedule_conv3d_nchw_cuda", [[1, 1, 64, 128, 128], [24, 1, 64, 64, 64], 1, [0, 2, 2], [1, 2, 2], 1], {}, ["schedule_conv3d_nchw_cuda", [1, 1, 64, 128, 128], [24, 1, 64, 64, 64], 1, [0, 2, 2], [1, 2, 2], 1], {"i": 51618776, "t": "", "c": null, "e": [["tile_n", "sp", [-1, 1, 1, 1]], ["tile_f", "sp", [-1, 2, 4, 3]], ["tile_d", "sp", [-1, 1, 1, 1]], ["tile_y", "sp", [-1, 3, 1, 1]], ["tile_x", "sp", [-1, 2, 3, 1]], ["tile_rc", "sp", [-1, 1]], ["tile_rd", "sp", [-1, 1]], ["tile_ry", "sp", [-1, 8]], ["tile_rx", "sp", [-1, 4]], ["auto_unroll_max_step", "ot", 512], ["unroll_explicit", "ot", 0], ["fuse_yx", "ot", 1]]}], "r": [[0.04283801775, 0.04249092475], 0, 1.5160095691680908, 1578494638.6210804], "v": 0.1}
{"i": ["cuda", "schedule_conv3d_nchw_cuda", [[1, 1, 64, 128, 128], [24, 1, 64, 64, 64], 1, [0, 2, 2], [1, 2, 2], 1], {}, ["schedule_conv3d_nchw_cuda", [1, 1, 64, 128, 128], [24, 1, 64, 64, 64], 1, [0, 2, 2], [1, 2, 2], 1], {"i": 61655296, "t": "", "c": null, "e": [["tile_n", "sp", [-1, 1, 1, 1]], ["tile_f", "sp", [-1, 4, 3, 1]], ["tile_d", "sp", [-1, 1, 1, 1]], ["tile_y", "sp", [-1, 6, 1, 1]], ["tile_x", "sp", [-1, 1, 6, 1]], ["tile_rc", "sp", [-1, 1]], ["tile_rd", "sp", [-1, 1]], ["tile_ry", "sp", [-1, 8]], ["tile_rx", "sp", [-1, 32]], ["auto_unroll_max_step", "ot", 1500], ["unroll_explicit", "ot", 0], ["fuse_yx", "ot", 1]]}], "r": [[0.13169973225, 0.1316963425], 0, 4.205535411834717, 1578494651.334835], "v": 0.1}
{"i": ["cuda", "schedule_conv3d_nchw_cuda", [[1, 1, 64, 128, 128], [24, 1, 64, 64, 64], 1, [0, 2, 2], [1, 2, 2], 1], {}, ["schedule_conv3d_nchw_cuda", [1, 1, 64, 128, 128], [24, 1, 64, 64, 64], 1, [0, 2, 2], [1, 2, 2], 1], {"i": 66385294, "t": "", "c": null, "e": [["tile_n", "sp", [-1, 1, 1, 1]], ["tile_f", "sp", [-1, 1, 3, 1]], ["tile_d", "sp", [-1, 1, 1, 1]], ["tile_y", "sp", [-1, 1, 6, 1]], ["tile_x", "sp", [-1, 2, 3, 1]], ["tile_rc", "sp", [-1, 1]], ["tile_rd", "sp", [-1, 1]], ["tile_ry", "sp", [-1, 2]], ["tile_rx", "sp", [-1, 8]], ["auto_unroll_max_step", "ot", 0], ["unroll_explicit", "ot", 1], ["fuse_yx", "ot", 1]]}], "r": [[0.02073423375, 0.019333683], 0, 1.2251880168914795, 1578494889.6327066], "v": 0.1}
{"i": ["cuda", "schedule_conv3d_nchw_cuda", [[1, 1, 64, 128, 128], [24, 1, 64, 64, 64], 1, [0, 2, 2], [1, 2, 2], 1], {}, ["schedule_conv3d_nchw_cuda", [1, 1, 64, 128, 128], [24, 1, 64, 64, 64], 1, [0, 2, 2], [1, 2, 2], 1], {"i": 45311374, "t": "", "c": null, "e": [["tile_n", "sp", [-1, 1, 1, 1]], ["tile_f", "sp", [-1, 1, 3, 1]], ["tile_d", "sp", [-1, 1, 1, 1]], ["tile_y", "sp", [-1, 1, 6, 1]], ["tile_x", "sp", [-1, 2, 3, 1]], ["tile_rc", "sp", [-1, 1]], ["tile_rd", "sp", [-1, 1]], ["tile_ry", "sp", [-1, 2]], ["tile_rx", "sp", [-1, 8]], ["auto_unroll_max_step", "ot", 0], ["unroll_explicit", "ot", 0], ["fuse_yx", "ot", 1]]}], "r": [[0.01755731475, 0.0169571075], 0, 1.112766981124878, 1578494890.3002884], "v": 0.1}
{"i": ["cuda", "schedule_conv3d_nchw_cuda", [[1, 1, 64, 128, 128], [24, 1, 64, 64, 64], 1, [0, 2, 2], [1, 2, 2], 1], {}, ["schedule_conv3d_nchw_cuda", [1, 1, 64, 128, 128], [24, 1, 64, 64, 64], 1, [0, 2, 2], [1, 2, 2], 1], {"i": 73409934, "t": "", "c": null, "e": [["tile_n", "sp", [-1, 1, 1, 1]], ["tile_f", "sp", [-1, 1, 3, 1]], ["tile_d", "sp", [-1, 1, 1, 1]], ["tile_y", "sp", [-1, 1, 6, 1]], ["tile_x", "sp", [-1, 2, 3, 1]], ["tile_rc", "sp", [-1, 1]], ["tile_rd", "sp", [-1, 1]], ["tile_ry", "sp", [-1, 2]], ["tile_rx", "sp", [-1, 8]], ["auto_unroll_max_step", "ot", 512], ["unroll_explicit", "ot", 1], ["fuse_yx", "ot", 1]]}], "r": [[0.016666791, 0.0166678775], 0, 1.1956267356872559, 1578494891.0887415], "v": 0.1}
{"i": ["cuda", "schedule_conv3d_nchw_cuda", [[1, 1, 64, 128, 128], [24, 1, 64, 64, 64], 1, [0, 2, 2], [1, 2, 2], 1], {}, ["schedule_conv3d_nchw_cuda", [1, 1, 64, 128, 128], [24, 1, 64, 64, 64], 1, [0, 2, 2], [1, 2, 2], 1], {"i": 52336014, "t": "", "c": null, "e": [["tile_n", "sp", [-1, 1, 1, 1]], ["tile_f", "sp", [-1, 1, 3, 1]], ["tile_d", "sp", [-1, 1, 1, 1]], ["tile_y", "sp", [-1, 1, 6, 1]], ["tile_x", "sp", [-1, 2, 3, 1]], ["tile_rc", "sp", [-1, 1]], ["tile_rd", "sp", [-1, 1]], ["tile_ry", "sp", [-1, 2]], ["tile_rx", "sp", [-1, 8]], ["auto_unroll_max_step", "ot", 512], ["unroll_explicit", "ot", 0], ["fuse_yx", "ot", 1]]}], "r": [[0.016962027, 0.0169606615], 0, 1.091482162475586, 1578494891.7493455], "v": 0.1}
{"i": ["cuda", "schedule_conv3d_nchw_cuda", [[1, 1, 64, 128, 128], [24, 1, 64, 64, 64], 1, [0, 2, 2], [1, 2, 2], 1], {}, ["schedule_conv3d_nchw_cuda", [1, 1, 64, 128, 128], [24, 1, 64, 64, 64], 1, [0, 2, 2], [1, 2, 2], 1], {"i": 80434574, "t": "", "c": null, "e": [["tile_n", "sp", [-1, 1, 1, 1]], ["tile_f", "sp", [-1, 1, 3, 1]], ["tile_d", "sp", [-1, 1, 1, 1]], ["tile_y", "sp", [-1, 1, 6, 1]], ["tile_x", "sp", [-1, 2, 3, 1]], ["tile_rc", "sp", [-1, 1]], ["tile_rd", "sp", [-1, 1]], ["tile_ry", "sp", [-1, 2]], ["tile_rx", "sp", [-1, 8]], ["auto_unroll_max_step", "ot", 1500], ["unroll_explicit", "ot", 1], ["fuse_yx", "ot", 1]]}], "r": [[0.01204233875, 0.01204209825], 0, 2.5678887367248535, 1578494892.7102103], "v": 0.1}
{"i": ["cuda", "schedule_conv3d_nchw_cuda", [[1, 1, 64, 128, 128], [24, 1, 64, 64, 64], 1, [0, 2, 2], [1, 2, 2], 1], {}, ["schedule_conv3d_nchw_cuda", [1, 1, 64, 128, 128], [24, 1, 64, 64, 64], 1, [0, 2, 2], [1, 2, 2], 1], {"i": 59360654, "t": "", "c": null, "e": [["tile_n", "sp", [-1, 1, 1, 1]], ["tile_f", "sp", [-1, 1, 3, 1]], ["tile_d", "sp", [-1, 1, 1, 1]], ["tile_y", "sp", [-1, 1, 6, 1]], ["tile_x", "sp", [-1, 2, 3, 1]], ["tile_rc", "sp", [-1, 1]], ["tile_rd", "sp", [-1, 1]], ["tile_ry", "sp", [-1, 2]], ["tile_rx", "sp", [-1, 8]], ["auto_unroll_max_step", "ot", 1500], ["unroll_explicit", "ot", 0], ["fuse_yx", "ot", 1]]}], "r": [[0.01807710525, 0.01808214075], 0, 2.0222909450531006, 1578494893.7921238], "v": 0.1}
{"i": ["cuda", "schedule_conv3d_nchw_cuda", [[1, 1, 64, 128, 128], [24, 1, 64, 64, 64], 1, [0, 2, 2], [1, 2, 2], 1], {}, ["schedule_conv3d_nchw_cuda", [1, 1, 64, 128, 128], [24, 1, 64, 64, 64], 1, [0, 2, 2], [1, 2, 2], 1], {"i": 45312334, "t": "", "c": null, "e": [["tile_n", "sp", [-1, 1, 1, 1]], ["tile_f", "sp", [-1, 1, 3, 1]], ["tile_d", "sp", [-1, 1, 1, 1]], ["tile_y", "sp", [-1, 1, 2, 1]], ["tile_x", "sp", [-1, 1, 6, 1]], ["tile_rc", "sp", [-1, 1]], ["tile_rd", "sp", [-1, 1]], ["tile_ry", "sp", [-1, 2]], ["tile_rx", "sp", [-1, 8]], ["auto_unroll_max_step", "ot", 0], ["unroll_explicit", "ot", 0], ["fuse_yx", "ot", 1]]}], "r": [[0.016607349, 0.016604541], 0, 1.2234930992126465, 1578494894.5880048], "v": 0.1}
{"i": ["cuda", "schedule_conv3d_nchw_cuda", [[1, 1, 64, 128, 128], [24, 1, 64, 64, 64], 1, [0, 2, 2], [1, 2, 2], 1], {}, ["schedule_conv3d_nchw_cuda", [1, 1, 64, 128, 128], [24, 1, 64, 64, 64], 1, [0, 2, 2], [1, 2, 2], 1], {"i": 66386254, "t": "", "c": null, "e": [["tile_n", "sp", [-1, 1, 1, 1]], ["tile_f", "sp", [-1, 1, 3, 1]], ["tile_d", "sp", [-1, 1, 1, 1]], ["tile_y", "sp", [-1, 1, 2, 1]], ["tile_x", "sp", [-1, 1, 6, 1]], ["tile_rc", "sp", [-1, 1]], ["tile_rd", "sp", [-1, 1]], ["tile_ry", "sp", [-1, 2]], ["tile_rx", "sp", [-1, 8]], ["auto_unroll_max_step", "ot", 0], ["unroll_explicit", "ot", 1], ["fuse_yx", "ot", 1]]}], "r": [[0.0165632945, 0.0165642815], 0, 1.0735104084014893, 1578494895.2489588], "v": 0.1}
{"i": ["cuda", "schedule_conv3d_nchw_cuda", [[1, 1, 64, 128, 128], [24, 1, 64, 64, 64], 1, [0, 2, 2], [1, 2, 2], 1], {}, ["schedule_conv3d_nchw_cuda", [1, 1, 64, 128, 128], [24, 1, 64, 64, 64], 1, [0, 2, 2], [1, 2, 2], 1], {"i": 45316494, "t": "", "c": null, "e": [["tile_n", "sp", [-1, 1, 1, 1]], ["tile_f", "sp", [-1, 1, 3, 1]], ["tile_d", "sp", [-1, 1, 1, 1]], ["tile_y", "sp", [-1, 1, 6, 1]], ["tile_x", "sp", [-1, 1, 3, 2]], ["tile_rc", "sp", [-1, 1]], ["tile_rd", "sp", [-1, 1]], ["tile_ry", "sp", [-1, 2]], ["tile_rx", "sp", [-1, 8]], ["auto_unroll_max_step", "ot", 0], ["unroll_explicit", "ot", 0], ["fuse_yx", "ot", 1]]}], "r": [[0.01613388825, 0.01613026525], 0, 1.2431316375732422, 1578494896.041897], "v": 0.1}
{"i": ["cuda", "schedule_conv3d_nchw_cuda", [[1, 1, 64, 128, 128], [24, 1, 64, 64, 64], 1, [0, 2, 2], [1, 2, 2], 1], {}, ["schedule_conv3d_nchw_cuda", [1, 1, 64, 128, 128], [24, 1, 64, 64, 64], 1, [0, 2, 2], [1, 2, 2], 1], {"i": 66390414, "t": "", "c": null, "e": [["tile_n", "sp", [-1, 1, 1, 1]], ["tile_f", "sp", [-1, 1, 3, 1]], ["tile_d", "sp", [-1, 1, 1, 1]], ["tile_y", "sp", [-1, 1, 6, 1]], ["tile_x", "sp", [-1, 1, 3, 2]], ["tile_rc", "sp", [-1, 1]], ["tile_rd", "sp", [-1, 1]], ["tile_ry", "sp", [-1, 2]], ["tile_rx", "sp", [-1, 8]], ["auto_unroll_max_step", "ot", 0], ["unroll_explicit", "ot", 1], ["fuse_yx", "ot", 1]]}], "r": [[0.01609525925, 0.01609666175], 0, 1.0451889038085938, 1578494896.6778293], "v": 0.1}
{"i": ["cuda", "schedule_conv3d_nchw_cuda", [[1, 1, 64, 128, 128], [24, 1, 64, 64, 64], 1, [0, 2, 2], [1, 2, 2], 1], {}, ["schedule_conv3d_nchw_cuda", [1, 1, 64, 128, 128], [24, 1, 64, 64, 64], 1, [0, 2, 2], [1, 2, 2], 1], {"i": 67390094, "t": "", "c": null, "e": [["tile_n", "sp", [-1, 1, 1, 1]], ["tile_f", "sp", [-1, 1, 3, 1]], ["tile_d", "sp", [-1, 1, 1, 1]], ["tile_y", "sp", [-1, 1, 6, 1]], ["tile_x", "sp", [-1, 1, 6, 1]], ["tile_rc", "sp", [-1, 1]], ["tile_rd", "sp", [-1, 1]], ["tile_ry", "sp", [-1, 2]], ["tile_rx", "sp", [-1, 16]], ["auto_unroll_max_step", "ot", 0], ["unroll_explicit", "ot", 1], ["fuse_yx", "ot", 1]]}], "r": [[0.00902487525, 0.0090274225], 0, 1.155174732208252, 1578494897.419585], "v": 0.1}
{"i": ["cuda", "schedule_conv3d_nchw_cuda", [[1, 1, 64, 128, 128], [24, 1, 64, 64, 64], 1, [0, 2, 2], [1, 2, 2], 1], {}, ["schedule_conv3d_nchw_cuda", [1, 1, 64, 128, 128], [24, 1, 64, 64, 64], 1, [0, 2, 2], [1, 2, 2], 1], {"i": 46316174, "t": "", "c": null, "e": [["tile_n", "sp", [-1, 1, 1, 1]], ["tile_f", "sp", [-1, 1, 3, 1]], ["tile_d", "sp", [-1, 1, 1, 1]], ["tile_y", "sp", [-1, 1, 6, 1]], ["tile_x", "sp", [-1, 1, 6, 1]], ["tile_rc", "sp", [-1, 1]], ["tile_rd", "sp", [-1, 1]], ["tile_ry", "sp", [-1, 2]], ["tile_rx", "sp", [-1, 16]], ["auto_unroll_max_step", "ot", 0], ["unroll_explicit", "ot", 0], ["fuse_yx", "ot", 1]]}], "r": [[0.009019212, 0.009018342], 0, 0.9660854339599609, 1578494898.0024421], "v": 0.1}
{"i": ["cuda", "schedule_conv3d_nchw_cuda", [[1, 1, 64, 128, 128], [24, 1, 64, 64, 64], 1, [0, 2, 2], [1, 2, 2], 1], {}, ["schedule_conv3d_nchw_cuda", [1, 1, 64, 128, 128], [24, 1, 64, 64, 64], 1, [0, 2, 2], [1, 2, 2], 1], {"i": 65546894, "t": "", "c": null, "e": [["tile_n", "sp", [-1, 1, 1, 1]], ["tile_f", "sp", [-1, 1, 3, 1]], ["tile_d", "sp", [-1, 1, 1, 1]], ["tile_y", "sp", [-1, 1, 6, 1]], ["tile_x", "sp", [-1, 1, 6, 1]], ["tile_rc", "sp", [-1, 1]], ["tile_rd", "sp", [-1, 2]], ["tile_ry", "sp", [-1, 4]], ["tile_rx", "sp", [-1, 4]], ["auto_unroll_max_step", "ot", 0], ["unroll_explicit", "ot", 1], ["fuse_yx", "ot", 1]]}], "r": [[0.01064906625, 0.01065140825], 0, 1.006641149520874, 1578494899.908438], "v": 0.1}
{"i": ["cuda", "schedule_conv3d_nchw_cuda", [[1, 1, 64, 128, 128], [24, 1, 64, 64, 64], 1, [0, 2, 2], [1, 2, 2], 1], {}, ["schedule_conv3d_nchw_cuda", [1, 1, 64, 128, 128], [24, 1, 64, 64, 64], 1, [0, 2, 2], [1, 2, 2], 1], {"i": 44472974, "t": "", "c": null, "e": [["tile_n", "sp", [-1, 1, 1, 1]], ["tile_f", "sp", [-1, 1, 3, 1]], ["tile_d", "sp", [-1, 1, 1, 1]], ["tile_y", "sp", [-1, 1, 6, 1]], ["tile_x", "sp", [-1, 1, 6, 1]], ["tile_rc", "sp", [-1, 1]], ["tile_rd", "sp", [-1, 2]], ["tile_ry", "sp", [-1, 4]], ["tile_rx", "sp", [-1, 4]], ["auto_unroll_max_step", "ot", 0], ["unroll_explicit", "ot", 0], ["fuse_yx", "ot", 1]]}], "r": [[0.01061544325, 0.01061230725], 0, 0.9887113571166992, 1578494900.4932969], "v": 0.1}
{"i": ["cuda", "schedule_conv3d_nchw_cuda", [[1, 1, 64, 128, 128], [24, 1, 64, 64, 64], 1, [0, 2, 2], [1, 2, 2], 1], {}, ["schedule_conv3d_nchw_cuda", [1, 1, 64, 128, 128], [24, 1, 64, 64, 64], 1, [0, 2, 2], [1, 2, 2], 1], {"i": 66386494, "t": "", "c": null, "e": [["tile_n", "sp", [-1, 1, 1, 1]], ["tile_f", "sp", [-1, 1, 3, 1]], ["tile_d", "sp", [-1, 1, 1, 1]], ["tile_y", "sp", [-1, 2, 3, 1]], ["tile_x", "sp", [-1, 1, 6, 1]], ["tile_rc", "sp", [-1, 1]], ["tile_rd", "sp", [-1, 1]], ["tile_ry", "sp", [-1, 2]], ["tile_rx", "sp", [-1, 8]], ["auto_unroll_max_step", "ot", 0], ["unroll_explicit", "ot", 1], ["fuse_yx", "ot", 1]]}], "r": [[0.01674802625, 0.0167461735], 0, 1.1820743083953857, 1578494901.3034108], "v": 0.1}
{"i": ["cuda", "schedule_conv3d_nchw_cuda", [[1, 1, 64, 128, 128], [24, 1, 64, 64, 64], 1, [0, 2, 2], [1, 2, 2], 1], {}, ["schedule_conv3d_nchw_cuda", [1, 1, 64, 128, 128], [24, 1, 64, 64, 64], 1, [0, 2, 2], [1, 2, 2], 1], {"i": 45312574, "t": "", "c": null, "e": [["tile_n", "sp", [-1, 1, 1, 1]], ["tile_f", "sp", [-1, 1, 3, 1]], ["tile_d", "sp", [-1, 1, 1, 1]], ["tile_y", "sp", [-1, 2, 3, 1]], ["tile_x", "sp", [-1, 1, 6, 1]], ["tile_rc", "sp", [-1, 1]], ["tile_rd", "sp", [-1, 1]], ["tile_ry", "sp", [-1, 2]], ["tile_rx", "sp", [-1, 8]], ["auto_unroll_max_step", "ot", 0], ["unroll_explicit", "ot", 0], ["fuse_yx", "ot", 1]]}], "r": [[0.01660815775, 0.016607115], 0, 1.030214786529541, 1578494901.9717178], "v": 0.1}
{"i": ["cuda", "schedule_conv3d_nchw_cuda", [[1, 1, 64, 128, 128], [24, 1, 64, 64, 64], 1, [0, 2, 2], [1, 2, 2], 1], {}, ["schedule_conv3d_nchw_cuda", [1, 1, 64, 128, 128], [24, 1, 64, 64, 64], 1, [0, 2, 2], [1, 2, 2], 1], {"i": 52336974, "t": "", "c": null, "e": [["tile_n", "sp", [-1, 1, 1, 1]], ["tile_f", "sp", [-1, 1, 3, 1]], ["tile_d", "sp", [-1, 1, 1, 1]], ["tile_y", "sp", [-1, 1, 2, 1]], ["tile_x", "sp", [-1, 1, 6, 1]], ["tile_rc", "sp", [-1, 1]], ["tile_rd", "sp", [-1, 1]], ["tile_ry", "sp", [-1, 2]], ["tile_rx", "sp", [-1, 8]], ["auto_unroll_max_step", "ot", 512], ["unroll_explicit", "ot", 0], ["fuse_yx", "ot", 1]]}], "r": [[0.0165612455, 0.016559909], 0, 1.1001191139221191, 1578494902.6373618], "v": 0.1}
{"i": ["cuda", "schedule_conv3d_nchw_cuda", [[1, 1, 64, 128, 128], [24, 1, 64, 64, 64], 1, [0, 2, 2], [1, 2, 2], 1], {}, ["schedule_conv3d_nchw_cuda", [1, 1, 64, 128, 128], [24, 1, 64, 64, 64], 1, [0, 2, 2], [1, 2, 2], 1], {"i": 73410894, "t": "", "c": null, "e": [["tile_n", "sp", [-1, 1, 1, 1]], ["tile_f", "sp", [-1, 1, 3, 1]], ["tile_d", "sp", [-1, 1, 1, 1]], ["tile_y", "sp", [-1, 1, 2, 1]], ["tile_x", "sp", [-1, 1, 6, 1]], ["tile_rc", "sp", [-1, 1]], ["tile_rd", "sp", [-1, 1]], ["tile_ry", "sp", [-1, 2]], ["tile_rx", "sp", [-1, 8]], ["auto_unroll_max_step", "ot", 512], ["unroll_explicit", "ot", 1], ["fuse_yx", "ot", 1]]}], "r": [[0.010977035, 0.01097394], 0, 1.1414787769317627, 1578494903.3661213], "v": 0.1}
{"i": ["cuda", "schedule_conv3d_nchw_cuda", [[1, 1, 64, 128, 128], [24, 1, 64, 64, 64], 1, [0, 2, 2], [1, 2, 2], 1], {}, ["schedule_conv3d_nchw_cuda", [1, 1, 64, 128, 128], [24, 1, 64, 64, 64], 1, [0, 2, 2], [1, 2, 2], 1], {"i": 45312414, "t": "", "c": null, "e": [["tile_n", "sp", [-1, 1, 1, 1]], ["tile_f", "sp", [-1, 1, 3, 1]], ["tile_d", "sp", [-1, 1, 1, 1]], ["tile_y", "sp", [-1, 3, 2, 1]], ["tile_x", "sp", [-1, 1, 6, 1]], ["tile_rc", "sp", [-1, 1]], ["tile_rd", "sp", [-1, 1]], ["tile_ry", "sp", [-1, 2]], ["tile_rx", "sp", [-1, 8]], ["auto_unroll_max_step", "ot", 0], ["unroll_explicit", "ot", 0], ["fuse_yx", "ot", 1]]}], "r": [[0.02419045825, 0.0241884885], 0, 1.3921852111816406, 1578494904.2967627], "v": 0.1}
{"i": ["cuda", "schedule_conv3d_nchw_cuda", [[1, 1, 64, 128, 128], [24, 1, 64, 64, 64], 1, [0, 2, 2], [1, 2, 2], 1], {}, ["schedule_conv3d_nchw_cuda", [1, 1, 64, 128, 128], [24, 1, 64, 64, 64], 1, [0, 2, 2], [1, 2, 2], 1], {"i": 66386334, "t": "", "c": null, "e": [["tile_n", "sp", [-1, 1, 1, 1]], ["tile_f", "sp", [-1, 1, 3, 1]], ["tile_d", "sp", [-1, 1, 1, 1]], ["tile_y", "sp", [-1, 3, 2, 1]], ["tile_x", "sp", [-1, 1, 6, 1]], ["tile_rc", "sp", [-1, 1]], ["tile_rd", "sp", [-1, 1]], ["tile_ry", "sp", [-1, 2]], ["tile_rx", "sp", [-1, 8]], ["auto_unroll_max_step", "ot", 0], ["unroll_explicit", "ot", 1], ["fuse_yx", "ot", 1]]}], "r": [[0.02428414925, 0.02428119], 0, 1.1629233360290527, 1578494905.0316615], "v": 0.1}
{"i": ["cuda", "schedule_conv3d_nchw_cuda", [[1, 1, 64, 128, 128], [24, 1, 64, 64, 64], 1, [0, 2, 2], [1, 2, 2], 1], {}, ["schedule_conv3d_nchw_cuda", [1, 1, 64, 128, 128], [24, 1, 64, 64, 64], 1, [0, 2, 2], [1, 2, 2], 1], {"i": 66407054, "t": "", "c": null, "e": [["tile_n", "sp", [-1, 1, 1, 1]], ["tile_f", "sp", [-1, 1, 3, 1]], ["tile_d", "sp", [-1, 1, 1, 1]], ["tile_y", "sp", [-1, 1, 6, 1]], ["tile_x", "sp", [-1, 1, 6, 1]], ["tile_rc", "sp", [-1, 1]], ["tile_rd", "sp", [-1, 2]], ["tile_ry", "sp", [-1, 2]], ["tile_rx", "sp", [-1, 8]], ["auto_unroll_max_step", "ot", 0], ["unroll_explicit", "ot", 1], ["fuse_yx", "ot", 1]]}], "r": [[0.00902288625, 0.00902438], 0, 1.194272756576538, 1578494905.7729568], "v": 0.1}
{"i": ["cuda", "schedule_conv3d_nchw_cuda", [[1, 1, 64, 128, 128], [24, 1, 64, 64, 64], 1, [0, 2, 2], [1, 2, 2], 1], {}, ["schedule_conv3d_nchw_cuda", [1, 1, 64, 128, 128], [24, 1, 64, 64, 64], 1, [0, 2, 2], [1, 2, 2], 1], {"i": 45333134, "t": "", "c": null, "e": [["tile_n", "sp", [-1, 1, 1, 1]], ["tile_f", "sp", [-1, 1, 3, 1]], ["tile_d", "sp", [-1, 1, 1, 1]], ["tile_y", "sp", [-1, 1, 6, 1]], ["tile_x", "sp", [-1, 1, 6, 1]], ["tile_rc", "sp", [-1, 1]], ["tile_rd", "sp", [-1, 2]], ["tile_ry", "sp", [-1, 2]], ["tile_rx", "sp", [-1, 8]], ["auto_unroll_max_step", "ot", 0], ["unroll_explicit", "ot", 0], ["fuse_yx", "ot", 1]]}], "r": [[0.0090495055, 0.0090212525], 0, 0.9935719966888428, 1578494906.3600879], "v": 0.1}
{"i": ["cuda", "schedule_conv3d_nchw_cuda", [[1, 1, 64, 128, 128], [24, 1, 64, 64, 64], 1, [0, 2, 2], [1, 2, 2], 1], {}, ["schedule_conv3d_nchw_cuda", [1, 1, 64, 128, 128], [24, 1, 64, 64, 64], 1, [0, 2, 2], [1, 2, 2], 1], {"i": 45311396, "t": "", "c": null, "e": [["tile_n", "sp", [-1, 1, 1, 1]], ["tile_f", "sp", [-1, 1, 2, 2]], ["tile_d", "sp", [-1, 1, 1, 1]], ["tile_y", "sp", [-1, 1, 6, 1]], ["tile_x", "sp", [-1, 2, 3, 1]], ["tile_rc", "sp", [-1, 1]], ["tile_rd", "sp", [-1, 1]], ["tile_ry", "sp", [-1, 2]], ["tile_rx", "sp", [-1, 8]], ["auto_unroll_max_step", "ot", 0], ["unroll_explicit", "ot", 0], ["fuse_yx", "ot", 1]]}], "r": [[0.02758851575, 0.0275907715], 0, 1.3991544246673584, 1578494907.3685517], "v": 0.1}
{"i": ["cuda", "schedule_conv3d_nchw_cuda", [[1, 1, 64, 128, 128], [24, 1, 64, 64, 64], 1, [0, 2, 2], [1, 2, 2], 1], {}, ["schedule_conv3d_nchw_cuda", [1, 1, 64, 128, 128], [24, 1, 64, 64, 64], 1, [0, 2, 2], [1, 2, 2], 1], {"i": 73415054, "t": "", "c": null, "e": [["tile_n", "sp", [-1, 1, 1, 1]], ["tile_f", "sp", [-1, 1, 3, 1]], ["tile_d", "sp", [-1, 1, 1, 1]], ["tile_y", "sp", [-1, 1, 6, 1]], ["tile_x", "sp", [-1, 1, 3, 2]], ["tile_rc", "sp", [-1, 1]], ["tile_rd", "sp", [-1, 1]], ["tile_ry", "sp", [-1, 2]], ["tile_rx", "sp", [-1, 8]], ["auto_unroll_max_step", "ot", 512], ["unroll_explicit", "ot", 1], ["fuse_yx", "ot", 1]]}], "r": [[0.01642997525, 0.0164305925], 0, 1.1672520637512207, 1578494908.1560059], "v": 0.1}
{"i": ["cuda", "schedule_conv3d_nchw_cuda", [[1, 1, 64, 128, 128], [24, 1, 64, 64, 64], 1, [0, 2, 2], [1, 2, 2], 1], {}, ["schedule_conv3d_nchw_cuda", [1, 1, 64, 128, 128], [24, 1, 64, 64, 64], 1, [0, 2, 2], [1, 2, 2], 1], {"i": 52341134, "t": "", "c": null, "e": [["tile_n", "sp", [-1, 1, 1, 1]], ["tile_f", "sp", [-1, 1, 3, 1]], ["tile_d", "sp", [-1, 1, 1, 1]], ["tile_y", "sp", [-1, 1, 6, 1]], ["tile_x", "sp", [-1, 1, 3, 2]], ["tile_rc", "sp", [-1, 1]], ["tile_rd", "sp", [-1, 1]], ["tile_ry", "sp", [-1, 2]], ["tile_rx", "sp", [-1, 8]], ["auto_unroll_max_step", "ot", 512], ["unroll_explicit", "ot", 0], ["fuse_yx", "ot", 1]]}], "r": [[0.01547999025, 0.015478597], 0, 1.1964130401611328, 1578494910.1584847], "v": 0.1}
{"i": ["cuda", "schedule_conv3d_nchw_cuda", [[1, 1, 64, 128, 128], [24, 1, 64, 64, 64], 1, [0, 2, 2], [1, 2, 2], 1], {}, ["schedule_conv3d_nchw_cuda", [1, 1, 64, 128, 128], [24, 1, 64, 64, 64], 1, [0, 2, 2], [1, 2, 2], 1], {"i": 66394254, "t": "", "c": null, "e": [["tile_n", "sp", [-1, 1, 1, 1]], ["tile_f", "sp", [-1, 1, 3, 1]], ["tile_d", "sp", [-1, 1, 1, 1]], ["tile_y", "sp", [-1, 1, 6, 1]], ["tile_x", "sp", [-1, 1, 2, 3]], ["tile_rc", "sp", [-1, 1]], ["tile_rd", "sp", [-1, 1]], ["tile_ry", "sp", [-1, 2]], ["tile_rx", "sp", [-1, 8]], ["auto_unroll_max_step", "ot", 0], ["unroll_explicit", "ot", 1], ["fuse_yx", "ot", 1]]}], "r": [[0.0234808475, 0.02347859625], 0, 1.3784654140472412, 1578494911.0941603], "v": 0.1}
{"i": ["cuda", "schedule_conv3d_nchw_cuda", [[1, 1, 64, 128, 128], [24, 1, 64, 64, 64], 1, [0, 2, 2], [1, 2, 2], 1], {}, ["schedule_conv3d_nchw_cuda", [1, 1, 64, 128, 128], [24, 1, 64, 64, 64], 1, [0, 2, 2], [1, 2, 2], 1], {"i": 53340814, "t": "", "c": null, "e": [["tile_n", "sp", [-1, 1, 1, 1]], ["tile_f", "sp", [-1, 1, 3, 1]], ["tile_d", "sp", [-1, 1, 1, 1]], ["tile_y", "sp", [-1, 1, 6, 1]], ["tile_x", "sp", [-1, 1, 6, 1]], ["tile_rc", "sp", [-1, 1]], ["tile_rd", "sp", [-1, 1]], ["tile_ry", "sp", [-1, 2]], ["tile_rx", "sp", [-1, 16]], ["auto_unroll_max_step", "ot", 512], ["unroll_explicit", "ot", 0], ["fuse_yx", "ot", 1]]}], "r": [[0.0090207655, 0.00901956275], 0, 1.0305449962615967, 1578494911.682382], "v": 0.1}
{"i": ["cuda", "schedule_conv3d_nchw_cuda", [[1, 1, 64, 128, 128], [24, 1, 64, 64, 64], 1, [0, 2, 2], [1, 2, 2], 1], {}, ["schedule_conv3d_nchw_cuda", [1, 1, 64, 128, 128], [24, 1, 64, 64, 64], 1, [0, 2, 2], [1, 2, 2], 1], {"i": 74414734, "t": "", "c": null, "e": [["tile_n", "sp", [-1, 1, 1, 1]], ["tile_f", "sp", [-1, 1, 3, 1]], ["tile_d", "sp", [-1, 1, 1, 1]], ["tile_y", "sp", [-1, 1, 6, 1]], ["tile_x", "sp", [-1, 1, 6, 1]], ["tile_rc", "sp", [-1, 1]], ["tile_rd", "sp", [-1, 1]], ["tile_ry", "sp", [-1, 2]], ["tile_rx", "sp", [-1, 16]], ["auto_unroll_max_step", "ot", 512], ["unroll_explicit", "ot", 1], ["fuse_yx", "ot", 1]]}], "r": [[0.00909879, 0.009099707], 0, 1.1778669357299805, 1578494912.4051425], "v": 0.1}
{"i": ["cuda", "schedule_conv3d_nchw_cuda", [[1, 1, 64, 128, 128], [24, 1, 64, 64, 64], 1, [0, 2, 2], [1, 2, 2], 1], {}, ["schedule_conv3d_nchw_cuda", [1, 1, 64, 128, 128], [24, 1, 64, 64, 64], 1, [0, 2, 2], [1, 2, 2], 1], {"i": 46314894, "t": "", "c": null, "e": [["tile_n", "sp", [-1, 1, 1, 1]], ["tile_f", "sp", [-1, 1, 3, 1]], ["tile_d", "sp", [-1, 1, 1, 1]], ["tile_y", "sp", [-1, 1, 6, 1]], ["tile_x", "sp", [-1, 2, 3, 1]], ["tile_rc", "sp", [-1, 1]], ["tile_rd", "sp", [-1, 1]], ["tile_ry", "sp", [-1, 2]], ["tile_rx", "sp", [-1, 16]], ["auto_unroll_max_step", "ot", 0], ["unroll_explicit", "ot", 0], ["fuse_yx", "ot", 1]]}], "r": [[0.0172543565, 0.017253226], 0, 1.3831632137298584, 1578494913.3422377], "v": 0.1}
{"i": ["cuda", "schedule_conv3d_nchw_cuda", [[1, 1, 64, 128, 128], [24, 1, 64, 64, 64], 1, [0, 2, 2], [1, 2, 2], 1], {}, ["schedule_conv3d_nchw_cuda", [1, 1, 64, 128, 128], [24, 1, 64, 64, 64], 1, [0, 2, 2], [1, 2, 2], 1], {"i": 67388814, "t": "", "c": null, "e": [["tile_n", "sp", [-1, 1, 1, 1]], ["tile_f", "sp", [-1, 1, 3, 1]], ["tile_d", "sp", [-1, 1, 1, 1]], ["tile_y", "sp", [-1, 1, 6, 1]], ["tile_x", "sp", [-1, 2, 3, 1]], ["tile_rc", "sp", [-1, 1]], ["tile_rd", "sp", [-1, 1]], ["tile_ry", "sp", [-1, 2]], ["tile_rx", "sp", [-1, 16]], ["auto_unroll_max_step", "ot", 0], ["unroll_explicit", "ot", 1], ["fuse_yx", "ot", 1]]}], "r": [[0.01708850775, 0.01708836], 0, 1.088303804397583, 1578494914.0142424], "v": 0.1}
{"i": ["cuda", "schedule_conv3d_nchw_cuda", [[1, 1, 64, 128, 128], [24, 1, 64, 64, 64], 1, [0, 2, 2], [1, 2, 2], 1], {}, ["schedule_conv3d_nchw_cuda", [1, 1, 64, 128, 128], [24, 1, 64, 64, 64], 1, [0, 2, 2], [1, 2, 2], 1], {"i": 66386248, "t": "", "c": null, "e": [["tile_n", "sp", [-1, 1, 1, 1]], ["tile_f", "sp", [-1, 1, 2, 1]], ["tile_d", "sp", [-1, 1, 1, 1]], ["tile_y", "sp", [-1, 1, 2, 1]], ["tile_x", "sp", [-1, 1, 6, 1]], ["tile_rc", "sp", [-1, 1]], ["tile_rd", "sp", [-1, 1]], ["tile_ry", "sp", [-1, 2]], ["tile_rx", "sp", [-1, 8]], ["auto_unroll_max_step", "ot", 0], ["unroll_explicit", "ot", 1], ["fuse_yx", "ot", 1]]}], "r": [[0.0222859415, 0.0222861305], 0, 1.3446178436279297, 1578494914.9001322], "v": 0.1}
{"i": ["cuda", "schedule_conv3d_nchw_cuda", [[1, 1, 64, 128, 128], [24, 1, 64, 64, 64], 1, [0, 2, 2], [1, 2, 2], 1], {}, ["schedule_conv3d_nchw_cuda", [1, 1, 64, 128, 128], [24, 1, 64, 64, 64], 1, [0, 2, 2], [1, 2, 2], 1], {"i": 45312328, "t": "", "c": null, "e": [["tile_n", "sp", [-1, 1, 1, 1]], ["tile_f", "sp", [-1, 1, 2, 1]], ["tile_d", "sp", [-1, 1, 1, 1]], ["tile_y", "sp", [-1, 1, 2, 1]], ["tile_x", "sp", [-1, 1, 6, 1]], ["tile_rc", "sp", [-1, 1]], ["tile_rd", "sp", [-1, 1]], ["tile_ry", "sp", [-1, 2]], ["tile_rx", "sp", [-1, 8]], ["auto_unroll_max_step", "ot", 0], ["unroll_explicit", "ot", 0], ["fuse_yx", "ot", 1]]}], "r": [[0.022272594, 0.02227209975], 0, 1.205359935760498, 1578494915.6119826], "v": 0.1}
{"i": ["cuda", "schedule_conv3d_nchw_cuda", [[1, 1, 64, 128, 128], [24, 1, 64, 64, 64], 1, [0, 2, 2], [1, 2, 2], 1], {}, ["schedule_conv3d_nchw_cuda", [1, 1, 64, 128, 128], [24, 1, 64, 64, 64], 1, [0, 2, 2], [1, 2, 2], 1], {"i": 67387243, "t": "", "c": null, "e": [["tile_n", "sp", [-1, 1, 1, 1]], ["tile_f", "sp", [-1, 1, 4, 2]], ["tile_d", "sp", [-1, 1, 1, 1]], ["tile_y", "sp", [-1, 1, 2, 1]], ["tile_x", "sp", [-1, 1, 3, 1]], ["tile_rc", "sp", [-1, 1]], ["tile_rd", "sp", [-1, 1]], ["tile_ry", "sp", [-1, 2]], ["tile_rx", "sp", [-1, 16]], ["auto_unroll_max_step", "ot", 0], ["unroll_explicit", "ot", 1], ["fuse_yx", "ot", 1]]}], "r": [[0.02566222225, 0.02566004975], 0, 1.2940237522125244, 1578494916.4425023], "v": 0.1}
{"i": ["cuda", "schedule_conv3d_nchw_cuda", [[1, 1, 64, 128, 128], [24, 1, 64, 64, 64], 1, [0, 2, 2], [1, 2, 2], 1], {}, ["schedule_conv3d_nchw_cuda", [1, 1, 64, 128, 128], [24, 1, 64, 64, 64], 1, [0, 2, 2], [1, 2, 2], 1], {"i": 46313323, "t": "", "c": null, "e": [["tile_n", "sp", [-1, 1, 1, 1]], ["tile_f", "sp", [-1, 1, 4, 2]], ["tile_d", "sp", [-1, 1, 1, 1]], ["tile_y", "sp", [-1, 1, 2, 1]], ["tile_x", "sp", [-1, 1, 3, 1]], ["tile_rc", "sp", [-1, 1]], ["tile_rd", "sp", [-1, 1]], ["tile_ry", "sp", [-1, 2]], ["tile_rx", "sp", [-1, 16]], ["auto_unroll_max_step", "ot", 0], ["unroll_explicit", "ot", 0], ["fuse_yx", "ot", 1]]}], "r": [[0.0256743045, 0.02567540925], 0, 1.1916346549987793, 1578494917.1866744], "v": 0.1}
{"i": ["cuda", "schedule_conv3d_nchw_cuda", [[1, 1, 64, 128, 128], [24, 1, 64, 64, 64], 1, [0, 2, 2], [1, 2, 2], 1], {}, ["schedule_conv3d_nchw_cuda", [1, 1, 64, 128, 128], [24, 1, 64, 64, 64], 1, [0, 2, 2], [1, 2, 2], 1], {"i": 51497614, "t": "", "c": null, "e": [["tile_n", "sp", [-1, 1, 1, 1]], ["tile_f", "sp", [-1, 1, 3, 1]], ["tile_d", "sp", [-1, 1, 1, 1]], ["tile_y", "sp", [-1, 1, 6, 1]], ["tile_x", "sp", [-1, 1, 6, 1]], ["tile_rc", "sp", [-1, 1]], ["tile_rd", "sp", [-1, 2]], ["tile_ry", "sp", [-1, 4]], ["tile_rx", "sp", [-1, 4]], ["auto_unroll_max_step", "ot", 512], ["unroll_explicit", "ot", 0], ["fuse_yx", "ot", 1]]}], "r": [[0.010619595, 0.01061531], 0, 1.0206470489501953, 1578494917.796112], "v": 0.1}
{"i": ["cuda", "schedule_conv3d_nchw_cuda", [[1, 1, 64, 128, 128], [24, 1, 64, 64, 64], 1, [0, 2, 2], [1, 2, 2], 1], {}, ["schedule_conv3d_nchw_cuda", [1, 1, 64, 128, 128], [24, 1, 64, 64, 64], 1, [0, 2, 2], [1, 2, 2], 1], {"i": 45312356, "t": "", "c": null, "e": [["tile_n", "sp", [-1, 1, 1, 1]], ["tile_f", "sp", [-1, 1, 2, 2]], ["tile_d", "sp", [-1, 1, 1, 1]], ["tile_y", "sp", [-1, 1, 2, 1]], ["tile_x", "sp", [-1, 1, 6, 1]], ["tile_rc", "sp", [-1, 1]], ["tile_rd", "sp", [-1, 1]], ["tile_ry", "sp", [-1, 2]], ["tile_rx", "sp", [-1, 8]], ["auto_unroll_max_step", "ot", 0], ["unroll_explicit", "ot", 0], ["fuse_yx", "ot", 1]]}], "r": [[0.0243853785, 0.02438507375], 0, 1.3258960247039795, 1578494918.753392], "v": 0.1}
{"i": ["cuda", "schedule_conv3d_nchw_cuda", [[1, 1, 64, 128, 128], [24, 1, 64, 64, 64], 1, [0, 2, 2], [1, 2, 2], 1], {}, ["schedule_conv3d_nchw_cuda", [1, 1, 64, 128, 128], [24, 1, 64, 64, 64], 1, [0, 2, 2], [1, 2, 2], 1], {"i": 66386276, "t": "", "c": null, "e": [["tile_n", "sp", [-1, 1, 1, 1]], ["tile_f", "sp", [-1, 1, 2, 2]], ["tile_d", "sp", [-1, 1, 1, 1]], ["tile_y", "sp", [-1, 1, 2, 1]], ["tile_x", "sp", [-1, 1, 6, 1]], ["tile_rc", "sp", [-1, 1]], ["tile_rd", "sp", [-1, 1]], ["tile_ry", "sp", [-1, 2]], ["tile_rx", "sp", [-1, 8]], ["auto_unroll_max_step", "ot", 0], ["unroll_explicit", "ot", 1], ["fuse_yx", "ot", 1]]}], "r": [[0.02438858975, 0.02438621075], 0, 1.1690073013305664, 1578494920.6951208], "v": 0.1}
{"i": ["cuda", "schedule_conv3d_nchw_cuda", [[1, 1, 64, 128, 128], [24, 1, 64, 64, 64], 1, [0, 2, 2], [1, 2, 2], 1], {}, ["schedule_conv3d_nchw_cuda", [1, 1, 64, 128, 128], [24, 1, 64, 64, 64], 1, [0, 2, 2], [1, 2, 2], 1], {"i": 67389796, "t": "", "c": null, "e": [["tile_n", "sp", [-1, 1, 1, 1]], ["tile_f", "sp", [-1, 1, 2, 2]], ["tile_d", "sp", [-1, 1, 1, 1]], ["tile_y", "sp", [-1, 1, 2, 1]], ["tile_x", "sp", [-1, 1, 6, 1]], ["tile_rc", "sp", [-1, 1]], ["tile_rd", "sp", [-1, 1]], ["tile_ry", "sp", [-1, 2]], ["tile_rx", "sp", [-1, 16]], ["auto_unroll_max_step", "ot", 0], ["unroll_explicit", "ot", 1], ["fuse_yx", "ot", 1]]}], "r": [[0.0212083505, 0.02120697175], 0, 1.1758646965026855, 1578494921.4362466], "v": 0.1}
{"i": ["cuda", "schedule_conv3d_nchw_cuda", [[1, 1, 64, 128, 128], [24, 1, 64, 64, 64], 1, [0, 2, 2], [1, 2, 2], 1], {}, ["schedule_conv3d_nchw_cuda", [1, 1, 64, 128, 128], [24, 1, 64, 64, 64], 1, [0, 2, 2], [1, 2, 2], 1], {"i": 46315876, "t": "", "c": null, "e": [["tile_n", "sp", [-1, 1, 1, 1]], ["tile_f", "sp", [-1, 1, 2, 2]], ["tile_d", "sp", [-1, 1, 1, 1]], ["tile_y", "sp", [-1, 1, 2, 1]], ["tile_x", "sp", [-1, 1, 6, 1]], ["tile_rc", "sp", [-1, 1]], ["tile_rd", "sp", [-1, 1]], ["tile_ry", "sp", [-1, 2]], ["tile_rx", "sp", [-1, 16]], ["auto_unroll_max_step", "ot", 0], ["unroll_explicit", "ot", 0], ["fuse_yx", "ot", 1]]}], "r": [[0.0212081545, 0.02121005875], 0, 1.1817374229431152, 1578494922.1574476], "v": 0.1}
{"i": ["cuda", "schedule_conv3d_nchw_cuda", [[1, 1, 64, 128, 128], [24, 1, 64, 64, 64], 1, [0, 2, 2], [1, 2, 2], 1], {}, ["schedule_conv3d_nchw_cuda", [1, 1, 64, 128, 128], [24, 1, 64, 64, 64], 1, [0, 2, 2], [1, 2, 2], 1], {"i": 45312494, "t": "", "c": null, "e": [["tile_n", "sp", [-1, 1, 1, 1]], ["tile_f", "sp", [-1, 1, 3, 1]], ["tile_d", "sp", [-1, 1, 1, 1]], ["tile_y", "sp", [-1, 1, 3, 1]], ["tile_x", "sp", [-1, 1, 6, 1]], ["tile_rc", "sp", [-1, 1]], ["tile_rd", "sp", [-1, 1]], ["tile_ry", "sp", [-1, 2]], ["tile_rx", "sp", [-1, 8]], ["auto_unroll_max_step", "ot", 0], ["unroll_explicit", "ot", 0], ["fuse_yx", "ot", 1]]}], "r": [[0.0139910925, 0.013993967], 0, 1.1762042045593262, 1578494922.869598], "v": 0.1}
{"i": ["cuda", "schedule_conv3d_nchw_cuda", [[1, 1, 64, 128, 128], [24, 1, 64, 64, 64], 1, [0, 2, 2], [1, 2, 2], 1], {}, ["schedule_conv3d_nchw_cuda", [1, 1, 64, 128, 128], [24, 1, 64, 64, 64], 1, [0, 2, 2], [1, 2, 2], 1], {"i": 66386414, "t": "", "c": null, "e": [["tile_n", "sp", [-1, 1, 1, 1]], ["tile_f", "sp", [-1, 1, 3, 1]], ["tile_d", "sp", [-1, 1, 1, 1]], ["tile_y", "sp", [-1, 1, 3, 1]], ["tile_x", "sp", [-1, 1, 6, 1]], ["tile_rc", "sp", [-1, 1]], ["tile_rd", "sp", [-1, 1]], ["tile_ry", "sp", [-1, 2]], ["tile_rx", "sp", [-1, 8]], ["auto_unroll_max_step", "ot", 0], ["unroll_explicit", "ot", 1], ["fuse_yx", "ot", 1]]}], "r": [[0.014044018, 0.0140426415], 0, 1.0769155025482178, 1578494923.4878588], "v": 0.1}
{"i": ["cuda", "schedule_conv3d_nchw_cuda", [[1, 1, 64, 128, 128], [24, 1, 64, 64, 64], 1, [0, 2, 2], [1, 2, 2], 1], {}, ["schedule_conv3d_nchw_cuda", [1, 1, 64, 128, 128], [24, 1, 64, 64, 64], 1, [0, 2, 2], [1, 2, 2], 1], {"i": 51353934, "t": "", "c": null, "e": [["tile_n", "sp", [-1, 1, 1, 1]], ["tile_f", "sp", [-1, 1, 3, 1]], ["tile_d", "sp", [-1, 1, 1, 1]], ["tile_y", "sp", [-1, 1, 2, 1]], ["tile_x", "sp", [-1, 1, 6, 1]], ["tile_rc", "sp", [-1, 1]], ["tile_rd", "sp", [-1, 2]], ["tile_ry", "sp", [-1, 2]], ["tile_rx", "sp", [-1, 4]], ["auto_unroll_max_step", "ot", 512], ["unroll_explicit", "ot", 0], ["fuse_yx", "ot", 1]]}], "r": [[0.01616822225, 0.01616631475], 0, 1.2281441688537598, 1578494924.2672176], "v": 0.1}
{"i": ["cuda", "schedule_conv3d_nchw_cuda", [[1, 1, 64, 128, 128], [24, 1, 64, 64, 64], 1, [0, 2, 2], [1, 2, 2], 1], {}, ["schedule_conv3d_nchw_cuda", [1, 1, 64, 128, 128], [24, 1, 64, 64, 64], 1, [0, 2, 2], [1, 2, 2], 1], {"i": 24238528, "t": "", "c": null, "e": [["tile_n", "sp", [-1, 1, 1, 1]], ["tile_f", "sp", [-1, 1, 1, 3]], ["tile_d", "sp", [-1, 1, 1, 1]], ["tile_y", "sp", [-1, 3, 2, 1]], ["tile_x", "sp", [-1, 1, 6, 1]], ["tile_rc", "sp", [-1, 1]], ["tile_rd", "sp", [-1, 1]], ["tile_ry", "sp", [-1, 2]], ["tile_rx", "sp", [-1, 8]], ["auto_unroll_max_step", "ot", 0], ["unroll_explicit", "ot", 1], ["fuse_yx", "ot", 0]]}], "r": [[0.05055559225, 0.05055426075], 0, 1.404714584350586, 1578494925.26726], "v": 0.1}
{"i": ["cuda", "schedule_conv3d_nchw_cuda", [[1, 1, 64, 128, 128], [24, 1, 64, 64, 64], 1, [0, 2, 2], [1, 2, 2], 1], {}, ["schedule_conv3d_nchw_cuda", [1, 1, 64, 128, 128], [24, 1, 64, 64, 64], 1, [0, 2, 2], [1, 2, 2], 1], {"i": 3164608, "t": "", "c": null, "e": [["tile_n", "sp", [-1, 1, 1, 1]], ["tile_f", "sp", [-1, 1, 1, 3]], ["tile_d", "sp", [-1, 1, 1, 1]], ["tile_y", "sp", [-1, 3, 2, 1]], ["tile_x", "sp", [-1, 1, 6, 1]], ["tile_rc", "sp", [-1, 1]], ["tile_rd", "sp", [-1, 1]], ["tile_ry", "sp", [-1, 2]], ["tile_rx", "sp", [-1, 8]], ["auto_unroll_max_step", "ot", 0], ["unroll_explicit", "ot", 0], ["fuse_yx", "ot", 0]]}], "r": [[0.0506116075, 0.0505574515], 0, 1.4216628074645996, 1578494926.2265453], "v": 0.1}
{"i": ["cuda", "schedule_conv3d_nchw_cuda", [[1, 1, 64, 128, 128], [24, 1, 64, 64, 64], 1, [0, 2, 2], [1, 2, 2], 1], {}, ["schedule_conv3d_nchw_cuda", [1, 1, 64, 128, 128], [24, 1, 64, 64, 64], 1, [0, 2, 2], [1, 2, 2], 1], {"i": 66386338, "t": "", "c": null, "e": [["tile_n", "sp", [-1, 1, 1, 1]], ["tile_f", "sp", [-1, 1, 4, 1]], ["tile_d", "sp", [-1, 1, 1, 1]], ["tile_y", "sp", [-1, 3, 2, 1]], ["tile_x", "sp", [-1, 1, 6, 1]], ["tile_rc", "sp", [-1, 1]], ["tile_rd", "sp", [-1, 1]], ["tile_ry", "sp", [-1, 2]], ["tile_rx", "sp", [-1, 8]], ["auto_unroll_max_step", "ot", 0], ["unroll_explicit", "ot", 1], ["fuse_yx", "ot", 1]]}], "r": [[0.01896877075, 0.01896926925], 0, 1.2709908485412598, 1578494927.0674121], "v": 0.1}
{"i": ["cuda", "schedule_conv3d_nchw_cuda", [[1, 1, 64, 128, 128], [24, 1, 64, 64, 64], 1, [0, 2, 2], [1, 2, 2], 1], {}, ["schedule_conv3d_nchw_cuda", [1, 1, 64, 128, 128], [24, 1, 64, 64, 64], 1, [0, 2, 2], [1, 2, 2], 1], {"i": 45312418, "t": "", "c": null, "e": [["tile_n", "sp", [-1, 1, 1, 1]], ["tile_f", "sp", [-1, 1, 4, 1]], ["tile_d", "sp", [-1, 1, 1, 1]], ["tile_y", "sp", [-1, 3, 2, 1]], ["tile_x", "sp", [-1, 1, 6, 1]], ["tile_rc", "sp", [-1, 1]], ["tile_rd", "sp", [-1, 1]], ["tile_ry", "sp", [-1, 2]], ["tile_rx", "sp", [-1, 8]], ["auto_unroll_max_step", "ot", 0], ["unroll_explicit", "ot", 0], ["fuse_yx", "ot", 1]]}], "r": [[0.019101626, 0.01903207725], 0, 1.132497787475586, 1578494927.7504916], "v": 0.1}
{"i": ["cuda", "schedule_conv3d_nchw_cuda", [[1, 1, 64, 128, 128], [24, 1, 64, 64, 64], 1, [0, 2, 2], [1, 2, 2], 1], {}, ["schedule_conv3d_nchw_cuda", [1, 1, 64, 128, 128], [24, 1, 64, 64, 64], 1, [0, 2, 2], [1, 2, 2], 1], {"i": 44344843, "t": "", "c": null, "e": [["tile_n", "sp", [-1, 1, 1, 1]], ["tile_f", "sp", [-1, 1, 4, 2]], ["tile_d", "sp", [-1, 1, 1, 1]], ["tile_y", "sp", [-1, 1, 3, 1]], ["tile_x", "sp", [-1, 1, 2, 1]], ["tile_rc", "sp", [-1, 1]], ["tile_rd", "sp", [-1, 4]], ["tile_ry", "sp", [-1, 2]], ["tile_rx", "sp", [-1, 4]], ["auto_unroll_max_step", "ot", 0], ["unroll_explicit", "ot", 0], ["fuse_yx", "ot", 1]]}], "r": [[0.01091435575, 0.0108536665], 0, 1.1096558570861816, 1578494928.4161735], "v": 0.1}
{"i": ["cuda", "schedule_conv3d_nchw_cuda", [[1, 1, 64, 128, 128], [24, 1, 64, 64, 64], 1, [0, 2, 2], [1, 2, 2], 1], {}, ["schedule_conv3d_nchw_cuda", [1, 1, 64, 128, 128], [24, 1, 64, 64, 64], 1, [0, 2, 2], [1, 2, 2], 1], {"i": 65418763, "t": "", "c": null, "e": [["tile_n", "sp", [-1, 1, 1, 1]], ["tile_f", "sp", [-1, 1, 4, 2]], ["tile_d", "sp", [-1, 1, 1, 1]], ["tile_y", "sp", [-1, 1, 3, 1]], ["tile_x", "sp", [-1, 1, 2, 1]], ["tile_rc", "sp", [-1, 1]], ["tile_rd", "sp", [-1, 4]], ["tile_ry", "sp", [-1, 2]], ["tile_rx", "sp", [-1, 4]], ["auto_unroll_max_step", "ot", 0], ["unroll_explicit", "ot", 1], ["fuse_yx", "ot", 1]]}], "r": [[0.010938724, 0.0109335765], 0, 1.02473783493042, 1578494929.0431736], "v": 0.1}
{"i": ["cuda", "schedule_conv3d_nchw_cuda", [[1, 1, 64, 128, 128], [24, 1, 64, 64, 64], 1, [0, 2, 2], [1, 2, 2], 1], {}, ["schedule_conv3d_nchw_cuda", [1, 1, 64, 128, 128], [24, 1, 64, 64, 64], 1, [0, 2, 2], [1, 2, 2], 1], {"i": 45312654, "t": "", "c": null, "e": [["tile_n", "sp", [-1, 1, 1, 1]], ["tile_f", "sp", [-1, 1, 3, 1]], ["tile_d", "sp", [-1, 1, 1, 1]], ["tile_y", "sp", [-1, 1, 6, 1]], ["tile_x", "sp", [-1, 1, 6, 1]], ["tile_rc", "sp", [-1, 1]], ["tile_rd", "sp", [-1, 1]], ["tile_ry", "sp", [-1, 2]], ["tile_rx", "sp", [-1, 8]], ["auto_unroll_max_step", "ot", 0], ["unroll_explicit", "ot", 0], ["fuse_yx", "ot", 1]]}], "r": [[0.01161416625, 0.0116152355], 0, 1.0809845924377441, 1578494931.0001228], "v": 0.1}
{"i": ["cuda", "schedule_conv3d_nchw_cuda", [[1, 1, 64, 128, 128], [24, 1, 64, 64, 64], 1, [0, 2, 2], [1, 2, 2], 1], {}, ["schedule_conv3d_nchw_cuda", [1, 1, 64, 128, 128], [24, 1, 64, 64, 64], 1, [0, 2, 2], [1, 2, 2], 1], {"i": 66386574, "t": "", "c": null, "e": [["tile_n", "sp", [-1, 1, 1, 1]], ["tile_f", "sp", [-1, 1, 3, 1]], ["tile_d", "sp", [-1, 1, 1, 1]], ["tile_y", "sp", [-1, 1, 6, 1]], ["tile_x", "sp", [-1, 1, 6, 1]], ["tile_rc", "sp", [-1, 1]], ["tile_rd", "sp", [-1, 1]], ["tile_ry", "sp", [-1, 2]], ["tile_rx", "sp", [-1, 8]], ["auto_unroll_max_step", "ot", 0], ["unroll_explicit", "ot", 1], ["fuse_yx", "ot", 1]]}], "r": [[0.01161452725, 0.01161269675], 0, 1.026085615158081, 1578494931.5923564], "v": 0.1}
{"i": ["cuda", "schedule_conv3d_nchw_cuda", [[1, 1, 64, 128, 128], [24, 1, 64, 64, 64], 1, [0, 2, 2], [1, 2, 2], 1], {}, ["schedule_conv3d_nchw_cuda", [1, 1, 64, 128, 128], [24, 1, 64, 64, 64], 1, [0, 2, 2], [1, 2, 2], 1], {"i": 52337214, "t": "", "c": null, "e": [["tile_n", "sp", [-1, 1, 1, 1]], ["tile_f", "sp", [-1, 1, 3, 1]], ["tile_d", "sp", [-1, 1, 1, 1]], ["tile_y", "sp", [-1, 2, 3, 1]], ["tile_x", "sp", [-1, 1, 6, 1]], ["tile_rc", "sp", [-1, 1]], ["tile_rd", "sp", [-1, 1]], ["tile_ry", "sp", [-1, 2]], ["tile_rx", "sp", [-1, 8]], ["auto_unroll_max_step", "ot", 512], ["unroll_explicit", "ot", 0], ["fuse_yx", "ot", 1]]}], "r": [[0.01674954025, 0.01669023575], 0, 1.0860552787780762, 1578494932.2452838], "v": 0.1}
{"i": ["cuda", "schedule_conv3d_nchw_cuda", [[1, 1, 64, 128, 128], [24, 1, 64, 64, 64], 1, [0, 2, 2], [1, 2, 2], 1], {}, ["schedule_conv3d_nchw_cuda", [1, 1, 64, 128, 128], [24, 1, 64, 64, 64], 1, [0, 2, 2], [1, 2, 2], 1], {"i": 73411134, "t": "", "c": null, "e": [["tile_n", "sp", [-1, 1, 1, 1]], ["tile_f", "sp", [-1, 1, 3, 1]], ["tile_d", "sp", [-1, 1, 1, 1]], ["tile_y", "sp", [-1, 2, 3, 1]], ["tile_x", "sp", [-1, 1, 6, 1]], ["tile_rc", "sp", [-1, 1]], ["tile_rd", "sp", [-1, 1]], ["tile_ry", "sp", [-1, 2]], ["tile_rx", "sp", [-1, 8]], ["auto_unroll_max_step", "ot", 512], ["unroll_explicit", "ot", 1], ["fuse_yx", "ot", 1]]}], "r": [[0.0161799715, 0.01617734125], 0, 1.2514517307281494, 1578494933.0384834], "v": 0.1}
{"i": ["cuda", "schedule_conv3d_nchw_cuda", [[1, 1, 64, 128, 128], [24, 1, 64, 64, 64], 1, [0, 2, 2], [1, 2, 2], 1], {}, ["schedule_conv3d_nchw_cuda", [1, 1, 64, 128, 128], [24, 1, 64, 64, 64], 1, [0, 2, 2], [1, 2, 2], 1], {"i": 46315854, "t": "", "c": null, "e": [["tile_n", "sp", [-1, 1, 1, 1]], ["tile_f", "sp", [-1, 1, 3, 1]], ["tile_d", "sp", [-1, 1, 1, 1]], ["tile_y", "sp", [-1, 1, 2, 1]], ["tile_x", "sp", [-1, 1, 6, 1]], ["tile_rc", "sp", [-1, 1]], ["tile_rd", "sp", [-1, 1]], ["tile_ry", "sp", [-1, 2]], ["tile_rx", "sp", [-1, 16]], ["auto_unroll_max_step", "ot", 0], ["unroll_explicit", "ot", 0], ["fuse_yx", "ot", 1]]}], "r": [[0.01809844075, 0.0181001985], 0, 1.683927297592163, 1578494934.2842429], "v": 0.1}
{"i": ["cuda", "schedule_conv3d_nchw_cuda", [[1, 1, 64, 128, 128], [24, 1, 64, 64, 64], 1, [0, 2, 2], [1, 2, 2], 1], {}, ["schedule_conv3d_nchw_cuda", [1, 1, 64, 128, 128], [24, 1, 64, 64, 64], 1, [0, 2, 2], [1, 2, 2], 1], {"i": 67389774, "t": "", "c": null, "e": [["tile_n", "sp", [-1, 1, 1, 1]], ["tile_f", "sp", [-1, 1, 3, 1]], ["tile_d", "sp", [-1, 1, 1, 1]], ["tile_y", "sp", [-1, 1, 2, 1]], ["tile_x", "sp", [-1, 1, 6, 1]], ["tile_rc", "sp", [-1, 1]], ["tile_rd", "sp", [-1, 1]], ["tile_ry", "sp", [-1, 2]], ["tile_rx", "sp", [-1, 16]], ["auto_unroll_max_step", "ot", 0], ["unroll_explicit", "ot", 1], ["fuse_yx", "ot", 1]]}], "r": [[0.01825962825, 0.0181891265], 0, 1.1332719326019287, 1578494934.9676404], "v": 0.1}
{"i": ["cuda", "schedule_conv3d_nchw_cuda", [[1, 1, 64, 128, 128], [24, 1, 64, 64, 64], 1, [0, 2, 2], [1, 2, 2], 1], {}, ["schedule_conv3d_nchw_cuda", [1, 1, 64, 128, 128], [24, 1, 64, 64, 64], 1, [0, 2, 2], [1, 2, 2], 1], {"i": 46311077, "t": "", "c": null, "e": [["tile_n", "sp", [-1, 1, 1, 1]], ["tile_f", "sp", [-1, 2, 2, 2]], ["tile_d", "sp", [-1, 1, 1, 1]], ["tile_y", "sp", [-1, 1, 6, 1]], ["tile_x", "sp", [-1, 1, 2, 1]], ["tile_rc", "sp", [-1, 1]], ["tile_rd", "sp", [-1, 1]], ["tile_ry", "sp", [-1, 2]], ["tile_rx", "sp", [-1, 16]], ["auto_unroll_max_step", "ot", 0], ["unroll_explicit", "ot", 0], ["fuse_yx", "ot", 1]]}], "r": [[0.00665628925, 0.006653567], 0, 1.0834109783172607, 1578494935.5766766], "v": 0.1}
{"i": ["cuda", "schedule_conv3d_nchw_cuda", [[1, 1, 64, 128, 128], [24, 1, 64, 64, 64], 1, [0, 2, 2], [1, 2, 2], 1], {}, ["schedule_conv3d_nchw_cuda", [1, 1, 64, 128, 128], [24, 1, 64, 64, 64], 1, [0, 2, 2], [1, 2, 2], 1], {"i": 67384997, "t": "", "c": null, "e": [["tile_n", "sp", [-1, 1, 1, 1]], ["tile_f", "sp", [-1, 2, 2, 2]], ["tile_d", "sp", [-1, 1, 1, 1]], ["tile_y", "sp", [-1, 1, 6, 1]], ["tile_x", "sp", [-1, 1, 2, 1]], ["tile_rc", "sp", [-1, 1]], ["tile_rd", "sp", [-1, 1]], ["tile_ry", "sp", [-1, 2]], ["tile_rx", "sp", [-1, 16]], ["auto_unroll_max_step", "ot", 0], ["unroll_explicit", "ot", 1], ["fuse_yx", "ot", 1]]}], "r": [[0.00665593475, 0.006658191], 0, 1.0232880115509033, 1578494936.157225], "v": 0.1}
{"i": ["cuda", "schedule_conv3d_nchw_cuda", [[1, 1, 64, 128, 128], [24, 1, 64, 64, 64], 1, [0, 2, 2], [1, 2, 2], 1], {}, ["schedule_conv3d_nchw_cuda", [1, 1, 64, 128, 128], [24, 1, 64, 64, 64], 1, [0, 2, 2], [1, 2, 2], 1], {"i": 73410974, "t": "", "c": null, "e": [["tile_n", "sp", [-1, 1, 1, 1]], ["tile_f", "sp", [-1, 1, 3, 1]], ["tile_d", "sp", [-1, 1, 1, 1]], ["tile_y", "sp", [-1, 3, 2, 1]], ["tile_x", "sp", [-1, 1, 6, 1]], ["tile_rc", "sp", [-1, 1]], ["tile_rd", "sp", [-1, 1]], ["tile_ry", "sp", [-1, 2]], ["tile_rx", "sp", [-1, 8]], ["auto_unroll_max_step", "ot", 512], ["unroll_explicit", "ot", 1], ["fuse_yx", "ot", 1]]}], "r": [[0.0143527675, 0.01434882625], 0, 1.2335495948791504, 1578494936.9472146], "v": 0.1}
{"i": ["cuda", "schedule_conv3d_nchw_cuda", [[1, 1, 64, 128, 128], [24, 1, 64, 64, 64], 1, [0, 2, 2], [1, 2, 2], 1], {}, ["schedule_conv3d_nchw_cuda", [1, 1, 64, 128, 128], [24, 1, 64, 64, 64], 1, [0, 2, 2], [1, 2, 2], 1], {"i": 45311134, "t": "", "c": null, "e": [["tile_n", "sp", [-1, 1, 1, 1]], ["tile_f", "sp", [-1, 1, 3, 1]], ["tile_d", "sp", [-1, 1, 1, 1]], ["tile_y", "sp", [-1, 3, 2, 1]], ["tile_x", "sp", [-1, 2, 3, 1]], ["tile_rc", "sp", [-1, 1]], ["tile_rd", "sp", [-1, 1]], ["tile_ry", "sp", [-1, 2]], ["tile_rx", "sp", [-1, 8]], ["auto_unroll_max_step", "ot", 0], ["unroll_explicit", "ot", 0], ["fuse_yx", "ot", 1]]}], "r": [[0.032260652, 0.03224378575], 0, 1.2546429634094238, 1578494937.8186755], "v": 0.1}
{"i": ["cuda", "schedule_conv3d_nchw_cuda", [[1, 1, 64, 128, 128], [24, 1, 64, 64, 64], 1, [0, 2, 2], [1, 2, 2], 1], {}, ["schedule_conv3d_nchw_cuda", [1, 1, 64, 128, 128], [24, 1, 64, 64, 64], 1, [0, 2, 2], [1, 2, 2], 1], {"i": 45312254, "t": "", "c": null, "e": [["tile_n", "sp", [-1, 1, 1, 1]], ["tile_f", "sp", [-1, 1, 3, 1]], ["tile_d", "sp", [-1, 1, 1, 1]], ["tile_y", "sp", [-1, 6, 1, 1]], ["tile_x", "sp", [-1, 1, 6, 1]], ["tile_rc", "sp", [-1, 1]], ["tile_rd", "sp", [-1, 1]], ["tile_ry", "sp", [-1, 2]], ["tile_rx", "sp", [-1, 8]], ["auto_unroll_max_step", "ot", 0], ["unroll_explicit", "ot", 0], ["fuse_yx", "ot", 1]]}], "r": [[0.032407532, 0.032377463], 0, 1.3026416301727295, 1578494938.6690657], "v": 0.1}
{"i": ["cuda", "schedule_conv3d_nchw_cuda", [[1, 1, 64, 128, 128], [24, 1, 64, 64, 64], 1, [0, 2, 2], [1, 2, 2], 1], {}, ["schedule_conv3d_nchw_cuda", [1, 1, 64, 128, 128], [24, 1, 64, 64, 64], 1, [0, 2, 2], [1, 2, 2], 1], {"i": 66386174, "t": "", "c": null, "e": [["tile_n", "sp", [-1, 1, 1, 1]], ["tile_f", "sp", [-1, 1, 3, 1]], ["tile_d", "sp", [-1, 1, 1, 1]], ["tile_y", "sp", [-1, 6, 1, 1]], ["tile_x", "sp", [-1, 1, 6, 1]], ["tile_rc", "sp", [-1, 1]], ["tile_rd", "sp", [-1, 1]], ["tile_ry", "sp", [-1, 2]], ["tile_rx", "sp", [-1, 8]], ["auto_unroll_max_step", "ot", 0], ["unroll_explicit", "ot", 1], ["fuse_yx", "ot", 1]]}], "r": [[0.03247263775, 0.03238369125], 0, 1.2441232204437256, 1578494939.4803755], "v": 0.1}
{"i": ["cuda", "schedule_conv3d_nchw_cuda", [[1, 1, 64, 128, 128], [24, 1, 64, 64, 64], 1, [0, 2, 2], [1, 2, 2], 1], {}, ["schedule_conv3d_nchw_cuda", [1, 1, 64, 128, 128], [24, 1, 64, 64, 64], 1, [0, 2, 2], [1, 2, 2], 1], {"i": 80456334, "t": "", "c": null, "e": [["tile_n", "sp", [-1, 1, 1, 1]], ["tile_f", "sp", [-1, 1, 3, 1]], ["tile_d", "sp", [-1, 1, 1, 1]], ["tile_y", "sp", [-1, 1, 6, 1]], ["tile_x", "sp", [-1, 1, 6, 1]], ["tile_rc", "sp", [-1, 1]], ["tile_rd", "sp", [-1, 2]], ["tile_ry", "sp", [-1, 2]], ["tile_rx", "sp", [-1, 8]], ["auto_unroll_max_step", "ot", 1500], ["unroll_explicit", "ot", 1], ["fuse_yx", "ot", 1]]}], "r": [[0.0071892, 0.00719006025], 0, 2.724057674407959, 1578495162.166844], "v": 0.1}
{"i": ["cuda", "schedule_conv3d_nchw_cuda", [[1, 1, 64, 128, 128], [24, 1, 64, 64, 64], 1, [0, 2, 2], [1, 2, 2], 1], {}, ["schedule_conv3d_nchw_cuda", [1, 1, 64, 128, 128], [24, 1, 64, 64, 64], 1, [0, 2, 2], [1, 2, 2], 1], {"i": 73431694, "t": "", "c": null, "e": [["tile_n", "sp", [-1, 1, 1, 1]], ["tile_f", "sp", [-1, 1, 3, 1]], ["tile_d", "sp", [-1, 1, 1, 1]], ["tile_y", "sp", [-1, 1, 6, 1]], ["tile_x", "sp", [-1, 1, 6, 1]], ["tile_rc", "sp", [-1, 1]], ["tile_rd", "sp", [-1, 2]], ["tile_ry", "sp", [-1, 2]], ["tile_rx", "sp", [-1, 8]], ["auto_unroll_max_step", "ot", 512], ["unroll_explicit", "ot", 1], ["fuse_yx", "ot", 1]]}], "r": [[0.01044665125, 0.01044659775], 0, 1.247743844985962, 1578495162.9425082], "v": 0.1}
{"i": ["cuda", "schedule_conv3d_nchw_cuda", [[1, 1, 64, 128, 128], [24, 1, 64, 64, 64], 1, [0, 2, 2], [1, 2, 2], 1], {}, ["schedule_conv3d_nchw_cuda", [1, 1, 64, 128, 128], [24, 1, 64, 64, 64], 1, [0, 2, 2], [1, 2, 2], 1], {"i": 52357774, "t": "", "c": null, "e": [["tile_n", "sp", [-1, 1, 1, 1]], ["tile_f", "sp", [-1, 1, 3, 1]], ["tile_d", "sp", [-1, 1, 1, 1]], ["tile_y", "sp", [-1, 1, 6, 1]], ["tile_x", "sp", [-1, 1, 6, 1]], ["tile_rc", "sp", [-1, 1]], ["tile_rd", "sp", [-1, 2]], ["tile_ry", "sp", [-1, 2]], ["tile_rx", "sp", [-1, 8]], ["auto_unroll_max_step", "ot", 512], ["unroll_explicit", "ot", 0], ["fuse_yx", "ot", 1]]}], "r": [[0.010213994, 0.010210329], 0, 1.0712471008300781, 1578495163.5514667], "v": 0.1}
{"i": ["cuda", "schedule_conv3d_nchw_cuda", [[1, 1, 64, 128, 128], [24, 1, 64, 64, 64], 1, [0, 2, 2], [1, 2, 2], 1], {}, ["schedule_conv3d_nchw_cuda", [1, 1, 64, 128, 128], [24, 1, 64, 64, 64], 1, [0, 2, 2], [1, 2, 2], 1], {"i": 59382414, "t": "", "c": null, "e": [["tile_n", "sp", [-1, 1, 1, 1]], ["tile_f", "sp", [-1, 1, 3, 1]], ["tile_d", "sp", [-1, 1, 1, 1]], ["tile_y", "sp", [-1, 1, 6, 1]], ["tile_x", "sp", [-1, 1, 6, 1]], ["tile_rc", "sp", [-1, 1]], ["tile_rd", "sp", [-1, 2]], ["tile_ry", "sp", [-1, 2]], ["tile_rx", "sp", [-1, 8]], ["auto_unroll_max_step", "ot", 1500], ["unroll_explicit", "ot", 0], ["fuse_yx", "ot", 1]]}], "r": [[0.00975606325, 0.00975485925], 0, 2.1696531772613525, 1578495164.6416602], "v": 0.1}
{"i": ["cuda", "schedule_conv3d_nchw_cuda", [[1, 1, 64, 128, 128], [24, 1, 64, 64, 64], 1, [0, 2, 2], [1, 2, 2], 1], {}, ["schedule_conv3d_nchw_cuda", [1, 1, 64, 128, 128], [24, 1, 64, 64, 64], 1, [0, 2, 2], [1, 2, 2], 1], {"i": 80594585, "t": "", "c": null, "e": [["tile_n", "sp", [-1, 1, 1, 1]], ["tile_f", "sp", [-1, 1, 8, 1]], ["tile_d", "sp", [-1, 1, 1, 1]], ["tile_y", "sp", [-1, 1, 6, 1]], ["tile_x", "sp", [-1, 1, 2, 1]], ["tile_rc", "sp", [-1, 1]], ["tile_rd", "sp", [-1, 2]], ["tile_ry", "sp", [-1, 4]], ["tile_rx", "sp", [-1, 8]], ["auto_unroll_max_step", "ot", 1500], ["unroll_explicit", "ot", 1], ["fuse_yx", "ot", 1]]}], "r": [[0.00483292, 0.00483284825], 0, 2.789111852645874, 1578495165.5505648], "v": 0.1}
{"i": ["cuda", "schedule_conv3d_nchw_cuda", [[1, 1, 64, 128, 128], [24, 1, 64, 64, 64], 1, [0, 2, 2], [1, 2, 2], 1], {}, ["schedule_conv3d_nchw_cuda", [1, 1, 64, 128, 128], [24, 1, 64, 64, 64], 1, [0, 2, 2], [1, 2, 2], 1], {"i": 73569945, "t": "", "c": null, "e": [["tile_n", "sp", [-1, 1, 1, 1]], ["tile_f", "sp", [-1, 1, 8, 1]], ["tile_d", "sp", [-1, 1, 1, 1]], ["tile_y", "sp", [-1, 1, 6, 1]], ["tile_x", "sp", [-1, 1, 2, 1]], ["tile_rc", "sp", [-1, 1]], ["tile_rd", "sp", [-1, 2]], ["tile_ry", "sp", [-1, 4]], ["tile_rx", "sp", [-1, 8]], ["auto_unroll_max_step", "ot", 512], ["unroll_explicit", "ot", 1], ["fuse_yx", "ot", 1]]}], "r": [[0.00713839025, 0.007136955], 0, 1.2564160823822021, 1578495166.294883], "v": 0.1}
