auto_log/((1, 192, 8, 8, 8), (192, 192, 3, 3, 3), (1, 192, 8, 8, 8), (1, 1, 1), (1, 1, 1), 1, 1, None)_bwd_wei_grad.log
{"i": ["cuda", "schedule_conv3d_nchw_cuda", [[192, 1, 8, 8, 8], [192, 1, 8, 8, 8], 1, [1, 1, 1], [1, 1, 1], 1], {}, ["schedule_conv3d_nchw_cuda", [192, 1, 8, 8, 8], [192, 1, 8, 8, 8], 1, [1, 1, 1], [1, 1, 1], 1], {"i": 3251222551, "t": "", "c": null, "e": [["tile_n", "sp", [-1, 2, 4, 4]], ["tile_f", "sp", [-1, 6, 8, 2]], ["tile_d", "sp", [-1, 1, 3, 1]], ["tile_y", "sp", [-1, 1, 1, 3]], ["tile_x", "sp", [-1, 1, 1, 3]], ["tile_rc", "sp", [-1, 1]], ["tile_rd", "sp", [-1, 2]], ["tile_ry", "sp", [-1, 1]], ["tile_rx", "sp", [-1, 1]], ["auto_unroll_max_step", "ot", 512], ["unroll_explicit", "ot", 0], ["fuse_yx", "ot", 1]]}], "r": [[0.022714765, 0.022687692], 0, 1.7557413578033447, 1578566185.7590132], "v": 0.1}
{"i": ["cuda", "schedule_conv3d_nchw_cuda", [[192, 1, 8, 8, 8], [192, 1, 8, 8, 8], 1, [1, 1, 1], [1, 1, 1], 1], {}, ["schedule_conv3d_nchw_cuda", [192, 1, 8, 8, 8], [192, 1, 8, 8, 8], 1, [1, 1, 1], [1, 1, 1], 1], {"i": 2227554062, "t": "", "c": null, "e": [["tile_n", "sp", [-1, 1, 16, 1]], ["tile_f", "sp", [-1, 32, 1, 1]], ["tile_d", "sp", [-1, 1, 1, 3]], ["tile_y", "sp", [-1, 1, 1, 1]], ["tile_x", "sp", [-1, 3, 1, 1]], ["tile_rc", "sp", [-1, 1]], ["tile_rd", "sp", [-1, 1]], ["tile_ry", "sp", [-1, 2]], ["tile_rx", "sp", [-1, 8]], ["auto_unroll_max_step", "ot", 512], ["unroll_explicit", "ot", 1], ["fuse_yx", "ot", 0]]}], "r": [[0.00109828875, 0.00108714425], 0, 2.33243465423584, 1578566186.901437], "v": 0.1}
{"i": ["cuda", "schedule_conv3d_nchw_cuda", [[192, 1, 8, 8, 8], [192, 1, 8, 8, 8], 1, [1, 1, 1], [1, 1, 1], 1], {}, ["schedule_conv3d_nchw_cuda", [192, 1, 8, 8, 8], [192, 1, 8, 8, 8], 1, [1, 1, 1], [1, 1, 1], 1], {"i": 4322716198, "t": "", "c": null, "e": [["tile_n", "sp", [-1, 6, 4, 8]], ["tile_f", "sp", [-1, 4, 6, 2]], ["tile_d", "sp", [-1, 3, 1, 1]], ["tile_y", "sp", [-1, 1, 1, 1]], ["tile_x", "sp", [-1, 3, 1, 1]], ["tile_rc", "sp", [-1, 1]], ["tile_rd", "sp", [-1, 4]], ["tile_ry", "sp", [-1, 2]], ["tile_rx", "sp", [-1, 2]], ["auto_unroll_max_step", "ot", 0], ["unroll_explicit", "ot", 1], ["fuse_yx", "ot", 1]]}], "r": [[0.03987249675, 0.039872537], 0, 2.937150716781616, 1578566188.0825958], "v": 0.1}
{"i": ["cuda", "schedule_conv3d_nchw_cuda", [[192, 1, 8, 8, 8], [192, 1, 8, 8, 8], 1, [1, 1, 1], [1, 1, 1], 1], {}, ["schedule_conv3d_nchw_cuda", [192, 1, 8, 8, 8], [192, 1, 8, 8, 8], 1, [1, 1, 1], [1, 1, 1], 1], {"i": 3387032587, "t": "", "c": null, "e": [["tile_n", "sp", [-1, 1, 6, 1]], ["tile_f", "sp", [-1, 12, 4, 2]], ["tile_d", "sp", [-1, 3, 1, 1]], ["tile_y", "sp", [-1, 1, 1, 1]], ["tile_x", "sp", [-1, 1, 1, 3]], ["tile_rc", "sp", [-1, 1]], ["tile_rd", "sp", [-1, 1]], ["tile_ry", "sp", [-1, 2]], ["tile_rx", "sp", [-1, 2]], ["auto_unroll_max_step", "ot", 512], ["unroll_explicit", "ot", 0], ["fuse_yx", "ot", 1]]}], "r": [[0.0002952905, 0.00029718375], 0, 1.119344711303711, 1578566194.6006193], "v": 0.1}
{"i": ["cuda", "schedule_conv3d_nchw_cuda", [[192, 1, 8, 8, 8], [192, 1, 8, 8, 8], 1, [1, 1, 1], [1, 1, 1], 1], {}, ["schedule_conv3d_nchw_cuda", [192, 1, 8, 8, 8], [192, 1, 8, 8, 8], 1, [1, 1, 1], [1, 1, 1], 1], {"i": 2464823208, "t": "", "c": null, "e": [["tile_n", "sp", [-1, 1, 6, 2]], ["tile_f", "sp", [-1, 1, 4, 6]], ["tile_d", "sp", [-1, 1, 1, 1]], ["tile_y", "sp", [-1, 1, 3, 1]], ["tile_x", "sp", [-1, 1, 1, 1]], ["tile_rc", "sp", [-1, 1]], ["tile_rd", "sp", [-1, 2]], ["tile_ry", "sp", [-1, 2]], ["tile_rx", "sp", [-1, 2]], ["auto_unroll_max_step", "ot", 1500], ["unroll_explicit", "ot", 1], ["fuse_yx", "ot", 0]]}], "r": [[0.0006206495, 0.0006199565], 0, 1.2840821743011475, 1578566195.5443783], "v": 0.1}
{"i": ["cuda", "schedule_conv3d_nchw_cuda", [[192, 1, 8, 8, 8], [192, 1, 8, 8, 8], 1, [1, 1, 1], [1, 1, 1], 1], {}, ["schedule_conv3d_nchw_cuda", [192, 1, 8, 8, 8], [192, 1, 8, 8, 8], 1, [1, 1, 1], [1, 1, 1], 1], {"i": 952249312, "t": "", "c": null, "e": [["tile_n", "sp", [-1, 1, 4, 2]], ["tile_f", "sp", [-1, 3, 2, 8]], ["tile_d", "sp", [-1, 1, 3, 1]], ["tile_y", "sp", [-1, 1, 1, 1]], ["tile_x", "sp", [-1, 1, 1, 3]], ["tile_rc", "sp", [-1, 1]], ["tile_rd", "sp", [-1, 8]], ["tile_ry", "sp", [-1, 1]], ["tile_rx", "sp", [-1, 1]], ["auto_unroll_max_step", "ot", 1500], ["unroll_explicit", "ot", 0], ["fuse_yx", "ot", 0]]}], "r": [[0.0007590645, 0.00075164725], 0, 1.2600581645965576, 1578566196.3106534], "v": 0.1}
{"i": ["cuda", "schedule_conv3d_nchw_cuda", [[192, 1, 8, 8, 8], [192, 1, 8, 8, 8], 1, [1, 1, 1], [1, 1, 1], 1], {}, ["schedule_conv3d_nchw_cuda", [192, 1, 8, 8, 8], [192, 1, 8, 8, 8], 1, [1, 1, 1], [1, 1, 1], 1], {"i": 4064953236, "t": "", "c": null, "e": [["tile_n", "sp", [-1, 4, 4, 1]], ["tile_f", "sp", [-1, 4, 12, 1]], ["tile_d", "sp", [-1, 1, 3, 1]], ["tile_y", "sp", [-1, 3, 1, 1]], ["tile_x", "sp", [-1, 1, 3, 1]], ["tile_rc", "sp", [-1, 1]], ["tile_rd", "sp", [-1, 4]], ["tile_ry", "sp", [-1, 1]], ["tile_rx", "sp", [-1, 8]], ["auto_unroll_max_step", "ot", 1500], ["unroll_explicit", "ot", 0], ["fuse_yx", "ot", 1]]}], "r": [[0.000268967, 0.000267219], 0, 1.0166306495666504, 1578566196.8987656], "v": 0.1}
{"i": ["cuda", "schedule_conv3d_nchw_cuda", [[192, 1, 8, 8, 8], [192, 1, 8, 8, 8], 1, [1, 1, 1], [1, 1, 1], 1], {}, ["schedule_conv3d_nchw_cuda", [192, 1, 8, 8, 8], [192, 1, 8, 8, 8], 1, [1, 1, 1], [1, 1, 1], 1], {"i": 2147713957, "t": "", "c": null, "e": [["tile_n", "sp", [-1, 2, 2, 12]], ["tile_f", "sp", [-1, 2, 2, 12]], ["tile_d", "sp", [-1, 1, 1, 3]], ["tile_y", "sp", [-1, 1, 1, 3]], ["tile_x", "sp", [-1, 1, 1, 1]], ["tile_rc", "sp", [-1, 1]], ["tile_rd", "sp", [-1, 2]], ["tile_ry", "sp", [-1, 4]], ["tile_rx", "sp", [-1, 4]], ["auto_unroll_max_step", "ot", 512], ["unroll_explicit", "ot", 1], ["fuse_yx", "ot", 0]]}], "r": [[0.0560189665, 0.05595513525], 0, 6.7185609340667725, 1578566198.2910066], "v": 0.1}
{"i": ["cuda", "schedule_conv3d_nchw_cuda", [[192, 1, 8, 8, 8], [192, 1, 8, 8, 8], 1, [1, 1, 1], [1, 1, 1], 1], {}, ["schedule_conv3d_nchw_cuda", [192, 1, 8, 8, 8], [192, 1, 8, 8, 8], 1, [1, 1, 1], [1, 1, 1], 1], {"i": 3380957335, "t": "", "c": null, "e": [["tile_n", "sp", [-1, 16, 1, 1]], ["tile_f", "sp", [-1, 12, 1, 4]], ["tile_d", "sp", [-1, 1, 1, 3]], ["tile_y", "sp", [-1, 1, 3, 1]], ["tile_x", "sp", [-1, 1, 1, 3]], ["tile_rc", "sp", [-1, 1]], ["tile_rd", "sp", [-1, 8]], ["tile_ry", "sp", [-1, 1]], ["tile_rx", "sp", [-1, 2]], ["auto_unroll_max_step", "ot", 512], ["unroll_explicit", "ot", 0], ["fuse_yx", "ot", 1]]}], "r": [[0.22911607075, 0.22903256975], 0, 5.731991767883301, 1578566212.8103108], "v": 0.1}
{"i": ["cuda", "schedule_conv3d_nchw_cuda", [[192, 1, 8, 8, 8], [192, 1, 8, 8, 8], 1, [1, 1, 1], [1, 1, 1], 1], {}, ["schedule_conv3d_nchw_cuda", [192, 1, 8, 8, 8], [192, 1, 8, 8, 8], 1, [1, 1, 1], [1, 1, 1], 1], {"i": 302760424, "t": "", "c": null, "e": [["tile_n", "sp", [-1, 2, 4, 6]], ["tile_f", "sp", [-1, 2, 3, 8]], ["tile_d", "sp", [-1, 3, 1, 1]], ["tile_y", "sp", [-1, 1, 3, 1]], ["tile_x", "sp", [-1, 1, 1, 3]], ["tile_rc", "sp", [-1, 1]], ["tile_rd", "sp", [-1, 2]], ["tile_ry", "sp", [-1, 4]], ["tile_rx", "sp", [-1, 4]], ["auto_unroll_max_step", "ot", 0], ["unroll_explicit", "ot", 0], ["fuse_yx", "ot", 0]]}], "r": [[0.0679757495, 0.0679657425], 0, 2.2238025665283203, 1578566214.0609713], "v": 0.1}
{"i": ["cuda", "schedule_conv3d_nchw_cuda", [[192, 1, 8, 8, 8], [192, 1, 8, 8, 8], 1, [1, 1, 1], [1, 1, 1], 1], {}, ["schedule_conv3d_nchw_cuda", [192, 1, 8, 8, 8], [192, 1, 8, 8, 8], 1, [1, 1, 1], [1, 1, 1], 1], {"i": 4185494103, "t": "", "c": null, "e": [["tile_n", "sp", [-1, 1, 4, 6]], ["tile_f", "sp", [-1, 1, 4, 16]], ["tile_d", "sp", [-1, 3, 1, 1]], ["tile_y", "sp", [-1, 1, 1, 1]], ["tile_x", "sp", [-1, 3, 1, 1]], ["tile_rc", "sp", [-1, 1]], ["tile_rd", "sp", [-1, 8]], ["tile_ry", "sp", [-1, 1]], ["tile_rx", "sp", [-1, 1]], ["auto_unroll_max_step", "ot", 0], ["unroll_explicit", "ot", 1], ["fuse_yx", "ot", 1]]}], "r": [[0.0163106365, 0.0163089975], 0, 1.5817265510559082, 1578566214.865298], "v": 0.1}
{"i": ["cuda", "schedule_conv3d_nchw_cuda", [[192, 1, 8, 8, 8], [192, 1, 8, 8, 8], 1, [1, 1, 1], [1, 1, 1], 1], {}, ["schedule_conv3d_nchw_cuda", [192, 1, 8, 8, 8], [192, 1, 8, 8, 8], 1, [1, 1, 1], [1, 1, 1], 1], {"i": 632626598, "t": "", "c": null, "e": [["tile_n", "sp", [-1, 3, 1, 2]], ["tile_f", "sp", [-1, 2, 8, 4]], ["tile_d", "sp", [-1, 1, 1, 3]], ["tile_y", "sp", [-1, 1, 1, 1]], ["tile_x", "sp", [-1, 1, 3, 1]], ["tile_rc", "sp", [-1, 1]], ["tile_rd", "sp", [-1, 8]], ["tile_ry", "sp", [-1, 2]], ["tile_rx", "sp", [-1, 2]], ["auto_unroll_max_step", "ot", 512], ["unroll_explicit", "ot", 0], ["fuse_yx", "ot", 0]]}], "r": [[0.00089392675, 0.0008938445], 0, 2.0361759662628174, 1578566215.8715212], "v": 0.1}
{"i": ["cuda", "schedule_conv3d_nchw_cuda", [[192, 1, 8, 8, 8], [192, 1, 8, 8, 8], 1, [1, 1, 1], [1, 1, 1], 1], {}, ["schedule_conv3d_nchw_cuda", [192, 1, 8, 8, 8], [192, 1, 8, 8, 8], 1, [1, 1, 1], [1, 1, 1], 1], {"i": 4902728169, "t": "", "c": null, "e": [["tile_n", "sp", [-1, 2, 3, 16]], ["tile_f", "sp", [-1, 3, 1, 32]], ["tile_d", "sp", [-1, 1, 3, 1]], ["tile_y", "sp", [-1, 1, 1, 1]], ["tile_x", "sp", [-1, 1, 3, 1]], ["tile_rc", "sp", [-1, 1]], ["tile_rd", "sp", [-1, 4]], ["tile_ry", "sp", [-1, 2]], ["tile_rx", "sp", [-1, 4]], ["auto_unroll_max_step", "ot", 512], ["unroll_explicit", "ot", 1], ["fuse_yx", "ot", 1]]}], "r": [[0.05301461575, 0.05300620475], 0, 8.520896673202515, 1578566219.2374513], "v": 0.1}
{"i": ["cuda", "schedule_conv3d_nchw_cuda", [[192, 1, 8, 8, 8], [192, 1, 8, 8, 8], 1, [1, 1, 1], [1, 1, 1], 1], {}, ["schedule_conv3d_nchw_cuda", [192, 1, 8, 8, 8], [192, 1, 8, 8, 8], 1, [1, 1, 1], [1, 1, 1], 1], {"i": 3974232745, "t": "", "c": null, "e": [["tile_n", "sp", [-1, 1, 24, 4]], ["tile_f", "sp", [-1, 4, 4, 4]], ["tile_d", "sp", [-1, 1, 3, 1]], ["tile_y", "sp", [-1, 1, 1, 1]], ["tile_x", "sp", [-1, 1, 1, 1]], ["tile_rc", "sp", [-1, 1]], ["tile_rd", "sp", [-1, 4]], ["tile_ry", "sp", [-1, 2]], ["tile_rx", "sp", [-1, 4]], ["auto_unroll_max_step", "ot", 1500], ["unroll_explicit", "ot", 0], ["fuse_yx", "ot", 1]]}], "r": [[0.0005477145, 0.00054697475], 0, 1.2815604209899902, 1578566224.2390647], "v": 0.1}
{"i": ["cuda", "schedule_conv3d_nchw_cuda", [[192, 1, 8, 8, 8], [192, 1, 8, 8, 8], 1, [1, 1, 1], [1, 1, 1], 1], {}, ["schedule_conv3d_nchw_cuda", [192, 1, 8, 8, 8], [192, 1, 8, 8, 8], 1, [1, 1, 1], [1, 1, 1], 1], {"i": 2009552731, "t": "", "c": null, "e": [["tile_n", "sp", [-1, 1, 8, 6]], ["tile_f", "sp", [-1, 64, 1, 1]], ["tile_d", "sp", [-1, 1, 1, 1]], ["tile_y", "sp", [-1, 1, 3, 1]], ["tile_x", "sp", [-1, 1, 1, 1]], ["tile_rc", "sp", [-1, 1]], ["tile_rd", "sp", [-1, 4]], ["tile_ry", "sp", [-1, 2]], ["tile_rx", "sp", [-1, 2]], ["auto_unroll_max_step", "ot", 512], ["unroll_explicit", "ot", 1], ["fuse_yx", "ot", 0]]}], "r": [[0.00248403825, 0.002466631], 0, 3.8632309436798096, 1578566228.4019978], "v": 0.1}
{"i": ["cuda", "schedule_conv3d_nchw_cuda", [[192, 1, 8, 8, 8], [192, 1, 8, 8, 8], 1, [1, 1, 1], [1, 1, 1], 1], {}, ["schedule_conv3d_nchw_cuda", [192, 1, 8, 8, 8], [192, 1, 8, 8, 8], 1, [1, 1, 1], [1, 1, 1], 1], {"i": 2029498658, "t": "", "c": null, "e": [["tile_n", "sp", [-1, 2, 3, 4]], ["tile_f", "sp", [-1, 1, 16, 6]], ["tile_d", "sp", [-1, 1, 1, 1]], ["tile_y", "sp", [-1, 1, 3, 1]], ["tile_x", "sp", [-1, 1, 1, 3]], ["tile_rc", "sp", [-1, 1]], ["tile_rd", "sp", [-1, 1]], ["tile_ry", "sp", [-1, 4]], ["tile_rx", "sp", [-1, 2]], ["auto_unroll_max_step", "ot", 512], ["unroll_explicit", "ot", 1], ["fuse_yx", "ot", 0]]}], "r": [[0.000434535, 0.00043333225], 0, 1.1628499031066895, 1578566229.0807862], "v": 0.1}
{"i": ["cuda", "schedule_conv3d_nchw_cuda", [[192, 1, 8, 8, 8], [192, 1, 8, 8, 8], 1, [1, 1, 1], [1, 1, 1], 1], {}, ["schedule_conv3d_nchw_cuda", [192, 1, 8, 8, 8], [192, 1, 8, 8, 8], 1, [1, 1, 1], [1, 1, 1], 1], {"i": 833067539, "t": "", "c": null, "e": [["tile_n", "sp", [-1, 2, 2, 6]], ["tile_f", "sp", [-1, 32, 2, 1]], ["tile_d", "sp", [-1, 1, 1, 3]], ["tile_y", "sp", [-1, 1, 1, 1]], ["tile_x", "sp", [-1, 3, 1, 1]], ["tile_rc", "sp", [-1, 1]], ["tile_rd", "sp", [-1, 8]], ["tile_ry", "sp", [-1, 1]], ["tile_rx", "sp", [-1, 8]], ["auto_unroll_max_step", "ot", 512], ["unroll_explicit", "ot", 0], ["fuse_yx", "ot", 0]]}], "r": [[0.23552587, 0.2328415995], 0, 4.100671768188477, 1578566231.8901887], "v": 0.1}
{"i": ["cuda", "schedule_conv3d_nchw_cuda", [[192, 1, 8, 8, 8], [192, 1, 8, 8, 8], 1, [1, 1, 1], [1, 1, 1], 1], {}, ["schedule_conv3d_nchw_cuda", [192, 1, 8, 8, 8], [192, 1, 8, 8, 8], 1, [1, 1, 1], [1, 1, 1], 1], {"i": 1907005997, "t": "", "c": null, "e": [["tile_n", "sp", [-1, 8, 3, 1]], ["tile_f", "sp", [-1, 4, 8, 6]], ["tile_d", "sp", [-1, 1, 1, 3]], ["tile_y", "sp", [-1, 1, 3, 1]], ["tile_x", "sp", [-1, 1, 1, 3]], ["tile_rc", "sp", [-1, 1]], ["tile_rd", "sp", [-1, 8]], ["tile_ry", "sp", [-1, 2]], ["tile_rx", "sp", [-1, 1]], ["auto_unroll_max_step", "ot", 512], ["unroll_explicit", "ot", 1], ["fuse_yx", "ot", 0]]}], "r": [[0.02036662925, 0.02037132875], 0, 3.5168240070343018, 1578566234.620869], "v": 0.1}
{"i": ["cuda", "schedule_conv3d_nchw_cuda", [[192, 1, 8, 8, 8], [192, 1, 8, 8, 8], 1, [1, 1, 1], [1, 1, 1], 1], {}, ["schedule_conv3d_nchw_cuda", [192, 1, 8, 8, 8], [192, 1, 8, 8, 8], 1, [1, 1, 1], [1, 1, 1], 1], {"i": 129475696, "t": "", "c": null, "e": [["tile_n", "sp", [-1, 1, 4, 2]], ["tile_f", "sp", [-1, 3, 1, 16]], ["tile_d", "sp", [-1, 1, 3, 1]], ["tile_y", "sp", [-1, 1, 3, 1]], ["tile_x", "sp", [-1, 1, 1, 3]], ["tile_rc", "sp", [-1, 1]], ["tile_rd", "sp", [-1, 2]], ["tile_ry", "sp", [-1, 1]], ["tile_rx", "sp", [-1, 2]], ["auto_unroll_max_step", "ot", 0], ["unroll_explicit", "ot", 0], ["fuse_yx", "ot", 0]]}], "r": [[0.012263562, 0.0122510625], 0, 1.6458983421325684, 1578566235.4985788], "v": 0.1}
{"i": ["cuda", "schedule_conv3d_nchw_cuda", [[192, 1, 8, 8, 8], [192, 1, 8, 8, 8], 1, [1, 1, 1], [1, 1, 1], 1], {}, ["schedule_conv3d_nchw_cuda", [192, 1, 8, 8, 8], [192, 1, 8, 8, 8], 1, [1, 1, 1], [1, 1, 1], 1], {"i": 2028688079, "t": "", "c": null, "e": [["tile_n", "sp", [-1, 16, 6, 1]], ["tile_f", "sp", [-1, 4, 1, 4]], ["tile_d", "sp", [-1, 3, 1, 1]], ["tile_y", "sp", [-1, 1, 1, 1]], ["tile_x", "sp", [-1, 1, 1, 3]], ["tile_rc", "sp", [-1, 1]], ["tile_rd", "sp", [-1, 1]], ["tile_ry", "sp", [-1, 4]], ["tile_rx", "sp", [-1, 2]], ["auto_unroll_max_step", "ot", 512], ["unroll_explicit", "ot", 1], ["fuse_yx", "ot", 0]]}], "r": [[0.131717125, 0.131705505], 0, 3.768665313720703, 1578566237.3989623], "v": 0.1}
{"i": ["cuda", "schedule_conv3d_nchw_cuda", [[192, 1, 8, 8, 8], [192, 1, 8, 8, 8], 1, [1, 1, 1], [1, 1, 1], 1], {}, ["schedule_conv3d_nchw_cuda", [192, 1, 8, 8, 8], [192, 1, 8, 8, 8], 1, [1, 1, 1], [1, 1, 1], 1], {"i": 4972085914, "t": "", "c": null, "e": [["tile_n", "sp", [-1, 2, 2, 8]], ["tile_f", "sp", [-1, 3, 2, 2]], ["tile_d", "sp", [-1, 3, 1, 1]], ["tile_y", "sp", [-1, 1, 3, 1]], ["tile_x", "sp", [-1, 1, 1, 1]], ["tile_rc", "sp", [-1, 1]], ["tile_rd", "sp", [-1, 1]], ["tile_ry", "sp", [-1, 1]], ["tile_rx", "sp", [-1, 8]], ["auto_unroll_max_step", "ot", 512], ["unroll_explicit", "ot", 1], ["fuse_yx", "ot", 1]]}], "r": [[0.00609273075, 0.00608082025], 0, 2.691026210784912, 1578566238.460466], "v": 0.1}
{"i": ["cuda", "schedule_conv3d_nchw_cuda", [[192, 1, 8, 8, 8], [192, 1, 8, 8, 8], 1, [1, 1, 1], [1, 1, 1], 1], {}, ["schedule_conv3d_nchw_cuda", [192, 1, 8, 8, 8], [192, 1, 8, 8, 8], 1, [1, 1, 1], [1, 1, 1], 1], {"i": 4297237435, "t": "", "c": null, "e": [["tile_n", "sp", [-1, 1, 6, 1]], ["tile_f", "sp", [-1, 8, 2, 6]], ["tile_d", "sp", [-1, 1, 1, 3]], ["tile_y", "sp", [-1, 1, 1, 3]], ["tile_x", "sp", [-1, 1, 3, 1]], ["tile_rc", "sp", [-1, 1]], ["tile_rd", "sp", [-1, 4]], ["tile_ry", "sp", [-1, 1]], ["tile_rx", "sp", [-1, 2]], ["auto_unroll_max_step", "ot", 0], ["unroll_explicit", "ot", 1], ["fuse_yx", "ot", 1]]}], "r": [[0.021483492, 0.02149125075], 0, 1.6123414039611816, 1578566249.5389347], "v": 0.1}
{"i": ["cuda", "schedule_conv3d_nchw_cuda", [[192, 1, 8, 8, 8], [192, 1, 8, 8, 8], 1, [1, 1, 1], [1, 1, 1], 1], {}, ["schedule_conv3d_nchw_cuda", [192, 1, 8, 8, 8], [192, 1, 8, 8, 8], 1, [1, 1, 1], [1, 1, 1], 1], {"i": 3956774122, "t": "", "c": null, "e": [["tile_n", "sp", [-1, 1, 2, 3]], ["tile_f", "sp", [-1, 2, 3, 32]], ["tile_d", "sp", [-1, 1, 1, 3]], ["tile_y", "sp", [-1, 3, 1, 1]], ["tile_x", "sp", [-1, 1, 3, 1]], ["tile_rc", "sp", [-1, 1]], ["tile_rd", "sp", [-1, 8]], ["tile_ry", "sp", [-1, 1]], ["tile_rx", "sp", [-1, 4]], ["auto_unroll_max_step", "ot", 1500], ["unroll_explicit", "ot", 0], ["fuse_yx", "ot", 1]]}], "r": [[0.01781811675, 0.017790038], 0, 6.577442646026611, 1578566251.4895499], "v": 0.1}
{"i": ["cuda", "schedule_conv3d_nchw_cuda", [[192, 1, 8, 8, 8], [192, 1, 8, 8, 8], 1, [1, 1, 1], [1, 1, 1], 1], {}, ["schedule_conv3d_nchw_cuda", [192, 1, 8, 8, 8], [192, 1, 8, 8, 8], 1, [1, 1, 1], [1, 1, 1], 1], {"i": 2908319819, "t": "", "c": null, "e": [["tile_n", "sp", [-1, 3, 2, 8]], ["tile_f", "sp", [-1, 4, 2, 1]], ["tile_d", "sp", [-1, 3, 1, 1]], ["tile_y", "sp", [-1, 1, 1, 1]], ["tile_x", "sp", [-1, 1, 3, 1]], ["tile_rc", "sp", [-1, 1]], ["tile_rd", "sp", [-1, 4]], ["tile_ry", "sp", [-1, 1]], ["tile_rx", "sp", [-1, 2]], ["auto_unroll_max_step", "ot", 0], ["unroll_explicit", "ot", 0], ["fuse_yx", "ot", 1]]}], "r": [[0.0439237915, 0.04397290175], 0, 2.230238914489746, 1578566252.6405246], "v": 0.1}
{"i": ["cuda", "schedule_conv3d_nchw_cuda", [[192, 1, 8, 8, 8], [192, 1, 8, 8, 8], 1, [1, 1, 1], [1, 1, 1], 1], {}, ["schedule_conv3d_nchw_cuda", [192, 1, 8, 8, 8], [192, 1, 8, 8, 8], 1, [1, 1, 1], [1, 1, 1], 1], {"i": 2103067764, "t": "", "c": null, "e": [["tile_n", "sp", [-1, 1, 1, 2]], ["tile_f", "sp", [-1, 4, 6, 2]], ["tile_d", "sp", [-1, 1, 1, 1]], ["tile_y", "sp", [-1, 3, 1, 1]], ["tile_x", "sp", [-1, 1, 1, 1]], ["tile_rc", "sp", [-1, 1]], ["tile_rd", "sp", [-1, 8]], ["tile_ry", "sp", [-1, 1]], ["tile_rx", "sp", [-1, 4]], ["auto_unroll_max_step", "ot", 512], ["unroll_explicit", "ot", 1], ["fuse_yx", "ot", 0]]}], "r": [[0.0020156425, 0.0020118235], 0, 1.7602367401123047, 1578566253.6050708], "v": 0.1}
{"i": ["cuda", "schedule_conv3d_nchw_cuda", [[192, 1, 8, 8, 8], [192, 1, 8, 8, 8], 1, [1, 1, 1], [1, 1, 1], 1], {}, ["schedule_conv3d_nchw_cuda", [192, 1, 8, 8, 8], [192, 1, 8, 8, 8], 1, [1, 1, 1], [1, 1, 1], 1], {"i": 3524095499, "t": "", "c": null, "e": [["tile_n", "sp", [-1, 2, 2, 3]], ["tile_f", "sp", [-1, 1, 24, 2]], ["tile_d", "sp", [-1, 1, 1, 3]], ["tile_y", "sp", [-1, 1, 1, 3]], ["tile_x", "sp", [-1, 1, 3, 1]], ["tile_rc", "sp", [-1, 1]], ["tile_rd", "sp", [-1, 8]], ["tile_ry", "sp", [-1, 2]], ["tile_rx", "sp", [-1, 4]], ["auto_unroll_max_step", "ot", 512], ["unroll_explicit", "ot", 0], ["fuse_yx", "ot", 1]]}], "r": [[0.0005007455, 0.00049987375], 0, 1.2706019878387451, 1578566260.4568162], "v": 0.1}
{"i": ["cuda", "schedule_conv3d_nchw_cuda", [[192, 1, 8, 8, 8], [192, 1, 8, 8, 8], 1, [1, 1, 1], [1, 1, 1], 1], {}, ["schedule_conv3d_nchw_cuda", [192, 1, 8, 8, 8], [192, 1, 8, 8, 8], 1, [1, 1, 1], [1, 1, 1], 1], {"i": 1978757951, "t": "", "c": null, "e": [["tile_n", "sp", [-1, 12, 2, 4]], ["tile_f", "sp", [-1, 6, 1, 2]], ["tile_d", "sp", [-1, 1, 1, 3]], ["tile_y", "sp", [-1, 3, 1, 1]], ["tile_x", "sp", [-1, 1, 1, 3]], ["tile_rc", "sp", [-1, 1]], ["tile_rd", "sp", [-1, 2]], ["tile_ry", "sp", [-1, 1]], ["tile_rx", "sp", [-1, 2]], ["auto_unroll_max_step", "ot", 512], ["unroll_explicit", "ot", 1], ["fuse_yx", "ot", 0]]}], "r": [[0.3110327645, 0.310874476], 0, 5.941179513931274, 1578566264.0003057], "v": 0.1}
{"i": ["cuda", "schedule_conv3d_nchw_cuda", [[192, 1, 8, 8, 8], [192, 1, 8, 8, 8], 1, [1, 1, 1], [1, 1, 1], 1], {}, ["schedule_conv3d_nchw_cuda", [192, 1, 8, 8, 8], [192, 1, 8, 8, 8], 1, [1, 1, 1], [1, 1, 1], 1], {"i": 4190273314, "t": "", "c": null, "e": [["tile_n", "sp", [-1, 4, 1, 4]], ["tile_f", "sp", [-1, 6, 32, 1]], ["tile_d", "sp", [-1, 1, 1, 1]], ["tile_y", "sp", [-1, 1, 1, 3]], ["tile_x", "sp", [-1, 1, 1, 3]], ["tile_rc", "sp", [-1, 1]], ["tile_rd", "sp", [-1, 8]], ["tile_ry", "sp", [-1, 1]], ["tile_rx", "sp", [-1, 1]], ["auto_unroll_max_step", "ot", 0], ["unroll_explicit", "ot", 1], ["fuse_yx", "ot", 1]]}], "r": [[0.01286627675, 0.0128737005], 0, 1.668290615081787, 1578566269.918902], "v": 0.1}
{"i": ["cuda", "schedule_conv3d_nchw_cuda", [[192, 1, 8, 8, 8], [192, 1, 8, 8, 8], 1, [1, 1, 1], [1, 1, 1], 1], {}, ["schedule_conv3d_nchw_cuda", [192, 1, 8, 8, 8], [192, 1, 8, 8, 8], 1, [1, 1, 1], [1, 1, 1], 1], {"i": 2802615389, "t": "", "c": null, "e": [["tile_n", "sp", [-1, 2, 48, 1]], ["tile_f", "sp", [-1, 6, 2, 8]], ["tile_d", "sp", [-1, 1, 1, 1]], ["tile_y", "sp", [-1, 1, 3, 1]], ["tile_x", "sp", [-1, 1, 1, 3]], ["tile_rc", "sp", [-1, 1]], ["tile_rd", "sp", [-1, 8]], ["tile_ry", "sp", [-1, 1]], ["tile_rx", "sp", [-1, 1]], ["auto_unroll_max_step", "ot", 0], ["unroll_explicit", "ot", 0], ["fuse_yx", "ot", 1]]}], "r": [[0.01283115775, 0.01282487425], 0, 1.2257156372070312, 1578566270.6631544], "v": 0.1}
{"i": ["cuda", "schedule_conv3d_nchw_cuda", [[192, 1, 8, 8, 8], [192, 1, 8, 8, 8], 1, [1, 1, 1], [1, 1, 1], 1], {}, ["schedule_conv3d_nchw_cuda", [192, 1, 8, 8, 8], [192, 1, 8, 8, 8], 1, [1, 1, 1], [1, 1, 1], 1], {"i": 1578573741, "t": "", "c": null, "e": [["tile_n", "sp", [-1, 4, 6, 1]], ["tile_f", "sp", [-1, 48, 1, 4]], ["tile_d", "sp", [-1, 1, 3, 1]], ["tile_y", "sp", [-1, 1, 1, 3]], ["tile_x", "sp", [-1, 3, 1, 1]], ["tile_rc", "sp", [-1, 1]], ["tile_rd", "sp", [-1, 4]], ["tile_ry", "sp", [-1, 4]], ["tile_rx", "sp", [-1, 2]], ["auto_unroll_max_step", "ot", 0], ["unroll_explicit", "ot", 1], ["fuse_yx", "ot", 0]]}], "r": [[0.06637090925, 0.06635481], 0, 5.817155838012695, 1578566272.3761635], "v": 0.1}
{"i": ["cuda", "schedule_conv3d_nchw_cuda", [[192, 1, 8, 8, 8], [192, 1, 8, 8, 8], 1, [1, 1, 1], [1, 1, 1], 1], {}, ["schedule_conv3d_nchw_cuda", [192, 1, 8, 8, 8], [192, 1, 8, 8, 8], 1, [1, 1, 1], [1, 1, 1], 1], {"i": 1894360315, "t": "", "c": null, "e": [["tile_n", "sp", [-1, 1, 6, 1]], ["tile_f", "sp", [-1, 4, 4, 6]], ["tile_d", "sp", [-1, 1, 1, 3]], ["tile_y", "sp", [-1, 1, 3, 1]], ["tile_x", "sp", [-1, 1, 1, 1]], ["tile_rc", "sp", [-1, 1]], ["tile_rd", "sp", [-1, 4]], ["tile_ry", "sp", [-1, 2]], ["tile_rx", "sp", [-1, 1]], ["auto_unroll_max_step", "ot", 512], ["unroll_explicit", "ot", 1], ["fuse_yx", "ot", 0]]}], "r": [[0.000687586, 0.00067418625], 0, 1.2818779945373535, 1578566521.4217777], "v": 0.1}
{"i": ["cuda", "schedule_conv3d_nchw_cuda", [[192, 1, 8, 8, 8], [192, 1, 8, 8, 8], 1, [1, 1, 1], [1, 1, 1], 1], {}, ["schedule_conv3d_nchw_cuda", [192, 1, 8, 8, 8], [192, 1, 8, 8, 8], 1, [1, 1, 1], [1, 1, 1], 1], {"i": 507094267, "t": "", "c": null, "e": [["tile_n", "sp", [-1, 1, 6, 1]], ["tile_f", "sp", [-1, 4, 4, 6]], ["tile_d", "sp", [-1, 1, 1, 3]], ["tile_y", "sp", [-1, 1, 3, 1]], ["tile_x", "sp", [-1, 1, 1, 1]], ["tile_rc", "sp", [-1, 1]], ["tile_rd", "sp", [-1, 4]], ["tile_ry", "sp", [-1, 2]], ["tile_rx", "sp", [-1, 1]], ["auto_unroll_max_step", "ot", 512], ["unroll_explicit", "ot", 0], ["fuse_yx", "ot", 0]]}], "r": [[0.00061324725, 0.0006307705], 0, 1.120478868484497, 1578566521.969107], "v": 0.1}
{"i": ["cuda", "schedule_conv3d_nchw_cuda", [[192, 1, 8, 8, 8], [192, 1, 8, 8, 8], 1, [1, 1, 1], [1, 1, 1], 1], {}, ["schedule_conv3d_nchw_cuda", [192, 1, 8, 8, 8], [192, 1, 8, 8, 8], 1, [1, 1, 1], [1, 1, 1], 1], {"i": 3511764678, "t": "", "c": null, "e": [["tile_n", "sp", [-1, 1, 4, 4]], ["tile_f", "sp", [-1, 3, 16, 1]], ["tile_d", "sp", [-1, 1, 3, 1]], ["tile_y", "sp", [-1, 1, 1, 1]], ["tile_x", "sp", [-1, 1, 1, 1]], ["tile_rc", "sp", [-1, 1]], ["tile_rd", "sp", [-1, 4]], ["tile_ry", "sp", [-1, 2]], ["tile_rx", "sp", [-1, 4]], ["auto_unroll_max_step", "ot", 512], ["unroll_explicit", "ot", 0], ["fuse_yx", "ot", 1]]}], "r": [[0.0005492355, 0.0005484655], 0, 1.3308115005493164, 1578566522.7166462], "v": 0.1}
{"i": ["cuda", "schedule_conv3d_nchw_cuda", [[192, 1, 8, 8, 8], [192, 1, 8, 8, 8], 1, [1, 1, 1], [1, 1, 1], 1], {}, ["schedule_conv3d_nchw_cuda", [192, 1, 8, 8, 8], [192, 1, 8, 8, 8], 1, [1, 1, 1], [1, 1, 1], 1], {"i": 969516283, "t": "", "c": null, "e": [["tile_n", "sp", [-1, 1, 6, 1]], ["tile_f", "sp", [-1, 4, 4, 6]], ["tile_d", "sp", [-1, 1, 1, 3]], ["tile_y", "sp", [-1, 1, 3, 1]], ["tile_x", "sp", [-1, 1, 1, 1]], ["tile_rc", "sp", [-1, 1]], ["tile_rd", "sp", [-1, 4]], ["tile_ry", "sp", [-1, 2]], ["tile_rx", "sp", [-1, 1]], ["auto_unroll_max_step", "ot", 1500], ["unroll_explicit", "ot", 0], ["fuse_yx", "ot", 0]]}], "r": [[0.00114592775, 0.00114382875], 0, 1.434004783630371, 1578566523.502278], "v": 0.1}
{"i": ["cuda", "schedule_conv3d_nchw_cuda", [[192, 1, 8, 8, 8], [192, 1, 8, 8, 8], 1, [1, 1, 1], [1, 1, 1], 1], {}, ["schedule_conv3d_nchw_cuda", [192, 1, 8, 8, 8], [192, 1, 8, 8, 8], 1, [1, 1, 1], [1, 1, 1], 1], {"i": 2356782331, "t": "", "c": null, "e": [["tile_n", "sp", [-1, 1, 6, 1]], ["tile_f", "sp", [-1, 4, 4, 6]], ["tile_d", "sp", [-1, 1, 1, 3]], ["tile_y", "sp", [-1, 1, 3, 1]], ["tile_x", "sp", [-1, 1, 1, 1]], ["tile_rc", "sp", [-1, 1]], ["tile_rd", "sp", [-1, 4]], ["tile_ry", "sp", [-1, 2]], ["tile_rx", "sp", [-1, 1]], ["auto_unroll_max_step", "ot", 1500], ["unroll_explicit", "ot", 1], ["fuse_yx", "ot", 0]]}], "r": [[0.0004883825, 0.0004872135], 0, 1.8008337020874023, 1578566524.2122288], "v": 0.1}
{"i": ["cuda", "schedule_conv3d_nchw_cuda", [[192, 1, 8, 8, 8], [192, 1, 8, 8, 8], 1, [1, 1, 1], [1, 1, 1], 1], {}, ["schedule_conv3d_nchw_cuda", [192, 1, 8, 8, 8], [192, 1, 8, 8, 8], 1, [1, 1, 1], [1, 1, 1], 1], {"i": 1431938299, "t": "", "c": null, "e": [["tile_n", "sp", [-1, 1, 6, 1]], ["tile_f", "sp", [-1, 4, 4, 6]], ["tile_d", "sp", [-1, 1, 1, 3]], ["tile_y", "sp", [-1, 1, 3, 1]], ["tile_x", "sp", [-1, 1, 1, 1]], ["tile_rc", "sp", [-1, 1]], ["tile_rd", "sp", [-1, 4]], ["tile_ry", "sp", [-1, 2]], ["tile_rx", "sp", [-1, 1]], ["auto_unroll_max_step", "ot", 0], ["unroll_explicit", "ot", 1], ["fuse_yx", "ot", 0]]}], "r": [[0.00062197975, 0.0006299815], 0, 1.1322267055511475, 1578566524.7602787], "v": 0.1}
{"i": ["cuda", "schedule_conv3d_nchw_cuda", [[192, 1, 8, 8, 8], [192, 1, 8, 8, 8], 1, [1, 1, 1], [1, 1, 1], 1], {}, ["schedule_conv3d_nchw_cuda", [192, 1, 8, 8, 8], [192, 1, 8, 8, 8], 1, [1, 1, 1], [1, 1, 1], 1], {"i": 44672251, "t": "", "c": null, "e": [["tile_n", "sp", [-1, 1, 6, 1]], ["tile_f", "sp", [-1, 4, 4, 6]], ["tile_d", "sp", [-1, 1, 1, 3]], ["tile_y", "sp", [-1, 1, 3, 1]], ["tile_x", "sp", [-1, 1, 1, 1]], ["tile_rc", "sp", [-1, 1]], ["tile_rd", "sp", [-1, 4]], ["tile_ry", "sp", [-1, 2]], ["tile_rx", "sp", [-1, 1]], ["auto_unroll_max_step", "ot", 0], ["unroll_explicit", "ot", 0], ["fuse_yx", "ot", 0]]}], "r": [[0.0006327965, 0.0006338605], 0, 1.0647730827331543, 1578566525.2660744], "v": 0.1}
{"i": ["cuda", "schedule_conv3d_nchw_cuda", [[192, 1, 8, 8, 8], [192, 1, 8, 8, 8], 1, [1, 1, 1], [1, 1, 1], 1], {}, ["schedule_conv3d_nchw_cuda", [192, 1, 8, 8, 8], [192, 1, 8, 8, 8], 1, [1, 1, 1], [1, 1, 1], 1], {"i": 507086592, "t": "", "c": null, "e": [["tile_n", "sp", [-1, 1, 2, 2]], ["tile_f", "sp", [-1, 3, 8, 4]], ["tile_d", "sp", [-1, 1, 1, 3]], ["tile_y", "sp", [-1, 1, 3, 1]], ["tile_x", "sp", [-1, 1, 1, 1]], ["tile_rc", "sp", [-1, 1]], ["tile_rd", "sp", [-1, 4]], ["tile_ry", "sp", [-1, 2]], ["tile_rx", "sp", [-1, 1]], ["auto_unroll_max_step", "ot", 512], ["unroll_explicit", "ot", 0], ["fuse_yx", "ot", 0]]}], "r": [[0.00082267175, 0.000820349], 0, 1.1671113967895508, 1578566525.8370042], "v": 0.1}
{"i": ["cuda", "schedule_conv3d_nchw_cuda", [[192, 1, 8, 8, 8], [192, 1, 8, 8, 8], 1, [1, 1, 1], [1, 1, 1], 1], {}, ["schedule_conv3d_nchw_cuda", [192, 1, 8, 8, 8], [192, 1, 8, 8, 8], 1, [1, 1, 1], [1, 1, 1], 1], {"i": 1894352640, "t": "", "c": null, "e": [["tile_n", "sp", [-1, 1, 2, 2]], ["tile_f", "sp", [-1, 3, 8, 4]], ["tile_d", "sp", [-1, 1, 1, 3]], ["tile_y", "sp", [-1, 1, 3, 1]], ["tile_x", "sp", [-1, 1, 1, 1]], ["tile_rc", "sp", [-1, 1]], ["tile_rd", "sp", [-1, 4]], ["tile_ry", "sp", [-1, 2]], ["tile_rx", "sp", [-1, 1]], ["auto_unroll_max_step", "ot", 512], ["unroll_explicit", "ot", 1], ["fuse_yx", "ot", 0]]}], "r": [[0.00082820625, 0.00082407825], 0, 1.2694201469421387, 1578566526.3975809], "v": 0.1}
{"i": ["cuda", "schedule_conv3d_nchw_cuda", [[192, 1, 8, 8, 8], [192, 1, 8, 8, 8], 1, [1, 1, 1], [1, 1, 1], 1], {}, ["schedule_conv3d_nchw_cuda", [192, 1, 8, 8, 8], [192, 1, 8, 8, 8], 1, [1, 1, 1], [1, 1, 1], 1], {"i": 3974186694, "t": "", "c": null, "e": [["tile_n", "sp", [-1, 1, 4, 4]], ["tile_f", "sp", [-1, 3, 16, 1]], ["tile_d", "sp", [-1, 1, 3, 1]], ["tile_y", "sp", [-1, 1, 1, 1]], ["tile_x", "sp", [-1, 1, 1, 1]], ["tile_rc", "sp", [-1, 1]], ["tile_rd", "sp", [-1, 4]], ["tile_ry", "sp", [-1, 2]], ["tile_rx", "sp", [-1, 4]], ["auto_unroll_max_step", "ot", 1500], ["unroll_explicit", "ot", 0], ["fuse_yx", "ot", 1]]}], "r": [[0.00055548725, 0.00055345275], 0, 1.0792787075042725, 1578566526.9250312], "v": 0.1}
{"i": ["cuda", "schedule_conv3d_nchw_cuda", [[192, 1, 8, 8, 8], [192, 1, 8, 8, 8], 1, [1, 1, 1], [1, 1, 1], 1], {}, ["schedule_conv3d_nchw_cuda", [192, 1, 8, 8, 8], [192, 1, 8, 8, 8], 1, [1, 1, 1], [1, 1, 1], 1], {"i": 2551529051, "t": "", "c": null, "e": [["tile_n", "sp", [-1, 2, 2, 3]], ["tile_f", "sp", [-1, 2, 8, 6]], ["tile_d", "sp", [-1, 1, 1, 1]], ["tile_y", "sp", [-1, 1, 3, 1]], ["tile_x", "sp", [-1, 1, 1, 1]], ["tile_rc", "sp", [-1, 1]], ["tile_rd", "sp", [-1, 2]], ["tile_ry", "sp", [-1, 1]], ["tile_rx", "sp", [-1, 4]], ["auto_unroll_max_step", "ot", 1500], ["unroll_explicit", "ot", 1], ["fuse_yx", "ot", 0]]}], "r": [[0.00049552825, 0.0005005645], 0, 1.5784118175506592, 1578566527.5543952], "v": 0.1}
{"i": ["cuda", "schedule_conv3d_nchw_cuda", [[192, 1, 8, 8, 8], [192, 1, 8, 8, 8], 1, [1, 1, 1], [1, 1, 1], 1], {}, ["schedule_conv3d_nchw_cuda", [192, 1, 8, 8, 8], [192, 1, 8, 8, 8], 1, [1, 1, 1], [1, 1, 1], 1], {"i": 1164263003, "t": "", "c": null, "e": [["tile_n", "sp", [-1, 2, 2, 3]], ["tile_f", "sp", [-1, 2, 8, 6]], ["tile_d", "sp", [-1, 1, 1, 1]], ["tile_y", "sp", [-1, 1, 3, 1]], ["tile_x", "sp", [-1, 1, 1, 1]], ["tile_rc", "sp", [-1, 1]], ["tile_rd", "sp", [-1, 2]], ["tile_ry", "sp", [-1, 1]], ["tile_rx", "sp", [-1, 4]], ["auto_unroll_max_step", "ot", 1500], ["unroll_explicit", "ot", 0], ["fuse_yx", "ot", 0]]}], "r": [[0.00056807275, 0.00056410425], 0, 1.1977620124816895, 1578566528.1811604], "v": 0.1}
{"i": ["cuda", "schedule_conv3d_nchw_cuda", [[192, 1, 8, 8, 8], [192, 1, 8, 8, 8], 1, [1, 1, 1], [1, 1, 1], 1], {}, ["schedule_conv3d_nchw_cuda", [192, 1, 8, 8, 8], [192, 1, 8, 8, 8], 1, [1, 1, 1], [1, 1, 1], 1], {"i": 1626685019, "t": "", "c": null, "e": [["tile_n", "sp", [-1, 2, 2, 3]], ["tile_f", "sp", [-1, 2, 8, 6]], ["tile_d", "sp", [-1, 1, 1, 1]], ["tile_y", "sp", [-1, 1, 3, 1]], ["tile_x", "sp", [-1, 1, 1, 1]], ["tile_rc", "sp", [-1, 1]], ["tile_rd", "sp", [-1, 2]], ["tile_ry", "sp", [-1, 1]], ["tile_rx", "sp", [-1, 4]], ["auto_unroll_max_step", "ot", 0], ["unroll_explicit", "ot", 1], ["fuse_yx", "ot", 0]]}], "r": [[0.00049148925, 0.0004943145], 0, 0.9629275798797607, 1578566530.0833828], "v": 0.1}
{"i": ["cuda", "schedule_conv3d_nchw_cuda", [[192, 1, 8, 8, 8], [192, 1, 8, 8, 8], 1, [1, 1, 1], [1, 1, 1], 1], {}, ["schedule_conv3d_nchw_cuda", [192, 1, 8, 8, 8], [192, 1, 8, 8, 8], 1, [1, 1, 1], [1, 1, 1], 1], {"i": 239418971, "t": "", "c": null, "e": [["tile_n", "sp", [-1, 2, 2, 3]], ["tile_f", "sp", [-1, 2, 8, 6]], ["tile_d", "sp", [-1, 1, 1, 1]], ["tile_y", "sp", [-1, 1, 3, 1]], ["tile_x", "sp", [-1, 1, 1, 1]], ["tile_rc", "sp", [-1, 1]], ["tile_rd", "sp", [-1, 2]], ["tile_ry", "sp", [-1, 1]], ["tile_rx", "sp", [-1, 4]], ["auto_unroll_max_step", "ot", 0], ["unroll_explicit", "ot", 0], ["fuse_yx", "ot", 0]]}], "r": [[0.000488188, 0.00048978525], 0, 1.001699686050415, 1578566530.5678985], "v": 0.1}
{"i": ["cuda", "schedule_conv3d_nchw_cuda", [[192, 1, 8, 8, 8], [192, 1, 8, 8, 8], 1, [1, 1, 1], [1, 1, 1], 1], {}, ["schedule_conv3d_nchw_cuda", [192, 1, 8, 8, 8], [192, 1, 8, 8, 8], 1, [1, 1, 1], [1, 1, 1], 1], {"i": 3511877574, "t": "", "c": null, "e": [["tile_n", "sp", [-1, 1, 4, 4]], ["tile_f", "sp", [-1, 3, 16, 1]], ["tile_d", "sp", [-1, 1, 1, 3]], ["tile_y", "sp", [-1, 1, 1, 1]], ["tile_x", "sp", [-1, 1, 1, 1]], ["tile_rc", "sp", [-1, 1]], ["tile_rd", "sp", [-1, 4]], ["tile_ry", "sp", [-1, 2]], ["tile_rx", "sp", [-1, 4]], ["auto_unroll_max_step", "ot", 512], ["unroll_explicit", "ot", 0], ["fuse_yx", "ot", 1]]}], "r": [[0.00042984475, 0.0004287685], 0, 1.175215482711792, 1578566531.171797], "v": 0.1}
{"i": ["cuda", "schedule_conv3d_nchw_cuda", [[192, 1, 8, 8, 8], [192, 1, 8, 8, 8], 1, [1, 1, 1], [1, 1, 1], 1], {}, ["schedule_conv3d_nchw_cuda", [192, 1, 8, 8, 8], [192, 1, 8, 8, 8], 1, [1, 1, 1], [1, 1, 1], 1], {"i": 4877375857, "t": "", "c": null, "e": [["tile_n", "sp", [-1, 1, 3, 4]], ["tile_f", "sp", [-1, 3, 8, 2]], ["tile_d", "sp", [-1, 1, 3, 1]], ["tile_y", "sp", [-1, 1, 1, 1]], ["tile_x", "sp", [-1, 1, 1, 1]], ["tile_rc", "sp", [-1, 1]], ["tile_rd", "sp", [-1, 8]], ["tile_ry", "sp", [-1, 1]], ["tile_rx", "sp", [-1, 4]], ["auto_unroll_max_step", "ot", 512], ["unroll_explicit", "ot", 1], ["fuse_yx", "ot", 1]]}], "r": [[0.00064774075, 0.00064808275], 0, 1.263798475265503, 1578566531.7443085], "v": 0.1}
{"i": ["cuda", "schedule_conv3d_nchw_cuda", [[192, 1, 8, 8, 8], [192, 1, 8, 8, 8], 1, [1, 1, 1], [1, 1, 1], 1], {}, ["schedule_conv3d_nchw_cuda", [192, 1, 8, 8, 8], [192, 1, 8, 8, 8], 1, [1, 1, 1], [1, 1, 1], 1], {"i": 3490109809, "t": "", "c": null, "e": [["tile_n", "sp", [-1, 1, 3, 4]], ["tile_f", "sp", [-1, 3, 8, 2]], ["tile_d", "sp", [-1, 1, 3, 1]], ["tile_y", "sp", [-1, 1, 1, 1]], ["tile_x", "sp", [-1, 1, 1, 1]], ["tile_rc", "sp", [-1, 1]], ["tile_rd", "sp", [-1, 8]], ["tile_ry", "sp", [-1, 1]], ["tile_rx", "sp", [-1, 4]], ["auto_unroll_max_step", "ot", 512], ["unroll_explicit", "ot", 0], ["fuse_yx", "ot", 1]]}], "r": [[0.000999269, 0.00100240825], 0, 1.2562108039855957, 1578566532.366954], "v": 0.1}
{"i": ["cuda", "schedule_conv3d_nchw_cuda", [[192, 1, 8, 8, 8], [192, 1, 8, 8, 8], 1, [1, 1, 1], [1, 1, 1], 1], {}, ["schedule_conv3d_nchw_cuda", [192, 1, 8, 8, 8], [192, 1, 8, 8, 8], 1, [1, 1, 1], [1, 1, 1], 1], {"i": 701840986, "t": "", "c": null, "e": [["tile_n", "sp", [-1, 1, 2, 3]], ["tile_f", "sp", [-1, 2, 8, 6]], ["tile_d", "sp", [-1, 1, 1, 1]], ["tile_y", "sp", [-1, 1, 3, 1]], ["tile_x", "sp", [-1, 1, 1, 1]], ["tile_rc", "sp", [-1, 1]], ["tile_rd", "sp", [-1, 2]], ["tile_ry", "sp", [-1, 1]], ["tile_rx", "sp", [-1, 4]], ["auto_unroll_max_step", "ot", 512], ["unroll_explicit", "ot", 0], ["fuse_yx", "ot", 0]]}], "r": [[0.0010233085, 0.00103401375], 0, 1.4006702899932861, 1578566533.2016165], "v": 0.1}
{"i": ["cuda", "schedule_conv3d_nchw_cuda", [[192, 1, 8, 8, 8], [192, 1, 8, 8, 8], 1, [1, 1, 1], [1, 1, 1], 1], {}, ["schedule_conv3d_nchw_cuda", [192, 1, 8, 8, 8], [192, 1, 8, 8, 8], 1, [1, 1, 1], [1, 1, 1], 1], {"i": 2089107034, "t": "", "c": null, "e": [["tile_n", "sp", [-1, 1, 2, 3]], ["tile_f", "sp", [-1, 2, 8, 6]], ["tile_d", "sp", [-1, 1, 1, 1]], ["tile_y", "sp", [-1, 1, 3, 1]], ["tile_x", "sp", [-1, 1, 1, 1]], ["tile_rc", "sp", [-1, 1]], ["tile_rd", "sp", [-1, 2]], ["tile_ry", "sp", [-1, 1]], ["tile_rx", "sp", [-1, 4]], ["auto_unroll_max_step", "ot", 512], ["unroll_explicit", "ot", 1], ["fuse_yx", "ot", 0]]}], "r": [[0.0010071315, 0.00100060125], 0, 1.4835073947906494, 1578566534.0081637], "v": 0.1}
{"i": ["cuda", "schedule_conv3d_nchw_cuda", [[192, 1, 8, 8, 8], [192, 1, 8, 8, 8], 1, [1, 1, 1], [1, 1, 1], 1], {}, ["schedule_conv3d_nchw_cuda", [192, 1, 8, 8, 8], [192, 1, 8, 8, 8], 1, [1, 1, 1], [1, 1, 1], 1], {"i": 1872336666, "t": "", "c": null, "e": [["tile_n", "sp", [-1, 2, 2, 4]], ["tile_f", "sp", [-1, 4, 6, 4]], ["tile_d", "sp", [-1, 1, 1, 1]], ["tile_y", "sp", [-1, 1, 3, 1]], ["tile_x", "sp", [-1, 1, 1, 1]], ["tile_rc", "sp", [-1, 1]], ["tile_rd", "sp", [-1, 8]], ["tile_ry", "sp", [-1, 1]], ["tile_rx", "sp", [-1, 1]], ["auto_unroll_max_step", "ot", 512], ["unroll_explicit", "ot", 1], ["fuse_yx", "ot", 0]]}], "r": [[0.00089327775, 0.0008982425], 0, 1.3639776706695557, 1578566534.5652044], "v": 0.1}
{"i": ["cuda", "schedule_conv3d_nchw_cuda", [[192, 1, 8, 8, 8], [192, 1, 8, 8, 8], 1, [1, 1, 1], [1, 1, 1], 1], {}, ["schedule_conv3d_nchw_cuda", [192, 1, 8, 8, 8], [192, 1, 8, 8, 8], 1, [1, 1, 1], [1, 1, 1], 1], {"i": 485070618, "t": "", "c": null, "e": [["tile_n", "sp", [-1, 2, 2, 4]], ["tile_f", "sp", [-1, 4, 6, 4]], ["tile_d", "sp", [-1, 1, 1, 1]], ["tile_y", "sp", [-1, 1, 3, 1]], ["tile_x", "sp", [-1, 1, 1, 1]], ["tile_rc", "sp", [-1, 1]], ["tile_rd", "sp", [-1, 8]], ["tile_ry", "sp", [-1, 1]], ["tile_rx", "sp", [-1, 1]], ["auto_unroll_max_step", "ot", 512], ["unroll_explicit", "ot", 0], ["fuse_yx", "ot", 0]]}], "r": [[0.001539342, 0.0015366605], 0, 1.2248561382293701, 1578566535.1840458], "v": 0.1}
{"i": ["cuda", "schedule_conv3d_nchw_cuda", [[192, 1, 8, 8, 8], [192, 1, 8, 8, 8], 1, [1, 1, 1], [1, 1, 1], 1], {}, ["schedule_conv3d_nchw_cuda", [192, 1, 8, 8, 8], [192, 1, 8, 8, 8], 1, [1, 1, 1], [1, 1, 1], 1], {"i": 22648602, "t": "", "c": null, "e": [["tile_n", "sp", [-1, 2, 2, 4]], ["tile_f", "sp", [-1, 4, 6, 4]], ["tile_d", "sp", [-1, 1, 1, 1]], ["tile_y", "sp", [-1, 1, 3, 1]], ["tile_x", "sp", [-1, 1, 1, 1]], ["tile_rc", "sp", [-1, 1]], ["tile_rd", "sp", [-1, 8]], ["tile_ry", "sp", [-1, 1]], ["tile_rx", "sp", [-1, 1]], ["auto_unroll_max_step", "ot", 0], ["unroll_explicit", "ot", 0], ["fuse_yx", "ot", 0]]}], "r": [[0.00093284175, 0.00090446175], 0, 1.225461483001709, 1578566535.7953787], "v": 0.1}
{"i": ["cuda", "schedule_conv3d_nchw_cuda", [[192, 1, 8, 8, 8], [192, 1, 8, 8, 8], 1, [1, 1, 1], [1, 1, 1], 1], {}, ["schedule_conv3d_nchw_cuda", [192, 1, 8, 8, 8], [192, 1, 8, 8, 8], 1, [1, 1, 1], [1, 1, 1], 1], {"i": 1409914650, "t": "", "c": null, "e": [["tile_n", "sp", [-1, 2, 2, 4]], ["tile_f", "sp", [-1, 4, 6, 4]], ["tile_d", "sp", [-1, 1, 1, 1]], ["tile_y", "sp", [-1, 1, 3, 1]], ["tile_x", "sp", [-1, 1, 1, 1]], ["tile_rc", "sp", [-1, 1]], ["tile_rd", "sp", [-1, 8]], ["tile_ry", "sp", [-1, 1]], ["tile_rx", "sp", [-1, 1]], ["auto_unroll_max_step", "ot", 0], ["unroll_explicit", "ot", 1], ["fuse_yx", "ot", 0]]}], "r": [[0.000916347, 0.0009357515], 0, 1.137406349182129, 1578566536.3260565], "v": 0.1}
{"i": ["cuda", "schedule_conv3d_nchw_cuda", [[192, 1, 8, 8, 8], [192, 1, 8, 8, 8], 1, [1, 1, 1], [1, 1, 1], 1], {}, ["schedule_conv3d_nchw_cuda", [192, 1, 8, 8, 8], [192, 1, 8, 8, 8], 1, [1, 1, 1], [1, 1, 1], 1], {"i": 3051826710, "t": "", "c": null, "e": [["tile_n", "sp", [-1, 1, 4, 4]], ["tile_f", "sp", [-1, 4, 16, 1]], ["tile_d", "sp", [-1, 1, 1, 1]], ["tile_y", "sp", [-1, 1, 3, 1]], ["tile_x", "sp", [-1, 3, 1, 1]], ["tile_rc", "sp", [-1, 1]], ["tile_rd", "sp", [-1, 4]], ["tile_ry", "sp", [-1, 2]], ["tile_rx", "sp", [-1, 4]], ["auto_unroll_max_step", "ot", 0], ["unroll_explicit", "ot", 0], ["fuse_yx", "ot", 1]]}], "r": [[0.0003430625, 0.0003418905], 0, 1.0187063217163086, 1578566536.8899891], "v": 0.1}
{"i": ["cuda", "schedule_conv3d_nchw_cuda", [[192, 1, 8, 8, 8], [192, 1, 8, 8, 8], 1, [1, 1, 1], [1, 1, 1], 1], {}, ["schedule_conv3d_nchw_cuda", [192, 1, 8, 8, 8], [192, 1, 8, 8, 8], 1, [1, 1, 1], [1, 1, 1], 1], {"i": 4439092758, "t": "", "c": null, "e": [["tile_n", "sp", [-1, 1, 4, 4]], ["tile_f", "sp", [-1, 4, 16, 1]], ["tile_d", "sp", [-1, 1, 1, 1]], ["tile_y", "sp", [-1, 1, 3, 1]], ["tile_x", "sp", [-1, 3, 1, 1]], ["tile_rc", "sp", [-1, 1]], ["tile_rd", "sp", [-1, 4]], ["tile_ry", "sp", [-1, 2]], ["tile_rx", "sp", [-1, 4]], ["auto_unroll_max_step", "ot", 0], ["unroll_explicit", "ot", 1], ["fuse_yx", "ot", 1]]}], "r": [[0.00034403975, 0.00034084925], 0, 1.0013713836669922, 1578566539.108031], "v": 0.1}
{"i": ["cuda", "schedule_conv3d_nchw_cuda", [[192, 1, 8, 8, 8], [192, 1, 8, 8, 8], 1, [1, 1, 1], [1, 1, 1], 1], {}, ["schedule_conv3d_nchw_cuda", [192, 1, 8, 8, 8], [192, 1, 8, 8, 8], 1, [1, 1, 1], [1, 1, 1], 1], {"i": 3514248726, "t": "", "c": null, "e": [["tile_n", "sp", [-1, 1, 4, 4]], ["tile_f", "sp", [-1, 4, 16, 1]], ["tile_d", "sp", [-1, 1, 1, 1]], ["tile_y", "sp", [-1, 1, 3, 1]], ["tile_x", "sp", [-1, 3, 1, 1]], ["tile_rc", "sp", [-1, 1]], ["tile_rd", "sp", [-1, 4]], ["tile_ry", "sp", [-1, 2]], ["tile_rx", "sp", [-1, 4]], ["auto_unroll_max_step", "ot", 512], ["unroll_explicit", "ot", 0], ["fuse_yx", "ot", 1]]}], "r": [[0.00027275775, 0.0002743085], 0, 1.2632176876068115, 1578566539.696099], "v": 0.1}
{"i": ["cuda", "schedule_conv3d_nchw_cuda", [[192, 1, 8, 8, 8], [192, 1, 8, 8, 8], 1, [1, 1, 1], [1, 1, 1], 1], {}, ["schedule_conv3d_nchw_cuda", [192, 1, 8, 8, 8], [192, 1, 8, 8, 8], 1, [1, 1, 1], [1, 1, 1], 1], {"i": 4322828987, "t": "", "c": null, "e": [["tile_n", "sp", [-1, 2, 2, 3]], ["tile_f", "sp", [-1, 4, 6, 2]], ["tile_d", "sp", [-1, 1, 3, 1]], ["tile_y", "sp", [-1, 1, 1, 1]], ["tile_x", "sp", [-1, 3, 1, 1]], ["tile_rc", "sp", [-1, 1]], ["tile_rd", "sp", [-1, 4]], ["tile_ry", "sp", [-1, 2]], ["tile_rx", "sp", [-1, 2]], ["auto_unroll_max_step", "ot", 0], ["unroll_explicit", "ot", 1], ["fuse_yx", "ot", 1]]}], "r": [[0.00096891575, 0.00097076875], 0, 1.3687138557434082, 1578566540.3387136], "v": 0.1}
{"i": ["cuda", "schedule_conv3d_nchw_cuda", [[192, 1, 8, 8, 8], [192, 1, 8, 8, 8], 1, [1, 1, 1], [1, 1, 1], 1], {}, ["schedule_conv3d_nchw_cuda", [192, 1, 8, 8, 8], [192, 1, 8, 8, 8], 1, [1, 1, 1], [1, 1, 1], 1], {"i": 3397984955, "t": "", "c": null, "e": [["tile_n", "sp", [-1, 2, 2, 3]], ["tile_f", "sp", [-1, 4, 6, 2]], ["tile_d", "sp", [-1, 1, 3, 1]], ["tile_y", "sp", [-1, 1, 1, 1]], ["tile_x", "sp", [-1, 3, 1, 1]], ["tile_rc", "sp", [-1, 1]], ["tile_rd", "sp", [-1, 4]], ["tile_ry", "sp", [-1, 2]], ["tile_rx", "sp", [-1, 2]], ["auto_unroll_max_step", "ot", 512], ["unroll_explicit", "ot", 0], ["fuse_yx", "ot", 1]]}], "r": [[0.0006106735, 0.00061228625], 0, 1.6308696269989014, 1578566541.0693457], "v": 0.1}
{"i": ["cuda", "schedule_conv3d_nchw_cuda", [[192, 1, 8, 8, 8], [192, 1, 8, 8, 8], 1, [1, 1, 1], [1, 1, 1], 1], {}, ["schedule_conv3d_nchw_cuda", [192, 1, 8, 8, 8], [192, 1, 8, 8, 8], 1, [1, 1, 1], [1, 1, 1], 1], {"i": 2935562939, "t": "", "c": null, "e": [["tile_n", "sp", [-1, 2, 2, 3]], ["tile_f", "sp", [-1, 4, 6, 2]], ["tile_d", "sp", [-1, 1, 3, 1]], ["tile_y", "sp", [-1, 1, 1, 1]], ["tile_x", "sp", [-1, 3, 1, 1]], ["tile_rc", "sp", [-1, 1]], ["tile_rd", "sp", [-1, 4]], ["tile_ry", "sp", [-1, 2]], ["tile_rx", "sp", [-1, 2]], ["auto_unroll_max_step", "ot", 0], ["unroll_explicit", "ot", 0], ["fuse_yx", "ot", 1]]}], "r": [[0.00097810025, 0.0009801725], 0, 1.1718697547912598, 1578566541.5876791], "v": 0.1}
{"i": ["cuda", "schedule_conv3d_nchw_cuda", [[192, 1, 8, 8, 8], [192, 1, 8, 8, 8], 1, [1, 1, 1], [1, 1, 1], 1], {}, ["schedule_conv3d_nchw_cuda", [192, 1, 8, 8, 8], [192, 1, 8, 8, 8], 1, [1, 1, 1], [1, 1, 1], 1], {"i": 4785251003, "t": "", "c": null, "e": [["tile_n", "sp", [-1, 2, 2, 3]], ["tile_f", "sp", [-1, 4, 6, 2]], ["tile_d", "sp", [-1, 1, 3, 1]], ["tile_y", "sp", [-1, 1, 1, 1]], ["tile_x", "sp", [-1, 3, 1, 1]], ["tile_rc", "sp", [-1, 1]], ["tile_rd", "sp", [-1, 4]], ["tile_ry", "sp", [-1, 2]], ["tile_rx", "sp", [-1, 2]], ["auto_unroll_max_step", "ot", 512], ["unroll_explicit", "ot", 1], ["fuse_yx", "ot", 1]]}], "r": [[0.00064826975, 0.00064451875], 0, 1.9059545993804932, 1578566542.263078], "v": 0.1}
{"i": ["cuda", "schedule_conv3d_nchw_cuda", [[192, 1, 8, 8, 8], [192, 1, 8, 8, 8], 1, [1, 1, 1], [1, 1, 1], 1], {}, ["schedule_conv3d_nchw_cuda", [192, 1, 8, 8, 8], [192, 1, 8, 8, 8], 1, [1, 1, 1], [1, 1, 1], 1], {"i": 969508608, "t": "", "c": null, "e": [["tile_n", "sp", [-1, 1, 2, 2]], ["tile_f", "sp", [-1, 3, 8, 4]], ["tile_d", "sp", [-1, 1, 1, 3]], ["tile_y", "sp", [-1, 1, 3, 1]], ["tile_x", "sp", [-1, 1, 1, 1]], ["tile_rc", "sp", [-1, 1]], ["tile_rd", "sp", [-1, 4]], ["tile_ry", "sp", [-1, 2]], ["tile_rx", "sp", [-1, 1]], ["auto_unroll_max_step", "ot", 1500], ["unroll_explicit", "ot", 0], ["fuse_yx", "ot", 0]]}], "r": [[0.00045340325, 0.00045265875], 0, 1.3686554431915283, 1578566542.99875], "v": 0.1}
{"i": ["cuda", "schedule_conv3d_nchw_cuda", [[192, 1, 8, 8, 8], [192, 1, 8, 8, 8], 1, [1, 1, 1], [1, 1, 1], 1], {}, ["schedule_conv3d_nchw_cuda", [192, 1, 8, 8, 8], [192, 1, 8, 8, 8], 1, [1, 1, 1], [1, 1, 1], 1], {"i": 1898752570, "t": "", "c": null, "e": [["tile_n", "sp", [-1, 1, 3, 2]], ["tile_f", "sp", [-1, 4, 4, 4]], ["tile_d", "sp", [-1, 1, 3, 1]], ["tile_y", "sp", [-1, 1, 1, 1]], ["tile_x", "sp", [-1, 1, 1, 3]], ["tile_rc", "sp", [-1, 1]], ["tile_rd", "sp", [-1, 4]], ["tile_ry", "sp", [-1, 2]], ["tile_rx", "sp", [-1, 1]], ["auto_unroll_max_step", "ot", 512], ["unroll_explicit", "ot", 1], ["fuse_yx", "ot", 0]]}], "r": [[0.000585289, 0.00058408025], 0, 1.3945627212524414, 1578566543.5733147], "v": 0.1}
{"i": ["cuda", "schedule_conv3d_nchw_cuda", [[192, 1, 8, 8, 8], [192, 1, 8, 8, 8], 1, [1, 1, 1], [1, 1, 1], 1], {}, ["schedule_conv3d_nchw_cuda", [192, 1, 8, 8, 8], [192, 1, 8, 8, 8], 1, [1, 1, 1], [1, 1, 1], 1], {"i": 511486522, "t": "", "c": null, "e": [["tile_n", "sp", [-1, 1, 3, 2]], ["tile_f", "sp", [-1, 4, 4, 4]], ["tile_d", "sp", [-1, 1, 3, 1]], ["tile_y", "sp", [-1, 1, 1, 1]], ["tile_x", "sp", [-1, 1, 1, 3]], ["tile_rc", "sp", [-1, 1]], ["tile_rd", "sp", [-1, 4]], ["tile_ry", "sp", [-1, 2]], ["tile_rx", "sp", [-1, 1]], ["auto_unroll_max_step", "ot", 512], ["unroll_explicit", "ot", 0], ["fuse_yx", "ot", 0]]}], "r": [[0.00066273, 0.00066256475], 0, 1.1939992904663086, 1578566544.1624322], "v": 0.1}
{"i": ["cuda", "schedule_conv3d_nchw_cuda", [[192, 1, 8, 8, 8], [192, 1, 8, 8, 8], 1, [1, 1, 1], [1, 1, 1], 1], {}, ["schedule_conv3d_nchw_cuda", [192, 1, 8, 8, 8], [192, 1, 8, 8, 8], 1, [1, 1, 1], [1, 1, 1], 1], {"i": 44664576, "t": "", "c": null, "e": [["tile_n", "sp", [-1, 1, 2, 2]], ["tile_f", "sp", [-1, 3, 8, 4]], ["tile_d", "sp", [-1, 1, 1, 3]], ["tile_y", "sp", [-1, 1, 3, 1]], ["tile_x", "sp", [-1, 1, 1, 1]], ["tile_rc", "sp", [-1, 1]], ["tile_rd", "sp", [-1, 4]], ["tile_ry", "sp", [-1, 2]], ["tile_rx", "sp", [-1, 1]], ["auto_unroll_max_step", "ot", 0], ["unroll_explicit", "ot", 0], ["fuse_yx", "ot", 0]]}], "r": [[0.00080333875, 0.00082249], 0, 1.104175090789795, 1578566544.725107], "v": 0.1}
{"i": ["cuda", "schedule_conv3d_nchw_cuda", [[192, 1, 8, 8, 8], [192, 1, 8, 8, 8], 1, [1, 1, 1], [1, 1, 1], 1], {}, ["schedule_conv3d_nchw_cuda", [192, 1, 8, 8, 8], [192, 1, 8, 8, 8], 1, [1, 1, 1], [1, 1, 1], 1], {"i": 506970752, "t": "", "c": null, "e": [["tile_n", "sp", [-1, 2, 1, 4]], ["tile_f", "sp", [-1, 4, 4, 4]], ["tile_d", "sp", [-1, 1, 3, 1]], ["tile_y", "sp", [-1, 1, 3, 1]], ["tile_x", "sp", [-1, 1, 1, 1]], ["tile_rc", "sp", [-1, 1]], ["tile_rd", "sp", [-1, 4]], ["tile_ry", "sp", [-1, 2]], ["tile_rx", "sp", [-1, 1]], ["auto_unroll_max_step", "ot", 512], ["unroll_explicit", "ot", 0], ["fuse_yx", "ot", 0]]}], "r": [[0.00039477225, 0.000394694], 0, 1.2984213829040527, 1578566545.3423991], "v": 0.1}
{"i": ["cuda", "schedule_conv3d_nchw_cuda", [[192, 1, 8, 8, 8], [192, 1, 8, 8, 8], 1, [1, 1, 1], [1, 1, 1], 1], {}, ["schedule_conv3d_nchw_cuda", [192, 1, 8, 8, 8], [192, 1, 8, 8, 8], 1, [1, 1, 1], [1, 1, 1], 1], {"i": 44548736, "t": "", "c": null, "e": [["tile_n", "sp", [-1, 2, 1, 4]], ["tile_f", "sp", [-1, 4, 4, 4]], ["tile_d", "sp", [-1, 1, 3, 1]], ["tile_y", "sp", [-1, 1, 3, 1]], ["tile_x", "sp", [-1, 1, 1, 1]], ["tile_rc", "sp", [-1, 1]], ["tile_rd", "sp", [-1, 4]], ["tile_ry", "sp", [-1, 2]], ["tile_rx", "sp", [-1, 1]], ["auto_unroll_max_step", "ot", 0], ["unroll_explicit", "ot", 0], ["fuse_yx", "ot", 0]]}], "r": [[0.0004170855, 0.0004158435], 0, 1.26100754737854, 1578566545.9399002], "v": 0.1}
{"i": ["cuda", "schedule_conv3d_nchw_cuda", [[192, 1, 8, 8, 8], [192, 1, 8, 8, 8], 1, [1, 1, 1], [1, 1, 1], 1], {}, ["schedule_conv3d_nchw_cuda", [192, 1, 8, 8, 8], [192, 1, 8, 8, 8], 1, [1, 1, 1], [1, 1, 1], 1], {"i": 1431814784, "t": "", "c": null, "e": [["tile_n", "sp", [-1, 2, 1, 4]], ["tile_f", "sp", [-1, 4, 4, 4]], ["tile_d", "sp", [-1, 1, 3, 1]], ["tile_y", "sp", [-1, 1, 3, 1]], ["tile_x", "sp", [-1, 1, 1, 1]], ["tile_rc", "sp", [-1, 1]], ["tile_rd", "sp", [-1, 4]], ["tile_ry", "sp", [-1, 2]], ["tile_rx", "sp", [-1, 1]], ["auto_unroll_max_step", "ot", 0], ["unroll_explicit", "ot", 1], ["fuse_yx", "ot", 0]]}], "r": [[0.00041691625, 0.000417268], 0, 1.1182043552398682, 1578566548.1382492], "v": 0.1}
{"i": ["cuda", "schedule_conv3d_nchw_cuda", [[192, 1, 8, 8, 8], [192, 1, 8, 8, 8], 1, [1, 1, 1], [1, 1, 1], 1], {}, ["schedule_conv3d_nchw_cuda", [192, 1, 8, 8, 8], [192, 1, 8, 8, 8], 1, [1, 1, 1], [1, 1, 1], 1], {"i": 506970730, "t": "", "c": null, "e": [["tile_n", "sp", [-1, 1, 2, 3]], ["tile_f", "sp", [-1, 4, 4, 4]], ["tile_d", "sp", [-1, 1, 3, 1]], ["tile_y", "sp", [-1, 1, 3, 1]], ["tile_x", "sp", [-1, 1, 1, 1]], ["tile_rc", "sp", [-1, 1]], ["tile_rd", "sp", [-1, 4]], ["tile_ry", "sp", [-1, 2]], ["tile_rx", "sp", [-1, 1]], ["auto_unroll_max_step", "ot", 512], ["unroll_explicit", "ot", 0], ["fuse_yx", "ot", 0]]}], "r": [[0.000467027, 0.00046514225], 0, 1.1999530792236328, 1578566548.772537], "v": 0.1}
{"i": ["cuda", "schedule_conv3d_nchw_cuda", [[192, 1, 8, 8, 8], [192, 1, 8, 8, 8], 1, [1, 1, 1], [1, 1, 1], 1], {}, ["schedule_conv3d_nchw_cuda", [192, 1, 8, 8, 8], [192, 1, 8, 8, 8], 1, [1, 1, 1], [1, 1, 1], 1], {"i": 1894236778, "t": "", "c": null, "e": [["tile_n", "sp", [-1, 1, 2, 3]], ["tile_f", "sp", [-1, 4, 4, 4]], ["tile_d", "sp", [-1, 1, 3, 1]], ["tile_y", "sp", [-1, 1, 3, 1]], ["tile_x", "sp", [-1, 1, 1, 1]], ["tile_rc", "sp", [-1, 1]], ["tile_rd", "sp", [-1, 4]], ["tile_ry", "sp", [-1, 2]], ["tile_rx", "sp", [-1, 1]], ["auto_unroll_max_step", "ot", 512], ["unroll_explicit", "ot", 1], ["fuse_yx", "ot", 0]]}], "r": [[0.00050244325, 0.000491469], 0, 1.5732073783874512, 1578566549.412122], "v": 0.1}
{"i": ["cuda", "schedule_conv3d_nchw_cuda", [[192, 1, 8, 8, 8], [192, 1, 8, 8, 8], 1, [1, 1, 1], [1, 1, 1], 1], {}, ["schedule_conv3d_nchw_cuda", [192, 1, 8, 8, 8], [192, 1, 8, 8, 8], 1, [1, 1, 1], [1, 1, 1], 1], {"i": 4986412553, "t": "", "c": null, "e": [["tile_n", "sp", [-1, 1, 2, 4]], ["tile_f", "sp", [-1, 4, 16, 1]], ["tile_d", "sp", [-1, 1, 1, 1]], ["tile_y", "sp", [-1, 1, 3, 1]], ["tile_x", "sp", [-1, 1, 1, 1]], ["tile_rc", "sp", [-1, 1]], ["tile_rd", "sp", [-1, 4]], ["tile_ry", "sp", [-1, 1]], ["tile_rx", "sp", [-1, 8]], ["auto_unroll_max_step", "ot", 512], ["unroll_explicit", "ot", 1], ["fuse_yx", "ot", 1]]}], "r": [[0.0007951585, 0.00080336475], 0, 1.722496747970581, 1578566550.0319655], "v": 0.1}
{"i": ["cuda", "schedule_conv3d_nchw_cuda", [[192, 1, 8, 8, 8], [192, 1, 8, 8, 8], 1, [1, 1, 1], [1, 1, 1], 1], {}, ["schedule_conv3d_nchw_cuda", [192, 1, 8, 8, 8], [192, 1, 8, 8, 8], 1, [1, 1, 1], [1, 1, 1], 1], {"i": 3599146505, "t": "", "c": null, "e": [["tile_n", "sp", [-1, 1, 2, 4]], ["tile_f", "sp", [-1, 4, 16, 1]], ["tile_d", "sp", [-1, 1, 1, 1]], ["tile_y", "sp", [-1, 1, 3, 1]], ["tile_x", "sp", [-1, 1, 1, 1]], ["tile_rc", "sp", [-1, 1]], ["tile_rd", "sp", [-1, 4]], ["tile_ry", "sp", [-1, 1]], ["tile_rx", "sp", [-1, 8]], ["auto_unroll_max_step", "ot", 512], ["unroll_explicit", "ot", 0], ["fuse_yx", "ot", 1]]}], "r": [[0.00082122425, 0.00081831125], 0, 1.2720658779144287, 1578566550.683687], "v": 0.1}
{"i": ["cuda", "schedule_conv3d_nchw_cuda", [[192, 1, 8, 8, 8], [192, 1, 8, 8, 8], 1, [1, 1, 1], [1, 1, 1], 1], {}, ["schedule_conv3d_nchw_cuda", [192, 1, 8, 8, 8], [192, 1, 8, 8, 8], 1, [1, 1, 1], [1, 1, 1], 1], {"i": 485183514, "t": "", "c": null, "e": [["tile_n", "sp", [-1, 2, 2, 4]], ["tile_f", "sp", [-1, 4, 6, 4]], ["tile_d", "sp", [-1, 3, 1, 1]], ["tile_y", "sp", [-1, 1, 3, 1]], ["tile_x", "sp", [-1, 1, 1, 1]], ["tile_rc", "sp", [-1, 1]], ["tile_rd", "sp", [-1, 8]], ["tile_ry", "sp", [-1, 1]], ["tile_rx", "sp", [-1, 1]], ["auto_unroll_max_step", "ot", 512], ["unroll_explicit", "ot", 0], ["fuse_yx", "ot", 0]]}], "r": [[0.005790553, 0.0058103285], 0, 1.9936001300811768, 1578566551.5267215], "v": 0.1}
{"i": ["cuda", "schedule_conv3d_nchw_cuda", [[192, 1, 8, 8, 8], [192, 1, 8, 8, 8], 1, [1, 1, 1], [1, 1, 1], 1], {}, ["schedule_conv3d_nchw_cuda", [192, 1, 8, 8, 8], [192, 1, 8, 8, 8], 1, [1, 1, 1], [1, 1, 1], 1], {"i": 22761498, "t": "", "c": null, "e": [["tile_n", "sp", [-1, 2, 2, 4]], ["tile_f", "sp", [-1, 4, 6, 4]], ["tile_d", "sp", [-1, 3, 1, 1]], ["tile_y", "sp", [-1, 1, 3, 1]], ["tile_x", "sp", [-1, 1, 1, 1]], ["tile_rc", "sp", [-1, 1]], ["tile_rd", "sp", [-1, 8]], ["tile_ry", "sp", [-1, 1]], ["tile_rx", "sp", [-1, 1]], ["auto_unroll_max_step", "ot", 0], ["unroll_explicit", "ot", 0], ["fuse_yx", "ot", 0]]}], "r": [[0.018298638, 0.0182377595], 0, 1.9137492179870605, 1578566552.3937283], "v": 0.1}
{"i": ["cuda", "schedule_conv3d_nchw_cuda", [[192, 1, 8, 8, 8], [192, 1, 8, 8, 8], 1, [1, 1, 1], [1, 1, 1], 1], {}, ["schedule_conv3d_nchw_cuda", [192, 1, 8, 8, 8], [192, 1, 8, 8, 8], 1, [1, 1, 1], [1, 1, 1], 1], {"i": 1410027546, "t": "", "c": null, "e": [["tile_n", "sp", [-1, 2, 2, 4]], ["tile_f", "sp", [-1, 4, 6, 4]], ["tile_d", "sp", [-1, 3, 1, 1]], ["tile_y", "sp", [-1, 1, 3, 1]], ["tile_x", "sp", [-1, 1, 1, 1]], ["tile_rc", "sp", [-1, 1]], ["tile_rd", "sp", [-1, 8]], ["tile_ry", "sp", [-1, 1]], ["tile_rx", "sp", [-1, 1]], ["auto_unroll_max_step", "ot", 0], ["unroll_explicit", "ot", 1], ["fuse_yx", "ot", 0]]}], "r": [[0.01816444875, 0.0181938545], 0, 1.7221193313598633, 1578566553.058715], "v": 0.1}
{"i": ["cuda", "schedule_conv3d_nchw_cuda", [[192, 1, 8, 8, 8], [192, 1, 8, 8, 8], 1, [1, 1, 1], [1, 1, 1], 1], {}, ["schedule_conv3d_nchw_cuda", [192, 1, 8, 8, 8], [192, 1, 8, 8, 8], 1, [1, 1, 1], [1, 1, 1], 1], {"i": 485071936, "t": "", "c": null, "e": [["tile_n", "sp", [-1, 1, 4, 3]], ["tile_f", "sp", [-1, 3, 8, 4]], ["tile_d", "sp", [-1, 1, 1, 1]], ["tile_y", "sp", [-1, 1, 3, 1]], ["tile_x", "sp", [-1, 1, 1, 1]], ["tile_rc", "sp", [-1, 1]], ["tile_rd", "sp", [-1, 8]], ["tile_ry", "sp", [-1, 1]], ["tile_rx", "sp", [-1, 1]], ["auto_unroll_max_step", "ot", 512], ["unroll_explicit", "ot", 0], ["fuse_yx", "ot", 0]]}], "r": [[0.000542507, 0.0005430615], 0, 1.1873466968536377, 1578566553.7192879], "v": 0.1}
{"i": ["cuda", "schedule_conv3d_nchw_cuda", [[192, 1, 8, 8, 8], [192, 1, 8, 8, 8], 1, [1, 1, 1], [1, 1, 1], 1], {}, ["schedule_conv3d_nchw_cuda", [192, 1, 8, 8, 8], [192, 1, 8, 8, 8], 1, [1, 1, 1], [1, 1, 1], 1], {"i": 1872337984, "t": "", "c": null, "e": [["tile_n", "sp", [-1, 1, 4, 3]], ["tile_f", "sp", [-1, 3, 8, 4]], ["tile_d", "sp", [-1, 1, 1, 1]], ["tile_y", "sp", [-1, 1, 3, 1]], ["tile_x", "sp", [-1, 1, 1, 1]], ["tile_rc", "sp", [-1, 1]], ["tile_rd", "sp", [-1, 8]], ["tile_ry", "sp", [-1, 1]], ["tile_rx", "sp", [-1, 1]], ["auto_unroll_max_step", "ot", 512], ["unroll_explicit", "ot", 1], ["fuse_yx", "ot", 0]]}], "r": [[0.00054639975, 0.00054669125], 0, 1.3550148010253906, 1578566554.3843403], "v": 0.1}
{"i": ["cuda", "schedule_conv3d_nchw_cuda", [[192, 1, 8, 8, 8], [192, 1, 8, 8, 8], 1, [1, 1, 1], [1, 1, 1], 1], {}, ["schedule_conv3d_nchw_cuda", [192, 1, 8, 8, 8], [192, 1, 8, 8, 8], 1, [1, 1, 1], [1, 1, 1], 1], {"i": 3952531825, "t": "", "c": null, "e": [["tile_n", "sp", [-1, 1, 3, 4]], ["tile_f", "sp", [-1, 3, 8, 2]], ["tile_d", "sp", [-1, 1, 3, 1]], ["tile_y", "sp", [-1, 1, 1, 1]], ["tile_x", "sp", [-1, 1, 1, 1]], ["tile_rc", "sp", [-1, 1]], ["tile_rd", "sp", [-1, 8]], ["tile_ry", "sp", [-1, 1]], ["tile_rx", "sp", [-1, 4]], ["auto_unroll_max_step", "ot", 1500], ["unroll_explicit", "ot", 0], ["fuse_yx", "ot", 1]]}], "r": [[0.0008195415, 0.000817278], 0, 1.3836817741394043, 1578566555.1100106], "v": 0.1}
{"i": ["cuda", "schedule_conv3d_nchw_cuda", [[192, 1, 8, 8, 8], [192, 1, 8, 8, 8], 1, [1, 1, 1], [1, 1, 1], 1], {}, ["schedule_conv3d_nchw_cuda", [192, 1, 8, 8, 8], [192, 1, 8, 8, 8], 1, [1, 1, 1], [1, 1, 1], 1], {"i": 3022815035, "t": "", "c": null, "e": [["tile_n", "sp", [-1, 2, 3, 2]], ["tile_f", "sp", [-1, 2, 32, 1]], ["tile_d", "sp", [-1, 1, 1, 3]], ["tile_y", "sp", [-1, 3, 1, 1]], ["tile_x", "sp", [-1, 3, 1, 1]], ["tile_rc", "sp", [-1, 1]], ["tile_rd", "sp", [-1, 4]], ["tile_ry", "sp", [-1, 1]], ["tile_rx", "sp", [-1, 4]], ["auto_unroll_max_step", "ot", 0], ["unroll_explicit", "ot", 0], ["fuse_yx", "ot", 1]]}], "r": [[0.0005535035, 0.00055166625], 0, 1.467128038406372, 1578566555.86833], "v": 0.1}
{"i": ["cuda", "schedule_conv3d_nchw_cuda", [[192, 1, 8, 8, 8], [192, 1, 8, 8, 8], 1, [1, 1, 1], [1, 1, 1], 1], {}, ["schedule_conv3d_nchw_cuda", [192, 1, 8, 8, 8], [192, 1, 8, 8, 8], 1, [1, 1, 1], [1, 1, 1], 1], {"i": 5334925115, "t": "", "c": null, "e": [["tile_n", "sp", [-1, 2, 3, 2]], ["tile_f", "sp", [-1, 2, 32, 1]], ["tile_d", "sp", [-1, 1, 1, 3]], ["tile_y", "sp", [-1, 3, 1, 1]], ["tile_x", "sp", [-1, 3, 1, 1]], ["tile_rc", "sp", [-1, 1]], ["tile_rd", "sp", [-1, 4]], ["tile_ry", "sp", [-1, 1]], ["tile_rx", "sp", [-1, 4]], ["auto_unroll_max_step", "ot", 1500], ["unroll_explicit", "ot", 1], ["fuse_yx", "ot", 1]]}], "r": [[0.0005655305, 0.00056433225], 0, 3.0241048336029053, 1578566559.2344754], "v": 0.1}
{"i": ["cuda", "schedule_conv3d_nchw_cuda", [[192, 1, 8, 8, 8], [192, 1, 8, 8, 8], 1, [1, 1, 1], [1, 1, 1], 1], {}, ["schedule_conv3d_nchw_cuda", [192, 1, 8, 8, 8], [192, 1, 8, 8, 8], 1, [1, 1, 1], [1, 1, 1], 1], {"i": 4410081083, "t": "", "c": null, "e": [["tile_n", "sp", [-1, 2, 3, 2]], ["tile_f", "sp", [-1, 2, 32, 1]], ["tile_d", "sp", [-1, 1, 1, 3]], ["tile_y", "sp", [-1, 3, 1, 1]], ["tile_x", "sp", [-1, 3, 1, 1]], ["tile_rc", "sp", [-1, 1]], ["tile_rd", "sp", [-1, 4]], ["tile_ry", "sp", [-1, 1]], ["tile_rx", "sp", [-1, 4]], ["auto_unroll_max_step", "ot", 0], ["unroll_explicit", "ot", 1], ["fuse_yx", "ot", 1]]}], "r": [[0.0005540095, 0.00055427475], 0, 1.3271396160125732, 1578566559.7447298], "v": 0.1}
{"i": ["cuda", "schedule_conv3d_nchw_cuda", [[192, 1, 8, 8, 8], [192, 1, 8, 8, 8], 1, [1, 1, 1], [1, 1, 1], 1], {}, ["schedule_conv3d_nchw_cuda", [192, 1, 8, 8, 8], [192, 1, 8, 8, 8], 1, [1, 1, 1], [1, 1, 1], 1], {"i": 4872503099, "t": "", "c": null, "e": [["tile_n", "sp", [-1, 2, 3, 2]], ["tile_f", "sp", [-1, 2, 32, 1]], ["tile_d", "sp", [-1, 1, 1, 3]], ["tile_y", "sp", [-1, 3, 1, 1]], ["tile_x", "sp", [-1, 3, 1, 1]], ["tile_rc", "sp", [-1, 1]], ["tile_rd", "sp", [-1, 4]], ["tile_ry", "sp", [-1, 1]], ["tile_rx", "sp", [-1, 4]], ["auto_unroll_max_step", "ot", 512], ["unroll_explicit", "ot", 1], ["fuse_yx", "ot", 1]]}], "r": [[0.00056370525, 0.0005631805], 0, 2.1576008796691895, 1578566560.5369127], "v": 0.1}
{"i": ["cuda", "schedule_conv3d_nchw_cuda", [[192, 1, 8, 8, 8], [192, 1, 8, 8, 8], 1, [1, 1, 1], [1, 1, 1], 1], {}, ["schedule_conv3d_nchw_cuda", [192, 1, 8, 8, 8], [192, 1, 8, 8, 8], 1, [1, 1, 1], [1, 1, 1], 1], {"i": 3947659067, "t": "", "c": null, "e": [["tile_n", "sp", [-1, 2, 3, 2]], ["tile_f", "sp", [-1, 2, 32, 1]], ["tile_d", "sp", [-1, 1, 1, 3]], ["tile_y", "sp", [-1, 3, 1, 1]], ["tile_x", "sp", [-1, 3, 1, 1]], ["tile_rc", "sp", [-1, 1]], ["tile_rd", "sp", [-1, 4]], ["tile_ry", "sp", [-1, 1]], ["tile_rx", "sp", [-1, 4]], ["auto_unroll_max_step", "ot", 1500], ["unroll_explicit", "ot", 0], ["fuse_yx", "ot", 1]]}], "r": [[0.0008105, 0.0008085605], 0, 2.143594741821289, 1578566561.428143], "v": 0.1}
{"i": ["cuda", "schedule_conv3d_nchw_cuda", [[192, 1, 8, 8, 8], [192, 1, 8, 8, 8], 1, [1, 1, 1], [1, 1, 1], 1], {}, ["schedule_conv3d_nchw_cuda", [192, 1, 8, 8, 8], [192, 1, 8, 8, 8], 1, [1, 1, 1], [1, 1, 1], 1], {"i": 3485237051, "t": "", "c": null, "e": [["tile_n", "sp", [-1, 2, 3, 2]], ["tile_f", "sp", [-1, 2, 32, 1]], ["tile_d", "sp", [-1, 1, 1, 3]], ["tile_y", "sp", [-1, 3, 1, 1]], ["tile_x", "sp", [-1, 3, 1, 1]], ["tile_rc", "sp", [-1, 1]], ["tile_rd", "sp", [-1, 4]], ["tile_ry", "sp", [-1, 1]], ["tile_rx", "sp", [-1, 4]], ["auto_unroll_max_step", "ot", 512], ["unroll_explicit", "ot", 0], ["fuse_yx", "ot", 1]]}], "r": [[0.00081281675, 0.000812678], 0, 1.8853986263275146, 1578566562.2620354], "v": 0.1}
{"i": ["cuda", "schedule_conv3d_nchw_cuda", [[192, 1, 8, 8, 8], [192, 1, 8, 8, 8], 1, [1, 1, 1], [1, 1, 1], 1], {}, ["schedule_conv3d_nchw_cuda", [192, 1, 8, 8, 8], [192, 1, 8, 8, 8], 1, [1, 1, 1], [1, 1, 1], 1], {"i": 3275043562, "t": "", "c": null, "e": [["tile_n", "sp", [-1, 1, 2, 3]], ["tile_f", "sp", [-1, 6, 8, 2]], ["tile_d", "sp", [-1, 3, 1, 1]], ["tile_y", "sp", [-1, 1, 1, 1]], ["tile_x", "sp", [-1, 3, 1, 1]], ["tile_rc", "sp", [-1, 1]], ["tile_rd", "sp", [-1, 2]], ["tile_ry", "sp", [-1, 2]], ["tile_rx", "sp", [-1, 1]], ["auto_unroll_max_step", "ot", 512], ["unroll_explicit", "ot", 0], ["fuse_yx", "ot", 1]]}], "r": [[0.002814033, 0.00280706575], 0, 1.7823114395141602, 1578566562.9648182], "v": 0.1}
{"i": ["cuda", "schedule_conv3d_nchw_cuda", [[192, 1, 8, 8, 8], [192, 1, 8, 8, 8], 1, [1, 1, 1], [1, 1, 1], 1], {}, ["schedule_conv3d_nchw_cuda", [192, 1, 8, 8, 8], [192, 1, 8, 8, 8], 1, [1, 1, 1], [1, 1, 1], 1], {"i": 2812621546, "t": "", "c": null, "e": [["tile_n", "sp", [-1, 1, 2, 3]], ["tile_f", "sp", [-1, 6, 8, 2]], ["tile_d", "sp", [-1, 3, 1, 1]], ["tile_y", "sp", [-1, 1, 1, 1]], ["tile_x", "sp", [-1, 3, 1, 1]], ["tile_rc", "sp", [-1, 1]], ["tile_rd", "sp", [-1, 2]], ["tile_ry", "sp", [-1, 2]], ["tile_rx", "sp", [-1, 1]], ["auto_unroll_max_step", "ot", 0], ["unroll_explicit", "ot", 0], ["fuse_yx", "ot", 1]]}], "r": [[0.01907894875, 0.01909362625], 0, 1.8190162181854248, 1578566563.7649074], "v": 0.1}
{"i": ["cuda", "schedule_conv3d_nchw_cuda", [[192, 1, 8, 8, 8], [192, 1, 8, 8, 8], 1, [1, 1, 1], [1, 1, 1], 1], {}, ["schedule_conv3d_nchw_cuda", [192, 1, 8, 8, 8], [192, 1, 8, 8, 8], 1, [1, 1, 1], [1, 1, 1], 1], {"i": 1164263002, "t": "", "c": null, "e": [["tile_n", "sp", [-1, 1, 2, 3]], ["tile_f", "sp", [-1, 2, 8, 6]], ["tile_d", "sp", [-1, 1, 1, 1]], ["tile_y", "sp", [-1, 1, 3, 1]], ["tile_x", "sp", [-1, 1, 1, 1]], ["tile_rc", "sp", [-1, 1]], ["tile_rd", "sp", [-1, 2]], ["tile_ry", "sp", [-1, 1]], ["tile_rx", "sp", [-1, 4]], ["auto_unroll_max_step", "ot", 1500], ["unroll_explicit", "ot", 0], ["fuse_yx", "ot", 0]]}], "r": [[0.0007960995, 0.000795097], 0, 1.056305170059204, 1578566564.2697206], "v": 0.1}
{"i": ["cuda", "schedule_conv3d_nchw_cuda", [[192, 1, 8, 8, 8], [192, 1, 8, 8, 8], 1, [1, 1, 1], [1, 1, 1], 1], {}, ["schedule_conv3d_nchw_cuda", [192, 1, 8, 8, 8], [192, 1, 8, 8, 8], 1, [1, 1, 1], [1, 1, 1], 1], {"i": 2551529050, "t": "", "c": null, "e": [["tile_n", "sp", [-1, 1, 2, 3]], ["tile_f", "sp", [-1, 2, 8, 6]], ["tile_d", "sp", [-1, 1, 1, 1]], ["tile_y", "sp", [-1, 1, 3, 1]], ["tile_x", "sp", [-1, 1, 1, 1]], ["tile_rc", "sp", [-1, 1]], ["tile_rd", "sp", [-1, 2]], ["tile_ry", "sp", [-1, 1]], ["tile_rx", "sp", [-1, 4]], ["auto_unroll_max_step", "ot", 1500], ["unroll_explicit", "ot", 1], ["fuse_yx", "ot", 0]]}], "r": [[0.00078050725, 0.0007830085], 0, 1.2652628421783447, 1578566564.7773545], "v": 0.1}
{"i": ["cuda", "schedule_conv3d_nchw_cuda", [[192, 1, 8, 8, 8], [192, 1, 8, 8, 8], 1, [1, 1, 1], [1, 1, 1], 1], {}, ["schedule_conv3d_nchw_cuda", [192, 1, 8, 8, 8], [192, 1, 8, 8, 8], 1, [1, 1, 1], [1, 1, 1], 1], {"i": 728933227, "t": "", "c": null, "e": [["tile_n", "sp", [-1, 1, 6, 1]], ["tile_f", "sp", [-1, 4, 2, 6]], ["tile_d", "sp", [-1, 1, 1, 1]], ["tile_y", "sp", [-1, 1, 3, 1]], ["tile_x", "sp", [-1, 1, 1, 3]], ["tile_rc", "sp", [-1, 1]], ["tile_rd", "sp", [-1, 1]], ["tile_ry", "sp", [-1, 2]], ["tile_rx", "sp", [-1, 4]], ["auto_unroll_max_step", "ot", 512], ["unroll_explicit", "ot", 0], ["fuse_yx", "ot", 0]]}], "r": [[0.000464437, 0.0004637465], 0, 1.1961405277252197, 1578566565.3636658], "v": 0.1}
{"i": ["cuda", "schedule_conv3d_nchw_cuda", [[192, 1, 8, 8, 8], [192, 1, 8, 8, 8], 1, [1, 1, 1], [1, 1, 1], 1], {}, ["schedule_conv3d_nchw_cuda", [192, 1, 8, 8, 8], [192, 1, 8, 8, 8], 1, [1, 1, 1], [1, 1, 1], 1], {"i": 1626685018, "t": "", "c": null, "e": [["tile_n", "sp", [-1, 1, 2, 3]], ["tile_f", "sp", [-1, 2, 8, 6]], ["tile_d", "sp", [-1, 1, 1, 1]], ["tile_y", "sp", [-1, 1, 3, 1]], ["tile_x", "sp", [-1, 1, 1, 1]], ["tile_rc", "sp", [-1, 1]], ["tile_rd", "sp", [-1, 2]], ["tile_ry", "sp", [-1, 1]], ["tile_rx", "sp", [-1, 4]], ["auto_unroll_max_step", "ot", 0], ["unroll_explicit", "ot", 1], ["fuse_yx", "ot", 0]]}], "r": [[0.0008021535, 0.00079759025], 0, 1.3644981384277344, 1578566566.1913414], "v": 0.1}
