auto_log/((1, 192, 16, 16, 16), (192, 192, 3, 3, 3), (1, 192, 16, 16, 16), (1, 1, 1), (1, 1, 1), 1, 1, None)_fwd.log
{"i": ["cuda", "schedule_direct_3d_cuda", [[1, 192, 16, 16, 16], [192, 192, 3, 3, 3], [1, 1, 1], [1, 1, 1], 1], {}, ["schedule_direct_3d_cuda", [1, 192, 16, 16, 16], [192, 192, 3, 3, 3], [1, 1, 1], [1, 1, 1], 1], {"i": 6798809647, "t": "", "c": null, "e": [["tile_f", "sp", [-1, 1, 1, 4]], ["tile_d", "sp", [-1, 4, 1, 1]], ["tile_y", "sp", [-1, 1, 1, 1]], ["tile_x", "sp", [-1, 1, 2, 8]], ["tile_rc", "sp", [-1, 32]], ["tile_rd", "sp", [-1, 3]], ["tile_ry", "sp", [-1, 1]], ["tile_rx", "sp", [-1, 1]], ["auto_unroll_max_step", "ot", 512], ["unroll_explicit", "ot", 1]]}], "r": [[0.1411321505, 0.134893551], 0, 2.827113628387451, 1578539759.0268972], "v": 0.1}
{"i": ["cuda", "schedule_direct_3d_cuda", [[1, 192, 16, 16, 16], [192, 192, 3, 3, 3], [1, 1, 1], [1, 1, 1], 1], {}, ["schedule_direct_3d_cuda", [1, 192, 16, 16, 16], [192, 192, 3, 3, 3], [1, 1, 1], [1, 1, 1], 1], {"i": 8915103333, "t": "", "c": null, "e": [["tile_f", "sp", [-1, 2, 12, 4]], ["tile_d", "sp", [-1, 1, 1, 1]], ["tile_y", "sp", [-1, 1, 4, 2]], ["tile_x", "sp", [-1, 2, 2, 4]], ["tile_rc", "sp", [-1, 3]], ["tile_rd", "sp", [-1, 1]], ["tile_ry", "sp", [-1, 1]], ["tile_rx", "sp", [-1, 3]], ["auto_unroll_max_step", "ot", 1500], ["unroll_explicit", "ot", 1]]}], "r": [[0.004834278, 0.0048365715], 0, 2.303992986679077, 1578539767.5247974], "v": 0.1}
{"i": ["cuda", "schedule_direct_3d_cuda", [[1, 192, 16, 16, 16], [192, 192, 3, 3, 3], [1, 1, 1], [1, 1, 1], 1], {}, ["schedule_direct_3d_cuda", [1, 192, 16, 16, 16], [192, 192, 3, 3, 3], [1, 1, 1], [1, 1, 1], 1], {"i": 421243461, "t": "", "c": null, "e": [["tile_f", "sp", [-1, 3, 4, 8]], ["tile_d", "sp", [-1, 1, 1, 1]], ["tile_y", "sp", [-1, 1, 1, 2]], ["tile_x", "sp", [-1, 8, 2, 1]], ["tile_rc", "sp", [-1, 2]], ["tile_rd", "sp", [-1, 1]], ["tile_ry", "sp", [-1, 3]], ["tile_rx", "sp", [-1, 1]], ["auto_unroll_max_step", "ot", 0], ["unroll_explicit", "ot", 0]]}], "r": [[0.32384871675, 0.315296389], 0, 3.922049045562744, 1578539793.5823076], "v": 0.1}
{"i": ["cuda", "schedule_direct_3d_cuda", [[1, 192, 16, 16, 16], [192, 192, 3, 3, 3], [1, 1, 1], [1, 1, 1], 1], {}, ["schedule_direct_3d_cuda", [1, 192, 16, 16, 16], [192, 192, 3, 3, 3], [1, 1, 1], [1, 1, 1], 1], {"i": 444751677, "t": "", "c": null, "e": [["tile_f", "sp", [-1, 4, 8, 6]], ["tile_d", "sp", [-1, 1, 1, 1]], ["tile_y", "sp", [-1, 1, 2, 2]], ["tile_x", "sp", [-1, 1, 4, 4]], ["tile_rc", "sp", [-1, 3]], ["tile_rd", "sp", [-1, 1]], ["tile_ry", "sp", [-1, 3]], ["tile_rx", "sp", [-1, 1]], ["auto_unroll_max_step", "ot", 0], ["unroll_explicit", "ot", 0]]}], "r": [[0.00370372375, 0.0036987115], 0, 1.3728973865509033, 1578539987.3515112], "v": 0.1}
{"i": ["cuda", "schedule_direct_3d_cuda", [[1, 192, 16, 16, 16], [192, 192, 3, 3, 3], [1, 1, 1], [1, 1, 1], 1], {}, ["schedule_direct_3d_cuda", [1, 192, 16, 16, 16], [192, 192, 3, 3, 3], [1, 1, 1], [1, 1, 1], 1], {"i": 833266774, "t": "", "c": null, "e": [["tile_f", "sp", [-1, 4, 12, 4]], ["tile_d", "sp", [-1, 1, 1, 1]], ["tile_y", "sp", [-1, 2, 1, 2]], ["tile_x", "sp", [-1, 2, 2, 4]], ["tile_rc", "sp", [-1, 2]], ["tile_rd", "sp", [-1, 1]], ["tile_ry", "sp", [-1, 1]], ["tile_rx", "sp", [-1, 3]], ["auto_unroll_max_step", "ot", 0], ["unroll_explicit", "ot", 0]]}], "r": [[0.1246458705, 0.12112605], 0, 2.8587167263031006, 1578539989.2667627], "v": 0.1}
{"i": ["cuda", "schedule_direct_3d_cuda", [[1, 192, 16, 16, 16], [192, 192, 3, 3, 3], [1, 1, 1], [1, 1, 1], 1], {}, ["schedule_direct_3d_cuda", [1, 192, 16, 16, 16], [192, 192, 3, 3, 3], [1, 1, 1], [1, 1, 1], 1], {"i": 5673682774, "t": "", "c": null, "e": [["tile_f", "sp", [-1, 4, 12, 4]], ["tile_d", "sp", [-1, 1, 1, 1]], ["tile_y", "sp", [-1, 2, 1, 2]], ["tile_x", "sp", [-1, 2, 2, 4]], ["tile_rc", "sp", [-1, 2]], ["tile_rd", "sp", [-1, 1]], ["tile_ry", "sp", [-1, 1]], ["tile_rx", "sp", [-1, 3]], ["auto_unroll_max_step", "ot", 0], ["unroll_explicit", "ot", 1]]}], "r": [[0.12245638, 0.12248238975], 0, 2.4300038814544678, 1578540001.615632], "v": 0.1}
{"i": ["cuda", "schedule_direct_3d_cuda", [[1, 192, 16, 16, 16], [192, 192, 3, 3, 3], [1, 1, 1], [1, 1, 1], 1], {}, ["schedule_direct_3d_cuda", [1, 192, 16, 16, 16], [192, 192, 3, 3, 3], [1, 1, 1], [1, 1, 1], 1], {"i": 443998871, "t": "", "c": null, "e": [["tile_f", "sp", [-1, 8, 24, 1]], ["tile_d", "sp", [-1, 1, 1, 1]], ["tile_y", "sp", [-1, 1, 1, 4]], ["tile_x", "sp", [-1, 1, 2, 4]], ["tile_rc", "sp", [-1, 3]], ["tile_rd", "sp", [-1, 1]], ["tile_ry", "sp", [-1, 3]], ["tile_rx", "sp", [-1, 1]], ["auto_unroll_max_step", "ot", 0], ["unroll_explicit", "ot", 0]]}], "r": [[0.00379684375, 0.0038165235], 0, 1.010073184967041, 1578540007.5890365], "v": 0.1}
{"i": ["cuda", "schedule_direct_3d_cuda", [[1, 192, 16, 16, 16], [192, 192, 3, 3, 3], [1, 1, 1], [1, 1, 1], 1], {}, ["schedule_direct_3d_cuda", [1, 192, 16, 16, 16], [192, 192, 3, 3, 3], [1, 1, 1], [1, 1, 1], 1], {"i": 834725526, "t": "", "c": null, "e": [["tile_f", "sp", [-1, 8, 8, 1]], ["tile_d", "sp", [-1, 4, 1, 1]], ["tile_y", "sp", [-1, 1, 1, 1]], ["tile_x", "sp", [-1, 1, 2, 8]], ["tile_rc", "sp", [-1, 2]], ["tile_rd", "sp", [-1, 1]], ["tile_ry", "sp", [-1, 1]], ["tile_rx", "sp", [-1, 3]], ["auto_unroll_max_step", "ot", 0], ["unroll_explicit", "ot", 0]]}], "r": [[0.00572357775, 0.00604873725], 0, 1.5520217418670654, 1578540016.7820413], "v": 0.1}
{"i": ["cuda", "schedule_direct_3d_cuda", [[1, 192, 16, 16, 16], [192, 192, 3, 3, 3], [1, 1, 1], [1, 1, 1], 1], {}, ["schedule_direct_3d_cuda", [1, 192, 16, 16, 16], [192, 192, 3, 3, 3], [1, 1, 1], [1, 1, 1], 1], {"i": 833784110, "t": "", "c": null, "e": [["tile_f", "sp", [-1, 16, 3, 2]], ["tile_d", "sp", [-1, 1, 1, 1]], ["tile_y", "sp", [-1, 1, 1, 4]], ["tile_x", "sp", [-1, 1, 4, 4]], ["tile_rc", "sp", [-1, 2]], ["tile_rd", "sp", [-1, 1]], ["tile_ry", "sp", [-1, 1]], ["tile_rx", "sp", [-1, 3]], ["auto_unroll_max_step", "ot", 0], ["unroll_explicit", "ot", 0]]}], "r": [[0.143782429, 0.1432334265], 0, 3.0344150066375732, 1578540018.692267], "v": 0.1}
{"i": ["cuda", "schedule_direct_3d_cuda", [[1, 192, 16, 16, 16], [192, 192, 3, 3, 3], [1, 1, 1], [1, 1, 1], 1], {}, ["schedule_direct_3d_cuda", [1, 192, 16, 16, 16], [192, 192, 3, 3, 3], [1, 1, 1], [1, 1, 1], 1], {"i": 4060199156, "t": "", "c": null, "e": [["tile_f", "sp", [-1, 12, 2, 1]], ["tile_d", "sp", [-1, 2, 1, 1]], ["tile_y", "sp", [-1, 1, 1, 2]], ["tile_x", "sp", [-1, 2, 2, 4]], ["tile_rc", "sp", [-1, 2]], ["tile_rd", "sp", [-1, 1]], ["tile_ry", "sp", [-1, 1]], ["tile_rx", "sp", [-1, 3]], ["auto_unroll_max_step", "ot", 1500], ["unroll_explicit", "ot", 0]]}], "r": [[0.15926672225, 0.1589522945], 0, 3.6247611045837402, 1578540031.275008], "v": 0.1}
{"i": ["cuda", "schedule_direct_3d_cuda", [[1, 192, 16, 16, 16], [192, 192, 3, 3, 3], [1, 1, 1], [1, 1, 1], 1], {}, ["schedule_direct_3d_cuda", [1, 192, 16, 16, 16], [192, 192, 3, 3, 3], [1, 1, 1], [1, 1, 1], 1], {"i": 7286971579, "t": "", "c": null, "e": [["tile_f", "sp", [-1, 1, 24, 2]], ["tile_d", "sp", [-1, 1, 1, 2]], ["tile_y", "sp", [-1, 1, 1, 1]], ["tile_x", "sp", [-1, 2, 2, 4]], ["tile_rc", "sp", [-1, 2]], ["tile_rd", "sp", [-1, 1]], ["tile_ry", "sp", [-1, 1]], ["tile_rx", "sp", [-1, 3]], ["auto_unroll_max_step", "ot", 512], ["unroll_explicit", "ot", 1]]}], "r": [[0.00228295075, 0.00227646675], 0, 1.2311527729034424, 1578540031.9189565], "v": 0.1}
{"i": ["cuda", "schedule_direct_3d_cuda", [[1, 192, 16, 16, 16], [192, 192, 3, 3, 3], [1, 1, 1], [1, 1, 1], 1], {}, ["schedule_direct_3d_cuda", [1, 192, 16, 16, 16], [192, 192, 3, 3, 3], [1, 1, 1], [1, 1, 1], 1], {"i": 7287154774, "t": "", "c": null, "e": [["tile_f", "sp", [-1, 4, 12, 4]], ["tile_d", "sp", [-1, 1, 1, 1]], ["tile_y", "sp", [-1, 2, 1, 2]], ["tile_x", "sp", [-1, 2, 2, 4]], ["tile_rc", "sp", [-1, 2]], ["tile_rd", "sp", [-1, 1]], ["tile_ry", "sp", [-1, 1]], ["tile_rx", "sp", [-1, 3]], ["auto_unroll_max_step", "ot", 512], ["unroll_explicit", "ot", 1]]}], "r": [[0.082465807, 0.08098795875], 0, 3.987797498703003, 1578540033.7597208], "v": 0.1}
{"i": ["cuda", "schedule_direct_3d_cuda", [[1, 192, 16, 16, 16], [192, 192, 3, 3, 3], [1, 1, 1], [1, 1, 1], 1], {}, ["schedule_direct_3d_cuda", [1, 192, 16, 16, 16], [192, 192, 3, 3, 3], [1, 1, 1], [1, 1, 1], 1], {"i": 2446555579, "t": "", "c": null, "e": [["tile_f", "sp", [-1, 1, 24, 2]], ["tile_d", "sp", [-1, 1, 1, 2]], ["tile_y", "sp", [-1, 1, 1, 1]], ["tile_x", "sp", [-1, 2, 2, 4]], ["tile_rc", "sp", [-1, 2]], ["tile_rd", "sp", [-1, 1]], ["tile_ry", "sp", [-1, 1]], ["tile_rx", "sp", [-1, 3]], ["auto_unroll_max_step", "ot", 512], ["unroll_explicit", "ot", 0]]}], "r": [[0.00300180375, 0.00298932275], 0, 1.122565746307373, 1578540034.3930852], "v": 0.1}
{"i": ["cuda", "schedule_direct_3d_cuda", [[1, 192, 16, 16, 16], [192, 192, 3, 3, 3], [1, 1, 1], [1, 1, 1], 1], {}, ["schedule_direct_3d_cuda", [1, 192, 16, 16, 16], [192, 192, 3, 3, 3], [1, 1, 1], [1, 1, 1], 1], {"i": 876313458, "t": "", "c": null, "e": [["tile_f", "sp", [-1, 8, 3, 8]], ["tile_d", "sp", [-1, 1, 1, 2]], ["tile_y", "sp", [-1, 2, 1, 1]], ["tile_x", "sp", [-1, 2, 2, 4]], ["tile_rc", "sp", [-1, 6]], ["tile_rd", "sp", [-1, 1]], ["tile_ry", "sp", [-1, 1]], ["tile_rx", "sp", [-1, 3]], ["auto_unroll_max_step", "ot", 0], ["unroll_explicit", "ot", 0]]}], "r": [[0.29153081125, 0.2915345585], 0, 4.6997387409210205, 1578540037.719844], "v": 0.1}
{"i": ["cuda", "schedule_direct_3d_cuda", [[1, 192, 16, 16, 16], [192, 192, 3, 3, 3], [1, 1, 1], [1, 1, 1], 1], {}, ["schedule_direct_3d_cuda", [1, 192, 16, 16, 16], [192, 192, 3, 3, 3], [1, 1, 1], [1, 1, 1], 1], {"i": 1726673868, "t": "", "c": null, "e": [["tile_f", "sp", [-1, 4, 3, 2]], ["tile_d", "sp", [-1, 1, 1, 1]], ["tile_y", "sp", [-1, 2, 1, 1]], ["tile_x", "sp", [-1, 1, 4, 4]], ["tile_rc", "sp", [-1, 16]], ["tile_rd", "sp", [-1, 1]], ["tile_ry", "sp", [-1, 1]], ["tile_rx", "sp", [-1, 1]], ["auto_unroll_max_step", "ot", 512], ["unroll_explicit", "ot", 0]]}], "r": [[0.017687226, 0.01811953825], 0, 1.935795545578003, 1578540038.5701704], "v": 0.1}
{"i": ["cuda", "schedule_direct_3d_cuda", [[1, 192, 16, 16, 16], [192, 192, 3, 3, 3], [1, 1, 1], [1, 1, 1], 1], {}, ["schedule_direct_3d_cuda", [1, 192, 16, 16, 16], [192, 192, 3, 3, 3], [1, 1, 1], [1, 1, 1], 1], {"i": 849236907, "t": "", "c": null, "e": [["tile_f", "sp", [-1, 3, 8, 8]], ["tile_d", "sp", [-1, 1, 1, 1]], ["tile_y", "sp", [-1, 1, 4, 1]], ["tile_x", "sp", [-1, 1, 2, 8]], ["tile_rc", "sp", [-1, 3]], ["tile_rd", "sp", [-1, 1]], ["tile_ry", "sp", [-1, 1]], ["tile_rx", "sp", [-1, 3]], ["auto_unroll_max_step", "ot", 0], ["unroll_explicit", "ot", 0]]}], "r": [[0.00285939675, 0.002870664], 0, 1.3152973651885986, 1578540039.2230494], "v": 0.1}
{"i": ["cuda", "schedule_direct_3d_cuda", [[1, 192, 16, 16, 16], [192, 192, 3, 3, 3], [1, 1, 1], [1, 1, 1], 1], {}, ["schedule_direct_3d_cuda", [1, 192, 16, 16, 16], [192, 192, 3, 3, 3], [1, 1, 1], [1, 1, 1], 1], {"i": 5689547526, "t": "", "c": null, "e": [["tile_f", "sp", [-1, 8, 8, 1]], ["tile_d", "sp", [-1, 4, 1, 1]], ["tile_y", "sp", [-1, 1, 1, 1]], ["tile_x", "sp", [-1, 1, 2, 8]], ["tile_rc", "sp", [-1, 3]], ["tile_rd", "sp", [-1, 1]], ["tile_ry", "sp", [-1, 1]], ["tile_rx", "sp", [-1, 3]], ["auto_unroll_max_step", "ot", 0], ["unroll_explicit", "ot", 1]]}], "r": [[0.008007229, 0.0079331895], 0, 1.5944178104400635, 1578540039.9658363], "v": 0.1}
{"i": ["cuda", "schedule_direct_3d_cuda", [[1, 192, 16, 16, 16], [192, 192, 3, 3, 3], [1, 1, 1], [1, 1, 1], 1], {}, ["schedule_direct_3d_cuda", [1, 192, 16, 16, 16], [192, 192, 3, 3, 3], [1, 1, 1], [1, 1, 1], 1], {"i": 1726262361, "t": "", "c": null, "e": [["tile_f", "sp", [-1, 4, 4, 4]], ["tile_d", "sp", [-1, 1, 1, 1]], ["tile_y", "sp", [-1, 2, 1, 1]], ["tile_x", "sp", [-1, 2, 2, 4]], ["tile_rc", "sp", [-1, 16]], ["tile_rd", "sp", [-1, 1]], ["tile_ry", "sp", [-1, 1]], ["tile_rx", "sp", [-1, 1]], ["auto_unroll_max_step", "ot", 512], ["unroll_explicit", "ot", 0]]}], "r": [[0.01491333525, 0.014890868], 0, 1.9650778770446777, 1578540051.0382073], "v": 0.1}
{"i": ["cuda", "schedule_direct_3d_cuda", [[1, 192, 16, 16, 16], [192, 192, 3, 3, 3], [1, 1, 1], [1, 1, 1], 1], {}, ["schedule_direct_3d_cuda", [1, 192, 16, 16, 16], [192, 192, 3, 3, 3], [1, 1, 1], [1, 1, 1], 1], {"i": 3483547255, "t": "", "c": null, "e": [["tile_f", "sp", [-1, 12, 8, 1]], ["tile_d", "sp", [-1, 1, 1, 1]], ["tile_y", "sp", [-1, 1, 1, 2]], ["tile_x", "sp", [-1, 1, 2, 4]], ["tile_rc", "sp", [-1, 4]], ["tile_rd", "sp", [-1, 3]], ["tile_ry", "sp", [-1, 1]], ["tile_rx", "sp", [-1, 1]], ["auto_unroll_max_step", "ot", 1500], ["unroll_explicit", "ot", 0]]}], "r": [[0.01214565525, 0.01214396], 0, 1.9826107025146484, 1578540052.063779], "v": 0.1}
{"i": ["cuda", "schedule_direct_3d_cuda", [[1, 192, 16, 16, 16], [192, 192, 3, 3, 3], [1, 1, 1], [1, 1, 1], 1], {}, ["schedule_direct_3d_cuda", [1, 192, 16, 16, 16], [192, 192, 3, 3, 3], [1, 1, 1], [1, 1, 1], 1], {"i": 5054041607, "t": "", "c": null, "e": [["tile_f", "sp", [-1, 4, 8, 3]], ["tile_d", "sp", [-1, 1, 1, 2]], ["tile_y", "sp", [-1, 1, 1, 1]], ["tile_x", "sp", [-1, 2, 2, 4]], ["tile_rc", "sp", [-1, 1]], ["tile_rd", "sp", [-1, 3]], ["tile_ry", "sp", [-1, 1]], ["tile_rx", "sp", [-1, 1]], ["auto_unroll_max_step", "ot", 0], ["unroll_explicit", "ot", 1]]}], "r": [[0.0054268895, 0.00544124775], 0, 1.2950036525726318, 1578540057.548249], "v": 0.1}
{"i": ["cuda", "schedule_direct_3d_cuda", [[1, 192, 16, 16, 16], [192, 192, 3, 3, 3], [1, 1, 1], [1, 1, 1], 1], {}, ["schedule_direct_3d_cuda", [1, 192, 16, 16, 16], [192, 192, 3, 3, 3], [1, 1, 1], [1, 1, 1], 1], {"i": 5327632855, "t": "", "c": null, "e": [["tile_f", "sp", [-1, 12, 8, 1]], ["tile_d", "sp", [-1, 1, 1, 1]], ["tile_y", "sp", [-1, 1, 1, 4]], ["tile_x", "sp", [-1, 1, 2, 4]], ["tile_rc", "sp", [-1, 8]], ["tile_rd", "sp", [-1, 1]], ["tile_ry", "sp", [-1, 3]], ["tile_rx", "sp", [-1, 1]], ["auto_unroll_max_step", "ot", 0], ["unroll_explicit", "ot", 1]]}], "r": [[0.00685560025, 0.00685545125], 0, 1.4977715015411377, 1578540058.330066], "v": 0.1}
{"i": ["cuda", "schedule_direct_3d_cuda", [[1, 192, 16, 16, 16], [192, 192, 3, 3, 3], [1, 1, 1], [1, 1, 1], 1], {}, ["schedule_direct_3d_cuda", [1, 192, 16, 16, 16], [192, 192, 3, 3, 3], [1, 1, 1], [1, 1, 1], 1], {"i": 5689547686, "t": "", "c": null, "e": [["tile_f", "sp", [-1, 4, 12, 4]], ["tile_d", "sp", [-1, 4, 1, 1]], ["tile_y", "sp", [-1, 1, 1, 1]], ["tile_x", "sp", [-1, 1, 2, 8]], ["tile_rc", "sp", [-1, 3]], ["tile_rd", "sp", [-1, 1]], ["tile_ry", "sp", [-1, 1]], ["tile_rx", "sp", [-1, 3]], ["auto_unroll_max_step", "ot", 0], ["unroll_explicit", "ot", 1]]}], "r": [[0.0963342165, 0.09659765125], 0, 2.6681439876556396, 1578540060.016433], "v": 0.1}
{"i": ["cuda", "schedule_direct_3d_cuda", [[1, 192, 16, 16, 16], [192, 192, 3, 3, 3], [1, 1, 1], [1, 1, 1], 1], {}, ["schedule_direct_3d_cuda", [1, 192, 16, 16, 16], [192, 192, 3, 3, 3], [1, 1, 1], [1, 1, 1], 1], {"i": 8151326564, "t": "", "c": null, "e": [["tile_f", "sp", [-1, 16, 4, 3]], ["tile_d", "sp", [-1, 1, 1, 1]], ["tile_y", "sp", [-1, 1, 1, 1]], ["tile_x", "sp", [-1, 2, 2, 4]], ["tile_rc", "sp", [-1, 8]], ["tile_rd", "sp", [-1, 1]], ["tile_ry", "sp", [-1, 1]], ["tile_rx", "sp", [-1, 1]], ["auto_unroll_max_step", "ot", 1500], ["unroll_explicit", "ot", 1]]}], "r": [[0.11648772875, 0.11817064975], 0, 3.7335686683654785, 1578540061.794981], "v": 0.1}
{"i": ["cuda", "schedule_direct_3d_cuda", [[1, 192, 16, 16, 16], [192, 192, 3, 3, 3], [1, 1, 1], [1, 1, 1], 1], {}, ["schedule_direct_3d_cuda", [1, 192, 16, 16, 16], [192, 192, 3, 3, 3], [1, 1, 1], [1, 1, 1], 1], {"i": 8916667418, "t": "", "c": null, "e": [["tile_f", "sp", [-1, 2, 24, 4]], ["tile_d", "sp", [-1, 1, 1, 1]], ["tile_y", "sp", [-1, 1, 1, 2]], ["tile_x", "sp", [-1, 1, 2, 8]], ["tile_rc", "sp", [-1, 3]], ["tile_rd", "sp", [-1, 1]], ["tile_ry", "sp", [-1, 1]], ["tile_rx", "sp", [-1, 3]], ["auto_unroll_max_step", "ot", 1500], ["unroll_explicit", "ot", 1]]}], "r": [[0.0046284125, 0.0046241755], 0, 2.609264850616455, 1578540062.519023], "v": 0.1}
{"i": ["cuda", "schedule_direct_3d_cuda", [[1, 192, 16, 16, 16], [192, 192, 3, 3, 3], [1, 1, 1], [1, 1, 1], 1], {}, ["schedule_direct_3d_cuda", [1, 192, 16, 16, 16], [192, 192, 3, 3, 3], [1, 1, 1], [1, 1, 1], 1], {"i": 5255602855, "t": "", "c": null, "e": [["tile_f", "sp", [-1, 12, 8, 1]], ["tile_d", "sp", [-1, 1, 1, 1]], ["tile_y", "sp", [-1, 1, 1, 4]], ["tile_x", "sp", [-1, 1, 2, 4]], ["tile_rc", "sp", [-1, 1]], ["tile_rd", "sp", [-1, 1]], ["tile_ry", "sp", [-1, 3]], ["tile_rx", "sp", [-1, 1]], ["auto_unroll_max_step", "ot", 0], ["unroll_explicit", "ot", 1]]}], "r": [[0.0050176385, 0.00501017175], 0, 1.1471328735351562, 1578540063.1302302], "v": 0.1}
{"i": ["cuda", "schedule_direct_3d_cuda", [[1, 192, 16, 16, 16], [192, 192, 3, 3, 3], [1, 1, 1], [1, 1, 1], 1], {}, ["schedule_direct_3d_cuda", [1, 192, 16, 16, 16], [192, 192, 3, 3, 3], [1, 1, 1], [1, 1, 1], 1], {"i": 8988521401, "t": "", "c": null, "e": [["tile_f", "sp", [-1, 4, 6, 8]], ["tile_d", "sp", [-1, 2, 1, 1]], ["tile_y", "sp", [-1, 1, 1, 1]], ["tile_x", "sp", [-1, 1, 2, 8]], ["tile_rc", "sp", [-1, 16]], ["tile_rd", "sp", [-1, 1]], ["tile_ry", "sp", [-1, 1]], ["tile_rx", "sp", [-1, 3]], ["auto_unroll_max_step", "ot", 1500], ["unroll_explicit", "ot", 1]]}], "r": [[0.23631539, 0.25218856425], 0, 10.941820621490479, 1578540087.8751354], "v": 0.1}
{"i": ["cuda", "schedule_direct_3d_cuda", [[1, 192, 16, 16, 16], [192, 192, 3, 3, 3], [1, 1, 1], [1, 1, 1], 1], {}, ["schedule_direct_3d_cuda", [1, 192, 16, 16, 16], [192, 192, 3, 3, 3], [1, 1, 1], [1, 1, 1], 1], {"i": 5716729458, "t": "", "c": null, "e": [["tile_f", "sp", [-1, 8, 3, 8]], ["tile_d", "sp", [-1, 1, 1, 2]], ["tile_y", "sp", [-1, 2, 1, 1]], ["tile_x", "sp", [-1, 2, 2, 4]], ["tile_rc", "sp", [-1, 6]], ["tile_rd", "sp", [-1, 1]], ["tile_ry", "sp", [-1, 1]], ["tile_rx", "sp", [-1, 3]], ["auto_unroll_max_step", "ot", 0], ["unroll_explicit", "ot", 1]]}], "r": [[0.29174858825, 0.292026807], 0, 4.953215837478638, 1578540091.1091413], "v": 0.1}
{"i": ["cuda", "schedule_direct_3d_cuda", [[1, 192, 16, 16, 16], [192, 192, 3, 3, 3], [1, 1, 1], [1, 1, 1], 1], {}, ["schedule_direct_3d_cuda", [1, 192, 16, 16, 16], [192, 192, 3, 3, 3], [1, 1, 1], [1, 1, 1], 1], {"i": 3670942871, "t": "", "c": null, "e": [["tile_f", "sp", [-1, 8, 24, 1]], ["tile_d", "sp", [-1, 1, 1, 1]], ["tile_y", "sp", [-1, 1, 1, 4]], ["tile_x", "sp", [-1, 1, 2, 4]], ["tile_rc", "sp", [-1, 3]], ["tile_rd", "sp", [-1, 1]], ["tile_ry", "sp", [-1, 3]], ["tile_rx", "sp", [-1, 1]], ["auto_unroll_max_step", "ot", 1500], ["unroll_explicit", "ot", 0]]}], "r": [[0.00478849625, 0.00484861225], 0, 1.5559802055358887, 1578540097.1886215], "v": 0.1}
{"i": ["cuda", "schedule_direct_3d_cuda", [[1, 192, 16, 16, 16], [192, 192, 3, 3, 3], [1, 1, 1], [1, 1, 1], 1], {}, ["schedule_direct_3d_cuda", [1, 192, 16, 16, 16], [192, 192, 3, 3, 3], [1, 1, 1], [1, 1, 1], 1], {"i": 5270008855, "t": "", "c": null, "e": [["tile_f", "sp", [-1, 12, 8, 1]], ["tile_d", "sp", [-1, 1, 1, 1]], ["tile_y", "sp", [-1, 1, 1, 4]], ["tile_x", "sp", [-1, 1, 2, 4]], ["tile_rc", "sp", [-1, 2]], ["tile_rd", "sp", [-1, 1]], ["tile_ry", "sp", [-1, 3]], ["tile_rx", "sp", [-1, 1]], ["auto_unroll_max_step", "ot", 0], ["unroll_explicit", "ot", 1]]}], "r": [[0.005896334, 0.005904079], 0, 1.5051560401916504, 1578540097.879524], "v": 0.1}
{"i": ["cuda", "schedule_direct_3d_cuda", [[1, 192, 16, 16, 16], [192, 192, 3, 3, 3], [1, 1, 1], [1, 1, 1], 1], {}, ["schedule_direct_3d_cuda", [1, 192, 16, 16, 16], [192, 192, 3, 3, 3], [1, 1, 1], [1, 1, 1], 1], {"i": 1726673961, "t": "", "c": null, "e": [["tile_f", "sp", [-1, 4, 4, 4]], ["tile_d", "sp", [-1, 1, 1, 1]], ["tile_y", "sp", [-1, 2, 1, 1]], ["tile_x", "sp", [-1, 1, 4, 4]], ["tile_rc", "sp", [-1, 16]], ["tile_rd", "sp", [-1, 1]], ["tile_ry", "sp", [-1, 1]], ["tile_rx", "sp", [-1, 1]], ["auto_unroll_max_step", "ot", 512], ["unroll_explicit", "ot", 0]]}], "r": [[0.00591899725, 0.005912406], 0, 1.472193717956543, 1578540098.502744], "v": 0.1}
{"i": ["cuda", "schedule_direct_3d_cuda", [[1, 192, 16, 16, 16], [192, 192, 3, 3, 3], [1, 1, 1], [1, 1, 1], 1], {}, ["schedule_direct_3d_cuda", [1, 192, 16, 16, 16], [192, 192, 3, 3, 3], [1, 1, 1], [1, 1, 1], 1], {"i": 6567089961, "t": "", "c": null, "e": [["tile_f", "sp", [-1, 4, 4, 4]], ["tile_d", "sp", [-1, 1, 1, 1]], ["tile_y", "sp", [-1, 2, 1, 1]], ["tile_x", "sp", [-1, 1, 4, 4]], ["tile_rc", "sp", [-1, 16]], ["tile_rd", "sp", [-1, 1]], ["tile_ry", "sp", [-1, 1]], ["tile_rx", "sp", [-1, 1]], ["auto_unroll_max_step", "ot", 512], ["unroll_explicit", "ot", 1]]}], "r": [[0.0067757655, 0.00646688375], 0, 1.8011994361877441, 1578540099.1303701], "v": 0.1}
{"i": ["cuda", "schedule_direct_3d_cuda", [[1, 192, 16, 16, 16], [192, 192, 3, 3, 3], [1, 1, 1], [1, 1, 1], 1], {}, ["schedule_direct_3d_cuda", [1, 192, 16, 16, 16], [192, 192, 3, 3, 3], [1, 1, 1], [1, 1, 1], 1], {"i": 4924382564, "t": "", "c": null, "e": [["tile_f", "sp", [-1, 16, 4, 3]], ["tile_d", "sp", [-1, 1, 1, 1]], ["tile_y", "sp", [-1, 1, 1, 1]], ["tile_x", "sp", [-1, 2, 2, 4]], ["tile_rc", "sp", [-1, 8]], ["tile_rd", "sp", [-1, 1]], ["tile_ry", "sp", [-1, 1]], ["tile_rx", "sp", [-1, 1]], ["auto_unroll_max_step", "ot", 0], ["unroll_explicit", "ot", 1]]}], "r": [[0.35292145275, 0.352363593], 0, 4.998197555541992, 1578540102.9469707], "v": 0.1}
{"i": ["cuda", "schedule_direct_3d_cuda", [[1, 192, 16, 16, 16], [192, 192, 3, 3, 3], [1, 1, 1], [1, 1, 1], 1], {}, ["schedule_direct_3d_cuda", [1, 192, 16, 16, 16], [192, 192, 3, 3, 3], [1, 1, 1], [1, 1, 1], 1], {"i": 8511358871, "t": "", "c": null, "e": [["tile_f", "sp", [-1, 8, 24, 1]], ["tile_d", "sp", [-1, 1, 1, 1]], ["tile_y", "sp", [-1, 1, 1, 4]], ["tile_x", "sp", [-1, 1, 2, 4]], ["tile_rc", "sp", [-1, 3]], ["tile_rd", "sp", [-1, 1]], ["tile_ry", "sp", [-1, 3]], ["tile_rx", "sp", [-1, 1]], ["auto_unroll_max_step", "ot", 1500], ["unroll_explicit", "ot", 1]]}], "r": [[0.004885764, 0.00521926], 0, 2.797612428665161, 1578540109.115055], "v": 0.1}
{"i": ["cuda", "schedule_direct_3d_cuda", [[1, 192, 16, 16, 16], [192, 192, 3, 3, 3], [1, 1, 1], [1, 1, 1], 1], {}, ["schedule_direct_3d_cuda", [1, 192, 16, 16, 16], [192, 192, 3, 3, 3], [1, 1, 1], [1, 1, 1], 1], {"i": 6667513607, "t": "", "c": null, "e": [["tile_f", "sp", [-1, 4, 8, 3]], ["tile_d", "sp", [-1, 1, 1, 2]], ["tile_y", "sp", [-1, 1, 1, 1]], ["tile_x", "sp", [-1, 2, 2, 4]], ["tile_rc", "sp", [-1, 1]], ["tile_rd", "sp", [-1, 3]], ["tile_ry", "sp", [-1, 1]], ["tile_rx", "sp", [-1, 1]], ["auto_unroll_max_step", "ot", 512], ["unroll_explicit", "ot", 1]]}], "r": [[0.00818782225, 0.00809727375], 0, 1.556603193283081, 1578540118.1525757], "v": 0.1}
{"i": ["cuda", "schedule_direct_3d_cuda", [[1, 192, 16, 16, 16], [192, 192, 3, 3, 3], [1, 1, 1], [1, 1, 1], 1], {}, ["schedule_direct_3d_cuda", [1, 192, 16, 16, 16], [192, 192, 3, 3, 3], [1, 1, 1], [1, 1, 1], 1], {"i": 3310910564, "t": "", "c": null, "e": [["tile_f", "sp", [-1, 16, 4, 3]], ["tile_d", "sp", [-1, 1, 1, 1]], ["tile_y", "sp", [-1, 1, 1, 1]], ["tile_x", "sp", [-1, 2, 2, 4]], ["tile_rc", "sp", [-1, 8]], ["tile_rd", "sp", [-1, 1]], ["tile_ry", "sp", [-1, 1]], ["tile_rx", "sp", [-1, 1]], ["auto_unroll_max_step", "ot", 1500], ["unroll_explicit", "ot", 0]]}], "r": [[0.1421688685, 0.1429311555], 0, 3.546841621398926, 1578540125.535879], "v": 0.1}
{"i": ["cuda", "schedule_direct_3d_cuda", [[1, 192, 16, 16, 16], [192, 192, 3, 3, 3], [1, 1, 1], [1, 1, 1], 1], {}, ["schedule_direct_3d_cuda", [1, 192, 16, 16, 16], [192, 192, 3, 3, 3], [1, 1, 1], [1, 1, 1], 1], {"i": 2030446526, "t": "", "c": null, "e": [["tile_f", "sp", [-1, 4, 6, 4]], ["tile_d", "sp", [-1, 1, 1, 1]], ["tile_y", "sp", [-1, 4, 1, 1]], ["tile_x", "sp", [-1, 1, 2, 8]], ["tile_rc", "sp", [-1, 1]], ["tile_rd", "sp", [-1, 1]], ["tile_ry", "sp", [-1, 3]], ["tile_rx", "sp", [-1, 1]], ["auto_unroll_max_step", "ot", 512], ["unroll_explicit", "ot", 0]]}], "r": [[0.16576023925, 0.16876171875], 0, 3.478172540664673, 1578540127.7984796], "v": 0.1}
{"i": ["cuda", "schedule_direct_3d_cuda", [[1, 192, 16, 16, 16], [192, 192, 3, 3, 3], [1, 1, 1], [1, 1, 1], 1], {}, ["schedule_direct_3d_cuda", [1, 192, 16, 16, 16], [192, 192, 3, 3, 3], [1, 1, 1], [1, 1, 1], 1], {"i": 3483958855, "t": "", "c": null, "e": [["tile_f", "sp", [-1, 12, 8, 1]], ["tile_d", "sp", [-1, 1, 1, 1]], ["tile_y", "sp", [-1, 1, 1, 2]], ["tile_x", "sp", [-1, 2, 2, 4]], ["tile_rc", "sp", [-1, 4]], ["tile_rd", "sp", [-1, 3]], ["tile_ry", "sp", [-1, 1]], ["tile_rx", "sp", [-1, 1]], ["auto_unroll_max_step", "ot", 1500], ["unroll_explicit", "ot", 0]]}], "r": [[0.01976779725, 0.0197445715], 0, 2.0316271781921387, 1578540134.1161659], "v": 0.1}
{"i": ["cuda", "schedule_direct_3d_cuda", [[1, 192, 16, 16, 16], [192, 192, 3, 3, 3], [1, 1, 1], [1, 1, 1], 1], {}, ["schedule_direct_3d_cuda", [1, 192, 16, 16, 16], [192, 192, 3, 3, 3], [1, 1, 1], [1, 1, 1], 1], {"i": 6537854564, "t": "", "c": null, "e": [["tile_f", "sp", [-1, 16, 4, 3]], ["tile_d", "sp", [-1, 1, 1, 1]], ["tile_y", "sp", [-1, 1, 1, 1]], ["tile_x", "sp", [-1, 2, 2, 4]], ["tile_rc", "sp", [-1, 8]], ["tile_rd", "sp", [-1, 1]], ["tile_ry", "sp", [-1, 1]], ["tile_rx", "sp", [-1, 1]], ["auto_unroll_max_step", "ot", 512], ["unroll_explicit", "ot", 1]]}], "r": [[0.121042037, 0.11876773025], 0, 3.6763741970062256, 1578540140.6043577], "v": 0.1}
{"i": ["cuda", "schedule_direct_3d_cuda", [[1, 192, 16, 16, 16], [192, 192, 3, 3, 3], [1, 1, 1], [1, 1, 1], 1], {}, ["schedule_direct_3d_cuda", [1, 192, 16, 16, 16], [192, 192, 3, 3, 3], [1, 1, 1], [1, 1, 1], 1], {"i": 7303195418, "t": "", "c": null, "e": [["tile_f", "sp", [-1, 2, 24, 4]], ["tile_d", "sp", [-1, 1, 1, 1]], ["tile_y", "sp", [-1, 1, 1, 2]], ["tile_x", "sp", [-1, 1, 2, 8]], ["tile_rc", "sp", [-1, 3]], ["tile_rd", "sp", [-1, 1]], ["tile_ry", "sp", [-1, 1]], ["tile_rx", "sp", [-1, 3]], ["auto_unroll_max_step", "ot", 512], ["unroll_explicit", "ot", 1]]}], "r": [[0.00328732075, 0.003354495], 0, 1.7624249458312988, 1578540141.235102], "v": 0.1}
{"i": ["cuda", "schedule_direct_3d_cuda", [[1, 192, 16, 16, 16], [192, 192, 3, 3, 3], [1, 1, 1], [1, 1, 1], 1], {}, ["schedule_direct_3d_cuda", [1, 192, 16, 16, 16], [192, 192, 3, 3, 3], [1, 1, 1], [1, 1, 1], 1], {"i": 5716489033, "t": "", "c": null, "e": [["tile_f", "sp", [-1, 2, 32, 1]], ["tile_d", "sp", [-1, 1, 1, 1]], ["tile_y", "sp", [-1, 2, 1, 2]], ["tile_x", "sp", [-1, 1, 2, 4]], ["tile_rc", "sp", [-1, 6]], ["tile_rd", "sp", [-1, 1]], ["tile_ry", "sp", [-1, 1]], ["tile_rx", "sp", [-1, 3]], ["auto_unroll_max_step", "ot", 0], ["unroll_explicit", "ot", 1]]}], "r": [[0.00205899425, 0.00205721375], 0, 0.8446683883666992, 1578540147.1347468], "v": 0.1}
{"i": ["cuda", "schedule_direct_3d_cuda", [[1, 192, 16, 16, 16], [192, 192, 3, 3, 3], [1, 1, 1], [1, 1, 1], 1], {}, ["schedule_direct_3d_cuda", [1, 192, 16, 16, 16], [192, 192, 3, 3, 3], [1, 1, 1], [1, 1, 1], 1], {"i": 2475139097, "t": "", "c": null, "e": [["tile_f", "sp", [-1, 3, 16, 2]], ["tile_d", "sp", [-1, 1, 1, 1]], ["tile_y", "sp", [-1, 2, 1, 2]], ["tile_x", "sp", [-1, 1, 2, 4]], ["tile_rc", "sp", [-1, 4]], ["tile_rd", "sp", [-1, 1]], ["tile_ry", "sp", [-1, 1]], ["tile_rx", "sp", [-1, 3]], ["auto_unroll_max_step", "ot", 512], ["unroll_explicit", "ot", 0]]}], "r": [[0.002507971, 0.00251523075], 0, 1.088606834411621, 1578540385.351327], "v": 0.1}
{"i": ["cuda", "schedule_direct_3d_cuda", [[1, 192, 16, 16, 16], [192, 192, 3, 3, 3], [1, 1, 1], [1, 1, 1], 1], {}, ["schedule_direct_3d_cuda", [1, 192, 16, 16, 16], [192, 192, 3, 3, 3], [1, 1, 1], [1, 1, 1], 1], {"i": 2460733097, "t": "", "c": null, "e": [["tile_f", "sp", [-1, 3, 16, 2]], ["tile_d", "sp", [-1, 1, 1, 1]], ["tile_y", "sp", [-1, 2, 1, 2]], ["tile_x", "sp", [-1, 1, 2, 4]], ["tile_rc", "sp", [-1, 3]], ["tile_rd", "sp", [-1, 1]], ["tile_ry", "sp", [-1, 1]], ["tile_rx", "sp", [-1, 3]], ["auto_unroll_max_step", "ot", 512], ["unroll_explicit", "ot", 0]]}], "r": [[0.002800135, 0.00279865125], 0, 1.2125675678253174, 1578540385.9556668], "v": 0.1}
{"i": ["cuda", "schedule_direct_3d_cuda", [[1, 192, 16, 16, 16], [192, 192, 3, 3, 3], [1, 1, 1], [1, 1, 1], 1], {}, ["schedule_direct_3d_cuda", [1, 192, 16, 16, 16], [192, 192, 3, 3, 3], [1, 1, 1], [1, 1, 1], 1], {"i": 2633710939, "t": "", "c": null, "e": [["tile_f", "sp", [-1, 1, 24, 2]], ["tile_d", "sp", [-1, 1, 1, 1]], ["tile_y", "sp", [-1, 1, 1, 4]], ["tile_x", "sp", [-1, 1, 2, 4]], ["tile_rc", "sp", [-1, 1]], ["tile_rd", "sp", [-1, 3]], ["tile_ry", "sp", [-1, 1]], ["tile_rx", "sp", [-1, 3]], ["auto_unroll_max_step", "ot", 512], ["unroll_explicit", "ot", 0]]}], "r": [[0.003096817, 0.00308512775], 0, 1.1676077842712402, 1578540386.5921783], "v": 0.1}
{"i": ["cuda", "schedule_direct_3d_cuda", [[1, 192, 16, 16, 16], [192, 192, 3, 3, 3], [1, 1, 1], [1, 1, 1], 1], {}, ["schedule_direct_3d_cuda", [1, 192, 16, 16, 16], [192, 192, 3, 3, 3], [1, 1, 1], [1, 1, 1], 1], {"i": 2460608853, "t": "", "c": null, "e": [["tile_f", "sp", [-1, 2, 12, 4]], ["tile_d", "sp", [-1, 1, 1, 2]], ["tile_y", "sp", [-1, 1, 2, 1]], ["tile_x", "sp", [-1, 1, 2, 4]], ["tile_rc", "sp", [-1, 3]], ["tile_rd", "sp", [-1, 1]], ["tile_ry", "sp", [-1, 1]], ["tile_rx", "sp", [-1, 3]], ["auto_unroll_max_step", "ot", 512], ["unroll_explicit", "ot", 0]]}], "r": [[0.00390603625, 0.0039567035], 0, 1.120713472366333, 1578540387.2022834], "v": 0.1}
{"i": ["cuda", "schedule_direct_3d_cuda", [[1, 192, 16, 16, 16], [192, 192, 3, 3, 3], [1, 1, 1], [1, 1, 1], 1], {}, ["schedule_direct_3d_cuda", [1, 192, 16, 16, 16], [192, 192, 3, 3, 3], [1, 1, 1], [1, 1, 1], 1], {"i": 2460608777, "t": "", "c": null, "e": [["tile_f", "sp", [-1, 3, 16, 2]], ["tile_d", "sp", [-1, 1, 1, 2]], ["tile_y", "sp", [-1, 1, 2, 1]], ["tile_x", "sp", [-1, 1, 2, 4]], ["tile_rc", "sp", [-1, 3]], ["tile_rd", "sp", [-1, 1]], ["tile_ry", "sp", [-1, 1]], ["tile_rx", "sp", [-1, 3]], ["auto_unroll_max_step", "ot", 512], ["unroll_explicit", "ot", 0]]}], "r": [[0.005718837, 0.00571578875], 0, 1.4120583534240723, 1578540387.9917736], "v": 0.1}
{"i": ["cuda", "schedule_direct_3d_cuda", [[1, 192, 16, 16, 16], [192, 192, 3, 3, 3], [1, 1, 1], [1, 1, 1], 1], {}, ["schedule_direct_3d_cuda", [1, 192, 16, 16, 16], [192, 192, 3, 3, 3], [1, 1, 1], [1, 1, 1], 1], {"i": 2485946617, "t": "", "c": null, "e": [["tile_f", "sp", [-1, 1, 24, 4]], ["tile_d", "sp", [-1, 1, 1, 1]], ["tile_y", "sp", [-1, 1, 1, 4]], ["tile_x", "sp", [-1, 1, 2, 2]], ["tile_rc", "sp", [-1, 6]], ["tile_rd", "sp", [-1, 1]], ["tile_ry", "sp", [-1, 1]], ["tile_rx", "sp", [-1, 3]], ["auto_unroll_max_step", "ot", 512], ["unroll_explicit", "ot", 0]]}], "r": [[0.00581705925, 0.00619275625], 0, 1.1077942848205566, 1578540388.609729], "v": 0.1}
{"i": ["cuda", "schedule_direct_3d_cuda", [[1, 192, 16, 16, 16], [192, 192, 3, 3, 3], [1, 1, 1], [1, 1, 1], 1], {}, ["schedule_direct_3d_cuda", [1, 192, 16, 16, 16], [192, 192, 3, 3, 3], [1, 1, 1], [1, 1, 1], 1], {"i": 7315555097, "t": "", "c": null, "e": [["tile_f", "sp", [-1, 3, 16, 2]], ["tile_d", "sp", [-1, 1, 1, 1]], ["tile_y", "sp", [-1, 2, 1, 2]], ["tile_x", "sp", [-1, 1, 2, 4]], ["tile_rc", "sp", [-1, 4]], ["tile_rd", "sp", [-1, 1]], ["tile_ry", "sp", [-1, 1]], ["tile_rx", "sp", [-1, 3]], ["auto_unroll_max_step", "ot", 512], ["unroll_explicit", "ot", 1]]}], "r": [[0.002646295, 0.0026438445], 0, 1.464730978012085, 1578540389.2295055], "v": 0.1}
{"i": ["cuda", "schedule_direct_3d_cuda", [[1, 192, 16, 16, 16], [192, 192, 3, 3, 3], [1, 1, 1], [1, 1, 1], 1], {}, ["schedule_direct_3d_cuda", [1, 192, 16, 16, 16], [192, 192, 3, 3, 3], [1, 1, 1], [1, 1, 1], 1], {"i": 2082578540, "t": "", "c": null, "e": [["tile_f", "sp", [-1, 2, 24, 2]], ["tile_d", "sp", [-1, 1, 1, 1]], ["tile_y", "sp", [-1, 1, 1, 4]], ["tile_x", "sp", [-1, 1, 2, 2]], ["tile_rc", "sp", [-1, 6]], ["tile_rd", "sp", [-1, 1]], ["tile_ry", "sp", [-1, 3]], ["tile_rx", "sp", [-1, 1]], ["auto_unroll_max_step", "ot", 512], ["unroll_explicit", "ot", 0]]}], "r": [[0.00723138675, 0.0071796865], 0, 1.1249704360961914, 1578540389.83873], "v": 0.1}
{"i": ["cuda", "schedule_direct_3d_cuda", [[1, 192, 16, 16, 16], [192, 192, 3, 3, 3], [1, 1, 1], [1, 1, 1], 1], {}, ["schedule_direct_3d_cuda", [1, 192, 16, 16, 16], [192, 192, 3, 3, 3], [1, 1, 1], [1, 1, 1], 1], {"i": 4088611097, "t": "", "c": null, "e": [["tile_f", "sp", [-1, 3, 16, 2]], ["tile_d", "sp", [-1, 1, 1, 1]], ["tile_y", "sp", [-1, 2, 1, 2]], ["tile_x", "sp", [-1, 1, 2, 4]], ["tile_rc", "sp", [-1, 4]], ["tile_rd", "sp", [-1, 1]], ["tile_ry", "sp", [-1, 1]], ["tile_rx", "sp", [-1, 3]], ["auto_unroll_max_step", "ot", 1500], ["unroll_explicit", "ot", 0]]}], "r": [[0.00264456475, 0.0026372425], 0, 1.3609602451324463, 1578540390.5916135], "v": 0.1}
{"i": ["cuda", "schedule_direct_3d_cuda", [[1, 192, 16, 16, 16], [192, 192, 3, 3, 3], [1, 1, 1], [1, 1, 1], 1], {}, ["schedule_direct_3d_cuda", [1, 192, 16, 16, 16], [192, 192, 3, 3, 3], [1, 1, 1], [1, 1, 1], 1], {"i": 7301149097, "t": "", "c": null, "e": [["tile_f", "sp", [-1, 3, 16, 2]], ["tile_d", "sp", [-1, 1, 1, 1]], ["tile_y", "sp", [-1, 2, 1, 2]], ["tile_x", "sp", [-1, 1, 2, 4]], ["tile_rc", "sp", [-1, 3]], ["tile_rd", "sp", [-1, 1]], ["tile_ry", "sp", [-1, 1]], ["tile_rx", "sp", [-1, 3]], ["auto_unroll_max_step", "ot", 512], ["unroll_explicit", "ot", 1]]}], "r": [[0.00279998625, 0.00279798425], 0, 1.352571964263916, 1578540391.2261224], "v": 0.1}
{"i": ["cuda", "schedule_direct_3d_cuda", [[1, 192, 16, 16, 16], [192, 192, 3, 3, 3], [1, 1, 1], [1, 1, 1], 1], {}, ["schedule_direct_3d_cuda", [1, 192, 16, 16, 16], [192, 192, 3, 3, 3], [1, 1, 1], [1, 1, 1], 1], {"i": 2460726457, "t": "", "c": null, "e": [["tile_f", "sp", [-1, 1, 24, 4]], ["tile_d", "sp", [-1, 1, 1, 2]], ["tile_y", "sp", [-1, 1, 1, 2]], ["tile_x", "sp", [-1, 1, 2, 4]], ["tile_rc", "sp", [-1, 3]], ["tile_rd", "sp", [-1, 1]], ["tile_ry", "sp", [-1, 1]], ["tile_rx", "sp", [-1, 3]], ["auto_unroll_max_step", "ot", 512], ["unroll_explicit", "ot", 0]]}], "r": [[0.00411161575, 0.00418737075], 0, 1.1285290718078613, 1578540391.8464177], "v": 0.1}
{"i": ["cuda", "schedule_direct_3d_cuda", [[1, 192, 16, 16, 16], [192, 192, 3, 3, 3], [1, 1, 1], [1, 1, 1], 1], {}, ["schedule_direct_3d_cuda", [1, 192, 16, 16, 16], [192, 192, 3, 3, 3], [1, 1, 1], [1, 1, 1], 1], {"i": 4074205097, "t": "", "c": null, "e": [["tile_f", "sp", [-1, 3, 16, 2]], ["tile_d", "sp", [-1, 1, 1, 1]], ["tile_y", "sp", [-1, 2, 1, 2]], ["tile_x", "sp", [-1, 1, 2, 4]], ["tile_rc", "sp", [-1, 3]], ["tile_rd", "sp", [-1, 1]], ["tile_ry", "sp", [-1, 1]], ["tile_rx", "sp", [-1, 3]], ["auto_unroll_max_step", "ot", 1500], ["unroll_explicit", "ot", 0]]}], "r": [[0.00867049575, 0.008581801], 0, 1.4491631984710693, 1578540392.744602], "v": 0.1}
{"i": ["cuda", "schedule_direct_3d_cuda", [[1, 192, 16, 16, 16], [192, 192, 3, 3, 3], [1, 1, 1], [1, 1, 1], 1], {}, ["schedule_direct_3d_cuda", [1, 192, 16, 16, 16], [192, 192, 3, 3, 3], [1, 1, 1], [1, 1, 1], 1], {"i": 2475139099, "t": "", "c": null, "e": [["tile_f", "sp", [-1, 1, 24, 2]], ["tile_d", "sp", [-1, 1, 1, 1]], ["tile_y", "sp", [-1, 2, 1, 2]], ["tile_x", "sp", [-1, 1, 2, 4]], ["tile_rc", "sp", [-1, 4]], ["tile_rd", "sp", [-1, 1]], ["tile_ry", "sp", [-1, 1]], ["tile_rx", "sp", [-1, 3]], ["auto_unroll_max_step", "ot", 512], ["unroll_explicit", "ot", 0]]}], "r": [[0.00359048675, 0.00357557975], 0, 1.2228374481201172, 1578540395.0604577], "v": 0.1}
{"i": ["cuda", "schedule_direct_3d_cuda", [[1, 192, 16, 16, 16], [192, 192, 3, 3, 3], [1, 1, 1], [1, 1, 1], 1], {}, ["schedule_direct_3d_cuda", [1, 192, 16, 16, 16], [192, 192, 3, 3, 3], [1, 1, 1], [1, 1, 1], 1], {"i": 1870075342, "t": "", "c": null, "e": [["tile_f", "sp", [-1, 1, 32, 2]], ["tile_d", "sp", [-1, 1, 1, 1]], ["tile_y", "sp", [-1, 1, 1, 2]], ["tile_x", "sp", [-1, 1, 2, 4]], ["tile_rc", "sp", [-1, 4]], ["tile_rd", "sp", [-1, 3]], ["tile_ry", "sp", [-1, 1]], ["tile_rx", "sp", [-1, 1]], ["auto_unroll_max_step", "ot", 512], ["unroll_explicit", "ot", 0]]}], "r": [[0.01034114975, 0.01020029325], 0, 1.2347500324249268, 1578540395.815686], "v": 0.1}
{"i": ["cuda", "schedule_direct_3d_cuda", [[1, 192, 16, 16, 16], [192, 192, 3, 3, 3], [1, 1, 1], [1, 1, 1], 1], {}, ["schedule_direct_3d_cuda", [1, 192, 16, 16, 16], [192, 192, 3, 3, 3], [1, 1, 1], [1, 1, 1], 1], {"i": 2460721673, "t": "", "c": null, "e": [["tile_f", "sp", [-1, 3, 16, 2]], ["tile_d", "sp", [-1, 2, 1, 1]], ["tile_y", "sp", [-1, 1, 1, 2]], ["tile_x", "sp", [-1, 1, 2, 4]], ["tile_rc", "sp", [-1, 3]], ["tile_rd", "sp", [-1, 1]], ["tile_ry", "sp", [-1, 1]], ["tile_rx", "sp", [-1, 3]], ["auto_unroll_max_step", "ot", 512], ["unroll_explicit", "ot", 0]]}], "r": [[0.002853006, 0.00283896775], 0, 1.2237138748168945, 1578540396.4512248], "v": 0.1}
{"i": ["cuda", "schedule_direct_3d_cuda", [[1, 192, 16, 16, 16], [192, 192, 3, 3, 3], [1, 1, 1], [1, 1, 1], 1], {}, ["schedule_direct_3d_cuda", [1, 192, 16, 16, 16], [192, 192, 3, 3, 3], [1, 1, 1], [1, 1, 1], 1], {"i": 7474126939, "t": "", "c": null, "e": [["tile_f", "sp", [-1, 1, 24, 2]], ["tile_d", "sp", [-1, 1, 1, 1]], ["tile_y", "sp", [-1, 1, 1, 4]], ["tile_x", "sp", [-1, 1, 2, 4]], ["tile_rc", "sp", [-1, 1]], ["tile_rd", "sp", [-1, 3]], ["tile_ry", "sp", [-1, 1]], ["tile_rx", "sp", [-1, 3]], ["auto_unroll_max_step", "ot", 512], ["unroll_explicit", "ot", 1]]}], "r": [[0.0030158565, 0.0029792645], 0, 1.3030102252960205, 1578540397.0767055], "v": 0.1}
{"i": ["cuda", "schedule_direct_3d_cuda", [[1, 192, 16, 16, 16], [192, 192, 3, 3, 3], [1, 1, 1], [1, 1, 1], 1], {}, ["schedule_direct_3d_cuda", [1, 192, 16, 16, 16], [192, 192, 3, 3, 3], [1, 1, 1], [1, 1, 1], 1], {"i": 2475014780, "t": "", "c": null, "e": [["tile_f", "sp", [-1, 2, 24, 2]], ["tile_d", "sp", [-1, 1, 1, 2]], ["tile_y", "sp", [-1, 1, 2, 1]], ["tile_x", "sp", [-1, 1, 2, 4]], ["tile_rc", "sp", [-1, 4]], ["tile_rd", "sp", [-1, 1]], ["tile_ry", "sp", [-1, 1]], ["tile_rx", "sp", [-1, 3]], ["auto_unroll_max_step", "ot", 512], ["unroll_explicit", "ot", 0]]}], "r": [[0.002953135, 0.0029348435], 0, 1.2342803478240967, 1578540397.738187], "v": 0.1}
{"i": ["cuda", "schedule_direct_3d_cuda", [[1, 192, 16, 16, 16], [192, 192, 3, 3, 3], [1, 1, 1], [1, 1, 1], 1], {}, ["schedule_direct_3d_cuda", [1, 192, 16, 16, 16], [192, 192, 3, 3, 3], [1, 1, 1], [1, 1, 1], 1], {"i": 2474967740, "t": "", "c": null, "e": [["tile_f", "sp", [-1, 2, 24, 2]], ["tile_d", "sp", [-1, 1, 1, 2]], ["tile_y", "sp", [-1, 2, 1, 1]], ["tile_x", "sp", [-1, 1, 2, 4]], ["tile_rc", "sp", [-1, 4]], ["tile_rd", "sp", [-1, 1]], ["tile_ry", "sp", [-1, 1]], ["tile_rx", "sp", [-1, 3]], ["auto_unroll_max_step", "ot", 512], ["unroll_explicit", "ot", 0]]}], "r": [[0.0039645635, 0.004009668], 0, 1.194545030593872, 1578540398.3723462], "v": 0.1}
{"i": ["cuda", "schedule_direct_3d_cuda", [[1, 192, 16, 16, 16], [192, 192, 3, 3, 3], [1, 1, 1], [1, 1, 1], 1], {}, ["schedule_direct_3d_cuda", [1, 192, 16, 16, 16], [192, 192, 3, 3, 3], [1, 1, 1], [1, 1, 1], 1], {"i": 7301024853, "t": "", "c": null, "e": [["tile_f", "sp", [-1, 2, 12, 4]], ["tile_d", "sp", [-1, 1, 1, 2]], ["tile_y", "sp", [-1, 1, 2, 1]], ["tile_x", "sp", [-1, 1, 2, 4]], ["tile_rc", "sp", [-1, 3]], ["tile_rd", "sp", [-1, 1]], ["tile_ry", "sp", [-1, 1]], ["tile_rx", "sp", [-1, 3]], ["auto_unroll_max_step", "ot", 512], ["unroll_explicit", "ot", 1]]}], "r": [[0.00361584975, 0.003564575], 0, 1.2847769260406494, 1578540398.9727144], "v": 0.1}
{"i": ["cuda", "schedule_direct_3d_cuda", [[1, 192, 16, 16, 16], [192, 192, 3, 3, 3], [1, 1, 1], [1, 1, 1], 1], {}, ["schedule_direct_3d_cuda", [1, 192, 16, 16, 16], [192, 192, 3, 3, 3], [1, 1, 1], [1, 1, 1], 1], {"i": 2485876053, "t": "", "c": null, "e": [["tile_f", "sp", [-1, 2, 12, 4]], ["tile_d", "sp", [-1, 1, 1, 1]], ["tile_y", "sp", [-1, 1, 2, 2]], ["tile_x", "sp", [-1, 1, 2, 2]], ["tile_rc", "sp", [-1, 6]], ["tile_rd", "sp", [-1, 1]], ["tile_ry", "sp", [-1, 1]], ["tile_rx", "sp", [-1, 3]], ["auto_unroll_max_step", "ot", 512], ["unroll_explicit", "ot", 0]]}], "r": [[0.004803242, 0.0048656705], 0, 1.098726511001587, 1578540399.5774531], "v": 0.1}
{"i": ["cuda", "schedule_direct_3d_cuda", [[1, 192, 16, 16, 16], [192, 192, 3, 3, 3], [1, 1, 1], [1, 1, 1], 1], {}, ["schedule_direct_3d_cuda", [1, 192, 16, 16, 16], [192, 192, 3, 3, 3], [1, 1, 1], [1, 1, 1], 1], {"i": 1711609342, "t": "", "c": null, "e": [["tile_f", "sp", [-1, 1, 32, 2]], ["tile_d", "sp", [-1, 1, 1, 1]], ["tile_y", "sp", [-1, 1, 1, 2]], ["tile_x", "sp", [-1, 1, 2, 4]], ["tile_rc", "sp", [-1, 12]], ["tile_rd", "sp", [-1, 1]], ["tile_ry", "sp", [-1, 1]], ["tile_rx", "sp", [-1, 1]], ["auto_unroll_max_step", "ot", 512], ["unroll_explicit", "ot", 0]]}], "r": [[0.00997883925, 0.00994626625], 0, 1.2783892154693604, 1578540400.3393495], "v": 0.1}
{"i": ["cuda", "schedule_direct_3d_cuda", [[1, 192, 16, 16, 16], [192, 192, 3, 3, 3], [1, 1, 1], [1, 1, 1], 1], {}, ["schedule_direct_3d_cuda", [1, 192, 16, 16, 16], [192, 192, 3, 3, 3], [1, 1, 1], [1, 1, 1], 1], {"i": 2444089328, "t": "", "c": null, "e": [["tile_f", "sp", [-1, 4, 8, 2]], ["tile_d", "sp", [-1, 1, 1, 4]], ["tile_y", "sp", [-1, 1, 1, 1]], ["tile_x", "sp", [-1, 2, 4, 2]], ["tile_rc", "sp", [-1, 2]], ["tile_rd", "sp", [-1, 1]], ["tile_ry", "sp", [-1, 1]], ["tile_rx", "sp", [-1, 3]], ["auto_unroll_max_step", "ot", 512], ["unroll_explicit", "ot", 0]]}], "r": [[0.00239708125, 0.0023945675], 0, 1.295924425125122, 1578540400.9911664], "v": 0.1}
{"i": ["cuda", "schedule_direct_3d_cuda", [[1, 192, 16, 16, 16], [192, 192, 3, 3, 3], [1, 1, 1], [1, 1, 1], 1], {}, ["schedule_direct_3d_cuda", [1, 192, 16, 16, 16], [192, 192, 3, 3, 3], [1, 1, 1], [1, 1, 1], 1], {"i": 2444374928, "t": "", "c": null, "e": [["tile_f", "sp", [-1, 4, 8, 2]], ["tile_d", "sp", [-1, 1, 1, 1]], ["tile_y", "sp", [-1, 1, 1, 4]], ["tile_x", "sp", [-1, 2, 4, 2]], ["tile_rc", "sp", [-1, 2]], ["tile_rd", "sp", [-1, 1]], ["tile_ry", "sp", [-1, 1]], ["tile_rx", "sp", [-1, 3]], ["auto_unroll_max_step", "ot", 512], ["unroll_explicit", "ot", 0]]}], "r": [[0.00240620425, 0.0024096025], 0, 1.2772233486175537, 1578540401.6454282], "v": 0.1}
{"i": ["cuda", "schedule_direct_3d_cuda", [[1, 192, 16, 16, 16], [192, 192, 3, 3, 3], [1, 1, 1], [1, 1, 1], 1], {}, ["schedule_direct_3d_cuda", [1, 192, 16, 16, 16], [192, 192, 3, 3, 3], [1, 1, 1], [1, 1, 1], 1], {"i": 7301024777, "t": "", "c": null, "e": [["tile_f", "sp", [-1, 3, 16, 2]], ["tile_d", "sp", [-1, 1, 1, 2]], ["tile_y", "sp", [-1, 1, 2, 1]], ["tile_x", "sp", [-1, 1, 2, 4]], ["tile_rc", "sp", [-1, 3]], ["tile_rd", "sp", [-1, 1]], ["tile_ry", "sp", [-1, 1]], ["tile_rx", "sp", [-1, 3]], ["auto_unroll_max_step", "ot", 512], ["unroll_explicit", "ot", 1]]}], "r": [[0.0058549935, 0.00584904225], 0, 1.6139426231384277, 1578540402.5293515], "v": 0.1}
{"i": ["cuda", "schedule_direct_3d_cuda", [[1, 192, 16, 16, 16], [192, 192, 3, 3, 3], [1, 1, 1], [1, 1, 1], 1], {}, ["schedule_direct_3d_cuda", [1, 192, 16, 16, 16], [192, 192, 3, 3, 3], [1, 1, 1], [1, 1, 1], 1], {"i": 2071876972, "t": "", "c": null, "e": [["tile_f", "sp", [-1, 1, 32, 3]], ["tile_d", "sp", [-1, 1, 1, 1]], ["tile_y", "sp", [-1, 1, 1, 4]], ["tile_x", "sp", [-1, 1, 2, 4]], ["tile_rc", "sp", [-1, 4]], ["tile_rd", "sp", [-1, 1]], ["tile_ry", "sp", [-1, 3]], ["tile_rx", "sp", [-1, 1]], ["auto_unroll_max_step", "ot", 512], ["unroll_explicit", "ot", 0]]}], "r": [[0.00308951625, 0.0030985855], 0, 1.0389692783355713, 1578540404.3477387], "v": 0.1}
{"i": ["cuda", "schedule_direct_3d_cuda", [[1, 192, 16, 16, 16], [192, 192, 3, 3, 3], [1, 1, 1], [1, 1, 1], 1], {}, ["schedule_direct_3d_cuda", [1, 192, 16, 16, 16], [192, 192, 3, 3, 3], [1, 1, 1], [1, 1, 1], 1], {"i": 2475367582, "t": "", "c": null, "e": [["tile_f", "sp", [-1, 1, 32, 2]], ["tile_d", "sp", [-1, 1, 1, 2]], ["tile_y", "sp", [-1, 1, 1, 1]], ["tile_x", "sp", [-1, 2, 2, 4]], ["tile_rc", "sp", [-1, 4]], ["tile_rd", "sp", [-1, 1]], ["tile_ry", "sp", [-1, 1]], ["tile_rx", "sp", [-1, 3]], ["auto_unroll_max_step", "ot", 512], ["unroll_explicit", "ot", 0]]}], "r": [[0.00349507525, 0.00349510225], 0, 1.1194677352905273, 1578540404.9860866], "v": 0.1}
{"i": ["cuda", "schedule_direct_3d_cuda", [[1, 192, 16, 16, 16], [192, 192, 3, 3, 3], [1, 1, 1], [1, 1, 1], 1], {}, ["schedule_direct_3d_cuda", [1, 192, 16, 16, 16], [192, 192, 3, 3, 3], [1, 1, 1], [1, 1, 1], 1], {"i": 256603342, "t": "", "c": null, "e": [["tile_f", "sp", [-1, 1, 32, 2]], ["tile_d", "sp", [-1, 1, 1, 1]], ["tile_y", "sp", [-1, 1, 1, 2]], ["tile_x", "sp", [-1, 1, 2, 4]], ["tile_rc", "sp", [-1, 4]], ["tile_rd", "sp", [-1, 3]], ["tile_ry", "sp", [-1, 1]], ["tile_rx", "sp", [-1, 1]], ["auto_unroll_max_step", "ot", 0], ["unroll_explicit", "ot", 0]]}], "r": [[0.00902101125, 0.009001177], 0, 1.1822760105133057, 1578540405.7244833], "v": 0.1}
{"i": ["cuda", "schedule_direct_3d_cuda", [[1, 192, 16, 16, 16], [192, 192, 3, 3, 3], [1, 1, 1], [1, 1, 1], 1], {}, ["schedule_direct_3d_cuda", [1, 192, 16, 16, 16], [192, 192, 3, 3, 3], [1, 1, 1], [1, 1, 1], 1], {"i": 2489650972, "t": "", "c": null, "e": [["tile_f", "sp", [-1, 1, 32, 3]], ["tile_d", "sp", [-1, 1, 1, 1]], ["tile_y", "sp", [-1, 1, 1, 4]], ["tile_x", "sp", [-1, 1, 2, 4]], ["tile_rc", "sp", [-1, 6]], ["tile_rd", "sp", [-1, 1]], ["tile_ry", "sp", [-1, 1]], ["tile_rx", "sp", [-1, 3]], ["auto_unroll_max_step", "ot", 512], ["unroll_explicit", "ot", 0]]}], "r": [[0.002328792, 0.00232223225], 0, 1.1800541877746582, 1578540406.3278115], "v": 0.1}
{"i": ["cuda", "schedule_direct_3d_cuda", [[1, 192, 16, 16, 16], [192, 192, 3, 3, 3], [1, 1, 1], [1, 1, 1], 1], {}, ["schedule_direct_3d_cuda", [1, 192, 16, 16, 16], [192, 192, 3, 3, 3], [1, 1, 1], [1, 1, 1], 1], {"i": 7085094380, "t": "", "c": null, "e": [["tile_f", "sp", [-1, 2, 24, 2]], ["tile_d", "sp", [-1, 1, 1, 1]], ["tile_y", "sp", [-1, 1, 2, 2]], ["tile_x", "sp", [-1, 1, 2, 4]], ["tile_rc", "sp", [-1, 2]], ["tile_rd", "sp", [-1, 3]], ["tile_ry", "sp", [-1, 3]], ["tile_rx", "sp", [-1, 1]], ["auto_unroll_max_step", "ot", 512], ["unroll_explicit", "ot", 1]]}], "r": [[0.00237995025, 0.002432165], 0, 1.354813814163208, 1578540406.9304254], "v": 0.1}
{"i": ["cuda", "schedule_direct_3d_cuda", [[1, 192, 16, 16, 16], [192, 192, 3, 3, 3], [1, 1, 1], [1, 1, 1], 1], {}, ["schedule_direct_3d_cuda", [1, 192, 16, 16, 16], [192, 192, 3, 3, 3], [1, 1, 1], [1, 1, 1], 1], {"i": 2444089336, "t": "", "c": null, "e": [["tile_f", "sp", [-1, 2, 16, 2]], ["tile_d", "sp", [-1, 1, 1, 4]], ["tile_y", "sp", [-1, 1, 1, 1]], ["tile_x", "sp", [-1, 2, 4, 2]], ["tile_rc", "sp", [-1, 2]], ["tile_rd", "sp", [-1, 1]], ["tile_ry", "sp", [-1, 1]], ["tile_rx", "sp", [-1, 3]], ["auto_unroll_max_step", "ot", 512], ["unroll_explicit", "ot", 0]]}], "r": [[0.00326173475, 0.0032543065], 0, 1.3008804321289062, 1578540407.6487026], "v": 0.1}
{"i": ["cuda", "schedule_direct_3d_cuda", [[1, 192, 16, 16, 16], [192, 192, 3, 3, 3], [1, 1, 1], [1, 1, 1], 1], {}, ["schedule_direct_3d_cuda", [1, 192, 16, 16, 16], [192, 192, 3, 3, 3], [1, 1, 1], [1, 1, 1], 1], {"i": 7326362617, "t": "", "c": null, "e": [["tile_f", "sp", [-1, 1, 24, 4]], ["tile_d", "sp", [-1, 1, 1, 1]], ["tile_y", "sp", [-1, 1, 1, 4]], ["tile_x", "sp", [-1, 1, 2, 2]], ["tile_rc", "sp", [-1, 6]], ["tile_rd", "sp", [-1, 1]], ["tile_ry", "sp", [-1, 1]], ["tile_rx", "sp", [-1, 3]], ["auto_unroll_max_step", "ot", 512], ["unroll_explicit", "ot", 1]]}], "r": [[0.0043719755, 0.0043519695], 0, 1.1569807529449463, 1578540408.241442], "v": 0.1}
{"i": ["cuda", "schedule_direct_3d_cuda", [[1, 192, 16, 16, 16], [192, 192, 3, 3, 3], [1, 1, 1], [1, 1, 1], 1], {}, ["schedule_direct_3d_cuda", [1, 192, 16, 16, 16], [192, 192, 3, 3, 3], [1, 1, 1], [1, 1, 1], 1], {"i": 2068584142, "t": "", "c": null, "e": [["tile_f", "sp", [-1, 1, 32, 2]], ["tile_d", "sp", [-1, 1, 1, 1]], ["tile_y", "sp", [-1, 1, 1, 4]], ["tile_x", "sp", [-1, 2, 2, 2]], ["tile_rc", "sp", [-1, 4]], ["tile_rd", "sp", [-1, 1]], ["tile_ry", "sp", [-1, 3]], ["tile_rx", "sp", [-1, 1]], ["auto_unroll_max_step", "ot", 512], ["unroll_explicit", "ot", 0]]}], "r": [[0.00308060525, 0.00305575125], 0, 1.2953858375549316, 1578540409.0159593], "v": 0.1}
{"i": ["cuda", "schedule_direct_3d_cuda", [[1, 192, 16, 16, 16], [192, 192, 3, 3, 3], [1, 1, 1], [1, 1, 1], 1], {}, ["schedule_direct_3d_cuda", [1, 192, 16, 16, 16], [192, 192, 3, 3, 3], [1, 1, 1], [1, 1, 1], 1], {"i": 2475127337, "t": "", "c": null, "e": [["tile_f", "sp", [-1, 3, 16, 2]], ["tile_d", "sp", [-1, 1, 1, 1]], ["tile_y", "sp", [-1, 1, 1, 2]], ["tile_x", "sp", [-1, 1, 2, 4]], ["tile_rc", "sp", [-1, 4]], ["tile_rd", "sp", [-1, 1]], ["tile_ry", "sp", [-1, 1]], ["tile_rx", "sp", [-1, 3]], ["auto_unroll_max_step", "ot", 512], ["unroll_explicit", "ot", 0]]}], "r": [[0.00377889375, 0.003770331], 0, 1.1134917736053467, 1578540409.606237], "v": 0.1}
{"i": ["cuda", "schedule_direct_3d_cuda", [[1, 192, 16, 16, 16], [192, 192, 3, 3, 3], [1, 1, 1], [1, 1, 1], 1], {}, ["schedule_direct_3d_cuda", [1, 192, 16, 16, 16], [192, 192, 3, 3, 3], [1, 1, 1], [1, 1, 1], 1], {"i": 2460961582, "t": "", "c": null, "e": [["tile_f", "sp", [-1, 1, 32, 2]], ["tile_d", "sp", [-1, 1, 1, 2]], ["tile_y", "sp", [-1, 1, 1, 1]], ["tile_x", "sp", [-1, 2, 2, 4]], ["tile_rc", "sp", [-1, 3]], ["tile_rd", "sp", [-1, 1]], ["tile_ry", "sp", [-1, 1]], ["tile_rx", "sp", [-1, 3]], ["auto_unroll_max_step", "ot", 512], ["unroll_explicit", "ot", 0]]}], "r": [[0.00303115175, 0.00300967], 0, 1.2135813236236572, 1578540410.3402264], "v": 0.1}
{"i": ["cuda", "schedule_direct_3d_cuda", [[1, 192, 16, 16, 16], [192, 192, 3, 3, 3], [1, 1, 1], [1, 1, 1], 1], {}, ["schedule_direct_3d_cuda", [1, 192, 16, 16, 16], [192, 192, 3, 3, 3], [1, 1, 1], [1, 1, 1], 1], {"i": 2475127678, "t": "", "c": null, "e": [["tile_f", "sp", [-1, 1, 32, 2]], ["tile_d", "sp", [-1, 2, 1, 1]], ["tile_y", "sp", [-1, 1, 1, 2]], ["tile_x", "sp", [-1, 1, 2, 4]], ["tile_rc", "sp", [-1, 4]], ["tile_rd", "sp", [-1, 1]], ["tile_ry", "sp", [-1, 1]], ["tile_rx", "sp", [-1, 3]], ["auto_unroll_max_step", "ot", 512], ["unroll_explicit", "ot", 0]]}], "r": [[0.00271824125, 0.00271308975], 0, 1.1646437644958496, 1578540411.0195107], "v": 0.1}
{"i": ["cuda", "schedule_direct_3d_cuda", [[1, 192, 16, 16, 16], [192, 192, 3, 3, 3], [1, 1, 1], [1, 1, 1], 1], {}, ["schedule_direct_3d_cuda", [1, 192, 16, 16, 16], [192, 192, 3, 3, 3], [1, 1, 1], [1, 1, 1], 1], {"i": 1020238939, "t": "", "c": null, "e": [["tile_f", "sp", [-1, 1, 24, 2]], ["tile_d", "sp", [-1, 1, 1, 1]], ["tile_y", "sp", [-1, 1, 1, 4]], ["tile_x", "sp", [-1, 1, 2, 4]], ["tile_rc", "sp", [-1, 1]], ["tile_rd", "sp", [-1, 3]], ["tile_ry", "sp", [-1, 1]], ["tile_rx", "sp", [-1, 3]], ["auto_unroll_max_step", "ot", 0], ["unroll_explicit", "ot", 0]]}], "r": [[0.00243595, 0.00244676925], 0, 1.0306124687194824, 1578540411.6296797], "v": 0.1}
{"i": ["cuda", "schedule_direct_3d_cuda", [[1, 192, 16, 16, 16], [192, 192, 3, 3, 3], [1, 1, 1], [1, 1, 1], 1], {}, ["schedule_direct_3d_cuda", [1, 192, 16, 16, 16], [192, 192, 3, 3, 3], [1, 1, 1], [1, 1, 1], 1], {"i": 3858150380, "t": "", "c": null, "e": [["tile_f", "sp", [-1, 2, 24, 2]], ["tile_d", "sp", [-1, 1, 1, 1]], ["tile_y", "sp", [-1, 1, 2, 2]], ["tile_x", "sp", [-1, 1, 2, 4]], ["tile_rc", "sp", [-1, 2]], ["tile_rd", "sp", [-1, 3]], ["tile_ry", "sp", [-1, 3]], ["tile_rx", "sp", [-1, 1]], ["auto_unroll_max_step", "ot", 1500], ["unroll_explicit", "ot", 0]]}], "r": [[0.0021458795, 0.0021416505], 0, 1.215973138809204, 1578540413.956152], "v": 0.1}
{"i": ["cuda", "schedule_direct_3d_cuda", [[1, 192, 16, 16, 16], [192, 192, 3, 3, 3], [1, 1, 1], [1, 1, 1], 1], {}, ["schedule_direct_3d_cuda", [1, 192, 16, 16, 16], [192, 192, 3, 3, 3], [1, 1, 1], [1, 1, 1], 1], {"i": 2460733029, "t": "", "c": null, "e": [["tile_f", "sp", [-1, 2, 24, 1]], ["tile_d", "sp", [-1, 1, 1, 1]], ["tile_y", "sp", [-1, 2, 1, 2]], ["tile_x", "sp", [-1, 1, 2, 4]], ["tile_rc", "sp", [-1, 3]], ["tile_rd", "sp", [-1, 1]], ["tile_ry", "sp", [-1, 1]], ["tile_rx", "sp", [-1, 3]], ["auto_unroll_max_step", "ot", 512], ["unroll_explicit", "ot", 0]]}], "r": [[0.00283381375, 0.002812026], 0, 1.1962435245513916, 1578540414.6710103], "v": 0.1}
{"i": ["cuda", "schedule_direct_3d_cuda", [[1, 192, 16, 16, 16], [192, 192, 3, 3, 3], [1, 1, 1], [1, 1, 1], 1], {}, ["schedule_direct_3d_cuda", [1, 192, 16, 16, 16], [192, 192, 3, 3, 3], [1, 1, 1], [1, 1, 1], 1], {"i": 1870075336, "t": "", "c": null, "e": [["tile_f", "sp", [-1, 2, 16, 2]], ["tile_d", "sp", [-1, 1, 1, 1]], ["tile_y", "sp", [-1, 1, 1, 2]], ["tile_x", "sp", [-1, 1, 2, 4]], ["tile_rc", "sp", [-1, 4]], ["tile_rd", "sp", [-1, 3]], ["tile_ry", "sp", [-1, 1]], ["tile_rx", "sp", [-1, 1]], ["auto_unroll_max_step", "ot", 512], ["unroll_explicit", "ot", 0]]}], "r": [[0.00807322275, 0.008138543], 0, 1.4247379302978516, 1578540415.5850089], "v": 0.1}
{"i": ["cuda", "schedule_direct_3d_cuda", [[1, 192, 16, 16, 16], [192, 192, 3, 3, 3], [1, 1, 1], [1, 1, 1], 1], {}, ["schedule_direct_3d_cuda", [1, 192, 16, 16, 16], [192, 192, 3, 3, 3], [1, 1, 1], [1, 1, 1], 1], {"i": 3872509279, "t": "", "c": null, "e": [["tile_f", "sp", [-1, 1, 64, 1]], ["tile_d", "sp", [-1, 1, 1, 1]], ["tile_y", "sp", [-1, 1, 1, 2]], ["tile_x", "sp", [-1, 1, 2, 4]], ["tile_rc", "sp", [-1, 3]], ["tile_rd", "sp", [-1, 3]], ["tile_ry", "sp", [-1, 3]], ["tile_rx", "sp", [-1, 1]], ["auto_unroll_max_step", "ot", 1500], ["unroll_explicit", "ot", 0]]}], "r": [[0.0056310195, 0.00555828375], 0, 1.499347448348999, 1578540416.3775303], "v": 0.1}
{"i": ["cuda", "schedule_direct_3d_cuda", [[1, 192, 16, 16, 16], [192, 192, 3, 3, 3], [1, 1, 1], [1, 1, 1], 1], {}, ["schedule_direct_3d_cuda", [1, 192, 16, 16, 16], [192, 192, 3, 3, 3], [1, 1, 1], [1, 1, 1], 1], {"i": 4088611033, "t": "", "c": null, "e": [["tile_f", "sp", [-1, 2, 32, 1]], ["tile_d", "sp", [-1, 1, 1, 1]], ["tile_y", "sp", [-1, 2, 1, 2]], ["tile_x", "sp", [-1, 1, 2, 4]], ["tile_rc", "sp", [-1, 4]], ["tile_rd", "sp", [-1, 1]], ["tile_ry", "sp", [-1, 1]], ["tile_rx", "sp", [-1, 3]], ["auto_unroll_max_step", "ot", 1500], ["unroll_explicit", "ot", 0]]}], "r": [[0.002691381, 0.0026867255], 0, 1.531510829925537, 1578540417.220853], "v": 0.1}
{"i": ["cuda", "schedule_direct_3d_cuda", [[1, 192, 16, 16, 16], [192, 192, 3, 3, 3], [1, 1, 1], [1, 1, 1], 1], {}, ["schedule_direct_3d_cuda", [1, 192, 16, 16, 16], [192, 192, 3, 3, 3], [1, 1, 1], [1, 1, 1], 1], {"i": 2461556297, "t": "", "c": null, "e": [["tile_f", "sp", [-1, 3, 16, 2]], ["tile_d", "sp", [-1, 1, 1, 1]], ["tile_y", "sp", [-1, 2, 1, 2]], ["tile_x", "sp", [-1, 1, 4, 4]], ["tile_rc", "sp", [-1, 3]], ["tile_rd", "sp", [-1, 1]], ["tile_ry", "sp", [-1, 1]], ["tile_rx", "sp", [-1, 3]], ["auto_unroll_max_step", "ot", 512], ["unroll_explicit", "ot", 0]]}], "r": [[0.002887458, 0.00288287925], 0, 1.3741955757141113, 1578540417.9030986], "v": 0.1}
{"i": ["cuda", "schedule_direct_3d_cuda", [[1, 192, 16, 16, 16], [192, 192, 3, 3, 3], [1, 1, 1], [1, 1, 1], 1], {}, ["schedule_direct_3d_cuda", [1, 192, 16, 16, 16], [192, 192, 3, 3, 3], [1, 1, 1], [1, 1, 1], 1], {"i": 847136853, "t": "", "c": null, "e": [["tile_f", "sp", [-1, 2, 12, 4]], ["tile_d", "sp", [-1, 1, 1, 2]], ["tile_y", "sp", [-1, 1, 2, 1]], ["tile_x", "sp", [-1, 1, 2, 4]], ["tile_rc", "sp", [-1, 3]], ["tile_rd", "sp", [-1, 1]], ["tile_ry", "sp", [-1, 1]], ["tile_rx", "sp", [-1, 3]], ["auto_unroll_max_step", "ot", 0], ["unroll_explicit", "ot", 0]]}], "r": [[0.00287940525, 0.00292229475], 0, 1.1507935523986816, 1578540418.4978533], "v": 0.1}
{"i": ["cuda", "schedule_direct_3d_cuda", [[1, 192, 16, 16, 16], [192, 192, 3, 3, 3], [1, 1, 1], [1, 1, 1], 1], {}, ["schedule_direct_3d_cuda", [1, 192, 16, 16, 16], [192, 192, 3, 3, 3], [1, 1, 1], [1, 1, 1], 1], {"i": 2460838935, "t": "", "c": null, "e": [["tile_f", "sp", [-1, 1, 16, 2]], ["tile_d", "sp", [-1, 1, 1, 1]], ["tile_y", "sp", [-1, 1, 1, 4]], ["tile_x", "sp", [-1, 1, 2, 4]], ["tile_rc", "sp", [-1, 3]], ["tile_rd", "sp", [-1, 1]], ["tile_ry", "sp", [-1, 1]], ["tile_rx", "sp", [-1, 3]], ["auto_unroll_max_step", "ot", 512], ["unroll_explicit", "ot", 0]]}], "r": [[0.003536808, 0.00351454775], 0, 1.2874681949615479, 1578540419.2471085], "v": 0.1}
{"i": ["cuda", "schedule_direct_3d_cuda", [[1, 192, 16, 16, 16], [192, 192, 3, 3, 3], [1, 1, 1], [1, 1, 1], 1], {}, ["schedule_direct_3d_cuda", [1, 192, 16, 16, 16], [192, 192, 3, 3, 3], [1, 1, 1], [1, 1, 1], 1], {"i": 2460721678, "t": "", "c": null, "e": [["tile_f", "sp", [-1, 1, 32, 2]], ["tile_d", "sp", [-1, 2, 1, 1]], ["tile_y", "sp", [-1, 1, 1, 2]], ["tile_x", "sp", [-1, 1, 2, 4]], ["tile_rc", "sp", [-1, 3]], ["tile_rd", "sp", [-1, 1]], ["tile_ry", "sp", [-1, 1]], ["tile_rx", "sp", [-1, 3]], ["auto_unroll_max_step", "ot", 512], ["unroll_explicit", "ot", 0]]}], "r": [[0.003229225, 0.00326199425], 0, 1.2578728199005127, 1578540419.9648182], "v": 0.1}
{"i": ["cuda", "schedule_direct_3d_cuda", [[1, 192, 16, 16, 16], [192, 192, 3, 3, 3], [1, 1, 1], [1, 1, 1], 1], {}, ["schedule_direct_3d_cuda", [1, 192, 16, 16, 16], [192, 192, 3, 3, 3], [1, 1, 1], [1, 1, 1], 1], {"i": 2475014853, "t": "", "c": null, "e": [["tile_f", "sp", [-1, 2, 12, 4]], ["tile_d", "sp", [-1, 1, 1, 2]], ["tile_y", "sp", [-1, 1, 2, 1]], ["tile_x", "sp", [-1, 1, 2, 4]], ["tile_rc", "sp", [-1, 4]], ["tile_rd", "sp", [-1, 1]], ["tile_ry", "sp", [-1, 1]], ["tile_rx", "sp", [-1, 3]], ["auto_unroll_max_step", "ot", 512], ["unroll_explicit", "ot", 0]]}], "r": [[0.003586285, 0.0034405885], 0, 1.6029596328735352, 1578540421.004495], "v": 0.1}
{"i": ["cuda", "schedule_direct_3d_cuda", [[1, 192, 16, 16, 16], [192, 192, 3, 3, 3], [1, 1, 1], [1, 1, 1], 1], {}, ["schedule_direct_3d_cuda", [1, 192, 16, 16, 16], [192, 192, 3, 3, 3], [1, 1, 1], [1, 1, 1], 1], {"i": 847261097, "t": "", "c": null, "e": [["tile_f", "sp", [-1, 3, 16, 2]], ["tile_d", "sp", [-1, 1, 1, 1]], ["tile_y", "sp", [-1, 2, 1, 2]], ["tile_x", "sp", [-1, 1, 2, 4]], ["tile_rc", "sp", [-1, 3]], ["tile_rd", "sp", [-1, 1]], ["tile_ry", "sp", [-1, 1]], ["tile_rx", "sp", [-1, 3]], ["auto_unroll_max_step", "ot", 0], ["unroll_explicit", "ot", 0]]}], "r": [[0.00221620825, 0.00221188525], 0, 1.1431756019592285, 1578540421.6229784], "v": 0.1}
{"i": ["cuda", "schedule_direct_3d_cuda", [[1, 192, 16, 16, 16], [192, 192, 3, 3, 3], [1, 1, 1], [1, 1, 1], 1], {}, ["schedule_direct_3d_cuda", [1, 192, 16, 16, 16], [192, 192, 3, 3, 3], [1, 1, 1], [1, 1, 1], 1], {"i": 8698566380, "t": "", "c": null, "e": [["tile_f", "sp", [-1, 2, 24, 2]], ["tile_d", "sp", [-1, 1, 1, 1]], ["tile_y", "sp", [-1, 1, 2, 2]], ["tile_x", "sp", [-1, 1, 2, 4]], ["tile_rc", "sp", [-1, 2]], ["tile_rd", "sp", [-1, 3]], ["tile_ry", "sp", [-1, 3]], ["tile_rx", "sp", [-1, 1]], ["auto_unroll_max_step", "ot", 1500], ["unroll_explicit", "ot", 1]]}], "r": [[0.00216709125, 0.00215274125], 0, 1.60099458694458, 1578540422.3318954], "v": 0.1}
{"i": ["cuda", "schedule_direct_3d_cuda", [[1, 192, 16, 16, 16], [192, 192, 3, 3, 3], [1, 1, 1], [1, 1, 1], 1], {}, ["schedule_direct_3d_cuda", [1, 192, 16, 16, 16], [192, 192, 3, 3, 3], [1, 1, 1], [1, 1, 1], 1], {"i": 2442854536, "t": "", "c": null, "e": [["tile_f", "sp", [-1, 2, 16, 2]], ["tile_d", "sp", [-1, 1, 1, 4]], ["tile_y", "sp", [-1, 1, 1, 1]], ["tile_x", "sp", [-1, 2, 2, 2]], ["tile_rc", "sp", [-1, 2]], ["tile_rd", "sp", [-1, 1]], ["tile_ry", "sp", [-1, 1]], ["tile_rx", "sp", [-1, 3]], ["auto_unroll_max_step", "ot", 512], ["unroll_explicit", "ot", 0]]}], "r": [[0.00409101525, 0.00408544275], 0, 1.1740589141845703, 1578540425.101593], "v": 0.1}
{"i": ["cuda", "schedule_direct_3d_cuda", [[1, 192, 16, 16, 16], [192, 192, 3, 3, 3], [1, 1, 1], [1, 1, 1], 1], {}, ["schedule_direct_3d_cuda", [1, 192, 16, 16, 16], [192, 192, 3, 3, 3], [1, 1, 1], [1, 1, 1], 1], {"i": 2475127673, "t": "", "c": null, "e": [["tile_f", "sp", [-1, 3, 16, 2]], ["tile_d", "sp", [-1, 2, 1, 1]], ["tile_y", "sp", [-1, 1, 1, 2]], ["tile_x", "sp", [-1, 1, 2, 4]], ["tile_rc", "sp", [-1, 4]], ["tile_rd", "sp", [-1, 1]], ["tile_ry", "sp", [-1, 1]], ["tile_rx", "sp", [-1, 3]], ["auto_unroll_max_step", "ot", 512], ["unroll_explicit", "ot", 0]]}], "r": [[0.00197311875, 0.0019603285], 0, 1.1882588863372803, 1578540425.710164], "v": 0.1}
{"i": ["cuda", "schedule_direct_3d_cuda", [[1, 192, 16, 16, 16], [192, 192, 3, 3, 3], [1, 1, 1], [1, 1, 1], 1], {}, ["schedule_direct_3d_cuda", [1, 192, 16, 16, 16], [192, 192, 3, 3, 3], [1, 1, 1], [1, 1, 1], 1], {"i": 2489365344, "t": "", "c": null, "e": [["tile_f", "sp", [-1, 1, 48, 2]], ["tile_d", "sp", [-1, 1, 1, 4]], ["tile_y", "sp", [-1, 1, 1, 1]], ["tile_x", "sp", [-1, 1, 2, 4]], ["tile_rc", "sp", [-1, 6]], ["tile_rd", "sp", [-1, 1]], ["tile_ry", "sp", [-1, 1]], ["tile_rx", "sp", [-1, 3]], ["auto_unroll_max_step", "ot", 512], ["unroll_explicit", "ot", 0]]}], "r": [[0.00286061075, 0.00285739275], 0, 1.0376920700073242, 1578540426.288698], "v": 0.1}
{"i": ["cuda", "schedule_direct_3d_cuda", [[1, 192, 16, 16, 16], [192, 192, 3, 3, 3], [1, 1, 1], [1, 1, 1], 1], {}, ["schedule_direct_3d_cuda", [1, 192, 16, 16, 16], [192, 192, 3, 3, 3], [1, 1, 1], [1, 1, 1], 1], {"i": 2630006537, "t": "", "c": null, "e": [["tile_f", "sp", [-1, 3, 16, 2]], ["tile_d", "sp", [-1, 1, 1, 1]], ["tile_y", "sp", [-1, 1, 1, 4]], ["tile_x", "sp", [-1, 1, 2, 2]], ["tile_rc", "sp", [-1, 1]], ["tile_rd", "sp", [-1, 3]], ["tile_ry", "sp", [-1, 1]], ["tile_rx", "sp", [-1, 3]], ["auto_unroll_max_step", "ot", 512], ["unroll_explicit", "ot", 0]]}], "r": [[0.004970832, 0.00497131575], 0, 1.320246934890747, 1578540426.9926555], "v": 0.1}
{"i": ["cuda", "schedule_direct_3d_cuda", [[1, 192, 16, 16, 16], [192, 192, 3, 3, 3], [1, 1, 1], [1, 1, 1], 1], {}, ["schedule_direct_3d_cuda", [1, 192, 16, 16, 16], [192, 192, 3, 3, 3], [1, 1, 1], [1, 1, 1], 1], {"i": 2457433710, "t": "", "c": null, "e": [["tile_f", "sp", [-1, 1, 24, 8]], ["tile_d", "sp", [-1, 1, 1, 2]], ["tile_y", "sp", [-1, 1, 1, 2]], ["tile_x", "sp", [-1, 2, 2, 2]], ["tile_rc", "sp", [-1, 3]], ["tile_rd", "sp", [-1, 1]], ["tile_ry", "sp", [-1, 1]], ["tile_rx", "sp", [-1, 3]], ["auto_unroll_max_step", "ot", 512], ["unroll_explicit", "ot", 0]]}], "r": [[0.00399847575, 0.00394823625], 0, 1.2841176986694336, 1578540427.6680996], "v": 0.1}
{"i": ["cuda", "schedule_direct_3d_cuda", [[1, 192, 16, 16, 16], [192, 192, 3, 3, 3], [1, 1, 1], [1, 1, 1], 1], {}, ["schedule_direct_3d_cuda", [1, 192, 16, 16, 16], [192, 192, 3, 3, 3], [1, 1, 1], [1, 1, 1], 1], {"i": 2485946572, "t": "", "c": null, "e": [["tile_f", "sp", [-1, 1, 32, 3]], ["tile_d", "sp", [-1, 1, 1, 1]], ["tile_y", "sp", [-1, 1, 1, 4]], ["tile_x", "sp", [-1, 1, 2, 2]], ["tile_rc", "sp", [-1, 6]], ["tile_rd", "sp", [-1, 1]], ["tile_ry", "sp", [-1, 1]], ["tile_rx", "sp", [-1, 3]], ["auto_unroll_max_step", "ot", 512], ["unroll_explicit", "ot", 0]]}], "r": [[0.0035404615, 0.003538594], 0, 1.3960988521575928, 1578540428.5032973], "v": 0.1}
{"i": ["cuda", "schedule_direct_3d_cuda", [[1, 192, 16, 16, 16], [192, 192, 3, 3, 3], [1, 1, 1], [1, 1, 1], 1], {}, ["schedule_direct_3d_cuda", [1, 192, 16, 16, 16], [192, 192, 3, 3, 3], [1, 1, 1], [1, 1, 1], 1], {"i": 8712925279, "t": "", "c": null, "e": [["tile_f", "sp", [-1, 1, 64, 1]], ["tile_d", "sp", [-1, 1, 1, 1]], ["tile_y", "sp", [-1, 1, 1, 2]], ["tile_x", "sp", [-1, 1, 2, 4]], ["tile_rc", "sp", [-1, 3]], ["tile_rd", "sp", [-1, 3]], ["tile_ry", "sp", [-1, 3]], ["tile_rx", "sp", [-1, 1]], ["auto_unroll_max_step", "ot", 1500], ["unroll_explicit", "ot", 1]]}], "r": [[0.00326139675, 0.003285917], 0, 1.753474473953247, 1578540429.184556], "v": 0.1}
{"i": ["cuda", "schedule_direct_3d_cuda", [[1, 192, 16, 16, 16], [192, 192, 3, 3, 3], [1, 1, 1], [1, 1, 1], 1], {}, ["schedule_direct_3d_cuda", [1, 192, 16, 16, 16], [192, 192, 3, 3, 3], [1, 1, 1], [1, 1, 1], 1], {"i": 8929027033, "t": "", "c": null, "e": [["tile_f", "sp", [-1, 2, 32, 1]], ["tile_d", "sp", [-1, 1, 1, 1]], ["tile_y", "sp", [-1, 2, 1, 2]], ["tile_x", "sp", [-1, 1, 2, 4]], ["tile_rc", "sp", [-1, 4]], ["tile_rd", "sp", [-1, 1]], ["tile_ry", "sp", [-1, 1]], ["tile_rx", "sp", [-1, 3]], ["auto_unroll_max_step", "ot", 1500], ["unroll_explicit", "ot", 1]]}], "r": [[0.00255193375, 0.002567854], 0, 2.411432981491089, 1578540430.0580063], "v": 0.1}
