auto_log/((1, 192, 16, 16, 16), (192, 192, 3, 3, 3), (1, 192, 16, 16, 16), (1, 1, 1), (1, 1, 1), 1, 1, None)_bwd_inp_grad.log
{"i": ["cuda", "schedule_conv3d_transpose_nchw_cuda", [[1, 192, 16, 16, 16], [192, 192, 3, 3, 3], [1, 1, 1], [1, 1, 1], [0, 0, 0], "float32"], {}, ["schedule_conv3d_transpose_nchw_cuda", [1, 192, 16, 16, 16], [192, 192, 3, 3, 3], [1, 1, 1], [1, 1, 1], [0, 0, 0], "float32"], {"i": 3783450964, "t": "", "c": null, "e": [["tile_f", "sp", [-1, 4, 1, 8]], ["tile_d", "sp", [-1, 1, 1, 1]], ["tile_y", "sp", [-1, 4, 1, 1]], ["tile_x", "sp", [-1, 1, 4, 2]], ["tile_rc", "sp", [-1, 48]], ["tile_rd", "sp", [-1, 1]], ["tile_ry", "sp", [-1, 3]], ["tile_rx", "sp", [-1, 1]], ["auto_unroll_max_step", "ot", 1500], ["unroll_explicit", "ot", 0]]}], "r": [[0.05484619275, 0.049072628], 0, 7.998080253601074, 1578543093.813958], "v": 0.1}
{"i": ["cuda", "schedule_conv3d_transpose_nchw_cuda", [[1, 192, 16, 16, 16], [192, 192, 3, 3, 3], [1, 1, 1], [1, 1, 1], [0, 0, 0], "float32"], {}, ["schedule_conv3d_transpose_nchw_cuda", [1, 192, 16, 16, 16], [192, 192, 3, 3, 3], [1, 1, 1], [1, 1, 1], [0, 0, 0], "float32"], {"i": 6294207906, "t": "", "c": null, "e": [["tile_f", "sp", [-1, 3, 8, 4]], ["tile_d", "sp", [-1, 2, 1, 4]], ["tile_y", "sp", [-1, 2, 1, 1]], ["tile_x", "sp", [-1, 2, 1, 8]], ["tile_rc", "sp", [-1, 3]], ["tile_rd", "sp", [-1, 3]], ["tile_ry", "sp", [-1, 3]], ["tile_rx", "sp", [-1, 3]], ["auto_unroll_max_step", "ot", 0], ["unroll_explicit", "ot", 1]]}], "r": [[0.22068193775, 0.2206383735], 0, 3.8581745624542236, 1578543104.8357863], "v": 0.1}
{"i": ["cuda", "schedule_conv3d_transpose_nchw_cuda", [[1, 192, 16, 16, 16], [192, 192, 3, 3, 3], [1, 1, 1], [1, 1, 1], [0, 0, 0], "float32"], {}, ["schedule_conv3d_transpose_nchw_cuda", [1, 192, 16, 16, 16], [192, 192, 3, 3, 3], [1, 1, 1], [1, 1, 1], [0, 0, 0], "float32"], {"i": 43473556, "t": "", "c": null, "e": [["tile_f", "sp", [-1, 8, 3, 4]], ["tile_d", "sp", [-1, 1, 1, 4]], ["tile_y", "sp", [-1, 4, 2, 2]], ["tile_x", "sp", [-1, 1, 1, 1]], ["tile_rc", "sp", [-1, 4]], ["tile_rd", "sp", [-1, 1]], ["tile_ry", "sp", [-1, 1]], ["tile_rx", "sp", [-1, 1]], ["auto_unroll_max_step", "ot", 0], ["unroll_explicit", "ot", 0]]}], "r": [[0.3609100695, 0.360433419], 0, 4.96871280670166, 1578543121.7435281], "v": 0.1}
{"i": ["cuda", "schedule_conv3d_transpose_nchw_cuda", [[1, 192, 16, 16, 16], [192, 192, 3, 3, 3], [1, 1, 1], [1, 1, 1], [0, 0, 0], "float32"], {}, ["schedule_conv3d_transpose_nchw_cuda", [1, 192, 16, 16, 16], [192, 192, 3, 3, 3], [1, 1, 1], [1, 1, 1], [0, 0, 0], "float32"], {"i": 3672107291, "t": "", "c": null, "e": [["tile_f", "sp", [-1, 3, 2, 8]], ["tile_d", "sp", [-1, 1, 1, 1]], ["tile_y", "sp", [-1, 1, 2, 2]], ["tile_x", "sp", [-1, 1, 1, 8]], ["tile_rc", "sp", [-1, 3]], ["tile_rd", "sp", [-1, 1]], ["tile_ry", "sp", [-1, 3]], ["tile_rx", "sp", [-1, 1]], ["auto_unroll_max_step", "ot", 1500], ["unroll_explicit", "ot", 0]]}], "r": [[0.092342761, 0.0888549695], 0, 3.2034153938293457, 1578543152.8270817], "v": 0.1}
{"i": ["cuda", "schedule_conv3d_transpose_nchw_cuda", [[1, 192, 16, 16, 16], [192, 192, 3, 3, 3], [1, 1, 1], [1, 1, 1], [0, 0, 0], "float32"], {}, ["schedule_conv3d_transpose_nchw_cuda", [1, 192, 16, 16, 16], [192, 192, 3, 3, 3], [1, 1, 1], [1, 1, 1], [0, 0, 0], "float32"], {"i": 6464147766, "t": "", "c": null, "e": [["tile_f", "sp", [-1, 12, 1, 1]], ["tile_d", "sp", [-1, 1, 1, 2]], ["tile_y", "sp", [-1, 2, 1, 8]], ["tile_x", "sp", [-1, 1, 8, 2]], ["tile_rc", "sp", [-1, 1]], ["tile_rd", "sp", [-1, 1]], ["tile_ry", "sp", [-1, 1]], ["tile_rx", "sp", [-1, 1]], ["auto_unroll_max_step", "ot", 512], ["unroll_explicit", "ot", 1]]}], "r": [[0.352290063, 0.3518114345], 0, 7.168545722961426, 1578543162.4546645], "v": 0.1}
{"i": ["cuda", "schedule_conv3d_transpose_nchw_cuda", [[1, 192, 16, 16, 16], [192, 192, 3, 3, 3], [1, 1, 1], [1, 1, 1], [0, 0, 0], "float32"], {}, ["schedule_conv3d_transpose_nchw_cuda", [1, 192, 16, 16, 16], [192, 192, 3, 3, 3], [1, 1, 1], [1, 1, 1], [0, 0, 0], "float32"], {"i": 14641520, "t": "", "c": null, "e": [["tile_f", "sp", [-1, 1, 3, 32]], ["tile_d", "sp", [-1, 1, 1, 1]], ["tile_y", "sp", [-1, 2, 2, 2]], ["tile_x", "sp", [-1, 1, 1, 1]], ["tile_rc", "sp", [-1, 2]], ["tile_rd", "sp", [-1, 1]], ["tile_ry", "sp", [-1, 1]], ["tile_rx", "sp", [-1, 1]], ["auto_unroll_max_step", "ot", 0], ["unroll_explicit", "ot", 0]]}], "r": [[0.03347497625, 0.0315921525], 0, 1.4774978160858154, 1578543246.8556502], "v": 0.1}
{"i": ["cuda", "schedule_conv3d_transpose_nchw_cuda", [[1, 192, 16, 16, 16], [192, 192, 3, 3, 3], [1, 1, 1], [1, 1, 1], [0, 0, 0], "float32"], {}, ["schedule_conv3d_transpose_nchw_cuda", [1, 192, 16, 16, 16], [192, 192, 3, 3, 3], [1, 1, 1], [1, 1, 1], [0, 0, 0], "float32"], {"i": 852024416, "t": "", "c": null, "e": [["tile_f", "sp", [-1, 1, 3, 32]], ["tile_d", "sp", [-1, 2, 1, 1]], ["tile_y", "sp", [-1, 2, 1, 1]], ["tile_x", "sp", [-1, 1, 2, 1]], ["tile_rc", "sp", [-1, 4]], ["tile_rd", "sp", [-1, 1]], ["tile_ry", "sp", [-1, 1]], ["tile_rx", "sp", [-1, 3]], ["auto_unroll_max_step", "ot", 0], ["unroll_explicit", "ot", 0]]}], "r": [[0.042124064, 0.0411664195], 0, 1.53617262840271, 1578543247.8584497], "v": 0.1}
{"i": ["cuda", "schedule_conv3d_transpose_nchw_cuda", [[1, 192, 16, 16, 16], [192, 192, 3, 3, 3], [1, 1, 1], [1, 1, 1], [0, 0, 0], "float32"], {}, ["schedule_conv3d_transpose_nchw_cuda", [1, 192, 16, 16, 16], [192, 192, 3, 3, 3], [1, 1, 1], [1, 1, 1], [0, 0, 0], "float32"], {"i": 216325520, "t": "", "c": null, "e": [["tile_f", "sp", [-1, 1, 3, 32]], ["tile_d", "sp", [-1, 1, 1, 1]], ["tile_y", "sp", [-1, 2, 2, 2]], ["tile_x", "sp", [-1, 1, 1, 1]], ["tile_rc", "sp", [-1, 2]], ["tile_rd", "sp", [-1, 3]], ["tile_ry", "sp", [-1, 1]], ["tile_rx", "sp", [-1, 1]], ["auto_unroll_max_step", "ot", 0], ["unroll_explicit", "ot", 0]]}], "r": [[0.034111333, 0.034193374], 0, 1.5624065399169922, 1578543248.815296], "v": 0.1}
{"i": ["cuda", "schedule_conv3d_transpose_nchw_cuda", [[1, 192, 16, 16, 16], [192, 192, 3, 3, 3], [1, 1, 1], [1, 1, 1], [0, 0, 0], "float32"], {}, ["schedule_conv3d_transpose_nchw_cuda", [1, 192, 16, 16, 16], [192, 192, 3, 3, 3], [1, 1, 1], [1, 1, 1], [0, 0, 0], "float32"], {"i": 1255392416, "t": "", "c": null, "e": [["tile_f", "sp", [-1, 1, 3, 32]], ["tile_d", "sp", [-1, 2, 1, 1]], ["tile_y", "sp", [-1, 2, 1, 1]], ["tile_x", "sp", [-1, 1, 2, 1]], ["tile_rc", "sp", [-1, 4]], ["tile_rd", "sp", [-1, 1]], ["tile_ry", "sp", [-1, 3]], ["tile_rx", "sp", [-1, 3]], ["auto_unroll_max_step", "ot", 0], ["unroll_explicit", "ot", 0]]}], "r": [[0.04146998325, 0.04154930125], 0, 1.6874542236328125, 1578543254.8373606], "v": 0.1}
{"i": ["cuda", "schedule_conv3d_transpose_nchw_cuda", [[1, 192, 16, 16, 16], [192, 192, 3, 3, 3], [1, 1, 1], [1, 1, 1], [0, 0, 0], "float32"], {}, ["schedule_conv3d_transpose_nchw_cuda", [1, 192, 16, 16, 16], [192, 192, 3, 3, 3], [1, 1, 1], [1, 1, 1], [0, 0, 0], "float32"], {"i": 607533648, "t": "", "c": null, "e": [["tile_f", "sp", [-1, 3, 1, 16]], ["tile_d", "sp", [-1, 1, 1, 1]], ["tile_y", "sp", [-1, 2, 1, 1]], ["tile_x", "sp", [-1, 2, 2, 1]], ["tile_rc", "sp", [-1, 1]], ["tile_rd", "sp", [-1, 3]], ["tile_ry", "sp", [-1, 3]], ["tile_rx", "sp", [-1, 1]], ["auto_unroll_max_step", "ot", 0], ["unroll_explicit", "ot", 0]]}], "r": [[0.36040946875, 0.36060687075], 0, 4.784221887588501, 1578543258.986648], "v": 0.1}
{"i": ["cuda", "schedule_conv3d_transpose_nchw_cuda", [[1, 192, 16, 16, 16], [192, 192, 3, 3, 3], [1, 1, 1], [1, 1, 1], [0, 0, 0], "float32"], {}, ["schedule_conv3d_transpose_nchw_cuda", [1, 192, 16, 16, 16], [192, 192, 3, 3, 3], [1, 1, 1], [1, 1, 1], [0, 0, 0], "float32"], {"i": 1700331968, "t": "", "c": null, "e": [["tile_f", "sp", [-1, 2, 1, 12]], ["tile_d", "sp", [-1, 2, 1, 1]], ["tile_y", "sp", [-1, 2, 1, 1]], ["tile_x", "sp", [-1, 2, 1, 1]], ["tile_rc", "sp", [-1, 12]], ["tile_rd", "sp", [-1, 1]], ["tile_ry", "sp", [-1, 1]], ["tile_rx", "sp", [-1, 1]], ["auto_unroll_max_step", "ot", 512], ["unroll_explicit", "ot", 0]]}], "r": [[0.2078984255, 0.20805686825], 0, 4.264107942581177, 1578543267.361293], "v": 0.1}
{"i": ["cuda", "schedule_conv3d_transpose_nchw_cuda", [[1, 192, 16, 16, 16], [192, 192, 3, 3, 3], [1, 1, 1], [1, 1, 1], [0, 0, 0], "float32"], {}, ["schedule_conv3d_transpose_nchw_cuda", [1, 192, 16, 16, 16], [192, 192, 3, 3, 3], [1, 1, 1], [1, 1, 1], [0, 0, 0], "float32"], {"i": 1642813514, "t": "", "c": null, "e": [["tile_f", "sp", [-1, 1, 1, 32]], ["tile_d", "sp", [-1, 1, 1, 1]], ["tile_y", "sp", [-1, 2, 4, 1]], ["tile_x", "sp", [-1, 2, 1, 1]], ["tile_rc", "sp", [-1, 3]], ["tile_rd", "sp", [-1, 1]], ["tile_ry", "sp", [-1, 1]], ["tile_rx", "sp", [-1, 1]], ["auto_unroll_max_step", "ot", 512], ["unroll_explicit", "ot", 0]]}], "r": [[0.01845325875, 0.01845260975], 0, 1.54837965965271, 1578543273.7029994], "v": 0.1}
{"i": ["cuda", "schedule_conv3d_transpose_nchw_cuda", [[1, 192, 16, 16, 16], [192, 192, 3, 3, 3], [1, 1, 1], [1, 1, 1], [0, 0, 0], "float32"], {}, ["schedule_conv3d_transpose_nchw_cuda", [1, 192, 16, 16, 16], [192, 192, 3, 3, 3], [1, 1, 1], [1, 1, 1], [0, 0, 0], "float32"], {"i": 4852423187, "t": "", "c": null, "e": [["tile_f", "sp", [-1, 2, 2, 6]], ["tile_d", "sp", [-1, 1, 1, 1]], ["tile_y", "sp", [-1, 2, 2, 1]], ["tile_x", "sp", [-1, 2, 2, 4]], ["tile_rc", "sp", [-1, 1]], ["tile_rd", "sp", [-1, 1]], ["tile_ry", "sp", [-1, 1]], ["tile_rx", "sp", [-1, 1]], ["auto_unroll_max_step", "ot", 0], ["unroll_explicit", "ot", 1]]}], "r": [[0.0179474335, 0.017856948], 0, 1.550886869430542, 1578543274.6188624], "v": 0.1}
{"i": ["cuda", "schedule_conv3d_transpose_nchw_cuda", [[1, 192, 16, 16, 16], [192, 192, 3, 3, 3], [1, 1, 1], [1, 1, 1], [0, 0, 0], "float32"], {}, ["schedule_conv3d_transpose_nchw_cuda", [1, 192, 16, 16, 16], [192, 192, 3, 3, 3], [1, 1, 1], [1, 1, 1], [0, 0, 0], "float32"], {"i": 619693520, "t": "", "c": null, "e": [["tile_f", "sp", [-1, 1, 3, 32]], ["tile_d", "sp", [-1, 1, 1, 1]], ["tile_y", "sp", [-1, 2, 2, 2]], ["tile_x", "sp", [-1, 1, 1, 1]], ["tile_rc", "sp", [-1, 2]], ["tile_rd", "sp", [-1, 3]], ["tile_ry", "sp", [-1, 3]], ["tile_rx", "sp", [-1, 1]], ["auto_unroll_max_step", "ot", 0], ["unroll_explicit", "ot", 0]]}], "r": [[0.02774902475, 0.0276656995], 0, 1.5085537433624268, 1578543282.8698533], "v": 0.1}
{"i": ["cuda", "schedule_conv3d_transpose_nchw_cuda", [[1, 192, 16, 16, 16], [192, 192, 3, 3, 3], [1, 1, 1], [1, 1, 1], [0, 0, 0], "float32"], {}, ["schedule_conv3d_transpose_nchw_cuda", [1, 192, 16, 16, 16], [192, 192, 3, 3, 3], [1, 1, 1], [1, 1, 1], [0, 0, 0], "float32"], {"i": 2856516084, "t": "", "c": null, "e": [["tile_f", "sp", [-1, 2, 1, 48]], ["tile_d", "sp", [-1, 1, 1, 1]], ["tile_y", "sp", [-1, 2, 1, 1]], ["tile_x", "sp", [-1, 2, 4, 1]], ["tile_rc", "sp", [-1, 3]], ["tile_rd", "sp", [-1, 1]], ["tile_ry", "sp", [-1, 3]], ["tile_rx", "sp", [-1, 3]], ["auto_unroll_max_step", "ot", 512], ["unroll_explicit", "ot", 0]]}], "r": [[0.21762200425, 0.21784373575], 0, 4.786245107650757, 1578543286.383744], "v": 0.1}
{"i": ["cuda", "schedule_conv3d_transpose_nchw_cuda", [[1, 192, 16, 16, 16], [192, 192, 3, 3, 3], [1, 1, 1], [1, 1, 1], [0, 0, 0], "float32"], {}, ["schedule_conv3d_transpose_nchw_cuda", [1, 192, 16, 16, 16], [192, 192, 3, 3, 3], [1, 1, 1], [1, 1, 1], [0, 0, 0], "float32"], {"i": 5250851987, "t": "", "c": null, "e": [["tile_f", "sp", [-1, 2, 2, 6]], ["tile_d", "sp", [-1, 1, 1, 1]], ["tile_y", "sp", [-1, 2, 2, 1]], ["tile_x", "sp", [-1, 4, 1, 2]], ["tile_rc", "sp", [-1, 1]], ["tile_rd", "sp", [-1, 1]], ["tile_ry", "sp", [-1, 3]], ["tile_rx", "sp", [-1, 1]], ["auto_unroll_max_step", "ot", 0], ["unroll_explicit", "ot", 1]]}], "r": [[0.021892811, 0.02181388], 0, 1.54046630859375, 1578543298.0178812], "v": 0.1}
{"i": ["cuda", "schedule_conv3d_transpose_nchw_cuda", [[1, 192, 16, 16, 16], [192, 192, 3, 3, 3], [1, 1, 1], [1, 1, 1], [0, 0, 0], "float32"], {}, ["schedule_conv3d_transpose_nchw_cuda", [1, 192, 16, 16, 16], [192, 192, 3, 3, 3], [1, 1, 1], [1, 1, 1], [0, 0, 0], "float32"], {"i": 4847483987, "t": "", "c": null, "e": [["tile_f", "sp", [-1, 2, 2, 6]], ["tile_d", "sp", [-1, 1, 1, 1]], ["tile_y", "sp", [-1, 2, 2, 1]], ["tile_x", "sp", [-1, 4, 1, 2]], ["tile_rc", "sp", [-1, 1]], ["tile_rd", "sp", [-1, 1]], ["tile_ry", "sp", [-1, 1]], ["tile_rx", "sp", [-1, 1]], ["auto_unroll_max_step", "ot", 0], ["unroll_explicit", "ot", 1]]}], "r": [[0.033326502, 0.033400115], 0, 1.8113999366760254, 1578543304.52581], "v": 0.1}
{"i": ["cuda", "schedule_conv3d_transpose_nchw_cuda", [[1, 192, 16, 16, 16], [192, 192, 3, 3, 3], [1, 1, 1], [1, 1, 1], [0, 0, 0], "float32"], {}, ["schedule_conv3d_transpose_nchw_cuda", [1, 192, 16, 16, 16], [192, 192, 3, 3, 3], [1, 1, 1], [1, 1, 1], [0, 0, 0], "float32"], {"i": 6254685648, "t": "", "c": null, "e": [["tile_f", "sp", [-1, 3, 1, 16]], ["tile_d", "sp", [-1, 1, 1, 1]], ["tile_y", "sp", [-1, 2, 1, 1]], ["tile_x", "sp", [-1, 2, 2, 1]], ["tile_rc", "sp", [-1, 1]], ["tile_rd", "sp", [-1, 3]], ["tile_ry", "sp", [-1, 3]], ["tile_rx", "sp", [-1, 3]], ["auto_unroll_max_step", "ot", 0], ["unroll_explicit", "ot", 1]]}], "r": [[0.04341557425, 0.04333267975], 0, 1.965749979019165, 1578543321.9808562], "v": 0.1}
{"i": ["cuda", "schedule_conv3d_transpose_nchw_cuda", [[1, 192, 16, 16, 16], [192, 192, 3, 3, 3], [1, 1, 1], [1, 1, 1], [0, 0, 0], "float32"], {}, ["schedule_conv3d_transpose_nchw_cuda", [1, 192, 16, 16, 16], [192, 192, 3, 3, 3], [1, 1, 1], [1, 1, 1], [0, 0, 0], "float32"], {"i": 1645353637, "t": "", "c": null, "e": [["tile_f", "sp", [-1, 2, 2, 12]], ["tile_d", "sp", [-1, 1, 1, 1]], ["tile_y", "sp", [-1, 2, 1, 2]], ["tile_x", "sp", [-1, 4, 2, 1]], ["tile_rc", "sp", [-1, 3]], ["tile_rd", "sp", [-1, 1]], ["tile_ry", "sp", [-1, 1]], ["tile_rx", "sp", [-1, 1]], ["auto_unroll_max_step", "ot", 512], ["unroll_explicit", "ot", 0]]}], "r": [[0.34094396225, 0.34133082775], 0, 5.141895532608032, 1578543334.3332298], "v": 0.1}
{"i": ["cuda", "schedule_conv3d_transpose_nchw_cuda", [[1, 192, 16, 16, 16], [192, 192, 3, 3, 3], [1, 1, 1], [1, 1, 1], [0, 0, 0], "float32"], {}, ["schedule_conv3d_transpose_nchw_cuda", [1, 192, 16, 16, 16], [192, 192, 3, 3, 3], [1, 1, 1], [1, 1, 1], [0, 0, 0], "float32"], {"i": 3429051648, "t": "", "c": null, "e": [["tile_f", "sp", [-1, 3, 1, 16]], ["tile_d", "sp", [-1, 1, 1, 1]], ["tile_y", "sp", [-1, 2, 1, 1]], ["tile_x", "sp", [-1, 2, 1, 1]], ["tile_rc", "sp", [-1, 1]], ["tile_rd", "sp", [-1, 3]], ["tile_ry", "sp", [-1, 1]], ["tile_rx", "sp", [-1, 1]], ["auto_unroll_max_step", "ot", 1500], ["unroll_explicit", "ot", 0]]}], "r": [[0.08771982325, 0.08771459675], 0, 2.471229314804077, 1578543335.89012], "v": 0.1}
{"i": ["cuda", "schedule_conv3d_transpose_nchw_cuda", [[1, 192, 16, 16, 16], [192, 192, 3, 3, 3], [1, 1, 1], [1, 1, 1], [0, 0, 0], "float32"], {}, ["schedule_conv3d_transpose_nchw_cuda", [1, 192, 16, 16, 16], [192, 192, 3, 3, 3], [1, 1, 1], [1, 1, 1], [0, 0, 0], "float32"], {"i": 3294870376, "t": "", "c": null, "e": [["tile_f", "sp", [-1, 1, 4, 12]], ["tile_d", "sp", [-1, 2, 1, 1]], ["tile_y", "sp", [-1, 2, 1, 1]], ["tile_x", "sp", [-1, 1, 1, 4]], ["tile_rc", "sp", [-1, 6]], ["tile_rd", "sp", [-1, 1]], ["tile_ry", "sp", [-1, 1]], ["tile_rx", "sp", [-1, 1]], ["auto_unroll_max_step", "ot", 1500], ["unroll_explicit", "ot", 0]]}], "r": [[0.06229374, 0.0623505005], 0, 2.5478055477142334, 1578543353.8236282], "v": 0.1}
{"i": ["cuda", "schedule_conv3d_transpose_nchw_cuda", [[1, 192, 16, 16, 16], [192, 192, 3, 3, 3], [1, 1, 1], [1, 1, 1], [0, 0, 0], "float32"], {}, ["schedule_conv3d_transpose_nchw_cuda", [1, 192, 16, 16, 16], [192, 192, 3, 3, 3], [1, 1, 1], [1, 1, 1], [0, 0, 0], "float32"], {"i": 4885704416, "t": "", "c": null, "e": [["tile_f", "sp", [-1, 1, 3, 32]], ["tile_d", "sp", [-1, 2, 1, 1]], ["tile_y", "sp", [-1, 2, 1, 1]], ["tile_x", "sp", [-1, 1, 2, 1]], ["tile_rc", "sp", [-1, 4]], ["tile_rd", "sp", [-1, 1]], ["tile_ry", "sp", [-1, 1]], ["tile_rx", "sp", [-1, 1]], ["auto_unroll_max_step", "ot", 0], ["unroll_explicit", "ot", 1]]}], "r": [[0.033933066, 0.033915082], 0, 1.5733833312988281, 1578543354.7645984], "v": 0.1}
{"i": ["cuda", "schedule_conv3d_transpose_nchw_cuda", [[1, 192, 16, 16, 16], [192, 192, 3, 3, 3], [1, 1, 1], [1, 1, 1], [0, 0, 0], "float32"], {}, ["schedule_conv3d_transpose_nchw_cuda", [1, 192, 16, 16, 16], [192, 192, 3, 3, 3], [1, 1, 1], [1, 1, 1], [0, 0, 0], "float32"], {"i": 5692440416, "t": "", "c": null, "e": [["tile_f", "sp", [-1, 1, 3, 32]], ["tile_d", "sp", [-1, 2, 1, 1]], ["tile_y", "sp", [-1, 2, 1, 1]], ["tile_x", "sp", [-1, 1, 2, 1]], ["tile_rc", "sp", [-1, 4]], ["tile_rd", "sp", [-1, 1]], ["tile_ry", "sp", [-1, 1]], ["tile_rx", "sp", [-1, 3]], ["auto_unroll_max_step", "ot", 0], ["unroll_explicit", "ot", 1]]}], "r": [[0.04202458725, 0.0420286685], 0, 1.4804441928863525, 1578543361.0882025], "v": 0.1}
{"i": ["cuda", "schedule_conv3d_transpose_nchw_cuda", [[1, 192, 16, 16, 16], [192, 192, 3, 3, 3], [1, 1, 1], [1, 1, 1], [0, 0, 0], "float32"], {}, ["schedule_conv3d_transpose_nchw_cuda", [1, 192, 16, 16, 16], [192, 192, 3, 3, 3], [1, 1, 1], [1, 1, 1], [0, 0, 0], "float32"], {"i": 7301149182, "t": "", "c": null, "e": [["tile_f", "sp", [-1, 4, 1, 6]], ["tile_d", "sp", [-1, 1, 1, 1]], ["tile_y", "sp", [-1, 2, 1, 2]], ["tile_x", "sp", [-1, 1, 2, 4]], ["tile_rc", "sp", [-1, 3]], ["tile_rd", "sp", [-1, 1]], ["tile_ry", "sp", [-1, 1]], ["tile_rx", "sp", [-1, 3]], ["auto_unroll_max_step", "ot", 512], ["unroll_explicit", "ot", 1]]}], "r": [[0.22507553025, 0.224481912], 0, 5.167480230331421, 1578543364.1547508], "v": 0.1}
{"i": ["cuda", "schedule_conv3d_transpose_nchw_cuda", [[1, 192, 16, 16, 16], [192, 192, 3, 3, 3], [1, 1, 1], [1, 1, 1], [0, 0, 0], "float32"], {}, ["schedule_conv3d_transpose_nchw_cuda", [1, 192, 16, 16, 16], [192, 192, 3, 3, 3], [1, 1, 1], [1, 1, 1], [0, 0, 0], "float32"], {"i": 6485769637, "t": "", "c": null, "e": [["tile_f", "sp", [-1, 2, 2, 12]], ["tile_d", "sp", [-1, 1, 1, 1]], ["tile_y", "sp", [-1, 2, 1, 2]], ["tile_x", "sp", [-1, 4, 2, 1]], ["tile_rc", "sp", [-1, 3]], ["tile_rd", "sp", [-1, 1]], ["tile_ry", "sp", [-1, 1]], ["tile_rx", "sp", [-1, 1]], ["auto_unroll_max_step", "ot", 512], ["unroll_explicit", "ot", 1]]}], "r": [[0.32272676975, 0.3231058985], 0, 5.723585367202759, 1578543374.018557], "v": 0.1}
{"i": ["cuda", "schedule_conv3d_transpose_nchw_cuda", [[1, 192, 16, 16, 16], [192, 192, 3, 3, 3], [1, 1, 1], [1, 1, 1], [0, 0, 0], "float32"], {}, ["schedule_conv3d_transpose_nchw_cuda", [1, 192, 16, 16, 16], [192, 192, 3, 3, 3], [1, 1, 1], [1, 1, 1], [0, 0, 0], "float32"], {"i": 5447949648, "t": "", "c": null, "e": [["tile_f", "sp", [-1, 3, 1, 16]], ["tile_d", "sp", [-1, 1, 1, 1]], ["tile_y", "sp", [-1, 2, 1, 1]], ["tile_x", "sp", [-1, 2, 2, 1]], ["tile_rc", "sp", [-1, 1]], ["tile_rd", "sp", [-1, 3]], ["tile_ry", "sp", [-1, 3]], ["tile_rx", "sp", [-1, 1]], ["auto_unroll_max_step", "ot", 0], ["unroll_explicit", "ot", 1]]}], "r": [[0.36253459025, 0.36203931025], 0, 4.492904186248779, 1578543377.8332858], "v": 0.1}
{"i": ["cuda", "schedule_conv3d_transpose_nchw_cuda", [[1, 192, 16, 16, 16], [192, 192, 3, 3, 3], [1, 1, 1], [1, 1, 1], [0, 0, 0], "float32"], {}, ["schedule_conv3d_transpose_nchw_cuda", [1, 192, 16, 16, 16], [192, 192, 3, 3, 3], [1, 1, 1], [1, 1, 1], [0, 0, 0], "float32"], {"i": 3443269520, "t": "", "c": null, "e": [["tile_f", "sp", [-1, 1, 3, 32]], ["tile_d", "sp", [-1, 1, 1, 1]], ["tile_y", "sp", [-1, 2, 2, 2]], ["tile_x", "sp", [-1, 1, 1, 1]], ["tile_rc", "sp", [-1, 2]], ["tile_rd", "sp", [-1, 3]], ["tile_ry", "sp", [-1, 1]], ["tile_rx", "sp", [-1, 1]], ["auto_unroll_max_step", "ot", 1500], ["unroll_explicit", "ot", 0]]}], "r": [[0.03143594125, 0.031511513], 0, 2.1393237113952637, 1578543384.4640777], "v": 0.1}
{"i": ["cuda", "schedule_conv3d_transpose_nchw_cuda", [[1, 192, 16, 16, 16], [192, 192, 3, 3, 3], [1, 1, 1], [1, 1, 1], [0, 0, 0], "float32"], {}, ["schedule_conv3d_transpose_nchw_cuda", [1, 192, 16, 16, 16], [192, 192, 3, 3, 3], [1, 1, 1], [1, 1, 1], [0, 0, 0], "float32"], {"i": 8076432272, "t": "", "c": null, "e": [["tile_f", "sp", [-1, 2, 1, 12]], ["tile_d", "sp", [-1, 1, 1, 2]], ["tile_y", "sp", [-1, 2, 1, 1]], ["tile_x", "sp", [-1, 1, 4, 2]], ["tile_rc", "sp", [-1, 1]], ["tile_rd", "sp", [-1, 1]], ["tile_ry", "sp", [-1, 1]], ["tile_rx", "sp", [-1, 1]], ["auto_unroll_max_step", "ot", 1500], ["unroll_explicit", "ot", 1]]}], "r": [[0.03702170225, 0.03719722125], 0, 2.739504337310791, 1578543385.6582143], "v": 0.1}
{"i": ["cuda", "schedule_conv3d_transpose_nchw_cuda", [[1, 192, 16, 16, 16], [192, 192, 3, 3, 3], [1, 1, 1], [1, 1, 1], [0, 0, 0], "float32"], {}, ["schedule_conv3d_transpose_nchw_cuda", [1, 192, 16, 16, 16], [192, 192, 3, 3, 3], [1, 1, 1], [1, 1, 1], [0, 0, 0], "float32"], {"i": 6494236788, "t": "", "c": null, "e": [["tile_f", "sp", [-1, 4, 2, 6]], ["tile_d", "sp", [-1, 1, 1, 1]], ["tile_y", "sp", [-1, 2, 1, 1]], ["tile_x", "sp", [-1, 1, 2, 4]], ["tile_rc", "sp", [-1, 3]], ["tile_rd", "sp", [-1, 1]], ["tile_ry", "sp", [-1, 1]], ["tile_rx", "sp", [-1, 1]], ["auto_unroll_max_step", "ot", 512], ["unroll_explicit", "ot", 1]]}], "r": [[0.065778434, 0.06580889425], 0, 2.6015994548797607, 1578543397.8044503], "v": 0.1}
{"i": ["cuda", "schedule_conv3d_transpose_nchw_cuda", [[1, 192, 16, 16, 16], [192, 192, 3, 3, 3], [1, 1, 1], [1, 1, 1], [0, 0, 0], "float32"], {}, ["schedule_conv3d_transpose_nchw_cuda", [1, 192, 16, 16, 16], [192, 192, 3, 3, 3], [1, 1, 1], [1, 1, 1], [0, 0, 0], "float32"], {"i": 7696932084, "t": "", "c": null, "e": [["tile_f", "sp", [-1, 2, 1, 48]], ["tile_d", "sp", [-1, 1, 1, 1]], ["tile_y", "sp", [-1, 2, 1, 1]], ["tile_x", "sp", [-1, 2, 4, 1]], ["tile_rc", "sp", [-1, 3]], ["tile_rd", "sp", [-1, 1]], ["tile_ry", "sp", [-1, 3]], ["tile_rx", "sp", [-1, 3]], ["auto_unroll_max_step", "ot", 512], ["unroll_explicit", "ot", 1]]}], "r": [[0.2224422515, 0.222786765], 0, 5.589798450469971, 1578543401.383478], "v": 0.1}
{"i": ["cuda", "schedule_conv3d_transpose_nchw_cuda", [[1, 192, 16, 16, 16], [192, 192, 3, 3, 3], [1, 1, 1], [1, 1, 1], [0, 0, 0], "float32"], {}, ["schedule_conv3d_transpose_nchw_cuda", [1, 192, 16, 16, 16], [192, 192, 3, 3, 3], [1, 1, 1], [1, 1, 1], [0, 0, 0], "float32"], {"i": 7292505637, "t": "", "c": null, "e": [["tile_f", "sp", [-1, 2, 2, 12]], ["tile_d", "sp", [-1, 1, 1, 1]], ["tile_y", "sp", [-1, 2, 1, 2]], ["tile_x", "sp", [-1, 4, 2, 1]], ["tile_rc", "sp", [-1, 3]], ["tile_rd", "sp", [-1, 1]], ["tile_ry", "sp", [-1, 1]], ["tile_rx", "sp", [-1, 3]], ["auto_unroll_max_step", "ot", 512], ["unroll_explicit", "ot", 1]]}], "r": [[0.151477916, 0.15164399075], 0, 4.4058518409729, 1578543439.0374095], "v": 0.1}
{"i": ["cuda", "schedule_conv3d_transpose_nchw_cuda", [[1, 192, 16, 16, 16], [192, 192, 3, 3, 3], [1, 1, 1], [1, 1, 1], [0, 0, 0], "float32"], {}, ["schedule_conv3d_transpose_nchw_cuda", [1, 192, 16, 16, 16], [192, 192, 3, 3, 3], [1, 1, 1], [1, 1, 1], [0, 0, 0], "float32"], {"i": 7300972788, "t": "", "c": null, "e": [["tile_f", "sp", [-1, 4, 2, 6]], ["tile_d", "sp", [-1, 1, 1, 1]], ["tile_y", "sp", [-1, 2, 1, 1]], ["tile_x", "sp", [-1, 1, 2, 4]], ["tile_rc", "sp", [-1, 3]], ["tile_rd", "sp", [-1, 1]], ["tile_ry", "sp", [-1, 1]], ["tile_rx", "sp", [-1, 3]], ["auto_unroll_max_step", "ot", 512], ["unroll_explicit", "ot", 1]]}], "r": [[0.03037252975, 0.03037333225], 0, 2.439404010772705, 1578543440.1172485], "v": 0.1}
{"i": ["cuda", "schedule_conv3d_transpose_nchw_cuda", [[1, 192, 16, 16, 16], [192, 192, 3, 3, 3], [1, 1, 1], [1, 1, 1], [0, 0, 0], "float32"], {}, ["schedule_conv3d_transpose_nchw_cuda", [1, 192, 16, 16, 16], [192, 192, 3, 3, 3], [1, 1, 1], [1, 1, 1], [0, 0, 0], "float32"], {"i": 6494241828, "t": "", "c": null, "e": [["tile_f", "sp", [-1, 4, 2, 6]], ["tile_d", "sp", [-1, 1, 1, 2]], ["tile_y", "sp", [-1, 2, 1, 1]], ["tile_x", "sp", [-1, 1, 2, 4]], ["tile_rc", "sp", [-1, 3]], ["tile_rd", "sp", [-1, 1]], ["tile_ry", "sp", [-1, 1]], ["tile_rx", "sp", [-1, 1]], ["auto_unroll_max_step", "ot", 512], ["unroll_explicit", "ot", 1]]}], "r": [[0.30996639575, 0.30844975725], 0, 5.376349449157715, 1578543454.533337], "v": 0.1}
{"i": ["cuda", "schedule_conv3d_transpose_nchw_cuda", [[1, 192, 16, 16, 16], [192, 192, 3, 3, 3], [1, 1, 1], [1, 1, 1], [0, 0, 0], "float32"], {}, ["schedule_conv3d_transpose_nchw_cuda", [1, 192, 16, 16, 16], [192, 192, 3, 3, 3], [1, 1, 1], [1, 1, 1], [0, 0, 0], "float32"], {"i": 6468400166, "t": "", "c": null, "e": [["tile_f", "sp", [-1, 1, 2, 48]], ["tile_d", "sp", [-1, 1, 1, 1]], ["tile_y", "sp", [-1, 1, 4, 1]], ["tile_x", "sp", [-1, 1, 1, 1]], ["tile_rc", "sp", [-1, 2]], ["tile_rd", "sp", [-1, 1]], ["tile_ry", "sp", [-1, 1]], ["tile_rx", "sp", [-1, 1]], ["auto_unroll_max_step", "ot", 512], ["unroll_explicit", "ot", 1]]}], "r": [[0.02068028625, 0.020708969], 0, 2.0593371391296387, 1578543706.5689914], "v": 0.1}
{"i": ["cuda", "schedule_conv3d_transpose_nchw_cuda", [[1, 192, 16, 16, 16], [192, 192, 3, 3, 3], [1, 1, 1], [1, 1, 1], [0, 0, 0], "float32"], {}, ["schedule_conv3d_transpose_nchw_cuda", [1, 192, 16, 16, 16], [192, 192, 3, 3, 3], [1, 1, 1], [1, 1, 1], [0, 0, 0], "float32"], {"i": 1627984166, "t": "", "c": null, "e": [["tile_f", "sp", [-1, 1, 2, 48]], ["tile_d", "sp", [-1, 1, 1, 1]], ["tile_y", "sp", [-1, 1, 4, 1]], ["tile_x", "sp", [-1, 1, 1, 1]], ["tile_rc", "sp", [-1, 2]], ["tile_rd", "sp", [-1, 1]], ["tile_ry", "sp", [-1, 1]], ["tile_rx", "sp", [-1, 1]], ["auto_unroll_max_step", "ot", 512], ["unroll_explicit", "ot", 0]]}], "r": [[0.0183032885, 0.01775916925], 0, 1.7448816299438477, 1578543707.7849936], "v": 0.1}
{"i": ["cuda", "schedule_conv3d_transpose_nchw_cuda", [[1, 192, 16, 16, 16], [192, 192, 3, 3, 3], [1, 1, 1], [1, 1, 1], [0, 0, 0], "float32"], {}, ["schedule_conv3d_transpose_nchw_cuda", [1, 192, 16, 16, 16], [192, 192, 3, 3, 3], [1, 1, 1], [1, 1, 1], [0, 0, 0], "float32"], {"i": 3241456166, "t": "", "c": null, "e": [["tile_f", "sp", [-1, 1, 2, 48]], ["tile_d", "sp", [-1, 1, 1, 1]], ["tile_y", "sp", [-1, 1, 4, 1]], ["tile_x", "sp", [-1, 1, 1, 1]], ["tile_rc", "sp", [-1, 2]], ["tile_rd", "sp", [-1, 1]], ["tile_ry", "sp", [-1, 1]], ["tile_rx", "sp", [-1, 1]], ["auto_unroll_max_step", "ot", 1500], ["unroll_explicit", "ot", 0]]}], "r": [[0.01683191825, 0.0168269445], 0, 2.401102304458618, 1578543709.0590546], "v": 0.1}
{"i": ["cuda", "schedule_conv3d_transpose_nchw_cuda", [[1, 192, 16, 16, 16], [192, 192, 3, 3, 3], [1, 1, 1], [1, 1, 1], [0, 0, 0], "float32"], {}, ["schedule_conv3d_transpose_nchw_cuda", [1, 192, 16, 16, 16], [192, 192, 3, 3, 3], [1, 1, 1], [1, 1, 1], [0, 0, 0], "float32"], {"i": 3634498836, "t": "", "c": null, "e": [["tile_f", "sp", [-1, 1, 2, 12]], ["tile_d", "sp", [-1, 1, 1, 1]], ["tile_y", "sp", [-1, 2, 2, 1]], ["tile_x", "sp", [-1, 2, 4, 1]], ["tile_rc", "sp", [-1, 1]], ["tile_rd", "sp", [-1, 1]], ["tile_ry", "sp", [-1, 3]], ["tile_rx", "sp", [-1, 1]], ["auto_unroll_max_step", "ot", 1500], ["unroll_explicit", "ot", 0]]}], "r": [[0.0041134835, 0.00414050025], 0, 1.6865355968475342, 1578543709.9292192], "v": 0.1}
{"i": ["cuda", "schedule_conv3d_transpose_nchw_cuda", [[1, 192, 16, 16, 16], [192, 192, 3, 3, 3], [1, 1, 1], [1, 1, 1], [0, 0, 0], "float32"], {}, ["schedule_conv3d_transpose_nchw_cuda", [1, 192, 16, 16, 16], [192, 192, 3, 3, 3], [1, 1, 1], [1, 1, 1], [0, 0, 0], "float32"], {"i": 3634075455, "t": "", "c": null, "e": [["tile_f", "sp", [-1, 1, 3, 8]], ["tile_d", "sp", [-1, 1, 1, 1]], ["tile_y", "sp", [-1, 1, 2, 1]], ["tile_x", "sp", [-1, 1, 4, 1]], ["tile_rc", "sp", [-1, 1]], ["tile_rd", "sp", [-1, 1]], ["tile_ry", "sp", [-1, 3]], ["tile_rx", "sp", [-1, 1]], ["auto_unroll_max_step", "ot", 1500], ["unroll_explicit", "ot", 0]]}], "r": [[0.00530931975, 0.0053180445], 0, 1.1353344917297363, 1578543710.5724363], "v": 0.1}
{"i": ["cuda", "schedule_conv3d_transpose_nchw_cuda", [[1, 192, 16, 16, 16], [192, 192, 3, 3, 3], [1, 1, 1], [1, 1, 1], [0, 0, 0], "float32"], {}, ["schedule_conv3d_transpose_nchw_cuda", [1, 192, 16, 16, 16], [192, 192, 3, 3, 3], [1, 1, 1], [1, 1, 1], [0, 0, 0], "float32"], {"i": 2020603455, "t": "", "c": null, "e": [["tile_f", "sp", [-1, 1, 3, 8]], ["tile_d", "sp", [-1, 1, 1, 1]], ["tile_y", "sp", [-1, 1, 2, 1]], ["tile_x", "sp", [-1, 1, 4, 1]], ["tile_rc", "sp", [-1, 1]], ["tile_rd", "sp", [-1, 1]], ["tile_ry", "sp", [-1, 3]], ["tile_rx", "sp", [-1, 1]], ["auto_unroll_max_step", "ot", 512], ["unroll_explicit", "ot", 0]]}], "r": [[0.00531293825, 0.00529098075], 0, 1.0634284019470215, 1578543711.1581597], "v": 0.1}
{"i": ["cuda", "schedule_conv3d_transpose_nchw_cuda", [[1, 192, 16, 16, 16], [192, 192, 3, 3, 3], [1, 1, 1], [1, 1, 1], [0, 0, 0], "float32"], {}, ["schedule_conv3d_transpose_nchw_cuda", [1, 192, 16, 16, 16], [192, 192, 3, 3, 3], [1, 1, 1], [1, 1, 1], [0, 0, 0], "float32"], {"i": 6861019455, "t": "", "c": null, "e": [["tile_f", "sp", [-1, 1, 3, 8]], ["tile_d", "sp", [-1, 1, 1, 1]], ["tile_y", "sp", [-1, 1, 2, 1]], ["tile_x", "sp", [-1, 1, 4, 1]], ["tile_rc", "sp", [-1, 1]], ["tile_rd", "sp", [-1, 1]], ["tile_ry", "sp", [-1, 3]], ["tile_rx", "sp", [-1, 1]], ["auto_unroll_max_step", "ot", 512], ["unroll_explicit", "ot", 1]]}], "r": [[0.005570588, 0.0065739505], 0, 1.2999720573425293, 1578543711.7917857], "v": 0.1}
{"i": ["cuda", "schedule_conv3d_transpose_nchw_cuda", [[1, 192, 16, 16, 16], [192, 192, 3, 3, 3], [1, 1, 1], [1, 1, 1], [0, 0, 0], "float32"], {}, ["schedule_conv3d_transpose_nchw_cuda", [1, 192, 16, 16, 16], [192, 192, 3, 3, 3], [1, 1, 1], [1, 1, 1], [0, 0, 0], "float32"], {"i": 8474491455, "t": "", "c": null, "e": [["tile_f", "sp", [-1, 1, 3, 8]], ["tile_d", "sp", [-1, 1, 1, 1]], ["tile_y", "sp", [-1, 1, 2, 1]], ["tile_x", "sp", [-1, 1, 4, 1]], ["tile_rc", "sp", [-1, 1]], ["tile_rd", "sp", [-1, 1]], ["tile_ry", "sp", [-1, 3]], ["tile_rx", "sp", [-1, 1]], ["auto_unroll_max_step", "ot", 1500], ["unroll_explicit", "ot", 1]]}], "r": [[0.00694000275, 0.0067374735], 0, 1.2955842018127441, 1578543712.3896368], "v": 0.1}
{"i": ["cuda", "schedule_conv3d_transpose_nchw_cuda", [[1, 192, 16, 16, 16], [192, 192, 3, 3, 3], [1, 1, 1], [1, 1, 1], [0, 0, 0], "float32"], {}, ["schedule_conv3d_transpose_nchw_cuda", [1, 192, 16, 16, 16], [192, 192, 3, 3, 3], [1, 1, 1], [1, 1, 1], [0, 0, 0], "float32"], {"i": 4854928166, "t": "", "c": null, "e": [["tile_f", "sp", [-1, 1, 2, 48]], ["tile_d", "sp", [-1, 1, 1, 1]], ["tile_y", "sp", [-1, 1, 4, 1]], ["tile_x", "sp", [-1, 1, 1, 1]], ["tile_rc", "sp", [-1, 2]], ["tile_rd", "sp", [-1, 1]], ["tile_ry", "sp", [-1, 1]], ["tile_rx", "sp", [-1, 1]], ["auto_unroll_max_step", "ot", 0], ["unroll_explicit", "ot", 1]]}], "r": [[0.01947443325, 0.018047852], 0, 1.6258957386016846, 1578543713.5146544], "v": 0.1}
{"i": ["cuda", "schedule_conv3d_transpose_nchw_cuda", [[1, 192, 16, 16, 16], [192, 192, 3, 3, 3], [1, 1, 1], [1, 1, 1], [0, 0, 0], "float32"], {}, ["schedule_conv3d_transpose_nchw_cuda", [1, 192, 16, 16, 16], [192, 192, 3, 3, 3], [1, 1, 1], [1, 1, 1], [0, 0, 0], "float32"], {"i": 8111095546, "t": "", "c": null, "e": [["tile_f", "sp", [-1, 1, 3, 2]], ["tile_d", "sp", [-1, 1, 1, 1]], ["tile_y", "sp", [-1, 1, 4, 1]], ["tile_x", "sp", [-1, 2, 1, 1]], ["tile_rc", "sp", [-1, 4]], ["tile_rd", "sp", [-1, 1]], ["tile_ry", "sp", [-1, 1]], ["tile_rx", "sp", [-1, 1]], ["auto_unroll_max_step", "ot", 1500], ["unroll_explicit", "ot", 1]]}], "r": [[0.02556683675, 0.025303691], 0, 2.4847521781921387, 1578543714.426676], "v": 0.1}
{"i": ["cuda", "schedule_conv3d_transpose_nchw_cuda", [[1, 192, 16, 16, 16], [192, 192, 3, 3, 3], [1, 1, 1], [1, 1, 1], [0, 0, 0], "float32"], {}, ["schedule_conv3d_transpose_nchw_cuda", [1, 192, 16, 16, 16], [192, 192, 3, 3, 3], [1, 1, 1], [1, 1, 1], [0, 0, 0], "float32"], {"i": 3633264036, "t": "", "c": null, "e": [["tile_f", "sp", [-1, 1, 2, 12]], ["tile_d", "sp", [-1, 1, 1, 1]], ["tile_y", "sp", [-1, 2, 2, 1]], ["tile_x", "sp", [-1, 4, 2, 1]], ["tile_rc", "sp", [-1, 1]], ["tile_rd", "sp", [-1, 1]], ["tile_ry", "sp", [-1, 3]], ["tile_rx", "sp", [-1, 1]], ["auto_unroll_max_step", "ot", 1500], ["unroll_explicit", "ot", 0]]}], "r": [[0.01752525725, 0.01747377475], 0, 1.6463665962219238, 1578543715.424659], "v": 0.1}
{"i": ["cuda", "schedule_conv3d_transpose_nchw_cuda", [[1, 192, 16, 16, 16], [192, 192, 3, 3, 3], [1, 1, 1], [1, 1, 1], [0, 0, 0], "float32"], {}, ["schedule_conv3d_transpose_nchw_cuda", [1, 192, 16, 16, 16], [192, 192, 3, 3, 3], [1, 1, 1], [1, 1, 1], [0, 0, 0], "float32"], {"i": 8473680036, "t": "", "c": null, "e": [["tile_f", "sp", [-1, 1, 2, 12]], ["tile_d", "sp", [-1, 1, 1, 1]], ["tile_y", "sp", [-1, 2, 2, 1]], ["tile_x", "sp", [-1, 4, 2, 1]], ["tile_rc", "sp", [-1, 1]], ["tile_rd", "sp", [-1, 1]], ["tile_ry", "sp", [-1, 3]], ["tile_rx", "sp", [-1, 1]], ["auto_unroll_max_step", "ot", 1500], ["unroll_explicit", "ot", 1]]}], "r": [[0.0172495435, 0.01725460925], 0, 2.286306142807007, 1578543716.42125], "v": 0.1}
{"i": ["cuda", "schedule_conv3d_transpose_nchw_cuda", [[1, 192, 16, 16, 16], [192, 192, 3, 3, 3], [1, 1, 1], [1, 1, 1], [0, 0, 0], "float32"], {}, ["schedule_conv3d_transpose_nchw_cuda", [1, 192, 16, 16, 16], [192, 192, 3, 3, 3], [1, 1, 1], [1, 1, 1], [0, 0, 0], "float32"], {"i": 3689994296, "t": "", "c": null, "e": [["tile_f", "sp", [-1, 1, 3, 16]], ["tile_d", "sp", [-1, 1, 1, 1]], ["tile_y", "sp", [-1, 1, 1, 1]], ["tile_x", "sp", [-1, 1, 2, 1]], ["tile_rc", "sp", [-1, 6]], ["tile_rd", "sp", [-1, 1]], ["tile_ry", "sp", [-1, 3]], ["tile_rx", "sp", [-1, 1]], ["auto_unroll_max_step", "ot", 1500], ["unroll_explicit", "ot", 0]]}], "r": [[0.02890081275, 0.029260766], 0, 2.7944676876068115, 1578543719.7151625], "v": 0.1}
{"i": ["cuda", "schedule_conv3d_transpose_nchw_cuda", [[1, 192, 16, 16, 16], [192, 192, 3, 3, 3], [1, 1, 1], [1, 1, 1], [0, 0, 0], "float32"], {}, ["schedule_conv3d_transpose_nchw_cuda", [1, 192, 16, 16, 16], [192, 192, 3, 3, 3], [1, 1, 1], [1, 1, 1], [0, 0, 0], "float32"], {"i": 2090928296, "t": "", "c": null, "e": [["tile_f", "sp", [-1, 1, 3, 16]], ["tile_d", "sp", [-1, 1, 1, 1]], ["tile_y", "sp", [-1, 1, 1, 1]], ["tile_x", "sp", [-1, 1, 2, 1]], ["tile_rc", "sp", [-1, 8]], ["tile_rd", "sp", [-1, 1]], ["tile_ry", "sp", [-1, 3]], ["tile_rx", "sp", [-1, 1]], ["auto_unroll_max_step", "ot", 512], ["unroll_explicit", "ot", 0]]}], "r": [[0.05237579925, 0.0523836895], 0, 2.6980342864990234, 1578543721.20444], "v": 0.1}
{"i": ["cuda", "schedule_conv3d_transpose_nchw_cuda", [[1, 192, 16, 16, 16], [192, 192, 3, 3, 3], [1, 1, 1], [1, 1, 1], [0, 0, 0], "float32"], {}, ["schedule_conv3d_transpose_nchw_cuda", [1, 192, 16, 16, 16], [192, 192, 3, 3, 3], [1, 1, 1], [1, 1, 1], [0, 0, 0], "float32"], {"i": 6872179666, "t": "", "c": null, "e": [["tile_f", "sp", [-1, 1, 2, 6]], ["tile_d", "sp", [-1, 1, 1, 1]], ["tile_y", "sp", [-1, 1, 4, 1]], ["tile_x", "sp", [-1, 2, 1, 1]], ["tile_rc", "sp", [-1, 2]], ["tile_rd", "sp", [-1, 1]], ["tile_ry", "sp", [-1, 3]], ["tile_rx", "sp", [-1, 1]], ["auto_unroll_max_step", "ot", 512], ["unroll_explicit", "ot", 1]]}], "r": [[0.00871057075, 0.00880656725], 0, 1.3917067050933838, 1578543721.906784], "v": 0.1}
{"i": ["cuda", "schedule_conv3d_transpose_nchw_cuda", [[1, 192, 16, 16, 16], [192, 192, 3, 3, 3], [1, 1, 1], [1, 1, 1], [0, 0, 0], "float32"], {}, ["schedule_conv3d_transpose_nchw_cuda", [1, 192, 16, 16, 16], [192, 192, 3, 3, 3], [1, 1, 1], [1, 1, 1], [0, 0, 0], "float32"], {"i": 8485651666, "t": "", "c": null, "e": [["tile_f", "sp", [-1, 1, 2, 6]], ["tile_d", "sp", [-1, 1, 1, 1]], ["tile_y", "sp", [-1, 1, 4, 1]], ["tile_x", "sp", [-1, 2, 1, 1]], ["tile_rc", "sp", [-1, 2]], ["tile_rd", "sp", [-1, 1]], ["tile_ry", "sp", [-1, 3]], ["tile_rx", "sp", [-1, 1]], ["auto_unroll_max_step", "ot", 1500], ["unroll_explicit", "ot", 1]]}], "r": [[0.008144008, 0.00814115775], 0, 1.9226722717285156, 1578543722.6433806], "v": 0.1}
{"i": ["cuda", "schedule_conv3d_transpose_nchw_cuda", [[1, 192, 16, 16, 16], [192, 192, 3, 3, 3], [1, 1, 1], [1, 1, 1], [0, 0, 0], "float32"], {}, ["schedule_conv3d_transpose_nchw_cuda", [1, 192, 16, 16, 16], [192, 192, 3, 3, 3], [1, 1, 1], [1, 1, 1], [0, 0, 0], "float32"], {"i": 2031763666, "t": "", "c": null, "e": [["tile_f", "sp", [-1, 1, 2, 6]], ["tile_d", "sp", [-1, 1, 1, 1]], ["tile_y", "sp", [-1, 1, 4, 1]], ["tile_x", "sp", [-1, 2, 1, 1]], ["tile_rc", "sp", [-1, 2]], ["tile_rd", "sp", [-1, 1]], ["tile_ry", "sp", [-1, 3]], ["tile_rx", "sp", [-1, 1]], ["auto_unroll_max_step", "ot", 512], ["unroll_explicit", "ot", 0]]}], "r": [[0.00931945375, 0.0092852715], 0, 1.2193129062652588, 1578543723.3132863], "v": 0.1}
{"i": ["cuda", "schedule_conv3d_transpose_nchw_cuda", [[1, 192, 16, 16, 16], [192, 192, 3, 3, 3], [1, 1, 1], [1, 1, 1], [0, 0, 0], "float32"], {}, ["schedule_conv3d_transpose_nchw_cuda", [1, 192, 16, 16, 16], [192, 192, 3, 3, 3], [1, 1, 1], [1, 1, 1], [0, 0, 0], "float32"], {"i": 2017734036, "t": "", "c": null, "e": [["tile_f", "sp", [-1, 1, 2, 12]], ["tile_d", "sp", [-1, 1, 1, 1]], ["tile_y", "sp", [-1, 2, 2, 1]], ["tile_x", "sp", [-1, 4, 1, 1]], ["tile_rc", "sp", [-1, 1]], ["tile_rd", "sp", [-1, 1]], ["tile_ry", "sp", [-1, 3]], ["tile_rx", "sp", [-1, 1]], ["auto_unroll_max_step", "ot", 512], ["unroll_explicit", "ot", 0]]}], "r": [[0.03833637725, 0.03827056425], 0, 1.7514121532440186, 1578543724.4337785], "v": 0.1}
{"i": ["cuda", "schedule_conv3d_transpose_nchw_cuda", [[1, 192, 16, 16, 16], [192, 192, 3, 3, 3], [1, 1, 1], [1, 1, 1], [0, 0, 0], "float32"], {}, ["schedule_conv3d_transpose_nchw_cuda", [1, 192, 16, 16, 16], [192, 192, 3, 3, 3], [1, 1, 1], [1, 1, 1], [0, 0, 0], "float32"], {"i": 3631206036, "t": "", "c": null, "e": [["tile_f", "sp", [-1, 1, 2, 12]], ["tile_d", "sp", [-1, 1, 1, 1]], ["tile_y", "sp", [-1, 2, 2, 1]], ["tile_x", "sp", [-1, 4, 1, 1]], ["tile_rc", "sp", [-1, 1]], ["tile_rd", "sp", [-1, 1]], ["tile_ry", "sp", [-1, 3]], ["tile_rx", "sp", [-1, 1]], ["auto_unroll_max_step", "ot", 1500], ["unroll_explicit", "ot", 0]]}], "r": [[0.036954809, 0.036954716], 0, 2.0487349033355713, 1578543725.6564772], "v": 0.1}
{"i": ["cuda", "schedule_conv3d_transpose_nchw_cuda", [[1, 192, 16, 16, 16], [192, 192, 3, 3, 3], [1, 1, 1], [1, 1, 1], [0, 0, 0], "float32"], {}, ["schedule_conv3d_transpose_nchw_cuda", [1, 192, 16, 16, 16], [192, 192, 3, 3, 3], [1, 1, 1], [1, 1, 1], [0, 0, 0], "float32"], {"i": 8471622036, "t": "", "c": null, "e": [["tile_f", "sp", [-1, 1, 2, 12]], ["tile_d", "sp", [-1, 1, 1, 1]], ["tile_y", "sp", [-1, 2, 2, 1]], ["tile_x", "sp", [-1, 4, 1, 1]], ["tile_rc", "sp", [-1, 1]], ["tile_rd", "sp", [-1, 1]], ["tile_ry", "sp", [-1, 3]], ["tile_rx", "sp", [-1, 1]], ["auto_unroll_max_step", "ot", 1500], ["unroll_explicit", "ot", 1]]}], "r": [[0.0333437835, 0.03328417875], 0, 2.5187251567840576, 1578543726.7905495], "v": 0.1}
{"i": ["cuda", "schedule_conv3d_transpose_nchw_cuda", [[1, 192, 16, 16, 16], [192, 192, 3, 3, 3], [1, 1, 1], [1, 1, 1], [0, 0, 0], "float32"], {}, ["schedule_conv3d_transpose_nchw_cuda", [1, 192, 16, 16, 16], [192, 192, 3, 3, 3], [1, 1, 1], [1, 1, 1], [0, 0, 0], "float32"], {"i": 6858150036, "t": "", "c": null, "e": [["tile_f", "sp", [-1, 1, 2, 12]], ["tile_d", "sp", [-1, 1, 1, 1]], ["tile_y", "sp", [-1, 2, 2, 1]], ["tile_x", "sp", [-1, 4, 1, 1]], ["tile_rc", "sp", [-1, 1]], ["tile_rd", "sp", [-1, 1]], ["tile_ry", "sp", [-1, 3]], ["tile_rx", "sp", [-1, 1]], ["auto_unroll_max_step", "ot", 512], ["unroll_explicit", "ot", 1]]}], "r": [[0.03721260375, 0.0371926475], 0, 1.9924275875091553, 1578543727.8966413], "v": 0.1}
{"i": ["cuda", "schedule_conv3d_transpose_nchw_cuda", [[1, 192, 16, 16, 16], [192, 192, 3, 3, 3], [1, 1, 1], [1, 1, 1], [0, 0, 0], "float32"], {}, ["schedule_conv3d_transpose_nchw_cuda", [1, 192, 16, 16, 16], [192, 192, 3, 3, 3], [1, 1, 1], [1, 1, 1], [0, 0, 0], "float32"], {"i": 2033410132, "t": "", "c": null, "e": [["tile_f", "sp", [-1, 1, 2, 16]], ["tile_d", "sp", [-1, 1, 1, 1]], ["tile_y", "sp", [-1, 1, 4, 1]], ["tile_x", "sp", [-1, 1, 2, 1]], ["tile_rc", "sp", [-1, 2]], ["tile_rd", "sp", [-1, 1]], ["tile_ry", "sp", [-1, 3]], ["tile_rx", "sp", [-1, 1]], ["auto_unroll_max_step", "ot", 512], ["unroll_explicit", "ot", 0]]}], "r": [[0.0071730905, 0.0071960685], 0, 1.4092631340026855, 1578543728.6319602], "v": 0.1}
{"i": ["cuda", "schedule_conv3d_transpose_nchw_cuda", [[1, 192, 16, 16, 16], [192, 192, 3, 3, 3], [1, 1, 1], [1, 1, 1], [0, 0, 0], "float32"], {}, ["schedule_conv3d_transpose_nchw_cuda", [1, 192, 16, 16, 16], [192, 192, 3, 3, 3], [1, 1, 1], [1, 1, 1], [0, 0, 0], "float32"], {"i": 3646882132, "t": "", "c": null, "e": [["tile_f", "sp", [-1, 1, 2, 16]], ["tile_d", "sp", [-1, 1, 1, 1]], ["tile_y", "sp", [-1, 1, 4, 1]], ["tile_x", "sp", [-1, 1, 2, 1]], ["tile_rc", "sp", [-1, 2]], ["tile_rd", "sp", [-1, 1]], ["tile_ry", "sp", [-1, 3]], ["tile_rx", "sp", [-1, 1]], ["auto_unroll_max_step", "ot", 1500], ["unroll_explicit", "ot", 0]]}], "r": [[0.0073605195, 0.007429592], 0, 1.6391963958740234, 1578543729.5045433], "v": 0.1}
{"i": ["cuda", "schedule_conv3d_transpose_nchw_cuda", [[1, 192, 16, 16, 16], [192, 192, 3, 3, 3], [1, 1, 1], [1, 1, 1], [0, 0, 0], "float32"], {}, ["schedule_conv3d_transpose_nchw_cuda", [1, 192, 16, 16, 16], [192, 192, 3, 3, 3], [1, 1, 1], [1, 1, 1], [0, 0, 0], "float32"], {"i": 6873826132, "t": "", "c": null, "e": [["tile_f", "sp", [-1, 1, 2, 16]], ["tile_d", "sp", [-1, 1, 1, 1]], ["tile_y", "sp", [-1, 1, 4, 1]], ["tile_x", "sp", [-1, 1, 2, 1]], ["tile_rc", "sp", [-1, 2]], ["tile_rd", "sp", [-1, 1]], ["tile_ry", "sp", [-1, 3]], ["tile_rx", "sp", [-1, 1]], ["auto_unroll_max_step", "ot", 512], ["unroll_explicit", "ot", 1]]}], "r": [[0.00663083525, 0.00661250375], 0, 1.4519321918487549, 1578543730.2078323], "v": 0.1}
{"i": ["cuda", "schedule_conv3d_transpose_nchw_cuda", [[1, 192, 16, 16, 16], [192, 192, 3, 3, 3], [1, 1, 1], [1, 1, 1], [0, 0, 0], "float32"], {}, ["schedule_conv3d_transpose_nchw_cuda", [1, 192, 16, 16, 16], [192, 192, 3, 3, 3], [1, 1, 1], [1, 1, 1], [0, 0, 0], "float32"], {"i": 8487298132, "t": "", "c": null, "e": [["tile_f", "sp", [-1, 1, 2, 16]], ["tile_d", "sp", [-1, 1, 1, 1]], ["tile_y", "sp", [-1, 1, 4, 1]], ["tile_x", "sp", [-1, 1, 2, 1]], ["tile_rc", "sp", [-1, 2]], ["tile_rd", "sp", [-1, 1]], ["tile_ry", "sp", [-1, 3]], ["tile_rx", "sp", [-1, 1]], ["auto_unroll_max_step", "ot", 1500], ["unroll_explicit", "ot", 1]]}], "r": [[0.00656333225, 0.0066412195], 0, 2.3872034549713135, 1578543732.9750707], "v": 0.1}
{"i": ["cuda", "schedule_conv3d_transpose_nchw_cuda", [[1, 192, 16, 16, 16], [192, 192, 3, 3, 3], [1, 1, 1], [1, 1, 1], [0, 0, 0], "float32"], {}, ["schedule_conv3d_transpose_nchw_cuda", [1, 192, 16, 16, 16], [192, 192, 3, 3, 3], [1, 1, 1], [1, 1, 1], [0, 0, 0], "float32"], {"i": 2076698696, "t": "", "c": null, "e": [["tile_f", "sp", [-1, 1, 3, 16]], ["tile_d", "sp", [-1, 1, 1, 1]], ["tile_y", "sp", [-1, 1, 1, 2]], ["tile_x", "sp", [-1, 1, 2, 1]], ["tile_rc", "sp", [-1, 6]], ["tile_rd", "sp", [-1, 1]], ["tile_ry", "sp", [-1, 3]], ["tile_rx", "sp", [-1, 1]], ["auto_unroll_max_step", "ot", 512], ["unroll_explicit", "ot", 0]]}], "r": [[0.01681165375, 0.016819756], 0, 1.3494629859924316, 1578543733.6928487], "v": 0.1}
{"i": ["cuda", "schedule_conv3d_transpose_nchw_cuda", [[1, 192, 16, 16, 16], [192, 192, 3, 3, 3], [1, 1, 1], [1, 1, 1], [0, 0, 0], "float32"], {}, ["schedule_conv3d_transpose_nchw_cuda", [1, 192, 16, 16, 16], [192, 192, 3, 3, 3], [1, 1, 1], [1, 1, 1], [0, 0, 0], "float32"], {"i": 5247547455, "t": "", "c": null, "e": [["tile_f", "sp", [-1, 1, 3, 8]], ["tile_d", "sp", [-1, 1, 1, 1]], ["tile_y", "sp", [-1, 1, 2, 1]], ["tile_x", "sp", [-1, 1, 4, 1]], ["tile_rc", "sp", [-1, 1]], ["tile_rd", "sp", [-1, 1]], ["tile_ry", "sp", [-1, 3]], ["tile_rx", "sp", [-1, 1]], ["auto_unroll_max_step", "ot", 0], ["unroll_explicit", "ot", 1]]}], "r": [[0.005137386, 0.005129501], 0, 1.0150017738342285, 1578543734.2996175], "v": 0.1}
{"i": ["cuda", "schedule_conv3d_transpose_nchw_cuda", [[1, 192, 16, 16, 16], [192, 192, 3, 3, 3], [1, 1, 1], [1, 1, 1], [0, 0, 0], "float32"], {}, ["schedule_conv3d_transpose_nchw_cuda", [1, 192, 16, 16, 16], [192, 192, 3, 3, 3], [1, 1, 1], [1, 1, 1], [0, 0, 0], "float32"], {"i": 407131455, "t": "", "c": null, "e": [["tile_f", "sp", [-1, 1, 3, 8]], ["tile_d", "sp", [-1, 1, 1, 1]], ["tile_y", "sp", [-1, 1, 2, 1]], ["tile_x", "sp", [-1, 1, 4, 1]], ["tile_rc", "sp", [-1, 1]], ["tile_rd", "sp", [-1, 1]], ["tile_ry", "sp", [-1, 3]], ["tile_rx", "sp", [-1, 1]], ["auto_unroll_max_step", "ot", 0], ["unroll_explicit", "ot", 0]]}], "r": [[0.00515991625, 0.00513107975], 0, 1.0096168518066406, 1578543734.8557713], "v": 0.1}
{"i": ["cuda", "schedule_conv3d_transpose_nchw_cuda", [[1, 192, 16, 16, 16], [192, 192, 3, 3, 3], [1, 1, 1], [1, 1, 1], [0, 0, 0], "float32"], {}, ["schedule_conv3d_transpose_nchw_cuda", [1, 192, 16, 16, 16], [192, 192, 3, 3, 3], [1, 1, 1], [1, 1, 1], [0, 0, 0], "float32"], {"i": 2082284708, "t": "", "c": null, "e": [["tile_f", "sp", [-1, 1, 2, 24]], ["tile_d", "sp", [-1, 1, 1, 1]], ["tile_y", "sp", [-1, 1, 1, 1]], ["tile_x", "sp", [-1, 1, 2, 2]], ["tile_rc", "sp", [-1, 6]], ["tile_rd", "sp", [-1, 1]], ["tile_ry", "sp", [-1, 3]], ["tile_rx", "sp", [-1, 1]], ["auto_unroll_max_step", "ot", 512], ["unroll_explicit", "ot", 0]]}], "r": [[0.063276443, 0.06335203725], 0, 2.574035406112671, 1578543736.2756429], "v": 0.1}
{"i": ["cuda", "schedule_conv3d_transpose_nchw_cuda", [[1, 192, 16, 16, 16], [192, 192, 3, 3, 3], [1, 1, 1], [1, 1, 1], [0, 0, 0], "float32"], {}, ["schedule_conv3d_transpose_nchw_cuda", [1, 192, 16, 16, 16], [192, 192, 3, 3, 3], [1, 1, 1], [1, 1, 1], [0, 0, 0], "float32"], {"i": 1673154326, "t": "", "c": null, "e": [["tile_f", "sp", [-1, 1, 2, 48]], ["tile_d", "sp", [-1, 1, 1, 1]], ["tile_y", "sp", [-1, 1, 1, 1]], ["tile_x", "sp", [-1, 1, 2, 1]], ["tile_rc", "sp", [-1, 6]], ["tile_rd", "sp", [-1, 1]], ["tile_ry", "sp", [-1, 1]], ["tile_rx", "sp", [-1, 1]], ["auto_unroll_max_step", "ot", 512], ["unroll_explicit", "ot", 0]]}], "r": [[0.26913136275, 0.2694896545], 0, 4.76946496963501, 1578543739.9867277], "v": 0.1}
{"i": ["cuda", "schedule_conv3d_transpose_nchw_cuda", [[1, 192, 16, 16, 16], [192, 192, 3, 3, 3], [1, 1, 1], [1, 1, 1], [0, 0, 0], "float32"], {}, ["schedule_conv3d_transpose_nchw_cuda", [1, 192, 16, 16, 16], [192, 192, 3, 3, 3], [1, 1, 1], [1, 1, 1], [0, 0, 0], "float32"], {"i": 463050296, "t": "", "c": null, "e": [["tile_f", "sp", [-1, 1, 3, 16]], ["tile_d", "sp", [-1, 1, 1, 1]], ["tile_y", "sp", [-1, 1, 1, 1]], ["tile_x", "sp", [-1, 1, 2, 1]], ["tile_rc", "sp", [-1, 6]], ["tile_rd", "sp", [-1, 1]], ["tile_ry", "sp", [-1, 3]], ["tile_rx", "sp", [-1, 1]], ["auto_unroll_max_step", "ot", 0], ["unroll_explicit", "ot", 0]]}], "r": [[0.03355575025, 0.033713177], 0, 1.3317511081695557, 1578543740.8623562], "v": 0.1}
{"i": ["cuda", "schedule_conv3d_transpose_nchw_cuda", [[1, 192, 16, 16, 16], [192, 192, 3, 3, 3], [1, 1, 1], [1, 1, 1], [0, 0, 0], "float32"], {}, ["schedule_conv3d_transpose_nchw_cuda", [1, 192, 16, 16, 16], [192, 192, 3, 3, 3], [1, 1, 1], [1, 1, 1], [0, 0, 0], "float32"], {"i": 2096690696, "t": "", "c": null, "e": [["tile_f", "sp", [-1, 1, 3, 16]], ["tile_d", "sp", [-1, 1, 1, 1]], ["tile_y", "sp", [-1, 1, 1, 1]], ["tile_x", "sp", [-1, 1, 2, 2]], ["tile_rc", "sp", [-1, 8]], ["tile_rd", "sp", [-1, 1]], ["tile_ry", "sp", [-1, 3]], ["tile_rx", "sp", [-1, 1]], ["auto_unroll_max_step", "ot", 512], ["unroll_explicit", "ot", 0]]}], "r": [[0.01994086075, 0.0199394195], 0, 1.8668394088745117, 1578543741.763224], "v": 0.1}
{"i": ["cuda", "schedule_conv3d_transpose_nchw_cuda", [[1, 192, 16, 16, 16], [192, 192, 3, 3, 3], [1, 1, 1], [1, 1, 1], [0, 0, 0], "float32"], {}, ["schedule_conv3d_transpose_nchw_cuda", [1, 192, 16, 16, 16], [192, 192, 3, 3, 3], [1, 1, 1], [1, 1, 1], [0, 0, 0], "float32"], {"i": 3443140166, "t": "", "c": null, "e": [["tile_f", "sp", [-1, 1, 2, 48]], ["tile_d", "sp", [-1, 1, 1, 1]], ["tile_y", "sp", [-1, 1, 4, 1]], ["tile_x", "sp", [-1, 1, 1, 1]], ["tile_rc", "sp", [-1, 2]], ["tile_rd", "sp", [-1, 3]], ["tile_ry", "sp", [-1, 1]], ["tile_rx", "sp", [-1, 1]], ["auto_unroll_max_step", "ot", 1500], ["unroll_explicit", "ot", 0]]}], "r": [[0.02326451925, 0.023249202], 0, 2.2743442058563232, 1578543742.9862025], "v": 0.1}
{"i": ["cuda", "schedule_conv3d_transpose_nchw_cuda", [[1, 192, 16, 16, 16], [192, 192, 3, 3, 3], [1, 1, 1], [1, 1, 1], [0, 0, 0], "float32"], {}, ["schedule_conv3d_transpose_nchw_cuda", [1, 192, 16, 16, 16], [192, 192, 3, 3, 3], [1, 1, 1], [1, 1, 1], [0, 0, 0], "float32"], {"i": 6670084166, "t": "", "c": null, "e": [["tile_f", "sp", [-1, 1, 2, 48]], ["tile_d", "sp", [-1, 1, 1, 1]], ["tile_y", "sp", [-1, 1, 4, 1]], ["tile_x", "sp", [-1, 1, 1, 1]], ["tile_rc", "sp", [-1, 2]], ["tile_rd", "sp", [-1, 3]], ["tile_ry", "sp", [-1, 1]], ["tile_rx", "sp", [-1, 1]], ["auto_unroll_max_step", "ot", 512], ["unroll_explicit", "ot", 1]]}], "r": [[0.02391933625, 0.02390843975], 0, 2.144134044647217, 1578543744.3402197], "v": 0.1}
{"i": ["cuda", "schedule_conv3d_transpose_nchw_cuda", [[1, 192, 16, 16, 16], [192, 192, 3, 3, 3], [1, 1, 1], [1, 1, 1], [0, 0, 0], "float32"], {}, ["schedule_conv3d_transpose_nchw_cuda", [1, 192, 16, 16, 16], [192, 192, 3, 3, 3], [1, 1, 1], [1, 1, 1], [0, 0, 0], "float32"], {"i": 2035021236, "t": "", "c": null, "e": [["tile_f", "sp", [-1, 1, 2, 12]], ["tile_d", "sp", [-1, 1, 1, 1]], ["tile_y", "sp", [-1, 2, 2, 1]], ["tile_x", "sp", [-1, 1, 4, 1]], ["tile_rc", "sp", [-1, 2]], ["tile_rd", "sp", [-1, 1]], ["tile_ry", "sp", [-1, 3]], ["tile_rx", "sp", [-1, 1]], ["auto_unroll_max_step", "ot", 512], ["unroll_explicit", "ot", 0]]}], "r": [[0.00395323825, 0.0039243005], 0, 1.3390307426452637, 1578543745.067213], "v": 0.1}
{"i": ["cuda", "schedule_conv3d_transpose_nchw_cuda", [[1, 192, 16, 16, 16], [192, 192, 3, 3, 3], [1, 1, 1], [1, 1, 1], [0, 0, 0], "float32"], {}, ["schedule_conv3d_transpose_nchw_cuda", [1, 192, 16, 16, 16], [192, 192, 3, 3, 3], [1, 1, 1], [1, 1, 1], [0, 0, 0], "float32"], {"i": 3445104086, "t": "", "c": null, "e": [["tile_f", "sp", [-1, 1, 2, 48]], ["tile_d", "sp", [-1, 1, 1, 1]], ["tile_y", "sp", [-1, 2, 1, 1]], ["tile_x", "sp", [-1, 1, 2, 1]], ["tile_rc", "sp", [-1, 2]], ["tile_rd", "sp", [-1, 3]], ["tile_ry", "sp", [-1, 1]], ["tile_rx", "sp", [-1, 1]], ["auto_unroll_max_step", "ot", 1500], ["unroll_explicit", "ot", 0]]}], "r": [[0.0288666055, 0.02875691475], 0, 1.9868488311767578, 1578543746.2062876], "v": 0.1}
{"i": ["cuda", "schedule_conv3d_transpose_nchw_cuda", [[1, 192, 16, 16, 16], [192, 192, 3, 3, 3], [1, 1, 1], [1, 1, 1], [0, 0, 0], "float32"], {}, ["schedule_conv3d_transpose_nchw_cuda", [1, 192, 16, 16, 16], [192, 192, 3, 3, 3], [1, 1, 1], [1, 1, 1], [0, 0, 0], "float32"], {"i": 1831632086, "t": "", "c": null, "e": [["tile_f", "sp", [-1, 1, 2, 48]], ["tile_d", "sp", [-1, 1, 1, 1]], ["tile_y", "sp", [-1, 2, 1, 1]], ["tile_x", "sp", [-1, 1, 2, 1]], ["tile_rc", "sp", [-1, 2]], ["tile_rd", "sp", [-1, 3]], ["tile_ry", "sp", [-1, 1]], ["tile_rx", "sp", [-1, 1]], ["auto_unroll_max_step", "ot", 512], ["unroll_explicit", "ot", 0]]}], "r": [[0.02443876825, 0.0244489425], 0, 1.6188018321990967, 1578543749.269784], "v": 0.1}
{"i": ["cuda", "schedule_conv3d_transpose_nchw_cuda", [[1, 192, 16, 16, 16], [192, 192, 3, 3, 3], [1, 1, 1], [1, 1, 1], [0, 0, 0], "float32"], {}, ["schedule_conv3d_transpose_nchw_cuda", [1, 192, 16, 16, 16], [192, 192, 3, 3, 3], [1, 1, 1], [1, 1, 1], [0, 0, 0], "float32"], {"i": 477456296, "t": "", "c": null, "e": [["tile_f", "sp", [-1, 1, 3, 16]], ["tile_d", "sp", [-1, 1, 1, 1]], ["tile_y", "sp", [-1, 1, 1, 1]], ["tile_x", "sp", [-1, 1, 2, 1]], ["tile_rc", "sp", [-1, 8]], ["tile_rd", "sp", [-1, 1]], ["tile_ry", "sp", [-1, 3]], ["tile_rx", "sp", [-1, 1]], ["auto_unroll_max_step", "ot", 0], ["unroll_explicit", "ot", 0]]}], "r": [[0.076604417, 0.07694305275], 0, 1.7466950416564941, 1578543750.5315297], "v": 0.1}
{"i": ["cuda", "schedule_conv3d_transpose_nchw_cuda", [[1, 192, 16, 16, 16], [192, 192, 3, 3, 3], [1, 1, 1], [1, 1, 1], [0, 0, 0], "float32"], {}, ["schedule_conv3d_transpose_nchw_cuda", [1, 192, 16, 16, 16], [192, 192, 3, 3, 3], [1, 1, 1], [1, 1, 1], [0, 0, 0], "float32"], {"i": 3231483636, "t": "", "c": null, "e": [["tile_f", "sp", [-1, 1, 2, 12]], ["tile_d", "sp", [-1, 1, 1, 1]], ["tile_y", "sp", [-1, 2, 1, 1]], ["tile_x", "sp", [-1, 4, 4, 1]], ["tile_rc", "sp", [-1, 1]], ["tile_rd", "sp", [-1, 1]], ["tile_ry", "sp", [-1, 1]], ["tile_rx", "sp", [-1, 1]], ["auto_unroll_max_step", "ot", 1500], ["unroll_explicit", "ot", 0]]}], "r": [[0.01751563175, 0.01751638275], 0, 1.76912522315979, 1578543751.6062188], "v": 0.1}
{"i": ["cuda", "schedule_conv3d_transpose_nchw_cuda", [[1, 192, 16, 16, 16], [192, 192, 3, 3, 3], [1, 1, 1], [1, 1, 1], [0, 0, 0], "float32"], {}, ["schedule_conv3d_transpose_nchw_cuda", [1, 192, 16, 16, 16], [192, 192, 3, 3, 3], [1, 1, 1], [1, 1, 1], [0, 0, 0], "float32"], {"i": 1618011636, "t": "", "c": null, "e": [["tile_f", "sp", [-1, 1, 2, 12]], ["tile_d", "sp", [-1, 1, 1, 1]], ["tile_y", "sp", [-1, 2, 1, 1]], ["tile_x", "sp", [-1, 4, 4, 1]], ["tile_rc", "sp", [-1, 1]], ["tile_rd", "sp", [-1, 1]], ["tile_ry", "sp", [-1, 1]], ["tile_rx", "sp", [-1, 1]], ["auto_unroll_max_step", "ot", 512], ["unroll_explicit", "ot", 0]]}], "r": [[0.0176050135, 0.0176045345], 0, 1.6056334972381592, 1578543752.6104858], "v": 0.1}
{"i": ["cuda", "schedule_conv3d_transpose_nchw_cuda", [[1, 192, 16, 16, 16], [192, 192, 3, 3, 3], [1, 1, 1], [1, 1, 1], [0, 0, 0], "float32"], {}, ["schedule_conv3d_transpose_nchw_cuda", [1, 192, 16, 16, 16], [192, 192, 3, 3, 3], [1, 1, 1], [1, 1, 1], [0, 0, 0], "float32"], {"i": 6458427636, "t": "", "c": null, "e": [["tile_f", "sp", [-1, 1, 2, 12]], ["tile_d", "sp", [-1, 1, 1, 1]], ["tile_y", "sp", [-1, 2, 1, 1]], ["tile_x", "sp", [-1, 4, 4, 1]], ["tile_rc", "sp", [-1, 1]], ["tile_rd", "sp", [-1, 1]], ["tile_ry", "sp", [-1, 1]], ["tile_rx", "sp", [-1, 1]], ["auto_unroll_max_step", "ot", 512], ["unroll_explicit", "ot", 1]]}], "r": [[0.0170785725, 0.01707697225], 0, 1.7318353652954102, 1578543753.6003792], "v": 0.1}
{"i": ["cuda", "schedule_conv3d_transpose_nchw_cuda", [[1, 192, 16, 16, 16], [192, 192, 3, 3, 3], [1, 1, 1], [1, 1, 1], [0, 0, 0], "float32"], {}, ["schedule_conv3d_transpose_nchw_cuda", [1, 192, 16, 16, 16], [192, 192, 3, 3, 3], [1, 1, 1], [1, 1, 1], [0, 0, 0], "float32"], {"i": 1874838326, "t": "", "c": null, "e": [["tile_f", "sp", [-1, 1, 2, 48]], ["tile_d", "sp", [-1, 1, 1, 1]], ["tile_y", "sp", [-1, 1, 1, 1]], ["tile_x", "sp", [-1, 1, 2, 1]], ["tile_rc", "sp", [-1, 6]], ["tile_rd", "sp", [-1, 3]], ["tile_ry", "sp", [-1, 1]], ["tile_rx", "sp", [-1, 1]], ["auto_unroll_max_step", "ot", 512], ["unroll_explicit", "ot", 0]]}], "r": [[0.14121180175, 0.1409667975], 0, 4.088111877441406, 1578543756.0364864], "v": 0.1}
{"i": ["cuda", "schedule_conv3d_transpose_nchw_cuda", [[1, 192, 16, 16, 16], [192, 192, 3, 3, 3], [1, 1, 1], [1, 1, 1], [0, 0, 0], "float32"], {}, ["schedule_conv3d_transpose_nchw_cuda", [1, 192, 16, 16, 16], [192, 192, 3, 3, 3], [1, 1, 1], [1, 1, 1], [0, 0, 0], "float32"], {"i": 3634075427, "t": "", "c": null, "e": [["tile_f", "sp", [-1, 2, 2, 6]], ["tile_d", "sp", [-1, 1, 1, 1]], ["tile_y", "sp", [-1, 1, 2, 1]], ["tile_x", "sp", [-1, 1, 4, 1]], ["tile_rc", "sp", [-1, 1]], ["tile_rd", "sp", [-1, 1]], ["tile_ry", "sp", [-1, 3]], ["tile_rx", "sp", [-1, 1]], ["auto_unroll_max_step", "ot", 1500], ["unroll_explicit", "ot", 0]]}], "r": [[0.00715393925, 0.00714924475], 0, 1.3398034572601318, 1578543756.7365203], "v": 0.1}
{"i": ["cuda", "schedule_conv3d_transpose_nchw_cuda", [[1, 192, 16, 16, 16], [192, 192, 3, 3, 3], [1, 1, 1], [1, 1, 1], [0, 0, 0], "float32"], {}, ["schedule_conv3d_transpose_nchw_cuda", [1, 192, 16, 16, 16], [192, 192, 3, 3, 3], [1, 1, 1], [1, 1, 1], [0, 0, 0], "float32"], {"i": 6861019427, "t": "", "c": null, "e": [["tile_f", "sp", [-1, 2, 2, 6]], ["tile_d", "sp", [-1, 1, 1, 1]], ["tile_y", "sp", [-1, 1, 2, 1]], ["tile_x", "sp", [-1, 1, 4, 1]], ["tile_rc", "sp", [-1, 1]], ["tile_rd", "sp", [-1, 1]], ["tile_ry", "sp", [-1, 3]], ["tile_rx", "sp", [-1, 1]], ["auto_unroll_max_step", "ot", 512], ["unroll_explicit", "ot", 1]]}], "r": [[0.0054818105, 0.0054814445], 0, 1.5821607112884521, 1578543757.4049213], "v": 0.1}
{"i": ["cuda", "schedule_conv3d_transpose_nchw_cuda", [[1, 192, 16, 16, 16], [192, 192, 3, 3, 3], [1, 1, 1], [1, 1, 1], [0, 0, 0], "float32"], {}, ["schedule_conv3d_transpose_nchw_cuda", [1, 192, 16, 16, 16], [192, 192, 3, 3, 3], [1, 1, 1], [1, 1, 1], [0, 0, 0], "float32"], {"i": 2020603427, "t": "", "c": null, "e": [["tile_f", "sp", [-1, 2, 2, 6]], ["tile_d", "sp", [-1, 1, 1, 1]], ["tile_y", "sp", [-1, 1, 2, 1]], ["tile_x", "sp", [-1, 1, 4, 1]], ["tile_rc", "sp", [-1, 1]], ["tile_rd", "sp", [-1, 1]], ["tile_ry", "sp", [-1, 3]], ["tile_rx", "sp", [-1, 1]], ["auto_unroll_max_step", "ot", 512], ["unroll_explicit", "ot", 0]]}], "r": [[0.00715798775, 0.00714791575], 0, 1.2318072319030762, 1578543758.041357], "v": 0.1}
{"i": ["cuda", "schedule_conv3d_transpose_nchw_cuda", [[1, 192, 16, 16, 16], [192, 192, 3, 3, 3], [1, 1, 1], [1, 1, 1], [0, 0, 0], "float32"], {}, ["schedule_conv3d_transpose_nchw_cuda", [1, 192, 16, 16, 16], [192, 192, 3, 3, 3], [1, 1, 1], [1, 1, 1], [0, 0, 0], "float32"], {"i": 8474491427, "t": "", "c": null, "e": [["tile_f", "sp", [-1, 2, 2, 6]], ["tile_d", "sp", [-1, 1, 1, 1]], ["tile_y", "sp", [-1, 1, 2, 1]], ["tile_x", "sp", [-1, 1, 4, 1]], ["tile_rc", "sp", [-1, 1]], ["tile_rd", "sp", [-1, 1]], ["tile_ry", "sp", [-1, 3]], ["tile_rx", "sp", [-1, 1]], ["auto_unroll_max_step", "ot", 1500], ["unroll_explicit", "ot", 1]]}], "r": [[0.005539007, 0.005458573], 0, 1.4183204174041748, 1578543758.6413321], "v": 0.1}
{"i": ["cuda", "schedule_conv3d_transpose_nchw_cuda", [[1, 192, 16, 16, 16], [192, 192, 3, 3, 3], [1, 1, 1], [1, 1, 1], [0, 0, 0], "float32"], {}, ["schedule_conv3d_transpose_nchw_cuda", [1, 192, 16, 16, 16], [192, 192, 3, 3, 3], [1, 1, 1], [1, 1, 1], [0, 0, 0], "float32"], {"i": 6858185266, "t": "", "c": null, "e": [["tile_f", "sp", [-1, 1, 2, 6]], ["tile_d", "sp", [-1, 1, 1, 1]], ["tile_y", "sp", [-1, 1, 4, 1]], ["tile_x", "sp", [-1, 4, 1, 1]], ["tile_rc", "sp", [-1, 1]], ["tile_rd", "sp", [-1, 1]], ["tile_ry", "sp", [-1, 3]], ["tile_rx", "sp", [-1, 1]], ["auto_unroll_max_step", "ot", 512], ["unroll_explicit", "ot", 1]]}], "r": [[0.008199799, 0.00816532675], 0, 1.3746190071105957, 1578543759.3366585], "v": 0.1}
{"i": ["cuda", "schedule_conv3d_transpose_nchw_cuda", [[1, 192, 16, 16, 16], [192, 192, 3, 3, 3], [1, 1, 1], [1, 1, 1], [0, 0, 0], "float32"], {}, ["schedule_conv3d_transpose_nchw_cuda", [1, 192, 16, 16, 16], [192, 192, 3, 3, 3], [1, 1, 1], [1, 1, 1], [0, 0, 0], "float32"], {"i": 2053472708, "t": "", "c": null, "e": [["tile_f", "sp", [-1, 1, 2, 24]], ["tile_d", "sp", [-1, 1, 1, 1]], ["tile_y", "sp", [-1, 1, 1, 1]], ["tile_x", "sp", [-1, 1, 2, 2]], ["tile_rc", "sp", [-1, 3]], ["tile_rd", "sp", [-1, 1]], ["tile_ry", "sp", [-1, 3]], ["tile_rx", "sp", [-1, 1]], ["auto_unroll_max_step", "ot", 512], ["unroll_explicit", "ot", 0]]}], "r": [[0.03787601425, 0.03789992125], 0, 2.0338120460510254, 1578543760.579551], "v": 0.1}
{"i": ["cuda", "schedule_conv3d_transpose_nchw_cuda", [[1, 192, 16, 16, 16], [192, 192, 3, 3, 3], [1, 1, 1], [1, 1, 1], [0, 0, 0], "float32"], {}, ["schedule_conv3d_transpose_nchw_cuda", [1, 192, 16, 16, 16], [192, 192, 3, 3, 3], [1, 1, 1], [1, 1, 1], [0, 0, 0], "float32"], {"i": 6922700708, "t": "", "c": null, "e": [["tile_f", "sp", [-1, 1, 2, 24]], ["tile_d", "sp", [-1, 1, 1, 1]], ["tile_y", "sp", [-1, 1, 1, 1]], ["tile_x", "sp", [-1, 1, 2, 2]], ["tile_rc", "sp", [-1, 6]], ["tile_rd", "sp", [-1, 1]], ["tile_ry", "sp", [-1, 3]], ["tile_rx", "sp", [-1, 1]], ["auto_unroll_max_step", "ot", 512], ["unroll_explicit", "ot", 1]]}], "r": [[0.050770881, 0.04509843525], 0, 2.787146806716919, 1578543764.6193972], "v": 0.1}
{"i": ["cuda", "schedule_conv3d_transpose_nchw_cuda", [[1, 192, 16, 16, 16], [192, 192, 3, 3, 3], [1, 1, 1], [1, 1, 1], [0, 0, 0], "float32"], {}, ["schedule_conv3d_transpose_nchw_cuda", [1, 192, 16, 16, 16], [192, 192, 3, 3, 3], [1, 1, 1], [1, 1, 1], [0, 0, 0], "float32"], {"i": 3231483586, "t": "", "c": null, "e": [["tile_f", "sp", [-1, 1, 2, 6]], ["tile_d", "sp", [-1, 1, 1, 1]], ["tile_y", "sp", [-1, 2, 1, 1]], ["tile_x", "sp", [-1, 4, 4, 1]], ["tile_rc", "sp", [-1, 1]], ["tile_rd", "sp", [-1, 1]], ["tile_ry", "sp", [-1, 1]], ["tile_rx", "sp", [-1, 1]], ["auto_unroll_max_step", "ot", 1500], ["unroll_explicit", "ot", 0]]}], "r": [[0.00912274425, 0.009127164], 0, 2.244037389755249, 1578543765.5417383], "v": 0.1}
{"i": ["cuda", "schedule_conv3d_transpose_nchw_cuda", [[1, 192, 16, 16, 16], [192, 192, 3, 3, 3], [1, 1, 1], [1, 1, 1], [0, 0, 0], "float32"], {}, ["schedule_conv3d_transpose_nchw_cuda", [1, 192, 16, 16, 16], [192, 192, 3, 3, 3], [1, 1, 1], [1, 1, 1], [0, 0, 0], "float32"], {"i": 6458427586, "t": "", "c": null, "e": [["tile_f", "sp", [-1, 1, 2, 6]], ["tile_d", "sp", [-1, 1, 1, 1]], ["tile_y", "sp", [-1, 2, 1, 1]], ["tile_x", "sp", [-1, 4, 4, 1]], ["tile_rc", "sp", [-1, 1]], ["tile_rd", "sp", [-1, 1]], ["tile_ry", "sp", [-1, 1]], ["tile_rx", "sp", [-1, 1]], ["auto_unroll_max_step", "ot", 512], ["unroll_explicit", "ot", 1]]}], "r": [[0.00925593375, 0.00922003925], 0, 1.703392505645752, 1578543766.3227975], "v": 0.1}
{"i": ["cuda", "schedule_conv3d_transpose_nchw_cuda", [[1, 192, 16, 16, 16], [192, 192, 3, 3, 3], [1, 1, 1], [1, 1, 1], [0, 0, 0], "float32"], {}, ["schedule_conv3d_transpose_nchw_cuda", [1, 192, 16, 16, 16], [192, 192, 3, 3, 3], [1, 1, 1], [1, 1, 1], [0, 0, 0], "float32"], {"i": 8071899586, "t": "", "c": null, "e": [["tile_f", "sp", [-1, 1, 2, 6]], ["tile_d", "sp", [-1, 1, 1, 1]], ["tile_y", "sp", [-1, 2, 1, 1]], ["tile_x", "sp", [-1, 4, 4, 1]], ["tile_rc", "sp", [-1, 1]], ["tile_rd", "sp", [-1, 1]], ["tile_ry", "sp", [-1, 1]], ["tile_rx", "sp", [-1, 1]], ["auto_unroll_max_step", "ot", 1500], ["unroll_explicit", "ot", 1]]}], "r": [[0.00663766, 0.00662960125], 0, 3.1777045726776123, 1578543767.2031195], "v": 0.1}
{"i": ["cuda", "schedule_conv3d_transpose_nchw_cuda", [[1, 192, 16, 16, 16], [192, 192, 3, 3, 3], [1, 1, 1], [1, 1, 1], [0, 0, 0], "float32"], {}, ["schedule_conv3d_transpose_nchw_cuda", [1, 192, 16, 16, 16], [192, 192, 3, 3, 3], [1, 1, 1], [1, 1, 1], [0, 0, 0], "float32"], {"i": 3259519476, "t": "", "c": null, "e": [["tile_f", "sp", [-1, 1, 2, 12]], ["tile_d", "sp", [-1, 1, 1, 1]], ["tile_y", "sp", [-1, 1, 2, 1]], ["tile_x", "sp", [-1, 1, 4, 1]], ["tile_rc", "sp", [-1, 3]], ["tile_rd", "sp", [-1, 1]], ["tile_ry", "sp", [-1, 1]], ["tile_rx", "sp", [-1, 1]], ["auto_unroll_max_step", "ot", 1500], ["unroll_explicit", "ot", 0]]}], "r": [[0.0142375515, 0.01442090075], 0, 2.638155460357666, 1578543768.4053307], "v": 0.1}
{"i": ["cuda", "schedule_conv3d_transpose_nchw_cuda", [[1, 192, 16, 16, 16], [192, 192, 3, 3, 3], [1, 1, 1], [1, 1, 1], [0, 0, 0], "float32"], {}, ["schedule_conv3d_transpose_nchw_cuda", [1, 192, 16, 16, 16], [192, 192, 3, 3, 3], [1, 1, 1], [1, 1, 1], [0, 0, 0], "float32"], {"i": 8099935476, "t": "", "c": null, "e": [["tile_f", "sp", [-1, 1, 2, 12]], ["tile_d", "sp", [-1, 1, 1, 1]], ["tile_y", "sp", [-1, 1, 2, 1]], ["tile_x", "sp", [-1, 1, 4, 1]], ["tile_rc", "sp", [-1, 3]], ["tile_rd", "sp", [-1, 1]], ["tile_ry", "sp", [-1, 1]], ["tile_rx", "sp", [-1, 1]], ["auto_unroll_max_step", "ot", 1500], ["unroll_explicit", "ot", 1]]}], "r": [[0.012272957, 0.0123269735], 0, 3.2299039363861084, 1578543769.3478947], "v": 0.1}
{"i": ["cuda", "schedule_conv3d_transpose_nchw_cuda", [[1, 192, 16, 16, 16], [192, 192, 3, 3, 3], [1, 1, 1], [1, 1, 1], [0, 0, 0], "float32"], {}, ["schedule_conv3d_transpose_nchw_cuda", [1, 192, 16, 16, 16], [192, 192, 3, 3, 3], [1, 1, 1], [1, 1, 1], [0, 0, 0], "float32"], {"i": 1628348585, "t": "", "c": null, "e": [["tile_f", "sp", [-1, 1, 2, 4]], ["tile_d", "sp", [-1, 1, 1, 1]], ["tile_y", "sp", [-1, 1, 2, 1]], ["tile_x", "sp", [-1, 2, 1, 1]], ["tile_rc", "sp", [-1, 2]], ["tile_rd", "sp", [-1, 1]], ["tile_ry", "sp", [-1, 1]], ["tile_rx", "sp", [-1, 1]], ["auto_unroll_max_step", "ot", 512], ["unroll_explicit", "ot", 0]]}], "r": [[0.02510988175, 0.0251426975], 0, 1.4023163318634033, 1578543770.1810758], "v": 0.1}
