auto_log/((1, 32, 64, 128, 128), (12, 32, 1, 1, 1), (1, 12, 64, 128, 128), (1, 1, 1), (0, 0, 0), 1, 1, None)_bwd_inp_grad.log
{"i": ["cuda", "schedule_conv3d_transpose_nchw_cuda", [[1, 12, 64, 128, 128], [12, 32, 1, 1, 1], [1, 1, 1], [0, 0, 0], [0, 0, 0], "float32"], {}, ["schedule_conv3d_transpose_nchw_cuda", [1, 12, 64, 128, 128], [12, 32, 1, 1, 1], [1, 1, 1], [0, 0, 0], [0, 0, 0], "float32"], {"i": 367514234, "t": "", "c": null, "e": [["tile_f", "sp", [-1, 16, 2, 1]], ["tile_d", "sp", [-1, 4, 1, 1]], ["tile_y", "sp", [-1, 1, 2, 1]], ["tile_x", "sp", [-1, 4, 4, 2]], ["tile_rc", "sp", [-1, 12]], ["tile_rd", "sp", [-1, 1]], ["tile_ry", "sp", [-1, 1]], ["tile_rx", "sp", [-1, 1]], ["auto_unroll_max_step", "ot", 0], ["unroll_explicit", "ot", 0]]}], "r": [[0.0312620075, 0.03128571175], 0, 2.167828321456909, 1578508949.3062992], "v": 0.1}
{"i": ["cuda", "schedule_conv3d_transpose_nchw_cuda", [[1, 12, 64, 128, 128], [12, 32, 1, 1, 1], [1, 1, 1], [0, 0, 0], [0, 0, 0], "float32"], {}, ["schedule_conv3d_transpose_nchw_cuda", [1, 12, 64, 128, 128], [12, 32, 1, 1, 1], [1, 1, 1], [0, 0, 0], [0, 0, 0], "float32"], {"i": 1657353796, "t": "", "c": null, "e": [["tile_f", "sp", [-1, 4, 2, 2]], ["tile_d", "sp", [-1, 4, 1, 4]], ["tile_y", "sp", [-1, 1, 2, 1]], ["tile_x", "sp", [-1, 4, 8, 2]], ["tile_rc", "sp", [-1, 1]], ["tile_rd", "sp", [-1, 1]], ["tile_ry", "sp", [-1, 1]], ["tile_rx", "sp", [-1, 1]], ["auto_unroll_max_step", "ot", 512], ["unroll_explicit", "ot", 1]]}], "r": [[0.014249941, 0.01423867725], 0, 5.671792507171631, 1578508960.582899], "v": 0.1}
{"i": ["cuda", "schedule_conv3d_transpose_nchw_cuda", [[1, 12, 64, 128, 128], [12, 32, 1, 1, 1], [1, 1, 1], [0, 0, 0], [0, 0, 0], "float32"], {}, ["schedule_conv3d_transpose_nchw_cuda", [1, 12, 64, 128, 128], [12, 32, 1, 1, 1], [1, 1, 1], [0, 0, 0], [0, 0, 0], "float32"], {"i": 994064987, "t": "", "c": null, "e": [["tile_f", "sp", [-1, 2, 2, 2]], ["tile_d", "sp", [-1, 1, 1, 2]], ["tile_y", "sp", [-1, 8, 1, 1]], ["tile_x", "sp", [-1, 4, 8, 4]], ["tile_rc", "sp", [-1, 3]], ["tile_rd", "sp", [-1, 1]], ["tile_ry", "sp", [-1, 1]], ["tile_rx", "sp", [-1, 1]], ["auto_unroll_max_step", "ot", 1500], ["unroll_explicit", "ot", 0]]}], "r": [[0.016655619, 0.0166462245], 0, 4.526899814605713, 1578508972.2728689], "v": 0.1}
{"i": ["cuda", "schedule_conv3d_transpose_nchw_cuda", [[1, 12, 64, 128, 128], [12, 32, 1, 1, 1], [1, 1, 1], [0, 0, 0], [0, 0, 0], "float32"], {}, ["schedule_conv3d_transpose_nchw_cuda", [1, 12, 64, 128, 128], [12, 32, 1, 1, 1], [1, 1, 1], [0, 0, 0], [0, 0, 0], "float32"], {"i": 17146127, "t": "", "c": null, "e": [["tile_f", "sp", [-1, 2, 1, 8]], ["tile_d", "sp", [-1, 1, 1, 1]], ["tile_y", "sp", [-1, 4, 2, 2]], ["tile_x", "sp", [-1, 1, 32, 1]], ["tile_rc", "sp", [-1, 1]], ["tile_rd", "sp", [-1, 1]], ["tile_ry", "sp", [-1, 1]], ["tile_rx", "sp", [-1, 1]], ["auto_unroll_max_step", "ot", 0], ["unroll_explicit", "ot", 0]]}], "r": [[0.0006592635, 0.000653184], 0, 1.0935664176940918, 1578509012.664901], "v": 0.1}
{"i": ["cuda", "schedule_conv3d_transpose_nchw_cuda", [[1, 12, 64, 128, 128], [12, 32, 1, 1, 1], [1, 1, 1], [0, 0, 0], [0, 0, 0], "float32"], {}, ["schedule_conv3d_transpose_nchw_cuda", [1, 12, 64, 128, 128], [12, 32, 1, 1, 1], [1, 1, 1], [0, 0, 0], [0, 0, 0], "float32"], {"i": 22703124, "t": "", "c": null, "e": [["tile_f", "sp", [-1, 1, 1, 16]], ["tile_d", "sp", [-1, 1, 1, 2]], ["tile_y", "sp", [-1, 1, 16, 1]], ["tile_x", "sp", [-1, 16, 1, 2]], ["tile_rc", "sp", [-1, 1]], ["tile_rd", "sp", [-1, 1]], ["tile_ry", "sp", [-1, 1]], ["tile_rx", "sp", [-1, 1]], ["auto_unroll_max_step", "ot", 0], ["unroll_explicit", "ot", 0]]}], "r": [[0.0218269, 0.021693859], 0, 1.3036527633666992, 1578509013.480952], "v": 0.1}
{"i": ["cuda", "schedule_conv3d_transpose_nchw_cuda", [[1, 12, 64, 128, 128], [12, 32, 1, 1, 1], [1, 1, 1], [0, 0, 0], [0, 0, 0], "float32"], {}, ["schedule_conv3d_transpose_nchw_cuda", [1, 12, 64, 128, 128], [12, 32, 1, 1, 1], [1, 1, 1], [0, 0, 0], [0, 0, 0], "float32"], {"i": 36250644, "t": "", "c": null, "e": [["tile_f", "sp", [-1, 1, 1, 16]], ["tile_d", "sp", [-1, 1, 1, 2]], ["tile_y", "sp", [-1, 1, 16, 1]], ["tile_x", "sp", [-1, 1, 1, 4]], ["tile_rc", "sp", [-1, 1]], ["tile_rd", "sp", [-1, 1]], ["tile_ry", "sp", [-1, 1]], ["tile_rx", "sp", [-1, 1]], ["auto_unroll_max_step", "ot", 0], ["unroll_explicit", "ot", 0]]}], "r": [[0.002004087, 0.0020027455], 0, 1.197160243988037, 1578509014.1567736], "v": 0.1}
{"i": ["cuda", "schedule_conv3d_transpose_nchw_cuda", [[1, 12, 64, 128, 128], [12, 32, 1, 1, 1], [1, 1, 1], [0, 0, 0], [0, 0, 0], "float32"], {}, ["schedule_conv3d_transpose_nchw_cuda", [1, 12, 64, 128, 128], [12, 32, 1, 1, 1], [1, 1, 1], [0, 0, 0], [0, 0, 0], "float32"], {"i": 57224207, "t": "", "c": null, "e": [["tile_f", "sp", [-1, 2, 1, 8]], ["tile_d", "sp", [-1, 1, 1, 1]], ["tile_y", "sp", [-1, 4, 2, 2]], ["tile_x", "sp", [-1, 2, 1, 16]], ["tile_rc", "sp", [-1, 1]], ["tile_rd", "sp", [-1, 1]], ["tile_ry", "sp", [-1, 1]], ["tile_rx", "sp", [-1, 1]], ["auto_unroll_max_step", "ot", 0], ["unroll_explicit", "ot", 0]]}], "r": [[0.1469362385, 0.14710280725], 0, 3.5732085704803467, 1578509016.2690372], "v": 0.1}
{"i": ["cuda", "schedule_conv3d_transpose_nchw_cuda", [[1, 12, 64, 128, 128], [12, 32, 1, 1, 1], [1, 1, 1], [0, 0, 0], [0, 0, 0], "float32"], {}, ["schedule_conv3d_transpose_nchw_cuda", [1, 12, 64, 128, 128], [12, 32, 1, 1, 1], [1, 1, 1], [0, 0, 0], [0, 0, 0], "float32"], {"i": 171613030, "t": "", "c": null, "e": [["tile_f", "sp", [-1, 2, 1, 2]], ["tile_d", "sp", [-1, 4, 1, 2]], ["tile_y", "sp", [-1, 4, 1, 1]], ["tile_x", "sp", [-1, 1, 1, 4]], ["tile_rc", "sp", [-1, 3]], ["tile_rd", "sp", [-1, 1]], ["tile_ry", "sp", [-1, 1]], ["tile_rx", "sp", [-1, 1]], ["auto_unroll_max_step", "ot", 0], ["unroll_explicit", "ot", 0]]}], "r": [[0.278316057, 0.2786200775], 0, 4.648738622665405, 1578509019.84832], "v": 0.1}
{"i": ["cuda", "schedule_conv3d_transpose_nchw_cuda", [[1, 12, 64, 128, 128], [12, 32, 1, 1, 1], [1, 1, 1], [0, 0, 0], [0, 0, 0], "float32"], {}, ["schedule_conv3d_transpose_nchw_cuda", [1, 12, 64, 128, 128], [12, 32, 1, 1, 1], [1, 1, 1], [0, 0, 0], [0, 0, 0], "float32"], {"i": 423531071, "t": "", "c": null, "e": [["tile_f", "sp", [-1, 2, 1, 8]], ["tile_d", "sp", [-1, 4, 1, 2]], ["tile_y", "sp", [-1, 1, 1, 2]], ["tile_x", "sp", [-1, 1, 32, 1]], ["tile_rc", "sp", [-1, 1]], ["tile_rd", "sp", [-1, 1]], ["tile_ry", "sp", [-1, 1]], ["tile_rx", "sp", [-1, 1]], ["auto_unroll_max_step", "ot", 512], ["unroll_explicit", "ot", 0]]}], "r": [[0.00105125275, 0.001060191], 0, 1.255490779876709, 1578509020.9896483], "v": 0.1}
{"i": ["cuda", "schedule_conv3d_transpose_nchw_cuda", [[1, 12, 64, 128, 128], [12, 32, 1, 1, 1], [1, 1, 1], [0, 0, 0], [0, 0, 0], "float32"], {}, ["schedule_conv3d_transpose_nchw_cuda", [1, 12, 64, 128, 128], [12, 32, 1, 1, 1], [1, 1, 1], [0, 0, 0], [0, 0, 0], "float32"], {"i": 444109357, "t": "", "c": null, "e": [["tile_f", "sp", [-1, 4, 4, 1]], ["tile_d", "sp", [-1, 1, 1, 1]], ["tile_y", "sp", [-1, 2, 2, 8]], ["tile_x", "sp", [-1, 4, 1, 4]], ["tile_rc", "sp", [-1, 1]], ["tile_rd", "sp", [-1, 1]], ["tile_ry", "sp", [-1, 1]], ["tile_rx", "sp", [-1, 1]], ["auto_unroll_max_step", "ot", 512], ["unroll_explicit", "ot", 0]]}], "r": [[0.04289050025, 0.04301332775], 0, 1.7781116962432861, 1578509022.2758505], "v": 0.1}
{"i": ["cuda", "schedule_conv3d_transpose_nchw_cuda", [[1, 12, 64, 128, 128], [12, 32, 1, 1, 1], [1, 1, 1], [0, 0, 0], [0, 0, 0], "float32"], {}, ["schedule_conv3d_transpose_nchw_cuda", [1, 12, 64, 128, 128], [12, 32, 1, 1, 1], [1, 1, 1], [0, 0, 0], [0, 0, 0], "float32"], {"i": 429128724, "t": "", "c": null, "e": [["tile_f", "sp", [-1, 1, 1, 16]], ["tile_d", "sp", [-1, 1, 1, 2]], ["tile_y", "sp", [-1, 1, 16, 1]], ["tile_x", "sp", [-1, 16, 1, 2]], ["tile_rc", "sp", [-1, 1]], ["tile_rd", "sp", [-1, 1]], ["tile_ry", "sp", [-1, 1]], ["tile_rx", "sp", [-1, 1]], ["auto_unroll_max_step", "ot", 512], ["unroll_explicit", "ot", 0]]}], "r": [[0.01494020875, 0.01493738675], 0, 1.4158942699432373, 1578509023.2645628], "v": 0.1}
{"i": ["cuda", "schedule_conv3d_transpose_nchw_cuda", [[1, 12, 64, 128, 128], [12, 32, 1, 1, 1], [1, 1, 1], [0, 0, 0], [0, 0, 0], "float32"], {}, ["schedule_conv3d_transpose_nchw_cuda", [1, 12, 64, 128, 128], [12, 32, 1, 1, 1], [1, 1, 1], [0, 0, 0], [0, 0, 0], "float32"], {"i": 446674751, "t": "", "c": null, "e": [["tile_f", "sp", [-1, 2, 1, 8]], ["tile_d", "sp", [-1, 4, 1, 2]], ["tile_y", "sp", [-1, 1, 1, 2]], ["tile_x", "sp", [-1, 2, 2, 4]], ["tile_rc", "sp", [-1, 1]], ["tile_rd", "sp", [-1, 1]], ["tile_ry", "sp", [-1, 1]], ["tile_rx", "sp", [-1, 1]], ["auto_unroll_max_step", "ot", 512], ["unroll_explicit", "ot", 0]]}], "r": [[0.1412887075, 0.14118137525], 0, 3.4805142879486084, 1578509035.8363214], "v": 0.1}
{"i": ["cuda", "schedule_conv3d_transpose_nchw_cuda", [[1, 12, 64, 128, 128], [12, 32, 1, 1, 1], [1, 1, 1], [0, 0, 0], [0, 0, 0], "float32"], {}, ["schedule_conv3d_transpose_nchw_cuda", [1, 12, 64, 128, 128], [12, 32, 1, 1, 1], [1, 1, 1], [0, 0, 0], [0, 0, 0], "float32"], {"i": 428046911, "t": "", "c": null, "e": [["tile_f", "sp", [-1, 2, 1, 8]], ["tile_d", "sp", [-1, 4, 1, 2]], ["tile_y", "sp", [-1, 1, 1, 2]], ["tile_x", "sp", [-1, 4, 1, 2]], ["tile_rc", "sp", [-1, 1]], ["tile_rd", "sp", [-1, 1]], ["tile_ry", "sp", [-1, 1]], ["tile_rx", "sp", [-1, 1]], ["auto_unroll_max_step", "ot", 512], ["unroll_explicit", "ot", 0]]}], "r": [[0.25366477075, 0.2539074905], 0, 4.687943935394287, 1578509039.1448889], "v": 0.1}
{"i": ["cuda", "schedule_conv3d_transpose_nchw_cuda", [[1, 12, 64, 128, 128], [12, 32, 1, 1, 1], [1, 1, 1], [0, 0, 0], [0, 0, 0], "float32"], {}, ["schedule_conv3d_transpose_nchw_cuda", [1, 12, 64, 128, 128], [12, 32, 1, 1, 1], [1, 1, 1], [0, 0, 0], [0, 0, 0], "float32"], {"i": 429410952, "t": "", "c": null, "e": [["tile_f", "sp", [-1, 1, 2, 4]], ["tile_d", "sp", [-1, 1, 1, 2]], ["tile_y", "sp", [-1, 2, 1, 8]], ["tile_x", "sp", [-1, 16, 1, 2]], ["tile_rc", "sp", [-1, 1]], ["tile_rd", "sp", [-1, 1]], ["tile_ry", "sp", [-1, 1]], ["tile_rx", "sp", [-1, 1]], ["auto_unroll_max_step", "ot", 512], ["unroll_explicit", "ot", 0]]}], "r": [[0.16578107175, 0.16593189825], 0, 7.700078964233398, 1578509042.1447268], "v": 0.1}
{"i": ["cuda", "schedule_conv3d_transpose_nchw_cuda", [[1, 12, 64, 128, 128], [12, 32, 1, 1, 1], [1, 1, 1], [0, 0, 0], [0, 0, 0], "float32"], {}, ["schedule_conv3d_transpose_nchw_cuda", [1, 12, 64, 128, 128], [12, 32, 1, 1, 1], [1, 1, 1], [0, 0, 0], [0, 0, 0], "float32"], {"i": 985271628, "t": "", "c": null, "e": [["tile_f", "sp", [-1, 2, 4, 1]], ["tile_d", "sp", [-1, 1, 1, 1]], ["tile_y", "sp", [-1, 1, 8, 2]], ["tile_x", "sp", [-1, 2, 1, 4]], ["tile_rc", "sp", [-1, 3]], ["tile_rd", "sp", [-1, 1]], ["tile_ry", "sp", [-1, 1]], ["tile_rx", "sp", [-1, 1]], ["auto_unroll_max_step", "ot", 1500], ["unroll_explicit", "ot", 0]]}], "r": [[0.001965095, 0.001955506], 0, 1.219895839691162, 1578509043.0456662], "v": 0.1}
{"i": ["cuda", "schedule_conv3d_transpose_nchw_cuda", [[1, 12, 64, 128, 128], [12, 32, 1, 1, 1], [1, 1, 1], [0, 0, 0], [0, 0, 0], "float32"], {}, ["schedule_conv3d_transpose_nchw_cuda", [1, 12, 64, 128, 128], [12, 32, 1, 1, 1], [1, 1, 1], [0, 0, 0], [0, 0, 0], "float32"], {"i": 1264640228, "t": "", "c": null, "e": [["tile_f", "sp", [-1, 2, 4, 1]], ["tile_d", "sp", [-1, 1, 1, 4]], ["tile_y", "sp", [-1, 1, 2, 2]], ["tile_x", "sp", [-1, 2, 8, 4]], ["tile_rc", "sp", [-1, 1]], ["tile_rd", "sp", [-1, 1]], ["tile_ry", "sp", [-1, 1]], ["tile_rx", "sp", [-1, 1]], ["auto_unroll_max_step", "ot", 0], ["unroll_explicit", "ot", 1]]}], "r": [[0.00139901675, 0.00140417225], 0, 1.3146569728851318, 1578509043.7085934], "v": 0.1}
{"i": ["cuda", "schedule_conv3d_transpose_nchw_cuda", [[1, 12, 64, 128, 128], [12, 32, 1, 1, 1], [1, 1, 1], [0, 0, 0], [0, 0, 0], "float32"], {}, ["schedule_conv3d_transpose_nchw_cuda", [1, 12, 64, 128, 128], [12, 32, 1, 1, 1], [1, 1, 1], [0, 0, 0], [0, 0, 0], "float32"], {"i": 835554312, "t": "", "c": null, "e": [["tile_f", "sp", [-1, 1, 2, 4]], ["tile_d", "sp", [-1, 1, 1, 2]], ["tile_y", "sp", [-1, 1, 16, 1]], ["tile_x", "sp", [-1, 16, 1, 2]], ["tile_rc", "sp", [-1, 1]], ["tile_rd", "sp", [-1, 1]], ["tile_ry", "sp", [-1, 1]], ["tile_rx", "sp", [-1, 1]], ["auto_unroll_max_step", "ot", 1500], ["unroll_explicit", "ot", 0]]}], "r": [[0.00264568, 0.002650719], 0, 1.5562264919281006, 1578509044.6664193], "v": 0.1}
{"i": ["cuda", "schedule_conv3d_transpose_nchw_cuda", [[1, 12, 64, 128, 128], [12, 32, 1, 1, 1], [1, 1, 1], [0, 0, 0], [0, 0, 0], "float32"], {}, ["schedule_conv3d_transpose_nchw_cuda", [1, 12, 64, 128, 128], [12, 32, 1, 1, 1], [1, 1, 1], [0, 0, 0], [0, 0, 0], "float32"], {"i": 1288886674, "t": "", "c": null, "e": [["tile_f", "sp", [-1, 1, 2, 2]], ["tile_d", "sp", [-1, 2, 1, 1]], ["tile_y", "sp", [-1, 4, 1, 2]], ["tile_x", "sp", [-1, 8, 1, 1]], ["tile_rc", "sp", [-1, 2]], ["tile_rd", "sp", [-1, 1]], ["tile_ry", "sp", [-1, 1]], ["tile_rx", "sp", [-1, 1]], ["auto_unroll_max_step", "ot", 0], ["unroll_explicit", "ot", 1]]}], "r": [[0.156959967, 0.15680441175], 0, 3.4723076820373535, 1578509047.0468926], "v": 0.1}
{"i": ["cuda", "schedule_conv3d_transpose_nchw_cuda", [[1, 12, 64, 128, 128], [12, 32, 1, 1, 1], [1, 1, 1], [0, 0, 0], [0, 0, 0], "float32"], {}, ["schedule_conv3d_transpose_nchw_cuda", [1, 12, 64, 128, 128], [12, 32, 1, 1, 1], [1, 1, 1], [0, 0, 0], [0, 0, 0], "float32"], {"i": 915059798, "t": "", "c": null, "e": [["tile_f", "sp", [-1, 1, 4, 2]], ["tile_d", "sp", [-1, 2, 1, 1]], ["tile_y", "sp", [-1, 1, 2, 1]], ["tile_x", "sp", [-1, 1, 32, 2]], ["tile_rc", "sp", [-1, 2]], ["tile_rd", "sp", [-1, 1]], ["tile_ry", "sp", [-1, 1]], ["tile_rx", "sp", [-1, 1]], ["auto_unroll_max_step", "ot", 1500], ["unroll_explicit", "ot", 0]]}], "r": [[0.00088948825, 0.00088842975], 0, 0.9957120418548584, 1578509051.365969], "v": 0.1}
{"i": ["cuda", "schedule_conv3d_transpose_nchw_cuda", [[1, 12, 64, 128, 128], [12, 32, 1, 1, 1], [1, 1, 1], [0, 0, 0], [0, 0, 0], "float32"], {}, ["schedule_conv3d_transpose_nchw_cuda", [1, 12, 64, 128, 128], [12, 32, 1, 1, 1], [1, 1, 1], [0, 0, 0], [0, 0, 0], "float32"], {"i": 429128712, "t": "", "c": null, "e": [["tile_f", "sp", [-1, 1, 2, 4]], ["tile_d", "sp", [-1, 1, 1, 2]], ["tile_y", "sp", [-1, 1, 16, 1]], ["tile_x", "sp", [-1, 16, 1, 2]], ["tile_rc", "sp", [-1, 1]], ["tile_rd", "sp", [-1, 1]], ["tile_ry", "sp", [-1, 1]], ["tile_rx", "sp", [-1, 1]], ["auto_unroll_max_step", "ot", 512], ["unroll_explicit", "ot", 0]]}], "r": [[0.00263887175, 0.00265105325], 0, 1.3017642498016357, 1578509052.0022376], "v": 0.1}
{"i": ["cuda", "schedule_conv3d_transpose_nchw_cuda", [[1, 12, 64, 128, 128], [12, 32, 1, 1, 1], [1, 1, 1], [0, 0, 0], [0, 0, 0], "float32"], {}, ["schedule_conv3d_transpose_nchw_cuda", [1, 12, 64, 128, 128], [12, 32, 1, 1, 1], [1, 1, 1], [0, 0, 0], [0, 0, 0], "float32"], {"i": 919177288, "t": "", "c": null, "e": [["tile_f", "sp", [-1, 4, 2, 1]], ["tile_d", "sp", [-1, 1, 1, 2]], ["tile_y", "sp", [-1, 1, 2, 2]], ["tile_x", "sp", [-1, 16, 1, 4]], ["tile_rc", "sp", [-1, 2]], ["tile_rd", "sp", [-1, 1]], ["tile_ry", "sp", [-1, 1]], ["tile_rx", "sp", [-1, 1]], ["auto_unroll_max_step", "ot", 1500], ["unroll_explicit", "ot", 0]]}], "r": [[0.07115849025, 0.0711514835], 0, 5.665375471115112, 1578509054.8134165], "v": 0.1}
{"i": ["cuda", "schedule_conv3d_transpose_nchw_cuda", [[1, 12, 64, 128, 128], [12, 32, 1, 1, 1], [1, 1, 1], [0, 0, 0], [0, 0, 0], "float32"], {}, ["schedule_conv3d_transpose_nchw_cuda", [1, 12, 64, 128, 128], [12, 32, 1, 1, 1], [1, 1, 1], [0, 0, 0], [0, 0, 0], "float32"], {"i": 909581128, "t": "", "c": null, "e": [["tile_f", "sp", [-1, 4, 2, 1]], ["tile_d", "sp", [-1, 1, 1, 2]], ["tile_y", "sp", [-1, 1, 2, 2]], ["tile_x", "sp", [-1, 4, 4, 2]], ["tile_rc", "sp", [-1, 2]], ["tile_rd", "sp", [-1, 1]], ["tile_ry", "sp", [-1, 1]], ["tile_rx", "sp", [-1, 1]], ["auto_unroll_max_step", "ot", 1500], ["unroll_explicit", "ot", 0]]}], "r": [[0.000954226, 0.00095504525], 0, 1.3365967273712158, 1578509055.890017], "v": 0.1}
{"i": ["cuda", "schedule_conv3d_transpose_nchw_cuda", [[1, 12, 64, 128, 128], [12, 32, 1, 1, 1], [1, 1, 1], [0, 0, 0], [0, 0, 0], "float32"], {}, ["schedule_conv3d_transpose_nchw_cuda", [1, 12, 64, 128, 128], [12, 32, 1, 1, 1], [1, 1, 1], [0, 0, 0], [0, 0, 0], "float32"], {"i": 909581122, "t": "", "c": null, "e": [["tile_f", "sp", [-1, 4, 1, 1]], ["tile_d", "sp", [-1, 1, 1, 2]], ["tile_y", "sp", [-1, 1, 2, 2]], ["tile_x", "sp", [-1, 4, 4, 2]], ["tile_rc", "sp", [-1, 2]], ["tile_rd", "sp", [-1, 1]], ["tile_ry", "sp", [-1, 1]], ["tile_rx", "sp", [-1, 1]], ["auto_unroll_max_step", "ot", 1500], ["unroll_explicit", "ot", 0]]}], "r": [[0.00231191275, 0.00231401225], 0, 1.2322635650634766, 1578509056.6060119], "v": 0.1}
{"i": ["cuda", "schedule_conv3d_transpose_nchw_cuda", [[1, 12, 64, 128, 128], [12, 32, 1, 1, 1], [1, 1, 1], [0, 0, 0], [0, 0, 0], "float32"], {}, ["schedule_conv3d_transpose_nchw_cuda", [1, 12, 64, 128, 128], [12, 32, 1, 1, 1], [1, 1, 1], [0, 0, 0], [0, 0, 0], "float32"], {"i": 2032339720, "t": "", "c": null, "e": [["tile_f", "sp", [-1, 1, 2, 4]], ["tile_d", "sp", [-1, 1, 1, 1]], ["tile_y", "sp", [-1, 4, 2, 2]], ["tile_x", "sp", [-1, 1, 1, 1]], ["tile_rc", "sp", [-1, 1]], ["tile_rd", "sp", [-1, 1]], ["tile_ry", "sp", [-1, 1]], ["tile_rx", "sp", [-1, 1]], ["auto_unroll_max_step", "ot", 1500], ["unroll_explicit", "ot", 1]]}], "r": [[0.00415176325, 0.004150775], 0, 1.3461933135986328, 1578509057.3315856], "v": 0.1}
{"i": ["cuda", "schedule_conv3d_transpose_nchw_cuda", [[1, 12, 64, 128, 128], [12, 32, 1, 1, 1], [1, 1, 1], [0, 0, 0], [0, 0, 0], "float32"], {}, ["schedule_conv3d_transpose_nchw_cuda", [1, 12, 64, 128, 128], [12, 32, 1, 1, 1], [1, 1, 1], [0, 0, 0], [0, 0, 0], "float32"], {"i": 1264640265, "t": "", "c": null, "e": [["tile_f", "sp", [-1, 1, 2, 8]], ["tile_d", "sp", [-1, 1, 1, 4]], ["tile_y", "sp", [-1, 1, 2, 2]], ["tile_x", "sp", [-1, 2, 8, 4]], ["tile_rc", "sp", [-1, 1]], ["tile_rd", "sp", [-1, 1]], ["tile_ry", "sp", [-1, 1]], ["tile_rx", "sp", [-1, 1]], ["auto_unroll_max_step", "ot", 0], ["unroll_explicit", "ot", 1]]}], "r": [[0.0101739155, 0.010157163], 0, 1.4961211681365967, 1578509058.0951028], "v": 0.1}
{"i": ["cuda", "schedule_conv3d_transpose_nchw_cuda", [[1, 12, 64, 128, 128], [12, 32, 1, 1, 1], [1, 1, 1], [0, 0, 0], [0, 0, 0], "float32"], {}, ["schedule_conv3d_transpose_nchw_cuda", [1, 12, 64, 128, 128], [12, 32, 1, 1, 1], [1, 1, 1], [0, 0, 0], [0, 0, 0], "float32"], {"i": 985271652, "t": "", "c": null, "e": [["tile_f", "sp", [-1, 1, 1, 4]], ["tile_d", "sp", [-1, 1, 1, 1]], ["tile_y", "sp", [-1, 1, 8, 2]], ["tile_x", "sp", [-1, 2, 1, 4]], ["tile_rc", "sp", [-1, 3]], ["tile_rd", "sp", [-1, 1]], ["tile_ry", "sp", [-1, 1]], ["tile_rx", "sp", [-1, 1]], ["auto_unroll_max_step", "ot", 1500], ["unroll_explicit", "ot", 0]]}], "r": [[0.00296571675, 0.002967108], 0, 1.36318039894104, 1578509059.1335557], "v": 0.1}
{"i": ["cuda", "schedule_conv3d_transpose_nchw_cuda", [[1, 12, 64, 128, 128], [12, 32, 1, 1, 1], [1, 1, 1], [0, 0, 0], [0, 0, 0], "float32"], {}, ["schedule_conv3d_transpose_nchw_cuda", [1, 12, 64, 128, 128], [12, 32, 1, 1, 1], [1, 1, 1], [0, 0, 0], [0, 0, 0], "float32"], {"i": 2046815535, "t": "", "c": null, "e": [["tile_f", "sp", [-1, 4, 1, 2]], ["tile_d", "sp", [-1, 2, 1, 2]], ["tile_y", "sp", [-1, 4, 1, 1]], ["tile_x", "sp", [-1, 1, 16, 1]], ["tile_rc", "sp", [-1, 1]], ["tile_rd", "sp", [-1, 1]], ["tile_ry", "sp", [-1, 1]], ["tile_rx", "sp", [-1, 1]], ["auto_unroll_max_step", "ot", 1500], ["unroll_explicit", "ot", 1]]}], "r": [[0.00117276475, 0.0011709925], 0, 1.1616816520690918, 1578509063.4366822], "v": 0.1}
{"i": ["cuda", "schedule_conv3d_transpose_nchw_cuda", [[1, 12, 64, 128, 128], [12, 32, 1, 1, 1], [1, 1, 1], [0, 0, 0], [0, 0, 0], "float32"], {}, ["schedule_conv3d_transpose_nchw_cuda", [1, 12, 64, 128, 128], [12, 32, 1, 1, 1], [1, 1, 1], [0, 0, 0], [0, 0, 0], "float32"], {"i": 2078627080, "t": "", "c": null, "e": [["tile_f", "sp", [-1, 1, 2, 4]], ["tile_d", "sp", [-1, 1, 1, 1]], ["tile_y", "sp", [-1, 4, 2, 2]], ["tile_x", "sp", [-1, 1, 16, 4]], ["tile_rc", "sp", [-1, 1]], ["tile_rd", "sp", [-1, 1]], ["tile_ry", "sp", [-1, 1]], ["tile_rx", "sp", [-1, 1]], ["auto_unroll_max_step", "ot", 1500], ["unroll_explicit", "ot", 1]]}], "r": [[0.00134658325, 0.001351802], 0, 1.2855281829833984, 1578509064.3284168], "v": 0.1}
{"i": ["cuda", "schedule_conv3d_transpose_nchw_cuda", [[1, 12, 64, 128, 128], [12, 32, 1, 1, 1], [1, 1, 1], [0, 0, 0], [0, 0, 0], "float32"], {}, ["schedule_conv3d_transpose_nchw_cuda", [1, 12, 64, 128, 128], [12, 32, 1, 1, 1], [1, 1, 1], [0, 0, 0], [0, 0, 0], "float32"], {"i": 1424361874, "t": "", "c": null, "e": [["tile_f", "sp", [-1, 1, 2, 2]], ["tile_d", "sp", [-1, 2, 1, 1]], ["tile_y", "sp", [-1, 4, 1, 2]], ["tile_x", "sp", [-1, 8, 1, 1]], ["tile_rc", "sp", [-1, 4]], ["tile_rd", "sp", [-1, 1]], ["tile_ry", "sp", [-1, 1]], ["tile_rx", "sp", [-1, 1]], ["auto_unroll_max_step", "ot", 0], ["unroll_explicit", "ot", 1]]}], "r": [[0.1647262455, 0.16547962225], 0, 3.2919976711273193, 1578509066.8688834], "v": 0.1}
{"i": ["cuda", "schedule_conv3d_transpose_nchw_cuda", [[1, 12, 64, 128, 128], [12, 32, 1, 1, 1], [1, 1, 1], [0, 0, 0], [0, 0, 0], "float32"], {}, ["schedule_conv3d_transpose_nchw_cuda", [1, 12, 64, 128, 128], [12, 32, 1, 1, 1], [1, 1, 1], [0, 0, 0], [0, 0, 0], "float32"], {"i": 1647323711, "t": "", "c": null, "e": [["tile_f", "sp", [-1, 2, 1, 8]], ["tile_d", "sp", [-1, 4, 1, 2]], ["tile_y", "sp", [-1, 1, 1, 2]], ["tile_x", "sp", [-1, 4, 1, 2]], ["tile_rc", "sp", [-1, 1]], ["tile_rd", "sp", [-1, 1]], ["tile_ry", "sp", [-1, 1]], ["tile_rx", "sp", [-1, 1]], ["auto_unroll_max_step", "ot", 512], ["unroll_explicit", "ot", 1]]}], "r": [[0.25369068025, 0.25372794425], 0, 4.949716567993164, 1578509069.96732], "v": 0.1}
{"i": ["cuda", "schedule_conv3d_transpose_nchw_cuda", [[1, 12, 64, 128, 128], [12, 32, 1, 1, 1], [1, 1, 1], [0, 0, 0], [0, 0, 0], "float32"], {}, ["schedule_conv3d_transpose_nchw_cuda", [1, 12, 64, 128, 128], [12, 32, 1, 1, 1], [1, 1, 1], [0, 0, 0], [0, 0, 0], "float32"], {"i": 2046815528, "t": "", "c": null, "e": [["tile_f", "sp", [-1, 2, 8, 1]], ["tile_d", "sp", [-1, 2, 1, 2]], ["tile_y", "sp", [-1, 4, 1, 1]], ["tile_x", "sp", [-1, 1, 16, 1]], ["tile_rc", "sp", [-1, 1]], ["tile_rd", "sp", [-1, 1]], ["tile_ry", "sp", [-1, 1]], ["tile_rx", "sp", [-1, 1]], ["auto_unroll_max_step", "ot", 1500], ["unroll_explicit", "ot", 1]]}], "r": [[0.00068303575, 0.00067576075], 0, 1.33180832862854, 1578509070.6510446], "v": 0.1}
{"i": ["cuda", "schedule_conv3d_transpose_nchw_cuda", [[1, 12, 64, 128, 128], [12, 32, 1, 1, 1], [1, 1, 1], [0, 0, 0], [0, 0, 0], "float32"], {}, ["schedule_conv3d_transpose_nchw_cuda", [1, 12, 64, 128, 128], [12, 32, 1, 1, 1], [1, 1, 1], [0, 0, 0], [0, 0, 0], "float32"], {"i": 1662000191, "t": "", "c": null, "e": [["tile_f", "sp", [-1, 2, 1, 8]], ["tile_d", "sp", [-1, 4, 1, 2]], ["tile_y", "sp", [-1, 1, 1, 2]], ["tile_x", "sp", [-1, 1, 1, 4]], ["tile_rc", "sp", [-1, 1]], ["tile_rd", "sp", [-1, 1]], ["tile_ry", "sp", [-1, 1]], ["tile_rx", "sp", [-1, 1]], ["auto_unroll_max_step", "ot", 512], ["unroll_explicit", "ot", 1]]}], "r": [[0.22907502, 0.2289051335], 0, 3.654074192047119, 1578509073.3954358], "v": 0.1}
{"i": ["cuda", "schedule_conv3d_transpose_nchw_cuda", [[1, 12, 64, 128, 128], [12, 32, 1, 1, 1], [1, 1, 1], [0, 0, 0], [0, 0, 0], "float32"], {}, ["schedule_conv3d_transpose_nchw_cuda", [1, 12, 64, 128, 128], [12, 32, 1, 1, 1], [1, 1, 1], [0, 0, 0], [0, 0, 0], "float32"], {"i": 835554324, "t": "", "c": null, "e": [["tile_f", "sp", [-1, 1, 1, 16]], ["tile_d", "sp", [-1, 1, 1, 2]], ["tile_y", "sp", [-1, 1, 16, 1]], ["tile_x", "sp", [-1, 16, 1, 2]], ["tile_rc", "sp", [-1, 1]], ["tile_rd", "sp", [-1, 1]], ["tile_ry", "sp", [-1, 1]], ["tile_rx", "sp", [-1, 1]], ["auto_unroll_max_step", "ot", 1500], ["unroll_explicit", "ot", 0]]}], "r": [[0.01928420075, 0.019300095], 0, 3.909632444381714, 1578509074.917619], "v": 0.1}
{"i": ["cuda", "schedule_conv3d_transpose_nchw_cuda", [[1, 12, 64, 128, 128], [12, 32, 1, 1, 1], [1, 1, 1], [0, 0, 0], [0, 0, 0], "float32"], {}, ["schedule_conv3d_transpose_nchw_cuda", [1, 12, 64, 128, 128], [12, 32, 1, 1, 1], [1, 1, 1], [0, 0, 0], [0, 0, 0], "float32"], {"i": 1830787474, "t": "", "c": null, "e": [["tile_f", "sp", [-1, 1, 2, 2]], ["tile_d", "sp", [-1, 2, 1, 1]], ["tile_y", "sp", [-1, 4, 1, 2]], ["tile_x", "sp", [-1, 8, 1, 1]], ["tile_rc", "sp", [-1, 4]], ["tile_rd", "sp", [-1, 1]], ["tile_ry", "sp", [-1, 1]], ["tile_rx", "sp", [-1, 1]], ["auto_unroll_max_step", "ot", 512], ["unroll_explicit", "ot", 1]]}], "r": [[0.0451671575, 0.044768613], 0, 3.2411580085754395, 1578509076.7928872], "v": 0.1}
{"i": ["cuda", "schedule_conv3d_transpose_nchw_cuda", [[1, 12, 64, 128, 128], [12, 32, 1, 1, 1], [1, 1, 1], [0, 0, 0], [0, 0, 0], "float32"], {}, ["schedule_conv3d_transpose_nchw_cuda", [1, 12, 64, 128, 128], [12, 32, 1, 1, 1], [1, 1, 1], [0, 0, 0], [0, 0, 0], "float32"], {"i": 1264641105, "t": "", "c": null, "e": [["tile_f", "sp", [-1, 1, 2, 8]], ["tile_d", "sp", [-1, 1, 1, 8]], ["tile_y", "sp", [-1, 1, 2, 2]], ["tile_x", "sp", [-1, 2, 8, 4]], ["tile_rc", "sp", [-1, 1]], ["tile_rd", "sp", [-1, 1]], ["tile_ry", "sp", [-1, 1]], ["tile_rx", "sp", [-1, 1]], ["auto_unroll_max_step", "ot", 0], ["unroll_explicit", "ot", 1]]}], "r": [[0.01009334325, 0.01008986675], 0, 1.8045713901519775, 1578509087.379065], "v": 0.1}
{"i": ["cuda", "schedule_conv3d_transpose_nchw_cuda", [[1, 12, 64, 128, 128], [12, 32, 1, 1, 1], [1, 1, 1], [0, 0, 0], [0, 0, 0], "float32"], {}, ["schedule_conv3d_transpose_nchw_cuda", [1, 12, 64, 128, 128], [12, 32, 1, 1, 1], [1, 1, 1], [0, 0, 0], [0, 0, 0], "float32"], {"i": 2101006724, "t": "", "c": null, "e": [["tile_f", "sp", [-1, 2, 4, 1]], ["tile_d", "sp", [-1, 1, 1, 4]], ["tile_y", "sp", [-1, 4, 1, 1]], ["tile_x", "sp", [-1, 4, 1, 1]], ["tile_rc", "sp", [-1, 2]], ["tile_rd", "sp", [-1, 1]], ["tile_ry", "sp", [-1, 1]], ["tile_rx", "sp", [-1, 1]], ["auto_unroll_max_step", "ot", 1500], ["unroll_explicit", "ot", 1]]}], "r": [[0.00378526775, 0.00378290875], 0, 1.4935972690582275, 1578509088.0856712], "v": 0.1}
{"i": ["cuda", "schedule_conv3d_transpose_nchw_cuda", [[1, 12, 64, 128, 128], [12, 32, 1, 1, 1], [1, 1, 1], [0, 0, 0], [0, 0, 0], "float32"], {}, ["schedule_conv3d_transpose_nchw_cuda", [1, 12, 64, 128, 128], [12, 32, 1, 1, 1], [1, 1, 1], [0, 0, 0], [0, 0, 0], "float32"], {"i": 2134336598, "t": "", "c": null, "e": [["tile_f", "sp", [-1, 1, 4, 2]], ["tile_d", "sp", [-1, 2, 1, 1]], ["tile_y", "sp", [-1, 1, 2, 1]], ["tile_x", "sp", [-1, 1, 32, 2]], ["tile_rc", "sp", [-1, 2]], ["tile_rd", "sp", [-1, 1]], ["tile_ry", "sp", [-1, 1]], ["tile_rx", "sp", [-1, 1]], ["auto_unroll_max_step", "ot", 1500], ["unroll_explicit", "ot", 1]]}], "r": [[0.00090081225, 0.00089927925], 0, 1.09549880027771, 1578509088.7123227], "v": 0.1}
{"i": ["cuda", "schedule_conv3d_transpose_nchw_cuda", [[1, 12, 64, 128, 128], [12, 32, 1, 1, 1], [1, 1, 1], [0, 0, 0], [0, 0, 0], "float32"], {}, ["schedule_conv3d_transpose_nchw_cuda", [1, 12, 64, 128, 128], [12, 32, 1, 1, 1], [1, 1, 1], [0, 0, 0], [0, 0, 0], "float32"], {"i": 870075407, "t": "", "c": null, "e": [["tile_f", "sp", [-1, 2, 1, 8]], ["tile_d", "sp", [-1, 1, 1, 1]], ["tile_y", "sp", [-1, 4, 2, 2]], ["tile_x", "sp", [-1, 2, 1, 16]], ["tile_rc", "sp", [-1, 1]], ["tile_rd", "sp", [-1, 1]], ["tile_ry", "sp", [-1, 1]], ["tile_rx", "sp", [-1, 1]], ["auto_unroll_max_step", "ot", 1500], ["unroll_explicit", "ot", 0]]}], "r": [[0.147728096, 0.1476997255], 0, 5.225602626800537, 1578509091.215535], "v": 0.1}
{"i": ["cuda", "schedule_conv3d_transpose_nchw_cuda", [[1, 12, 64, 128, 128], [12, 32, 1, 1, 1], [1, 1, 1], [0, 0, 0], [0, 0, 0], "float32"], {}, ["schedule_conv3d_transpose_nchw_cuda", [1, 12, 64, 128, 128], [12, 32, 1, 1, 1], [1, 1, 1], [0, 0, 0], [0, 0, 0], "float32"], {"i": 1665951551, "t": "", "c": null, "e": [["tile_f", "sp", [-1, 2, 1, 8]], ["tile_d", "sp", [-1, 4, 1, 2]], ["tile_y", "sp", [-1, 1, 1, 2]], ["tile_x", "sp", [-1, 2, 2, 4]], ["tile_rc", "sp", [-1, 1]], ["tile_rd", "sp", [-1, 1]], ["tile_ry", "sp", [-1, 1]], ["tile_rx", "sp", [-1, 1]], ["auto_unroll_max_step", "ot", 512], ["unroll_explicit", "ot", 1]]}], "r": [[0.11911971275, 0.1190459215], 0, 3.705359697341919, 1578509093.2655022], "v": 0.1}
{"i": ["cuda", "schedule_conv3d_transpose_nchw_cuda", [[1, 12, 64, 128, 128], [12, 32, 1, 1, 1], [1, 1, 1], [0, 0, 0], [0, 0, 0], "float32"], {}, ["schedule_conv3d_transpose_nchw_cuda", [1, 12, 64, 128, 128], [12, 32, 1, 1, 1], [1, 1, 1], [0, 0, 0], [0, 0, 0], "float32"], {"i": 919177283, "t": "", "c": null, "e": [["tile_f", "sp", [-1, 8, 1, 1]], ["tile_d", "sp", [-1, 1, 1, 2]], ["tile_y", "sp", [-1, 1, 2, 2]], ["tile_x", "sp", [-1, 16, 1, 4]], ["tile_rc", "sp", [-1, 2]], ["tile_rd", "sp", [-1, 1]], ["tile_ry", "sp", [-1, 1]], ["tile_rx", "sp", [-1, 1]], ["auto_unroll_max_step", "ot", 1500], ["unroll_explicit", "ot", 0]]}], "r": [[0.24211577075, 0.2417364895], 0, 12.649761199951172, 1578509097.5103517], "v": 0.1}
{"i": ["cuda", "schedule_conv3d_transpose_nchw_cuda", [[1, 12, 64, 128, 128], [12, 32, 1, 1, 1], [1, 1, 1], [0, 0, 0], [0, 0, 0], "float32"], {}, ["schedule_conv3d_transpose_nchw_cuda", [1, 12, 64, 128, 128], [12, 32, 1, 1, 1], [1, 1, 1], [0, 0, 0], [0, 0, 0], "float32"], {"i": 1264641060, "t": "", "c": null, "e": [["tile_f", "sp", [-1, 16, 1, 1]], ["tile_d", "sp", [-1, 1, 1, 8]], ["tile_y", "sp", [-1, 1, 2, 2]], ["tile_x", "sp", [-1, 2, 8, 4]], ["tile_rc", "sp", [-1, 1]], ["tile_rd", "sp", [-1, 1]], ["tile_ry", "sp", [-1, 1]], ["tile_rx", "sp", [-1, 1]], ["auto_unroll_max_step", "ot", 0], ["unroll_explicit", "ot", 1]]}], "r": [[0.019386678, 0.01938465575], 0, 3.900947332382202, 1578509098.4272656], "v": 0.1}
{"i": ["cuda", "schedule_conv3d_transpose_nchw_cuda", [[1, 12, 64, 128, 128], [12, 32, 1, 1, 1], [1, 1, 1], [0, 0, 0], [0, 0, 0], "float32"], {}, ["schedule_conv3d_transpose_nchw_cuda", [1, 12, 64, 128, 128], [12, 32, 1, 1, 1], [1, 1, 1], [0, 0, 0], [0, 0, 0], "float32"], {"i": 1642807871, "t": "", "c": null, "e": [["tile_f", "sp", [-1, 2, 1, 8]], ["tile_d", "sp", [-1, 4, 1, 2]], ["tile_y", "sp", [-1, 1, 1, 2]], ["tile_x", "sp", [-1, 1, 32, 1]], ["tile_rc", "sp", [-1, 1]], ["tile_rd", "sp", [-1, 1]], ["tile_ry", "sp", [-1, 1]], ["tile_rx", "sp", [-1, 1]], ["auto_unroll_max_step", "ot", 512], ["unroll_explicit", "ot", 1]]}], "r": [[0.00103346325, 0.00103314275], 0, 1.5566768646240234, 1578509099.137888], "v": 0.1}
{"i": ["cuda", "schedule_conv3d_transpose_nchw_cuda", [[1, 12, 64, 128, 128], [12, 32, 1, 1, 1], [1, 1, 1], [0, 0, 0], [0, 0, 0], "float32"], {}, ["schedule_conv3d_transpose_nchw_cuda", [1, 12, 64, 128, 128], [12, 32, 1, 1, 1], [1, 1, 1], [0, 0, 0], [0, 0, 0], "float32"], {"i": 857484351, "t": "", "c": null, "e": [["tile_f", "sp", [-1, 2, 4, 2]], ["tile_d", "sp", [-1, 1, 1, 2]], ["tile_y", "sp", [-1, 1, 2, 1]], ["tile_x", "sp", [-1, 1, 8, 4]], ["tile_rc", "sp", [-1, 1]], ["tile_rd", "sp", [-1, 1]], ["tile_ry", "sp", [-1, 1]], ["tile_rx", "sp", [-1, 1]], ["auto_unroll_max_step", "ot", 1500], ["unroll_explicit", "ot", 0]]}], "r": [[0.001037073, 0.00103706225], 0, 1.2507457733154297, 1578509309.864636], "v": 0.1}
{"i": ["cuda", "schedule_conv3d_transpose_nchw_cuda", [[1, 12, 64, 128, 128], [12, 32, 1, 1, 1], [1, 1, 1], [0, 0, 0], [0, 0, 0], "float32"], {}, ["schedule_conv3d_transpose_nchw_cuda", [1, 12, 64, 128, 128], [12, 32, 1, 1, 1], [1, 1, 1], [0, 0, 0], [0, 0, 0], "float32"], {"i": 451058751, "t": "", "c": null, "e": [["tile_f", "sp", [-1, 2, 4, 2]], ["tile_d", "sp", [-1, 1, 1, 2]], ["tile_y", "sp", [-1, 1, 2, 1]], ["tile_x", "sp", [-1, 1, 8, 4]], ["tile_rc", "sp", [-1, 1]], ["tile_rd", "sp", [-1, 1]], ["tile_ry", "sp", [-1, 1]], ["tile_rx", "sp", [-1, 1]], ["auto_unroll_max_step", "ot", 512], ["unroll_explicit", "ot", 0]]}], "r": [[0.00103871475, 0.00102613825], 0, 1.211263656616211, 1578509310.4740324], "v": 0.1}
{"i": ["cuda", "schedule_conv3d_transpose_nchw_cuda", [[1, 12, 64, 128, 128], [12, 32, 1, 1, 1], [1, 1, 1], [0, 0, 0], [0, 0, 0], "float32"], {}, ["schedule_conv3d_transpose_nchw_cuda", [1, 12, 64, 128, 128], [12, 32, 1, 1, 1], [1, 1, 1], [0, 0, 0], [0, 0, 0], "float32"], {"i": 2076761151, "t": "", "c": null, "e": [["tile_f", "sp", [-1, 2, 4, 2]], ["tile_d", "sp", [-1, 1, 1, 2]], ["tile_y", "sp", [-1, 1, 2, 1]], ["tile_x", "sp", [-1, 1, 8, 4]], ["tile_rc", "sp", [-1, 1]], ["tile_rd", "sp", [-1, 1]], ["tile_ry", "sp", [-1, 1]], ["tile_rx", "sp", [-1, 1]], ["auto_unroll_max_step", "ot", 1500], ["unroll_explicit", "ot", 1]]}], "r": [[0.00102693725, 0.0010275205], 0, 1.474757432937622, 1578509311.1560965], "v": 0.1}
{"i": ["cuda", "schedule_conv3d_transpose_nchw_cuda", [[1, 12, 64, 128, 128], [12, 32, 1, 1, 1], [1, 1, 1], [0, 0, 0], [0, 0, 0], "float32"], {}, ["schedule_conv3d_transpose_nchw_cuda", [1, 12, 64, 128, 128], [12, 32, 1, 1, 1], [1, 1, 1], [0, 0, 0], [0, 0, 0], "float32"], {"i": 1670335551, "t": "", "c": null, "e": [["tile_f", "sp", [-1, 2, 4, 2]], ["tile_d", "sp", [-1, 1, 1, 2]], ["tile_y", "sp", [-1, 1, 2, 1]], ["tile_x", "sp", [-1, 1, 8, 4]], ["tile_rc", "sp", [-1, 1]], ["tile_rd", "sp", [-1, 1]], ["tile_ry", "sp", [-1, 1]], ["tile_rx", "sp", [-1, 1]], ["auto_unroll_max_step", "ot", 512], ["unroll_explicit", "ot", 1]]}], "r": [[0.00103848025, 0.00102493525], 0, 1.4385578632354736, 1578509311.795686], "v": 0.1}
{"i": ["cuda", "schedule_conv3d_transpose_nchw_cuda", [[1, 12, 64, 128, 128], [12, 32, 1, 1, 1], [1, 1, 1], [0, 0, 0], [0, 0, 0], "float32"], {}, ["schedule_conv3d_transpose_nchw_cuda", [1, 12, 64, 128, 128], [12, 32, 1, 1, 1], [1, 1, 1], [0, 0, 0], [0, 0, 0], "float32"], {"i": 846226120, "t": "", "c": null, "e": [["tile_f", "sp", [-1, 1, 2, 4]], ["tile_d", "sp", [-1, 1, 1, 1]], ["tile_y", "sp", [-1, 1, 4, 1]], ["tile_x", "sp", [-1, 2, 16, 2]], ["tile_rc", "sp", [-1, 1]], ["tile_rd", "sp", [-1, 1]], ["tile_ry", "sp", [-1, 1]], ["tile_rx", "sp", [-1, 1]], ["auto_unroll_max_step", "ot", 1500], ["unroll_explicit", "ot", 0]]}], "r": [[0.00094371475, 0.000941547], 0, 1.1848101615905762, 1578509312.4601364], "v": 0.1}
{"i": ["cuda", "schedule_conv3d_transpose_nchw_cuda", [[1, 12, 64, 128, 128], [12, 32, 1, 1, 1], [1, 1, 1], [0, 0, 0], [0, 0, 0], "float32"], {}, ["schedule_conv3d_transpose_nchw_cuda", [1, 12, 64, 128, 128], [12, 32, 1, 1, 1], [1, 1, 1], [0, 0, 0], [0, 0, 0], "float32"], {"i": 439800520, "t": "", "c": null, "e": [["tile_f", "sp", [-1, 1, 2, 4]], ["tile_d", "sp", [-1, 1, 1, 1]], ["tile_y", "sp", [-1, 1, 4, 1]], ["tile_x", "sp", [-1, 2, 16, 2]], ["tile_rc", "sp", [-1, 1]], ["tile_rd", "sp", [-1, 1]], ["tile_ry", "sp", [-1, 1]], ["tile_rx", "sp", [-1, 1]], ["auto_unroll_max_step", "ot", 512], ["unroll_explicit", "ot", 0]]}], "r": [[0.00097865175, 0.00094671275], 0, 1.1533987522125244, 1578509313.0851264], "v": 0.1}
{"i": ["cuda", "schedule_conv3d_transpose_nchw_cuda", [[1, 12, 64, 128, 128], [12, 32, 1, 1, 1], [1, 1, 1], [0, 0, 0], [0, 0, 0], "float32"], {}, ["schedule_conv3d_transpose_nchw_cuda", [1, 12, 64, 128, 128], [12, 32, 1, 1, 1], [1, 1, 1], [0, 0, 0], [0, 0, 0], "float32"], {"i": 1659077320, "t": "", "c": null, "e": [["tile_f", "sp", [-1, 1, 2, 4]], ["tile_d", "sp", [-1, 1, 1, 1]], ["tile_y", "sp", [-1, 1, 4, 1]], ["tile_x", "sp", [-1, 2, 16, 2]], ["tile_rc", "sp", [-1, 1]], ["tile_rd", "sp", [-1, 1]], ["tile_ry", "sp", [-1, 1]], ["tile_rx", "sp", [-1, 1]], ["auto_unroll_max_step", "ot", 512], ["unroll_explicit", "ot", 1]]}], "r": [[0.00094071675, 0.00093893775], 0, 1.371643304824829, 1578509313.7608526], "v": 0.1}
{"i": ["cuda", "schedule_conv3d_transpose_nchw_cuda", [[1, 12, 64, 128, 128], [12, 32, 1, 1, 1], [1, 1, 1], [0, 0, 0], [0, 0, 0], "float32"], {}, ["schedule_conv3d_transpose_nchw_cuda", [1, 12, 64, 128, 128], [12, 32, 1, 1, 1], [1, 1, 1], [0, 0, 0], [0, 0, 0], "float32"], {"i": 845630280, "t": "", "c": null, "e": [["tile_f", "sp", [-1, 1, 2, 4]], ["tile_d", "sp", [-1, 1, 1, 2]], ["tile_y", "sp", [-1, 1, 2, 1]], ["tile_x", "sp", [-1, 1, 16, 2]], ["tile_rc", "sp", [-1, 1]], ["tile_rd", "sp", [-1, 1]], ["tile_ry", "sp", [-1, 1]], ["tile_rx", "sp", [-1, 1]], ["auto_unroll_max_step", "ot", 1500], ["unroll_explicit", "ot", 0]]}], "r": [[0.00093930025, 0.0009418785], 0, 1.2646901607513428, 1578509314.4158797], "v": 0.1}
{"i": ["cuda", "schedule_conv3d_transpose_nchw_cuda", [[1, 12, 64, 128, 128], [12, 32, 1, 1, 1], [1, 1, 1], [0, 0, 0], [0, 0, 0], "float32"], {}, ["schedule_conv3d_transpose_nchw_cuda", [1, 12, 64, 128, 128], [12, 32, 1, 1, 1], [1, 1, 1], [0, 0, 0], [0, 0, 0], "float32"], {"i": 439204680, "t": "", "c": null, "e": [["tile_f", "sp", [-1, 1, 2, 4]], ["tile_d", "sp", [-1, 1, 1, 2]], ["tile_y", "sp", [-1, 1, 2, 1]], ["tile_x", "sp", [-1, 1, 16, 2]], ["tile_rc", "sp", [-1, 1]], ["tile_rd", "sp", [-1, 1]], ["tile_ry", "sp", [-1, 1]], ["tile_rx", "sp", [-1, 1]], ["auto_unroll_max_step", "ot", 512], ["unroll_explicit", "ot", 0]]}], "r": [[0.00097566475, 0.00093946625], 0, 1.19480299949646, 1578509315.0243907], "v": 0.1}
{"i": ["cuda", "schedule_conv3d_transpose_nchw_cuda", [[1, 12, 64, 128, 128], [12, 32, 1, 1, 1], [1, 1, 1], [0, 0, 0], [0, 0, 0], "float32"], {}, ["schedule_conv3d_transpose_nchw_cuda", [1, 12, 64, 128, 128], [12, 32, 1, 1, 1], [1, 1, 1], [0, 0, 0], [0, 0, 0], "float32"], {"i": 1658481480, "t": "", "c": null, "e": [["tile_f", "sp", [-1, 1, 2, 4]], ["tile_d", "sp", [-1, 1, 1, 2]], ["tile_y", "sp", [-1, 1, 2, 1]], ["tile_x", "sp", [-1, 1, 16, 2]], ["tile_rc", "sp", [-1, 1]], ["tile_rd", "sp", [-1, 1]], ["tile_ry", "sp", [-1, 1]], ["tile_rx", "sp", [-1, 1]], ["auto_unroll_max_step", "ot", 512], ["unroll_explicit", "ot", 1]]}], "r": [[0.000933425, 0.000932506], 0, 1.3466567993164062, 1578509315.6882641], "v": 0.1}
{"i": ["cuda", "schedule_conv3d_transpose_nchw_cuda", [[1, 12, 64, 128, 128], [12, 32, 1, 1, 1], [1, 1, 1], [0, 0, 0], [0, 0, 0], "float32"], {}, ["schedule_conv3d_transpose_nchw_cuda", [1, 12, 64, 128, 128], [12, 32, 1, 1, 1], [1, 1, 1], [0, 0, 0], [0, 0, 0], "float32"], {"i": 2064907080, "t": "", "c": null, "e": [["tile_f", "sp", [-1, 1, 2, 4]], ["tile_d", "sp", [-1, 1, 1, 2]], ["tile_y", "sp", [-1, 1, 2, 1]], ["tile_x", "sp", [-1, 1, 16, 2]], ["tile_rc", "sp", [-1, 1]], ["tile_rd", "sp", [-1, 1]], ["tile_ry", "sp", [-1, 1]], ["tile_rx", "sp", [-1, 1]], ["auto_unroll_max_step", "ot", 1500], ["unroll_explicit", "ot", 1]]}], "r": [[0.00097138925, 0.00093509425], 0, 1.1912338733673096, 1578509316.2976413], "v": 0.1}
{"i": ["cuda", "schedule_conv3d_transpose_nchw_cuda", [[1, 12, 64, 128, 128], [12, 32, 1, 1, 1], [1, 1, 1], [0, 0, 0], [0, 0, 0], "float32"], {}, ["schedule_conv3d_transpose_nchw_cuda", [1, 12, 64, 128, 128], [12, 32, 1, 1, 1], [1, 1, 1], [0, 0, 0], [0, 0, 0], "float32"], {"i": 451058763, "t": "", "c": null, "e": [["tile_f", "sp", [-1, 1, 4, 4]], ["tile_d", "sp", [-1, 1, 1, 2]], ["tile_y", "sp", [-1, 1, 2, 1]], ["tile_x", "sp", [-1, 1, 8, 4]], ["tile_rc", "sp", [-1, 1]], ["tile_rd", "sp", [-1, 1]], ["tile_ry", "sp", [-1, 1]], ["tile_rx", "sp", [-1, 1]], ["auto_unroll_max_step", "ot", 512], ["unroll_explicit", "ot", 0]]}], "r": [[0.0010417285, 0.00104011125], 0, 1.200359582901001, 1578509316.9944441], "v": 0.1}
{"i": ["cuda", "schedule_conv3d_transpose_nchw_cuda", [[1, 12, 64, 128, 128], [12, 32, 1, 1, 1], [1, 1, 1], [0, 0, 0], [0, 0, 0], "float32"], {}, ["schedule_conv3d_transpose_nchw_cuda", [1, 12, 64, 128, 128], [12, 32, 1, 1, 1], [1, 1, 1], [0, 0, 0], [0, 0, 0], "float32"], {"i": 829824831, "t": "", "c": null, "e": [["tile_f", "sp", [-1, 2, 4, 2]], ["tile_d", "sp", [-1, 1, 1, 2]], ["tile_y", "sp", [-1, 1, 2, 1]], ["tile_x", "sp", [-1, 1, 32, 1]], ["tile_rc", "sp", [-1, 1]], ["tile_rd", "sp", [-1, 1]], ["tile_ry", "sp", [-1, 1]], ["tile_rx", "sp", [-1, 1]], ["auto_unroll_max_step", "ot", 1500], ["unroll_explicit", "ot", 0]]}], "r": [[0.00117631125, 0.00117601325], 0, 1.028799295425415, 1578509319.5875247], "v": 0.1}
{"i": ["cuda", "schedule_conv3d_transpose_nchw_cuda", [[1, 12, 64, 128, 128], [12, 32, 1, 1, 1], [1, 1, 1], [0, 0, 0], [0, 0, 0], "float32"], {}, ["schedule_conv3d_transpose_nchw_cuda", [1, 12, 64, 128, 128], [12, 32, 1, 1, 1], [1, 1, 1], [0, 0, 0], [0, 0, 0], "float32"], {"i": 423399231, "t": "", "c": null, "e": [["tile_f", "sp", [-1, 2, 4, 2]], ["tile_d", "sp", [-1, 1, 1, 2]], ["tile_y", "sp", [-1, 1, 2, 1]], ["tile_x", "sp", [-1, 1, 32, 1]], ["tile_rc", "sp", [-1, 1]], ["tile_rd", "sp", [-1, 1]], ["tile_ry", "sp", [-1, 1]], ["tile_rx", "sp", [-1, 1]], ["auto_unroll_max_step", "ot", 512], ["unroll_explicit", "ot", 0]]}], "r": [[0.00117679575, 0.00117022325], 0, 0.9617722034454346, 1578509320.165246], "v": 0.1}
{"i": ["cuda", "schedule_conv3d_transpose_nchw_cuda", [[1, 12, 64, 128, 128], [12, 32, 1, 1, 1], [1, 1, 1], [0, 0, 0], [0, 0, 0], "float32"], {}, ["schedule_conv3d_transpose_nchw_cuda", [1, 12, 64, 128, 128], [12, 32, 1, 1, 1], [1, 1, 1], [0, 0, 0], [0, 0, 0], "float32"], {"i": 2049101631, "t": "", "c": null, "e": [["tile_f", "sp", [-1, 2, 4, 2]], ["tile_d", "sp", [-1, 1, 1, 2]], ["tile_y", "sp", [-1, 1, 2, 1]], ["tile_x", "sp", [-1, 1, 32, 1]], ["tile_rc", "sp", [-1, 1]], ["tile_rd", "sp", [-1, 1]], ["tile_ry", "sp", [-1, 1]], ["tile_rx", "sp", [-1, 1]], ["auto_unroll_max_step", "ot", 1500], ["unroll_explicit", "ot", 1]]}], "r": [[0.00113072925, 0.001129775], 0, 1.178452730178833, 1578509320.800438], "v": 0.1}
{"i": ["cuda", "schedule_conv3d_transpose_nchw_cuda", [[1, 12, 64, 128, 128], [12, 32, 1, 1, 1], [1, 1, 1], [0, 0, 0], [0, 0, 0], "float32"], {}, ["schedule_conv3d_transpose_nchw_cuda", [1, 12, 64, 128, 128], [12, 32, 1, 1, 1], [1, 1, 1], [0, 0, 0], [0, 0, 0], "float32"], {"i": 1642676031, "t": "", "c": null, "e": [["tile_f", "sp", [-1, 2, 4, 2]], ["tile_d", "sp", [-1, 1, 1, 2]], ["tile_y", "sp", [-1, 1, 2, 1]], ["tile_x", "sp", [-1, 1, 32, 1]], ["tile_rc", "sp", [-1, 1]], ["tile_rd", "sp", [-1, 1]], ["tile_ry", "sp", [-1, 1]], ["tile_rx", "sp", [-1, 1]], ["auto_unroll_max_step", "ot", 512], ["unroll_explicit", "ot", 1]]}], "r": [[0.00114131725, 0.00113336275], 0, 1.1795954704284668, 1578509321.4297965], "v": 0.1}
{"i": ["cuda", "schedule_conv3d_transpose_nchw_cuda", [[1, 12, 64, 128, 128], [12, 32, 1, 1, 1], [1, 1, 1], [0, 0, 0], [0, 0, 0], "float32"], {}, ["schedule_conv3d_transpose_nchw_cuda", [1, 12, 64, 128, 128], [12, 32, 1, 1, 1], [1, 1, 1], [0, 0, 0], [0, 0, 0], "float32"], {"i": 913367870, "t": "", "c": null, "e": [["tile_f", "sp", [-1, 1, 4, 2]], ["tile_d", "sp", [-1, 1, 1, 2]], ["tile_y", "sp", [-1, 1, 2, 1]], ["tile_x", "sp", [-1, 1, 16, 2]], ["tile_rc", "sp", [-1, 2]], ["tile_rd", "sp", [-1, 1]], ["tile_ry", "sp", [-1, 1]], ["tile_rx", "sp", [-1, 1]], ["auto_unroll_max_step", "ot", 1500], ["unroll_explicit", "ot", 0]]}], "r": [[0.0009140825, 0.00091417775], 0, 1.1526496410369873, 1578509322.091069], "v": 0.1}
{"i": ["cuda", "schedule_conv3d_transpose_nchw_cuda", [[1, 12, 64, 128, 128], [12, 32, 1, 1, 1], [1, 1, 1], [0, 0, 0], [0, 0, 0], "float32"], {}, ["schedule_conv3d_transpose_nchw_cuda", [1, 12, 64, 128, 128], [12, 32, 1, 1, 1], [1, 1, 1], [0, 0, 0], [0, 0, 0], "float32"], {"i": 2132644670, "t": "", "c": null, "e": [["tile_f", "sp", [-1, 1, 4, 2]], ["tile_d", "sp", [-1, 1, 1, 2]], ["tile_y", "sp", [-1, 1, 2, 1]], ["tile_x", "sp", [-1, 1, 16, 2]], ["tile_rc", "sp", [-1, 2]], ["tile_rd", "sp", [-1, 1]], ["tile_ry", "sp", [-1, 1]], ["tile_rx", "sp", [-1, 1]], ["auto_unroll_max_step", "ot", 1500], ["unroll_explicit", "ot", 1]]}], "r": [[0.0009297035, 0.000931977], 0, 1.1680176258087158, 1578509322.7262542], "v": 0.1}
{"i": ["cuda", "schedule_conv3d_transpose_nchw_cuda", [[1, 12, 64, 128, 128], [12, 32, 1, 1, 1], [1, 1, 1], [0, 0, 0], [0, 0, 0], "float32"], {}, ["schedule_conv3d_transpose_nchw_cuda", [1, 12, 64, 128, 128], [12, 32, 1, 1, 1], [1, 1, 1], [0, 0, 0], [0, 0, 0], "float32"], {"i": 439204681, "t": "", "c": null, "e": [["tile_f", "sp", [-1, 2, 2, 4]], ["tile_d", "sp", [-1, 1, 1, 2]], ["tile_y", "sp", [-1, 1, 2, 1]], ["tile_x", "sp", [-1, 1, 16, 2]], ["tile_rc", "sp", [-1, 1]], ["tile_rd", "sp", [-1, 1]], ["tile_ry", "sp", [-1, 1]], ["tile_rx", "sp", [-1, 1]], ["auto_unroll_max_step", "ot", 512], ["unroll_explicit", "ot", 0]]}], "r": [[0.000690079, 0.00068808125], 0, 1.304349422454834, 1578509323.438405], "v": 0.1}
{"i": ["cuda", "schedule_conv3d_transpose_nchw_cuda", [[1, 12, 64, 128, 128], [12, 32, 1, 1, 1], [1, 1, 1], [0, 0, 0], [0, 0, 0], "float32"], {}, ["schedule_conv3d_transpose_nchw_cuda", [1, 12, 64, 128, 128], [12, 32, 1, 1, 1], [1, 1, 1], [0, 0, 0], [0, 0, 0], "float32"], {"i": 845630281, "t": "", "c": null, "e": [["tile_f", "sp", [-1, 2, 2, 4]], ["tile_d", "sp", [-1, 1, 1, 2]], ["tile_y", "sp", [-1, 1, 2, 1]], ["tile_x", "sp", [-1, 1, 16, 2]], ["tile_rc", "sp", [-1, 1]], ["tile_rd", "sp", [-1, 1]], ["tile_ry", "sp", [-1, 1]], ["tile_rx", "sp", [-1, 1]], ["auto_unroll_max_step", "ot", 1500], ["unroll_explicit", "ot", 0]]}], "r": [[0.000724012, 0.000687428], 0, 1.1454393863677979, 1578509324.0742388], "v": 0.1}
{"i": ["cuda", "schedule_conv3d_transpose_nchw_cuda", [[1, 12, 64, 128, 128], [12, 32, 1, 1, 1], [1, 1, 1], [0, 0, 0], [0, 0, 0], "float32"], {}, ["schedule_conv3d_transpose_nchw_cuda", [1, 12, 64, 128, 128], [12, 32, 1, 1, 1], [1, 1, 1], [0, 0, 0], [0, 0, 0], "float32"], {"i": 1658481481, "t": "", "c": null, "e": [["tile_f", "sp", [-1, 2, 2, 4]], ["tile_d", "sp", [-1, 1, 1, 2]], ["tile_y", "sp", [-1, 1, 2, 1]], ["tile_x", "sp", [-1, 1, 16, 2]], ["tile_rc", "sp", [-1, 1]], ["tile_rd", "sp", [-1, 1]], ["tile_ry", "sp", [-1, 1]], ["tile_rx", "sp", [-1, 1]], ["auto_unroll_max_step", "ot", 512], ["unroll_explicit", "ot", 1]]}], "r": [[0.000691696, 0.00069279075], 0, 1.4085438251495361, 1578509324.7669814], "v": 0.1}
{"i": ["cuda", "schedule_conv3d_transpose_nchw_cuda", [[1, 12, 64, 128, 128], [12, 32, 1, 1, 1], [1, 1, 1], [0, 0, 0], [0, 0, 0], "float32"], {}, ["schedule_conv3d_transpose_nchw_cuda", [1, 12, 64, 128, 128], [12, 32, 1, 1, 1], [1, 1, 1], [0, 0, 0], [0, 0, 0], "float32"], {"i": 2064907081, "t": "", "c": null, "e": [["tile_f", "sp", [-1, 2, 2, 4]], ["tile_d", "sp", [-1, 1, 1, 2]], ["tile_y", "sp", [-1, 1, 2, 1]], ["tile_x", "sp", [-1, 1, 16, 2]], ["tile_rc", "sp", [-1, 1]], ["tile_rd", "sp", [-1, 1]], ["tile_ry", "sp", [-1, 1]], ["tile_rx", "sp", [-1, 1]], ["auto_unroll_max_step", "ot", 1500], ["unroll_explicit", "ot", 1]]}], "r": [[0.000721541, 0.000688103], 0, 1.2841017246246338, 1578509325.4042528], "v": 0.1}
{"i": ["cuda", "schedule_conv3d_transpose_nchw_cuda", [[1, 12, 64, 128, 128], [12, 32, 1, 1, 1], [1, 1, 1], [0, 0, 0], [0, 0, 0], "float32"], {}, ["schedule_conv3d_transpose_nchw_cuda", [1, 12, 64, 128, 128], [12, 32, 1, 1, 1], [1, 1, 1], [0, 0, 0], [0, 0, 0], "float32"], {"i": 439236040, "t": "", "c": null, "e": [["tile_f", "sp", [-1, 1, 2, 4]], ["tile_d", "sp", [-1, 1, 1, 1]], ["tile_y", "sp", [-1, 1, 4, 1]], ["tile_x", "sp", [-1, 1, 16, 2]], ["tile_rc", "sp", [-1, 1]], ["tile_rd", "sp", [-1, 1]], ["tile_ry", "sp", [-1, 1]], ["tile_rx", "sp", [-1, 1]], ["auto_unroll_max_step", "ot", 512], ["unroll_explicit", "ot", 0]]}], "r": [[0.001055213, 0.001055439], 0, 1.037534475326538, 1578509326.0696683], "v": 0.1}
{"i": ["cuda", "schedule_conv3d_transpose_nchw_cuda", [[1, 12, 64, 128, 128], [12, 32, 1, 1, 1], [1, 1, 1], [0, 0, 0], [0, 0, 0], "float32"], {}, ["schedule_conv3d_transpose_nchw_cuda", [1, 12, 64, 128, 128], [12, 32, 1, 1, 1], [1, 1, 1], [0, 0, 0], [0, 0, 0], "float32"], {"i": 845661640, "t": "", "c": null, "e": [["tile_f", "sp", [-1, 1, 2, 4]], ["tile_d", "sp", [-1, 1, 1, 1]], ["tile_y", "sp", [-1, 1, 4, 1]], ["tile_x", "sp", [-1, 1, 16, 2]], ["tile_rc", "sp", [-1, 1]], ["tile_rd", "sp", [-1, 1]], ["tile_ry", "sp", [-1, 1]], ["tile_rx", "sp", [-1, 1]], ["auto_unroll_max_step", "ot", 1500], ["unroll_explicit", "ot", 0]]}], "r": [[0.0010724025, 0.001056612], 0, 0.9513368606567383, 1578509326.6834629], "v": 0.1}
{"i": ["cuda", "schedule_conv3d_transpose_nchw_cuda", [[1, 12, 64, 128, 128], [12, 32, 1, 1, 1], [1, 1, 1], [0, 0, 0], [0, 0, 0], "float32"], {}, ["schedule_conv3d_transpose_nchw_cuda", [1, 12, 64, 128, 128], [12, 32, 1, 1, 1], [1, 1, 1], [0, 0, 0], [0, 0, 0], "float32"], {"i": 44633151, "t": "", "c": null, "e": [["tile_f", "sp", [-1, 2, 4, 2]], ["tile_d", "sp", [-1, 1, 1, 2]], ["tile_y", "sp", [-1, 1, 2, 1]], ["tile_x", "sp", [-1, 1, 8, 4]], ["tile_rc", "sp", [-1, 1]], ["tile_rd", "sp", [-1, 1]], ["tile_ry", "sp", [-1, 1]], ["tile_rx", "sp", [-1, 1]], ["auto_unroll_max_step", "ot", 0], ["unroll_explicit", "ot", 0]]}], "r": [[0.00100388375, 0.001002214], 0, 1.031726360321045, 1578509329.222293], "v": 0.1}
{"i": ["cuda", "schedule_conv3d_transpose_nchw_cuda", [[1, 12, 64, 128, 128], [12, 32, 1, 1, 1], [1, 1, 1], [0, 0, 0], [0, 0, 0], "float32"], {}, ["schedule_conv3d_transpose_nchw_cuda", [1, 12, 64, 128, 128], [12, 32, 1, 1, 1], [1, 1, 1], [0, 0, 0], [0, 0, 0], "float32"], {"i": 1658512840, "t": "", "c": null, "e": [["tile_f", "sp", [-1, 1, 2, 4]], ["tile_d", "sp", [-1, 1, 1, 1]], ["tile_y", "sp", [-1, 1, 4, 1]], ["tile_x", "sp", [-1, 1, 16, 2]], ["tile_rc", "sp", [-1, 1]], ["tile_rd", "sp", [-1, 1]], ["tile_ry", "sp", [-1, 1]], ["tile_rx", "sp", [-1, 1]], ["auto_unroll_max_step", "ot", 512], ["unroll_explicit", "ot", 1]]}], "r": [[0.00105207925, 0.0010514275], 0, 1.1100821495056152, 1578509329.8212306], "v": 0.1}
{"i": ["cuda", "schedule_conv3d_transpose_nchw_cuda", [[1, 12, 64, 128, 128], [12, 32, 1, 1, 1], [1, 1, 1], [0, 0, 0], [0, 0, 0], "float32"], {}, ["schedule_conv3d_transpose_nchw_cuda", [1, 12, 64, 128, 128], [12, 32, 1, 1, 1], [1, 1, 1], [0, 0, 0], [0, 0, 0], "float32"], {"i": 2064938440, "t": "", "c": null, "e": [["tile_f", "sp", [-1, 1, 2, 4]], ["tile_d", "sp", [-1, 1, 1, 1]], ["tile_y", "sp", [-1, 1, 4, 1]], ["tile_x", "sp", [-1, 1, 16, 2]], ["tile_rc", "sp", [-1, 1]], ["tile_rd", "sp", [-1, 1]], ["tile_ry", "sp", [-1, 1]], ["tile_rx", "sp", [-1, 1]], ["auto_unroll_max_step", "ot", 1500], ["unroll_explicit", "ot", 1]]}], "r": [[0.00106961475, 0.001051932], 0, 1.1052112579345703, 1578509330.4152045], "v": 0.1}
{"i": ["cuda", "schedule_conv3d_transpose_nchw_cuda", [[1, 12, 64, 128, 128], [12, 32, 1, 1, 1], [1, 1, 1], [0, 0, 0], [0, 0, 0], "float32"], {}, ["schedule_conv3d_transpose_nchw_cuda", [1, 12, 64, 128, 128], [12, 32, 1, 1, 1], [1, 1, 1], [0, 0, 0], [0, 0, 0], "float32"], {"i": 845661696, "t": "", "c": null, "e": [["tile_f", "sp", [-1, 1, 2, 4]], ["tile_d", "sp", [-1, 2, 1, 1]], ["tile_y", "sp", [-1, 1, 4, 1]], ["tile_x", "sp", [-1, 1, 16, 2]], ["tile_rc", "sp", [-1, 1]], ["tile_rd", "sp", [-1, 1]], ["tile_ry", "sp", [-1, 1]], ["tile_rx", "sp", [-1, 1]], ["auto_unroll_max_step", "ot", 1500], ["unroll_explicit", "ot", 0]]}], "r": [[0.00094046125, 0.00093768575], 0, 1.1868963241577148, 1578509331.0791488], "v": 0.1}
{"i": ["cuda", "schedule_conv3d_transpose_nchw_cuda", [[1, 12, 64, 128, 128], [12, 32, 1, 1, 1], [1, 1, 1], [0, 0, 0], [0, 0, 0], "float32"], {}, ["schedule_conv3d_transpose_nchw_cuda", [1, 12, 64, 128, 128], [12, 32, 1, 1, 1], [1, 1, 1], [0, 0, 0], [0, 0, 0], "float32"], {"i": 439236096, "t": "", "c": null, "e": [["tile_f", "sp", [-1, 1, 2, 4]], ["tile_d", "sp", [-1, 2, 1, 1]], ["tile_y", "sp", [-1, 1, 4, 1]], ["tile_x", "sp", [-1, 1, 16, 2]], ["tile_rc", "sp", [-1, 1]], ["tile_rd", "sp", [-1, 1]], ["tile_ry", "sp", [-1, 1]], ["tile_rx", "sp", [-1, 1]], ["auto_unroll_max_step", "ot", 512], ["unroll_explicit", "ot", 0]]}], "r": [[0.00097297175, 0.000939763], 0, 1.1334915161132812, 1578509331.695869], "v": 0.1}
{"i": ["cuda", "schedule_conv3d_transpose_nchw_cuda", [[1, 12, 64, 128, 128], [12, 32, 1, 1, 1], [1, 1, 1], [0, 0, 0], [0, 0, 0], "float32"], {}, ["schedule_conv3d_transpose_nchw_cuda", [1, 12, 64, 128, 128], [12, 32, 1, 1, 1], [1, 1, 1], [0, 0, 0], [0, 0, 0], "float32"], {"i": 1263909951, "t": "", "c": null, "e": [["tile_f", "sp", [-1, 2, 4, 2]], ["tile_d", "sp", [-1, 1, 1, 2]], ["tile_y", "sp", [-1, 1, 2, 1]], ["tile_x", "sp", [-1, 1, 8, 4]], ["tile_rc", "sp", [-1, 1]], ["tile_rd", "sp", [-1, 1]], ["tile_ry", "sp", [-1, 1]], ["tile_rx", "sp", [-1, 1]], ["auto_unroll_max_step", "ot", 0], ["unroll_explicit", "ot", 1]]}], "r": [[0.00101554775, 0.0010050155], 0, 1.1450607776641846, 1578509332.2963047], "v": 0.1}
{"i": ["cuda", "schedule_conv3d_transpose_nchw_cuda", [[1, 12, 64, 128, 128], [12, 32, 1, 1, 1], [1, 1, 1], [0, 0, 0], [0, 0, 0], "float32"], {}, ["schedule_conv3d_transpose_nchw_cuda", [1, 12, 64, 128, 128], [12, 32, 1, 1, 1], [1, 1, 1], [0, 0, 0], [0, 0, 0], "float32"], {"i": 33374920, "t": "", "c": null, "e": [["tile_f", "sp", [-1, 1, 2, 4]], ["tile_d", "sp", [-1, 1, 1, 1]], ["tile_y", "sp", [-1, 1, 4, 1]], ["tile_x", "sp", [-1, 2, 16, 2]], ["tile_rc", "sp", [-1, 1]], ["tile_rd", "sp", [-1, 1]], ["tile_ry", "sp", [-1, 1]], ["tile_rx", "sp", [-1, 1]], ["auto_unroll_max_step", "ot", 0], ["unroll_explicit", "ot", 0]]}], "r": [[0.00089395575, 0.00088972825], 0, 1.1168265342712402, 1578509332.9382327], "v": 0.1}
{"i": ["cuda", "schedule_conv3d_transpose_nchw_cuda", [[1, 12, 64, 128, 128], [12, 32, 1, 1, 1], [1, 1, 1], [0, 0, 0], [0, 0, 0], "float32"], {}, ["schedule_conv3d_transpose_nchw_cuda", [1, 12, 64, 128, 128], [12, 32, 1, 1, 1], [1, 1, 1], [0, 0, 0], [0, 0, 0], "float32"], {"i": 439204671, "t": "", "c": null, "e": [["tile_f", "sp", [-1, 2, 4, 2]], ["tile_d", "sp", [-1, 1, 1, 2]], ["tile_y", "sp", [-1, 1, 2, 1]], ["tile_x", "sp", [-1, 1, 16, 2]], ["tile_rc", "sp", [-1, 1]], ["tile_rd", "sp", [-1, 1]], ["tile_ry", "sp", [-1, 1]], ["tile_rx", "sp", [-1, 1]], ["auto_unroll_max_step", "ot", 512], ["unroll_explicit", "ot", 0]]}], "r": [[0.0007646425, 0.00076524], 0, 1.1944458484649658, 1578509333.6059275], "v": 0.1}
{"i": ["cuda", "schedule_conv3d_transpose_nchw_cuda", [[1, 12, 64, 128, 128], [12, 32, 1, 1, 1], [1, 1, 1], [0, 0, 0], [0, 0, 0], "float32"], {}, ["schedule_conv3d_transpose_nchw_cuda", [1, 12, 64, 128, 128], [12, 32, 1, 1, 1], [1, 1, 1], [0, 0, 0], [0, 0, 0], "float32"], {"i": 1658481471, "t": "", "c": null, "e": [["tile_f", "sp", [-1, 2, 4, 2]], ["tile_d", "sp", [-1, 1, 1, 2]], ["tile_y", "sp", [-1, 1, 2, 1]], ["tile_x", "sp", [-1, 1, 16, 2]], ["tile_rc", "sp", [-1, 1]], ["tile_rd", "sp", [-1, 1]], ["tile_ry", "sp", [-1, 1]], ["tile_rx", "sp", [-1, 1]], ["auto_unroll_max_step", "ot", 512], ["unroll_explicit", "ot", 1]]}], "r": [[0.000801247, 0.00080045225], 0, 1.2547814846038818, 1578509334.2730243], "v": 0.1}
{"i": ["cuda", "schedule_conv3d_transpose_nchw_cuda", [[1, 12, 64, 128, 128], [12, 32, 1, 1, 1], [1, 1, 1], [0, 0, 0], [0, 0, 0], "float32"], {}, ["schedule_conv3d_transpose_nchw_cuda", [1, 12, 64, 128, 128], [12, 32, 1, 1, 1], [1, 1, 1], [0, 0, 0], [0, 0, 0], "float32"], {"i": 439237608, "t": "", "c": null, "e": [["tile_f", "sp", [-1, 1, 2, 4]], ["tile_d", "sp", [-1, 1, 1, 2]], ["tile_y", "sp", [-1, 1, 4, 1]], ["tile_x", "sp", [-1, 1, 16, 2]], ["tile_rc", "sp", [-1, 1]], ["tile_rd", "sp", [-1, 1]], ["tile_ry", "sp", [-1, 1]], ["tile_rx", "sp", [-1, 1]], ["auto_unroll_max_step", "ot", 512], ["unroll_explicit", "ot", 0]]}], "r": [[0.00094101925, 0.00094365375], 0, 1.081554651260376, 1578509334.9343271], "v": 0.1}
{"i": ["cuda", "schedule_conv3d_transpose_nchw_cuda", [[1, 12, 64, 128, 128], [12, 32, 1, 1, 1], [1, 1, 1], [0, 0, 0], [0, 0, 0], "float32"], {}, ["schedule_conv3d_transpose_nchw_cuda", [1, 12, 64, 128, 128], [12, 32, 1, 1, 1], [1, 1, 1], [0, 0, 0], [0, 0, 0], "float32"], {"i": 845663208, "t": "", "c": null, "e": [["tile_f", "sp", [-1, 1, 2, 4]], ["tile_d", "sp", [-1, 1, 1, 2]], ["tile_y", "sp", [-1, 1, 4, 1]], ["tile_x", "sp", [-1, 1, 16, 2]], ["tile_rc", "sp", [-1, 1]], ["tile_rd", "sp", [-1, 1]], ["tile_ry", "sp", [-1, 1]], ["tile_rx", "sp", [-1, 1]], ["auto_unroll_max_step", "ot", 1500], ["unroll_explicit", "ot", 0]]}], "r": [[0.0009777065, 0.00094104825], 0, 1.032334327697754, 1578509335.5403094], "v": 0.1}
{"i": ["cuda", "schedule_conv3d_transpose_nchw_cuda", [[1, 12, 64, 128, 128], [12, 32, 1, 1, 1], [1, 1, 1], [0, 0, 0], [0, 0, 0], "float32"], {}, ["schedule_conv3d_transpose_nchw_cuda", [1, 12, 64, 128, 128], [12, 32, 1, 1, 1], [1, 1, 1], [0, 0, 0], [0, 0, 0], "float32"], {"i": 829856200, "t": "", "c": null, "e": [["tile_f", "sp", [-1, 1, 2, 4]], ["tile_d", "sp", [-1, 1, 1, 1]], ["tile_y", "sp", [-1, 1, 4, 1]], ["tile_x", "sp", [-1, 1, 32, 1]], ["tile_rc", "sp", [-1, 1]], ["tile_rd", "sp", [-1, 1]], ["tile_ry", "sp", [-1, 1]], ["tile_rx", "sp", [-1, 1]], ["auto_unroll_max_step", "ot", 1500], ["unroll_explicit", "ot", 0]]}], "r": [[0.00229495075, 0.0022950795], 0, 1.0879566669464111, 1578509336.1952348], "v": 0.1}
{"i": ["cuda", "schedule_conv3d_transpose_nchw_cuda", [[1, 12, 64, 128, 128], [12, 32, 1, 1, 1], [1, 1, 1], [0, 0, 0], [0, 0, 0], "float32"], {}, ["schedule_conv3d_transpose_nchw_cuda", [1, 12, 64, 128, 128], [12, 32, 1, 1, 1], [1, 1, 1], [0, 0, 0], [0, 0, 0], "float32"], {"i": 423430600, "t": "", "c": null, "e": [["tile_f", "sp", [-1, 1, 2, 4]], ["tile_d", "sp", [-1, 1, 1, 1]], ["tile_y", "sp", [-1, 1, 4, 1]], ["tile_x", "sp", [-1, 1, 32, 1]], ["tile_rc", "sp", [-1, 1]], ["tile_rd", "sp", [-1, 1]], ["tile_ry", "sp", [-1, 1]], ["tile_rx", "sp", [-1, 1]], ["auto_unroll_max_step", "ot", 512], ["unroll_explicit", "ot", 0]]}], "r": [[0.00229869425, 0.0022946505], 0, 1.024062156677246, 1578509338.7887542], "v": 0.1}
{"i": ["cuda", "schedule_conv3d_transpose_nchw_cuda", [[1, 12, 64, 128, 128], [12, 32, 1, 1, 1], [1, 1, 1], [0, 0, 0], [0, 0, 0], "float32"], {}, ["schedule_conv3d_transpose_nchw_cuda", [1, 12, 64, 128, 128], [12, 32, 1, 1, 1], [1, 1, 1], [0, 0, 0], [0, 0, 0], "float32"], {"i": 452783560, "t": "", "c": null, "e": [["tile_f", "sp", [-1, 1, 2, 4]], ["tile_d", "sp", [-1, 1, 1, 1]], ["tile_y", "sp", [-1, 1, 4, 1]], ["tile_x", "sp", [-1, 1, 16, 4]], ["tile_rc", "sp", [-1, 1]], ["tile_rd", "sp", [-1, 1]], ["tile_ry", "sp", [-1, 1]], ["tile_rx", "sp", [-1, 1]], ["auto_unroll_max_step", "ot", 512], ["unroll_explicit", "ot", 0]]}], "r": [[0.00129203, 0.00129296875], 0, 1.1649012565612793, 1578509339.4222467], "v": 0.1}
{"i": ["cuda", "schedule_conv3d_transpose_nchw_cuda", [[1, 12, 64, 128, 128], [12, 32, 1, 1, 1], [1, 1, 1], [0, 0, 0], [0, 0, 0], "float32"], {}, ["schedule_conv3d_transpose_nchw_cuda", [1, 12, 64, 128, 128], [12, 32, 1, 1, 1], [1, 1, 1], [0, 0, 0], [0, 0, 0], "float32"], {"i": 859209160, "t": "", "c": null, "e": [["tile_f", "sp", [-1, 1, 2, 4]], ["tile_d", "sp", [-1, 1, 1, 1]], ["tile_y", "sp", [-1, 1, 4, 1]], ["tile_x", "sp", [-1, 1, 16, 4]], ["tile_rc", "sp", [-1, 1]], ["tile_rd", "sp", [-1, 1]], ["tile_ry", "sp", [-1, 1]], ["tile_rx", "sp", [-1, 1]], ["auto_unroll_max_step", "ot", 1500], ["unroll_explicit", "ot", 0]]}], "r": [[0.00136250525, 0.00128945575], 0, 1.1229100227355957, 1578509340.0205817], "v": 0.1}
{"i": ["cuda", "schedule_conv3d_transpose_nchw_cuda", [[1, 12, 64, 128, 128], [12, 32, 1, 1, 1], [1, 1, 1], [0, 0, 0], [0, 0, 0], "float32"], {}, ["schedule_conv3d_transpose_nchw_cuda", [1, 12, 64, 128, 128], [12, 32, 1, 1, 1], [1, 1, 1], [0, 0, 0], [0, 0, 0], "float32"], {"i": 2049133000, "t": "", "c": null, "e": [["tile_f", "sp", [-1, 1, 2, 4]], ["tile_d", "sp", [-1, 1, 1, 1]], ["tile_y", "sp", [-1, 1, 4, 1]], ["tile_x", "sp", [-1, 1, 32, 1]], ["tile_rc", "sp", [-1, 1]], ["tile_rd", "sp", [-1, 1]], ["tile_ry", "sp", [-1, 1]], ["tile_rx", "sp", [-1, 1]], ["auto_unroll_max_step", "ot", 1500], ["unroll_explicit", "ot", 1]]}], "r": [[0.00227717675, 0.00227738775], 0, 1.1530232429504395, 1578509340.6831908], "v": 0.1}
{"i": ["cuda", "schedule_conv3d_transpose_nchw_cuda", [[1, 12, 64, 128, 128], [12, 32, 1, 1, 1], [1, 1, 1], [0, 0, 0], [0, 0, 0], "float32"], {}, ["schedule_conv3d_transpose_nchw_cuda", [1, 12, 64, 128, 128], [12, 32, 1, 1, 1], [1, 1, 1], [0, 0, 0], [0, 0, 0], "float32"], {"i": 1642707400, "t": "", "c": null, "e": [["tile_f", "sp", [-1, 1, 2, 4]], ["tile_d", "sp", [-1, 1, 1, 1]], ["tile_y", "sp", [-1, 1, 4, 1]], ["tile_x", "sp", [-1, 1, 32, 1]], ["tile_rc", "sp", [-1, 1]], ["tile_rd", "sp", [-1, 1]], ["tile_ry", "sp", [-1, 1]], ["tile_rx", "sp", [-1, 1]], ["auto_unroll_max_step", "ot", 512], ["unroll_explicit", "ot", 1]]}], "r": [[0.0022825005, 0.00227896125], 0, 1.1511163711547852, 1578509341.2964997], "v": 0.1}
{"i": ["cuda", "schedule_conv3d_transpose_nchw_cuda", [[1, 12, 64, 128, 128], [12, 32, 1, 1, 1], [1, 1, 1], [0, 0, 0], [0, 0, 0], "float32"], {}, ["schedule_conv3d_transpose_nchw_cuda", [1, 12, 64, 128, 128], [12, 32, 1, 1, 1], [1, 1, 1], [0, 0, 0], [0, 0, 0], "float32"], {"i": 453315103, "t": "", "c": null, "e": [["tile_f", "sp", [-1, 2, 4, 2]], ["tile_d", "sp", [-1, 1, 1, 1]], ["tile_y", "sp", [-1, 1, 2, 1]], ["tile_x", "sp", [-1, 2, 16, 4]], ["tile_rc", "sp", [-1, 1]], ["tile_rd", "sp", [-1, 1]], ["tile_ry", "sp", [-1, 1]], ["tile_rx", "sp", [-1, 1]], ["auto_unroll_max_step", "ot", 512], ["unroll_explicit", "ot", 0]]}], "r": [[0.0010606945, 0.00106010975], 0, 1.2312796115875244, 1578509341.9877071], "v": 0.1}
{"i": ["cuda", "schedule_conv3d_transpose_nchw_cuda", [[1, 12, 64, 128, 128], [12, 32, 1, 1, 1], [1, 1, 1], [0, 0, 0], [0, 0, 0], "float32"], {}, ["schedule_conv3d_transpose_nchw_cuda", [1, 12, 64, 128, 128], [12, 32, 1, 1, 1], [1, 1, 1], [0, 0, 0], [0, 0, 0], "float32"], {"i": 461217823, "t": "", "c": null, "e": [["tile_f", "sp", [-1, 2, 4, 2]], ["tile_d", "sp", [-1, 1, 1, 1]], ["tile_y", "sp", [-1, 1, 2, 1]], ["tile_x", "sp", [-1, 1, 8, 8]], ["tile_rc", "sp", [-1, 1]], ["tile_rd", "sp", [-1, 1]], ["tile_ry", "sp", [-1, 1]], ["tile_rx", "sp", [-1, 1]], ["auto_unroll_max_step", "ot", 512], ["unroll_explicit", "ot", 0]]}], "r": [[0.0016657895, 0.00166443575], 0, 1.2489581108093262, 1578509342.676224], "v": 0.1}
{"i": ["cuda", "schedule_conv3d_transpose_nchw_cuda", [[1, 12, 64, 128, 128], [12, 32, 1, 1, 1], [1, 1, 1], [0, 0, 0], [0, 0, 0], "float32"], {}, ["schedule_conv3d_transpose_nchw_cuda", [1, 12, 64, 128, 128], [12, 32, 1, 1, 1], [1, 1, 1], [0, 0, 0], [0, 0, 0], "float32"], {"i": 867643423, "t": "", "c": null, "e": [["tile_f", "sp", [-1, 2, 4, 2]], ["tile_d", "sp", [-1, 1, 1, 1]], ["tile_y", "sp", [-1, 1, 2, 1]], ["tile_x", "sp", [-1, 1, 8, 8]], ["tile_rc", "sp", [-1, 1]], ["tile_rd", "sp", [-1, 1]], ["tile_ry", "sp", [-1, 1]], ["tile_rx", "sp", [-1, 1]], ["auto_unroll_max_step", "ot", 1500], ["unroll_explicit", "ot", 0]]}], "r": [[0.00167560475, 0.00166461025], 0, 1.1634302139282227, 1578509343.3070638], "v": 0.1}
{"i": ["cuda", "schedule_conv3d_transpose_nchw_cuda", [[1, 12, 64, 128, 128], [12, 32, 1, 1, 1], [1, 1, 1], [0, 0, 0], [0, 0, 0], "float32"], {}, ["schedule_conv3d_transpose_nchw_cuda", [1, 12, 64, 128, 128], [12, 32, 1, 1, 1], [1, 1, 1], [0, 0, 0], [0, 0, 0], "float32"], {"i": 2086920223, "t": "", "c": null, "e": [["tile_f", "sp", [-1, 2, 4, 2]], ["tile_d", "sp", [-1, 1, 1, 1]], ["tile_y", "sp", [-1, 1, 2, 1]], ["tile_x", "sp", [-1, 1, 8, 8]], ["tile_rc", "sp", [-1, 1]], ["tile_rd", "sp", [-1, 1]], ["tile_ry", "sp", [-1, 1]], ["tile_rx", "sp", [-1, 1]], ["auto_unroll_max_step", "ot", 1500], ["unroll_explicit", "ot", 1]]}], "r": [[0.00166576675, 0.00166381625], 0, 1.4067084789276123, 1578509344.0164442], "v": 0.1}
{"i": ["cuda", "schedule_conv3d_transpose_nchw_cuda", [[1, 12, 64, 128, 128], [12, 32, 1, 1, 1], [1, 1, 1], [0, 0, 0], [0, 0, 0], "float32"], {}, ["schedule_conv3d_transpose_nchw_cuda", [1, 12, 64, 128, 128], [12, 32, 1, 1, 1], [1, 1, 1], [0, 0, 0], [0, 0, 0], "float32"], {"i": 1680494623, "t": "", "c": null, "e": [["tile_f", "sp", [-1, 2, 4, 2]], ["tile_d", "sp", [-1, 1, 1, 1]], ["tile_y", "sp", [-1, 1, 2, 1]], ["tile_x", "sp", [-1, 1, 8, 8]], ["tile_rc", "sp", [-1, 1]], ["tile_rd", "sp", [-1, 1]], ["tile_ry", "sp", [-1, 1]], ["tile_rx", "sp", [-1, 1]], ["auto_unroll_max_step", "ot", 512], ["unroll_explicit", "ot", 1]]}], "r": [[0.0016730315, 0.0016637375], 0, 1.3410654067993164, 1578509344.6509724], "v": 0.1}
