auto_log/((1, 32, 64, 128, 128), (12, 32, 1, 1, 1), (1, 12, 64, 128, 128), (1, 1, 1), (0, 0, 0), 1, 1, None)_bwd_wei_grad.log
{"i": ["cuda", "schedule_conv3d_nchw_cuda", [[32, 1, 64, 128, 128], [12, 1, 64, 128, 128], 1, [0, 0, 0], [1, 1, 1], 1], {}, ["schedule_conv3d_nchw_cuda", [32, 1, 64, 128, 128], [12, 1, 64, 128, 128], 1, [0, 0, 0], [1, 1, 1], 1], {"i": 7324431, "t": "", "c": null, "e": [["tile_n", "sp", [-1, 4, 1, 2]], ["tile_f", "sp", [-1, 1, 1, 4]], ["tile_d", "sp", [-1, 1, 1, 1]], ["tile_y", "sp", [-1, 1, 1, 1]], ["tile_x", "sp", [-1, 1, 1, 1]], ["tile_rc", "sp", [-1, 1]], ["tile_rd", "sp", [-1, 1]], ["tile_ry", "sp", [-1, 8]], ["tile_rx", "sp", [-1, 4]], ["auto_unroll_max_step", "ot", 512], ["unroll_explicit", "ot", 0], ["fuse_yx", "ot", 1]]}], "r": [[0.198820509, 0.19398337925], 0, 3.4688608646392822, 1578511706.814097], "v": 0.1}
{"i": ["cuda", "schedule_conv3d_nchw_cuda", [[32, 1, 64, 128, 128], [12, 1, 64, 128, 128], 1, [0, 0, 0], [1, 1, 1], 1], {}, ["schedule_conv3d_nchw_cuda", [32, 1, 64, 128, 128], [12, 1, 64, 128, 128], 1, [0, 0, 0], [1, 1, 1], 1], {"i": 4362345, "t": "", "c": null, "e": [["tile_n", "sp", [-1, 2, 1, 1]], ["tile_f", "sp", [-1, 2, 1, 2]], ["tile_d", "sp", [-1, 1, 1, 1]], ["tile_y", "sp", [-1, 1, 1, 1]], ["tile_x", "sp", [-1, 1, 1, 1]], ["tile_rc", "sp", [-1, 1]], ["tile_rd", "sp", [-1, 2]], ["tile_ry", "sp", [-1, 64]], ["tile_rx", "sp", [-1, 4]], ["auto_unroll_max_step", "ot", 512], ["unroll_explicit", "ot", 1], ["fuse_yx", "ot", 0]]}], "r": [[0.309011008, 0.31001041725], 0, 4.920307874679565, 1578511710.8413734], "v": 0.1}
{"i": ["cuda", "schedule_conv3d_nchw_cuda", [[32, 1, 64, 128, 128], [12, 1, 64, 128, 128], 1, [0, 0, 0], [1, 1, 1], 1], {}, ["schedule_conv3d_nchw_cuda", [32, 1, 64, 128, 128], [12, 1, 64, 128, 128], 1, [0, 0, 0], [1, 1, 1], 1], {"i": 3922042, "t": "", "c": null, "e": [["tile_n", "sp", [-1, 1, 2, 2]], ["tile_f", "sp", [-1, 1, 1, 6]], ["tile_d", "sp", [-1, 1, 1, 1]], ["tile_y", "sp", [-1, 1, 1, 1]], ["tile_x", "sp", [-1, 1, 1, 1]], ["tile_rc", "sp", [-1, 1]], ["tile_rd", "sp", [-1, 1]], ["tile_ry", "sp", [-1, 4]], ["tile_rx", "sp", [-1, 128]], ["auto_unroll_max_step", "ot", 0], ["unroll_explicit", "ot", 1], ["fuse_yx", "ot", 0]]}], "r": [[0.19871501175, 0.198707025], 0, 2.6531920433044434, 1578511724.7727876], "v": 0.1}
{"i": ["cuda", "schedule_conv3d_nchw_cuda", [[32, 1, 64, 128, 128], [12, 1, 64, 128, 128], 1, [0, 0, 0], [1, 1, 1], 1], {}, ["schedule_conv3d_nchw_cuda", [32, 1, 64, 128, 128], [12, 1, 64, 128, 128], 1, [0, 0, 0], [1, 1, 1], 1], {"i": 8285973, "t": "", "c": null, "e": [["tile_n", "sp", [-1, 1, 8, 4]], ["tile_f", "sp", [-1, 4, 1, 1]], ["tile_d", "sp", [-1, 1, 1, 1]], ["tile_y", "sp", [-1, 1, 1, 1]], ["tile_x", "sp", [-1, 1, 1, 1]], ["tile_rc", "sp", [-1, 1]], ["tile_rd", "sp", [-1, 8]], ["tile_ry", "sp", [-1, 1]], ["tile_rx", "sp", [-1, 4]], ["auto_unroll_max_step", "ot", 1500], ["unroll_explicit", "ot", 0], ["fuse_yx", "ot", 1]]}], "r": [[0.23473132575, 0.23472036825], 0, 3.6753792762756348, 1578511732.0269616], "v": 0.1}
{"i": ["cuda", "schedule_conv3d_nchw_cuda", [[32, 1, 64, 128, 128], [12, 1, 64, 128, 128], 1, [0, 0, 0], [1, 1, 1], 1], {}, ["schedule_conv3d_nchw_cuda", [32, 1, 64, 128, 128], [12, 1, 64, 128, 128], 1, [0, 0, 0], [1, 1, 1], 1], {"i": 8326873, "t": "", "c": null, "e": [["tile_n", "sp", [-1, 8, 2, 1]], ["tile_f", "sp", [-1, 3, 4, 1]], ["tile_d", "sp", [-1, 1, 1, 1]], ["tile_y", "sp", [-1, 1, 1, 1]], ["tile_x", "sp", [-1, 1, 1, 1]], ["tile_rc", "sp", [-1, 1]], ["tile_rd", "sp", [-1, 1]], ["tile_ry", "sp", [-1, 8]], ["tile_rx", "sp", [-1, 4]], ["auto_unroll_max_step", "ot", 1500], ["unroll_explicit", "ot", 0], ["fuse_yx", "ot", 1]]}], "r": [[0.1390726825, 0.1390536585], 0, 2.7684175968170166, 1578511734.692686], "v": 0.1}
{"i": ["cuda", "schedule_conv3d_nchw_cuda", [[32, 1, 64, 128, 128], [12, 1, 64, 128, 128], 1, [0, 0, 0], [1, 1, 1], 1], {}, ["schedule_conv3d_nchw_cuda", [32, 1, 64, 128, 128], [12, 1, 64, 128, 128], 1, [0, 0, 0], [1, 1, 1], 1], {"i": 58304, "t": "", "c": null, "e": [["tile_n", "sp", [-1, 4, 2, 1]], ["tile_f", "sp", [-1, 2, 1, 1]], ["tile_d", "sp", [-1, 1, 1, 1]], ["tile_y", "sp", [-1, 1, 1, 1]], ["tile_x", "sp", [-1, 1, 1, 1]], ["tile_rc", "sp", [-1, 1]], ["tile_rd", "sp", [-1, 32]], ["tile_ry", "sp", [-1, 8]], ["tile_rx", "sp", [-1, 1]], ["auto_unroll_max_step", "ot", 0], ["unroll_explicit", "ot", 0], ["fuse_yx", "ot", 0]]}], "r": [[0.22077986075, 0.2207077935], 0, 2.9659745693206787, 1578511746.7753732], "v": 0.1}
{"i": ["cuda", "schedule_conv3d_nchw_cuda", [[32, 1, 64, 128, 128], [12, 1, 64, 128, 128], 1, [0, 0, 0], [1, 1, 1], 1], {}, ["schedule_conv3d_nchw_cuda", [32, 1, 64, 128, 128], [12, 1, 64, 128, 128], 1, [0, 0, 0], [1, 1, 1], 1], {"i": 1683254, "t": "", "c": null, "e": [["tile_n", "sp", [-1, 1, 2, 1]], ["tile_f", "sp", [-1, 1, 1, 2]], ["tile_d", "sp", [-1, 1, 1, 1]], ["tile_y", "sp", [-1, 1, 1, 1]], ["tile_x", "sp", [-1, 1, 1, 1]], ["tile_rc", "sp", [-1, 1]], ["tile_rd", "sp", [-1, 4]], ["tile_ry", "sp", [-1, 8]], ["tile_rx", "sp", [-1, 32]], ["auto_unroll_max_step", "ot", 512], ["unroll_explicit", "ot", 0], ["fuse_yx", "ot", 0]]}], "r": [[0.10229041475, 0.10228598025], 0, 2.8574814796447754, 1578511749.1386976], "v": 0.1}
{"i": ["cuda", "schedule_conv3d_nchw_cuda", [[32, 1, 64, 128, 128], [12, 1, 64, 128, 128], 1, [0, 0, 0], [1, 1, 1], 1], {}, ["schedule_conv3d_nchw_cuda", [32, 1, 64, 128, 128], [12, 1, 64, 128, 128], 1, [0, 0, 0], [1, 1, 1], 1], {"i": 5198213, "t": "", "c": null, "e": [["tile_n", "sp", [-1, 4, 4, 1]], ["tile_f", "sp", [-1, 2, 3, 2]], ["tile_d", "sp", [-1, 1, 1, 1]], ["tile_y", "sp", [-1, 1, 1, 1]], ["tile_x", "sp", [-1, 1, 1, 1]], ["tile_rc", "sp", [-1, 1]], ["tile_rd", "sp", [-1, 8]], ["tile_ry", "sp", [-1, 8]], ["tile_rx", "sp", [-1, 2]], ["auto_unroll_max_step", "ot", 1500], ["unroll_explicit", "ot", 1], ["fuse_yx", "ot", 0]]}], "r": [[0.099686722, 0.09021985425], 0, 3.4016740322113037, 1578511753.538848], "v": 0.1}
{"i": ["cuda", "schedule_conv3d_nchw_cuda", [[32, 1, 64, 128, 128], [12, 1, 64, 128, 128], 1, [0, 0, 0], [1, 1, 1], 1], {}, ["schedule_conv3d_nchw_cuda", [32, 1, 64, 128, 128], [12, 1, 64, 128, 128], 1, [0, 0, 0], [1, 1, 1], 1], {"i": 1192695, "t": "", "c": null, "e": [["tile_n", "sp", [-1, 2, 2, 1]], ["tile_f", "sp", [-1, 1, 1, 2]], ["tile_d", "sp", [-1, 1, 1, 1]], ["tile_y", "sp", [-1, 1, 1, 1]], ["tile_x", "sp", [-1, 1, 1, 1]], ["tile_rc", "sp", [-1, 1]], ["tile_rd", "sp", [-1, 1]], ["tile_ry", "sp", [-1, 16]], ["tile_rx", "sp", [-1, 2]], ["auto_unroll_max_step", "ot", 512], ["unroll_explicit", "ot", 0], ["fuse_yx", "ot", 0]]}], "r": [[0.1403087595, 0.14032301175], 0, 2.9841582775115967, 1578511756.424067], "v": 0.1}
{"i": ["cuda", "schedule_conv3d_nchw_cuda", [[32, 1, 64, 128, 128], [12, 1, 64, 128, 128], 1, [0, 0, 0], [1, 1, 1], 1], {}, ["schedule_conv3d_nchw_cuda", [32, 1, 64, 128, 128], [12, 1, 64, 128, 128], 1, [0, 0, 0], [1, 1, 1], 1], {"i": 3072757, "t": "", "c": null, "e": [["tile_n", "sp", [-1, 2, 1, 4]], ["tile_f", "sp", [-1, 1, 2, 3]], ["tile_d", "sp", [-1, 1, 1, 1]], ["tile_y", "sp", [-1, 1, 1, 1]], ["tile_x", "sp", [-1, 1, 1, 1]], ["tile_rc", "sp", [-1, 1]], ["tile_rd", "sp", [-1, 64]], ["tile_ry", "sp", [-1, 8]], ["tile_rx", "sp", [-1, 1]], ["auto_unroll_max_step", "ot", 0], ["unroll_explicit", "ot", 1], ["fuse_yx", "ot", 0]]}], "r": [[0.27194192575, 0.27191435625], 0, 3.3994696140289307, 1578511759.6759393], "v": 0.1}
{"i": ["cuda", "schedule_conv3d_nchw_cuda", [[32, 1, 64, 128, 128], [12, 1, 64, 128, 128], 1, [0, 0, 0], [1, 1, 1], 1], {}, ["schedule_conv3d_nchw_cuda", [32, 1, 64, 128, 128], [12, 1, 64, 128, 128], 1, [0, 0, 0], [1, 1, 1], 1], {"i": 8296303, "t": "", "c": null, "e": [["tile_n", "sp", [-1, 1, 8, 1]], ["tile_f", "sp", [-1, 2, 1, 3]], ["tile_d", "sp", [-1, 1, 1, 1]], ["tile_y", "sp", [-1, 1, 1, 1]], ["tile_x", "sp", [-1, 1, 1, 1]], ["tile_rc", "sp", [-1, 1]], ["tile_rd", "sp", [-1, 1]], ["tile_ry", "sp", [-1, 2]], ["tile_rx", "sp", [-1, 4]], ["auto_unroll_max_step", "ot", 1500], ["unroll_explicit", "ot", 0], ["fuse_yx", "ot", 1]]}], "r": [[0.05581467, 0.05580094475], 0, 1.4315321445465088, 1578511760.7725003], "v": 0.1}
{"i": ["cuda", "schedule_conv3d_nchw_cuda", [[32, 1, 64, 128, 128], [12, 1, 64, 128, 128], 1, [0, 0, 0], [1, 1, 1], 1], {}, ["schedule_conv3d_nchw_cuda", [32, 1, 64, 128, 128], [12, 1, 64, 128, 128], 1, [0, 0, 0], [1, 1, 1], 1], {"i": 395897, "t": "", "c": null, "e": [["tile_n", "sp", [-1, 1, 8, 2]], ["tile_f", "sp", [-1, 4, 1, 3]], ["tile_d", "sp", [-1, 1, 1, 1]], ["tile_y", "sp", [-1, 1, 1, 1]], ["tile_x", "sp", [-1, 1, 1, 1]], ["tile_rc", "sp", [-1, 1]], ["tile_rd", "sp", [-1, 2]], ["tile_ry", "sp", [-1, 2]], ["tile_rx", "sp", [-1, 8]], ["auto_unroll_max_step", "ot", 0], ["unroll_explicit", "ot", 0], ["fuse_yx", "ot", 0]]}], "r": [[0.20315852675, 0.20309652275], 0, 2.8042898178100586, 1578511763.23877], "v": 0.1}
{"i": ["cuda", "schedule_conv3d_nchw_cuda", [[32, 1, 64, 128, 128], [12, 1, 64, 128, 128], 1, [0, 0, 0], [1, 1, 1], 1], {}, ["schedule_conv3d_nchw_cuda", [32, 1, 64, 128, 128], [12, 1, 64, 128, 128], 1, [0, 0, 0], [1, 1, 1], 1], {"i": 4503134, "t": "", "c": null, "e": [["tile_n", "sp", [-1, 1, 2, 1]], ["tile_f", "sp", [-1, 1, 4, 1]], ["tile_d", "sp", [-1, 1, 1, 1]], ["tile_y", "sp", [-1, 1, 1, 1]], ["tile_x", "sp", [-1, 1, 1, 1]], ["tile_rc", "sp", [-1, 1]], ["tile_rd", "sp", [-1, 2]], ["tile_ry", "sp", [-1, 128]], ["tile_rx", "sp", [-1, 8]], ["auto_unroll_max_step", "ot", 512], ["unroll_explicit", "ot", 1], ["fuse_yx", "ot", 0]]}], "r": [[0.0395775385, 0.03945849225], 0, 5.104523658752441, 1578511774.2895236], "v": 0.1}
{"i": ["cuda", "schedule_conv3d_nchw_cuda", [[32, 1, 64, 128, 128], [12, 1, 64, 128, 128], 1, [0, 0, 0], [1, 1, 1], 1], {}, ["schedule_conv3d_nchw_cuda", [32, 1, 64, 128, 128], [12, 1, 64, 128, 128], 1, [0, 0, 0], [1, 1, 1], 1], {"i": 11668475, "t": "", "c": null, "e": [["tile_n", "sp", [-1, 1, 16, 2]], ["tile_f", "sp", [-1, 12, 1, 1]], ["tile_d", "sp", [-1, 1, 1, 1]], ["tile_y", "sp", [-1, 1, 1, 1]], ["tile_x", "sp", [-1, 1, 1, 1]], ["tile_rc", "sp", [-1, 1]], ["tile_rd", "sp", [-1, 2]], ["tile_ry", "sp", [-1, 1]], ["tile_rx", "sp", [-1, 32]], ["auto_unroll_max_step", "ot", 1500], ["unroll_explicit", "ot", 1], ["fuse_yx", "ot", 1]]}], "r": [[0.12521619825, 0.12521453625], 0, 3.935452699661255, 1578511777.5012546], "v": 0.1}
{"i": ["cuda", "schedule_conv3d_nchw_cuda", [[32, 1, 64, 128, 128], [12, 1, 64, 128, 128], 1, [0, 0, 0], [1, 1, 1], 1], {}, ["schedule_conv3d_nchw_cuda", [32, 1, 64, 128, 128], [12, 1, 64, 128, 128], 1, [0, 0, 0], [1, 1, 1], 1], {"i": 4293498, "t": "", "c": null, "e": [["tile_n", "sp", [-1, 2, 8, 2]], ["tile_f", "sp", [-1, 4, 1, 3]], ["tile_d", "sp", [-1, 1, 1, 1]], ["tile_y", "sp", [-1, 1, 1, 1]], ["tile_x", "sp", [-1, 1, 1, 1]], ["tile_rc", "sp", [-1, 1]], ["tile_rd", "sp", [-1, 32]], ["tile_ry", "sp", [-1, 2]], ["tile_rx", "sp", [-1, 4]], ["auto_unroll_max_step", "ot", 512], ["unroll_explicit", "ot", 1], ["fuse_yx", "ot", 0]]}], "r": [[0.2049960255, 0.2050327005], 0, 4.201184988021851, 1578511785.7979198], "v": 0.1}
{"i": ["cuda", "schedule_conv3d_nchw_cuda", [[32, 1, 64, 128, 128], [12, 1, 64, 128, 128], 1, [0, 0, 0], [1, 1, 1], 1], {}, ["schedule_conv3d_nchw_cuda", [32, 1, 64, 128, 128], [12, 1, 64, 128, 128], 1, [0, 0, 0], [1, 1, 1], 1], {"i": 4472066, "t": "", "c": null, "e": [["tile_n", "sp", [-1, 1, 16, 1]], ["tile_f", "sp", [-1, 1, 1, 2]], ["tile_d", "sp", [-1, 1, 1, 1]], ["tile_y", "sp", [-1, 1, 1, 1]], ["tile_x", "sp", [-1, 1, 1, 1]], ["tile_rc", "sp", [-1, 1]], ["tile_rd", "sp", [-1, 2]], ["tile_ry", "sp", [-1, 32]], ["tile_rx", "sp", [-1, 8]], ["auto_unroll_max_step", "ot", 512], ["unroll_explicit", "ot", 1], ["fuse_yx", "ot", 0]]}], "r": [[0.0809205515, 0.0703115695], 0, 7.9264976978302, 1578511800.101454], "v": 0.1}
{"i": ["cuda", "schedule_conv3d_nchw_cuda", [[32, 1, 64, 128, 128], [12, 1, 64, 128, 128], 1, [0, 0, 0], [1, 1, 1], 1], {}, ["schedule_conv3d_nchw_cuda", [32, 1, 64, 128, 128], [12, 1, 64, 128, 128], 1, [0, 0, 0], [1, 1, 1], 1], {"i": 3413580, "t": "", "c": null, "e": [["tile_n", "sp", [-1, 2, 4, 4]], ["tile_f", "sp", [-1, 1, 1, 6]], ["tile_d", "sp", [-1, 1, 1, 1]], ["tile_y", "sp", [-1, 1, 1, 1]], ["tile_x", "sp", [-1, 1, 1, 1]], ["tile_rc", "sp", [-1, 1]], ["tile_rd", "sp", [-1, 16]], ["tile_ry", "sp", [-1, 2]], ["tile_rx", "sp", [-1, 8]], ["auto_unroll_max_step", "ot", 0], ["unroll_explicit", "ot", 1], ["fuse_yx", "ot", 0]]}], "r": [[0.41068576225, 0.410203768], 0, 4.705229043960571, 1578511804.4487677], "v": 0.1}
{"i": ["cuda", "schedule_conv3d_nchw_cuda", [[32, 1, 64, 128, 128], [12, 1, 64, 128, 128], 1, [0, 0, 0], [1, 1, 1], 1], {}, ["schedule_conv3d_nchw_cuda", [32, 1, 64, 128, 128], [12, 1, 64, 128, 128], 1, [0, 0, 0], [1, 1, 1], 1], {"i": 8297974, "t": "", "c": null, "e": [["tile_n", "sp", [-1, 1, 2, 1]], ["tile_f", "sp", [-1, 1, 1, 2]], ["tile_d", "sp", [-1, 1, 1, 1]], ["tile_y", "sp", [-1, 1, 1, 1]], ["tile_x", "sp", [-1, 1, 1, 1]], ["tile_rc", "sp", [-1, 1]], ["tile_rd", "sp", [-1, 2]], ["tile_ry", "sp", [-1, 2]], ["tile_rx", "sp", [-1, 4]], ["auto_unroll_max_step", "ot", 1500], ["unroll_explicit", "ot", 0], ["fuse_yx", "ot", 1]]}], "r": [[0.03349780175, 0.0334969955], 0, 1.1279933452606201, 1578511805.9503508], "v": 0.1}
{"i": ["cuda", "schedule_conv3d_nchw_cuda", [[32, 1, 64, 128, 128], [12, 1, 64, 128, 128], 1, [0, 0, 0], [1, 1, 1], 1], {}, ["schedule_conv3d_nchw_cuda", [32, 1, 64, 128, 128], [12, 1, 64, 128, 128], 1, [0, 0, 0], [1, 1, 1], 1], {"i": 4672769, "t": "", "c": null, "e": [["tile_n", "sp", [-1, 4, 8, 1]], ["tile_f", "sp", [-1, 3, 1, 1]], ["tile_d", "sp", [-1, 1, 1, 1]], ["tile_y", "sp", [-1, 1, 1, 1]], ["tile_x", "sp", [-1, 1, 1, 1]], ["tile_rc", "sp", [-1, 1]], ["tile_rd", "sp", [-1, 1]], ["tile_ry", "sp", [-1, 4]], ["tile_rx", "sp", [-1, 32]], ["auto_unroll_max_step", "ot", 512], ["unroll_explicit", "ot", 1], ["fuse_yx", "ot", 0]]}], "r": [[0.28810768325, 0.28809370025], 0, 6.739112377166748, 1578511813.4082491], "v": 0.1}
{"i": ["cuda", "schedule_conv3d_nchw_cuda", [[32, 1, 64, 128, 128], [12, 1, 64, 128, 128], 1, [0, 0, 0], [1, 1, 1], 1], {}, ["schedule_conv3d_nchw_cuda", [32, 1, 64, 128, 128], [12, 1, 64, 128, 128], 1, [0, 0, 0], [1, 1, 1], 1], {"i": 9553122, "t": "", "c": null, "e": [["tile_n", "sp", [-1, 1, 2, 2]], ["tile_f", "sp", [-1, 2, 2, 3]], ["tile_d", "sp", [-1, 1, 1, 1]], ["tile_y", "sp", [-1, 1, 1, 1]], ["tile_x", "sp", [-1, 1, 1, 1]], ["tile_rc", "sp", [-1, 1]], ["tile_rd", "sp", [-1, 2]], ["tile_ry", "sp", [-1, 2]], ["tile_rx", "sp", [-1, 16]], ["auto_unroll_max_step", "ot", 0], ["unroll_explicit", "ot", 1], ["fuse_yx", "ot", 1]]}], "r": [[0.15099615725, 0.15071821825], 0, 2.3666164875030518, 1578511821.0898168], "v": 0.1}
{"i": ["cuda", "schedule_conv3d_nchw_cuda", [[32, 1, 64, 128, 128], [12, 1, 64, 128, 128], 1, [0, 0, 0], [1, 1, 1], 1], {}, ["schedule_conv3d_nchw_cuda", [32, 1, 64, 128, 128], [12, 1, 64, 128, 128], 1, [0, 0, 0], [1, 1, 1], 1], {"i": 3578126, "t": "", "c": null, "e": [["tile_n", "sp", [-1, 1, 2, 1]], ["tile_f", "sp", [-1, 1, 6, 1]], ["tile_d", "sp", [-1, 1, 1, 1]], ["tile_y", "sp", [-1, 1, 1, 1]], ["tile_x", "sp", [-1, 1, 1, 1]], ["tile_rc", "sp", [-1, 1]], ["tile_rd", "sp", [-1, 2]], ["tile_ry", "sp", [-1, 16]], ["tile_rx", "sp", [-1, 16]], ["auto_unroll_max_step", "ot", 0], ["unroll_explicit", "ot", 1], ["fuse_yx", "ot", 0]]}], "r": [[0.0564281485, 0.056430966], 0, 1.4491543769836426, 1578511822.6181273], "v": 0.1}
{"i": ["cuda", "schedule_conv3d_nchw_cuda", [[32, 1, 64, 128, 128], [12, 1, 64, 128, 128], 1, [0, 0, 0], [1, 1, 1], 1], {}, ["schedule_conv3d_nchw_cuda", [32, 1, 64, 128, 128], [12, 1, 64, 128, 128], 1, [0, 0, 0], [1, 1, 1], 1], {"i": 11465334, "t": "", "c": null, "e": [["tile_n", "sp", [-1, 1, 2, 1]], ["tile_f", "sp", [-1, 1, 1, 2]], ["tile_d", "sp", [-1, 1, 1, 1]], ["tile_y", "sp", [-1, 1, 1, 1]], ["tile_x", "sp", [-1, 1, 1, 1]], ["tile_rc", "sp", [-1, 1]], ["tile_rd", "sp", [-1, 2]], ["tile_ry", "sp", [-1, 8]], ["tile_rx", "sp", [-1, 8]], ["auto_unroll_max_step", "ot", 1500], ["unroll_explicit", "ot", 1], ["fuse_yx", "ot", 1]]}], "r": [[0.047140143, 0.042270404], 0, 3.2643744945526123, 1578512009.6091466], "v": 0.1}
{"i": ["cuda", "schedule_conv3d_nchw_cuda", [[32, 1, 64, 128, 128], [12, 1, 64, 128, 128], 1, [0, 0, 0], [1, 1, 1], 1], {}, ["schedule_conv3d_nchw_cuda", [32, 1, 64, 128, 128], [12, 1, 64, 128, 128], 1, [0, 0, 0], [1, 1, 1], 1], {"i": 9458294, "t": "", "c": null, "e": [["tile_n", "sp", [-1, 1, 2, 1]], ["tile_f", "sp", [-1, 1, 1, 2]], ["tile_d", "sp", [-1, 1, 1, 1]], ["tile_y", "sp", [-1, 1, 1, 1]], ["tile_x", "sp", [-1, 1, 1, 1]], ["tile_rc", "sp", [-1, 1]], ["tile_rd", "sp", [-1, 2]], ["tile_ry", "sp", [-1, 8]], ["tile_rx", "sp", [-1, 8]], ["auto_unroll_max_step", "ot", 0], ["unroll_explicit", "ot", 1], ["fuse_yx", "ot", 1]]}], "r": [[0.10093225675, 0.1003053425], 0, 2.077256679534912, 1578512011.163854], "v": 0.1}
{"i": ["cuda", "schedule_conv3d_nchw_cuda", [[32, 1, 64, 128, 128], [12, 1, 64, 128, 128], 1, [0, 0, 0], [1, 1, 1], 1], {}, ["schedule_conv3d_nchw_cuda", [32, 1, 64, 128, 128], [12, 1, 64, 128, 128], 1, [0, 0, 0], [1, 1, 1], 1], {"i": 10461814, "t": "", "c": null, "e": [["tile_n", "sp", [-1, 1, 2, 1]], ["tile_f", "sp", [-1, 1, 1, 2]], ["tile_d", "sp", [-1, 1, 1, 1]], ["tile_y", "sp", [-1, 1, 1, 1]], ["tile_x", "sp", [-1, 1, 1, 1]], ["tile_rc", "sp", [-1, 1]], ["tile_rd", "sp", [-1, 2]], ["tile_ry", "sp", [-1, 8]], ["tile_rx", "sp", [-1, 8]], ["auto_unroll_max_step", "ot", 512], ["unroll_explicit", "ot", 1], ["fuse_yx", "ot", 1]]}], "r": [[0.037144518, 0.0371427675], 0, 2.838362693786621, 1578512012.2391212], "v": 0.1}
{"i": ["cuda", "schedule_conv3d_nchw_cuda", [[32, 1, 64, 128, 128], [12, 1, 64, 128, 128], 1, [0, 0, 0], [1, 1, 1], 1], {}, ["schedule_conv3d_nchw_cuda", [32, 1, 64, 128, 128], [12, 1, 64, 128, 128], 1, [0, 0, 0], [1, 1, 1], 1], {"i": 10585014, "t": "", "c": null, "e": [["tile_n", "sp", [-1, 1, 2, 1]], ["tile_f", "sp", [-1, 1, 1, 2]], ["tile_d", "sp", [-1, 1, 1, 1]], ["tile_y", "sp", [-1, 1, 1, 1]], ["tile_x", "sp", [-1, 1, 1, 1]], ["tile_rc", "sp", [-1, 1]], ["tile_rd", "sp", [-1, 1]], ["tile_ry", "sp", [-1, 8]], ["tile_rx", "sp", [-1, 16]], ["auto_unroll_max_step", "ot", 512], ["unroll_explicit", "ot", 1], ["fuse_yx", "ot", 1]]}], "r": [[0.03652534725, 0.03652112525], 0, 3.1071178913116455, 1578512013.5201943], "v": 0.1}
{"i": ["cuda", "schedule_conv3d_nchw_cuda", [[32, 1, 64, 128, 128], [12, 1, 64, 128, 128], 1, [0, 0, 0], [1, 1, 1], 1], {}, ["schedule_conv3d_nchw_cuda", [32, 1, 64, 128, 128], [12, 1, 64, 128, 128], 1, [0, 0, 0], [1, 1, 1], 1], {"i": 9581494, "t": "", "c": null, "e": [["tile_n", "sp", [-1, 1, 2, 1]], ["tile_f", "sp", [-1, 1, 1, 2]], ["tile_d", "sp", [-1, 1, 1, 1]], ["tile_y", "sp", [-1, 1, 1, 1]], ["tile_x", "sp", [-1, 1, 1, 1]], ["tile_rc", "sp", [-1, 1]], ["tile_rd", "sp", [-1, 1]], ["tile_ry", "sp", [-1, 8]], ["tile_rx", "sp", [-1, 16]], ["auto_unroll_max_step", "ot", 0], ["unroll_explicit", "ot", 1], ["fuse_yx", "ot", 1]]}], "r": [[0.0949239975, 0.09492912475], 0, 2.0109939575195312, 1578512015.0078087], "v": 0.1}
{"i": ["cuda", "schedule_conv3d_nchw_cuda", [[32, 1, 64, 128, 128], [12, 1, 64, 128, 128], 1, [0, 0, 0], [1, 1, 1], 1], {}, ["schedule_conv3d_nchw_cuda", [32, 1, 64, 128, 128], [12, 1, 64, 128, 128], 1, [0, 0, 0], [1, 1, 1], 1], {"i": 11588534, "t": "", "c": null, "e": [["tile_n", "sp", [-1, 1, 2, 1]], ["tile_f", "sp", [-1, 1, 1, 2]], ["tile_d", "sp", [-1, 1, 1, 1]], ["tile_y", "sp", [-1, 1, 1, 1]], ["tile_x", "sp", [-1, 1, 1, 1]], ["tile_rc", "sp", [-1, 1]], ["tile_rd", "sp", [-1, 1]], ["tile_ry", "sp", [-1, 8]], ["tile_rx", "sp", [-1, 16]], ["auto_unroll_max_step", "ot", 1500], ["unroll_explicit", "ot", 1], ["fuse_yx", "ot", 1]]}], "r": [[0.03661226375, 0.036659994], 0, 3.0030574798583984, 1578512016.0592272], "v": 0.1}
{"i": ["cuda", "schedule_conv3d_nchw_cuda", [[32, 1, 64, 128, 128], [12, 1, 64, 128, 128], 1, [0, 0, 0], [1, 1, 1], 1], {}, ["schedule_conv3d_nchw_cuda", [32, 1, 64, 128, 128], [12, 1, 64, 128, 128], 1, [0, 0, 0], [1, 1, 1], 1], {"i": 10585019, "t": "", "c": null, "e": [["tile_n", "sp", [-1, 1, 4, 1]], ["tile_f", "sp", [-1, 1, 1, 2]], ["tile_d", "sp", [-1, 1, 1, 1]], ["tile_y", "sp", [-1, 1, 1, 1]], ["tile_x", "sp", [-1, 1, 1, 1]], ["tile_rc", "sp", [-1, 1]], ["tile_rd", "sp", [-1, 1]], ["tile_ry", "sp", [-1, 8]], ["tile_rx", "sp", [-1, 16]], ["auto_unroll_max_step", "ot", 512], ["unroll_explicit", "ot", 1], ["fuse_yx", "ot", 1]]}], "r": [[0.032572387, 0.0325682985], 0, 2.4521076679229736, 1578512017.2532804], "v": 0.1}
{"i": ["cuda", "schedule_conv3d_nchw_cuda", [[32, 1, 64, 128, 128], [12, 1, 64, 128, 128], 1, [0, 0, 0], [1, 1, 1], 1], {}, ["schedule_conv3d_nchw_cuda", [32, 1, 64, 128, 128], [12, 1, 64, 128, 128], 1, [0, 0, 0], [1, 1, 1], 1], {"i": 11588539, "t": "", "c": null, "e": [["tile_n", "sp", [-1, 1, 4, 1]], ["tile_f", "sp", [-1, 1, 1, 2]], ["tile_d", "sp", [-1, 1, 1, 1]], ["tile_y", "sp", [-1, 1, 1, 1]], ["tile_x", "sp", [-1, 1, 1, 1]], ["tile_rc", "sp", [-1, 1]], ["tile_rd", "sp", [-1, 1]], ["tile_ry", "sp", [-1, 8]], ["tile_rx", "sp", [-1, 16]], ["auto_unroll_max_step", "ot", 1500], ["unroll_explicit", "ot", 1], ["fuse_yx", "ot", 1]]}], "r": [[0.032680026, 0.03268350175], 0, 2.671095609664917, 1578512018.249174], "v": 0.1}
{"i": ["cuda", "schedule_conv3d_nchw_cuda", [[32, 1, 64, 128, 128], [12, 1, 64, 128, 128], 1, [0, 0, 0], [1, 1, 1], 1], {}, ["schedule_conv3d_nchw_cuda", [32, 1, 64, 128, 128], [12, 1, 64, 128, 128], 1, [0, 0, 0], [1, 1, 1], 1], {"i": 9581499, "t": "", "c": null, "e": [["tile_n", "sp", [-1, 1, 4, 1]], ["tile_f", "sp", [-1, 1, 1, 2]], ["tile_d", "sp", [-1, 1, 1, 1]], ["tile_y", "sp", [-1, 1, 1, 1]], ["tile_x", "sp", [-1, 1, 1, 1]], ["tile_rc", "sp", [-1, 1]], ["tile_rd", "sp", [-1, 1]], ["tile_ry", "sp", [-1, 8]], ["tile_rx", "sp", [-1, 16]], ["auto_unroll_max_step", "ot", 0], ["unroll_explicit", "ot", 1], ["fuse_yx", "ot", 1]]}], "r": [[0.08156915325, 0.081566709], 0, 1.7862515449523926, 1578512019.6216793], "v": 0.1}
{"i": ["cuda", "schedule_conv3d_nchw_cuda", [[32, 1, 64, 128, 128], [12, 1, 64, 128, 128], 1, [0, 0, 0], [1, 1, 1], 1], {}, ["schedule_conv3d_nchw_cuda", [32, 1, 64, 128, 128], [12, 1, 64, 128, 128], 1, [0, 0, 0], [1, 1, 1], 1], {"i": 5444214, "t": "", "c": null, "e": [["tile_n", "sp", [-1, 1, 2, 1]], ["tile_f", "sp", [-1, 1, 1, 2]], ["tile_d", "sp", [-1, 1, 1, 1]], ["tile_y", "sp", [-1, 1, 1, 1]], ["tile_x", "sp", [-1, 1, 1, 1]], ["tile_rc", "sp", [-1, 1]], ["tile_rd", "sp", [-1, 2]], ["tile_ry", "sp", [-1, 8]], ["tile_rx", "sp", [-1, 8]], ["auto_unroll_max_step", "ot", 1500], ["unroll_explicit", "ot", 1], ["fuse_yx", "ot", 0]]}], "r": [[0.03812850325, 0.03812426125], 0, 2.970946788787842, 1578512020.7031238], "v": 0.1}
{"i": ["cuda", "schedule_conv3d_nchw_cuda", [[32, 1, 64, 128, 128], [12, 1, 64, 128, 128], 1, [0, 0, 0], [1, 1, 1], 1], {}, ["schedule_conv3d_nchw_cuda", [32, 1, 64, 128, 128], [12, 1, 64, 128, 128], 1, [0, 0, 0], [1, 1, 1], 1], {"i": 3437174, "t": "", "c": null, "e": [["tile_n", "sp", [-1, 1, 2, 1]], ["tile_f", "sp", [-1, 1, 1, 2]], ["tile_d", "sp", [-1, 1, 1, 1]], ["tile_y", "sp", [-1, 1, 1, 1]], ["tile_x", "sp", [-1, 1, 1, 1]], ["tile_rc", "sp", [-1, 1]], ["tile_rd", "sp", [-1, 2]], ["tile_ry", "sp", [-1, 8]], ["tile_rx", "sp", [-1, 8]], ["auto_unroll_max_step", "ot", 0], ["unroll_explicit", "ot", 1], ["fuse_yx", "ot", 0]]}], "r": [[0.1010322955, 0.10103693475], 0, 2.0866048336029053, 1578512022.207354], "v": 0.1}
{"i": ["cuda", "schedule_conv3d_nchw_cuda", [[32, 1, 64, 128, 128], [12, 1, 64, 128, 128], 1, [0, 0, 0], [1, 1, 1], 1], {}, ["schedule_conv3d_nchw_cuda", [32, 1, 64, 128, 128], [12, 1, 64, 128, 128], 1, [0, 0, 0], [1, 1, 1], 1], {"i": 4440694, "t": "", "c": null, "e": [["tile_n", "sp", [-1, 1, 2, 1]], ["tile_f", "sp", [-1, 1, 1, 2]], ["tile_d", "sp", [-1, 1, 1, 1]], ["tile_y", "sp", [-1, 1, 1, 1]], ["tile_x", "sp", [-1, 1, 1, 1]], ["tile_rc", "sp", [-1, 1]], ["tile_rd", "sp", [-1, 2]], ["tile_ry", "sp", [-1, 8]], ["tile_rx", "sp", [-1, 8]], ["auto_unroll_max_step", "ot", 512], ["unroll_explicit", "ot", 1], ["fuse_yx", "ot", 0]]}], "r": [[0.0381290275, 0.03812354025], 0, 2.82726788520813, 1578512023.267029], "v": 0.1}
{"i": ["cuda", "schedule_conv3d_nchw_cuda", [[32, 1, 64, 128, 128], [12, 1, 64, 128, 128], 1, [0, 0, 0], [1, 1, 1], 1], {}, ["schedule_conv3d_nchw_cuda", [32, 1, 64, 128, 128], [12, 1, 64, 128, 128], 1, [0, 0, 0], [1, 1, 1], 1], {"i": 9581998, "t": "", "c": null, "e": [["tile_n", "sp", [-1, 1, 2, 1]], ["tile_f", "sp", [-1, 1, 1, 3]], ["tile_d", "sp", [-1, 1, 1, 1]], ["tile_y", "sp", [-1, 1, 1, 1]], ["tile_x", "sp", [-1, 1, 1, 1]], ["tile_rc", "sp", [-1, 1]], ["tile_rd", "sp", [-1, 1]], ["tile_ry", "sp", [-1, 8]], ["tile_rx", "sp", [-1, 16]], ["auto_unroll_max_step", "ot", 0], ["unroll_explicit", "ot", 1], ["fuse_yx", "ot", 1]]}], "r": [[0.13872938625, 0.131251427], 0, 2.3446836471557617, 1578512028.340734], "v": 0.1}
{"i": ["cuda", "schedule_conv3d_nchw_cuda", [[32, 1, 64, 128, 128], [12, 1, 64, 128, 128], 1, [0, 0, 0], [1, 1, 1], 1], {}, ["schedule_conv3d_nchw_cuda", [32, 1, 64, 128, 128], [12, 1, 64, 128, 128], 1, [0, 0, 0], [1, 1, 1], 1], {"i": 10585518, "t": "", "c": null, "e": [["tile_n", "sp", [-1, 1, 2, 1]], ["tile_f", "sp", [-1, 1, 1, 3]], ["tile_d", "sp", [-1, 1, 1, 1]], ["tile_y", "sp", [-1, 1, 1, 1]], ["tile_x", "sp", [-1, 1, 1, 1]], ["tile_rc", "sp", [-1, 1]], ["tile_rd", "sp", [-1, 1]], ["tile_ry", "sp", [-1, 8]], ["tile_rx", "sp", [-1, 16]], ["auto_unroll_max_step", "ot", 512], ["unroll_explicit", "ot", 1], ["fuse_yx", "ot", 1]]}], "r": [[0.053863345, 0.05383855425], 0, 4.214680433273315, 1578512029.9919713], "v": 0.1}
{"i": ["cuda", "schedule_conv3d_nchw_cuda", [[32, 1, 64, 128, 128], [12, 1, 64, 128, 128], 1, [0, 0, 0], [1, 1, 1], 1], {}, ["schedule_conv3d_nchw_cuda", [32, 1, 64, 128, 128], [12, 1, 64, 128, 128], 1, [0, 0, 0], [1, 1, 1], 1], {"i": 11589038, "t": "", "c": null, "e": [["tile_n", "sp", [-1, 1, 2, 1]], ["tile_f", "sp", [-1, 1, 1, 3]], ["tile_d", "sp", [-1, 1, 1, 1]], ["tile_y", "sp", [-1, 1, 1, 1]], ["tile_x", "sp", [-1, 1, 1, 1]], ["tile_rc", "sp", [-1, 1]], ["tile_rd", "sp", [-1, 1]], ["tile_ry", "sp", [-1, 8]], ["tile_rx", "sp", [-1, 16]], ["auto_unroll_max_step", "ot", 1500], ["unroll_explicit", "ot", 1], ["fuse_yx", "ot", 1]]}], "r": [[0.05369736775, 0.053706971], 0, 3.4677863121032715, 1578512031.2755845], "v": 0.1}
{"i": ["cuda", "schedule_conv3d_nchw_cuda", [[32, 1, 64, 128, 128], [12, 1, 64, 128, 128], 1, [0, 0, 0], [1, 1, 1], 1], {}, ["schedule_conv3d_nchw_cuda", [32, 1, 64, 128, 128], [12, 1, 64, 128, 128], 1, [0, 0, 0], [1, 1, 1], 1], {"i": 10694774, "t": "", "c": null, "e": [["tile_n", "sp", [-1, 1, 2, 1]], ["tile_f", "sp", [-1, 1, 1, 2]], ["tile_d", "sp", [-1, 1, 1, 1]], ["tile_y", "sp", [-1, 1, 1, 1]], ["tile_x", "sp", [-1, 1, 1, 1]], ["tile_rc", "sp", [-1, 1]], ["tile_rd", "sp", [-1, 1]], ["tile_ry", "sp", [-1, 4]], ["tile_rx", "sp", [-1, 32]], ["auto_unroll_max_step", "ot", 512], ["unroll_explicit", "ot", 1], ["fuse_yx", "ot", 1]]}], "r": [[0.034966729, 0.03496779375], 0, 3.187514543533325, 1578512032.5631638], "v": 0.1}
{"i": ["cuda", "schedule_conv3d_nchw_cuda", [[32, 1, 64, 128, 128], [12, 1, 64, 128, 128], 1, [0, 0, 0], [1, 1, 1], 1], {}, ["schedule_conv3d_nchw_cuda", [32, 1, 64, 128, 128], [12, 1, 64, 128, 128], 1, [0, 0, 0], [1, 1, 1], 1], {"i": 11698294, "t": "", "c": null, "e": [["tile_n", "sp", [-1, 1, 2, 1]], ["tile_f", "sp", [-1, 1, 1, 2]], ["tile_d", "sp", [-1, 1, 1, 1]], ["tile_y", "sp", [-1, 1, 1, 1]], ["tile_x", "sp", [-1, 1, 1, 1]], ["tile_rc", "sp", [-1, 1]], ["tile_rd", "sp", [-1, 1]], ["tile_ry", "sp", [-1, 4]], ["tile_rx", "sp", [-1, 32]], ["auto_unroll_max_step", "ot", 1500], ["unroll_explicit", "ot", 1], ["fuse_yx", "ot", 1]]}], "r": [[0.034997931, 0.03499097875], 0, 2.958014965057373, 1578512033.5781279], "v": 0.1}
{"i": ["cuda", "schedule_conv3d_nchw_cuda", [[32, 1, 64, 128, 128], [12, 1, 64, 128, 128], 1, [0, 0, 0], [1, 1, 1], 1], {}, ["schedule_conv3d_nchw_cuda", [32, 1, 64, 128, 128], [12, 1, 64, 128, 128], 1, [0, 0, 0], [1, 1, 1], 1], {"i": 9691254, "t": "", "c": null, "e": [["tile_n", "sp", [-1, 1, 2, 1]], ["tile_f", "sp", [-1, 1, 1, 2]], ["tile_d", "sp", [-1, 1, 1, 1]], ["tile_y", "sp", [-1, 1, 1, 1]], ["tile_x", "sp", [-1, 1, 1, 1]], ["tile_rc", "sp", [-1, 1]], ["tile_rd", "sp", [-1, 1]], ["tile_ry", "sp", [-1, 4]], ["tile_rx", "sp", [-1, 32]], ["auto_unroll_max_step", "ot", 0], ["unroll_explicit", "ot", 1], ["fuse_yx", "ot", 1]]}], "r": [[0.0775876675, 0.07755774925], 0, 1.909738302230835, 1578512034.9225543], "v": 0.1}
{"i": ["cuda", "schedule_conv3d_nchw_cuda", [[32, 1, 64, 128, 128], [12, 1, 64, 128, 128], 1, [0, 0, 0], [1, 1, 1], 1], {}, ["schedule_conv3d_nchw_cuda", [32, 1, 64, 128, 128], [12, 1, 64, 128, 128], 1, [0, 0, 0], [1, 1, 1], 1], {"i": 10338614, "t": "", "c": null, "e": [["tile_n", "sp", [-1, 1, 2, 1]], ["tile_f", "sp", [-1, 1, 1, 2]], ["tile_d", "sp", [-1, 1, 1, 1]], ["tile_y", "sp", [-1, 1, 1, 1]], ["tile_x", "sp", [-1, 1, 1, 1]], ["tile_rc", "sp", [-1, 1]], ["tile_rd", "sp", [-1, 4]], ["tile_ry", "sp", [-1, 8]], ["tile_rx", "sp", [-1, 4]], ["auto_unroll_max_step", "ot", 512], ["unroll_explicit", "ot", 1], ["fuse_yx", "ot", 1]]}], "r": [[0.03824683775, 0.03823584525], 0, 3.4422051906585693, 1578512036.3020437], "v": 0.1}
{"i": ["cuda", "schedule_conv3d_nchw_cuda", [[32, 1, 64, 128, 128], [12, 1, 64, 128, 128], 1, [0, 0, 0], [1, 1, 1], 1], {}, ["schedule_conv3d_nchw_cuda", [32, 1, 64, 128, 128], [12, 1, 64, 128, 128], 1, [0, 0, 0], [1, 1, 1], 1], {"i": 9335094, "t": "", "c": null, "e": [["tile_n", "sp", [-1, 1, 2, 1]], ["tile_f", "sp", [-1, 1, 1, 2]], ["tile_d", "sp", [-1, 1, 1, 1]], ["tile_y", "sp", [-1, 1, 1, 1]], ["tile_x", "sp", [-1, 1, 1, 1]], ["tile_rc", "sp", [-1, 1]], ["tile_rd", "sp", [-1, 4]], ["tile_ry", "sp", [-1, 8]], ["tile_rx", "sp", [-1, 4]], ["auto_unroll_max_step", "ot", 0], ["unroll_explicit", "ot", 1], ["fuse_yx", "ot", 1]]}], "r": [[0.09716274975, 0.0971625395], 0, 2.0610523223876953, 1578512037.8207614], "v": 0.1}
{"i": ["cuda", "schedule_conv3d_nchw_cuda", [[32, 1, 64, 128, 128], [12, 1, 64, 128, 128], 1, [0, 0, 0], [1, 1, 1], 1], {}, ["schedule_conv3d_nchw_cuda", [32, 1, 64, 128, 128], [12, 1, 64, 128, 128], 1, [0, 0, 0], [1, 1, 1], 1], {"i": 11342134, "t": "", "c": null, "e": [["tile_n", "sp", [-1, 1, 2, 1]], ["tile_f", "sp", [-1, 1, 1, 2]], ["tile_d", "sp", [-1, 1, 1, 1]], ["tile_y", "sp", [-1, 1, 1, 1]], ["tile_x", "sp", [-1, 1, 1, 1]], ["tile_rc", "sp", [-1, 1]], ["tile_rd", "sp", [-1, 4]], ["tile_ry", "sp", [-1, 8]], ["tile_rx", "sp", [-1, 4]], ["auto_unroll_max_step", "ot", 1500], ["unroll_explicit", "ot", 1], ["fuse_yx", "ot", 1]]}], "r": [[0.03860690075, 0.03861224475], 0, 3.152268409729004, 1578512038.9164495], "v": 0.1}
{"i": ["cuda", "schedule_conv3d_nchw_cuda", [[32, 1, 64, 128, 128], [12, 1, 64, 128, 128], 1, [0, 0, 0], [1, 1, 1], 1], {}, ["schedule_conv3d_nchw_cuda", [32, 1, 64, 128, 128], [12, 1, 64, 128, 128], 1, [0, 0, 0], [1, 1, 1], 1], {"i": 11575094, "t": "", "c": null, "e": [["tile_n", "sp", [-1, 1, 2, 1]], ["tile_f", "sp", [-1, 1, 1, 2]], ["tile_d", "sp", [-1, 1, 1, 1]], ["tile_y", "sp", [-1, 1, 1, 1]], ["tile_x", "sp", [-1, 1, 1, 1]], ["tile_rc", "sp", [-1, 1]], ["tile_rd", "sp", [-1, 2]], ["tile_ry", "sp", [-1, 4]], ["tile_rx", "sp", [-1, 16]], ["auto_unroll_max_step", "ot", 1500], ["unroll_explicit", "ot", 1], ["fuse_yx", "ot", 1]]}], "r": [[0.03790480775, 0.0382425095], 0, 3.0902111530303955, 1578512040.2505221], "v": 0.1}
{"i": ["cuda", "schedule_conv3d_nchw_cuda", [[32, 1, 64, 128, 128], [12, 1, 64, 128, 128], 1, [0, 0, 0], [1, 1, 1], 1], {}, ["schedule_conv3d_nchw_cuda", [32, 1, 64, 128, 128], [12, 1, 64, 128, 128], 1, [0, 0, 0], [1, 1, 1], 1], {"i": 10571574, "t": "", "c": null, "e": [["tile_n", "sp", [-1, 1, 2, 1]], ["tile_f", "sp", [-1, 1, 1, 2]], ["tile_d", "sp", [-1, 1, 1, 1]], ["tile_y", "sp", [-1, 1, 1, 1]], ["tile_x", "sp", [-1, 1, 1, 1]], ["tile_rc", "sp", [-1, 1]], ["tile_rd", "sp", [-1, 2]], ["tile_ry", "sp", [-1, 4]], ["tile_rx", "sp", [-1, 16]], ["auto_unroll_max_step", "ot", 512], ["unroll_explicit", "ot", 1], ["fuse_yx", "ot", 1]]}], "r": [[0.0377488025, 0.0377435135], 0, 2.5824697017669678, 1578512041.3215675], "v": 0.1}
{"i": ["cuda", "schedule_conv3d_nchw_cuda", [[32, 1, 64, 128, 128], [12, 1, 64, 128, 128], 1, [0, 0, 0], [1, 1, 1], 1], {}, ["schedule_conv3d_nchw_cuda", [32, 1, 64, 128, 128], [12, 1, 64, 128, 128], 1, [0, 0, 0], [1, 1, 1], 1], {"i": 9568054, "t": "", "c": null, "e": [["tile_n", "sp", [-1, 1, 2, 1]], ["tile_f", "sp", [-1, 1, 1, 2]], ["tile_d", "sp", [-1, 1, 1, 1]], ["tile_y", "sp", [-1, 1, 1, 1]], ["tile_x", "sp", [-1, 1, 1, 1]], ["tile_rc", "sp", [-1, 1]], ["tile_rd", "sp", [-1, 2]], ["tile_ry", "sp", [-1, 4]], ["tile_rx", "sp", [-1, 16]], ["auto_unroll_max_step", "ot", 0], ["unroll_explicit", "ot", 1], ["fuse_yx", "ot", 1]]}], "r": [[0.081678615, 0.081962195], 0, 1.8306035995483398, 1578512042.707256], "v": 0.1}
{"i": ["cuda", "schedule_conv3d_nchw_cuda", [[32, 1, 64, 128, 128], [12, 1, 64, 128, 128], 1, [0, 0, 0], [1, 1, 1], 1], {}, ["schedule_conv3d_nchw_cuda", [32, 1, 64, 128, 128], [12, 1, 64, 128, 128], 1, [0, 0, 0], [1, 1, 1], 1], {"i": 3560374, "t": "", "c": null, "e": [["tile_n", "sp", [-1, 1, 2, 1]], ["tile_f", "sp", [-1, 1, 1, 2]], ["tile_d", "sp", [-1, 1, 1, 1]], ["tile_y", "sp", [-1, 1, 1, 1]], ["tile_x", "sp", [-1, 1, 1, 1]], ["tile_rc", "sp", [-1, 1]], ["tile_rd", "sp", [-1, 1]], ["tile_ry", "sp", [-1, 8]], ["tile_rx", "sp", [-1, 16]], ["auto_unroll_max_step", "ot", 0], ["unroll_explicit", "ot", 1], ["fuse_yx", "ot", 0]]}], "r": [[0.09566409875, 0.0956640605], 0, 1.7941782474517822, 1578512047.457664], "v": 0.1}
{"i": ["cuda", "schedule_conv3d_nchw_cuda", [[32, 1, 64, 128, 128], [12, 1, 64, 128, 128], 1, [0, 0, 0], [1, 1, 1], 1], {}, ["schedule_conv3d_nchw_cuda", [32, 1, 64, 128, 128], [12, 1, 64, 128, 128], 1, [0, 0, 0], [1, 1, 1], 1], {"i": 4563894, "t": "", "c": null, "e": [["tile_n", "sp", [-1, 1, 2, 1]], ["tile_f", "sp", [-1, 1, 1, 2]], ["tile_d", "sp", [-1, 1, 1, 1]], ["tile_y", "sp", [-1, 1, 1, 1]], ["tile_x", "sp", [-1, 1, 1, 1]], ["tile_rc", "sp", [-1, 1]], ["tile_rd", "sp", [-1, 1]], ["tile_ry", "sp", [-1, 8]], ["tile_rx", "sp", [-1, 16]], ["auto_unroll_max_step", "ot", 512], ["unroll_explicit", "ot", 1], ["fuse_yx", "ot", 0]]}], "r": [[0.03684413175, 0.03685029775], 0, 3.0186867713928223, 1578512048.5033555], "v": 0.1}
{"i": ["cuda", "schedule_conv3d_nchw_cuda", [[32, 1, 64, 128, 128], [12, 1, 64, 128, 128], 1, [0, 0, 0], [1, 1, 1], 1], {}, ["schedule_conv3d_nchw_cuda", [32, 1, 64, 128, 128], [12, 1, 64, 128, 128], 1, [0, 0, 0], [1, 1, 1], 1], {"i": 5567414, "t": "", "c": null, "e": [["tile_n", "sp", [-1, 1, 2, 1]], ["tile_f", "sp", [-1, 1, 1, 2]], ["tile_d", "sp", [-1, 1, 1, 1]], ["tile_y", "sp", [-1, 1, 1, 1]], ["tile_x", "sp", [-1, 1, 1, 1]], ["tile_rc", "sp", [-1, 1]], ["tile_rd", "sp", [-1, 1]], ["tile_ry", "sp", [-1, 8]], ["tile_rx", "sp", [-1, 16]], ["auto_unroll_max_step", "ot", 1500], ["unroll_explicit", "ot", 1], ["fuse_yx", "ot", 0]]}], "r": [[0.037025687, 0.037026523], 0, 3.0650134086608887, 1578512049.5635214], "v": 0.1}
{"i": ["cuda", "schedule_conv3d_nchw_cuda", [[32, 1, 64, 128, 128], [12, 1, 64, 128, 128], 1, [0, 0, 0], [1, 1, 1], 1], {}, ["schedule_conv3d_nchw_cuda", [32, 1, 64, 128, 128], [12, 1, 64, 128, 128], 1, [0, 0, 0], [1, 1, 1], 1], {"i": 9458798, "t": "", "c": null, "e": [["tile_n", "sp", [-1, 1, 2, 1]], ["tile_f", "sp", [-1, 1, 1, 3]], ["tile_d", "sp", [-1, 1, 1, 1]], ["tile_y", "sp", [-1, 1, 1, 1]], ["tile_x", "sp", [-1, 1, 1, 1]], ["tile_rc", "sp", [-1, 1]], ["tile_rd", "sp", [-1, 2]], ["tile_ry", "sp", [-1, 8]], ["tile_rx", "sp", [-1, 8]], ["auto_unroll_max_step", "ot", 0], ["unroll_explicit", "ot", 1], ["fuse_yx", "ot", 1]]}], "r": [[0.1232416045, 0.12264510575], 0, 2.3313004970550537, 1578512051.3368168], "v": 0.1}
{"i": ["cuda", "schedule_conv3d_nchw_cuda", [[32, 1, 64, 128, 128], [12, 1, 64, 128, 128], 1, [0, 0, 0], [1, 1, 1], 1], {}, ["schedule_conv3d_nchw_cuda", [32, 1, 64, 128, 128], [12, 1, 64, 128, 128], 1, [0, 0, 0], [1, 1, 1], 1], {"i": 11465838, "t": "", "c": null, "e": [["tile_n", "sp", [-1, 1, 2, 1]], ["tile_f", "sp", [-1, 1, 1, 3]], ["tile_d", "sp", [-1, 1, 1, 1]], ["tile_y", "sp", [-1, 1, 1, 1]], ["tile_x", "sp", [-1, 1, 1, 1]], ["tile_rc", "sp", [-1, 1]], ["tile_rd", "sp", [-1, 2]], ["tile_ry", "sp", [-1, 8]], ["tile_rx", "sp", [-1, 8]], ["auto_unroll_max_step", "ot", 1500], ["unroll_explicit", "ot", 1], ["fuse_yx", "ot", 1]]}], "r": [[0.054012815, 0.05401552225], 0, 4.197009086608887, 1578512053.0996256], "v": 0.1}
{"i": ["cuda", "schedule_conv3d_nchw_cuda", [[32, 1, 64, 128, 128], [12, 1, 64, 128, 128], 1, [0, 0, 0], [1, 1, 1], 1], {}, ["schedule_conv3d_nchw_cuda", [32, 1, 64, 128, 128], [12, 1, 64, 128, 128], 1, [0, 0, 0], [1, 1, 1], 1], {"i": 10462318, "t": "", "c": null, "e": [["tile_n", "sp", [-1, 1, 2, 1]], ["tile_f", "sp", [-1, 1, 1, 3]], ["tile_d", "sp", [-1, 1, 1, 1]], ["tile_y", "sp", [-1, 1, 1, 1]], ["tile_x", "sp", [-1, 1, 1, 1]], ["tile_rc", "sp", [-1, 1]], ["tile_rd", "sp", [-1, 2]], ["tile_ry", "sp", [-1, 8]], ["tile_rx", "sp", [-1, 8]], ["auto_unroll_max_step", "ot", 512], ["unroll_explicit", "ot", 1], ["fuse_yx", "ot", 1]]}], "r": [[0.05398877575, 0.05399152825], 0, 3.5326476097106934, 1578512054.3879364], "v": 0.1}
{"i": ["cuda", "schedule_conv3d_nchw_cuda", [[32, 1, 64, 128, 128], [12, 1, 64, 128, 128], 1, [0, 0, 0], [1, 1, 1], 1], {}, ["schedule_conv3d_nchw_cuda", [32, 1, 64, 128, 128], [12, 1, 64, 128, 128], 1, [0, 0, 0], [1, 1, 1], 1], {"i": 9458299, "t": "", "c": null, "e": [["tile_n", "sp", [-1, 1, 4, 1]], ["tile_f", "sp", [-1, 1, 1, 2]], ["tile_d", "sp", [-1, 1, 1, 1]], ["tile_y", "sp", [-1, 1, 1, 1]], ["tile_x", "sp", [-1, 1, 1, 1]], ["tile_rc", "sp", [-1, 1]], ["tile_rd", "sp", [-1, 2]], ["tile_ry", "sp", [-1, 8]], ["tile_rx", "sp", [-1, 8]], ["auto_unroll_max_step", "ot", 0], ["unroll_explicit", "ot", 1], ["fuse_yx", "ot", 1]]}], "r": [[0.078089782, 0.07809613125], 0, 1.9194934368133545, 1578512055.7253976], "v": 0.1}
{"i": ["cuda", "schedule_conv3d_nchw_cuda", [[32, 1, 64, 128, 128], [12, 1, 64, 128, 128], 1, [0, 0, 0], [1, 1, 1], 1], {}, ["schedule_conv3d_nchw_cuda", [32, 1, 64, 128, 128], [12, 1, 64, 128, 128], 1, [0, 0, 0], [1, 1, 1], 1], {"i": 10461819, "t": "", "c": null, "e": [["tile_n", "sp", [-1, 1, 4, 1]], ["tile_f", "sp", [-1, 1, 1, 2]], ["tile_d", "sp", [-1, 1, 1, 1]], ["tile_y", "sp", [-1, 1, 1, 1]], ["tile_x", "sp", [-1, 1, 1, 1]], ["tile_rc", "sp", [-1, 1]], ["tile_rd", "sp", [-1, 2]], ["tile_ry", "sp", [-1, 8]], ["tile_rx", "sp", [-1, 8]], ["auto_unroll_max_step", "ot", 512], ["unroll_explicit", "ot", 1], ["fuse_yx", "ot", 1]]}], "r": [[0.03237621725, 0.032378482], 0, 2.6425836086273193, 1578512056.9596803], "v": 0.1}
{"i": ["cuda", "schedule_conv3d_nchw_cuda", [[32, 1, 64, 128, 128], [12, 1, 64, 128, 128], 1, [0, 0, 0], [1, 1, 1], 1], {}, ["schedule_conv3d_nchw_cuda", [32, 1, 64, 128, 128], [12, 1, 64, 128, 128], 1, [0, 0, 0], [1, 1, 1], 1], {"i": 11465339, "t": "", "c": null, "e": [["tile_n", "sp", [-1, 1, 4, 1]], ["tile_f", "sp", [-1, 1, 1, 2]], ["tile_d", "sp", [-1, 1, 1, 1]], ["tile_y", "sp", [-1, 1, 1, 1]], ["tile_x", "sp", [-1, 1, 1, 1]], ["tile_rc", "sp", [-1, 1]], ["tile_rd", "sp", [-1, 2]], ["tile_ry", "sp", [-1, 8]], ["tile_rx", "sp", [-1, 8]], ["auto_unroll_max_step", "ot", 1500], ["unroll_explicit", "ot", 1], ["fuse_yx", "ot", 1]]}], "r": [[0.03292940475, 0.03293602], 0, 2.256099224090576, 1578512057.9776957], "v": 0.1}
{"i": ["cuda", "schedule_conv3d_nchw_cuda", [[32, 1, 64, 128, 128], [12, 1, 64, 128, 128], 1, [0, 0, 0], [1, 1, 1], 1], {}, ["schedule_conv3d_nchw_cuda", [32, 1, 64, 128, 128], [12, 1, 64, 128, 128], 1, [0, 0, 0], [1, 1, 1], 1], {"i": 10585523, "t": "", "c": null, "e": [["tile_n", "sp", [-1, 1, 4, 1]], ["tile_f", "sp", [-1, 1, 1, 3]], ["tile_d", "sp", [-1, 1, 1, 1]], ["tile_y", "sp", [-1, 1, 1, 1]], ["tile_x", "sp", [-1, 1, 1, 1]], ["tile_rc", "sp", [-1, 1]], ["tile_rd", "sp", [-1, 1]], ["tile_ry", "sp", [-1, 8]], ["tile_rx", "sp", [-1, 16]], ["auto_unroll_max_step", "ot", 512], ["unroll_explicit", "ot", 1], ["fuse_yx", "ot", 1]]}], "r": [[0.0435809815, 0.0435668465], 0, 3.194272041320801, 1578512059.383968], "v": 0.1}
{"i": ["cuda", "schedule_conv3d_nchw_cuda", [[32, 1, 64, 128, 128], [12, 1, 64, 128, 128], 1, [0, 0, 0], [1, 1, 1], 1], {}, ["schedule_conv3d_nchw_cuda", [32, 1, 64, 128, 128], [12, 1, 64, 128, 128], 1, [0, 0, 0], [1, 1, 1], 1], {"i": 11589043, "t": "", "c": null, "e": [["tile_n", "sp", [-1, 1, 4, 1]], ["tile_f", "sp", [-1, 1, 1, 3]], ["tile_d", "sp", [-1, 1, 1, 1]], ["tile_y", "sp", [-1, 1, 1, 1]], ["tile_x", "sp", [-1, 1, 1, 1]], ["tile_rc", "sp", [-1, 1]], ["tile_rd", "sp", [-1, 1]], ["tile_ry", "sp", [-1, 8]], ["tile_rx", "sp", [-1, 16]], ["auto_unroll_max_step", "ot", 1500], ["unroll_explicit", "ot", 1], ["fuse_yx", "ot", 1]]}], "r": [[0.04358444075, 0.04391289525], 0, 2.6073191165924072, 1578512060.5284655], "v": 0.1}
{"i": ["cuda", "schedule_conv3d_nchw_cuda", [[32, 1, 64, 128, 128], [12, 1, 64, 128, 128], 1, [0, 0, 0], [1, 1, 1], 1], {}, ["schedule_conv3d_nchw_cuda", [32, 1, 64, 128, 128], [12, 1, 64, 128, 128], 1, [0, 0, 0], [1, 1, 1], 1], {"i": 9582003, "t": "", "c": null, "e": [["tile_n", "sp", [-1, 1, 4, 1]], ["tile_f", "sp", [-1, 1, 1, 3]], ["tile_d", "sp", [-1, 1, 1, 1]], ["tile_y", "sp", [-1, 1, 1, 1]], ["tile_x", "sp", [-1, 1, 1, 1]], ["tile_rc", "sp", [-1, 1]], ["tile_rd", "sp", [-1, 1]], ["tile_ry", "sp", [-1, 8]], ["tile_rx", "sp", [-1, 16]], ["auto_unroll_max_step", "ot", 0], ["unroll_explicit", "ot", 1], ["fuse_yx", "ot", 1]]}], "r": [[0.10614621175, 0.1061432555], 0, 2.087113618850708, 1578512062.1043515], "v": 0.1}
{"i": ["cuda", "schedule_conv3d_nchw_cuda", [[32, 1, 64, 128, 128], [12, 1, 64, 128, 128], 1, [0, 0, 0], [1, 1, 1], 1], {}, ["schedule_conv3d_nchw_cuda", [32, 1, 64, 128, 128], [12, 1, 64, 128, 128], 1, [0, 0, 0], [1, 1, 1], 1], {"i": 4563899, "t": "", "c": null, "e": [["tile_n", "sp", [-1, 1, 4, 1]], ["tile_f", "sp", [-1, 1, 1, 2]], ["tile_d", "sp", [-1, 1, 1, 1]], ["tile_y", "sp", [-1, 1, 1, 1]], ["tile_x", "sp", [-1, 1, 1, 1]], ["tile_rc", "sp", [-1, 1]], ["tile_rd", "sp", [-1, 1]], ["tile_ry", "sp", [-1, 8]], ["tile_rx", "sp", [-1, 16]], ["auto_unroll_max_step", "ot", 512], ["unroll_explicit", "ot", 1], ["fuse_yx", "ot", 0]]}], "r": [[0.03261593125, 0.03257517375], 0, 2.2704315185546875, 1578512065.68149], "v": 0.1}
{"i": ["cuda", "schedule_conv3d_nchw_cuda", [[32, 1, 64, 128, 128], [12, 1, 64, 128, 128], 1, [0, 0, 0], [1, 1, 1], 1], {}, ["schedule_conv3d_nchw_cuda", [32, 1, 64, 128, 128], [12, 1, 64, 128, 128], 1, [0, 0, 0], [1, 1, 1], 1], {"i": 3560379, "t": "", "c": null, "e": [["tile_n", "sp", [-1, 1, 4, 1]], ["tile_f", "sp", [-1, 1, 1, 2]], ["tile_d", "sp", [-1, 1, 1, 1]], ["tile_y", "sp", [-1, 1, 1, 1]], ["tile_x", "sp", [-1, 1, 1, 1]], ["tile_rc", "sp", [-1, 1]], ["tile_rd", "sp", [-1, 1]], ["tile_ry", "sp", [-1, 8]], ["tile_rx", "sp", [-1, 16]], ["auto_unroll_max_step", "ot", 0], ["unroll_explicit", "ot", 1], ["fuse_yx", "ot", 0]]}], "r": [[0.0817844585, 0.081782802], 0, 1.7956292629241943, 1578512066.9955966], "v": 0.1}
{"i": ["cuda", "schedule_conv3d_nchw_cuda", [[32, 1, 64, 128, 128], [12, 1, 64, 128, 128], 1, [0, 0, 0], [1, 1, 1], 1], {}, ["schedule_conv3d_nchw_cuda", [32, 1, 64, 128, 128], [12, 1, 64, 128, 128], 1, [0, 0, 0], [1, 1, 1], 1], {"i": 5567419, "t": "", "c": null, "e": [["tile_n", "sp", [-1, 1, 4, 1]], ["tile_f", "sp", [-1, 1, 1, 2]], ["tile_d", "sp", [-1, 1, 1, 1]], ["tile_y", "sp", [-1, 1, 1, 1]], ["tile_x", "sp", [-1, 1, 1, 1]], ["tile_rc", "sp", [-1, 1]], ["tile_rd", "sp", [-1, 1]], ["tile_ry", "sp", [-1, 8]], ["tile_rx", "sp", [-1, 16]], ["auto_unroll_max_step", "ot", 1500], ["unroll_explicit", "ot", 1], ["fuse_yx", "ot", 0]]}], "r": [[0.03247297575, 0.03247597275], 0, 2.625852584838867, 1578512067.9972582], "v": 0.1}
{"i": ["cuda", "schedule_conv3d_nchw_cuda", [[32, 1, 64, 128, 128], [12, 1, 64, 128, 128], 1, [0, 0, 0], [1, 1, 1], 1], {}, ["schedule_conv3d_nchw_cuda", [32, 1, 64, 128, 128], [12, 1, 64, 128, 128], 1, [0, 0, 0], [1, 1, 1], 1], {"i": 8577974, "t": "", "c": null, "e": [["tile_n", "sp", [-1, 1, 2, 1]], ["tile_f", "sp", [-1, 1, 1, 2]], ["tile_d", "sp", [-1, 1, 1, 1]], ["tile_y", "sp", [-1, 1, 1, 1]], ["tile_x", "sp", [-1, 1, 1, 1]], ["tile_rc", "sp", [-1, 1]], ["tile_rd", "sp", [-1, 1]], ["tile_ry", "sp", [-1, 8]], ["tile_rx", "sp", [-1, 16]], ["auto_unroll_max_step", "ot", 1500], ["unroll_explicit", "ot", 0], ["fuse_yx", "ot", 1]]}], "r": [[0.11607881375, 0.116079175], 0, 3.8383560180664062, 1578512070.1839926], "v": 0.1}
{"i": ["cuda", "schedule_conv3d_nchw_cuda", [[32, 1, 64, 128, 128], [12, 1, 64, 128, 128], 1, [0, 0, 0], [1, 1, 1], 1], {}, ["schedule_conv3d_nchw_cuda", [32, 1, 64, 128, 128], [12, 1, 64, 128, 128], 1, [0, 0, 0], [1, 1, 1], 1], {"i": 7574454, "t": "", "c": null, "e": [["tile_n", "sp", [-1, 1, 2, 1]], ["tile_f", "sp", [-1, 1, 1, 2]], ["tile_d", "sp", [-1, 1, 1, 1]], ["tile_y", "sp", [-1, 1, 1, 1]], ["tile_x", "sp", [-1, 1, 1, 1]], ["tile_rc", "sp", [-1, 1]], ["tile_rd", "sp", [-1, 1]], ["tile_ry", "sp", [-1, 8]], ["tile_rx", "sp", [-1, 16]], ["auto_unroll_max_step", "ot", 512], ["unroll_explicit", "ot", 0], ["fuse_yx", "ot", 1]]}], "r": [[0.11607726925, 0.1160783285], 0, 3.397146701812744, 1578512072.0031285], "v": 0.1}
{"i": ["cuda", "schedule_conv3d_nchw_cuda", [[32, 1, 64, 128, 128], [12, 1, 64, 128, 128], 1, [0, 0, 0], [1, 1, 1], 1], {}, ["schedule_conv3d_nchw_cuda", [32, 1, 64, 128, 128], [12, 1, 64, 128, 128], 1, [0, 0, 0], [1, 1, 1], 1], {"i": 6570934, "t": "", "c": null, "e": [["tile_n", "sp", [-1, 1, 2, 1]], ["tile_f", "sp", [-1, 1, 1, 2]], ["tile_d", "sp", [-1, 1, 1, 1]], ["tile_y", "sp", [-1, 1, 1, 1]], ["tile_x", "sp", [-1, 1, 1, 1]], ["tile_rc", "sp", [-1, 1]], ["tile_rd", "sp", [-1, 1]], ["tile_ry", "sp", [-1, 8]], ["tile_rx", "sp", [-1, 16]], ["auto_unroll_max_step", "ot", 0], ["unroll_explicit", "ot", 0], ["fuse_yx", "ot", 1]]}], "r": [[0.09565078575, 0.09565658175], 0, 1.9612951278686523, 1578512073.45029], "v": 0.1}
{"i": ["cuda", "schedule_conv3d_nchw_cuda", [[32, 1, 64, 128, 128], [12, 1, 64, 128, 128], 1, [0, 0, 0], [1, 1, 1], 1], {}, ["schedule_conv3d_nchw_cuda", [32, 1, 64, 128, 128], [12, 1, 64, 128, 128], 1, [0, 0, 0], [1, 1, 1], 1], {"i": 8454774, "t": "", "c": null, "e": [["tile_n", "sp", [-1, 1, 2, 1]], ["tile_f", "sp", [-1, 1, 1, 2]], ["tile_d", "sp", [-1, 1, 1, 1]], ["tile_y", "sp", [-1, 1, 1, 1]], ["tile_x", "sp", [-1, 1, 1, 1]], ["tile_rc", "sp", [-1, 1]], ["tile_rd", "sp", [-1, 2]], ["tile_ry", "sp", [-1, 8]], ["tile_rx", "sp", [-1, 8]], ["auto_unroll_max_step", "ot", 1500], ["unroll_explicit", "ot", 0], ["fuse_yx", "ot", 1]]}], "r": [[0.170145676, 0.17014609], 0, 4.39684271812439, 1578512076.2842555], "v": 0.1}
{"i": ["cuda", "schedule_conv3d_nchw_cuda", [[32, 1, 64, 128, 128], [12, 1, 64, 128, 128], 1, [0, 0, 0], [1, 1, 1], 1], {}, ["schedule_conv3d_nchw_cuda", [32, 1, 64, 128, 128], [12, 1, 64, 128, 128], 1, [0, 0, 0], [1, 1, 1], 1], {"i": 7451254, "t": "", "c": null, "e": [["tile_n", "sp", [-1, 1, 2, 1]], ["tile_f", "sp", [-1, 1, 1, 2]], ["tile_d", "sp", [-1, 1, 1, 1]], ["tile_y", "sp", [-1, 1, 1, 1]], ["tile_x", "sp", [-1, 1, 1, 1]], ["tile_rc", "sp", [-1, 1]], ["tile_rd", "sp", [-1, 2]], ["tile_ry", "sp", [-1, 8]], ["tile_rx", "sp", [-1, 8]], ["auto_unroll_max_step", "ot", 512], ["unroll_explicit", "ot", 0], ["fuse_yx", "ot", 1]]}], "r": [[0.1708907605, 0.17134973675], 0, 3.8151309490203857, 1578512078.6304631], "v": 0.1}
{"i": ["cuda", "schedule_conv3d_nchw_cuda", [[32, 1, 64, 128, 128], [12, 1, 64, 128, 128], 1, [0, 0, 0], [1, 1, 1], 1], {}, ["schedule_conv3d_nchw_cuda", [32, 1, 64, 128, 128], [12, 1, 64, 128, 128], 1, [0, 0, 0], [1, 1, 1], 1], {"i": 6447734, "t": "", "c": null, "e": [["tile_n", "sp", [-1, 1, 2, 1]], ["tile_f", "sp", [-1, 1, 1, 2]], ["tile_d", "sp", [-1, 1, 1, 1]], ["tile_y", "sp", [-1, 1, 1, 1]], ["tile_x", "sp", [-1, 1, 1, 1]], ["tile_rc", "sp", [-1, 1]], ["tile_rd", "sp", [-1, 2]], ["tile_ry", "sp", [-1, 8]], ["tile_rx", "sp", [-1, 8]], ["auto_unroll_max_step", "ot", 0], ["unroll_explicit", "ot", 0], ["fuse_yx", "ot", 1]]}], "r": [[0.1013466395, 0.1013801975], 0, 2.0612070560455322, 1578512080.1369176], "v": 0.1}
{"i": ["cuda", "schedule_conv3d_nchw_cuda", [[32, 1, 64, 128, 128], [12, 1, 64, 128, 128], 1, [0, 0, 0], [1, 1, 1], 1], {}, ["schedule_conv3d_nchw_cuda", [32, 1, 64, 128, 128], [12, 1, 64, 128, 128], 1, [0, 0, 0], [1, 1, 1], 1], {"i": 11682614, "t": "", "c": null, "e": [["tile_n", "sp", [-1, 1, 2, 1]], ["tile_f", "sp", [-1, 1, 1, 2]], ["tile_d", "sp", [-1, 1, 1, 1]], ["tile_y", "sp", [-1, 1, 1, 1]], ["tile_x", "sp", [-1, 1, 1, 1]], ["tile_rc", "sp", [-1, 1]], ["tile_rd", "sp", [-1, 1]], ["tile_ry", "sp", [-1, 2]], ["tile_rx", "sp", [-1, 32]], ["auto_unroll_max_step", "ot", 1500], ["unroll_explicit", "ot", 1], ["fuse_yx", "ot", 1]]}], "r": [[0.02812694725, 0.02812693675], 0, 1.8017351627349854, 1578512081.0668159], "v": 0.1}
{"i": ["cuda", "schedule_conv3d_nchw_cuda", [[32, 1, 64, 128, 128], [12, 1, 64, 128, 128], 1, [0, 0, 0], [1, 1, 1], 1], {}, ["schedule_conv3d_nchw_cuda", [32, 1, 64, 128, 128], [12, 1, 64, 128, 128], 1, [0, 0, 0], [1, 1, 1], 1], {"i": 9675574, "t": "", "c": null, "e": [["tile_n", "sp", [-1, 1, 2, 1]], ["tile_f", "sp", [-1, 1, 1, 2]], ["tile_d", "sp", [-1, 1, 1, 1]], ["tile_y", "sp", [-1, 1, 1, 1]], ["tile_x", "sp", [-1, 1, 1, 1]], ["tile_rc", "sp", [-1, 1]], ["tile_rd", "sp", [-1, 1]], ["tile_ry", "sp", [-1, 2]], ["tile_rx", "sp", [-1, 32]], ["auto_unroll_max_step", "ot", 0], ["unroll_explicit", "ot", 1], ["fuse_yx", "ot", 1]]}], "r": [[0.059165734, 0.05916096575], 0, 1.72627592086792, 1578512082.2522652], "v": 0.1}
{"i": ["cuda", "schedule_conv3d_nchw_cuda", [[32, 1, 64, 128, 128], [12, 1, 64, 128, 128], 1, [0, 0, 0], [1, 1, 1], 1], {}, ["schedule_conv3d_nchw_cuda", [32, 1, 64, 128, 128], [12, 1, 64, 128, 128], 1, [0, 0, 0], [1, 1, 1], 1], {"i": 10679094, "t": "", "c": null, "e": [["tile_n", "sp", [-1, 1, 2, 1]], ["tile_f", "sp", [-1, 1, 1, 2]], ["tile_d", "sp", [-1, 1, 1, 1]], ["tile_y", "sp", [-1, 1, 1, 1]], ["tile_x", "sp", [-1, 1, 1, 1]], ["tile_rc", "sp", [-1, 1]], ["tile_rd", "sp", [-1, 1]], ["tile_ry", "sp", [-1, 2]], ["tile_rx", "sp", [-1, 32]], ["auto_unroll_max_step", "ot", 512], ["unroll_explicit", "ot", 1], ["fuse_yx", "ot", 1]]}], "r": [[0.02805575175, 0.02805449775], 0, 1.643122911453247, 1578512083.1196284], "v": 0.1}
{"i": ["cuda", "schedule_conv3d_nchw_cuda", [[32, 1, 64, 128, 128], [12, 1, 64, 128, 128], 1, [0, 0, 0], [1, 1, 1], 1], {}, ["schedule_conv3d_nchw_cuda", [32, 1, 64, 128, 128], [12, 1, 64, 128, 128], 1, [0, 0, 0], [1, 1, 1], 1], {"i": 9458303, "t": "", "c": null, "e": [["tile_n", "sp", [-1, 1, 8, 1]], ["tile_f", "sp", [-1, 1, 1, 2]], ["tile_d", "sp", [-1, 1, 1, 1]], ["tile_y", "sp", [-1, 1, 1, 1]], ["tile_x", "sp", [-1, 1, 1, 1]], ["tile_rc", "sp", [-1, 1]], ["tile_rd", "sp", [-1, 2]], ["tile_ry", "sp", [-1, 8]], ["tile_rx", "sp", [-1, 8]], ["auto_unroll_max_step", "ot", 0], ["unroll_explicit", "ot", 1], ["fuse_yx", "ot", 1]]}], "r": [[0.0599275205, 0.05397340775], 0, 1.557767629623413, 1578512087.5132139], "v": 0.1}
{"i": ["cuda", "schedule_conv3d_nchw_cuda", [[32, 1, 64, 128, 128], [12, 1, 64, 128, 128], 1, [0, 0, 0], [1, 1, 1], 1], {}, ["schedule_conv3d_nchw_cuda", [32, 1, 64, 128, 128], [12, 1, 64, 128, 128], 1, [0, 0, 0], [1, 1, 1], 1], {"i": 10461823, "t": "", "c": null, "e": [["tile_n", "sp", [-1, 1, 8, 1]], ["tile_f", "sp", [-1, 1, 1, 2]], ["tile_d", "sp", [-1, 1, 1, 1]], ["tile_y", "sp", [-1, 1, 1, 1]], ["tile_x", "sp", [-1, 1, 1, 1]], ["tile_rc", "sp", [-1, 1]], ["tile_rd", "sp", [-1, 2]], ["tile_ry", "sp", [-1, 8]], ["tile_rx", "sp", [-1, 8]], ["auto_unroll_max_step", "ot", 512], ["unroll_explicit", "ot", 1], ["fuse_yx", "ot", 1]]}], "r": [[0.026093609, 0.0260964865], 0, 2.1986162662506104, 1578512088.4823709], "v": 0.1}
{"i": ["cuda", "schedule_conv3d_nchw_cuda", [[32, 1, 64, 128, 128], [12, 1, 64, 128, 128], 1, [0, 0, 0], [1, 1, 1], 1], {}, ["schedule_conv3d_nchw_cuda", [32, 1, 64, 128, 128], [12, 1, 64, 128, 128], 1, [0, 0, 0], [1, 1, 1], 1], {"i": 11465343, "t": "", "c": null, "e": [["tile_n", "sp", [-1, 1, 8, 1]], ["tile_f", "sp", [-1, 1, 1, 2]], ["tile_d", "sp", [-1, 1, 1, 1]], ["tile_y", "sp", [-1, 1, 1, 1]], ["tile_x", "sp", [-1, 1, 1, 1]], ["tile_rc", "sp", [-1, 1]], ["tile_rd", "sp", [-1, 2]], ["tile_ry", "sp", [-1, 8]], ["tile_rx", "sp", [-1, 8]], ["auto_unroll_max_step", "ot", 1500], ["unroll_explicit", "ot", 1], ["fuse_yx", "ot", 1]]}], "r": [[0.026093923, 0.02609178125], 0, 2.169511556625366, 1578512089.373741], "v": 0.1}
{"i": ["cuda", "schedule_conv3d_nchw_cuda", [[32, 1, 64, 128, 128], [12, 1, 64, 128, 128], 1, [0, 0, 0], [1, 1, 1], 1], {}, ["schedule_conv3d_nchw_cuda", [32, 1, 64, 128, 128], [12, 1, 64, 128, 128], 1, [0, 0, 0], [1, 1, 1], 1], {"i": 6570939, "t": "", "c": null, "e": [["tile_n", "sp", [-1, 1, 4, 1]], ["tile_f", "sp", [-1, 1, 1, 2]], ["tile_d", "sp", [-1, 1, 1, 1]], ["tile_y", "sp", [-1, 1, 1, 1]], ["tile_x", "sp", [-1, 1, 1, 1]], ["tile_rc", "sp", [-1, 1]], ["tile_rd", "sp", [-1, 1]], ["tile_ry", "sp", [-1, 8]], ["tile_rx", "sp", [-1, 16]], ["auto_unroll_max_step", "ot", 0], ["unroll_explicit", "ot", 0], ["fuse_yx", "ot", 1]]}], "r": [[0.082028334, 0.0826919395], 0, 1.8563871383666992, 1578512090.7151337], "v": 0.1}
{"i": ["cuda", "schedule_conv3d_nchw_cuda", [[32, 1, 64, 128, 128], [12, 1, 64, 128, 128], 1, [0, 0, 0], [1, 1, 1], 1], {}, ["schedule_conv3d_nchw_cuda", [32, 1, 64, 128, 128], [12, 1, 64, 128, 128], 1, [0, 0, 0], [1, 1, 1], 1], {"i": 8577979, "t": "", "c": null, "e": [["tile_n", "sp", [-1, 1, 4, 1]], ["tile_f", "sp", [-1, 1, 1, 2]], ["tile_d", "sp", [-1, 1, 1, 1]], ["tile_y", "sp", [-1, 1, 1, 1]], ["tile_x", "sp", [-1, 1, 1, 1]], ["tile_rc", "sp", [-1, 1]], ["tile_rd", "sp", [-1, 1]], ["tile_ry", "sp", [-1, 8]], ["tile_rx", "sp", [-1, 16]], ["auto_unroll_max_step", "ot", 1500], ["unroll_explicit", "ot", 0], ["fuse_yx", "ot", 1]]}], "r": [[0.08016846, 0.08016826225], 0, 3.119640350341797, 1578512092.5161438], "v": 0.1}
{"i": ["cuda", "schedule_conv3d_nchw_cuda", [[32, 1, 64, 128, 128], [12, 1, 64, 128, 128], 1, [0, 0, 0], [1, 1, 1], 1], {}, ["schedule_conv3d_nchw_cuda", [32, 1, 64, 128, 128], [12, 1, 64, 128, 128], 1, [0, 0, 0], [1, 1, 1], 1], {"i": 7574459, "t": "", "c": null, "e": [["tile_n", "sp", [-1, 1, 4, 1]], ["tile_f", "sp", [-1, 1, 1, 2]], ["tile_d", "sp", [-1, 1, 1, 1]], ["tile_y", "sp", [-1, 1, 1, 1]], ["tile_x", "sp", [-1, 1, 1, 1]], ["tile_rc", "sp", [-1, 1]], ["tile_rd", "sp", [-1, 1]], ["tile_ry", "sp", [-1, 8]], ["tile_rx", "sp", [-1, 16]], ["auto_unroll_max_step", "ot", 512], ["unroll_explicit", "ot", 0], ["fuse_yx", "ot", 1]]}], "r": [[0.080225986, 0.080231735], 0, 2.654663562774658, 1578512093.9709907], "v": 0.1}
{"i": ["cuda", "schedule_conv3d_nchw_cuda", [[32, 1, 64, 128, 128], [12, 1, 64, 128, 128], 1, [0, 0, 0], [1, 1, 1], 1], {}, ["schedule_conv3d_nchw_cuda", [32, 1, 64, 128, 128], [12, 1, 64, 128, 128], 1, [0, 0, 0], [1, 1, 1], 1], {"i": 3560878, "t": "", "c": null, "e": [["tile_n", "sp", [-1, 1, 2, 1]], ["tile_f", "sp", [-1, 1, 1, 3]], ["tile_d", "sp", [-1, 1, 1, 1]], ["tile_y", "sp", [-1, 1, 1, 1]], ["tile_x", "sp", [-1, 1, 1, 1]], ["tile_rc", "sp", [-1, 1]], ["tile_rd", "sp", [-1, 1]], ["tile_ry", "sp", [-1, 8]], ["tile_rx", "sp", [-1, 16]], ["auto_unroll_max_step", "ot", 0], ["unroll_explicit", "ot", 1], ["fuse_yx", "ot", 0]]}], "r": [[0.1319513215, 0.131947662], 0, 2.304158926010132, 1578512095.775396], "v": 0.1}
{"i": ["cuda", "schedule_conv3d_nchw_cuda", [[32, 1, 64, 128, 128], [12, 1, 64, 128, 128], 1, [0, 0, 0], [1, 1, 1], 1], {}, ["schedule_conv3d_nchw_cuda", [32, 1, 64, 128, 128], [12, 1, 64, 128, 128], 1, [0, 0, 0], [1, 1, 1], 1], {"i": 5567918, "t": "", "c": null, "e": [["tile_n", "sp", [-1, 1, 2, 1]], ["tile_f", "sp", [-1, 1, 1, 3]], ["tile_d", "sp", [-1, 1, 1, 1]], ["tile_y", "sp", [-1, 1, 1, 1]], ["tile_x", "sp", [-1, 1, 1, 1]], ["tile_rc", "sp", [-1, 1]], ["tile_rd", "sp", [-1, 1]], ["tile_ry", "sp", [-1, 8]], ["tile_rx", "sp", [-1, 16]], ["auto_unroll_max_step", "ot", 1500], ["unroll_explicit", "ot", 1], ["fuse_yx", "ot", 0]]}], "r": [[0.054144778, 0.054147659], 0, 3.4045603275299072, 1578512097.043301], "v": 0.1}
{"i": ["cuda", "schedule_conv3d_nchw_cuda", [[32, 1, 64, 128, 128], [12, 1, 64, 128, 128], 1, [0, 0, 0], [1, 1, 1], 1], {}, ["schedule_conv3d_nchw_cuda", [32, 1, 64, 128, 128], [12, 1, 64, 128, 128], 1, [0, 0, 0], [1, 1, 1], 1], {"i": 4564398, "t": "", "c": null, "e": [["tile_n", "sp", [-1, 1, 2, 1]], ["tile_f", "sp", [-1, 1, 1, 3]], ["tile_d", "sp", [-1, 1, 1, 1]], ["tile_y", "sp", [-1, 1, 1, 1]], ["tile_x", "sp", [-1, 1, 1, 1]], ["tile_rc", "sp", [-1, 1]], ["tile_rd", "sp", [-1, 1]], ["tile_ry", "sp", [-1, 8]], ["tile_rx", "sp", [-1, 16]], ["auto_unroll_max_step", "ot", 512], ["unroll_explicit", "ot", 1], ["fuse_yx", "ot", 0]]}], "r": [[0.05412868125, 0.05414173725], 0, 3.3083572387695312, 1578512098.3099387], "v": 0.1}
{"i": ["cuda", "schedule_conv3d_nchw_cuda", [[32, 1, 64, 128, 128], [12, 1, 64, 128, 128], 1, [0, 0, 0], [1, 1, 1], 1], {}, ["schedule_conv3d_nchw_cuda", [32, 1, 64, 128, 128], [12, 1, 64, 128, 128], 1, [0, 0, 0], [1, 1, 1], 1], {"i": 5677174, "t": "", "c": null, "e": [["tile_n", "sp", [-1, 1, 2, 1]], ["tile_f", "sp", [-1, 1, 1, 2]], ["tile_d", "sp", [-1, 1, 1, 1]], ["tile_y", "sp", [-1, 1, 1, 1]], ["tile_x", "sp", [-1, 1, 1, 1]], ["tile_rc", "sp", [-1, 1]], ["tile_rd", "sp", [-1, 1]], ["tile_ry", "sp", [-1, 4]], ["tile_rx", "sp", [-1, 32]], ["auto_unroll_max_step", "ot", 1500], ["unroll_explicit", "ot", 1], ["fuse_yx", "ot", 0]]}], "r": [[0.035166187, 0.03516385475], 0, 2.610982656478882, 1578512099.3421235], "v": 0.1}
{"i": ["cuda", "schedule_conv3d_nchw_cuda", [[32, 1, 64, 128, 128], [12, 1, 64, 128, 128], 1, [0, 0, 0], [1, 1, 1], 1], {}, ["schedule_conv3d_nchw_cuda", [32, 1, 64, 128, 128], [12, 1, 64, 128, 128], 1, [0, 0, 0], [1, 1, 1], 1], {"i": 3670134, "t": "", "c": null, "e": [["tile_n", "sp", [-1, 1, 2, 1]], ["tile_f", "sp", [-1, 1, 1, 2]], ["tile_d", "sp", [-1, 1, 1, 1]], ["tile_y", "sp", [-1, 1, 1, 1]], ["tile_x", "sp", [-1, 1, 1, 1]], ["tile_rc", "sp", [-1, 1]], ["tile_rd", "sp", [-1, 1]], ["tile_ry", "sp", [-1, 4]], ["tile_rx", "sp", [-1, 32]], ["auto_unroll_max_step", "ot", 0], ["unroll_explicit", "ot", 1], ["fuse_yx", "ot", 0]]}], "r": [[0.078181895, 0.0784600085], 0, 1.7992432117462158, 1578512100.649134], "v": 0.1}
{"i": ["cuda", "schedule_conv3d_nchw_cuda", [[32, 1, 64, 128, 128], [12, 1, 64, 128, 128], 1, [0, 0, 0], [1, 1, 1], 1], {}, ["schedule_conv3d_nchw_cuda", [32, 1, 64, 128, 128], [12, 1, 64, 128, 128], 1, [0, 0, 0], [1, 1, 1], 1], {"i": 4673654, "t": "", "c": null, "e": [["tile_n", "sp", [-1, 1, 2, 1]], ["tile_f", "sp", [-1, 1, 1, 2]], ["tile_d", "sp", [-1, 1, 1, 1]], ["tile_y", "sp", [-1, 1, 1, 1]], ["tile_x", "sp", [-1, 1, 1, 1]], ["tile_rc", "sp", [-1, 1]], ["tile_rd", "sp", [-1, 1]], ["tile_ry", "sp", [-1, 4]], ["tile_rx", "sp", [-1, 32]], ["auto_unroll_max_step", "ot", 512], ["unroll_explicit", "ot", 1], ["fuse_yx", "ot", 0]]}], "r": [[0.03517231825, 0.035178772], 0, 2.372206687927246, 1578512101.6909094], "v": 0.1}
{"i": ["cuda", "schedule_conv3d_nchw_cuda", [[32, 1, 64, 128, 128], [12, 1, 64, 128, 128], 1, [0, 0, 0], [1, 1, 1], 1], {}, ["schedule_conv3d_nchw_cuda", [32, 1, 64, 128, 128], [12, 1, 64, 128, 128], 1, [0, 0, 0], [1, 1, 1], 1], {"i": 11666262, "t": "", "c": null, "e": [["tile_n", "sp", [-1, 1, 2, 1]], ["tile_f", "sp", [-1, 1, 2, 1]], ["tile_d", "sp", [-1, 1, 1, 1]], ["tile_y", "sp", [-1, 1, 1, 1]], ["tile_x", "sp", [-1, 1, 1, 1]], ["tile_rc", "sp", [-1, 1]], ["tile_rd", "sp", [-1, 1]], ["tile_ry", "sp", [-1, 1]], ["tile_rx", "sp", [-1, 32]], ["auto_unroll_max_step", "ot", 1500], ["unroll_explicit", "ot", 1], ["fuse_yx", "ot", 1]]}], "r": [[0.03905193875, 0.03595919075], 0, 1.4489920139312744, 1578512242.4776828], "v": 0.1}
{"i": ["cuda", "schedule_conv3d_nchw_cuda", [[32, 1, 64, 128, 128], [12, 1, 64, 128, 128], 1, [0, 0, 0], [1, 1, 1], 1], {}, ["schedule_conv3d_nchw_cuda", [32, 1, 64, 128, 128], [12, 1, 64, 128, 128], 1, [0, 0, 0], [1, 1, 1], 1], {"i": 10416342, "t": "", "c": null, "e": [["tile_n", "sp", [-1, 1, 2, 1]], ["tile_f", "sp", [-1, 1, 2, 1]], ["tile_d", "sp", [-1, 1, 1, 1]], ["tile_y", "sp", [-1, 1, 1, 1]], ["tile_x", "sp", [-1, 1, 1, 1]], ["tile_rc", "sp", [-1, 1]], ["tile_rd", "sp", [-1, 4]], ["tile_ry", "sp", [-1, 1]], ["tile_rx", "sp", [-1, 8]], ["auto_unroll_max_step", "ot", 512], ["unroll_explicit", "ot", 1], ["fuse_yx", "ot", 1]]}], "r": [[0.027117143, 0.026339509], 0, 1.379258632659912, 1578512243.3441691], "v": 0.1}
{"i": ["cuda", "schedule_conv3d_nchw_cuda", [[32, 1, 64, 128, 128], [12, 1, 64, 128, 128], 1, [0, 0, 0], [1, 1, 1], 1], {}, ["schedule_conv3d_nchw_cuda", [32, 1, 64, 128, 128], [12, 1, 64, 128, 128], 1, [0, 0, 0], [1, 1, 1], 1], {"i": 11417678, "t": "", "c": null, "e": [["tile_n", "sp", [-1, 1, 2, 1]], ["tile_f", "sp", [-1, 2, 2, 1]], ["tile_d", "sp", [-1, 1, 1, 1]], ["tile_y", "sp", [-1, 1, 1, 1]], ["tile_x", "sp", [-1, 1, 1, 1]], ["tile_rc", "sp", [-1, 1]], ["tile_rd", "sp", [-1, 2]], ["tile_ry", "sp", [-1, 1]], ["tile_rx", "sp", [-1, 8]], ["auto_unroll_max_step", "ot", 1500], ["unroll_explicit", "ot", 1], ["fuse_yx", "ot", 1]]}], "r": [[0.03547505175, 0.03546851375], 0, 1.5109965801239014, 1578512244.2947853], "v": 0.1}
{"i": ["cuda", "schedule_conv3d_nchw_cuda", [[32, 1, 64, 128, 128], [12, 1, 64, 128, 128], 1, [0, 0, 0], [1, 1, 1], 1], {}, ["schedule_conv3d_nchw_cuda", [32, 1, 64, 128, 128], [12, 1, 64, 128, 128], 1, [0, 0, 0], [1, 1, 1], 1], {"i": 10432022, "t": "", "c": null, "e": [["tile_n", "sp", [-1, 1, 2, 1]], ["tile_f", "sp", [-1, 1, 2, 1]], ["tile_d", "sp", [-1, 1, 1, 1]], ["tile_y", "sp", [-1, 1, 1, 1]], ["tile_x", "sp", [-1, 1, 1, 1]], ["tile_rc", "sp", [-1, 1]], ["tile_rd", "sp", [-1, 4]], ["tile_ry", "sp", [-1, 2]], ["tile_rx", "sp", [-1, 8]], ["auto_unroll_max_step", "ot", 512], ["unroll_explicit", "ot", 1], ["fuse_yx", "ot", 1]]}], "r": [[0.026881591, 0.02688073475], 0, 1.6254596710205078, 1578512245.2297263], "v": 0.1}
{"i": ["cuda", "schedule_conv3d_nchw_cuda", [[32, 1, 64, 128, 128], [12, 1, 64, 128, 128], 1, [0, 0, 0], [1, 1, 1], 1], {}, ["schedule_conv3d_nchw_cuda", [32, 1, 64, 128, 128], [12, 1, 64, 128, 128], 1, [0, 0, 0], [1, 1, 1], 1], {"i": 11433307, "t": "", "c": null, "e": [["tile_n", "sp", [-1, 1, 4, 1]], ["tile_f", "sp", [-1, 1, 2, 1]], ["tile_d", "sp", [-1, 1, 1, 1]], ["tile_y", "sp", [-1, 1, 1, 1]], ["tile_x", "sp", [-1, 1, 1, 1]], ["tile_rc", "sp", [-1, 1]], ["tile_rd", "sp", [-1, 2]], ["tile_ry", "sp", [-1, 2]], ["tile_rx", "sp", [-1, 8]], ["auto_unroll_max_step", "ot", 1500], ["unroll_explicit", "ot", 1], ["fuse_yx", "ot", 1]]}], "r": [[0.0386902845, 0.03869229975], 0, 1.5115902423858643, 1578512246.2239532], "v": 0.1}
{"i": ["cuda", "schedule_conv3d_nchw_cuda", [[32, 1, 64, 128, 128], [12, 1, 64, 128, 128], 1, [0, 0, 0], [1, 1, 1], 1], {}, ["schedule_conv3d_nchw_cuda", [32, 1, 64, 128, 128], [12, 1, 64, 128, 128], 1, [0, 0, 0], [1, 1, 1], 1], {"i": 11543062, "t": "", "c": null, "e": [["tile_n", "sp", [-1, 1, 2, 1]], ["tile_f", "sp", [-1, 1, 2, 1]], ["tile_d", "sp", [-1, 1, 1, 1]], ["tile_y", "sp", [-1, 1, 1, 1]], ["tile_x", "sp", [-1, 1, 1, 1]], ["tile_rc", "sp", [-1, 1]], ["tile_rd", "sp", [-1, 2]], ["tile_ry", "sp", [-1, 1]], ["tile_rx", "sp", [-1, 16]], ["auto_unroll_max_step", "ot", 1500], ["unroll_explicit", "ot", 1], ["fuse_yx", "ot", 1]]}], "r": [[0.0652279905, 0.06523052], 0, 1.8221180438995361, 1578512247.4658775], "v": 0.1}
