auto_log/((1, 24, 64, 128, 128), (12, 24, 1, 1, 1), (1, 12, 64, 128, 128), (1, 1, 1), (0, 0, 0), 1, 1, None)_bwd_wei_grad.log
{"i": ["cuda", "schedule_conv3d_nchw_cuda", [[24, 1, 64, 128, 128], [12, 1, 64, 128, 128], 1, [0, 0, 0], [1, 1, 1], 1], {}, ["schedule_conv3d_nchw_cuda", [24, 1, 64, 128, 128], [12, 1, 64, 128, 128], 1, [0, 0, 0], [1, 1, 1], 1], {"i": 15991773, "t": "", "c": null, "e": [["tile_n", "sp", [-1, 12, 2, 1]], ["tile_f", "sp", [-1, 1, 12, 1]], ["tile_d", "sp", [-1, 1, 1, 1]], ["tile_y", "sp", [-1, 1, 1, 1]], ["tile_x", "sp", [-1, 1, 1, 1]], ["tile_rc", "sp", [-1, 1]], ["tile_rd", "sp", [-1, 64]], ["tile_ry", "sp", [-1, 2]], ["tile_rx", "sp", [-1, 2]], ["auto_unroll_max_step", "ot", 1500], ["unroll_explicit", "ot", 1], ["fuse_yx", "ot", 1]]}], "r": [[0.1019415575, 0.10193163875], 0, 3.0862441062927246, 1578503233.687316], "v": 0.1}
{"i": ["cuda", "schedule_conv3d_nchw_cuda", [[24, 1, 64, 128, 128], [12, 1, 64, 128, 128], 1, [0, 0, 0], [1, 1, 1], 1], {}, ["schedule_conv3d_nchw_cuda", [24, 1, 64, 128, 128], [12, 1, 64, 128, 128], 1, [0, 0, 0], [1, 1, 1], 1], {"i": 8983496, "t": "", "c": null, "e": [["tile_n", "sp", [-1, 2, 4, 3]], ["tile_f", "sp", [-1, 1, 4, 1]], ["tile_d", "sp", [-1, 1, 1, 1]], ["tile_y", "sp", [-1, 1, 1, 1]], ["tile_x", "sp", [-1, 1, 1, 1]], ["tile_rc", "sp", [-1, 1]], ["tile_rd", "sp", [-1, 1]], ["tile_ry", "sp", [-1, 2]], ["tile_rx", "sp", [-1, 4]], ["auto_unroll_max_step", "ot", 0], ["unroll_explicit", "ot", 0], ["fuse_yx", "ot", 1]]}], "r": [[0.058742964, 0.058717474], 0, 1.4108753204345703, 1578503234.81842], "v": 0.1}
{"i": ["cuda", "schedule_conv3d_nchw_cuda", [[24, 1, 64, 128, 128], [12, 1, 64, 128, 128], 1, [0, 0, 0], [1, 1, 1], 1], {}, ["schedule_conv3d_nchw_cuda", [24, 1, 64, 128, 128], [12, 1, 64, 128, 128], 1, [0, 0, 0], [1, 1, 1], 1], {"i": 14900403, "t": "", "c": null, "e": [["tile_n", "sp", [-1, 4, 1, 1]], ["tile_f", "sp", [-1, 1, 6, 1]], ["tile_d", "sp", [-1, 1, 1, 1]], ["tile_y", "sp", [-1, 1, 1, 1]], ["tile_x", "sp", [-1, 1, 1, 1]], ["tile_rc", "sp", [-1, 1]], ["tile_rd", "sp", [-1, 2]], ["tile_ry", "sp", [-1, 2]], ["tile_rx", "sp", [-1, 8]], ["auto_unroll_max_step", "ot", 512], ["unroll_explicit", "ot", 1], ["fuse_yx", "ot", 1]]}], "r": [[0.05404382975, 0.0540425925], 0, 1.5494909286499023, 1578503240.5958037], "v": 0.1}
{"i": ["cuda", "schedule_conv3d_nchw_cuda", [[24, 1, 64, 128, 128], [12, 1, 64, 128, 128], 1, [0, 0, 0], [1, 1, 1], 1], {}, ["schedule_conv3d_nchw_cuda", [24, 1, 64, 128, 128], [12, 1, 64, 128, 128], 1, [0, 0, 0], [1, 1, 1], 1], {"i": 3095120, "t": "", "c": null, "e": [["tile_n", "sp", [-1, 1, 1, 1]], ["tile_f", "sp", [-1, 6, 2, 1]], ["tile_d", "sp", [-1, 1, 1, 1]], ["tile_y", "sp", [-1, 1, 1, 1]], ["tile_x", "sp", [-1, 1, 1, 1]], ["tile_rc", "sp", [-1, 1]], ["tile_rd", "sp", [-1, 2]], ["tile_ry", "sp", [-1, 4]], ["tile_rx", "sp", [-1, 2]], ["auto_unroll_max_step", "ot", 1500], ["unroll_explicit", "ot", 0], ["fuse_yx", "ot", 0]]}], "r": [[0.2798267885, 0.27987707025], 0, 3.8269948959350586, 1578503256.2402334], "v": 0.1}
{"i": ["cuda", "schedule_conv3d_nchw_cuda", [[24, 1, 64, 128, 128], [12, 1, 64, 128, 128], 1, [0, 0, 0], [1, 1, 1], 1], {}, ["schedule_conv3d_nchw_cuda", [24, 1, 64, 128, 128], [12, 1, 64, 128, 128], 1, [0, 0, 0], [1, 1, 1], 1], {"i": 9058029, "t": "", "c": null, "e": [["tile_n", "sp", [-1, 1, 24, 1]], ["tile_f", "sp", [-1, 2, 3, 2]], ["tile_d", "sp", [-1, 1, 1, 1]], ["tile_y", "sp", [-1, 1, 1, 1]], ["tile_x", "sp", [-1, 1, 1, 1]], ["tile_rc", "sp", [-1, 1]], ["tile_rd", "sp", [-1, 4]], ["tile_ry", "sp", [-1, 16]], ["tile_rx", "sp", [-1, 4]], ["auto_unroll_max_step", "ot", 0], ["unroll_explicit", "ot", 0], ["fuse_yx", "ot", 1]]}], "r": [[0.138993169, 0.139005542], 0, 2.1113529205322266, 1578503258.102233], "v": 0.1}
{"i": ["cuda", "schedule_conv3d_nchw_cuda", [[24, 1, 64, 128, 128], [12, 1, 64, 128, 128], 1, [0, 0, 0], [1, 1, 1], 1], {}, ["schedule_conv3d_nchw_cuda", [24, 1, 64, 128, 128], [12, 1, 64, 128, 128], 1, [0, 0, 0], [1, 1, 1], 1], {"i": 8904612, "t": "", "c": null, "e": [["tile_n", "sp", [-1, 1, 2, 3]], ["tile_f", "sp", [-1, 1, 1, 3]], ["tile_d", "sp", [-1, 1, 1, 1]], ["tile_y", "sp", [-1, 1, 1, 1]], ["tile_x", "sp", [-1, 1, 1, 1]], ["tile_rc", "sp", [-1, 1]], ["tile_rd", "sp", [-1, 8]], ["tile_ry", "sp", [-1, 32]], ["tile_rx", "sp", [-1, 2]], ["auto_unroll_max_step", "ot", 0], ["unroll_explicit", "ot", 0], ["fuse_yx", "ot", 1]]}], "r": [[0.21890701925, 0.21881754575], 0, 2.847015857696533, 1578503261.0901635], "v": 0.1}
{"i": ["cuda", "schedule_conv3d_nchw_cuda", [[24, 1, 64, 128, 128], [12, 1, 64, 128, 128], 1, [0, 0, 0], [1, 1, 1], 1], {}, ["schedule_conv3d_nchw_cuda", [24, 1, 64, 128, 128], [12, 1, 64, 128, 128], 1, [0, 0, 0], [1, 1, 1], 1], {"i": 517403, "t": "", "c": null, "e": [["tile_n", "sp", [-1, 1, 4, 2]], ["tile_f", "sp", [-1, 1, 1, 3]], ["tile_d", "sp", [-1, 1, 1, 1]], ["tile_y", "sp", [-1, 1, 1, 1]], ["tile_x", "sp", [-1, 1, 1, 1]], ["tile_rc", "sp", [-1, 1]], ["tile_rd", "sp", [-1, 1]], ["tile_ry", "sp", [-1, 128]], ["tile_rx", "sp", [-1, 4]], ["auto_unroll_max_step", "ot", 0], ["unroll_explicit", "ot", 0], ["fuse_yx", "ot", 0]]}], "r": [[0.13013302, 0.1301384815], 0, 2.1311135292053223, 1578503283.240708], "v": 0.1}
{"i": ["cuda", "schedule_conv3d_nchw_cuda", [[24, 1, 64, 128, 128], [12, 1, 64, 128, 128], 1, [0, 0, 0], [1, 1, 1], 1], {}, ["schedule_conv3d_nchw_cuda", [24, 1, 64, 128, 128], [12, 1, 64, 128, 128], 1, [0, 0, 0], [1, 1, 1], 1], {"i": 10976558, "t": "", "c": null, "e": [["tile_n", "sp", [-1, 1, 2, 12]], ["tile_f", "sp", [-1, 1, 2, 1]], ["tile_d", "sp", [-1, 1, 1, 1]], ["tile_y", "sp", [-1, 1, 1, 1]], ["tile_x", "sp", [-1, 1, 1, 1]], ["tile_rc", "sp", [-1, 1]], ["tile_rd", "sp", [-1, 1]], ["tile_ry", "sp", [-1, 4]], ["tile_rx", "sp", [-1, 32]], ["auto_unroll_max_step", "ot", 512], ["unroll_explicit", "ot", 0], ["fuse_yx", "ot", 1]]}], "r": [[0.2663285525, 0.26631529525], 0, 3.4349637031555176, 1578503286.3176384], "v": 0.1}
{"i": ["cuda", "schedule_conv3d_nchw_cuda", [[24, 1, 64, 128, 128], [12, 1, 64, 128, 128], 1, [0, 0, 0], [1, 1, 1], 1], {}, ["schedule_conv3d_nchw_cuda", [24, 1, 64, 128, 128], [12, 1, 64, 128, 128], 1, [0, 0, 0], [1, 1, 1], 1], {"i": 10355328, "t": "", "c": null, "e": [["tile_n", "sp", [-1, 1, 1, 3]], ["tile_f", "sp", [-1, 2, 1, 1]], ["tile_d", "sp", [-1, 1, 1, 1]], ["tile_y", "sp", [-1, 1, 1, 1]], ["tile_x", "sp", [-1, 1, 1, 1]], ["tile_rc", "sp", [-1, 1]], ["tile_rd", "sp", [-1, 4]], ["tile_ry", "sp", [-1, 64]], ["tile_rx", "sp", [-1, 2]], ["auto_unroll_max_step", "ot", 512], ["unroll_explicit", "ot", 0], ["fuse_yx", "ot", 1]]}], "r": [[0.2526960265, 0.25270038075], 0, 3.641392230987549, 1578503311.1237376], "v": 0.1}
{"i": ["cuda", "schedule_conv3d_nchw_cuda", [[24, 1, 64, 128, 128], [12, 1, 64, 128, 128], 1, [0, 0, 0], [1, 1, 1], 1], {}, ["schedule_conv3d_nchw_cuda", [24, 1, 64, 128, 128], [12, 1, 64, 128, 128], 1, [0, 0, 0], [1, 1, 1], 1], {"i": 65955, "t": "", "c": null, "e": [["tile_n", "sp", [-1, 12, 1, 2]], ["tile_f", "sp", [-1, 1, 3, 2]], ["tile_d", "sp", [-1, 1, 1, 1]], ["tile_y", "sp", [-1, 1, 1, 1]], ["tile_x", "sp", [-1, 1, 1, 1]], ["tile_rc", "sp", [-1, 1]], ["tile_rd", "sp", [-1, 64]], ["tile_ry", "sp", [-1, 4]], ["tile_rx", "sp", [-1, 1]], ["auto_unroll_max_step", "ot", 0], ["unroll_explicit", "ot", 0], ["fuse_yx", "ot", 0]]}], "r": [[0.41230562275, 0.4122508865], 0, 4.821004629135132, 1578503324.8235004], "v": 0.1}
{"i": ["cuda", "schedule_conv3d_nchw_cuda", [[24, 1, 64, 128, 128], [12, 1, 64, 128, 128], 1, [0, 0, 0], [1, 1, 1], 1], {}, ["schedule_conv3d_nchw_cuda", [24, 1, 64, 128, 128], [12, 1, 64, 128, 128], 1, [0, 0, 0], [1, 1, 1], 1], {"i": 10597, "t": "", "c": null, "e": [["tile_n", "sp", [-1, 2, 2, 2]], ["tile_f", "sp", [-1, 4, 3, 1]], ["tile_d", "sp", [-1, 1, 1, 1]], ["tile_y", "sp", [-1, 1, 1, 1]], ["tile_x", "sp", [-1, 1, 1, 1]], ["tile_rc", "sp", [-1, 1]], ["tile_rd", "sp", [-1, 8]], ["tile_ry", "sp", [-1, 1]], ["tile_rx", "sp", [-1, 1]], ["auto_unroll_max_step", "ot", 0], ["unroll_explicit", "ot", 0], ["fuse_yx", "ot", 0]]}], "r": [[0.08306050625, 0.0830613], 0, 1.7553901672363281, 1578503337.598207], "v": 0.1}
{"i": ["cuda", "schedule_conv3d_nchw_cuda", [[24, 1, 64, 128, 128], [12, 1, 64, 128, 128], 1, [0, 0, 0], [1, 1, 1], 1], {}, ["schedule_conv3d_nchw_cuda", [24, 1, 64, 128, 128], [12, 1, 64, 128, 128], 1, [0, 0, 0], [1, 1, 1], 1], {"i": 16152676, "t": "", "c": null, "e": [["tile_n", "sp", [-1, 1, 2, 2]], ["tile_f", "sp", [-1, 2, 1, 3]], ["tile_d", "sp", [-1, 1, 1, 1]], ["tile_y", "sp", [-1, 1, 1, 1]], ["tile_x", "sp", [-1, 1, 1, 1]], ["tile_rc", "sp", [-1, 1]], ["tile_rd", "sp", [-1, 1]], ["tile_ry", "sp", [-1, 2]], ["tile_rx", "sp", [-1, 4]], ["auto_unroll_max_step", "ot", 1500], ["unroll_explicit", "ot", 1], ["fuse_yx", "ot", 1]]}], "r": [[0.07371397, 0.07437093475], 0, 1.6909639835357666, 1578503339.0859928], "v": 0.1}
{"i": ["cuda", "schedule_conv3d_nchw_cuda", [[24, 1, 64, 128, 128], [12, 1, 64, 128, 128], 1, [0, 0, 0], [1, 1, 1], 1], {}, ["schedule_conv3d_nchw_cuda", [24, 1, 64, 128, 128], [12, 1, 64, 128, 128], 1, [0, 0, 0], [1, 1, 1], 1], {"i": 13982074, "t": "", "c": null, "e": [["tile_n", "sp", [-1, 3, 1, 8]], ["tile_f", "sp", [-1, 1, 6, 1]], ["tile_d", "sp", [-1, 1, 1, 1]], ["tile_y", "sp", [-1, 1, 1, 1]], ["tile_x", "sp", [-1, 1, 1, 1]], ["tile_rc", "sp", [-1, 1]], ["tile_rd", "sp", [-1, 2]], ["tile_ry", "sp", [-1, 1]], ["tile_rx", "sp", [-1, 64]], ["auto_unroll_max_step", "ot", 0], ["unroll_explicit", "ot", 1], ["fuse_yx", "ot", 1]]}], "r": [[0.230183835, 0.230152448], 0, 3.103087902069092, 1578503353.4298615], "v": 0.1}
{"i": ["cuda", "schedule_conv3d_nchw_cuda", [[24, 1, 64, 128, 128], [12, 1, 64, 128, 128], 1, [0, 0, 0], [1, 1, 1], 1], {}, ["schedule_conv3d_nchw_cuda", [24, 1, 64, 128, 128], [12, 1, 64, 128, 128], 1, [0, 0, 0], [1, 1, 1], 1], {"i": 4431483, "t": "", "c": null, "e": [["tile_n", "sp", [-1, 1, 4, 2]], ["tile_f", "sp", [-1, 1, 1, 4]], ["tile_d", "sp", [-1, 1, 1, 1]], ["tile_y", "sp", [-1, 1, 1, 1]], ["tile_x", "sp", [-1, 1, 1, 1]], ["tile_rc", "sp", [-1, 1]], ["tile_rd", "sp", [-1, 32]], ["tile_ry", "sp", [-1, 32]], ["tile_rx", "sp", [-1, 1]], ["auto_unroll_max_step", "ot", 0], ["unroll_explicit", "ot", 1], ["fuse_yx", "ot", 0]]}], "r": [[0.153029651, 0.15030703575], 0, 2.368736982345581, 1578503370.8110394], "v": 0.1}
{"i": ["cuda", "schedule_conv3d_nchw_cuda", [[24, 1, 64, 128, 128], [12, 1, 64, 128, 128], 1, [0, 0, 0], [1, 1, 1], 1], {}, ["schedule_conv3d_nchw_cuda", [24, 1, 64, 128, 128], [12, 1, 64, 128, 128], 1, [0, 0, 0], [1, 1, 1], 1], {"i": 12257431, "t": "", "c": null, "e": [["tile_n", "sp", [-1, 2, 2, 6]], ["tile_f", "sp", [-1, 1, 12, 1]], ["tile_d", "sp", [-1, 1, 1, 1]], ["tile_y", "sp", [-1, 1, 1, 1]], ["tile_x", "sp", [-1, 1, 1, 1]], ["tile_rc", "sp", [-1, 1]], ["tile_rd", "sp", [-1, 2]], ["tile_ry", "sp", [-1, 8]], ["tile_rx", "sp", [-1, 16]], ["auto_unroll_max_step", "ot", 1500], ["unroll_explicit", "ot", 0], ["fuse_yx", "ot", 1]]}], "r": [[0.20270935525, 0.2026954085], 0, 5.070999383926392, 1578503374.438758], "v": 0.1}
{"i": ["cuda", "schedule_conv3d_nchw_cuda", [[24, 1, 64, 128, 128], [12, 1, 64, 128, 128], 1, [0, 0, 0], [1, 1, 1], 1], {}, ["schedule_conv3d_nchw_cuda", [24, 1, 64, 128, 128], [12, 1, 64, 128, 128], 1, [0, 0, 0], [1, 1, 1], 1], {"i": 8985746, "t": "", "c": null, "e": [["tile_n", "sp", [-1, 1, 6, 4]], ["tile_f", "sp", [-1, 2, 1, 1]], ["tile_d", "sp", [-1, 1, 1, 1]], ["tile_y", "sp", [-1, 1, 1, 1]], ["tile_x", "sp", [-1, 1, 1, 1]], ["tile_rc", "sp", [-1, 1]], ["tile_rd", "sp", [-1, 2]], ["tile_ry", "sp", [-1, 2]], ["tile_rx", "sp", [-1, 4]], ["auto_unroll_max_step", "ot", 0], ["unroll_explicit", "ot", 0], ["fuse_yx", "ot", 1]]}], "r": [[0.1940104695, 0.19397995925], 0, 2.7179293632507324, 1578503377.2215822], "v": 0.1}
{"i": ["cuda", "schedule_conv3d_nchw_cuda", [[24, 1, 64, 128, 128], [12, 1, 64, 128, 128], 1, [0, 0, 0], [1, 1, 1], 1], {}, ["schedule_conv3d_nchw_cuda", [24, 1, 64, 128, 128], [12, 1, 64, 128, 128], 1, [0, 0, 0], [1, 1, 1], 1], {"i": 12983625, "t": "", "c": null, "e": [["tile_n", "sp", [-1, 1, 8, 1]], ["tile_f", "sp", [-1, 1, 6, 1]], ["tile_d", "sp", [-1, 1, 1, 1]], ["tile_y", "sp", [-1, 1, 1, 1]], ["tile_x", "sp", [-1, 1, 1, 1]], ["tile_rc", "sp", [-1, 1]], ["tile_rd", "sp", [-1, 16]], ["tile_ry", "sp", [-1, 8]], ["tile_rx", "sp", [-1, 1]], ["auto_unroll_max_step", "ot", 0], ["unroll_explicit", "ot", 1], ["fuse_yx", "ot", 1]]}], "r": [[0.0811648925, 0.07536383475], 0, 1.7538974285125732, 1578503585.998375], "v": 0.1}
{"i": ["cuda", "schedule_conv3d_nchw_cuda", [[24, 1, 64, 128, 128], [12, 1, 64, 128, 128], 1, [0, 0, 0], [1, 1, 1], 1], {}, ["schedule_conv3d_nchw_cuda", [24, 1, 64, 128, 128], [12, 1, 64, 128, 128], 1, [0, 0, 0], [1, 1, 1], 1], {"i": 8682825, "t": "", "c": null, "e": [["tile_n", "sp", [-1, 1, 8, 1]], ["tile_f", "sp", [-1, 1, 6, 1]], ["tile_d", "sp", [-1, 1, 1, 1]], ["tile_y", "sp", [-1, 1, 1, 1]], ["tile_x", "sp", [-1, 1, 1, 1]], ["tile_rc", "sp", [-1, 1]], ["tile_rd", "sp", [-1, 16]], ["tile_ry", "sp", [-1, 8]], ["tile_rx", "sp", [-1, 1]], ["auto_unroll_max_step", "ot", 0], ["unroll_explicit", "ot", 0], ["fuse_yx", "ot", 1]]}], "r": [[0.07522725875, 0.0752346185], 0, 1.7344114780426025, 1578503587.2239828], "v": 0.1}
{"i": ["cuda", "schedule_conv3d_nchw_cuda", [[24, 1, 64, 128, 128], [12, 1, 64, 128, 128], 1, [0, 0, 0], [1, 1, 1], 1], {}, ["schedule_conv3d_nchw_cuda", [24, 1, 64, 128, 128], [12, 1, 64, 128, 128], 1, [0, 0, 0], [1, 1, 1], 1], {"i": 8615625, "t": "", "c": null, "e": [["tile_n", "sp", [-1, 1, 8, 1]], ["tile_f", "sp", [-1, 1, 6, 1]], ["tile_d", "sp", [-1, 1, 1, 1]], ["tile_y", "sp", [-1, 1, 1, 1]], ["tile_x", "sp", [-1, 1, 1, 1]], ["tile_rc", "sp", [-1, 1]], ["tile_rd", "sp", [-1, 16]], ["tile_ry", "sp", [-1, 1]], ["tile_rx", "sp", [-1, 1]], ["auto_unroll_max_step", "ot", 0], ["unroll_explicit", "ot", 0], ["fuse_yx", "ot", 1]]}], "r": [[0.0377315875, 0.03776625425], 0, 1.3352701663970947, 1578503588.152208], "v": 0.1}
{"i": ["cuda", "schedule_conv3d_nchw_cuda", [[24, 1, 64, 128, 128], [12, 1, 64, 128, 128], 1, [0, 0, 0], [1, 1, 1], 1], {}, ["schedule_conv3d_nchw_cuda", [24, 1, 64, 128, 128], [12, 1, 64, 128, 128], 1, [0, 0, 0], [1, 1, 1], 1], {"i": 8638025, "t": "", "c": null, "e": [["tile_n", "sp", [-1, 1, 8, 1]], ["tile_f", "sp", [-1, 1, 6, 1]], ["tile_d", "sp", [-1, 1, 1, 1]], ["tile_y", "sp", [-1, 1, 1, 1]], ["tile_x", "sp", [-1, 1, 1, 1]], ["tile_rc", "sp", [-1, 1]], ["tile_rd", "sp", [-1, 16]], ["tile_ry", "sp", [-1, 2]], ["tile_rx", "sp", [-1, 1]], ["auto_unroll_max_step", "ot", 0], ["unroll_explicit", "ot", 0], ["fuse_yx", "ot", 1]]}], "r": [[0.03561014625, 0.03558472025], 0, 1.4333100318908691, 1578503589.0778291], "v": 0.1}
{"i": ["cuda", "schedule_conv3d_nchw_cuda", [[24, 1, 64, 128, 128], [12, 1, 64, 128, 128], 1, [0, 0, 0], [1, 1, 1], 1], {}, ["schedule_conv3d_nchw_cuda", [24, 1, 64, 128, 128], [12, 1, 64, 128, 128], 1, [0, 0, 0], [1, 1, 1], 1], {"i": 12916425, "t": "", "c": null, "e": [["tile_n", "sp", [-1, 1, 8, 1]], ["tile_f", "sp", [-1, 1, 6, 1]], ["tile_d", "sp", [-1, 1, 1, 1]], ["tile_y", "sp", [-1, 1, 1, 1]], ["tile_x", "sp", [-1, 1, 1, 1]], ["tile_rc", "sp", [-1, 1]], ["tile_rd", "sp", [-1, 16]], ["tile_ry", "sp", [-1, 1]], ["tile_rx", "sp", [-1, 1]], ["auto_unroll_max_step", "ot", 0], ["unroll_explicit", "ot", 1], ["fuse_yx", "ot", 1]]}], "r": [[0.03755021025, 0.0375652375], 0, 1.3359112739562988, 1578503589.9464035], "v": 0.1}
{"i": ["cuda", "schedule_conv3d_nchw_cuda", [[24, 1, 64, 128, 128], [12, 1, 64, 128, 128], 1, [0, 0, 0], [1, 1, 1], 1], {}, ["schedule_conv3d_nchw_cuda", [24, 1, 64, 128, 128], [12, 1, 64, 128, 128], 1, [0, 0, 0], [1, 1, 1], 1], {"i": 12938825, "t": "", "c": null, "e": [["tile_n", "sp", [-1, 1, 8, 1]], ["tile_f", "sp", [-1, 1, 6, 1]], ["tile_d", "sp", [-1, 1, 1, 1]], ["tile_y", "sp", [-1, 1, 1, 1]], ["tile_x", "sp", [-1, 1, 1, 1]], ["tile_rc", "sp", [-1, 1]], ["tile_rd", "sp", [-1, 16]], ["tile_ry", "sp", [-1, 2]], ["tile_rx", "sp", [-1, 1]], ["auto_unroll_max_step", "ot", 0], ["unroll_explicit", "ot", 1], ["fuse_yx", "ot", 1]]}], "r": [[0.03571387175, 0.03571928425], 0, 1.396263837814331, 1578503590.8281052], "v": 0.1}
{"i": ["cuda", "schedule_conv3d_nchw_cuda", [[24, 1, 64, 128, 128], [12, 1, 64, 128, 128], 1, [0, 0, 0], [1, 1, 1], 1], {}, ["schedule_conv3d_nchw_cuda", [24, 1, 64, 128, 128], [12, 1, 64, 128, 128], 1, [0, 0, 0], [1, 1, 1], 1], {"i": 8858825, "t": "", "c": null, "e": [["tile_n", "sp", [-1, 1, 8, 1]], ["tile_f", "sp", [-1, 1, 6, 1]], ["tile_d", "sp", [-1, 1, 1, 1]], ["tile_y", "sp", [-1, 1, 1, 1]], ["tile_x", "sp", [-1, 1, 1, 1]], ["tile_rc", "sp", [-1, 1]], ["tile_rd", "sp", [-1, 8]], ["tile_ry", "sp", [-1, 8]], ["tile_rx", "sp", [-1, 2]], ["auto_unroll_max_step", "ot", 0], ["unroll_explicit", "ot", 0], ["fuse_yx", "ot", 1]]}], "r": [[0.04444983225, 0.044443545], 0, 1.4346015453338623, 1578503591.8508172], "v": 0.1}
{"i": ["cuda", "schedule_conv3d_nchw_cuda", [[24, 1, 64, 128, 128], [12, 1, 64, 128, 128], 1, [0, 0, 0], [1, 1, 1], 1], {}, ["schedule_conv3d_nchw_cuda", [24, 1, 64, 128, 128], [12, 1, 64, 128, 128], 1, [0, 0, 0], [1, 1, 1], 1], {"i": 13159625, "t": "", "c": null, "e": [["tile_n", "sp", [-1, 1, 8, 1]], ["tile_f", "sp", [-1, 1, 6, 1]], ["tile_d", "sp", [-1, 1, 1, 1]], ["tile_y", "sp", [-1, 1, 1, 1]], ["tile_x", "sp", [-1, 1, 1, 1]], ["tile_rc", "sp", [-1, 1]], ["tile_rd", "sp", [-1, 8]], ["tile_ry", "sp", [-1, 8]], ["tile_rx", "sp", [-1, 2]], ["auto_unroll_max_step", "ot", 0], ["unroll_explicit", "ot", 1], ["fuse_yx", "ot", 1]]}], "r": [[0.04451018, 0.04451104325], 0, 1.442795991897583, 1578503592.8157735], "v": 0.1}
{"i": ["cuda", "schedule_conv3d_nchw_cuda", [[24, 1, 64, 128, 128], [12, 1, 64, 128, 128], 1, [0, 0, 0], [1, 1, 1], 1], {}, ["schedule_conv3d_nchw_cuda", [24, 1, 64, 128, 128], [12, 1, 64, 128, 128], 1, [0, 0, 0], [1, 1, 1], 1], {"i": 8634825, "t": "", "c": null, "e": [["tile_n", "sp", [-1, 1, 8, 1]], ["tile_f", "sp", [-1, 1, 6, 1]], ["tile_d", "sp", [-1, 1, 1, 1]], ["tile_y", "sp", [-1, 1, 1, 1]], ["tile_x", "sp", [-1, 1, 1, 1]], ["tile_rc", "sp", [-1, 1]], ["tile_rd", "sp", [-1, 8]], ["tile_ry", "sp", [-1, 2]], ["tile_rx", "sp", [-1, 1]], ["auto_unroll_max_step", "ot", 0], ["unroll_explicit", "ot", 0], ["fuse_yx", "ot", 1]]}], "r": [[0.0235548615, 0.02354913425], 0, 1.508455514907837, 1578503593.7972143], "v": 0.1}
{"i": ["cuda", "schedule_conv3d_nchw_cuda", [[24, 1, 64, 128, 128], [12, 1, 64, 128, 128], 1, [0, 0, 0], [1, 1, 1], 1], {}, ["schedule_conv3d_nchw_cuda", [24, 1, 64, 128, 128], [12, 1, 64, 128, 128], 1, [0, 0, 0], [1, 1, 1], 1], {"i": 12935625, "t": "", "c": null, "e": [["tile_n", "sp", [-1, 1, 8, 1]], ["tile_f", "sp", [-1, 1, 6, 1]], ["tile_d", "sp", [-1, 1, 1, 1]], ["tile_y", "sp", [-1, 1, 1, 1]], ["tile_x", "sp", [-1, 1, 1, 1]], ["tile_rc", "sp", [-1, 1]], ["tile_rd", "sp", [-1, 8]], ["tile_ry", "sp", [-1, 2]], ["tile_rx", "sp", [-1, 1]], ["auto_unroll_max_step", "ot", 0], ["unroll_explicit", "ot", 1], ["fuse_yx", "ot", 1]]}], "r": [[0.02349704775, 0.02349788], 0, 1.3174455165863037, 1578503594.5620847], "v": 0.1}
{"i": ["cuda", "schedule_conv3d_nchw_cuda", [[24, 1, 64, 128, 128], [12, 1, 64, 128, 128], 1, [0, 0, 0], [1, 1, 1], 1], {}, ["schedule_conv3d_nchw_cuda", [24, 1, 64, 128, 128], [12, 1, 64, 128, 128], 1, [0, 0, 0], [1, 1, 1], 1], {"i": 12932425, "t": "", "c": null, "e": [["tile_n", "sp", [-1, 1, 8, 1]], ["tile_f", "sp", [-1, 1, 6, 1]], ["tile_d", "sp", [-1, 1, 1, 1]], ["tile_y", "sp", [-1, 1, 1, 1]], ["tile_x", "sp", [-1, 1, 1, 1]], ["tile_rc", "sp", [-1, 1]], ["tile_rd", "sp", [-1, 4]], ["tile_ry", "sp", [-1, 2]], ["tile_rx", "sp", [-1, 1]], ["auto_unroll_max_step", "ot", 0], ["unroll_explicit", "ot", 1], ["fuse_yx", "ot", 1]]}], "r": [[0.0402260715, 0.040227705], 0, 1.457538366317749, 1578503595.58304], "v": 0.1}
{"i": ["cuda", "schedule_conv3d_nchw_cuda", [[24, 1, 64, 128, 128], [12, 1, 64, 128, 128], 1, [0, 0, 0], [1, 1, 1], 1], {}, ["schedule_conv3d_nchw_cuda", [24, 1, 64, 128, 128], [12, 1, 64, 128, 128], 1, [0, 0, 0], [1, 1, 1], 1], {"i": 8631625, "t": "", "c": null, "e": [["tile_n", "sp", [-1, 1, 8, 1]], ["tile_f", "sp", [-1, 1, 6, 1]], ["tile_d", "sp", [-1, 1, 1, 1]], ["tile_y", "sp", [-1, 1, 1, 1]], ["tile_x", "sp", [-1, 1, 1, 1]], ["tile_rc", "sp", [-1, 1]], ["tile_rd", "sp", [-1, 4]], ["tile_ry", "sp", [-1, 2]], ["tile_rx", "sp", [-1, 1]], ["auto_unroll_max_step", "ot", 0], ["unroll_explicit", "ot", 0], ["fuse_yx", "ot", 1]]}], "r": [[0.0401224475, 0.040125081], 0, 1.2759721279144287, 1578503596.5045302], "v": 0.1}
{"i": ["cuda", "schedule_conv3d_nchw_cuda", [[24, 1, 64, 128, 128], [12, 1, 64, 128, 128], 1, [0, 0, 0], [1, 1, 1], 1], {}, ["schedule_conv3d_nchw_cuda", [24, 1, 64, 128, 128], [12, 1, 64, 128, 128], 1, [0, 0, 0], [1, 1, 1], 1], {"i": 15850825, "t": "", "c": null, "e": [["tile_n", "sp", [-1, 1, 8, 1]], ["tile_f", "sp", [-1, 1, 6, 1]], ["tile_d", "sp", [-1, 1, 1, 1]], ["tile_y", "sp", [-1, 1, 1, 1]], ["tile_x", "sp", [-1, 1, 1, 1]], ["tile_rc", "sp", [-1, 1]], ["tile_rd", "sp", [-1, 16]], ["tile_ry", "sp", [-1, 8]], ["tile_rx", "sp", [-1, 1]], ["auto_unroll_max_step", "ot", 1500], ["unroll_explicit", "ot", 1], ["fuse_yx", "ot", 1]]}], "r": [[0.02344076575, 0.0234315085], 0, 1.489633560180664, 1578503599.1251974], "v": 0.1}
{"i": ["cuda", "schedule_conv3d_nchw_cuda", [[24, 1, 64, 128, 128], [12, 1, 64, 128, 128], 1, [0, 0, 0], [1, 1, 1], 1], {}, ["schedule_conv3d_nchw_cuda", [24, 1, 64, 128, 128], [12, 1, 64, 128, 128], 1, [0, 0, 0], [1, 1, 1], 1], {"i": 10116425, "t": "", "c": null, "e": [["tile_n", "sp", [-1, 1, 8, 1]], ["tile_f", "sp", [-1, 1, 6, 1]], ["tile_d", "sp", [-1, 1, 1, 1]], ["tile_y", "sp", [-1, 1, 1, 1]], ["tile_x", "sp", [-1, 1, 1, 1]], ["tile_rc", "sp", [-1, 1]], ["tile_rd", "sp", [-1, 16]], ["tile_ry", "sp", [-1, 8]], ["tile_rx", "sp", [-1, 1]], ["auto_unroll_max_step", "ot", 512], ["unroll_explicit", "ot", 0], ["fuse_yx", "ot", 1]]}], "r": [[0.02428729725, 0.02428732975], 0, 1.5393383502960205, 1578503599.9948072], "v": 0.1}
{"i": ["cuda", "schedule_conv3d_nchw_cuda", [[24, 1, 64, 128, 128], [12, 1, 64, 128, 128], 1, [0, 0, 0], [1, 1, 1], 1], {}, ["schedule_conv3d_nchw_cuda", [24, 1, 64, 128, 128], [12, 1, 64, 128, 128], 1, [0, 0, 0], [1, 1, 1], 1], {"i": 14417225, "t": "", "c": null, "e": [["tile_n", "sp", [-1, 1, 8, 1]], ["tile_f", "sp", [-1, 1, 6, 1]], ["tile_d", "sp", [-1, 1, 1, 1]], ["tile_y", "sp", [-1, 1, 1, 1]], ["tile_x", "sp", [-1, 1, 1, 1]], ["tile_rc", "sp", [-1, 1]], ["tile_rd", "sp", [-1, 16]], ["tile_ry", "sp", [-1, 8]], ["tile_rx", "sp", [-1, 1]], ["auto_unroll_max_step", "ot", 512], ["unroll_explicit", "ot", 1], ["fuse_yx", "ot", 1]]}], "r": [[0.02392553425, 0.023909196], 0, 1.5527925491333008, 1578503600.778364], "v": 0.1}
{"i": ["cuda", "schedule_conv3d_nchw_cuda", [[24, 1, 64, 128, 128], [12, 1, 64, 128, 128], 1, [0, 0, 0], [1, 1, 1], 1], {}, ["schedule_conv3d_nchw_cuda", [24, 1, 64, 128, 128], [12, 1, 64, 128, 128], 1, [0, 0, 0], [1, 1, 1], 1], {"i": 11550025, "t": "", "c": null, "e": [["tile_n", "sp", [-1, 1, 8, 1]], ["tile_f", "sp", [-1, 1, 6, 1]], ["tile_d", "sp", [-1, 1, 1, 1]], ["tile_y", "sp", [-1, 1, 1, 1]], ["tile_x", "sp", [-1, 1, 1, 1]], ["tile_rc", "sp", [-1, 1]], ["tile_rd", "sp", [-1, 16]], ["tile_ry", "sp", [-1, 8]], ["tile_rx", "sp", [-1, 1]], ["auto_unroll_max_step", "ot", 1500], ["unroll_explicit", "ot", 0], ["fuse_yx", "ot", 1]]}], "r": [[0.02407796075, 0.0240780085], 0, 1.4505164623260498, 1578503601.5871851], "v": 0.1}
{"i": ["cuda", "schedule_conv3d_nchw_cuda", [[24, 1, 64, 128, 128], [12, 1, 64, 128, 128], 1, [0, 0, 0], [1, 1, 1], 1], {}, ["schedule_conv3d_nchw_cuda", [24, 1, 64, 128, 128], [12, 1, 64, 128, 128], 1, [0, 0, 0], [1, 1, 1], 1], {"i": 8702025, "t": "", "c": null, "e": [["tile_n", "sp", [-1, 1, 8, 1]], ["tile_f", "sp", [-1, 1, 6, 1]], ["tile_d", "sp", [-1, 1, 1, 1]], ["tile_y", "sp", [-1, 1, 1, 1]], ["tile_x", "sp", [-1, 1, 1, 1]], ["tile_rc", "sp", [-1, 1]], ["tile_rd", "sp", [-1, 8]], ["tile_ry", "sp", [-1, 16]], ["tile_rx", "sp", [-1, 1]], ["auto_unroll_max_step", "ot", 0], ["unroll_explicit", "ot", 0], ["fuse_yx", "ot", 1]]}], "r": [[0.07435656825, 0.07435421], 0, 1.7727241516113281, 1578503602.8370435], "v": 0.1}
{"i": ["cuda", "schedule_conv3d_nchw_cuda", [[24, 1, 64, 128, 128], [12, 1, 64, 128, 128], 1, [0, 0, 0], [1, 1, 1], 1], {}, ["schedule_conv3d_nchw_cuda", [24, 1, 64, 128, 128], [12, 1, 64, 128, 128], 1, [0, 0, 0], [1, 1, 1], 1], {"i": 13002825, "t": "", "c": null, "e": [["tile_n", "sp", [-1, 1, 8, 1]], ["tile_f", "sp", [-1, 1, 6, 1]], ["tile_d", "sp", [-1, 1, 1, 1]], ["tile_y", "sp", [-1, 1, 1, 1]], ["tile_x", "sp", [-1, 1, 1, 1]], ["tile_rc", "sp", [-1, 1]], ["tile_rd", "sp", [-1, 8]], ["tile_ry", "sp", [-1, 16]], ["tile_rx", "sp", [-1, 1]], ["auto_unroll_max_step", "ot", 0], ["unroll_explicit", "ot", 1], ["fuse_yx", "ot", 1]]}], "r": [[0.07460004475, 0.074598922], 0, 1.765491008758545, 1578503604.0647836], "v": 0.1}
{"i": ["cuda", "schedule_conv3d_nchw_cuda", [[24, 1, 64, 128, 128], [12, 1, 64, 128, 128], 1, [0, 0, 0], [1, 1, 1], 1], {}, ["schedule_conv3d_nchw_cuda", [24, 1, 64, 128, 128], [12, 1, 64, 128, 128], 1, [0, 0, 0], [1, 1, 1], 1], {"i": 12938414, "t": "", "c": null, "e": [["tile_n", "sp", [-1, 1, 3, 1]], ["tile_f", "sp", [-1, 1, 3, 1]], ["tile_d", "sp", [-1, 1, 1, 1]], ["tile_y", "sp", [-1, 1, 1, 1]], ["tile_x", "sp", [-1, 1, 1, 1]], ["tile_rc", "sp", [-1, 1]], ["tile_rd", "sp", [-1, 16]], ["tile_ry", "sp", [-1, 2]], ["tile_rx", "sp", [-1, 1]], ["auto_unroll_max_step", "ot", 0], ["unroll_explicit", "ot", 1], ["fuse_yx", "ot", 1]]}], "r": [[0.02578743425, 0.02578944025], 0, 1.3372759819030762, 1578503604.902682], "v": 0.1}
{"i": ["cuda", "schedule_conv3d_nchw_cuda", [[24, 1, 64, 128, 128], [12, 1, 64, 128, 128], 1, [0, 0, 0], [1, 1, 1], 1], {}, ["schedule_conv3d_nchw_cuda", [24, 1, 64, 128, 128], [12, 1, 64, 128, 128], 1, [0, 0, 0], [1, 1, 1], 1], {"i": 8637614, "t": "", "c": null, "e": [["tile_n", "sp", [-1, 1, 3, 1]], ["tile_f", "sp", [-1, 1, 3, 1]], ["tile_d", "sp", [-1, 1, 1, 1]], ["tile_y", "sp", [-1, 1, 1, 1]], ["tile_x", "sp", [-1, 1, 1, 1]], ["tile_rc", "sp", [-1, 1]], ["tile_rd", "sp", [-1, 16]], ["tile_ry", "sp", [-1, 2]], ["tile_rx", "sp", [-1, 1]], ["auto_unroll_max_step", "ot", 0], ["unroll_explicit", "ot", 0], ["fuse_yx", "ot", 1]]}], "r": [[0.02578985275, 0.02579024025], 0, 1.3576703071594238, 1578503605.6988754], "v": 0.1}
{"i": ["cuda", "schedule_conv3d_nchw_cuda", [[24, 1, 64, 128, 128], [12, 1, 64, 128, 128], 1, [0, 0, 0], [1, 1, 1], 1], {}, ["schedule_conv3d_nchw_cuda", [24, 1, 64, 128, 128], [12, 1, 64, 128, 128], 1, [0, 0, 0], [1, 1, 1], 1], {"i": 8682822, "t": "", "c": null, "e": [["tile_n", "sp", [-1, 1, 6, 1]], ["tile_f", "sp", [-1, 1, 6, 1]], ["tile_d", "sp", [-1, 1, 1, 1]], ["tile_y", "sp", [-1, 1, 1, 1]], ["tile_x", "sp", [-1, 1, 1, 1]], ["tile_rc", "sp", [-1, 1]], ["tile_rd", "sp", [-1, 16]], ["tile_ry", "sp", [-1, 8]], ["tile_rx", "sp", [-1, 1]], ["auto_unroll_max_step", "ot", 0], ["unroll_explicit", "ot", 0], ["fuse_yx", "ot", 1]]}], "r": [[0.03169881425, 0.03169357325], 0, 1.39237380027771, 1578503606.6008615], "v": 0.1}
{"i": ["cuda", "schedule_conv3d_nchw_cuda", [[24, 1, 64, 128, 128], [12, 1, 64, 128, 128], 1, [0, 0, 0], [1, 1, 1], 1], {}, ["schedule_conv3d_nchw_cuda", [24, 1, 64, 128, 128], [12, 1, 64, 128, 128], 1, [0, 0, 0], [1, 1, 1], 1], {"i": 12983622, "t": "", "c": null, "e": [["tile_n", "sp", [-1, 1, 6, 1]], ["tile_f", "sp", [-1, 1, 6, 1]], ["tile_d", "sp", [-1, 1, 1, 1]], ["tile_y", "sp", [-1, 1, 1, 1]], ["tile_x", "sp", [-1, 1, 1, 1]], ["tile_rc", "sp", [-1, 1]], ["tile_rd", "sp", [-1, 16]], ["tile_ry", "sp", [-1, 8]], ["tile_rx", "sp", [-1, 1]], ["auto_unroll_max_step", "ot", 0], ["unroll_explicit", "ot", 1], ["fuse_yx", "ot", 1]]}], "r": [[0.031723368, 0.03169583125], 0, 1.327754020690918, 1578503607.4404902], "v": 0.1}
{"i": ["cuda", "schedule_conv3d_nchw_cuda", [[24, 1, 64, 128, 128], [12, 1, 64, 128, 128], 1, [0, 0, 0], [1, 1, 1], 1], {}, ["schedule_conv3d_nchw_cuda", [24, 1, 64, 128, 128], [12, 1, 64, 128, 128], 1, [0, 0, 0], [1, 1, 1], 1], {"i": 13111625, "t": "", "c": null, "e": [["tile_n", "sp", [-1, 1, 8, 1]], ["tile_f", "sp", [-1, 1, 6, 1]], ["tile_d", "sp", [-1, 1, 1, 1]], ["tile_y", "sp", [-1, 1, 1, 1]], ["tile_x", "sp", [-1, 1, 1, 1]], ["tile_rc", "sp", [-1, 1]], ["tile_rd", "sp", [-1, 4]], ["tile_ry", "sp", [-1, 2]], ["tile_rx", "sp", [-1, 2]], ["auto_unroll_max_step", "ot", 0], ["unroll_explicit", "ot", 1], ["fuse_yx", "ot", 1]]}], "r": [[0.023353438, 0.023354847], 0, 1.3838636875152588, 1578503608.3599684], "v": 0.1}
{"i": ["cuda", "schedule_conv3d_nchw_cuda", [[24, 1, 64, 128, 128], [12, 1, 64, 128, 128], 1, [0, 0, 0], [1, 1, 1], 1], {}, ["schedule_conv3d_nchw_cuda", [24, 1, 64, 128, 128], [12, 1, 64, 128, 128], 1, [0, 0, 0], [1, 1, 1], 1], {"i": 8810825, "t": "", "c": null, "e": [["tile_n", "sp", [-1, 1, 8, 1]], ["tile_f", "sp", [-1, 1, 6, 1]], ["tile_d", "sp", [-1, 1, 1, 1]], ["tile_y", "sp", [-1, 1, 1, 1]], ["tile_x", "sp", [-1, 1, 1, 1]], ["tile_rc", "sp", [-1, 1]], ["tile_rd", "sp", [-1, 4]], ["tile_ry", "sp", [-1, 2]], ["tile_rx", "sp", [-1, 2]], ["auto_unroll_max_step", "ot", 0], ["unroll_explicit", "ot", 0], ["fuse_yx", "ot", 1]]}], "r": [[0.02339614975, 0.02339651325], 0, 1.1861538887023926, 1578503609.1076567], "v": 0.1}
{"i": ["cuda", "schedule_conv3d_nchw_cuda", [[24, 1, 64, 128, 128], [12, 1, 64, 128, 128], 1, [0, 0, 0], [1, 1, 1], 1], {}, ["schedule_conv3d_nchw_cuda", [24, 1, 64, 128, 128], [12, 1, 64, 128, 128], 1, [0, 0, 0], [1, 1, 1], 1], {"i": 13290825, "t": "", "c": null, "e": [["tile_n", "sp", [-1, 1, 8, 1]], ["tile_f", "sp", [-1, 1, 6, 1]], ["tile_d", "sp", [-1, 1, 1, 1]], ["tile_y", "sp", [-1, 1, 1, 1]], ["tile_x", "sp", [-1, 1, 1, 1]], ["tile_rc", "sp", [-1, 1]], ["tile_rd", "sp", [-1, 4]], ["tile_ry", "sp", [-1, 2]], ["tile_rx", "sp", [-1, 4]], ["auto_unroll_max_step", "ot", 0], ["unroll_explicit", "ot", 1], ["fuse_yx", "ot", 1]]}], "r": [[0.03580792275, 0.035825131], 0, 1.2096481323242188, 1578503611.7587464], "v": 0.1}
{"i": ["cuda", "schedule_conv3d_nchw_cuda", [[24, 1, 64, 128, 128], [12, 1, 64, 128, 128], 1, [0, 0, 0], [1, 1, 1], 1], {}, ["schedule_conv3d_nchw_cuda", [24, 1, 64, 128, 128], [12, 1, 64, 128, 128], 1, [0, 0, 0], [1, 1, 1], 1], {"i": 13268425, "t": "", "c": null, "e": [["tile_n", "sp", [-1, 1, 8, 1]], ["tile_f", "sp", [-1, 1, 6, 1]], ["tile_d", "sp", [-1, 1, 1, 1]], ["tile_y", "sp", [-1, 1, 1, 1]], ["tile_x", "sp", [-1, 1, 1, 1]], ["tile_rc", "sp", [-1, 1]], ["tile_rd", "sp", [-1, 4]], ["tile_ry", "sp", [-1, 1]], ["tile_rx", "sp", [-1, 4]], ["auto_unroll_max_step", "ot", 0], ["unroll_explicit", "ot", 1], ["fuse_yx", "ot", 1]]}], "r": [[0.03637174725, 0.03637594025], 0, 1.3038568496704102, 1578503612.662339], "v": 0.1}
{"i": ["cuda", "schedule_conv3d_nchw_cuda", [[24, 1, 64, 128, 128], [12, 1, 64, 128, 128], 1, [0, 0, 0], [1, 1, 1], 1], {}, ["schedule_conv3d_nchw_cuda", [24, 1, 64, 128, 128], [12, 1, 64, 128, 128], 1, [0, 0, 0], [1, 1, 1], 1], {"i": 8990025, "t": "", "c": null, "e": [["tile_n", "sp", [-1, 1, 8, 1]], ["tile_f", "sp", [-1, 1, 6, 1]], ["tile_d", "sp", [-1, 1, 1, 1]], ["tile_y", "sp", [-1, 1, 1, 1]], ["tile_x", "sp", [-1, 1, 1, 1]], ["tile_rc", "sp", [-1, 1]], ["tile_rd", "sp", [-1, 4]], ["tile_ry", "sp", [-1, 2]], ["tile_rx", "sp", [-1, 4]], ["auto_unroll_max_step", "ot", 0], ["unroll_explicit", "ot", 0], ["fuse_yx", "ot", 1]]}], "r": [[0.03551756925, 0.03553556625], 0, 1.3049607276916504, 1578503613.5506794], "v": 0.1}
{"i": ["cuda", "schedule_conv3d_nchw_cuda", [[24, 1, 64, 128, 128], [12, 1, 64, 128, 128], 1, [0, 0, 0], [1, 1, 1], 1], {}, ["schedule_conv3d_nchw_cuda", [24, 1, 64, 128, 128], [12, 1, 64, 128, 128], 1, [0, 0, 0], [1, 1, 1], 1], {"i": 8612425, "t": "", "c": null, "e": [["tile_n", "sp", [-1, 1, 8, 1]], ["tile_f", "sp", [-1, 1, 6, 1]], ["tile_d", "sp", [-1, 1, 1, 1]], ["tile_y", "sp", [-1, 1, 1, 1]], ["tile_x", "sp", [-1, 1, 1, 1]], ["tile_rc", "sp", [-1, 1]], ["tile_rd", "sp", [-1, 8]], ["tile_ry", "sp", [-1, 1]], ["tile_rx", "sp", [-1, 1]], ["auto_unroll_max_step", "ot", 0], ["unroll_explicit", "ot", 0], ["fuse_yx", "ot", 1]]}], "r": [[0.029162155, 0.029137431], 0, 1.4701642990112305, 1578503614.5514126], "v": 0.1}
{"i": ["cuda", "schedule_conv3d_nchw_cuda", [[24, 1, 64, 128, 128], [12, 1, 64, 128, 128], 1, [0, 0, 0], [1, 1, 1], 1], {}, ["schedule_conv3d_nchw_cuda", [24, 1, 64, 128, 128], [12, 1, 64, 128, 128], 1, [0, 0, 0], [1, 1, 1], 1], {"i": 12913225, "t": "", "c": null, "e": [["tile_n", "sp", [-1, 1, 8, 1]], ["tile_f", "sp", [-1, 1, 6, 1]], ["tile_d", "sp", [-1, 1, 1, 1]], ["tile_y", "sp", [-1, 1, 1, 1]], ["tile_x", "sp", [-1, 1, 1, 1]], ["tile_rc", "sp", [-1, 1]], ["tile_rd", "sp", [-1, 8]], ["tile_ry", "sp", [-1, 1]], ["tile_rx", "sp", [-1, 1]], ["auto_unroll_max_step", "ot", 0], ["unroll_explicit", "ot", 1], ["fuse_yx", "ot", 1]]}], "r": [[0.0291974015, 0.02919840575], 0, 1.2486557960510254, 1578503615.3646338], "v": 0.1}
{"i": ["cuda", "schedule_conv3d_nchw_cuda", [[24, 1, 64, 128, 128], [12, 1, 64, 128, 128], 1, [0, 0, 0], [1, 1, 1], 1], {}, ["schedule_conv3d_nchw_cuda", [24, 1, 64, 128, 128], [12, 1, 64, 128, 128], 1, [0, 0, 0], [1, 1, 1], 1], {"i": 12961225, "t": "", "c": null, "e": [["tile_n", "sp", [-1, 1, 8, 1]], ["tile_f", "sp", [-1, 1, 6, 1]], ["tile_d", "sp", [-1, 1, 1, 1]], ["tile_y", "sp", [-1, 1, 1, 1]], ["tile_x", "sp", [-1, 1, 1, 1]], ["tile_rc", "sp", [-1, 1]], ["tile_rd", "sp", [-1, 16]], ["tile_ry", "sp", [-1, 4]], ["tile_rx", "sp", [-1, 1]], ["auto_unroll_max_step", "ot", 0], ["unroll_explicit", "ot", 1], ["fuse_yx", "ot", 1]]}], "r": [[0.0253539765, 0.02535245], 0, 1.3423805236816406, 1578503616.205534], "v": 0.1}
{"i": ["cuda", "schedule_conv3d_nchw_cuda", [[24, 1, 64, 128, 128], [12, 1, 64, 128, 128], 1, [0, 0, 0], [1, 1, 1], 1], {}, ["schedule_conv3d_nchw_cuda", [24, 1, 64, 128, 128], [12, 1, 64, 128, 128], 1, [0, 0, 0], [1, 1, 1], 1], {"i": 8660425, "t": "", "c": null, "e": [["tile_n", "sp", [-1, 1, 8, 1]], ["tile_f", "sp", [-1, 1, 6, 1]], ["tile_d", "sp", [-1, 1, 1, 1]], ["tile_y", "sp", [-1, 1, 1, 1]], ["tile_x", "sp", [-1, 1, 1, 1]], ["tile_rc", "sp", [-1, 1]], ["tile_rd", "sp", [-1, 16]], ["tile_ry", "sp", [-1, 4]], ["tile_rx", "sp", [-1, 1]], ["auto_unroll_max_step", "ot", 0], ["unroll_explicit", "ot", 0], ["fuse_yx", "ot", 1]]}], "r": [[0.025390662, 0.02540329025], 0, 1.237971544265747, 1578503617.0025704], "v": 0.1}
{"i": ["cuda", "schedule_conv3d_nchw_cuda", [[24, 1, 64, 128, 128], [12, 1, 64, 128, 128], 1, [0, 0, 0], [1, 1, 1], 1], {}, ["schedule_conv3d_nchw_cuda", [24, 1, 64, 128, 128], [12, 1, 64, 128, 128], 1, [0, 0, 0], [1, 1, 1], 1], {"i": 12932429, "t": "", "c": null, "e": [["tile_n", "sp", [-1, 1, 24, 1]], ["tile_f", "sp", [-1, 1, 6, 1]], ["tile_d", "sp", [-1, 1, 1, 1]], ["tile_y", "sp", [-1, 1, 1, 1]], ["tile_x", "sp", [-1, 1, 1, 1]], ["tile_rc", "sp", [-1, 1]], ["tile_rd", "sp", [-1, 4]], ["tile_ry", "sp", [-1, 2]], ["tile_rx", "sp", [-1, 1]], ["auto_unroll_max_step", "ot", 0], ["unroll_explicit", "ot", 1], ["fuse_yx", "ot", 1]]}], "r": [[0.03862809075, 0.038624749], 0, 1.3828749656677246, 1578503618.0045033], "v": 0.1}
{"i": ["cuda", "schedule_conv3d_nchw_cuda", [[24, 1, 64, 128, 128], [12, 1, 64, 128, 128], 1, [0, 0, 0], [1, 1, 1], 1], {}, ["schedule_conv3d_nchw_cuda", [24, 1, 64, 128, 128], [12, 1, 64, 128, 128], 1, [0, 0, 0], [1, 1, 1], 1], {"i": 8631629, "t": "", "c": null, "e": [["tile_n", "sp", [-1, 1, 24, 1]], ["tile_f", "sp", [-1, 1, 6, 1]], ["tile_d", "sp", [-1, 1, 1, 1]], ["tile_y", "sp", [-1, 1, 1, 1]], ["tile_x", "sp", [-1, 1, 1, 1]], ["tile_rc", "sp", [-1, 1]], ["tile_rd", "sp", [-1, 4]], ["tile_ry", "sp", [-1, 2]], ["tile_rx", "sp", [-1, 1]], ["auto_unroll_max_step", "ot", 0], ["unroll_explicit", "ot", 0], ["fuse_yx", "ot", 1]]}], "r": [[0.03852511775, 0.03852764725], 0, 1.3354876041412354, 1578503618.9070113], "v": 0.1}
{"i": ["cuda", "schedule_conv3d_nchw_cuda", [[24, 1, 64, 128, 128], [12, 1, 64, 128, 128], 1, [0, 0, 0], [1, 1, 1], 1], {}, ["schedule_conv3d_nchw_cuda", [24, 1, 64, 128, 128], [12, 1, 64, 128, 128], 1, [0, 0, 0], [1, 1, 1], 1], {"i": 12938408, "t": "", "c": null, "e": [["tile_n", "sp", [-1, 1, 2, 1]], ["tile_f", "sp", [-1, 1, 3, 1]], ["tile_d", "sp", [-1, 1, 1, 1]], ["tile_y", "sp", [-1, 1, 1, 1]], ["tile_x", "sp", [-1, 1, 1, 1]], ["tile_rc", "sp", [-1, 1]], ["tile_rd", "sp", [-1, 16]], ["tile_ry", "sp", [-1, 2]], ["tile_rx", "sp", [-1, 1]], ["auto_unroll_max_step", "ot", 0], ["unroll_explicit", "ot", 1], ["fuse_yx", "ot", 1]]}], "r": [[0.039157031, 0.039233678], 0, 1.4578056335449219, 1578503619.8757644], "v": 0.1}
{"i": ["cuda", "schedule_conv3d_nchw_cuda", [[24, 1, 64, 128, 128], [12, 1, 64, 128, 128], 1, [0, 0, 0], [1, 1, 1], 1], {}, ["schedule_conv3d_nchw_cuda", [24, 1, 64, 128, 128], [12, 1, 64, 128, 128], 1, [0, 0, 0], [1, 1, 1], 1], {"i": 12916008, "t": "", "c": null, "e": [["tile_n", "sp", [-1, 1, 2, 1]], ["tile_f", "sp", [-1, 1, 3, 1]], ["tile_d", "sp", [-1, 1, 1, 1]], ["tile_y", "sp", [-1, 1, 1, 1]], ["tile_x", "sp", [-1, 1, 1, 1]], ["tile_rc", "sp", [-1, 1]], ["tile_rd", "sp", [-1, 16]], ["tile_ry", "sp", [-1, 1]], ["tile_rx", "sp", [-1, 1]], ["auto_unroll_max_step", "ot", 0], ["unroll_explicit", "ot", 1], ["fuse_yx", "ot", 1]]}], "r": [[0.0260043375, 0.02598600975], 0, 1.1868555545806885, 1578503620.6990805], "v": 0.1}
{"i": ["cuda", "schedule_conv3d_nchw_cuda", [[24, 1, 64, 128, 128], [12, 1, 64, 128, 128], 1, [0, 0, 0], [1, 1, 1], 1], {}, ["schedule_conv3d_nchw_cuda", [24, 1, 64, 128, 128], [12, 1, 64, 128, 128], 1, [0, 0, 0], [1, 1, 1], 1], {"i": 12932443, "t": "", "c": null, "e": [["tile_n", "sp", [-1, 1, 4, 2]], ["tile_f", "sp", [-1, 1, 6, 1]], ["tile_d", "sp", [-1, 1, 1, 1]], ["tile_y", "sp", [-1, 1, 1, 1]], ["tile_x", "sp", [-1, 1, 1, 1]], ["tile_rc", "sp", [-1, 1]], ["tile_rd", "sp", [-1, 4]], ["tile_ry", "sp", [-1, 2]], ["tile_rx", "sp", [-1, 1]], ["auto_unroll_max_step", "ot", 0], ["unroll_explicit", "ot", 1], ["fuse_yx", "ot", 1]]}], "r": [[0.0458630535, 0.045833577], 0, 1.5290162563323975, 1578503621.841661], "v": 0.1}
{"i": ["cuda", "schedule_conv3d_nchw_cuda", [[24, 1, 64, 128, 128], [12, 1, 64, 128, 128], 1, [0, 0, 0], [1, 1, 1], 1], {}, ["schedule_conv3d_nchw_cuda", [24, 1, 64, 128, 128], [12, 1, 64, 128, 128], 1, [0, 0, 0], [1, 1, 1], 1], {"i": 8631643, "t": "", "c": null, "e": [["tile_n", "sp", [-1, 1, 4, 2]], ["tile_f", "sp", [-1, 1, 6, 1]], ["tile_d", "sp", [-1, 1, 1, 1]], ["tile_y", "sp", [-1, 1, 1, 1]], ["tile_x", "sp", [-1, 1, 1, 1]], ["tile_rc", "sp", [-1, 1]], ["tile_rd", "sp", [-1, 4]], ["tile_ry", "sp", [-1, 2]], ["tile_rx", "sp", [-1, 1]], ["auto_unroll_max_step", "ot", 0], ["unroll_explicit", "ot", 0], ["fuse_yx", "ot", 1]]}], "r": [[0.045856155, 0.0458372925], 0, 1.3149428367614746, 1578503624.4919996], "v": 0.1}
{"i": ["cuda", "schedule_conv3d_nchw_cuda", [[24, 1, 64, 128, 128], [12, 1, 64, 128, 128], 1, [0, 0, 0], [1, 1, 1], 1], {}, ["schedule_conv3d_nchw_cuda", [24, 1, 64, 128, 128], [12, 1, 64, 128, 128], 1, [0, 0, 0], [1, 1, 1], 1], {"i": 10071625, "t": "", "c": null, "e": [["tile_n", "sp", [-1, 1, 8, 1]], ["tile_f", "sp", [-1, 1, 6, 1]], ["tile_d", "sp", [-1, 1, 1, 1]], ["tile_y", "sp", [-1, 1, 1, 1]], ["tile_x", "sp", [-1, 1, 1, 1]], ["tile_rc", "sp", [-1, 1]], ["tile_rd", "sp", [-1, 16]], ["tile_ry", "sp", [-1, 2]], ["tile_rx", "sp", [-1, 1]], ["auto_unroll_max_step", "ot", 512], ["unroll_explicit", "ot", 0], ["fuse_yx", "ot", 1]]}], "r": [[0.03596625825, 0.03596116225], 0, 1.3745522499084473, 1578503625.362667], "v": 0.1}
{"i": ["cuda", "schedule_conv3d_nchw_cuda", [[24, 1, 64, 128, 128], [12, 1, 64, 128, 128], 1, [0, 0, 0], [1, 1, 1], 1], {}, ["schedule_conv3d_nchw_cuda", [24, 1, 64, 128, 128], [12, 1, 64, 128, 128], 1, [0, 0, 0], [1, 1, 1], 1], {"i": 14350025, "t": "", "c": null, "e": [["tile_n", "sp", [-1, 1, 8, 1]], ["tile_f", "sp", [-1, 1, 6, 1]], ["tile_d", "sp", [-1, 1, 1, 1]], ["tile_y", "sp", [-1, 1, 1, 1]], ["tile_x", "sp", [-1, 1, 1, 1]], ["tile_rc", "sp", [-1, 1]], ["tile_rd", "sp", [-1, 16]], ["tile_ry", "sp", [-1, 1]], ["tile_rx", "sp", [-1, 1]], ["auto_unroll_max_step", "ot", 512], ["unroll_explicit", "ot", 1], ["fuse_yx", "ot", 1]]}], "r": [[0.03917480075, 0.039178353], 0, 1.4279842376708984, 1578503626.3026085], "v": 0.1}
{"i": ["cuda", "schedule_conv3d_nchw_cuda", [[24, 1, 64, 128, 128], [12, 1, 64, 128, 128], 1, [0, 0, 0], [1, 1, 1], 1], {}, ["schedule_conv3d_nchw_cuda", [24, 1, 64, 128, 128], [12, 1, 64, 128, 128], 1, [0, 0, 0], [1, 1, 1], 1], {"i": 11505225, "t": "", "c": null, "e": [["tile_n", "sp", [-1, 1, 8, 1]], ["tile_f", "sp", [-1, 1, 6, 1]], ["tile_d", "sp", [-1, 1, 1, 1]], ["tile_y", "sp", [-1, 1, 1, 1]], ["tile_x", "sp", [-1, 1, 1, 1]], ["tile_rc", "sp", [-1, 1]], ["tile_rd", "sp", [-1, 16]], ["tile_ry", "sp", [-1, 2]], ["tile_rx", "sp", [-1, 1]], ["auto_unroll_max_step", "ot", 1500], ["unroll_explicit", "ot", 0], ["fuse_yx", "ot", 1]]}], "r": [[0.036465373, 0.03638590625], 0, 1.3363635540008545, 1578503627.1965942], "v": 0.1}
{"i": ["cuda", "schedule_conv3d_nchw_cuda", [[24, 1, 64, 128, 128], [12, 1, 64, 128, 128], 1, [0, 0, 0], [1, 1, 1], 1], {}, ["schedule_conv3d_nchw_cuda", [24, 1, 64, 128, 128], [12, 1, 64, 128, 128], 1, [0, 0, 0], [1, 1, 1], 1], {"i": 11482825, "t": "", "c": null, "e": [["tile_n", "sp", [-1, 1, 8, 1]], ["tile_f", "sp", [-1, 1, 6, 1]], ["tile_d", "sp", [-1, 1, 1, 1]], ["tile_y", "sp", [-1, 1, 1, 1]], ["tile_x", "sp", [-1, 1, 1, 1]], ["tile_rc", "sp", [-1, 1]], ["tile_rd", "sp", [-1, 16]], ["tile_ry", "sp", [-1, 1]], ["tile_rx", "sp", [-1, 1]], ["auto_unroll_max_step", "ot", 1500], ["unroll_explicit", "ot", 0], ["fuse_yx", "ot", 1]]}], "r": [[0.03814241775, 0.038187473], 0, 1.3988690376281738, 1578503628.1008942], "v": 0.1}
{"i": ["cuda", "schedule_conv3d_nchw_cuda", [[24, 1, 64, 128, 128], [12, 1, 64, 128, 128], 1, [0, 0, 0], [1, 1, 1], 1], {}, ["schedule_conv3d_nchw_cuda", [24, 1, 64, 128, 128], [12, 1, 64, 128, 128], 1, [0, 0, 0], [1, 1, 1], 1], {"i": 10049225, "t": "", "c": null, "e": [["tile_n", "sp", [-1, 1, 8, 1]], ["tile_f", "sp", [-1, 1, 6, 1]], ["tile_d", "sp", [-1, 1, 1, 1]], ["tile_y", "sp", [-1, 1, 1, 1]], ["tile_x", "sp", [-1, 1, 1, 1]], ["tile_rc", "sp", [-1, 1]], ["tile_rd", "sp", [-1, 16]], ["tile_ry", "sp", [-1, 1]], ["tile_rx", "sp", [-1, 1]], ["auto_unroll_max_step", "ot", 512], ["unroll_explicit", "ot", 0], ["fuse_yx", "ot", 1]]}], "r": [[0.03812756725, 0.03812012375], 0, 1.3203821182250977, 1578503628.9857275], "v": 0.1}
{"i": ["cuda", "schedule_conv3d_nchw_cuda", [[24, 1, 64, 128, 128], [12, 1, 64, 128, 128], 1, [0, 0, 0], [1, 1, 1], 1], {}, ["schedule_conv3d_nchw_cuda", [24, 1, 64, 128, 128], [12, 1, 64, 128, 128], 1, [0, 0, 0], [1, 1, 1], 1], {"i": 14372425, "t": "", "c": null, "e": [["tile_n", "sp", [-1, 1, 8, 1]], ["tile_f", "sp", [-1, 1, 6, 1]], ["tile_d", "sp", [-1, 1, 1, 1]], ["tile_y", "sp", [-1, 1, 1, 1]], ["tile_x", "sp", [-1, 1, 1, 1]], ["tile_rc", "sp", [-1, 1]], ["tile_rd", "sp", [-1, 16]], ["tile_ry", "sp", [-1, 2]], ["tile_rx", "sp", [-1, 1]], ["auto_unroll_max_step", "ot", 512], ["unroll_explicit", "ot", 1], ["fuse_yx", "ot", 1]]}], "r": [[0.03081188125, 0.03081603825], 0, 1.4608557224273682, 1578503629.8548613], "v": 0.1}
{"i": ["cuda", "schedule_conv3d_nchw_cuda", [[24, 1, 64, 128, 128], [12, 1, 64, 128, 128], 1, [0, 0, 0], [1, 1, 1], 1], {}, ["schedule_conv3d_nchw_cuda", [24, 1, 64, 128, 128], [12, 1, 64, 128, 128], 1, [0, 0, 0], [1, 1, 1], 1], {"i": 15783625, "t": "", "c": null, "e": [["tile_n", "sp", [-1, 1, 8, 1]], ["tile_f", "sp", [-1, 1, 6, 1]], ["tile_d", "sp", [-1, 1, 1, 1]], ["tile_y", "sp", [-1, 1, 1, 1]], ["tile_x", "sp", [-1, 1, 1, 1]], ["tile_rc", "sp", [-1, 1]], ["tile_rd", "sp", [-1, 16]], ["tile_ry", "sp", [-1, 1]], ["tile_rx", "sp", [-1, 1]], ["auto_unroll_max_step", "ot", 1500], ["unroll_explicit", "ot", 1], ["fuse_yx", "ot", 1]]}], "r": [[0.03912849975, 0.0391241065], 0, 1.3803718090057373, 1578503630.728782], "v": 0.1}
{"i": ["cuda", "schedule_conv3d_nchw_cuda", [[24, 1, 64, 128, 128], [12, 1, 64, 128, 128], 1, [0, 0, 0], [1, 1, 1], 1], {}, ["schedule_conv3d_nchw_cuda", [24, 1, 64, 128, 128], [12, 1, 64, 128, 128], 1, [0, 0, 0], [1, 1, 1], 1], {"i": 15806025, "t": "", "c": null, "e": [["tile_n", "sp", [-1, 1, 8, 1]], ["tile_f", "sp", [-1, 1, 6, 1]], ["tile_d", "sp", [-1, 1, 1, 1]], ["tile_y", "sp", [-1, 1, 1, 1]], ["tile_x", "sp", [-1, 1, 1, 1]], ["tile_rc", "sp", [-1, 1]], ["tile_rd", "sp", [-1, 16]], ["tile_ry", "sp", [-1, 2]], ["tile_rx", "sp", [-1, 1]], ["auto_unroll_max_step", "ot", 1500], ["unroll_explicit", "ot", 1], ["fuse_yx", "ot", 1]]}], "r": [[0.03106560025, 0.0309065925], 0, 1.3618628978729248, 1578503631.5597627], "v": 0.1}
{"i": ["cuda", "schedule_conv3d_nchw_cuda", [[24, 1, 64, 128, 128], [12, 1, 64, 128, 128], 1, [0, 0, 0], [1, 1, 1], 1], {}, ["schedule_conv3d_nchw_cuda", [24, 1, 64, 128, 128], [12, 1, 64, 128, 128], 1, [0, 0, 0], [1, 1, 1], 1], {"i": 12935622, "t": "", "c": null, "e": [["tile_n", "sp", [-1, 1, 6, 1]], ["tile_f", "sp", [-1, 1, 6, 1]], ["tile_d", "sp", [-1, 1, 1, 1]], ["tile_y", "sp", [-1, 1, 1, 1]], ["tile_x", "sp", [-1, 1, 1, 1]], ["tile_rc", "sp", [-1, 1]], ["tile_rd", "sp", [-1, 8]], ["tile_ry", "sp", [-1, 2]], ["tile_rx", "sp", [-1, 1]], ["auto_unroll_max_step", "ot", 0], ["unroll_explicit", "ot", 1], ["fuse_yx", "ot", 1]]}], "r": [[0.02837541675, 0.028374743], 0, 1.601180076599121, 1578503632.646342], "v": 0.1}
{"i": ["cuda", "schedule_conv3d_nchw_cuda", [[24, 1, 64, 128, 128], [12, 1, 64, 128, 128], 1, [0, 0, 0], [1, 1, 1], 1], {}, ["schedule_conv3d_nchw_cuda", [24, 1, 64, 128, 128], [12, 1, 64, 128, 128], 1, [0, 0, 0], [1, 1, 1], 1], {"i": 8634822, "t": "", "c": null, "e": [["tile_n", "sp", [-1, 1, 6, 1]], ["tile_f", "sp", [-1, 1, 6, 1]], ["tile_d", "sp", [-1, 1, 1, 1]], ["tile_y", "sp", [-1, 1, 1, 1]], ["tile_x", "sp", [-1, 1, 1, 1]], ["tile_rc", "sp", [-1, 1]], ["tile_rd", "sp", [-1, 8]], ["tile_ry", "sp", [-1, 2]], ["tile_rx", "sp", [-1, 1]], ["auto_unroll_max_step", "ot", 0], ["unroll_explicit", "ot", 0], ["fuse_yx", "ot", 1]]}], "r": [[0.02841666275, 0.0284148265], 0, 1.22774338722229, 1578503633.453285], "v": 0.1}
{"i": ["cuda", "schedule_conv3d_nchw_cuda", [[24, 1, 64, 128, 128], [12, 1, 64, 128, 128], 1, [0, 0, 0], [1, 1, 1], 1], {}, ["schedule_conv3d_nchw_cuda", [24, 1, 64, 128, 128], [12, 1, 64, 128, 128], 1, [0, 0, 0], [1, 1, 1], 1], {"i": 8676425, "t": "", "c": null, "e": [["tile_n", "sp", [-1, 1, 8, 1]], ["tile_f", "sp", [-1, 1, 6, 1]], ["tile_d", "sp", [-1, 1, 1, 1]], ["tile_y", "sp", [-1, 1, 1, 1]], ["tile_x", "sp", [-1, 1, 1, 1]], ["tile_rc", "sp", [-1, 1]], ["tile_rd", "sp", [-1, 4]], ["tile_ry", "sp", [-1, 8]], ["tile_rx", "sp", [-1, 1]], ["auto_unroll_max_step", "ot", 0], ["unroll_explicit", "ot", 0], ["fuse_yx", "ot", 1]]}], "r": [[0.03047618, 0.0304722165], 0, 1.3931477069854736, 1578503634.4065125], "v": 0.1}
{"i": ["cuda", "schedule_conv3d_nchw_cuda", [[24, 1, 64, 128, 128], [12, 1, 64, 128, 128], 1, [0, 0, 0], [1, 1, 1], 1], {}, ["schedule_conv3d_nchw_cuda", [24, 1, 64, 128, 128], [12, 1, 64, 128, 128], 1, [0, 0, 0], [1, 1, 1], 1], {"i": 8654025, "t": "", "c": null, "e": [["tile_n", "sp", [-1, 1, 8, 1]], ["tile_f", "sp", [-1, 1, 6, 1]], ["tile_d", "sp", [-1, 1, 1, 1]], ["tile_y", "sp", [-1, 1, 1, 1]], ["tile_x", "sp", [-1, 1, 1, 1]], ["tile_rc", "sp", [-1, 1]], ["tile_rd", "sp", [-1, 4]], ["tile_ry", "sp", [-1, 4]], ["tile_rx", "sp", [-1, 1]], ["auto_unroll_max_step", "ot", 0], ["unroll_explicit", "ot", 0], ["fuse_yx", "ot", 1]]}], "r": [[0.021896563, 0.021902617], 0, 1.187159776687622, 1578503636.9436224], "v": 0.1}
{"i": ["cuda", "schedule_conv3d_nchw_cuda", [[24, 1, 64, 128, 128], [12, 1, 64, 128, 128], 1, [0, 0, 0], [1, 1, 1], 1], {}, ["schedule_conv3d_nchw_cuda", [24, 1, 64, 128, 128], [12, 1, 64, 128, 128], 1, [0, 0, 0], [1, 1, 1], 1], {"i": 12954825, "t": "", "c": null, "e": [["tile_n", "sp", [-1, 1, 8, 1]], ["tile_f", "sp", [-1, 1, 6, 1]], ["tile_d", "sp", [-1, 1, 1, 1]], ["tile_y", "sp", [-1, 1, 1, 1]], ["tile_x", "sp", [-1, 1, 1, 1]], ["tile_rc", "sp", [-1, 1]], ["tile_rd", "sp", [-1, 4]], ["tile_ry", "sp", [-1, 4]], ["tile_rx", "sp", [-1, 1]], ["auto_unroll_max_step", "ot", 0], ["unroll_explicit", "ot", 1], ["fuse_yx", "ot", 1]]}], "r": [[0.021847711, 0.0218485855], 0, 1.1407396793365479, 1578503637.6725798], "v": 0.1}
{"i": ["cuda", "schedule_conv3d_nchw_cuda", [[24, 1, 64, 128, 128], [12, 1, 64, 128, 128], 1, [0, 0, 0], [1, 1, 1], 1], {}, ["schedule_conv3d_nchw_cuda", [24, 1, 64, 128, 128], [12, 1, 64, 128, 128], 1, [0, 0, 0], [1, 1, 1], 1], {"i": 12977225, "t": "", "c": null, "e": [["tile_n", "sp", [-1, 1, 8, 1]], ["tile_f", "sp", [-1, 1, 6, 1]], ["tile_d", "sp", [-1, 1, 1, 1]], ["tile_y", "sp", [-1, 1, 1, 1]], ["tile_x", "sp", [-1, 1, 1, 1]], ["tile_rc", "sp", [-1, 1]], ["tile_rd", "sp", [-1, 4]], ["tile_ry", "sp", [-1, 8]], ["tile_rx", "sp", [-1, 1]], ["auto_unroll_max_step", "ot", 0], ["unroll_explicit", "ot", 1], ["fuse_yx", "ot", 1]]}], "r": [[0.03043070575, 0.03043796625], 0, 1.2770683765411377, 1578503638.5242956], "v": 0.1}
{"i": ["cuda", "schedule_conv3d_nchw_cuda", [[24, 1, 64, 128, 128], [12, 1, 64, 128, 128], 1, [0, 0, 0], [1, 1, 1], 1], {}, ["schedule_conv3d_nchw_cuda", [24, 1, 64, 128, 128], [12, 1, 64, 128, 128], 1, [0, 0, 0], [1, 1, 1], 1], {"i": 8679625, "t": "", "c": null, "e": [["tile_n", "sp", [-1, 1, 8, 1]], ["tile_f", "sp", [-1, 1, 6, 1]], ["tile_d", "sp", [-1, 1, 1, 1]], ["tile_y", "sp", [-1, 1, 1, 1]], ["tile_x", "sp", [-1, 1, 1, 1]], ["tile_rc", "sp", [-1, 1]], ["tile_rd", "sp", [-1, 8]], ["tile_ry", "sp", [-1, 8]], ["tile_rx", "sp", [-1, 1]], ["auto_unroll_max_step", "ot", 0], ["unroll_explicit", "ot", 0], ["fuse_yx", "ot", 1]]}], "r": [[0.041718346, 0.04136600975], 0, 1.6406893730163574, 1578503639.6826808], "v": 0.1}
{"i": ["cuda", "schedule_conv3d_nchw_cuda", [[24, 1, 64, 128, 128], [12, 1, 64, 128, 128], 1, [0, 0, 0], [1, 1, 1], 1], {}, ["schedule_conv3d_nchw_cuda", [24, 1, 64, 128, 128], [12, 1, 64, 128, 128], 1, [0, 0, 0], [1, 1, 1], 1], {"i": 12980425, "t": "", "c": null, "e": [["tile_n", "sp", [-1, 1, 8, 1]], ["tile_f", "sp", [-1, 1, 6, 1]], ["tile_d", "sp", [-1, 1, 1, 1]], ["tile_y", "sp", [-1, 1, 1, 1]], ["tile_x", "sp", [-1, 1, 1, 1]], ["tile_rc", "sp", [-1, 1]], ["tile_rd", "sp", [-1, 8]], ["tile_ry", "sp", [-1, 8]], ["tile_rx", "sp", [-1, 1]], ["auto_unroll_max_step", "ot", 0], ["unroll_explicit", "ot", 1], ["fuse_yx", "ot", 1]]}], "r": [[0.04140734675, 0.0414021115], 0, 1.3690149784088135, 1578503640.6238682], "v": 0.1}
{"i": ["cuda", "schedule_conv3d_nchw_cuda", [[24, 1, 64, 128, 128], [12, 1, 64, 128, 128], 1, [0, 0, 0], [1, 1, 1], 1], {}, ["schedule_conv3d_nchw_cuda", [24, 1, 64, 128, 128], [12, 1, 64, 128, 128], 1, [0, 0, 0], [1, 1, 1], 1], {"i": 8814025, "t": "", "c": null, "e": [["tile_n", "sp", [-1, 1, 8, 1]], ["tile_f", "sp", [-1, 1, 6, 1]], ["tile_d", "sp", [-1, 1, 1, 1]], ["tile_y", "sp", [-1, 1, 1, 1]], ["tile_x", "sp", [-1, 1, 1, 1]], ["tile_rc", "sp", [-1, 1]], ["tile_rd", "sp", [-1, 8]], ["tile_ry", "sp", [-1, 2]], ["tile_rx", "sp", [-1, 2]], ["auto_unroll_max_step", "ot", 0], ["unroll_explicit", "ot", 0], ["fuse_yx", "ot", 1]]}], "r": [[0.03587060925, 0.035835988], 0, 1.348010540008545, 1578503641.53581], "v": 0.1}
{"i": ["cuda", "schedule_conv3d_nchw_cuda", [[24, 1, 64, 128, 128], [12, 1, 64, 128, 128], 1, [0, 0, 0], [1, 1, 1], 1], {}, ["schedule_conv3d_nchw_cuda", [24, 1, 64, 128, 128], [12, 1, 64, 128, 128], 1, [0, 0, 0], [1, 1, 1], 1], {"i": 8791625, "t": "", "c": null, "e": [["tile_n", "sp", [-1, 1, 8, 1]], ["tile_f", "sp", [-1, 1, 6, 1]], ["tile_d", "sp", [-1, 1, 1, 1]], ["tile_y", "sp", [-1, 1, 1, 1]], ["tile_x", "sp", [-1, 1, 1, 1]], ["tile_rc", "sp", [-1, 1]], ["tile_rd", "sp", [-1, 8]], ["tile_ry", "sp", [-1, 1]], ["tile_rx", "sp", [-1, 2]], ["auto_unroll_max_step", "ot", 0], ["unroll_explicit", "ot", 0], ["fuse_yx", "ot", 1]]}], "r": [[0.03907484575, 0.039082768], 0, 1.3911387920379639, 1578503642.4642994], "v": 0.1}
{"i": ["cuda", "schedule_conv3d_nchw_cuda", [[24, 1, 64, 128, 128], [12, 1, 64, 128, 128], 1, [0, 0, 0], [1, 1, 1], 1], {}, ["schedule_conv3d_nchw_cuda", [24, 1, 64, 128, 128], [12, 1, 64, 128, 128], 1, [0, 0, 0], [1, 1, 1], 1], {"i": 13114825, "t": "", "c": null, "e": [["tile_n", "sp", [-1, 1, 8, 1]], ["tile_f", "sp", [-1, 1, 6, 1]], ["tile_d", "sp", [-1, 1, 1, 1]], ["tile_y", "sp", [-1, 1, 1, 1]], ["tile_x", "sp", [-1, 1, 1, 1]], ["tile_rc", "sp", [-1, 1]], ["tile_rd", "sp", [-1, 8]], ["tile_ry", "sp", [-1, 2]], ["tile_rx", "sp", [-1, 2]], ["auto_unroll_max_step", "ot", 0], ["unroll_explicit", "ot", 1], ["fuse_yx", "ot", 1]]}], "r": [[0.03591842975, 0.035890132], 0, 1.3635954856872559, 1578503643.3434002], "v": 0.1}
{"i": ["cuda", "schedule_conv3d_nchw_cuda", [[24, 1, 64, 128, 128], [12, 1, 64, 128, 128], 1, [0, 0, 0], [1, 1, 1], 1], {}, ["schedule_conv3d_nchw_cuda", [24, 1, 64, 128, 128], [12, 1, 64, 128, 128], 1, [0, 0, 0], [1, 1, 1], 1], {"i": 13092425, "t": "", "c": null, "e": [["tile_n", "sp", [-1, 1, 8, 1]], ["tile_f", "sp", [-1, 1, 6, 1]], ["tile_d", "sp", [-1, 1, 1, 1]], ["tile_y", "sp", [-1, 1, 1, 1]], ["tile_x", "sp", [-1, 1, 1, 1]], ["tile_rc", "sp", [-1, 1]], ["tile_rd", "sp", [-1, 8]], ["tile_ry", "sp", [-1, 1]], ["tile_rx", "sp", [-1, 2]], ["auto_unroll_max_step", "ot", 0], ["unroll_explicit", "ot", 1], ["fuse_yx", "ot", 1]]}], "r": [[0.03926502075, 0.0392756045], 0, 1.326498031616211, 1578503644.251548], "v": 0.1}
{"i": ["cuda", "schedule_conv3d_nchw_cuda", [[24, 1, 64, 128, 128], [12, 1, 64, 128, 128], 1, [0, 0, 0], [1, 1, 1], 1], {}, ["schedule_conv3d_nchw_cuda", [24, 1, 64, 128, 128], [12, 1, 64, 128, 128], 1, [0, 0, 0], [1, 1, 1], 1], {"i": 8788425, "t": "", "c": null, "e": [["tile_n", "sp", [-1, 1, 8, 1]], ["tile_f", "sp", [-1, 1, 6, 1]], ["tile_d", "sp", [-1, 1, 1, 1]], ["tile_y", "sp", [-1, 1, 1, 1]], ["tile_x", "sp", [-1, 1, 1, 1]], ["tile_rc", "sp", [-1, 1]], ["tile_rd", "sp", [-1, 4]], ["tile_ry", "sp", [-1, 1]], ["tile_rx", "sp", [-1, 2]], ["auto_unroll_max_step", "ot", 0], ["unroll_explicit", "ot", 0], ["fuse_yx", "ot", 1]]}], "r": [[0.04143345725, 0.0414159745], 0, 1.4977402687072754, 1578503645.3677218], "v": 0.1}
{"i": ["cuda", "schedule_conv3d_nchw_cuda", [[24, 1, 64, 128, 128], [12, 1, 64, 128, 128], 1, [0, 0, 0], [1, 1, 1], 1], {}, ["schedule_conv3d_nchw_cuda", [24, 1, 64, 128, 128], [12, 1, 64, 128, 128], 1, [0, 0, 0], [1, 1, 1], 1], {"i": 13089225, "t": "", "c": null, "e": [["tile_n", "sp", [-1, 1, 8, 1]], ["tile_f", "sp", [-1, 1, 6, 1]], ["tile_d", "sp", [-1, 1, 1, 1]], ["tile_y", "sp", [-1, 1, 1, 1]], ["tile_x", "sp", [-1, 1, 1, 1]], ["tile_rc", "sp", [-1, 1]], ["tile_rd", "sp", [-1, 4]], ["tile_ry", "sp", [-1, 1]], ["tile_rx", "sp", [-1, 2]], ["auto_unroll_max_step", "ot", 0], ["unroll_explicit", "ot", 1], ["fuse_yx", "ot", 1]]}], "r": [[0.04144186475, 0.04144491925], 0, 1.3078107833862305, 1578503646.279494], "v": 0.1}
{"i": ["cuda", "schedule_conv3d_nchw_cuda", [[24, 1, 64, 128, 128], [12, 1, 64, 128, 128], 1, [0, 0, 0], [1, 1, 1], 1], {}, ["schedule_conv3d_nchw_cuda", [24, 1, 64, 128, 128], [12, 1, 64, 128, 128], 1, [0, 0, 0], [1, 1, 1], 1], {"i": 9162825, "t": "", "c": null, "e": [["tile_n", "sp", [-1, 1, 8, 1]], ["tile_f", "sp", [-1, 1, 6, 1]], ["tile_d", "sp", [-1, 1, 1, 1]], ["tile_y", "sp", [-1, 1, 1, 1]], ["tile_x", "sp", [-1, 1, 1, 1]], ["tile_rc", "sp", [-1, 1]], ["tile_rd", "sp", [-1, 1]], ["tile_ry", "sp", [-1, 2]], ["tile_rx", "sp", [-1, 8]], ["auto_unroll_max_step", "ot", 0], ["unroll_explicit", "ot", 0], ["fuse_yx", "ot", 1]]}], "r": [[0.0233665505, 0.02337058775], 0, 1.3276786804199219, 1578503647.241686], "v": 0.1}
{"i": ["cuda", "schedule_conv3d_nchw_cuda", [[24, 1, 64, 128, 128], [12, 1, 64, 128, 128], 1, [0, 0, 0], [1, 1, 1], 1], {}, ["schedule_conv3d_nchw_cuda", [24, 1, 64, 128, 128], [12, 1, 64, 128, 128], 1, [0, 0, 0], [1, 1, 1], 1], {"i": 14388425, "t": "", "c": null, "e": [["tile_n", "sp", [-1, 1, 8, 1]], ["tile_f", "sp", [-1, 1, 6, 1]], ["tile_d", "sp", [-1, 1, 1, 1]], ["tile_y", "sp", [-1, 1, 1, 1]], ["tile_x", "sp", [-1, 1, 1, 1]], ["tile_rc", "sp", [-1, 1]], ["tile_rd", "sp", [-1, 4]], ["tile_ry", "sp", [-1, 4]], ["tile_rx", "sp", [-1, 1]], ["auto_unroll_max_step", "ot", 512], ["unroll_explicit", "ot", 1], ["fuse_yx", "ot", 1]]}], "r": [[0.03551048225, 0.0329608225], 0, 1.3595123291015625, 1578503790.2212534], "v": 0.1}
{"i": ["cuda", "schedule_conv3d_nchw_cuda", [[24, 1, 64, 128, 128], [12, 1, 64, 128, 128], 1, [0, 0, 0], [1, 1, 1], 1], {}, ["schedule_conv3d_nchw_cuda", [24, 1, 64, 128, 128], [12, 1, 64, 128, 128], 1, [0, 0, 0], [1, 1, 1], 1], {"i": 10087625, "t": "", "c": null, "e": [["tile_n", "sp", [-1, 1, 8, 1]], ["tile_f", "sp", [-1, 1, 6, 1]], ["tile_d", "sp", [-1, 1, 1, 1]], ["tile_y", "sp", [-1, 1, 1, 1]], ["tile_x", "sp", [-1, 1, 1, 1]], ["tile_rc", "sp", [-1, 1]], ["tile_rd", "sp", [-1, 4]], ["tile_ry", "sp", [-1, 4]], ["tile_rx", "sp", [-1, 1]], ["auto_unroll_max_step", "ot", 512], ["unroll_explicit", "ot", 0], ["fuse_yx", "ot", 1]]}], "r": [[0.02174298525, 0.02174830175], 0, 1.1576991081237793, 1578503790.9883447], "v": 0.1}
{"i": ["cuda", "schedule_conv3d_nchw_cuda", [[24, 1, 64, 128, 128], [12, 1, 64, 128, 128], 1, [0, 0, 0], [1, 1, 1], 1], {}, ["schedule_conv3d_nchw_cuda", [24, 1, 64, 128, 128], [12, 1, 64, 128, 128], 1, [0, 0, 0], [1, 1, 1], 1], {"i": 15822025, "t": "", "c": null, "e": [["tile_n", "sp", [-1, 1, 8, 1]], ["tile_f", "sp", [-1, 1, 6, 1]], ["tile_d", "sp", [-1, 1, 1, 1]], ["tile_y", "sp", [-1, 1, 1, 1]], ["tile_x", "sp", [-1, 1, 1, 1]], ["tile_rc", "sp", [-1, 1]], ["tile_rd", "sp", [-1, 4]], ["tile_ry", "sp", [-1, 4]], ["tile_rx", "sp", [-1, 1]], ["auto_unroll_max_step", "ot", 1500], ["unroll_explicit", "ot", 1], ["fuse_yx", "ot", 1]]}], "r": [[0.03612067875, 0.0361209845], 0, 2.780240297317505, 1578503792.0747287], "v": 0.1}
{"i": ["cuda", "schedule_conv3d_nchw_cuda", [[24, 1, 64, 128, 128], [12, 1, 64, 128, 128], 1, [0, 0, 0], [1, 1, 1], 1], {}, ["schedule_conv3d_nchw_cuda", [24, 1, 64, 128, 128], [12, 1, 64, 128, 128], 1, [0, 0, 0], [1, 1, 1], 1], {"i": 11521225, "t": "", "c": null, "e": [["tile_n", "sp", [-1, 1, 8, 1]], ["tile_f", "sp", [-1, 1, 6, 1]], ["tile_d", "sp", [-1, 1, 1, 1]], ["tile_y", "sp", [-1, 1, 1, 1]], ["tile_x", "sp", [-1, 1, 1, 1]], ["tile_rc", "sp", [-1, 1]], ["tile_rd", "sp", [-1, 4]], ["tile_ry", "sp", [-1, 4]], ["tile_rx", "sp", [-1, 1]], ["auto_unroll_max_step", "ot", 1500], ["unroll_explicit", "ot", 0], ["fuse_yx", "ot", 1]]}], "r": [[0.0311933575, 0.0311924225], 0, 1.915168285369873, 1578503793.1437268], "v": 0.1}
{"i": ["cuda", "schedule_conv3d_nchw_cuda", [[24, 1, 64, 128, 128], [12, 1, 64, 128, 128], 1, [0, 0, 0], [1, 1, 1], 1], {}, ["schedule_conv3d_nchw_cuda", [24, 1, 64, 128, 128], [12, 1, 64, 128, 128], 1, [0, 0, 0], [1, 1, 1], 1], {"i": 15978825, "t": "", "c": null, "e": [["tile_n", "sp", [-1, 1, 8, 1]], ["tile_f", "sp", [-1, 1, 6, 1]], ["tile_d", "sp", [-1, 1, 1, 1]], ["tile_y", "sp", [-1, 1, 1, 1]], ["tile_x", "sp", [-1, 1, 1, 1]], ["tile_rc", "sp", [-1, 1]], ["tile_rd", "sp", [-1, 4]], ["tile_ry", "sp", [-1, 2]], ["tile_rx", "sp", [-1, 2]], ["auto_unroll_max_step", "ot", 1500], ["unroll_explicit", "ot", 1], ["fuse_yx", "ot", 1]]}], "r": [[0.021711664, 0.0217096785], 0, 4.570267915725708, 1578503794.3385673], "v": 0.1}
{"i": ["cuda", "schedule_conv3d_nchw_cuda", [[24, 1, 64, 128, 128], [12, 1, 64, 128, 128], 1, [0, 0, 0], [1, 1, 1], 1], {}, ["schedule_conv3d_nchw_cuda", [24, 1, 64, 128, 128], [12, 1, 64, 128, 128], 1, [0, 0, 0], [1, 1, 1], 1], {"i": 11678025, "t": "", "c": null, "e": [["tile_n", "sp", [-1, 1, 8, 1]], ["tile_f", "sp", [-1, 1, 6, 1]], ["tile_d", "sp", [-1, 1, 1, 1]], ["tile_y", "sp", [-1, 1, 1, 1]], ["tile_x", "sp", [-1, 1, 1, 1]], ["tile_rc", "sp", [-1, 1]], ["tile_rd", "sp", [-1, 4]], ["tile_ry", "sp", [-1, 2]], ["tile_rx", "sp", [-1, 2]], ["auto_unroll_max_step", "ot", 1500], ["unroll_explicit", "ot", 0], ["fuse_yx", "ot", 1]]}], "r": [[0.02538715675, 0.02538756725], 0, 3.220384359359741, 1578503795.6166334], "v": 0.1}
{"i": ["cuda", "schedule_conv3d_nchw_cuda", [[24, 1, 64, 128, 128], [12, 1, 64, 128, 128], 1, [0, 0, 0], [1, 1, 1], 1], {}, ["schedule_conv3d_nchw_cuda", [24, 1, 64, 128, 128], [12, 1, 64, 128, 128], 1, [0, 0, 0], [1, 1, 1], 1], {"i": 14545225, "t": "", "c": null, "e": [["tile_n", "sp", [-1, 1, 8, 1]], ["tile_f", "sp", [-1, 1, 6, 1]], ["tile_d", "sp", [-1, 1, 1, 1]], ["tile_y", "sp", [-1, 1, 1, 1]], ["tile_x", "sp", [-1, 1, 1, 1]], ["tile_rc", "sp", [-1, 1]], ["tile_rd", "sp", [-1, 4]], ["tile_ry", "sp", [-1, 2]], ["tile_rx", "sp", [-1, 2]], ["auto_unroll_max_step", "ot", 512], ["unroll_explicit", "ot", 1], ["fuse_yx", "ot", 1]]}], "r": [[0.0292026635, 0.02919784625], 0, 1.4430100917816162, 1578503796.609248], "v": 0.1}
{"i": ["cuda", "schedule_conv3d_nchw_cuda", [[24, 1, 64, 128, 128], [12, 1, 64, 128, 128], 1, [0, 0, 0], [1, 1, 1], 1], {}, ["schedule_conv3d_nchw_cuda", [24, 1, 64, 128, 128], [12, 1, 64, 128, 128], 1, [0, 0, 0], [1, 1, 1], 1], {"i": 10244425, "t": "", "c": null, "e": [["tile_n", "sp", [-1, 1, 8, 1]], ["tile_f", "sp", [-1, 1, 6, 1]], ["tile_d", "sp", [-1, 1, 1, 1]], ["tile_y", "sp", [-1, 1, 1, 1]], ["tile_x", "sp", [-1, 1, 1, 1]], ["tile_rc", "sp", [-1, 1]], ["tile_rd", "sp", [-1, 4]], ["tile_ry", "sp", [-1, 2]], ["tile_rx", "sp", [-1, 2]], ["auto_unroll_max_step", "ot", 512], ["unroll_explicit", "ot", 0], ["fuse_yx", "ot", 1]]}], "r": [[0.02335352725, 0.023356167], 0, 1.3386621475219727, 1578503797.38307], "v": 0.1}
{"i": ["cuda", "schedule_conv3d_nchw_cuda", [[24, 1, 64, 128, 128], [12, 1, 64, 128, 128], 1, [0, 0, 0], [1, 1, 1], 1], {}, ["schedule_conv3d_nchw_cuda", [24, 1, 64, 128, 128], [12, 1, 64, 128, 128], 1, [0, 0, 0], [1, 1, 1], 1], {"i": 11697225, "t": "", "c": null, "e": [["tile_n", "sp", [-1, 1, 8, 1]], ["tile_f", "sp", [-1, 1, 6, 1]], ["tile_d", "sp", [-1, 1, 1, 1]], ["tile_y", "sp", [-1, 1, 1, 1]], ["tile_x", "sp", [-1, 1, 1, 1]], ["tile_rc", "sp", [-1, 1]], ["tile_rd", "sp", [-1, 2]], ["tile_ry", "sp", [-1, 4]], ["tile_rx", "sp", [-1, 2]], ["auto_unroll_max_step", "ot", 1500], ["unroll_explicit", "ot", 0], ["fuse_yx", "ot", 1]]}], "r": [[0.01896174125, 0.01896154575], 0, 1.8998491764068604, 1578503798.3449004], "v": 0.1}
{"i": ["cuda", "schedule_conv3d_nchw_cuda", [[24, 1, 64, 128, 128], [12, 1, 64, 128, 128], 1, [0, 0, 0], [1, 1, 1], 1], {}, ["schedule_conv3d_nchw_cuda", [24, 1, 64, 128, 128], [12, 1, 64, 128, 128], 1, [0, 0, 0], [1, 1, 1], 1], {"i": 10263625, "t": "", "c": null, "e": [["tile_n", "sp", [-1, 1, 8, 1]], ["tile_f", "sp", [-1, 1, 6, 1]], ["tile_d", "sp", [-1, 1, 1, 1]], ["tile_y", "sp", [-1, 1, 1, 1]], ["tile_x", "sp", [-1, 1, 1, 1]], ["tile_rc", "sp", [-1, 1]], ["tile_rd", "sp", [-1, 2]], ["tile_ry", "sp", [-1, 4]], ["tile_rx", "sp", [-1, 2]], ["auto_unroll_max_step", "ot", 512], ["unroll_explicit", "ot", 0], ["fuse_yx", "ot", 1]]}], "r": [[0.0215866955, 0.021589915], 0, 1.3656089305877686, 1578503799.2055328], "v": 0.1}
{"i": ["cuda", "schedule_conv3d_nchw_cuda", [[24, 1, 64, 128, 128], [12, 1, 64, 128, 128], 1, [0, 0, 0], [1, 1, 1], 1], {}, ["schedule_conv3d_nchw_cuda", [24, 1, 64, 128, 128], [12, 1, 64, 128, 128], 1, [0, 0, 0], [1, 1, 1], 1], {"i": 15998025, "t": "", "c": null, "e": [["tile_n", "sp", [-1, 1, 8, 1]], ["tile_f", "sp", [-1, 1, 6, 1]], ["tile_d", "sp", [-1, 1, 1, 1]], ["tile_y", "sp", [-1, 1, 1, 1]], ["tile_x", "sp", [-1, 1, 1, 1]], ["tile_rc", "sp", [-1, 1]], ["tile_rd", "sp", [-1, 2]], ["tile_ry", "sp", [-1, 4]], ["tile_rx", "sp", [-1, 2]], ["auto_unroll_max_step", "ot", 1500], ["unroll_explicit", "ot", 1], ["fuse_yx", "ot", 1]]}], "r": [[0.0353530425, 0.0353485905], 0, 3.465031147003174, 1578503800.29264], "v": 0.1}
