auto_log/((1, 32, 64, 128, 128), (12, 32, 1, 1, 1), (1, 12, 64, 128, 128), (1, 1, 1), (0, 0, 0), 1, 1, None)_fwd.log
{"i": ["cuda", "schedule_direct_3d_cuda", [[1, 32, 64, 128, 128], [12, 32, 1, 1, 1], [1, 1, 1], [0, 0, 0], 1], {}, ["schedule_direct_3d_cuda", [1, 32, 64, 128, 128], [12, 32, 1, 1, 1], [1, 1, 1], [0, 0, 0], 1], {"i": 547429215, "t": "", "c": null, "e": [["tile_f", "sp", [-1, 1, 6, 1]], ["tile_d", "sp", [-1, 4, 1, 2]], ["tile_y", "sp", [-1, 1, 1, 8]], ["tile_x", "sp", [-1, 2, 1, 2]], ["tile_rc", "sp", [-1, 32]], ["tile_rd", "sp", [-1, 1]], ["tile_ry", "sp", [-1, 1]], ["tile_rx", "sp", [-1, 1]], ["auto_unroll_max_step", "ot", 512], ["unroll_explicit", "ot", 0]]}], "r": [[0.040686382, 0.04072406575], 0, 1.614018201828003, 1578505895.5402043], "v": 0.1}
{"i": ["cuda", "schedule_direct_3d_cuda", [[1, 32, 64, 128, 128], [12, 32, 1, 1, 1], [1, 1, 1], [0, 0, 0], 1], {}, ["schedule_direct_3d_cuda", [1, 32, 64, 128, 128], [12, 32, 1, 1, 1], [1, 1, 1], [0, 0, 0], 1], {"i": 558099487, "t": "", "c": null, "e": [["tile_f", "sp", [-1, 2, 2, 1]], ["tile_d", "sp", [-1, 8, 1, 1]], ["tile_y", "sp", [-1, 1, 8, 1]], ["tile_x", "sp", [-1, 1, 1, 4]], ["tile_rc", "sp", [-1, 32]], ["tile_rd", "sp", [-1, 1]], ["tile_ry", "sp", [-1, 1]], ["tile_rx", "sp", [-1, 1]], ["auto_unroll_max_step", "ot", 512], ["unroll_explicit", "ot", 0]]}], "r": [[0.0044653755, 0.00447009325], 0, 1.8668768405914307, 1578505904.8584342], "v": 0.1}
{"i": ["cuda", "schedule_direct_3d_cuda", [[1, 32, 64, 128, 128], [12, 32, 1, 1, 1], [1, 1, 1], [0, 0, 0], 1], {}, ["schedule_direct_3d_cuda", [1, 32, 64, 128, 128], [12, 32, 1, 1, 1], [1, 1, 1], [0, 0, 0], 1], {"i": 1955132, "t": "", "c": null, "e": [["tile_f", "sp", [-1, 4, 3, 1]], ["tile_d", "sp", [-1, 1, 1, 16]], ["tile_y", "sp", [-1, 2, 1, 16]], ["tile_x", "sp", [-1, 16, 1, 1]], ["tile_rc", "sp", [-1, 1]], ["tile_rd", "sp", [-1, 1]], ["tile_ry", "sp", [-1, 1]], ["tile_rx", "sp", [-1, 1]], ["auto_unroll_max_step", "ot", 0], ["unroll_explicit", "ot", 0]]}], "r": [[0.28250908125, 0.2825221305], 0, 3.7674343585968018, 1578505908.550729], "v": 0.1}
{"i": ["cuda", "schedule_direct_3d_cuda", [[1, 32, 64, 128, 128], [12, 32, 1, 1, 1], [1, 1, 1], [0, 0, 0], 1], {}, ["schedule_direct_3d_cuda", [1, 32, 64, 128, 128], [12, 32, 1, 1, 1], [1, 1, 1], [0, 0, 0], 1], {"i": 267731171, "t": "", "c": null, "e": [["tile_f", "sp", [-1, 2, 3, 1]], ["tile_d", "sp", [-1, 2, 1, 16]], ["tile_y", "sp", [-1, 2, 1, 1]], ["tile_x", "sp", [-1, 1, 1, 4]], ["tile_rc", "sp", [-1, 32]], ["tile_rd", "sp", [-1, 1]], ["tile_ry", "sp", [-1, 1]], ["tile_rx", "sp", [-1, 1]], ["auto_unroll_max_step", "ot", 0], ["unroll_explicit", "ot", 0]]}], "r": [[0.134463376, 0.12952729575], 0, 2.6064846515655518, 1578506132.805811], "v": 0.1}
{"i": ["cuda", "schedule_direct_3d_cuda", [[1, 32, 64, 128, 128], [12, 32, 1, 1, 1], [1, 1, 1], [0, 0, 0], 1], {}, ["schedule_direct_3d_cuda", [1, 32, 64, 128, 128], [12, 32, 1, 1, 1], [1, 1, 1], [0, 0, 0], 1], {"i": 267948531, "t": "", "c": null, "e": [["tile_f", "sp", [-1, 2, 3, 1]], ["tile_d", "sp", [-1, 1, 1, 4]], ["tile_y", "sp", [-1, 4, 1, 4]], ["tile_x", "sp", [-1, 1, 1, 4]], ["tile_rc", "sp", [-1, 32]], ["tile_rd", "sp", [-1, 1]], ["tile_ry", "sp", [-1, 1]], ["tile_rx", "sp", [-1, 1]], ["auto_unroll_max_step", "ot", 0], ["unroll_explicit", "ot", 0]]}], "r": [[0.128269647, 0.12842307475], 0, 2.909557819366455, 1578506134.6798282], "v": 0.1}
{"i": ["cuda", "schedule_direct_3d_cuda", [[1, 32, 64, 128, 128], [12, 32, 1, 1, 1], [1, 1, 1], [0, 0, 0], 1], {}, ["schedule_direct_3d_cuda", [1, 32, 64, 128, 128], [12, 32, 1, 1, 1], [1, 1, 1], [0, 0, 0], 1], {"i": 256453971, "t": "", "c": null, "e": [["tile_f", "sp", [-1, 2, 3, 1]], ["tile_d", "sp", [-1, 1, 1, 4]], ["tile_y", "sp", [-1, 32, 1, 1]], ["tile_x", "sp", [-1, 1, 1, 2]], ["tile_rc", "sp", [-1, 32]], ["tile_rd", "sp", [-1, 1]], ["tile_ry", "sp", [-1, 1]], ["tile_rx", "sp", [-1, 1]], ["auto_unroll_max_step", "ot", 0], ["unroll_explicit", "ot", 0]]}], "r": [[0.14280873575, 0.14318461225], 0, 3.2269363403320312, 1578506136.8105953], "v": 0.1}
{"i": ["cuda", "schedule_direct_3d_cuda", [[1, 32, 64, 128, 128], [12, 32, 1, 1, 1], [1, 1, 1], [0, 0, 0], 1], {}, ["schedule_direct_3d_cuda", [1, 32, 64, 128, 128], [12, 32, 1, 1, 1], [1, 1, 1], [0, 0, 0], 1], {"i": 242211011, "t": "", "c": null, "e": [["tile_f", "sp", [-1, 2, 3, 1]], ["tile_d", "sp", [-1, 4, 1, 4]], ["tile_y", "sp", [-1, 2, 1, 8]], ["tile_x", "sp", [-1, 1, 1, 1]], ["tile_rc", "sp", [-1, 32]], ["tile_rd", "sp", [-1, 1]], ["tile_ry", "sp", [-1, 1]], ["tile_rx", "sp", [-1, 1]], ["auto_unroll_max_step", "ot", 0], ["unroll_explicit", "ot", 0]]}], "r": [[0.15083172625, 0.150553215], 0, 3.2408649921417236, 1578506138.8910806], "v": 0.1}
{"i": ["cuda", "schedule_direct_3d_cuda", [[1, 32, 64, 128, 128], [12, 32, 1, 1, 1], [1, 1, 1], [0, 0, 0], 1], {}, ["schedule_direct_3d_cuda", [1, 32, 64, 128, 128], [12, 32, 1, 1, 1], [1, 1, 1], [0, 0, 0], 1], {"i": 547512051, "t": "", "c": null, "e": [["tile_f", "sp", [-1, 2, 3, 1]], ["tile_d", "sp", [-1, 2, 1, 1]], ["tile_y", "sp", [-1, 1, 1, 32]], ["tile_x", "sp", [-1, 2, 1, 2]], ["tile_rc", "sp", [-1, 32]], ["tile_rd", "sp", [-1, 1]], ["tile_ry", "sp", [-1, 1]], ["tile_rx", "sp", [-1, 1]], ["auto_unroll_max_step", "ot", 512], ["unroll_explicit", "ot", 0]]}], "r": [[0.13787159675, 0.1380082085], 0, 3.7544474601745605, 1578506140.9950252], "v": 0.1}
{"i": ["cuda", "schedule_direct_3d_cuda", [[1, 32, 64, 128, 128], [12, 32, 1, 1, 1], [1, 1, 1], [0, 0, 0], 1], {}, ["schedule_direct_3d_cuda", [1, 32, 64, 128, 128], [12, 32, 1, 1, 1], [1, 1, 1], [0, 0, 0], 1], {"i": 532600371, "t": "", "c": null, "e": [["tile_f", "sp", [-1, 2, 3, 1]], ["tile_d", "sp", [-1, 2, 1, 1]], ["tile_y", "sp", [-1, 4, 1, 32]], ["tile_x", "sp", [-1, 1, 1, 1]], ["tile_rc", "sp", [-1, 32]], ["tile_rd", "sp", [-1, 1]], ["tile_ry", "sp", [-1, 1]], ["tile_rx", "sp", [-1, 1]], ["auto_unroll_max_step", "ot", 512], ["unroll_explicit", "ot", 0]]}], "r": [[0.1447915715, 0.14437696125], 0, 3.6527724266052246, 1578506143.2018564], "v": 0.1}
{"i": ["cuda", "schedule_direct_3d_cuda", [[1, 32, 64, 128, 128], [12, 32, 1, 1, 1], [1, 1, 1], [0, 0, 0], 1], {}, ["schedule_direct_3d_cuda", [1, 32, 64, 128, 128], [12, 32, 1, 1, 1], [1, 1, 1], [0, 0, 0], 1], {"i": 1428947171, "t": "", "c": null, "e": [["tile_f", "sp", [-1, 2, 3, 1]], ["tile_d", "sp", [-1, 2, 1, 16]], ["tile_y", "sp", [-1, 2, 1, 1]], ["tile_x", "sp", [-1, 1, 1, 4]], ["tile_rc", "sp", [-1, 32]], ["tile_rd", "sp", [-1, 1]], ["tile_ry", "sp", [-1, 1]], ["tile_rx", "sp", [-1, 1]], ["auto_unroll_max_step", "ot", 512], ["unroll_explicit", "ot", 1]]}], "r": [[0.13946959075, 0.13944298775], 0, 4.462944269180298, 1578506145.331161], "v": 0.1}
{"i": ["cuda", "schedule_direct_3d_cuda", [[1, 32, 64, 128, 128], [12, 32, 1, 1, 1], [1, 1, 1], [0, 0, 0], 1], {}, ["schedule_direct_3d_cuda", [1, 32, 64, 128, 128], [12, 32, 1, 1, 1], [1, 1, 1], [0, 0, 0], 1], {"i": 532240051, "t": "", "c": null, "e": [["tile_f", "sp", [-1, 2, 3, 1]], ["tile_d", "sp", [-1, 2, 1, 8]], ["tile_y", "sp", [-1, 16, 1, 1]], ["tile_x", "sp", [-1, 1, 1, 1]], ["tile_rc", "sp", [-1, 32]], ["tile_rd", "sp", [-1, 1]], ["tile_ry", "sp", [-1, 1]], ["tile_rx", "sp", [-1, 1]], ["auto_unroll_max_step", "ot", 512], ["unroll_explicit", "ot", 0]]}], "r": [[0.15119462675, 0.151420827], 0, 3.64005184173584, 1578506147.5661216], "v": 0.1}
{"i": ["cuda", "schedule_direct_3d_cuda", [[1, 32, 64, 128, 128], [12, 32, 1, 1, 1], [1, 1, 1], [0, 0, 0], 1], {}, ["schedule_direct_3d_cuda", [1, 32, 64, 128, 128], [12, 32, 1, 1, 1], [1, 1, 1], [0, 0, 0], 1], {"i": 1403512371, "t": "", "c": null, "e": [["tile_f", "sp", [-1, 2, 3, 1]], ["tile_d", "sp", [-1, 2, 1, 1]], ["tile_y", "sp", [-1, 4, 1, 32]], ["tile_x", "sp", [-1, 1, 1, 1]], ["tile_rc", "sp", [-1, 32]], ["tile_rd", "sp", [-1, 1]], ["tile_ry", "sp", [-1, 1]], ["tile_rx", "sp", [-1, 1]], ["auto_unroll_max_step", "ot", 512], ["unroll_explicit", "ot", 1]]}], "r": [[0.15495533225, 0.155045557], 0, 4.473821640014648, 1578506149.842166], "v": 0.1}
{"i": ["cuda", "schedule_direct_3d_cuda", [[1, 32, 64, 128, 128], [12, 32, 1, 1, 1], [1, 1, 1], [0, 0, 0], 1], {}, ["schedule_direct_3d_cuda", [1, 32, 64, 128, 128], [12, 32, 1, 1, 1], [1, 1, 1], [0, 0, 0], 1], {"i": 1719251171, "t": "", "c": null, "e": [["tile_f", "sp", [-1, 2, 3, 1]], ["tile_d", "sp", [-1, 2, 1, 16]], ["tile_y", "sp", [-1, 2, 1, 1]], ["tile_x", "sp", [-1, 1, 1, 4]], ["tile_rc", "sp", [-1, 32]], ["tile_rd", "sp", [-1, 1]], ["tile_ry", "sp", [-1, 1]], ["tile_rx", "sp", [-1, 1]], ["auto_unroll_max_step", "ot", 1500], ["unroll_explicit", "ot", 1]]}], "r": [[0.13925681525, 0.1393851055], 0, 4.174691200256348, 1578506151.7512703], "v": 0.1}
{"i": ["cuda", "schedule_direct_3d_cuda", [[1, 32, 64, 128, 128], [12, 32, 1, 1, 1], [1, 1, 1], [0, 0, 0], 1], {}, ["schedule_direct_3d_cuda", [1, 32, 64, 128, 128], [12, 32, 1, 1, 1], [1, 1, 1], [0, 0, 0], 1], {"i": 532515011, "t": "", "c": null, "e": [["tile_f", "sp", [-1, 2, 3, 1]], ["tile_d", "sp", [-1, 4, 1, 4]], ["tile_y", "sp", [-1, 2, 1, 8]], ["tile_x", "sp", [-1, 1, 1, 1]], ["tile_rc", "sp", [-1, 32]], ["tile_rd", "sp", [-1, 1]], ["tile_ry", "sp", [-1, 1]], ["tile_rx", "sp", [-1, 1]], ["auto_unroll_max_step", "ot", 512], ["unroll_explicit", "ot", 0]]}], "r": [[0.146341383, 0.14654392325], 0, 3.764535427093506, 1578506153.9781127], "v": 0.1}
{"i": ["cuda", "schedule_direct_3d_cuda", [[1, 32, 64, 128, 128], [12, 32, 1, 1, 1], [1, 1, 1], [0, 0, 0], 1], {}, ["schedule_direct_3d_cuda", [1, 32, 64, 128, 128], [12, 32, 1, 1, 1], [1, 1, 1], [0, 0, 0], 1], {"i": 242211931, "t": "", "c": null, "e": [["tile_f", "sp", [-1, 2, 3, 1]], ["tile_d", "sp", [-1, 1, 1, 16]], ["tile_y", "sp", [-1, 2, 1, 8]], ["tile_x", "sp", [-1, 1, 1, 1]], ["tile_rc", "sp", [-1, 32]], ["tile_rd", "sp", [-1, 1]], ["tile_ry", "sp", [-1, 1]], ["tile_rx", "sp", [-1, 1]], ["auto_unroll_max_step", "ot", 0], ["unroll_explicit", "ot", 0]]}], "r": [[0.1504853185, 0.15036663225], 0, 2.9130468368530273, 1578506156.0260115], "v": 0.1}
{"i": ["cuda", "schedule_direct_3d_cuda", [[1, 32, 64, 128, 128], [12, 32, 1, 1, 1], [1, 1, 1], [0, 0, 0], 1], {}, ["schedule_direct_3d_cuda", [1, 32, 64, 128, 128], [12, 32, 1, 1, 1], [1, 1, 1], [0, 0, 0], 1], {"i": 242296371, "t": "", "c": null, "e": [["tile_f", "sp", [-1, 2, 3, 1]], ["tile_d", "sp", [-1, 2, 1, 1]], ["tile_y", "sp", [-1, 4, 1, 32]], ["tile_x", "sp", [-1, 1, 1, 1]], ["tile_rc", "sp", [-1, 32]], ["tile_rd", "sp", [-1, 1]], ["tile_ry", "sp", [-1, 1]], ["tile_rx", "sp", [-1, 1]], ["auto_unroll_max_step", "ot", 0], ["unroll_explicit", "ot", 0]]}], "r": [[0.15742984475, 0.1518195395], 0, 2.683037042617798, 1578506161.3956945], "v": 0.1}
{"i": ["cuda", "schedule_direct_3d_cuda", [[1, 32, 64, 128, 128], [12, 32, 1, 1, 1], [1, 1, 1], [0, 0, 0], 1], {}, ["schedule_direct_3d_cuda", [1, 32, 64, 128, 128], [12, 32, 1, 1, 1], [1, 1, 1], [0, 0, 0], 1], {"i": 822870811, "t": "", "c": null, "e": [["tile_f", "sp", [-1, 2, 3, 1]], ["tile_d", "sp", [-1, 4, 1, 1]], ["tile_y", "sp", [-1, 4, 1, 16]], ["tile_x", "sp", [-1, 1, 1, 1]], ["tile_rc", "sp", [-1, 32]], ["tile_rd", "sp", [-1, 1]], ["tile_ry", "sp", [-1, 1]], ["tile_rx", "sp", [-1, 1]], ["auto_unroll_max_step", "ot", 1500], ["unroll_explicit", "ot", 0]]}], "r": [[0.1475398915, 0.147437074], 0, 3.771728277206421, 1578506163.6135392], "v": 0.1}
{"i": ["cuda", "schedule_direct_3d_cuda", [[1, 32, 64, 128, 128], [12, 32, 1, 1, 1], [1, 1, 1], [0, 0, 0], 1], {}, ["schedule_direct_3d_cuda", [1, 32, 64, 128, 128], [12, 32, 1, 1, 1], [1, 1, 1], [0, 0, 0], 1], {"i": 1403152051, "t": "", "c": null, "e": [["tile_f", "sp", [-1, 2, 3, 1]], ["tile_d", "sp", [-1, 2, 1, 8]], ["tile_y", "sp", [-1, 16, 1, 1]], ["tile_x", "sp", [-1, 1, 1, 1]], ["tile_rc", "sp", [-1, 32]], ["tile_rd", "sp", [-1, 1]], ["tile_ry", "sp", [-1, 1]], ["tile_rx", "sp", [-1, 1]], ["auto_unroll_max_step", "ot", 512], ["unroll_explicit", "ot", 1]]}], "r": [[0.15291041875, 0.15308151325], 0, 4.843987941741943, 1578506165.8891833], "v": 0.1}
{"i": ["cuda", "schedule_direct_3d_cuda", [[1, 32, 64, 128, 128], [12, 32, 1, 1, 1], [1, 1, 1], [0, 0, 0], 1], {}, ["schedule_direct_3d_cuda", [1, 32, 64, 128, 128], [12, 32, 1, 1, 1], [1, 1, 1], [0, 0, 0], 1], {"i": 848339171, "t": "", "c": null, "e": [["tile_f", "sp", [-1, 2, 3, 1]], ["tile_d", "sp", [-1, 2, 1, 16]], ["tile_y", "sp", [-1, 2, 1, 1]], ["tile_x", "sp", [-1, 1, 1, 4]], ["tile_rc", "sp", [-1, 32]], ["tile_rd", "sp", [-1, 1]], ["tile_ry", "sp", [-1, 1]], ["tile_rx", "sp", [-1, 1]], ["auto_unroll_max_step", "ot", 1500], ["unroll_explicit", "ot", 0]]}], "r": [[0.12925019325, 0.12928101925], 0, 3.4998974800109863, 1578506167.9238284], "v": 0.1}
{"i": ["cuda", "schedule_direct_3d_cuda", [[1, 32, 64, 128, 128], [12, 32, 1, 1, 1], [1, 1, 1], [0, 0, 0], 1], {}, ["schedule_direct_3d_cuda", [1, 32, 64, 128, 128], [12, 32, 1, 1, 1], [1, 1, 1], [0, 0, 0], 1], {"i": 1429164531, "t": "", "c": null, "e": [["tile_f", "sp", [-1, 2, 3, 1]], ["tile_d", "sp", [-1, 1, 1, 4]], ["tile_y", "sp", [-1, 4, 1, 4]], ["tile_x", "sp", [-1, 1, 1, 4]], ["tile_rc", "sp", [-1, 32]], ["tile_rd", "sp", [-1, 1]], ["tile_ry", "sp", [-1, 1]], ["tile_rx", "sp", [-1, 1]], ["auto_unroll_max_step", "ot", 512], ["unroll_explicit", "ot", 1]]}], "r": [[0.139389149, 0.1396953175], 0, 4.705313444137573, 1578506170.0632706], "v": 0.1}
{"i": ["cuda", "schedule_direct_3d_cuda", [[1, 32, 64, 128, 128], [12, 32, 1, 1, 1], [1, 1, 1], [0, 0, 0], 1], {}, ["schedule_direct_3d_cuda", [1, 32, 64, 128, 128], [12, 32, 1, 1, 1], [1, 1, 1], [0, 0, 0], 1], {"i": 1417787571, "t": "", "c": null, "e": [["tile_f", "sp", [-1, 2, 3, 1]], ["tile_d", "sp", [-1, 1, 1, 4]], ["tile_y", "sp", [-1, 16, 1, 2]], ["tile_x", "sp", [-1, 1, 1, 2]], ["tile_rc", "sp", [-1, 32]], ["tile_rd", "sp", [-1, 1]], ["tile_ry", "sp", [-1, 1]], ["tile_rx", "sp", [-1, 1]], ["auto_unroll_max_step", "ot", 512], ["unroll_explicit", "ot", 1]]}], "r": [[0.15414129275, 0.1542712375], 0, 4.730952501296997, 1578506172.3355992], "v": 0.1}
{"i": ["cuda", "schedule_direct_3d_cuda", [[1, 32, 64, 128, 128], [12, 32, 1, 1, 1], [1, 1, 1], [0, 0, 0], 1], {}, ["schedule_direct_3d_cuda", [1, 32, 64, 128, 128], [12, 32, 1, 1, 1], [1, 1, 1], [0, 0, 0], 1], {"i": 848556531, "t": "", "c": null, "e": [["tile_f", "sp", [-1, 2, 3, 1]], ["tile_d", "sp", [-1, 1, 1, 4]], ["tile_y", "sp", [-1, 4, 1, 4]], ["tile_x", "sp", [-1, 1, 1, 4]], ["tile_rc", "sp", [-1, 32]], ["tile_rd", "sp", [-1, 1]], ["tile_ry", "sp", [-1, 1]], ["tile_rx", "sp", [-1, 1]], ["auto_unroll_max_step", "ot", 1500], ["unroll_explicit", "ot", 0]]}], "r": [[0.12955590475, 0.12953925425], 0, 3.5409140586853027, 1578506174.3775954], "v": 0.1}
{"i": ["cuda", "schedule_direct_3d_cuda", [[1, 32, 64, 128, 128], [12, 32, 1, 1, 1], [1, 1, 1], [0, 0, 0], 1], {}, ["schedule_direct_3d_cuda", [1, 32, 64, 128, 128], [12, 32, 1, 1, 1], [1, 1, 1], [0, 0, 0], 1], {"i": 1113208371, "t": "", "c": null, "e": [["tile_f", "sp", [-1, 2, 3, 1]], ["tile_d", "sp", [-1, 2, 1, 1]], ["tile_y", "sp", [-1, 4, 1, 32]], ["tile_x", "sp", [-1, 1, 1, 1]], ["tile_rc", "sp", [-1, 32]], ["tile_rd", "sp", [-1, 1]], ["tile_ry", "sp", [-1, 1]], ["tile_rx", "sp", [-1, 1]], ["auto_unroll_max_step", "ot", 0], ["unroll_explicit", "ot", 1]]}], "r": [[0.152098784, 0.15185217625], 0, 2.7388253211975098, 1578506176.3205361], "v": 0.1}
{"i": ["cuda", "schedule_direct_3d_cuda", [[1, 32, 64, 128, 128], [12, 32, 1, 1, 1], [1, 1, 1], [0, 0, 0], 1], {}, ["schedule_direct_3d_cuda", [1, 32, 64, 128, 128], [12, 32, 1, 1, 1], [1, 1, 1], [0, 0, 0], 1], {"i": 837816051, "t": "", "c": null, "e": [["tile_f", "sp", [-1, 2, 3, 1]], ["tile_d", "sp", [-1, 2, 1, 1]], ["tile_y", "sp", [-1, 1, 1, 32]], ["tile_x", "sp", [-1, 2, 1, 2]], ["tile_rc", "sp", [-1, 32]], ["tile_rd", "sp", [-1, 1]], ["tile_ry", "sp", [-1, 1]], ["tile_rx", "sp", [-1, 1]], ["auto_unroll_max_step", "ot", 1500], ["unroll_explicit", "ot", 0]]}], "r": [[0.13836427825, 0.138295448], 0, 3.5176444053649902, 1578506178.2301514], "v": 0.1}
{"i": ["cuda", "schedule_direct_3d_cuda", [[1, 32, 64, 128, 128], [12, 32, 1, 1, 1], [1, 1, 1], [0, 0, 0], 1], {}, ["schedule_direct_3d_cuda", [1, 32, 64, 128, 128], [12, 32, 1, 1, 1], [1, 1, 1], [0, 0, 0], 1], {"i": 558035171, "t": "", "c": null, "e": [["tile_f", "sp", [-1, 2, 3, 1]], ["tile_d", "sp", [-1, 2, 1, 16]], ["tile_y", "sp", [-1, 2, 1, 1]], ["tile_x", "sp", [-1, 1, 1, 4]], ["tile_rc", "sp", [-1, 32]], ["tile_rd", "sp", [-1, 1]], ["tile_ry", "sp", [-1, 1]], ["tile_rx", "sp", [-1, 1]], ["auto_unroll_max_step", "ot", 512], ["unroll_explicit", "ot", 0]]}], "r": [[0.129487137, 0.12945536225], 0, 3.157457113265991, 1578506180.0752304], "v": 0.1}
{"i": ["cuda", "schedule_direct_3d_cuda", [[1, 32, 64, 128, 128], [12, 32, 1, 1, 1], [1, 1, 1], [0, 0, 0], 1], {}, ["schedule_direct_3d_cuda", [1, 32, 64, 128, 128], [12, 32, 1, 1, 1], [1, 1, 1], [0, 0, 0], 1], {"i": 1113209451, "t": "", "c": null, "e": [["tile_f", "sp", [-1, 2, 3, 1]], ["tile_d", "sp", [-1, 1, 1, 2]], ["tile_y", "sp", [-1, 4, 1, 32]], ["tile_x", "sp", [-1, 1, 1, 1]], ["tile_rc", "sp", [-1, 32]], ["tile_rd", "sp", [-1, 1]], ["tile_ry", "sp", [-1, 1]], ["tile_rx", "sp", [-1, 1]], ["auto_unroll_max_step", "ot", 0], ["unroll_explicit", "ot", 1]]}], "r": [[0.14821231675, 0.14880820525], 0, 3.813373327255249, 1578506182.1635985], "v": 0.1}
{"i": ["cuda", "schedule_direct_3d_cuda", [[1, 32, 64, 128, 128], [12, 32, 1, 1, 1], [1, 1, 1], [0, 0, 0], 1], {}, ["schedule_direct_3d_cuda", [1, 32, 64, 128, 128], [12, 32, 1, 1, 1], [1, 1, 1], [0, 0, 0], 1], {"i": 1127365971, "t": "", "c": null, "e": [["tile_f", "sp", [-1, 2, 3, 1]], ["tile_d", "sp", [-1, 1, 1, 4]], ["tile_y", "sp", [-1, 32, 1, 1]], ["tile_x", "sp", [-1, 1, 1, 2]], ["tile_rc", "sp", [-1, 32]], ["tile_rd", "sp", [-1, 1]], ["tile_ry", "sp", [-1, 1]], ["tile_rx", "sp", [-1, 1]], ["auto_unroll_max_step", "ot", 0], ["unroll_explicit", "ot", 1]]}], "r": [[0.14298945375, 0.14287440125], 0, 3.0607643127441406, 1578506184.053608], "v": 0.1}
{"i": ["cuda", "schedule_direct_3d_cuda", [[1, 32, 64, 128, 128], [12, 32, 1, 1, 1], [1, 1, 1], [0, 0, 0], 1], {}, ["schedule_direct_3d_cuda", [1, 32, 64, 128, 128], [12, 32, 1, 1, 1], [1, 1, 1], [0, 0, 0], 1], {"i": 1417669971, "t": "", "c": null, "e": [["tile_f", "sp", [-1, 2, 3, 1]], ["tile_d", "sp", [-1, 1, 1, 4]], ["tile_y", "sp", [-1, 32, 1, 1]], ["tile_x", "sp", [-1, 1, 1, 2]], ["tile_rc", "sp", [-1, 32]], ["tile_rd", "sp", [-1, 1]], ["tile_ry", "sp", [-1, 1]], ["tile_rx", "sp", [-1, 1]], ["auto_unroll_max_step", "ot", 512], ["unroll_explicit", "ot", 1]]}], "r": [[0.15468610075, 0.15471968775], 0, 4.822681665420532, 1578506189.6959534], "v": 0.1}
{"i": ["cuda", "schedule_direct_3d_cuda", [[1, 32, 64, 128, 128], [12, 32, 1, 1, 1], [1, 1, 1], [0, 0, 0], 1], {}, ["schedule_direct_3d_cuda", [1, 32, 64, 128, 128], [12, 32, 1, 1, 1], [1, 1, 1], [0, 0, 0], 1], {"i": 822819011, "t": "", "c": null, "e": [["tile_f", "sp", [-1, 2, 3, 1]], ["tile_d", "sp", [-1, 4, 1, 4]], ["tile_y", "sp", [-1, 2, 1, 8]], ["tile_x", "sp", [-1, 1, 1, 1]], ["tile_rc", "sp", [-1, 32]], ["tile_rd", "sp", [-1, 1]], ["tile_ry", "sp", [-1, 1]], ["tile_rx", "sp", [-1, 1]], ["auto_unroll_max_step", "ot", 1500], ["unroll_explicit", "ot", 0]]}], "r": [[0.146915104, 0.14717109275], 0, 3.5574381351470947, 1578506191.6831934], "v": 0.1}
{"i": ["cuda", "schedule_direct_3d_cuda", [[1, 32, 64, 128, 128], [12, 32, 1, 1, 1], [1, 1, 1], [0, 0, 0], 1], {}, ["schedule_direct_3d_cuda", [1, 32, 64, 128, 128], [12, 32, 1, 1, 1], [1, 1, 1], [0, 0, 0], 1], {"i": 1138643171, "t": "", "c": null, "e": [["tile_f", "sp", [-1, 2, 3, 1]], ["tile_d", "sp", [-1, 2, 1, 16]], ["tile_y", "sp", [-1, 2, 1, 1]], ["tile_x", "sp", [-1, 1, 1, 4]], ["tile_rc", "sp", [-1, 32]], ["tile_rd", "sp", [-1, 1]], ["tile_ry", "sp", [-1, 1]], ["tile_rx", "sp", [-1, 1]], ["auto_unroll_max_step", "ot", 0], ["unroll_explicit", "ot", 1]]}], "r": [[0.129926619, 0.128762977], 0, 2.5261495113372803, 1578506193.4211478], "v": 0.1}
{"i": ["cuda", "schedule_direct_3d_cuda", [[1, 32, 64, 128, 128], [12, 32, 1, 1, 1], [1, 1, 1], [0, 0, 0], 1], {}, ["schedule_direct_3d_cuda", [1, 32, 64, 128, 128], [12, 32, 1, 1, 1], [1, 1, 1], [0, 0, 0], 1], {"i": 1138860531, "t": "", "c": null, "e": [["tile_f", "sp", [-1, 2, 3, 1]], ["tile_d", "sp", [-1, 1, 1, 4]], ["tile_y", "sp", [-1, 4, 1, 4]], ["tile_x", "sp", [-1, 1, 1, 4]], ["tile_rc", "sp", [-1, 32]], ["tile_rd", "sp", [-1, 1]], ["tile_ry", "sp", [-1, 1]], ["tile_rx", "sp", [-1, 1]], ["auto_unroll_max_step", "ot", 0], ["unroll_explicit", "ot", 1]]}], "r": [[0.12900388875, 0.12900491375], 0, 2.882960796356201, 1578506195.1906695], "v": 0.1}
{"i": ["cuda", "schedule_direct_3d_cuda", [[1, 32, 64, 128, 128], [12, 32, 1, 1, 1], [1, 1, 1], [0, 0, 0], 1], {}, ["schedule_direct_3d_cuda", [1, 32, 64, 128, 128], [12, 32, 1, 1, 1], [1, 1, 1], [0, 0, 0], 1], {"i": 1693731011, "t": "", "c": null, "e": [["tile_f", "sp", [-1, 2, 3, 1]], ["tile_d", "sp", [-1, 4, 1, 4]], ["tile_y", "sp", [-1, 2, 1, 8]], ["tile_x", "sp", [-1, 1, 1, 1]], ["tile_rc", "sp", [-1, 32]], ["tile_rd", "sp", [-1, 1]], ["tile_ry", "sp", [-1, 1]], ["tile_rx", "sp", [-1, 1]], ["auto_unroll_max_step", "ot", 1500], ["unroll_explicit", "ot", 1]]}], "r": [[0.15752675325, 0.157566492], 0, 4.8163511753082275, 1578506197.4960396], "v": 0.1}
{"i": ["cuda", "schedule_direct_3d_cuda", [[1, 32, 64, 128, 128], [12, 32, 1, 1, 1], [1, 1, 1], [0, 0, 0], 1], {}, ["schedule_direct_3d_cuda", [1, 32, 64, 128, 128], [12, 32, 1, 1, 1], [1, 1, 1], [0, 0, 0], 1], {"i": 1719468531, "t": "", "c": null, "e": [["tile_f", "sp", [-1, 2, 3, 1]], ["tile_d", "sp", [-1, 1, 1, 4]], ["tile_y", "sp", [-1, 4, 1, 4]], ["tile_x", "sp", [-1, 1, 1, 4]], ["tile_rc", "sp", [-1, 32]], ["tile_rd", "sp", [-1, 1]], ["tile_ry", "sp", [-1, 1]], ["tile_rx", "sp", [-1, 1]], ["auto_unroll_max_step", "ot", 1500], ["unroll_explicit", "ot", 1]]}], "r": [[0.13964288875, 0.13963217775], 0, 4.527229309082031, 1578506199.421776], "v": 0.1}
{"i": ["cuda", "schedule_direct_3d_cuda", [[1, 32, 64, 128, 128], [12, 32, 1, 1, 1], [1, 1, 1], [0, 0, 0], 1], {}, ["schedule_direct_3d_cuda", [1, 32, 64, 128, 128], [12, 32, 1, 1, 1], [1, 1, 1], [0, 0, 0], 1], {"i": 558252531, "t": "", "c": null, "e": [["tile_f", "sp", [-1, 2, 3, 1]], ["tile_d", "sp", [-1, 1, 1, 4]], ["tile_y", "sp", [-1, 4, 1, 4]], ["tile_x", "sp", [-1, 1, 1, 4]], ["tile_rc", "sp", [-1, 32]], ["tile_rd", "sp", [-1, 1]], ["tile_ry", "sp", [-1, 1]], ["tile_rx", "sp", [-1, 1]], ["auto_unroll_max_step", "ot", 512], ["unroll_explicit", "ot", 0]]}], "r": [[0.12954838275, 0.12949690975], 0, 3.282651901245117, 1578506201.2665384], "v": 0.1}
{"i": ["cuda", "schedule_direct_3d_cuda", [[1, 32, 64, 128, 128], [12, 32, 1, 1, 1], [1, 1, 1], [0, 0, 0], 1], {}, ["schedule_direct_3d_cuda", [1, 32, 64, 128, 128], [12, 32, 1, 1, 1], [1, 1, 1], [0, 0, 0], 1], {"i": 547438087, "t": "", "c": null, "e": [["tile_f", "sp", [-1, 2, 2, 1]], ["tile_d", "sp", [-1, 1, 1, 1]], ["tile_y", "sp", [-1, 8, 1, 8]], ["tile_x", "sp", [-1, 2, 1, 2]], ["tile_rc", "sp", [-1, 32]], ["tile_rd", "sp", [-1, 1]], ["tile_ry", "sp", [-1, 1]], ["tile_rx", "sp", [-1, 1]], ["auto_unroll_max_step", "ot", 512], ["unroll_explicit", "ot", 0]]}], "r": [[0.09842376025, 0.098659551], 0, 3.5074310302734375, 1578506203.0369704], "v": 0.1}
{"i": ["cuda", "schedule_direct_3d_cuda", [[1, 32, 64, 128, 128], [12, 32, 1, 1, 1], [1, 1, 1], [0, 0, 0], 1], {}, ["schedule_direct_3d_cuda", [1, 32, 64, 128, 128], [12, 32, 1, 1, 1], [1, 1, 1], [0, 0, 0], 1], {"i": 823552047, "t": "", "c": null, "e": [["tile_f", "sp", [-1, 2, 2, 1]], ["tile_d", "sp", [-1, 2, 1, 8]], ["tile_y", "sp", [-1, 1, 1, 4]], ["tile_x", "sp", [-1, 4, 1, 1]], ["tile_rc", "sp", [-1, 32]], ["tile_rd", "sp", [-1, 1]], ["tile_ry", "sp", [-1, 1]], ["tile_rx", "sp", [-1, 1]], ["auto_unroll_max_step", "ot", 1500], ["unroll_explicit", "ot", 0]]}], "r": [[0.0940899515, 0.09444283775], 0, 3.495281219482422, 1578506204.7768557], "v": 0.1}
{"i": ["cuda", "schedule_direct_3d_cuda", [[1, 32, 64, 128, 128], [12, 32, 1, 1, 1], [1, 1, 1], [0, 0, 0], 1], {}, ["schedule_direct_3d_cuda", [1, 32, 64, 128, 128], [12, 32, 1, 1, 1], [1, 1, 1], [0, 0, 0], 1], {"i": 822819927, "t": "", "c": null, "e": [["tile_f", "sp", [-1, 2, 2, 1]], ["tile_d", "sp", [-1, 1, 1, 16]], ["tile_y", "sp", [-1, 2, 1, 8]], ["tile_x", "sp", [-1, 1, 1, 1]], ["tile_rc", "sp", [-1, 32]], ["tile_rd", "sp", [-1, 1]], ["tile_ry", "sp", [-1, 1]], ["tile_rx", "sp", [-1, 1]], ["auto_unroll_max_step", "ot", 1500], ["unroll_explicit", "ot", 0]]}], "r": [[0.0948807525, 0.09476185725], 0, 3.4182426929473877, 1578506206.5019825], "v": 0.1}
{"i": ["cuda", "schedule_direct_3d_cuda", [[1, 32, 64, 128, 128], [12, 32, 1, 1, 1], [1, 1, 1], [0, 0, 0], 1], {}, ["schedule_direct_3d_cuda", [1, 32, 64, 128, 128], [12, 32, 1, 1, 1], [1, 1, 1], [0, 0, 0], 1], {"i": 823552407, "t": "", "c": null, "e": [["tile_f", "sp", [-1, 2, 2, 1]], ["tile_d", "sp", [-1, 1, 1, 16]], ["tile_y", "sp", [-1, 1, 1, 4]], ["tile_x", "sp", [-1, 4, 1, 1]], ["tile_rc", "sp", [-1, 32]], ["tile_rd", "sp", [-1, 1]], ["tile_ry", "sp", [-1, 1]], ["tile_rx", "sp", [-1, 1]], ["auto_unroll_max_step", "ot", 1500], ["unroll_explicit", "ot", 0]]}], "r": [[0.09446598475, 0.09442966475], 0, 2.996748447418213, 1578506208.2386675], "v": 0.1}
{"i": ["cuda", "schedule_direct_3d_cuda", [[1, 32, 64, 128, 128], [12, 32, 1, 1, 1], [1, 1, 1], [0, 0, 0], 1], {}, ["schedule_direct_3d_cuda", [1, 32, 64, 128, 128], [12, 32, 1, 1, 1], [1, 1, 1], [0, 0, 0], 1], {"i": 848350728, "t": "", "c": null, "e": [["tile_f", "sp", [-1, 3, 2, 1]], ["tile_d", "sp", [-1, 1, 1, 2]], ["tile_y", "sp", [-1, 32, 1, 1]], ["tile_x", "sp", [-1, 1, 1, 4]], ["tile_rc", "sp", [-1, 32]], ["tile_rd", "sp", [-1, 1]], ["tile_ry", "sp", [-1, 1]], ["tile_rx", "sp", [-1, 1]], ["auto_unroll_max_step", "ot", 1500], ["unroll_explicit", "ot", 0]]}], "r": [[0.1494864695, 0.149169285], 0, 4.519009113311768, 1578506210.6861885], "v": 0.1}
{"i": ["cuda", "schedule_direct_3d_cuda", [[1, 32, 64, 128, 128], [12, 32, 1, 1, 1], [1, 1, 1], [0, 0, 0], 1], {}, ["schedule_direct_3d_cuda", [1, 32, 64, 128, 128], [12, 32, 1, 1, 1], [1, 1, 1], [0, 0, 0], 1], {"i": 822870808, "t": "", "c": null, "e": [["tile_f", "sp", [-1, 3, 2, 1]], ["tile_d", "sp", [-1, 4, 1, 1]], ["tile_y", "sp", [-1, 4, 1, 16]], ["tile_x", "sp", [-1, 1, 1, 1]], ["tile_rc", "sp", [-1, 32]], ["tile_rd", "sp", [-1, 1]], ["tile_ry", "sp", [-1, 1]], ["tile_rx", "sp", [-1, 1]], ["auto_unroll_max_step", "ot", 1500], ["unroll_explicit", "ot", 0]]}], "r": [[0.171453189, 0.167035473], 0, 5.033973455429077, 1578506218.341876], "v": 0.1}
{"i": ["cuda", "schedule_direct_3d_cuda", [[1, 32, 64, 128, 128], [12, 32, 1, 1, 1], [1, 1, 1], [0, 0, 0], 1], {}, ["schedule_direct_3d_cuda", [1, 32, 64, 128, 128], [12, 32, 1, 1, 1], [1, 1, 1], [0, 0, 0], 1], {"i": 837179567, "t": "", "c": null, "e": [["tile_f", "sp", [-1, 2, 2, 1]], ["tile_d", "sp", [-1, 1, 1, 4]], ["tile_y", "sp", [-1, 16, 1, 2]], ["tile_x", "sp", [-1, 1, 1, 2]], ["tile_rc", "sp", [-1, 32]], ["tile_rd", "sp", [-1, 1]], ["tile_ry", "sp", [-1, 1]], ["tile_rx", "sp", [-1, 1]], ["auto_unroll_max_step", "ot", 1500], ["unroll_explicit", "ot", 0]]}], "r": [[0.09419236525, 0.0946499185], 0, 3.610128879547119, 1578506220.1156754], "v": 0.1}
{"i": ["cuda", "schedule_direct_3d_cuda", [[1, 32, 64, 128, 128], [12, 32, 1, 1, 1], [1, 1, 1], [0, 0, 0], 1], {}, ["schedule_direct_3d_cuda", [1, 32, 64, 128, 128], [12, 32, 1, 1, 1], [1, 1, 1], [0, 0, 0], 1], {"i": 1127365168, "t": "", "c": null, "e": [["tile_f", "sp", [-1, 3, 2, 1]], ["tile_d", "sp", [-1, 2, 1, 2]], ["tile_y", "sp", [-1, 32, 1, 1]], ["tile_x", "sp", [-1, 1, 1, 2]], ["tile_rc", "sp", [-1, 32]], ["tile_rd", "sp", [-1, 1]], ["tile_ry", "sp", [-1, 1]], ["tile_rx", "sp", [-1, 1]], ["auto_unroll_max_step", "ot", 0], ["unroll_explicit", "ot", 1]]}], "r": [[0.1332175005, 0.1319404065], 0, 3.4911134243011475, 1578506222.1785035], "v": 0.1}
{"i": ["cuda", "schedule_direct_3d_cuda", [[1, 32, 64, 128, 128], [12, 32, 1, 1, 1], [1, 1, 1], [0, 0, 0], 1], {}, ["schedule_direct_3d_cuda", [1, 32, 64, 128, 128], [12, 32, 1, 1, 1], [1, 1, 1], [0, 0, 0], 1], {"i": 837061168, "t": "", "c": null, "e": [["tile_f", "sp", [-1, 3, 2, 1]], ["tile_d", "sp", [-1, 2, 1, 2]], ["tile_y", "sp", [-1, 32, 1, 1]], ["tile_x", "sp", [-1, 1, 1, 2]], ["tile_rc", "sp", [-1, 32]], ["tile_rd", "sp", [-1, 1]], ["tile_ry", "sp", [-1, 1]], ["tile_rx", "sp", [-1, 1]], ["auto_unroll_max_step", "ot", 1500], ["unroll_explicit", "ot", 0]]}], "r": [[0.16138697075, 0.161972336], 0, 4.991573333740234, 1578506224.7465446], "v": 0.1}
{"i": ["cuda", "schedule_direct_3d_cuda", [[1, 32, 64, 128, 128], [12, 32, 1, 1, 1], [1, 1, 1], [0, 0, 0], 1], {}, ["schedule_direct_3d_cuda", [1, 32, 64, 128, 128], [12, 32, 1, 1, 1], [1, 1, 1], [0, 0, 0], 1], {"i": 1113231888, "t": "", "c": null, "e": [["tile_f", "sp", [-1, 3, 2, 1]], ["tile_d", "sp", [-1, 2, 1, 1]], ["tile_y", "sp", [-1, 1, 1, 128]], ["tile_x", "sp", [-1, 1, 1, 1]], ["tile_rc", "sp", [-1, 32]], ["tile_rd", "sp", [-1, 1]], ["tile_ry", "sp", [-1, 1]], ["tile_rx", "sp", [-1, 1]], ["auto_unroll_max_step", "ot", 0], ["unroll_explicit", "ot", 1]]}], "r": [[0.15235003, 0.152223757], 0, 2.4836807250976562, 1578506226.7551677], "v": 0.1}
{"i": ["cuda", "schedule_direct_3d_cuda", [[1, 32, 64, 128, 128], [12, 32, 1, 1, 1], [1, 1, 1], [0, 0, 0], 1], {}, ["schedule_direct_3d_cuda", [1, 32, 64, 128, 128], [12, 32, 1, 1, 1], [1, 1, 1], [0, 0, 0], 1], {"i": 1403152048, "t": "", "c": null, "e": [["tile_f", "sp", [-1, 3, 2, 1]], ["tile_d", "sp", [-1, 2, 1, 8]], ["tile_y", "sp", [-1, 16, 1, 1]], ["tile_x", "sp", [-1, 1, 1, 1]], ["tile_rc", "sp", [-1, 32]], ["tile_rd", "sp", [-1, 1]], ["tile_ry", "sp", [-1, 1]], ["tile_rx", "sp", [-1, 1]], ["auto_unroll_max_step", "ot", 512], ["unroll_explicit", "ot", 1]]}], "r": [[0.20005476275, 0.200154986], 0, 3.5490658283233643, 1578506229.2278883], "v": 0.1}
{"i": ["cuda", "schedule_direct_3d_cuda", [[1, 32, 64, 128, 128], [12, 32, 1, 1, 1], [1, 1, 1], [0, 0, 0], 1], {}, ["schedule_direct_3d_cuda", [1, 32, 64, 128, 128], [12, 32, 1, 1, 1], [1, 1, 1], [0, 0, 0], 1], {"i": 822927888, "t": "", "c": null, "e": [["tile_f", "sp", [-1, 3, 2, 1]], ["tile_d", "sp", [-1, 2, 1, 1]], ["tile_y", "sp", [-1, 1, 1, 128]], ["tile_x", "sp", [-1, 1, 1, 1]], ["tile_rc", "sp", [-1, 32]], ["tile_rd", "sp", [-1, 1]], ["tile_ry", "sp", [-1, 1]], ["tile_rx", "sp", [-1, 1]], ["auto_unroll_max_step", "ot", 1500], ["unroll_explicit", "ot", 0]]}], "r": [[0.157752701, 0.15790356075], 0, 4.816000938415527, 1578506231.7407336], "v": 0.1}
{"i": ["cuda", "schedule_direct_3d_cuda", [[1, 32, 64, 128, 128], [12, 32, 1, 1, 1], [1, 1, 1], [0, 0, 0], 1], {}, ["schedule_direct_3d_cuda", [1, 32, 64, 128, 128], [12, 32, 1, 1, 1], [1, 1, 1], [0, 0, 0], 1], {"i": 1112851368, "t": "", "c": null, "e": [["tile_f", "sp", [-1, 3, 2, 1]], ["tile_d", "sp", [-1, 1, 1, 8]], ["tile_y", "sp", [-1, 32, 1, 1]], ["tile_x", "sp", [-1, 1, 1, 1]], ["tile_rc", "sp", [-1, 32]], ["tile_rd", "sp", [-1, 1]], ["tile_ry", "sp", [-1, 1]], ["tile_rx", "sp", [-1, 1]], ["auto_unroll_max_step", "ot", 0], ["unroll_explicit", "ot", 1]]}], "r": [[0.2104485975, 0.210775924], 0, 3.316572666168213, 1578506234.3024886], "v": 0.1}
{"i": ["cuda", "schedule_direct_3d_cuda", [[1, 32, 64, 128, 128], [12, 32, 1, 1, 1], [1, 1, 1], [0, 0, 0], 1], {}, ["schedule_direct_3d_cuda", [1, 32, 64, 128, 128], [12, 32, 1, 1, 1], [1, 1, 1], [0, 0, 0], 1], {"i": 1708085488, "t": "", "c": null, "e": [["tile_f", "sp", [-1, 3, 2, 1]], ["tile_d", "sp", [-1, 2, 1, 8]], ["tile_y", "sp", [-1, 4, 1, 2]], ["tile_x", "sp", [-1, 1, 1, 2]], ["tile_rc", "sp", [-1, 32]], ["tile_rd", "sp", [-1, 1]], ["tile_ry", "sp", [-1, 1]], ["tile_rx", "sp", [-1, 1]], ["auto_unroll_max_step", "ot", 1500], ["unroll_explicit", "ot", 1]]}], "r": [[0.1540956125, 0.152438861], 0, 6.30916690826416, 1578506236.752897], "v": 0.1}
{"i": ["cuda", "schedule_direct_3d_cuda", [[1, 32, 64, 128, 128], [12, 32, 1, 1, 1], [1, 1, 1], [0, 0, 0], 1], {}, ["schedule_direct_3d_cuda", [1, 32, 64, 128, 128], [12, 32, 1, 1, 1], [1, 1, 1], [0, 0, 0], 1], {"i": 1113760648, "t": "", "c": null, "e": [["tile_f", "sp", [-1, 3, 2, 1]], ["tile_d", "sp", [-1, 16, 1, 2]], ["tile_y", "sp", [-1, 1, 1, 2]], ["tile_x", "sp", [-1, 4, 1, 1]], ["tile_rc", "sp", [-1, 32]], ["tile_rd", "sp", [-1, 1]], ["tile_ry", "sp", [-1, 1]], ["tile_rx", "sp", [-1, 1]], ["auto_unroll_max_step", "ot", 0], ["unroll_explicit", "ot", 1]]}], "r": [[0.1567182995, 0.15628334075], 0, 3.679792881011963, 1578506239.0019236], "v": 0.1}
{"i": ["cuda", "schedule_direct_3d_cuda", [[1, 32, 64, 128, 128], [12, 32, 1, 1, 1], [1, 1, 1], [0, 0, 0], 1], {}, ["schedule_direct_3d_cuda", [1, 32, 64, 128, 128], [12, 32, 1, 1, 1], [1, 1, 1], [0, 0, 0], 1], {"i": 1404066008, "t": "", "c": null, "e": [["tile_f", "sp", [-1, 3, 2, 1]], ["tile_d", "sp", [-1, 4, 1, 8]], ["tile_y", "sp", [-1, 1, 1, 2]], ["tile_x", "sp", [-1, 4, 1, 1]], ["tile_rc", "sp", [-1, 32]], ["tile_rd", "sp", [-1, 1]], ["tile_ry", "sp", [-1, 1]], ["tile_rx", "sp", [-1, 1]], ["auto_unroll_max_step", "ot", 512], ["unroll_explicit", "ot", 1]]}], "r": [[0.148283361, 0.14835527375], 0, 3.2319915294647217, 1578506240.9884038], "v": 0.1}
{"i": ["cuda", "schedule_direct_3d_cuda", [[1, 32, 64, 128, 128], [12, 32, 1, 1, 1], [1, 1, 1], [0, 0, 0], 1], {}, ["schedule_direct_3d_cuda", [1, 32, 64, 128, 128], [12, 32, 1, 1, 1], [1, 1, 1], [0, 0, 0], 1], {"i": 1404064648, "t": "", "c": null, "e": [["tile_f", "sp", [-1, 3, 2, 1]], ["tile_d", "sp", [-1, 16, 1, 2]], ["tile_y", "sp", [-1, 1, 1, 2]], ["tile_x", "sp", [-1, 4, 1, 1]], ["tile_rc", "sp", [-1, 32]], ["tile_rd", "sp", [-1, 1]], ["tile_ry", "sp", [-1, 1]], ["tile_rx", "sp", [-1, 1]], ["auto_unroll_max_step", "ot", 512], ["unroll_explicit", "ot", 1]]}], "r": [[0.16510162525, 0.16527493125], 0, 5.743418455123901, 1578506243.4962611], "v": 0.1}
{"i": ["cuda", "schedule_direct_3d_cuda", [[1, 32, 64, 128, 128], [12, 32, 1, 1, 1], [1, 1, 1], [0, 0, 0], 1], {}, ["schedule_direct_3d_cuda", [1, 32, 64, 128, 128], [12, 32, 1, 1, 1], [1, 1, 1], [0, 0, 0], 1], {"i": 1113123927, "t": "", "c": null, "e": [["tile_f", "sp", [-1, 2, 2, 1]], ["tile_d", "sp", [-1, 1, 1, 16]], ["tile_y", "sp", [-1, 2, 1, 8]], ["tile_x", "sp", [-1, 1, 1, 1]], ["tile_rc", "sp", [-1, 32]], ["tile_rd", "sp", [-1, 1]], ["tile_ry", "sp", [-1, 1]], ["tile_rx", "sp", [-1, 1]], ["auto_unroll_max_step", "ot", 0], ["unroll_explicit", "ot", 1]]}], "r": [[0.09802329125, 0.09796557075], 0, 2.299593210220337, 1578506250.677141], "v": 0.1}
{"i": ["cuda", "schedule_direct_3d_cuda", [[1, 32, 64, 128, 128], [12, 32, 1, 1, 1], [1, 1, 1], [0, 0, 0], 1], {}, ["schedule_direct_3d_cuda", [1, 32, 64, 128, 128], [12, 32, 1, 1, 1], [1, 1, 1], [0, 0, 0], 1], {"i": 1128093127, "t": "", "c": null, "e": [["tile_f", "sp", [-1, 2, 2, 1]], ["tile_d", "sp", [-1, 1, 1, 1]], ["tile_y", "sp", [-1, 4, 1, 16]], ["tile_x", "sp", [-1, 2, 1, 2]], ["tile_rc", "sp", [-1, 32]], ["tile_rd", "sp", [-1, 1]], ["tile_ry", "sp", [-1, 1]], ["tile_rx", "sp", [-1, 1]], ["auto_unroll_max_step", "ot", 0], ["unroll_explicit", "ot", 1]]}], "r": [[0.08583069225, 0.08579170325], 0, 2.271496057510376, 1578506252.1812363], "v": 0.1}
{"i": ["cuda", "schedule_direct_3d_cuda", [[1, 32, 64, 128, 128], [12, 32, 1, 1, 1], [1, 1, 1], [0, 0, 0], 1], {}, ["schedule_direct_3d_cuda", [1, 32, 64, 128, 128], [12, 32, 1, 1, 1], [1, 1, 1], [0, 0, 0], 1], {"i": 1694243048, "t": "", "c": null, "e": [["tile_f", "sp", [-1, 3, 2, 1]], ["tile_d", "sp", [-1, 1, 1, 1]], ["tile_y", "sp", [-1, 1, 1, 128]], ["tile_x", "sp", [-1, 2, 1, 1]], ["tile_rc", "sp", [-1, 32]], ["tile_rd", "sp", [-1, 1]], ["tile_ry", "sp", [-1, 1]], ["tile_rx", "sp", [-1, 1]], ["auto_unroll_max_step", "ot", 1500], ["unroll_explicit", "ot", 1]]}], "r": [[0.14126932, 0.140906144], 0, 6.547908067703247, 1578506254.545336], "v": 0.1}
{"i": ["cuda", "schedule_direct_3d_cuda", [[1, 32, 64, 128, 128], [12, 32, 1, 1, 1], [1, 1, 1], [0, 0, 0], 1], {}, ["schedule_direct_3d_cuda", [1, 32, 64, 128, 128], [12, 32, 1, 1, 1], [1, 1, 1], [0, 0, 0], 1], {"i": 1417669167, "t": "", "c": null, "e": [["tile_f", "sp", [-1, 2, 2, 1]], ["tile_d", "sp", [-1, 2, 1, 2]], ["tile_y", "sp", [-1, 32, 1, 1]], ["tile_x", "sp", [-1, 1, 1, 2]], ["tile_rc", "sp", [-1, 32]], ["tile_rd", "sp", [-1, 1]], ["tile_ry", "sp", [-1, 1]], ["tile_rx", "sp", [-1, 1]], ["auto_unroll_max_step", "ot", 512], ["unroll_explicit", "ot", 1]]}], "r": [[0.10535398075, 0.10541057], 0, 4.647672653198242, 1578506256.401414], "v": 0.1}
{"i": ["cuda", "schedule_direct_3d_cuda", [[1, 32, 64, 128, 128], [12, 32, 1, 1, 1], [1, 1, 1], [0, 0, 0], 1], {}, ["schedule_direct_3d_cuda", [1, 32, 64, 128, 128], [12, 32, 1, 1, 1], [1, 1, 1], [0, 0, 0], 1], {"i": 1429281287, "t": "", "c": null, "e": [["tile_f", "sp", [-1, 2, 2, 1]], ["tile_d", "sp", [-1, 1, 1, 2]], ["tile_y", "sp", [-1, 2, 1, 16]], ["tile_x", "sp", [-1, 1, 1, 4]], ["tile_rc", "sp", [-1, 32]], ["tile_rd", "sp", [-1, 1]], ["tile_ry", "sp", [-1, 1]], ["tile_rx", "sp", [-1, 1]], ["auto_unroll_max_step", "ot", 512], ["unroll_explicit", "ot", 1]]}], "r": [[0.11333916925, 0.11344638275], 0, 4.631977558135986, 1578506258.3037798], "v": 0.1}
{"i": ["cuda", "schedule_direct_3d_cuda", [[1, 32, 64, 128, 128], [12, 32, 1, 1, 1], [1, 1, 1], [0, 0, 0], 1], {}, ["schedule_direct_3d_cuda", [1, 32, 64, 128, 128], [12, 32, 1, 1, 1], [1, 1, 1], [0, 0, 0], 1], {"i": 837061968, "t": "", "c": null, "e": [["tile_f", "sp", [-1, 3, 2, 1]], ["tile_d", "sp", [-1, 1, 1, 4]], ["tile_y", "sp", [-1, 32, 1, 1]], ["tile_x", "sp", [-1, 1, 1, 2]], ["tile_rc", "sp", [-1, 32]], ["tile_rd", "sp", [-1, 1]], ["tile_ry", "sp", [-1, 1]], ["tile_rx", "sp", [-1, 1]], ["auto_unroll_max_step", "ot", 1500], ["unroll_explicit", "ot", 0]]}], "r": [[0.14543183625, 0.14501057525], 0, 4.693624258041382, 1578506260.720744], "v": 0.1}
{"i": ["cuda", "schedule_direct_3d_cuda", [[1, 32, 64, 128, 128], [12, 32, 1, 1, 1], [1, 1, 1], [0, 0, 0], 1], {}, ["schedule_direct_3d_cuda", [1, 32, 64, 128, 128], [12, 32, 1, 1, 1], [1, 1, 1], [0, 0, 0], 1], {"i": 848559047, "t": "", "c": null, "e": [["tile_f", "sp", [-1, 2, 2, 1]], ["tile_d", "sp", [-1, 1, 1, 2]], ["tile_y", "sp", [-1, 8, 1, 4]], ["tile_x", "sp", [-1, 1, 1, 4]], ["tile_rc", "sp", [-1, 32]], ["tile_rd", "sp", [-1, 1]], ["tile_ry", "sp", [-1, 1]], ["tile_rx", "sp", [-1, 1]], ["auto_unroll_max_step", "ot", 1500], ["unroll_explicit", "ot", 0]]}], "r": [[0.0916773185, 0.0918493145], 0, 3.182826042175293, 1578506262.42935], "v": 0.1}
{"i": ["cuda", "schedule_direct_3d_cuda", [[1, 32, 64, 128, 128], [12, 32, 1, 1, 1], [1, 1, 1], [0, 0, 0], 1], {}, ["schedule_direct_3d_cuda", [1, 32, 64, 128, 128], [12, 32, 1, 1, 1], [1, 1, 1], [0, 0, 0], 1], {"i": 1113174808, "t": "", "c": null, "e": [["tile_f", "sp", [-1, 3, 2, 1]], ["tile_d", "sp", [-1, 4, 1, 1]], ["tile_y", "sp", [-1, 4, 1, 16]], ["tile_x", "sp", [-1, 1, 1, 1]], ["tile_rc", "sp", [-1, 32]], ["tile_rd", "sp", [-1, 1]], ["tile_ry", "sp", [-1, 1]], ["tile_rx", "sp", [-1, 1]], ["auto_unroll_max_step", "ot", 0], ["unroll_explicit", "ot", 1]]}], "r": [[0.18607487425, 0.18692596925], 0, 3.0704517364501953, 1578506264.728642], "v": 0.1}
{"i": ["cuda", "schedule_direct_3d_cuda", [[1, 32, 64, 128, 128], [12, 32, 1, 1, 1], [1, 1, 1], [0, 0, 0], 1], {}, ["schedule_direct_3d_cuda", [1, 32, 64, 128, 128], [12, 32, 1, 1, 1], [1, 1, 1], [0, 0, 0], 1], {"i": 1403354367, "t": "", "c": null, "e": [["tile_f", "sp", [-1, 2, 2, 1]], ["tile_d", "sp", [-1, 1, 1, 64]], ["tile_y", "sp", [-1, 1, 1, 4]], ["tile_x", "sp", [-1, 1, 1, 1]], ["tile_rc", "sp", [-1, 32]], ["tile_rd", "sp", [-1, 1]], ["tile_ry", "sp", [-1, 1]], ["tile_rx", "sp", [-1, 1]], ["auto_unroll_max_step", "ot", 512], ["unroll_explicit", "ot", 1]]}], "r": [[0.1078135035, 0.10826066025], 0, 3.941507577896118, 1578506266.5592945], "v": 0.1}
{"i": ["cuda", "schedule_direct_3d_cuda", [[1, 32, 64, 128, 128], [12, 32, 1, 1, 1], [1, 1, 1], [0, 0, 0], 1], {}, ["schedule_direct_3d_cuda", [1, 32, 64, 128, 128], [12, 32, 1, 1, 1], [1, 1, 1], [0, 0, 0], 1], {"i": 1719262728, "t": "", "c": null, "e": [["tile_f", "sp", [-1, 3, 2, 1]], ["tile_d", "sp", [-1, 1, 1, 2]], ["tile_y", "sp", [-1, 32, 1, 1]], ["tile_x", "sp", [-1, 1, 1, 4]], ["tile_rc", "sp", [-1, 32]], ["tile_rd", "sp", [-1, 1]], ["tile_ry", "sp", [-1, 1]], ["tile_rx", "sp", [-1, 1]], ["auto_unroll_max_step", "ot", 1500], ["unroll_explicit", "ot", 1]]}], "r": [[0.14048617725, 0.1423402865], 0, 6.480678081512451, 1578506268.9146278], "v": 0.1}
{"i": ["cuda", "schedule_direct_3d_cuda", [[1, 32, 64, 128, 128], [12, 32, 1, 1, 1], [1, 1, 1], [0, 0, 0], 1], {}, ["schedule_direct_3d_cuda", [1, 32, 64, 128, 128], [12, 32, 1, 1, 1], [1, 1, 1], [0, 0, 0], 1], {"i": 1708701127, "t": "", "c": null, "e": [["tile_f", "sp", [-1, 2, 2, 1]], ["tile_d", "sp", [-1, 1, 1, 1]], ["tile_y", "sp", [-1, 4, 1, 16]], ["tile_x", "sp", [-1, 2, 1, 2]], ["tile_rc", "sp", [-1, 32]], ["tile_rd", "sp", [-1, 1]], ["tile_ry", "sp", [-1, 1]], ["tile_rx", "sp", [-1, 1]], ["auto_unroll_max_step", "ot", 1500], ["unroll_explicit", "ot", 1]]}], "r": [[0.10931758975, 0.10935314275], 0, 4.373960494995117, 1578506270.8053582], "v": 0.1}
{"i": ["cuda", "schedule_direct_3d_cuda", [[1, 32, 64, 128, 128], [12, 32, 1, 1, 1], [1, 1, 1], [0, 0, 0], 1], {}, ["schedule_direct_3d_cuda", [1, 32, 64, 128, 128], [12, 32, 1, 1, 1], [1, 1, 1], [0, 0, 0], 1], {"i": 1707973168, "t": "", "c": null, "e": [["tile_f", "sp", [-1, 3, 2, 1]], ["tile_d", "sp", [-1, 2, 1, 2]], ["tile_y", "sp", [-1, 32, 1, 1]], ["tile_x", "sp", [-1, 1, 1, 2]], ["tile_rc", "sp", [-1, 32]], ["tile_rd", "sp", [-1, 1]], ["tile_ry", "sp", [-1, 1]], ["tile_rx", "sp", [-1, 1]], ["auto_unroll_max_step", "ot", 1500], ["unroll_explicit", "ot", 1]]}], "r": [[0.1514118305, 0.15021979875], 0, 6.7040183544158936, 1578506273.2746427], "v": 0.1}
{"i": ["cuda", "schedule_direct_3d_cuda", [[1, 32, 64, 128, 128], [12, 32, 1, 1, 1], [1, 1, 1], [0, 0, 0], 1], {}, ["schedule_direct_3d_cuda", [1, 32, 64, 128, 128], [12, 32, 1, 1, 1], [1, 1, 1], [0, 0, 0], 1], {"i": 532749293, "t": "", "c": null, "e": [["tile_f", "sp", [-1, 1, 4, 1]], ["tile_d", "sp", [-1, 1, 1, 2]], ["tile_y", "sp", [-1, 1, 1, 2]], ["tile_x", "sp", [-1, 2, 1, 1]], ["tile_rc", "sp", [-1, 32]], ["tile_rd", "sp", [-1, 1]], ["tile_ry", "sp", [-1, 1]], ["tile_rx", "sp", [-1, 1]], ["auto_unroll_max_step", "ot", 512], ["unroll_explicit", "ot", 0]]}], "r": [[0.0054102565, 0.00538796075], 0, 1.2384448051452637, 1578506476.7930176], "v": 0.1}
{"i": ["cuda", "schedule_direct_3d_cuda", [[1, 32, 64, 128, 128], [12, 32, 1, 1, 1], [1, 1, 1], [0, 0, 0], 1], {}, ["schedule_direct_3d_cuda", [1, 32, 64, 128, 128], [12, 32, 1, 1, 1], [1, 1, 1], [0, 0, 0], 1], {"i": 546740333, "t": "", "c": null, "e": [["tile_f", "sp", [-1, 1, 4, 1]], ["tile_d", "sp", [-1, 1, 1, 2]], ["tile_y", "sp", [-1, 1, 1, 1]], ["tile_x", "sp", [-1, 1, 1, 2]], ["tile_rc", "sp", [-1, 32]], ["tile_rd", "sp", [-1, 1]], ["tile_ry", "sp", [-1, 1]], ["tile_rx", "sp", [-1, 1]], ["auto_unroll_max_step", "ot", 512], ["unroll_explicit", "ot", 0]]}], "r": [[0.0049000145, 0.00490613525], 0, 1.0845677852630615, 1578506477.4595942], "v": 0.1}
{"i": ["cuda", "schedule_direct_3d_cuda", [[1, 32, 64, 128, 128], [12, 32, 1, 1, 1], [1, 1, 1], [0, 0, 0], 1], {}, ["schedule_direct_3d_cuda", [1, 32, 64, 128, 128], [12, 32, 1, 1, 1], [1, 1, 1], [0, 0, 0], 1], {"i": 532749287, "t": "", "c": null, "e": [["tile_f", "sp", [-1, 2, 2, 1]], ["tile_d", "sp", [-1, 1, 1, 2]], ["tile_y", "sp", [-1, 1, 1, 2]], ["tile_x", "sp", [-1, 2, 1, 1]], ["tile_rc", "sp", [-1, 32]], ["tile_rd", "sp", [-1, 1]], ["tile_ry", "sp", [-1, 1]], ["tile_rx", "sp", [-1, 1]], ["auto_unroll_max_step", "ot", 512], ["unroll_explicit", "ot", 0]]}], "r": [[0.0061749465, 0.00616509325], 0, 1.4833629131317139, 1578506478.2759874], "v": 0.1}
{"i": ["cuda", "schedule_direct_3d_cuda", [[1, 32, 64, 128, 128], [12, 32, 1, 1, 1], [1, 1, 1], [0, 0, 0], 1], {}, ["schedule_direct_3d_cuda", [1, 32, 64, 128, 128], [12, 32, 1, 1, 1], [1, 1, 1], [0, 0, 0], 1], {"i": 532749290, "t": "", "c": null, "e": [["tile_f", "sp", [-1, 1, 3, 1]], ["tile_d", "sp", [-1, 1, 1, 2]], ["tile_y", "sp", [-1, 1, 1, 2]], ["tile_x", "sp", [-1, 2, 1, 1]], ["tile_rc", "sp", [-1, 32]], ["tile_rd", "sp", [-1, 1]], ["tile_ry", "sp", [-1, 1]], ["tile_rx", "sp", [-1, 1]], ["auto_unroll_max_step", "ot", 512], ["unroll_explicit", "ot", 0]]}], "r": [[0.0197843515, 0.019636638], 0, 1.7124261856079102, 1578506479.3221898], "v": 0.1}
{"i": ["cuda", "schedule_direct_3d_cuda", [[1, 32, 64, 128, 128], [12, 32, 1, 1, 1], [1, 1, 1], [0, 0, 0], 1], {}, ["schedule_direct_3d_cuda", [1, 32, 64, 128, 128], [12, 32, 1, 1, 1], [1, 1, 1], [0, 0, 0], 1], {"i": 532844213, "t": "", "c": null, "e": [["tile_f", "sp", [-1, 1, 4, 1]], ["tile_d", "sp", [-1, 1, 1, 4]], ["tile_y", "sp", [-1, 1, 1, 4]], ["tile_x", "sp", [-1, 2, 1, 1]], ["tile_rc", "sp", [-1, 32]], ["tile_rd", "sp", [-1, 1]], ["tile_ry", "sp", [-1, 1]], ["tile_rx", "sp", [-1, 1]], ["auto_unroll_max_step", "ot", 512], ["unroll_explicit", "ot", 0]]}], "r": [[0.00360649275, 0.003597456], 0, 1.6058881282806396, 1578506480.113518], "v": 0.1}
{"i": ["cuda", "schedule_direct_3d_cuda", [[1, 32, 64, 128, 128], [12, 32, 1, 1, 1], [1, 1, 1], [0, 0, 0], 1], {}, ["schedule_direct_3d_cuda", [1, 32, 64, 128, 128], [12, 32, 1, 1, 1], [1, 1, 1], [0, 0, 0], 1], {"i": 532750133, "t": "", "c": null, "e": [["tile_f", "sp", [-1, 1, 4, 1]], ["tile_d", "sp", [-1, 1, 1, 4]], ["tile_y", "sp", [-1, 1, 1, 2]], ["tile_x", "sp", [-1, 2, 1, 1]], ["tile_rc", "sp", [-1, 32]], ["tile_rd", "sp", [-1, 1]], ["tile_ry", "sp", [-1, 1]], ["tile_rx", "sp", [-1, 1]], ["auto_unroll_max_step", "ot", 512], ["unroll_explicit", "ot", 0]]}], "r": [[0.00442923825, 0.004425718], 0, 1.6764423847198486, 1578506480.9226358], "v": 0.1}
{"i": ["cuda", "schedule_direct_3d_cuda", [[1, 32, 64, 128, 128], [12, 32, 1, 1, 1], [1, 1, 1], [0, 0, 0], 1], {}, ["schedule_direct_3d_cuda", [1, 32, 64, 128, 128], [12, 32, 1, 1, 1], [1, 1, 1], [0, 0, 0], 1], {"i": 546740327, "t": "", "c": null, "e": [["tile_f", "sp", [-1, 2, 2, 1]], ["tile_d", "sp", [-1, 1, 1, 2]], ["tile_y", "sp", [-1, 1, 1, 1]], ["tile_x", "sp", [-1, 1, 1, 2]], ["tile_rc", "sp", [-1, 32]], ["tile_rd", "sp", [-1, 1]], ["tile_ry", "sp", [-1, 1]], ["tile_rx", "sp", [-1, 1]], ["auto_unroll_max_step", "ot", 512], ["unroll_explicit", "ot", 0]]}], "r": [[0.0071248585, 0.00713222475], 0, 1.3905820846557617, 1578506481.6653502], "v": 0.1}
{"i": ["cuda", "schedule_direct_3d_cuda", [[1, 32, 64, 128, 128], [12, 32, 1, 1, 1], [1, 1, 1], [0, 0, 0], 1], {}, ["schedule_direct_3d_cuda", [1, 32, 64, 128, 128], [12, 32, 1, 1, 1], [1, 1, 1], [0, 0, 0], 1], {"i": 532748173, "t": "", "c": null, "e": [["tile_f", "sp", [-1, 1, 4, 1]], ["tile_d", "sp", [-1, 1, 1, 1]], ["tile_y", "sp", [-1, 1, 1, 2]], ["tile_x", "sp", [-1, 2, 1, 1]], ["tile_rc", "sp", [-1, 32]], ["tile_rd", "sp", [-1, 1]], ["tile_ry", "sp", [-1, 1]], ["tile_rx", "sp", [-1, 1]], ["auto_unroll_max_step", "ot", 512], ["unroll_explicit", "ot", 0]]}], "r": [[0.0056842645, 0.005695375], 0, 1.2265915870666504, 1578506482.36447], "v": 0.1}
{"i": ["cuda", "schedule_direct_3d_cuda", [[1, 32, 64, 128, 128], [12, 32, 1, 1, 1], [1, 1, 1], [0, 0, 0], 1], {}, ["schedule_direct_3d_cuda", [1, 32, 64, 128, 128], [12, 32, 1, 1, 1], [1, 1, 1], [0, 0, 0], 1], {"i": 208337935, "t": "", "c": null, "e": [["tile_f", "sp", [-1, 1, 6, 1]], ["tile_d", "sp", [-1, 1, 1, 2]], ["tile_y", "sp", [-1, 1, 1, 8]], ["tile_x", "sp", [-1, 1, 1, 2]], ["tile_rc", "sp", [-1, 16]], ["tile_rd", "sp", [-1, 1]], ["tile_ry", "sp", [-1, 1]], ["tile_rx", "sp", [-1, 1]], ["auto_unroll_max_step", "ot", 0], ["unroll_explicit", "ot", 0]]}], "r": [[0.004009285, 0.0040077885], 0, 1.2814035415649414, 1578506483.0518432], "v": 0.1}
{"i": ["cuda", "schedule_direct_3d_cuda", [[1, 32, 64, 128, 128], [12, 32, 1, 1, 1], [1, 1, 1], [0, 0, 0], 1], {}, ["schedule_direct_3d_cuda", [1, 32, 64, 128, 128], [12, 32, 1, 1, 1], [1, 1, 1], [0, 0, 0], 1], {"i": 484460213, "t": "", "c": null, "e": [["tile_f", "sp", [-1, 1, 4, 1]], ["tile_d", "sp", [-1, 1, 1, 4]], ["tile_y", "sp", [-1, 1, 1, 4]], ["tile_x", "sp", [-1, 2, 1, 1]], ["tile_rc", "sp", [-1, 16]], ["tile_rd", "sp", [-1, 1]], ["tile_ry", "sp", [-1, 1]], ["tile_rx", "sp", [-1, 1]], ["auto_unroll_max_step", "ot", 512], ["unroll_explicit", "ot", 0]]}], "r": [[0.00402729775, 0.00401966425], 0, 1.6576652526855469, 1578506483.919405], "v": 0.1}
{"i": ["cuda", "schedule_direct_3d_cuda", [[1, 32, 64, 128, 128], [12, 32, 1, 1, 1], [1, 1, 1], [0, 0, 0], 1], {}, ["schedule_direct_3d_cuda", [1, 32, 64, 128, 128], [12, 32, 1, 1, 1], [1, 1, 1], [0, 0, 0], 1], {"i": 484366130, "t": "", "c": null, "e": [["tile_f", "sp", [-1, 1, 3, 1]], ["tile_d", "sp", [-1, 1, 1, 4]], ["tile_y", "sp", [-1, 1, 1, 2]], ["tile_x", "sp", [-1, 2, 1, 1]], ["tile_rc", "sp", [-1, 16]], ["tile_rd", "sp", [-1, 1]], ["tile_ry", "sp", [-1, 1]], ["tile_rx", "sp", [-1, 1]], ["auto_unroll_max_step", "ot", 512], ["unroll_explicit", "ot", 0]]}], "r": [[0.03705448575, 0.0351788135], 0, 1.8212602138519287, 1578506485.0863633], "v": 0.1}
{"i": ["cuda", "schedule_direct_3d_cuda", [[1, 32, 64, 128, 128], [12, 32, 1, 1, 1], [1, 1, 1], [0, 0, 0], 1], {}, ["schedule_direct_3d_cuda", [1, 32, 64, 128, 128], [12, 32, 1, 1, 1], [1, 1, 1], [0, 0, 0], 1], {"i": 532750130, "t": "", "c": null, "e": [["tile_f", "sp", [-1, 1, 3, 1]], ["tile_d", "sp", [-1, 1, 1, 4]], ["tile_y", "sp", [-1, 1, 1, 2]], ["tile_x", "sp", [-1, 2, 1, 1]], ["tile_rc", "sp", [-1, 32]], ["tile_rd", "sp", [-1, 1]], ["tile_ry", "sp", [-1, 1]], ["tile_rx", "sp", [-1, 1]], ["auto_unroll_max_step", "ot", 512], ["unroll_explicit", "ot", 0]]}], "r": [[0.01846932375, 0.018288172], 0, 2.0030012130737305, 1578506486.3546557], "v": 0.1}
{"i": ["cuda", "schedule_direct_3d_cuda", [[1, 32, 64, 128, 128], [12, 32, 1, 1, 1], [1, 1, 1], [0, 0, 0], 1], {}, ["schedule_direct_3d_cuda", [1, 32, 64, 128, 128], [12, 32, 1, 1, 1], [1, 1, 1], [0, 0, 0], 1], {"i": 532843373, "t": "", "c": null, "e": [["tile_f", "sp", [-1, 1, 4, 1]], ["tile_d", "sp", [-1, 1, 1, 2]], ["tile_y", "sp", [-1, 1, 1, 4]], ["tile_x", "sp", [-1, 2, 1, 1]], ["tile_rc", "sp", [-1, 32]], ["tile_rd", "sp", [-1, 1]], ["tile_ry", "sp", [-1, 1]], ["tile_rx", "sp", [-1, 1]], ["auto_unroll_max_step", "ot", 512], ["unroll_explicit", "ot", 0]]}], "r": [[0.00392007075, 0.00391874825], 0, 1.5379841327667236, 1578506488.8471525], "v": 0.1}
{"i": ["cuda", "schedule_direct_3d_cuda", [[1, 32, 64, 128, 128], [12, 32, 1, 1, 1], [1, 1, 1], [0, 0, 0], 1], {}, ["schedule_direct_3d_cuda", [1, 32, 64, 128, 128], [12, 32, 1, 1, 1], [1, 1, 1], [0, 0, 0], 1], {"i": 1079249935, "t": "", "c": null, "e": [["tile_f", "sp", [-1, 1, 6, 1]], ["tile_d", "sp", [-1, 1, 1, 2]], ["tile_y", "sp", [-1, 1, 1, 8]], ["tile_x", "sp", [-1, 1, 1, 2]], ["tile_rc", "sp", [-1, 16]], ["tile_rd", "sp", [-1, 1]], ["tile_ry", "sp", [-1, 1]], ["tile_rx", "sp", [-1, 1]], ["auto_unroll_max_step", "ot", 0], ["unroll_explicit", "ot", 1]]}], "r": [[0.00374804075, 0.003746317], 0, 0.9654853343963623, 1578506489.4438157], "v": 0.1}
{"i": ["cuda", "schedule_direct_3d_cuda", [[1, 32, 64, 128, 128], [12, 32, 1, 1, 1], [1, 1, 1], [0, 0, 0], 1], {}, ["schedule_direct_3d_cuda", [1, 32, 64, 128, 128], [12, 32, 1, 1, 1], [1, 1, 1], [0, 0, 0], 1], {"i": 1113357287, "t": "", "c": null, "e": [["tile_f", "sp", [-1, 2, 2, 1]], ["tile_d", "sp", [-1, 1, 1, 2]], ["tile_y", "sp", [-1, 1, 1, 2]], ["tile_x", "sp", [-1, 2, 1, 1]], ["tile_rc", "sp", [-1, 32]], ["tile_rd", "sp", [-1, 1]], ["tile_ry", "sp", [-1, 1]], ["tile_rx", "sp", [-1, 1]], ["auto_unroll_max_step", "ot", 0], ["unroll_explicit", "ot", 1]]}], "r": [[0.005458598, 0.0054697415], 0, 1.065680980682373, 1578506490.3571532], "v": 0.1}
{"i": ["cuda", "schedule_direct_3d_cuda", [[1, 32, 64, 128, 128], [12, 32, 1, 1, 1], [1, 1, 1], [0, 0, 0], 1], {}, ["schedule_direct_3d_cuda", [1, 32, 64, 128, 128], [12, 32, 1, 1, 1], [1, 1, 1], [0, 0, 0], 1], {"i": 546740330, "t": "", "c": null, "e": [["tile_f", "sp", [-1, 1, 3, 1]], ["tile_d", "sp", [-1, 1, 1, 2]], ["tile_y", "sp", [-1, 1, 1, 1]], ["tile_x", "sp", [-1, 1, 1, 2]], ["tile_rc", "sp", [-1, 32]], ["tile_rd", "sp", [-1, 1]], ["tile_ry", "sp", [-1, 1]], ["tile_rx", "sp", [-1, 1]], ["auto_unroll_max_step", "ot", 512], ["unroll_explicit", "ot", 0]]}], "r": [[0.0172875895, 0.01724696175], 0, 1.4183249473571777, 1578506491.2316911], "v": 0.1}
{"i": ["cuda", "schedule_direct_3d_cuda", [[1, 32, 64, 128, 128], [12, 32, 1, 1, 1], [1, 1, 1], [0, 0, 0], 1], {}, ["schedule_direct_3d_cuda", [1, 32, 64, 128, 128], [12, 32, 1, 1, 1], [1, 1, 1], [0, 0, 0], 1], {"i": 242445287, "t": "", "c": null, "e": [["tile_f", "sp", [-1, 2, 2, 1]], ["tile_d", "sp", [-1, 1, 1, 2]], ["tile_y", "sp", [-1, 1, 1, 2]], ["tile_x", "sp", [-1, 2, 1, 1]], ["tile_rc", "sp", [-1, 32]], ["tile_rd", "sp", [-1, 1]], ["tile_ry", "sp", [-1, 1]], ["tile_rx", "sp", [-1, 1]], ["auto_unroll_max_step", "ot", 0], ["unroll_explicit", "ot", 0]]}], "r": [[0.00544180775, 0.005453722], 0, 1.0370054244995117, 1578506491.8473446], "v": 0.1}
{"i": ["cuda", "schedule_direct_3d_cuda", [[1, 32, 64, 128, 128], [12, 32, 1, 1, 1], [1, 1, 1], [0, 0, 0], 1], {}, ["schedule_direct_3d_cuda", [1, 32, 64, 128, 128], [12, 32, 1, 1, 1], [1, 1, 1], [0, 0, 0], 1], {"i": 1113450247, "t": "", "c": null, "e": [["tile_f", "sp", [-1, 2, 2, 1]], ["tile_d", "sp", [-1, 1, 1, 1]], ["tile_y", "sp", [-1, 1, 1, 4]], ["tile_x", "sp", [-1, 2, 1, 1]], ["tile_rc", "sp", [-1, 32]], ["tile_rd", "sp", [-1, 1]], ["tile_ry", "sp", [-1, 1]], ["tile_rx", "sp", [-1, 1]], ["auto_unroll_max_step", "ot", 0], ["unroll_explicit", "ot", 1]]}], "r": [[0.00494943325, 0.00494381375], 0, 1.1676819324493408, 1578506492.5213044], "v": 0.1}
{"i": ["cuda", "schedule_direct_3d_cuda", [[1, 32, 64, 128, 128], [12, 32, 1, 1, 1], [1, 1, 1], [0, 0, 0], 1], {}, ["schedule_direct_3d_cuda", [1, 32, 64, 128, 128], [12, 32, 1, 1, 1], [1, 1, 1], [0, 0, 0], 1], {"i": 484365290, "t": "", "c": null, "e": [["tile_f", "sp", [-1, 1, 3, 1]], ["tile_d", "sp", [-1, 1, 1, 2]], ["tile_y", "sp", [-1, 1, 1, 2]], ["tile_x", "sp", [-1, 2, 1, 1]], ["tile_rc", "sp", [-1, 16]], ["tile_rd", "sp", [-1, 1]], ["tile_ry", "sp", [-1, 1]], ["tile_rx", "sp", [-1, 1]], ["auto_unroll_max_step", "ot", 512], ["unroll_explicit", "ot", 0]]}], "r": [[0.0265176195, 0.02652188375], 0, 1.6766839027404785, 1578506493.6359532], "v": 0.1}
{"i": ["cuda", "schedule_direct_3d_cuda", [[1, 32, 64, 128, 128], [12, 32, 1, 1, 1], [1, 1, 1], [0, 0, 0], 1], {}, ["schedule_direct_3d_cuda", [1, 32, 64, 128, 128], [12, 32, 1, 1, 1], [1, 1, 1], [0, 0, 0], 1], {"i": 484365293, "t": "", "c": null, "e": [["tile_f", "sp", [-1, 1, 4, 1]], ["tile_d", "sp", [-1, 1, 1, 2]], ["tile_y", "sp", [-1, 1, 1, 2]], ["tile_x", "sp", [-1, 2, 1, 1]], ["tile_rc", "sp", [-1, 16]], ["tile_rd", "sp", [-1, 1]], ["tile_ry", "sp", [-1, 1]], ["tile_rx", "sp", [-1, 1]], ["auto_unroll_max_step", "ot", 512], ["unroll_explicit", "ot", 0]]}], "r": [[0.0036392015, 0.00363860575], 0, 1.233793020248413, 1578506494.361593], "v": 0.1}
{"i": ["cuda", "schedule_direct_3d_cuda", [[1, 32, 64, 128, 128], [12, 32, 1, 1, 1], [1, 1, 1], [0, 0, 0], 1], {}, ["schedule_direct_3d_cuda", [1, 32, 64, 128, 128], [12, 32, 1, 1, 1], [1, 1, 1], [0, 0, 0], 1], {"i": 242445293, "t": "", "c": null, "e": [["tile_f", "sp", [-1, 1, 4, 1]], ["tile_d", "sp", [-1, 1, 1, 2]], ["tile_y", "sp", [-1, 1, 1, 2]], ["tile_x", "sp", [-1, 2, 1, 1]], ["tile_rc", "sp", [-1, 32]], ["tile_rd", "sp", [-1, 1]], ["tile_ry", "sp", [-1, 1]], ["tile_rx", "sp", [-1, 1]], ["auto_unroll_max_step", "ot", 0], ["unroll_explicit", "ot", 0]]}], "r": [[0.0048358305, 0.00480944925], 0, 1.0560081005096436, 1578506495.2430289], "v": 0.1}
{"i": ["cuda", "schedule_direct_3d_cuda", [[1, 32, 64, 128, 128], [12, 32, 1, 1, 1], [1, 1, 1], [0, 0, 0], 1], {}, ["schedule_direct_3d_cuda", [1, 32, 64, 128, 128], [12, 32, 1, 1, 1], [1, 1, 1], [0, 0, 0], 1], {"i": 435742737, "t": "", "c": null, "e": [["tile_f", "sp", [-1, 1, 12, 1]], ["tile_d", "sp", [-1, 1, 1, 2]], ["tile_y", "sp", [-1, 1, 1, 8]], ["tile_x", "sp", [-1, 1, 1, 1]], ["tile_rc", "sp", [-1, 8]], ["tile_rd", "sp", [-1, 1]], ["tile_ry", "sp", [-1, 1]], ["tile_rx", "sp", [-1, 1]], ["auto_unroll_max_step", "ot", 512], ["unroll_explicit", "ot", 0]]}], "r": [[0.0022730535, 0.00227713925], 0, 1.1287000179290771, 1578506498.0902097], "v": 0.1}
{"i": ["cuda", "schedule_direct_3d_cuda", [[1, 32, 64, 128, 128], [12, 32, 1, 1, 1], [1, 1, 1], [0, 0, 0], 1], {}, ["schedule_direct_3d_cuda", [1, 32, 64, 128, 128], [12, 32, 1, 1, 1], [1, 1, 1], [0, 0, 0], 1], {"i": 532842253, "t": "", "c": null, "e": [["tile_f", "sp", [-1, 1, 4, 1]], ["tile_d", "sp", [-1, 1, 1, 1]], ["tile_y", "sp", [-1, 1, 1, 4]], ["tile_x", "sp", [-1, 2, 1, 1]], ["tile_rc", "sp", [-1, 32]], ["tile_rd", "sp", [-1, 1]], ["tile_ry", "sp", [-1, 1]], ["tile_rx", "sp", [-1, 1]], ["auto_unroll_max_step", "ot", 512], ["unroll_explicit", "ot", 0]]}], "r": [[0.00455682775, 0.00457964925], 0, 1.2616214752197266, 1578506498.770573], "v": 0.1}
{"i": ["cuda", "schedule_direct_3d_cuda", [[1, 32, 64, 128, 128], [12, 32, 1, 1, 1], [1, 1, 1], [0, 0, 0], 1], {}, ["schedule_direct_3d_cuda", [1, 32, 64, 128, 128], [12, 32, 1, 1, 1], [1, 1, 1], [0, 0, 0], 1], {"i": 242660333, "t": "", "c": null, "e": [["tile_f", "sp", [-1, 1, 4, 1]], ["tile_d", "sp", [-1, 1, 1, 2]], ["tile_y", "sp", [-1, 1, 1, 16]], ["tile_x", "sp", [-1, 2, 1, 1]], ["tile_rc", "sp", [-1, 32]], ["tile_rd", "sp", [-1, 1]], ["tile_ry", "sp", [-1, 1]], ["tile_rx", "sp", [-1, 1]], ["auto_unroll_max_step", "ot", 0], ["unroll_explicit", "ot", 0]]}], "r": [[0.00549736575, 0.0054935885], 0, 1.2484421730041504, 1578506499.4686284], "v": 0.1}
{"i": ["cuda", "schedule_direct_3d_cuda", [[1, 32, 64, 128, 128], [12, 32, 1, 1, 1], [1, 1, 1], [0, 0, 0], 1], {}, ["schedule_direct_3d_cuda", [1, 32, 64, 128, 128], [12, 32, 1, 1, 1], [1, 1, 1], [0, 0, 0], 1], {"i": 532749286, "t": "", "c": null, "e": [["tile_f", "sp", [-1, 1, 2, 1]], ["tile_d", "sp", [-1, 1, 1, 2]], ["tile_y", "sp", [-1, 1, 1, 2]], ["tile_x", "sp", [-1, 2, 1, 1]], ["tile_rc", "sp", [-1, 32]], ["tile_rd", "sp", [-1, 1]], ["tile_ry", "sp", [-1, 1]], ["tile_rx", "sp", [-1, 1]], ["auto_unroll_max_step", "ot", 512], ["unroll_explicit", "ot", 0]]}], "r": [[0.008348092, 0.00834495625], 0, 1.4769155979156494, 1578506500.2468245], "v": 0.1}
{"i": ["cuda", "schedule_direct_3d_cuda", [[1, 32, 64, 128, 128], [12, 32, 1, 1, 1], [1, 1, 1], [0, 0, 0], 1], {}, ["schedule_direct_3d_cuda", [1, 32, 64, 128, 128], [12, 32, 1, 1, 1], [1, 1, 1], [0, 0, 0], 1], {"i": 1064785135, "t": "", "c": null, "e": [["tile_f", "sp", [-1, 1, 6, 1]], ["tile_d", "sp", [-1, 1, 1, 2]], ["tile_y", "sp", [-1, 1, 1, 16]], ["tile_x", "sp", [-1, 1, 1, 1]], ["tile_rc", "sp", [-1, 16]], ["tile_rd", "sp", [-1, 1]], ["tile_ry", "sp", [-1, 1]], ["tile_rx", "sp", [-1, 1]], ["auto_unroll_max_step", "ot", 0], ["unroll_explicit", "ot", 1]]}], "r": [[0.00329078625, 0.0032907035], 0, 1.0981812477111816, 1578506500.942507], "v": 0.1}
{"i": ["cuda", "schedule_direct_3d_cuda", [[1, 32, 64, 128, 128], [12, 32, 1, 1, 1], [1, 1, 1], [0, 0, 0], 1], {}, ["schedule_direct_3d_cuda", [1, 32, 64, 128, 128], [12, 32, 1, 1, 1], [1, 1, 1], [0, 0, 0], 1], {"i": 484459370, "t": "", "c": null, "e": [["tile_f", "sp", [-1, 1, 3, 1]], ["tile_d", "sp", [-1, 1, 1, 2]], ["tile_y", "sp", [-1, 1, 1, 4]], ["tile_x", "sp", [-1, 2, 1, 1]], ["tile_rc", "sp", [-1, 16]], ["tile_rd", "sp", [-1, 1]], ["tile_ry", "sp", [-1, 1]], ["tile_rx", "sp", [-1, 1]], ["auto_unroll_max_step", "ot", 512], ["unroll_explicit", "ot", 0]]}], "r": [[0.03196899925, 0.03192671625], 0, 1.8925838470458984, 1578506502.2854133], "v": 0.1}
{"i": ["cuda", "schedule_direct_3d_cuda", [[1, 32, 64, 128, 128], [12, 32, 1, 1, 1], [1, 1, 1], [0, 0, 0], 1], {}, ["schedule_direct_3d_cuda", [1, 32, 64, 128, 128], [12, 32, 1, 1, 1], [1, 1, 1], [0, 0, 0], 1], {"i": 532346090, "t": "", "c": null, "e": [["tile_f", "sp", [-1, 1, 3, 1]], ["tile_d", "sp", [-1, 1, 1, 2]], ["tile_y", "sp", [-1, 1, 1, 2]], ["tile_x", "sp", [-1, 1, 1, 1]], ["tile_rc", "sp", [-1, 32]], ["tile_rd", "sp", [-1, 1]], ["tile_ry", "sp", [-1, 1]], ["tile_rx", "sp", [-1, 1]], ["auto_unroll_max_step", "ot", 512], ["unroll_explicit", "ot", 0]]}], "r": [[0.0177196185, 0.017718392], 0, 1.4242355823516846, 1578506503.146655], "v": 0.1}
{"i": ["cuda", "schedule_direct_3d_cuda", [[1, 32, 64, 128, 128], [12, 32, 1, 1, 1], [1, 1, 1], [0, 0, 0], 1], {}, ["schedule_direct_3d_cuda", [1, 32, 64, 128, 128], [12, 32, 1, 1, 1], [1, 1, 1], [0, 0, 0], 1], {"i": 484366133, "t": "", "c": null, "e": [["tile_f", "sp", [-1, 1, 4, 1]], ["tile_d", "sp", [-1, 1, 1, 4]], ["tile_y", "sp", [-1, 1, 1, 2]], ["tile_x", "sp", [-1, 2, 1, 1]], ["tile_rc", "sp", [-1, 16]], ["tile_rd", "sp", [-1, 1]], ["tile_ry", "sp", [-1, 1]], ["tile_rx", "sp", [-1, 1]], ["auto_unroll_max_step", "ot", 512], ["unroll_explicit", "ot", 0]]}], "r": [[0.00303180825, 0.00302326875], 0, 1.4058189392089844, 1578506503.8557396], "v": 0.1}
{"i": ["cuda", "schedule_direct_3d_cuda", [[1, 32, 64, 128, 128], [12, 32, 1, 1, 1], [1, 1, 1], [0, 0, 0], 1], {}, ["schedule_direct_3d_cuda", [1, 32, 64, 128, 128], [12, 32, 1, 1, 1], [1, 1, 1], [0, 0, 0], 1], {"i": 1113356173, "t": "", "c": null, "e": [["tile_f", "sp", [-1, 1, 4, 1]], ["tile_d", "sp", [-1, 1, 1, 1]], ["tile_y", "sp", [-1, 1, 1, 2]], ["tile_x", "sp", [-1, 2, 1, 1]], ["tile_rc", "sp", [-1, 32]], ["tile_rd", "sp", [-1, 1]], ["tile_ry", "sp", [-1, 1]], ["tile_rx", "sp", [-1, 1]], ["auto_unroll_max_step", "ot", 0], ["unroll_explicit", "ot", 1]]}], "r": [[0.00499629675, 0.00501636875], 0, 1.0694692134857178, 1578506504.535391], "v": 0.1}
{"i": ["cuda", "schedule_direct_3d_cuda", [[1, 32, 64, 128, 128], [12, 32, 1, 1, 1], [1, 1, 1], [0, 0, 0], 1], {}, ["schedule_direct_3d_cuda", [1, 32, 64, 128, 128], [12, 32, 1, 1, 1], [1, 1, 1], [0, 0, 0], 1], {"i": 1127348327, "t": "", "c": null, "e": [["tile_f", "sp", [-1, 2, 2, 1]], ["tile_d", "sp", [-1, 1, 1, 2]], ["tile_y", "sp", [-1, 1, 1, 1]], ["tile_x", "sp", [-1, 1, 1, 2]], ["tile_rc", "sp", [-1, 32]], ["tile_rd", "sp", [-1, 1]], ["tile_ry", "sp", [-1, 1]], ["tile_rx", "sp", [-1, 1]], ["auto_unroll_max_step", "ot", 0], ["unroll_explicit", "ot", 1]]}], "r": [[0.0071579195, 0.0071535485], 0, 1.0675482749938965, 1578506505.2348053], "v": 0.1}
{"i": ["cuda", "schedule_direct_3d_cuda", [[1, 32, 64, 128, 128], [12, 32, 1, 1, 1], [1, 1, 1], [0, 0, 0], 1], {}, ["schedule_direct_3d_cuda", [1, 32, 64, 128, 128], [12, 32, 1, 1, 1], [1, 1, 1], [0, 0, 0], 1], {"i": 484365281, "t": "", "c": null, "e": [["tile_f", "sp", [-1, 2, 1, 1]], ["tile_d", "sp", [-1, 1, 1, 2]], ["tile_y", "sp", [-1, 1, 1, 2]], ["tile_x", "sp", [-1, 2, 1, 1]], ["tile_rc", "sp", [-1, 16]], ["tile_rd", "sp", [-1, 1]], ["tile_ry", "sp", [-1, 1]], ["tile_rx", "sp", [-1, 1]], ["auto_unroll_max_step", "ot", 512], ["unroll_explicit", "ot", 0]]}], "r": [[0.0148583275, 0.0148591865], 0, 1.4946324825286865, 1578506506.09422], "v": 0.1}
{"i": ["cuda", "schedule_direct_3d_cuda", [[1, 32, 64, 128, 128], [12, 32, 1, 1, 1], [1, 1, 1], [0, 0, 0], 1], {}, ["schedule_direct_3d_cuda", [1, 32, 64, 128, 128], [12, 32, 1, 1, 1], [1, 1, 1], [0, 0, 0], 1], {"i": 242538247, "t": "", "c": null, "e": [["tile_f", "sp", [-1, 2, 2, 1]], ["tile_d", "sp", [-1, 1, 1, 1]], ["tile_y", "sp", [-1, 1, 1, 4]], ["tile_x", "sp", [-1, 2, 1, 1]], ["tile_rc", "sp", [-1, 32]], ["tile_rd", "sp", [-1, 1]], ["tile_ry", "sp", [-1, 1]], ["tile_rx", "sp", [-1, 1]], ["auto_unroll_max_step", "ot", 0], ["unroll_explicit", "ot", 0]]}], "r": [[0.004963658, 0.004966995], 0, 1.0617363452911377, 1578506508.6175632], "v": 0.1}
{"i": ["cuda", "schedule_direct_3d_cuda", [[1, 32, 64, 128, 128], [12, 32, 1, 1, 1], [1, 1, 1], [0, 0, 0], 1], {}, ["schedule_direct_3d_cuda", [1, 32, 64, 128, 128], [12, 32, 1, 1, 1], [1, 1, 1], [0, 0, 0], 1], {"i": 256436327, "t": "", "c": null, "e": [["tile_f", "sp", [-1, 2, 2, 1]], ["tile_d", "sp", [-1, 1, 1, 2]], ["tile_y", "sp", [-1, 1, 1, 1]], ["tile_x", "sp", [-1, 1, 1, 2]], ["tile_rc", "sp", [-1, 32]], ["tile_rd", "sp", [-1, 1]], ["tile_ry", "sp", [-1, 1]], ["tile_rx", "sp", [-1, 1]], ["auto_unroll_max_step", "ot", 0], ["unroll_explicit", "ot", 0]]}], "r": [[0.0071561345, 0.007155939], 0, 1.0167815685272217, 1578506509.2354653], "v": 0.1}
