auto_log/((1, 192, 16, 16, 16), (192, 192, 3, 3, 3), (1, 192, 16, 16, 16), (1, 1, 1), (1, 1, 1), 1, 1, None)_bwd_wei_grad.log
{"i": ["cuda", "schedule_conv3d_nchw_cuda", [[192, 1, 16, 16, 16], [192, 1, 16, 16, 16], 1, [1, 1, 1], [1, 1, 1], 1], {}, ["schedule_conv3d_nchw_cuda", [192, 1, 16, 16, 16], [192, 1, 16, 16, 16], 1, [1, 1, 1], [1, 1, 1], 1], {"i": 8499290951, "t": "", "c": null, "e": [["tile_n", "sp", [-1, 1, 6, 8]], ["tile_f", "sp", [-1, 1, 1, 2]], ["tile_d", "sp", [-1, 1, 1, 1]], ["tile_y", "sp", [-1, 3, 1, 1]], ["tile_x", "sp", [-1, 3, 1, 1]], ["tile_rc", "sp", [-1, 1]], ["tile_rd", "sp", [-1, 2]], ["tile_ry", "sp", [-1, 1]], ["tile_rx", "sp", [-1, 4]], ["auto_unroll_max_step", "ot", 0], ["unroll_explicit", "ot", 1], ["fuse_yx", "ot", 1]]}], "r": [[0.18734431825, 0.18111250475], 0, 2.7466444969177246, 1578546205.121683], "v": 0.1}
{"i": ["cuda", "schedule_conv3d_nchw_cuda", [[192, 1, 16, 16, 16], [192, 1, 16, 16, 16], 1, [1, 1, 1], [1, 1, 1], 1], {}, ["schedule_conv3d_nchw_cuda", [192, 1, 16, 16, 16], [192, 1, 16, 16, 16], 1, [1, 1, 1], [1, 1, 1], 1], {"i": 8294538185, "t": "", "c": null, "e": [["tile_n", "sp", [-1, 1, 2, 4]], ["tile_f", "sp", [-1, 2, 6, 4]], ["tile_d", "sp", [-1, 1, 3, 1]], ["tile_y", "sp", [-1, 1, 1, 3]], ["tile_x", "sp", [-1, 1, 1, 3]], ["tile_rc", "sp", [-1, 1]], ["tile_rd", "sp", [-1, 4]], ["tile_ry", "sp", [-1, 16]], ["tile_rx", "sp", [-1, 1]], ["auto_unroll_max_step", "ot", 0], ["unroll_explicit", "ot", 1], ["fuse_yx", "ot", 1]]}], "r": [[0.1076716705, 0.107649956], 0, 2.0989811420440674, 1578546212.7226512], "v": 0.1}
{"i": ["cuda", "schedule_conv3d_nchw_cuda", [[192, 1, 16, 16, 16], [192, 1, 16, 16, 16], 1, [1, 1, 1], [1, 1, 1], 1], {}, ["schedule_conv3d_nchw_cuda", [192, 1, 16, 16, 16], [192, 1, 16, 16, 16], 1, [1, 1, 1], [1, 1, 1], 1], {"i": 7241511910, "t": "", "c": null, "e": [["tile_n", "sp", [-1, 6, 4, 8]], ["tile_f", "sp", [-1, 4, 24, 1]], ["tile_d", "sp", [-1, 1, 1, 3]], ["tile_y", "sp", [-1, 1, 1, 3]], ["tile_x", "sp", [-1, 1, 1, 1]], ["tile_rc", "sp", [-1, 1]], ["tile_rd", "sp", [-1, 4]], ["tile_ry", "sp", [-1, 1]], ["tile_rx", "sp", [-1, 1]], ["auto_unroll_max_step", "ot", 1500], ["unroll_explicit", "ot", 0], ["fuse_yx", "ot", 1]]}], "r": [[0.18166484125, 0.18181236975], 0, 3.512230634689331, 1578546215.4311316], "v": 0.1}
{"i": ["cuda", "schedule_conv3d_nchw_cuda", [[192, 1, 16, 16, 16], [192, 1, 16, 16, 16], 1, [1, 1, 1], [1, 1, 1], 1], {}, ["schedule_conv3d_nchw_cuda", [192, 1, 16, 16, 16], [192, 1, 16, 16, 16], 1, [1, 1, 1], [1, 1, 1], 1], {"i": 6688655005, "t": "", "c": null, "e": [["tile_n", "sp", [-1, 8, 3, 2]], ["tile_f", "sp", [-1, 12, 8, 1]], ["tile_d", "sp", [-1, 1, 3, 1]], ["tile_y", "sp", [-1, 1, 1, 3]], ["tile_x", "sp", [-1, 1, 3, 1]], ["tile_rc", "sp", [-1, 1]], ["tile_rd", "sp", [-1, 1]], ["tile_ry", "sp", [-1, 1]], ["tile_rx", "sp", [-1, 4]], ["auto_unroll_max_step", "ot", 512], ["unroll_explicit", "ot", 0], ["fuse_yx", "ot", 1]]}], "r": [[0.10290708525, 0.105472898], 0, 3.14341402053833, 1578546220.7433474], "v": 0.1}
{"i": ["cuda", "schedule_conv3d_nchw_cuda", [[192, 1, 16, 16, 16], [192, 1, 16, 16, 16], 1, [1, 1, 1], [1, 1, 1], 1], {}, ["schedule_conv3d_nchw_cuda", [192, 1, 16, 16, 16], [192, 1, 16, 16, 16], 1, [1, 1, 1], [1, 1, 1], 1], {"i": 10206352155, "t": "", "c": null, "e": [["tile_n", "sp", [-1, 2, 3, 1]], ["tile_f", "sp", [-1, 1, 1, 24]], ["tile_d", "sp", [-1, 1, 1, 1]], ["tile_y", "sp", [-1, 3, 1, 1]], ["tile_x", "sp", [-1, 1, 3, 1]], ["tile_rc", "sp", [-1, 1]], ["tile_rd", "sp", [-1, 4]], ["tile_ry", "sp", [-1, 4]], ["tile_rx", "sp", [-1, 2]], ["auto_unroll_max_step", "ot", 1500], ["unroll_explicit", "ot", 1], ["fuse_yx", "ot", 1]]}], "r": [[0.01585978575, 0.01586421625], 0, 4.079583644866943, 1578546227.1892607], "v": 0.1}
{"i": ["cuda", "schedule_conv3d_nchw_cuda", [[192, 1, 16, 16, 16], [192, 1, 16, 16, 16], 1, [1, 1, 1], [1, 1, 1], 1], {}, ["schedule_conv3d_nchw_cuda", [192, 1, 16, 16, 16], [192, 1, 16, 16, 16], 1, [1, 1, 1], [1, 1, 1], 1], {"i": 9692876823, "t": "", "c": null, "e": [["tile_n", "sp", [-1, 1, 4, 6]], ["tile_f", "sp", [-1, 1, 4, 6]], ["tile_d", "sp", [-1, 1, 1, 1]], ["tile_y", "sp", [-1, 1, 1, 1]], ["tile_x", "sp", [-1, 1, 3, 1]], ["tile_rc", "sp", [-1, 1]], ["tile_rd", "sp", [-1, 2]], ["tile_ry", "sp", [-1, 8]], ["tile_rx", "sp", [-1, 8]], ["auto_unroll_max_step", "ot", 512], ["unroll_explicit", "ot", 1], ["fuse_yx", "ot", 1]]}], "r": [[0.0083519855, 0.00832098625], 0, 2.638169527053833, 1578546228.277379], "v": 0.1}
{"i": ["cuda", "schedule_conv3d_nchw_cuda", [[192, 1, 16, 16, 16], [192, 1, 16, 16, 16], 1, [1, 1, 1], [1, 1, 1], 1], {}, ["schedule_conv3d_nchw_cuda", [192, 1, 16, 16, 16], [192, 1, 16, 16, 16], 1, [1, 1, 1], [1, 1, 1], 1], {"i": 7313224975, "t": "", "c": null, "e": [["tile_n", "sp", [-1, 1, 1, 4]], ["tile_f", "sp", [-1, 1, 32, 2]], ["tile_d", "sp", [-1, 1, 3, 1]], ["tile_y", "sp", [-1, 1, 3, 1]], ["tile_x", "sp", [-1, 1, 1, 1]], ["tile_rc", "sp", [-1, 1]], ["tile_rd", "sp", [-1, 4]], ["tile_ry", "sp", [-1, 4]], ["tile_rx", "sp", [-1, 1]], ["auto_unroll_max_step", "ot", 1500], ["unroll_explicit", "ot", 0], ["fuse_yx", "ot", 1]]}], "r": [[0.00432065225, 0.004309292], 0, 1.0440409183502197, 1578546229.0942295], "v": 0.1}
{"i": ["cuda", "schedule_conv3d_nchw_cuda", [[192, 1, 16, 16, 16], [192, 1, 16, 16, 16], 1, [1, 1, 1], [1, 1, 1], 1], {}, ["schedule_conv3d_nchw_cuda", [192, 1, 16, 16, 16], [192, 1, 16, 16, 16], 1, [1, 1, 1], [1, 1, 1], 1], {"i": 6403147757, "t": "", "c": null, "e": [["tile_n", "sp", [-1, 1, 8, 2]], ["tile_f", "sp", [-1, 6, 32, 1]], ["tile_d", "sp", [-1, 3, 1, 1]], ["tile_y", "sp", [-1, 1, 1, 3]], ["tile_x", "sp", [-1, 1, 1, 1]], ["tile_rc", "sp", [-1, 1]], ["tile_rd", "sp", [-1, 2]], ["tile_ry", "sp", [-1, 4]], ["tile_rx", "sp", [-1, 1]], ["auto_unroll_max_step", "ot", 512], ["unroll_explicit", "ot", 0], ["fuse_yx", "ot", 1]]}], "r": [[0.00244504075, 0.00244581025], 0, 1.0825493335723877, 1578546240.4920108], "v": 0.1}
{"i": ["cuda", "schedule_conv3d_nchw_cuda", [[192, 1, 16, 16, 16], [192, 1, 16, 16, 16], 1, [1, 1, 1], [1, 1, 1], 1], {}, ["schedule_conv3d_nchw_cuda", [192, 1, 16, 16, 16], [192, 1, 16, 16, 16], 1, [1, 1, 1], [1, 1, 1], 1], {"i": 8425006937, "t": "", "c": null, "e": [["tile_n", "sp", [-1, 3, 16, 2]], ["tile_f", "sp", [-1, 8, 1, 2]], ["tile_d", "sp", [-1, 1, 3, 1]], ["tile_y", "sp", [-1, 1, 1, 1]], ["tile_x", "sp", [-1, 1, 1, 1]], ["tile_rc", "sp", [-1, 1]], ["tile_rd", "sp", [-1, 2]], ["tile_ry", "sp", [-1, 8]], ["tile_rx", "sp", [-1, 2]], ["auto_unroll_max_step", "ot", 0], ["unroll_explicit", "ot", 1], ["fuse_yx", "ot", 1]]}], "r": [[0.009760089, 0.009756336], 0, 1.364570140838623, 1578546241.375567], "v": 0.1}
{"i": ["cuda", "schedule_conv3d_nchw_cuda", [[192, 1, 16, 16, 16], [192, 1, 16, 16, 16], 1, [1, 1, 1], [1, 1, 1], 1], {}, ["schedule_conv3d_nchw_cuda", [192, 1, 16, 16, 16], [192, 1, 16, 16, 16], 1, [1, 1, 1], [1, 1, 1], 1], {"i": 196049323, "t": "", "c": null, "e": [["tile_n", "sp", [-1, 1, 6, 1]], ["tile_f", "sp", [-1, 48, 1, 4]], ["tile_d", "sp", [-1, 1, 1, 1]], ["tile_y", "sp", [-1, 1, 3, 1]], ["tile_x", "sp", [-1, 1, 1, 1]], ["tile_rc", "sp", [-1, 1]], ["tile_rd", "sp", [-1, 4]], ["tile_ry", "sp", [-1, 1]], ["tile_rx", "sp", [-1, 2]], ["auto_unroll_max_step", "ot", 0], ["unroll_explicit", "ot", 0], ["fuse_yx", "ot", 0]]}], "r": [[0.102764378, 0.103404735], 0, 2.8686511516571045, 1578546243.715431], "v": 0.1}
{"i": ["cuda", "schedule_conv3d_nchw_cuda", [[192, 1, 16, 16, 16], [192, 1, 16, 16, 16], 1, [1, 1, 1], [1, 1, 1], 1], {}, ["schedule_conv3d_nchw_cuda", [192, 1, 16, 16, 16], [192, 1, 16, 16, 16], 1, [1, 1, 1], [1, 1, 1], 1], {"i": 8506986586, "t": "", "c": null, "e": [["tile_n", "sp", [-1, 1, 2, 3]], ["tile_f", "sp", [-1, 2, 24, 2]], ["tile_d", "sp", [-1, 1, 1, 1]], ["tile_y", "sp", [-1, 1, 3, 1]], ["tile_x", "sp", [-1, 3, 1, 1]], ["tile_rc", "sp", [-1, 1]], ["tile_rd", "sp", [-1, 4]], ["tile_ry", "sp", [-1, 1]], ["tile_rx", "sp", [-1, 4]], ["auto_unroll_max_step", "ot", 0], ["unroll_explicit", "ot", 1], ["fuse_yx", "ot", 1]]}], "r": [[0.0023762055, 0.00237349775], 0, 0.9482176303863525, 1578546244.2897685], "v": 0.1}
{"i": ["cuda", "schedule_conv3d_nchw_cuda", [[192, 1, 16, 16, 16], [192, 1, 16, 16, 16], 1, [1, 1, 1], [1, 1, 1], 1], {}, ["schedule_conv3d_nchw_cuda", [192, 1, 16, 16, 16], [192, 1, 16, 16, 16], 1, [1, 1, 1], [1, 1, 1], 1], {"i": 4192922177, "t": "", "c": null, "e": [["tile_n", "sp", [-1, 4, 2, 1]], ["tile_f", "sp", [-1, 1, 4, 6]], ["tile_d", "sp", [-1, 1, 1, 3]], ["tile_y", "sp", [-1, 1, 1, 1]], ["tile_x", "sp", [-1, 3, 1, 1]], ["tile_rc", "sp", [-1, 1]], ["tile_rd", "sp", [-1, 1]], ["tile_ry", "sp", [-1, 2]], ["tile_rx", "sp", [-1, 8]], ["auto_unroll_max_step", "ot", 512], ["unroll_explicit", "ot", 1], ["fuse_yx", "ot", 0]]}], "r": [[0.01446083825, 0.01382160525], 0, 2.622434377670288, 1578546249.9893622], "v": 0.1}
{"i": ["cuda", "schedule_conv3d_nchw_cuda", [[192, 1, 16, 16, 16], [192, 1, 16, 16, 16], 1, [1, 1, 1], [1, 1, 1], 1], {}, ["schedule_conv3d_nchw_cuda", [192, 1, 16, 16, 16], [192, 1, 16, 16, 16], 1, [1, 1, 1], [1, 1, 1], 1], {"i": 1173554457, "t": "", "c": null, "e": [["tile_n", "sp", [-1, 4, 4, 4]], ["tile_f", "sp", [-1, 2, 1, 1]], ["tile_d", "sp", [-1, 1, 1, 3]], ["tile_y", "sp", [-1, 1, 3, 1]], ["tile_x", "sp", [-1, 3, 1, 1]], ["tile_rc", "sp", [-1, 1]], ["tile_rd", "sp", [-1, 4]], ["tile_ry", "sp", [-1, 4]], ["tile_rx", "sp", [-1, 2]], ["auto_unroll_max_step", "ot", 512], ["unroll_explicit", "ot", 0], ["fuse_yx", "ot", 0]]}], "r": [[0.13451819275, 0.13394605475], 0, 2.977433919906616, 1578546271.328115], "v": 0.1}
{"i": ["cuda", "schedule_conv3d_nchw_cuda", [[192, 1, 16, 16, 16], [192, 1, 16, 16, 16], 1, [1, 1, 1], [1, 1, 1], 1], {}, ["schedule_conv3d_nchw_cuda", [192, 1, 16, 16, 16], [192, 1, 16, 16, 16], 1, [1, 1, 1], [1, 1, 1], 1], {"i": 8876604929, "t": "", "c": null, "e": [["tile_n", "sp", [-1, 4, 2, 1]], ["tile_f", "sp", [-1, 1, 12, 2]], ["tile_d", "sp", [-1, 1, 3, 1]], ["tile_y", "sp", [-1, 1, 1, 1]], ["tile_x", "sp", [-1, 1, 3, 1]], ["tile_rc", "sp", [-1, 1]], ["tile_rd", "sp", [-1, 8]], ["tile_ry", "sp", [-1, 1]], ["tile_rx", "sp", [-1, 16]], ["auto_unroll_max_step", "ot", 0], ["unroll_explicit", "ot", 1], ["fuse_yx", "ot", 1]]}], "r": [[0.00514131025, 0.00515612575], 0, 0.9664773941040039, 1578546291.7365363], "v": 0.1}
{"i": ["cuda", "schedule_conv3d_nchw_cuda", [[192, 1, 16, 16, 16], [192, 1, 16, 16, 16], 1, [1, 1, 1], [1, 1, 1], 1], {}, ["schedule_conv3d_nchw_cuda", [192, 1, 16, 16, 16], [192, 1, 16, 16, 16], 1, [1, 1, 1], [1, 1, 1], 1], {"i": 9574754128, "t": "", "c": null, "e": [["tile_n", "sp", [-1, 3, 2, 1]], ["tile_f", "sp", [-1, 2, 12, 2]], ["tile_d", "sp", [-1, 1, 3, 1]], ["tile_y", "sp", [-1, 1, 3, 1]], ["tile_x", "sp", [-1, 1, 1, 1]], ["tile_rc", "sp", [-1, 1]], ["tile_rd", "sp", [-1, 1]], ["tile_ry", "sp", [-1, 1]], ["tile_rx", "sp", [-1, 8]], ["auto_unroll_max_step", "ot", 512], ["unroll_explicit", "ot", 1], ["fuse_yx", "ot", 1]]}], "r": [[0.00408704675, 0.0040747525], 0, 1.1879193782806396, 1578546552.0374417], "v": 0.1}
{"i": ["cuda", "schedule_conv3d_nchw_cuda", [[192, 1, 16, 16, 16], [192, 1, 16, 16, 16], 1, [1, 1, 1], [1, 1, 1], 1], {}, ["schedule_conv3d_nchw_cuda", [192, 1, 16, 16, 16], [192, 1, 16, 16, 16], 1, [1, 1, 1], [1, 1, 1], 1], {"i": 5962082128, "t": "", "c": null, "e": [["tile_n", "sp", [-1, 3, 2, 1]], ["tile_f", "sp", [-1, 2, 12, 2]], ["tile_d", "sp", [-1, 1, 3, 1]], ["tile_y", "sp", [-1, 1, 3, 1]], ["tile_x", "sp", [-1, 1, 1, 1]], ["tile_rc", "sp", [-1, 1]], ["tile_rd", "sp", [-1, 1]], ["tile_ry", "sp", [-1, 1]], ["tile_rx", "sp", [-1, 8]], ["auto_unroll_max_step", "ot", 0], ["unroll_explicit", "ot", 0], ["fuse_yx", "ot", 1]]}], "r": [[0.003751269, 0.003719428], 0, 1.1688268184661865, 1578546552.7452881], "v": 0.1}
{"i": ["cuda", "schedule_conv3d_nchw_cuda", [[192, 1, 16, 16, 16], [192, 1, 16, 16, 16], 1, [1, 1, 1], [1, 1, 1], 1], {}, ["schedule_conv3d_nchw_cuda", [192, 1, 16, 16, 16], [192, 1, 16, 16, 16], 1, [1, 1, 1], [1, 1, 1], 1], {"i": 7045883728, "t": "", "c": null, "e": [["tile_n", "sp", [-1, 3, 2, 1]], ["tile_f", "sp", [-1, 2, 12, 2]], ["tile_d", "sp", [-1, 1, 3, 1]], ["tile_y", "sp", [-1, 1, 3, 1]], ["tile_x", "sp", [-1, 1, 1, 1]], ["tile_rc", "sp", [-1, 1]], ["tile_rd", "sp", [-1, 1]], ["tile_ry", "sp", [-1, 1]], ["tile_rx", "sp", [-1, 16]], ["auto_unroll_max_step", "ot", 512], ["unroll_explicit", "ot", 0], ["fuse_yx", "ot", 1]]}], "r": [[0.00433792925, 0.0043399895], 0, 1.259009838104248, 1578546553.4947739], "v": 0.1}
{"i": ["cuda", "schedule_conv3d_nchw_cuda", [[192, 1, 16, 16, 16], [192, 1, 16, 16, 16], 1, [1, 1, 1], [1, 1, 1], 1], {}, ["schedule_conv3d_nchw_cuda", [192, 1, 16, 16, 16], [192, 1, 16, 16, 16], 1, [1, 1, 1], [1, 1, 1], 1], {"i": 6865250128, "t": "", "c": null, "e": [["tile_n", "sp", [-1, 3, 2, 1]], ["tile_f", "sp", [-1, 2, 12, 2]], ["tile_d", "sp", [-1, 1, 3, 1]], ["tile_y", "sp", [-1, 1, 3, 1]], ["tile_x", "sp", [-1, 1, 1, 1]], ["tile_rc", "sp", [-1, 1]], ["tile_rd", "sp", [-1, 1]], ["tile_ry", "sp", [-1, 1]], ["tile_rx", "sp", [-1, 8]], ["auto_unroll_max_step", "ot", 512], ["unroll_explicit", "ot", 0], ["fuse_yx", "ot", 1]]}], "r": [[0.0037125175, 0.00373396875], 0, 1.2254271507263184, 1578546554.2386322], "v": 0.1}
{"i": ["cuda", "schedule_conv3d_nchw_cuda", [[192, 1, 16, 16, 16], [192, 1, 16, 16, 16], 1, [1, 1, 1], [1, 1, 1], 1], {}, ["schedule_conv3d_nchw_cuda", [192, 1, 16, 16, 16], [192, 1, 16, 16, 16], 1, [1, 1, 1], [1, 1, 1], 1], {"i": 7045883390, "t": "", "c": null, "e": [["tile_n", "sp", [-1, 1, 2, 1]], ["tile_f", "sp", [-1, 1, 12, 2]], ["tile_d", "sp", [-1, 1, 3, 1]], ["tile_y", "sp", [-1, 1, 3, 1]], ["tile_x", "sp", [-1, 1, 1, 1]], ["tile_rc", "sp", [-1, 1]], ["tile_rd", "sp", [-1, 1]], ["tile_ry", "sp", [-1, 1]], ["tile_rx", "sp", [-1, 16]], ["auto_unroll_max_step", "ot", 512], ["unroll_explicit", "ot", 0], ["fuse_yx", "ot", 1]]}], "r": [[0.01000338375, 0.00996605425], 0, 1.0968377590179443, 1578546554.8793588], "v": 0.1}
{"i": ["cuda", "schedule_conv3d_nchw_cuda", [[192, 1, 16, 16, 16], [192, 1, 16, 16, 16], 1, [1, 1, 1], [1, 1, 1], 1], {}, ["schedule_conv3d_nchw_cuda", [192, 1, 16, 16, 16], [192, 1, 16, 16, 16], 1, [1, 1, 1], [1, 1, 1], 1], {"i": 10658555390, "t": "", "c": null, "e": [["tile_n", "sp", [-1, 1, 2, 1]], ["tile_f", "sp", [-1, 1, 12, 2]], ["tile_d", "sp", [-1, 1, 3, 1]], ["tile_y", "sp", [-1, 1, 3, 1]], ["tile_x", "sp", [-1, 1, 1, 1]], ["tile_rc", "sp", [-1, 1]], ["tile_rd", "sp", [-1, 1]], ["tile_ry", "sp", [-1, 1]], ["tile_rx", "sp", [-1, 16]], ["auto_unroll_max_step", "ot", 1500], ["unroll_explicit", "ot", 1], ["fuse_yx", "ot", 1]]}], "r": [[0.009569784, 0.00873287425], 0, 1.7142791748046875, 1578546555.616596], "v": 0.1}
{"i": ["cuda", "schedule_conv3d_nchw_cuda", [[192, 1, 16, 16, 16], [192, 1, 16, 16, 16], 1, [1, 1, 1], [1, 1, 1], 1], {}, ["schedule_conv3d_nchw_cuda", [192, 1, 16, 16, 16], [192, 1, 16, 16, 16], 1, [1, 1, 1], [1, 1, 1], 1], {"i": 9755387390, "t": "", "c": null, "e": [["tile_n", "sp", [-1, 1, 2, 1]], ["tile_f", "sp", [-1, 1, 12, 2]], ["tile_d", "sp", [-1, 1, 3, 1]], ["tile_y", "sp", [-1, 1, 3, 1]], ["tile_x", "sp", [-1, 1, 1, 1]], ["tile_rc", "sp", [-1, 1]], ["tile_rd", "sp", [-1, 1]], ["tile_ry", "sp", [-1, 1]], ["tile_rx", "sp", [-1, 16]], ["auto_unroll_max_step", "ot", 512], ["unroll_explicit", "ot", 1], ["fuse_yx", "ot", 1]]}], "r": [[0.008934611, 0.00871715425], 0, 1.0749502182006836, 1578546556.2361817], "v": 0.1}
{"i": ["cuda", "schedule_conv3d_nchw_cuda", [[192, 1, 16, 16, 16], [192, 1, 16, 16, 16], 1, [1, 1, 1], [1, 1, 1], 1], {}, ["schedule_conv3d_nchw_cuda", [192, 1, 16, 16, 16], [192, 1, 16, 16, 16], 1, [1, 1, 1], [1, 1, 1], 1], {"i": 6142715390, "t": "", "c": null, "e": [["tile_n", "sp", [-1, 1, 2, 1]], ["tile_f", "sp", [-1, 1, 12, 2]], ["tile_d", "sp", [-1, 1, 3, 1]], ["tile_y", "sp", [-1, 1, 3, 1]], ["tile_x", "sp", [-1, 1, 1, 1]], ["tile_rc", "sp", [-1, 1]], ["tile_rd", "sp", [-1, 1]], ["tile_ry", "sp", [-1, 1]], ["tile_rx", "sp", [-1, 16]], ["auto_unroll_max_step", "ot", 0], ["unroll_explicit", "ot", 0], ["fuse_yx", "ot", 1]]}], "r": [[0.007741978, 0.00775215775], 0, 0.9676921367645264, 1578546556.7838063], "v": 0.1}
{"i": ["cuda", "schedule_conv3d_nchw_cuda", [[192, 1, 16, 16, 16], [192, 1, 16, 16, 16], 1, [1, 1, 1], [1, 1, 1], 1], {}, ["schedule_conv3d_nchw_cuda", [192, 1, 16, 16, 16], [192, 1, 16, 16, 16], 1, [1, 1, 1], [1, 1, 1], 1], {"i": 8852219390, "t": "", "c": null, "e": [["tile_n", "sp", [-1, 1, 2, 1]], ["tile_f", "sp", [-1, 1, 12, 2]], ["tile_d", "sp", [-1, 1, 3, 1]], ["tile_y", "sp", [-1, 1, 3, 1]], ["tile_x", "sp", [-1, 1, 1, 1]], ["tile_rc", "sp", [-1, 1]], ["tile_rd", "sp", [-1, 1]], ["tile_ry", "sp", [-1, 1]], ["tile_rx", "sp", [-1, 16]], ["auto_unroll_max_step", "ot", 0], ["unroll_explicit", "ot", 1], ["fuse_yx", "ot", 1]]}], "r": [[0.00778504775, 0.00775595875], 0, 1.0016460418701172, 1578546557.32796], "v": 0.1}
{"i": ["cuda", "schedule_conv3d_nchw_cuda", [[192, 1, 16, 16, 16], [192, 1, 16, 16, 16], 1, [1, 1, 1], [1, 1, 1], 1], {}, ["schedule_conv3d_nchw_cuda", [192, 1, 16, 16, 16], [192, 1, 16, 16, 16], 1, [1, 1, 1], [1, 1, 1], 1], {"i": 10477696363, "t": "", "c": null, "e": [["tile_n", "sp", [-1, 1, 6, 1]], ["tile_f", "sp", [-1, 2, 12, 2]], ["tile_d", "sp", [-1, 1, 1, 1]], ["tile_y", "sp", [-1, 1, 3, 1]], ["tile_x", "sp", [-1, 1, 1, 1]], ["tile_rc", "sp", [-1, 1]], ["tile_rd", "sp", [-1, 1]], ["tile_ry", "sp", [-1, 1]], ["tile_rx", "sp", [-1, 8]], ["auto_unroll_max_step", "ot", 1500], ["unroll_explicit", "ot", 1], ["fuse_yx", "ot", 1]]}], "r": [[0.0076756125, 0.00768123075], 0, 2.2963180541992188, 1578546558.1753876], "v": 0.1}
{"i": ["cuda", "schedule_conv3d_nchw_cuda", [[192, 1, 16, 16, 16], [192, 1, 16, 16, 16], 1, [1, 1, 1], [1, 1, 1], 1], {}, ["schedule_conv3d_nchw_cuda", [192, 1, 16, 16, 16], [192, 1, 16, 16, 16], 1, [1, 1, 1], [1, 1, 1], 1], {"i": 8671360363, "t": "", "c": null, "e": [["tile_n", "sp", [-1, 1, 6, 1]], ["tile_f", "sp", [-1, 2, 12, 2]], ["tile_d", "sp", [-1, 1, 1, 1]], ["tile_y", "sp", [-1, 1, 3, 1]], ["tile_x", "sp", [-1, 1, 1, 1]], ["tile_rc", "sp", [-1, 1]], ["tile_rd", "sp", [-1, 1]], ["tile_ry", "sp", [-1, 1]], ["tile_rx", "sp", [-1, 8]], ["auto_unroll_max_step", "ot", 0], ["unroll_explicit", "ot", 1], ["fuse_yx", "ot", 1]]}], "r": [[0.008298369, 0.0083221425], 0, 1.0663096904754639, 1578546558.844657], "v": 0.1}
{"i": ["cuda", "schedule_conv3d_nchw_cuda", [[192, 1, 16, 16, 16], [192, 1, 16, 16, 16], 1, [1, 1, 1], [1, 1, 1], 1], {}, ["schedule_conv3d_nchw_cuda", [192, 1, 16, 16, 16], [192, 1, 16, 16, 16], 1, [1, 1, 1], [1, 1, 1], 1], {"i": 7768192363, "t": "", "c": null, "e": [["tile_n", "sp", [-1, 1, 6, 1]], ["tile_f", "sp", [-1, 2, 12, 2]], ["tile_d", "sp", [-1, 1, 1, 1]], ["tile_y", "sp", [-1, 1, 3, 1]], ["tile_x", "sp", [-1, 1, 1, 1]], ["tile_rc", "sp", [-1, 1]], ["tile_rd", "sp", [-1, 1]], ["tile_ry", "sp", [-1, 1]], ["tile_rx", "sp", [-1, 8]], ["auto_unroll_max_step", "ot", 1500], ["unroll_explicit", "ot", 0], ["fuse_yx", "ot", 1]]}], "r": [[0.011168694, 0.011173294], 0, 1.724360466003418, 1578546559.8042843], "v": 0.1}
{"i": ["cuda", "schedule_conv3d_nchw_cuda", [[192, 1, 16, 16, 16], [192, 1, 16, 16, 16], 1, [1, 1, 1], [1, 1, 1], 1], {}, ["schedule_conv3d_nchw_cuda", [192, 1, 16, 16, 16], [192, 1, 16, 16, 16], 1, [1, 1, 1], [1, 1, 1], 1], {"i": 8671588467, "t": "", "c": null, "e": [["tile_n", "sp", [-1, 4, 1, 1]], ["tile_f", "sp", [-1, 1, 24, 2]], ["tile_d", "sp", [-1, 1, 3, 1]], ["tile_y", "sp", [-1, 1, 3, 1]], ["tile_x", "sp", [-1, 1, 1, 1]], ["tile_rc", "sp", [-1, 1]], ["tile_rd", "sp", [-1, 1]], ["tile_ry", "sp", [-1, 1]], ["tile_rx", "sp", [-1, 8]], ["auto_unroll_max_step", "ot", 0], ["unroll_explicit", "ot", 1], ["fuse_yx", "ot", 1]]}], "r": [[0.00434944425, 0.00433967275], 0, 1.0007131099700928, 1578546562.6339564], "v": 0.1}
{"i": ["cuda", "schedule_conv3d_nchw_cuda", [[192, 1, 16, 16, 16], [192, 1, 16, 16, 16], 1, [1, 1, 1], [1, 1, 1], 1], {}, ["schedule_conv3d_nchw_cuda", [192, 1, 16, 16, 16], [192, 1, 16, 16, 16], 1, [1, 1, 1], [1, 1, 1], 1], {"i": 7768420467, "t": "", "c": null, "e": [["tile_n", "sp", [-1, 4, 1, 1]], ["tile_f", "sp", [-1, 1, 24, 2]], ["tile_d", "sp", [-1, 1, 3, 1]], ["tile_y", "sp", [-1, 1, 3, 1]], ["tile_x", "sp", [-1, 1, 1, 1]], ["tile_rc", "sp", [-1, 1]], ["tile_rd", "sp", [-1, 1]], ["tile_ry", "sp", [-1, 1]], ["tile_rx", "sp", [-1, 8]], ["auto_unroll_max_step", "ot", 1500], ["unroll_explicit", "ot", 0], ["fuse_yx", "ot", 1]]}], "r": [[0.00432902125, 0.004322965], 0, 1.4722907543182373, 1578546563.4461834], "v": 0.1}
{"i": ["cuda", "schedule_conv3d_nchw_cuda", [[192, 1, 16, 16, 16], [192, 1, 16, 16, 16], 1, [1, 1, 1], [1, 1, 1], 1], {}, ["schedule_conv3d_nchw_cuda", [192, 1, 16, 16, 16], [192, 1, 16, 16, 16], 1, [1, 1, 1], [1, 1, 1], 1], {"i": 5962084467, "t": "", "c": null, "e": [["tile_n", "sp", [-1, 4, 1, 1]], ["tile_f", "sp", [-1, 1, 24, 2]], ["tile_d", "sp", [-1, 1, 3, 1]], ["tile_y", "sp", [-1, 1, 3, 1]], ["tile_x", "sp", [-1, 1, 1, 1]], ["tile_rc", "sp", [-1, 1]], ["tile_rd", "sp", [-1, 1]], ["tile_ry", "sp", [-1, 1]], ["tile_rx", "sp", [-1, 8]], ["auto_unroll_max_step", "ot", 0], ["unroll_explicit", "ot", 0], ["fuse_yx", "ot", 1]]}], "r": [[0.00440270625, 0.0043822225], 0, 0.9809138774871826, 1578546563.9677093], "v": 0.1}
{"i": ["cuda", "schedule_conv3d_nchw_cuda", [[192, 1, 16, 16, 16], [192, 1, 16, 16, 16], 1, [1, 1, 1], [1, 1, 1], 1], {}, ["schedule_conv3d_nchw_cuda", [192, 1, 16, 16, 16], [192, 1, 16, 16, 16], 1, [1, 1, 1], [1, 1, 1], 1], {"i": 10477924467, "t": "", "c": null, "e": [["tile_n", "sp", [-1, 4, 1, 1]], ["tile_f", "sp", [-1, 1, 24, 2]], ["tile_d", "sp", [-1, 1, 3, 1]], ["tile_y", "sp", [-1, 1, 3, 1]], ["tile_x", "sp", [-1, 1, 1, 1]], ["tile_rc", "sp", [-1, 1]], ["tile_rd", "sp", [-1, 1]], ["tile_ry", "sp", [-1, 1]], ["tile_rx", "sp", [-1, 8]], ["auto_unroll_max_step", "ot", 1500], ["unroll_explicit", "ot", 1], ["fuse_yx", "ot", 1]]}], "r": [[0.00461189775, 0.0044614545], 0, 2.378302574157715, 1578546564.7915144], "v": 0.1}
{"i": ["cuda", "schedule_conv3d_nchw_cuda", [[192, 1, 16, 16, 16], [192, 1, 16, 16, 16], 1, [1, 1, 1], [1, 1, 1], 1], {}, ["schedule_conv3d_nchw_cuda", [192, 1, 16, 16, 16], [192, 1, 16, 16, 16], 1, [1, 1, 1], [1, 1, 1], 1], {"i": 9430048363, "t": "", "c": null, "e": [["tile_n", "sp", [-1, 1, 6, 1]], ["tile_f", "sp", [-1, 1, 12, 4]], ["tile_d", "sp", [-1, 1, 1, 1]], ["tile_y", "sp", [-1, 1, 3, 1]], ["tile_x", "sp", [-1, 1, 1, 1]], ["tile_rc", "sp", [-1, 1]], ["tile_rd", "sp", [-1, 1]], ["tile_ry", "sp", [-1, 2]], ["tile_rx", "sp", [-1, 4]], ["auto_unroll_max_step", "ot", 512], ["unroll_explicit", "ot", 1], ["fuse_yx", "ot", 1]]}], "r": [[0.01055162125, 0.0106028835], 0, 1.4667279720306396, 1578546565.5096443], "v": 0.1}
{"i": ["cuda", "schedule_conv3d_nchw_cuda", [[192, 1, 16, 16, 16], [192, 1, 16, 16, 16], 1, [1, 1, 1], [1, 1, 1], 1], {}, ["schedule_conv3d_nchw_cuda", [192, 1, 16, 16, 16], [192, 1, 16, 16, 16], 1, [1, 1, 1], [1, 1, 1], 1], {"i": 8526880363, "t": "", "c": null, "e": [["tile_n", "sp", [-1, 1, 6, 1]], ["tile_f", "sp", [-1, 1, 12, 4]], ["tile_d", "sp", [-1, 1, 1, 1]], ["tile_y", "sp", [-1, 1, 3, 1]], ["tile_x", "sp", [-1, 1, 1, 1]], ["tile_rc", "sp", [-1, 1]], ["tile_rd", "sp", [-1, 1]], ["tile_ry", "sp", [-1, 2]], ["tile_rx", "sp", [-1, 4]], ["auto_unroll_max_step", "ot", 0], ["unroll_explicit", "ot", 1], ["fuse_yx", "ot", 1]]}], "r": [[0.01062712375, 0.0105765905], 0, 1.1538605690002441, 1578546566.1899955], "v": 0.1}
{"i": ["cuda", "schedule_conv3d_nchw_cuda", [[192, 1, 16, 16, 16], [192, 1, 16, 16, 16], 1, [1, 1, 1], [1, 1, 1], 1], {}, ["schedule_conv3d_nchw_cuda", [192, 1, 16, 16, 16], [192, 1, 16, 16, 16], 1, [1, 1, 1], [1, 1, 1], 1], {"i": 10332538987, "t": "", "c": null, "e": [["tile_n", "sp", [-1, 1, 6, 1]], ["tile_f", "sp", [-1, 1, 12, 4]], ["tile_d", "sp", [-1, 1, 3, 1]], ["tile_y", "sp", [-1, 1, 1, 1]], ["tile_x", "sp", [-1, 1, 1, 1]], ["tile_rc", "sp", [-1, 1]], ["tile_rd", "sp", [-1, 1]], ["tile_ry", "sp", [-1, 2]], ["tile_rx", "sp", [-1, 4]], ["auto_unroll_max_step", "ot", 1500], ["unroll_explicit", "ot", 1], ["fuse_yx", "ot", 1]]}], "r": [[0.01055720625, 0.010554568], 0, 2.688278913497925, 1578546567.0912733], "v": 0.1}
{"i": ["cuda", "schedule_conv3d_nchw_cuda", [[192, 1, 16, 16, 16], [192, 1, 16, 16, 16], 1, [1, 1, 1], [1, 1, 1], 1], {}, ["schedule_conv3d_nchw_cuda", [192, 1, 16, 16, 16], [192, 1, 16, 16, 16], 1, [1, 1, 1], [1, 1, 1], 1], {"i": 7623712363, "t": "", "c": null, "e": [["tile_n", "sp", [-1, 1, 6, 1]], ["tile_f", "sp", [-1, 1, 12, 4]], ["tile_d", "sp", [-1, 1, 1, 1]], ["tile_y", "sp", [-1, 1, 3, 1]], ["tile_x", "sp", [-1, 1, 1, 1]], ["tile_rc", "sp", [-1, 1]], ["tile_rd", "sp", [-1, 1]], ["tile_ry", "sp", [-1, 2]], ["tile_rx", "sp", [-1, 4]], ["auto_unroll_max_step", "ot", 1500], ["unroll_explicit", "ot", 0], ["fuse_yx", "ot", 1]]}], "r": [[0.0108313345, 0.01082973325], 0, 2.005922317504883, 1578546567.9857662], "v": 0.1}
{"i": ["cuda", "schedule_conv3d_nchw_cuda", [[192, 1, 16, 16, 16], [192, 1, 16, 16, 16], 1, [1, 1, 1], [1, 1, 1], 1], {}, ["schedule_conv3d_nchw_cuda", [192, 1, 16, 16, 16], [192, 1, 16, 16, 16], 1, [1, 1, 1], [1, 1, 1], 1], {"i": 9429370987, "t": "", "c": null, "e": [["tile_n", "sp", [-1, 1, 6, 1]], ["tile_f", "sp", [-1, 1, 12, 4]], ["tile_d", "sp", [-1, 1, 3, 1]], ["tile_y", "sp", [-1, 1, 1, 1]], ["tile_x", "sp", [-1, 1, 1, 1]], ["tile_rc", "sp", [-1, 1]], ["tile_rd", "sp", [-1, 1]], ["tile_ry", "sp", [-1, 2]], ["tile_rx", "sp", [-1, 4]], ["auto_unroll_max_step", "ot", 512], ["unroll_explicit", "ot", 1], ["fuse_yx", "ot", 1]]}], "r": [[0.0109720505, 0.0109749185], 0, 1.5279197692871094, 1578546568.6933227], "v": 0.1}
{"i": ["cuda", "schedule_conv3d_nchw_cuda", [[192, 1, 16, 16, 16], [192, 1, 16, 16, 16], 1, [1, 1, 1], [1, 1, 1], 1], {}, ["schedule_conv3d_nchw_cuda", [192, 1, 16, 16, 16], [192, 1, 16, 16, 16], 1, [1, 1, 1], [1, 1, 1], 1], {"i": 10333216363, "t": "", "c": null, "e": [["tile_n", "sp", [-1, 1, 6, 1]], ["tile_f", "sp", [-1, 1, 12, 4]], ["tile_d", "sp", [-1, 1, 1, 1]], ["tile_y", "sp", [-1, 1, 3, 1]], ["tile_x", "sp", [-1, 1, 1, 1]], ["tile_rc", "sp", [-1, 1]], ["tile_rd", "sp", [-1, 1]], ["tile_ry", "sp", [-1, 2]], ["tile_rx", "sp", [-1, 4]], ["auto_unroll_max_step", "ot", 1500], ["unroll_explicit", "ot", 1], ["fuse_yx", "ot", 1]]}], "r": [[0.01052864575, 0.01052349475], 0, 2.529782295227051, 1578546569.548842], "v": 0.1}
{"i": ["cuda", "schedule_conv3d_nchw_cuda", [[192, 1, 16, 16, 16], [192, 1, 16, 16, 16], 1, [1, 1, 1], [1, 1, 1], 1], {}, ["schedule_conv3d_nchw_cuda", [192, 1, 16, 16, 16], [192, 1, 16, 16, 16], 1, [1, 1, 1], [1, 1, 1], 1], {"i": 5817376363, "t": "", "c": null, "e": [["tile_n", "sp", [-1, 1, 6, 1]], ["tile_f", "sp", [-1, 1, 12, 4]], ["tile_d", "sp", [-1, 1, 1, 1]], ["tile_y", "sp", [-1, 1, 3, 1]], ["tile_x", "sp", [-1, 1, 1, 1]], ["tile_rc", "sp", [-1, 1]], ["tile_rd", "sp", [-1, 1]], ["tile_ry", "sp", [-1, 2]], ["tile_rx", "sp", [-1, 4]], ["auto_unroll_max_step", "ot", 0], ["unroll_explicit", "ot", 0], ["fuse_yx", "ot", 1]]}], "r": [[0.01066129075, 0.010670809], 0, 1.0458321571350098, 1578546570.1360831], "v": 0.1}
{"i": ["cuda", "schedule_conv3d_nchw_cuda", [[192, 1, 16, 16, 16], [192, 1, 16, 16, 16], 1, [1, 1, 1], [1, 1, 1], 1], {}, ["schedule_conv3d_nchw_cuda", [192, 1, 16, 16, 16], [192, 1, 16, 16, 16], 1, [1, 1, 1], [1, 1, 1], 1], {"i": 6720544363, "t": "", "c": null, "e": [["tile_n", "sp", [-1, 1, 6, 1]], ["tile_f", "sp", [-1, 1, 12, 4]], ["tile_d", "sp", [-1, 1, 1, 1]], ["tile_y", "sp", [-1, 1, 3, 1]], ["tile_x", "sp", [-1, 1, 1, 1]], ["tile_rc", "sp", [-1, 1]], ["tile_rd", "sp", [-1, 1]], ["tile_ry", "sp", [-1, 2]], ["tile_rx", "sp", [-1, 4]], ["auto_unroll_max_step", "ot", 512], ["unroll_explicit", "ot", 0], ["fuse_yx", "ot", 1]]}], "r": [[0.01146546925, 0.01146324875], 0, 1.2351875305175781, 1578546570.8945804], "v": 0.1}
{"i": ["cuda", "schedule_conv3d_nchw_cuda", [[192, 1, 16, 16, 16], [192, 1, 16, 16, 16], 1, [1, 1, 1], [1, 1, 1], 1], {}, ["schedule_conv3d_nchw_cuda", [192, 1, 16, 16, 16], [192, 1, 16, 16, 16], 1, [1, 1, 1], [1, 1, 1], 1], {"i": 7623034987, "t": "", "c": null, "e": [["tile_n", "sp", [-1, 1, 6, 1]], ["tile_f", "sp", [-1, 1, 12, 4]], ["tile_d", "sp", [-1, 1, 3, 1]], ["tile_y", "sp", [-1, 1, 1, 1]], ["tile_x", "sp", [-1, 1, 1, 1]], ["tile_rc", "sp", [-1, 1]], ["tile_rd", "sp", [-1, 1]], ["tile_ry", "sp", [-1, 2]], ["tile_rx", "sp", [-1, 4]], ["auto_unroll_max_step", "ot", 1500], ["unroll_explicit", "ot", 0], ["fuse_yx", "ot", 1]]}], "r": [[0.01814977225, 0.01662311675], 0, 2.000884532928467, 1578546573.9231243], "v": 0.1}
{"i": ["cuda", "schedule_conv3d_nchw_cuda", [[192, 1, 16, 16, 16], [192, 1, 16, 16, 16], 1, [1, 1, 1], [1, 1, 1], 1], {}, ["schedule_conv3d_nchw_cuda", [192, 1, 16, 16, 16], [192, 1, 16, 16, 16], 1, [1, 1, 1], [1, 1, 1], 1], {"i": 6719866987, "t": "", "c": null, "e": [["tile_n", "sp", [-1, 1, 6, 1]], ["tile_f", "sp", [-1, 1, 12, 4]], ["tile_d", "sp", [-1, 1, 3, 1]], ["tile_y", "sp", [-1, 1, 1, 1]], ["tile_x", "sp", [-1, 1, 1, 1]], ["tile_rc", "sp", [-1, 1]], ["tile_rd", "sp", [-1, 1]], ["tile_ry", "sp", [-1, 2]], ["tile_rx", "sp", [-1, 4]], ["auto_unroll_max_step", "ot", 512], ["unroll_explicit", "ot", 0], ["fuse_yx", "ot", 1]]}], "r": [[0.012217451, 0.0126410135], 0, 1.2971794605255127, 1578546574.6797507], "v": 0.1}
{"i": ["cuda", "schedule_conv3d_nchw_cuda", [[192, 1, 16, 16, 16], [192, 1, 16, 16, 16], 1, [1, 1, 1], [1, 1, 1], 1], {}, ["schedule_conv3d_nchw_cuda", [192, 1, 16, 16, 16], [192, 1, 16, 16, 16], 1, [1, 1, 1], [1, 1, 1], 1], {"i": 5816698987, "t": "", "c": null, "e": [["tile_n", "sp", [-1, 1, 6, 1]], ["tile_f", "sp", [-1, 1, 12, 4]], ["tile_d", "sp", [-1, 1, 3, 1]], ["tile_y", "sp", [-1, 1, 1, 1]], ["tile_x", "sp", [-1, 1, 1, 1]], ["tile_rc", "sp", [-1, 1]], ["tile_rd", "sp", [-1, 1]], ["tile_ry", "sp", [-1, 2]], ["tile_rx", "sp", [-1, 4]], ["auto_unroll_max_step", "ot", 0], ["unroll_explicit", "ot", 0], ["fuse_yx", "ot", 1]]}], "r": [[0.0112405705, 0.01124703175], 0, 1.1265742778778076, 1578546575.3679311], "v": 0.1}
{"i": ["cuda", "schedule_conv3d_nchw_cuda", [[192, 1, 16, 16, 16], [192, 1, 16, 16, 16], 1, [1, 1, 1], [1, 1, 1], 1], {}, ["schedule_conv3d_nchw_cuda", [192, 1, 16, 16, 16], [192, 1, 16, 16, 16], 1, [1, 1, 1], [1, 1, 1], 1], {"i": 8526202987, "t": "", "c": null, "e": [["tile_n", "sp", [-1, 1, 6, 1]], ["tile_f", "sp", [-1, 1, 12, 4]], ["tile_d", "sp", [-1, 1, 3, 1]], ["tile_y", "sp", [-1, 1, 1, 1]], ["tile_x", "sp", [-1, 1, 1, 1]], ["tile_rc", "sp", [-1, 1]], ["tile_rd", "sp", [-1, 1]], ["tile_ry", "sp", [-1, 2]], ["tile_rx", "sp", [-1, 4]], ["auto_unroll_max_step", "ot", 0], ["unroll_explicit", "ot", 1], ["fuse_yx", "ot", 1]]}], "r": [[0.0107592745, 0.0107633], 0, 1.0156748294830322, 1578546575.9363184], "v": 0.1}
{"i": ["cuda", "schedule_conv3d_nchw_cuda", [[192, 1, 16, 16, 16], [192, 1, 16, 16, 16], 1, [1, 1, 1], [1, 1, 1], 1], {}, ["schedule_conv3d_nchw_cuda", [192, 1, 16, 16, 16], [192, 1, 16, 16, 16], 1, [1, 1, 1], [1, 1, 1], 1], {"i": 7044982923, "t": "", "c": null, "e": [["tile_n", "sp", [-1, 2, 3, 1]], ["tile_f", "sp", [-1, 1, 24, 2]], ["tile_d", "sp", [-1, 1, 3, 1]], ["tile_y", "sp", [-1, 1, 1, 1]], ["tile_x", "sp", [-1, 1, 1, 1]], ["tile_rc", "sp", [-1, 1]], ["tile_rd", "sp", [-1, 1]], ["tile_ry", "sp", [-1, 1]], ["tile_rx", "sp", [-1, 16]], ["auto_unroll_max_step", "ot", 512], ["unroll_explicit", "ot", 0], ["fuse_yx", "ot", 1]]}], "r": [[0.0094094395, 0.009414809], 0, 1.1820995807647705, 1578546576.6344929], "v": 0.1}
{"i": ["cuda", "schedule_conv3d_nchw_cuda", [[192, 1, 16, 16, 16], [192, 1, 16, 16, 16], 1, [1, 1, 1], [1, 1, 1], 1], {}, ["schedule_conv3d_nchw_cuda", [192, 1, 16, 16, 16], [192, 1, 16, 16, 16], 1, [1, 1, 1], [1, 1, 1], 1], {"i": 10657654923, "t": "", "c": null, "e": [["tile_n", "sp", [-1, 2, 3, 1]], ["tile_f", "sp", [-1, 1, 24, 2]], ["tile_d", "sp", [-1, 1, 3, 1]], ["tile_y", "sp", [-1, 1, 1, 1]], ["tile_x", "sp", [-1, 1, 1, 1]], ["tile_rc", "sp", [-1, 1]], ["tile_rd", "sp", [-1, 1]], ["tile_ry", "sp", [-1, 1]], ["tile_rx", "sp", [-1, 16]], ["auto_unroll_max_step", "ot", 1500], ["unroll_explicit", "ot", 1], ["fuse_yx", "ot", 1]]}], "r": [[0.00875617425, 0.00877718125], 0, 2.444586992263794, 1578546577.4494963], "v": 0.1}
{"i": ["cuda", "schedule_conv3d_nchw_cuda", [[192, 1, 16, 16, 16], [192, 1, 16, 16, 16], 1, [1, 1, 1], [1, 1, 1], 1], {}, ["schedule_conv3d_nchw_cuda", [192, 1, 16, 16, 16], [192, 1, 16, 16, 16], 1, [1, 1, 1], [1, 1, 1], 1], {"i": 7948150923, "t": "", "c": null, "e": [["tile_n", "sp", [-1, 2, 3, 1]], ["tile_f", "sp", [-1, 1, 24, 2]], ["tile_d", "sp", [-1, 1, 3, 1]], ["tile_y", "sp", [-1, 1, 1, 1]], ["tile_x", "sp", [-1, 1, 1, 1]], ["tile_rc", "sp", [-1, 1]], ["tile_rd", "sp", [-1, 1]], ["tile_ry", "sp", [-1, 1]], ["tile_rx", "sp", [-1, 16]], ["auto_unroll_max_step", "ot", 1500], ["unroll_explicit", "ot", 0], ["fuse_yx", "ot", 1]]}], "r": [[0.0091782945, 0.0091728495], 0, 1.7339365482330322, 1578546578.3409503], "v": 0.1}
{"i": ["cuda", "schedule_conv3d_nchw_cuda", [[192, 1, 16, 16, 16], [192, 1, 16, 16, 16], 1, [1, 1, 1], [1, 1, 1], 1], {}, ["schedule_conv3d_nchw_cuda", [192, 1, 16, 16, 16], [192, 1, 16, 16, 16], 1, [1, 1, 1], [1, 1, 1], 1], {"i": 9754486923, "t": "", "c": null, "e": [["tile_n", "sp", [-1, 2, 3, 1]], ["tile_f", "sp", [-1, 1, 24, 2]], ["tile_d", "sp", [-1, 1, 3, 1]], ["tile_y", "sp", [-1, 1, 1, 1]], ["tile_x", "sp", [-1, 1, 1, 1]], ["tile_rc", "sp", [-1, 1]], ["tile_rd", "sp", [-1, 1]], ["tile_ry", "sp", [-1, 1]], ["tile_rx", "sp", [-1, 16]], ["auto_unroll_max_step", "ot", 512], ["unroll_explicit", "ot", 1], ["fuse_yx", "ot", 1]]}], "r": [[0.0089307465, 0.00892306325], 0, 1.1605198383331299, 1578546579.0123339], "v": 0.1}
{"i": ["cuda", "schedule_conv3d_nchw_cuda", [[192, 1, 16, 16, 16], [192, 1, 16, 16, 16], 1, [1, 1, 1], [1, 1, 1], 1], {}, ["schedule_conv3d_nchw_cuda", [192, 1, 16, 16, 16], [192, 1, 16, 16, 16], 1, [1, 1, 1], [1, 1, 1], 1], {"i": 7767517323, "t": "", "c": null, "e": [["tile_n", "sp", [-1, 2, 3, 1]], ["tile_f", "sp", [-1, 1, 24, 2]], ["tile_d", "sp", [-1, 1, 3, 1]], ["tile_y", "sp", [-1, 1, 1, 1]], ["tile_x", "sp", [-1, 1, 1, 1]], ["tile_rc", "sp", [-1, 1]], ["tile_rd", "sp", [-1, 1]], ["tile_ry", "sp", [-1, 1]], ["tile_rx", "sp", [-1, 8]], ["auto_unroll_max_step", "ot", 1500], ["unroll_explicit", "ot", 0], ["fuse_yx", "ot", 1]]}], "r": [[0.00925336875, 0.0092842455], 0, 1.6553761959075928, 1578546579.8640165], "v": 0.1}
{"i": ["cuda", "schedule_conv3d_nchw_cuda", [[192, 1, 16, 16, 16], [192, 1, 16, 16, 16], 1, [1, 1, 1], [1, 1, 1], 1], {}, ["schedule_conv3d_nchw_cuda", [192, 1, 16, 16, 16], [192, 1, 16, 16, 16], 1, [1, 1, 1], [1, 1, 1], 1], {"i": 6864349323, "t": "", "c": null, "e": [["tile_n", "sp", [-1, 2, 3, 1]], ["tile_f", "sp", [-1, 1, 24, 2]], ["tile_d", "sp", [-1, 1, 3, 1]], ["tile_y", "sp", [-1, 1, 1, 1]], ["tile_x", "sp", [-1, 1, 1, 1]], ["tile_rc", "sp", [-1, 1]], ["tile_rd", "sp", [-1, 1]], ["tile_ry", "sp", [-1, 1]], ["tile_rx", "sp", [-1, 8]], ["auto_unroll_max_step", "ot", 512], ["unroll_explicit", "ot", 0], ["fuse_yx", "ot", 1]]}], "r": [[0.009042997, 0.0086824465], 0, 1.124072551727295, 1578546580.52236], "v": 0.1}
{"i": ["cuda", "schedule_conv3d_nchw_cuda", [[192, 1, 16, 16, 16], [192, 1, 16, 16, 16], 1, [1, 1, 1], [1, 1, 1], 1], {}, ["schedule_conv3d_nchw_cuda", [192, 1, 16, 16, 16], [192, 1, 16, 16, 16], 1, [1, 1, 1], [1, 1, 1], 1], {"i": 6141814923, "t": "", "c": null, "e": [["tile_n", "sp", [-1, 2, 3, 1]], ["tile_f", "sp", [-1, 1, 24, 2]], ["tile_d", "sp", [-1, 1, 3, 1]], ["tile_y", "sp", [-1, 1, 1, 1]], ["tile_x", "sp", [-1, 1, 1, 1]], ["tile_rc", "sp", [-1, 1]], ["tile_rd", "sp", [-1, 1]], ["tile_ry", "sp", [-1, 1]], ["tile_rx", "sp", [-1, 16]], ["auto_unroll_max_step", "ot", 0], ["unroll_explicit", "ot", 0], ["fuse_yx", "ot", 1]]}], "r": [[0.00914263475, 0.009147455], 0, 1.0763154029846191, 1578546581.214395], "v": 0.1}
{"i": ["cuda", "schedule_conv3d_nchw_cuda", [[192, 1, 16, 16, 16], [192, 1, 16, 16, 16], 1, [1, 1, 1], [1, 1, 1], 1], {}, ["schedule_conv3d_nchw_cuda", [192, 1, 16, 16, 16], [192, 1, 16, 16, 16], 1, [1, 1, 1], [1, 1, 1], 1], {"i": 8851318923, "t": "", "c": null, "e": [["tile_n", "sp", [-1, 2, 3, 1]], ["tile_f", "sp", [-1, 1, 24, 2]], ["tile_d", "sp", [-1, 1, 3, 1]], ["tile_y", "sp", [-1, 1, 1, 1]], ["tile_x", "sp", [-1, 1, 1, 1]], ["tile_rc", "sp", [-1, 1]], ["tile_rd", "sp", [-1, 1]], ["tile_ry", "sp", [-1, 1]], ["tile_rx", "sp", [-1, 16]], ["auto_unroll_max_step", "ot", 0], ["unroll_explicit", "ot", 1], ["fuse_yx", "ot", 1]]}], "r": [[0.0091379285, 0.009140339], 0, 1.0617671012878418, 1578546581.7853642], "v": 0.1}
{"i": ["cuda", "schedule_conv3d_nchw_cuda", [[192, 1, 16, 16, 16], [192, 1, 16, 16, 16], 1, [1, 1, 1], [1, 1, 1], 1], {}, ["schedule_conv3d_nchw_cuda", [192, 1, 16, 16, 16], [192, 1, 16, 16, 16], 1, [1, 1, 1], [1, 1, 1], 1], {"i": 5961181323, "t": "", "c": null, "e": [["tile_n", "sp", [-1, 2, 3, 1]], ["tile_f", "sp", [-1, 1, 24, 2]], ["tile_d", "sp", [-1, 1, 3, 1]], ["tile_y", "sp", [-1, 1, 1, 1]], ["tile_x", "sp", [-1, 1, 1, 1]], ["tile_rc", "sp", [-1, 1]], ["tile_rd", "sp", [-1, 1]], ["tile_ry", "sp", [-1, 1]], ["tile_rx", "sp", [-1, 8]], ["auto_unroll_max_step", "ot", 0], ["unroll_explicit", "ot", 0], ["fuse_yx", "ot", 1]]}], "r": [[0.0086179425, 0.00864233225], 0, 0.9203369617462158, 1578546584.2147634], "v": 0.1}
{"i": ["cuda", "schedule_conv3d_nchw_cuda", [[192, 1, 16, 16, 16], [192, 1, 16, 16, 16], 1, [1, 1, 1], [1, 1, 1], 1], {}, ["schedule_conv3d_nchw_cuda", [192, 1, 16, 16, 16], [192, 1, 16, 16, 16], 1, [1, 1, 1], [1, 1, 1], 1], {"i": 9573853323, "t": "", "c": null, "e": [["tile_n", "sp", [-1, 2, 3, 1]], ["tile_f", "sp", [-1, 1, 24, 2]], ["tile_d", "sp", [-1, 1, 3, 1]], ["tile_y", "sp", [-1, 1, 1, 1]], ["tile_x", "sp", [-1, 1, 1, 1]], ["tile_rc", "sp", [-1, 1]], ["tile_rd", "sp", [-1, 1]], ["tile_ry", "sp", [-1, 1]], ["tile_rx", "sp", [-1, 8]], ["auto_unroll_max_step", "ot", 512], ["unroll_explicit", "ot", 1], ["fuse_yx", "ot", 1]]}], "r": [[0.008773398, 0.00874256225], 0, 0.9885032176971436, 1578546584.811604], "v": 0.1}
{"i": ["cuda", "schedule_conv3d_nchw_cuda", [[192, 1, 16, 16, 16], [192, 1, 16, 16, 16], 1, [1, 1, 1], [1, 1, 1], 1], {}, ["schedule_conv3d_nchw_cuda", [192, 1, 16, 16, 16], [192, 1, 16, 16, 16], 1, [1, 1, 1], [1, 1, 1], 1], {"i": 7771807346, "t": "", "c": null, "e": [["tile_n", "sp", [-1, 3, 1, 1]], ["tile_f", "sp", [-1, 1, 24, 2]], ["tile_d", "sp", [-1, 1, 1, 1]], ["tile_y", "sp", [-1, 1, 3, 1]], ["tile_x", "sp", [-1, 1, 3, 1]], ["tile_rc", "sp", [-1, 1]], ["tile_rd", "sp", [-1, 1]], ["tile_ry", "sp", [-1, 1]], ["tile_rx", "sp", [-1, 8]], ["auto_unroll_max_step", "ot", 1500], ["unroll_explicit", "ot", 0], ["fuse_yx", "ot", 1]]}], "r": [[0.00476914825, 0.00472753325], 0, 1.3447482585906982, 1578546585.5786493], "v": 0.1}
{"i": ["cuda", "schedule_conv3d_nchw_cuda", [[192, 1, 16, 16, 16], [192, 1, 16, 16, 16], 1, [1, 1, 1], [1, 1, 1], 1], {}, ["schedule_conv3d_nchw_cuda", [192, 1, 16, 16, 16], [192, 1, 16, 16, 16], 1, [1, 1, 1], [1, 1, 1], 1], {"i": 6868639346, "t": "", "c": null, "e": [["tile_n", "sp", [-1, 3, 1, 1]], ["tile_f", "sp", [-1, 1, 24, 2]], ["tile_d", "sp", [-1, 1, 1, 1]], ["tile_y", "sp", [-1, 1, 3, 1]], ["tile_x", "sp", [-1, 1, 3, 1]], ["tile_rc", "sp", [-1, 1]], ["tile_rd", "sp", [-1, 1]], ["tile_ry", "sp", [-1, 1]], ["tile_rx", "sp", [-1, 8]], ["auto_unroll_max_step", "ot", 512], ["unroll_explicit", "ot", 0], ["fuse_yx", "ot", 1]]}], "r": [[0.0047425215, 0.004743479], 0, 1.55741286277771, 1578546586.7096474], "v": 0.1}
{"i": ["cuda", "schedule_conv3d_nchw_cuda", [[192, 1, 16, 16, 16], [192, 1, 16, 16, 16], 1, [1, 1, 1], [1, 1, 1], 1], {}, ["schedule_conv3d_nchw_cuda", [192, 1, 16, 16, 16], [192, 1, 16, 16, 16], 1, [1, 1, 1], [1, 1, 1], 1], {"i": 5965471346, "t": "", "c": null, "e": [["tile_n", "sp", [-1, 3, 1, 1]], ["tile_f", "sp", [-1, 1, 24, 2]], ["tile_d", "sp", [-1, 1, 1, 1]], ["tile_y", "sp", [-1, 1, 3, 1]], ["tile_x", "sp", [-1, 1, 3, 1]], ["tile_rc", "sp", [-1, 1]], ["tile_rd", "sp", [-1, 1]], ["tile_ry", "sp", [-1, 1]], ["tile_rx", "sp", [-1, 8]], ["auto_unroll_max_step", "ot", 0], ["unroll_explicit", "ot", 0], ["fuse_yx", "ot", 1]]}], "r": [[0.004717284, 0.0047200485], 0, 0.9785671234130859, 1578546587.228809], "v": 0.1}
{"i": ["cuda", "schedule_conv3d_nchw_cuda", [[192, 1, 16, 16, 16], [192, 1, 16, 16, 16], 1, [1, 1, 1], [1, 1, 1], 1], {}, ["schedule_conv3d_nchw_cuda", [192, 1, 16, 16, 16], [192, 1, 16, 16, 16], 1, [1, 1, 1], [1, 1, 1], 1], {"i": 8674975346, "t": "", "c": null, "e": [["tile_n", "sp", [-1, 3, 1, 1]], ["tile_f", "sp", [-1, 1, 24, 2]], ["tile_d", "sp", [-1, 1, 1, 1]], ["tile_y", "sp", [-1, 1, 3, 1]], ["tile_x", "sp", [-1, 1, 3, 1]], ["tile_rc", "sp", [-1, 1]], ["tile_rd", "sp", [-1, 1]], ["tile_ry", "sp", [-1, 1]], ["tile_rx", "sp", [-1, 8]], ["auto_unroll_max_step", "ot", 0], ["unroll_explicit", "ot", 1], ["fuse_yx", "ot", 1]]}], "r": [[0.0047338985, 0.00471890675], 0, 0.9436240196228027, 1578546587.7442076], "v": 0.1}
{"i": ["cuda", "schedule_conv3d_nchw_cuda", [[192, 1, 16, 16, 16], [192, 1, 16, 16, 16], 1, [1, 1, 1], [1, 1, 1], 1], {}, ["schedule_conv3d_nchw_cuda", [192, 1, 16, 16, 16], [192, 1, 16, 16, 16], 1, [1, 1, 1], [1, 1, 1], 1], {"i": 10658329963, "t": "", "c": null, "e": [["tile_n", "sp", [-1, 1, 6, 1]], ["tile_f", "sp", [-1, 2, 12, 2]], ["tile_d", "sp", [-1, 1, 1, 1]], ["tile_y", "sp", [-1, 1, 3, 1]], ["tile_x", "sp", [-1, 1, 1, 1]], ["tile_rc", "sp", [-1, 1]], ["tile_rd", "sp", [-1, 1]], ["tile_ry", "sp", [-1, 1]], ["tile_rx", "sp", [-1, 16]], ["auto_unroll_max_step", "ot", 1500], ["unroll_explicit", "ot", 1], ["fuse_yx", "ot", 1]]}], "r": [[0.01037906625, 0.01034243375], 0, 2.2514381408691406, 1578546588.609797], "v": 0.1}
{"i": ["cuda", "schedule_conv3d_nchw_cuda", [[192, 1, 16, 16, 16], [192, 1, 16, 16, 16], 1, [1, 1, 1], [1, 1, 1], 1], {}, ["schedule_conv3d_nchw_cuda", [192, 1, 16, 16, 16], [192, 1, 16, 16, 16], 1, [1, 1, 1], [1, 1, 1], 1], {"i": 5964789962, "t": "", "c": null, "e": [["tile_n", "sp", [-1, 1, 3, 1]], ["tile_f", "sp", [-1, 3, 8, 2]], ["tile_d", "sp", [-1, 1, 3, 1]], ["tile_y", "sp", [-1, 1, 1, 1]], ["tile_x", "sp", [-1, 1, 3, 1]], ["tile_rc", "sp", [-1, 1]], ["tile_rd", "sp", [-1, 1]], ["tile_ry", "sp", [-1, 1]], ["tile_rx", "sp", [-1, 8]], ["auto_unroll_max_step", "ot", 0], ["unroll_explicit", "ot", 0], ["fuse_yx", "ot", 1]]}], "r": [[0.0046887785, 0.00468038275], 0, 1.0100810527801514, 1578546589.169221], "v": 0.1}
{"i": ["cuda", "schedule_conv3d_nchw_cuda", [[192, 1, 16, 16, 16], [192, 1, 16, 16, 16], 1, [1, 1, 1], [1, 1, 1], 1], {}, ["schedule_conv3d_nchw_cuda", [192, 1, 16, 16, 16], [192, 1, 16, 16, 16], 1, [1, 1, 1], [1, 1, 1], 1], {"i": 7775643472, "t": "", "c": null, "e": [["tile_n", "sp", [-1, 3, 2, 1]], ["tile_f", "sp", [-1, 2, 12, 2]], ["tile_d", "sp", [-1, 1, 3, 1]], ["tile_y", "sp", [-1, 1, 3, 1]], ["tile_x", "sp", [-1, 1, 1, 1]], ["tile_rc", "sp", [-1, 1]], ["tile_rd", "sp", [-1, 2]], ["tile_ry", "sp", [-1, 1]], ["tile_rx", "sp", [-1, 8]], ["auto_unroll_max_step", "ot", 1500], ["unroll_explicit", "ot", 0], ["fuse_yx", "ot", 1]]}], "r": [[0.00353476275, 0.00352135675], 0, 1.2631542682647705, 1578546589.9456048], "v": 0.1}
{"i": ["cuda", "schedule_conv3d_nchw_cuda", [[192, 1, 16, 16, 16], [192, 1, 16, 16, 16], 1, [1, 1, 1], [1, 1, 1], 1], {}, ["schedule_conv3d_nchw_cuda", [192, 1, 16, 16, 16], [192, 1, 16, 16, 16], 1, [1, 1, 1], [1, 1, 1], 1], {"i": 6872475472, "t": "", "c": null, "e": [["tile_n", "sp", [-1, 3, 2, 1]], ["tile_f", "sp", [-1, 2, 12, 2]], ["tile_d", "sp", [-1, 1, 3, 1]], ["tile_y", "sp", [-1, 1, 3, 1]], ["tile_x", "sp", [-1, 1, 1, 1]], ["tile_rc", "sp", [-1, 1]], ["tile_rd", "sp", [-1, 2]], ["tile_ry", "sp", [-1, 1]], ["tile_rx", "sp", [-1, 8]], ["auto_unroll_max_step", "ot", 512], ["unroll_explicit", "ot", 0], ["fuse_yx", "ot", 1]]}], "r": [[0.00351581125, 0.003532595], 0, 1.0100476741790771, 1578546590.475535], "v": 0.1}
{"i": ["cuda", "schedule_conv3d_nchw_cuda", [[192, 1, 16, 16, 16], [192, 1, 16, 16, 16], 1, [1, 1, 1], [1, 1, 1], 1], {}, ["schedule_conv3d_nchw_cuda", [192, 1, 16, 16, 16], [192, 1, 16, 16, 16], 1, [1, 1, 1], [1, 1, 1], 1], {"i": 10485147472, "t": "", "c": null, "e": [["tile_n", "sp", [-1, 3, 2, 1]], ["tile_f", "sp", [-1, 2, 12, 2]], ["tile_d", "sp", [-1, 1, 3, 1]], ["tile_y", "sp", [-1, 1, 3, 1]], ["tile_x", "sp", [-1, 1, 1, 1]], ["tile_rc", "sp", [-1, 1]], ["tile_rd", "sp", [-1, 2]], ["tile_ry", "sp", [-1, 1]], ["tile_rx", "sp", [-1, 8]], ["auto_unroll_max_step", "ot", 1500], ["unroll_explicit", "ot", 1], ["fuse_yx", "ot", 1]]}], "r": [[0.0030893745, 0.00309441625], 0, 1.2907376289367676, 1578546591.2214148], "v": 0.1}
{"i": ["cuda", "schedule_conv3d_nchw_cuda", [[192, 1, 16, 16, 16], [192, 1, 16, 16, 16], 1, [1, 1, 1], [1, 1, 1], 1], {}, ["schedule_conv3d_nchw_cuda", [192, 1, 16, 16, 16], [192, 1, 16, 16, 16], 1, [1, 1, 1], [1, 1, 1], 1], {"i": 7768443675, "t": "", "c": null, "e": [["tile_n", "sp", [-1, 2, 3, 1]], ["tile_f", "sp", [-1, 1, 8, 4]], ["tile_d", "sp", [-1, 1, 3, 1]], ["tile_y", "sp", [-1, 1, 3, 1]], ["tile_x", "sp", [-1, 1, 1, 1]], ["tile_rc", "sp", [-1, 1]], ["tile_rd", "sp", [-1, 1]], ["tile_ry", "sp", [-1, 1]], ["tile_rx", "sp", [-1, 8]], ["auto_unroll_max_step", "ot", 1500], ["unroll_explicit", "ot", 0], ["fuse_yx", "ot", 1]]}], "r": [[0.0044888665, 0.0044186785], 0, 1.371579647064209, 1578546592.0361977], "v": 0.1}
{"i": ["cuda", "schedule_conv3d_nchw_cuda", [[192, 1, 16, 16, 16], [192, 1, 16, 16, 16], 1, [1, 1, 1], [1, 1, 1], 1], {}, ["schedule_conv3d_nchw_cuda", [192, 1, 16, 16, 16], [192, 1, 16, 16, 16], 1, [1, 1, 1], [1, 1, 1], 1], {"i": 10477947675, "t": "", "c": null, "e": [["tile_n", "sp", [-1, 2, 3, 1]], ["tile_f", "sp", [-1, 1, 8, 4]], ["tile_d", "sp", [-1, 1, 3, 1]], ["tile_y", "sp", [-1, 1, 3, 1]], ["tile_x", "sp", [-1, 1, 1, 1]], ["tile_rc", "sp", [-1, 1]], ["tile_rd", "sp", [-1, 1]], ["tile_ry", "sp", [-1, 1]], ["tile_rx", "sp", [-1, 8]], ["auto_unroll_max_step", "ot", 1500], ["unroll_explicit", "ot", 1], ["fuse_yx", "ot", 1]]}], "r": [[0.00440322175, 0.00440160025], 0, 2.4879510402679443, 1578546595.4828863], "v": 0.1}
{"i": ["cuda", "schedule_conv3d_nchw_cuda", [[192, 1, 16, 16, 16], [192, 1, 16, 16, 16], 1, [1, 1, 1], [1, 1, 1], 1], {}, ["schedule_conv3d_nchw_cuda", [192, 1, 16, 16, 16], [192, 1, 16, 16, 16], 1, [1, 1, 1], [1, 1, 1], 1], {"i": 8389547083, "t": "", "c": null, "e": [["tile_n", "sp", [-1, 1, 6, 1]], ["tile_f", "sp", [-1, 2, 12, 1]], ["tile_d", "sp", [-1, 1, 1, 1]], ["tile_y", "sp", [-1, 1, 3, 1]], ["tile_x", "sp", [-1, 1, 1, 1]], ["tile_rc", "sp", [-1, 1]], ["tile_rd", "sp", [-1, 2]], ["tile_ry", "sp", [-1, 4]], ["tile_rx", "sp", [-1, 2]], ["auto_unroll_max_step", "ot", 0], ["unroll_explicit", "ot", 1], ["fuse_yx", "ot", 1]]}], "r": [[0.00747836525, 0.00747807525], 0, 1.1062467098236084, 1578546596.1552064], "v": 0.1}
{"i": ["cuda", "schedule_conv3d_nchw_cuda", [[192, 1, 16, 16, 16], [192, 1, 16, 16, 16], 1, [1, 1, 1], [1, 1, 1], 1], {}, ["schedule_conv3d_nchw_cuda", [192, 1, 16, 16, 16], [192, 1, 16, 16, 16], 1, [1, 1, 1], [1, 1, 1], 1], {"i": 5680043083, "t": "", "c": null, "e": [["tile_n", "sp", [-1, 1, 6, 1]], ["tile_f", "sp", [-1, 2, 12, 1]], ["tile_d", "sp", [-1, 1, 1, 1]], ["tile_y", "sp", [-1, 1, 3, 1]], ["tile_x", "sp", [-1, 1, 1, 1]], ["tile_rc", "sp", [-1, 1]], ["tile_rd", "sp", [-1, 2]], ["tile_ry", "sp", [-1, 4]], ["tile_rx", "sp", [-1, 2]], ["auto_unroll_max_step", "ot", 0], ["unroll_explicit", "ot", 0], ["fuse_yx", "ot", 1]]}], "r": [[0.00747953625, 0.00747933025], 0, 0.9931552410125732, 1578546596.7074971], "v": 0.1}
{"i": ["cuda", "schedule_conv3d_nchw_cuda", [[192, 1, 16, 16, 16], [192, 1, 16, 16, 16], 1, [1, 1, 1], [1, 1, 1], 1], {}, ["schedule_conv3d_nchw_cuda", [192, 1, 16, 16, 16], [192, 1, 16, 16, 16], 1, [1, 1, 1], [1, 1, 1], 1], {"i": 6583211083, "t": "", "c": null, "e": [["tile_n", "sp", [-1, 1, 6, 1]], ["tile_f", "sp", [-1, 2, 12, 1]], ["tile_d", "sp", [-1, 1, 1, 1]], ["tile_y", "sp", [-1, 1, 3, 1]], ["tile_x", "sp", [-1, 1, 1, 1]], ["tile_rc", "sp", [-1, 1]], ["tile_rd", "sp", [-1, 2]], ["tile_ry", "sp", [-1, 4]], ["tile_rx", "sp", [-1, 2]], ["auto_unroll_max_step", "ot", 512], ["unroll_explicit", "ot", 0], ["fuse_yx", "ot", 1]]}], "r": [[0.00752756175, 0.00751545825], 0, 1.1164915561676025, 1578546597.3812628], "v": 0.1}
{"i": ["cuda", "schedule_conv3d_nchw_cuda", [[192, 1, 16, 16, 16], [192, 1, 16, 16, 16], 1, [1, 1, 1], [1, 1, 1], 1], {}, ["schedule_conv3d_nchw_cuda", [192, 1, 16, 16, 16], [192, 1, 16, 16, 16], 1, [1, 1, 1], [1, 1, 1], 1], {"i": 10195883083, "t": "", "c": null, "e": [["tile_n", "sp", [-1, 1, 6, 1]], ["tile_f", "sp", [-1, 2, 12, 1]], ["tile_d", "sp", [-1, 1, 1, 1]], ["tile_y", "sp", [-1, 1, 3, 1]], ["tile_x", "sp", [-1, 1, 1, 1]], ["tile_rc", "sp", [-1, 1]], ["tile_rd", "sp", [-1, 2]], ["tile_ry", "sp", [-1, 4]], ["tile_rx", "sp", [-1, 2]], ["auto_unroll_max_step", "ot", 1500], ["unroll_explicit", "ot", 1], ["fuse_yx", "ot", 1]]}], "r": [[0.0077134295, 0.0077552255], 0, 2.875736951828003, 1578546598.232214], "v": 0.1}
{"i": ["cuda", "schedule_conv3d_nchw_cuda", [[192, 1, 16, 16, 16], [192, 1, 16, 16, 16], 1, [1, 1, 1], [1, 1, 1], 1], {}, ["schedule_conv3d_nchw_cuda", [192, 1, 16, 16, 16], [192, 1, 16, 16, 16], 1, [1, 1, 1], [1, 1, 1], 1], {"i": 9292715083, "t": "", "c": null, "e": [["tile_n", "sp", [-1, 1, 6, 1]], ["tile_f", "sp", [-1, 2, 12, 1]], ["tile_d", "sp", [-1, 1, 1, 1]], ["tile_y", "sp", [-1, 1, 3, 1]], ["tile_x", "sp", [-1, 1, 1, 1]], ["tile_rc", "sp", [-1, 1]], ["tile_rd", "sp", [-1, 2]], ["tile_ry", "sp", [-1, 4]], ["tile_rx", "sp", [-1, 2]], ["auto_unroll_max_step", "ot", 512], ["unroll_explicit", "ot", 1], ["fuse_yx", "ot", 1]]}], "r": [[0.00753116575, 0.0075359715], 0, 1.2179243564605713, 1578546598.9086592], "v": 0.1}
{"i": ["cuda", "schedule_conv3d_nchw_cuda", [[192, 1, 16, 16, 16], [192, 1, 16, 16, 16], 1, [1, 1, 1], [1, 1, 1], 1], {}, ["schedule_conv3d_nchw_cuda", [192, 1, 16, 16, 16], [192, 1, 16, 16, 16], 1, [1, 1, 1], [1, 1, 1], 1], {"i": 7486379083, "t": "", "c": null, "e": [["tile_n", "sp", [-1, 1, 6, 1]], ["tile_f", "sp", [-1, 2, 12, 1]], ["tile_d", "sp", [-1, 1, 1, 1]], ["tile_y", "sp", [-1, 1, 3, 1]], ["tile_x", "sp", [-1, 1, 1, 1]], ["tile_rc", "sp", [-1, 1]], ["tile_rd", "sp", [-1, 2]], ["tile_ry", "sp", [-1, 4]], ["tile_rx", "sp", [-1, 2]], ["auto_unroll_max_step", "ot", 1500], ["unroll_explicit", "ot", 0], ["fuse_yx", "ot", 1]]}], "r": [[0.00806750075, 0.0080211485], 0, 1.8593602180480957, 1578546599.932596], "v": 0.1}
{"i": ["cuda", "schedule_conv3d_nchw_cuda", [[192, 1, 16, 16, 16], [192, 1, 16, 16, 16], 1, [1, 1, 1], [1, 1, 1], 1], {}, ["schedule_conv3d_nchw_cuda", [192, 1, 16, 16, 16], [192, 1, 16, 16, 16], 1, [1, 1, 1], [1, 1, 1], 1], {"i": 8534302251, "t": "", "c": null, "e": [["tile_n", "sp", [-1, 2, 3, 1]], ["tile_f", "sp", [-1, 1, 8, 2]], ["tile_d", "sp", [-1, 1, 3, 1]], ["tile_y", "sp", [-1, 1, 3, 1]], ["tile_x", "sp", [-1, 1, 1, 1]], ["tile_rc", "sp", [-1, 1]], ["tile_rd", "sp", [-1, 2]], ["tile_ry", "sp", [-1, 2]], ["tile_rx", "sp", [-1, 4]], ["auto_unroll_max_step", "ot", 0], ["unroll_explicit", "ot", 1], ["fuse_yx", "ot", 1]]}], "r": [[0.0048890665, 0.00489236275], 0, 1.193723440170288, 1578546600.664502], "v": 0.1}
{"i": ["cuda", "schedule_conv3d_nchw_cuda", [[192, 1, 16, 16, 16], [192, 1, 16, 16, 16], 1, [1, 1, 1], [1, 1, 1], 1], {}, ["schedule_conv3d_nchw_cuda", [192, 1, 16, 16, 16], [192, 1, 16, 16, 16], 1, [1, 1, 1], [1, 1, 1], 1], {"i": 5964802720, "t": "", "c": null, "e": [["tile_n", "sp", [-1, 3, 2, 1]], ["tile_f", "sp", [-1, 1, 8, 3]], ["tile_d", "sp", [-1, 1, 3, 1]], ["tile_y", "sp", [-1, 1, 1, 1]], ["tile_x", "sp", [-1, 1, 3, 1]], ["tile_rc", "sp", [-1, 1]], ["tile_rd", "sp", [-1, 1]], ["tile_ry", "sp", [-1, 1]], ["tile_rx", "sp", [-1, 8]], ["auto_unroll_max_step", "ot", 0], ["unroll_explicit", "ot", 0], ["fuse_yx", "ot", 1]]}], "r": [[0.00330878175, 0.003289607], 0, 1.1575868129730225, 1578546601.3874142], "v": 0.1}
{"i": ["cuda", "schedule_conv3d_nchw_cuda", [[192, 1, 16, 16, 16], [192, 1, 16, 16, 16], 1, [1, 1, 1], [1, 1, 1], 1], {}, ["schedule_conv3d_nchw_cuda", [192, 1, 16, 16, 16], [192, 1, 16, 16, 16], 1, [1, 1, 1], [1, 1, 1], 1], {"i": 6867970720, "t": "", "c": null, "e": [["tile_n", "sp", [-1, 3, 2, 1]], ["tile_f", "sp", [-1, 1, 8, 3]], ["tile_d", "sp", [-1, 1, 3, 1]], ["tile_y", "sp", [-1, 1, 1, 1]], ["tile_x", "sp", [-1, 1, 3, 1]], ["tile_rc", "sp", [-1, 1]], ["tile_rd", "sp", [-1, 1]], ["tile_ry", "sp", [-1, 1]], ["tile_rx", "sp", [-1, 8]], ["auto_unroll_max_step", "ot", 512], ["unroll_explicit", "ot", 0], ["fuse_yx", "ot", 1]]}], "r": [[0.0030622455, 0.0030599155], 0, 1.2207531929016113, 1578546602.1238968], "v": 0.1}
{"i": ["cuda", "schedule_conv3d_nchw_cuda", [[192, 1, 16, 16, 16], [192, 1, 16, 16, 16], 1, [1, 1, 1], [1, 1, 1], 1], {}, ["schedule_conv3d_nchw_cuda", [192, 1, 16, 16, 16], [192, 1, 16, 16, 16], 1, [1, 1, 1], [1, 1, 1], 1], {"i": 8674306720, "t": "", "c": null, "e": [["tile_n", "sp", [-1, 3, 2, 1]], ["tile_f", "sp", [-1, 1, 8, 3]], ["tile_d", "sp", [-1, 1, 3, 1]], ["tile_y", "sp", [-1, 1, 1, 1]], ["tile_x", "sp", [-1, 1, 3, 1]], ["tile_rc", "sp", [-1, 1]], ["tile_rd", "sp", [-1, 1]], ["tile_ry", "sp", [-1, 1]], ["tile_rx", "sp", [-1, 8]], ["auto_unroll_max_step", "ot", 0], ["unroll_explicit", "ot", 1], ["fuse_yx", "ot", 1]]}], "r": [[0.00330279475, 0.00332310625], 0, 0.9706840515136719, 1578546602.6307492], "v": 0.1}
{"i": ["cuda", "schedule_conv3d_nchw_cuda", [[192, 1, 16, 16, 16], [192, 1, 16, 16, 16], 1, [1, 1, 1], [1, 1, 1], 1], {}, ["schedule_conv3d_nchw_cuda", [192, 1, 16, 16, 16], [192, 1, 16, 16, 16], 1, [1, 1, 1], [1, 1, 1], 1], {"i": 10480642720, "t": "", "c": null, "e": [["tile_n", "sp", [-1, 3, 2, 1]], ["tile_f", "sp", [-1, 1, 8, 3]], ["tile_d", "sp", [-1, 1, 3, 1]], ["tile_y", "sp", [-1, 1, 1, 1]], ["tile_x", "sp", [-1, 1, 3, 1]], ["tile_rc", "sp", [-1, 1]], ["tile_rd", "sp", [-1, 1]], ["tile_ry", "sp", [-1, 1]], ["tile_rx", "sp", [-1, 8]], ["auto_unroll_max_step", "ot", 1500], ["unroll_explicit", "ot", 1], ["fuse_yx", "ot", 1]]}], "r": [[0.00362607425, 0.00366263875], 0, 2.8466806411743164, 1578546603.4801164], "v": 0.1}
{"i": ["cuda", "schedule_conv3d_nchw_cuda", [[192, 1, 16, 16, 16], [192, 1, 16, 16, 16], 1, [1, 1, 1], [1, 1, 1], 1], {}, ["schedule_conv3d_nchw_cuda", [192, 1, 16, 16, 16], [192, 1, 16, 16, 16], 1, [1, 1, 1], [1, 1, 1], 1], {"i": 9577474720, "t": "", "c": null, "e": [["tile_n", "sp", [-1, 3, 2, 1]], ["tile_f", "sp", [-1, 1, 8, 3]], ["tile_d", "sp", [-1, 1, 3, 1]], ["tile_y", "sp", [-1, 1, 1, 1]], ["tile_x", "sp", [-1, 1, 3, 1]], ["tile_rc", "sp", [-1, 1]], ["tile_rd", "sp", [-1, 1]], ["tile_ry", "sp", [-1, 1]], ["tile_rx", "sp", [-1, 8]], ["auto_unroll_max_step", "ot", 512], ["unroll_explicit", "ot", 1], ["fuse_yx", "ot", 1]]}], "r": [[0.0042296395, 0.0042375605], 0, 1.199509859085083, 1578546836.7379637], "v": 0.1}
{"i": ["cuda", "schedule_conv3d_nchw_cuda", [[192, 1, 16, 16, 16], [192, 1, 16, 16, 16], 1, [1, 1, 1], [1, 1, 1], 1], {}, ["schedule_conv3d_nchw_cuda", [192, 1, 16, 16, 16], [192, 1, 16, 16, 16], 1, [1, 1, 1], [1, 1, 1], 1], {"i": 9229531782, "t": "", "c": null, "e": [["tile_n", "sp", [-1, 1, 4, 4]], ["tile_f", "sp", [-1, 1, 32, 3]], ["tile_d", "sp", [-1, 1, 1, 1]], ["tile_y", "sp", [-1, 1, 3, 1]], ["tile_x", "sp", [-1, 3, 1, 1]], ["tile_rc", "sp", [-1, 1]], ["tile_rd", "sp", [-1, 4]], ["tile_ry", "sp", [-1, 1]], ["tile_rx", "sp", [-1, 2]], ["auto_unroll_max_step", "ot", 512], ["unroll_explicit", "ot", 1], ["fuse_yx", "ot", 1]]}], "r": [[0.0029978155, 0.00300605625], 0, 1.3135058879852295, 1578546837.3189151], "v": 0.1}
{"i": ["cuda", "schedule_conv3d_nchw_cuda", [[192, 1, 16, 16, 16], [192, 1, 16, 16, 16], 1, [1, 1, 1], [1, 1, 1], 1], {}, ["schedule_conv3d_nchw_cuda", [192, 1, 16, 16, 16], [192, 1, 16, 16, 16], 1, [1, 1, 1], [1, 1, 1], 1], {"i": 8678811472, "t": "", "c": null, "e": [["tile_n", "sp", [-1, 3, 2, 1]], ["tile_f", "sp", [-1, 2, 12, 2]], ["tile_d", "sp", [-1, 1, 3, 1]], ["tile_y", "sp", [-1, 1, 3, 1]], ["tile_x", "sp", [-1, 1, 1, 1]], ["tile_rc", "sp", [-1, 1]], ["tile_rd", "sp", [-1, 2]], ["tile_ry", "sp", [-1, 1]], ["tile_rx", "sp", [-1, 8]], ["auto_unroll_max_step", "ot", 0], ["unroll_explicit", "ot", 1], ["fuse_yx", "ot", 1]]}], "r": [[0.004513022, 0.004491215], 0, 1.1051173210144043, 1578546837.9146616], "v": 0.1}
{"i": ["cuda", "schedule_conv3d_nchw_cuda", [[192, 1, 16, 16, 16], [192, 1, 16, 16, 16], 1, [1, 1, 1], [1, 1, 1], 1], {}, ["schedule_conv3d_nchw_cuda", [192, 1, 16, 16, 16], [192, 1, 16, 16, 16], 1, [1, 1, 1], [1, 1, 1], 1], {"i": 9404732833, "t": "", "c": null, "e": [["tile_n", "sp", [-1, 2, 2, 2]], ["tile_f", "sp", [-1, 2, 12, 2]], ["tile_d", "sp", [-1, 1, 1, 1]], ["tile_y", "sp", [-1, 1, 3, 1]], ["tile_x", "sp", [-1, 1, 3, 1]], ["tile_rc", "sp", [-1, 1]], ["tile_rd", "sp", [-1, 2]], ["tile_ry", "sp", [-1, 1]], ["tile_rx", "sp", [-1, 4]], ["auto_unroll_max_step", "ot", 512], ["unroll_explicit", "ot", 1], ["fuse_yx", "ot", 1]]}], "r": [[0.0032624915, 0.00324752025], 0, 1.244924545288086, 1578546838.617384], "v": 0.1}
{"i": ["cuda", "schedule_conv3d_nchw_cuda", [[192, 1, 16, 16, 16], [192, 1, 16, 16, 16], 1, [1, 1, 1], [1, 1, 1], 1], {}, ["schedule_conv3d_nchw_cuda", [192, 1, 16, 16, 16], [192, 1, 16, 16, 16], 1, [1, 1, 1], [1, 1, 1], 1], {"i": 9401345872, "t": "", "c": null, "e": [["tile_n", "sp", [-1, 3, 2, 1]], ["tile_f", "sp", [-1, 2, 12, 2]], ["tile_d", "sp", [-1, 1, 3, 1]], ["tile_y", "sp", [-1, 1, 3, 1]], ["tile_x", "sp", [-1, 1, 1, 1]], ["tile_rc", "sp", [-1, 1]], ["tile_rd", "sp", [-1, 2]], ["tile_ry", "sp", [-1, 1]], ["tile_rx", "sp", [-1, 4]], ["auto_unroll_max_step", "ot", 512], ["unroll_explicit", "ot", 1], ["fuse_yx", "ot", 1]]}], "r": [[0.003389885, 0.0033885105], 0, 1.1667132377624512, 1578546839.2924159], "v": 0.1}
{"i": ["cuda", "schedule_conv3d_nchw_cuda", [[192, 1, 16, 16, 16], [192, 1, 16, 16, 16], 1, [1, 1, 1], [1, 1, 1], 1], {}, ["schedule_conv3d_nchw_cuda", [192, 1, 16, 16, 16], [192, 1, 16, 16, 16], 1, [1, 1, 1], [1, 1, 1], 1], {"i": 8498177872, "t": "", "c": null, "e": [["tile_n", "sp", [-1, 3, 2, 1]], ["tile_f", "sp", [-1, 2, 12, 2]], ["tile_d", "sp", [-1, 1, 3, 1]], ["tile_y", "sp", [-1, 1, 3, 1]], ["tile_x", "sp", [-1, 1, 1, 1]], ["tile_rc", "sp", [-1, 1]], ["tile_rd", "sp", [-1, 2]], ["tile_ry", "sp", [-1, 1]], ["tile_rx", "sp", [-1, 4]], ["auto_unroll_max_step", "ot", 0], ["unroll_explicit", "ot", 1], ["fuse_yx", "ot", 1]]}], "r": [[0.003438683, 0.00343329525], 0, 1.113189697265625, 1578546839.9474173], "v": 0.1}
{"i": ["cuda", "schedule_conv3d_nchw_cuda", [[192, 1, 16, 16, 16], [192, 1, 16, 16, 16], 1, [1, 1, 1], [1, 1, 1], 1], {}, ["schedule_conv3d_nchw_cuda", [192, 1, 16, 16, 16], [192, 1, 16, 16, 16], 1, [1, 1, 1], [1, 1, 1], 1], {"i": 10132699782, "t": "", "c": null, "e": [["tile_n", "sp", [-1, 1, 4, 4]], ["tile_f", "sp", [-1, 1, 32, 3]], ["tile_d", "sp", [-1, 1, 1, 1]], ["tile_y", "sp", [-1, 1, 3, 1]], ["tile_x", "sp", [-1, 3, 1, 1]], ["tile_rc", "sp", [-1, 1]], ["tile_rd", "sp", [-1, 4]], ["tile_ry", "sp", [-1, 1]], ["tile_rx", "sp", [-1, 2]], ["auto_unroll_max_step", "ot", 1500], ["unroll_explicit", "ot", 1], ["fuse_yx", "ot", 1]]}], "r": [[0.002986109, 0.0030041335], 0, 1.2120654582977295, 1578546840.5090542], "v": 0.1}
{"i": ["cuda", "schedule_conv3d_nchw_cuda", [[192, 1, 16, 16, 16], [192, 1, 16, 16, 16], 1, [1, 1, 1], [1, 1, 1], 1], {}, ["schedule_conv3d_nchw_cuda", [192, 1, 16, 16, 16], [192, 1, 16, 16, 16], 1, [1, 1, 1], [1, 1, 1], 1], {"i": 10485149824, "t": "", "c": null, "e": [["tile_n", "sp", [-1, 3, 2, 1]], ["tile_f", "sp", [-1, 1, 24, 2]], ["tile_d", "sp", [-1, 1, 3, 1]], ["tile_y", "sp", [-1, 1, 3, 1]], ["tile_x", "sp", [-1, 1, 1, 1]], ["tile_rc", "sp", [-1, 1]], ["tile_rd", "sp", [-1, 2]], ["tile_ry", "sp", [-1, 1]], ["tile_rx", "sp", [-1, 8]], ["auto_unroll_max_step", "ot", 1500], ["unroll_explicit", "ot", 1], ["fuse_yx", "ot", 1]]}], "r": [[0.0047252675, 0.00472452975], 0, 1.2438576221466064, 1578546841.2729318], "v": 0.1}
{"i": ["cuda", "schedule_conv3d_nchw_cuda", [[192, 1, 16, 16, 16], [192, 1, 16, 16, 16], 1, [1, 1, 1], [1, 1, 1], 1], {}, ["schedule_conv3d_nchw_cuda", [192, 1, 16, 16, 16], [192, 1, 16, 16, 16], 1, [1, 1, 1], [1, 1, 1], 1], {"i": 8501564833, "t": "", "c": null, "e": [["tile_n", "sp", [-1, 2, 2, 2]], ["tile_f", "sp", [-1, 2, 12, 2]], ["tile_d", "sp", [-1, 1, 1, 1]], ["tile_y", "sp", [-1, 1, 3, 1]], ["tile_x", "sp", [-1, 1, 3, 1]], ["tile_rc", "sp", [-1, 1]], ["tile_rd", "sp", [-1, 2]], ["tile_ry", "sp", [-1, 1]], ["tile_rx", "sp", [-1, 4]], ["auto_unroll_max_step", "ot", 0], ["unroll_explicit", "ot", 1], ["fuse_yx", "ot", 1]]}], "r": [[0.0033556115, 0.003347971], 0, 1.0225329399108887, 1578546841.8484793], "v": 0.1}
{"i": ["cuda", "schedule_conv3d_nchw_cuda", [[192, 1, 16, 16, 16], [192, 1, 16, 16, 16], 1, [1, 1, 1], [1, 1, 1], 1], {}, ["schedule_conv3d_nchw_cuda", [192, 1, 16, 16, 16], [192, 1, 16, 16, 16], 1, [1, 1, 1], [1, 1, 1], 1], {"i": 9411959522, "t": "", "c": null, "e": [["tile_n", "sp", [-1, 3, 2, 2]], ["tile_f", "sp", [-1, 2, 16, 2]], ["tile_d", "sp", [-1, 1, 1, 1]], ["tile_y", "sp", [-1, 1, 3, 1]], ["tile_x", "sp", [-1, 1, 3, 1]], ["tile_rc", "sp", [-1, 1]], ["tile_rd", "sp", [-1, 4]], ["tile_ry", "sp", [-1, 1]], ["tile_rx", "sp", [-1, 4]], ["auto_unroll_max_step", "ot", 512], ["unroll_explicit", "ot", 1], ["fuse_yx", "ot", 1]]}], "r": [[0.002425007, 0.00242815925], 0, 1.293081521987915, 1578546842.4532824], "v": 0.1}
{"i": ["cuda", "schedule_conv3d_nchw_cuda", [[192, 1, 16, 16, 16], [192, 1, 16, 16, 16], 1, [1, 1, 1], [1, 1, 1], 1], {}, ["schedule_conv3d_nchw_cuda", [192, 1, 16, 16, 16], [192, 1, 16, 16, 16], 1, [1, 1, 1], [1, 1, 1], 1], {"i": 9411970530, "t": "", "c": null, "e": [["tile_n", "sp", [-1, 6, 2, 1]], ["tile_f", "sp", [-1, 1, 16, 3]], ["tile_d", "sp", [-1, 1, 1, 1]], ["tile_y", "sp", [-1, 1, 3, 1]], ["tile_x", "sp", [-1, 1, 3, 1]], ["tile_rc", "sp", [-1, 1]], ["tile_rd", "sp", [-1, 4]], ["tile_ry", "sp", [-1, 1]], ["tile_rx", "sp", [-1, 4]], ["auto_unroll_max_step", "ot", 512], ["unroll_explicit", "ot", 1], ["fuse_yx", "ot", 1]]}], "r": [[0.00266845475, 0.00267342625], 0, 1.209094762802124, 1578546843.0826292], "v": 0.1}
{"i": ["cuda", "schedule_conv3d_nchw_cuda", [[192, 1, 16, 16, 16], [192, 1, 16, 16, 16], 1, [1, 1, 1], [1, 1, 1], 1], {}, ["schedule_conv3d_nchw_cuda", [192, 1, 16, 16, 16], [192, 1, 16, 16, 16], 1, [1, 1, 1], [1, 1, 1], 1], {"i": 9229530688, "t": "", "c": null, "e": [["tile_n", "sp", [-1, 1, 4, 2]], ["tile_f", "sp", [-1, 1, 16, 3]], ["tile_d", "sp", [-1, 1, 1, 1]], ["tile_y", "sp", [-1, 1, 3, 1]], ["tile_x", "sp", [-1, 3, 1, 1]], ["tile_rc", "sp", [-1, 1]], ["tile_rd", "sp", [-1, 4]], ["tile_ry", "sp", [-1, 1]], ["tile_rx", "sp", [-1, 2]], ["auto_unroll_max_step", "ot", 512], ["unroll_explicit", "ot", 1], ["fuse_yx", "ot", 1]]}], "r": [[0.00317461125, 0.00313172075], 0, 1.2760887145996094, 1578546843.8594913], "v": 0.1}
{"i": ["cuda", "schedule_conv3d_nchw_cuda", [[192, 1, 16, 16, 16], [192, 1, 16, 16, 16], 1, [1, 1, 1], [1, 1, 1], 1], {}, ["schedule_conv3d_nchw_cuda", [192, 1, 16, 16, 16], [192, 1, 16, 16, 16], 1, [1, 1, 1], [1, 1, 1], 1], {"i": 10304513872, "t": "", "c": null, "e": [["tile_n", "sp", [-1, 3, 2, 1]], ["tile_f", "sp", [-1, 2, 12, 2]], ["tile_d", "sp", [-1, 1, 3, 1]], ["tile_y", "sp", [-1, 1, 3, 1]], ["tile_x", "sp", [-1, 1, 1, 1]], ["tile_rc", "sp", [-1, 1]], ["tile_rd", "sp", [-1, 2]], ["tile_ry", "sp", [-1, 1]], ["tile_rx", "sp", [-1, 4]], ["auto_unroll_max_step", "ot", 1500], ["unroll_explicit", "ot", 1], ["fuse_yx", "ot", 1]]}], "r": [[0.0033773295, 0.00339579375], 0, 0.9542081356048584, 1578546845.7253337], "v": 0.1}
