auto_log/((1, 24, 64, 64, 64), (24, 24, 3, 3, 3), (1, 24, 64, 64, 64), (1, 1, 1), (1, 1, 1), 1, 1, None)_bwd_wei_grad.log
{"i": ["cuda", "schedule_conv3d_nchw_cuda", [[24, 1, 64, 64, 64], [24, 1, 64, 64, 64], 1, [1, 1, 1], [1, 1, 1], 1], {}, ["schedule_conv3d_nchw_cuda", [24, 1, 64, 64, 64], [24, 1, 64, 64, 64], 1, [1, 1, 1], [1, 1, 1], 1], {"i": 562835866, "t": "", "c": null, "e": [["tile_n", "sp", [-1, 3, 8, 1]], ["tile_f", "sp", [-1, 1, 2, 1]], ["tile_d", "sp", [-1, 1, 1, 3]], ["tile_y", "sp", [-1, 3, 1, 1]], ["tile_x", "sp", [-1, 1, 1, 1]], ["tile_rc", "sp", [-1, 1]], ["tile_rd", "sp", [-1, 4]], ["tile_ry", "sp", [-1, 1]], ["tile_rx", "sp", [-1, 1]], ["auto_unroll_max_step", "ot", 512], ["unroll_explicit", "ot", 1], ["fuse_yx", "ot", 0]]}], "r": [[0.34131015225, 0.34053571025], 0, 4.440730571746826, 1578521110.1094258], "v": 0.1}
{"i": ["cuda", "schedule_conv3d_nchw_cuda", [[24, 1, 64, 64, 64], [24, 1, 64, 64, 64], 1, [1, 1, 1], [1, 1, 1], 1], {}, ["schedule_conv3d_nchw_cuda", [24, 1, 64, 64, 64], [24, 1, 64, 64, 64], 1, [1, 1, 1], [1, 1, 1], 1], {"i": 866823417, "t": "", "c": null, "e": [["tile_n", "sp", [-1, 1, 8, 3]], ["tile_f", "sp", [-1, 6, 2, 1]], ["tile_d", "sp", [-1, 3, 1, 1]], ["tile_y", "sp", [-1, 1, 1, 1]], ["tile_x", "sp", [-1, 3, 1, 1]], ["tile_rc", "sp", [-1, 1]], ["tile_rd", "sp", [-1, 4]], ["tile_ry", "sp", [-1, 2]], ["tile_rx", "sp", [-1, 2]], ["auto_unroll_max_step", "ot", 0], ["unroll_explicit", "ot", 0], ["fuse_yx", "ot", 1]]}], "r": [[0.14429669725, 0.14429751], 0, 2.475811004638672, 1578521118.428474], "v": 0.1}
{"i": ["cuda", "schedule_conv3d_nchw_cuda", [[24, 1, 64, 64, 64], [24, 1, 64, 64, 64], 1, [1, 1, 1], [1, 1, 1], 1], {}, ["schedule_conv3d_nchw_cuda", [24, 1, 64, 64, 64], [24, 1, 64, 64, 64], 1, [1, 1, 1], [1, 1, 1], 1], {"i": 1331491240, "t": "", "c": null, "e": [["tile_n", "sp", [-1, 1, 3, 2]], ["tile_f", "sp", [-1, 1, 3, 2]], ["tile_d", "sp", [-1, 3, 1, 1]], ["tile_y", "sp", [-1, 1, 1, 3]], ["tile_x", "sp", [-1, 1, 3, 1]], ["tile_rc", "sp", [-1, 1]], ["tile_rd", "sp", [-1, 4]], ["tile_ry", "sp", [-1, 4]], ["tile_rx", "sp", [-1, 8]], ["auto_unroll_max_step", "ot", 0], ["unroll_explicit", "ot", 1], ["fuse_yx", "ot", 1]]}], "r": [[0.09853675475, 0.09857674875], 0, 2.01181960105896, 1578521135.1557736], "v": 0.1}
{"i": ["cuda", "schedule_conv3d_nchw_cuda", [[24, 1, 64, 64, 64], [24, 1, 64, 64, 64], 1, [1, 1, 1], [1, 1, 1], 1], {}, ["schedule_conv3d_nchw_cuda", [24, 1, 64, 64, 64], [24, 1, 64, 64, 64], 1, [1, 1, 1], [1, 1, 1], 1], {"i": 1405954393, "t": "", "c": null, "e": [["tile_n", "sp", [-1, 1, 1, 8]], ["tile_f", "sp", [-1, 1, 24, 1]], ["tile_d", "sp", [-1, 1, 1, 1]], ["tile_y", "sp", [-1, 1, 1, 1]], ["tile_x", "sp", [-1, 1, 3, 1]], ["tile_rc", "sp", [-1, 1]], ["tile_rd", "sp", [-1, 4]], ["tile_ry", "sp", [-1, 1]], ["tile_rx", "sp", [-1, 1]], ["auto_unroll_max_step", "ot", 512], ["unroll_explicit", "ot", 1], ["fuse_yx", "ot", 1]]}], "r": [[0.03515741425, 0.03516054475], 0, 1.3757820129394531, 1578521174.985312], "v": 0.1}
{"i": ["cuda", "schedule_conv3d_nchw_cuda", [[24, 1, 64, 64, 64], [24, 1, 64, 64, 64], 1, [1, 1, 1], [1, 1, 1], 1], {}, ["schedule_conv3d_nchw_cuda", [24, 1, 64, 64, 64], [24, 1, 64, 64, 64], 1, [1, 1, 1], [1, 1, 1], 1], {"i": 1525623312, "t": "", "c": null, "e": [["tile_n", "sp", [-1, 3, 1, 2]], ["tile_f", "sp", [-1, 8, 1, 3]], ["tile_d", "sp", [-1, 1, 3, 1]], ["tile_y", "sp", [-1, 1, 3, 1]], ["tile_x", "sp", [-1, 1, 3, 1]], ["tile_rc", "sp", [-1, 1]], ["tile_rd", "sp", [-1, 1]], ["tile_ry", "sp", [-1, 1]], ["tile_rx", "sp", [-1, 64]], ["auto_unroll_max_step", "ot", 512], ["unroll_explicit", "ot", 1], ["fuse_yx", "ot", 1]]}], "r": [[0.16790701625, 0.16791335475], 0, 3.911461353302002, 1578521177.7198932], "v": 0.1}
{"i": ["cuda", "schedule_conv3d_nchw_cuda", [[24, 1, 64, 64, 64], [24, 1, 64, 64, 64], 1, [1, 1, 1], [1, 1, 1], 1], {}, ["schedule_conv3d_nchw_cuda", [24, 1, 64, 64, 64], [24, 1, 64, 64, 64], 1, [1, 1, 1], [1, 1, 1], 1], {"i": 1561107361, "t": "", "c": null, "e": [["tile_n", "sp", [-1, 2, 1, 1]], ["tile_f", "sp", [-1, 3, 1, 1]], ["tile_d", "sp", [-1, 1, 1, 3]], ["tile_y", "sp", [-1, 1, 1, 1]], ["tile_x", "sp", [-1, 3, 1, 1]], ["tile_rc", "sp", [-1, 1]], ["tile_rd", "sp", [-1, 8]], ["tile_ry", "sp", [-1, 32]], ["tile_rx", "sp", [-1, 1]], ["auto_unroll_max_step", "ot", 1500], ["unroll_explicit", "ot", 1], ["fuse_yx", "ot", 1]]}], "r": [[0.076430435, 0.08047158425], 0, 6.809521436691284, 1578521180.3986032], "v": 0.1}
{"i": ["cuda", "schedule_conv3d_nchw_cuda", [[24, 1, 64, 64, 64], [24, 1, 64, 64, 64], 1, [1, 1, 1], [1, 1, 1], 1], {}, ["schedule_conv3d_nchw_cuda", [24, 1, 64, 64, 64], [24, 1, 64, 64, 64], 1, [1, 1, 1], [1, 1, 1], 1], {"i": 1210615928, "t": "", "c": null, "e": [["tile_n", "sp", [-1, 1, 2, 1]], ["tile_f", "sp", [-1, 2, 1, 4]], ["tile_d", "sp", [-1, 1, 3, 1]], ["tile_y", "sp", [-1, 3, 1, 1]], ["tile_x", "sp", [-1, 1, 3, 1]], ["tile_rc", "sp", [-1, 1]], ["tile_rd", "sp", [-1, 2]], ["tile_ry", "sp", [-1, 4]], ["tile_rx", "sp", [-1, 16]], ["auto_unroll_max_step", "ot", 1500], ["unroll_explicit", "ot", 0], ["fuse_yx", "ot", 1]]}], "r": [[0.051568955, 0.0515681745], 0, 2.8451743125915527, 1578521208.125266], "v": 0.1}
{"i": ["cuda", "schedule_conv3d_nchw_cuda", [[24, 1, 64, 64, 64], [24, 1, 64, 64, 64], 1, [1, 1, 1], [1, 1, 1], 1], {}, ["schedule_conv3d_nchw_cuda", [24, 1, 64, 64, 64], [24, 1, 64, 64, 64], 1, [1, 1, 1], [1, 1, 1], 1], {"i": 49925267, "t": "", "c": null, "e": [["tile_n", "sp", [-1, 1, 1, 6]], ["tile_f", "sp", [-1, 2, 3, 4]], ["tile_d", "sp", [-1, 1, 1, 1]], ["tile_y", "sp", [-1, 1, 3, 1]], ["tile_x", "sp", [-1, 1, 1, 3]], ["tile_rc", "sp", [-1, 1]], ["tile_rd", "sp", [-1, 4]], ["tile_ry", "sp", [-1, 8]], ["tile_rx", "sp", [-1, 4]], ["auto_unroll_max_step", "ot", 0], ["unroll_explicit", "ot", 0], ["fuse_yx", "ot", 0]]}], "r": [[0.235893264, 0.2358947145], 0, 3.365521192550659, 1578521211.42868], "v": 0.1}
{"i": ["cuda", "schedule_conv3d_nchw_cuda", [[24, 1, 64, 64, 64], [24, 1, 64, 64, 64], 1, [1, 1, 1], [1, 1, 1], 1], {}, ["schedule_conv3d_nchw_cuda", [24, 1, 64, 64, 64], [24, 1, 64, 64, 64], 1, [1, 1, 1], [1, 1, 1], 1], {"i": 1047350842, "t": "", "c": null, "e": [["tile_n", "sp", [-1, 4, 3, 2]], ["tile_f", "sp", [-1, 1, 6, 2]], ["tile_d", "sp", [-1, 1, 1, 1]], ["tile_y", "sp", [-1, 1, 1, 1]], ["tile_x", "sp", [-1, 1, 1, 1]], ["tile_rc", "sp", [-1, 1]], ["tile_rd", "sp", [-1, 4]], ["tile_ry", "sp", [-1, 2]], ["tile_rx", "sp", [-1, 8]], ["auto_unroll_max_step", "ot", 512], ["unroll_explicit", "ot", 0], ["fuse_yx", "ot", 1]]}], "r": [[0.162289388, 0.16230079275], 0, 3.9400386810302734, 1578521216.1488695], "v": 0.1}
{"i": ["cuda", "schedule_conv3d_nchw_cuda", [[24, 1, 64, 64, 64], [24, 1, 64, 64, 64], 1, [1, 1, 1], [1, 1, 1], 1], {}, ["schedule_conv3d_nchw_cuda", [24, 1, 64, 64, 64], [24, 1, 64, 64, 64], 1, [1, 1, 1], [1, 1, 1], 1], {"i": 1356261465, "t": "", "c": null, "e": [["tile_n", "sp", [-1, 1, 8, 1]], ["tile_f", "sp", [-1, 2, 1, 6]], ["tile_d", "sp", [-1, 1, 1, 3]], ["tile_y", "sp", [-1, 1, 3, 1]], ["tile_x", "sp", [-1, 1, 1, 1]], ["tile_rc", "sp", [-1, 1]], ["tile_rd", "sp", [-1, 1]], ["tile_ry", "sp", [-1, 16]], ["tile_rx", "sp", [-1, 16]], ["auto_unroll_max_step", "ot", 0], ["unroll_explicit", "ot", 1], ["fuse_yx", "ot", 1]]}], "r": [[0.10501736675, 0.105017728], 0, 1.9420177936553955, 1578521217.973012], "v": 0.1}
{"i": ["cuda", "schedule_conv3d_nchw_cuda", [[24, 1, 64, 64, 64], [24, 1, 64, 64, 64], 1, [1, 1, 1], [1, 1, 1], 1], {}, ["schedule_conv3d_nchw_cuda", [24, 1, 64, 64, 64], [24, 1, 64, 64, 64], 1, [1, 1, 1], [1, 1, 1], 1], {"i": 327967426, "t": "", "c": null, "e": [["tile_n", "sp", [-1, 1, 6, 4]], ["tile_f", "sp", [-1, 1, 4, 6]], ["tile_d", "sp", [-1, 1, 1, 1]], ["tile_y", "sp", [-1, 1, 1, 3]], ["tile_x", "sp", [-1, 1, 3, 1]], ["tile_rc", "sp", [-1, 1]], ["tile_rd", "sp", [-1, 4]], ["tile_ry", "sp", [-1, 4]], ["tile_rx", "sp", [-1, 4]], ["auto_unroll_max_step", "ot", 1500], ["unroll_explicit", "ot", 0], ["fuse_yx", "ot", 0]]}], "r": [[0.0580451375, 0.058047632], 0, 2.249066114425659, 1578521219.477387], "v": 0.1}
{"i": ["cuda", "schedule_conv3d_nchw_cuda", [[24, 1, 64, 64, 64], [24, 1, 64, 64, 64], 1, [1, 1, 1], [1, 1, 1], 1], {}, ["schedule_conv3d_nchw_cuda", [24, 1, 64, 64, 64], [24, 1, 64, 64, 64], 1, [1, 1, 1], [1, 1, 1], 1], {"i": 1551850418, "t": "", "c": null, "e": [["tile_n", "sp", [-1, 1, 4, 1]], ["tile_f", "sp", [-1, 4, 1, 3]], ["tile_d", "sp", [-1, 1, 1, 1]], ["tile_y", "sp", [-1, 1, 1, 3]], ["tile_x", "sp", [-1, 1, 3, 1]], ["tile_rc", "sp", [-1, 1]], ["tile_rd", "sp", [-1, 2]], ["tile_ry", "sp", [-1, 4]], ["tile_rx", "sp", [-1, 1]], ["auto_unroll_max_step", "ot", 1500], ["unroll_explicit", "ot", 1], ["fuse_yx", "ot", 1]]}], "r": [[0.07300143975, 0.073061338], 0, 1.867100477218628, 1578521226.9077973], "v": 0.1}
{"i": ["cuda", "schedule_conv3d_nchw_cuda", [[24, 1, 64, 64, 64], [24, 1, 64, 64, 64], 1, [1, 1, 1], [1, 1, 1], 1], {}, ["schedule_conv3d_nchw_cuda", [24, 1, 64, 64, 64], [24, 1, 64, 64, 64], 1, [1, 1, 1], [1, 1, 1], 1], {"i": 990511083, "t": "", "c": null, "e": [["tile_n", "sp", [-1, 1, 4, 2]], ["tile_f", "sp", [-1, 2, 12, 1]], ["tile_d", "sp", [-1, 1, 1, 3]], ["tile_y", "sp", [-1, 1, 1, 3]], ["tile_x", "sp", [-1, 1, 1, 1]], ["tile_rc", "sp", [-1, 1]], ["tile_rd", "sp", [-1, 8]], ["tile_ry", "sp", [-1, 4]], ["tile_rx", "sp", [-1, 1]], ["auto_unroll_max_step", "ot", 512], ["unroll_explicit", "ot", 0], ["fuse_yx", "ot", 1]]}], "r": [[0.02482429825, 0.024821085], 0, 1.3100199699401855, 1578521227.8252177], "v": 0.1}
{"i": ["cuda", "schedule_conv3d_nchw_cuda", [[24, 1, 64, 64, 64], [24, 1, 64, 64, 64], 1, [1, 1, 1], [1, 1, 1], 1], {}, ["schedule_conv3d_nchw_cuda", [24, 1, 64, 64, 64], [24, 1, 64, 64, 64], 1, [1, 1, 1], [1, 1, 1], 1], {"i": 1147959614, "t": "", "c": null, "e": [["tile_n", "sp", [-1, 1, 3, 1]], ["tile_f", "sp", [-1, 1, 4, 3]], ["tile_d", "sp", [-1, 1, 1, 1]], ["tile_y", "sp", [-1, 1, 3, 1]], ["tile_x", "sp", [-1, 1, 3, 1]], ["tile_rc", "sp", [-1, 1]], ["tile_rd", "sp", [-1, 4]], ["tile_ry", "sp", [-1, 2]], ["tile_rx", "sp", [-1, 2]], ["auto_unroll_max_step", "ot", 1500], ["unroll_explicit", "ot", 0], ["fuse_yx", "ot", 1]]}], "r": [[0.01782653625, 0.01719340625], 0, 1.351062536239624, 1578521485.76085], "v": 0.1}
{"i": ["cuda", "schedule_conv3d_nchw_cuda", [[24, 1, 64, 64, 64], [24, 1, 64, 64, 64], 1, [1, 1, 1], [1, 1, 1], 1], {}, ["schedule_conv3d_nchw_cuda", [24, 1, 64, 64, 64], [24, 1, 64, 64, 64], 1, [1, 1, 1], [1, 1, 1], 1], {"i": 990224116, "t": "", "c": null, "e": [["tile_n", "sp", [-1, 1, 2, 2]], ["tile_f", "sp", [-1, 2, 3, 2]], ["tile_d", "sp", [-1, 1, 3, 1]], ["tile_y", "sp", [-1, 1, 1, 1]], ["tile_x", "sp", [-1, 1, 3, 1]], ["tile_rc", "sp", [-1, 1]], ["tile_rd", "sp", [-1, 4]], ["tile_ry", "sp", [-1, 4]], ["tile_rx", "sp", [-1, 1]], ["auto_unroll_max_step", "ot", 512], ["unroll_explicit", "ot", 0], ["fuse_yx", "ot", 1]]}], "r": [[0.034112267, 0.03189358], 0, 1.6668205261230469, 1578521486.835678], "v": 0.1}
{"i": ["cuda", "schedule_conv3d_nchw_cuda", [[24, 1, 64, 64, 64], [24, 1, 64, 64, 64], 1, [1, 1, 1], [1, 1, 1], 1], {}, ["schedule_conv3d_nchw_cuda", [24, 1, 64, 64, 64], [24, 1, 64, 64, 64], 1, [1, 1, 1], [1, 1, 1], 1], {"i": 1569438014, "t": "", "c": null, "e": [["tile_n", "sp", [-1, 1, 3, 1]], ["tile_f", "sp", [-1, 1, 4, 3]], ["tile_d", "sp", [-1, 1, 1, 1]], ["tile_y", "sp", [-1, 1, 3, 1]], ["tile_x", "sp", [-1, 1, 3, 1]], ["tile_rc", "sp", [-1, 1]], ["tile_rd", "sp", [-1, 4]], ["tile_ry", "sp", [-1, 2]], ["tile_rx", "sp", [-1, 2]], ["auto_unroll_max_step", "ot", 1500], ["unroll_explicit", "ot", 1], ["fuse_yx", "ot", 1]]}], "r": [[0.01174234275, 0.01175798275], 0, 1.4350838661193848, 1578521487.6946619], "v": 0.1}
{"i": ["cuda", "schedule_conv3d_nchw_cuda", [[24, 1, 64, 64, 64], [24, 1, 64, 64, 64], 1, [1, 1, 1], [1, 1, 1], 1], {}, ["schedule_conv3d_nchw_cuda", [24, 1, 64, 64, 64], [24, 1, 64, 64, 64], 1, [1, 1, 1], [1, 1, 1], 1], {"i": 1007466814, "t": "", "c": null, "e": [["tile_n", "sp", [-1, 1, 3, 1]], ["tile_f", "sp", [-1, 1, 4, 3]], ["tile_d", "sp", [-1, 1, 1, 1]], ["tile_y", "sp", [-1, 1, 3, 1]], ["tile_x", "sp", [-1, 1, 3, 1]], ["tile_rc", "sp", [-1, 1]], ["tile_rd", "sp", [-1, 4]], ["tile_ry", "sp", [-1, 2]], ["tile_rx", "sp", [-1, 2]], ["auto_unroll_max_step", "ot", 512], ["unroll_explicit", "ot", 0], ["fuse_yx", "ot", 1]]}], "r": [[0.0138899955, 0.01387517175], 0, 1.2634329795837402, 1578521488.401198], "v": 0.1}
{"i": ["cuda", "schedule_conv3d_nchw_cuda", [[24, 1, 64, 64, 64], [24, 1, 64, 64, 64], 1, [1, 1, 1], [1, 1, 1], 1], {}, ["schedule_conv3d_nchw_cuda", [24, 1, 64, 64, 64], [24, 1, 64, 64, 64], 1, [1, 1, 1], [1, 1, 1], 1], {"i": 1428945214, "t": "", "c": null, "e": [["tile_n", "sp", [-1, 1, 3, 1]], ["tile_f", "sp", [-1, 1, 4, 3]], ["tile_d", "sp", [-1, 1, 1, 1]], ["tile_y", "sp", [-1, 1, 3, 1]], ["tile_x", "sp", [-1, 1, 3, 1]], ["tile_rc", "sp", [-1, 1]], ["tile_rd", "sp", [-1, 4]], ["tile_ry", "sp", [-1, 2]], ["tile_rx", "sp", [-1, 2]], ["auto_unroll_max_step", "ot", 512], ["unroll_explicit", "ot", 1], ["fuse_yx", "ot", 1]]}], "r": [[0.01177506425, 0.0117048395], 0, 1.2353906631469727, 1578521489.099963], "v": 0.1}
{"i": ["cuda", "schedule_conv3d_nchw_cuda", [[24, 1, 64, 64, 64], [24, 1, 64, 64, 64], 1, [1, 1, 1], [1, 1, 1], 1], {}, ["schedule_conv3d_nchw_cuda", [24, 1, 64, 64, 64], [24, 1, 64, 64, 64], 1, [1, 1, 1], [1, 1, 1], 1], {"i": 1288452414, "t": "", "c": null, "e": [["tile_n", "sp", [-1, 1, 3, 1]], ["tile_f", "sp", [-1, 1, 4, 3]], ["tile_d", "sp", [-1, 1, 1, 1]], ["tile_y", "sp", [-1, 1, 3, 1]], ["tile_x", "sp", [-1, 1, 3, 1]], ["tile_rc", "sp", [-1, 1]], ["tile_rd", "sp", [-1, 4]], ["tile_ry", "sp", [-1, 2]], ["tile_rx", "sp", [-1, 2]], ["auto_unroll_max_step", "ot", 0], ["unroll_explicit", "ot", 1], ["fuse_yx", "ot", 1]]}], "r": [[0.013884769, 0.01388298875], 0, 1.496567964553833, 1578521489.9873433], "v": 0.1}
{"i": ["cuda", "schedule_conv3d_nchw_cuda", [[24, 1, 64, 64, 64], [24, 1, 64, 64, 64], 1, [1, 1, 1], [1, 1, 1], 1], {}, ["schedule_conv3d_nchw_cuda", [24, 1, 64, 64, 64], [24, 1, 64, 64, 64], 1, [1, 1, 1], [1, 1, 1], 1], {"i": 852599710, "t": "", "c": null, "e": [["tile_n", "sp", [-1, 1, 1, 2]], ["tile_f", "sp", [-1, 2, 4, 3]], ["tile_d", "sp", [-1, 1, 3, 1]], ["tile_y", "sp", [-1, 1, 1, 1]], ["tile_x", "sp", [-1, 1, 3, 1]], ["tile_rc", "sp", [-1, 1]], ["tile_rd", "sp", [-1, 4]], ["tile_ry", "sp", [-1, 8]], ["tile_rx", "sp", [-1, 1]], ["auto_unroll_max_step", "ot", 0], ["unroll_explicit", "ot", 0], ["fuse_yx", "ot", 1]]}], "r": [[0.04251126675, 0.04251182525], 0, 1.592993974685669, 1578521491.0050507], "v": 0.1}
{"i": ["cuda", "schedule_conv3d_nchw_cuda", [[24, 1, 64, 64, 64], [24, 1, 64, 64, 64], 1, [1, 1, 1], [1, 1, 1], 1], {}, ["schedule_conv3d_nchw_cuda", [24, 1, 64, 64, 64], [24, 1, 64, 64, 64], 1, [1, 1, 1], [1, 1, 1], 1], {"i": 1448978008, "t": "", "c": null, "e": [["tile_n", "sp", [-1, 1, 2, 1]], ["tile_f", "sp", [-1, 2, 3, 4]], ["tile_d", "sp", [-1, 1, 3, 1]], ["tile_y", "sp", [-1, 1, 1, 1]], ["tile_x", "sp", [-1, 1, 3, 1]], ["tile_rc", "sp", [-1, 1]], ["tile_rd", "sp", [-1, 4]], ["tile_ry", "sp", [-1, 2]], ["tile_rx", "sp", [-1, 4]], ["auto_unroll_max_step", "ot", 512], ["unroll_explicit", "ot", 1], ["fuse_yx", "ot", 1]]}], "r": [[0.022800834, 0.02282711475], 0, 1.7687530517578125, 1578521491.8840504], "v": 0.1}
{"i": ["cuda", "schedule_conv3d_nchw_cuda", [[24, 1, 64, 64, 64], [24, 1, 64, 64, 64], 1, [1, 1, 1], [1, 1, 1], 1], {}, ["schedule_conv3d_nchw_cuda", [24, 1, 64, 64, 64], [24, 1, 64, 64, 64], 1, [1, 1, 1], [1, 1, 1], 1], {"i": 1414570910, "t": "", "c": null, "e": [["tile_n", "sp", [-1, 1, 1, 2]], ["tile_f", "sp", [-1, 2, 4, 3]], ["tile_d", "sp", [-1, 1, 3, 1]], ["tile_y", "sp", [-1, 1, 1, 1]], ["tile_x", "sp", [-1, 1, 3, 1]], ["tile_rc", "sp", [-1, 1]], ["tile_rd", "sp", [-1, 4]], ["tile_ry", "sp", [-1, 8]], ["tile_rx", "sp", [-1, 1]], ["auto_unroll_max_step", "ot", 512], ["unroll_explicit", "ot", 1], ["fuse_yx", "ot", 1]]}], "r": [[0.02898828525, 0.02898762275], 0, 2.0245516300201416, 1578521493.0522861], "v": 0.1}
{"i": ["cuda", "schedule_conv3d_nchw_cuda", [[24, 1, 64, 64, 64], [24, 1, 64, 64, 64], 1, [1, 1, 1], [1, 1, 1], 1], {}, ["schedule_conv3d_nchw_cuda", [24, 1, 64, 64, 64], [24, 1, 64, 64, 64], 1, [1, 1, 1], [1, 1, 1], 1], {"i": 1555063710, "t": "", "c": null, "e": [["tile_n", "sp", [-1, 1, 1, 2]], ["tile_f", "sp", [-1, 2, 4, 3]], ["tile_d", "sp", [-1, 1, 3, 1]], ["tile_y", "sp", [-1, 1, 1, 1]], ["tile_x", "sp", [-1, 1, 3, 1]], ["tile_rc", "sp", [-1, 1]], ["tile_rd", "sp", [-1, 4]], ["tile_ry", "sp", [-1, 8]], ["tile_rx", "sp", [-1, 1]], ["auto_unroll_max_step", "ot", 1500], ["unroll_explicit", "ot", 1], ["fuse_yx", "ot", 1]]}], "r": [[0.02900651475, 0.02900504425], 0, 1.7775533199310303, 1578521493.9233465], "v": 0.1}
{"i": ["cuda", "schedule_conv3d_nchw_cuda", [[24, 1, 64, 64, 64], [24, 1, 64, 64, 64], 1, [1, 1, 1], [1, 1, 1], 1], {}, ["schedule_conv3d_nchw_cuda", [24, 1, 64, 64, 64], [24, 1, 64, 64, 64], 1, [1, 1, 1], [1, 1, 1], 1], {"i": 993092510, "t": "", "c": null, "e": [["tile_n", "sp", [-1, 1, 1, 2]], ["tile_f", "sp", [-1, 2, 4, 3]], ["tile_d", "sp", [-1, 1, 3, 1]], ["tile_y", "sp", [-1, 1, 1, 1]], ["tile_x", "sp", [-1, 1, 3, 1]], ["tile_rc", "sp", [-1, 1]], ["tile_rd", "sp", [-1, 4]], ["tile_ry", "sp", [-1, 8]], ["tile_rx", "sp", [-1, 1]], ["auto_unroll_max_step", "ot", 512], ["unroll_explicit", "ot", 0], ["fuse_yx", "ot", 1]]}], "r": [[0.03409991325, 0.0341028675], 0, 1.8604965209960938, 1578521495.1610734], "v": 0.1}
{"i": ["cuda", "schedule_conv3d_nchw_cuda", [[24, 1, 64, 64, 64], [24, 1, 64, 64, 64], 1, [1, 1, 1], [1, 1, 1], 1], {}, ["schedule_conv3d_nchw_cuda", [24, 1, 64, 64, 64], [24, 1, 64, 64, 64], 1, [1, 1, 1], [1, 1, 1], 1], {"i": 1274078110, "t": "", "c": null, "e": [["tile_n", "sp", [-1, 1, 1, 2]], ["tile_f", "sp", [-1, 2, 4, 3]], ["tile_d", "sp", [-1, 1, 3, 1]], ["tile_y", "sp", [-1, 1, 1, 1]], ["tile_x", "sp", [-1, 1, 3, 1]], ["tile_rc", "sp", [-1, 1]], ["tile_rd", "sp", [-1, 4]], ["tile_ry", "sp", [-1, 8]], ["tile_rx", "sp", [-1, 1]], ["auto_unroll_max_step", "ot", 0], ["unroll_explicit", "ot", 1], ["fuse_yx", "ot", 1]]}], "r": [[0.04252999225, 0.04253337025], 0, 1.4855842590332031, 1578521496.1085515], "v": 0.1}
{"i": ["cuda", "schedule_conv3d_nchw_cuda", [[24, 1, 64, 64, 64], [24, 1, 64, 64, 64], 1, [1, 1, 1], [1, 1, 1], 1], {}, ["schedule_conv3d_nchw_cuda", [24, 1, 64, 64, 64], [24, 1, 64, 64, 64], 1, [1, 1, 1], [1, 1, 1], 1], {"i": 1288886888, "t": "", "c": null, "e": [["tile_n", "sp", [-1, 1, 2, 1]], ["tile_f", "sp", [-1, 2, 6, 2]], ["tile_d", "sp", [-1, 1, 1, 1]], ["tile_y", "sp", [-1, 1, 1, 3]], ["tile_x", "sp", [-1, 1, 3, 1]], ["tile_rc", "sp", [-1, 1]], ["tile_rd", "sp", [-1, 8]], ["tile_ry", "sp", [-1, 2]], ["tile_rx", "sp", [-1, 2]], ["auto_unroll_max_step", "ot", 0], ["unroll_explicit", "ot", 1], ["fuse_yx", "ot", 1]]}], "r": [[0.03153482475, 0.031531611], 0, 1.3436405658721924, 1578521498.986511], "v": 0.1}
{"i": ["cuda", "schedule_conv3d_nchw_cuda", [[24, 1, 64, 64, 64], [24, 1, 64, 64, 64], 1, [1, 1, 1], [1, 1, 1], 1], {}, ["schedule_conv3d_nchw_cuda", [24, 1, 64, 64, 64], [24, 1, 64, 64, 64], 1, [1, 1, 1], [1, 1, 1], 1], {"i": 1589470808, "t": "", "c": null, "e": [["tile_n", "sp", [-1, 1, 2, 1]], ["tile_f", "sp", [-1, 2, 3, 4]], ["tile_d", "sp", [-1, 1, 3, 1]], ["tile_y", "sp", [-1, 1, 1, 1]], ["tile_x", "sp", [-1, 1, 3, 1]], ["tile_rc", "sp", [-1, 1]], ["tile_rd", "sp", [-1, 4]], ["tile_ry", "sp", [-1, 2]], ["tile_rx", "sp", [-1, 4]], ["auto_unroll_max_step", "ot", 1500], ["unroll_explicit", "ot", 1], ["fuse_yx", "ot", 1]]}], "r": [[0.02294623825, 0.022935191], 0, 1.6769673824310303, 1578521499.7925937], "v": 0.1}
{"i": ["cuda", "schedule_conv3d_nchw_cuda", [[24, 1, 64, 64, 64], [24, 1, 64, 64, 64], 1, [1, 1, 1], [1, 1, 1], 1], {}, ["schedule_conv3d_nchw_cuda", [24, 1, 64, 64, 64], [24, 1, 64, 64, 64], 1, [1, 1, 1], [1, 1, 1], 1], {"i": 1167992408, "t": "", "c": null, "e": [["tile_n", "sp", [-1, 1, 2, 1]], ["tile_f", "sp", [-1, 2, 3, 4]], ["tile_d", "sp", [-1, 1, 3, 1]], ["tile_y", "sp", [-1, 1, 1, 1]], ["tile_x", "sp", [-1, 1, 3, 1]], ["tile_rc", "sp", [-1, 1]], ["tile_rd", "sp", [-1, 4]], ["tile_ry", "sp", [-1, 2]], ["tile_rx", "sp", [-1, 4]], ["auto_unroll_max_step", "ot", 1500], ["unroll_explicit", "ot", 0], ["fuse_yx", "ot", 1]]}], "r": [[0.02293098175, 0.022954749], 0, 1.4071612358093262, 1578521500.663016], "v": 0.1}
{"i": ["cuda", "schedule_conv3d_nchw_cuda", [[24, 1, 64, 64, 64], [24, 1, 64, 64, 64], 1, [1, 1, 1], [1, 1, 1], 1], {}, ["schedule_conv3d_nchw_cuda", [24, 1, 64, 64, 64], [24, 1, 64, 64, 64], 1, [1, 1, 1], [1, 1, 1], 1], {"i": 1588930240, "t": "", "c": null, "e": [["tile_n", "sp", [-1, 1, 1, 1]], ["tile_f", "sp", [-1, 2, 12, 1]], ["tile_d", "sp", [-1, 1, 3, 1]], ["tile_y", "sp", [-1, 1, 1, 3]], ["tile_x", "sp", [-1, 1, 1, 1]], ["tile_rc", "sp", [-1, 1]], ["tile_rd", "sp", [-1, 2]], ["tile_ry", "sp", [-1, 2]], ["tile_rx", "sp", [-1, 4]], ["auto_unroll_max_step", "ot", 1500], ["unroll_explicit", "ot", 1], ["fuse_yx", "ot", 1]]}], "r": [[0.018252994, 0.01825664725], 0, 1.3775889873504639, 1578521501.4553595], "v": 0.1}
{"i": ["cuda", "schedule_conv3d_nchw_cuda", [[24, 1, 64, 64, 64], [24, 1, 64, 64, 64], 1, [1, 1, 1], [1, 1, 1], 1], {}, ["schedule_conv3d_nchw_cuda", [24, 1, 64, 64, 64], [24, 1, 64, 64, 64], 1, [1, 1, 1], [1, 1, 1], 1], {"i": 1167451840, "t": "", "c": null, "e": [["tile_n", "sp", [-1, 1, 1, 1]], ["tile_f", "sp", [-1, 2, 12, 1]], ["tile_d", "sp", [-1, 1, 3, 1]], ["tile_y", "sp", [-1, 1, 1, 3]], ["tile_x", "sp", [-1, 1, 1, 1]], ["tile_rc", "sp", [-1, 1]], ["tile_rd", "sp", [-1, 2]], ["tile_ry", "sp", [-1, 2]], ["tile_rx", "sp", [-1, 4]], ["auto_unroll_max_step", "ot", 1500], ["unroll_explicit", "ot", 0], ["fuse_yx", "ot", 1]]}], "r": [[0.019531445, 0.01935298725], 0, 1.4151740074157715, 1578521502.2937646], "v": 0.1}
{"i": ["cuda", "schedule_conv3d_nchw_cuda", [[24, 1, 64, 64, 64], [24, 1, 64, 64, 64], 1, [1, 1, 1], [1, 1, 1], 1], {}, ["schedule_conv3d_nchw_cuda", [24, 1, 64, 64, 64], [24, 1, 64, 64, 64], 1, [1, 1, 1], [1, 1, 1], 1], {"i": 1307944640, "t": "", "c": null, "e": [["tile_n", "sp", [-1, 1, 1, 1]], ["tile_f", "sp", [-1, 2, 12, 1]], ["tile_d", "sp", [-1, 1, 3, 1]], ["tile_y", "sp", [-1, 1, 1, 3]], ["tile_x", "sp", [-1, 1, 1, 1]], ["tile_rc", "sp", [-1, 1]], ["tile_rd", "sp", [-1, 2]], ["tile_ry", "sp", [-1, 2]], ["tile_rx", "sp", [-1, 4]], ["auto_unroll_max_step", "ot", 0], ["unroll_explicit", "ot", 1], ["fuse_yx", "ot", 1]]}], "r": [[0.01758944325, 0.01756707475], 0, 1.4138767719268799, 1578521503.0774612], "v": 0.1}
{"i": ["cuda", "schedule_conv3d_nchw_cuda", [[24, 1, 64, 64, 64], [24, 1, 64, 64, 64], 1, [1, 1, 1], [1, 1, 1], 1], {}, ["schedule_conv3d_nchw_cuda", [24, 1, 64, 64, 64], [24, 1, 64, 64, 64], 1, [1, 1, 1], [1, 1, 1], 1], {"i": 883982618, "t": "", "c": null, "e": [["tile_n", "sp", [-1, 1, 1, 4]], ["tile_f", "sp", [-1, 1, 6, 1]], ["tile_d", "sp", [-1, 1, 3, 1]], ["tile_y", "sp", [-1, 1, 3, 1]], ["tile_x", "sp", [-1, 1, 1, 1]], ["tile_rc", "sp", [-1, 1]], ["tile_rd", "sp", [-1, 4]], ["tile_ry", "sp", [-1, 1]], ["tile_rx", "sp", [-1, 4]], ["auto_unroll_max_step", "ot", 0], ["unroll_explicit", "ot", 0], ["fuse_yx", "ot", 1]]}], "r": [[0.02268026925, 0.0226401], 0, 1.3362181186676025, 1578521503.9000087], "v": 0.1}
{"i": ["cuda", "schedule_conv3d_nchw_cuda", [[24, 1, 64, 64, 64], [24, 1, 64, 64, 64], 1, [1, 1, 1], [1, 1, 1], 1], {}, ["schedule_conv3d_nchw_cuda", [24, 1, 64, 64, 64], [24, 1, 64, 64, 64], 1, [1, 1, 1], [1, 1, 1], 1], {"i": 1305461018, "t": "", "c": null, "e": [["tile_n", "sp", [-1, 1, 1, 4]], ["tile_f", "sp", [-1, 1, 6, 1]], ["tile_d", "sp", [-1, 1, 3, 1]], ["tile_y", "sp", [-1, 1, 3, 1]], ["tile_x", "sp", [-1, 1, 1, 1]], ["tile_rc", "sp", [-1, 1]], ["tile_rd", "sp", [-1, 4]], ["tile_ry", "sp", [-1, 1]], ["tile_rx", "sp", [-1, 4]], ["auto_unroll_max_step", "ot", 0], ["unroll_explicit", "ot", 1], ["fuse_yx", "ot", 1]]}], "r": [[0.0225309555, 0.02253468475], 0, 1.3575260639190674, 1578521504.6779017], "v": 0.1}
{"i": ["cuda", "schedule_conv3d_nchw_cuda", [[24, 1, 64, 64, 64], [24, 1, 64, 64, 64], 1, [1, 1, 1], [1, 1, 1], 1], {}, ["schedule_conv3d_nchw_cuda", [24, 1, 64, 64, 64], [24, 1, 64, 64, 64], 1, [1, 1, 1], [1, 1, 1], 1], {"i": 1305462436, "t": "", "c": null, "e": [["tile_n", "sp", [-1, 1, 2, 2]], ["tile_f", "sp", [-1, 1, 3, 2]], ["tile_d", "sp", [-1, 1, 3, 1]], ["tile_y", "sp", [-1, 1, 3, 1]], ["tile_x", "sp", [-1, 1, 1, 1]], ["tile_rc", "sp", [-1, 1]], ["tile_rd", "sp", [-1, 4]], ["tile_ry", "sp", [-1, 1]], ["tile_rx", "sp", [-1, 4]], ["auto_unroll_max_step", "ot", 0], ["unroll_explicit", "ot", 1], ["fuse_yx", "ot", 1]]}], "r": [[0.02147514275, 0.02148523525], 0, 1.2959787845611572, 1578521505.4901447], "v": 0.1}
{"i": ["cuda", "schedule_conv3d_nchw_cuda", [[24, 1, 64, 64, 64], [24, 1, 64, 64, 64], 1, [1, 1, 1], [1, 1, 1], 1], {}, ["schedule_conv3d_nchw_cuda", [24, 1, 64, 64, 64], [24, 1, 64, 64, 64], 1, [1, 1, 1], [1, 1, 1], 1], {"i": 869648254, "t": "", "c": null, "e": [["tile_n", "sp", [-1, 1, 3, 1]], ["tile_f", "sp", [-1, 1, 4, 2]], ["tile_d", "sp", [-1, 1, 3, 1]], ["tile_y", "sp", [-1, 1, 3, 1]], ["tile_x", "sp", [-1, 1, 1, 1]], ["tile_rc", "sp", [-1, 1]], ["tile_rd", "sp", [-1, 4]], ["tile_ry", "sp", [-1, 4]], ["tile_rx", "sp", [-1, 2]], ["auto_unroll_max_step", "ot", 0], ["unroll_explicit", "ot", 0], ["fuse_yx", "ot", 1]]}], "r": [[0.0147234555, 0.0146169295], 0, 1.3899753093719482, 1578521506.3666735], "v": 0.1}
{"i": ["cuda", "schedule_conv3d_nchw_cuda", [[24, 1, 64, 64, 64], [24, 1, 64, 64, 64], 1, [1, 1, 1], [1, 1, 1], 1], {}, ["schedule_conv3d_nchw_cuda", [24, 1, 64, 64, 64], [24, 1, 64, 64, 64], 1, [1, 1, 1], [1, 1, 1], 1], {"i": 1010141054, "t": "", "c": null, "e": [["tile_n", "sp", [-1, 1, 3, 1]], ["tile_f", "sp", [-1, 1, 4, 2]], ["tile_d", "sp", [-1, 1, 3, 1]], ["tile_y", "sp", [-1, 1, 3, 1]], ["tile_x", "sp", [-1, 1, 1, 1]], ["tile_rc", "sp", [-1, 1]], ["tile_rd", "sp", [-1, 4]], ["tile_ry", "sp", [-1, 4]], ["tile_rx", "sp", [-1, 2]], ["auto_unroll_max_step", "ot", 512], ["unroll_explicit", "ot", 0], ["fuse_yx", "ot", 1]]}], "r": [[0.015577238, 0.0155756775], 0, 1.385188341140747, 1578521507.264334], "v": 0.1}
{"i": ["cuda", "schedule_conv3d_nchw_cuda", [[24, 1, 64, 64, 64], [24, 1, 64, 64, 64], 1, [1, 1, 1], [1, 1, 1], 1], {}, ["schedule_conv3d_nchw_cuda", [24, 1, 64, 64, 64], [24, 1, 64, 64, 64], 1, [1, 1, 1], [1, 1, 1], 1], {"i": 1164968218, "t": "", "c": null, "e": [["tile_n", "sp", [-1, 1, 1, 4]], ["tile_f", "sp", [-1, 1, 6, 1]], ["tile_d", "sp", [-1, 1, 3, 1]], ["tile_y", "sp", [-1, 1, 3, 1]], ["tile_x", "sp", [-1, 1, 1, 1]], ["tile_rc", "sp", [-1, 1]], ["tile_rd", "sp", [-1, 4]], ["tile_ry", "sp", [-1, 1]], ["tile_rx", "sp", [-1, 4]], ["auto_unroll_max_step", "ot", 1500], ["unroll_explicit", "ot", 0], ["fuse_yx", "ot", 1]]}], "r": [[0.022491785, 0.02247861425], 0, 1.2594246864318848, 1578521508.0890887], "v": 0.1}
{"i": ["cuda", "schedule_conv3d_nchw_cuda", [[24, 1, 64, 64, 64], [24, 1, 64, 64, 64], 1, [1, 1, 1], [1, 1, 1], 1], {}, ["schedule_conv3d_nchw_cuda", [24, 1, 64, 64, 64], [24, 1, 64, 64, 64], 1, [1, 1, 1], [1, 1, 1], 1], {"i": 1586446618, "t": "", "c": null, "e": [["tile_n", "sp", [-1, 1, 1, 4]], ["tile_f", "sp", [-1, 1, 6, 1]], ["tile_d", "sp", [-1, 1, 3, 1]], ["tile_y", "sp", [-1, 1, 3, 1]], ["tile_x", "sp", [-1, 1, 1, 1]], ["tile_rc", "sp", [-1, 1]], ["tile_rd", "sp", [-1, 4]], ["tile_ry", "sp", [-1, 1]], ["tile_rx", "sp", [-1, 4]], ["auto_unroll_max_step", "ot", 1500], ["unroll_explicit", "ot", 1], ["fuse_yx", "ot", 1]]}], "r": [[0.0226177455, 0.02278630925], 0, 1.3606758117675781, 1578521510.875286], "v": 0.1}
{"i": ["cuda", "schedule_conv3d_nchw_cuda", [[24, 1, 64, 64, 64], [24, 1, 64, 64, 64], 1, [1, 1, 1], [1, 1, 1], 1], {}, ["schedule_conv3d_nchw_cuda", [24, 1, 64, 64, 64], [24, 1, 64, 64, 64], 1, [1, 1, 1], [1, 1, 1], 1], {"i": 1164969636, "t": "", "c": null, "e": [["tile_n", "sp", [-1, 1, 2, 2]], ["tile_f", "sp", [-1, 1, 3, 2]], ["tile_d", "sp", [-1, 1, 3, 1]], ["tile_y", "sp", [-1, 1, 3, 1]], ["tile_x", "sp", [-1, 1, 1, 1]], ["tile_rc", "sp", [-1, 1]], ["tile_rd", "sp", [-1, 4]], ["tile_ry", "sp", [-1, 1]], ["tile_rx", "sp", [-1, 4]], ["auto_unroll_max_step", "ot", 1500], ["unroll_explicit", "ot", 0], ["fuse_yx", "ot", 1]]}], "r": [[0.022147578, 0.02204552325], 0, 1.2029364109039307, 1578521511.6788971], "v": 0.1}
{"i": ["cuda", "schedule_conv3d_nchw_cuda", [[24, 1, 64, 64, 64], [24, 1, 64, 64, 64], 1, [1, 1, 1], [1, 1, 1], 1], {}, ["schedule_conv3d_nchw_cuda", [24, 1, 64, 64, 64], [24, 1, 64, 64, 64], 1, [1, 1, 1], [1, 1, 1], 1], {"i": 883984036, "t": "", "c": null, "e": [["tile_n", "sp", [-1, 1, 2, 2]], ["tile_f", "sp", [-1, 1, 3, 2]], ["tile_d", "sp", [-1, 1, 3, 1]], ["tile_y", "sp", [-1, 1, 3, 1]], ["tile_x", "sp", [-1, 1, 1, 1]], ["tile_rc", "sp", [-1, 1]], ["tile_rd", "sp", [-1, 4]], ["tile_ry", "sp", [-1, 1]], ["tile_rx", "sp", [-1, 4]], ["auto_unroll_max_step", "ot", 0], ["unroll_explicit", "ot", 0], ["fuse_yx", "ot", 1]]}], "r": [[0.0222031885, 0.02195950075], 0, 1.276801586151123, 1578521512.4659858], "v": 0.1}
{"i": ["cuda", "schedule_conv3d_nchw_cuda", [[24, 1, 64, 64, 64], [24, 1, 64, 64, 64], 1, [1, 1, 1], [1, 1, 1], 1], {}, ["schedule_conv3d_nchw_cuda", [24, 1, 64, 64, 64], [24, 1, 64, 64, 64], 1, [1, 1, 1], [1, 1, 1], 1], {"i": 1431619454, "t": "", "c": null, "e": [["tile_n", "sp", [-1, 1, 3, 1]], ["tile_f", "sp", [-1, 1, 4, 2]], ["tile_d", "sp", [-1, 1, 3, 1]], ["tile_y", "sp", [-1, 1, 3, 1]], ["tile_x", "sp", [-1, 1, 1, 1]], ["tile_rc", "sp", [-1, 1]], ["tile_rd", "sp", [-1, 4]], ["tile_ry", "sp", [-1, 4]], ["tile_rx", "sp", [-1, 2]], ["auto_unroll_max_step", "ot", 512], ["unroll_explicit", "ot", 1], ["fuse_yx", "ot", 1]]}], "r": [[0.0139914405, 0.014094654], 0, 1.4411983489990234, 1578521513.3264203], "v": 0.1}
{"i": ["cuda", "schedule_conv3d_nchw_cuda", [[24, 1, 64, 64, 64], [24, 1, 64, 64, 64], 1, [1, 1, 1], [1, 1, 1], 1], {}, ["schedule_conv3d_nchw_cuda", [24, 1, 64, 64, 64], [24, 1, 64, 64, 64], 1, [1, 1, 1], [1, 1, 1], 1], {"i": 1024475418, "t": "", "c": null, "e": [["tile_n", "sp", [-1, 1, 1, 4]], ["tile_f", "sp", [-1, 1, 6, 1]], ["tile_d", "sp", [-1, 1, 3, 1]], ["tile_y", "sp", [-1, 1, 3, 1]], ["tile_x", "sp", [-1, 1, 1, 1]], ["tile_rc", "sp", [-1, 1]], ["tile_rd", "sp", [-1, 4]], ["tile_ry", "sp", [-1, 1]], ["tile_rx", "sp", [-1, 4]], ["auto_unroll_max_step", "ot", 512], ["unroll_explicit", "ot", 0], ["fuse_yx", "ot", 1]]}], "r": [[0.022598544, 0.022606518], 0, 1.3591532707214355, 1578521514.1329725], "v": 0.1}
{"i": ["cuda", "schedule_conv3d_nchw_cuda", [[24, 1, 64, 64, 64], [24, 1, 64, 64, 64], 1, [1, 1, 1], [1, 1, 1], 1], {}, ["schedule_conv3d_nchw_cuda", [24, 1, 64, 64, 64], [24, 1, 64, 64, 64], 1, [1, 1, 1], [1, 1, 1], 1], {"i": 1586448036, "t": "", "c": null, "e": [["tile_n", "sp", [-1, 1, 2, 2]], ["tile_f", "sp", [-1, 1, 3, 2]], ["tile_d", "sp", [-1, 1, 3, 1]], ["tile_y", "sp", [-1, 1, 3, 1]], ["tile_x", "sp", [-1, 1, 1, 1]], ["tile_rc", "sp", [-1, 1]], ["tile_rd", "sp", [-1, 4]], ["tile_ry", "sp", [-1, 1]], ["tile_rx", "sp", [-1, 4]], ["auto_unroll_max_step", "ot", 1500], ["unroll_explicit", "ot", 1], ["fuse_yx", "ot", 1]]}], "r": [[0.02316308725, 0.023073451], 0, 1.3859150409698486, 1578521514.975776], "v": 0.1}
{"i": ["cuda", "schedule_conv3d_nchw_cuda", [[24, 1, 64, 64, 64], [24, 1, 64, 64, 64], 1, [1, 1, 1], [1, 1, 1], 1], {}, ["schedule_conv3d_nchw_cuda", [24, 1, 64, 64, 64], [24, 1, 64, 64, 64], 1, [1, 1, 1], [1, 1, 1], 1], {"i": 1024475408, "t": "", "c": null, "e": [["tile_n", "sp", [-1, 1, 1, 3]], ["tile_f", "sp", [-1, 1, 6, 1]], ["tile_d", "sp", [-1, 1, 3, 1]], ["tile_y", "sp", [-1, 1, 3, 1]], ["tile_x", "sp", [-1, 1, 1, 1]], ["tile_rc", "sp", [-1, 1]], ["tile_rd", "sp", [-1, 4]], ["tile_ry", "sp", [-1, 1]], ["tile_rx", "sp", [-1, 4]], ["auto_unroll_max_step", "ot", 512], ["unroll_explicit", "ot", 0], ["fuse_yx", "ot", 1]]}], "r": [[0.015258451, 0.015256603], 0, 1.2937324047088623, 1578521515.737368], "v": 0.1}
{"i": ["cuda", "schedule_conv3d_nchw_cuda", [[24, 1, 64, 64, 64], [24, 1, 64, 64, 64], 1, [1, 1, 1], [1, 1, 1], 1], {}, ["schedule_conv3d_nchw_cuda", [24, 1, 64, 64, 64], [24, 1, 64, 64, 64], 1, [1, 1, 1], [1, 1, 1], 1], {"i": 1024476836, "t": "", "c": null, "e": [["tile_n", "sp", [-1, 1, 2, 2]], ["tile_f", "sp", [-1, 1, 3, 2]], ["tile_d", "sp", [-1, 1, 3, 1]], ["tile_y", "sp", [-1, 1, 3, 1]], ["tile_x", "sp", [-1, 1, 1, 1]], ["tile_rc", "sp", [-1, 1]], ["tile_rd", "sp", [-1, 4]], ["tile_ry", "sp", [-1, 1]], ["tile_rx", "sp", [-1, 4]], ["auto_unroll_max_step", "ot", 512], ["unroll_explicit", "ot", 0], ["fuse_yx", "ot", 1]]}], "r": [[0.02167705175, 0.02167484825], 0, 1.3025002479553223, 1578521516.51473], "v": 0.1}
{"i": ["cuda", "schedule_conv3d_nchw_cuda", [[24, 1, 64, 64, 64], [24, 1, 64, 64, 64], 1, [1, 1, 1], [1, 1, 1], 1], {}, ["schedule_conv3d_nchw_cuda", [24, 1, 64, 64, 64], [24, 1, 64, 64, 64], 1, [1, 1, 1], [1, 1, 1], 1], {"i": 1445953818, "t": "", "c": null, "e": [["tile_n", "sp", [-1, 1, 1, 4]], ["tile_f", "sp", [-1, 1, 6, 1]], ["tile_d", "sp", [-1, 1, 3, 1]], ["tile_y", "sp", [-1, 1, 3, 1]], ["tile_x", "sp", [-1, 1, 1, 1]], ["tile_rc", "sp", [-1, 1]], ["tile_rd", "sp", [-1, 4]], ["tile_ry", "sp", [-1, 1]], ["tile_rx", "sp", [-1, 4]], ["auto_unroll_max_step", "ot", 512], ["unroll_explicit", "ot", 1], ["fuse_yx", "ot", 1]]}], "r": [[0.022757579, 0.022645513], 0, 1.3833260536193848, 1578521517.3047981], "v": 0.1}
{"i": ["cuda", "schedule_conv3d_nchw_cuda", [[24, 1, 64, 64, 64], [24, 1, 64, 64, 64], 1, [1, 1, 1], [1, 1, 1], 1], {}, ["schedule_conv3d_nchw_cuda", [24, 1, 64, 64, 64], [24, 1, 64, 64, 64], 1, [1, 1, 1], [1, 1, 1], 1], {"i": 993028590, "t": "", "c": null, "e": [["tile_n", "sp", [-1, 1, 1, 2]], ["tile_f", "sp", [-1, 1, 8, 3]], ["tile_d", "sp", [-1, 1, 1, 1]], ["tile_y", "sp", [-1, 1, 3, 1]], ["tile_x", "sp", [-1, 3, 1, 1]], ["tile_rc", "sp", [-1, 1]], ["tile_rd", "sp", [-1, 4]], ["tile_ry", "sp", [-1, 8]], ["tile_rx", "sp", [-1, 1]], ["auto_unroll_max_step", "ot", 512], ["unroll_explicit", "ot", 0], ["fuse_yx", "ot", 1]]}], "r": [[0.047303428, 0.047302774], 0, 1.6751983165740967, 1578521518.4482555], "v": 0.1}
{"i": ["cuda", "schedule_conv3d_nchw_cuda", [[24, 1, 64, 64, 64], [24, 1, 64, 64, 64], 1, [1, 1, 1], [1, 1, 1], 1], {}, ["schedule_conv3d_nchw_cuda", [24, 1, 64, 64, 64], [24, 1, 64, 64, 64], 1, [1, 1, 1], [1, 1, 1], 1], {"i": 850135790, "t": "", "c": null, "e": [["tile_n", "sp", [-1, 1, 1, 2]], ["tile_f", "sp", [-1, 1, 8, 3]], ["tile_d", "sp", [-1, 3, 1, 1]], ["tile_y", "sp", [-1, 1, 1, 1]], ["tile_x", "sp", [-1, 1, 3, 1]], ["tile_rc", "sp", [-1, 1]], ["tile_rd", "sp", [-1, 8]], ["tile_ry", "sp", [-1, 4]], ["tile_rx", "sp", [-1, 1]], ["auto_unroll_max_step", "ot", 0], ["unroll_explicit", "ot", 0], ["fuse_yx", "ot", 1]]}], "r": [[0.02634976675, 0.02635045275], 0, 1.3368761539459229, 1578521519.304629], "v": 0.1}
{"i": ["cuda", "schedule_conv3d_nchw_cuda", [[24, 1, 64, 64, 64], [24, 1, 64, 64, 64], 1, [1, 1, 1], [1, 1, 1], 1], {}, ["schedule_conv3d_nchw_cuda", [24, 1, 64, 64, 64], [24, 1, 64, 64, 64], 1, [1, 1, 1], [1, 1, 1], 1], {"i": 1133521390, "t": "", "c": null, "e": [["tile_n", "sp", [-1, 1, 1, 2]], ["tile_f", "sp", [-1, 1, 8, 3]], ["tile_d", "sp", [-1, 1, 1, 1]], ["tile_y", "sp", [-1, 1, 3, 1]], ["tile_x", "sp", [-1, 3, 1, 1]], ["tile_rc", "sp", [-1, 1]], ["tile_rd", "sp", [-1, 4]], ["tile_ry", "sp", [-1, 8]], ["tile_rx", "sp", [-1, 1]], ["auto_unroll_max_step", "ot", 1500], ["unroll_explicit", "ot", 0], ["fuse_yx", "ot", 1]]}], "r": [[0.02675985475, 0.02675607125], 0, 1.5037884712219238, 1578521520.33764], "v": 0.1}
{"i": ["cuda", "schedule_conv3d_nchw_cuda", [[24, 1, 64, 64, 64], [24, 1, 64, 64, 64], 1, [1, 1, 1], [1, 1, 1], 1], {}, ["schedule_conv3d_nchw_cuda", [24, 1, 64, 64, 64], [24, 1, 64, 64, 64], 1, [1, 1, 1], [1, 1, 1], 1], {"i": 1554999790, "t": "", "c": null, "e": [["tile_n", "sp", [-1, 1, 1, 2]], ["tile_f", "sp", [-1, 1, 8, 3]], ["tile_d", "sp", [-1, 1, 1, 1]], ["tile_y", "sp", [-1, 1, 3, 1]], ["tile_x", "sp", [-1, 3, 1, 1]], ["tile_rc", "sp", [-1, 1]], ["tile_rd", "sp", [-1, 4]], ["tile_ry", "sp", [-1, 8]], ["tile_rx", "sp", [-1, 1]], ["auto_unroll_max_step", "ot", 1500], ["unroll_explicit", "ot", 1], ["fuse_yx", "ot", 1]]}], "r": [[0.04089816975, 0.0376167615], 0, 2.205179452896118, 1578521523.6099641], "v": 0.1}
{"i": ["cuda", "schedule_conv3d_nchw_cuda", [[24, 1, 64, 64, 64], [24, 1, 64, 64, 64], 1, [1, 1, 1], [1, 1, 1], 1], {}, ["schedule_conv3d_nchw_cuda", [24, 1, 64, 64, 64], [24, 1, 64, 64, 64], 1, [1, 1, 1], [1, 1, 1], 1], {"i": 1027436168, "t": "", "c": null, "e": [["tile_n", "sp", [-1, 1, 2, 1]], ["tile_f", "sp", [-1, 1, 4, 6]], ["tile_d", "sp", [-1, 1, 1, 1]], ["tile_y", "sp", [-1, 1, 3, 1]], ["tile_x", "sp", [-1, 3, 1, 1]], ["tile_rc", "sp", [-1, 1]], ["tile_rd", "sp", [-1, 4]], ["tile_ry", "sp", [-1, 2]], ["tile_rx", "sp", [-1, 4]], ["auto_unroll_max_step", "ot", 512], ["unroll_explicit", "ot", 0], ["fuse_yx", "ot", 1]]}], "r": [[0.0268046035, 0.026807065], 0, 1.519756555557251, 1578521524.521827], "v": 0.1}
{"i": ["cuda", "schedule_conv3d_nchw_cuda", [[24, 1, 64, 64, 64], [24, 1, 64, 64, 64], 1, [1, 1, 1], [1, 1, 1], 1], {}, ["schedule_conv3d_nchw_cuda", [24, 1, 64, 64, 64], [24, 1, 64, 64, 64], 1, [1, 1, 1], [1, 1, 1], 1], {"i": 1027512488, "t": "", "c": null, "e": [["tile_n", "sp", [-1, 1, 2, 1]], ["tile_f", "sp", [-1, 1, 6, 4]], ["tile_d", "sp", [-1, 1, 1, 1]], ["tile_y", "sp", [-1, 3, 1, 1]], ["tile_x", "sp", [-1, 1, 3, 1]], ["tile_rc", "sp", [-1, 1]], ["tile_rd", "sp", [-1, 4]], ["tile_ry", "sp", [-1, 2]], ["tile_rx", "sp", [-1, 4]], ["auto_unroll_max_step", "ot", 512], ["unroll_explicit", "ot", 0], ["fuse_yx", "ot", 1]]}], "r": [[0.03232069875, 0.03231602525], 0, 1.7119553089141846, 1578521525.5385473], "v": 0.1}
{"i": ["cuda", "schedule_conv3d_nchw_cuda", [[24, 1, 64, 64, 64], [24, 1, 64, 64, 64], 1, [1, 1, 1], [1, 1, 1], 1], {}, ["schedule_conv3d_nchw_cuda", [24, 1, 64, 64, 64], [24, 1, 64, 64, 64], 1, [1, 1, 1], [1, 1, 1], 1], {"i": 1168030888, "t": "", "c": null, "e": [["tile_n", "sp", [-1, 1, 2, 1]], ["tile_f", "sp", [-1, 1, 6, 4]], ["tile_d", "sp", [-1, 1, 1, 1]], ["tile_y", "sp", [-1, 1, 3, 1]], ["tile_x", "sp", [-1, 1, 3, 1]], ["tile_rc", "sp", [-1, 1]], ["tile_rd", "sp", [-1, 4]], ["tile_ry", "sp", [-1, 2]], ["tile_rx", "sp", [-1, 4]], ["auto_unroll_max_step", "ot", 1500], ["unroll_explicit", "ot", 0], ["fuse_yx", "ot", 1]]}], "r": [[0.01894573375, 0.01898295275], 0, 1.3589990139007568, 1578521526.3555782], "v": 0.1}
{"i": ["cuda", "schedule_conv3d_nchw_cuda", [[24, 1, 64, 64, 64], [24, 1, 64, 64, 64], 1, [1, 1, 1], [1, 1, 1], 1], {}, ["schedule_conv3d_nchw_cuda", [24, 1, 64, 64, 64], [24, 1, 64, 64, 64], 1, [1, 1, 1], [1, 1, 1], 1], {"i": 1027538088, "t": "", "c": null, "e": [["tile_n", "sp", [-1, 1, 2, 1]], ["tile_f", "sp", [-1, 1, 6, 4]], ["tile_d", "sp", [-1, 1, 1, 1]], ["tile_y", "sp", [-1, 1, 3, 1]], ["tile_x", "sp", [-1, 1, 3, 1]], ["tile_rc", "sp", [-1, 1]], ["tile_rd", "sp", [-1, 4]], ["tile_ry", "sp", [-1, 2]], ["tile_rx", "sp", [-1, 4]], ["auto_unroll_max_step", "ot", 512], ["unroll_explicit", "ot", 0], ["fuse_yx", "ot", 1]]}], "r": [[0.01896707, 0.01901168225], 0, 1.4438755512237549, 1578521527.1385205], "v": 0.1}
{"i": ["cuda", "schedule_conv3d_nchw_cuda", [[24, 1, 64, 64, 64], [24, 1, 64, 64, 64], 1, [1, 1, 1], [1, 1, 1], 1], {}, ["schedule_conv3d_nchw_cuda", [24, 1, 64, 64, 64], [24, 1, 64, 64, 64], 1, [1, 1, 1], [1, 1, 1], 1], {"i": 1412106990, "t": "", "c": null, "e": [["tile_n", "sp", [-1, 1, 1, 2]], ["tile_f", "sp", [-1, 1, 8, 3]], ["tile_d", "sp", [-1, 3, 1, 1]], ["tile_y", "sp", [-1, 1, 1, 1]], ["tile_x", "sp", [-1, 1, 3, 1]], ["tile_rc", "sp", [-1, 1]], ["tile_rd", "sp", [-1, 8]], ["tile_ry", "sp", [-1, 4]], ["tile_rx", "sp", [-1, 1]], ["auto_unroll_max_step", "ot", 512], ["unroll_explicit", "ot", 1], ["fuse_yx", "ot", 1]]}], "r": [[0.024145964, 0.02414471825], 0, 1.5942862033843994, 1578521528.0093603], "v": 0.1}
{"i": ["cuda", "schedule_conv3d_nchw_cuda", [[24, 1, 64, 64, 64], [24, 1, 64, 64, 64], 1, [1, 1, 1], [1, 1, 1], 1], {}, ["schedule_conv3d_nchw_cuda", [24, 1, 64, 64, 64], [24, 1, 64, 64, 64], 1, [1, 1, 1], [1, 1, 1], 1], {"i": 1572202990, "t": "", "c": null, "e": [["tile_n", "sp", [-1, 1, 1, 2]], ["tile_f", "sp", [-1, 1, 8, 3]], ["tile_d", "sp", [-1, 1, 1, 1]], ["tile_y", "sp", [-1, 1, 3, 1]], ["tile_x", "sp", [-1, 3, 1, 1]], ["tile_rc", "sp", [-1, 1]], ["tile_rd", "sp", [-1, 4]], ["tile_ry", "sp", [-1, 4]], ["tile_rx", "sp", [-1, 2]], ["auto_unroll_max_step", "ot", 1500], ["unroll_explicit", "ot", 1], ["fuse_yx", "ot", 1]]}], "r": [[0.02872908225, 0.028731077], 0, 2.154893636703491, 1578521528.9882617], "v": 0.1}
{"i": ["cuda", "schedule_conv3d_nchw_cuda", [[24, 1, 64, 64, 64], [24, 1, 64, 64, 64], 1, [1, 1, 1], [1, 1, 1], 1], {}, ["schedule_conv3d_nchw_cuda", [24, 1, 64, 64, 64], [24, 1, 64, 64, 64], 1, [1, 1, 1], [1, 1, 1], 1], {"i": 990628590, "t": "", "c": null, "e": [["tile_n", "sp", [-1, 1, 1, 2]], ["tile_f", "sp", [-1, 1, 8, 3]], ["tile_d", "sp", [-1, 3, 1, 1]], ["tile_y", "sp", [-1, 1, 1, 1]], ["tile_x", "sp", [-1, 1, 3, 1]], ["tile_rc", "sp", [-1, 1]], ["tile_rd", "sp", [-1, 8]], ["tile_ry", "sp", [-1, 4]], ["tile_rx", "sp", [-1, 1]], ["auto_unroll_max_step", "ot", 512], ["unroll_explicit", "ot", 0], ["fuse_yx", "ot", 1]]}], "r": [[0.02527047925, 0.02527618825], 0, 1.5031003952026367, 1578521529.8964431], "v": 0.1}
{"i": ["cuda", "schedule_conv3d_nchw_cuda", [[24, 1, 64, 64, 64], [24, 1, 64, 64, 64], 1, [1, 1, 1], [1, 1, 1], 1], {}, ["schedule_conv3d_nchw_cuda", [24, 1, 64, 64, 64], [24, 1, 64, 64, 64], 1, [1, 1, 1], [1, 1, 1], 1], {"i": 1274014190, "t": "", "c": null, "e": [["tile_n", "sp", [-1, 1, 1, 2]], ["tile_f", "sp", [-1, 1, 8, 3]], ["tile_d", "sp", [-1, 1, 1, 1]], ["tile_y", "sp", [-1, 1, 3, 1]], ["tile_x", "sp", [-1, 3, 1, 1]], ["tile_rc", "sp", [-1, 1]], ["tile_rd", "sp", [-1, 4]], ["tile_ry", "sp", [-1, 8]], ["tile_rx", "sp", [-1, 1]], ["auto_unroll_max_step", "ot", 0], ["unroll_explicit", "ot", 1], ["fuse_yx", "ot", 1]]}], "r": [[0.02243644, 0.02243708325], 0, 1.5634562969207764, 1578521530.7758422], "v": 0.1}
{"i": ["cuda", "schedule_conv3d_nchw_cuda", [[24, 1, 64, 64, 64], [24, 1, 64, 64, 64], 1, [1, 1, 1], [1, 1, 1], 1], {}, ["schedule_conv3d_nchw_cuda", [24, 1, 64, 64, 64], [24, 1, 64, 64, 64], 1, [1, 1, 1], [1, 1, 1], 1], {"i": 1449016968, "t": "", "c": null, "e": [["tile_n", "sp", [-1, 1, 2, 1]], ["tile_f", "sp", [-1, 1, 4, 6]], ["tile_d", "sp", [-1, 1, 1, 1]], ["tile_y", "sp", [-1, 1, 3, 1]], ["tile_x", "sp", [-1, 1, 3, 1]], ["tile_rc", "sp", [-1, 1]], ["tile_rd", "sp", [-1, 4]], ["tile_ry", "sp", [-1, 2]], ["tile_rx", "sp", [-1, 4]], ["auto_unroll_max_step", "ot", 512], ["unroll_explicit", "ot", 1], ["fuse_yx", "ot", 1]]}], "r": [[0.02139275625, 0.021478991], 0, 1.6544249057769775, 1578521531.6346526], "v": 0.1}
{"i": ["cuda", "schedule_conv3d_nchw_cuda", [[24, 1, 64, 64, 64], [24, 1, 64, 64, 64], 1, [1, 1, 1], [1, 1, 1], 1], {}, ["schedule_conv3d_nchw_cuda", [24, 1, 64, 64, 64], [24, 1, 64, 64, 64], 1, [1, 1, 1], [1, 1, 1], 1], {"i": 1412114568, "t": "", "c": null, "e": [["tile_n", "sp", [-1, 1, 2, 1]], ["tile_f", "sp", [-1, 1, 4, 6]], ["tile_d", "sp", [-1, 1, 3, 1]], ["tile_y", "sp", [-1, 1, 1, 1]], ["tile_x", "sp", [-1, 1, 3, 1]], ["tile_rc", "sp", [-1, 1]], ["tile_rd", "sp", [-1, 8]], ["tile_ry", "sp", [-1, 4]], ["tile_rx", "sp", [-1, 1]], ["auto_unroll_max_step", "ot", 512], ["unroll_explicit", "ot", 1], ["fuse_yx", "ot", 1]]}], "r": [[0.02009253075, 0.02002532225], 0, 1.5101697444915771, 1578521532.4596527], "v": 0.1}
{"i": ["cuda", "schedule_conv3d_nchw_cuda", [[24, 1, 64, 64, 64], [24, 1, 64, 64, 64], 1, [1, 1, 1], [1, 1, 1], 1], {}, ["schedule_conv3d_nchw_cuda", [24, 1, 64, 64, 64], [24, 1, 64, 64, 64], 1, [1, 1, 1], [1, 1, 1], 1], {"i": 1414506990, "t": "", "c": null, "e": [["tile_n", "sp", [-1, 1, 1, 2]], ["tile_f", "sp", [-1, 1, 8, 3]], ["tile_d", "sp", [-1, 1, 1, 1]], ["tile_y", "sp", [-1, 1, 3, 1]], ["tile_x", "sp", [-1, 3, 1, 1]], ["tile_rc", "sp", [-1, 1]], ["tile_rd", "sp", [-1, 4]], ["tile_ry", "sp", [-1, 8]], ["tile_rx", "sp", [-1, 1]], ["auto_unroll_max_step", "ot", 512], ["unroll_explicit", "ot", 1], ["fuse_yx", "ot", 1]]}], "r": [[0.039326099, 0.039324849], 0, 1.7873597145080566, 1578521533.4859934], "v": 0.1}
{"i": ["cuda", "schedule_conv3d_nchw_cuda", [[24, 1, 64, 64, 64], [24, 1, 64, 64, 64], 1, [1, 1, 1], [1, 1, 1], 1], {}, ["schedule_conv3d_nchw_cuda", [24, 1, 64, 64, 64], [24, 1, 64, 64, 64], 1, [1, 1, 1], [1, 1, 1], 1], {"i": 1448914568, "t": "", "c": null, "e": [["tile_n", "sp", [-1, 1, 2, 1]], ["tile_f", "sp", [-1, 1, 4, 6]], ["tile_d", "sp", [-1, 1, 1, 1]], ["tile_y", "sp", [-1, 1, 3, 1]], ["tile_x", "sp", [-1, 3, 1, 1]], ["tile_rc", "sp", [-1, 1]], ["tile_rd", "sp", [-1, 4]], ["tile_ry", "sp", [-1, 2]], ["tile_rx", "sp", [-1, 4]], ["auto_unroll_max_step", "ot", 512], ["unroll_explicit", "ot", 1], ["fuse_yx", "ot", 1]]}], "r": [[0.03318312775, 0.03321574525], 0, 1.7291548252105713, 1578521537.2424629], "v": 0.1}
{"i": ["cuda", "schedule_conv3d_nchw_cuda", [[24, 1, 64, 64, 64], [24, 1, 64, 64, 64], 1, [1, 1, 1], [1, 1, 1], 1], {}, ["schedule_conv3d_nchw_cuda", [24, 1, 64, 64, 64], [24, 1, 64, 64, 64], 1, [1, 1, 1], [1, 1, 1], 1], {"i": 990634990, "t": "", "c": null, "e": [["tile_n", "sp", [-1, 1, 1, 2]], ["tile_f", "sp", [-1, 1, 8, 3]], ["tile_d", "sp", [-1, 1, 3, 1]], ["tile_y", "sp", [-1, 1, 1, 1]], ["tile_x", "sp", [-1, 1, 3, 1]], ["tile_rc", "sp", [-1, 1]], ["tile_rd", "sp", [-1, 8]], ["tile_ry", "sp", [-1, 4]], ["tile_rx", "sp", [-1, 1]], ["auto_unroll_max_step", "ot", 512], ["unroll_explicit", "ot", 0], ["fuse_yx", "ot", 1]]}], "r": [[0.01668657975, 0.0166752245], 0, 1.2482106685638428, 1578521538.0250509], "v": 0.1}
{"i": ["cuda", "schedule_conv3d_nchw_cuda", [[24, 1, 64, 64, 64], [24, 1, 64, 64, 64], 1, [1, 1, 1], [1, 1, 1], 1], {}, ["schedule_conv3d_nchw_cuda", [24, 1, 64, 64, 64], [24, 1, 64, 64, 64], 1, [1, 1, 1], [1, 1, 1], 1], {"i": 1168005288, "t": "", "c": null, "e": [["tile_n", "sp", [-1, 1, 2, 1]], ["tile_f", "sp", [-1, 1, 6, 4]], ["tile_d", "sp", [-1, 1, 1, 1]], ["tile_y", "sp", [-1, 3, 1, 1]], ["tile_x", "sp", [-1, 1, 3, 1]], ["tile_rc", "sp", [-1, 1]], ["tile_rd", "sp", [-1, 4]], ["tile_ry", "sp", [-1, 2]], ["tile_rx", "sp", [-1, 4]], ["auto_unroll_max_step", "ot", 1500], ["unroll_explicit", "ot", 0], ["fuse_yx", "ot", 1]]}], "r": [[0.032350342, 0.0323544355], 0, 1.63395094871521, 1578521538.9636803], "v": 0.1}
{"i": ["cuda", "schedule_conv3d_nchw_cuda", [[24, 1, 64, 64, 64], [24, 1, 64, 64, 64], 1, [1, 1, 1], [1, 1, 1], 1], {}, ["schedule_conv3d_nchw_cuda", [24, 1, 64, 64, 64], [24, 1, 64, 64, 64], 1, [1, 1, 1], [1, 1, 1], 1], {"i": 906512014, "t": "", "c": null, "e": [["tile_n", "sp", [-1, 1, 3, 1]], ["tile_f", "sp", [-1, 1, 3, 2]], ["tile_d", "sp", [-1, 1, 3, 1]], ["tile_y", "sp", [-1, 1, 3, 1]], ["tile_x", "sp", [-1, 1, 1, 1]], ["tile_rc", "sp", [-1, 1]], ["tile_rd", "sp", [-1, 2]], ["tile_ry", "sp", [-1, 2]], ["tile_rx", "sp", [-1, 8]], ["auto_unroll_max_step", "ot", 0], ["unroll_explicit", "ot", 0], ["fuse_yx", "ot", 1]]}], "r": [[0.0158408575, 0.015674345], 0, 1.6550142765045166, 1578521540.0132127], "v": 0.1}
{"i": ["cuda", "schedule_conv3d_nchw_cuda", [[24, 1, 64, 64, 64], [24, 1, 64, 64, 64], 1, [1, 1, 1], [1, 1, 1], 1], {}, ["schedule_conv3d_nchw_cuda", [24, 1, 64, 64, 64], [24, 1, 64, 64, 64], 1, [1, 1, 1], [1, 1, 1], 1], {"i": 1204700814, "t": "", "c": null, "e": [["tile_n", "sp", [-1, 1, 3, 1]], ["tile_f", "sp", [-1, 1, 3, 2]], ["tile_d", "sp", [-1, 1, 3, 1]], ["tile_y", "sp", [-1, 1, 3, 1]], ["tile_x", "sp", [-1, 1, 1, 1]], ["tile_rc", "sp", [-1, 1]], ["tile_rd", "sp", [-1, 2]], ["tile_ry", "sp", [-1, 1]], ["tile_rx", "sp", [-1, 16]], ["auto_unroll_max_step", "ot", 1500], ["unroll_explicit", "ot", 0], ["fuse_yx", "ot", 1]]}], "r": [[0.01777415, 0.017788106], 0, 1.3738105297088623, 1578521540.7875013], "v": 0.1}
{"i": ["cuda", "schedule_conv3d_nchw_cuda", [[24, 1, 64, 64, 64], [24, 1, 64, 64, 64], 1, [1, 1, 1], [1, 1, 1], 1], {}, ["schedule_conv3d_nchw_cuda", [24, 1, 64, 64, 64], [24, 1, 64, 64, 64], 1, [1, 1, 1], [1, 1, 1], 1], {"i": 992721938, "t": "", "c": null, "e": [["tile_n", "sp", [-1, 1, 4, 1]], ["tile_f", "sp", [-1, 1, 3, 4]], ["tile_d", "sp", [-1, 1, 1, 1]], ["tile_y", "sp", [-1, 1, 3, 1]], ["tile_x", "sp", [-1, 1, 3, 1]], ["tile_rc", "sp", [-1, 1]], ["tile_rd", "sp", [-1, 2]], ["tile_ry", "sp", [-1, 8]], ["tile_rx", "sp", [-1, 1]], ["auto_unroll_max_step", "ot", 512], ["unroll_explicit", "ot", 0], ["fuse_yx", "ot", 1]]}], "r": [[0.027976415, 0.02792852825], 0, 1.5538339614868164, 1578521541.7324636], "v": 0.1}
{"i": ["cuda", "schedule_conv3d_nchw_cuda", [[24, 1, 64, 64, 64], [24, 1, 64, 64, 64], 1, [1, 1, 1], [1, 1, 1], 1], {}, ["schedule_conv3d_nchw_cuda", [24, 1, 64, 64, 64], [24, 1, 64, 64, 64], 1, [1, 1, 1], [1, 1, 1], 1], {"i": 1611625614, "t": "", "c": null, "e": [["tile_n", "sp", [-1, 1, 3, 1]], ["tile_f", "sp", [-1, 1, 3, 2]], ["tile_d", "sp", [-1, 1, 1, 1]], ["tile_y", "sp", [-1, 1, 3, 1]], ["tile_x", "sp", [-1, 1, 3, 1]], ["tile_rc", "sp", [-1, 1]], ["tile_rd", "sp", [-1, 1]], ["tile_ry", "sp", [-1, 4]], ["tile_rx", "sp", [-1, 8]], ["auto_unroll_max_step", "ot", 1500], ["unroll_explicit", "ot", 1], ["fuse_yx", "ot", 1]]}], "r": [[0.011426177, 0.01136844], 0, 2.8664488792419434, 1578521542.776855], "v": 0.1}
{"i": ["cuda", "schedule_conv3d_nchw_cuda", [[24, 1, 64, 64, 64], [24, 1, 64, 64, 64], 1, [1, 1, 1], [1, 1, 1], 1], {}, ["schedule_conv3d_nchw_cuda", [24, 1, 64, 64, 64], [24, 1, 64, 64, 64], 1, [1, 1, 1], [1, 1, 1], 1], {"i": 1273707538, "t": "", "c": null, "e": [["tile_n", "sp", [-1, 1, 4, 1]], ["tile_f", "sp", [-1, 1, 3, 4]], ["tile_d", "sp", [-1, 1, 1, 1]], ["tile_y", "sp", [-1, 1, 3, 1]], ["tile_x", "sp", [-1, 1, 3, 1]], ["tile_rc", "sp", [-1, 1]], ["tile_rd", "sp", [-1, 2]], ["tile_ry", "sp", [-1, 8]], ["tile_rx", "sp", [-1, 1]], ["auto_unroll_max_step", "ot", 0], ["unroll_explicit", "ot", 1], ["fuse_yx", "ot", 1]]}], "r": [[0.0273821575, 0.0273747835], 0, 1.5203278064727783, 1578521543.7084568], "v": 0.1}
{"i": ["cuda", "schedule_conv3d_nchw_cuda", [[24, 1, 64, 64, 64], [24, 1, 64, 64, 64], 1, [1, 1, 1], [1, 1, 1], 1], {}, ["schedule_conv3d_nchw_cuda", [24, 1, 64, 64, 64], [24, 1, 64, 64, 64], 1, [1, 1, 1], [1, 1, 1], 1], {"i": 1133214738, "t": "", "c": null, "e": [["tile_n", "sp", [-1, 1, 4, 1]], ["tile_f", "sp", [-1, 1, 3, 4]], ["tile_d", "sp", [-1, 1, 1, 1]], ["tile_y", "sp", [-1, 1, 3, 1]], ["tile_x", "sp", [-1, 1, 3, 1]], ["tile_rc", "sp", [-1, 1]], ["tile_rd", "sp", [-1, 2]], ["tile_ry", "sp", [-1, 8]], ["tile_rx", "sp", [-1, 1]], ["auto_unroll_max_step", "ot", 1500], ["unroll_explicit", "ot", 0], ["fuse_yx", "ot", 1]]}], "r": [[0.02379847075, 0.023813332], 0, 1.7918071746826172, 1578521544.7072039], "v": 0.1}
{"i": ["cuda", "schedule_conv3d_nchw_cuda", [[24, 1, 64, 64, 64], [24, 1, 64, 64, 64], 1, [1, 1, 1], [1, 1, 1], 1], {}, ["schedule_conv3d_nchw_cuda", [24, 1, 64, 64, 64], [24, 1, 64, 64, 64], 1, [1, 1, 1], [1, 1, 1], 1], {"i": 1047004814, "t": "", "c": null, "e": [["tile_n", "sp", [-1, 1, 3, 1]], ["tile_f", "sp", [-1, 1, 3, 2]], ["tile_d", "sp", [-1, 1, 3, 1]], ["tile_y", "sp", [-1, 1, 3, 1]], ["tile_x", "sp", [-1, 1, 1, 1]], ["tile_rc", "sp", [-1, 1]], ["tile_rd", "sp", [-1, 2]], ["tile_ry", "sp", [-1, 2]], ["tile_rx", "sp", [-1, 8]], ["auto_unroll_max_step", "ot", 512], ["unroll_explicit", "ot", 0], ["fuse_yx", "ot", 1]]}], "r": [[0.01582410025, 0.0157009625], 0, 1.586735486984253, 1578521545.7067738], "v": 0.1}
{"i": ["cuda", "schedule_conv3d_nchw_cuda", [[24, 1, 64, 64, 64], [24, 1, 64, 64, 64], 1, [1, 1, 1], [1, 1, 1], 1], {}, ["schedule_conv3d_nchw_cuda", [24, 1, 64, 64, 64], [24, 1, 64, 64, 64], 1, [1, 1, 1], [1, 1, 1], 1], {"i": 1330640014, "t": "", "c": null, "e": [["tile_n", "sp", [-1, 1, 3, 1]], ["tile_f", "sp", [-1, 1, 3, 2]], ["tile_d", "sp", [-1, 1, 1, 1]], ["tile_y", "sp", [-1, 1, 3, 1]], ["tile_x", "sp", [-1, 1, 3, 1]], ["tile_rc", "sp", [-1, 1]], ["tile_rd", "sp", [-1, 1]], ["tile_ry", "sp", [-1, 4]], ["tile_rx", "sp", [-1, 8]], ["auto_unroll_max_step", "ot", 0], ["unroll_explicit", "ot", 1], ["fuse_yx", "ot", 1]]}], "r": [[0.0137399025, 0.01378282725], 0, 1.3665437698364258, 1578521546.55848], "v": 0.1}
{"i": ["cuda", "schedule_conv3d_nchw_cuda", [[24, 1, 64, 64, 64], [24, 1, 64, 64, 64], 1, [1, 1, 1], [1, 1, 1], 1], {}, ["schedule_conv3d_nchw_cuda", [24, 1, 64, 64, 64], [24, 1, 64, 64, 64], 1, [1, 1, 1], [1, 1, 1], 1], {"i": 1414200338, "t": "", "c": null, "e": [["tile_n", "sp", [-1, 1, 4, 1]], ["tile_f", "sp", [-1, 1, 3, 4]], ["tile_d", "sp", [-1, 1, 1, 1]], ["tile_y", "sp", [-1, 1, 3, 1]], ["tile_x", "sp", [-1, 1, 3, 1]], ["tile_rc", "sp", [-1, 1]], ["tile_rd", "sp", [-1, 2]], ["tile_ry", "sp", [-1, 8]], ["tile_rx", "sp", [-1, 1]], ["auto_unroll_max_step", "ot", 512], ["unroll_explicit", "ot", 1], ["fuse_yx", "ot", 1]]}], "r": [[0.02574623975, 0.0257244635], 0, 1.3812408447265625, 1578521547.4655585], "v": 0.1}
{"i": ["cuda", "schedule_conv3d_nchw_cuda", [[24, 1, 64, 64, 64], [24, 1, 64, 64, 64], 1, [1, 1, 1], [1, 1, 1], 1], {}, ["schedule_conv3d_nchw_cuda", [24, 1, 64, 64, 64], [24, 1, 64, 64, 64], 1, [1, 1, 1], [1, 1, 1], 1], {"i": 1049654808, "t": "", "c": null, "e": [["tile_n", "sp", [-1, 1, 2, 1]], ["tile_f", "sp", [-1, 1, 6, 2]], ["tile_d", "sp", [-1, 1, 1, 1]], ["tile_y", "sp", [-1, 1, 3, 1]], ["tile_x", "sp", [-1, 1, 3, 1]], ["tile_rc", "sp", [-1, 1]], ["tile_rd", "sp", [-1, 1]], ["tile_ry", "sp", [-1, 4]], ["tile_rx", "sp", [-1, 8]], ["auto_unroll_max_step", "ot", 512], ["unroll_explicit", "ot", 0], ["fuse_yx", "ot", 1]]}], "r": [[0.01660751675, 0.016363789], 0, 1.333526849746704, 1578521788.9958818], "v": 0.1}
{"i": ["cuda", "schedule_conv3d_nchw_cuda", [[24, 1, 64, 64, 64], [24, 1, 64, 64, 64], 1, [1, 1, 1], [1, 1, 1], 1], {}, ["schedule_conv3d_nchw_cuda", [24, 1, 64, 64, 64], [24, 1, 64, 64, 64], 1, [1, 1, 1], [1, 1, 1], 1], {"i": 1066858814, "t": "", "c": null, "e": [["tile_n", "sp", [-1, 1, 3, 1]], ["tile_f", "sp", [-1, 1, 4, 3]], ["tile_d", "sp", [-1, 1, 1, 1]], ["tile_y", "sp", [-1, 1, 3, 1]], ["tile_x", "sp", [-1, 1, 3, 1]], ["tile_rc", "sp", [-1, 1]], ["tile_rd", "sp", [-1, 1]], ["tile_ry", "sp", [-1, 2]], ["tile_rx", "sp", [-1, 16]], ["auto_unroll_max_step", "ot", 512], ["unroll_explicit", "ot", 0], ["fuse_yx", "ot", 1]]}], "r": [[0.0149905125, 0.01504257225], 0, 1.2153220176696777, 1578521789.7619357], "v": 0.1}
{"i": ["cuda", "schedule_conv3d_nchw_cuda", [[24, 1, 64, 64, 64], [24, 1, 64, 64, 64], 1, [1, 1, 1], [1, 1, 1], 1], {}, ["schedule_conv3d_nchw_cuda", [24, 1, 64, 64, 64], [24, 1, 64, 64, 64], 1, [1, 1, 1], [1, 1, 1], 1], {"i": 1029994008, "t": "", "c": null, "e": [["tile_n", "sp", [-1, 1, 2, 1]], ["tile_f", "sp", [-1, 1, 6, 2]], ["tile_d", "sp", [-1, 1, 1, 1]], ["tile_y", "sp", [-1, 1, 3, 1]], ["tile_x", "sp", [-1, 1, 3, 1]], ["tile_rc", "sp", [-1, 1]], ["tile_rd", "sp", [-1, 2]], ["tile_ry", "sp", [-1, 4]], ["tile_rx", "sp", [-1, 4]], ["auto_unroll_max_step", "ot", 512], ["unroll_explicit", "ot", 0], ["fuse_yx", "ot", 1]]}], "r": [[0.0143953305, 0.01438131275], 0, 1.4259209632873535, 1578521790.62973], "v": 0.1}
{"i": ["cuda", "schedule_conv3d_nchw_cuda", [[24, 1, 64, 64, 64], [24, 1, 64, 64, 64], 1, [1, 1, 1], [1, 1, 1], 1], {}, ["schedule_conv3d_nchw_cuda", [24, 1, 64, 64, 64], [24, 1, 64, 64, 64], 1, [1, 1, 1], [1, 1, 1], 1], {"i": 1448606014, "t": "", "c": null, "e": [["tile_n", "sp", [-1, 1, 3, 1]], ["tile_f", "sp", [-1, 1, 4, 3]], ["tile_d", "sp", [-1, 1, 1, 1]], ["tile_y", "sp", [-1, 1, 3, 1]], ["tile_x", "sp", [-1, 1, 3, 1]], ["tile_rc", "sp", [-1, 1]], ["tile_rd", "sp", [-1, 2]], ["tile_ry", "sp", [-1, 2]], ["tile_rx", "sp", [-1, 4]], ["auto_unroll_max_step", "ot", 512], ["unroll_explicit", "ot", 1], ["fuse_yx", "ot", 1]]}], "r": [[0.010825243, 0.01081932825], 0, 1.4366083145141602, 1578521791.4671466], "v": 0.1}
{"i": ["cuda", "schedule_conv3d_nchw_cuda", [[24, 1, 64, 64, 64], [24, 1, 64, 64, 64], 1, [1, 1, 1], [1, 1, 1], 1], {}, ["schedule_conv3d_nchw_cuda", [24, 1, 64, 64, 64], [24, 1, 64, 64, 64], 1, [1, 1, 1], [1, 1, 1], 1], {"i": 1084061208, "t": "", "c": null, "e": [["tile_n", "sp", [-1, 1, 2, 1]], ["tile_f", "sp", [-1, 1, 6, 2]], ["tile_d", "sp", [-1, 1, 1, 1]], ["tile_y", "sp", [-1, 1, 3, 1]], ["tile_x", "sp", [-1, 1, 3, 1]], ["tile_rc", "sp", [-1, 1]], ["tile_rd", "sp", [-1, 1]], ["tile_ry", "sp", [-1, 1]], ["tile_rx", "sp", [-1, 32]], ["auto_unroll_max_step", "ot", 512], ["unroll_explicit", "ot", 0], ["fuse_yx", "ot", 1]]}], "r": [[0.01211677325, 0.01211936975], 0, 1.3317036628723145, 1578521792.240284], "v": 0.1}
{"i": ["cuda", "schedule_conv3d_nchw_cuda", [[24, 1, 64, 64, 64], [24, 1, 64, 64, 64], 1, [1, 1, 1], [1, 1, 1], 1], {}, ["schedule_conv3d_nchw_cuda", [24, 1, 64, 64, 64], [24, 1, 64, 64, 64], 1, [1, 1, 1], [1, 1, 1], 1], {"i": 1046788414, "t": "", "c": null, "e": [["tile_n", "sp", [-1, 1, 3, 1]], ["tile_f", "sp", [-1, 1, 4, 3]], ["tile_d", "sp", [-1, 1, 1, 1]], ["tile_y", "sp", [-1, 1, 3, 1]], ["tile_x", "sp", [-1, 1, 3, 1]], ["tile_rc", "sp", [-1, 1]], ["tile_rd", "sp", [-1, 1]], ["tile_ry", "sp", [-1, 2]], ["tile_rx", "sp", [-1, 8]], ["auto_unroll_max_step", "ot", 512], ["unroll_explicit", "ot", 0], ["fuse_yx", "ot", 1]]}], "r": [[0.01266847325, 0.0126733735], 0, 1.410851240158081, 1578521793.1342535], "v": 0.1}
{"i": ["cuda", "schedule_conv3d_nchw_cuda", [[24, 1, 64, 64, 64], [24, 1, 64, 64, 64], 1, [1, 1, 1], [1, 1, 1], 1], {}, ["schedule_conv3d_nchw_cuda", [24, 1, 64, 64, 64], [24, 1, 64, 64, 64], 1, [1, 1, 1], [1, 1, 1], 1], {"i": 889501208, "t": "", "c": null, "e": [["tile_n", "sp", [-1, 1, 2, 1]], ["tile_f", "sp", [-1, 1, 6, 2]], ["tile_d", "sp", [-1, 1, 1, 1]], ["tile_y", "sp", [-1, 1, 3, 1]], ["tile_x", "sp", [-1, 1, 3, 1]], ["tile_rc", "sp", [-1, 1]], ["tile_rd", "sp", [-1, 2]], ["tile_ry", "sp", [-1, 4]], ["tile_rx", "sp", [-1, 4]], ["auto_unroll_max_step", "ot", 0], ["unroll_explicit", "ot", 0], ["fuse_yx", "ot", 1]]}], "r": [[0.0137120115, 0.01372610575], 0, 1.5019421577453613, 1578521794.0141857], "v": 0.1}
{"i": ["cuda", "schedule_conv3d_nchw_cuda", [[24, 1, 64, 64, 64], [24, 1, 64, 64, 64], 1, [1, 1, 1], [1, 1, 1], 1], {}, ["schedule_conv3d_nchw_cuda", [24, 1, 64, 64, 64], [24, 1, 64, 64, 64], 1, [1, 1, 1], [1, 1, 1], 1], {"i": 1451472408, "t": "", "c": null, "e": [["tile_n", "sp", [-1, 1, 2, 1]], ["tile_f", "sp", [-1, 1, 6, 2]], ["tile_d", "sp", [-1, 1, 1, 1]], ["tile_y", "sp", [-1, 1, 3, 1]], ["tile_x", "sp", [-1, 1, 3, 1]], ["tile_rc", "sp", [-1, 1]], ["tile_rd", "sp", [-1, 2]], ["tile_ry", "sp", [-1, 4]], ["tile_rx", "sp", [-1, 4]], ["auto_unroll_max_step", "ot", 512], ["unroll_explicit", "ot", 1], ["fuse_yx", "ot", 1]]}], "r": [[0.01149393125, 0.01146498425], 0, 1.4450960159301758, 1578521794.8338616], "v": 0.1}
{"i": ["cuda", "schedule_conv3d_nchw_cuda", [[24, 1, 64, 64, 64], [24, 1, 64, 64, 64], 1, [1, 1, 1], [1, 1, 1], 1], {}, ["schedule_conv3d_nchw_cuda", [24, 1, 64, 64, 64], [24, 1, 64, 64, 64], 1, [1, 1, 1], [1, 1, 1], 1], {"i": 1027127614, "t": "", "c": null, "e": [["tile_n", "sp", [-1, 1, 3, 1]], ["tile_f", "sp", [-1, 1, 4, 3]], ["tile_d", "sp", [-1, 1, 1, 1]], ["tile_y", "sp", [-1, 1, 3, 1]], ["tile_x", "sp", [-1, 1, 3, 1]], ["tile_rc", "sp", [-1, 1]], ["tile_rd", "sp", [-1, 2]], ["tile_ry", "sp", [-1, 2]], ["tile_rx", "sp", [-1, 4]], ["auto_unroll_max_step", "ot", 512], ["unroll_explicit", "ot", 0], ["fuse_yx", "ot", 1]]}], "r": [[0.01252678975, 0.01252589975], 0, 1.3915185928344727, 1578521795.6803913], "v": 0.1}
{"i": ["cuda", "schedule_conv3d_nchw_cuda", [[24, 1, 64, 64, 64], [24, 1, 64, 64, 64], 1, [1, 1, 1], [1, 1, 1], 1], {}, ["schedule_conv3d_nchw_cuda", [24, 1, 64, 64, 64], [24, 1, 64, 64, 64], 1, [1, 1, 1], [1, 1, 1], 1], {"i": 1451433854, "t": "", "c": null, "e": [["tile_n", "sp", [-1, 1, 3, 1]], ["tile_f", "sp", [-1, 1, 4, 2]], ["tile_d", "sp", [-1, 1, 3, 1]], ["tile_y", "sp", [-1, 1, 1, 1]], ["tile_x", "sp", [-1, 1, 3, 1]], ["tile_rc", "sp", [-1, 1]], ["tile_rd", "sp", [-1, 2]], ["tile_ry", "sp", [-1, 4]], ["tile_rx", "sp", [-1, 4]], ["auto_unroll_max_step", "ot", 512], ["unroll_explicit", "ot", 1], ["fuse_yx", "ot", 1]]}], "r": [[0.01430669025, 0.01429952775], 0, 1.437265157699585, 1578521796.5686986], "v": 0.1}
{"i": ["cuda", "schedule_conv3d_nchw_cuda", [[24, 1, 64, 64, 64], [24, 1, 64, 64, 64], 1, [1, 1, 1], [1, 1, 1], 1], {}, ["schedule_conv3d_nchw_cuda", [24, 1, 64, 64, 64], [24, 1, 64, 64, 64], 1, [1, 1, 1], [1, 1, 1], 1], {"i": 1063990808, "t": "", "c": null, "e": [["tile_n", "sp", [-1, 1, 2, 1]], ["tile_f", "sp", [-1, 1, 6, 2]], ["tile_d", "sp", [-1, 1, 1, 1]], ["tile_y", "sp", [-1, 1, 3, 1]], ["tile_x", "sp", [-1, 1, 3, 1]], ["tile_rc", "sp", [-1, 1]], ["tile_rd", "sp", [-1, 1]], ["tile_ry", "sp", [-1, 1]], ["tile_rx", "sp", [-1, 16]], ["auto_unroll_max_step", "ot", 512], ["unroll_explicit", "ot", 0], ["fuse_yx", "ot", 1]]}], "r": [[0.00911027575, 0.00909877], 0, 1.500157356262207, 1578521797.581421], "v": 0.1}
{"i": ["cuda", "schedule_conv3d_nchw_cuda", [[24, 1, 64, 64, 64], [24, 1, 64, 64, 64], 1, [1, 1, 1], [1, 1, 1], 1], {}, ["schedule_conv3d_nchw_cuda", [24, 1, 64, 64, 64], [24, 1, 64, 64, 64], 1, [1, 1, 1], [1, 1, 1], 1], {"i": 1046787608, "t": "", "c": null, "e": [["tile_n", "sp", [-1, 1, 2, 1]], ["tile_f", "sp", [-1, 1, 6, 2]], ["tile_d", "sp", [-1, 1, 1, 1]], ["tile_y", "sp", [-1, 1, 3, 1]], ["tile_x", "sp", [-1, 1, 3, 1]], ["tile_rc", "sp", [-1, 1]], ["tile_rd", "sp", [-1, 1]], ["tile_ry", "sp", [-1, 2]], ["tile_rx", "sp", [-1, 8]], ["auto_unroll_max_step", "ot", 512], ["unroll_explicit", "ot", 0], ["fuse_yx", "ot", 1]]}], "r": [[0.01415995175, 0.0141585695], 0, 1.2168960571289062, 1578521798.4084725], "v": 0.1}
{"i": ["cuda", "schedule_conv3d_nchw_cuda", [[24, 1, 64, 64, 64], [24, 1, 64, 64, 64], 1, [1, 1, 1], [1, 1, 1], 1], {}, ["schedule_conv3d_nchw_cuda", [24, 1, 64, 64, 64], [24, 1, 64, 64, 64], 1, [1, 1, 1], [1, 1, 1], 1], {"i": 926366014, "t": "", "c": null, "e": [["tile_n", "sp", [-1, 1, 3, 1]], ["tile_f", "sp", [-1, 1, 4, 3]], ["tile_d", "sp", [-1, 1, 1, 1]], ["tile_y", "sp", [-1, 1, 3, 1]], ["tile_x", "sp", [-1, 1, 3, 1]], ["tile_rc", "sp", [-1, 1]], ["tile_rd", "sp", [-1, 1]], ["tile_ry", "sp", [-1, 2]], ["tile_rx", "sp", [-1, 16]], ["auto_unroll_max_step", "ot", 0], ["unroll_explicit", "ot", 0], ["fuse_yx", "ot", 1]]}], "r": [[0.011791006, 0.01168872125], 0, 1.0828070640563965, 1578521801.1402028], "v": 0.1}
{"i": ["cuda", "schedule_conv3d_nchw_cuda", [[24, 1, 64, 64, 64], [24, 1, 64, 64, 64], 1, [1, 1, 1], [1, 1, 1], 1], {}, ["schedule_conv3d_nchw_cuda", [24, 1, 64, 64, 64], [24, 1, 64, 64, 64], 1, [1, 1, 1], [1, 1, 1], 1], {"i": 1471133208, "t": "", "c": null, "e": [["tile_n", "sp", [-1, 1, 2, 1]], ["tile_f", "sp", [-1, 1, 6, 2]], ["tile_d", "sp", [-1, 1, 1, 1]], ["tile_y", "sp", [-1, 1, 3, 1]], ["tile_x", "sp", [-1, 1, 3, 1]], ["tile_rc", "sp", [-1, 1]], ["tile_rd", "sp", [-1, 1]], ["tile_ry", "sp", [-1, 4]], ["tile_rx", "sp", [-1, 8]], ["auto_unroll_max_step", "ot", 512], ["unroll_explicit", "ot", 1], ["fuse_yx", "ot", 1]]}], "r": [[0.01120334875, 0.01126148675], 0, 1.3986096382141113, 1578521801.9552448], "v": 0.1}
{"i": ["cuda", "schedule_conv3d_nchw_cuda", [[24, 1, 64, 64, 64], [24, 1, 64, 64, 64], 1, [1, 1, 1], [1, 1, 1], 1], {}, ["schedule_conv3d_nchw_cuda", [24, 1, 64, 64, 64], [24, 1, 64, 64, 64], 1, [1, 1, 1], [1, 1, 1], 1], {"i": 1488337214, "t": "", "c": null, "e": [["tile_n", "sp", [-1, 1, 3, 1]], ["tile_f", "sp", [-1, 1, 4, 3]], ["tile_d", "sp", [-1, 1, 1, 1]], ["tile_y", "sp", [-1, 1, 3, 1]], ["tile_x", "sp", [-1, 1, 3, 1]], ["tile_rc", "sp", [-1, 1]], ["tile_rd", "sp", [-1, 1]], ["tile_ry", "sp", [-1, 2]], ["tile_rx", "sp", [-1, 16]], ["auto_unroll_max_step", "ot", 512], ["unroll_explicit", "ot", 1], ["fuse_yx", "ot", 1]]}], "r": [[0.01266451875, 0.01237058875], 0, 1.3152267932891846, 1578521802.7143457], "v": 0.1}
