auto_log/((1, 1, 64, 128, 128), (24, 1, 1, 5, 5), (1, 24, 64, 64, 64), (1, 2, 2), (0, 2, 2), 1, 1, None)_bwd_inp_grad.log
{"i": ["cuda", "schedule_conv3d_transpose_nchw_cuda", [[1, 24, 64, 64, 64], [24, 1, 1, 5, 5], [1, 2, 2], [0, 2, 2], [0, 1, 1], "float32"], {}, ["schedule_conv3d_transpose_nchw_cuda", [1, 24, 64, 64, 64], [24, 1, 1, 5, 5], [1, 2, 2], [0, 2, 2], [0, 1, 1], "float32"], {"i": 373929913, "t": "", "c": null, "e": [["tile_f", "sp", [-1, 1, 1, 1]], ["tile_d", "sp", [-1, 1, 1, 4]], ["tile_y", "sp", [-1, 1, 16, 1]], ["tile_x", "sp", [-1, 2, 4, 1]], ["tile_rc", "sp", [-1, 8]], ["tile_rd", "sp", [-1, 1]], ["tile_ry", "sp", [-1, 5]], ["tile_rx", "sp", [-1, 5]], ["auto_unroll_max_step", "ot", 512], ["unroll_explicit", "ot", 1]]}], "r": [[0.0006482805, 0.00064662075], 0, 1.4697177410125732, 1578492096.214028], "v": 0.1}
{"i": ["cuda", "schedule_conv3d_transpose_nchw_cuda", [[1, 24, 64, 64, 64], [24, 1, 1, 5, 5], [1, 2, 2], [0, 2, 2], [0, 1, 1], "float32"], {}, ["schedule_conv3d_transpose_nchw_cuda", [1, 24, 64, 64, 64], [24, 1, 1, 5, 5], [1, 2, 2], [0, 2, 2], [0, 1, 1], "float32"], {"i": 144809393, "t": "", "c": null, "e": [["tile_f", "sp", [-1, 1, 1, 1]], ["tile_d", "sp", [-1, 2, 1, 2]], ["tile_y", "sp", [-1, 2, 1, 1]], ["tile_x", "sp", [-1, 2, 1, 8]], ["tile_rc", "sp", [-1, 24]], ["tile_rd", "sp", [-1, 1]], ["tile_ry", "sp", [-1, 5]], ["tile_rx", "sp", [-1, 5]], ["auto_unroll_max_step", "ot", 512], ["unroll_explicit", "ot", 0]]}], "r": [[0.058789382, 0.051644381], 0, 1.8713924884796143, 1578492148.4223597], "v": 0.1}
{"i": ["cuda", "schedule_conv3d_transpose_nchw_cuda", [[1, 24, 64, 64, 64], [24, 1, 1, 5, 5], [1, 2, 2], [0, 2, 2], [0, 1, 1], "float32"], {}, ["schedule_conv3d_transpose_nchw_cuda", [1, 24, 64, 64, 64], [24, 1, 1, 5, 5], [1, 2, 2], [0, 2, 2], [0, 1, 1], "float32"], {"i": 66538501, "t": "", "c": null, "e": [["tile_f", "sp", [-1, 1, 1, 1]], ["tile_d", "sp", [-1, 2, 1, 1]], ["tile_y", "sp", [-1, 32, 1, 1]], ["tile_x", "sp", [-1, 2, 1, 1]], ["tile_rc", "sp", [-1, 24]], ["tile_rd", "sp", [-1, 1]], ["tile_ry", "sp", [-1, 5]], ["tile_rx", "sp", [-1, 5]], ["auto_unroll_max_step", "ot", 0], ["unroll_explicit", "ot", 0]]}], "r": [[0.060893874, 0.054043099], 0, 1.9520399570465088, 1578492212.2371411], "v": 0.1}
{"i": ["cuda", "schedule_conv3d_transpose_nchw_cuda", [[1, 24, 64, 64, 64], [24, 1, 1, 5, 5], [1, 2, 2], [0, 2, 2], [0, 1, 1], "float32"], {}, ["schedule_conv3d_transpose_nchw_cuda", [1, 24, 64, 64, 64], [24, 1, 1, 5, 5], [1, 2, 2], [0, 2, 2], [0, 1, 1], "float32"], {"i": 64260787, "t": "", "c": null, "e": [["tile_f", "sp", [-1, 1, 1, 1]], ["tile_d", "sp", [-1, 8, 1, 2]], ["tile_y", "sp", [-1, 2, 2, 1]], ["tile_x", "sp", [-1, 1, 4, 1]], ["tile_rc", "sp", [-1, 8]], ["tile_rd", "sp", [-1, 1]], ["tile_ry", "sp", [-1, 5]], ["tile_rx", "sp", [-1, 5]], ["auto_unroll_max_step", "ot", 0], ["unroll_explicit", "ot", 0]]}], "r": [[0.00376237925, 0.0037566145], 0, 1.0220887660980225, 1578492212.932483], "v": 0.1}
{"i": ["cuda", "schedule_conv3d_transpose_nchw_cuda", [[1, 24, 64, 64, 64], [24, 1, 1, 5, 5], [1, 2, 2], [0, 2, 2], [0, 1, 1], "float32"], {}, ["schedule_conv3d_transpose_nchw_cuda", [1, 24, 64, 64, 64], [24, 1, 1, 5, 5], [1, 2, 2], [0, 2, 2], [0, 1, 1], "float32"], {"i": 66977428, "t": "", "c": null, "e": [["tile_f", "sp", [-1, 1, 1, 1]], ["tile_d", "sp", [-1, 1, 1, 2]], ["tile_y", "sp", [-1, 1, 2, 4]], ["tile_x", "sp", [-1, 2, 2, 2]], ["tile_rc", "sp", [-1, 24]], ["tile_rd", "sp", [-1, 1]], ["tile_ry", "sp", [-1, 5]], ["tile_rx", "sp", [-1, 5]], ["auto_unroll_max_step", "ot", 0], ["unroll_explicit", "ot", 0]]}], "r": [[0.010218509, 0.010221563], 0, 0.9512567520141602, 1578492213.5952735], "v": 0.1}
{"i": ["cuda", "schedule_conv3d_transpose_nchw_cuda", [[1, 24, 64, 64, 64], [24, 1, 1, 5, 5], [1, 2, 2], [0, 2, 2], [0, 1, 1], "float32"], {}, ["schedule_conv3d_transpose_nchw_cuda", [1, 24, 64, 64, 64], [24, 1, 1, 5, 5], [1, 2, 2], [0, 2, 2], [0, 1, 1], "float32"], {"i": 66965668, "t": "", "c": null, "e": [["tile_f", "sp", [-1, 1, 1, 1]], ["tile_d", "sp", [-1, 1, 1, 2]], ["tile_y", "sp", [-1, 2, 4, 2]], ["tile_x", "sp", [-1, 1, 2, 2]], ["tile_rc", "sp", [-1, 24]], ["tile_rd", "sp", [-1, 1]], ["tile_ry", "sp", [-1, 5]], ["tile_rx", "sp", [-1, 5]], ["auto_unroll_max_step", "ot", 0], ["unroll_explicit", "ot", 0]]}], "r": [[0.002039552, 0.00203630375], 0, 0.8840997219085693, 1578492214.172894], "v": 0.1}
{"i": ["cuda", "schedule_conv3d_transpose_nchw_cuda", [[1, 24, 64, 64, 64], [24, 1, 1, 5, 5], [1, 2, 2], [0, 2, 2], [0, 1, 1], "float32"], {}, ["schedule_conv3d_transpose_nchw_cuda", [1, 24, 64, 64, 64], [24, 1, 1, 5, 5], [1, 2, 2], [0, 2, 2], [0, 1, 1], "float32"], {"i": 66546817, "t": "", "c": null, "e": [["tile_f", "sp", [-1, 1, 1, 1]], ["tile_d", "sp", [-1, 2, 1, 1]], ["tile_y", "sp", [-1, 1, 2, 16]], ["tile_x", "sp", [-1, 2, 1, 1]], ["tile_rc", "sp", [-1, 24]], ["tile_rd", "sp", [-1, 1]], ["tile_ry", "sp", [-1, 5]], ["tile_rx", "sp", [-1, 5]], ["auto_unroll_max_step", "ot", 0], ["unroll_explicit", "ot", 0]]}], "r": [[0.02257403225, 0.0226495495], 0, 1.313323974609375, 1578492215.100767], "v": 0.1}
{"i": ["cuda", "schedule_conv3d_transpose_nchw_cuda", [[1, 24, 64, 64, 64], [24, 1, 1, 5, 5], [1, 2, 2], [0, 2, 2], [0, 1, 1], "float32"], {}, ["schedule_conv3d_transpose_nchw_cuda", [1, 24, 64, 64, 64], [24, 1, 1, 5, 5], [1, 2, 2], [0, 2, 2], [0, 1, 1], "float32"], {"i": 141675187, "t": "", "c": null, "e": [["tile_f", "sp", [-1, 1, 1, 1]], ["tile_d", "sp", [-1, 8, 1, 2]], ["tile_y", "sp", [-1, 2, 2, 1]], ["tile_x", "sp", [-1, 1, 4, 1]], ["tile_rc", "sp", [-1, 8]], ["tile_rd", "sp", [-1, 1]], ["tile_ry", "sp", [-1, 5]], ["tile_rx", "sp", [-1, 5]], ["auto_unroll_max_step", "ot", 512], ["unroll_explicit", "ot", 0]]}], "r": [[0.01484989275, 0.013821815], 0, 4.5133891105651855, 1578492218.4742432], "v": 0.1}
{"i": ["cuda", "schedule_conv3d_transpose_nchw_cuda", [[1, 24, 64, 64, 64], [24, 1, 1, 5, 5], [1, 2, 2], [0, 2, 2], [0, 1, 1], "float32"], {}, ["schedule_conv3d_transpose_nchw_cuda", [1, 24, 64, 64, 64], [24, 1, 1, 5, 5], [1, 2, 2], [0, 2, 2], [0, 1, 1], "float32"], {"i": 141536896, "t": "", "c": null, "e": [["tile_f", "sp", [-1, 1, 1, 1]], ["tile_d", "sp", [-1, 16, 1, 1]], ["tile_y", "sp", [-1, 1, 2, 2]], ["tile_x", "sp", [-1, 2, 1, 1]], ["tile_rc", "sp", [-1, 8]], ["tile_rd", "sp", [-1, 1]], ["tile_ry", "sp", [-1, 5]], ["tile_rx", "sp", [-1, 5]], ["auto_unroll_max_step", "ot", 512], ["unroll_explicit", "ot", 0]]}], "r": [[0.0143214205, 0.01433609375], 0, 1.2893507480621338, 1578492221.0303097], "v": 0.1}
{"i": ["cuda", "schedule_conv3d_transpose_nchw_cuda", [[1, 24, 64, 64, 64], [24, 1, 1, 5, 5], [1, 2, 2], [0, 2, 2], [0, 1, 1], "float32"], {}, ["schedule_conv3d_transpose_nchw_cuda", [1, 24, 64, 64, 64], [24, 1, 1, 5, 5], [1, 2, 2], [0, 2, 2], [0, 1, 1], "float32"], {"i": 65469985, "t": "", "c": null, "e": [["tile_f", "sp", [-1, 1, 1, 1]], ["tile_d", "sp", [-1, 1, 1, 4]], ["tile_y", "sp", [-1, 16, 1, 1]], ["tile_x", "sp", [-1, 1, 4, 1]], ["tile_rc", "sp", [-1, 12]], ["tile_rd", "sp", [-1, 1]], ["tile_ry", "sp", [-1, 5]], ["tile_rx", "sp", [-1, 5]], ["auto_unroll_max_step", "ot", 0], ["unroll_explicit", "ot", 0]]}], "r": [[0.020408916, 0.02036997925], 0, 2.3405425548553467, 1578492223.0856972], "v": 0.1}
{"i": ["cuda", "schedule_conv3d_transpose_nchw_cuda", [[1, 24, 64, 64, 64], [24, 1, 1, 5, 5], [1, 2, 2], [0, 2, 2], [0, 1, 1], "float32"], {}, ["schedule_conv3d_transpose_nchw_cuda", [1, 24, 64, 64, 64], [24, 1, 1, 5, 5], [1, 2, 2], [0, 2, 2], [0, 1, 1], "float32"], {"i": 67388917, "t": "", "c": null, "e": [["tile_f", "sp", [-1, 1, 1, 1]], ["tile_d", "sp", [-1, 2, 1, 1]], ["tile_y", "sp", [-1, 1, 4, 2]], ["tile_x", "sp", [-1, 1, 1, 8]], ["tile_rc", "sp", [-1, 24]], ["tile_rd", "sp", [-1, 1]], ["tile_ry", "sp", [-1, 5]], ["tile_rx", "sp", [-1, 5]], ["auto_unroll_max_step", "ot", 0], ["unroll_explicit", "ot", 0]]}], "r": [[0.003442445, 0.003441116], 0, 1.0088937282562256, 1578492223.8386068], "v": 0.1}
{"i": ["cuda", "schedule_conv3d_transpose_nchw_cuda", [[1, 24, 64, 64, 64], [24, 1, 1, 5, 5], [1, 2, 2], [0, 2, 2], [0, 1, 1], "float32"], {}, ["schedule_conv3d_transpose_nchw_cuda", [1, 24, 64, 64, 64], [24, 1, 1, 5, 5], [1, 2, 2], [0, 2, 2], [0, 1, 1], "float32"], {"i": 297713185, "t": "", "c": null, "e": [["tile_f", "sp", [-1, 1, 1, 1]], ["tile_d", "sp", [-1, 1, 1, 4]], ["tile_y", "sp", [-1, 16, 1, 1]], ["tile_x", "sp", [-1, 1, 4, 1]], ["tile_rc", "sp", [-1, 12]], ["tile_rd", "sp", [-1, 1]], ["tile_ry", "sp", [-1, 5]], ["tile_rx", "sp", [-1, 5]], ["auto_unroll_max_step", "ot", 0], ["unroll_explicit", "ot", 1]]}], "r": [[0.0193859925, 0.01931258875], 0, 1.1055622100830078, 1578492229.0242648], "v": 0.1}
{"i": ["cuda", "schedule_conv3d_transpose_nchw_cuda", [[1, 24, 64, 64, 64], [24, 1, 1, 5, 5], [1, 2, 2], [0, 2, 2], [0, 1, 1], "float32"], {}, ["schedule_conv3d_transpose_nchw_cuda", [1, 24, 64, 64, 64], [24, 1, 1, 5, 5], [1, 2, 2], [0, 2, 2], [0, 1, 1], "float32"], {"i": 298790017, "t": "", "c": null, "e": [["tile_f", "sp", [-1, 1, 1, 1]], ["tile_d", "sp", [-1, 2, 1, 1]], ["tile_y", "sp", [-1, 1, 2, 16]], ["tile_x", "sp", [-1, 2, 1, 1]], ["tile_rc", "sp", [-1, 24]], ["tile_rd", "sp", [-1, 1]], ["tile_ry", "sp", [-1, 5]], ["tile_rx", "sp", [-1, 5]], ["auto_unroll_max_step", "ot", 0], ["unroll_explicit", "ot", 1]]}], "r": [[0.02264573275, 0.022680001], 0, 1.1030817031860352, 1578492229.9747446], "v": 0.1}
{"i": ["cuda", "schedule_conv3d_transpose_nchw_cuda", [[1, 24, 64, 64, 64], [24, 1, 1, 5, 5], [1, 2, 2], [0, 2, 2], [0, 1, 1], "float32"], {}, ["schedule_conv3d_transpose_nchw_cuda", [1, 24, 64, 64, 64], [24, 1, 1, 5, 5], [1, 2, 2], [0, 2, 2], [0, 1, 1], "float32"], {"i": 298781701, "t": "", "c": null, "e": [["tile_f", "sp", [-1, 1, 1, 1]], ["tile_d", "sp", [-1, 2, 1, 1]], ["tile_y", "sp", [-1, 32, 1, 1]], ["tile_x", "sp", [-1, 2, 1, 1]], ["tile_rc", "sp", [-1, 24]], ["tile_rd", "sp", [-1, 1]], ["tile_ry", "sp", [-1, 5]], ["tile_rx", "sp", [-1, 5]], ["auto_unroll_max_step", "ot", 0], ["unroll_explicit", "ot", 1]]}], "r": [[0.05002686, 0.050405886], 0, 1.5378503799438477, 1578492237.6058626], "v": 0.1}
{"i": ["cuda", "schedule_conv3d_transpose_nchw_cuda", [[1, 24, 64, 64, 64], [24, 1, 1, 5, 5], [1, 2, 2], [0, 2, 2], [0, 1, 1], "float32"], {}, ["schedule_conv3d_transpose_nchw_cuda", [1, 24, 64, 64, 64], [24, 1, 1, 5, 5], [1, 2, 2], [0, 2, 2], [0, 1, 1], "float32"], {"i": 144380068, "t": "", "c": null, "e": [["tile_f", "sp", [-1, 1, 1, 1]], ["tile_d", "sp", [-1, 1, 1, 2]], ["tile_y", "sp", [-1, 2, 4, 2]], ["tile_x", "sp", [-1, 1, 2, 2]], ["tile_rc", "sp", [-1, 24]], ["tile_rd", "sp", [-1, 1]], ["tile_ry", "sp", [-1, 5]], ["tile_rx", "sp", [-1, 5]], ["auto_unroll_max_step", "ot", 512], ["unroll_explicit", "ot", 0]]}], "r": [[0.00151593625, 0.00150960525], 0, 4.576530933380127, 1578492241.519297], "v": 0.1}
{"i": ["cuda", "schedule_conv3d_transpose_nchw_cuda", [[1, 24, 64, 64, 64], [24, 1, 1, 5, 5], [1, 2, 2], [0, 2, 2], [0, 1, 1], "float32"], {}, ["schedule_conv3d_transpose_nchw_cuda", [1, 24, 64, 64, 64], [24, 1, 1, 5, 5], [1, 2, 2], [0, 2, 2], [0, 1, 1], "float32"], {"i": 143956096, "t": "", "c": null, "e": [["tile_f", "sp", [-1, 1, 1, 1]], ["tile_d", "sp", [-1, 16, 1, 1]], ["tile_y", "sp", [-1, 1, 2, 2]], ["tile_x", "sp", [-1, 2, 1, 1]], ["tile_rc", "sp", [-1, 24]], ["tile_rd", "sp", [-1, 1]], ["tile_ry", "sp", [-1, 5]], ["tile_rx", "sp", [-1, 5]], ["auto_unroll_max_step", "ot", 512], ["unroll_explicit", "ot", 0]]}], "r": [[0.03266426375, 0.03264354175], 0, 1.6611509323120117, 1578492251.4290767], "v": 0.1}
{"i": ["cuda", "schedule_conv3d_transpose_nchw_cuda", [[1, 24, 64, 64, 64], [24, 1, 1, 5, 5], [1, 2, 2], [0, 2, 2], [0, 1, 1], "float32"], {}, ["schedule_conv3d_transpose_nchw_cuda", [1, 24, 64, 64, 64], [24, 1, 1, 5, 5], [1, 2, 2], [0, 2, 2], [0, 1, 1], "float32"], {"i": 219089587, "t": "", "c": null, "e": [["tile_f", "sp", [-1, 1, 1, 1]], ["tile_d", "sp", [-1, 8, 1, 2]], ["tile_y", "sp", [-1, 2, 2, 1]], ["tile_x", "sp", [-1, 1, 4, 1]], ["tile_rc", "sp", [-1, 8]], ["tile_rd", "sp", [-1, 1]], ["tile_ry", "sp", [-1, 5]], ["tile_rx", "sp", [-1, 5]], ["auto_unroll_max_step", "ot", 1500], ["unroll_explicit", "ot", 0]]}], "r": [[0.01053919875, 0.0105357515], 0, 8.424592733383179, 1578492254.7727995], "v": 0.1}
{"i": ["cuda", "schedule_conv3d_transpose_nchw_cuda", [[1, 24, 64, 64, 64], [24, 1, 1, 5, 5], [1, 2, 2], [0, 2, 2], [0, 1, 1], "float32"], {}, ["schedule_conv3d_transpose_nchw_cuda", [1, 24, 64, 64, 64], [24, 1, 1, 5, 5], [1, 2, 2], [0, 2, 2], [0, 1, 1], "float32"], {"i": 221370496, "t": "", "c": null, "e": [["tile_f", "sp", [-1, 1, 1, 1]], ["tile_d", "sp", [-1, 16, 1, 1]], ["tile_y", "sp", [-1, 1, 2, 2]], ["tile_x", "sp", [-1, 2, 1, 1]], ["tile_rc", "sp", [-1, 24]], ["tile_rd", "sp", [-1, 1]], ["tile_ry", "sp", [-1, 5]], ["tile_rx", "sp", [-1, 5]], ["auto_unroll_max_step", "ot", 1500], ["unroll_explicit", "ot", 0]]}], "r": [[0.03272708725, 0.033154872], 0, 1.4836664199829102, 1578492255.628055], "v": 0.1}
{"i": ["cuda", "schedule_conv3d_transpose_nchw_cuda", [[1, 24, 64, 64, 64], [24, 1, 1, 5, 5], [1, 2, 2], [0, 2, 2], [0, 1, 1], "float32"], {}, ["schedule_conv3d_transpose_nchw_cuda", [1, 24, 64, 64, 64], [24, 1, 1, 5, 5], [1, 2, 2], [0, 2, 2], [0, 1, 1], "float32"], {"i": 141967507, "t": "", "c": null, "e": [["tile_f", "sp", [-1, 1, 1, 1]], ["tile_d", "sp", [-1, 8, 1, 2]], ["tile_y", "sp", [-1, 2, 2, 1]], ["tile_x", "sp", [-1, 2, 2, 2]], ["tile_rc", "sp", [-1, 8]], ["tile_rd", "sp", [-1, 1]], ["tile_ry", "sp", [-1, 5]], ["tile_rx", "sp", [-1, 5]], ["auto_unroll_max_step", "ot", 512], ["unroll_explicit", "ot", 0]]}], "r": [[0.01317429475, 0.01318249625], 0, 1.6375129222869873, 1578492258.7850435], "v": 0.1}
{"i": ["cuda", "schedule_conv3d_transpose_nchw_cuda", [[1, 24, 64, 64, 64], [24, 1, 1, 5, 5], [1, 2, 2], [0, 2, 2], [0, 1, 1], "float32"], {}, ["schedule_conv3d_transpose_nchw_cuda", [1, 24, 64, 64, 64], [24, 1, 1, 5, 5], [1, 2, 2], [0, 2, 2], [0, 1, 1], "float32"], {"i": 377046517, "t": "", "c": null, "e": [["tile_f", "sp", [-1, 1, 1, 1]], ["tile_d", "sp", [-1, 2, 1, 1]], ["tile_y", "sp", [-1, 1, 4, 2]], ["tile_x", "sp", [-1, 1, 1, 8]], ["tile_rc", "sp", [-1, 24]], ["tile_rd", "sp", [-1, 1]], ["tile_ry", "sp", [-1, 5]], ["tile_rx", "sp", [-1, 5]], ["auto_unroll_max_step", "ot", 512], ["unroll_explicit", "ot", 1]]}], "r": [[0.000610869, 0.000605051], 0, 2.06237530708313, 1578492259.6404037], "v": 0.1}
{"i": ["cuda", "schedule_conv3d_transpose_nchw_cuda", [[1, 24, 64, 64, 64], [24, 1, 1, 5, 5], [1, 2, 2], [0, 2, 2], [0, 1, 1], "float32"], {}, ["schedule_conv3d_transpose_nchw_cuda", [1, 24, 64, 64, 64], [24, 1, 1, 5, 5], [1, 2, 2], [0, 2, 2], [0, 1, 1], "float32"], {"i": 375131029, "t": "", "c": null, "e": [["tile_f", "sp", [-1, 1, 1, 1]], ["tile_d", "sp", [-1, 1, 1, 4]], ["tile_y", "sp", [-1, 4, 2, 2]], ["tile_x", "sp", [-1, 1, 4, 1]], ["tile_rc", "sp", [-1, 12]], ["tile_rd", "sp", [-1, 1]], ["tile_ry", "sp", [-1, 5]], ["tile_rx", "sp", [-1, 5]], ["auto_unroll_max_step", "ot", 512], ["unroll_explicit", "ot", 1]]}], "r": [[0.0012517285, 0.00125461925], 0, 2.079108476638794, 1578492260.536063], "v": 0.1}
{"i": ["cuda", "schedule_conv3d_transpose_nchw_cuda", [[1, 24, 64, 64, 64], [24, 1, 1, 5, 5], [1, 2, 2], [0, 2, 2], [0, 1, 1], "float32"], {}, ["schedule_conv3d_transpose_nchw_cuda", [1, 24, 64, 64, 64], [24, 1, 1, 5, 5], [1, 2, 2], [0, 2, 2], [0, 1, 1], "float32"], {"i": 299632117, "t": "", "c": null, "e": [["tile_f", "sp", [-1, 1, 1, 1]], ["tile_d", "sp", [-1, 2, 1, 1]], ["tile_y", "sp", [-1, 1, 4, 2]], ["tile_x", "sp", [-1, 1, 1, 8]], ["tile_rc", "sp", [-1, 24]], ["tile_rd", "sp", [-1, 1]], ["tile_ry", "sp", [-1, 5]], ["tile_rx", "sp", [-1, 5]], ["auto_unroll_max_step", "ot", 0], ["unroll_explicit", "ot", 1]]}], "r": [[0.00346522225, 0.003463052], 0, 0.8800482749938965, 1578492261.2655], "v": 0.1}
{"i": ["cuda", "schedule_conv3d_transpose_nchw_cuda", [[1, 24, 64, 64, 64], [24, 1, 1, 5, 5], [1, 2, 2], [0, 2, 2], [0, 1, 1], "float32"], {}, ["schedule_conv3d_transpose_nchw_cuda", [1, 24, 64, 64, 64], [24, 1, 1, 5, 5], [1, 2, 2], [0, 2, 2], [0, 1, 1], "float32"], {"i": 297716629, "t": "", "c": null, "e": [["tile_f", "sp", [-1, 1, 1, 1]], ["tile_d", "sp", [-1, 1, 1, 4]], ["tile_y", "sp", [-1, 4, 2, 2]], ["tile_x", "sp", [-1, 1, 4, 1]], ["tile_rc", "sp", [-1, 12]], ["tile_rd", "sp", [-1, 1]], ["tile_ry", "sp", [-1, 5]], ["tile_rx", "sp", [-1, 5]], ["auto_unroll_max_step", "ot", 0], ["unroll_explicit", "ot", 1]]}], "r": [[0.002970832, 0.00296304075], 0, 1.027235746383667, 1578492261.9554455], "v": 0.1}
{"i": ["cuda", "schedule_conv3d_transpose_nchw_cuda", [[1, 24, 64, 64, 64], [24, 1, 1, 5, 5], [1, 2, 2], [0, 2, 2], [0, 1, 1], "float32"], {}, ["schedule_conv3d_transpose_nchw_cuda", [1, 24, 64, 64, 64], [24, 1, 1, 5, 5], [1, 2, 2], [0, 2, 2], [0, 1, 1], "float32"], {"i": 298785061, "t": "", "c": null, "e": [["tile_f", "sp", [-1, 1, 1, 1]], ["tile_d", "sp", [-1, 2, 1, 1]], ["tile_y", "sp", [-1, 4, 2, 2]], ["tile_x", "sp", [-1, 2, 1, 1]], ["tile_rc", "sp", [-1, 24]], ["tile_rd", "sp", [-1, 1]], ["tile_ry", "sp", [-1, 5]], ["tile_rx", "sp", [-1, 5]], ["auto_unroll_max_step", "ot", 0], ["unroll_explicit", "ot", 1]]}], "r": [[0.008722822, 0.008720259], 0, 0.9921112060546875, 1578492262.7457457], "v": 0.1}
{"i": ["cuda", "schedule_conv3d_transpose_nchw_cuda", [[1, 24, 64, 64, 64], [24, 1, 1, 5, 5], [1, 2, 2], [0, 2, 2], [0, 1, 1], "float32"], {}, ["schedule_conv3d_transpose_nchw_cuda", [1, 24, 64, 64, 64], [24, 1, 1, 5, 5], [1, 2, 2], [0, 2, 2], [0, 1, 1], "float32"], {"i": 453613861, "t": "", "c": null, "e": [["tile_f", "sp", [-1, 1, 1, 1]], ["tile_d", "sp", [-1, 2, 1, 1]], ["tile_y", "sp", [-1, 4, 2, 2]], ["tile_x", "sp", [-1, 2, 1, 1]], ["tile_rc", "sp", [-1, 24]], ["tile_rd", "sp", [-1, 1]], ["tile_ry", "sp", [-1, 5]], ["tile_rx", "sp", [-1, 5]], ["auto_unroll_max_step", "ot", 1500], ["unroll_explicit", "ot", 1]]}], "r": [[0.0014457025, 0.00144591125], 0, 2.655860424041748, 1578492263.8350983], "v": 0.1}
{"i": ["cuda", "schedule_conv3d_transpose_nchw_cuda", [[1, 24, 64, 64, 64], [24, 1, 1, 5, 5], [1, 2, 2], [0, 2, 2], [0, 1, 1], "float32"], {}, ["schedule_conv3d_transpose_nchw_cuda", [1, 24, 64, 64, 64], [24, 1, 1, 5, 5], [1, 2, 2], [0, 2, 2], [0, 1, 1], "float32"], {"i": 296506897, "t": "", "c": null, "e": [["tile_f", "sp", [-1, 1, 1, 1]], ["tile_d", "sp", [-1, 2, 1, 1]], ["tile_y", "sp", [-1, 2, 2, 2]], ["tile_x", "sp", [-1, 1, 4, 1]], ["tile_rc", "sp", [-1, 8]], ["tile_rd", "sp", [-1, 1]], ["tile_ry", "sp", [-1, 5]], ["tile_rx", "sp", [-1, 5]], ["auto_unroll_max_step", "ot", 0], ["unroll_explicit", "ot", 1]]}], "r": [[0.00165872075, 0.00165703575], 0, 0.9662253856658936, 1578492490.0842147], "v": 0.1}
{"i": ["cuda", "schedule_conv3d_transpose_nchw_cuda", [[1, 24, 64, 64, 64], [24, 1, 1, 5, 5], [1, 2, 2], [0, 2, 2], [0, 1, 1], "float32"], {}, ["schedule_conv3d_transpose_nchw_cuda", [1, 24, 64, 64, 64], [24, 1, 1, 5, 5], [1, 2, 2], [0, 2, 2], [0, 1, 1], "float32"], {"i": 296506814, "t": "", "c": null, "e": [["tile_f", "sp", [-1, 1, 1, 1]], ["tile_d", "sp", [-1, 4, 1, 1]], ["tile_y", "sp", [-1, 1, 2, 2]], ["tile_x", "sp", [-1, 1, 4, 1]], ["tile_rc", "sp", [-1, 8]], ["tile_rd", "sp", [-1, 1]], ["tile_ry", "sp", [-1, 5]], ["tile_rx", "sp", [-1, 5]], ["auto_unroll_max_step", "ot", 0], ["unroll_explicit", "ot", 1]]}], "r": [[0.001962872, 0.0019605085], 0, 1.0364139080047607, 1578492490.6858237], "v": 0.1}
{"i": ["cuda", "schedule_conv3d_transpose_nchw_cuda", [[1, 24, 64, 64, 64], [24, 1, 1, 5, 5], [1, 2, 2], [0, 2, 2], [0, 1, 1], "float32"], {}, ["schedule_conv3d_transpose_nchw_cuda", [1, 24, 64, 64, 64], [24, 1, 1, 5, 5], [1, 2, 2], [0, 2, 2], [0, 1, 1], "float32"], {"i": 296506813, "t": "", "c": null, "e": [["tile_f", "sp", [-1, 1, 1, 1]], ["tile_d", "sp", [-1, 2, 1, 1]], ["tile_y", "sp", [-1, 1, 2, 2]], ["tile_x", "sp", [-1, 1, 4, 1]], ["tile_rc", "sp", [-1, 8]], ["tile_rd", "sp", [-1, 1]], ["tile_ry", "sp", [-1, 5]], ["tile_rx", "sp", [-1, 5]], ["auto_unroll_max_step", "ot", 0], ["unroll_explicit", "ot", 1]]}], "r": [[0.00368594875, 0.0036856905], 0, 1.0959134101867676, 1578492491.2867167], "v": 0.1}
{"i": ["cuda", "schedule_conv3d_transpose_nchw_cuda", [[1, 24, 64, 64, 64], [24, 1, 1, 5, 5], [1, 2, 2], [0, 2, 2], [0, 1, 1], "float32"], {}, ["schedule_conv3d_transpose_nchw_cuda", [1, 24, 64, 64, 64], [24, 1, 1, 5, 5], [1, 2, 2], [0, 2, 2], [0, 1, 1], "float32"], {"i": 297716497, "t": "", "c": null, "e": [["tile_f", "sp", [-1, 1, 1, 1]], ["tile_d", "sp", [-1, 2, 1, 1]], ["tile_y", "sp", [-1, 2, 2, 2]], ["tile_x", "sp", [-1, 1, 4, 1]], ["tile_rc", "sp", [-1, 12]], ["tile_rd", "sp", [-1, 1]], ["tile_ry", "sp", [-1, 5]], ["tile_rx", "sp", [-1, 5]], ["auto_unroll_max_step", "ot", 0], ["unroll_explicit", "ot", 1]]}], "r": [[0.00195514875, 0.001955127], 0, 1.0787379741668701, 1578492491.9075227], "v": 0.1}
{"i": ["cuda", "schedule_conv3d_transpose_nchw_cuda", [[1, 24, 64, 64, 64], [24, 1, 1, 5, 5], [1, 2, 2], [0, 2, 2], [0, 1, 1], "float32"], {}, ["schedule_conv3d_transpose_nchw_cuda", [1, 24, 64, 64, 64], [24, 1, 1, 5, 5], [1, 2, 2], [0, 2, 2], [0, 1, 1], "float32"], {"i": 297646021, "t": "", "c": null, "e": [["tile_f", "sp", [-1, 1, 1, 1]], ["tile_d", "sp", [-1, 2, 1, 1]], ["tile_y", "sp", [-1, 4, 2, 2]], ["tile_x", "sp", [-1, 1, 2, 1]], ["tile_rc", "sp", [-1, 12]], ["tile_rd", "sp", [-1, 1]], ["tile_ry", "sp", [-1, 5]], ["tile_rx", "sp", [-1, 5]], ["auto_unroll_max_step", "ot", 0], ["unroll_explicit", "ot", 1]]}], "r": [[0.0061030255, 0.00609763125], 0, 1.193843126296997, 1578492492.6079774], "v": 0.1}
{"i": ["cuda", "schedule_conv3d_transpose_nchw_cuda", [[1, 24, 64, 64, 64], [24, 1, 1, 5, 5], [1, 2, 2], [0, 2, 2], [0, 1, 1], "float32"], {}, ["schedule_conv3d_transpose_nchw_cuda", [1, 24, 64, 64, 64], [24, 1, 1, 5, 5], [1, 2, 2], [0, 2, 2], [0, 1, 1], "float32"], {"i": 64263697, "t": "", "c": null, "e": [["tile_f", "sp", [-1, 1, 1, 1]], ["tile_d", "sp", [-1, 2, 1, 1]], ["tile_y", "sp", [-1, 2, 2, 2]], ["tile_x", "sp", [-1, 1, 4, 1]], ["tile_rc", "sp", [-1, 8]], ["tile_rd", "sp", [-1, 1]], ["tile_ry", "sp", [-1, 5]], ["tile_rx", "sp", [-1, 5]], ["auto_unroll_max_step", "ot", 0], ["unroll_explicit", "ot", 0]]}], "r": [[0.00165789975, 0.0016584185], 0, 0.9539616107940674, 1578492493.1564374], "v": 0.1}
{"i": ["cuda", "schedule_conv3d_transpose_nchw_cuda", [[1, 24, 64, 64, 64], [24, 1, 1, 5, 5], [1, 2, 2], [0, 2, 2], [0, 1, 1], "float32"], {}, ["schedule_conv3d_transpose_nchw_cuda", [1, 24, 64, 64, 64], [24, 1, 1, 5, 5], [1, 2, 2], [0, 2, 2], [0, 1, 1], "float32"], {"i": 297716414, "t": "", "c": null, "e": [["tile_f", "sp", [-1, 1, 1, 1]], ["tile_d", "sp", [-1, 4, 1, 1]], ["tile_y", "sp", [-1, 1, 2, 2]], ["tile_x", "sp", [-1, 1, 4, 1]], ["tile_rc", "sp", [-1, 12]], ["tile_rd", "sp", [-1, 1]], ["tile_ry", "sp", [-1, 5]], ["tile_rx", "sp", [-1, 5]], ["auto_unroll_max_step", "ot", 0], ["unroll_explicit", "ot", 1]]}], "r": [[0.0022349025, 0.0022349305], 0, 1.0229833126068115, 1578492493.7703698], "v": 0.1}
{"i": ["cuda", "schedule_conv3d_transpose_nchw_cuda", [[1, 24, 64, 64, 64], [24, 1, 1, 5, 5], [1, 2, 2], [0, 2, 2], [0, 1, 1], "float32"], {}, ["schedule_conv3d_transpose_nchw_cuda", [1, 24, 64, 64, 64], [24, 1, 1, 5, 5], [1, 2, 2], [0, 2, 2], [0, 1, 1], "float32"], {"i": 296503984, "t": "", "c": null, "e": [["tile_f", "sp", [-1, 1, 1, 1]], ["tile_d", "sp", [-1, 1, 1, 2]], ["tile_y", "sp", [-1, 2, 2, 1]], ["tile_x", "sp", [-1, 1, 4, 1]], ["tile_rc", "sp", [-1, 8]], ["tile_rd", "sp", [-1, 1]], ["tile_ry", "sp", [-1, 5]], ["tile_rx", "sp", [-1, 5]], ["auto_unroll_max_step", "ot", 0], ["unroll_explicit", "ot", 1]]}], "r": [[0.00328430575, 0.0032787835], 0, 1.0465161800384521, 1578492494.3810332], "v": 0.1}
{"i": ["cuda", "schedule_conv3d_transpose_nchw_cuda", [[1, 24, 64, 64, 64], [24, 1, 1, 5, 5], [1, 2, 2], [0, 2, 2], [0, 1, 1], "float32"], {}, ["schedule_conv3d_transpose_nchw_cuda", [1, 24, 64, 64, 64], [24, 1, 1, 5, 5], [1, 2, 2], [0, 2, 2], [0, 1, 1], "float32"], {"i": 296506812, "t": "", "c": null, "e": [["tile_f", "sp", [-1, 1, 1, 1]], ["tile_d", "sp", [-1, 1, 1, 1]], ["tile_y", "sp", [-1, 1, 2, 2]], ["tile_x", "sp", [-1, 1, 4, 1]], ["tile_rc", "sp", [-1, 8]], ["tile_rd", "sp", [-1, 1]], ["tile_ry", "sp", [-1, 5]], ["tile_rx", "sp", [-1, 5]], ["auto_unroll_max_step", "ot", 0], ["unroll_explicit", "ot", 1]]}], "r": [[0.0059280475, 0.005928075], 0, 1.0230543613433838, 1578492494.9886932], "v": 0.1}
{"i": ["cuda", "schedule_conv3d_transpose_nchw_cuda", [[1, 24, 64, 64, 64], [24, 1, 1, 5, 5], [1, 2, 2], [0, 2, 2], [0, 1, 1], "float32"], {}, ["schedule_conv3d_transpose_nchw_cuda", [1, 24, 64, 64, 64], [24, 1, 1, 5, 5], [1, 2, 2], [0, 2, 2], [0, 1, 1], "float32"], {"i": 296436421, "t": "", "c": null, "e": [["tile_f", "sp", [-1, 1, 1, 1]], ["tile_d", "sp", [-1, 2, 1, 1]], ["tile_y", "sp", [-1, 4, 2, 2]], ["tile_x", "sp", [-1, 1, 2, 1]], ["tile_rc", "sp", [-1, 8]], ["tile_rd", "sp", [-1, 1]], ["tile_ry", "sp", [-1, 5]], ["tile_rx", "sp", [-1, 5]], ["auto_unroll_max_step", "ot", 0], ["unroll_explicit", "ot", 1]]}], "r": [[0.0047318895, 0.0047241695], 0, 1.1949806213378906, 1578492495.7392864], "v": 0.1}
{"i": ["cuda", "schedule_conv3d_transpose_nchw_cuda", [[1, 24, 64, 64, 64], [24, 1, 1, 5, 5], [1, 2, 2], [0, 2, 2], [0, 1, 1], "float32"], {}, ["schedule_conv3d_transpose_nchw_cuda", [1, 24, 64, 64, 64], [24, 1, 1, 5, 5], [1, 2, 2], [0, 2, 2], [0, 1, 1], "float32"], {"i": 64263614, "t": "", "c": null, "e": [["tile_f", "sp", [-1, 1, 1, 1]], ["tile_d", "sp", [-1, 4, 1, 1]], ["tile_y", "sp", [-1, 1, 2, 2]], ["tile_x", "sp", [-1, 1, 4, 1]], ["tile_rc", "sp", [-1, 8]], ["tile_rd", "sp", [-1, 1]], ["tile_ry", "sp", [-1, 5]], ["tile_rx", "sp", [-1, 5]], ["auto_unroll_max_step", "ot", 0], ["unroll_explicit", "ot", 0]]}], "r": [[0.00197703925, 0.001975737], 0, 0.9226970672607422, 1578492496.270375], "v": 0.1}
{"i": ["cuda", "schedule_conv3d_transpose_nchw_cuda", [[1, 24, 64, 64, 64], [24, 1, 1, 5, 5], [1, 2, 2], [0, 2, 2], [0, 1, 1], "float32"], {}, ["schedule_conv3d_transpose_nchw_cuda", [1, 24, 64, 64, 64], [24, 1, 1, 5, 5], [1, 2, 2], [0, 2, 2], [0, 1, 1], "float32"], {"i": 64263613, "t": "", "c": null, "e": [["tile_f", "sp", [-1, 1, 1, 1]], ["tile_d", "sp", [-1, 2, 1, 1]], ["tile_y", "sp", [-1, 1, 2, 2]], ["tile_x", "sp", [-1, 1, 4, 1]], ["tile_rc", "sp", [-1, 8]], ["tile_rd", "sp", [-1, 1]], ["tile_ry", "sp", [-1, 5]], ["tile_rx", "sp", [-1, 5]], ["auto_unroll_max_step", "ot", 0], ["unroll_explicit", "ot", 0]]}], "r": [[0.00368610125, 0.00368761425], 0, 0.9320909976959229, 1578492496.8422463], "v": 0.1}
{"i": ["cuda", "schedule_conv3d_transpose_nchw_cuda", [[1, 24, 64, 64, 64], [24, 1, 1, 5, 5], [1, 2, 2], [0, 2, 2], [0, 1, 1], "float32"], {}, ["schedule_conv3d_transpose_nchw_cuda", [1, 24, 64, 64, 64], [24, 1, 1, 5, 5], [1, 2, 2], [0, 2, 2], [0, 1, 1], "float32"], {"i": 296506898, "t": "", "c": null, "e": [["tile_f", "sp", [-1, 1, 1, 1]], ["tile_d", "sp", [-1, 4, 1, 1]], ["tile_y", "sp", [-1, 2, 2, 2]], ["tile_x", "sp", [-1, 1, 4, 1]], ["tile_rc", "sp", [-1, 8]], ["tile_rd", "sp", [-1, 1]], ["tile_ry", "sp", [-1, 5]], ["tile_rx", "sp", [-1, 5]], ["auto_unroll_max_step", "ot", 0], ["unroll_explicit", "ot", 1]]}], "r": [[0.001948068, 0.00193671375], 0, 1.0958988666534424, 1578492498.652765], "v": 0.1}
{"i": ["cuda", "schedule_conv3d_transpose_nchw_cuda", [[1, 24, 64, 64, 64], [24, 1, 1, 5, 5], [1, 2, 2], [0, 2, 2], [0, 1, 1], "float32"], {}, ["schedule_conv3d_transpose_nchw_cuda", [1, 24, 64, 64, 64], [24, 1, 1, 5, 5], [1, 2, 2], [0, 2, 2], [0, 1, 1], "float32"], {"i": 297716496, "t": "", "c": null, "e": [["tile_f", "sp", [-1, 1, 1, 1]], ["tile_d", "sp", [-1, 1, 1, 1]], ["tile_y", "sp", [-1, 2, 2, 2]], ["tile_x", "sp", [-1, 1, 4, 1]], ["tile_rc", "sp", [-1, 12]], ["tile_rd", "sp", [-1, 1]], ["tile_ry", "sp", [-1, 5]], ["tile_rx", "sp", [-1, 5]], ["auto_unroll_max_step", "ot", 0], ["unroll_explicit", "ot", 1]]}], "r": [[0.004511097, 0.00451038425], 0, 1.0725173950195312, 1578492499.233122], "v": 0.1}
{"i": ["cuda", "schedule_conv3d_transpose_nchw_cuda", [[1, 24, 64, 64, 64], [24, 1, 1, 5, 5], [1, 2, 2], [0, 2, 2], [0, 1, 1], "float32"], {}, ["schedule_conv3d_transpose_nchw_cuda", [1, 24, 64, 64, 64], [24, 1, 1, 5, 5], [1, 2, 2], [0, 2, 2], [0, 1, 1], "float32"], {"i": 298856041, "t": "", "c": null, "e": [["tile_f", "sp", [-1, 1, 1, 1]], ["tile_d", "sp", [-1, 2, 1, 1]], ["tile_y", "sp", [-1, 2, 4, 2]], ["tile_x", "sp", [-1, 1, 2, 1]], ["tile_rc", "sp", [-1, 24]], ["tile_rd", "sp", [-1, 1]], ["tile_ry", "sp", [-1, 5]], ["tile_rx", "sp", [-1, 5]], ["auto_unroll_max_step", "ot", 0], ["unroll_explicit", "ot", 1]]}], "r": [[0.0045777935, 0.004538511], 0, 1.0297937393188477, 1578492499.869569], "v": 0.1}
{"i": ["cuda", "schedule_conv3d_transpose_nchw_cuda", [[1, 24, 64, 64, 64], [24, 1, 1, 5, 5], [1, 2, 2], [0, 2, 2], [0, 1, 1], "float32"], {}, ["schedule_conv3d_transpose_nchw_cuda", [1, 24, 64, 64, 64], [24, 1, 1, 5, 5], [1, 2, 2], [0, 2, 2], [0, 1, 1], "float32"], {"i": 65473297, "t": "", "c": null, "e": [["tile_f", "sp", [-1, 1, 1, 1]], ["tile_d", "sp", [-1, 2, 1, 1]], ["tile_y", "sp", [-1, 2, 2, 2]], ["tile_x", "sp", [-1, 1, 4, 1]], ["tile_rc", "sp", [-1, 12]], ["tile_rd", "sp", [-1, 1]], ["tile_ry", "sp", [-1, 5]], ["tile_rx", "sp", [-1, 5]], ["auto_unroll_max_step", "ot", 0], ["unroll_explicit", "ot", 0]]}], "r": [[0.0019550555, 0.00195387725], 0, 0.9707729816436768, 1578492500.4062128], "v": 0.1}
{"i": ["cuda", "schedule_conv3d_transpose_nchw_cuda", [[1, 24, 64, 64, 64], [24, 1, 1, 5, 5], [1, 2, 2], [0, 2, 2], [0, 1, 1], "float32"], {}, ["schedule_conv3d_transpose_nchw_cuda", [1, 24, 64, 64, 64], [24, 1, 1, 5, 5], [1, 2, 2], [0, 2, 2], [0, 1, 1], "float32"], {"i": 373921297, "t": "", "c": null, "e": [["tile_f", "sp", [-1, 1, 1, 1]], ["tile_d", "sp", [-1, 2, 1, 1]], ["tile_y", "sp", [-1, 2, 2, 2]], ["tile_x", "sp", [-1, 1, 4, 1]], ["tile_rc", "sp", [-1, 8]], ["tile_rd", "sp", [-1, 1]], ["tile_ry", "sp", [-1, 5]], ["tile_rx", "sp", [-1, 5]], ["auto_unroll_max_step", "ot", 512], ["unroll_explicit", "ot", 1]]}], "r": [[0.0015755915, 0.001581121], 0, 1.324915885925293, 1578492501.0327053], "v": 0.1}
{"i": ["cuda", "schedule_conv3d_transpose_nchw_cuda", [[1, 24, 64, 64, 64], [24, 1, 1, 5, 5], [1, 2, 2], [0, 2, 2], [0, 1, 1], "float32"], {}, ["schedule_conv3d_transpose_nchw_cuda", [1, 24, 64, 64, 64], [24, 1, 1, 5, 5], [1, 2, 2], [0, 2, 2], [0, 1, 1], "float32"], {"i": 297716498, "t": "", "c": null, "e": [["tile_f", "sp", [-1, 1, 1, 1]], ["tile_d", "sp", [-1, 4, 1, 1]], ["tile_y", "sp", [-1, 2, 2, 2]], ["tile_x", "sp", [-1, 1, 4, 1]], ["tile_rc", "sp", [-1, 12]], ["tile_rd", "sp", [-1, 1]], ["tile_ry", "sp", [-1, 5]], ["tile_rx", "sp", [-1, 5]], ["auto_unroll_max_step", "ot", 0], ["unroll_explicit", "ot", 1]]}], "r": [[0.00208590325, 0.002087404], 0, 1.1156551837921143, 1578492501.660669], "v": 0.1}
{"i": ["cuda", "schedule_conv3d_transpose_nchw_cuda", [[1, 24, 64, 64, 64], [24, 1, 1, 5, 5], [1, 2, 2], [0, 2, 2], [0, 1, 1], "float32"], {}, ["schedule_conv3d_transpose_nchw_cuda", [1, 24, 64, 64, 64], [24, 1, 1, 5, 5], [1, 2, 2], [0, 2, 2], [0, 1, 1], "float32"], {"i": 65473214, "t": "", "c": null, "e": [["tile_f", "sp", [-1, 1, 1, 1]], ["tile_d", "sp", [-1, 4, 1, 1]], ["tile_y", "sp", [-1, 1, 2, 2]], ["tile_x", "sp", [-1, 1, 4, 1]], ["tile_rc", "sp", [-1, 12]], ["tile_rd", "sp", [-1, 1]], ["tile_ry", "sp", [-1, 5]], ["tile_rx", "sp", [-1, 5]], ["auto_unroll_max_step", "ot", 0], ["unroll_explicit", "ot", 0]]}], "r": [[0.00223327125, 0.00223358525], 0, 1.0315470695495605, 1578492502.2177036], "v": 0.1}
{"i": ["cuda", "schedule_conv3d_transpose_nchw_cuda", [[1, 24, 64, 64, 64], [24, 1, 1, 5, 5], [1, 2, 2], [0, 2, 2], [0, 1, 1], "float32"], {}, ["schedule_conv3d_transpose_nchw_cuda", [1, 24, 64, 64, 64], [24, 1, 1, 5, 5], [1, 2, 2], [0, 2, 2], [0, 1, 1], "float32"], {"i": 298926097, "t": "", "c": null, "e": [["tile_f", "sp", [-1, 1, 1, 1]], ["tile_d", "sp", [-1, 2, 1, 1]], ["tile_y", "sp", [-1, 2, 2, 2]], ["tile_x", "sp", [-1, 1, 4, 1]], ["tile_rc", "sp", [-1, 24]], ["tile_rd", "sp", [-1, 1]], ["tile_ry", "sp", [-1, 5]], ["tile_rx", "sp", [-1, 5]], ["auto_unroll_max_step", "ot", 0], ["unroll_explicit", "ot", 1]]}], "r": [[0.00269709625, 0.00269257475], 0, 1.1107022762298584, 1578492502.8365197], "v": 0.1}
{"i": ["cuda", "schedule_conv3d_transpose_nchw_cuda", [[1, 24, 64, 64, 64], [24, 1, 1, 5, 5], [1, 2, 2], [0, 2, 2], [0, 1, 1], "float32"], {}, ["schedule_conv3d_transpose_nchw_cuda", [1, 24, 64, 64, 64], [24, 1, 1, 5, 5], [1, 2, 2], [0, 2, 2], [0, 1, 1], "float32"], {"i": 296503957, "t": "", "c": null, "e": [["tile_f", "sp", [-1, 1, 1, 1]], ["tile_d", "sp", [-1, 2, 1, 1]], ["tile_y", "sp", [-1, 2, 2, 1]], ["tile_x", "sp", [-1, 1, 4, 1]], ["tile_rc", "sp", [-1, 8]], ["tile_rd", "sp", [-1, 1]], ["tile_ry", "sp", [-1, 5]], ["tile_rx", "sp", [-1, 5]], ["auto_unroll_max_step", "ot", 0], ["unroll_explicit", "ot", 1]]}], "r": [[0.003397992, 0.00338146775], 0, 1.060960292816162, 1578492503.4562821], "v": 0.1}
{"i": ["cuda", "schedule_conv3d_transpose_nchw_cuda", [[1, 24, 64, 64, 64], [24, 1, 1, 5, 5], [1, 2, 2], [0, 2, 2], [0, 1, 1], "float32"], {}, ["schedule_conv3d_transpose_nchw_cuda", [1, 24, 64, 64, 64], [24, 1, 1, 5, 5], [1, 2, 2], [0, 2, 2], [0, 1, 1], "float32"], {"i": 296503956, "t": "", "c": null, "e": [["tile_f", "sp", [-1, 1, 1, 1]], ["tile_d", "sp", [-1, 1, 1, 1]], ["tile_y", "sp", [-1, 2, 2, 1]], ["tile_x", "sp", [-1, 1, 4, 1]], ["tile_rc", "sp", [-1, 8]], ["tile_rd", "sp", [-1, 1]], ["tile_ry", "sp", [-1, 5]], ["tile_rx", "sp", [-1, 5]], ["auto_unroll_max_step", "ot", 0], ["unroll_explicit", "ot", 1]]}], "r": [[0.00386904375, 0.00386896175], 0, 1.052952527999878, 1578492504.0739202], "v": 0.1}
{"i": ["cuda", "schedule_conv3d_transpose_nchw_cuda", [[1, 24, 64, 64, 64], [24, 1, 1, 5, 5], [1, 2, 2], [0, 2, 2], [0, 1, 1], "float32"], {}, ["schedule_conv3d_transpose_nchw_cuda", [1, 24, 64, 64, 64], [24, 1, 1, 5, 5], [1, 2, 2], [0, 2, 2], [0, 1, 1], "float32"], {"i": 297713557, "t": "", "c": null, "e": [["tile_f", "sp", [-1, 1, 1, 1]], ["tile_d", "sp", [-1, 2, 1, 1]], ["tile_y", "sp", [-1, 2, 2, 1]], ["tile_x", "sp", [-1, 1, 4, 1]], ["tile_rc", "sp", [-1, 12]], ["tile_rd", "sp", [-1, 1]], ["tile_ry", "sp", [-1, 5]], ["tile_rx", "sp", [-1, 5]], ["auto_unroll_max_step", "ot", 0], ["unroll_explicit", "ot", 1]]}], "r": [[0.00385398775, 0.003852915], 0, 1.0448384284973145, 1578492504.693928], "v": 0.1}
{"i": ["cuda", "schedule_conv3d_transpose_nchw_cuda", [[1, 24, 64, 64, 64], [24, 1, 1, 5, 5], [1, 2, 2], [0, 2, 2], [0, 1, 1], "float32"], {}, ["schedule_conv3d_transpose_nchw_cuda", [1, 24, 64, 64, 64], [24, 1, 1, 5, 5], [1, 2, 2], [0, 2, 2], [0, 1, 1], "float32"], {"i": 296506924, "t": "", "c": null, "e": [["tile_f", "sp", [-1, 1, 1, 1]], ["tile_d", "sp", [-1, 1, 1, 2]], ["tile_y", "sp", [-1, 2, 2, 2]], ["tile_x", "sp", [-1, 1, 4, 1]], ["tile_rc", "sp", [-1, 8]], ["tile_rd", "sp", [-1, 1]], ["tile_ry", "sp", [-1, 5]], ["tile_rx", "sp", [-1, 5]], ["auto_unroll_max_step", "ot", 0], ["unroll_explicit", "ot", 1]]}], "r": [[0.0016561115, 0.0016404475], 0, 1.0092213153839111, 1578492505.3240755], "v": 0.1}
{"i": ["cuda", "schedule_conv3d_transpose_nchw_cuda", [[1, 24, 64, 64, 64], [24, 1, 1, 5, 5], [1, 2, 2], [0, 2, 2], [0, 1, 1], "float32"], {}, ["schedule_conv3d_transpose_nchw_cuda", [1, 24, 64, 64, 64], [24, 1, 1, 5, 5], [1, 2, 2], [0, 2, 2], [0, 1, 1], "float32"], {"i": 296506899, "t": "", "c": null, "e": [["tile_f", "sp", [-1, 1, 1, 1]], ["tile_d", "sp", [-1, 8, 1, 1]], ["tile_y", "sp", [-1, 2, 2, 2]], ["tile_x", "sp", [-1, 1, 4, 1]], ["tile_rc", "sp", [-1, 8]], ["tile_rd", "sp", [-1, 1]], ["tile_ry", "sp", [-1, 5]], ["tile_rx", "sp", [-1, 5]], ["auto_unroll_max_step", "ot", 0], ["unroll_explicit", "ot", 1]]}], "r": [[0.00293200075, 0.00292806275], 0, 1.1990411281585693, 1578492507.2404523], "v": 0.1}
{"i": ["cuda", "schedule_conv3d_transpose_nchw_cuda", [[1, 24, 64, 64, 64], [24, 1, 1, 5, 5], [1, 2, 2], [0, 2, 2], [0, 1, 1], "float32"], {}, ["schedule_conv3d_transpose_nchw_cuda", [1, 24, 64, 64, 64], [24, 1, 1, 5, 5], [1, 2, 2], [0, 2, 2], [0, 1, 1], "float32"], {"i": 297713640, "t": "", "c": null, "e": [["tile_f", "sp", [-1, 1, 1, 1]], ["tile_d", "sp", [-1, 1, 1, 1]], ["tile_y", "sp", [-1, 4, 2, 1]], ["tile_x", "sp", [-1, 1, 4, 1]], ["tile_rc", "sp", [-1, 12]], ["tile_rd", "sp", [-1, 1]], ["tile_ry", "sp", [-1, 5]], ["tile_rx", "sp", [-1, 5]], ["auto_unroll_max_step", "ot", 0], ["unroll_explicit", "ot", 1]]}], "r": [[0.004123929, 0.00412369475], 0, 1.0478174686431885, 1578492507.8143368], "v": 0.1}
{"i": ["cuda", "schedule_conv3d_transpose_nchw_cuda", [[1, 24, 64, 64, 64], [24, 1, 1, 5, 5], [1, 2, 2], [0, 2, 2], [0, 1, 1], "float32"], {}, ["schedule_conv3d_transpose_nchw_cuda", [1, 24, 64, 64, 64], [24, 1, 1, 5, 5], [1, 2, 2], [0, 2, 2], [0, 1, 1], "float32"], {"i": 297716580, "t": "", "c": null, "e": [["tile_f", "sp", [-1, 1, 1, 1]], ["tile_d", "sp", [-1, 1, 1, 1]], ["tile_y", "sp", [-1, 4, 2, 2]], ["tile_x", "sp", [-1, 1, 4, 1]], ["tile_rc", "sp", [-1, 12]], ["tile_rd", "sp", [-1, 1]], ["tile_ry", "sp", [-1, 5]], ["tile_rx", "sp", [-1, 5]], ["auto_unroll_max_step", "ot", 0], ["unroll_explicit", "ot", 1]]}], "r": [[0.00199588075, 0.0019937795], 0, 1.0879888534545898, 1578492508.4062636], "v": 0.1}
{"i": ["cuda", "schedule_conv3d_transpose_nchw_cuda", [[1, 24, 64, 64, 64], [24, 1, 1, 5, 5], [1, 2, 2], [0, 2, 2], [0, 1, 1], "float32"], {}, ["schedule_conv3d_transpose_nchw_cuda", [1, 24, 64, 64, 64], [24, 1, 1, 5, 5], [1, 2, 2], [0, 2, 2], [0, 1, 1], "float32"], {"i": 297716413, "t": "", "c": null, "e": [["tile_f", "sp", [-1, 1, 1, 1]], ["tile_d", "sp", [-1, 2, 1, 1]], ["tile_y", "sp", [-1, 1, 2, 2]], ["tile_x", "sp", [-1, 1, 4, 1]], ["tile_rc", "sp", [-1, 12]], ["tile_rd", "sp", [-1, 1]], ["tile_ry", "sp", [-1, 5]], ["tile_rx", "sp", [-1, 5]], ["auto_unroll_max_step", "ot", 0], ["unroll_explicit", "ot", 1]]}], "r": [[0.00410712825, 0.00410676], 0, 1.103588581085205, 1578492508.989071], "v": 0.1}
{"i": ["cuda", "schedule_conv3d_transpose_nchw_cuda", [[1, 24, 64, 64, 64], [24, 1, 1, 5, 5], [1, 2, 2], [0, 2, 2], [0, 1, 1], "float32"], {}, ["schedule_conv3d_transpose_nchw_cuda", [1, 24, 64, 64, 64], [24, 1, 1, 5, 5], [1, 2, 2], [0, 2, 2], [0, 1, 1], "float32"], {"i": 297716412, "t": "", "c": null, "e": [["tile_f", "sp", [-1, 1, 1, 1]], ["tile_d", "sp", [-1, 1, 1, 1]], ["tile_y", "sp", [-1, 1, 2, 2]], ["tile_x", "sp", [-1, 1, 4, 1]], ["tile_rc", "sp", [-1, 12]], ["tile_rd", "sp", [-1, 1]], ["tile_ry", "sp", [-1, 5]], ["tile_rx", "sp", [-1, 5]], ["auto_unroll_max_step", "ot", 0], ["unroll_explicit", "ot", 1]]}], "r": [[0.006459036, 0.00643206225], 0, 1.0124213695526123, 1578492509.6137667], "v": 0.1}
{"i": ["cuda", "schedule_conv3d_transpose_nchw_cuda", [[1, 24, 64, 64, 64], [24, 1, 1, 5, 5], [1, 2, 2], [0, 2, 2], [0, 1, 1], "float32"], {}, ["schedule_conv3d_transpose_nchw_cuda", [1, 24, 64, 64, 64], [24, 1, 1, 5, 5], [1, 2, 2], [0, 2, 2], [0, 1, 1], "float32"], {"i": 296506840, "t": "", "c": null, "e": [["tile_f", "sp", [-1, 1, 1, 1]], ["tile_d", "sp", [-1, 1, 1, 2]], ["tile_y", "sp", [-1, 1, 2, 2]], ["tile_x", "sp", [-1, 1, 4, 1]], ["tile_rc", "sp", [-1, 8]], ["tile_rd", "sp", [-1, 1]], ["tile_ry", "sp", [-1, 5]], ["tile_rx", "sp", [-1, 5]], ["auto_unroll_max_step", "ot", 0], ["unroll_explicit", "ot", 1]]}], "r": [[0.00371466325, 0.003712644], 0, 1.0786986351013184, 1578492510.2389455], "v": 0.1}
{"i": ["cuda", "schedule_conv3d_transpose_nchw_cuda", [[1, 24, 64, 64, 64], [24, 1, 1, 5, 5], [1, 2, 2], [0, 2, 2], [0, 1, 1], "float32"], {}, ["schedule_conv3d_transpose_nchw_cuda", [1, 24, 64, 64, 64], [24, 1, 1, 5, 5], [1, 2, 2], [0, 2, 2], [0, 1, 1], "float32"], {"i": 296503873, "t": "", "c": null, "e": [["tile_f", "sp", [-1, 1, 1, 1]], ["tile_d", "sp", [-1, 2, 1, 1]], ["tile_y", "sp", [-1, 1, 2, 1]], ["tile_x", "sp", [-1, 1, 4, 1]], ["tile_rc", "sp", [-1, 8]], ["tile_rd", "sp", [-1, 1]], ["tile_ry", "sp", [-1, 5]], ["tile_rx", "sp", [-1, 5]], ["auto_unroll_max_step", "ot", 0], ["unroll_explicit", "ot", 1]]}], "r": [[0.00373634025, 0.0037351435], 0, 1.1589138507843018, 1578492510.9411297], "v": 0.1}
{"i": ["cuda", "schedule_conv3d_transpose_nchw_cuda", [[1, 24, 64, 64, 64], [24, 1, 1, 5, 5], [1, 2, 2], [0, 2, 2], [0, 1, 1], "float32"], {}, ["schedule_conv3d_transpose_nchw_cuda", [1, 24, 64, 64, 64], [24, 1, 1, 5, 5], [1, 2, 2], [0, 2, 2], [0, 1, 1], "float32"], {"i": 296503874, "t": "", "c": null, "e": [["tile_f", "sp", [-1, 1, 1, 1]], ["tile_d", "sp", [-1, 4, 1, 1]], ["tile_y", "sp", [-1, 1, 2, 1]], ["tile_x", "sp", [-1, 1, 4, 1]], ["tile_rc", "sp", [-1, 8]], ["tile_rd", "sp", [-1, 1]], ["tile_ry", "sp", [-1, 5]], ["tile_rx", "sp", [-1, 5]], ["auto_unroll_max_step", "ot", 0], ["unroll_explicit", "ot", 1]]}], "r": [[0.0032464355, 0.00324646125], 0, 1.1389713287353516, 1578492511.5877762], "v": 0.1}
{"i": ["cuda", "schedule_conv3d_transpose_nchw_cuda", [[1, 24, 64, 64, 64], [24, 1, 1, 5, 5], [1, 2, 2], [0, 2, 2], [0, 1, 1], "float32"], {}, ["schedule_conv3d_transpose_nchw_cuda", [1, 24, 64, 64, 64], [24, 1, 1, 5, 5], [1, 2, 2], [0, 2, 2], [0, 1, 1], "float32"], {"i": 297713474, "t": "", "c": null, "e": [["tile_f", "sp", [-1, 1, 1, 1]], ["tile_d", "sp", [-1, 4, 1, 1]], ["tile_y", "sp", [-1, 1, 2, 1]], ["tile_x", "sp", [-1, 1, 4, 1]], ["tile_rc", "sp", [-1, 12]], ["tile_rd", "sp", [-1, 1]], ["tile_ry", "sp", [-1, 5]], ["tile_rx", "sp", [-1, 5]], ["auto_unroll_max_step", "ot", 0], ["unroll_explicit", "ot", 1]]}], "r": [[0.00455894725, 0.00449986075], 0, 1.0683043003082275, 1578492512.2242992], "v": 0.1}
{"i": ["cuda", "schedule_conv3d_transpose_nchw_cuda", [[1, 24, 64, 64, 64], [24, 1, 1, 5, 5], [1, 2, 2], [0, 2, 2], [0, 1, 1], "float32"], {}, ["schedule_conv3d_transpose_nchw_cuda", [1, 24, 64, 64, 64], [24, 1, 1, 5, 5], [1, 2, 2], [0, 2, 2], [0, 1, 1], "float32"], {"i": 64260784, "t": "", "c": null, "e": [["tile_f", "sp", [-1, 1, 1, 1]], ["tile_d", "sp", [-1, 1, 1, 2]], ["tile_y", "sp", [-1, 2, 2, 1]], ["tile_x", "sp", [-1, 1, 4, 1]], ["tile_rc", "sp", [-1, 8]], ["tile_rd", "sp", [-1, 1]], ["tile_ry", "sp", [-1, 5]], ["tile_rx", "sp", [-1, 5]], ["auto_unroll_max_step", "ot", 0], ["unroll_explicit", "ot", 0]]}], "r": [[0.00328409375, 0.00328518925], 0, 0.9877712726593018, 1578492512.7740078], "v": 0.1}
{"i": ["cuda", "schedule_conv3d_transpose_nchw_cuda", [[1, 24, 64, 64, 64], [24, 1, 1, 5, 5], [1, 2, 2], [0, 2, 2], [0, 1, 1], "float32"], {}, ["schedule_conv3d_transpose_nchw_cuda", [1, 24, 64, 64, 64], [24, 1, 1, 5, 5], [1, 2, 2], [0, 2, 2], [0, 1, 1], "float32"], {"i": 65402821, "t": "", "c": null, "e": [["tile_f", "sp", [-1, 1, 1, 1]], ["tile_d", "sp", [-1, 2, 1, 1]], ["tile_y", "sp", [-1, 4, 2, 2]], ["tile_x", "sp", [-1, 1, 2, 1]], ["tile_rc", "sp", [-1, 12]], ["tile_rd", "sp", [-1, 1]], ["tile_ry", "sp", [-1, 5]], ["tile_rx", "sp", [-1, 5]], ["auto_unroll_max_step", "ot", 0], ["unroll_explicit", "ot", 0]]}], "r": [[0.006157021, 0.00614890875], 0, 1.0557136535644531, 1578492513.3569887], "v": 0.1}
{"i": ["cuda", "schedule_conv3d_transpose_nchw_cuda", [[1, 24, 64, 64, 64], [24, 1, 1, 5, 5], [1, 2, 2], [0, 2, 2], [0, 1, 1], "float32"], {}, ["schedule_conv3d_transpose_nchw_cuda", [1, 24, 64, 64, 64], [24, 1, 1, 5, 5], [1, 2, 2], [0, 2, 2], [0, 1, 1], "float32"], {"i": 297718682, "t": "", "c": null, "e": [["tile_f", "sp", [-1, 1, 1, 1]], ["tile_d", "sp", [-1, 4, 1, 1]], ["tile_y", "sp", [-1, 1, 2, 4]], ["tile_x", "sp", [-1, 1, 4, 1]], ["tile_rc", "sp", [-1, 12]], ["tile_rd", "sp", [-1, 1]], ["tile_ry", "sp", [-1, 5]], ["tile_rx", "sp", [-1, 5]], ["auto_unroll_max_step", "ot", 0], ["unroll_explicit", "ot", 1]]}], "r": [[0.0039999355, 0.003988479], 0, 1.1329500675201416, 1578492514.0872586], "v": 0.1}
{"i": ["cuda", "schedule_conv3d_transpose_nchw_cuda", [[1, 24, 64, 64, 64], [24, 1, 1, 5, 5], [1, 2, 2], [0, 2, 2], [0, 1, 1], "float32"], {}, ["schedule_conv3d_transpose_nchw_cuda", [1, 24, 64, 64, 64], [24, 1, 1, 5, 5], [1, 2, 2], [0, 2, 2], [0, 1, 1], "float32"], {"i": 297716440, "t": "", "c": null, "e": [["tile_f", "sp", [-1, 1, 1, 1]], ["tile_d", "sp", [-1, 1, 1, 2]], ["tile_y", "sp", [-1, 1, 2, 2]], ["tile_x", "sp", [-1, 1, 4, 1]], ["tile_rc", "sp", [-1, 12]], ["tile_rd", "sp", [-1, 1]], ["tile_ry", "sp", [-1, 5]], ["tile_rx", "sp", [-1, 5]], ["auto_unroll_max_step", "ot", 0], ["unroll_explicit", "ot", 1]]}], "r": [[0.00405142775, 0.0040505195], 0, 0.9807696342468262, 1578492515.9252338], "v": 0.1}
{"i": ["cuda", "schedule_conv3d_transpose_nchw_cuda", [[1, 24, 64, 64, 64], [24, 1, 1, 5, 5], [1, 2, 2], [0, 2, 2], [0, 1, 1], "float32"], {}, ["schedule_conv3d_transpose_nchw_cuda", [1, 24, 64, 64, 64], [24, 1, 1, 5, 5], [1, 2, 2], [0, 2, 2], [0, 1, 1], "float32"], {"i": 64263612, "t": "", "c": null, "e": [["tile_f", "sp", [-1, 1, 1, 1]], ["tile_d", "sp", [-1, 1, 1, 1]], ["tile_y", "sp", [-1, 1, 2, 2]], ["tile_x", "sp", [-1, 1, 4, 1]], ["tile_rc", "sp", [-1, 8]], ["tile_rd", "sp", [-1, 1]], ["tile_ry", "sp", [-1, 5]], ["tile_rx", "sp", [-1, 5]], ["auto_unroll_max_step", "ot", 0], ["unroll_explicit", "ot", 0]]}], "r": [[0.00592778775, 0.005927963], 0, 0.9656755924224854, 1578492516.4624002], "v": 0.1}
{"i": ["cuda", "schedule_conv3d_transpose_nchw_cuda", [[1, 24, 64, 64, 64], [24, 1, 1, 5, 5], [1, 2, 2], [0, 2, 2], [0, 1, 1], "float32"], {}, ["schedule_conv3d_transpose_nchw_cuda", [1, 24, 64, 64, 64], [24, 1, 1, 5, 5], [1, 2, 2], [0, 2, 2], [0, 1, 1], "float32"], {"i": 298926014, "t": "", "c": null, "e": [["tile_f", "sp", [-1, 1, 1, 1]], ["tile_d", "sp", [-1, 4, 1, 1]], ["tile_y", "sp", [-1, 1, 2, 2]], ["tile_x", "sp", [-1, 1, 4, 1]], ["tile_rc", "sp", [-1, 24]], ["tile_rd", "sp", [-1, 1]], ["tile_ry", "sp", [-1, 5]], ["tile_rx", "sp", [-1, 5]], ["auto_unroll_max_step", "ot", 0], ["unroll_explicit", "ot", 1]]}], "r": [[0.00232012025, 0.00231571925], 0, 1.0594332218170166, 1578492517.0664384], "v": 0.1}
{"i": ["cuda", "schedule_conv3d_transpose_nchw_cuda", [[1, 24, 64, 64, 64], [24, 1, 1, 5, 5], [1, 2, 2], [0, 2, 2], [0, 1, 1], "float32"], {}, ["schedule_conv3d_transpose_nchw_cuda", [1, 24, 64, 64, 64], [24, 1, 1, 5, 5], [1, 2, 2], [0, 2, 2], [0, 1, 1], "float32"], {"i": 375130897, "t": "", "c": null, "e": [["tile_f", "sp", [-1, 1, 1, 1]], ["tile_d", "sp", [-1, 2, 1, 1]], ["tile_y", "sp", [-1, 2, 2, 2]], ["tile_x", "sp", [-1, 1, 4, 1]], ["tile_rc", "sp", [-1, 12]], ["tile_rd", "sp", [-1, 1]], ["tile_ry", "sp", [-1, 5]], ["tile_rx", "sp", [-1, 5]], ["auto_unroll_max_step", "ot", 512], ["unroll_explicit", "ot", 1]]}], "r": [[0.001462383, 0.00146714775], 0, 1.3784713745117188, 1578492517.6897974], "v": 0.1}
{"i": ["cuda", "schedule_conv3d_transpose_nchw_cuda", [[1, 24, 64, 64, 64], [24, 1, 1, 5, 5], [1, 2, 2], [0, 2, 2], [0, 1, 1], "float32"], {}, ["schedule_conv3d_transpose_nchw_cuda", [1, 24, 64, 64, 64], [24, 1, 1, 5, 5], [1, 2, 2], [0, 2, 2], [0, 1, 1], "float32"], {"i": 296846677, "t": "", "c": null, "e": [["tile_f", "sp", [-1, 1, 1, 1]], ["tile_d", "sp", [-1, 2, 1, 1]], ["tile_y", "sp", [-1, 2, 2, 1]], ["tile_x", "sp", [-1, 1, 4, 2]], ["tile_rc", "sp", [-1, 8]], ["tile_rd", "sp", [-1, 1]], ["tile_ry", "sp", [-1, 5]], ["tile_rx", "sp", [-1, 5]], ["auto_unroll_max_step", "ot", 0], ["unroll_explicit", "ot", 1]]}], "r": [[0.0047868995, 0.00478663475], 0, 1.0494754314422607, 1578492518.3217075], "v": 0.1}
{"i": ["cuda", "schedule_conv3d_transpose_nchw_cuda", [[1, 24, 64, 64, 64], [24, 1, 1, 5, 5], [1, 2, 2], [0, 2, 2], [0, 1, 1], "float32"], {}, ["schedule_conv3d_transpose_nchw_cuda", [1, 24, 64, 64, 64], [24, 1, 1, 5, 5], [1, 2, 2], [0, 2, 2], [0, 1, 1], "float32"], {"i": 298926124, "t": "", "c": null, "e": [["tile_f", "sp", [-1, 1, 1, 1]], ["tile_d", "sp", [-1, 1, 1, 2]], ["tile_y", "sp", [-1, 2, 2, 2]], ["tile_x", "sp", [-1, 1, 4, 1]], ["tile_rc", "sp", [-1, 24]], ["tile_rd", "sp", [-1, 1]], ["tile_ry", "sp", [-1, 5]], ["tile_rx", "sp", [-1, 5]], ["auto_unroll_max_step", "ot", 0], ["unroll_explicit", "ot", 1]]}], "r": [[0.00270136425, 0.0026934065], 0, 1.0555641651153564, 1578492518.9434555], "v": 0.1}
{"i": ["cuda", "schedule_conv3d_transpose_nchw_cuda", [[1, 24, 64, 64, 64], [24, 1, 1, 5, 5], [1, 2, 2], [0, 2, 2], [0, 1, 1], "float32"], {}, ["schedule_conv3d_transpose_nchw_cuda", [1, 24, 64, 64, 64], [24, 1, 1, 5, 5], [1, 2, 2], [0, 2, 2], [0, 1, 1], "float32"], {"i": 64263698, "t": "", "c": null, "e": [["tile_f", "sp", [-1, 1, 1, 1]], ["tile_d", "sp", [-1, 4, 1, 1]], ["tile_y", "sp", [-1, 2, 2, 2]], ["tile_x", "sp", [-1, 1, 4, 1]], ["tile_rc", "sp", [-1, 8]], ["tile_rd", "sp", [-1, 1]], ["tile_ry", "sp", [-1, 5]], ["tile_rx", "sp", [-1, 5]], ["auto_unroll_max_step", "ot", 0], ["unroll_explicit", "ot", 0]]}], "r": [[0.001950052, 0.00195104], 0, 1.0686135292053223, 1578492519.5033705], "v": 0.1}
{"i": ["cuda", "schedule_conv3d_transpose_nchw_cuda", [[1, 24, 64, 64, 64], [24, 1, 1, 5, 5], [1, 2, 2], [0, 2, 2], [0, 1, 1], "float32"], {}, ["schedule_conv3d_transpose_nchw_cuda", [1, 24, 64, 64, 64], [24, 1, 1, 5, 5], [1, 2, 2], [0, 2, 2], [0, 1, 1], "float32"], {"i": 297716499, "t": "", "c": null, "e": [["tile_f", "sp", [-1, 1, 1, 1]], ["tile_d", "sp", [-1, 8, 1, 1]], ["tile_y", "sp", [-1, 2, 2, 2]], ["tile_x", "sp", [-1, 1, 4, 1]], ["tile_rc", "sp", [-1, 12]], ["tile_rd", "sp", [-1, 1]], ["tile_ry", "sp", [-1, 5]], ["tile_rx", "sp", [-1, 5]], ["auto_unroll_max_step", "ot", 0], ["unroll_explicit", "ot", 1]]}], "r": [[0.002903937, 0.002904015], 0, 1.1982793807983398, 1578492520.2237728], "v": 0.1}
{"i": ["cuda", "schedule_conv3d_transpose_nchw_cuda", [[1, 24, 64, 64, 64], [24, 1, 1, 5, 5], [1, 2, 2], [0, 2, 2], [0, 1, 1], "float32"], {}, ["schedule_conv3d_transpose_nchw_cuda", [1, 24, 64, 64, 64], [24, 1, 1, 5, 5], [1, 2, 2], [0, 2, 2], [0, 1, 1], "float32"], {"i": 297646020, "t": "", "c": null, "e": [["tile_f", "sp", [-1, 1, 1, 1]], ["tile_d", "sp", [-1, 1, 1, 1]], ["tile_y", "sp", [-1, 4, 2, 2]], ["tile_x", "sp", [-1, 1, 2, 1]], ["tile_rc", "sp", [-1, 12]], ["tile_rd", "sp", [-1, 1]], ["tile_ry", "sp", [-1, 5]], ["tile_rx", "sp", [-1, 5]], ["auto_unroll_max_step", "ot", 0], ["unroll_explicit", "ot", 1]]}], "r": [[0.00396672075, 0.003965369], 0, 1.1605141162872314, 1578492520.9227338], "v": 0.1}
{"i": ["cuda", "schedule_conv3d_transpose_nchw_cuda", [[1, 24, 64, 64, 64], [24, 1, 1, 5, 5], [1, 2, 2], [0, 2, 2], [0, 1, 1], "float32"], {}, ["schedule_conv3d_transpose_nchw_cuda", [1, 24, 64, 64, 64], [24, 1, 1, 5, 5], [1, 2, 2], [0, 2, 2], [0, 1, 1], "float32"], {"i": 296506980, "t": "", "c": null, "e": [["tile_f", "sp", [-1, 1, 1, 1]], ["tile_d", "sp", [-1, 1, 1, 1]], ["tile_y", "sp", [-1, 4, 2, 2]], ["tile_x", "sp", [-1, 1, 4, 1]], ["tile_rc", "sp", [-1, 8]], ["tile_rd", "sp", [-1, 1]], ["tile_ry", "sp", [-1, 5]], ["tile_rx", "sp", [-1, 5]], ["auto_unroll_max_step", "ot", 0], ["unroll_explicit", "ot", 1]]}], "r": [[0.00145957075, 0.00145990225], 0, 1.0114028453826904, 1578492521.5028093], "v": 0.1}
{"i": ["cuda", "schedule_conv3d_transpose_nchw_cuda", [[1, 24, 64, 64, 64], [24, 1, 1, 5, 5], [1, 2, 2], [0, 2, 2], [0, 1, 1], "float32"], {}, ["schedule_conv3d_transpose_nchw_cuda", [1, 24, 64, 64, 64], [24, 1, 1, 5, 5], [1, 2, 2], [0, 2, 2], [0, 1, 1], "float32"], {"i": 296509082, "t": "", "c": null, "e": [["tile_f", "sp", [-1, 1, 1, 1]], ["tile_d", "sp", [-1, 4, 1, 1]], ["tile_y", "sp", [-1, 1, 2, 4]], ["tile_x", "sp", [-1, 1, 4, 1]], ["tile_rc", "sp", [-1, 8]], ["tile_rd", "sp", [-1, 1]], ["tile_ry", "sp", [-1, 5]], ["tile_rx", "sp", [-1, 5]], ["auto_unroll_max_step", "ot", 0], ["unroll_explicit", "ot", 1]]}], "r": [[0.00365288125, 0.00365518], 0, 1.1264681816101074, 1578492522.1956754], "v": 0.1}
{"i": ["cuda", "schedule_conv3d_transpose_nchw_cuda", [[1, 24, 64, 64, 64], [24, 1, 1, 5, 5], [1, 2, 2], [0, 2, 2], [0, 1, 1], "float32"], {}, ["schedule_conv3d_transpose_nchw_cuda", [1, 24, 64, 64, 64], [24, 1, 1, 5, 5], [1, 2, 2], [0, 2, 2], [0, 1, 1], "float32"], {"i": 296509081, "t": "", "c": null, "e": [["tile_f", "sp", [-1, 1, 1, 1]], ["tile_d", "sp", [-1, 2, 1, 1]], ["tile_y", "sp", [-1, 1, 2, 4]], ["tile_x", "sp", [-1, 1, 4, 1]], ["tile_rc", "sp", [-1, 8]], ["tile_rd", "sp", [-1, 1]], ["tile_ry", "sp", [-1, 5]], ["tile_rx", "sp", [-1, 5]], ["auto_unroll_max_step", "ot", 0], ["unroll_explicit", "ot", 1]]}], "r": [[0.00217620625, 0.00218036075], 0, 1.0261163711547852, 1578492522.8288376], "v": 0.1}
{"i": ["cuda", "schedule_conv3d_transpose_nchw_cuda", [[1, 24, 64, 64, 64], [24, 1, 1, 5, 5], [1, 2, 2], [0, 2, 2], [0, 1, 1], "float32"], {}, ["schedule_conv3d_transpose_nchw_cuda", [1, 24, 64, 64, 64], [24, 1, 1, 5, 5], [1, 2, 2], [0, 2, 2], [0, 1, 1], "float32"], {"i": 65473212, "t": "", "c": null, "e": [["tile_f", "sp", [-1, 1, 1, 1]], ["tile_d", "sp", [-1, 1, 1, 1]], ["tile_y", "sp", [-1, 1, 2, 2]], ["tile_x", "sp", [-1, 1, 4, 1]], ["tile_rc", "sp", [-1, 12]], ["tile_rd", "sp", [-1, 1]], ["tile_ry", "sp", [-1, 5]], ["tile_rx", "sp", [-1, 5]], ["auto_unroll_max_step", "ot", 0], ["unroll_explicit", "ot", 0]]}], "r": [[0.0064611215, 0.00646033825], 0, 0.9945628643035889, 1578492524.8022225], "v": 0.1}
{"i": ["cuda", "schedule_conv3d_transpose_nchw_cuda", [[1, 24, 64, 64, 64], [24, 1, 1, 5, 5], [1, 2, 2], [0, 2, 2], [0, 1, 1], "float32"], {}, ["schedule_conv3d_transpose_nchw_cuda", [1, 24, 64, 64, 64], [24, 1, 1, 5, 5], [1, 2, 2], [0, 2, 2], [0, 1, 1], "float32"], {"i": 65473213, "t": "", "c": null, "e": [["tile_f", "sp", [-1, 1, 1, 1]], ["tile_d", "sp", [-1, 2, 1, 1]], ["tile_y", "sp", [-1, 1, 2, 2]], ["tile_x", "sp", [-1, 1, 4, 1]], ["tile_rc", "sp", [-1, 12]], ["tile_rd", "sp", [-1, 1]], ["tile_ry", "sp", [-1, 5]], ["tile_rx", "sp", [-1, 5]], ["auto_unroll_max_step", "ot", 0], ["unroll_explicit", "ot", 0]]}], "r": [[0.004106104, 0.004106276], 0, 0.9531333446502686, 1578492525.3340108], "v": 0.1}
{"i": ["cuda", "schedule_conv3d_transpose_nchw_cuda", [[1, 24, 64, 64, 64], [24, 1, 1, 5, 5], [1, 2, 2], [0, 2, 2], [0, 1, 1], "float32"], {}, ["schedule_conv3d_transpose_nchw_cuda", [1, 24, 64, 64, 64], [24, 1, 1, 5, 5], [1, 2, 2], [0, 2, 2], [0, 1, 1], "float32"], {"i": 65473298, "t": "", "c": null, "e": [["tile_f", "sp", [-1, 1, 1, 1]], ["tile_d", "sp", [-1, 4, 1, 1]], ["tile_y", "sp", [-1, 2, 2, 2]], ["tile_x", "sp", [-1, 1, 4, 1]], ["tile_rc", "sp", [-1, 12]], ["tile_rd", "sp", [-1, 1]], ["tile_ry", "sp", [-1, 5]], ["tile_rx", "sp", [-1, 5]], ["auto_unroll_max_step", "ot", 0], ["unroll_explicit", "ot", 0]]}], "r": [[0.002361758, 0.00219698425], 0, 0.9400918483734131, 1578492525.8808973], "v": 0.1}
{"i": ["cuda", "schedule_conv3d_transpose_nchw_cuda", [[1, 24, 64, 64, 64], [24, 1, 1, 5, 5], [1, 2, 2], [0, 2, 2], [0, 1, 1], "float32"], {}, ["schedule_conv3d_transpose_nchw_cuda", [1, 24, 64, 64, 64], [24, 1, 1, 5, 5], [1, 2, 2], [0, 2, 2], [0, 1, 1], "float32"], {"i": 297713556, "t": "", "c": null, "e": [["tile_f", "sp", [-1, 1, 1, 1]], ["tile_d", "sp", [-1, 1, 1, 1]], ["tile_y", "sp", [-1, 2, 2, 1]], ["tile_x", "sp", [-1, 1, 4, 1]], ["tile_rc", "sp", [-1, 12]], ["tile_rd", "sp", [-1, 1]], ["tile_ry", "sp", [-1, 5]], ["tile_rx", "sp", [-1, 5]], ["auto_unroll_max_step", "ot", 0], ["unroll_explicit", "ot", 1]]}], "r": [[0.00477436925, 0.004774027], 0, 1.0849244594573975, 1578492526.4893103], "v": 0.1}
{"i": ["cuda", "schedule_conv3d_transpose_nchw_cuda", [[1, 24, 64, 64, 64], [24, 1, 1, 5, 5], [1, 2, 2], [0, 2, 2], [0, 1, 1], "float32"], {}, ["schedule_conv3d_transpose_nchw_cuda", [1, 24, 64, 64, 64], [24, 1, 1, 5, 5], [1, 2, 2], [0, 2, 2], [0, 1, 1], "float32"], {"i": 65470274, "t": "", "c": null, "e": [["tile_f", "sp", [-1, 1, 1, 1]], ["tile_d", "sp", [-1, 4, 1, 1]], ["tile_y", "sp", [-1, 1, 2, 1]], ["tile_x", "sp", [-1, 1, 4, 1]], ["tile_rc", "sp", [-1, 12]], ["tile_rd", "sp", [-1, 1]], ["tile_ry", "sp", [-1, 5]], ["tile_rx", "sp", [-1, 5]], ["auto_unroll_max_step", "ot", 0], ["unroll_explicit", "ot", 0]]}], "r": [[0.00450330275, 0.00449991425], 0, 1.0294415950775146, 1578492527.052675], "v": 0.1}
{"i": ["cuda", "schedule_conv3d_transpose_nchw_cuda", [[1, 24, 64, 64, 64], [24, 1, 1, 5, 5], [1, 2, 2], [0, 2, 2], [0, 1, 1], "float32"], {}, ["schedule_conv3d_transpose_nchw_cuda", [1, 24, 64, 64, 64], [24, 1, 1, 5, 5], [1, 2, 2], [0, 2, 2], [0, 1, 1], "float32"], {"i": 65475482, "t": "", "c": null, "e": [["tile_f", "sp", [-1, 1, 1, 1]], ["tile_d", "sp", [-1, 4, 1, 1]], ["tile_y", "sp", [-1, 1, 2, 4]], ["tile_x", "sp", [-1, 1, 4, 1]], ["tile_rc", "sp", [-1, 12]], ["tile_rd", "sp", [-1, 1]], ["tile_ry", "sp", [-1, 5]], ["tile_rx", "sp", [-1, 5]], ["auto_unroll_max_step", "ot", 0], ["unroll_explicit", "ot", 0]]}], "r": [[0.00399685, 0.00400007825], 0, 1.0448648929595947, 1578492527.606426], "v": 0.1}
{"i": ["cuda", "schedule_conv3d_transpose_nchw_cuda", [[1, 24, 64, 64, 64], [24, 1, 1, 5, 5], [1, 2, 2], [0, 2, 2], [0, 1, 1], "float32"], {}, ["schedule_conv3d_transpose_nchw_cuda", [1, 24, 64, 64, 64], [24, 1, 1, 5, 5], [1, 2, 2], [0, 2, 2], [0, 1, 1], "float32"], {"i": 65470357, "t": "", "c": null, "e": [["tile_f", "sp", [-1, 1, 1, 1]], ["tile_d", "sp", [-1, 2, 1, 1]], ["tile_y", "sp", [-1, 2, 2, 1]], ["tile_x", "sp", [-1, 1, 4, 1]], ["tile_rc", "sp", [-1, 12]], ["tile_rd", "sp", [-1, 1]], ["tile_ry", "sp", [-1, 5]], ["tile_rx", "sp", [-1, 5]], ["auto_unroll_max_step", "ot", 0], ["unroll_explicit", "ot", 0]]}], "r": [[0.00385610375, 0.00385387625], 0, 1.038860559463501, 1578492528.1869235], "v": 0.1}
{"i": ["cuda", "schedule_conv3d_transpose_nchw_cuda", [[1, 24, 64, 64, 64], [24, 1, 1, 5, 5], [1, 2, 2], [0, 2, 2], [0, 1, 1], "float32"], {}, ["schedule_conv3d_transpose_nchw_cuda", [1, 24, 64, 64, 64], [24, 1, 1, 5, 5], [1, 2, 2], [0, 2, 2], [0, 1, 1], "float32"], {"i": 64260756, "t": "", "c": null, "e": [["tile_f", "sp", [-1, 1, 1, 1]], ["tile_d", "sp", [-1, 1, 1, 1]], ["tile_y", "sp", [-1, 2, 2, 1]], ["tile_x", "sp", [-1, 1, 4, 1]], ["tile_rc", "sp", [-1, 8]], ["tile_rd", "sp", [-1, 1]], ["tile_ry", "sp", [-1, 5]], ["tile_rx", "sp", [-1, 5]], ["auto_unroll_max_step", "ot", 0], ["unroll_explicit", "ot", 0]]}], "r": [[0.003869673, 0.00386910075], 0, 1.0315401554107666, 1578492528.7412708], "v": 0.1}
{"i": ["cuda", "schedule_conv3d_transpose_nchw_cuda", [[1, 24, 64, 64, 64], [24, 1, 1, 5, 5], [1, 2, 2], [0, 2, 2], [0, 1, 1], "float32"], {}, ["schedule_conv3d_transpose_nchw_cuda", [1, 24, 64, 64, 64], [24, 1, 1, 5, 5], [1, 2, 2], [0, 2, 2], [0, 1, 1], "float32"], {"i": 64260757, "t": "", "c": null, "e": [["tile_f", "sp", [-1, 1, 1, 1]], ["tile_d", "sp", [-1, 2, 1, 1]], ["tile_y", "sp", [-1, 2, 2, 1]], ["tile_x", "sp", [-1, 1, 4, 1]], ["tile_rc", "sp", [-1, 8]], ["tile_rd", "sp", [-1, 1]], ["tile_ry", "sp", [-1, 5]], ["tile_rx", "sp", [-1, 5]], ["auto_unroll_max_step", "ot", 0], ["unroll_explicit", "ot", 0]]}], "r": [[0.00339903925, 0.0033985195], 0, 0.9788219928741455, 1578492529.3015852], "v": 0.1}
{"i": ["cuda", "schedule_conv3d_transpose_nchw_cuda", [[1, 24, 64, 64, 64], [24, 1, 1, 5, 5], [1, 2, 2], [0, 2, 2], [0, 1, 1], "float32"], {}, ["schedule_conv3d_transpose_nchw_cuda", [1, 24, 64, 64, 64], [24, 1, 1, 5, 5], [1, 2, 2], [0, 2, 2], [0, 1, 1], "float32"], {"i": 297713641, "t": "", "c": null, "e": [["tile_f", "sp", [-1, 1, 1, 1]], ["tile_d", "sp", [-1, 2, 1, 1]], ["tile_y", "sp", [-1, 4, 2, 1]], ["tile_x", "sp", [-1, 1, 4, 1]], ["tile_rc", "sp", [-1, 12]], ["tile_rd", "sp", [-1, 1]], ["tile_ry", "sp", [-1, 5]], ["tile_rx", "sp", [-1, 5]], ["auto_unroll_max_step", "ot", 0], ["unroll_explicit", "ot", 1]]}], "r": [[0.00345348675, 0.003451592], 0, 1.1254539489746094, 1578492529.962935], "v": 0.1}
{"i": ["cuda", "schedule_conv3d_transpose_nchw_cuda", [[1, 24, 64, 64, 64], [24, 1, 1, 5, 5], [1, 2, 2], [0, 2, 2], [0, 1, 1], "float32"], {}, ["schedule_conv3d_transpose_nchw_cuda", [1, 24, 64, 64, 64], [24, 1, 1, 5, 5], [1, 2, 2], [0, 2, 2], [0, 1, 1], "float32"], {"i": 64263724, "t": "", "c": null, "e": [["tile_f", "sp", [-1, 1, 1, 1]], ["tile_d", "sp", [-1, 1, 1, 2]], ["tile_y", "sp", [-1, 2, 2, 2]], ["tile_x", "sp", [-1, 1, 4, 1]], ["tile_rc", "sp", [-1, 8]], ["tile_rd", "sp", [-1, 1]], ["tile_ry", "sp", [-1, 5]], ["tile_rx", "sp", [-1, 5]], ["auto_unroll_max_step", "ot", 0], ["unroll_explicit", "ot", 0]]}], "r": [[0.00165671875, 0.001656513], 0, 0.9343705177307129, 1578492530.4892995], "v": 0.1}
{"i": ["cuda", "schedule_conv3d_transpose_nchw_cuda", [[1, 24, 64, 64, 64], [24, 1, 1, 5, 5], [1, 2, 2], [0, 2, 2], [0, 1, 1], "float32"], {}, ["schedule_conv3d_transpose_nchw_cuda", [1, 24, 64, 64, 64], [24, 1, 1, 5, 5], [1, 2, 2], [0, 2, 2], [0, 1, 1], "float32"], {"i": 373921214, "t": "", "c": null, "e": [["tile_f", "sp", [-1, 1, 1, 1]], ["tile_d", "sp", [-1, 4, 1, 1]], ["tile_y", "sp", [-1, 1, 2, 2]], ["tile_x", "sp", [-1, 1, 4, 1]], ["tile_rc", "sp", [-1, 8]], ["tile_rd", "sp", [-1, 1]], ["tile_ry", "sp", [-1, 5]], ["tile_rx", "sp", [-1, 5]], ["auto_unroll_max_step", "ot", 512], ["unroll_explicit", "ot", 1]]}], "r": [[0.0019088755, 0.0019071455], 0, 1.236910104751587, 1578492531.115287], "v": 0.1}
{"i": ["cuda", "schedule_conv3d_transpose_nchw_cuda", [[1, 24, 64, 64, 64], [24, 1, 1, 5, 5], [1, 2, 2], [0, 2, 2], [0, 1, 1], "float32"], {}, ["schedule_conv3d_transpose_nchw_cuda", [1, 24, 64, 64, 64], [24, 1, 1, 5, 5], [1, 2, 2], [0, 2, 2], [0, 1, 1], "float32"], {"i": 373921213, "t": "", "c": null, "e": [["tile_f", "sp", [-1, 1, 1, 1]], ["tile_d", "sp", [-1, 2, 1, 1]], ["tile_y", "sp", [-1, 1, 2, 2]], ["tile_x", "sp", [-1, 1, 4, 1]], ["tile_rc", "sp", [-1, 8]], ["tile_rd", "sp", [-1, 1]], ["tile_ry", "sp", [-1, 5]], ["tile_rx", "sp", [-1, 5]], ["auto_unroll_max_step", "ot", 512], ["unroll_explicit", "ot", 1]]}], "r": [[0.00216800025, 0.00216746925], 0, 0.9607458114624023, 1578492532.5710537], "v": 0.1}
{"i": ["cuda", "schedule_conv3d_transpose_nchw_cuda", [[1, 24, 64, 64, 64], [24, 1, 1, 5, 5], [1, 2, 2], [0, 2, 2], [0, 1, 1], "float32"], {}, ["schedule_conv3d_transpose_nchw_cuda", [1, 24, 64, 64, 64], [24, 1, 1, 5, 5], [1, 2, 2], [0, 2, 2], [0, 1, 1], "float32"], {"i": 451335697, "t": "", "c": null, "e": [["tile_f", "sp", [-1, 1, 1, 1]], ["tile_d", "sp", [-1, 2, 1, 1]], ["tile_y", "sp", [-1, 2, 2, 2]], ["tile_x", "sp", [-1, 1, 4, 1]], ["tile_rc", "sp", [-1, 8]], ["tile_rd", "sp", [-1, 1]], ["tile_ry", "sp", [-1, 5]], ["tile_rx", "sp", [-1, 5]], ["auto_unroll_max_step", "ot", 1500], ["unroll_explicit", "ot", 1]]}], "r": [[0.0015783145, 0.0015850735], 0, 1.308997631072998, 1578492726.1362824], "v": 0.1}
{"i": ["cuda", "schedule_conv3d_transpose_nchw_cuda", [[1, 24, 64, 64, 64], [24, 1, 1, 5, 5], [1, 2, 2], [0, 2, 2], [0, 1, 1], "float32"], {}, ["schedule_conv3d_transpose_nchw_cuda", [1, 24, 64, 64, 64], [24, 1, 1, 5, 5], [1, 2, 2], [0, 2, 2], [0, 1, 1], "float32"], {"i": 452545297, "t": "", "c": null, "e": [["tile_f", "sp", [-1, 1, 1, 1]], ["tile_d", "sp", [-1, 2, 1, 1]], ["tile_y", "sp", [-1, 2, 2, 2]], ["tile_x", "sp", [-1, 1, 4, 1]], ["tile_rc", "sp", [-1, 12]], ["tile_rd", "sp", [-1, 1]], ["tile_ry", "sp", [-1, 5]], ["tile_rx", "sp", [-1, 5]], ["auto_unroll_max_step", "ot", 1500], ["unroll_explicit", "ot", 1]]}], "r": [[0.0014609015, 0.00146074075], 0, 1.3622643947601318, 1578492726.677664], "v": 0.1}
{"i": ["cuda", "schedule_conv3d_transpose_nchw_cuda", [[1, 24, 64, 64, 64], [24, 1, 1, 5, 5], [1, 2, 2], [0, 2, 2], [0, 1, 1], "float32"], {}, ["schedule_conv3d_transpose_nchw_cuda", [1, 24, 64, 64, 64], [24, 1, 1, 5, 5], [1, 2, 2], [0, 2, 2], [0, 1, 1], "float32"], {"i": 453755008, "t": "", "c": null, "e": [["tile_f", "sp", [-1, 1, 1, 1]], ["tile_d", "sp", [-1, 1, 1, 2]], ["tile_y", "sp", [-1, 4, 2, 2]], ["tile_x", "sp", [-1, 1, 4, 1]], ["tile_rc", "sp", [-1, 24]], ["tile_rd", "sp", [-1, 1]], ["tile_ry", "sp", [-1, 5]], ["tile_rx", "sp", [-1, 5]], ["auto_unroll_max_step", "ot", 1500], ["unroll_explicit", "ot", 1]]}], "r": [[0.001407225, 0.00140625875], 0, 2.0965983867645264, 1578492727.4263203], "v": 0.1}
