auto_log/((1, 24, 64, 128, 128), (12, 24, 1, 1, 1), (1, 12, 64, 128, 128), (1, 1, 1), (0, 0, 0), 1, 1, None)_bwd_inp_grad.log
{"i": ["cuda", "schedule_conv3d_transpose_nchw_cuda", [[1, 12, 64, 128, 128], [12, 24, 1, 1, 1], [1, 1, 1], [0, 0, 0], [0, 0, 0], "float32"], {}, ["schedule_conv3d_transpose_nchw_cuda", [1, 12, 64, 128, 128], [12, 24, 1, 1, 1], [1, 1, 1], [0, 0, 0], [0, 0, 0], "float32"], {"i": 1203656783, "t": "", "c": null, "e": [["tile_f", "sp", [-1, 3, 2, 4]], ["tile_d", "sp", [-1, 1, 1, 4]], ["tile_y", "sp", [-1, 1, 4, 4]], ["tile_x", "sp", [-1, 8, 4, 2]], ["tile_rc", "sp", [-1, 1]], ["tile_rd", "sp", [-1, 1]], ["tile_ry", "sp", [-1, 1]], ["tile_rx", "sp", [-1, 1]], ["auto_unroll_max_step", "ot", 1500], ["unroll_explicit", "ot", 0]]}], "r": [[0.008184999, 0.0081973425], 0, 6.0649189949035645, 1578500193.2576034], "v": 0.1}
{"i": ["cuda", "schedule_conv3d_transpose_nchw_cuda", [[1, 12, 64, 128, 128], [12, 24, 1, 1, 1], [1, 1, 1], [0, 0, 0], [0, 0, 0], "float32"], {}, ["schedule_conv3d_transpose_nchw_cuda", [1, 12, 64, 128, 128], [12, 24, 1, 1, 1], [1, 1, 1], [0, 0, 0], [0, 0, 0], "float32"], {"i": 337220257, "t": "", "c": null, "e": [["tile_f", "sp", [-1, 8, 3, 1]], ["tile_d", "sp", [-1, 1, 1, 4]], ["tile_y", "sp", [-1, 1, 8, 1]], ["tile_x", "sp", [-1, 1, 16, 2]], ["tile_rc", "sp", [-1, 4]], ["tile_rd", "sp", [-1, 1]], ["tile_ry", "sp", [-1, 1]], ["tile_rx", "sp", [-1, 1]], ["auto_unroll_max_step", "ot", 0], ["unroll_explicit", "ot", 0]]}], "r": [[0.00054586525, 0.000547498], 0, 0.9909214973449707, 1578500196.6874313], "v": 0.1}
{"i": ["cuda", "schedule_conv3d_transpose_nchw_cuda", [[1, 12, 64, 128, 128], [12, 24, 1, 1, 1], [1, 1, 1], [0, 0, 0], [0, 0, 0], "float32"], {}, ["schedule_conv3d_transpose_nchw_cuda", [1, 12, 64, 128, 128], [12, 24, 1, 1, 1], [1, 1, 1], [0, 0, 0], [0, 0, 0], "float32"], {"i": 3110858324, "t": "", "c": null, "e": [["tile_f", "sp", [-1, 6, 1, 1]], ["tile_d", "sp", [-1, 2, 1, 2]], ["tile_y", "sp", [-1, 1, 1, 8]], ["tile_x", "sp", [-1, 4, 4, 1]], ["tile_rc", "sp", [-1, 3]], ["tile_rd", "sp", [-1, 1]], ["tile_ry", "sp", [-1, 1]], ["tile_rx", "sp", [-1, 1]], ["auto_unroll_max_step", "ot", 1500], ["unroll_explicit", "ot", 1]]}], "r": [[0.0606307095, 0.06015919025], 0, 5.485219717025757, 1578500205.1851807], "v": 0.1}
{"i": ["cuda", "schedule_conv3d_transpose_nchw_cuda", [[1, 12, 64, 128, 128], [12, 24, 1, 1, 1], [1, 1, 1], [0, 0, 0], [0, 0, 0], "float32"], {}, ["schedule_conv3d_transpose_nchw_cuda", [1, 12, 64, 128, 128], [12, 24, 1, 1, 1], [1, 1, 1], [0, 0, 0], [0, 0, 0], "float32"], {"i": 702809665, "t": "", "c": null, "e": [["tile_f", "sp", [-1, 2, 3, 4]], ["tile_d", "sp", [-1, 1, 1, 8]], ["tile_y", "sp", [-1, 1, 1, 4]], ["tile_x", "sp", [-1, 2, 32, 1]], ["tile_rc", "sp", [-1, 2]], ["tile_rd", "sp", [-1, 1]], ["tile_ry", "sp", [-1, 1]], ["tile_rx", "sp", [-1, 1]], ["auto_unroll_max_step", "ot", 512], ["unroll_explicit", "ot", 0]]}], "r": [[0.00564800775, 0.0056610845], 0, 2.6309077739715576, 1578500443.407139], "v": 0.1}
{"i": ["cuda", "schedule_conv3d_transpose_nchw_cuda", [[1, 12, 64, 128, 128], [12, 24, 1, 1, 1], [1, 1, 1], [0, 0, 0], [0, 0, 0], "float32"], {}, ["schedule_conv3d_transpose_nchw_cuda", [1, 12, 64, 128, 128], [12, 24, 1, 1, 1], [1, 1, 1], [0, 0, 0], [0, 0, 0], "float32"], {"i": 2484222785, "t": "", "c": null, "e": [["tile_f", "sp", [-1, 2, 3, 4]], ["tile_d", "sp", [-1, 1, 1, 1]], ["tile_y", "sp", [-1, 2, 4, 4]], ["tile_x", "sp", [-1, 2, 8, 4]], ["tile_rc", "sp", [-1, 2]], ["tile_rd", "sp", [-1, 1]], ["tile_ry", "sp", [-1, 1]], ["tile_rx", "sp", [-1, 1]], ["auto_unroll_max_step", "ot", 512], ["unroll_explicit", "ot", 1]]}], "r": [[0.004812848, 0.00480414], 0, 3.4126627445220947, 1578500444.3677547], "v": 0.1}
{"i": ["cuda", "schedule_conv3d_transpose_nchw_cuda", [[1, 12, 64, 128, 128], [12, 24, 1, 1, 1], [1, 1, 1], [0, 0, 0], [0, 0, 0], "float32"], {}, ["schedule_conv3d_transpose_nchw_cuda", [1, 12, 64, 128, 128], [12, 24, 1, 1, 1], [1, 1, 1], [0, 0, 0], [0, 0, 0], "float32"], {"i": 144786377, "t": "", "c": null, "e": [["tile_f", "sp", [-1, 1, 8, 3]], ["tile_d", "sp", [-1, 1, 1, 4]], ["tile_y", "sp", [-1, 2, 1, 4]], ["tile_x", "sp", [-1, 2, 16, 2]], ["tile_rc", "sp", [-1, 2]], ["tile_rd", "sp", [-1, 1]], ["tile_ry", "sp", [-1, 1]], ["tile_rx", "sp", [-1, 1]], ["auto_unroll_max_step", "ot", 0], ["unroll_explicit", "ot", 0]]}], "r": [[0.007567125, 0.00756844275], 0, 1.9471170902252197, 1578500445.1150992], "v": 0.1}
{"i": ["cuda", "schedule_conv3d_transpose_nchw_cuda", [[1, 12, 64, 128, 128], [12, 24, 1, 1, 1], [1, 1, 1], [0, 0, 0], [0, 0, 0], "float32"], {}, ["schedule_conv3d_transpose_nchw_cuda", [1, 12, 64, 128, 128], [12, 24, 1, 1, 1], [1, 1, 1], [0, 0, 0], [0, 0, 0], "float32"], {"i": 1306002386, "t": "", "c": null, "e": [["tile_f", "sp", [-1, 1, 6, 4]], ["tile_d", "sp", [-1, 1, 1, 4]], ["tile_y", "sp", [-1, 2, 1, 4]], ["tile_x", "sp", [-1, 2, 16, 2]], ["tile_rc", "sp", [-1, 2]], ["tile_rd", "sp", [-1, 1]], ["tile_ry", "sp", [-1, 1]], ["tile_rx", "sp", [-1, 1]], ["auto_unroll_max_step", "ot", 1500], ["unroll_explicit", "ot", 0]]}], "r": [[0.005409015, 0.00556154575], 0, 3.1523749828338623, 1578500446.4099386], "v": 0.1}
{"i": ["cuda", "schedule_conv3d_transpose_nchw_cuda", [[1, 12, 64, 128, 128], [12, 24, 1, 1, 1], [1, 1, 1], [0, 0, 0], [0, 0, 0], "float32"], {}, ["schedule_conv3d_transpose_nchw_cuda", [1, 12, 64, 128, 128], [12, 24, 1, 1, 1], [1, 1, 1], [0, 0, 0], [0, 0, 0], "float32"], {"i": 725394377, "t": "", "c": null, "e": [["tile_f", "sp", [-1, 1, 8, 3]], ["tile_d", "sp", [-1, 1, 1, 4]], ["tile_y", "sp", [-1, 2, 1, 4]], ["tile_x", "sp", [-1, 2, 16, 2]], ["tile_rc", "sp", [-1, 2]], ["tile_rd", "sp", [-1, 1]], ["tile_ry", "sp", [-1, 1]], ["tile_rx", "sp", [-1, 1]], ["auto_unroll_max_step", "ot", 512], ["unroll_explicit", "ot", 0]]}], "r": [[0.0033920135, 0.0033829975], 0, 2.052295207977295, 1578500447.2335603], "v": 0.1}
{"i": ["cuda", "schedule_conv3d_transpose_nchw_cuda", [[1, 12, 64, 128, 128], [12, 24, 1, 1, 1], [1, 1, 1], [0, 0, 0], [0, 0, 0], "float32"], {}, ["schedule_conv3d_transpose_nchw_cuda", [1, 12, 64, 128, 128], [12, 24, 1, 1, 1], [1, 1, 1], [0, 0, 0], [0, 0, 0], "float32"], {"i": 122201665, "t": "", "c": null, "e": [["tile_f", "sp", [-1, 2, 3, 4]], ["tile_d", "sp", [-1, 1, 1, 8]], ["tile_y", "sp", [-1, 1, 1, 4]], ["tile_x", "sp", [-1, 2, 32, 1]], ["tile_rc", "sp", [-1, 2]], ["tile_rd", "sp", [-1, 1]], ["tile_ry", "sp", [-1, 1]], ["tile_rx", "sp", [-1, 1]], ["auto_unroll_max_step", "ot", 0], ["unroll_explicit", "ot", 0]]}], "r": [[0.0078487935, 0.00784274825], 0, 2.2257590293884277, 1578500447.9907892], "v": 0.1}
{"i": ["cuda", "schedule_conv3d_transpose_nchw_cuda", [[1, 12, 64, 128, 128], [12, 24, 1, 1, 1], [1, 1, 1], [0, 0, 0], [0, 0, 0], "float32"], {}, ["schedule_conv3d_transpose_nchw_cuda", [1, 12, 64, 128, 128], [12, 24, 1, 1, 1], [1, 1, 1], [0, 0, 0], [0, 0, 0], "float32"], {"i": 725394386, "t": "", "c": null, "e": [["tile_f", "sp", [-1, 1, 6, 4]], ["tile_d", "sp", [-1, 1, 1, 4]], ["tile_y", "sp", [-1, 2, 1, 4]], ["tile_x", "sp", [-1, 2, 16, 2]], ["tile_rc", "sp", [-1, 2]], ["tile_rd", "sp", [-1, 1]], ["tile_ry", "sp", [-1, 1]], ["tile_rx", "sp", [-1, 1]], ["auto_unroll_max_step", "ot", 512], ["unroll_explicit", "ot", 0]]}], "r": [[0.0049135655, 0.0049174175], 0, 2.826611280441284, 1578500449.0385249], "v": 0.1}
{"i": ["cuda", "schedule_conv3d_transpose_nchw_cuda", [[1, 12, 64, 128, 128], [12, 24, 1, 1, 1], [1, 1, 1], [0, 0, 0], [0, 0, 0], "float32"], {}, ["schedule_conv3d_transpose_nchw_cuda", [1, 12, 64, 128, 128], [12, 24, 1, 1, 1], [1, 1, 1], [0, 0, 0], [0, 0, 0], "float32"], {"i": 1903735745, "t": "", "c": null, "e": [["tile_f", "sp", [-1, 2, 3, 4]], ["tile_d", "sp", [-1, 1, 1, 1]], ["tile_y", "sp", [-1, 1, 4, 8]], ["tile_x", "sp", [-1, 2, 8, 4]], ["tile_rc", "sp", [-1, 2]], ["tile_rd", "sp", [-1, 1]], ["tile_ry", "sp", [-1, 1]], ["tile_rx", "sp", [-1, 1]], ["auto_unroll_max_step", "ot", 0], ["unroll_explicit", "ot", 1]]}], "r": [[0.00791863725, 0.00789735275], 0, 2.3392510414123535, 1578500449.7766082], "v": 0.1}
{"i": ["cuda", "schedule_conv3d_transpose_nchw_cuda", [[1, 12, 64, 128, 128], [12, 24, 1, 1, 1], [1, 1, 1], [0, 0, 0], [0, 0, 0], "float32"], {}, ["schedule_conv3d_transpose_nchw_cuda", [1, 12, 64, 128, 128], [12, 24, 1, 1, 1], [1, 1, 1], [0, 0, 0], [0, 0, 0], "float32"], {"i": 1884224777, "t": "", "c": null, "e": [["tile_f", "sp", [-1, 1, 8, 3]], ["tile_d", "sp", [-1, 1, 1, 4]], ["tile_y", "sp", [-1, 1, 2, 4]], ["tile_x", "sp", [-1, 4, 8, 2]], ["tile_rc", "sp", [-1, 2]], ["tile_rd", "sp", [-1, 1]], ["tile_ry", "sp", [-1, 1]], ["tile_rx", "sp", [-1, 1]], ["auto_unroll_max_step", "ot", 0], ["unroll_explicit", "ot", 1]]}], "r": [[0.007619142, 0.00761905825], 0, 2.1772286891937256, 1578500450.5439873], "v": 0.1}
{"i": ["cuda", "schedule_conv3d_transpose_nchw_cuda", [[1, 12, 64, 128, 128], [12, 24, 1, 1, 1], [1, 1, 1], [0, 0, 0], [0, 0, 0], "float32"], {}, ["schedule_conv3d_transpose_nchw_cuda", [1, 12, 64, 128, 128], [12, 24, 1, 1, 1], [1, 1, 1], [0, 0, 0], [0, 0, 0], "float32"], {"i": 144786386, "t": "", "c": null, "e": [["tile_f", "sp", [-1, 1, 6, 4]], ["tile_d", "sp", [-1, 1, 1, 4]], ["tile_y", "sp", [-1, 2, 1, 4]], ["tile_x", "sp", [-1, 2, 16, 2]], ["tile_rc", "sp", [-1, 2]], ["tile_rd", "sp", [-1, 1]], ["tile_ry", "sp", [-1, 1]], ["tile_rx", "sp", [-1, 1]], ["auto_unroll_max_step", "ot", 0], ["unroll_explicit", "ot", 0]]}], "r": [[0.0074265655, 0.00742846025], 0, 2.173522472381592, 1578500451.364877], "v": 0.1}
{"i": ["cuda", "schedule_conv3d_transpose_nchw_cuda", [[1, 12, 64, 128, 128], [12, 24, 1, 1, 1], [1, 1, 1], [0, 0, 0], [0, 0, 0], "float32"], {}, ["schedule_conv3d_transpose_nchw_cuda", [1, 12, 64, 128, 128], [12, 24, 1, 1, 1], [1, 1, 1], [0, 0, 0], [0, 0, 0], "float32"], {"i": 3047826386, "t": "", "c": null, "e": [["tile_f", "sp", [-1, 1, 6, 4]], ["tile_d", "sp", [-1, 1, 1, 4]], ["tile_y", "sp", [-1, 2, 1, 4]], ["tile_x", "sp", [-1, 2, 16, 2]], ["tile_rc", "sp", [-1, 2]], ["tile_rd", "sp", [-1, 1]], ["tile_ry", "sp", [-1, 1]], ["tile_rx", "sp", [-1, 1]], ["auto_unroll_max_step", "ot", 1500], ["unroll_explicit", "ot", 1]]}], "r": [[0.00473596975, 0.0047438075], 0, 4.366084814071655, 1578500452.6467187], "v": 0.1}
{"i": ["cuda", "schedule_conv3d_transpose_nchw_cuda", [[1, 12, 64, 128, 128], [12, 24, 1, 1, 1], [1, 1, 1], [0, 0, 0], [0, 0, 0], "float32"], {}, ["schedule_conv3d_transpose_nchw_cuda", [1, 12, 64, 128, 128], [12, 24, 1, 1, 1], [1, 1, 1], [0, 0, 0], [0, 0, 0], "float32"], {"i": 1886610377, "t": "", "c": null, "e": [["tile_f", "sp", [-1, 1, 8, 3]], ["tile_d", "sp", [-1, 1, 1, 4]], ["tile_y", "sp", [-1, 2, 1, 4]], ["tile_x", "sp", [-1, 2, 16, 2]], ["tile_rc", "sp", [-1, 2]], ["tile_rd", "sp", [-1, 1]], ["tile_ry", "sp", [-1, 1]], ["tile_rx", "sp", [-1, 1]], ["auto_unroll_max_step", "ot", 0], ["unroll_explicit", "ot", 1]]}], "r": [[0.007575241, 0.0075764545], 0, 1.8932814598083496, 1578500453.309214], "v": 0.1}
{"i": ["cuda", "schedule_conv3d_transpose_nchw_cuda", [[1, 12, 64, 128, 128], [12, 24, 1, 1, 1], [1, 1, 1], [0, 0, 0], [0, 0, 0], "float32"], {}, ["schedule_conv3d_transpose_nchw_cuda", [1, 12, 64, 128, 128], [12, 24, 1, 1, 1], [1, 1, 1], [0, 0, 0], [0, 0, 0], "float32"], {"i": 2444633665, "t": "", "c": null, "e": [["tile_f", "sp", [-1, 2, 3, 4]], ["tile_d", "sp", [-1, 1, 1, 8]], ["tile_y", "sp", [-1, 1, 1, 4]], ["tile_x", "sp", [-1, 2, 32, 1]], ["tile_rc", "sp", [-1, 2]], ["tile_rd", "sp", [-1, 1]], ["tile_ry", "sp", [-1, 1]], ["tile_rx", "sp", [-1, 1]], ["auto_unroll_max_step", "ot", 512], ["unroll_explicit", "ot", 1]]}], "r": [[0.00503573875, 0.00504487], 0, 3.248213768005371, 1578500458.201719], "v": 0.1}
{"i": ["cuda", "schedule_conv3d_transpose_nchw_cuda", [[1, 12, 64, 128, 128], [12, 24, 1, 1, 1], [1, 1, 1], [0, 0, 0], [0, 0, 0], "float32"], {}, ["schedule_conv3d_transpose_nchw_cuda", [1, 12, 64, 128, 128], [12, 24, 1, 1, 1], [1, 1, 1], [0, 0, 0], [0, 0, 0], "float32"], {"i": 142400777, "t": "", "c": null, "e": [["tile_f", "sp", [-1, 1, 8, 3]], ["tile_d", "sp", [-1, 1, 1, 4]], ["tile_y", "sp", [-1, 1, 2, 4]], ["tile_x", "sp", [-1, 4, 8, 2]], ["tile_rc", "sp", [-1, 2]], ["tile_rd", "sp", [-1, 1]], ["tile_ry", "sp", [-1, 1]], ["tile_rx", "sp", [-1, 1]], ["auto_unroll_max_step", "ot", 0], ["unroll_explicit", "ot", 0]]}], "r": [[0.00763036825, 0.0076251885], 0, 1.9581847190856934, 1578500458.8552248], "v": 0.1}
{"i": ["cuda", "schedule_conv3d_transpose_nchw_cuda", [[1, 12, 64, 128, 128], [12, 24, 1, 1, 1], [1, 1, 1], [0, 0, 0], [0, 0, 0], "float32"], {}, ["schedule_conv3d_transpose_nchw_cuda", [1, 12, 64, 128, 128], [12, 24, 1, 1, 1], [1, 1, 1], [0, 0, 0], [0, 0, 0], "float32"], {"i": 1864025665, "t": "", "c": null, "e": [["tile_f", "sp", [-1, 2, 3, 4]], ["tile_d", "sp", [-1, 1, 1, 8]], ["tile_y", "sp", [-1, 1, 1, 4]], ["tile_x", "sp", [-1, 2, 32, 1]], ["tile_rc", "sp", [-1, 2]], ["tile_rd", "sp", [-1, 1]], ["tile_ry", "sp", [-1, 1]], ["tile_rx", "sp", [-1, 1]], ["auto_unroll_max_step", "ot", 0], ["unroll_explicit", "ot", 1]]}], "r": [[0.007816325, 0.00781441525], 0, 2.0726892948150635, 1578500459.5298996], "v": 0.1}
{"i": ["cuda", "schedule_conv3d_transpose_nchw_cuda", [[1, 12, 64, 128, 128], [12, 24, 1, 1, 1], [1, 1, 1], [0, 0, 0], [0, 0, 0], "float32"], {}, ["schedule_conv3d_transpose_nchw_cuda", [1, 12, 64, 128, 128], [12, 24, 1, 1, 1], [1, 1, 1], [0, 0, 0], [0, 0, 0], "float32"], {"i": 1306002377, "t": "", "c": null, "e": [["tile_f", "sp", [-1, 1, 8, 3]], ["tile_d", "sp", [-1, 1, 1, 4]], ["tile_y", "sp", [-1, 2, 1, 4]], ["tile_x", "sp", [-1, 2, 16, 2]], ["tile_rc", "sp", [-1, 2]], ["tile_rd", "sp", [-1, 1]], ["tile_ry", "sp", [-1, 1]], ["tile_rx", "sp", [-1, 1]], ["auto_unroll_max_step", "ot", 1500], ["unroll_explicit", "ot", 0]]}], "r": [[0.003709118, 0.00372112925], 0, 2.1131021976470947, 1578500460.5294702], "v": 0.1}
{"i": ["cuda", "schedule_conv3d_transpose_nchw_cuda", [[1, 12, 64, 128, 128], [12, 24, 1, 1, 1], [1, 1, 1], [0, 0, 0], [0, 0, 0], "float32"], {}, ["schedule_conv3d_transpose_nchw_cuda", [1, 12, 64, 128, 128], [12, 24, 1, 1, 1], [1, 1, 1], [0, 0, 0], [0, 0, 0], "float32"], {"i": 700627345, "t": "", "c": null, "e": [["tile_f", "sp", [-1, 2, 3, 4]], ["tile_d", "sp", [-1, 2, 1, 1]], ["tile_y", "sp", [-1, 1, 1, 16]], ["tile_x", "sp", [-1, 4, 16, 1]], ["tile_rc", "sp", [-1, 2]], ["tile_rd", "sp", [-1, 1]], ["tile_ry", "sp", [-1, 1]], ["tile_rx", "sp", [-1, 1]], ["auto_unroll_max_step", "ot", 512], ["unroll_explicit", "ot", 0]]}], "r": [[0.00917053775, 0.0093025935], 0, 3.2004780769348145, 1578500461.8179853], "v": 0.1}
{"i": ["cuda", "schedule_conv3d_transpose_nchw_cuda", [[1, 12, 64, 128, 128], [12, 24, 1, 1, 1], [1, 1, 1], [0, 0, 0], [0, 0, 0], "float32"], {}, ["schedule_conv3d_transpose_nchw_cuda", [1, 12, 64, 128, 128], [12, 24, 1, 1, 1], [1, 1, 1], [0, 0, 0], [0, 0, 0], "float32"], {"i": 723008777, "t": "", "c": null, "e": [["tile_f", "sp", [-1, 1, 8, 3]], ["tile_d", "sp", [-1, 1, 1, 4]], ["tile_y", "sp", [-1, 1, 2, 4]], ["tile_x", "sp", [-1, 4, 8, 2]], ["tile_rc", "sp", [-1, 2]], ["tile_rd", "sp", [-1, 1]], ["tile_ry", "sp", [-1, 1]], ["tile_rx", "sp", [-1, 1]], ["auto_unroll_max_step", "ot", 512], ["unroll_explicit", "ot", 0]]}], "r": [[0.00343124425, 0.0034246235], 0, 2.0610923767089844, 1578500462.6721501], "v": 0.1}
{"i": ["cuda", "schedule_conv3d_transpose_nchw_cuda", [[1, 12, 64, 128, 128], [12, 24, 1, 1, 1], [1, 1, 1], [0, 0, 0], [0, 0, 0], "float32"], {}, ["schedule_conv3d_transpose_nchw_cuda", [1, 12, 64, 128, 128], [12, 24, 1, 1, 1], [1, 1, 1], [0, 0, 0], [0, 0, 0], "float32"], {"i": 1303616777, "t": "", "c": null, "e": [["tile_f", "sp", [-1, 1, 8, 3]], ["tile_d", "sp", [-1, 1, 1, 4]], ["tile_y", "sp", [-1, 1, 2, 4]], ["tile_x", "sp", [-1, 4, 8, 2]], ["tile_rc", "sp", [-1, 2]], ["tile_rd", "sp", [-1, 1]], ["tile_ry", "sp", [-1, 1]], ["tile_rx", "sp", [-1, 1]], ["auto_unroll_max_step", "ot", 1500], ["unroll_explicit", "ot", 0]]}], "r": [[0.0037955115, 0.0037917005], 0, 2.323108196258545, 1578500463.6425753], "v": 0.1}
{"i": ["cuda", "schedule_conv3d_transpose_nchw_cuda", [[1, 12, 64, 128, 128], [12, 24, 1, 1, 1], [1, 1, 1], [0, 0, 0], [0, 0, 0], "float32"], {}, ["schedule_conv3d_transpose_nchw_cuda", [1, 12, 64, 128, 128], [12, 24, 1, 1, 1], [1, 1, 1], [0, 0, 0], [0, 0, 0], "float32"], {"i": 3045440777, "t": "", "c": null, "e": [["tile_f", "sp", [-1, 1, 8, 3]], ["tile_d", "sp", [-1, 1, 1, 4]], ["tile_y", "sp", [-1, 1, 2, 4]], ["tile_x", "sp", [-1, 4, 8, 2]], ["tile_rc", "sp", [-1, 2]], ["tile_rd", "sp", [-1, 1]], ["tile_ry", "sp", [-1, 1]], ["tile_rx", "sp", [-1, 1]], ["auto_unroll_max_step", "ot", 1500], ["unroll_explicit", "ot", 1]]}], "r": [[0.00368597125, 0.00369724275], 0, 3.226933002471924, 1578500464.622692], "v": 0.1}
{"i": ["cuda", "schedule_conv3d_transpose_nchw_cuda", [[1, 12, 64, 128, 128], [12, 24, 1, 1, 1], [1, 1, 1], [0, 0, 0], [0, 0, 0], "float32"], {}, ["schedule_conv3d_transpose_nchw_cuda", [1, 12, 64, 128, 128], [12, 24, 1, 1, 1], [1, 1, 1], [0, 0, 0], [0, 0, 0], "float32"], {"i": 3259831752, "t": "", "c": null, "e": [["tile_f", "sp", [-1, 1, 4, 6]], ["tile_d", "sp", [-1, 1, 1, 1]], ["tile_y", "sp", [-1, 1, 8, 2]], ["tile_x", "sp", [-1, 1, 16, 4]], ["tile_rc", "sp", [-1, 4]], ["tile_rd", "sp", [-1, 1]], ["tile_ry", "sp", [-1, 1]], ["tile_rx", "sp", [-1, 1]], ["auto_unroll_max_step", "ot", 1500], ["unroll_explicit", "ot", 1]]}], "r": [[0.000563676, 0.00056212025], 0, 1.7973966598510742, 1578500465.3076086], "v": 0.1}
{"i": ["cuda", "schedule_conv3d_transpose_nchw_cuda", [[1, 12, 64, 128, 128], [12, 24, 1, 1, 1], [1, 1, 1], [0, 0, 0], [0, 0, 0], "float32"], {}, ["schedule_conv3d_transpose_nchw_cuda", [1, 12, 64, 128, 128], [12, 24, 1, 1, 1], [1, 1, 1], [0, 0, 0], [0, 0, 0], "float32"], {"i": 2484343745, "t": "", "c": null, "e": [["tile_f", "sp", [-1, 2, 3, 4]], ["tile_d", "sp", [-1, 1, 1, 1]], ["tile_y", "sp", [-1, 1, 4, 8]], ["tile_x", "sp", [-1, 2, 8, 4]], ["tile_rc", "sp", [-1, 2]], ["tile_rd", "sp", [-1, 1]], ["tile_ry", "sp", [-1, 1]], ["tile_rx", "sp", [-1, 1]], ["auto_unroll_max_step", "ot", 512], ["unroll_explicit", "ot", 1]]}], "r": [[0.00463785325, 0.004644235], 0, 3.1609179973602295, 1578500466.263576], "v": 0.1}
{"i": ["cuda", "schedule_conv3d_transpose_nchw_cuda", [[1, 12, 64, 128, 128], [12, 24, 1, 1, 1], [1, 1, 1], [0, 0, 0], [0, 0, 0], "float32"], {}, ["schedule_conv3d_transpose_nchw_cuda", [1, 12, 64, 128, 128], [12, 24, 1, 1, 1], [1, 1, 1], [0, 0, 0], [0, 0, 0], "float32"], {"i": 2467218377, "t": "", "c": null, "e": [["tile_f", "sp", [-1, 1, 8, 3]], ["tile_d", "sp", [-1, 1, 1, 4]], ["tile_y", "sp", [-1, 2, 1, 4]], ["tile_x", "sp", [-1, 2, 16, 2]], ["tile_rc", "sp", [-1, 2]], ["tile_rd", "sp", [-1, 1]], ["tile_ry", "sp", [-1, 1]], ["tile_rx", "sp", [-1, 1]], ["auto_unroll_max_step", "ot", 512], ["unroll_explicit", "ot", 1]]}], "r": [[0.00338905825, 0.003389249], 0, 2.4585764408111572, 1578500469.9668705], "v": 0.1}
{"i": ["cuda", "schedule_conv3d_transpose_nchw_cuda", [[1, 12, 64, 128, 128], [12, 24, 1, 1, 1], [1, 1, 1], [0, 0, 0], [0, 0, 0], "float32"], {}, ["schedule_conv3d_transpose_nchw_cuda", [1, 12, 64, 128, 128], [12, 24, 1, 1, 1], [1, 1, 1], [0, 0, 0], [0, 0, 0], "float32"], {"i": 1323002306, "t": "", "c": null, "e": [["tile_f", "sp", [-1, 1, 6, 4]], ["tile_d", "sp", [-1, 1, 1, 2]], ["tile_y", "sp", [-1, 1, 4, 4]], ["tile_x", "sp", [-1, 2, 8, 4]], ["tile_rc", "sp", [-1, 2]], ["tile_rd", "sp", [-1, 1]], ["tile_ry", "sp", [-1, 1]], ["tile_rx", "sp", [-1, 1]], ["auto_unroll_max_step", "ot", 1500], ["unroll_explicit", "ot", 0]]}], "r": [[0.0016042655, 0.00160439425], 0, 1.6923730373382568, 1578500470.7434285], "v": 0.1}
{"i": ["cuda", "schedule_conv3d_transpose_nchw_cuda", [[1, 12, 64, 128, 128], [12, 24, 1, 1, 1], [1, 1, 1], [0, 0, 0], [0, 0, 0], "float32"], {}, ["schedule_conv3d_transpose_nchw_cuda", [1, 12, 64, 128, 128], [12, 24, 1, 1, 1], [1, 1, 1], [0, 0, 0], [0, 0, 0], "float32"], {"i": 142400767, "t": "", "c": null, "e": [["tile_f", "sp", [-1, 1, 12, 2]], ["tile_d", "sp", [-1, 1, 1, 4]], ["tile_y", "sp", [-1, 1, 2, 4]], ["tile_x", "sp", [-1, 4, 8, 2]], ["tile_rc", "sp", [-1, 2]], ["tile_rd", "sp", [-1, 1]], ["tile_ry", "sp", [-1, 1]], ["tile_rx", "sp", [-1, 1]], ["auto_unroll_max_step", "ot", 0], ["unroll_explicit", "ot", 0]]}], "r": [[0.00791700175, 0.007916485], 0, 1.8272778987884521, 1578500472.248609], "v": 0.1}
{"i": ["cuda", "schedule_conv3d_transpose_nchw_cuda", [[1, 12, 64, 128, 128], [12, 24, 1, 1, 1], [1, 1, 1], [0, 0, 0], [0, 0, 0], "float32"], {}, ["schedule_conv3d_transpose_nchw_cuda", [1, 12, 64, 128, 128], [12, 24, 1, 1, 1], [1, 1, 1], [0, 0, 0], [0, 0, 0], "float32"], {"i": 122201647, "t": "", "c": null, "e": [["tile_f", "sp", [-1, 1, 12, 2]], ["tile_d", "sp", [-1, 1, 1, 8]], ["tile_y", "sp", [-1, 1, 1, 4]], ["tile_x", "sp", [-1, 2, 32, 1]], ["tile_rc", "sp", [-1, 2]], ["tile_rd", "sp", [-1, 1]], ["tile_ry", "sp", [-1, 1]], ["tile_rx", "sp", [-1, 1]], ["auto_unroll_max_step", "ot", 0], ["unroll_explicit", "ot", 0]]}], "r": [[0.000645579, 0.00063781075], 0, 1.2490692138671875, 1578500472.8952334], "v": 0.1}
{"i": ["cuda", "schedule_conv3d_transpose_nchw_cuda", [[1, 12, 64, 128, 128], [12, 24, 1, 1, 1], [1, 1, 1], [0, 0, 0], [0, 0, 0], "float32"], {}, ["schedule_conv3d_transpose_nchw_cuda", [1, 12, 64, 128, 128], [12, 24, 1, 1, 1], [1, 1, 1], [0, 0, 0], [0, 0, 0], "float32"], {"i": 920673727, "t": "", "c": null, "e": [["tile_f", "sp", [-1, 1, 12, 2]], ["tile_d", "sp", [-1, 2, 1, 1]], ["tile_y", "sp", [-1, 1, 1, 8]], ["tile_x", "sp", [-1, 1, 32, 2]], ["tile_rc", "sp", [-1, 4]], ["tile_rd", "sp", [-1, 1]], ["tile_ry", "sp", [-1, 1]], ["tile_rx", "sp", [-1, 1]], ["auto_unroll_max_step", "ot", 512], ["unroll_explicit", "ot", 0]]}], "r": [[0.000485954, 0.00048470125], 0, 1.2402307987213135, 1578500473.5525668], "v": 0.1}
{"i": ["cuda", "schedule_conv3d_transpose_nchw_cuda", [[1, 12, 64, 128, 128], [12, 24, 1, 1, 1], [1, 1, 1], [0, 0, 0], [0, 0, 0], "float32"], {}, ["schedule_conv3d_transpose_nchw_cuda", [1, 12, 64, 128, 128], [12, 24, 1, 1, 1], [1, 1, 1], [0, 0, 0], [0, 0, 0], "float32"], {"i": 743560504, "t": "", "c": null, "e": [["tile_f", "sp", [-1, 4, 6, 1]], ["tile_d", "sp", [-1, 1, 1, 16]], ["tile_y", "sp", [-1, 1, 2, 1]], ["tile_x", "sp", [-1, 1, 16, 4]], ["tile_rc", "sp", [-1, 2]], ["tile_rd", "sp", [-1, 1]], ["tile_ry", "sp", [-1, 1]], ["tile_rx", "sp", [-1, 1]], ["auto_unroll_max_step", "ot", 512], ["unroll_explicit", "ot", 0]]}], "r": [[0.00144138325, 0.00143785425], 0, 1.758819580078125, 1578500474.3889363], "v": 0.1}
{"i": ["cuda", "schedule_conv3d_transpose_nchw_cuda", [[1, 12, 64, 128, 128], [12, 24, 1, 1, 1], [1, 1, 1], [0, 0, 0], [0, 0, 0], "float32"], {}, ["schedule_conv3d_transpose_nchw_cuda", [1, 12, 64, 128, 128], [12, 24, 1, 1, 1], [1, 1, 1], [0, 0, 0], [0, 0, 0], "float32"], {"i": 742394306, "t": "", "c": null, "e": [["tile_f", "sp", [-1, 1, 6, 4]], ["tile_d", "sp", [-1, 1, 1, 2]], ["tile_y", "sp", [-1, 1, 4, 4]], ["tile_x", "sp", [-1, 2, 8, 4]], ["tile_rc", "sp", [-1, 2]], ["tile_rd", "sp", [-1, 1]], ["tile_ry", "sp", [-1, 1]], ["tile_rx", "sp", [-1, 1]], ["auto_unroll_max_step", "ot", 512], ["unroll_explicit", "ot", 0]]}], "r": [[0.0016038075, 0.00160012475], 0, 1.6025900840759277, 1578500475.045963], "v": 0.1}
{"i": ["cuda", "schedule_conv3d_transpose_nchw_cuda", [[1, 12, 64, 128, 128], [12, 24, 1, 1, 1], [1, 1, 1], [0, 0, 0], [0, 0, 0], "float32"], {}, ["schedule_conv3d_transpose_nchw_cuda", [1, 12, 64, 128, 128], [12, 24, 1, 1, 1], [1, 1, 1], [0, 0, 0], [0, 0, 0], "float32"], {"i": 3064826306, "t": "", "c": null, "e": [["tile_f", "sp", [-1, 1, 6, 4]], ["tile_d", "sp", [-1, 1, 1, 2]], ["tile_y", "sp", [-1, 1, 4, 4]], ["tile_x", "sp", [-1, 2, 8, 4]], ["tile_rc", "sp", [-1, 2]], ["tile_rd", "sp", [-1, 1]], ["tile_ry", "sp", [-1, 1]], ["tile_rx", "sp", [-1, 1]], ["auto_unroll_max_step", "ot", 1500], ["unroll_explicit", "ot", 1]]}], "r": [[0.0009594505, 0.0009539935], 0, 2.114990472793579, 1578500476.468502], "v": 0.1}
{"i": ["cuda", "schedule_conv3d_transpose_nchw_cuda", [[1, 12, 64, 128, 128], [12, 24, 1, 1, 1], [1, 1, 1], [0, 0, 0], [0, 0, 0], "float32"], {}, ["schedule_conv3d_transpose_nchw_cuda", [1, 12, 64, 128, 128], [12, 24, 1, 1, 1], [1, 1, 1], [0, 0, 0], [0, 0, 0], "float32"], {"i": 1884224767, "t": "", "c": null, "e": [["tile_f", "sp", [-1, 1, 12, 2]], ["tile_d", "sp", [-1, 1, 1, 4]], ["tile_y", "sp", [-1, 1, 2, 4]], ["tile_x", "sp", [-1, 4, 8, 2]], ["tile_rc", "sp", [-1, 2]], ["tile_rd", "sp", [-1, 1]], ["tile_ry", "sp", [-1, 1]], ["tile_rx", "sp", [-1, 1]], ["auto_unroll_max_step", "ot", 0], ["unroll_explicit", "ot", 1]]}], "r": [[0.007908455, 0.00790298075], 0, 1.7438464164733887, 1578500477.1196897], "v": 0.1}
{"i": ["cuda", "schedule_conv3d_transpose_nchw_cuda", [[1, 12, 64, 128, 128], [12, 24, 1, 1, 1], [1, 1, 1], [0, 0, 0], [0, 0, 0], "float32"], {}, ["schedule_conv3d_transpose_nchw_cuda", [1, 12, 64, 128, 128], [12, 24, 1, 1, 1], [1, 1, 1], [0, 0, 0], [0, 0, 0], "float32"], {"i": 1324168504, "t": "", "c": null, "e": [["tile_f", "sp", [-1, 4, 6, 1]], ["tile_d", "sp", [-1, 1, 1, 16]], ["tile_y", "sp", [-1, 1, 2, 1]], ["tile_x", "sp", [-1, 1, 16, 4]], ["tile_rc", "sp", [-1, 2]], ["tile_rd", "sp", [-1, 1]], ["tile_ry", "sp", [-1, 1]], ["tile_rx", "sp", [-1, 1]], ["auto_unroll_max_step", "ot", 1500], ["unroll_explicit", "ot", 0]]}], "r": [[0.00143769975, 0.00143620725], 0, 1.5461726188659668, 1578500477.7645955], "v": 0.1}
{"i": ["cuda", "schedule_conv3d_transpose_nchw_cuda", [[1, 12, 64, 128, 128], [12, 24, 1, 1, 1], [1, 1, 1], [0, 0, 0], [0, 0, 0], "float32"], {}, ["schedule_conv3d_transpose_nchw_cuda", [1, 12, 64, 128, 128], [12, 24, 1, 1, 1], [1, 1, 1], [0, 0, 0], [0, 0, 0], "float32"], {"i": 161385966, "t": "", "c": null, "e": [["tile_f", "sp", [-1, 2, 6, 2]], ["tile_d", "sp", [-1, 1, 1, 8]], ["tile_y", "sp", [-1, 1, 4, 1]], ["tile_x", "sp", [-1, 2, 8, 4]], ["tile_rc", "sp", [-1, 2]], ["tile_rd", "sp", [-1, 1]], ["tile_ry", "sp", [-1, 1]], ["tile_rx", "sp", [-1, 1]], ["auto_unroll_max_step", "ot", 0], ["unroll_explicit", "ot", 0]]}], "r": [[0.00226078375, 0.00227656625], 0, 1.8900175094604492, 1578500481.4984066], "v": 0.1}
{"i": ["cuda", "schedule_conv3d_transpose_nchw_cuda", [[1, 12, 64, 128, 128], [12, 24, 1, 1, 1], [1, 1, 1], [0, 0, 0], [0, 0, 0], "float32"], {}, ["schedule_conv3d_transpose_nchw_cuda", [1, 12, 64, 128, 128], [12, 24, 1, 1, 1], [1, 1, 1], [0, 0, 0], [0, 0, 0], "float32"], {"i": 3064425966, "t": "", "c": null, "e": [["tile_f", "sp", [-1, 2, 6, 2]], ["tile_d", "sp", [-1, 1, 1, 8]], ["tile_y", "sp", [-1, 1, 4, 1]], ["tile_x", "sp", [-1, 2, 8, 4]], ["tile_rc", "sp", [-1, 2]], ["tile_rd", "sp", [-1, 1]], ["tile_ry", "sp", [-1, 1]], ["tile_rx", "sp", [-1, 1]], ["auto_unroll_max_step", "ot", 1500], ["unroll_explicit", "ot", 1]]}], "r": [[0.0009461835, 0.00094702975], 0, 2.2159171104431152, 1578500482.2916236], "v": 0.1}
{"i": ["cuda", "schedule_conv3d_transpose_nchw_cuda", [[1, 12, 64, 128, 128], [12, 24, 1, 1, 1], [1, 1, 1], [0, 0, 0], [0, 0, 0], "float32"], {}, ["schedule_conv3d_transpose_nchw_cuda", [1, 12, 64, 128, 128], [12, 24, 1, 1, 1], [1, 1, 1], [0, 0, 0], [0, 0, 0], "float32"], {"i": 1322601966, "t": "", "c": null, "e": [["tile_f", "sp", [-1, 2, 6, 2]], ["tile_d", "sp", [-1, 1, 1, 8]], ["tile_y", "sp", [-1, 1, 4, 1]], ["tile_x", "sp", [-1, 2, 8, 4]], ["tile_rc", "sp", [-1, 2]], ["tile_rd", "sp", [-1, 1]], ["tile_ry", "sp", [-1, 1]], ["tile_rx", "sp", [-1, 1]], ["auto_unroll_max_step", "ot", 1500], ["unroll_explicit", "ot", 0]]}], "r": [[0.00161951475, 0.00161517825], 0, 1.7412335872650146, 1578500483.9483297], "v": 0.1}
{"i": ["cuda", "schedule_conv3d_transpose_nchw_cuda", [[1, 12, 64, 128, 128], [12, 24, 1, 1, 1], [1, 1, 1], [0, 0, 0], [0, 0, 0], "float32"], {}, ["schedule_conv3d_transpose_nchw_cuda", [1, 12, 64, 128, 128], [12, 24, 1, 1, 1], [1, 1, 1], [0, 0, 0], [0, 0, 0], "float32"], {"i": 1905294847, "t": "", "c": null, "e": [["tile_f", "sp", [-1, 1, 12, 2]], ["tile_d", "sp", [-1, 2, 1, 1]], ["tile_y", "sp", [-1, 2, 1, 8]], ["tile_x", "sp", [-1, 1, 16, 4]], ["tile_rc", "sp", [-1, 2]], ["tile_rd", "sp", [-1, 1]], ["tile_ry", "sp", [-1, 1]], ["tile_rx", "sp", [-1, 1]], ["auto_unroll_max_step", "ot", 0], ["unroll_explicit", "ot", 1]]}], "r": [[0.0078526165, 0.00785927925], 0, 1.9807441234588623, 1578500484.6849382], "v": 0.1}
{"i": ["cuda", "schedule_conv3d_transpose_nchw_cuda", [[1, 12, 64, 128, 128], [12, 24, 1, 1, 1], [1, 1, 1], [0, 0, 0], [0, 0, 0], "float32"], {}, ["schedule_conv3d_transpose_nchw_cuda", [1, 12, 64, 128, 128], [12, 24, 1, 1, 1], [1, 1, 1], [0, 0, 0], [0, 0, 0], "float32"], {"i": 2081889727, "t": "", "c": null, "e": [["tile_f", "sp", [-1, 1, 12, 2]], ["tile_d", "sp", [-1, 2, 1, 1]], ["tile_y", "sp", [-1, 1, 1, 8]], ["tile_x", "sp", [-1, 1, 32, 2]], ["tile_rc", "sp", [-1, 4]], ["tile_rd", "sp", [-1, 1]], ["tile_ry", "sp", [-1, 1]], ["tile_rx", "sp", [-1, 1]], ["auto_unroll_max_step", "ot", 0], ["unroll_explicit", "ot", 1]]}], "r": [[0.0004952395, 0.00049365575], 0, 1.1322455406188965, 1578500485.3112206], "v": 0.1}
{"i": ["cuda", "schedule_conv3d_transpose_nchw_cuda", [[1, 12, 64, 128, 128], [12, 24, 1, 1, 1], [1, 1, 1], [0, 0, 0], [0, 0, 0], "float32"], {}, ["schedule_conv3d_transpose_nchw_cuda", [1, 12, 64, 128, 128], [12, 24, 1, 1, 1], [1, 1, 1], [0, 0, 0], [0, 0, 0], "float32"], {"i": 1501214475, "t": "", "c": null, "e": [["tile_f", "sp", [-1, 1, 3, 8]], ["tile_d", "sp", [-1, 1, 1, 1]], ["tile_y", "sp", [-1, 1, 4, 4]], ["tile_x", "sp", [-1, 1, 32, 2]], ["tile_rc", "sp", [-1, 4]], ["tile_rd", "sp", [-1, 1]], ["tile_ry", "sp", [-1, 1]], ["tile_rx", "sp", [-1, 1]], ["auto_unroll_max_step", "ot", 1500], ["unroll_explicit", "ot", 0]]}], "r": [[0.0006139305, 0.00061842475], 0, 1.5080475807189941, 1578500486.083676], "v": 0.1}
{"i": ["cuda", "schedule_conv3d_transpose_nchw_cuda", [[1, 12, 64, 128, 128], [12, 24, 1, 1, 1], [1, 1, 1], [0, 0, 0], [0, 0, 0], "float32"], {}, ["schedule_conv3d_transpose_nchw_cuda", [1, 12, 64, 128, 128], [12, 24, 1, 1, 1], [1, 1, 1], [0, 0, 0], [0, 0, 0], "float32"], {"i": 340065727, "t": "", "c": null, "e": [["tile_f", "sp", [-1, 1, 12, 2]], ["tile_d", "sp", [-1, 2, 1, 1]], ["tile_y", "sp", [-1, 1, 1, 8]], ["tile_x", "sp", [-1, 1, 32, 2]], ["tile_rc", "sp", [-1, 4]], ["tile_rd", "sp", [-1, 1]], ["tile_ry", "sp", [-1, 1]], ["tile_rx", "sp", [-1, 1]], ["auto_unroll_max_step", "ot", 0], ["unroll_explicit", "ot", 0]]}], "r": [[0.00049960575, 0.0004940415], 0, 1.1429250240325928, 1578500486.6643195], "v": 0.1}
{"i": ["cuda", "schedule_conv3d_transpose_nchw_cuda", [[1, 12, 64, 128, 128], [12, 24, 1, 1, 1], [1, 1, 1], [0, 0, 0], [0, 0, 0], "float32"], {}, ["schedule_conv3d_transpose_nchw_cuda", [1, 12, 64, 128, 128], [12, 24, 1, 1, 1], [1, 1, 1], [0, 0, 0], [0, 0, 0], "float32"], {"i": 3243038475, "t": "", "c": null, "e": [["tile_f", "sp", [-1, 1, 3, 8]], ["tile_d", "sp", [-1, 1, 1, 1]], ["tile_y", "sp", [-1, 1, 4, 4]], ["tile_x", "sp", [-1, 1, 32, 2]], ["tile_rc", "sp", [-1, 4]], ["tile_rd", "sp", [-1, 1]], ["tile_ry", "sp", [-1, 1]], ["tile_rx", "sp", [-1, 1]], ["auto_unroll_max_step", "ot", 1500], ["unroll_explicit", "ot", 1]]}], "r": [[0.00062059025, 0.0006157605], 0, 1.9692189693450928, 1578500487.435344], "v": 0.1}
{"i": ["cuda", "schedule_conv3d_transpose_nchw_cuda", [[1, 12, 64, 128, 128], [12, 24, 1, 1, 1], [1, 1, 1], [0, 0, 0], [0, 0, 0], "float32"], {}, ["schedule_conv3d_transpose_nchw_cuda", [1, 12, 64, 128, 128], [12, 24, 1, 1, 1], [1, 1, 1], [0, 0, 0], [0, 0, 0], "float32"], {"i": 339998475, "t": "", "c": null, "e": [["tile_f", "sp", [-1, 1, 3, 8]], ["tile_d", "sp", [-1, 1, 1, 1]], ["tile_y", "sp", [-1, 1, 4, 4]], ["tile_x", "sp", [-1, 1, 32, 2]], ["tile_rc", "sp", [-1, 4]], ["tile_rd", "sp", [-1, 1]], ["tile_ry", "sp", [-1, 1]], ["tile_rx", "sp", [-1, 1]], ["auto_unroll_max_step", "ot", 0], ["unroll_explicit", "ot", 0]]}], "r": [[0.00046486125, 0.000465057], 0, 1.17159104347229, 1578500488.0648181], "v": 0.1}
{"i": ["cuda", "schedule_conv3d_transpose_nchw_cuda", [[1, 12, 64, 128, 128], [12, 24, 1, 1, 1], [1, 1, 1], [0, 0, 0], [0, 0, 0], "float32"], {}, ["schedule_conv3d_transpose_nchw_cuda", [1, 12, 64, 128, 128], [12, 24, 1, 1, 1], [1, 1, 1], [0, 0, 0], [0, 0, 0], "float32"], {"i": 1498297617, "t": "", "c": null, "e": [["tile_f", "sp", [-1, 8, 3, 1]], ["tile_d", "sp", [-1, 1, 1, 32]], ["tile_y", "sp", [-1, 1, 1, 1]], ["tile_x", "sp", [-1, 1, 16, 2]], ["tile_rc", "sp", [-1, 4]], ["tile_rd", "sp", [-1, 1]], ["tile_ry", "sp", [-1, 1]], ["tile_rx", "sp", [-1, 1]], ["auto_unroll_max_step", "ot", 1500], ["unroll_explicit", "ot", 0]]}], "r": [[0.005546816, 0.00554912575], 0, 2.387434244155884, 1578500489.2626176], "v": 0.1}
{"i": ["cuda", "schedule_conv3d_transpose_nchw_cuda", [[1, 12, 64, 128, 128], [12, 24, 1, 1, 1], [1, 1, 1], [0, 0, 0], [0, 0, 0], "float32"], {}, ["schedule_conv3d_transpose_nchw_cuda", [1, 12, 64, 128, 128], [12, 24, 1, 1, 1], [1, 1, 1], [0, 0, 0], [0, 0, 0], "float32"], {"i": 1903549821, "t": "", "c": null, "e": [["tile_f", "sp", [-1, 6, 1, 4]], ["tile_d", "sp", [-1, 1, 1, 2]], ["tile_y", "sp", [-1, 4, 1, 4]], ["tile_x", "sp", [-1, 2, 8, 4]], ["tile_rc", "sp", [-1, 2]], ["tile_rd", "sp", [-1, 1]], ["tile_ry", "sp", [-1, 1]], ["tile_rx", "sp", [-1, 1]], ["auto_unroll_max_step", "ot", 0], ["unroll_explicit", "ot", 1]]}], "r": [[0.02766769475, 0.02769714425], 0, 2.7654223442077637, 1578500497.070252], "v": 0.1}
{"i": ["cuda", "schedule_conv3d_transpose_nchw_cuda", [[1, 12, 64, 128, 128], [12, 24, 1, 1, 1], [1, 1, 1], [0, 0, 0], [0, 0, 0], "float32"], {}, ["schedule_conv3d_transpose_nchw_cuda", [1, 12, 64, 128, 128], [12, 24, 1, 1, 1], [1, 1, 1], [0, 0, 0], [0, 0, 0], "float32"], {"i": 1498297651, "t": "", "c": null, "e": [["tile_f", "sp", [-1, 8, 1, 3]], ["tile_d", "sp", [-1, 1, 1, 32]], ["tile_y", "sp", [-1, 1, 1, 1]], ["tile_x", "sp", [-1, 1, 16, 2]], ["tile_rc", "sp", [-1, 4]], ["tile_rd", "sp", [-1, 1]], ["tile_ry", "sp", [-1, 1]], ["tile_rx", "sp", [-1, 1]], ["auto_unroll_max_step", "ot", 1500], ["unroll_explicit", "ot", 0]]}], "r": [[0.009324165, 0.00931532925], 0, 4.530177593231201, 1578500498.0568318], "v": 0.1}
{"i": ["cuda", "schedule_conv3d_transpose_nchw_cuda", [[1, 12, 64, 128, 128], [12, 24, 1, 1, 1], [1, 1, 1], [0, 0, 0], [0, 0, 0], "float32"], {}, ["schedule_conv3d_transpose_nchw_cuda", [1, 12, 64, 128, 128], [12, 24, 1, 1, 1], [1, 1, 1], [0, 0, 0], [0, 0, 0], "float32"], {"i": 1916825447, "t": "", "c": null, "e": [["tile_f", "sp", [-1, 24, 1, 1]], ["tile_d", "sp", [-1, 1, 1, 16]], ["tile_y", "sp", [-1, 2, 1, 1]], ["tile_x", "sp", [-1, 1, 8, 8]], ["tile_rc", "sp", [-1, 2]], ["tile_rd", "sp", [-1, 1]], ["tile_ry", "sp", [-1, 1]], ["tile_rx", "sp", [-1, 1]], ["auto_unroll_max_step", "ot", 0], ["unroll_explicit", "ot", 1]]}], "r": [[0.043711631, 0.0436732685], 0, 2.144592761993408, 1578500499.1023626], "v": 0.1}
{"i": ["cuda", "schedule_conv3d_transpose_nchw_cuda", [[1, 12, 64, 128, 128], [12, 24, 1, 1, 1], [1, 1, 1], [0, 0, 0], [0, 0, 0], "float32"], {}, ["schedule_conv3d_transpose_nchw_cuda", [1, 12, 64, 128, 128], [12, 24, 1, 1, 1], [1, 1, 1], [0, 0, 0], [0, 0, 0], "float32"], {"i": 2079573491, "t": "", "c": null, "e": [["tile_f", "sp", [-1, 8, 1, 3]], ["tile_d", "sp", [-1, 1, 1, 2]], ["tile_y", "sp", [-1, 1, 1, 16]], ["tile_x", "sp", [-1, 1, 16, 2]], ["tile_rc", "sp", [-1, 4]], ["tile_rd", "sp", [-1, 1]], ["tile_ry", "sp", [-1, 1]], ["tile_rx", "sp", [-1, 1]], ["auto_unroll_max_step", "ot", 0], ["unroll_explicit", "ot", 1]]}], "r": [[0.00909073525, 0.00908273025], 0, 2.7906277179718018, 1578500499.9345639], "v": 0.1}
{"i": ["cuda", "schedule_conv3d_transpose_nchw_cuda", [[1, 12, 64, 128, 128], [12, 24, 1, 1, 1], [1, 1, 1], [0, 0, 0], [0, 0, 0], "float32"], {}, ["schedule_conv3d_transpose_nchw_cuda", [1, 12, 64, 128, 128], [12, 24, 1, 1, 1], [1, 1, 1], [0, 0, 0], [0, 0, 0], "float32"], {"i": 2078905613, "t": "", "c": null, "e": [["tile_f", "sp", [-1, 12, 2, 1]], ["tile_d", "sp", [-1, 1, 1, 32]], ["tile_y", "sp", [-1, 1, 1, 1]], ["tile_x", "sp", [-1, 1, 16, 2]], ["tile_rc", "sp", [-1, 4]], ["tile_rd", "sp", [-1, 1]], ["tile_ry", "sp", [-1, 1]], ["tile_rx", "sp", [-1, 1]], ["auto_unroll_max_step", "ot", 0], ["unroll_explicit", "ot", 1]]}], "r": [[0.0079988805, 0.0080050575], 0, 1.2827086448669434, 1578500500.6204817], "v": 0.1}
{"i": ["cuda", "schedule_conv3d_transpose_nchw_cuda", [[1, 12, 64, 128, 128], [12, 24, 1, 1, 1], [1, 1, 1], [0, 0, 0], [0, 0, 0], "float32"], {}, ["schedule_conv3d_transpose_nchw_cuda", [1, 12, 64, 128, 128], [12, 24, 1, 1, 1], [1, 1, 1], [0, 0, 0], [0, 0, 0], "float32"], {"i": 2659513651, "t": "", "c": null, "e": [["tile_f", "sp", [-1, 8, 1, 3]], ["tile_d", "sp", [-1, 1, 1, 32]], ["tile_y", "sp", [-1, 1, 1, 1]], ["tile_x", "sp", [-1, 1, 16, 2]], ["tile_rc", "sp", [-1, 4]], ["tile_rd", "sp", [-1, 1]], ["tile_ry", "sp", [-1, 1]], ["tile_rx", "sp", [-1, 1]], ["auto_unroll_max_step", "ot", 512], ["unroll_explicit", "ot", 1]]}], "r": [[0.00926205325, 0.0093008045], 0, 6.8487701416015625, 1578500501.635495], "v": 0.1}
{"i": ["cuda", "schedule_conv3d_transpose_nchw_cuda", [[1, 12, 64, 128, 128], [12, 24, 1, 1, 1], [1, 1, 1], [0, 0, 0], [0, 0, 0], "float32"], {}, ["schedule_conv3d_transpose_nchw_cuda", [1, 12, 64, 128, 128], [12, 24, 1, 1, 1], [1, 1, 1], [0, 0, 0], [0, 0, 0], "float32"], {"i": 2098691891, "t": "", "c": null, "e": [["tile_f", "sp", [-1, 8, 1, 3]], ["tile_d", "sp", [-1, 1, 1, 2]], ["tile_y", "sp", [-1, 2, 1, 4]], ["tile_x", "sp", [-1, 1, 16, 4]], ["tile_rc", "sp", [-1, 4]], ["tile_rd", "sp", [-1, 1]], ["tile_ry", "sp", [-1, 1]], ["tile_rx", "sp", [-1, 1]], ["auto_unroll_max_step", "ot", 0], ["unroll_explicit", "ot", 1]]}], "r": [[0.00855840925, 0.008565128], 0, 2.5564229488372803, 1578500502.446797], "v": 0.1}
{"i": ["cuda", "schedule_conv3d_transpose_nchw_cuda", [[1, 12, 64, 128, 128], [12, 24, 1, 1, 1], [1, 1, 1], [0, 0, 0], [0, 0, 0], "float32"], {}, ["schedule_conv3d_transpose_nchw_cuda", [1, 12, 64, 128, 128], [12, 24, 1, 1, 1], [1, 1, 1], [0, 0, 0], [0, 0, 0], "float32"], {"i": 2679299891, "t": "", "c": null, "e": [["tile_f", "sp", [-1, 8, 1, 3]], ["tile_d", "sp", [-1, 1, 1, 2]], ["tile_y", "sp", [-1, 2, 1, 4]], ["tile_x", "sp", [-1, 1, 16, 4]], ["tile_rc", "sp", [-1, 4]], ["tile_rd", "sp", [-1, 1]], ["tile_ry", "sp", [-1, 1]], ["tile_rx", "sp", [-1, 1]], ["auto_unroll_max_step", "ot", 512], ["unroll_explicit", "ot", 1]]}], "r": [[0.00889150975, 0.00887686575], 0, 6.449253082275391, 1578500503.4232323], "v": 0.1}
{"i": ["cuda", "schedule_conv3d_transpose_nchw_cuda", [[1, 12, 64, 128, 128], [12, 24, 1, 1, 1], [1, 1, 1], [0, 0, 0], [0, 0, 0], "float32"], {}, ["schedule_conv3d_transpose_nchw_cuda", [1, 12, 64, 128, 128], [12, 24, 1, 1, 1], [1, 1, 1], [0, 0, 0], [0, 0, 0], "float32"], {"i": 2659513613, "t": "", "c": null, "e": [["tile_f", "sp", [-1, 12, 2, 1]], ["tile_d", "sp", [-1, 1, 1, 32]], ["tile_y", "sp", [-1, 1, 1, 1]], ["tile_x", "sp", [-1, 1, 16, 2]], ["tile_rc", "sp", [-1, 4]], ["tile_rd", "sp", [-1, 1]], ["tile_ry", "sp", [-1, 1]], ["tile_rx", "sp", [-1, 1]], ["auto_unroll_max_step", "ot", 512], ["unroll_explicit", "ot", 1]]}], "r": [[0.0079140825, 0.00790861525], 0, 1.6862154006958008, 1578500504.14048], "v": 0.1}
{"i": ["cuda", "schedule_conv3d_transpose_nchw_cuda", [[1, 12, 64, 128, 128], [12, 24, 1, 1, 1], [1, 1, 1], [0, 0, 0], [0, 0, 0], "float32"], {}, ["schedule_conv3d_transpose_nchw_cuda", [1, 12, 64, 128, 128], [12, 24, 1, 1, 1], [1, 1, 1], [0, 0, 0], [0, 0, 0], "float32"], {"i": 2078905617, "t": "", "c": null, "e": [["tile_f", "sp", [-1, 8, 3, 1]], ["tile_d", "sp", [-1, 1, 1, 32]], ["tile_y", "sp", [-1, 1, 1, 1]], ["tile_x", "sp", [-1, 1, 16, 2]], ["tile_rc", "sp", [-1, 4]], ["tile_rd", "sp", [-1, 1]], ["tile_ry", "sp", [-1, 1]], ["tile_rx", "sp", [-1, 1]], ["auto_unroll_max_step", "ot", 0], ["unroll_explicit", "ot", 1]]}], "r": [[0.00825796075, 0.00825782675], 0, 1.7569284439086914, 1578500504.9387107], "v": 0.1}
{"i": ["cuda", "schedule_conv3d_transpose_nchw_cuda", [[1, 12, 64, 128, 128], [12, 24, 1, 1, 1], [1, 1, 1], [0, 0, 0], [0, 0, 0], "float32"], {}, ["schedule_conv3d_transpose_nchw_cuda", [1, 12, 64, 128, 128], [12, 24, 1, 1, 1], [1, 1, 1], [0, 0, 0], [0, 0, 0], "float32"], {"i": 3078173891, "t": "", "c": null, "e": [["tile_f", "sp", [-1, 8, 1, 3]], ["tile_d", "sp", [-1, 1, 1, 4]], ["tile_y", "sp", [-1, 1, 8, 1]], ["tile_x", "sp", [-1, 1, 8, 8]], ["tile_rc", "sp", [-1, 2]], ["tile_rd", "sp", [-1, 1]], ["tile_ry", "sp", [-1, 1]], ["tile_rx", "sp", [-1, 1]], ["auto_unroll_max_step", "ot", 1500], ["unroll_explicit", "ot", 1]]}], "r": [[0.00762635925, 0.00763237575], 0, 4.890724182128906, 1578500506.097988], "v": 0.1}
{"i": ["cuda", "schedule_conv3d_transpose_nchw_cuda", [[1, 12, 64, 128, 128], [12, 24, 1, 1, 1], [1, 1, 1], [0, 0, 0], [0, 0, 0], "float32"], {}, ["schedule_conv3d_transpose_nchw_cuda", [1, 12, 64, 128, 128], [12, 24, 1, 1, 1], [1, 1, 1], [0, 0, 0], [0, 0, 0], "float32"], {"i": 3240121651, "t": "", "c": null, "e": [["tile_f", "sp", [-1, 8, 1, 3]], ["tile_d", "sp", [-1, 1, 1, 32]], ["tile_y", "sp", [-1, 1, 1, 1]], ["tile_x", "sp", [-1, 1, 16, 2]], ["tile_rc", "sp", [-1, 4]], ["tile_rd", "sp", [-1, 1]], ["tile_ry", "sp", [-1, 1]], ["tile_rx", "sp", [-1, 1]], ["auto_unroll_max_step", "ot", 1500], ["unroll_explicit", "ot", 1]]}], "r": [[0.009291697, 0.0092899685], 0, 6.349099159240723, 1578500506.879524], "v": 0.1}
{"i": ["cuda", "schedule_conv3d_transpose_nchw_cuda", [[1, 12, 64, 128, 128], [12, 24, 1, 1, 1], [1, 1, 1], [0, 0, 0], [0, 0, 0], "float32"], {}, ["schedule_conv3d_transpose_nchw_cuda", [1, 12, 64, 128, 128], [12, 24, 1, 1, 1], [1, 1, 1], [0, 0, 0], [0, 0, 0], "float32"], {"i": 1501808066, "t": "", "c": null, "e": [["tile_f", "sp", [-1, 1, 6, 4]], ["tile_d", "sp", [-1, 1, 1, 2]], ["tile_y", "sp", [-1, 1, 2, 2]], ["tile_x", "sp", [-1, 2, 32, 2]], ["tile_rc", "sp", [-1, 4]], ["tile_rd", "sp", [-1, 1]], ["tile_ry", "sp", [-1, 1]], ["tile_rx", "sp", [-1, 1]], ["auto_unroll_max_step", "ot", 1500], ["unroll_explicit", "ot", 0]]}], "r": [[0.0007258985, 0.00072796425], 0, 1.365476369857788, 1578500723.1049604], "v": 0.1}
{"i": ["cuda", "schedule_conv3d_transpose_nchw_cuda", [[1, 12, 64, 128, 128], [12, 24, 1, 1, 1], [1, 1, 1], [0, 0, 0], [0, 0, 0], "float32"], {}, ["schedule_conv3d_transpose_nchw_cuda", [1, 12, 64, 128, 128], [12, 24, 1, 1, 1], [1, 1, 1], [0, 0, 0], [0, 0, 0], "float32"], {"i": 727664064, "t": "", "c": null, "e": [["tile_f", "sp", [-1, 1, 3, 4]], ["tile_d", "sp", [-1, 1, 1, 2]], ["tile_y", "sp", [-1, 1, 2, 2]], ["tile_x", "sp", [-1, 2, 32, 2]], ["tile_rc", "sp", [-1, 2]], ["tile_rd", "sp", [-1, 1]], ["tile_ry", "sp", [-1, 1]], ["tile_rx", "sp", [-1, 1]], ["auto_unroll_max_step", "ot", 512], ["unroll_explicit", "ot", 0]]}], "r": [[0.00068360375, 0.00069207125], 0, 1.0843183994293213, 1578500723.7169008], "v": 0.1}
{"i": ["cuda", "schedule_conv3d_transpose_nchw_cuda", [[1, 12, 64, 128, 128], [12, 24, 1, 1, 1], [1, 1, 1], [0, 0, 0], [0, 0, 0], "float32"], {}, ["schedule_conv3d_transpose_nchw_cuda", [1, 12, 64, 128, 128], [12, 24, 1, 1, 1], [1, 1, 1], [0, 0, 0], [0, 0, 0], "float32"], {"i": 727661915, "t": "", "c": null, "e": [["tile_f", "sp", [-1, 1, 3, 8]], ["tile_d", "sp", [-1, 2, 1, 1]], ["tile_y", "sp", [-1, 1, 2, 2]], ["tile_x", "sp", [-1, 2, 32, 2]], ["tile_rc", "sp", [-1, 2]], ["tile_rd", "sp", [-1, 1]], ["tile_ry", "sp", [-1, 1]], ["tile_rx", "sp", [-1, 1]], ["auto_unroll_max_step", "ot", 512], ["unroll_explicit", "ot", 0]]}], "r": [[0.00047754275, 0.000476086], 0, 1.1600139141082764, 1578500724.3722434], "v": 0.1}
{"i": ["cuda", "schedule_conv3d_transpose_nchw_cuda", [[1, 12, 64, 128, 128], [12, 24, 1, 1, 1], [1, 1, 1], [0, 0, 0], [0, 0, 0], "float32"], {}, ["schedule_conv3d_transpose_nchw_cuda", [1, 12, 64, 128, 128], [12, 24, 1, 1, 1], [1, 1, 1], [0, 0, 0], [0, 0, 0], "float32"], {"i": 1308269915, "t": "", "c": null, "e": [["tile_f", "sp", [-1, 1, 3, 8]], ["tile_d", "sp", [-1, 2, 1, 1]], ["tile_y", "sp", [-1, 1, 2, 2]], ["tile_x", "sp", [-1, 2, 32, 2]], ["tile_rc", "sp", [-1, 2]], ["tile_rd", "sp", [-1, 1]], ["tile_ry", "sp", [-1, 1]], ["tile_rx", "sp", [-1, 1]], ["auto_unroll_max_step", "ot", 1500], ["unroll_explicit", "ot", 0]]}], "r": [[0.00049251675, 0.0004778335], 0, 1.151158332824707, 1578500724.9773958], "v": 0.1}
{"i": ["cuda", "schedule_conv3d_transpose_nchw_cuda", [[1, 12, 64, 128, 128], [12, 24, 1, 1, 1], [1, 1, 1], [0, 0, 0], [0, 0, 0], "float32"], {}, ["schedule_conv3d_transpose_nchw_cuda", [1, 12, 64, 128, 128], [12, 24, 1, 1, 1], [1, 1, 1], [0, 0, 0], [0, 0, 0], "float32"], {"i": 2663969346, "t": "", "c": null, "e": [["tile_f", "sp", [-1, 1, 6, 4]], ["tile_d", "sp", [-1, 1, 1, 1]], ["tile_y", "sp", [-1, 1, 1, 4]], ["tile_x", "sp", [-1, 1, 64, 2]], ["tile_rc", "sp", [-1, 4]], ["tile_rd", "sp", [-1, 1]], ["tile_ry", "sp", [-1, 1]], ["tile_rx", "sp", [-1, 1]], ["auto_unroll_max_step", "ot", 512], ["unroll_explicit", "ot", 1]]}], "r": [[0.00044376125, 0.00044423625], 0, 1.3471958637237549, 1578500725.641466], "v": 0.1}
{"i": ["cuda", "schedule_conv3d_transpose_nchw_cuda", [[1, 12, 64, 128, 128], [12, 24, 1, 1, 1], [1, 1, 1], [0, 0, 0], [0, 0, 0], "float32"], {}, ["schedule_conv3d_transpose_nchw_cuda", [1, 12, 64, 128, 128], [12, 24, 1, 1, 1], [1, 1, 1], [0, 0, 0], [0, 0, 0], "float32"], {"i": 2469488064, "t": "", "c": null, "e": [["tile_f", "sp", [-1, 1, 3, 4]], ["tile_d", "sp", [-1, 1, 1, 2]], ["tile_y", "sp", [-1, 1, 2, 2]], ["tile_x", "sp", [-1, 2, 32, 2]], ["tile_rc", "sp", [-1, 2]], ["tile_rd", "sp", [-1, 1]], ["tile_ry", "sp", [-1, 1]], ["tile_rx", "sp", [-1, 1]], ["auto_unroll_max_step", "ot", 512], ["unroll_explicit", "ot", 1]]}], "r": [[0.000681015, 0.000678991], 0, 1.267378807067871, 1578500726.2998486], "v": 0.1}
{"i": ["cuda", "schedule_conv3d_transpose_nchw_cuda", [[1, 12, 64, 128, 128], [12, 24, 1, 1, 1], [1, 1, 1], [0, 0, 0], [0, 0, 0], "float32"], {}, ["schedule_conv3d_transpose_nchw_cuda", [1, 12, 64, 128, 128], [12, 24, 1, 1, 1], [1, 1, 1], [0, 0, 0], [0, 0, 0], "float32"], {"i": 726051275, "t": "", "c": null, "e": [["tile_f", "sp", [-1, 1, 3, 8]], ["tile_d", "sp", [-1, 1, 1, 2]], ["tile_y", "sp", [-1, 1, 2, 2]], ["tile_x", "sp", [-1, 4, 16, 2]], ["tile_rc", "sp", [-1, 2]], ["tile_rd", "sp", [-1, 1]], ["tile_ry", "sp", [-1, 1]], ["tile_rx", "sp", [-1, 1]], ["auto_unroll_max_step", "ot", 512], ["unroll_explicit", "ot", 0]]}], "r": [[0.00140801625, 0.00140783125], 0, 1.6245677471160889, 1578500727.1400747], "v": 0.1}
{"i": ["cuda", "schedule_conv3d_transpose_nchw_cuda", [[1, 12, 64, 128, 128], [12, 24, 1, 1, 1], [1, 1, 1], [0, 0, 0], [0, 0, 0], "float32"], {}, ["schedule_conv3d_transpose_nchw_cuda", [1, 12, 64, 128, 128], [12, 24, 1, 1, 1], [1, 1, 1], [0, 0, 0], [0, 0, 0], "float32"], {"i": 727664065, "t": "", "c": null, "e": [["tile_f", "sp", [-1, 2, 3, 4]], ["tile_d", "sp", [-1, 1, 1, 2]], ["tile_y", "sp", [-1, 1, 2, 2]], ["tile_x", "sp", [-1, 2, 32, 2]], ["tile_rc", "sp", [-1, 2]], ["tile_rd", "sp", [-1, 1]], ["tile_ry", "sp", [-1, 1]], ["tile_rx", "sp", [-1, 1]], ["auto_unroll_max_step", "ot", 512], ["unroll_explicit", "ot", 0]]}], "r": [[0.0004831085, 0.00047909025], 0, 1.213747262954712, 1578500727.8176012], "v": 0.1}
{"i": ["cuda", "schedule_conv3d_transpose_nchw_cuda", [[1, 12, 64, 128, 128], [12, 24, 1, 1, 1], [1, 1, 1], [0, 0, 0], [0, 0, 0], "float32"], {}, ["schedule_conv3d_transpose_nchw_cuda", [1, 12, 64, 128, 128], [12, 24, 1, 1, 1], [1, 1, 1], [0, 0, 0], [0, 0, 0], "float32"], {"i": 2469485915, "t": "", "c": null, "e": [["tile_f", "sp", [-1, 1, 3, 8]], ["tile_d", "sp", [-1, 2, 1, 1]], ["tile_y", "sp", [-1, 1, 2, 2]], ["tile_x", "sp", [-1, 2, 32, 2]], ["tile_rc", "sp", [-1, 2]], ["tile_rd", "sp", [-1, 1]], ["tile_ry", "sp", [-1, 1]], ["tile_rx", "sp", [-1, 1]], ["auto_unroll_max_step", "ot", 512], ["unroll_explicit", "ot", 1]]}], "r": [[0.00071486425, 0.0007153645], 0, 1.435190200805664, 1578500728.505037], "v": 0.1}
{"i": ["cuda", "schedule_conv3d_transpose_nchw_cuda", [[1, 12, 64, 128, 128], [12, 24, 1, 1, 1], [1, 1, 1], [0, 0, 0], [0, 0, 0], "float32"], {}, ["schedule_conv3d_transpose_nchw_cuda", [1, 12, 64, 128, 128], [12, 24, 1, 1, 1], [1, 1, 1], [0, 0, 0], [0, 0, 0], "float32"], {"i": 3244577346, "t": "", "c": null, "e": [["tile_f", "sp", [-1, 1, 6, 4]], ["tile_d", "sp", [-1, 1, 1, 1]], ["tile_y", "sp", [-1, 1, 1, 4]], ["tile_x", "sp", [-1, 1, 64, 2]], ["tile_rc", "sp", [-1, 4]], ["tile_rd", "sp", [-1, 1]], ["tile_ry", "sp", [-1, 1]], ["tile_rx", "sp", [-1, 1]], ["auto_unroll_max_step", "ot", 1500], ["unroll_explicit", "ot", 1]]}], "r": [[0.0004614765, 0.00044343725], 0, 1.3136863708496094, 1578500729.109444], "v": 0.1}
{"i": ["cuda", "schedule_conv3d_transpose_nchw_cuda", [[1, 12, 64, 128, 128], [12, 24, 1, 1, 1], [1, 1, 1], [0, 0, 0], [0, 0, 0], "float32"], {}, ["schedule_conv3d_transpose_nchw_cuda", [1, 12, 64, 128, 128], [12, 24, 1, 1, 1], [1, 1, 1], [0, 0, 0], [0, 0, 0], "float32"], {"i": 921197915, "t": "", "c": null, "e": [["tile_f", "sp", [-1, 1, 3, 8]], ["tile_d", "sp", [-1, 2, 1, 1]], ["tile_y", "sp", [-1, 1, 2, 2]], ["tile_x", "sp", [-1, 2, 32, 2]], ["tile_rc", "sp", [-1, 4]], ["tile_rd", "sp", [-1, 1]], ["tile_ry", "sp", [-1, 1]], ["tile_rx", "sp", [-1, 1]], ["auto_unroll_max_step", "ot", 512], ["unroll_explicit", "ot", 0]]}], "r": [[0.0007570545, 0.0007564365], 0, 1.527235984802246, 1578500729.871851], "v": 0.1}
{"i": ["cuda", "schedule_conv3d_transpose_nchw_cuda", [[1, 12, 64, 128, 128], [12, 24, 1, 1, 1], [1, 1, 1], [0, 0, 0], [0, 0, 0], "float32"], {}, ["schedule_conv3d_transpose_nchw_cuda", [1, 12, 64, 128, 128], [12, 24, 1, 1, 1], [1, 1, 1], [0, 0, 0], [0, 0, 0], "float32"], {"i": 2640583755, "t": "", "c": null, "e": [["tile_f", "sp", [-1, 1, 3, 8]], ["tile_d", "sp", [-1, 1, 1, 1]], ["tile_y", "sp", [-1, 1, 1, 4]], ["tile_x", "sp", [-1, 2, 64, 1]], ["tile_rc", "sp", [-1, 4]], ["tile_rd", "sp", [-1, 1]], ["tile_ry", "sp", [-1, 1]], ["tile_rx", "sp", [-1, 1]], ["auto_unroll_max_step", "ot", 512], ["unroll_explicit", "ot", 1]]}], "r": [[0.00042999125, 0.000424963], 0, 1.2431857585906982, 1578500730.5281777], "v": 0.1}
{"i": ["cuda", "schedule_conv3d_transpose_nchw_cuda", [[1, 12, 64, 128, 128], [12, 24, 1, 1, 1], [1, 1, 1], [0, 0, 0], [0, 0, 0], "float32"], {}, ["schedule_conv3d_transpose_nchw_cuda", [1, 12, 64, 128, 128], [12, 24, 1, 1, 1], [1, 1, 1], [0, 0, 0], [0, 0, 0], "float32"], {"i": 340592066, "t": "", "c": null, "e": [["tile_f", "sp", [-1, 1, 6, 4]], ["tile_d", "sp", [-1, 1, 1, 2]], ["tile_y", "sp", [-1, 1, 2, 2]], ["tile_x", "sp", [-1, 2, 32, 2]], ["tile_rc", "sp", [-1, 4]], ["tile_rd", "sp", [-1, 1]], ["tile_ry", "sp", [-1, 1]], ["tile_rx", "sp", [-1, 1]], ["auto_unroll_max_step", "ot", 0], ["unroll_explicit", "ot", 0]]}], "r": [[0.0005357325, 0.000532312], 0, 1.0922784805297852, 1578500733.3570578], "v": 0.1}
{"i": ["cuda", "schedule_conv3d_transpose_nchw_cuda", [[1, 12, 64, 128, 128], [12, 24, 1, 1, 1], [1, 1, 1], [0, 0, 0], [0, 0, 0], "float32"], {}, ["schedule_conv3d_transpose_nchw_cuda", [1, 12, 64, 128, 128], [12, 24, 1, 1, 1], [1, 1, 1], [0, 0, 0], [0, 0, 0], "float32"], {"i": 922145346, "t": "", "c": null, "e": [["tile_f", "sp", [-1, 1, 6, 4]], ["tile_d", "sp", [-1, 1, 1, 1]], ["tile_y", "sp", [-1, 1, 1, 4]], ["tile_x", "sp", [-1, 1, 64, 2]], ["tile_rc", "sp", [-1, 4]], ["tile_rd", "sp", [-1, 1]], ["tile_ry", "sp", [-1, 1]], ["tile_rx", "sp", [-1, 1]], ["auto_unroll_max_step", "ot", 512], ["unroll_explicit", "ot", 0]]}], "r": [[0.0004165265, 0.000415591], 0, 1.168799877166748, 1578500733.996007], "v": 0.1}
{"i": ["cuda", "schedule_conv3d_transpose_nchw_cuda", [[1, 12, 64, 128, 128], [12, 24, 1, 1, 1], [1, 1, 1], [0, 0, 0], [0, 0, 0], "float32"], {}, ["schedule_conv3d_transpose_nchw_cuda", [1, 12, 64, 128, 128], [12, 24, 1, 1, 1], [1, 1, 1], [0, 0, 0], [0, 0, 0], "float32"], {"i": 2470247506, "t": "", "c": null, "e": [["tile_f", "sp", [-1, 1, 6, 4]], ["tile_d", "sp", [-1, 2, 1, 2]], ["tile_y", "sp", [-1, 1, 1, 2]], ["tile_x", "sp", [-1, 1, 64, 2]], ["tile_rc", "sp", [-1, 2]], ["tile_rd", "sp", [-1, 1]], ["tile_ry", "sp", [-1, 1]], ["tile_rx", "sp", [-1, 1]], ["auto_unroll_max_step", "ot", 512], ["unroll_explicit", "ot", 1]]}], "r": [[0.00051654125, 0.00051565575], 0, 1.2181851863861084, 1578500734.6153283], "v": 0.1}
{"i": ["cuda", "schedule_conv3d_transpose_nchw_cuda", [[1, 12, 64, 128, 128], [12, 24, 1, 1, 1], [1, 1, 1], [0, 0, 0], [0, 0, 0], "float32"], {}, ["schedule_conv3d_transpose_nchw_cuda", [1, 12, 64, 128, 128], [12, 24, 1, 1, 1], [1, 1, 1], [0, 0, 0], [0, 0, 0], "float32"], {"i": 726049115, "t": "", "c": null, "e": [["tile_f", "sp", [-1, 1, 3, 8]], ["tile_d", "sp", [-1, 2, 1, 1]], ["tile_y", "sp", [-1, 1, 2, 2]], ["tile_x", "sp", [-1, 4, 16, 2]], ["tile_rc", "sp", [-1, 2]], ["tile_rd", "sp", [-1, 1]], ["tile_ry", "sp", [-1, 1]], ["tile_rx", "sp", [-1, 1]], ["auto_unroll_max_step", "ot", 512], ["unroll_explicit", "ot", 0]]}], "r": [[0.001409062, 0.00141086175], 0, 1.7137184143066406, 1578500735.4462023], "v": 0.1}
{"i": ["cuda", "schedule_conv3d_transpose_nchw_cuda", [[1, 12, 64, 128, 128], [12, 24, 1, 1, 1], [1, 1, 1], [0, 0, 0], [0, 0, 0], "float32"], {}, ["schedule_conv3d_transpose_nchw_cuda", [1, 12, 64, 128, 128], [12, 24, 1, 1, 1], [1, 1, 1], [0, 0, 0], [0, 0, 0], "float32"], {"i": 921341167, "t": "", "c": null, "e": [["tile_f", "sp", [-1, 1, 12, 2]], ["tile_d", "sp", [-1, 1, 1, 2]], ["tile_y", "sp", [-1, 1, 1, 4]], ["tile_x", "sp", [-1, 2, 32, 2]], ["tile_rc", "sp", [-1, 4]], ["tile_rd", "sp", [-1, 1]], ["tile_ry", "sp", [-1, 1]], ["tile_rx", "sp", [-1, 1]], ["auto_unroll_max_step", "ot", 512], ["unroll_explicit", "ot", 0]]}], "r": [[0.0005526915, 0.00055197175], 0, 1.2001218795776367, 1578500736.101546], "v": 0.1}
{"i": ["cuda", "schedule_conv3d_transpose_nchw_cuda", [[1, 12, 64, 128, 128], [12, 24, 1, 1, 1], [1, 1, 1], [0, 0, 0], [0, 0, 0], "float32"], {}, ["schedule_conv3d_transpose_nchw_cuda", [1, 12, 64, 128, 128], [12, 24, 1, 1, 1], [1, 1, 1], [0, 0, 0], [0, 0, 0], "float32"], {"i": 920400386, "t": "", "c": null, "e": [["tile_f", "sp", [-1, 1, 6, 4]], ["tile_d", "sp", [-1, 1, 1, 2]], ["tile_y", "sp", [-1, 2, 2, 2]], ["tile_x", "sp", [-1, 1, 32, 2]], ["tile_rc", "sp", [-1, 4]], ["tile_rd", "sp", [-1, 1]], ["tile_ry", "sp", [-1, 1]], ["tile_rx", "sp", [-1, 1]], ["auto_unroll_max_step", "ot", 512], ["unroll_explicit", "ot", 0]]}], "r": [[0.00074289425, 0.00074507], 0, 1.1464478969573975, 1578500736.7266302], "v": 0.1}
{"i": ["cuda", "schedule_conv3d_transpose_nchw_cuda", [[1, 12, 64, 128, 128], [12, 24, 1, 1, 1], [1, 1, 1], [0, 0, 0], [0, 0, 0], "float32"], {}, ["schedule_conv3d_transpose_nchw_cuda", [1, 12, 64, 128, 128], [12, 24, 1, 1, 1], [1, 1, 1], [0, 0, 0], [0, 0, 0], "float32"], {"i": 1501008386, "t": "", "c": null, "e": [["tile_f", "sp", [-1, 1, 6, 4]], ["tile_d", "sp", [-1, 1, 1, 2]], ["tile_y", "sp", [-1, 2, 2, 2]], ["tile_x", "sp", [-1, 1, 32, 2]], ["tile_rc", "sp", [-1, 4]], ["tile_rd", "sp", [-1, 1]], ["tile_ry", "sp", [-1, 1]], ["tile_rx", "sp", [-1, 1]], ["auto_unroll_max_step", "ot", 1500], ["unroll_explicit", "ot", 0]]}], "r": [[0.000754622, 0.00075484975], 0, 1.573957920074463, 1578500737.5611217], "v": 0.1}
{"i": ["cuda", "schedule_conv3d_transpose_nchw_cuda", [[1, 12, 64, 128, 128], [12, 24, 1, 1, 1], [1, 1, 1], [0, 0, 0], [0, 0, 0], "float32"], {}, ["schedule_conv3d_transpose_nchw_cuda", [1, 12, 64, 128, 128], [12, 24, 1, 1, 1], [1, 1, 1], [0, 0, 0], [0, 0, 0], "float32"], {"i": 1308272065, "t": "", "c": null, "e": [["tile_f", "sp", [-1, 2, 3, 4]], ["tile_d", "sp", [-1, 1, 1, 2]], ["tile_y", "sp", [-1, 1, 2, 2]], ["tile_x", "sp", [-1, 2, 32, 2]], ["tile_rc", "sp", [-1, 2]], ["tile_rd", "sp", [-1, 1]], ["tile_ry", "sp", [-1, 1]], ["tile_rx", "sp", [-1, 1]], ["auto_unroll_max_step", "ot", 1500], ["unroll_explicit", "ot", 0]]}], "r": [[0.000502431, 0.0004811495], 0, 1.2337324619293213, 1578500738.162421], "v": 0.1}
{"i": ["cuda", "schedule_conv3d_transpose_nchw_cuda", [[1, 12, 64, 128, 128], [12, 24, 1, 1, 1], [1, 1, 1], [0, 0, 0], [0, 0, 0], "float32"], {}, ["schedule_conv3d_transpose_nchw_cuda", [1, 12, 64, 128, 128], [12, 24, 1, 1, 1], [1, 1, 1], [0, 0, 0], [0, 0, 0], "float32"], {"i": 920675887, "t": "", "c": null, "e": [["tile_f", "sp", [-1, 1, 12, 2]], ["tile_d", "sp", [-1, 1, 1, 2]], ["tile_y", "sp", [-1, 1, 1, 8]], ["tile_x", "sp", [-1, 1, 32, 2]], ["tile_rc", "sp", [-1, 4]], ["tile_rd", "sp", [-1, 1]], ["tile_ry", "sp", [-1, 1]], ["tile_rx", "sp", [-1, 1]], ["auto_unroll_max_step", "ot", 512], ["unroll_explicit", "ot", 0]]}], "r": [[0.000555891, 0.0005545415], 0, 1.1828420162200928, 1578500738.848662], "v": 0.1}
{"i": ["cuda", "schedule_conv3d_transpose_nchw_cuda", [[1, 12, 64, 128, 128], [12, 24, 1, 1, 1], [1, 1, 1], [0, 0, 0], [0, 0, 0], "float32"], {}, ["schedule_conv3d_transpose_nchw_cuda", [1, 12, 64, 128, 128], [12, 24, 1, 1, 1], [1, 1, 1], [0, 0, 0], [0, 0, 0], "float32"], {"i": 3221191755, "t": "", "c": null, "e": [["tile_f", "sp", [-1, 1, 3, 8]], ["tile_d", "sp", [-1, 1, 1, 1]], ["tile_y", "sp", [-1, 1, 1, 4]], ["tile_x", "sp", [-1, 2, 64, 1]], ["tile_rc", "sp", [-1, 4]], ["tile_rd", "sp", [-1, 1]], ["tile_ry", "sp", [-1, 1]], ["tile_rx", "sp", [-1, 1]], ["auto_unroll_max_step", "ot", 1500], ["unroll_explicit", "ot", 1]]}], "r": [[0.000632663, 0.00062876675], 0, 1.7986044883728027, 1578500739.601572], "v": 0.1}
{"i": ["cuda", "schedule_conv3d_transpose_nchw_cuda", [[1, 12, 64, 128, 128], [12, 24, 1, 1, 1], [1, 1, 1], [0, 0, 0], [0, 0, 0], "float32"], {}, ["schedule_conv3d_transpose_nchw_cuda", [1, 12, 64, 128, 128], [12, 24, 1, 1, 1], [1, 1, 1], [0, 0, 0], [0, 0, 0], "float32"], {"i": 2663165167, "t": "", "c": null, "e": [["tile_f", "sp", [-1, 1, 12, 2]], ["tile_d", "sp", [-1, 1, 1, 2]], ["tile_y", "sp", [-1, 1, 1, 4]], ["tile_x", "sp", [-1, 2, 32, 2]], ["tile_rc", "sp", [-1, 4]], ["tile_rd", "sp", [-1, 1]], ["tile_ry", "sp", [-1, 1]], ["tile_rx", "sp", [-1, 1]], ["auto_unroll_max_step", "ot", 512], ["unroll_explicit", "ot", 1]]}], "r": [[0.00054890425, 0.0005480255], 0, 1.4012398719787598, 1578500740.2873394], "v": 0.1}
{"i": ["cuda", "schedule_conv3d_transpose_nchw_cuda", [[1, 12, 64, 128, 128], [12, 24, 1, 1, 1], [1, 1, 1], [0, 0, 0], [0, 0, 0], "float32"], {}, ["schedule_conv3d_transpose_nchw_cuda", [1, 12, 64, 128, 128], [12, 24, 1, 1, 1], [1, 1, 1], [0, 0, 0], [0, 0, 0], "float32"], {"i": 2638786706, "t": "", "c": null, "e": [["tile_f", "sp", [-1, 1, 6, 4]], ["tile_d", "sp", [-1, 1, 1, 4]], ["tile_y", "sp", [-1, 1, 1, 2]], ["tile_x", "sp", [-1, 4, 32, 1]], ["tile_rc", "sp", [-1, 4]], ["tile_rd", "sp", [-1, 1]], ["tile_ry", "sp", [-1, 1]], ["tile_rx", "sp", [-1, 1]], ["auto_unroll_max_step", "ot", 512], ["unroll_explicit", "ot", 1]]}], "r": [[0.0004963095, 0.00049373975], 0, 1.6767370700836182, 1578500741.0387926], "v": 0.1}
{"i": ["cuda", "schedule_conv3d_transpose_nchw_cuda", [[1, 12, 64, 128, 128], [12, 24, 1, 1, 1], [1, 1, 1], [0, 0, 0], [0, 0, 0], "float32"], {}, ["schedule_conv3d_transpose_nchw_cuda", [1, 12, 64, 128, 128], [12, 24, 1, 1, 1], [1, 1, 1], [0, 0, 0], [0, 0, 0], "float32"], {"i": 2663969344, "t": "", "c": null, "e": [["tile_f", "sp", [-1, 1, 3, 4]], ["tile_d", "sp", [-1, 1, 1, 1]], ["tile_y", "sp", [-1, 1, 1, 4]], ["tile_x", "sp", [-1, 1, 64, 2]], ["tile_rc", "sp", [-1, 4]], ["tile_rd", "sp", [-1, 1]], ["tile_ry", "sp", [-1, 1]], ["tile_rx", "sp", [-1, 1]], ["auto_unroll_max_step", "ot", 512], ["unroll_explicit", "ot", 1]]}], "r": [[0.0008235545, 0.00081424775], 0, 1.400968074798584, 1578500744.0443425], "v": 0.1}
{"i": ["cuda", "schedule_conv3d_transpose_nchw_cuda", [[1, 12, 64, 128, 128], [12, 24, 1, 1, 1], [1, 1, 1], [0, 0, 0], [0, 0, 0], "float32"], {}, ["schedule_conv3d_transpose_nchw_cuda", [1, 12, 64, 128, 128], [12, 24, 1, 1, 1], [1, 1, 1], [0, 0, 0], [0, 0, 0], "float32"], {"i": 2662499887, "t": "", "c": null, "e": [["tile_f", "sp", [-1, 1, 12, 2]], ["tile_d", "sp", [-1, 1, 1, 2]], ["tile_y", "sp", [-1, 1, 1, 8]], ["tile_x", "sp", [-1, 1, 32, 2]], ["tile_rc", "sp", [-1, 4]], ["tile_rd", "sp", [-1, 1]], ["tile_ry", "sp", [-1, 1]], ["tile_rx", "sp", [-1, 1]], ["auto_unroll_max_step", "ot", 512], ["unroll_explicit", "ot", 1]]}], "r": [[0.00056250825, 0.00056322575], 0, 1.455033779144287, 1578500744.6834614], "v": 0.1}
{"i": ["cuda", "schedule_conv3d_transpose_nchw_cuda", [[1, 12, 64, 128, 128], [12, 24, 1, 1, 1], [1, 1, 1], [0, 0, 0], [0, 0, 0], "float32"], {}, ["schedule_conv3d_transpose_nchw_cuda", [1, 12, 64, 128, 128], [12, 24, 1, 1, 1], [1, 1, 1], [0, 0, 0], [0, 0, 0], "float32"], {"i": 921341186, "t": "", "c": null, "e": [["tile_f", "sp", [-1, 1, 6, 4]], ["tile_d", "sp", [-1, 1, 1, 2]], ["tile_y", "sp", [-1, 1, 1, 4]], ["tile_x", "sp", [-1, 2, 32, 2]], ["tile_rc", "sp", [-1, 4]], ["tile_rd", "sp", [-1, 1]], ["tile_ry", "sp", [-1, 1]], ["tile_rx", "sp", [-1, 1]], ["auto_unroll_max_step", "ot", 512], ["unroll_explicit", "ot", 0]]}], "r": [[0.0007684585, 0.00076968], 0, 1.5252964496612549, 1578500745.4438794], "v": 0.1}
{"i": ["cuda", "schedule_conv3d_transpose_nchw_cuda", [[1, 12, 64, 128, 128], [12, 24, 1, 1, 1], [1, 1, 1], [0, 0, 0], [0, 0, 0], "float32"], {}, ["schedule_conv3d_transpose_nchw_cuda", [1, 12, 64, 128, 128], [12, 24, 1, 1, 1], [1, 1, 1], [0, 0, 0], [0, 0, 0], "float32"], {"i": 920707246, "t": "", "c": null, "e": [["tile_f", "sp", [-1, 2, 6, 2]], ["tile_d", "sp", [-1, 1, 1, 1]], ["tile_y", "sp", [-1, 1, 2, 8]], ["tile_x", "sp", [-1, 1, 32, 2]], ["tile_rc", "sp", [-1, 4]], ["tile_rd", "sp", [-1, 1]], ["tile_ry", "sp", [-1, 1]], ["tile_rx", "sp", [-1, 1]], ["auto_unroll_max_step", "ot", 512], ["unroll_explicit", "ot", 0]]}], "r": [[0.00052121875, 0.000576659], 0, 1.207552194595337, 1578500746.1101403], "v": 0.1}
{"i": ["cuda", "schedule_conv3d_transpose_nchw_cuda", [[1, 12, 64, 128, 128], [12, 24, 1, 1, 1], [1, 1, 1], [0, 0, 0], [0, 0, 0], "float32"], {}, ["schedule_conv3d_transpose_nchw_cuda", [1, 12, 64, 128, 128], [12, 24, 1, 1, 1], [1, 1, 1], [0, 0, 0], [0, 0, 0], "float32"], {"i": 1501315246, "t": "", "c": null, "e": [["tile_f", "sp", [-1, 2, 6, 2]], ["tile_d", "sp", [-1, 1, 1, 1]], ["tile_y", "sp", [-1, 1, 2, 8]], ["tile_x", "sp", [-1, 1, 32, 2]], ["tile_rc", "sp", [-1, 4]], ["tile_rd", "sp", [-1, 1]], ["tile_ry", "sp", [-1, 1]], ["tile_rx", "sp", [-1, 1]], ["auto_unroll_max_step", "ot", 1500], ["unroll_explicit", "ot", 0]]}], "r": [[0.000717051, 0.0007132615], 0, 1.5320723056793213, 1578500746.9096484], "v": 0.1}
{"i": ["cuda", "schedule_conv3d_transpose_nchw_cuda", [[1, 12, 64, 128, 128], [12, 24, 1, 1, 1], [1, 1, 1], [0, 0, 0], [0, 0, 0], "float32"], {}, ["schedule_conv3d_transpose_nchw_cuda", [1, 12, 64, 128, 128], [12, 24, 1, 1, 1], [1, 1, 1], [0, 0, 0], [0, 0, 0], "float32"], {"i": 2640962395, "t": "", "c": null, "e": [["tile_f", "sp", [-1, 1, 3, 8]], ["tile_d", "sp", [-1, 2, 1, 2]], ["tile_y", "sp", [-1, 1, 1, 1]], ["tile_x", "sp", [-1, 1, 128, 1]], ["tile_rc", "sp", [-1, 4]], ["tile_rd", "sp", [-1, 1]], ["tile_ry", "sp", [-1, 1]], ["tile_rx", "sp", [-1, 1]], ["auto_unroll_max_step", "ot", 512], ["unroll_explicit", "ot", 1]]}], "r": [[0.00042294025, 0.00042016025], 0, 1.5218605995178223, 1578500747.585843], "v": 0.1}
{"i": ["cuda", "schedule_conv3d_transpose_nchw_cuda", [[1, 12, 64, 128, 128], [12, 24, 1, 1, 1], [1, 1, 1], [0, 0, 0], [0, 0, 0], "float32"], {}, ["schedule_conv3d_transpose_nchw_cuda", [1, 12, 64, 128, 128], [12, 24, 1, 1, 1], [1, 1, 1], [0, 0, 0], [0, 0, 0], "float32"], {"i": 824432072, "t": "", "c": null, "e": [["tile_f", "sp", [-1, 1, 4, 6]], ["tile_d", "sp", [-1, 1, 1, 2]], ["tile_y", "sp", [-1, 1, 2, 2]], ["tile_x", "sp", [-1, 2, 32, 2]], ["tile_rc", "sp", [-1, 3]], ["tile_rd", "sp", [-1, 1]], ["tile_ry", "sp", [-1, 1]], ["tile_rx", "sp", [-1, 1]], ["auto_unroll_max_step", "ot", 512], ["unroll_explicit", "ot", 0]]}], "r": [[0.00056013575, 0.00055783225], 0, 1.31998610496521, 1578500748.2695782], "v": 0.1}
