auto_log/((1, 24, 64, 64, 64), (24, 24, 3, 3, 3), (1, 24, 64, 64, 64), (1, 1, 1), (1, 1, 1), 1, 1, None)_fwd.log
{"i": ["cuda", "schedule_direct_3d_cuda", [[1, 24, 64, 64, 64], [24, 24, 3, 3, 3], [1, 1, 1], [1, 1, 1], 1], {}, ["schedule_direct_3d_cuda", [1, 24, 64, 64, 64], [24, 24, 3, 3, 3], [1, 1, 1], [1, 1, 1], 1], {"i": 15590951077, "t": "", "c": null, "e": [["tile_f", "sp", [-1, 2, 2, 2]], ["tile_d", "sp", [-1, 1, 1, 1]], ["tile_y", "sp", [-1, 4, 1, 1]], ["tile_x", "sp", [-1, 1, 2, 8]], ["tile_rc", "sp", [-1, 1]], ["tile_rd", "sp", [-1, 3]], ["tile_ry", "sp", [-1, 1]], ["tile_rx", "sp", [-1, 1]], ["auto_unroll_max_step", "ot", 1500], ["unroll_explicit", "ot", 1]]}], "r": [[0.0559735125, 0.0559215525], 0, 4.017249822616577, 1578514386.756629], "v": 0.1}
{"i": ["cuda", "schedule_direct_3d_cuda", [[1, 24, 64, 64, 64], [24, 24, 3, 3, 3], [1, 1, 1], [1, 1, 1], 1], {}, ["schedule_direct_3d_cuda", [1, 24, 64, 64, 64], [24, 24, 3, 3, 3], [1, 1, 1], [1, 1, 1], 1], {"i": 4144805917, "t": "", "c": null, "e": [["tile_f", "sp", [-1, 2, 1, 12]], ["tile_d", "sp", [-1, 1, 1, 4]], ["tile_y", "sp", [-1, 1, 4, 4]], ["tile_x", "sp", [-1, 1, 2, 2]], ["tile_rc", "sp", [-1, 24]], ["tile_rd", "sp", [-1, 1]], ["tile_ry", "sp", [-1, 3]], ["tile_rx", "sp", [-1, 1]], ["auto_unroll_max_step", "ot", 512], ["unroll_explicit", "ot", 0]]}], "r": [[0.3183942095, 0.31662550975], 0, 4.37748908996582, 1578514396.6386888], "v": 0.1}
{"i": ["cuda", "schedule_direct_3d_cuda", [[1, 24, 64, 64, 64], [24, 24, 3, 3, 3], [1, 1, 1], [1, 1, 1], 1], {}, ["schedule_direct_3d_cuda", [1, 24, 64, 64, 64], [24, 24, 3, 3, 3], [1, 1, 1], [1, 1, 1], 1], {"i": 6647316661, "t": "", "c": null, "e": [["tile_f", "sp", [-1, 6, 4, 1]], ["tile_d", "sp", [-1, 4, 1, 1]], ["tile_y", "sp", [-1, 1, 1, 1]], ["tile_x", "sp", [-1, 8, 4, 1]], ["tile_rc", "sp", [-1, 6]], ["tile_rd", "sp", [-1, 3]], ["tile_ry", "sp", [-1, 1]], ["tile_rx", "sp", [-1, 1]], ["auto_unroll_max_step", "ot", 1500], ["unroll_explicit", "ot", 0]]}], "r": [[0.02131973825, 0.02134636], 0, 2.5774829387664795, 1578514408.775644], "v": 0.1}
{"i": ["cuda", "schedule_direct_3d_cuda", [[1, 24, 64, 64, 64], [24, 24, 3, 3, 3], [1, 1, 1], [1, 1, 1], 1], {}, ["schedule_direct_3d_cuda", [1, 24, 64, 64, 64], [24, 24, 3, 3, 3], [1, 1, 1], [1, 1, 1], 1], {"i": 534226638, "t": "", "c": null, "e": [["tile_f", "sp", [-1, 1, 2, 12]], ["tile_d", "sp", [-1, 1, 1, 1]], ["tile_y", "sp", [-1, 1, 2, 2]], ["tile_x", "sp", [-1, 1, 16, 1]], ["tile_rc", "sp", [-1, 4]], ["tile_rd", "sp", [-1, 3]], ["tile_ry", "sp", [-1, 1]], ["tile_rx", "sp", [-1, 1]], ["auto_unroll_max_step", "ot", 0], ["unroll_explicit", "ot", 0]]}], "r": [[0.006648994, 0.0066338935], 0, 1.0859081745147705, 1578514472.8851357], "v": 0.1}
{"i": ["cuda", "schedule_direct_3d_cuda", [[1, 24, 64, 64, 64], [24, 24, 3, 3, 3], [1, 1, 1], [1, 1, 1], 1], {}, ["schedule_direct_3d_cuda", [1, 24, 64, 64, 64], [24, 24, 3, 3, 3], [1, 1, 1], [1, 1, 1], 1], {"i": 581642958, "t": "", "c": null, "e": [["tile_f", "sp", [-1, 1, 2, 12]], ["tile_d", "sp", [-1, 1, 1, 1]], ["tile_y", "sp", [-1, 1, 2, 2]], ["tile_x", "sp", [-1, 1, 16, 1]], ["tile_rc", "sp", [-1, 6]], ["tile_rd", "sp", [-1, 3]], ["tile_ry", "sp", [-1, 1]], ["tile_rx", "sp", [-1, 1]], ["auto_unroll_max_step", "ot", 0], ["unroll_explicit", "ot", 0]]}], "r": [[0.00846021275, 0.00845013], 0, 1.0589005947113037, 1578514473.7672932], "v": 0.1}
{"i": ["cuda", "schedule_direct_3d_cuda", [[1, 24, 64, 64, 64], [24, 24, 3, 3, 3], [1, 1, 1], [1, 1, 1], 1], {}, ["schedule_direct_3d_cuda", [1, 24, 64, 64, 64], [24, 24, 3, 3, 3], [1, 1, 1], [1, 1, 1], 1], {"i": 3616287438, "t": "", "c": null, "e": [["tile_f", "sp", [-1, 1, 2, 12]], ["tile_d", "sp", [-1, 1, 1, 1]], ["tile_y", "sp", [-1, 1, 2, 2]], ["tile_x", "sp", [-1, 1, 16, 1]], ["tile_rc", "sp", [-1, 6]], ["tile_rd", "sp", [-1, 3]], ["tile_ry", "sp", [-1, 1]], ["tile_rx", "sp", [-1, 1]], ["auto_unroll_max_step", "ot", 512], ["unroll_explicit", "ot", 0]]}], "r": [[0.00645341925, 0.00645555925], 0, 1.3390452861785889, 1578514475.7772017], "v": 0.1}
{"i": ["cuda", "schedule_direct_3d_cuda", [[1, 24, 64, 64, 64], [24, 24, 3, 3, 3], [1, 1, 1], [1, 1, 1], 1], {}, ["schedule_direct_3d_cuda", [1, 24, 64, 64, 64], [24, 24, 3, 3, 3], [1, 1, 1], [1, 1, 1], 1], {"i": 1671425436, "t": "", "c": null, "e": [["tile_f", "sp", [-1, 1, 1, 12]], ["tile_d", "sp", [-1, 2, 1, 1]], ["tile_y", "sp", [-1, 1, 1, 1]], ["tile_x", "sp", [-1, 8, 8, 1]], ["tile_rc", "sp", [-1, 4]], ["tile_rd", "sp", [-1, 1]], ["tile_ry", "sp", [-1, 1]], ["tile_rx", "sp", [-1, 3]], ["auto_unroll_max_step", "ot", 0], ["unroll_explicit", "ot", 0]]}], "r": [[0.005707445, 0.005713826], 0, 1.1475911140441895, 1578514476.7936811], "v": 0.1}
{"i": ["cuda", "schedule_direct_3d_cuda", [[1, 24, 64, 64, 64], [24, 24, 3, 3, 3], [1, 1, 1], [1, 1, 1], 1], {}, ["schedule_direct_3d_cuda", [1, 24, 64, 64, 64], [24, 24, 3, 3, 3], [1, 1, 1], [1, 1, 1], 1], {"i": 4069390135, "t": "", "c": null, "e": [["tile_f", "sp", [-1, 1, 4, 3]], ["tile_d", "sp", [-1, 1, 1, 1]], ["tile_y", "sp", [-1, 2, 2, 1]], ["tile_x", "sp", [-1, 2, 2, 8]], ["tile_rc", "sp", [-1, 8]], ["tile_rd", "sp", [-1, 1]], ["tile_ry", "sp", [-1, 3]], ["tile_rx", "sp", [-1, 1]], ["auto_unroll_max_step", "ot", 512], ["unroll_explicit", "ot", 0]]}], "r": [[0.0064339995, 0.0064412135], 0, 1.5380291938781738, 1578514486.533885], "v": 0.1}
{"i": ["cuda", "schedule_direct_3d_cuda", [[1, 24, 64, 64, 64], [24, 24, 3, 3, 3], [1, 1, 1], [1, 1, 1], 1], {}, ["schedule_direct_3d_cuda", [1, 24, 64, 64, 64], [24, 24, 3, 3, 3], [1, 1, 1], [1, 1, 1], 1], {"i": 9685576398, "t": "", "c": null, "e": [["tile_f", "sp", [-1, 1, 2, 12]], ["tile_d", "sp", [-1, 1, 1, 1]], ["tile_y", "sp", [-1, 1, 2, 2]], ["tile_x", "sp", [-1, 1, 16, 1]], ["tile_rc", "sp", [-1, 6]], ["tile_rd", "sp", [-1, 3]], ["tile_ry", "sp", [-1, 1]], ["tile_rx", "sp", [-1, 1]], ["auto_unroll_max_step", "ot", 0], ["unroll_explicit", "ot", 1]]}], "r": [[0.00656254825, 0.00654317425], 0, 0.9007635116577148, 1578514487.3906627], "v": 0.1}
{"i": ["cuda", "schedule_direct_3d_cuda", [[1, 24, 64, 64, 64], [24, 24, 3, 3, 3], [1, 1, 1], [1, 1, 1], 1], {}, ["schedule_direct_3d_cuda", [1, 24, 64, 64, 64], [24, 24, 3, 3, 3], [1, 1, 1], [1, 1, 1], 1], {"i": 2816755232, "t": "", "c": null, "e": [["tile_f", "sp", [-1, 3, 1, 2]], ["tile_d", "sp", [-1, 1, 1, 1]], ["tile_y", "sp", [-1, 1, 1, 1]], ["tile_x", "sp", [-1, 1, 2, 2]], ["tile_rc", "sp", [-1, 4]], ["tile_rd", "sp", [-1, 3]], ["tile_ry", "sp", [-1, 3]], ["tile_rx", "sp", [-1, 3]], ["auto_unroll_max_step", "ot", 0], ["unroll_explicit", "ot", 0]]}], "r": [[0.11294820525, 0.11298817825], 0, 2.0395359992980957, 1578514489.6565752], "v": 0.1}
{"i": ["cuda", "schedule_direct_3d_cuda", [[1, 24, 64, 64, 64], [24, 24, 3, 3, 3], [1, 1, 1], [1, 1, 1], 1], {}, ["schedule_direct_3d_cuda", [1, 24, 64, 64, 64], [24, 24, 3, 3, 3], [1, 1, 1], [1, 1, 1], 1], {"i": 5133609678, "t": "", "c": null, "e": [["tile_f", "sp", [-1, 1, 2, 12]], ["tile_d", "sp", [-1, 1, 1, 1]], ["tile_y", "sp", [-1, 1, 2, 2]], ["tile_x", "sp", [-1, 1, 16, 1]], ["tile_rc", "sp", [-1, 6]], ["tile_rd", "sp", [-1, 3]], ["tile_ry", "sp", [-1, 1]], ["tile_rx", "sp", [-1, 3]], ["auto_unroll_max_step", "ot", 512], ["unroll_explicit", "ot", 0]]}], "r": [[0.00576410675, 0.005773237], 0, 1.3861896991729736, 1578514494.0367906], "v": 0.1}
{"i": ["cuda", "schedule_direct_3d_cuda", [[1, 24, 64, 64, 64], [24, 24, 3, 3, 3], [1, 1, 1], [1, 1, 1], 1], {}, ["schedule_direct_3d_cuda", [1, 24, 64, 64, 64], [24, 24, 3, 3, 3], [1, 1, 1], [1, 1, 1], 1], {"i": 14319782459, "t": "", "c": null, "e": [["tile_f", "sp", [-1, 2, 1, 4]], ["tile_d", "sp", [-1, 1, 1, 1]], ["tile_y", "sp", [-1, 2, 2, 1]], ["tile_x", "sp", [-1, 1, 1, 1]], ["tile_rc", "sp", [-1, 12]], ["tile_rd", "sp", [-1, 3]], ["tile_ry", "sp", [-1, 1]], ["tile_rx", "sp", [-1, 3]], ["auto_unroll_max_step", "ot", 512], ["unroll_explicit", "ot", 1]]}], "r": [[0.047677641, 0.047618068], 0, 3.3410770893096924, 1578514496.0201645], "v": 0.1}
{"i": ["cuda", "schedule_direct_3d_cuda", [[1, 24, 64, 64, 64], [24, 24, 3, 3, 3], [1, 1, 1], [1, 1, 1], 1], {}, ["schedule_direct_3d_cuda", [1, 24, 64, 64, 64], [24, 24, 3, 3, 3], [1, 1, 1], [1, 1, 1], 1], {"i": 16093893202, "t": "", "c": null, "e": [["tile_f", "sp", [-1, 3, 1, 1]], ["tile_d", "sp", [-1, 1, 1, 4]], ["tile_y", "sp", [-1, 1, 1, 1]], ["tile_x", "sp", [-1, 2, 2, 2]], ["tile_rc", "sp", [-1, 4]], ["tile_rd", "sp", [-1, 1]], ["tile_ry", "sp", [-1, 3]], ["tile_rx", "sp", [-1, 1]], ["auto_unroll_max_step", "ot", 1500], ["unroll_explicit", "ot", 1]]}], "r": [[0.07255317525, 0.07256054175], 0, 2.8761773109436035, 1578514498.1754467], "v": 0.1}
{"i": ["cuda", "schedule_direct_3d_cuda", [[1, 24, 64, 64, 64], [24, 24, 3, 3, 3], [1, 1, 1], [1, 1, 1], 1], {}, ["schedule_direct_3d_cuda", [1, 24, 64, 64, 64], [24, 24, 3, 3, 3], [1, 1, 1], [1, 1, 1], 1], {"i": 12720220878, "t": "", "c": null, "e": [["tile_f", "sp", [-1, 1, 2, 12]], ["tile_d", "sp", [-1, 1, 1, 1]], ["tile_y", "sp", [-1, 1, 2, 2]], ["tile_x", "sp", [-1, 1, 16, 1]], ["tile_rc", "sp", [-1, 6]], ["tile_rd", "sp", [-1, 3]], ["tile_ry", "sp", [-1, 1]], ["tile_rx", "sp", [-1, 1]], ["auto_unroll_max_step", "ot", 512], ["unroll_explicit", "ot", 1]]}], "r": [[0.0052638705, 0.005257406], 0, 1.8043055534362793, 1578514503.414974], "v": 0.1}
{"i": ["cuda", "schedule_direct_3d_cuda", [[1, 24, 64, 64, 64], [24, 24, 3, 3, 3], [1, 1, 1], [1, 1, 1], 1], {}, ["schedule_direct_3d_cuda", [1, 24, 64, 64, 64], [24, 24, 3, 3, 3], [1, 1, 1], [1, 1, 1], 1], {"i": 15867536733, "t": "", "c": null, "e": [["tile_f", "sp", [-1, 12, 2, 1]], ["tile_d", "sp", [-1, 1, 1, 4]], ["tile_y", "sp", [-1, 1, 1, 1]], ["tile_x", "sp", [-1, 1, 2, 4]], ["tile_rc", "sp", [-1, 12]], ["tile_rd", "sp", [-1, 3]], ["tile_ry", "sp", [-1, 1]], ["tile_rx", "sp", [-1, 1]], ["auto_unroll_max_step", "ot", 1500], ["unroll_explicit", "ot", 1]]}], "r": [[0.00877071175, 0.0087525785], 0, 3.17244815826416, 1578514504.3754551], "v": 0.1}
{"i": ["cuda", "schedule_direct_3d_cuda", [[1, 24, 64, 64, 64], [24, 24, 3, 3, 3], [1, 1, 1], [1, 1, 1], 1], {}, ["schedule_direct_3d_cuda", [1, 24, 64, 64, 64], [24, 24, 3, 3, 3], [1, 1, 1], [1, 1, 1], 1], {"i": 17518831726, "t": "", "c": null, "e": [["tile_f", "sp", [-1, 2, 6, 2]], ["tile_d", "sp", [-1, 1, 1, 1]], ["tile_y", "sp", [-1, 2, 1, 2]], ["tile_x", "sp", [-1, 1, 4, 2]], ["tile_rc", "sp", [-1, 2]], ["tile_rd", "sp", [-1, 1]], ["tile_ry", "sp", [-1, 3]], ["tile_rx", "sp", [-1, 3]], ["auto_unroll_max_step", "ot", 1500], ["unroll_explicit", "ot", 1]]}], "r": [[0.002015923, 0.00201311375], 0, 1.505324125289917, 1578514505.51766], "v": 0.1}
{"i": ["cuda", "schedule_direct_3d_cuda", [[1, 24, 64, 64, 64], [24, 24, 3, 3, 3], [1, 1, 1], [1, 1, 1], 1], {}, ["schedule_direct_3d_cuda", [1, 24, 64, 64, 64], [24, 24, 3, 3, 3], [1, 1, 1], [1, 1, 1], 1], {"i": 13817354928, "t": "", "c": null, "e": [["tile_f", "sp", [-1, 1, 1, 3]], ["tile_d", "sp", [-1, 1, 1, 1]], ["tile_y", "sp", [-1, 4, 1, 1]], ["tile_x", "sp", [-1, 1, 2, 2]], ["tile_rc", "sp", [-1, 4]], ["tile_rd", "sp", [-1, 1]], ["tile_ry", "sp", [-1, 1]], ["tile_rx", "sp", [-1, 3]], ["auto_unroll_max_step", "ot", 512], ["unroll_explicit", "ot", 1]]}], "r": [[0.02947513575, 0.0295224], 0, 1.6177339553833008, 1578514506.7237082], "v": 0.1}
{"i": ["cuda", "schedule_direct_3d_cuda", [[1, 24, 64, 64, 64], [24, 24, 3, 3, 3], [1, 1, 1], [1, 1, 1], 1], {}, ["schedule_direct_3d_cuda", [1, 24, 64, 64, 64], [24, 24, 3, 3, 3], [1, 1, 1], [1, 1, 1], 1], {"i": 17539153006, "t": "", "c": null, "e": [["tile_f", "sp", [-1, 2, 6, 2]], ["tile_d", "sp", [-1, 1, 1, 1]], ["tile_y", "sp", [-1, 2, 1, 2]], ["tile_x", "sp", [-1, 2, 1, 16]], ["tile_rc", "sp", [-1, 2]], ["tile_rd", "sp", [-1, 1]], ["tile_ry", "sp", [-1, 3]], ["tile_rx", "sp", [-1, 3]], ["auto_unroll_max_step", "ot", 1500], ["unroll_explicit", "ot", 1]]}], "r": [[0.11283935325, 0.11286034725], 0, 4.830127239227295, 1578514508.8861847], "v": 0.1}
{"i": ["cuda", "schedule_direct_3d_cuda", [[1, 24, 64, 64, 64], [24, 24, 3, 3, 3], [1, 1, 1], [1, 1, 1], 1], {}, ["schedule_direct_3d_cuda", [1, 24, 64, 64, 64], [24, 24, 3, 3, 3], [1, 1, 1], [1, 1, 1], 1], {"i": 16380840044, "t": "", "c": null, "e": [["tile_f", "sp", [-1, 3, 4, 2]], ["tile_d", "sp", [-1, 1, 1, 1]], ["tile_y", "sp", [-1, 2, 1, 2]], ["tile_x", "sp", [-1, 1, 4, 2]], ["tile_rc", "sp", [-1, 2]], ["tile_rd", "sp", [-1, 3]], ["tile_ry", "sp", [-1, 3]], ["tile_rx", "sp", [-1, 1]], ["auto_unroll_max_step", "ot", 1500], ["unroll_explicit", "ot", 1]]}], "r": [[0.009869094, 0.00986380325], 0, 2.16070294380188, 1578514515.795044], "v": 0.1}
{"i": ["cuda", "schedule_direct_3d_cuda", [[1, 24, 64, 64, 64], [24, 24, 3, 3, 3], [1, 1, 1], [1, 1, 1], 1], {}, ["schedule_direct_3d_cuda", [1, 24, 64, 64, 64], [24, 24, 3, 3, 3], [1, 1, 1], [1, 1, 1], 1], {"i": 7104034615, "t": "", "c": null, "e": [["tile_f", "sp", [-1, 1, 4, 3]], ["tile_d", "sp", [-1, 1, 1, 1]], ["tile_y", "sp", [-1, 2, 2, 1]], ["tile_x", "sp", [-1, 2, 2, 8]], ["tile_rc", "sp", [-1, 8]], ["tile_rd", "sp", [-1, 1]], ["tile_ry", "sp", [-1, 3]], ["tile_rx", "sp", [-1, 1]], ["auto_unroll_max_step", "ot", 1500], ["unroll_explicit", "ot", 0]]}], "r": [[0.00653750225, 0.0065342385], 0, 1.4862918853759766, 1578514521.3605409], "v": 0.1}
{"i": ["cuda", "schedule_direct_3d_cuda", [[1, 24, 64, 64, 64], [24, 24, 3, 3, 3], [1, 1, 1], [1, 1, 1], 1], {}, ["schedule_direct_3d_cuda", [1, 24, 64, 64, 64], [24, 24, 3, 3, 3], [1, 1, 1], [1, 1, 1], 1], {"i": 16001509486, "t": "", "c": null, "e": [["tile_f", "sp", [-1, 2, 6, 2]], ["tile_d", "sp", [-1, 1, 1, 1]], ["tile_y", "sp", [-1, 2, 1, 2]], ["tile_x", "sp", [-1, 1, 4, 2]], ["tile_rc", "sp", [-1, 2]], ["tile_rd", "sp", [-1, 1]], ["tile_ry", "sp", [-1, 3]], ["tile_rx", "sp", [-1, 1]], ["auto_unroll_max_step", "ot", 1500], ["unroll_explicit", "ot", 1]]}], "r": [[0.0022822935, 0.00227836075], 0, 1.648134469985962, 1578514522.359807], "v": 0.1}
{"i": ["cuda", "schedule_direct_3d_cuda", [[1, 24, 64, 64, 64], [24, 24, 3, 3, 3], [1, 1, 1], [1, 1, 1], 1], {}, ["schedule_direct_3d_cuda", [1, 24, 64, 64, 64], [24, 24, 3, 3, 3], [1, 1, 1], [1, 1, 1], 1], {"i": 4021973815, "t": "", "c": null, "e": [["tile_f", "sp", [-1, 1, 4, 3]], ["tile_d", "sp", [-1, 1, 1, 1]], ["tile_y", "sp", [-1, 2, 2, 1]], ["tile_x", "sp", [-1, 2, 2, 8]], ["tile_rc", "sp", [-1, 6]], ["tile_rd", "sp", [-1, 1]], ["tile_ry", "sp", [-1, 3]], ["tile_rx", "sp", [-1, 1]], ["auto_unroll_max_step", "ot", 512], ["unroll_explicit", "ot", 0]]}], "r": [[0.0306885095, 0.0307186685], 0, 2.8012847900390625, 1578514523.714513], "v": 0.1}
{"i": ["cuda", "schedule_direct_3d_cuda", [[1, 24, 64, 64, 64], [24, 24, 3, 3, 3], [1, 1, 1], [1, 1, 1], 1], {}, ["schedule_direct_3d_cuda", [1, 24, 64, 64, 64], [24, 24, 3, 3, 3], [1, 1, 1], [1, 1, 1], 1], {"i": 16380840046, "t": "", "c": null, "e": [["tile_f", "sp", [-1, 2, 6, 2]], ["tile_d", "sp", [-1, 1, 1, 1]], ["tile_y", "sp", [-1, 2, 1, 2]], ["tile_x", "sp", [-1, 1, 4, 2]], ["tile_rc", "sp", [-1, 2]], ["tile_rd", "sp", [-1, 3]], ["tile_ry", "sp", [-1, 3]], ["tile_rx", "sp", [-1, 1]], ["auto_unroll_max_step", "ot", 1500], ["unroll_explicit", "ot", 1]]}], "r": [[0.00302135, 0.0030209735], 0, 1.7710387706756592, 1578514524.4998536], "v": 0.1}
{"i": ["cuda", "schedule_direct_3d_cuda", [[1, 24, 64, 64, 64], [24, 24, 3, 3, 3], [1, 1, 1], [1, 1, 1], 1], {}, ["schedule_direct_3d_cuda", [1, 24, 64, 64, 64], [24, 24, 3, 3, 3], [1, 1, 1], [1, 1, 1], 1], {"i": 11005102168, "t": "", "c": null, "e": [["tile_f", "sp", [-1, 1, 2, 1]], ["tile_d", "sp", [-1, 2, 1, 1]], ["tile_y", "sp", [-1, 1, 1, 1]], ["tile_x", "sp", [-1, 2, 2, 1]], ["tile_rc", "sp", [-1, 1]], ["tile_rd", "sp", [-1, 3]], ["tile_ry", "sp", [-1, 1]], ["tile_rx", "sp", [-1, 3]], ["auto_unroll_max_step", "ot", 0], ["unroll_explicit", "ot", 1]]}], "r": [[0.03133590975, 0.031328747], 0, 1.3753125667572021, 1578514530.8859591], "v": 0.1}
{"i": ["cuda", "schedule_direct_3d_cuda", [[1, 24, 64, 64, 64], [24, 24, 3, 3, 3], [1, 1, 1], [1, 1, 1], 1], {}, ["schedule_direct_3d_cuda", [1, 24, 64, 64, 64], [24, 24, 3, 3, 3], [1, 1, 1], [1, 1, 1], 1], {"i": 5215849019, "t": "", "c": null, "e": [["tile_f", "sp", [-1, 2, 1, 4]], ["tile_d", "sp", [-1, 1, 1, 1]], ["tile_y", "sp", [-1, 2, 2, 1]], ["tile_x", "sp", [-1, 1, 1, 1]], ["tile_rc", "sp", [-1, 12]], ["tile_rd", "sp", [-1, 3]], ["tile_ry", "sp", [-1, 1]], ["tile_rx", "sp", [-1, 3]], ["auto_unroll_max_step", "ot", 512], ["unroll_explicit", "ot", 0]]}], "r": [[0.0495276345, 0.050262274], 0, 2.9445912837982178, 1578514532.4724495], "v": 0.1}
{"i": ["cuda", "schedule_direct_3d_cuda", [[1, 24, 64, 64, 64], [24, 24, 3, 3, 3], [1, 1, 1], [1, 1, 1], 1], {}, ["schedule_direct_3d_cuda", [1, 24, 64, 64, 64], [24, 24, 3, 3, 3], [1, 1, 1], [1, 1, 1], 1], {"i": 16001509484, "t": "", "c": null, "e": [["tile_f", "sp", [-1, 3, 4, 2]], ["tile_d", "sp", [-1, 1, 1, 1]], ["tile_y", "sp", [-1, 2, 1, 2]], ["tile_x", "sp", [-1, 1, 4, 2]], ["tile_rc", "sp", [-1, 2]], ["tile_rd", "sp", [-1, 1]], ["tile_ry", "sp", [-1, 3]], ["tile_rx", "sp", [-1, 1]], ["auto_unroll_max_step", "ot", 1500], ["unroll_explicit", "ot", 1]]}], "r": [[0.00546951225, 0.0054695615], 0, 1.925417184829712, 1578514533.3730433], "v": 0.1}
{"i": ["cuda", "schedule_direct_3d_cuda", [[1, 24, 64, 64, 64], [24, 24, 3, 3, 3], [1, 1, 1], [1, 1, 1], 1], {}, ["schedule_direct_3d_cuda", [1, 24, 64, 64, 64], [24, 24, 3, 3, 3], [1, 1, 1], [1, 1, 1], 1], {"i": 14319782479, "t": "", "c": null, "e": [["tile_f", "sp", [-1, 1, 1, 24]], ["tile_d", "sp", [-1, 1, 1, 1]], ["tile_y", "sp", [-1, 2, 2, 1]], ["tile_x", "sp", [-1, 1, 1, 1]], ["tile_rc", "sp", [-1, 12]], ["tile_rd", "sp", [-1, 3]], ["tile_ry", "sp", [-1, 1]], ["tile_rx", "sp", [-1, 3]], ["auto_unroll_max_step", "ot", 512], ["unroll_explicit", "ot", 1]]}], "r": [[0.27790328625, 0.27732381225], 0, 4.723109245300293, 1578514536.672755], "v": 0.1}
{"i": ["cuda", "schedule_direct_3d_cuda", [[1, 24, 64, 64, 64], [24, 24, 3, 3, 3], [1, 1, 1], [1, 1, 1], 1], {}, ["schedule_direct_3d_cuda", [1, 24, 64, 64, 64], [24, 24, 3, 3, 3], [1, 1, 1], [1, 1, 1], 1], {"i": 16134195918, "t": "", "c": null, "e": [["tile_f", "sp", [-1, 1, 2, 12]], ["tile_d", "sp", [-1, 1, 1, 1]], ["tile_y", "sp", [-1, 1, 2, 2]], ["tile_x", "sp", [-1, 1, 16, 1]], ["tile_rc", "sp", [-1, 6]], ["tile_rd", "sp", [-1, 1]], ["tile_ry", "sp", [-1, 3]], ["tile_rx", "sp", [-1, 1]], ["auto_unroll_max_step", "ot", 1500], ["unroll_explicit", "ot", 1]]}], "r": [[0.005770637, 0.00575609975], 0, 3.767371892929077, 1578514780.8003037], "v": 0.1}
{"i": ["cuda", "schedule_direct_3d_cuda", [[1, 24, 64, 64, 64], [24, 24, 3, 3, 3], [1, 1, 1], [1, 1, 1], 1], {}, ["schedule_direct_3d_cuda", [1, 24, 64, 64, 64], [24, 24, 3, 3, 3], [1, 1, 1], [1, 1, 1], 1], {"i": 16131971598, "t": "", "c": null, "e": [["tile_f", "sp", [-1, 1, 2, 12]], ["tile_d", "sp", [-1, 1, 1, 1]], ["tile_y", "sp", [-1, 1, 4, 2]], ["tile_x", "sp", [-1, 1, 8, 1]], ["tile_rc", "sp", [-1, 6]], ["tile_rd", "sp", [-1, 1]], ["tile_ry", "sp", [-1, 3]], ["tile_rx", "sp", [-1, 1]], ["auto_unroll_max_step", "ot", 1500], ["unroll_explicit", "ot", 1]]}], "r": [[0.005854218, 0.00584796425], 0, 3.7136166095733643, 1578514781.9150949], "v": 0.1}
{"i": ["cuda", "schedule_direct_3d_cuda", [[1, 24, 64, 64, 64], [24, 24, 3, 3, 3], [1, 1, 1], [1, 1, 1], 1], {}, ["schedule_direct_3d_cuda", [1, 24, 64, 64, 64], [24, 24, 3, 3, 3], [1, 1, 1], [1, 1, 1], 1], {"i": 6978108550, "t": "", "c": null, "e": [["tile_f", "sp", [-1, 1, 2, 6]], ["tile_d", "sp", [-1, 1, 1, 1]], ["tile_y", "sp", [-1, 2, 1, 1]], ["tile_x", "sp", [-1, 2, 4, 1]], ["tile_rc", "sp", [-1, 4]], ["tile_rd", "sp", [-1, 1]], ["tile_ry", "sp", [-1, 3]], ["tile_rx", "sp", [-1, 1]], ["auto_unroll_max_step", "ot", 1500], ["unroll_explicit", "ot", 0]]}], "r": [[0.0135959705, 0.01285395925], 0, 1.9072444438934326, 1578514782.9752812], "v": 0.1}
{"i": ["cuda", "schedule_direct_3d_cuda", [[1, 24, 64, 64, 64], [24, 24, 3, 3, 3], [1, 1, 1], [1, 1, 1], 1], {}, ["schedule_direct_3d_cuda", [1, 24, 64, 64, 64], [24, 24, 3, 3, 3], [1, 1, 1], [1, 1, 1], 1], {"i": 7593962958, "t": "", "c": null, "e": [["tile_f", "sp", [-1, 1, 2, 12]], ["tile_d", "sp", [-1, 1, 1, 1]], ["tile_y", "sp", [-1, 4, 1, 1]], ["tile_x", "sp", [-1, 1, 4, 1]], ["tile_rc", "sp", [-1, 1]], ["tile_rd", "sp", [-1, 1]], ["tile_ry", "sp", [-1, 1]], ["tile_rx", "sp", [-1, 3]], ["auto_unroll_max_step", "ot", 1500], ["unroll_explicit", "ot", 0]]}], "r": [[0.0073403605, 0.00735745075], 0, 1.8608930110931396, 1578514783.9410248], "v": 0.1}
{"i": ["cuda", "schedule_direct_3d_cuda", [[1, 24, 64, 64, 64], [24, 24, 3, 3, 3], [1, 1, 1], [1, 1, 1], 1], {}, ["schedule_direct_3d_cuda", [1, 24, 64, 64, 64], [24, 24, 3, 3, 3], [1, 1, 1], [1, 1, 1], 1], {"i": 16697896398, "t": "", "c": null, "e": [["tile_f", "sp", [-1, 1, 2, 12]], ["tile_d", "sp", [-1, 1, 1, 1]], ["tile_y", "sp", [-1, 4, 1, 1]], ["tile_x", "sp", [-1, 1, 4, 1]], ["tile_rc", "sp", [-1, 1]], ["tile_rd", "sp", [-1, 1]], ["tile_ry", "sp", [-1, 1]], ["tile_rx", "sp", [-1, 3]], ["auto_unroll_max_step", "ot", 1500], ["unroll_explicit", "ot", 1]]}], "r": [[0.00582444475, 0.0058231585], 0, 3.311480760574341, 1578514784.8685791], "v": 0.1}
{"i": ["cuda", "schedule_direct_3d_cuda", [[1, 24, 64, 64, 64], [24, 24, 3, 3, 3], [1, 1, 1], [1, 1, 1], 1], {}, ["schedule_direct_3d_cuda", [1, 24, 64, 64, 64], [24, 24, 3, 3, 3], [1, 1, 1], [1, 1, 1], 1], {"i": 13099551438, "t": "", "c": null, "e": [["tile_f", "sp", [-1, 1, 2, 12]], ["tile_d", "sp", [-1, 1, 1, 1]], ["tile_y", "sp", [-1, 1, 2, 2]], ["tile_x", "sp", [-1, 1, 16, 1]], ["tile_rc", "sp", [-1, 6]], ["tile_rd", "sp", [-1, 1]], ["tile_ry", "sp", [-1, 3]], ["tile_rx", "sp", [-1, 1]], ["auto_unroll_max_step", "ot", 512], ["unroll_explicit", "ot", 1]]}], "r": [[0.00426038975, 0.004262594], 0, 2.21819806098938, 1578514785.9404902], "v": 0.1}
{"i": ["cuda", "schedule_direct_3d_cuda", [[1, 24, 64, 64, 64], [24, 24, 3, 3, 3], [1, 1, 1], [1, 1, 1], 1], {}, ["schedule_direct_3d_cuda", [1, 24, 64, 64, 64], [24, 24, 3, 3, 3], [1, 1, 1], [1, 1, 1], 1], {"i": 13097327118, "t": "", "c": null, "e": [["tile_f", "sp", [-1, 1, 2, 12]], ["tile_d", "sp", [-1, 1, 1, 1]], ["tile_y", "sp", [-1, 1, 4, 2]], ["tile_x", "sp", [-1, 1, 8, 1]], ["tile_rc", "sp", [-1, 6]], ["tile_rd", "sp", [-1, 1]], ["tile_ry", "sp", [-1, 3]], ["tile_rx", "sp", [-1, 1]], ["auto_unroll_max_step", "ot", 512], ["unroll_explicit", "ot", 1]]}], "r": [[0.00455907475, 0.0045545365], 0, 2.088801145553589, 1578514786.9206605], "v": 0.1}
{"i": ["cuda", "schedule_direct_3d_cuda", [[1, 24, 64, 64, 64], [24, 24, 3, 3, 3], [1, 1, 1], [1, 1, 1], 1], {}, ["schedule_direct_3d_cuda", [1, 24, 64, 64, 64], [24, 24, 3, 3, 3], [1, 1, 1], [1, 1, 1], 1], {"i": 16129155918, "t": "", "c": null, "e": [["tile_f", "sp", [-1, 1, 2, 12]], ["tile_d", "sp", [-1, 1, 1, 1]], ["tile_y", "sp", [-1, 2, 4, 2]], ["tile_x", "sp", [-1, 1, 4, 1]], ["tile_rc", "sp", [-1, 6]], ["tile_rd", "sp", [-1, 1]], ["tile_ry", "sp", [-1, 3]], ["tile_rx", "sp", [-1, 1]], ["auto_unroll_max_step", "ot", 1500], ["unroll_explicit", "ot", 1]]}], "r": [[0.00639924425, 0.006405252], 0, 2.6633358001708984, 1578514787.9029706], "v": 0.1}
{"i": ["cuda", "schedule_direct_3d_cuda", [[1, 24, 64, 64, 64], [24, 24, 3, 3, 3], [1, 1, 1], [1, 1, 1], 1], {}, ["schedule_direct_3d_cuda", [1, 24, 64, 64, 64], [24, 24, 3, 3, 3], [1, 1, 1], [1, 1, 1], 1], {"i": 15371119750, "t": "", "c": null, "e": [["tile_f", "sp", [-1, 1, 2, 6]], ["tile_d", "sp", [-1, 1, 1, 1]], ["tile_y", "sp", [-1, 1, 1, 4]], ["tile_x", "sp", [-1, 2, 4, 1]], ["tile_rc", "sp", [-1, 6]], ["tile_rd", "sp", [-1, 1]], ["tile_ry", "sp", [-1, 1]], ["tile_rx", "sp", [-1, 1]], ["auto_unroll_max_step", "ot", 1500], ["unroll_explicit", "ot", 1]]}], "r": [[0.0243441735, 0.02438269775], 0, 3.100980043411255, 1578514789.1174314], "v": 0.1}
{"i": ["cuda", "schedule_direct_3d_cuda", [[1, 24, 64, 64, 64], [24, 24, 3, 3, 3], [1, 1, 1], [1, 1, 1], 1], {}, ["schedule_direct_3d_cuda", [1, 24, 64, 64, 64], [24, 24, 3, 3, 3], [1, 1, 1], [1, 1, 1], 1], {"i": 6267186310, "t": "", "c": null, "e": [["tile_f", "sp", [-1, 1, 2, 6]], ["tile_d", "sp", [-1, 1, 1, 1]], ["tile_y", "sp", [-1, 1, 1, 4]], ["tile_x", "sp", [-1, 2, 4, 1]], ["tile_rc", "sp", [-1, 6]], ["tile_rd", "sp", [-1, 1]], ["tile_ry", "sp", [-1, 1]], ["tile_rx", "sp", [-1, 1]], ["auto_unroll_max_step", "ot", 1500], ["unroll_explicit", "ot", 0]]}], "r": [[0.01878617275, 0.0187749975], 0, 2.296595811843872, 1578514790.300923], "v": 0.1}
{"i": ["cuda", "schedule_direct_3d_cuda", [[1, 24, 64, 64, 64], [24, 24, 3, 3, 3], [1, 1, 1], [1, 1, 1], 1], {}, ["schedule_direct_3d_cuda", [1, 24, 64, 64, 64], [24, 24, 3, 3, 3], [1, 1, 1], [1, 1, 1], 1], {"i": 7030262478, "t": "", "c": null, "e": [["tile_f", "sp", [-1, 1, 2, 12]], ["tile_d", "sp", [-1, 1, 1, 1]], ["tile_y", "sp", [-1, 1, 2, 2]], ["tile_x", "sp", [-1, 1, 16, 1]], ["tile_rc", "sp", [-1, 6]], ["tile_rd", "sp", [-1, 1]], ["tile_ry", "sp", [-1, 3]], ["tile_rx", "sp", [-1, 1]], ["auto_unroll_max_step", "ot", 1500], ["unroll_explicit", "ot", 0]]}], "r": [[0.00377154075, 0.00377178], 0, 2.371006727218628, 1578514791.559616], "v": 0.1}
{"i": ["cuda", "schedule_direct_3d_cuda", [[1, 24, 64, 64, 64], [24, 24, 3, 3, 3], [1, 1, 1], [1, 1, 1], 1], {}, ["schedule_direct_3d_cuda", [1, 24, 64, 64, 64], [24, 24, 3, 3, 3], [1, 1, 1], [1, 1, 1], 1], {"i": 15370803910, "t": "", "c": null, "e": [["tile_f", "sp", [-1, 1, 2, 6]], ["tile_d", "sp", [-1, 1, 1, 1]], ["tile_y", "sp", [-1, 4, 1, 1]], ["tile_x", "sp", [-1, 2, 4, 1]], ["tile_rc", "sp", [-1, 6]], ["tile_rd", "sp", [-1, 1]], ["tile_ry", "sp", [-1, 1]], ["tile_rx", "sp", [-1, 1]], ["auto_unroll_max_step", "ot", 1500], ["unroll_explicit", "ot", 1]]}], "r": [[0.01983783425, 0.01909293425], 0, 2.968242645263672, 1578514792.7419927], "v": 0.1}
{"i": ["cuda", "schedule_direct_3d_cuda", [[1, 24, 64, 64, 64], [24, 24, 3, 3, 3], [1, 1, 1], [1, 1, 1], 1], {}, ["schedule_direct_3d_cuda", [1, 24, 64, 64, 64], [24, 24, 3, 3, 3], [1, 1, 1], [1, 1, 1], 1], {"i": 6266292550, "t": "", "c": null, "e": [["tile_f", "sp", [-1, 1, 2, 6]], ["tile_d", "sp", [-1, 1, 1, 1]], ["tile_y", "sp", [-1, 1, 1, 1]], ["tile_x", "sp", [-1, 1, 4, 1]], ["tile_rc", "sp", [-1, 6]], ["tile_rd", "sp", [-1, 1]], ["tile_ry", "sp", [-1, 1]], ["tile_rx", "sp", [-1, 1]], ["auto_unroll_max_step", "ot", 1500], ["unroll_explicit", "ot", 0]]}], "r": [[0.0229745025, 0.02298458225], 0, 3.086754083633423, 1578514798.2774308], "v": 0.1}
{"i": ["cuda", "schedule_direct_3d_cuda", [[1, 24, 64, 64, 64], [24, 24, 3, 3, 3], [1, 1, 1], [1, 1, 1], 1], {}, ["schedule_direct_3d_cuda", [1, 24, 64, 64, 64], [24, 24, 3, 3, 3], [1, 1, 1], [1, 1, 1], 1], {"i": 15370225992, "t": "", "c": null, "e": [["tile_f", "sp", [-1, 1, 4, 6]], ["tile_d", "sp", [-1, 1, 1, 1]], ["tile_y", "sp", [-1, 1, 1, 1]], ["tile_x", "sp", [-1, 1, 4, 1]], ["tile_rc", "sp", [-1, 6]], ["tile_rd", "sp", [-1, 1]], ["tile_ry", "sp", [-1, 1]], ["tile_rx", "sp", [-1, 1]], ["auto_unroll_max_step", "ot", 1500], ["unroll_explicit", "ot", 1]]}], "r": [[0.02569321575, 0.02603886325], 0, 3.9990010261535645, 1578514799.431556], "v": 0.1}
{"i": ["cuda", "schedule_direct_3d_cuda", [[1, 24, 64, 64, 64], [24, 24, 3, 3, 3], [1, 1, 1], [1, 1, 1], 1], {}, ["schedule_direct_3d_cuda", [1, 24, 64, 64, 64], [24, 24, 3, 3, 3], [1, 1, 1], [1, 1, 1], 1], {"i": 15370225990, "t": "", "c": null, "e": [["tile_f", "sp", [-1, 1, 2, 6]], ["tile_d", "sp", [-1, 1, 1, 1]], ["tile_y", "sp", [-1, 1, 1, 1]], ["tile_x", "sp", [-1, 1, 4, 1]], ["tile_rc", "sp", [-1, 6]], ["tile_rd", "sp", [-1, 1]], ["tile_ry", "sp", [-1, 1]], ["tile_rx", "sp", [-1, 1]], ["auto_unroll_max_step", "ot", 1500], ["unroll_explicit", "ot", 1]]}], "r": [[0.01736993375, 0.0172265515], 0, 3.979057550430298, 1578514800.5406501], "v": 0.1}
{"i": ["cuda", "schedule_direct_3d_cuda", [[1, 24, 64, 64, 64], [24, 24, 3, 3, 3], [1, 1, 1], [1, 1, 1], 1], {}, ["schedule_direct_3d_cuda", [1, 24, 64, 64, 64], [24, 24, 3, 3, 3], [1, 1, 1], [1, 1, 1], 1], {"i": 6266292552, "t": "", "c": null, "e": [["tile_f", "sp", [-1, 1, 4, 6]], ["tile_d", "sp", [-1, 1, 1, 1]], ["tile_y", "sp", [-1, 1, 1, 1]], ["tile_x", "sp", [-1, 1, 4, 1]], ["tile_rc", "sp", [-1, 6]], ["tile_rd", "sp", [-1, 1]], ["tile_ry", "sp", [-1, 1]], ["tile_rx", "sp", [-1, 1]], ["auto_unroll_max_step", "ot", 1500], ["unroll_explicit", "ot", 0]]}], "r": [[0.02850614725, 0.028717276], 0, 3.306893825531006, 1578514801.7982442], "v": 0.1}
{"i": ["cuda", "schedule_direct_3d_cuda", [[1, 24, 64, 64, 64], [24, 24, 3, 3, 3], [1, 1, 1], [1, 1, 1], 1], {}, ["schedule_direct_3d_cuda", [1, 24, 64, 64, 64], [24, 24, 3, 3, 3], [1, 1, 1], [1, 1, 1], 1], {"i": 16887561672, "t": "", "c": null, "e": [["tile_f", "sp", [-1, 1, 4, 6]], ["tile_d", "sp", [-1, 1, 1, 1]], ["tile_y", "sp", [-1, 4, 1, 1]], ["tile_x", "sp", [-1, 1, 4, 1]], ["tile_rc", "sp", [-1, 6]], ["tile_rd", "sp", [-1, 1]], ["tile_ry", "sp", [-1, 1]], ["tile_rx", "sp", [-1, 3]], ["auto_unroll_max_step", "ot", 1500], ["unroll_explicit", "ot", 1]]}], "r": [[0.00702028025, 0.00701999825], 0, 3.4779751300811768, 1578514802.8948073], "v": 0.1}
{"i": ["cuda", "schedule_direct_3d_cuda", [[1, 24, 64, 64, 64], [24, 24, 3, 3, 3], [1, 1, 1], [1, 1, 1], 1], {}, ["schedule_direct_3d_cuda", [1, 24, 64, 64, 64], [24, 24, 3, 3, 3], [1, 1, 1], [1, 1, 1], 1], {"i": 16133967438, "t": "", "c": null, "e": [["tile_f", "sp", [-1, 1, 2, 12]], ["tile_d", "sp", [-1, 1, 1, 1]], ["tile_y", "sp", [-1, 1, 1, 1]], ["tile_x", "sp", [-1, 1, 16, 1]], ["tile_rc", "sp", [-1, 6]], ["tile_rd", "sp", [-1, 1]], ["tile_ry", "sp", [-1, 3]], ["tile_rx", "sp", [-1, 1]], ["auto_unroll_max_step", "ot", 1500], ["unroll_explicit", "ot", 1]]}], "r": [[0.00680524075, 0.00679224775], 0, 2.7931969165802, 1578514803.961703], "v": 0.1}
{"i": ["cuda", "schedule_direct_3d_cuda", [[1, 24, 64, 64, 64], [24, 24, 3, 3, 3], [1, 1, 1], [1, 1, 1], 1], {}, ["schedule_direct_3d_cuda", [1, 24, 64, 64, 64], [24, 24, 3, 3, 3], [1, 1, 1], [1, 1, 1], 1], {"i": 16128987918, "t": "", "c": null, "e": [["tile_f", "sp", [-1, 1, 2, 12]], ["tile_d", "sp", [-1, 1, 1, 1]], ["tile_y", "sp", [-1, 4, 4, 1]], ["tile_x", "sp", [-1, 1, 4, 1]], ["tile_rc", "sp", [-1, 6]], ["tile_rd", "sp", [-1, 1]], ["tile_ry", "sp", [-1, 3]], ["tile_rx", "sp", [-1, 1]], ["auto_unroll_max_step", "ot", 1500], ["unroll_explicit", "ot", 1]]}], "r": [[0.00512664125, 0.00512463925], 0, 2.966071128845215, 1578514804.9508123], "v": 0.1}
{"i": ["cuda", "schedule_direct_3d_cuda", [[1, 24, 64, 64, 64], [24, 24, 3, 3, 3], [1, 1, 1], [1, 1, 1], 1], {}, ["schedule_direct_3d_cuda", [1, 24, 64, 64, 64], [24, 24, 3, 3, 3], [1, 1, 1], [1, 1, 1], 1], {"i": 16840145358, "t": "", "c": null, "e": [["tile_f", "sp", [-1, 1, 2, 12]], ["tile_d", "sp", [-1, 1, 1, 1]], ["tile_y", "sp", [-1, 4, 1, 1]], ["tile_x", "sp", [-1, 1, 4, 1]], ["tile_rc", "sp", [-1, 4]], ["tile_rd", "sp", [-1, 1]], ["tile_ry", "sp", [-1, 1]], ["tile_rx", "sp", [-1, 3]], ["auto_unroll_max_step", "ot", 1500], ["unroll_explicit", "ot", 1]]}], "r": [[0.0076099865, 0.00761362875], 0, 2.320099115371704, 1578514805.8447304], "v": 0.1}
{"i": ["cuda", "schedule_direct_3d_cuda", [[1, 24, 64, 64, 64], [24, 24, 3, 3, 3], [1, 1, 1], [1, 1, 1], 1], {}, ["schedule_direct_3d_cuda", [1, 24, 64, 64, 64], [24, 24, 3, 3, 3], [1, 1, 1], [1, 1, 1], 1], {"i": 15370797195, "t": "", "c": null, "e": [["tile_f", "sp", [-1, 1, 3, 8]], ["tile_d", "sp", [-1, 1, 1, 1]], ["tile_y", "sp", [-1, 2, 1, 1]], ["tile_x", "sp", [-1, 2, 4, 1]], ["tile_rc", "sp", [-1, 6]], ["tile_rd", "sp", [-1, 1]], ["tile_ry", "sp", [-1, 1]], ["tile_rx", "sp", [-1, 1]], ["auto_unroll_max_step", "ot", 1500], ["unroll_explicit", "ot", 1]]}], "r": [[0.007598002, 0.00763207525], 0, 2.310068130493164, 1578514806.7271423], "v": 0.1}
{"i": ["cuda", "schedule_direct_3d_cuda", [[1, 24, 64, 64, 64], [24, 24, 3, 3, 3], [1, 1, 1], [1, 1, 1], 1], {}, ["schedule_direct_3d_cuda", [1, 24, 64, 64, 64], [24, 24, 3, 3, 3], [1, 1, 1], [1, 1, 1], 1], {"i": 6267051912, "t": "", "c": null, "e": [["tile_f", "sp", [-1, 1, 4, 6]], ["tile_d", "sp", [-1, 1, 1, 1]], ["tile_y", "sp", [-1, 2, 1, 2]], ["tile_x", "sp", [-1, 2, 4, 1]], ["tile_rc", "sp", [-1, 6]], ["tile_rd", "sp", [-1, 1]], ["tile_ry", "sp", [-1, 1]], ["tile_rx", "sp", [-1, 1]], ["auto_unroll_max_step", "ot", 1500], ["unroll_explicit", "ot", 0]]}], "r": [[0.01172356875, 0.0117283445], 0, 2.2633860111236572, 1578514807.9026835], "v": 0.1}
{"i": ["cuda", "schedule_direct_3d_cuda", [[1, 24, 64, 64, 64], [24, 24, 3, 3, 3], [1, 1, 1], [1, 1, 1], 1], {}, ["schedule_direct_3d_cuda", [1, 24, 64, 64, 64], [24, 24, 3, 3, 3], [1, 1, 1], [1, 1, 1], 1], {"i": 6361353670, "t": "", "c": null, "e": [["tile_f", "sp", [-1, 1, 2, 6]], ["tile_d", "sp", [-1, 1, 1, 1]], ["tile_y", "sp", [-1, 1, 2, 2]], ["tile_x", "sp", [-1, 1, 4, 1]], ["tile_rc", "sp", [-1, 12]], ["tile_rd", "sp", [-1, 1]], ["tile_ry", "sp", [-1, 1]], ["tile_rx", "sp", [-1, 1]], ["auto_unroll_max_step", "ot", 1500], ["unroll_explicit", "ot", 0]]}], "r": [[0.007787911, 0.0078434145], 0, 2.659332513809204, 1578514809.0295444], "v": 0.1}
{"i": ["cuda", "schedule_direct_3d_cuda", [[1, 24, 64, 64, 64], [24, 24, 3, 3, 3], [1, 1, 1], [1, 1, 1], 1], {}, ["schedule_direct_3d_cuda", [1, 24, 64, 64, 64], [24, 24, 3, 3, 3], [1, 1, 1], [1, 1, 1], 1], {"i": 15465287110, "t": "", "c": null, "e": [["tile_f", "sp", [-1, 1, 2, 6]], ["tile_d", "sp", [-1, 1, 1, 1]], ["tile_y", "sp", [-1, 1, 2, 2]], ["tile_x", "sp", [-1, 1, 4, 1]], ["tile_rc", "sp", [-1, 12]], ["tile_rd", "sp", [-1, 1]], ["tile_ry", "sp", [-1, 1]], ["tile_rx", "sp", [-1, 1]], ["auto_unroll_max_step", "ot", 1500], ["unroll_explicit", "ot", 1]]}], "r": [[0.00991167725, 0.00984687325], 0, 3.849078893661499, 1578514810.1286688], "v": 0.1}
{"i": ["cuda", "schedule_direct_3d_cuda", [[1, 24, 64, 64, 64], [24, 24, 3, 3, 3], [1, 1, 1], [1, 1, 1], 1], {}, ["schedule_direct_3d_cuda", [1, 24, 64, 64, 64], [24, 24, 3, 3, 3], [1, 1, 1], [1, 1, 1], 1], {"i": 15322809678, "t": "", "c": null, "e": [["tile_f", "sp", [-1, 1, 2, 12]], ["tile_d", "sp", [-1, 1, 1, 1]], ["tile_y", "sp", [-1, 1, 1, 1]], ["tile_x", "sp", [-1, 1, 4, 1]], ["tile_rc", "sp", [-1, 4]], ["tile_rd", "sp", [-1, 1]], ["tile_ry", "sp", [-1, 1]], ["tile_rx", "sp", [-1, 1]], ["auto_unroll_max_step", "ot", 1500], ["unroll_explicit", "ot", 1]]}], "r": [[0.0245763345, 0.024491505], 0, 2.176919460296631, 1578514814.826355], "v": 0.1}
{"i": ["cuda", "schedule_direct_3d_cuda", [[1, 24, 64, 64, 64], [24, 24, 3, 3, 3], [1, 1, 1], [1, 1, 1], 1], {}, ["schedule_direct_3d_cuda", [1, 24, 64, 64, 64], [24, 24, 3, 3, 3], [1, 1, 1], [1, 1, 1], 1], {"i": 4559318478, "t": "", "c": null, "e": [["tile_f", "sp", [-1, 1, 2, 12]], ["tile_d", "sp", [-1, 1, 1, 1]], ["tile_y", "sp", [-1, 4, 1, 1]], ["tile_x", "sp", [-1, 1, 4, 1]], ["tile_rc", "sp", [-1, 1]], ["tile_rd", "sp", [-1, 1]], ["tile_ry", "sp", [-1, 1]], ["tile_rx", "sp", [-1, 3]], ["auto_unroll_max_step", "ot", 512], ["unroll_explicit", "ot", 0]]}], "r": [[0.00612225675, 0.00611535675], 0, 1.2864634990692139, 1578514815.6625547], "v": 0.1}
{"i": ["cuda", "schedule_direct_3d_cuda", [[1, 24, 64, 64, 64], [24, 24, 3, 3, 3], [1, 1, 1], [1, 1, 1], 1], {}, ["schedule_direct_3d_cuda", [1, 24, 64, 64, 64], [24, 24, 3, 3, 3], [1, 1, 1], [1, 1, 1], 1], {"i": 13663251918, "t": "", "c": null, "e": [["tile_f", "sp", [-1, 1, 2, 12]], ["tile_d", "sp", [-1, 1, 1, 1]], ["tile_y", "sp", [-1, 4, 1, 1]], ["tile_x", "sp", [-1, 1, 4, 1]], ["tile_rc", "sp", [-1, 1]], ["tile_rd", "sp", [-1, 1]], ["tile_ry", "sp", [-1, 1]], ["tile_rx", "sp", [-1, 3]], ["auto_unroll_max_step", "ot", 512], ["unroll_explicit", "ot", 1]]}], "r": [[0.005428436, 0.0054301905], 0, 1.695657730102539, 1578514816.490788], "v": 0.1}
{"i": ["cuda", "schedule_direct_3d_cuda", [[1, 24, 64, 64, 64], [24, 24, 3, 3, 3], [1, 1, 1], [1, 1, 1], 1], {}, ["schedule_direct_3d_cuda", [1, 24, 64, 64, 64], [24, 24, 3, 3, 3], [1, 1, 1], [1, 1, 1], 1], {"i": 6362018950, "t": "", "c": null, "e": [["tile_f", "sp", [-1, 1, 2, 6]], ["tile_d", "sp", [-1, 1, 1, 1]], ["tile_y", "sp", [-1, 1, 1, 4]], ["tile_x", "sp", [-1, 2, 4, 1]], ["tile_rc", "sp", [-1, 12]], ["tile_rd", "sp", [-1, 1]], ["tile_ry", "sp", [-1, 1]], ["tile_rx", "sp", [-1, 1]], ["auto_unroll_max_step", "ot", 1500], ["unroll_explicit", "ot", 0]]}], "r": [[0.020926726, 0.0209673815], 0, 2.104849338531494, 1578514817.6336281], "v": 0.1}
{"i": ["cuda", "schedule_direct_3d_cuda", [[1, 24, 64, 64, 64], [24, 24, 3, 3, 3], [1, 1, 1], [1, 1, 1], 1], {}, ["schedule_direct_3d_cuda", [1, 24, 64, 64, 64], [24, 24, 3, 3, 3], [1, 1, 1], [1, 1, 1], 1], {"i": 15465952390, "t": "", "c": null, "e": [["tile_f", "sp", [-1, 1, 2, 6]], ["tile_d", "sp", [-1, 1, 1, 1]], ["tile_y", "sp", [-1, 1, 1, 4]], ["tile_x", "sp", [-1, 2, 4, 1]], ["tile_rc", "sp", [-1, 12]], ["tile_rd", "sp", [-1, 1]], ["tile_ry", "sp", [-1, 1]], ["tile_rx", "sp", [-1, 1]], ["auto_unroll_max_step", "ot", 1500], ["unroll_explicit", "ot", 1]]}], "r": [[0.020568574, 0.02057750975], 0, 2.5554964542388916, 1578514818.7282362], "v": 0.1}
{"i": ["cuda", "schedule_direct_3d_cuda", [[1, 24, 64, 64, 64], [24, 24, 3, 3, 3], [1, 1, 1], [1, 1, 1], 1], {}, ["schedule_direct_3d_cuda", [1, 24, 64, 64, 64], [24, 24, 3, 3, 3], [1, 1, 1], [1, 1, 1], 1], {"i": 16931698638, "t": "", "c": null, "e": [["tile_f", "sp", [-1, 1, 2, 12]], ["tile_d", "sp", [-1, 1, 1, 1]], ["tile_y", "sp", [-1, 1, 8, 1]], ["tile_x", "sp", [-1, 1, 2, 1]], ["tile_rc", "sp", [-1, 8]], ["tile_rd", "sp", [-1, 1]], ["tile_ry", "sp", [-1, 1]], ["tile_rx", "sp", [-1, 3]], ["auto_unroll_max_step", "ot", 1500], ["unroll_explicit", "ot", 1]]}], "r": [[0.0049291205, 0.0049445465], 0, 2.719957113265991, 1578514819.7685091], "v": 0.1}
{"i": ["cuda", "schedule_direct_3d_cuda", [[1, 24, 64, 64, 64], [24, 24, 3, 3, 3], [1, 1, 1], [1, 1, 1], 1], {}, ["schedule_direct_3d_cuda", [1, 24, 64, 64, 64], [24, 24, 3, 3, 3], [1, 1, 1], [1, 1, 1], 1], {"i": 16129149198, "t": "", "c": null, "e": [["tile_f", "sp", [-1, 1, 2, 12]], ["tile_d", "sp", [-1, 1, 1, 1]], ["tile_y", "sp", [-1, 1, 4, 2]], ["tile_x", "sp", [-1, 1, 4, 1]], ["tile_rc", "sp", [-1, 6]], ["tile_rd", "sp", [-1, 1]], ["tile_ry", "sp", [-1, 3]], ["tile_rx", "sp", [-1, 1]], ["auto_unroll_max_step", "ot", 1500], ["unroll_explicit", "ot", 1]]}], "r": [[0.00498249, 0.004974282], 0, 3.554405927658081, 1578514820.9708765], "v": 0.1}
{"i": ["cuda", "schedule_direct_3d_cuda", [[1, 24, 64, 64, 64], [24, 24, 3, 3, 3], [1, 1, 1], [1, 1, 1], 1], {}, ["schedule_direct_3d_cuda", [1, 24, 64, 64, 64], [24, 24, 3, 3, 3], [1, 1, 1], [1, 1, 1], 1], {"i": 13094511438, "t": "", "c": null, "e": [["tile_f", "sp", [-1, 1, 2, 12]], ["tile_d", "sp", [-1, 1, 1, 1]], ["tile_y", "sp", [-1, 2, 4, 2]], ["tile_x", "sp", [-1, 1, 4, 1]], ["tile_rc", "sp", [-1, 6]], ["tile_rd", "sp", [-1, 1]], ["tile_ry", "sp", [-1, 3]], ["tile_rx", "sp", [-1, 1]], ["auto_unroll_max_step", "ot", 512], ["unroll_explicit", "ot", 1]]}], "r": [[0.00210764225, 0.00207460075], 0, 1.7891004085540771, 1578514821.7087204], "v": 0.1}
{"i": ["cuda", "schedule_direct_3d_cuda", [[1, 24, 64, 64, 64], [24, 24, 3, 3, 3], [1, 1, 1], [1, 1, 1], 1], {}, ["schedule_direct_3d_cuda", [1, 24, 64, 64, 64], [24, 24, 3, 3, 3], [1, 1, 1], [1, 1, 1], 1], {"i": 13094363598, "t": "", "c": null, "e": [["tile_f", "sp", [-1, 1, 2, 12]], ["tile_d", "sp", [-1, 1, 1, 1]], ["tile_y", "sp", [-1, 1, 8, 1]], ["tile_x", "sp", [-1, 1, 4, 1]], ["tile_rc", "sp", [-1, 6]], ["tile_rd", "sp", [-1, 1]], ["tile_ry", "sp", [-1, 3]], ["tile_rx", "sp", [-1, 1]], ["auto_unroll_max_step", "ot", 512], ["unroll_explicit", "ot", 1]]}], "r": [[0.0033199595, 0.00332292075], 0, 1.6661689281463623, 1578514822.6090355], "v": 0.1}
{"i": ["cuda", "schedule_direct_3d_cuda", [[1, 24, 64, 64, 64], [24, 24, 3, 3, 3], [1, 1, 1], [1, 1, 1], 1], {}, ["schedule_direct_3d_cuda", [1, 24, 64, 64, 64], [24, 24, 3, 3, 3], [1, 1, 1], [1, 1, 1], 1], {"i": 16134155598, "t": "", "c": null, "e": [["tile_f", "sp", [-1, 1, 2, 12]], ["tile_d", "sp", [-1, 1, 1, 1]], ["tile_y", "sp", [-1, 1, 1, 2]], ["tile_x", "sp", [-1, 1, 16, 1]], ["tile_rc", "sp", [-1, 6]], ["tile_rd", "sp", [-1, 1]], ["tile_ry", "sp", [-1, 3]], ["tile_rx", "sp", [-1, 1]], ["auto_unroll_max_step", "ot", 1500], ["unroll_explicit", "ot", 1]]}], "r": [[0.00514565275, 0.00514991775], 0, 3.6379497051239014, 1578514823.8668053], "v": 0.1}
{"i": ["cuda", "schedule_direct_3d_cuda", [[1, 24, 64, 64, 64], [24, 24, 3, 3, 3], [1, 1, 1], [1, 1, 1], 1], {}, ["schedule_direct_3d_cuda", [1, 24, 64, 64, 64], [24, 24, 3, 3, 3], [1, 1, 1], [1, 1, 1], 1], {"i": 15371119752, "t": "", "c": null, "e": [["tile_f", "sp", [-1, 1, 4, 6]], ["tile_d", "sp", [-1, 1, 1, 1]], ["tile_y", "sp", [-1, 1, 1, 4]], ["tile_x", "sp", [-1, 2, 4, 1]], ["tile_rc", "sp", [-1, 6]], ["tile_rd", "sp", [-1, 1]], ["tile_ry", "sp", [-1, 1]], ["tile_rx", "sp", [-1, 1]], ["auto_unroll_max_step", "ot", 1500], ["unroll_explicit", "ot", 1]]}], "r": [[0.01190867475, 0.01190936475], 0, 2.73679780960083, 1578514824.9346864], "v": 0.1}
{"i": ["cuda", "schedule_direct_3d_cuda", [[1, 24, 64, 64, 64], [24, 24, 3, 3, 3], [1, 1, 1], [1, 1, 1], 1], {}, ["schedule_direct_3d_cuda", [1, 24, 64, 64, 64], [24, 24, 3, 3, 3], [1, 1, 1], [1, 1, 1], 1], {"i": 3231648070, "t": "", "c": null, "e": [["tile_f", "sp", [-1, 1, 2, 6]], ["tile_d", "sp", [-1, 1, 1, 1]], ["tile_y", "sp", [-1, 1, 1, 1]], ["tile_x", "sp", [-1, 1, 4, 1]], ["tile_rc", "sp", [-1, 6]], ["tile_rd", "sp", [-1, 1]], ["tile_ry", "sp", [-1, 1]], ["tile_rx", "sp", [-1, 1]], ["auto_unroll_max_step", "ot", 512], ["unroll_explicit", "ot", 0]]}], "r": [[0.020802814, 0.0207913285], 0, 1.6998357772827148, 1578514825.9634907], "v": 0.1}
{"i": ["cuda", "schedule_direct_3d_cuda", [[1, 24, 64, 64, 64], [24, 24, 3, 3, 3], [1, 1, 1], [1, 1, 1], 1], {}, ["schedule_direct_3d_cuda", [1, 24, 64, 64, 64], [24, 24, 3, 3, 3], [1, 1, 1], [1, 1, 1], 1], {"i": 12335581510, "t": "", "c": null, "e": [["tile_f", "sp", [-1, 1, 2, 6]], ["tile_d", "sp", [-1, 1, 1, 1]], ["tile_y", "sp", [-1, 1, 1, 1]], ["tile_x", "sp", [-1, 1, 4, 1]], ["tile_rc", "sp", [-1, 6]], ["tile_rd", "sp", [-1, 1]], ["tile_ry", "sp", [-1, 1]], ["tile_rx", "sp", [-1, 1]], ["auto_unroll_max_step", "ot", 512], ["unroll_explicit", "ot", 1]]}], "r": [[0.021027139, 0.02100179], 0, 1.9707419872283936, 1578514830.501732], "v": 0.1}
{"i": ["cuda", "schedule_direct_3d_cuda", [[1, 24, 64, 64, 64], [24, 24, 3, 3, 3], [1, 1, 1], [1, 1, 1], 1], {}, ["schedule_direct_3d_cuda", [1, 24, 64, 64, 64], [24, 24, 3, 3, 3], [1, 1, 1], [1, 1, 1], 1], {"i": 3231648072, "t": "", "c": null, "e": [["tile_f", "sp", [-1, 1, 4, 6]], ["tile_d", "sp", [-1, 1, 1, 1]], ["tile_y", "sp", [-1, 1, 1, 1]], ["tile_x", "sp", [-1, 1, 4, 1]], ["tile_rc", "sp", [-1, 6]], ["tile_rd", "sp", [-1, 1]], ["tile_ry", "sp", [-1, 1]], ["tile_rx", "sp", [-1, 1]], ["auto_unroll_max_step", "ot", 512], ["unroll_explicit", "ot", 0]]}], "r": [[0.0247302085, 0.024854947], 0, 1.7116622924804688, 1578514831.521924], "v": 0.1}
{"i": ["cuda", "schedule_direct_3d_cuda", [[1, 24, 64, 64, 64], [24, 24, 3, 3, 3], [1, 1, 1], [1, 1, 1], 1], {}, ["schedule_direct_3d_cuda", [1, 24, 64, 64, 64], [24, 24, 3, 3, 3], [1, 1, 1], [1, 1, 1], 1], {"i": 12335581512, "t": "", "c": null, "e": [["tile_f", "sp", [-1, 1, 4, 6]], ["tile_d", "sp", [-1, 1, 1, 1]], ["tile_y", "sp", [-1, 1, 1, 1]], ["tile_x", "sp", [-1, 1, 4, 1]], ["tile_rc", "sp", [-1, 6]], ["tile_rd", "sp", [-1, 1]], ["tile_ry", "sp", [-1, 1]], ["tile_rx", "sp", [-1, 1]], ["auto_unroll_max_step", "ot", 512], ["unroll_explicit", "ot", 1]]}], "r": [[0.02741222875, 0.02741329825], 0, 2.119236946105957, 1578514832.5516787], "v": 0.1}
{"i": ["cuda", "schedule_direct_3d_cuda", [[1, 24, 64, 64, 64], [24, 24, 3, 3, 3], [1, 1, 1], [1, 1, 1], 1], {}, ["schedule_direct_3d_cuda", [1, 24, 64, 64, 64], [24, 24, 3, 3, 3], [1, 1, 1], [1, 1, 1], 1], {"i": 16078171278, "t": "", "c": null, "e": [["tile_f", "sp", [-1, 1, 2, 12]], ["tile_d", "sp", [-1, 1, 1, 1]], ["tile_y", "sp", [-1, 1, 4, 1]], ["tile_x", "sp", [-1, 1, 2, 1]], ["tile_rc", "sp", [-1, 4]], ["tile_rd", "sp", [-1, 1]], ["tile_ry", "sp", [-1, 3]], ["tile_rx", "sp", [-1, 1]], ["auto_unroll_max_step", "ot", 1500], ["unroll_explicit", "ot", 1]]}], "r": [[0.0108829865, 0.0108083795], 0, 3.6838579177856445, 1578514833.6254945], "v": 0.1}
{"i": ["cuda", "schedule_direct_3d_cuda", [[1, 24, 64, 64, 64], [24, 24, 3, 3, 3], [1, 1, 1], [1, 1, 1], 1], {}, ["schedule_direct_3d_cuda", [1, 24, 64, 64, 64], [24, 24, 3, 3, 3], [1, 1, 1], [1, 1, 1], 1], {"i": 16884813198, "t": "", "c": null, "e": [["tile_f", "sp", [-1, 1, 2, 12]], ["tile_d", "sp", [-1, 1, 1, 1]], ["tile_y", "sp", [-1, 1, 4, 1]], ["tile_x", "sp", [-1, 2, 2, 1]], ["tile_rc", "sp", [-1, 6]], ["tile_rd", "sp", [-1, 1]], ["tile_ry", "sp", [-1, 1]], ["tile_rx", "sp", [-1, 3]], ["auto_unroll_max_step", "ot", 1500], ["unroll_explicit", "ot", 1]]}], "r": [[0.0097628445, 0.00975133], 0, 3.92301869392395, 1578514834.8446643], "v": 0.1}
{"i": ["cuda", "schedule_direct_3d_cuda", [[1, 24, 64, 64, 64], [24, 24, 3, 3, 3], [1, 1, 1], [1, 1, 1], 1], {}, ["schedule_direct_3d_cuda", [1, 24, 64, 64, 64], [24, 24, 3, 3, 3], [1, 1, 1], [1, 1, 1], 1], {"i": 16836832398, "t": "", "c": null, "e": [["tile_f", "sp", [-1, 1, 2, 12]], ["tile_d", "sp", [-1, 1, 1, 1]], ["tile_y", "sp", [-1, 1, 4, 1]], ["tile_x", "sp", [-1, 1, 2, 1]], ["tile_rc", "sp", [-1, 4]], ["tile_rd", "sp", [-1, 1]], ["tile_ry", "sp", [-1, 1]], ["tile_rx", "sp", [-1, 3]], ["auto_unroll_max_step", "ot", 1500], ["unroll_explicit", "ot", 1]]}], "r": [[0.009281901, 0.0092046055], 0, 3.5710370540618896, 1578514835.9152198], "v": 0.1}
{"i": ["cuda", "schedule_direct_3d_cuda", [[1, 24, 64, 64, 64], [24, 24, 3, 3, 3], [1, 1, 1], [1, 1, 1], 1], {}, ["schedule_direct_3d_cuda", [1, 24, 64, 64, 64], [24, 24, 3, 3, 3], [1, 1, 1], [1, 1, 1], 1], {"i": 16125587598, "t": "", "c": null, "e": [["tile_f", "sp", [-1, 1, 2, 12]], ["tile_d", "sp", [-1, 1, 1, 1]], ["tile_y", "sp", [-1, 1, 4, 1]], ["tile_x", "sp", [-1, 1, 2, 1]], ["tile_rc", "sp", [-1, 6]], ["tile_rd", "sp", [-1, 1]], ["tile_ry", "sp", [-1, 3]], ["tile_rx", "sp", [-1, 1]], ["auto_unroll_max_step", "ot", 1500], ["unroll_explicit", "ot", 1]]}], "r": [[0.0081390815, 0.008141693], 0, 2.745927572250366, 1578514836.8925378], "v": 0.1}
{"i": ["cuda", "schedule_direct_3d_cuda", [[1, 24, 64, 64, 64], [24, 24, 3, 3, 3], [1, 1, 1], [1, 1, 1], 1], {}, ["schedule_direct_3d_cuda", [1, 24, 64, 64, 64], [24, 24, 3, 3, 3], [1, 1, 1], [1, 1, 1], 1], {"i": 3995617998, "t": "", "c": null, "e": [["tile_f", "sp", [-1, 1, 2, 12]], ["tile_d", "sp", [-1, 1, 1, 1]], ["tile_y", "sp", [-1, 1, 2, 2]], ["tile_x", "sp", [-1, 1, 16, 1]], ["tile_rc", "sp", [-1, 6]], ["tile_rd", "sp", [-1, 1]], ["tile_ry", "sp", [-1, 3]], ["tile_rx", "sp", [-1, 1]], ["auto_unroll_max_step", "ot", 512], ["unroll_explicit", "ot", 0]]}], "r": [[0.0055427305, 0.00553868875], 0, 1.9349336624145508, 1578514837.9737768], "v": 0.1}
{"i": ["cuda", "schedule_direct_3d_cuda", [[1, 24, 64, 64, 64], [24, 24, 3, 3, 3], [1, 1, 1], [1, 1, 1], 1], {}, ["schedule_direct_3d_cuda", [1, 24, 64, 64, 64], [24, 24, 3, 3, 3], [1, 1, 1], [1, 1, 1], 1], {"i": 7025222478, "t": "", "c": null, "e": [["tile_f", "sp", [-1, 1, 2, 12]], ["tile_d", "sp", [-1, 1, 1, 1]], ["tile_y", "sp", [-1, 2, 4, 2]], ["tile_x", "sp", [-1, 1, 4, 1]], ["tile_rc", "sp", [-1, 6]], ["tile_rd", "sp", [-1, 1]], ["tile_ry", "sp", [-1, 3]], ["tile_rx", "sp", [-1, 1]], ["auto_unroll_max_step", "ot", 1500], ["unroll_explicit", "ot", 0]]}], "r": [[0.0071146255, 0.00711057275], 0, 2.1074371337890625, 1578514839.090028], "v": 0.1}
{"i": ["cuda", "schedule_direct_3d_cuda", [[1, 24, 64, 64, 64], [24, 24, 3, 3, 3], [1, 1, 1], [1, 1, 1], 1], {}, ["schedule_direct_3d_cuda", [1, 24, 64, 64, 64], [24, 24, 3, 3, 3], [1, 1, 1], [1, 1, 1], 1], {"i": 16887561678, "t": "", "c": null, "e": [["tile_f", "sp", [-1, 1, 2, 12]], ["tile_d", "sp", [-1, 1, 1, 1]], ["tile_y", "sp", [-1, 4, 1, 1]], ["tile_x", "sp", [-1, 1, 4, 1]], ["tile_rc", "sp", [-1, 6]], ["tile_rd", "sp", [-1, 1]], ["tile_ry", "sp", [-1, 1]], ["tile_rx", "sp", [-1, 3]], ["auto_unroll_max_step", "ot", 1500], ["unroll_explicit", "ot", 1]]}], "r": [[0.01217435125, 0.01216318675], 0, 2.697082042694092, 1578514840.0696223], "v": 0.1}
{"i": ["cuda", "schedule_direct_3d_cuda", [[1, 24, 64, 64, 64], [24, 24, 3, 3, 3], [1, 1, 1], [1, 1, 1], 1], {}, ["schedule_direct_3d_cuda", [1, 24, 64, 64, 64], [24, 24, 3, 3, 3], [1, 1, 1], [1, 1, 1], 1], {"i": 16078702158, "t": "", "c": null, "e": [["tile_f", "sp", [-1, 1, 2, 12]], ["tile_d", "sp", [-1, 1, 1, 1]], ["tile_y", "sp", [-1, 2, 2, 1]], ["tile_x", "sp", [-1, 2, 2, 1]], ["tile_rc", "sp", [-1, 4]], ["tile_rd", "sp", [-1, 1]], ["tile_ry", "sp", [-1, 3]], ["tile_rx", "sp", [-1, 1]], ["auto_unroll_max_step", "ot", 1500], ["unroll_explicit", "ot", 1]]}], "r": [[0.00507276375, 0.00507146575], 0, 2.19360089302063, 1578514840.9008343], "v": 0.1}
{"i": ["cuda", "schedule_direct_3d_cuda", [[1, 24, 64, 64, 64], [24, 24, 3, 3, 3], [1, 1, 1], [1, 1, 1], 1], {}, ["schedule_direct_3d_cuda", [1, 24, 64, 64, 64], [24, 24, 3, 3, 3], [1, 1, 1], [1, 1, 1], 1], {"i": 16128934158, "t": "", "c": null, "e": [["tile_f", "sp", [-1, 1, 2, 12]], ["tile_d", "sp", [-1, 1, 1, 1]], ["tile_y", "sp", [-1, 1, 2, 1]], ["tile_x", "sp", [-1, 1, 4, 1]], ["tile_rc", "sp", [-1, 6]], ["tile_rd", "sp", [-1, 1]], ["tile_ry", "sp", [-1, 3]], ["tile_rx", "sp", [-1, 1]], ["auto_unroll_max_step", "ot", 1500], ["unroll_explicit", "ot", 1]]}], "r": [[0.0087080595, 0.0087150695], 0, 2.3955280780792236, 1578514841.9076507], "v": 0.1}
{"i": ["cuda", "schedule_direct_3d_cuda", [[1, 24, 64, 64, 64], [24, 24, 3, 3, 3], [1, 1, 1], [1, 1, 1], 1], {}, ["schedule_direct_3d_cuda", [1, 24, 64, 64, 64], [24, 24, 3, 3, 3], [1, 1, 1], [1, 1, 1], 1], {"i": 6266863752, "t": "", "c": null, "e": [["tile_f", "sp", [-1, 1, 4, 6]], ["tile_d", "sp", [-1, 1, 1, 1]], ["tile_y", "sp", [-1, 2, 1, 1]], ["tile_x", "sp", [-1, 2, 4, 1]], ["tile_rc", "sp", [-1, 6]], ["tile_rd", "sp", [-1, 1]], ["tile_ry", "sp", [-1, 1]], ["tile_rx", "sp", [-1, 1]], ["auto_unroll_max_step", "ot", 1500], ["unroll_explicit", "ot", 0]]}], "r": [[0.011104318, 0.0111028995], 0, 2.5697128772735596, 1578514846.957432], "v": 0.1}
{"i": ["cuda", "schedule_direct_3d_cuda", [[1, 24, 64, 64, 64], [24, 24, 3, 3, 3], [1, 1, 1], [1, 1, 1], 1], {}, ["schedule_direct_3d_cuda", [1, 24, 64, 64, 64], [24, 24, 3, 3, 3], [1, 1, 1], [1, 1, 1], 1], {"i": 15370797192, "t": "", "c": null, "e": [["tile_f", "sp", [-1, 1, 4, 6]], ["tile_d", "sp", [-1, 1, 1, 1]], ["tile_y", "sp", [-1, 2, 1, 1]], ["tile_x", "sp", [-1, 2, 4, 1]], ["tile_rc", "sp", [-1, 6]], ["tile_rd", "sp", [-1, 1]], ["tile_ry", "sp", [-1, 1]], ["tile_rx", "sp", [-1, 1]], ["auto_unroll_max_step", "ot", 1500], ["unroll_explicit", "ot", 1]]}], "r": [[0.00856229575, 0.008549716], 0, 3.4769763946533203, 1578514847.9607928], "v": 0.1}
{"i": ["cuda", "schedule_direct_3d_cuda", [[1, 24, 64, 64, 64], [24, 24, 3, 3, 3], [1, 1, 1], [1, 1, 1], 1], {}, ["schedule_direct_3d_cuda", [1, 24, 64, 64, 64], [24, 24, 3, 3, 3], [1, 1, 1], [1, 1, 1], 1], {"i": 13094343438, "t": "", "c": null, "e": [["tile_f", "sp", [-1, 1, 2, 12]], ["tile_d", "sp", [-1, 1, 1, 1]], ["tile_y", "sp", [-1, 4, 4, 1]], ["tile_x", "sp", [-1, 1, 4, 1]], ["tile_rc", "sp", [-1, 6]], ["tile_rd", "sp", [-1, 1]], ["tile_ry", "sp", [-1, 3]], ["tile_rx", "sp", [-1, 1]], ["auto_unroll_max_step", "ot", 512], ["unroll_explicit", "ot", 1]]}], "r": [[0.00206279275, 0.00205068925], 0, 1.7577157020568848, 1578514848.7039862], "v": 0.1}
{"i": ["cuda", "schedule_direct_3d_cuda", [[1, 24, 64, 64, 64], [24, 24, 3, 3, 3], [1, 1, 1], [1, 1, 1], 1], {}, ["schedule_direct_3d_cuda", [1, 24, 64, 64, 64], [24, 24, 3, 3, 3], [1, 1, 1], [1, 1, 1], 1], {"i": 16125789198, "t": "", "c": null, "e": [["tile_f", "sp", [-1, 1, 2, 12]], ["tile_d", "sp", [-1, 1, 1, 1]], ["tile_y", "sp", [-1, 1, 8, 2]], ["tile_x", "sp", [-1, 1, 2, 1]], ["tile_rc", "sp", [-1, 6]], ["tile_rd", "sp", [-1, 1]], ["tile_ry", "sp", [-1, 3]], ["tile_rx", "sp", [-1, 1]], ["auto_unroll_max_step", "ot", 1500], ["unroll_explicit", "ot", 1]]}], "r": [[0.005296549, 0.00529063425], 0, 3.7405476570129395, 1578514849.8475296], "v": 0.1}
{"i": ["cuda", "schedule_direct_3d_cuda", [[1, 24, 64, 64, 64], [24, 24, 3, 3, 3], [1, 1, 1], [1, 1, 1], 1], {}, ["schedule_direct_3d_cuda", [1, 24, 64, 64, 64], [24, 24, 3, 3, 3], [1, 1, 1], [1, 1, 1], 1], {"i": 6313708870, "t": "", "c": null, "e": [["tile_f", "sp", [-1, 1, 2, 6]], ["tile_d", "sp", [-1, 1, 1, 1]], ["tile_y", "sp", [-1, 1, 1, 1]], ["tile_x", "sp", [-1, 1, 4, 1]], ["tile_rc", "sp", [-1, 8]], ["tile_rd", "sp", [-1, 1]], ["tile_ry", "sp", [-1, 1]], ["tile_rx", "sp", [-1, 1]], ["auto_unroll_max_step", "ot", 1500], ["unroll_explicit", "ot", 0]]}], "r": [[0.02263400325, 0.022696552], 0, 2.0632717609405518, 1578514850.9083147], "v": 0.1}
{"i": ["cuda", "schedule_direct_3d_cuda", [[1, 24, 64, 64, 64], [24, 24, 3, 3, 3], [1, 1, 1], [1, 1, 1], 1], {}, ["schedule_direct_3d_cuda", [1, 24, 64, 64, 64], [24, 24, 3, 3, 3], [1, 1, 1], [1, 1, 1], 1], {"i": 6361125190, "t": "", "c": null, "e": [["tile_f", "sp", [-1, 1, 2, 6]], ["tile_d", "sp", [-1, 1, 1, 1]], ["tile_y", "sp", [-1, 1, 1, 1]], ["tile_x", "sp", [-1, 1, 4, 1]], ["tile_rc", "sp", [-1, 12]], ["tile_rd", "sp", [-1, 1]], ["tile_ry", "sp", [-1, 1]], ["tile_rx", "sp", [-1, 1]], ["auto_unroll_max_step", "ot", 1500], ["unroll_explicit", "ot", 0]]}], "r": [[0.0287553775, 0.028759529], 0, 2.850125551223755, 1578514852.2990055], "v": 0.1}
{"i": ["cuda", "schedule_direct_3d_cuda", [[1, 24, 64, 64, 64], [24, 24, 3, 3, 3], [1, 1, 1], [1, 1, 1], 1], {}, ["schedule_direct_3d_cuda", [1, 24, 64, 64, 64], [24, 24, 3, 3, 3], [1, 1, 1], [1, 1, 1], 1], {"i": 15465058630, "t": "", "c": null, "e": [["tile_f", "sp", [-1, 1, 2, 6]], ["tile_d", "sp", [-1, 1, 1, 1]], ["tile_y", "sp", [-1, 1, 1, 1]], ["tile_x", "sp", [-1, 1, 4, 1]], ["tile_rc", "sp", [-1, 12]], ["tile_rd", "sp", [-1, 1]], ["tile_ry", "sp", [-1, 1]], ["tile_rx", "sp", [-1, 1]], ["auto_unroll_max_step", "ot", 1500], ["unroll_explicit", "ot", 1]]}], "r": [[0.020076097, 0.02007366975], 0, 3.017518997192383, 1578514853.4738257], "v": 0.1}
{"i": ["cuda", "schedule_direct_3d_cuda", [[1, 24, 64, 64, 64], [24, 24, 3, 3, 3], [1, 1, 1], [1, 1, 1], 1], {}, ["schedule_direct_3d_cuda", [1, 24, 64, 64, 64], [24, 24, 3, 3, 3], [1, 1, 1], [1, 1, 1], 1], {"i": 13805494150, "t": "", "c": null, "e": [["tile_f", "sp", [-1, 1, 2, 6]], ["tile_d", "sp", [-1, 1, 1, 1]], ["tile_y", "sp", [-1, 2, 1, 1]], ["tile_x", "sp", [-1, 1, 4, 1]], ["tile_rc", "sp", [-1, 4]], ["tile_rd", "sp", [-1, 1]], ["tile_ry", "sp", [-1, 1]], ["tile_rx", "sp", [-1, 3]], ["auto_unroll_max_step", "ot", 512], ["unroll_explicit", "ot", 1]]}], "r": [[0.00761110975, 0.00760851825], 0, 2.0344505310058594, 1578514854.3579884], "v": 0.1}
{"i": ["cuda", "schedule_direct_3d_cuda", [[1, 24, 64, 64, 64], [24, 24, 3, 3, 3], [1, 1, 1], [1, 1, 1], 1], {}, ["schedule_direct_3d_cuda", [1, 24, 64, 64, 64], [24, 24, 3, 3, 3], [1, 1, 1], [1, 1, 1], 1], {"i": 4701560710, "t": "", "c": null, "e": [["tile_f", "sp", [-1, 1, 2, 6]], ["tile_d", "sp", [-1, 1, 1, 1]], ["tile_y", "sp", [-1, 2, 1, 1]], ["tile_x", "sp", [-1, 1, 4, 1]], ["tile_rc", "sp", [-1, 4]], ["tile_rd", "sp", [-1, 1]], ["tile_ry", "sp", [-1, 1]], ["tile_rx", "sp", [-1, 3]], ["auto_unroll_max_step", "ot", 512], ["unroll_explicit", "ot", 0]]}], "r": [[0.0090080465, 0.009006229], 0, 1.6358349323272705, 1578514855.2371006], "v": 0.1}
{"i": ["cuda", "schedule_direct_3d_cuda", [[1, 24, 64, 64, 64], [24, 24, 3, 3, 3], [1, 1, 1], [1, 1, 1], 1], {}, ["schedule_direct_3d_cuda", [1, 24, 64, 64, 64], [24, 24, 3, 3, 3], [1, 1, 1], [1, 1, 1], 1], {"i": 16129458312, "t": "", "c": null, "e": [["tile_f", "sp", [-1, 1, 4, 6]], ["tile_d", "sp", [-1, 1, 1, 1]], ["tile_y", "sp", [-1, 2, 1, 1]], ["tile_x", "sp", [-1, 2, 4, 1]], ["tile_rc", "sp", [-1, 6]], ["tile_rd", "sp", [-1, 1]], ["tile_ry", "sp", [-1, 3]], ["tile_rx", "sp", [-1, 1]], ["auto_unroll_max_step", "ot", 1500], ["unroll_explicit", "ot", 1]]}], "r": [[0.00996372175, 0.009966441], 0, 3.452548027038574, 1578514856.428693], "v": 0.1}
{"i": ["cuda", "schedule_direct_3d_cuda", [[1, 24, 64, 64, 64], [24, 24, 3, 3, 3], [1, 1, 1], [1, 1, 1], 1], {}, ["schedule_direct_3d_cuda", [1, 24, 64, 64, 64], [24, 24, 3, 3, 3], [1, 1, 1], [1, 1, 1], 1], {"i": 16887554952, "t": "", "c": null, "e": [["tile_f", "sp", [-1, 1, 4, 6]], ["tile_d", "sp", [-1, 1, 1, 1]], ["tile_y", "sp", [-1, 2, 1, 1]], ["tile_x", "sp", [-1, 1, 4, 1]], ["tile_rc", "sp", [-1, 6]], ["tile_rd", "sp", [-1, 1]], ["tile_ry", "sp", [-1, 1]], ["tile_rx", "sp", [-1, 3]], ["auto_unroll_max_step", "ot", 1500], ["unroll_explicit", "ot", 1]]}], "r": [[0.008541663, 0.00854362875], 0, 2.2654640674591064, 1578514857.3645742], "v": 0.1}
{"i": ["cuda", "schedule_direct_3d_cuda", [[1, 24, 64, 64, 64], [24, 24, 3, 3, 3], [1, 1, 1], [1, 1, 1], 1], {}, ["schedule_direct_3d_cuda", [1, 24, 64, 64, 64], [24, 24, 3, 3, 3], [1, 1, 1], [1, 1, 1], 1], {"i": 7783628232, "t": "", "c": null, "e": [["tile_f", "sp", [-1, 1, 4, 6]], ["tile_d", "sp", [-1, 1, 1, 1]], ["tile_y", "sp", [-1, 4, 1, 1]], ["tile_x", "sp", [-1, 1, 4, 1]], ["tile_rc", "sp", [-1, 6]], ["tile_rd", "sp", [-1, 1]], ["tile_ry", "sp", [-1, 1]], ["tile_rx", "sp", [-1, 3]], ["auto_unroll_max_step", "ot", 1500], ["unroll_explicit", "ot", 0]]}], "r": [[0.00613669875, 0.00613314225], 0, 2.205042600631714, 1578514858.4812868], "v": 0.1}
{"i": ["cuda", "schedule_direct_3d_cuda", [[1, 24, 64, 64, 64], [24, 24, 3, 3, 3], [1, 1, 1], [1, 1, 1], 1], {}, ["schedule_direct_3d_cuda", [1, 24, 64, 64, 64], [24, 24, 3, 3, 3], [1, 1, 1], [1, 1, 1], 1], {"i": 13052101518, "t": "", "c": null, "e": [["tile_f", "sp", [-1, 1, 2, 12]], ["tile_d", "sp", [-1, 1, 1, 1]], ["tile_y", "sp", [-1, 2, 1, 2]], ["tile_x", "sp", [-1, 1, 16, 1]], ["tile_rc", "sp", [-1, 4]], ["tile_rd", "sp", [-1, 1]], ["tile_ry", "sp", [-1, 3]], ["tile_rx", "sp", [-1, 1]], ["auto_unroll_max_step", "ot", 512], ["unroll_explicit", "ot", 1]]}], "r": [[0.002944878, 0.0029457235], 0, 1.4141533374786377, 1578515081.6299613], "v": 0.1}
{"i": ["cuda", "schedule_direct_3d_cuda", [[1, 24, 64, 64, 64], [24, 24, 3, 3, 3], [1, 1, 1], [1, 1, 1], 1], {}, ["schedule_direct_3d_cuda", [1, 24, 64, 64, 64], [24, 24, 3, 3, 3], [1, 1, 1], [1, 1, 1], 1], {"i": 3948168078, "t": "", "c": null, "e": [["tile_f", "sp", [-1, 1, 2, 12]], ["tile_d", "sp", [-1, 1, 1, 1]], ["tile_y", "sp", [-1, 2, 1, 2]], ["tile_x", "sp", [-1, 1, 16, 1]], ["tile_rc", "sp", [-1, 4]], ["tile_rd", "sp", [-1, 1]], ["tile_ry", "sp", [-1, 3]], ["tile_rx", "sp", [-1, 1]], ["auto_unroll_max_step", "ot", 512], ["unroll_explicit", "ot", 0]]}], "r": [[0.00286913075, 0.00286727975], 0, 1.2351720333099365, 1578515082.2901845], "v": 0.1}
{"i": ["cuda", "schedule_direct_3d_cuda", [[1, 24, 64, 64, 64], [24, 24, 3, 3, 3], [1, 1, 1], [1, 1, 1], 1], {}, ["schedule_direct_3d_cuda", [1, 24, 64, 64, 64], [24, 24, 3, 3, 3], [1, 1, 1], [1, 1, 1], 1], {"i": 13063814478, "t": "", "c": null, "e": [["tile_f", "sp", [-1, 1, 2, 12]], ["tile_d", "sp", [-1, 1, 1, 1]], ["tile_y", "sp", [-1, 2, 2, 1]], ["tile_x", "sp", [-1, 1, 8, 2]], ["tile_rc", "sp", [-1, 4]], ["tile_rd", "sp", [-1, 1]], ["tile_ry", "sp", [-1, 3]], ["tile_rx", "sp", [-1, 1]], ["auto_unroll_max_step", "ot", 512], ["unroll_explicit", "ot", 1]]}], "r": [[0.0029865765, 0.00298085975], 0, 1.4698255062103271, 1578515082.9688034], "v": 0.1}
{"i": ["cuda", "schedule_direct_3d_cuda", [[1, 24, 64, 64, 64], [24, 24, 3, 3, 3], [1, 1, 1], [1, 1, 1], 1], {}, ["schedule_direct_3d_cuda", [1, 24, 64, 64, 64], [24, 24, 3, 3, 3], [1, 1, 1], [1, 1, 1], 1], {"i": 13810621518, "t": "", "c": null, "e": [["tile_f", "sp", [-1, 1, 2, 12]], ["tile_d", "sp", [-1, 1, 1, 1]], ["tile_y", "sp", [-1, 2, 2, 1]], ["tile_x", "sp", [-1, 1, 16, 1]], ["tile_rc", "sp", [-1, 4]], ["tile_rd", "sp", [-1, 1]], ["tile_ry", "sp", [-1, 1]], ["tile_rx", "sp", [-1, 3]], ["auto_unroll_max_step", "ot", 512], ["unroll_explicit", "ot", 1]]}], "r": [[0.0039147125, 0.0039146345], 0, 1.75299072265625, 1578515083.854967], "v": 0.1}
{"i": ["cuda", "schedule_direct_3d_cuda", [[1, 24, 64, 64, 64], [24, 24, 3, 3, 3], [1, 1, 1], [1, 1, 1], 1], {}, ["schedule_direct_3d_cuda", [1, 24, 64, 64, 64], [24, 24, 3, 3, 3], [1, 1, 1], [1, 1, 1], 1], {"i": 16086745998, "t": "", "c": null, "e": [["tile_f", "sp", [-1, 1, 2, 12]], ["tile_d", "sp", [-1, 1, 1, 1]], ["tile_y", "sp", [-1, 2, 1, 2]], ["tile_x", "sp", [-1, 1, 16, 1]], ["tile_rc", "sp", [-1, 4]], ["tile_rd", "sp", [-1, 1]], ["tile_ry", "sp", [-1, 3]], ["tile_rx", "sp", [-1, 1]], ["auto_unroll_max_step", "ot", 1500], ["unroll_explicit", "ot", 1]]}], "r": [[0.00314302775, 0.00315985825], 0, 1.9198062419891357, 1578515084.6960616], "v": 0.1}
{"i": ["cuda", "schedule_direct_3d_cuda", [[1, 24, 64, 64, 64], [24, 24, 3, 3, 3], [1, 1, 1], [1, 1, 1], 1], {}, ["schedule_direct_3d_cuda", [1, 24, 64, 64, 64], [24, 24, 3, 3, 3], [1, 1, 1], [1, 1, 1], 1], {"i": 10017457038, "t": "", "c": null, "e": [["tile_f", "sp", [-1, 1, 2, 12]], ["tile_d", "sp", [-1, 1, 1, 1]], ["tile_y", "sp", [-1, 2, 1, 2]], ["tile_x", "sp", [-1, 1, 16, 1]], ["tile_rc", "sp", [-1, 4]], ["tile_rd", "sp", [-1, 1]], ["tile_ry", "sp", [-1, 3]], ["tile_rx", "sp", [-1, 1]], ["auto_unroll_max_step", "ot", 0], ["unroll_explicit", "ot", 1]]}], "r": [[0.0030633145, 0.003238524], 0, 1.2755305767059326, 1578515085.3907366], "v": 0.1}
{"i": ["cuda", "schedule_direct_3d_cuda", [[1, 24, 64, 64, 64], [24, 24, 3, 3, 3], [1, 1, 1], [1, 1, 1], 1], {}, ["schedule_direct_3d_cuda", [1, 24, 64, 64, 64], [24, 24, 3, 3, 3], [1, 1, 1], [1, 1, 1], 1], {"i": 16845265998, "t": "", "c": null, "e": [["tile_f", "sp", [-1, 1, 2, 12]], ["tile_d", "sp", [-1, 1, 1, 1]], ["tile_y", "sp", [-1, 2, 2, 1]], ["tile_x", "sp", [-1, 1, 16, 1]], ["tile_rc", "sp", [-1, 4]], ["tile_rd", "sp", [-1, 1]], ["tile_ry", "sp", [-1, 1]], ["tile_rx", "sp", [-1, 3]], ["auto_unroll_max_step", "ot", 1500], ["unroll_explicit", "ot", 1]]}], "r": [[0.003635284, 0.003632348], 0, 2.4107563495635986, 1578515086.3253715], "v": 0.1}
{"i": ["cuda", "schedule_direct_3d_cuda", [[1, 24, 64, 64, 64], [24, 24, 3, 3, 3], [1, 1, 1], [1, 1, 1], 1], {}, ["schedule_direct_3d_cuda", [1, 24, 64, 64, 64], [24, 24, 3, 3, 3], [1, 1, 1], [1, 1, 1], 1], {"i": 14484046145, "t": "", "c": null, "e": [["tile_f", "sp", [-1, 2, 3, 4]], ["tile_d", "sp", [-1, 1, 1, 1]], ["tile_y", "sp", [-1, 2, 2, 1]], ["tile_x", "sp", [-1, 1, 4, 2]], ["tile_rc", "sp", [-1, 2]], ["tile_rd", "sp", [-1, 1]], ["tile_ry", "sp", [-1, 3]], ["tile_rx", "sp", [-1, 3]], ["auto_unroll_max_step", "ot", 512], ["unroll_explicit", "ot", 1]]}], "r": [[0.00199681875, 0.00199503125], 0, 1.5842628479003906, 1578515087.0295885], "v": 0.1}
{"i": ["cuda", "schedule_direct_3d_cuda", [[1, 24, 64, 64, 64], [24, 24, 3, 3, 3], [1, 1, 1], [1, 1, 1], 1], {}, ["schedule_direct_3d_cuda", [1, 24, 64, 64, 64], [24, 24, 3, 3, 3], [1, 1, 1], [1, 1, 1], 1], {"i": 11449401665, "t": "", "c": null, "e": [["tile_f", "sp", [-1, 2, 3, 4]], ["tile_d", "sp", [-1, 1, 1, 1]], ["tile_y", "sp", [-1, 2, 2, 1]], ["tile_x", "sp", [-1, 1, 4, 2]], ["tile_rc", "sp", [-1, 2]], ["tile_rd", "sp", [-1, 1]], ["tile_ry", "sp", [-1, 3]], ["tile_rx", "sp", [-1, 3]], ["auto_unroll_max_step", "ot", 0], ["unroll_explicit", "ot", 1]]}], "r": [[0.00225745975, 0.00225323475], 0, 1.4274139404296875, 1578515087.775684], "v": 0.1}
{"i": ["cuda", "schedule_direct_3d_cuda", [[1, 24, 64, 64, 64], [24, 24, 3, 3, 3], [1, 1, 1], [1, 1, 1], 1], {}, ["schedule_direct_3d_cuda", [1, 24, 64, 64, 64], [24, 24, 3, 3, 3], [1, 1, 1], [1, 1, 1], 1], {"i": 17518690625, "t": "", "c": null, "e": [["tile_f", "sp", [-1, 2, 3, 4]], ["tile_d", "sp", [-1, 1, 1, 1]], ["tile_y", "sp", [-1, 2, 2, 1]], ["tile_x", "sp", [-1, 1, 4, 2]], ["tile_rc", "sp", [-1, 2]], ["tile_rd", "sp", [-1, 1]], ["tile_ry", "sp", [-1, 3]], ["tile_rx", "sp", [-1, 3]], ["auto_unroll_max_step", "ot", 1500], ["unroll_explicit", "ot", 1]]}], "r": [[0.00254633175, 0.0025495225], 0, 1.7846324443817139, 1578515088.5653021], "v": 0.1}
