auto_log/((1, 64, 32, 32, 32), (64, 64, 3, 3, 3), (1, 64, 32, 32, 32), (1, 1, 1), (1, 1, 1), 1, 1, None)_bwd_wei_grad.log
{"i": ["cuda", "schedule_conv3d_nchw_cuda", [[64, 1, 32, 32, 32], [64, 1, 32, 32, 32], 1, [1, 1, 1], [1, 1, 1], 1], {}, ["schedule_conv3d_nchw_cuda", [64, 1, 32, 32, 32], [64, 1, 32, 32, 32], 1, [1, 1, 1], [1, 1, 1], 1], {"i": 980079931, "t": "", "c": null, "e": [["tile_n", "sp", [-1, 2, 8, 1]], ["tile_f", "sp", [-1, 1, 8, 1]], ["tile_d", "sp", [-1, 1, 1, 1]], ["tile_y", "sp", [-1, 3, 1, 1]], ["tile_x", "sp", [-1, 3, 1, 1]], ["tile_rc", "sp", [-1, 1]], ["tile_rd", "sp", [-1, 16]], ["tile_ry", "sp", [-1, 2]], ["tile_rx", "sp", [-1, 1]], ["auto_unroll_max_step", "ot", 512], ["unroll_explicit", "ot", 1], ["fuse_yx", "ot", 1]]}], "r": [[0.01402365525, 0.01371182275], 0, 1.686652660369873, 1578531152.9069707], "v": 0.1}
{"i": ["cuda", "schedule_conv3d_nchw_cuda", [[64, 1, 32, 32, 32], [64, 1, 32, 32, 32], 1, [1, 1, 1], [1, 1, 1], 1], {}, ["schedule_conv3d_nchw_cuda", [64, 1, 32, 32, 32], [64, 1, 32, 32, 32], 1, [1, 1, 1], [1, 1, 1], 1], {"i": 303579396, "t": "", "c": null, "e": [["tile_n", "sp", [-1, 4, 2, 2]], ["tile_f", "sp", [-1, 4, 16, 1]], ["tile_d", "sp", [-1, 1, 1, 1]], ["tile_y", "sp", [-1, 1, 1, 1]], ["tile_x", "sp", [-1, 3, 1, 1]], ["tile_rc", "sp", [-1, 1]], ["tile_rd", "sp", [-1, 1]], ["tile_ry", "sp", [-1, 16]], ["tile_rx", "sp", [-1, 1]], ["auto_unroll_max_step", "ot", 0], ["unroll_explicit", "ot", 1], ["fuse_yx", "ot", 0]]}], "r": [[0.00756314475, 0.00756199575], 0, 1.3309273719787598, 1578531159.4521475], "v": 0.1}
{"i": ["cuda", "schedule_conv3d_nchw_cuda", [[64, 1, 32, 32, 32], [64, 1, 32, 32, 32], 1, [1, 1, 1], [1, 1, 1], 1], {}, ["schedule_conv3d_nchw_cuda", [64, 1, 32, 32, 32], [64, 1, 32, 32, 32], 1, [1, 1, 1], [1, 1, 1], 1], {"i": 789824461, "t": "", "c": null, "e": [["tile_n", "sp", [-1, 1, 4, 1]], ["tile_f", "sp", [-1, 1, 32, 2]], ["tile_d", "sp", [-1, 1, 1, 1]], ["tile_y", "sp", [-1, 1, 1, 1]], ["tile_x", "sp", [-1, 1, 1, 1]], ["tile_rc", "sp", [-1, 1]], ["tile_rd", "sp", [-1, 8]], ["tile_ry", "sp", [-1, 8]], ["tile_rx", "sp", [-1, 1]], ["auto_unroll_max_step", "ot", 1500], ["unroll_explicit", "ot", 0], ["fuse_yx", "ot", 1]]}], "r": [[0.02183085175, 0.0212994705], 0, 1.5672190189361572, 1578531160.3681254], "v": 0.1}
{"i": ["cuda", "schedule_conv3d_nchw_cuda", [[64, 1, 32, 32, 32], [64, 1, 32, 32, 32], 1, [1, 1, 1], [1, 1, 1], 1], {}, ["schedule_conv3d_nchw_cuda", [64, 1, 32, 32, 32], [64, 1, 32, 32, 32], 1, [1, 1, 1], [1, 1, 1], 1], {"i": 1085799549, "t": "", "c": null, "e": [["tile_n", "sp", [-1, 4, 2, 1]], ["tile_f", "sp", [-1, 1, 4, 1]], ["tile_d", "sp", [-1, 1, 1, 3]], ["tile_y", "sp", [-1, 1, 3, 1]], ["tile_x", "sp", [-1, 3, 1, 1]], ["tile_rc", "sp", [-1, 1]], ["tile_rd", "sp", [-1, 16]], ["tile_ry", "sp", [-1, 16]], ["tile_rx", "sp", [-1, 1]], ["auto_unroll_max_step", "ot", 1500], ["unroll_explicit", "ot", 1], ["fuse_yx", "ot", 1]]}], "r": [[0.04182433375, 0.041815029], 0, 7.083120584487915, 1578531163.5884721], "v": 0.1}
{"i": ["cuda", "schedule_conv3d_nchw_cuda", [[64, 1, 32, 32, 32], [64, 1, 32, 32, 32], 1, [1, 1, 1], [1, 1, 1], 1], {}, ["schedule_conv3d_nchw_cuda", [64, 1, 32, 32, 32], [64, 1, 32, 32, 32], 1, [1, 1, 1], [1, 1, 1], 1], {"i": 1013584918, "t": "", "c": null, "e": [["tile_n", "sp", [-1, 8, 2, 1]], ["tile_f", "sp", [-1, 2, 2, 4]], ["tile_d", "sp", [-1, 1, 1, 1]], ["tile_y", "sp", [-1, 1, 1, 1]], ["tile_x", "sp", [-1, 1, 3, 1]], ["tile_rc", "sp", [-1, 1]], ["tile_rd", "sp", [-1, 1]], ["tile_ry", "sp", [-1, 4]], ["tile_rx", "sp", [-1, 4]], ["auto_unroll_max_step", "ot", 512], ["unroll_explicit", "ot", 1], ["fuse_yx", "ot", 1]]}], "r": [[0.0075324695, 0.00753091225], 0, 1.5743374824523926, 1578531178.1401465], "v": 0.1}
{"i": ["cuda", "schedule_conv3d_nchw_cuda", [[64, 1, 32, 32, 32], [64, 1, 32, 32, 32], 1, [1, 1, 1], [1, 1, 1], 1], {}, ["schedule_conv3d_nchw_cuda", [64, 1, 32, 32, 32], [64, 1, 32, 32, 32], 1, [1, 1, 1], [1, 1, 1], 1], {"i": 637217456, "t": "", "c": null, "e": [["tile_n", "sp", [-1, 2, 2, 1]], ["tile_f", "sp", [-1, 2, 1, 4]], ["tile_d", "sp", [-1, 1, 1, 1]], ["tile_y", "sp", [-1, 3, 1, 1]], ["tile_x", "sp", [-1, 1, 1, 1]], ["tile_rc", "sp", [-1, 1]], ["tile_rd", "sp", [-1, 2]], ["tile_ry", "sp", [-1, 2]], ["tile_rx", "sp", [-1, 8]], ["auto_unroll_max_step", "ot", 0], ["unroll_explicit", "ot", 0], ["fuse_yx", "ot", 1]]}], "r": [[0.0716995105, 0.0714795535], 0, 1.7738919258117676, 1578531190.5875866], "v": 0.1}
{"i": ["cuda", "schedule_conv3d_nchw_cuda", [[64, 1, 32, 32, 32], [64, 1, 32, 32, 32], 1, [1, 1, 1], [1, 1, 1], 1], {}, ["schedule_conv3d_nchw_cuda", [64, 1, 32, 32, 32], [64, 1, 32, 32, 32], 1, [1, 1, 1], [1, 1, 1], 1], {"i": 932769611, "t": "", "c": null, "e": [["tile_n", "sp", [-1, 16, 2, 1]], ["tile_f", "sp", [-1, 4, 8, 1]], ["tile_d", "sp", [-1, 1, 1, 3]], ["tile_y", "sp", [-1, 1, 1, 1]], ["tile_x", "sp", [-1, 1, 3, 1]], ["tile_rc", "sp", [-1, 1]], ["tile_rd", "sp", [-1, 2]], ["tile_ry", "sp", [-1, 4]], ["tile_rx", "sp", [-1, 8]], ["auto_unroll_max_step", "ot", 0], ["unroll_explicit", "ot", 1], ["fuse_yx", "ot", 1]]}], "r": [[0.10411864225, 0.10412296275], 0, 2.2561445236206055, 1578531212.7762794], "v": 0.1}
{"i": ["cuda", "schedule_conv3d_nchw_cuda", [[64, 1, 32, 32, 32], [64, 1, 32, 32, 32], 1, [1, 1, 1], [1, 1, 1], 1], {}, ["schedule_conv3d_nchw_cuda", [64, 1, 32, 32, 32], [64, 1, 32, 32, 32], 1, [1, 1, 1], [1, 1, 1], 1], {"i": 1086743196, "t": "", "c": null, "e": [["tile_n", "sp", [-1, 1, 1, 1]], ["tile_f", "sp", [-1, 2, 1, 16]], ["tile_d", "sp", [-1, 1, 1, 1]], ["tile_y", "sp", [-1, 1, 1, 1]], ["tile_x", "sp", [-1, 1, 3, 1]], ["tile_rc", "sp", [-1, 1]], ["tile_rd", "sp", [-1, 1]], ["tile_ry", "sp", [-1, 32]], ["tile_rx", "sp", [-1, 1]], ["auto_unroll_max_step", "ot", 1500], ["unroll_explicit", "ot", 1], ["fuse_yx", "ot", 1]]}], "r": [[0.13230188525, 0.13195673275], 0, 5.407880544662476, 1578531215.5355022], "v": 0.1}
{"i": ["cuda", "schedule_conv3d_nchw_cuda", [[64, 1, 32, 32, 32], [64, 1, 32, 32, 32], 1, [1, 1, 1], [1, 1, 1], 1], {}, ["schedule_conv3d_nchw_cuda", [64, 1, 32, 32, 32], [64, 1, 32, 32, 32], 1, [1, 1, 1], [1, 1, 1], 1], {"i": 49655962, "t": "", "c": null, "e": [["tile_n", "sp", [-1, 1, 2, 2]], ["tile_f", "sp", [-1, 1, 2, 2]], ["tile_d", "sp", [-1, 3, 1, 1]], ["tile_y", "sp", [-1, 1, 1, 3]], ["tile_x", "sp", [-1, 1, 1, 3]], ["tile_rc", "sp", [-1, 1]], ["tile_rd", "sp", [-1, 2]], ["tile_ry", "sp", [-1, 1]], ["tile_rx", "sp", [-1, 8]], ["auto_unroll_max_step", "ot", 0], ["unroll_explicit", "ot", 0], ["fuse_yx", "ot", 0]]}], "r": [[0.0790354035, 0.07895028975], 0, 1.8737068176269531, 1578531216.956124], "v": 0.1}
{"i": ["cuda", "schedule_conv3d_nchw_cuda", [[64, 1, 32, 32, 32], [64, 1, 32, 32, 32], 1, [1, 1, 1], [1, 1, 1], 1], {}, ["schedule_conv3d_nchw_cuda", [64, 1, 32, 32, 32], [64, 1, 32, 32, 32], 1, [1, 1, 1], [1, 1, 1], 1], {"i": 488227330, "t": "", "c": null, "e": [["tile_n", "sp", [-1, 8, 2, 1]], ["tile_f", "sp", [-1, 1, 8, 1]], ["tile_d", "sp", [-1, 3, 1, 1]], ["tile_y", "sp", [-1, 1, 3, 1]], ["tile_x", "sp", [-1, 1, 1, 1]], ["tile_rc", "sp", [-1, 1]], ["tile_rd", "sp", [-1, 2]], ["tile_ry", "sp", [-1, 1]], ["tile_rx", "sp", [-1, 1]], ["auto_unroll_max_step", "ot", 1500], ["unroll_explicit", "ot", 1], ["fuse_yx", "ot", 0]]}], "r": [[0.0117385405, 0.0117338315], 0, 1.1427550315856934, 1578531217.8033202], "v": 0.1}
{"i": ["cuda", "schedule_conv3d_nchw_cuda", [[64, 1, 32, 32, 32], [64, 1, 32, 32, 32], 1, [1, 1, 1], [1, 1, 1], 1], {}, ["schedule_conv3d_nchw_cuda", [64, 1, 32, 32, 32], [64, 1, 32, 32, 32], 1, [1, 1, 1], [1, 1, 1], 1], {"i": 913634528, "t": "", "c": null, "e": [["tile_n", "sp", [-1, 2, 8, 2]], ["tile_f", "sp", [-1, 2, 1, 2]], ["tile_d", "sp", [-1, 1, 1, 3]], ["tile_y", "sp", [-1, 1, 3, 1]], ["tile_x", "sp", [-1, 1, 1, 1]], ["tile_rc", "sp", [-1, 1]], ["tile_rd", "sp", [-1, 2]], ["tile_ry", "sp", [-1, 2]], ["tile_rx", "sp", [-1, 4]], ["auto_unroll_max_step", "ot", 0], ["unroll_explicit", "ot", 1], ["fuse_yx", "ot", 1]]}], "r": [[0.01238249225, 0.01237989225], 0, 1.0929920673370361, 1578531218.542961], "v": 0.1}
{"i": ["cuda", "schedule_conv3d_nchw_cuda", [[64, 1, 32, 32, 32], [64, 1, 32, 32, 32], 1, [1, 1, 1], [1, 1, 1], 1], {}, ["schedule_conv3d_nchw_cuda", [64, 1, 32, 32, 32], [64, 1, 32, 32, 32], 1, [1, 1, 1], [1, 1, 1], 1], {"i": 625281728, "t": "", "c": null, "e": [["tile_n", "sp", [-1, 2, 2, 1]], ["tile_f", "sp", [-1, 4, 1, 1]], ["tile_d", "sp", [-1, 3, 1, 1]], ["tile_y", "sp", [-1, 1, 3, 1]], ["tile_x", "sp", [-1, 1, 3, 1]], ["tile_rc", "sp", [-1, 1]], ["tile_rd", "sp", [-1, 16]], ["tile_ry", "sp", [-1, 4]], ["tile_rx", "sp", [-1, 4]], ["auto_unroll_max_step", "ot", 0], ["unroll_explicit", "ot", 0], ["fuse_yx", "ot", 1]]}], "r": [[0.01248107775, 0.01242796325], 0, 1.1513755321502686, 1578531224.8663766], "v": 0.1}
{"i": ["cuda", "schedule_conv3d_nchw_cuda", [[64, 1, 32, 32, 32], [64, 1, 32, 32, 32], 1, [1, 1, 1], [1, 1, 1], 1], {}, ["schedule_conv3d_nchw_cuda", [64, 1, 32, 32, 32], [64, 1, 32, 32, 32], 1, [1, 1, 1], [1, 1, 1], 1], {"i": 961721544, "t": "", "c": null, "e": [["tile_n", "sp", [-1, 1, 1, 1]], ["tile_f", "sp", [-1, 1, 2, 2]], ["tile_d", "sp", [-1, 1, 3, 1]], ["tile_y", "sp", [-1, 1, 3, 1]], ["tile_x", "sp", [-1, 1, 3, 1]], ["tile_rc", "sp", [-1, 1]], ["tile_rd", "sp", [-1, 32]], ["tile_ry", "sp", [-1, 1]], ["tile_rx", "sp", [-1, 32]], ["auto_unroll_max_step", "ot", 0], ["unroll_explicit", "ot", 1], ["fuse_yx", "ot", 1]]}], "r": [[0.01794998825, 0.01795166775], 0, 1.2227530479431152, 1578531231.0453343], "v": 0.1}
{"i": ["cuda", "schedule_conv3d_nchw_cuda", [[64, 1, 32, 32, 32], [64, 1, 32, 32, 32], 1, [1, 1, 1], [1, 1, 1], 1], {}, ["schedule_conv3d_nchw_cuda", [64, 1, 32, 32, 32], [64, 1, 32, 32, 32], 1, [1, 1, 1], [1, 1, 1], 1], {"i": 1000492534, "t": "", "c": null, "e": [["tile_n", "sp", [-1, 1, 2, 2]], ["tile_f", "sp", [-1, 1, 4, 1]], ["tile_d", "sp", [-1, 3, 1, 1]], ["tile_y", "sp", [-1, 1, 1, 1]], ["tile_x", "sp", [-1, 1, 3, 1]], ["tile_rc", "sp", [-1, 1]], ["tile_rd", "sp", [-1, 2]], ["tile_ry", "sp", [-1, 8]], ["tile_rx", "sp", [-1, 2]], ["auto_unroll_max_step", "ot", 512], ["unroll_explicit", "ot", 1], ["fuse_yx", "ot", 1]]}], "r": [[0.0134776645, 0.01348028525], 0, 1.5139625072479248, 1578531231.9054055], "v": 0.1}
{"i": ["cuda", "schedule_conv3d_nchw_cuda", [[64, 1, 32, 32, 32], [64, 1, 32, 32, 32], 1, [1, 1, 1], [1, 1, 1], 1], {}, ["schedule_conv3d_nchw_cuda", [64, 1, 32, 32, 32], [64, 1, 32, 32, 32], 1, [1, 1, 1], [1, 1, 1], 1], {"i": 1074561249, "t": "", "c": null, "e": [["tile_n", "sp", [-1, 2, 2, 8]], ["tile_f", "sp", [-1, 2, 2, 2]], ["tile_d", "sp", [-1, 1, 3, 1]], ["tile_y", "sp", [-1, 1, 1, 1]], ["tile_x", "sp", [-1, 1, 3, 1]], ["tile_rc", "sp", [-1, 1]], ["tile_rd", "sp", [-1, 8]], ["tile_ry", "sp", [-1, 1]], ["tile_rx", "sp", [-1, 1]], ["auto_unroll_max_step", "ot", 1500], ["unroll_explicit", "ot", 1], ["fuse_yx", "ot", 1]]}], "r": [[0.025509422, 0.025508061], 0, 1.9469611644744873, 1578531233.057842], "v": 0.1}
{"i": ["cuda", "schedule_conv3d_nchw_cuda", [[64, 1, 32, 32, 32], [64, 1, 32, 32, 32], 1, [1, 1, 1], [1, 1, 1], 1], {}, ["schedule_conv3d_nchw_cuda", [64, 1, 32, 32, 32], [64, 1, 32, 32, 32], 1, [1, 1, 1], [1, 1, 1], 1], {"i": 900736152, "t": "", "c": null, "e": [["tile_n", "sp", [-1, 4, 2, 2]], ["tile_f", "sp", [-1, 2, 1, 2]], ["tile_d", "sp", [-1, 1, 1, 3]], ["tile_y", "sp", [-1, 3, 1, 1]], ["tile_x", "sp", [-1, 1, 3, 1]], ["tile_rc", "sp", [-1, 1]], ["tile_rd", "sp", [-1, 4]], ["tile_ry", "sp", [-1, 4]], ["tile_rx", "sp", [-1, 2]], ["auto_unroll_max_step", "ot", 0], ["unroll_explicit", "ot", 1], ["fuse_yx", "ot", 1]]}], "r": [[0.12403391175, 0.12464752425], 0, 2.7649314403533936, 1578531249.926662], "v": 0.1}
{"i": ["cuda", "schedule_conv3d_nchw_cuda", [[64, 1, 32, 32, 32], [64, 1, 32, 32, 32], 1, [1, 1, 1], [1, 1, 1], 1], {}, ["schedule_conv3d_nchw_cuda", [64, 1, 32, 32, 32], [64, 1, 32, 32, 32], 1, [1, 1, 1], [1, 1, 1], 1], {"i": 336677722, "t": "", "c": null, "e": [["tile_n", "sp", [-1, 8, 2, 1]], ["tile_f", "sp", [-1, 2, 2, 1]], ["tile_d", "sp", [-1, 1, 1, 3]], ["tile_y", "sp", [-1, 1, 1, 1]], ["tile_x", "sp", [-1, 1, 3, 1]], ["tile_rc", "sp", [-1, 1]], ["tile_rd", "sp", [-1, 2]], ["tile_ry", "sp", [-1, 16]], ["tile_rx", "sp", [-1, 4]], ["auto_unroll_max_step", "ot", 0], ["unroll_explicit", "ot", 1], ["fuse_yx", "ot", 0]]}], "r": [[0.082450453, 0.08238989025], 0, 2.0369904041290283, 1578531253.1392393], "v": 0.1}
{"i": ["cuda", "schedule_conv3d_nchw_cuda", [[64, 1, 32, 32, 32], [64, 1, 32, 32, 32], 1, [1, 1, 1], [1, 1, 1], 1], {}, ["schedule_conv3d_nchw_cuda", [64, 1, 32, 32, 32], [64, 1, 32, 32, 32], 1, [1, 1, 1], [1, 1, 1], 1], {"i": 228961668, "t": "", "c": null, "e": [["tile_n", "sp", [-1, 32, 2, 1]], ["tile_f", "sp", [-1, 1, 8, 1]], ["tile_d", "sp", [-1, 3, 1, 1]], ["tile_y", "sp", [-1, 1, 1, 1]], ["tile_x", "sp", [-1, 1, 1, 1]], ["tile_rc", "sp", [-1, 1]], ["tile_rd", "sp", [-1, 8]], ["tile_ry", "sp", [-1, 1]], ["tile_rx", "sp", [-1, 4]], ["auto_unroll_max_step", "ot", 1500], ["unroll_explicit", "ot", 0], ["fuse_yx", "ot", 0]]}], "r": [[0.0453747235, 0.0453502645], 0, 3.7983715534210205, 1578531258.1212165], "v": 0.1}
{"i": ["cuda", "schedule_conv3d_nchw_cuda", [[64, 1, 32, 32, 32], [64, 1, 32, 32, 32], 1, [1, 1, 1], [1, 1, 1], 1], {}, ["schedule_conv3d_nchw_cuda", [64, 1, 32, 32, 32], [64, 1, 32, 32, 32], 1, [1, 1, 1], [1, 1, 1], 1], {"i": 120124959, "t": "", "c": null, "e": [["tile_n", "sp", [-1, 8, 1, 1]], ["tile_f", "sp", [-1, 1, 8, 2]], ["tile_d", "sp", [-1, 1, 1, 1]], ["tile_y", "sp", [-1, 1, 1, 1]], ["tile_x", "sp", [-1, 1, 1, 1]], ["tile_rc", "sp", [-1, 1]], ["tile_rd", "sp", [-1, 4]], ["tile_ry", "sp", [-1, 4]], ["tile_rx", "sp", [-1, 2]], ["auto_unroll_max_step", "ot", 512], ["unroll_explicit", "ot", 0], ["fuse_yx", "ot", 0]]}], "r": [[0.011030569, 0.0109619015], 0, 1.3276796340942383, 1578531258.9730694], "v": 0.1}
{"i": ["cuda", "schedule_conv3d_nchw_cuda", [[64, 1, 32, 32, 32], [64, 1, 32, 32, 32], 1, [1, 1, 1], [1, 1, 1], 1], {}, ["schedule_conv3d_nchw_cuda", [64, 1, 32, 32, 32], [64, 1, 32, 32, 32], 1, [1, 1, 1], [1, 1, 1], 1], {"i": 684263704, "t": "", "c": null, "e": [["tile_n", "sp", [-1, 2, 4, 2]], ["tile_f", "sp", [-1, 32, 2, 1]], ["tile_d", "sp", [-1, 1, 1, 1]], ["tile_y", "sp", [-1, 1, 1, 1]], ["tile_x", "sp", [-1, 3, 1, 1]], ["tile_rc", "sp", [-1, 1]], ["tile_rd", "sp", [-1, 8]], ["tile_ry", "sp", [-1, 1]], ["tile_rx", "sp", [-1, 1]], ["auto_unroll_max_step", "ot", 512], ["unroll_explicit", "ot", 0], ["fuse_yx", "ot", 1]]}], "r": [[0.1804710785, 0.180975095], 0, 3.828237533569336, 1578531262.018386], "v": 0.1}
{"i": ["cuda", "schedule_conv3d_nchw_cuda", [[64, 1, 32, 32, 32], [64, 1, 32, 32, 32], 1, [1, 1, 1], [1, 1, 1], 1], {}, ["schedule_conv3d_nchw_cuda", [64, 1, 32, 32, 32], [64, 1, 32, 32, 32], 1, [1, 1, 1], [1, 1, 1], 1], {"i": 878232692, "t": "", "c": null, "e": [["tile_n", "sp", [-1, 2, 2, 1]], ["tile_f", "sp", [-1, 1, 2, 1]], ["tile_d", "sp", [-1, 1, 3, 1]], ["tile_y", "sp", [-1, 1, 1, 1]], ["tile_x", "sp", [-1, 1, 1, 3]], ["tile_rc", "sp", [-1, 1]], ["tile_rd", "sp", [-1, 1]], ["tile_ry", "sp", [-1, 1]], ["tile_rx", "sp", [-1, 1]], ["auto_unroll_max_step", "ot", 0], ["unroll_explicit", "ot", 1], ["fuse_yx", "ot", 1]]}], "r": [[0.03251119675, 0.03210548625], 0, 1.1798160076141357, 1578531263.315359], "v": 0.1}
{"i": ["cuda", "schedule_conv3d_nchw_cuda", [[64, 1, 32, 32, 32], [64, 1, 32, 32, 32], 1, [1, 1, 1], [1, 1, 1], 1], {}, ["schedule_conv3d_nchw_cuda", [64, 1, 32, 32, 32], [64, 1, 32, 32, 32], 1, [1, 1, 1], [1, 1, 1], 1], {"i": 1124445350, "t": "", "c": null, "e": [["tile_n", "sp", [-1, 2, 4, 1]], ["tile_f", "sp", [-1, 2, 4, 1]], ["tile_d", "sp", [-1, 1, 1, 1]], ["tile_y", "sp", [-1, 1, 1, 1]], ["tile_x", "sp", [-1, 1, 1, 1]], ["tile_rc", "sp", [-1, 1]], ["tile_rd", "sp", [-1, 1]], ["tile_ry", "sp", [-1, 2]], ["tile_rx", "sp", [-1, 8]], ["auto_unroll_max_step", "ot", 1500], ["unroll_explicit", "ot", 1], ["fuse_yx", "ot", 1]]}], "r": [[0.0157107775, 0.015696995], 0, 3.5473880767822266, 1578531513.9469113], "v": 0.1}
{"i": ["cuda", "schedule_conv3d_nchw_cuda", [[64, 1, 32, 32, 32], [64, 1, 32, 32, 32], 1, [1, 1, 1], [1, 1, 1], 1], {}, ["schedule_conv3d_nchw_cuda", [64, 1, 32, 32, 32], [64, 1, 32, 32, 32], 1, [1, 1, 1], [1, 1, 1], 1], {"i": 1092834470, "t": "", "c": null, "e": [["tile_n", "sp", [-1, 2, 4, 1]], ["tile_f", "sp", [-1, 2, 4, 1]], ["tile_d", "sp", [-1, 1, 1, 1]], ["tile_y", "sp", [-1, 1, 1, 1]], ["tile_x", "sp", [-1, 1, 1, 1]], ["tile_rc", "sp", [-1, 1]], ["tile_rd", "sp", [-1, 4]], ["tile_ry", "sp", [-1, 2]], ["tile_rx", "sp", [-1, 2]], ["auto_unroll_max_step", "ot", 1500], ["unroll_explicit", "ot", 1], ["fuse_yx", "ot", 1]]}], "r": [[0.01368513675, 0.0136364635], 0, 3.5152218341827393, 1578531514.9825542], "v": 0.1}
{"i": ["cuda", "schedule_conv3d_nchw_cuda", [[64, 1, 32, 32, 32], [64, 1, 32, 32, 32], 1, [1, 1, 1], [1, 1, 1], 1], {}, ["schedule_conv3d_nchw_cuda", [64, 1, 32, 32, 32], [64, 1, 32, 32, 32], 1, [1, 1, 1], [1, 1, 1], 1], {"i": 929361062, "t": "", "c": null, "e": [["tile_n", "sp", [-1, 2, 4, 1]], ["tile_f", "sp", [-1, 2, 4, 1]], ["tile_d", "sp", [-1, 1, 1, 1]], ["tile_y", "sp", [-1, 1, 1, 1]], ["tile_x", "sp", [-1, 1, 1, 1]], ["tile_rc", "sp", [-1, 1]], ["tile_rd", "sp", [-1, 1]], ["tile_ry", "sp", [-1, 2]], ["tile_rx", "sp", [-1, 8]], ["auto_unroll_max_step", "ot", 0], ["unroll_explicit", "ot", 1], ["fuse_yx", "ot", 1]]}], "r": [[0.012642117, 0.0126590875], 0, 1.2768676280975342, 1578531515.775837], "v": 0.1}
{"i": ["cuda", "schedule_conv3d_nchw_cuda", [[64, 1, 32, 32, 32], [64, 1, 32, 32, 32], 1, [1, 1, 1], [1, 1, 1], 1], {}, ["schedule_conv3d_nchw_cuda", [64, 1, 32, 32, 32], [64, 1, 32, 32, 32], 1, [1, 1, 1], [1, 1, 1], 1], {"i": 636734630, "t": "", "c": null, "e": [["tile_n", "sp", [-1, 2, 4, 1]], ["tile_f", "sp", [-1, 2, 4, 1]], ["tile_d", "sp", [-1, 1, 1, 1]], ["tile_y", "sp", [-1, 1, 1, 1]], ["tile_x", "sp", [-1, 1, 1, 1]], ["tile_rc", "sp", [-1, 1]], ["tile_rd", "sp", [-1, 1]], ["tile_ry", "sp", [-1, 2]], ["tile_rx", "sp", [-1, 8]], ["auto_unroll_max_step", "ot", 0], ["unroll_explicit", "ot", 0], ["fuse_yx", "ot", 1]]}], "r": [[0.01201678225, 0.0120809755], 0, 1.1477925777435303, 1578531516.4319737], "v": 0.1}
{"i": ["cuda", "schedule_conv3d_nchw_cuda", [[64, 1, 32, 32, 32], [64, 1, 32, 32, 32], 1, [1, 1, 1], [1, 1, 1], 1], {}, ["schedule_conv3d_nchw_cuda", [64, 1, 32, 32, 32], [64, 1, 32, 32, 32], 1, [1, 1, 1], [1, 1, 1], 1], {"i": 831818918, "t": "", "c": null, "e": [["tile_n", "sp", [-1, 2, 4, 1]], ["tile_f", "sp", [-1, 2, 4, 1]], ["tile_d", "sp", [-1, 1, 1, 1]], ["tile_y", "sp", [-1, 1, 1, 1]], ["tile_x", "sp", [-1, 1, 1, 1]], ["tile_rc", "sp", [-1, 1]], ["tile_rd", "sp", [-1, 1]], ["tile_ry", "sp", [-1, 2]], ["tile_rx", "sp", [-1, 8]], ["auto_unroll_max_step", "ot", 1500], ["unroll_explicit", "ot", 0], ["fuse_yx", "ot", 1]]}], "r": [[0.0119719355, 0.01200868475], 0, 2.1532015800476074, 1578531517.4140277], "v": 0.1}
{"i": ["cuda", "schedule_conv3d_nchw_cuda", [[64, 1, 32, 32, 32], [64, 1, 32, 32, 32], 1, [1, 1, 1], [1, 1, 1], 1], {}, ["schedule_conv3d_nchw_cuda", [64, 1, 32, 32, 32], [64, 1, 32, 32, 32], 1, [1, 1, 1], [1, 1, 1], 1], {"i": 734276774, "t": "", "c": null, "e": [["tile_n", "sp", [-1, 2, 4, 1]], ["tile_f", "sp", [-1, 2, 4, 1]], ["tile_d", "sp", [-1, 1, 1, 1]], ["tile_y", "sp", [-1, 1, 1, 1]], ["tile_x", "sp", [-1, 1, 1, 1]], ["tile_rc", "sp", [-1, 1]], ["tile_rd", "sp", [-1, 1]], ["tile_ry", "sp", [-1, 2]], ["tile_rx", "sp", [-1, 8]], ["auto_unroll_max_step", "ot", 512], ["unroll_explicit", "ot", 0], ["fuse_yx", "ot", 1]]}], "r": [[0.01205435625, 0.0120527045], 0, 1.3751204013824463, 1578531518.2001634], "v": 0.1}
{"i": ["cuda", "schedule_conv3d_nchw_cuda", [[64, 1, 32, 32, 32], [64, 1, 32, 32, 32], 1, [1, 1, 1], [1, 1, 1], 1], {}, ["schedule_conv3d_nchw_cuda", [64, 1, 32, 32, 32], [64, 1, 32, 32, 32], 1, [1, 1, 1], [1, 1, 1], 1], {"i": 981744806, "t": "", "c": null, "e": [["tile_n", "sp", [-1, 2, 4, 1]], ["tile_f", "sp", [-1, 2, 4, 1]], ["tile_d", "sp", [-1, 1, 1, 1]], ["tile_y", "sp", [-1, 1, 1, 1]], ["tile_x", "sp", [-1, 1, 1, 1]], ["tile_rc", "sp", [-1, 1]], ["tile_rd", "sp", [-1, 4]], ["tile_ry", "sp", [-1, 4]], ["tile_rx", "sp", [-1, 1]], ["auto_unroll_max_step", "ot", 512], ["unroll_explicit", "ot", 1], ["fuse_yx", "ot", 1]]}], "r": [[0.008008375, 0.008007569], 0, 1.3482680320739746, 1578531518.9169214], "v": 0.1}
{"i": ["cuda", "schedule_conv3d_nchw_cuda", [[64, 1, 32, 32, 32], [64, 1, 32, 32, 32], 1, [1, 1, 1], [1, 1, 1], 1], {}, ["schedule_conv3d_nchw_cuda", [64, 1, 32, 32, 32], [64, 1, 32, 32, 32], 1, [1, 1, 1], [1, 1, 1], 1], {"i": 1026903206, "t": "", "c": null, "e": [["tile_n", "sp", [-1, 2, 4, 1]], ["tile_f", "sp", [-1, 2, 4, 1]], ["tile_d", "sp", [-1, 1, 1, 1]], ["tile_y", "sp", [-1, 1, 1, 1]], ["tile_x", "sp", [-1, 1, 1, 1]], ["tile_rc", "sp", [-1, 1]], ["tile_rd", "sp", [-1, 1]], ["tile_ry", "sp", [-1, 2]], ["tile_rx", "sp", [-1, 8]], ["auto_unroll_max_step", "ot", 512], ["unroll_explicit", "ot", 1], ["fuse_yx", "ot", 1]]}], "r": [[0.01228696475, 0.01230598975], 0, 1.4563090801239014, 1578531519.7277615], "v": 0.1}
{"i": ["cuda", "schedule_conv3d_nchw_cuda", [[64, 1, 32, 32, 32], [64, 1, 32, 32, 32], 1, [1, 1, 1], [1, 1, 1], 1], {}, ["schedule_conv3d_nchw_cuda", [64, 1, 32, 32, 32], [64, 1, 32, 32, 32], 1, [1, 1, 1], [1, 1, 1], 1], {"i": 884202662, "t": "", "c": null, "e": [["tile_n", "sp", [-1, 2, 4, 1]], ["tile_f", "sp", [-1, 2, 4, 1]], ["tile_d", "sp", [-1, 1, 1, 1]], ["tile_y", "sp", [-1, 1, 1, 1]], ["tile_x", "sp", [-1, 1, 1, 1]], ["tile_rc", "sp", [-1, 1]], ["tile_rd", "sp", [-1, 4]], ["tile_ry", "sp", [-1, 4]], ["tile_rx", "sp", [-1, 1]], ["auto_unroll_max_step", "ot", 0], ["unroll_explicit", "ot", 1], ["fuse_yx", "ot", 1]]}], "r": [[0.0068787015, 0.00687043875], 0, 1.2694995403289795, 1578531520.4267852], "v": 0.1}
{"i": ["cuda", "schedule_conv3d_nchw_cuda", [[64, 1, 32, 32, 32], [64, 1, 32, 32, 32], 1, [1, 1, 1], [1, 1, 1], 1], {}, ["schedule_conv3d_nchw_cuda", [64, 1, 32, 32, 32], [64, 1, 32, 32, 32], 1, [1, 1, 1], [1, 1, 1], 1], {"i": 813755889, "t": "", "c": null, "e": [["tile_n", "sp", [-1, 4, 2, 1]], ["tile_f", "sp", [-1, 1, 8, 1]], ["tile_d", "sp", [-1, 1, 1, 1]], ["tile_y", "sp", [-1, 1, 1, 1]], ["tile_x", "sp", [-1, 1, 1, 1]], ["tile_rc", "sp", [-1, 1]], ["tile_rd", "sp", [-1, 4]], ["tile_ry", "sp", [-1, 1]], ["tile_rx", "sp", [-1, 4]], ["auto_unroll_max_step", "ot", 1500], ["unroll_explicit", "ot", 0], ["fuse_yx", "ot", 1]]}], "r": [[0.0248337465, 0.025126177], 0, 1.5188579559326172, 1578531521.3977325], "v": 0.1}
{"i": ["cuda", "schedule_conv3d_nchw_cuda", [[64, 1, 32, 32, 32], [64, 1, 32, 32, 32], 1, [1, 1, 1], [1, 1, 1], 1], {}, ["schedule_conv3d_nchw_cuda", [64, 1, 32, 32, 32], [64, 1, 32, 32, 32], 1, [1, 1, 1], [1, 1, 1], 1], {"i": 784402929, "t": "", "c": null, "e": [["tile_n", "sp", [-1, 4, 2, 1]], ["tile_f", "sp", [-1, 1, 8, 1]], ["tile_d", "sp", [-1, 1, 1, 1]], ["tile_y", "sp", [-1, 1, 1, 1]], ["tile_x", "sp", [-1, 1, 1, 1]], ["tile_rc", "sp", [-1, 1]], ["tile_rd", "sp", [-1, 8]], ["tile_ry", "sp", [-1, 2]], ["tile_rx", "sp", [-1, 1]], ["auto_unroll_max_step", "ot", 1500], ["unroll_explicit", "ot", 0], ["fuse_yx", "ot", 1]]}], "r": [[0.012610147, 0.012885524], 0, 2.12052583694458, 1578531522.4074643], "v": 0.1}
{"i": ["cuda", "schedule_conv3d_nchw_cuda", [[64, 1, 32, 32, 32], [64, 1, 32, 32, 32], 1, [1, 1, 1], [1, 1, 1], 1], {}, ["schedule_conv3d_nchw_cuda", [64, 1, 32, 32, 32], [64, 1, 32, 32, 32], 1, [1, 1, 1], [1, 1, 1], 1], {"i": 977229297, "t": "", "c": null, "e": [["tile_n", "sp", [-1, 4, 2, 1]], ["tile_f", "sp", [-1, 1, 8, 1]], ["tile_d", "sp", [-1, 1, 1, 1]], ["tile_y", "sp", [-1, 1, 1, 1]], ["tile_x", "sp", [-1, 1, 1, 1]], ["tile_rc", "sp", [-1, 1]], ["tile_rd", "sp", [-1, 16]], ["tile_ry", "sp", [-1, 1]], ["tile_rx", "sp", [-1, 1]], ["auto_unroll_max_step", "ot", 512], ["unroll_explicit", "ot", 1], ["fuse_yx", "ot", 1]]}], "r": [[0.02901424, 0.02831063], 0, 1.404520034790039, 1578531523.264533], "v": 0.1}
{"i": ["cuda", "schedule_conv3d_nchw_cuda", [[64, 1, 32, 32, 32], [64, 1, 32, 32, 32], 1, [1, 1, 1], [1, 1, 1], 1], {}, ["schedule_conv3d_nchw_cuda", [64, 1, 32, 32, 32], [64, 1, 32, 32, 32], 1, [1, 1, 1], [1, 1, 1], 1], {"i": 587060721, "t": "", "c": null, "e": [["tile_n", "sp", [-1, 4, 2, 1]], ["tile_f", "sp", [-1, 1, 8, 1]], ["tile_d", "sp", [-1, 1, 1, 1]], ["tile_y", "sp", [-1, 1, 1, 1]], ["tile_x", "sp", [-1, 1, 1, 1]], ["tile_rc", "sp", [-1, 1]], ["tile_rd", "sp", [-1, 16]], ["tile_ry", "sp", [-1, 1]], ["tile_rx", "sp", [-1, 1]], ["auto_unroll_max_step", "ot", 0], ["unroll_explicit", "ot", 0], ["fuse_yx", "ot", 1]]}], "r": [[0.03322579175, 0.03010752525], 0, 1.3692617416381836, 1578531526.6713593], "v": 0.1}
{"i": ["cuda", "schedule_conv3d_nchw_cuda", [[64, 1, 32, 32, 32], [64, 1, 32, 32, 32], 1, [1, 1, 1], [1, 1, 1], 1], {}, ["schedule_conv3d_nchw_cuda", [64, 1, 32, 32, 32], [64, 1, 32, 32, 32], 1, [1, 1, 1], [1, 1, 1], 1], {"i": 6775611, "t": "", "c": null, "e": [["tile_n", "sp", [-1, 8, 1, 1]], ["tile_f", "sp", [-1, 1, 16, 1]], ["tile_d", "sp", [-1, 1, 1, 1]], ["tile_y", "sp", [-1, 1, 1, 1]], ["tile_x", "sp", [-1, 1, 1, 1]], ["tile_rc", "sp", [-1, 1]], ["tile_rd", "sp", [-1, 8]], ["tile_ry", "sp", [-1, 4]], ["tile_rx", "sp", [-1, 1]], ["auto_unroll_max_step", "ot", 0], ["unroll_explicit", "ot", 0], ["fuse_yx", "ot", 0]]}], "r": [[0.008536736, 0.0085633455], 0, 1.1478877067565918, 1578531527.3675528], "v": 0.1}
{"i": ["cuda", "schedule_conv3d_nchw_cuda", [[64, 1, 32, 32, 32], [64, 1, 32, 32, 32], 1, [1, 1, 1], [1, 1, 1], 1], {}, ["schedule_conv3d_nchw_cuda", [64, 1, 32, 32, 32], [64, 1, 32, 32, 32], 1, [1, 1, 1], [1, 1, 1], 1], {"i": 982196721, "t": "", "c": null, "e": [["tile_n", "sp", [-1, 4, 2, 1]], ["tile_f", "sp", [-1, 1, 8, 1]], ["tile_d", "sp", [-1, 1, 1, 1]], ["tile_y", "sp", [-1, 1, 1, 1]], ["tile_x", "sp", [-1, 1, 1, 1]], ["tile_rc", "sp", [-1, 1]], ["tile_rd", "sp", [-1, 8]], ["tile_ry", "sp", [-1, 4]], ["tile_rx", "sp", [-1, 1]], ["auto_unroll_max_step", "ot", 512], ["unroll_explicit", "ot", 1], ["fuse_yx", "ot", 1]]}], "r": [[0.011387969, 0.0113728115], 0, 1.6216254234313965, 1578531528.2275727], "v": 0.1}
{"i": ["cuda", "schedule_conv3d_nchw_cuda", [[64, 1, 32, 32, 32], [64, 1, 32, 32, 32], 1, [1, 1, 1], [1, 1, 1], 1], {}, ["schedule_conv3d_nchw_cuda", [64, 1, 32, 32, 32], [64, 1, 32, 32, 32], 1, [1, 1, 1], [1, 1, 1], 1], {"i": 784854513, "t": "", "c": null, "e": [["tile_n", "sp", [-1, 4, 2, 1]], ["tile_f", "sp", [-1, 1, 8, 1]], ["tile_d", "sp", [-1, 1, 1, 1]], ["tile_y", "sp", [-1, 1, 1, 1]], ["tile_x", "sp", [-1, 1, 1, 1]], ["tile_rc", "sp", [-1, 1]], ["tile_rd", "sp", [-1, 16]], ["tile_ry", "sp", [-1, 2]], ["tile_rx", "sp", [-1, 1]], ["auto_unroll_max_step", "ot", 1500], ["unroll_explicit", "ot", 0], ["fuse_yx", "ot", 1]]}], "r": [[0.0132737115, 0.0133601305], 0, 1.322206735610962, 1578531529.0055747], "v": 0.1}
{"i": ["cuda", "schedule_conv3d_nchw_cuda", [[64, 1, 32, 32, 32], [64, 1, 32, 32, 32], 1, [1, 1, 1], [1, 1, 1], 1], {}, ["schedule_conv3d_nchw_cuda", [64, 1, 32, 32, 32], [64, 1, 32, 32, 32], 1, [1, 1, 1], [1, 1, 1], 1], {"i": 816465393, "t": "", "c": null, "e": [["tile_n", "sp", [-1, 4, 2, 1]], ["tile_f", "sp", [-1, 1, 8, 1]], ["tile_d", "sp", [-1, 1, 1, 1]], ["tile_y", "sp", [-1, 1, 1, 1]], ["tile_x", "sp", [-1, 1, 1, 1]], ["tile_rc", "sp", [-1, 1]], ["tile_rd", "sp", [-1, 4]], ["tile_ry", "sp", [-1, 2]], ["tile_rx", "sp", [-1, 4]], ["auto_unroll_max_step", "ot", 1500], ["unroll_explicit", "ot", 0], ["fuse_yx", "ot", 1]]}], "r": [[0.012183134, 0.0122310965], 0, 1.3838412761688232, 1578531529.8012345], "v": 0.1}
{"i": ["cuda", "schedule_conv3d_nchw_cuda", [[64, 1, 32, 32, 32], [64, 1, 32, 32, 32], 1, [1, 1, 1], [1, 1, 1], 1], {}, ["schedule_conv3d_nchw_cuda", [64, 1, 32, 32, 32], [64, 1, 32, 32, 32], 1, [1, 1, 1], [1, 1, 1], 1], {"i": 686860785, "t": "", "c": null, "e": [["tile_n", "sp", [-1, 4, 2, 1]], ["tile_f", "sp", [-1, 1, 8, 1]], ["tile_d", "sp", [-1, 1, 1, 1]], ["tile_y", "sp", [-1, 1, 1, 1]], ["tile_x", "sp", [-1, 1, 1, 1]], ["tile_rc", "sp", [-1, 1]], ["tile_rd", "sp", [-1, 8]], ["tile_ry", "sp", [-1, 2]], ["tile_rx", "sp", [-1, 1]], ["auto_unroll_max_step", "ot", 512], ["unroll_explicit", "ot", 0], ["fuse_yx", "ot", 1]]}], "r": [[0.0130697805, 0.0131603505], 0, 1.373128890991211, 1578531530.6084602], "v": 0.1}
{"i": ["cuda", "schedule_conv3d_nchw_cuda", [[64, 1, 32, 32, 32], [64, 1, 32, 32, 32], 1, [1, 1, 1], [1, 1, 1], 1], {}, ["schedule_conv3d_nchw_cuda", [64, 1, 32, 32, 32], [64, 1, 32, 32, 32], 1, [1, 1, 1], [1, 1, 1], 1], {"i": 718923249, "t": "", "c": null, "e": [["tile_n", "sp", [-1, 4, 2, 1]], ["tile_f", "sp", [-1, 1, 8, 1]], ["tile_d", "sp", [-1, 1, 1, 1]], ["tile_y", "sp", [-1, 1, 1, 1]], ["tile_x", "sp", [-1, 1, 1, 1]], ["tile_rc", "sp", [-1, 1]], ["tile_rd", "sp", [-1, 4]], ["tile_ry", "sp", [-1, 2]], ["tile_rx", "sp", [-1, 4]], ["auto_unroll_max_step", "ot", 512], ["unroll_explicit", "ot", 0], ["fuse_yx", "ot", 1]]}], "r": [[0.0121754615, 0.01212986975], 0, 1.2580208778381348, 1578531531.3139677], "v": 0.1}
{"i": ["cuda", "schedule_conv3d_nchw_cuda", [[64, 1, 32, 32, 32], [64, 1, 32, 32, 32], 1, [1, 1, 1], [1, 1, 1], 1], {}, ["schedule_conv3d_nchw_cuda", [64, 1, 32, 32, 32], [64, 1, 32, 32, 32], 1, [1, 1, 1], [1, 1, 1], 1], {"i": 1074771441, "t": "", "c": null, "e": [["tile_n", "sp", [-1, 4, 2, 1]], ["tile_f", "sp", [-1, 1, 8, 1]], ["tile_d", "sp", [-1, 1, 1, 1]], ["tile_y", "sp", [-1, 1, 1, 1]], ["tile_x", "sp", [-1, 1, 1, 1]], ["tile_rc", "sp", [-1, 1]], ["tile_rd", "sp", [-1, 16]], ["tile_ry", "sp", [-1, 1]], ["tile_rx", "sp", [-1, 1]], ["auto_unroll_max_step", "ot", 1500], ["unroll_explicit", "ot", 1], ["fuse_yx", "ot", 1]]}], "r": [[0.0279473825, 0.02721591075], 0, 1.4980409145355225, 1578531532.1325786], "v": 0.1}
{"i": ["cuda", "schedule_conv3d_nchw_cuda", [[64, 1, 32, 32, 32], [64, 1, 32, 32, 32], 1, [1, 1, 1], [1, 1, 1], 1], {}, ["schedule_conv3d_nchw_cuda", [64, 1, 32, 32, 32], [64, 1, 32, 32, 32], 1, [1, 1, 1], [1, 1, 1], 1], {"i": 589770225, "t": "", "c": null, "e": [["tile_n", "sp", [-1, 4, 2, 1]], ["tile_f", "sp", [-1, 1, 8, 1]], ["tile_d", "sp", [-1, 1, 1, 1]], ["tile_y", "sp", [-1, 1, 1, 1]], ["tile_x", "sp", [-1, 1, 1, 1]], ["tile_rc", "sp", [-1, 1]], ["tile_rd", "sp", [-1, 16]], ["tile_ry", "sp", [-1, 2]], ["tile_rx", "sp", [-1, 1]], ["auto_unroll_max_step", "ot", 0], ["unroll_explicit", "ot", 0], ["fuse_yx", "ot", 1]]}], "r": [[0.013475995, 0.01346402425], 0, 1.251495599746704, 1578531532.8687212], "v": 0.1}
{"i": ["cuda", "schedule_conv3d_nchw_cuda", [[64, 1, 32, 32, 32], [64, 1, 32, 32, 32], 1, [1, 1, 1], [1, 1, 1], 1], {}, ["schedule_conv3d_nchw_cuda", [64, 1, 32, 32, 32], [64, 1, 32, 32, 32], 1, [1, 1, 1], [1, 1, 1], 1], {"i": 589318641, "t": "", "c": null, "e": [["tile_n", "sp", [-1, 4, 2, 1]], ["tile_f", "sp", [-1, 1, 8, 1]], ["tile_d", "sp", [-1, 1, 1, 1]], ["tile_y", "sp", [-1, 1, 1, 1]], ["tile_x", "sp", [-1, 1, 1, 1]], ["tile_rc", "sp", [-1, 1]], ["tile_rd", "sp", [-1, 8]], ["tile_ry", "sp", [-1, 2]], ["tile_rx", "sp", [-1, 1]], ["auto_unroll_max_step", "ot", 0], ["unroll_explicit", "ot", 0], ["fuse_yx", "ot", 1]]}], "r": [[0.01285271775, 0.01284309175], 0, 1.2771401405334473, 1578531533.6666682], "v": 0.1}
{"i": ["cuda", "schedule_conv3d_nchw_cuda", [[64, 1, 32, 32, 32], [64, 1, 32, 32, 32], 1, [1, 1, 1], [1, 1, 1], 1], {}, ["schedule_conv3d_nchw_cuda", [64, 1, 32, 32, 32], [64, 1, 32, 32, 32], 1, [1, 1, 1], [1, 1, 1], 1], {"i": 591576561, "t": "", "c": null, "e": [["tile_n", "sp", [-1, 4, 2, 1]], ["tile_f", "sp", [-1, 1, 8, 1]], ["tile_d", "sp", [-1, 1, 1, 1]], ["tile_y", "sp", [-1, 1, 1, 1]], ["tile_x", "sp", [-1, 1, 1, 1]], ["tile_rc", "sp", [-1, 1]], ["tile_rd", "sp", [-1, 4]], ["tile_ry", "sp", [-1, 4]], ["tile_rx", "sp", [-1, 1]], ["auto_unroll_max_step", "ot", 0], ["unroll_explicit", "ot", 0], ["fuse_yx", "ot", 1]]}], "r": [[0.00683182725, 0.00682954525], 0, 1.1304972171783447, 1578531534.3592322], "v": 0.1}
{"i": ["cuda", "schedule_conv3d_nchw_cuda", [[64, 1, 32, 32, 32], [64, 1, 32, 32, 32], 1, [1, 1, 1], [1, 1, 1], 1], {}, ["schedule_conv3d_nchw_cuda", [64, 1, 32, 32, 32], [64, 1, 32, 32, 32], 1, [1, 1, 1], [1, 1, 1], 1], {"i": 787112433, "t": "", "c": null, "e": [["tile_n", "sp", [-1, 4, 2, 1]], ["tile_f", "sp", [-1, 1, 8, 1]], ["tile_d", "sp", [-1, 1, 1, 1]], ["tile_y", "sp", [-1, 1, 1, 1]], ["tile_x", "sp", [-1, 1, 1, 1]], ["tile_rc", "sp", [-1, 1]], ["tile_rd", "sp", [-1, 8]], ["tile_ry", "sp", [-1, 4]], ["tile_rx", "sp", [-1, 1]], ["auto_unroll_max_step", "ot", 1500], ["unroll_explicit", "ot", 0], ["fuse_yx", "ot", 1]]}], "r": [[0.01883121075, 0.01865549525], 0, 2.424906015396118, 1578531535.6932204], "v": 0.1}
{"i": ["cuda", "schedule_conv3d_nchw_cuda", [[64, 1, 32, 32, 32], [64, 1, 32, 32, 32], 1, [1, 1, 1], [1, 1, 1], 1], {}, ["schedule_conv3d_nchw_cuda", [64, 1, 32, 32, 32], [64, 1, 32, 32, 32], 1, [1, 1, 1], [1, 1, 1], 1], {"i": 592028145, "t": "", "c": null, "e": [["tile_n", "sp", [-1, 4, 2, 1]], ["tile_f", "sp", [-1, 1, 8, 1]], ["tile_d", "sp", [-1, 1, 1, 1]], ["tile_y", "sp", [-1, 1, 1, 1]], ["tile_x", "sp", [-1, 1, 1, 1]], ["tile_rc", "sp", [-1, 1]], ["tile_rd", "sp", [-1, 8]], ["tile_ry", "sp", [-1, 4]], ["tile_rx", "sp", [-1, 1]], ["auto_unroll_max_step", "ot", 0], ["unroll_explicit", "ot", 0], ["fuse_yx", "ot", 1]]}], "r": [[0.01103528075, 0.01105216575], 0, 1.1935439109802246, 1578531538.2391372], "v": 0.1}
{"i": ["cuda", "schedule_conv3d_nchw_cuda", [[64, 1, 32, 32, 32], [64, 1, 32, 32, 32], 1, [1, 1, 1], [1, 1, 1], 1], {}, ["schedule_conv3d_nchw_cuda", [64, 1, 32, 32, 32], [64, 1, 32, 32, 32], 1, [1, 1, 1], [1, 1, 1], 1], {"i": 979487217, "t": "", "c": null, "e": [["tile_n", "sp", [-1, 4, 2, 1]], ["tile_f", "sp", [-1, 1, 8, 1]], ["tile_d", "sp", [-1, 1, 1, 1]], ["tile_y", "sp", [-1, 1, 1, 1]], ["tile_x", "sp", [-1, 1, 1, 1]], ["tile_rc", "sp", [-1, 1]], ["tile_rd", "sp", [-1, 8]], ["tile_ry", "sp", [-1, 2]], ["tile_rx", "sp", [-1, 1]], ["auto_unroll_max_step", "ot", 512], ["unroll_explicit", "ot", 1], ["fuse_yx", "ot", 1]]}], "r": [[0.0123014705, 0.0123594765], 0, 1.4082136154174805, 1578531539.0421338], "v": 0.1}
{"i": ["cuda", "schedule_conv3d_nchw_cuda", [[64, 1, 32, 32, 32], [64, 1, 32, 32, 32], 1, [1, 1, 1], [1, 1, 1], 1], {}, ["schedule_conv3d_nchw_cuda", [64, 1, 32, 32, 32], [64, 1, 32, 32, 32], 1, [1, 1, 1], [1, 1, 1], 1], {"i": 879687153, "t": "", "c": null, "e": [["tile_n", "sp", [-1, 4, 2, 1]], ["tile_f", "sp", [-1, 1, 8, 1]], ["tile_d", "sp", [-1, 1, 1, 1]], ["tile_y", "sp", [-1, 1, 1, 1]], ["tile_x", "sp", [-1, 1, 1, 1]], ["tile_rc", "sp", [-1, 1]], ["tile_rd", "sp", [-1, 16]], ["tile_ry", "sp", [-1, 1]], ["tile_rx", "sp", [-1, 1]], ["auto_unroll_max_step", "ot", 0], ["unroll_explicit", "ot", 1], ["fuse_yx", "ot", 1]]}], "r": [[0.02717777475, 0.02742622075], 0, 1.362051010131836, 1578531539.8409843], "v": 0.1}
{"i": ["cuda", "schedule_conv3d_nchw_cuda", [[64, 1, 32, 32, 32], [64, 1, 32, 32, 32], 1, [1, 1, 1], [1, 1, 1], 1], {}, ["schedule_conv3d_nchw_cuda", [64, 1, 32, 32, 32], [64, 1, 32, 32, 32], 1, [1, 1, 1], [1, 1, 1], 1], {"i": 884654577, "t": "", "c": null, "e": [["tile_n", "sp", [-1, 4, 2, 1]], ["tile_f", "sp", [-1, 1, 8, 1]], ["tile_d", "sp", [-1, 1, 1, 1]], ["tile_y", "sp", [-1, 1, 1, 1]], ["tile_x", "sp", [-1, 1, 1, 1]], ["tile_rc", "sp", [-1, 1]], ["tile_rd", "sp", [-1, 8]], ["tile_ry", "sp", [-1, 4]], ["tile_rx", "sp", [-1, 1]], ["auto_unroll_max_step", "ot", 0], ["unroll_explicit", "ot", 1], ["fuse_yx", "ot", 1]]}], "r": [[0.010976787, 0.01102482475], 0, 1.18113112449646, 1578531540.5021107], "v": 0.1}
{"i": ["cuda", "schedule_conv3d_nchw_cuda", [[64, 1, 32, 32, 32], [64, 1, 32, 32, 32], 1, [1, 1, 1], [1, 1, 1], 1], {}, ["schedule_conv3d_nchw_cuda", [64, 1, 32, 32, 32], [64, 1, 32, 32, 32], 1, [1, 1, 1], [1, 1, 1], 1], {"i": 881945073, "t": "", "c": null, "e": [["tile_n", "sp", [-1, 4, 2, 1]], ["tile_f", "sp", [-1, 1, 8, 1]], ["tile_d", "sp", [-1, 1, 1, 1]], ["tile_y", "sp", [-1, 1, 1, 1]], ["tile_x", "sp", [-1, 1, 1, 1]], ["tile_rc", "sp", [-1, 1]], ["tile_rd", "sp", [-1, 8]], ["tile_ry", "sp", [-1, 2]], ["tile_rx", "sp", [-1, 1]], ["auto_unroll_max_step", "ot", 0], ["unroll_explicit", "ot", 1], ["fuse_yx", "ot", 1]]}], "r": [[0.0127562055, 0.01300327525], 0, 1.2608985900878906, 1578531541.189526], "v": 0.1}
{"i": ["cuda", "schedule_conv3d_nchw_cuda", [[64, 1, 32, 32, 32], [64, 1, 32, 32, 32], 1, [1, 1, 1], [1, 1, 1], 1], {}, ["schedule_conv3d_nchw_cuda", [64, 1, 32, 32, 32], [64, 1, 32, 32, 32], 1, [1, 1, 1], [1, 1, 1], 1], {"i": 1077480945, "t": "", "c": null, "e": [["tile_n", "sp", [-1, 4, 2, 1]], ["tile_f", "sp", [-1, 1, 8, 1]], ["tile_d", "sp", [-1, 1, 1, 1]], ["tile_y", "sp", [-1, 1, 1, 1]], ["tile_x", "sp", [-1, 1, 1, 1]], ["tile_rc", "sp", [-1, 1]], ["tile_rd", "sp", [-1, 16]], ["tile_ry", "sp", [-1, 2]], ["tile_rx", "sp", [-1, 1]], ["auto_unroll_max_step", "ot", 1500], ["unroll_explicit", "ot", 1], ["fuse_yx", "ot", 1]]}], "r": [[0.0123579385, 0.012393679], 0, 1.3689947128295898, 1578531541.958986], "v": 0.1}
{"i": ["cuda", "schedule_conv3d_nchw_cuda", [[64, 1, 32, 32, 32], [64, 1, 32, 32, 32], 1, [1, 1, 1], [1, 1, 1], 1], {}, ["schedule_conv3d_nchw_cuda", [64, 1, 32, 32, 32], [64, 1, 32, 32, 32], 1, [1, 1, 1], [1, 1, 1], 1], {"i": 782145009, "t": "", "c": null, "e": [["tile_n", "sp", [-1, 4, 2, 1]], ["tile_f", "sp", [-1, 1, 8, 1]], ["tile_d", "sp", [-1, 1, 1, 1]], ["tile_y", "sp", [-1, 1, 1, 1]], ["tile_x", "sp", [-1, 1, 1, 1]], ["tile_rc", "sp", [-1, 1]], ["tile_rd", "sp", [-1, 16]], ["tile_ry", "sp", [-1, 1]], ["tile_rx", "sp", [-1, 1]], ["auto_unroll_max_step", "ot", 1500], ["unroll_explicit", "ot", 0], ["fuse_yx", "ot", 1]]}], "r": [[0.02684802775, 0.02675224475], 0, 1.5084223747253418, 1578531542.995603], "v": 0.1}
{"i": ["cuda", "schedule_conv3d_nchw_cuda", [[64, 1, 32, 32, 32], [64, 1, 32, 32, 32], 1, [1, 1, 1], [1, 1, 1], 1], {}, ["schedule_conv3d_nchw_cuda", [64, 1, 32, 32, 32], [64, 1, 32, 32, 32], 1, [1, 1, 1], [1, 1, 1], 1], {"i": 979938801, "t": "", "c": null, "e": [["tile_n", "sp", [-1, 4, 2, 1]], ["tile_f", "sp", [-1, 1, 8, 1]], ["tile_d", "sp", [-1, 1, 1, 1]], ["tile_y", "sp", [-1, 1, 1, 1]], ["tile_x", "sp", [-1, 1, 1, 1]], ["tile_rc", "sp", [-1, 1]], ["tile_rd", "sp", [-1, 16]], ["tile_ry", "sp", [-1, 2]], ["tile_rx", "sp", [-1, 1]], ["auto_unroll_max_step", "ot", 512], ["unroll_explicit", "ot", 1], ["fuse_yx", "ot", 1]]}], "r": [[0.012361788, 0.012391315], 0, 1.4631178379058838, 1578531543.6829095], "v": 0.1}
{"i": ["cuda", "schedule_conv3d_nchw_cuda", [[64, 1, 32, 32, 32], [64, 1, 32, 32, 32], 1, [1, 1, 1], [1, 1, 1], 1], {}, ["schedule_conv3d_nchw_cuda", [64, 1, 32, 32, 32], [64, 1, 32, 32, 32], 1, [1, 1, 1], [1, 1, 1], 1], {"i": 882396657, "t": "", "c": null, "e": [["tile_n", "sp", [-1, 4, 2, 1]], ["tile_f", "sp", [-1, 1, 8, 1]], ["tile_d", "sp", [-1, 1, 1, 1]], ["tile_y", "sp", [-1, 1, 1, 1]], ["tile_x", "sp", [-1, 1, 1, 1]], ["tile_rc", "sp", [-1, 1]], ["tile_rd", "sp", [-1, 16]], ["tile_ry", "sp", [-1, 2]], ["tile_rx", "sp", [-1, 1]], ["auto_unroll_max_step", "ot", 0], ["unroll_explicit", "ot", 1], ["fuse_yx", "ot", 1]]}], "r": [[0.01361137975, 0.013581564], 0, 1.2551288604736328, 1578531544.3792377], "v": 0.1}
{"i": ["cuda", "schedule_conv3d_nchw_cuda", [[64, 1, 32, 32, 32], [64, 1, 32, 32, 32], 1, [1, 1, 1], [1, 1, 1], 1], {}, ["schedule_conv3d_nchw_cuda", [64, 1, 32, 32, 32], [64, 1, 32, 32, 32], 1, [1, 1, 1], [1, 1, 1], 1], {"i": 587060722, "t": "", "c": null, "e": [["tile_n", "sp", [-1, 8, 2, 1]], ["tile_f", "sp", [-1, 1, 8, 1]], ["tile_d", "sp", [-1, 1, 1, 1]], ["tile_y", "sp", [-1, 1, 1, 1]], ["tile_x", "sp", [-1, 1, 1, 1]], ["tile_rc", "sp", [-1, 1]], ["tile_rd", "sp", [-1, 16]], ["tile_ry", "sp", [-1, 1]], ["tile_rx", "sp", [-1, 1]], ["auto_unroll_max_step", "ot", 0], ["unroll_explicit", "ot", 0], ["fuse_yx", "ot", 1]]}], "r": [[0.01882343575, 0.019167278], 0, 1.2728564739227295, 1578531545.157521], "v": 0.1}
{"i": ["cuda", "schedule_conv3d_nchw_cuda", [[64, 1, 32, 32, 32], [64, 1, 32, 32, 32], 1, [1, 1, 1], [1, 1, 1], 1], {}, ["schedule_conv3d_nchw_cuda", [64, 1, 32, 32, 32], [64, 1, 32, 32, 32], 1, [1, 1, 1], [1, 1, 1], 1], {"i": 592253596, "t": "", "c": null, "e": [["tile_n", "sp", [-1, 16, 1, 1]], ["tile_f", "sp", [-1, 2, 4, 1]], ["tile_d", "sp", [-1, 1, 1, 1]], ["tile_y", "sp", [-1, 1, 1, 1]], ["tile_x", "sp", [-1, 1, 3, 1]], ["tile_rc", "sp", [-1, 1]], ["tile_rd", "sp", [-1, 8]], ["tile_ry", "sp", [-1, 4]], ["tile_rx", "sp", [-1, 1]], ["auto_unroll_max_step", "ot", 0], ["unroll_explicit", "ot", 0], ["fuse_yx", "ot", 1]]}], "r": [[0.00830430325, 0.008361634], 0, 1.208348274230957, 1578531545.864219], "v": 0.1}
{"i": ["cuda", "schedule_conv3d_nchw_cuda", [[64, 1, 32, 32, 32], [64, 1, 32, 32, 32], 1, [1, 1, 1], [1, 1, 1], 1], {}, ["schedule_conv3d_nchw_cuda", [64, 1, 32, 32, 32], [64, 1, 32, 32, 32], 1, [1, 1, 1], [1, 1, 1], 1], {"i": 589770226, "t": "", "c": null, "e": [["tile_n", "sp", [-1, 8, 2, 1]], ["tile_f", "sp", [-1, 1, 8, 1]], ["tile_d", "sp", [-1, 1, 1, 1]], ["tile_y", "sp", [-1, 1, 1, 1]], ["tile_x", "sp", [-1, 1, 1, 1]], ["tile_rc", "sp", [-1, 1]], ["tile_rd", "sp", [-1, 16]], ["tile_ry", "sp", [-1, 2]], ["tile_rx", "sp", [-1, 1]], ["auto_unroll_max_step", "ot", 0], ["unroll_explicit", "ot", 0], ["fuse_yx", "ot", 1]]}], "r": [[0.0109694025, 0.010988305], 0, 1.1480178833007812, 1578531546.5922837], "v": 0.1}
{"i": ["cuda", "schedule_conv3d_nchw_cuda", [[64, 1, 32, 32, 32], [64, 1, 32, 32, 32], 1, [1, 1, 1], [1, 1, 1], 1], {}, ["schedule_conv3d_nchw_cuda", [64, 1, 32, 32, 32], [64, 1, 32, 32, 32], 1, [1, 1, 1], [1, 1, 1], 1], {"i": 602866162, "t": "", "c": null, "e": [["tile_n", "sp", [-1, 8, 2, 1]], ["tile_f", "sp", [-1, 1, 8, 1]], ["tile_d", "sp", [-1, 1, 1, 1]], ["tile_y", "sp", [-1, 1, 1, 1]], ["tile_x", "sp", [-1, 1, 1, 1]], ["tile_rc", "sp", [-1, 1]], ["tile_rd", "sp", [-1, 8]], ["tile_ry", "sp", [-1, 1]], ["tile_rx", "sp", [-1, 2]], ["auto_unroll_max_step", "ot", 0], ["unroll_explicit", "ot", 0], ["fuse_yx", "ot", 1]]}], "r": [[0.0189121165, 0.01858626525], 0, 1.1927497386932373, 1578531549.4570684], "v": 0.1}
{"i": ["cuda", "schedule_conv3d_nchw_cuda", [[64, 1, 32, 32, 32], [64, 1, 32, 32, 32], 1, [1, 1, 1], [1, 1, 1], 1], {}, ["schedule_conv3d_nchw_cuda", [64, 1, 32, 32, 32], [64, 1, 32, 32, 32], 1, [1, 1, 1], [1, 1, 1], 1], {"i": 620929522, "t": "", "c": null, "e": [["tile_n", "sp", [-1, 8, 2, 1]], ["tile_f", "sp", [-1, 1, 8, 1]], ["tile_d", "sp", [-1, 1, 1, 1]], ["tile_y", "sp", [-1, 1, 1, 1]], ["tile_x", "sp", [-1, 1, 1, 1]], ["tile_rc", "sp", [-1, 1]], ["tile_rd", "sp", [-1, 2]], ["tile_ry", "sp", [-1, 2]], ["tile_rx", "sp", [-1, 4]], ["auto_unroll_max_step", "ot", 0], ["unroll_explicit", "ot", 0], ["fuse_yx", "ot", 1]]}], "r": [[0.012124531, 0.0120475225], 0, 1.196686029434204, 1578531550.1752646], "v": 0.1}
{"i": ["cuda", "schedule_conv3d_nchw_cuda", [[64, 1, 32, 32, 32], [64, 1, 32, 32, 32], 1, [1, 1, 1], [1, 1, 1], 1], {}, ["schedule_conv3d_nchw_cuda", [64, 1, 32, 32, 32], [64, 1, 32, 32, 32], 1, [1, 1, 1], [1, 1, 1], 1], {"i": 621381106, "t": "", "c": null, "e": [["tile_n", "sp", [-1, 8, 2, 1]], ["tile_f", "sp", [-1, 1, 8, 1]], ["tile_d", "sp", [-1, 1, 1, 1]], ["tile_y", "sp", [-1, 1, 1, 1]], ["tile_x", "sp", [-1, 1, 1, 1]], ["tile_rc", "sp", [-1, 1]], ["tile_rd", "sp", [-1, 4]], ["tile_ry", "sp", [-1, 2]], ["tile_rx", "sp", [-1, 4]], ["auto_unroll_max_step", "ot", 0], ["unroll_explicit", "ot", 0], ["fuse_yx", "ot", 1]]}], "r": [[0.0107138335, 0.01069781425], 0, 1.2686879634857178, 1578531550.8948743], "v": 0.1}
{"i": ["cuda", "schedule_conv3d_nchw_cuda", [[64, 1, 32, 32, 32], [64, 1, 32, 32, 32], 1, [1, 1, 1], [1, 1, 1], 1], {}, ["schedule_conv3d_nchw_cuda", [64, 1, 32, 32, 32], [64, 1, 32, 32, 32], 1, [1, 1, 1], [1, 1, 1], 1], {"i": 879687154, "t": "", "c": null, "e": [["tile_n", "sp", [-1, 8, 2, 1]], ["tile_f", "sp", [-1, 1, 8, 1]], ["tile_d", "sp", [-1, 1, 1, 1]], ["tile_y", "sp", [-1, 1, 1, 1]], ["tile_x", "sp", [-1, 1, 1, 1]], ["tile_rc", "sp", [-1, 1]], ["tile_rd", "sp", [-1, 16]], ["tile_ry", "sp", [-1, 1]], ["tile_rx", "sp", [-1, 1]], ["auto_unroll_max_step", "ot", 0], ["unroll_explicit", "ot", 1], ["fuse_yx", "ot", 1]]}], "r": [[0.0188196225, 0.018878132], 0, 1.227818250656128, 1578531551.6383383], "v": 0.1}
{"i": ["cuda", "schedule_conv3d_nchw_cuda", [[64, 1, 32, 32, 32], [64, 1, 32, 32, 32], 1, [1, 1, 1], [1, 1, 1], 1], {}, ["schedule_conv3d_nchw_cuda", [64, 1, 32, 32, 32], [64, 1, 32, 32, 32], 1, [1, 1, 1], [1, 1, 1], 1], {"i": 813755890, "t": "", "c": null, "e": [["tile_n", "sp", [-1, 8, 2, 1]], ["tile_f", "sp", [-1, 1, 8, 1]], ["tile_d", "sp", [-1, 1, 1, 1]], ["tile_y", "sp", [-1, 1, 1, 1]], ["tile_x", "sp", [-1, 1, 1, 1]], ["tile_rc", "sp", [-1, 1]], ["tile_rd", "sp", [-1, 4]], ["tile_ry", "sp", [-1, 1]], ["tile_rx", "sp", [-1, 4]], ["auto_unroll_max_step", "ot", 1500], ["unroll_explicit", "ot", 0], ["fuse_yx", "ot", 1]]}], "r": [[0.02129649975, 0.02139396825], 0, 1.3659439086914062, 1578531552.4734774], "v": 0.1}
{"i": ["cuda", "schedule_conv3d_nchw_cuda", [[64, 1, 32, 32, 32], [64, 1, 32, 32, 32], 1, [1, 1, 1], [1, 1, 1], 1], {}, ["schedule_conv3d_nchw_cuda", [64, 1, 32, 32, 32], [64, 1, 32, 32, 32], 1, [1, 1, 1], [1, 1, 1], 1], {"i": 816013810, "t": "", "c": null, "e": [["tile_n", "sp", [-1, 8, 2, 1]], ["tile_f", "sp", [-1, 1, 8, 1]], ["tile_d", "sp", [-1, 1, 1, 1]], ["tile_y", "sp", [-1, 1, 1, 1]], ["tile_x", "sp", [-1, 1, 1, 1]], ["tile_rc", "sp", [-1, 1]], ["tile_rd", "sp", [-1, 2]], ["tile_ry", "sp", [-1, 2]], ["tile_rx", "sp", [-1, 4]], ["auto_unroll_max_step", "ot", 1500], ["unroll_explicit", "ot", 0], ["fuse_yx", "ot", 1]]}], "r": [[0.00948514475, 0.0095572395], 0, 1.4868712425231934, 1578531553.4939327], "v": 0.1}
{"i": ["cuda", "schedule_conv3d_nchw_cuda", [[64, 1, 32, 32, 32], [64, 1, 32, 32, 32], 1, [1, 1, 1], [1, 1, 1], 1], {}, ["schedule_conv3d_nchw_cuda", [64, 1, 32, 32, 32], [64, 1, 32, 32, 32], 1, [1, 1, 1], [1, 1, 1], 1], {"i": 687312370, "t": "", "c": null, "e": [["tile_n", "sp", [-1, 8, 2, 1]], ["tile_f", "sp", [-1, 1, 8, 1]], ["tile_d", "sp", [-1, 1, 1, 1]], ["tile_y", "sp", [-1, 1, 1, 1]], ["tile_x", "sp", [-1, 1, 1, 1]], ["tile_rc", "sp", [-1, 1]], ["tile_rd", "sp", [-1, 16]], ["tile_ry", "sp", [-1, 2]], ["tile_rx", "sp", [-1, 1]], ["auto_unroll_max_step", "ot", 512], ["unroll_explicit", "ot", 0], ["fuse_yx", "ot", 1]]}], "r": [[0.01060519525, 0.01059920275], 0, 1.4861130714416504, 1578531554.33934], "v": 0.1}
{"i": ["cuda", "schedule_conv3d_nchw_cuda", [[64, 1, 32, 32, 32], [64, 1, 32, 32, 32], 1, [1, 1, 1], [1, 1, 1], 1], {}, ["schedule_conv3d_nchw_cuda", [64, 1, 32, 32, 32], [64, 1, 32, 32, 32], 1, [1, 1, 1], [1, 1, 1], 1], {"i": 718471666, "t": "", "c": null, "e": [["tile_n", "sp", [-1, 8, 2, 1]], ["tile_f", "sp", [-1, 1, 8, 1]], ["tile_d", "sp", [-1, 1, 1, 1]], ["tile_y", "sp", [-1, 1, 1, 1]], ["tile_x", "sp", [-1, 1, 1, 1]], ["tile_rc", "sp", [-1, 1]], ["tile_rd", "sp", [-1, 2]], ["tile_ry", "sp", [-1, 2]], ["tile_rx", "sp", [-1, 4]], ["auto_unroll_max_step", "ot", 512], ["unroll_explicit", "ot", 0], ["fuse_yx", "ot", 1]]}], "r": [[0.009512089, 0.009504579], 0, 1.3175811767578125, 1578531555.0235994], "v": 0.1}
{"i": ["cuda", "schedule_conv3d_nchw_cuda", [[64, 1, 32, 32, 32], [64, 1, 32, 32, 32], 1, [1, 1, 1], [1, 1, 1], 1], {}, ["schedule_conv3d_nchw_cuda", [64, 1, 32, 32, 32], [64, 1, 32, 32, 32], 1, [1, 1, 1], [1, 1, 1], 1], {"i": 689795740, "t": "", "c": null, "e": [["tile_n", "sp", [-1, 16, 1, 1]], ["tile_f", "sp", [-1, 2, 4, 1]], ["tile_d", "sp", [-1, 1, 1, 1]], ["tile_y", "sp", [-1, 1, 1, 1]], ["tile_x", "sp", [-1, 1, 3, 1]], ["tile_rc", "sp", [-1, 1]], ["tile_rd", "sp", [-1, 8]], ["tile_ry", "sp", [-1, 4]], ["tile_rx", "sp", [-1, 1]], ["auto_unroll_max_step", "ot", 512], ["unroll_explicit", "ot", 0], ["fuse_yx", "ot", 1]]}], "r": [[0.012583942, 0.012667397], 0, 2.0989503860473633, 1578531556.0281804], "v": 0.1}
{"i": ["cuda", "schedule_conv3d_nchw_cuda", [[64, 1, 32, 32, 32], [64, 1, 32, 32, 32], 1, [1, 1, 1], [1, 1, 1], 1], {}, ["schedule_conv3d_nchw_cuda", [64, 1, 32, 32, 32], [64, 1, 32, 32, 32], 1, [1, 1, 1], [1, 1, 1], 1], {"i": 684602866, "t": "", "c": null, "e": [["tile_n", "sp", [-1, 8, 2, 1]], ["tile_f", "sp", [-1, 1, 8, 1]], ["tile_d", "sp", [-1, 1, 1, 1]], ["tile_y", "sp", [-1, 1, 1, 1]], ["tile_x", "sp", [-1, 1, 1, 1]], ["tile_rc", "sp", [-1, 1]], ["tile_rd", "sp", [-1, 16]], ["tile_ry", "sp", [-1, 1]], ["tile_rx", "sp", [-1, 1]], ["auto_unroll_max_step", "ot", 512], ["unroll_explicit", "ot", 0], ["fuse_yx", "ot", 1]]}], "r": [[0.02568208225, 0.02506661475], 0, 1.4696934223175049, 1578531556.9061005], "v": 0.1}
{"i": ["cuda", "schedule_conv3d_nchw_cuda", [[64, 1, 32, 32, 32], [64, 1, 32, 32, 32], 1, [1, 1, 1], [1, 1, 1], 1], {}, ["schedule_conv3d_nchw_cuda", [64, 1, 32, 32, 32], [64, 1, 32, 32, 32], 1, [1, 1, 1], [1, 1, 1], 1], {"i": 977229298, "t": "", "c": null, "e": [["tile_n", "sp", [-1, 8, 2, 1]], ["tile_f", "sp", [-1, 1, 8, 1]], ["tile_d", "sp", [-1, 1, 1, 1]], ["tile_y", "sp", [-1, 1, 1, 1]], ["tile_x", "sp", [-1, 1, 1, 1]], ["tile_rc", "sp", [-1, 1]], ["tile_rd", "sp", [-1, 16]], ["tile_ry", "sp", [-1, 1]], ["tile_rx", "sp", [-1, 1]], ["auto_unroll_max_step", "ot", 512], ["unroll_explicit", "ot", 1], ["fuse_yx", "ot", 1]]}], "r": [[0.0180465145, 0.0177822515], 0, 1.3501431941986084, 1578531557.6847992], "v": 0.1}
{"i": ["cuda", "schedule_conv3d_nchw_cuda", [[64, 1, 32, 32, 32], [64, 1, 32, 32, 32], 1, [1, 1, 1], [1, 1, 1], 1], {}, ["schedule_conv3d_nchw_cuda", [64, 1, 32, 32, 32], [64, 1, 32, 32, 32], 1, [1, 1, 1], [1, 1, 1], 1], {"i": 895492594, "t": "", "c": null, "e": [["tile_n", "sp", [-1, 8, 2, 1]], ["tile_f", "sp", [-1, 1, 8, 1]], ["tile_d", "sp", [-1, 1, 1, 1]], ["tile_y", "sp", [-1, 1, 1, 1]], ["tile_x", "sp", [-1, 1, 1, 1]], ["tile_rc", "sp", [-1, 1]], ["tile_rd", "sp", [-1, 8]], ["tile_ry", "sp", [-1, 1]], ["tile_rx", "sp", [-1, 2]], ["auto_unroll_max_step", "ot", 0], ["unroll_explicit", "ot", 1], ["fuse_yx", "ot", 1]]}], "r": [[0.019167551, 0.018728591], 0, 1.2083625793457031, 1578531558.4411955], "v": 0.1}
{"i": ["cuda", "schedule_conv3d_nchw_cuda", [[64, 1, 32, 32, 32], [64, 1, 32, 32, 32], 1, [1, 1, 1], [1, 1, 1], 1], {}, ["schedule_conv3d_nchw_cuda", [64, 1, 32, 32, 32], [64, 1, 32, 32, 32], 1, [1, 1, 1], [1, 1, 1], 1], {"i": 1109105512, "t": "", "c": null, "e": [["tile_n", "sp", [-1, 16, 1, 1]], ["tile_f", "sp", [-1, 1, 4, 1]], ["tile_d", "sp", [-1, 1, 3, 1]], ["tile_y", "sp", [-1, 1, 1, 1]], ["tile_x", "sp", [-1, 1, 1, 1]], ["tile_rc", "sp", [-1, 1]], ["tile_rd", "sp", [-1, 4]], ["tile_ry", "sp", [-1, 2]], ["tile_rx", "sp", [-1, 4]], ["auto_unroll_max_step", "ot", 1500], ["unroll_explicit", "ot", 1], ["fuse_yx", "ot", 1]]}], "r": [[0.040847035, 0.0408509495], 0, 2.956791400909424, 1578531561.9055479], "v": 0.1}
{"i": ["cuda", "schedule_conv3d_nchw_cuda", [[64, 1, 32, 32, 32], [64, 1, 32, 32, 32], 1, [1, 1, 1], [1, 1, 1], 1], {}, ["schedule_conv3d_nchw_cuda", [64, 1, 32, 32, 32], [64, 1, 32, 32, 32], 1, [1, 1, 1], [1, 1, 1], 1], {"i": 1093286386, "t": "", "c": null, "e": [["tile_n", "sp", [-1, 8, 2, 1]], ["tile_f", "sp", [-1, 1, 8, 1]], ["tile_d", "sp", [-1, 1, 1, 1]], ["tile_y", "sp", [-1, 1, 1, 1]], ["tile_x", "sp", [-1, 1, 1, 1]], ["tile_rc", "sp", [-1, 1]], ["tile_rd", "sp", [-1, 8]], ["tile_ry", "sp", [-1, 2]], ["tile_rx", "sp", [-1, 2]], ["auto_unroll_max_step", "ot", 1500], ["unroll_explicit", "ot", 1], ["fuse_yx", "ot", 1]]}], "r": [[0.01772486425, 0.017668453], 0, 1.958143711090088, 1578531562.7471213], "v": 0.1}
{"i": ["cuda", "schedule_conv3d_nchw_cuda", [[64, 1, 32, 32, 32], [64, 1, 32, 32, 32], 1, [1, 1, 1], [1, 1, 1], 1], {}, ["schedule_conv3d_nchw_cuda", [64, 1, 32, 32, 32], [64, 1, 32, 32, 32], 1, [1, 1, 1], [1, 1, 1], 1], {"i": 816465394, "t": "", "c": null, "e": [["tile_n", "sp", [-1, 8, 2, 1]], ["tile_f", "sp", [-1, 1, 8, 1]], ["tile_d", "sp", [-1, 1, 1, 1]], ["tile_y", "sp", [-1, 1, 1, 1]], ["tile_x", "sp", [-1, 1, 1, 1]], ["tile_rc", "sp", [-1, 1]], ["tile_rd", "sp", [-1, 4]], ["tile_ry", "sp", [-1, 2]], ["tile_rx", "sp", [-1, 4]], ["auto_unroll_max_step", "ot", 1500], ["unroll_explicit", "ot", 0], ["fuse_yx", "ot", 1]]}], "r": [[0.011178104, 0.01124960275], 0, 1.5229389667510986, 1578531563.6206276], "v": 0.1}
{"i": ["cuda", "schedule_conv3d_nchw_cuda", [[64, 1, 32, 32, 32], [64, 1, 32, 32, 32], 1, [1, 1, 1], [1, 1, 1], 1], {}, ["schedule_conv3d_nchw_cuda", [64, 1, 32, 32, 32], [64, 1, 32, 32, 32], 1, [1, 1, 1], [1, 1, 1], 1], {"i": 1011549682, "t": "", "c": null, "e": [["tile_n", "sp", [-1, 8, 2, 1]], ["tile_f", "sp", [-1, 1, 8, 1]], ["tile_d", "sp", [-1, 1, 1, 1]], ["tile_y", "sp", [-1, 1, 1, 1]], ["tile_x", "sp", [-1, 1, 1, 1]], ["tile_rc", "sp", [-1, 1]], ["tile_rd", "sp", [-1, 4]], ["tile_ry", "sp", [-1, 2]], ["tile_rx", "sp", [-1, 4]], ["auto_unroll_max_step", "ot", 512], ["unroll_explicit", "ot", 1], ["fuse_yx", "ot", 1]]}], "r": [[0.01700467725, 0.01699326775], 0, 1.9133381843566895, 1578531564.455066], "v": 0.1}
{"i": ["cuda", "schedule_conv3d_nchw_cuda", [[64, 1, 32, 32, 32], [64, 1, 32, 32, 32], 1, [1, 1, 1], [1, 1, 1], 1], {}, ["schedule_conv3d_nchw_cuda", [64, 1, 32, 32, 32], [64, 1, 32, 32, 32], 1, [1, 1, 1], [1, 1, 1], 1], {"i": 718923250, "t": "", "c": null, "e": [["tile_n", "sp", [-1, 8, 2, 1]], ["tile_f", "sp", [-1, 1, 8, 1]], ["tile_d", "sp", [-1, 1, 1, 1]], ["tile_y", "sp", [-1, 1, 1, 1]], ["tile_x", "sp", [-1, 1, 1, 1]], ["tile_rc", "sp", [-1, 1]], ["tile_rd", "sp", [-1, 4]], ["tile_ry", "sp", [-1, 2]], ["tile_rx", "sp", [-1, 4]], ["auto_unroll_max_step", "ot", 512], ["unroll_explicit", "ot", 0], ["fuse_yx", "ot", 1]]}], "r": [[0.0111497775, 0.01119362075], 0, 1.500229835510254, 1578531565.2000318], "v": 0.1}
{"i": ["cuda", "schedule_conv3d_nchw_cuda", [[64, 1, 32, 32, 32], [64, 1, 32, 32, 32], 1, [1, 1, 1], [1, 1, 1], 1], {}, ["schedule_conv3d_nchw_cuda", [64, 1, 32, 32, 32], [64, 1, 32, 32, 32], 1, [1, 1, 1], [1, 1, 1], 1], {"i": 882396658, "t": "", "c": null, "e": [["tile_n", "sp", [-1, 8, 2, 1]], ["tile_f", "sp", [-1, 1, 8, 1]], ["tile_d", "sp", [-1, 1, 1, 1]], ["tile_y", "sp", [-1, 1, 1, 1]], ["tile_x", "sp", [-1, 1, 1, 1]], ["tile_rc", "sp", [-1, 1]], ["tile_rd", "sp", [-1, 16]], ["tile_ry", "sp", [-1, 2]], ["tile_rx", "sp", [-1, 1]], ["auto_unroll_max_step", "ot", 0], ["unroll_explicit", "ot", 1], ["fuse_yx", "ot", 1]]}], "r": [[0.0109245905, 0.010983652], 0, 1.233870506286621, 1578531565.869023], "v": 0.1}
{"i": ["cuda", "schedule_conv3d_nchw_cuda", [[64, 1, 32, 32, 32], [64, 1, 32, 32, 32], 1, [1, 1, 1], [1, 1, 1], 1], {}, ["schedule_conv3d_nchw_cuda", [64, 1, 32, 32, 32], [64, 1, 32, 32, 32], 1, [1, 1, 1], [1, 1, 1], 1], {"i": 995744242, "t": "", "c": null, "e": [["tile_n", "sp", [-1, 8, 2, 1]], ["tile_f", "sp", [-1, 1, 8, 1]], ["tile_d", "sp", [-1, 1, 1, 1]], ["tile_y", "sp", [-1, 1, 1, 1]], ["tile_x", "sp", [-1, 1, 1, 1]], ["tile_rc", "sp", [-1, 1]], ["tile_rd", "sp", [-1, 8]], ["tile_ry", "sp", [-1, 2]], ["tile_rx", "sp", [-1, 2]], ["auto_unroll_max_step", "ot", 512], ["unroll_explicit", "ot", 1], ["fuse_yx", "ot", 1]]}], "r": [[0.01773780175, 0.01772548925], 0, 1.8098714351654053, 1578531566.6765926], "v": 0.1}
{"i": ["cuda", "schedule_conv3d_nchw_cuda", [[64, 1, 32, 32, 32], [64, 1, 32, 32, 32], 1, [1, 1, 1], [1, 1, 1], 1], {}, ["schedule_conv3d_nchw_cuda", [64, 1, 32, 32, 32], [64, 1, 32, 32, 32], 1, [1, 1, 1], [1, 1, 1], 1], {"i": 884880028, "t": "", "c": null, "e": [["tile_n", "sp", [-1, 16, 1, 1]], ["tile_f", "sp", [-1, 2, 4, 1]], ["tile_d", "sp", [-1, 1, 1, 1]], ["tile_y", "sp", [-1, 1, 1, 1]], ["tile_x", "sp", [-1, 1, 3, 1]], ["tile_rc", "sp", [-1, 1]], ["tile_rd", "sp", [-1, 8]], ["tile_ry", "sp", [-1, 4]], ["tile_rx", "sp", [-1, 1]], ["auto_unroll_max_step", "ot", 0], ["unroll_explicit", "ot", 1], ["fuse_yx", "ot", 1]]}], "r": [[0.0082953335, 0.00829520725], 0, 1.2411444187164307, 1578531567.3402624], "v": 0.1}
{"i": ["cuda", "schedule_conv3d_nchw_cuda", [[64, 1, 32, 32, 32], [64, 1, 32, 32, 32], 1, [1, 1, 1], [1, 1, 1], 1], {}, ["schedule_conv3d_nchw_cuda", [64, 1, 32, 32, 32], [64, 1, 32, 32, 32], 1, [1, 1, 1], [1, 1, 1], 1], {"i": 1074771442, "t": "", "c": null, "e": [["tile_n", "sp", [-1, 8, 2, 1]], ["tile_f", "sp", [-1, 1, 8, 1]], ["tile_d", "sp", [-1, 1, 1, 1]], ["tile_y", "sp", [-1, 1, 1, 1]], ["tile_x", "sp", [-1, 1, 1, 1]], ["tile_rc", "sp", [-1, 1]], ["tile_rd", "sp", [-1, 16]], ["tile_ry", "sp", [-1, 1]], ["tile_rx", "sp", [-1, 1]], ["auto_unroll_max_step", "ot", 1500], ["unroll_explicit", "ot", 1], ["fuse_yx", "ot", 1]]}], "r": [[0.017628225, 0.01755874], 0, 1.527198076248169, 1578531568.0887225], "v": 0.1}
{"i": ["cuda", "schedule_conv3d_nchw_cuda", [[64, 1, 32, 32, 32], [64, 1, 32, 32, 32], 1, [1, 1, 1], [1, 1, 1], 1], {}, ["schedule_conv3d_nchw_cuda", [64, 1, 32, 32, 32], [64, 1, 32, 32, 32], 1, [1, 1, 1], [1, 1, 1], 1], {"i": 914007538, "t": "", "c": null, "e": [["tile_n", "sp", [-1, 8, 2, 1]], ["tile_f", "sp", [-1, 1, 8, 1]], ["tile_d", "sp", [-1, 1, 1, 1]], ["tile_y", "sp", [-1, 1, 1, 1]], ["tile_x", "sp", [-1, 1, 1, 1]], ["tile_rc", "sp", [-1, 1]], ["tile_rd", "sp", [-1, 4]], ["tile_ry", "sp", [-1, 2]], ["tile_rx", "sp", [-1, 4]], ["auto_unroll_max_step", "ot", 0], ["unroll_explicit", "ot", 1], ["fuse_yx", "ot", 1]]}], "r": [[0.01069716675, 0.010687448], 0, 1.332735300064087, 1578531568.7671185], "v": 0.1}
{"i": ["cuda", "schedule_conv3d_nchw_cuda", [[64, 1, 32, 32, 32], [64, 1, 32, 32, 32], 1, [1, 1, 1], [1, 1, 1], 1], {}, ["schedule_conv3d_nchw_cuda", [64, 1, 32, 32, 32], [64, 1, 32, 32, 32], 1, [1, 1, 1], [1, 1, 1], 1], {"i": 898202098, "t": "", "c": null, "e": [["tile_n", "sp", [-1, 8, 2, 1]], ["tile_f", "sp", [-1, 1, 8, 1]], ["tile_d", "sp", [-1, 1, 1, 1]], ["tile_y", "sp", [-1, 1, 1, 1]], ["tile_x", "sp", [-1, 1, 1, 1]], ["tile_rc", "sp", [-1, 1]], ["tile_rd", "sp", [-1, 8]], ["tile_ry", "sp", [-1, 2]], ["tile_rx", "sp", [-1, 2]], ["auto_unroll_max_step", "ot", 0], ["unroll_explicit", "ot", 1], ["fuse_yx", "ot", 1]]}], "r": [[0.01127916675, 0.01128288075], 0, 1.2961654663085938, 1578531569.485315], "v": 0.1}
{"i": ["cuda", "schedule_conv3d_nchw_cuda", [[64, 1, 32, 32, 32], [64, 1, 32, 32, 32], 1, [1, 1, 1], [1, 1, 1], 1], {}, ["schedule_conv3d_nchw_cuda", [64, 1, 32, 32, 32], [64, 1, 32, 32, 32], 1, [1, 1, 1], [1, 1, 1], 1], {"i": 993034738, "t": "", "c": null, "e": [["tile_n", "sp", [-1, 8, 2, 1]], ["tile_f", "sp", [-1, 1, 8, 1]], ["tile_d", "sp", [-1, 1, 1, 1]], ["tile_y", "sp", [-1, 1, 1, 1]], ["tile_x", "sp", [-1, 1, 1, 1]], ["tile_rc", "sp", [-1, 1]], ["tile_rd", "sp", [-1, 8]], ["tile_ry", "sp", [-1, 1]], ["tile_rx", "sp", [-1, 2]], ["auto_unroll_max_step", "ot", 512], ["unroll_explicit", "ot", 1], ["fuse_yx", "ot", 1]]}], "r": [[0.017055399, 0.0169307535], 0, 1.483443260192871, 1578531570.2663386], "v": 0.1}
{"i": ["cuda", "schedule_conv3d_nchw_cuda", [[64, 1, 32, 32, 32], [64, 1, 32, 32, 32], 1, [1, 1, 1], [1, 1, 1], 1], {}, ["schedule_conv3d_nchw_cuda", [64, 1, 32, 32, 32], [64, 1, 32, 32, 32], 1, [1, 1, 1], [1, 1, 1], 1], {"i": 301660214, "t": "", "c": null, "e": [["tile_n", "sp", [-1, 4, 1, 1]], ["tile_f", "sp", [-1, 1, 32, 1]], ["tile_d", "sp", [-1, 1, 1, 1]], ["tile_y", "sp", [-1, 1, 1, 1]], ["tile_x", "sp", [-1, 1, 1, 1]], ["tile_rc", "sp", [-1, 1]], ["tile_rd", "sp", [-1, 4]], ["tile_ry", "sp", [-1, 8]], ["tile_rx", "sp", [-1, 1]], ["auto_unroll_max_step", "ot", 0], ["unroll_explicit", "ot", 1], ["fuse_yx", "ot", 0]]}], "r": [[0.008912359, 0.008912029], 0, 1.1571195125579834, 1578531785.6387734], "v": 0.1}
{"i": ["cuda", "schedule_conv3d_nchw_cuda", [[64, 1, 32, 32, 32], [64, 1, 32, 32, 32], 1, [1, 1, 1], [1, 1, 1], 1], {}, ["schedule_conv3d_nchw_cuda", [64, 1, 32, 32, 32], [64, 1, 32, 32, 32], 1, [1, 1, 1], [1, 1, 1], 1], {"i": 986375734, "t": "", "c": null, "e": [["tile_n", "sp", [-1, 1, 16, 1]], ["tile_f", "sp", [-1, 2, 4, 2]], ["tile_d", "sp", [-1, 1, 1, 1]], ["tile_y", "sp", [-1, 1, 1, 1]], ["tile_x", "sp", [-1, 3, 1, 1]], ["tile_rc", "sp", [-1, 1]], ["tile_rd", "sp", [-1, 1]], ["tile_ry", "sp", [-1, 16]], ["tile_rx", "sp", [-1, 1]], ["auto_unroll_max_step", "ot", 512], ["unroll_explicit", "ot", 1], ["fuse_yx", "ot", 1]]}], "r": [[0.0049743365, 0.00496509575], 0, 1.440826654434204, 1578531786.3047457], "v": 0.1}
{"i": ["cuda", "schedule_conv3d_nchw_cuda", [[64, 1, 32, 32, 32], [64, 1, 32, 32, 32], 1, [1, 1, 1], [1, 1, 1], 1], {}, ["schedule_conv3d_nchw_cuda", [64, 1, 32, 32, 32], [64, 1, 32, 32, 32], 1, [1, 1, 1], [1, 1, 1], 1], {"i": 886462687, "t": "", "c": null, "e": [["tile_n", "sp", [-1, 2, 8, 1]], ["tile_f", "sp", [-1, 1, 4, 2]], ["tile_d", "sp", [-1, 1, 1, 1]], ["tile_y", "sp", [-1, 1, 1, 1]], ["tile_x", "sp", [-1, 1, 1, 1]], ["tile_rc", "sp", [-1, 1]], ["tile_rd", "sp", [-1, 2]], ["tile_ry", "sp", [-1, 8]], ["tile_rx", "sp", [-1, 1]], ["auto_unroll_max_step", "ot", 0], ["unroll_explicit", "ot", 1], ["fuse_yx", "ot", 1]]}], "r": [[0.00745878225, 0.00745681575], 0, 1.1662912368774414, 1578531786.9673548], "v": 0.1}
{"i": ["cuda", "schedule_conv3d_nchw_cuda", [[64, 1, 32, 32, 32], [64, 1, 32, 32, 32], 1, [1, 1, 1], [1, 1, 1], 1], {}, ["schedule_conv3d_nchw_cuda", [64, 1, 32, 32, 32], [64, 1, 32, 32, 32], 1, [1, 1, 1], [1, 1, 1], 1], {"i": 986375731, "t": "", "c": null, "e": [["tile_n", "sp", [-1, 2, 8, 1]], ["tile_f", "sp", [-1, 2, 4, 2]], ["tile_d", "sp", [-1, 1, 1, 1]], ["tile_y", "sp", [-1, 1, 1, 1]], ["tile_x", "sp", [-1, 3, 1, 1]], ["tile_rc", "sp", [-1, 1]], ["tile_rd", "sp", [-1, 1]], ["tile_ry", "sp", [-1, 16]], ["tile_rx", "sp", [-1, 1]], ["auto_unroll_max_step", "ot", 512], ["unroll_explicit", "ot", 1], ["fuse_yx", "ot", 1]]}], "r": [[0.00675888675, 0.00675492475], 0, 1.5767302513122559, 1578531787.7099895], "v": 0.1}
{"i": ["cuda", "schedule_conv3d_nchw_cuda", [[64, 1, 32, 32, 32], [64, 1, 32, 32, 32], 1, [1, 1, 1], [1, 1, 1], 1], {}, ["schedule_conv3d_nchw_cuda", [64, 1, 32, 32, 32], [64, 1, 32, 32, 32], 1, [1, 1, 1], [1, 1, 1], 1], {"i": 301660046, "t": "", "c": null, "e": [["tile_n", "sp", [-1, 4, 1, 1]], ["tile_f", "sp", [-1, 2, 16, 1]], ["tile_d", "sp", [-1, 1, 1, 1]], ["tile_y", "sp", [-1, 1, 1, 1]], ["tile_x", "sp", [-1, 1, 1, 1]], ["tile_rc", "sp", [-1, 1]], ["tile_rd", "sp", [-1, 4]], ["tile_ry", "sp", [-1, 8]], ["tile_rx", "sp", [-1, 1]], ["auto_unroll_max_step", "ot", 0], ["unroll_explicit", "ot", 1], ["fuse_yx", "ot", 0]]}], "r": [[0.01144841875, 0.0112525065], 0, 1.248236894607544, 1578531788.4262614], "v": 0.1}
{"i": ["cuda", "schedule_conv3d_nchw_cuda", [[64, 1, 32, 32, 32], [64, 1, 32, 32, 32], 1, [1, 1, 1], [1, 1, 1], 1], {}, ["schedule_conv3d_nchw_cuda", [64, 1, 32, 32, 32], [64, 1, 32, 32, 32], 1, [1, 1, 1], [1, 1, 1], 1], {"i": 886462690, "t": "", "c": null, "e": [["tile_n", "sp", [-1, 1, 16, 1]], ["tile_f", "sp", [-1, 1, 4, 2]], ["tile_d", "sp", [-1, 1, 1, 1]], ["tile_y", "sp", [-1, 1, 1, 1]], ["tile_x", "sp", [-1, 1, 1, 1]], ["tile_rc", "sp", [-1, 1]], ["tile_rd", "sp", [-1, 2]], ["tile_ry", "sp", [-1, 8]], ["tile_rx", "sp", [-1, 1]], ["auto_unroll_max_step", "ot", 0], ["unroll_explicit", "ot", 1], ["fuse_yx", "ot", 1]]}], "r": [[0.013345843, 0.01334783775], 0, 1.2879447937011719, 1578531789.1445253], "v": 0.1}
{"i": ["cuda", "schedule_conv3d_nchw_cuda", [[64, 1, 32, 32, 32], [64, 1, 32, 32, 32], 1, [1, 1, 1], [1, 1, 1], 1], {}, ["schedule_conv3d_nchw_cuda", [64, 1, 32, 32, 32], [64, 1, 32, 32, 32], 1, [1, 1, 1], [1, 1, 1], 1], {"i": 986260738, "t": "", "c": null, "e": [["tile_n", "sp", [-1, 1, 16, 1]], ["tile_f", "sp", [-1, 4, 4, 1]], ["tile_d", "sp", [-1, 1, 1, 1]], ["tile_y", "sp", [-1, 1, 1, 1]], ["tile_x", "sp", [-1, 1, 1, 1]], ["tile_rc", "sp", [-1, 1]], ["tile_rd", "sp", [-1, 1]], ["tile_ry", "sp", [-1, 16]], ["tile_rx", "sp", [-1, 1]], ["auto_unroll_max_step", "ot", 512], ["unroll_explicit", "ot", 1], ["fuse_yx", "ot", 1]]}], "r": [[0.00590602175, 0.00590236775], 0, 1.280533790588379, 1578531789.8273177], "v": 0.1}
