auto_log/((1, 64, 32, 32, 32), (64, 64, 3, 3, 3), (1, 64, 32, 32, 32), (1, 1, 1), (1, 1, 1), 1, 1, None)_fwd.log
{"i": ["cuda", "schedule_direct_3d_cuda", [[1, 64, 32, 32, 32], [64, 64, 3, 3, 3], [1, 1, 1], [1, 1, 1], 1], {}, ["schedule_direct_3d_cuda", [1, 64, 32, 32, 32], [64, 64, 3, 3, 3], [1, 1, 1], [1, 1, 1], 1], {"i": 1317679930, "t": "", "c": null, "e": [["tile_f", "sp", [-1, 4, 2, 8]], ["tile_d", "sp", [-1, 2, 1, 1]], ["tile_y", "sp", [-1, 2, 2, 1]], ["tile_x", "sp", [-1, 1, 16, 1]], ["tile_rc", "sp", [-1, 32]], ["tile_rd", "sp", [-1, 1]], ["tile_ry", "sp", [-1, 1]], ["tile_rx", "sp", [-1, 3]], ["auto_unroll_max_step", "ot", 512], ["unroll_explicit", "ot", 0]]}], "r": [[0.0018177715, 0.0018154955], 0, 1.5280673503875732, 1578524672.950782], "v": 0.1}
{"i": ["cuda", "schedule_direct_3d_cuda", [[1, 64, 32, 32, 32], [64, 64, 3, 3, 3], [1, 1, 1], [1, 1, 1], 1], {}, ["schedule_direct_3d_cuda", [1, 64, 32, 32, 32], [64, 64, 3, 3, 3], [1, 1, 1], [1, 1, 1], 1], {"i": 348572929, "t": "", "c": null, "e": [["tile_f", "sp", [-1, 1, 8, 4]], ["tile_d", "sp", [-1, 1, 1, 2]], ["tile_y", "sp", [-1, 4, 4, 1]], ["tile_x", "sp", [-1, 1, 16, 2]], ["tile_rc", "sp", [-1, 4]], ["tile_rd", "sp", [-1, 3]], ["tile_ry", "sp", [-1, 3]], ["tile_rx", "sp", [-1, 1]], ["auto_unroll_max_step", "ot", 0], ["unroll_explicit", "ot", 0]]}], "r": [[0.001511252, 0.001509115], 0, 1.1352896690368652, 1578524673.9037], "v": 0.1}
{"i": ["cuda", "schedule_direct_3d_cuda", [[1, 64, 32, 32, 32], [64, 64, 3, 3, 3], [1, 1, 1], [1, 1, 1], 1], {}, ["schedule_direct_3d_cuda", [1, 64, 32, 32, 32], [64, 64, 3, 3, 3], [1, 1, 1], [1, 1, 1], 1], {"i": 961928926, "t": "", "c": null, "e": [["tile_f", "sp", [-1, 4, 2, 8]], ["tile_d", "sp", [-1, 4, 1, 4]], ["tile_y", "sp", [-1, 1, 16, 2]], ["tile_x", "sp", [-1, 1, 4, 1]], ["tile_rc", "sp", [-1, 4]], ["tile_rd", "sp", [-1, 3]], ["tile_ry", "sp", [-1, 1]], ["tile_rx", "sp", [-1, 1]], ["auto_unroll_max_step", "ot", 512], ["unroll_explicit", "ot", 0]]}], "r": [[0.0786205695, 0.078647867], 0, 2.5934576988220215, 1578524688.0646896], "v": 0.1}
{"i": ["cuda", "schedule_direct_3d_cuda", [[1, 64, 32, 32, 32], [64, 64, 3, 3, 3], [1, 1, 1], [1, 1, 1], 1], {}, ["schedule_direct_3d_cuda", [1, 64, 32, 32, 32], [64, 64, 3, 3, 3], [1, 1, 1], [1, 1, 1], 1], {"i": 1970443005, "t": "", "c": null, "e": [["tile_f", "sp", [-1, 2, 2, 8]], ["tile_d", "sp", [-1, 4, 1, 4]], ["tile_y", "sp", [-1, 1, 2, 1]], ["tile_x", "sp", [-1, 4, 4, 2]], ["tile_rc", "sp", [-1, 1]], ["tile_rd", "sp", [-1, 3]], ["tile_ry", "sp", [-1, 3]], ["tile_rx", "sp", [-1, 1]], ["auto_unroll_max_step", "ot", 1500], ["unroll_explicit", "ot", 0]]}], "r": [[0.177287651, 0.17509503525], 0, 6.013345241546631, 1578524692.7771184], "v": 0.1}
{"i": ["cuda", "schedule_direct_3d_cuda", [[1, 64, 32, 32, 32], [64, 64, 3, 3, 3], [1, 1, 1], [1, 1, 1], 1], {}, ["schedule_direct_3d_cuda", [1, 64, 32, 32, 32], [64, 64, 3, 3, 3], [1, 1, 1], [1, 1, 1], 1], {"i": 4445598346, "t": "", "c": null, "e": [["tile_f", "sp", [-1, 4, 2, 8]], ["tile_d", "sp", [-1, 2, 1, 4]], ["tile_y", "sp", [-1, 1, 4, 1]], ["tile_x", "sp", [-1, 1, 32, 1]], ["tile_rc", "sp", [-1, 1]], ["tile_rd", "sp", [-1, 3]], ["tile_ry", "sp", [-1, 3]], ["tile_rx", "sp", [-1, 1]], ["auto_unroll_max_step", "ot", 1500], ["unroll_explicit", "ot", 1]]}], "r": [[0.0063049315, 0.00630782475], 0, 2.4102742671966553, 1578524698.6059976], "v": 0.1}
{"i": ["cuda", "schedule_direct_3d_cuda", [[1, 64, 32, 32, 32], [64, 64, 3, 3, 3], [1, 1, 1], [1, 1, 1], 1], {}, ["schedule_direct_3d_cuda", [1, 64, 32, 32, 32], [64, 64, 3, 3, 3], [1, 1, 1], [1, 1, 1], 1], {"i": 4042832388, "t": "", "c": null, "e": [["tile_f", "sp", [-1, 1, 1, 1]], ["tile_d", "sp", [-1, 2, 1, 4]], ["tile_y", "sp", [-1, 4, 4, 1]], ["tile_x", "sp", [-1, 8, 1, 1]], ["tile_rc", "sp", [-1, 2]], ["tile_rd", "sp", [-1, 3]], ["tile_ry", "sp", [-1, 3]], ["tile_rx", "sp", [-1, 3]], ["auto_unroll_max_step", "ot", 512], ["unroll_explicit", "ot", 1]]}], "r": [[0.1233304035, 0.123205751], 0, 3.433574676513672, 1578524704.5886319], "v": 0.1}
{"i": ["cuda", "schedule_direct_3d_cuda", [[1, 64, 32, 32, 32], [64, 64, 3, 3, 3], [1, 1, 1], [1, 1, 1], 1], {}, ["schedule_direct_3d_cuda", [1, 64, 32, 32, 32], [64, 64, 3, 3, 3], [1, 1, 1], [1, 1, 1], 1], {"i": 4292230711, "t": "", "c": null, "e": [["tile_f", "sp", [-1, 2, 2, 4]], ["tile_d", "sp", [-1, 1, 1, 1]], ["tile_y", "sp", [-1, 1, 1, 1]], ["tile_x", "sp", [-1, 1, 2, 16]], ["tile_rc", "sp", [-1, 8]], ["tile_rd", "sp", [-1, 3]], ["tile_ry", "sp", [-1, 1]], ["tile_rx", "sp", [-1, 1]], ["auto_unroll_max_step", "ot", 1500], ["unroll_explicit", "ot", 1]]}], "r": [[0.01033134925, 0.0104009155], 0, 2.3240888118743896, 1578524720.0027056], "v": 0.1}
{"i": ["cuda", "schedule_direct_3d_cuda", [[1, 64, 32, 32, 32], [64, 64, 3, 3, 3], [1, 1, 1], [1, 1, 1], 1], {}, ["schedule_direct_3d_cuda", [1, 64, 32, 32, 32], [64, 64, 3, 3, 3], [1, 1, 1], [1, 1, 1], 1], {"i": 112533954, "t": "", "c": null, "e": [["tile_f", "sp", [-1, 2, 2, 16]], ["tile_d", "sp", [-1, 2, 1, 1]], ["tile_y", "sp", [-1, 1, 4, 1]], ["tile_x", "sp", [-1, 1, 16, 2]], ["tile_rc", "sp", [-1, 1]], ["tile_rd", "sp", [-1, 3]], ["tile_ry", "sp", [-1, 1]], ["tile_rx", "sp", [-1, 1]], ["auto_unroll_max_step", "ot", 0], ["unroll_explicit", "ot", 0]]}], "r": [[0.00211431775, 0.0020961135], 0, 1.2802646160125732, 1578524975.8641438], "v": 0.1}
{"i": ["cuda", "schedule_direct_3d_cuda", [[1, 64, 32, 32, 32], [64, 64, 3, 3, 3], [1, 1, 1], [1, 1, 1], 1], {}, ["schedule_direct_3d_cuda", [1, 64, 32, 32, 32], [64, 64, 3, 3, 3], [1, 1, 1], [1, 1, 1], 1], {"i": 315132209, "t": "", "c": null, "e": [["tile_f", "sp", [-1, 1, 2, 16]], ["tile_d", "sp", [-1, 1, 1, 2]], ["tile_y", "sp", [-1, 2, 8, 1]], ["tile_x", "sp", [-1, 1, 32, 1]], ["tile_rc", "sp", [-1, 1]], ["tile_rd", "sp", [-1, 3]], ["tile_ry", "sp", [-1, 3]], ["tile_rx", "sp", [-1, 1]], ["auto_unroll_max_step", "ot", 0], ["unroll_explicit", "ot", 0]]}], "r": [[0.002203941, 0.0022031435], 0, 1.2443902492523193, 1578524976.546483], "v": 0.1}
{"i": ["cuda", "schedule_direct_3d_cuda", [[1, 64, 32, 32, 32], [64, 64, 3, 3, 3], [1, 1, 1], [1, 1, 1], 1], {}, ["schedule_direct_3d_cuda", [1, 64, 32, 32, 32], [64, 64, 3, 3, 3], [1, 1, 1], [1, 1, 1], 1], {"i": 318884237, "t": "", "c": null, "e": [["tile_f", "sp", [-1, 1, 2, 16]], ["tile_d", "sp", [-1, 1, 1, 1]], ["tile_y", "sp", [-1, 1, 4, 2]], ["tile_x", "sp", [-1, 2, 8, 2]], ["tile_rc", "sp", [-1, 1]], ["tile_rd", "sp", [-1, 3]], ["tile_ry", "sp", [-1, 3]], ["tile_rx", "sp", [-1, 1]], ["auto_unroll_max_step", "ot", 0], ["unroll_explicit", "ot", 0]]}], "r": [[0.00359077025, 0.00357431025], 0, 1.381059169769287, 1578524977.3274412], "v": 0.1}
{"i": ["cuda", "schedule_direct_3d_cuda", [[1, 64, 32, 32, 32], [64, 64, 3, 3, 3], [1, 1, 1], [1, 1, 1], 1], {}, ["schedule_direct_3d_cuda", [1, 64, 32, 32, 32], [64, 64, 3, 3, 3], [1, 1, 1], [1, 1, 1], 1], {"i": 314849974, "t": "", "c": null, "e": [["tile_f", "sp", [-1, 1, 2, 32]], ["tile_d", "sp", [-1, 1, 1, 2]], ["tile_y", "sp", [-1, 2, 4, 1]], ["tile_x", "sp", [-1, 2, 16, 1]], ["tile_rc", "sp", [-1, 1]], ["tile_rd", "sp", [-1, 3]], ["tile_ry", "sp", [-1, 3]], ["tile_rx", "sp", [-1, 1]], ["auto_unroll_max_step", "ot", 0], ["unroll_explicit", "ot", 0]]}], "r": [[0.07865929525, 0.07826617975], 0, 2.49875545501709, 1578524979.1495225], "v": 0.1}
{"i": ["cuda", "schedule_direct_3d_cuda", [[1, 64, 32, 32, 32], [64, 64, 3, 3, 3], [1, 1, 1], [1, 1, 1], 1], {}, ["schedule_direct_3d_cuda", [1, 64, 32, 32, 32], [64, 64, 3, 3, 3], [1, 1, 1], [1, 1, 1], 1], {"i": 315114631, "t": "", "c": null, "e": [["tile_f", "sp", [-1, 2, 2, 4]], ["tile_d", "sp", [-1, 1, 1, 4]], ["tile_y", "sp", [-1, 2, 4, 1]], ["tile_x", "sp", [-1, 1, 32, 1]], ["tile_rc", "sp", [-1, 1]], ["tile_rd", "sp", [-1, 3]], ["tile_ry", "sp", [-1, 3]], ["tile_rx", "sp", [-1, 1]], ["auto_unroll_max_step", "ot", 0], ["unroll_explicit", "ot", 0]]}], "r": [[0.001737066, 0.0017336045], 0, 1.323179006576538, 1578524979.8761322], "v": 0.1}
{"i": ["cuda", "schedule_direct_3d_cuda", [[1, 64, 32, 32, 32], [64, 64, 3, 3, 3], [1, 1, 1], [1, 1, 1], 1], {}, ["schedule_direct_3d_cuda", [1, 64, 32, 32, 32], [64, 64, 3, 3, 3], [1, 1, 1], [1, 1, 1], 1], {"i": 1145176591, "t": "", "c": null, "e": [["tile_f", "sp", [-1, 2, 2, 4]], ["tile_d", "sp", [-1, 2, 1, 2]], ["tile_y", "sp", [-1, 1, 8, 1]], ["tile_x", "sp", [-1, 1, 16, 2]], ["tile_rc", "sp", [-1, 1]], ["tile_rd", "sp", [-1, 3]], ["tile_ry", "sp", [-1, 3]], ["tile_rx", "sp", [-1, 1]], ["auto_unroll_max_step", "ot", 512], ["unroll_explicit", "ot", 0]]}], "r": [[0.0017976305, 0.00179534375], 0, 1.2747118473052979, 1578524980.6085157], "v": 0.1}
{"i": ["cuda", "schedule_direct_3d_cuda", [[1, 64, 32, 32, 32], [64, 64, 3, 3, 3], [1, 1, 1], [1, 1, 1], 1], {}, ["schedule_direct_3d_cuda", [1, 64, 32, 32, 32], [64, 64, 3, 3, 3], [1, 1, 1], [1, 1, 1], 1], {"i": 1970991931, "t": "", "c": null, "e": [["tile_f", "sp", [-1, 2, 2, 4]], ["tile_d", "sp", [-1, 1, 1, 2]], ["tile_y", "sp", [-1, 1, 4, 1]], ["tile_x", "sp", [-1, 2, 8, 2]], ["tile_rc", "sp", [-1, 1]], ["tile_rd", "sp", [-1, 3]], ["tile_ry", "sp", [-1, 3]], ["tile_rx", "sp", [-1, 1]], ["auto_unroll_max_step", "ot", 1500], ["unroll_explicit", "ot", 0]]}], "r": [[0.00151378925, 0.0015131105], 0, 1.552816390991211, 1578524981.5025556], "v": 0.1}
{"i": ["cuda", "schedule_direct_3d_cuda", [[1, 64, 32, 32, 32], [64, 64, 3, 3, 3], [1, 1, 1], [1, 1, 1], 1], {}, ["schedule_direct_3d_cuda", [1, 64, 32, 32, 32], [64, 64, 3, 3, 3], [1, 1, 1], [1, 1, 1], 1], {"i": 318796603, "t": "", "c": null, "e": [["tile_f", "sp", [-1, 2, 2, 4]], ["tile_d", "sp", [-1, 1, 1, 2]], ["tile_y", "sp", [-1, 1, 4, 1]], ["tile_x", "sp", [-1, 2, 8, 2]], ["tile_rc", "sp", [-1, 1]], ["tile_rd", "sp", [-1, 3]], ["tile_ry", "sp", [-1, 3]], ["tile_rx", "sp", [-1, 1]], ["auto_unroll_max_step", "ot", 0], ["unroll_explicit", "ot", 0]]}], "r": [[0.00263818025, 0.00264174825], 0, 1.3395302295684814, 1578524982.199736], "v": 0.1}
{"i": ["cuda", "schedule_direct_3d_cuda", [[1, 64, 32, 32, 32], [64, 64, 3, 3, 3], [1, 1, 1], [1, 1, 1], 1], {}, ["schedule_direct_3d_cuda", [1, 64, 32, 32, 32], [64, 64, 3, 3, 3], [1, 1, 1], [1, 1, 1], 1], {"i": 319091205, "t": "", "c": null, "e": [["tile_f", "sp", [-1, 2, 2, 8]], ["tile_d", "sp", [-1, 1, 1, 1]], ["tile_y", "sp", [-1, 1, 16, 1]], ["tile_x", "sp", [-1, 1, 16, 2]], ["tile_rc", "sp", [-1, 1]], ["tile_rd", "sp", [-1, 3]], ["tile_ry", "sp", [-1, 3]], ["tile_rx", "sp", [-1, 1]], ["auto_unroll_max_step", "ot", 0], ["unroll_explicit", "ot", 0]]}], "r": [[0.002841578, 0.002836456], 0, 1.249297857284546, 1578524982.8972342], "v": 0.1}
{"i": ["cuda", "schedule_direct_3d_cuda", [[1, 64, 32, 32, 32], [64, 64, 3, 3, 3], [1, 1, 1], [1, 1, 1], 1], {}, ["schedule_direct_3d_cuda", [1, 64, 32, 32, 32], [64, 64, 3, 3, 3], [1, 1, 1], [1, 1, 1], 1], {"i": 3623289006, "t": "", "c": null, "e": [["tile_f", "sp", [-1, 2, 2, 16]], ["tile_d", "sp", [-1, 1, 1, 1]], ["tile_y", "sp", [-1, 1, 8, 2]], ["tile_x", "sp", [-1, 2, 8, 2]], ["tile_rc", "sp", [-1, 1]], ["tile_rd", "sp", [-1, 3]], ["tile_ry", "sp", [-1, 3]], ["tile_rx", "sp", [-1, 1]], ["auto_unroll_max_step", "ot", 512], ["unroll_explicit", "ot", 1]]}], "r": [[0.0123662695, 0.01236509875], 0, 2.206679344177246, 1578524983.9018004], "v": 0.1}
{"i": ["cuda", "schedule_direct_3d_cuda", [[1, 64, 32, 32, 32], [64, 64, 3, 3, 3], [1, 1, 1], [1, 1, 1], 1], {}, ["schedule_direct_3d_cuda", [1, 64, 32, 32, 32], [64, 64, 3, 3, 3], [1, 1, 1], [1, 1, 1], 1], {"i": 319078949, "t": "", "c": null, "e": [["tile_f", "sp", [-1, 1, 2, 16]], ["tile_d", "sp", [-1, 2, 1, 2]], ["tile_y", "sp", [-1, 1, 8, 1]], ["tile_x", "sp", [-1, 1, 16, 2]], ["tile_rc", "sp", [-1, 1]], ["tile_rd", "sp", [-1, 3]], ["tile_ry", "sp", [-1, 3]], ["tile_rx", "sp", [-1, 1]], ["auto_unroll_max_step", "ot", 0], ["unroll_explicit", "ot", 0]]}], "r": [[0.00217178775, 0.00217155625], 0, 1.3009088039398193, 1578524984.6580229], "v": 0.1}
{"i": ["cuda", "schedule_direct_3d_cuda", [[1, 64, 32, 32, 32], [64, 64, 3, 3, 3], [1, 1, 1], [1, 1, 1], 1], {}, ["schedule_direct_3d_cuda", [1, 64, 32, 32, 32], [64, 64, 3, 3, 3], [1, 1, 1], [1, 1, 1], 1], {"i": 2807908794, "t": "", "c": null, "e": [["tile_f", "sp", [-1, 1, 2, 4]], ["tile_d", "sp", [-1, 1, 1, 2]], ["tile_y", "sp", [-1, 1, 8, 1]], ["tile_x", "sp", [-1, 2, 16, 1]], ["tile_rc", "sp", [-1, 2]], ["tile_rd", "sp", [-1, 3]], ["tile_ry", "sp", [-1, 3]], ["tile_rx", "sp", [-1, 1]], ["auto_unroll_max_step", "ot", 0], ["unroll_explicit", "ot", 1]]}], "r": [[0.00180641725, 0.00180489425], 0, 1.1643259525299072, 1578524985.4218287], "v": 0.1}
{"i": ["cuda", "schedule_direct_3d_cuda", [[1, 64, 32, 32, 32], [64, 64, 3, 3, 3], [1, 1, 1], [1, 1, 1], 1], {}, ["schedule_direct_3d_cuda", [1, 64, 32, 32, 32], [64, 64, 3, 3, 3], [1, 1, 1], [1, 1, 1], 1], {"i": 2793142966, "t": "", "c": null, "e": [["tile_f", "sp", [-1, 1, 2, 32]], ["tile_d", "sp", [-1, 1, 1, 2]], ["tile_y", "sp", [-1, 2, 4, 1]], ["tile_x", "sp", [-1, 2, 16, 1]], ["tile_rc", "sp", [-1, 1]], ["tile_rd", "sp", [-1, 3]], ["tile_ry", "sp", [-1, 3]], ["tile_rx", "sp", [-1, 1]], ["auto_unroll_max_step", "ot", 0], ["unroll_explicit", "ot", 1]]}], "r": [[0.07823506825, 0.07824093325], 0, 2.0982165336608887, 1578524989.3571844], "v": 0.1}
{"i": ["cuda", "schedule_direct_3d_cuda", [[1, 64, 32, 32, 32], [64, 64, 3, 3, 3], [1, 1, 1], [1, 1, 1], 1], {}, ["schedule_direct_3d_cuda", [1, 64, 32, 32, 32], [64, 64, 3, 3, 3], [1, 1, 1], [1, 1, 1], 1], {"i": 3416661093, "t": "", "c": null, "e": [["tile_f", "sp", [-1, 2, 2, 8]], ["tile_d", "sp", [-1, 1, 1, 1]], ["tile_y", "sp", [-1, 1, 4, 1]], ["tile_x", "sp", [-1, 2, 8, 2]], ["tile_rc", "sp", [-1, 1]], ["tile_rd", "sp", [-1, 3]], ["tile_ry", "sp", [-1, 1]], ["tile_rx", "sp", [-1, 1]], ["auto_unroll_max_step", "ot", 512], ["unroll_explicit", "ot", 1]]}], "r": [[0.00379183175, 0.003789953], 0, 1.698467493057251, 1578524990.240689], "v": 0.1}
{"i": ["cuda", "schedule_direct_3d_cuda", [[1, 64, 32, 32, 32], [64, 64, 3, 3, 3], [1, 1, 1], [1, 1, 1], 1], {}, ["schedule_direct_3d_cuda", [1, 64, 32, 32, 32], [64, 64, 3, 3, 3], [1, 1, 1], [1, 1, 1], 1], {"i": 1140947638, "t": "", "c": null, "e": [["tile_f", "sp", [-1, 1, 2, 32]], ["tile_d", "sp", [-1, 1, 1, 2]], ["tile_y", "sp", [-1, 2, 4, 1]], ["tile_x", "sp", [-1, 2, 16, 1]], ["tile_rc", "sp", [-1, 1]], ["tile_rd", "sp", [-1, 3]], ["tile_ry", "sp", [-1, 3]], ["tile_rx", "sp", [-1, 1]], ["auto_unroll_max_step", "ot", 512], ["unroll_explicit", "ot", 0]]}], "r": [[0.0067778705, 0.006784288], 0, 1.8758373260498047, 1578524991.1761742], "v": 0.1}
{"i": ["cuda", "schedule_direct_3d_cuda", [[1, 64, 32, 32, 32], [64, 64, 3, 3, 3], [1, 1, 1], [1, 1, 1], 1], {}, ["schedule_direct_3d_cuda", [1, 64, 32, 32, 32], [64, 64, 3, 3, 3], [1, 1, 1], [1, 1, 1], 1], {"i": 319058370, "t": "", "c": null, "e": [["tile_f", "sp", [-1, 2, 2, 16]], ["tile_d", "sp", [-1, 2, 1, 1]], ["tile_y", "sp", [-1, 1, 4, 1]], ["tile_x", "sp", [-1, 1, 16, 2]], ["tile_rc", "sp", [-1, 1]], ["tile_rd", "sp", [-1, 3]], ["tile_ry", "sp", [-1, 3]], ["tile_rx", "sp", [-1, 1]], ["auto_unroll_max_step", "ot", 0], ["unroll_explicit", "ot", 0]]}], "r": [[0.0011174575, 0.00111706725], 0, 1.5290656089782715, 1578524991.9152668], "v": 0.1}
{"i": ["cuda", "schedule_direct_3d_cuda", [[1, 64, 32, 32, 32], [64, 64, 3, 3, 3], [1, 1, 1], [1, 1, 1], 1], {}, ["schedule_direct_3d_cuda", [1, 64, 32, 32, 32], [64, 64, 3, 3, 3], [1, 1, 1], [1, 1, 1], 1], {"i": 1971274277, "t": "", "c": null, "e": [["tile_f", "sp", [-1, 1, 2, 16]], ["tile_d", "sp", [-1, 2, 1, 2]], ["tile_y", "sp", [-1, 1, 8, 1]], ["tile_x", "sp", [-1, 1, 16, 2]], ["tile_rc", "sp", [-1, 1]], ["tile_rd", "sp", [-1, 3]], ["tile_ry", "sp", [-1, 3]], ["tile_rx", "sp", [-1, 1]], ["auto_unroll_max_step", "ot", 1500], ["unroll_explicit", "ot", 0]]}], "r": [[0.0044552375, 0.0044528655], 0, 2.0194785594940186, 1578524993.0583084], "v": 0.1}
{"i": ["cuda", "schedule_direct_3d_cuda", [[1, 64, 32, 32, 32], [64, 64, 3, 3, 3], [1, 1, 1], [1, 1, 1], 1], {}, ["schedule_direct_3d_cuda", [1, 64, 32, 32, 32], [64, 64, 3, 3, 3], [1, 1, 1], [1, 1, 1], 1], {"i": 1967043595, "t": "", "c": null, "e": [["tile_f", "sp", [-1, 2, 2, 4]], ["tile_d", "sp", [-1, 2, 1, 1]], ["tile_y", "sp", [-1, 2, 4, 1]], ["tile_x", "sp", [-1, 2, 16, 1]], ["tile_rc", "sp", [-1, 1]], ["tile_rd", "sp", [-1, 3]], ["tile_ry", "sp", [-1, 3]], ["tile_rx", "sp", [-1, 1]], ["auto_unroll_max_step", "ot", 1500], ["unroll_explicit", "ot", 0]]}], "r": [[0.001610895, 0.00162113975], 0, 1.6280112266540527, 1578524993.9156928], "v": 0.1}
{"i": ["cuda", "schedule_direct_3d_cuda", [[1, 64, 32, 32, 32], [64, 64, 3, 3, 3], [1, 1, 1], [1, 1, 1], 1], {}, ["schedule_direct_3d_cuda", [1, 64, 32, 32, 32], [64, 64, 3, 3, 3], [1, 1, 1], [1, 1, 1], 1], {"i": 319078927, "t": "", "c": null, "e": [["tile_f", "sp", [-1, 2, 2, 4]], ["tile_d", "sp", [-1, 2, 1, 2]], ["tile_y", "sp", [-1, 1, 8, 1]], ["tile_x", "sp", [-1, 1, 16, 2]], ["tile_rc", "sp", [-1, 1]], ["tile_rd", "sp", [-1, 3]], ["tile_ry", "sp", [-1, 3]], ["tile_rx", "sp", [-1, 1]], ["auto_unroll_max_step", "ot", 0], ["unroll_explicit", "ot", 0]]}], "r": [[0.00170834275, 0.001706691], 0, 1.3994896411895752, 1578524994.634531], "v": 0.1}
{"i": ["cuda", "schedule_direct_3d_cuda", [[1, 64, 32, 32, 32], [64, 64, 3, 3, 3], [1, 1, 1], [1, 1, 1], 1], {}, ["schedule_direct_3d_cuda", [1, 64, 32, 32, 32], [64, 64, 3, 3, 3], [1, 1, 1], [1, 1, 1], 1], {"i": 1967045302, "t": "", "c": null, "e": [["tile_f", "sp", [-1, 1, 2, 32]], ["tile_d", "sp", [-1, 1, 1, 2]], ["tile_y", "sp", [-1, 2, 4, 1]], ["tile_x", "sp", [-1, 2, 16, 1]], ["tile_rc", "sp", [-1, 1]], ["tile_rd", "sp", [-1, 3]], ["tile_ry", "sp", [-1, 3]], ["tile_rx", "sp", [-1, 1]], ["auto_unroll_max_step", "ot", 1500], ["unroll_explicit", "ot", 0]]}], "r": [[0.00677944025, 0.006776585], 0, 1.923515796661377, 1578524995.6004472], "v": 0.1}
{"i": ["cuda", "schedule_direct_3d_cuda", [[1, 64, 32, 32, 32], [64, 64, 3, 3, 3], [1, 1, 1], [1, 1, 1], 1], {}, ["schedule_direct_3d_cuda", [1, 64, 32, 32, 32], [64, 64, 3, 3, 3], [1, 1, 1], [1, 1, 1], 1], {"i": 3623543021, "t": "", "c": null, "e": [["tile_f", "sp", [-1, 1, 2, 16]], ["tile_d", "sp", [-1, 1, 1, 1]], ["tile_y", "sp", [-1, 2, 4, 2]], ["tile_x", "sp", [-1, 1, 16, 2]], ["tile_rc", "sp", [-1, 1]], ["tile_rd", "sp", [-1, 3]], ["tile_ry", "sp", [-1, 3]], ["tile_rx", "sp", [-1, 1]], ["auto_unroll_max_step", "ot", 512], ["unroll_explicit", "ot", 1]]}], "r": [[0.00199035575, 0.00203888275], 0, 2.0811331272125244, 1578524996.3950658], "v": 0.1}
{"i": ["cuda", "schedule_direct_3d_cuda", [[1, 64, 32, 32, 32], [64, 64, 3, 3, 3], [1, 1, 1], [1, 1, 1], 1], {}, ["schedule_direct_3d_cuda", [1, 64, 32, 32, 32], [64, 64, 3, 3, 3], [1, 1, 1], [1, 1, 1], 1], {"i": 2797089595, "t": "", "c": null, "e": [["tile_f", "sp", [-1, 2, 2, 4]], ["tile_d", "sp", [-1, 1, 1, 2]], ["tile_y", "sp", [-1, 1, 4, 1]], ["tile_x", "sp", [-1, 2, 8, 2]], ["tile_rc", "sp", [-1, 1]], ["tile_rd", "sp", [-1, 3]], ["tile_ry", "sp", [-1, 3]], ["tile_rx", "sp", [-1, 1]], ["auto_unroll_max_step", "ot", 0], ["unroll_explicit", "ot", 1]]}], "r": [[0.00214001025, 0.002162415], 0, 1.338848352432251, 1578524997.0420866], "v": 0.1}
{"i": ["cuda", "schedule_direct_3d_cuda", [[1, 64, 32, 32, 32], [64, 64, 3, 3, 3], [1, 1, 1], [1, 1, 1], 1], {}, ["schedule_direct_3d_cuda", [1, 64, 32, 32, 32], [64, 64, 3, 3, 3], [1, 1, 1], [1, 1, 1], 1], {"i": 1144996014, "t": "", "c": null, "e": [["tile_f", "sp", [-1, 2, 2, 16]], ["tile_d", "sp", [-1, 1, 1, 1]], ["tile_y", "sp", [-1, 1, 8, 2]], ["tile_x", "sp", [-1, 2, 8, 2]], ["tile_rc", "sp", [-1, 1]], ["tile_rd", "sp", [-1, 3]], ["tile_ry", "sp", [-1, 3]], ["tile_rx", "sp", [-1, 1]], ["auto_unroll_max_step", "ot", 512], ["unroll_explicit", "ot", 0]]}], "r": [[0.0089422275, 0.00895482575], 0, 1.783478021621704, 1578524998.0389028], "v": 0.1}
{"i": ["cuda", "schedule_direct_3d_cuda", [[1, 64, 32, 32, 32], [64, 64, 3, 3, 3], [1, 1, 1], [1, 1, 1], 1], {}, ["schedule_direct_3d_cuda", [1, 64, 32, 32, 32], [64, 64, 3, 3, 3], [1, 1, 1], [1, 1, 1], 1], {"i": 1864040045, "t": "", "c": null, "e": [["tile_f", "sp", [-1, 1, 2, 16]], ["tile_d", "sp", [-1, 1, 1, 1]], ["tile_y", "sp", [-1, 1, 4, 1]], ["tile_x", "sp", [-1, 1, 32, 1]], ["tile_rc", "sp", [-1, 1]], ["tile_rd", "sp", [-1, 1]], ["tile_ry", "sp", [-1, 3]], ["tile_rx", "sp", [-1, 1]], ["auto_unroll_max_step", "ot", 1500], ["unroll_explicit", "ot", 0]]}], "r": [[0.002676923, 0.00266917075], 0, 1.3836042881011963, 1578524998.781215], "v": 0.1}
{"i": ["cuda", "schedule_direct_3d_cuda", [[1, 64, 32, 32, 32], [64, 64, 3, 3, 3], [1, 1, 1], [1, 1, 1], 1], {}, ["schedule_direct_3d_cuda", [1, 64, 32, 32, 32], [64, 64, 3, 3, 3], [1, 1, 1], [1, 1, 1], 1], {"i": 329615802, "t": "", "c": null, "e": [["tile_f", "sp", [-1, 1, 2, 4]], ["tile_d", "sp", [-1, 1, 1, 2]], ["tile_y", "sp", [-1, 1, 8, 1]], ["tile_x", "sp", [-1, 2, 16, 1]], ["tile_rc", "sp", [-1, 2]], ["tile_rd", "sp", [-1, 3]], ["tile_ry", "sp", [-1, 3]], ["tile_rx", "sp", [-1, 1]], ["auto_unroll_max_step", "ot", 0], ["unroll_explicit", "ot", 0]]}], "r": [[0.00161124825, 0.0016095245], 0, 1.409430742263794, 1578525003.3376682], "v": 0.1}
{"i": ["cuda", "schedule_direct_3d_cuda", [[1, 64, 32, 32, 32], [64, 64, 3, 3, 3], [1, 1, 1], [1, 1, 1], 1], {}, ["schedule_direct_3d_cuda", [1, 64, 32, 32, 32], [64, 64, 3, 3, 3], [1, 1, 1], [1, 1, 1], 1], {"i": 1971253698, "t": "", "c": null, "e": [["tile_f", "sp", [-1, 2, 2, 16]], ["tile_d", "sp", [-1, 2, 1, 1]], ["tile_y", "sp", [-1, 1, 4, 1]], ["tile_x", "sp", [-1, 1, 16, 2]], ["tile_rc", "sp", [-1, 1]], ["tile_rd", "sp", [-1, 3]], ["tile_ry", "sp", [-1, 3]], ["tile_rx", "sp", [-1, 1]], ["auto_unroll_max_step", "ot", 1500], ["unroll_explicit", "ot", 0]]}], "r": [[0.003947482, 0.003947029], 0, 2.066864252090454, 1578525004.5197995], "v": 0.1}
{"i": ["cuda", "schedule_direct_3d_cuda", [[1, 64, 32, 32, 32], [64, 64, 3, 3, 3], [1, 1, 1], [1, 1, 1], 1], {}, ["schedule_direct_3d_cuda", [1, 64, 32, 32, 32], [64, 64, 3, 3, 3], [1, 1, 1], [1, 1, 1], 1], {"i": 4449640685, "t": "", "c": null, "e": [["tile_f", "sp", [-1, 1, 2, 16]], ["tile_d", "sp", [-1, 1, 1, 1]], ["tile_y", "sp", [-1, 2, 4, 2]], ["tile_x", "sp", [-1, 1, 16, 2]], ["tile_rc", "sp", [-1, 1]], ["tile_rd", "sp", [-1, 3]], ["tile_ry", "sp", [-1, 3]], ["tile_rx", "sp", [-1, 1]], ["auto_unroll_max_step", "ot", 1500], ["unroll_explicit", "ot", 1]]}], "r": [[0.004684272, 0.00468992675], 0, 3.54453706741333, 1578525005.6840131], "v": 0.1}
{"i": ["cuda", "schedule_direct_3d_cuda", [[1, 64, 32, 32, 32], [64, 64, 3, 3, 3], [1, 1, 1], [1, 1, 1], 1], {}, ["schedule_direct_3d_cuda", [1, 64, 32, 32, 32], [64, 64, 3, 3, 3], [1, 1, 1], [1, 1, 1], 1], {"i": 4242758757, "t": "", "c": null, "e": [["tile_f", "sp", [-1, 2, 2, 8]], ["tile_d", "sp", [-1, 1, 1, 1]], ["tile_y", "sp", [-1, 1, 4, 1]], ["tile_x", "sp", [-1, 2, 8, 2]], ["tile_rc", "sp", [-1, 1]], ["tile_rd", "sp", [-1, 3]], ["tile_ry", "sp", [-1, 1]], ["tile_rx", "sp", [-1, 1]], ["auto_unroll_max_step", "ot", 1500], ["unroll_explicit", "ot", 1]]}], "r": [[0.00226826575, 0.002273763], 0, 2.1436336040496826, 1578525006.5890317], "v": 0.1}
{"i": ["cuda", "schedule_direct_3d_cuda", [[1, 64, 32, 32, 32], [64, 64, 3, 3, 3], [1, 1, 1], [1, 1, 1], 1], {}, ["schedule_direct_3d_cuda", [1, 64, 32, 32, 32], [64, 64, 3, 3, 3], [1, 1, 1], [1, 1, 1], 1], {"i": 4449546690, "t": "", "c": null, "e": [["tile_f", "sp", [-1, 2, 2, 16]], ["tile_d", "sp", [-1, 2, 1, 1]], ["tile_y", "sp", [-1, 1, 4, 1]], ["tile_x", "sp", [-1, 1, 16, 2]], ["tile_rc", "sp", [-1, 1]], ["tile_rd", "sp", [-1, 3]], ["tile_ry", "sp", [-1, 3]], ["tile_rx", "sp", [-1, 1]], ["auto_unroll_max_step", "ot", 1500], ["unroll_explicit", "ot", 1]]}], "r": [[0.0047667315, 0.00477109625], 0, 3.545680046081543, 1578525007.7741811], "v": 0.1}
{"i": ["cuda", "schedule_direct_3d_cuda", [[1, 64, 32, 32, 32], [64, 64, 3, 3, 3], [1, 1, 1], [1, 1, 1], 1], {}, ["schedule_direct_3d_cuda", [1, 64, 32, 32, 32], [64, 64, 3, 3, 3], [1, 1, 1], [1, 1, 1], 1], {"i": 2797384197, "t": "", "c": null, "e": [["tile_f", "sp", [-1, 2, 2, 8]], ["tile_d", "sp", [-1, 1, 1, 1]], ["tile_y", "sp", [-1, 1, 16, 1]], ["tile_x", "sp", [-1, 1, 16, 2]], ["tile_rc", "sp", [-1, 1]], ["tile_rd", "sp", [-1, 3]], ["tile_ry", "sp", [-1, 3]], ["tile_rx", "sp", [-1, 1]], ["auto_unroll_max_step", "ot", 0], ["unroll_explicit", "ot", 1]]}], "r": [[0.0023088595, 0.002305397], 0, 1.149308204650879, 1578525008.4019845], "v": 0.1}
{"i": ["cuda", "schedule_direct_3d_cuda", [[1, 64, 32, 32, 32], [64, 64, 3, 3, 3], [1, 1, 1], [1, 1, 1], 1], {}, ["schedule_direct_3d_cuda", [1, 64, 32, 32, 32], [64, 64, 3, 3, 3], [1, 1, 1], [1, 1, 1], 1], {"i": 4449567269, "t": "", "c": null, "e": [["tile_f", "sp", [-1, 1, 2, 16]], ["tile_d", "sp", [-1, 2, 1, 2]], ["tile_y", "sp", [-1, 1, 8, 1]], ["tile_x", "sp", [-1, 1, 16, 2]], ["tile_rc", "sp", [-1, 1]], ["tile_rd", "sp", [-1, 3]], ["tile_ry", "sp", [-1, 3]], ["tile_rx", "sp", [-1, 1]], ["auto_unroll_max_step", "ot", 1500], ["unroll_explicit", "ot", 1]]}], "r": [[0.00433309925, 0.00433050325], 0, 3.534799814224243, 1578525010.2836645], "v": 0.1}
{"i": ["cuda", "schedule_direct_3d_cuda", [[1, 64, 32, 32, 32], [64, 64, 3, 3, 3], [1, 1, 1], [1, 1, 1], 1], {}, ["schedule_direct_3d_cuda", [1, 64, 32, 32, 32], [64, 64, 3, 3, 3], [1, 1, 1], [1, 1, 1], 1], {"i": 3619238839, "t": "", "c": null, "e": [["tile_f", "sp", [-1, 2, 2, 4]], ["tile_d", "sp", [-1, 1, 1, 1]], ["tile_y", "sp", [-1, 2, 4, 1]], ["tile_x", "sp", [-1, 2, 16, 1]], ["tile_rc", "sp", [-1, 1]], ["tile_rd", "sp", [-1, 3]], ["tile_ry", "sp", [-1, 3]], ["tile_rx", "sp", [-1, 1]], ["auto_unroll_max_step", "ot", 512], ["unroll_explicit", "ot", 1]]}], "r": [[0.00229532225, 0.0022891015], 0, 1.8516209125518799, 1578525011.0569723], "v": 0.1}
{"i": ["cuda", "schedule_direct_3d_cuda", [[1, 64, 32, 32, 32], [64, 64, 3, 3, 3], [1, 1, 1], [1, 1, 1], 1], {}, ["schedule_direct_3d_cuda", [1, 64, 32, 32, 32], [64, 64, 3, 3, 3], [1, 1, 1], [1, 1, 1], 1], {"i": 3619240630, "t": "", "c": null, "e": [["tile_f", "sp", [-1, 1, 2, 32]], ["tile_d", "sp", [-1, 1, 1, 2]], ["tile_y", "sp", [-1, 2, 4, 1]], ["tile_x", "sp", [-1, 2, 16, 1]], ["tile_rc", "sp", [-1, 1]], ["tile_rd", "sp", [-1, 3]], ["tile_ry", "sp", [-1, 3]], ["tile_rx", "sp", [-1, 1]], ["auto_unroll_max_step", "ot", 512], ["unroll_explicit", "ot", 1]]}], "r": [[0.0066488585, 0.006640062], 0, 2.3052358627319336, 1578525011.9947686], "v": 0.1}
{"i": ["cuda", "schedule_direct_3d_cuda", [[1, 64, 32, 32, 32], [64, 64, 3, 3, 3], [1, 1, 1], [1, 1, 1], 1], {}, ["schedule_direct_3d_cuda", [1, 64, 32, 32, 32], [64, 64, 3, 3, 3], [1, 1, 1], [1, 1, 1], 1], {"i": 4243022274, "t": "", "c": null, "e": [["tile_f", "sp", [-1, 2, 2, 16]], ["tile_d", "sp", [-1, 2, 1, 1]], ["tile_y", "sp", [-1, 1, 4, 1]], ["tile_x", "sp", [-1, 1, 16, 2]], ["tile_rc", "sp", [-1, 1]], ["tile_rd", "sp", [-1, 3]], ["tile_ry", "sp", [-1, 1]], ["tile_rx", "sp", [-1, 1]], ["auto_unroll_max_step", "ot", 1500], ["unroll_explicit", "ot", 1]]}], "r": [[0.00414151875, 0.004139202], 0, 3.2579753398895264, 1578525013.1474018], "v": 0.1}
{"i": ["cuda", "schedule_direct_3d_cuda", [[1, 64, 32, 32, 32], [64, 64, 3, 3, 3], [1, 1, 1], [1, 1, 1], 1], {}, ["schedule_direct_3d_cuda", [1, 64, 32, 32, 32], [64, 64, 3, 3, 3], [1, 1, 1], [1, 1, 1], 1], {"i": 4356294570, "t": "", "c": null, "e": [["tile_f", "sp", [-1, 1, 2, 4]], ["tile_d", "sp", [-1, 2, 1, 1]], ["tile_y", "sp", [-1, 1, 4, 1]], ["tile_x", "sp", [-1, 4, 8, 1]], ["tile_rc", "sp", [-1, 2]], ["tile_rd", "sp", [-1, 1]], ["tile_ry", "sp", [-1, 3]], ["tile_rx", "sp", [-1, 1]], ["auto_unroll_max_step", "ot", 1500], ["unroll_explicit", "ot", 1]]}], "r": [[0.0043752565, 0.00436196575], 0, 2.3499977588653564, 1578525014.1236103], "v": 0.1}
{"i": ["cuda", "schedule_direct_3d_cuda", [[1, 64, 32, 32, 32], [64, 64, 3, 3, 3], [1, 1, 1], [1, 1, 1], 1], {}, ["schedule_direct_3d_cuda", [1, 64, 32, 32, 32], [64, 64, 3, 3, 3], [1, 1, 1], [1, 1, 1], 1], {"i": 4464298510, "t": "", "c": null, "e": [["tile_f", "sp", [-1, 4, 2, 8]], ["tile_d", "sp", [-1, 4, 1, 1]], ["tile_y", "sp", [-1, 1, 4, 1]], ["tile_x", "sp", [-1, 1, 16, 2]], ["tile_rc", "sp", [-1, 2]], ["tile_rd", "sp", [-1, 3]], ["tile_ry", "sp", [-1, 3]], ["tile_rx", "sp", [-1, 1]], ["auto_unroll_max_step", "ot", 1500], ["unroll_explicit", "ot", 1]]}], "r": [[0.01885498425, 0.01872032475], 0, 3.7097389698028564, 1578525019.3171659], "v": 0.1}
{"i": ["cuda", "schedule_direct_3d_cuda", [[1, 64, 32, 32, 32], [64, 64, 3, 3, 3], [1, 1, 1], [1, 1, 1], 1], {}, ["schedule_direct_3d_cuda", [1, 64, 32, 32, 32], [64, 64, 3, 3, 3], [1, 1, 1], [1, 1, 1], 1], {"i": 1967325764, "t": "", "c": null, "e": [["tile_f", "sp", [-1, 1, 2, 8]], ["tile_d", "sp", [-1, 1, 1, 1]], ["tile_y", "sp", [-1, 2, 8, 1]], ["tile_x", "sp", [-1, 1, 32, 1]], ["tile_rc", "sp", [-1, 1]], ["tile_rd", "sp", [-1, 3]], ["tile_ry", "sp", [-1, 3]], ["tile_rx", "sp", [-1, 1]], ["auto_unroll_max_step", "ot", 1500], ["unroll_explicit", "ot", 0]]}], "r": [[0.002736151, 0.002732725], 0, 1.2955756187438965, 1578525020.0737298], "v": 0.1}
{"i": ["cuda", "schedule_direct_3d_cuda", [[1, 64, 32, 32, 32], [64, 64, 3, 3, 3], [1, 1, 1], [1, 1, 1], 1], {}, ["schedule_direct_3d_cuda", [1, 64, 32, 32, 32], [64, 64, 3, 3, 3], [1, 1, 1], [1, 1, 1], 1], {"i": 4342333037, "t": "", "c": null, "e": [["tile_f", "sp", [-1, 1, 2, 16]], ["tile_d", "sp", [-1, 1, 1, 1]], ["tile_y", "sp", [-1, 1, 4, 1]], ["tile_x", "sp", [-1, 1, 32, 1]], ["tile_rc", "sp", [-1, 1]], ["tile_rd", "sp", [-1, 1]], ["tile_ry", "sp", [-1, 3]], ["tile_rx", "sp", [-1, 1]], ["auto_unroll_max_step", "ot", 1500], ["unroll_explicit", "ot", 1]]}], "r": [[0.00227680325, 0.00227466525], 0, 1.8097562789916992, 1578525020.8380973], "v": 0.1}
{"i": ["cuda", "schedule_direct_3d_cuda", [[1, 64, 32, 32, 32], [64, 64, 3, 3, 3], [1, 1, 1], [1, 1, 1], 1], {}, ["schedule_direct_3d_cuda", [1, 64, 32, 32, 32], [64, 64, 3, 3, 3], [1, 1, 1], [1, 1, 1], 1], {"i": 4452204342, "t": "", "c": null, "e": [["tile_f", "sp", [-1, 1, 2, 4]], ["tile_d", "sp", [-1, 1, 1, 1]], ["tile_y", "sp", [-1, 2, 8, 1]], ["tile_x", "sp", [-1, 1, 8, 4]], ["tile_rc", "sp", [-1, 1]], ["tile_rd", "sp", [-1, 3]], ["tile_ry", "sp", [-1, 3]], ["tile_rx", "sp", [-1, 1]], ["auto_unroll_max_step", "ot", 1500], ["unroll_explicit", "ot", 1]]}], "r": [[0.0025734635, 0.002573346], 0, 2.6703240871429443, 1578525021.69917], "v": 0.1}
{"i": ["cuda", "schedule_direct_3d_cuda", [[1, 64, 32, 32, 32], [64, 64, 3, 3, 3], [1, 1, 1], [1, 1, 1], 1], {}, ["schedule_direct_3d_cuda", [1, 64, 32, 32, 32], [64, 64, 3, 3, 3], [1, 1, 1], [1, 1, 1], 1], {"i": 2704099257, "t": "", "c": null, "e": [["tile_f", "sp", [-1, 2, 2, 8]], ["tile_d", "sp", [-1, 2, 1, 1]], ["tile_y", "sp", [-1, 1, 4, 1]], ["tile_x", "sp", [-1, 4, 8, 1]], ["tile_rc", "sp", [-1, 2]], ["tile_rd", "sp", [-1, 1]], ["tile_ry", "sp", [-1, 3]], ["tile_rx", "sp", [-1, 1]], ["auto_unroll_max_step", "ot", 0], ["unroll_explicit", "ot", 1]]}], "r": [[0.0024974485, 0.00249733825], 0, 1.5504982471466064, 1578525022.435047], "v": 0.1}
{"i": ["cuda", "schedule_direct_3d_cuda", [[1, 64, 32, 32, 32], [64, 64, 3, 3, 3], [1, 1, 1], [1, 1, 1], 1], {}, ["schedule_direct_3d_cuda", [1, 64, 32, 32, 32], [64, 64, 3, 3, 3], [1, 1, 1], [1, 1, 1], 1], {"i": 1971274255, "t": "", "c": null, "e": [["tile_f", "sp", [-1, 2, 2, 4]], ["tile_d", "sp", [-1, 2, 1, 2]], ["tile_y", "sp", [-1, 1, 8, 1]], ["tile_x", "sp", [-1, 1, 16, 2]], ["tile_rc", "sp", [-1, 1]], ["tile_rd", "sp", [-1, 3]], ["tile_ry", "sp", [-1, 3]], ["tile_rx", "sp", [-1, 1]], ["auto_unroll_max_step", "ot", 1500], ["unroll_explicit", "ot", 0]]}], "r": [[0.0025595445, 0.0025537975], 0, 1.6842224597930908, 1578525024.1713479], "v": 0.1}
{"i": ["cuda", "schedule_direct_3d_cuda", [[1, 64, 32, 32, 32], [64, 64, 3, 3, 3], [1, 1, 1], [1, 1, 1], 1], {}, ["schedule_direct_3d_cuda", [1, 64, 32, 32, 32], [64, 64, 3, 3, 3], [1, 1, 1], [1, 1, 1], 1], {"i": 1141212295, "t": "", "c": null, "e": [["tile_f", "sp", [-1, 2, 2, 4]], ["tile_d", "sp", [-1, 1, 1, 4]], ["tile_y", "sp", [-1, 2, 4, 1]], ["tile_x", "sp", [-1, 1, 32, 1]], ["tile_rc", "sp", [-1, 1]], ["tile_rd", "sp", [-1, 3]], ["tile_ry", "sp", [-1, 3]], ["tile_rx", "sp", [-1, 1]], ["auto_unroll_max_step", "ot", 512], ["unroll_explicit", "ot", 0]]}], "r": [[0.00185017525, 0.00175309975], 0, 1.481184959411621, 1578525024.8926911], "v": 0.1}
{"i": ["cuda", "schedule_direct_3d_cuda", [[1, 64, 32, 32, 32], [64, 64, 3, 3, 3], [1, 1, 1], [1, 1, 1], 1], {}, ["schedule_direct_3d_cuda", [1, 64, 32, 32, 32], [64, 64, 3, 3, 3], [1, 1, 1], [1, 1, 1], 1], {"i": 2704099242, "t": "", "c": null, "e": [["tile_f", "sp", [-1, 1, 2, 4]], ["tile_d", "sp", [-1, 2, 1, 1]], ["tile_y", "sp", [-1, 1, 4, 1]], ["tile_x", "sp", [-1, 4, 8, 1]], ["tile_rc", "sp", [-1, 2]], ["tile_rd", "sp", [-1, 1]], ["tile_ry", "sp", [-1, 3]], ["tile_rx", "sp", [-1, 1]], ["auto_unroll_max_step", "ot", 0], ["unroll_explicit", "ot", 1]]}], "r": [[0.004633984, 0.00454171], 0, 1.392693281173706, 1578525025.6197147], "v": 0.1}
{"i": ["cuda", "schedule_direct_3d_cuda", [[1, 64, 32, 32, 32], [64, 64, 3, 3, 3], [1, 1, 1], [1, 1, 1], 1], {}, ["schedule_direct_3d_cuda", [1, 64, 32, 32, 32], [64, 64, 3, 3, 3], [1, 1, 1], [1, 1, 1], 1], {"i": 2812103182, "t": "", "c": null, "e": [["tile_f", "sp", [-1, 4, 2, 8]], ["tile_d", "sp", [-1, 4, 1, 1]], ["tile_y", "sp", [-1, 1, 4, 1]], ["tile_x", "sp", [-1, 1, 16, 2]], ["tile_rc", "sp", [-1, 2]], ["tile_rd", "sp", [-1, 3]], ["tile_ry", "sp", [-1, 3]], ["tile_rx", "sp", [-1, 1]], ["auto_unroll_max_step", "ot", 0], ["unroll_explicit", "ot", 1]]}], "r": [[0.01837303375, 0.018319608], 0, 2.1530351638793945, 1578525026.8620386], "v": 0.1}
{"i": ["cuda", "schedule_direct_3d_cuda", [[1, 64, 32, 32, 32], [64, 64, 3, 3, 3], [1, 1, 1], [1, 1, 1], 1], {}, ["schedule_direct_3d_cuda", [1, 64, 32, 32, 32], [64, 64, 3, 3, 3], [1, 1, 1], [1, 1, 1], 1], {"i": 2793138235, "t": "", "c": null, "e": [["tile_f", "sp", [-1, 2, 2, 4]], ["tile_d", "sp", [-1, 1, 1, 2]], ["tile_y", "sp", [-1, 1, 4, 1]], ["tile_x", "sp", [-1, 2, 16, 1]], ["tile_rc", "sp", [-1, 1]], ["tile_rd", "sp", [-1, 3]], ["tile_ry", "sp", [-1, 3]], ["tile_rx", "sp", [-1, 1]], ["auto_unroll_max_step", "ot", 0], ["unroll_explicit", "ot", 1]]}], "r": [[0.001387911, 0.00138751425], 0, 1.3784432411193848, 1578525027.6170967], "v": 0.1}
{"i": ["cuda", "schedule_direct_3d_cuda", [[1, 64, 32, 32, 32], [64, 64, 3, 3, 3], [1, 1, 1], [1, 1, 1], 1], {}, ["schedule_direct_3d_cuda", [1, 64, 32, 32, 32], [64, 64, 3, 3, 3], [1, 1, 1], [1, 1, 1], 1], {"i": 4361036202, "t": "", "c": null, "e": [["tile_f", "sp", [-1, 1, 2, 4]], ["tile_d", "sp", [-1, 2, 1, 1]], ["tile_y", "sp", [-1, 1, 4, 1]], ["tile_x", "sp", [-1, 1, 16, 2]], ["tile_rc", "sp", [-1, 2]], ["tile_rd", "sp", [-1, 1]], ["tile_ry", "sp", [-1, 3]], ["tile_rx", "sp", [-1, 1]], ["auto_unroll_max_step", "ot", 1500], ["unroll_explicit", "ot", 1]]}], "r": [[0.00190392975, 0.00188140975], 0, 2.6724250316619873, 1578525032.0776312], "v": 0.1}
{"i": ["cuda", "schedule_direct_3d_cuda", [[1, 64, 32, 32, 32], [64, 64, 3, 3, 3], [1, 1, 1], [1, 1, 1], 1], {}, ["schedule_direct_3d_cuda", [1, 64, 32, 32, 32], [64, 64, 3, 3, 3], [1, 1, 1], [1, 1, 1], 1], {"i": 4445604644, "t": "", "c": null, "e": [["tile_f", "sp", [-1, 1, 2, 8]], ["tile_d", "sp", [-1, 1, 1, 1]], ["tile_y", "sp", [-1, 4, 4, 1]], ["tile_x", "sp", [-1, 1, 32, 1]], ["tile_rc", "sp", [-1, 1]], ["tile_rd", "sp", [-1, 3]], ["tile_ry", "sp", [-1, 3]], ["tile_rx", "sp", [-1, 1]], ["auto_unroll_max_step", "ot", 1500], ["unroll_explicit", "ot", 1]]}], "r": [[0.00346711525, 0.00346676875], 0, 2.4393365383148193, 1578525032.896302], "v": 0.1}
{"i": ["cuda", "schedule_direct_3d_cuda", [[1, 64, 32, 32, 32], [64, 64, 3, 3, 3], [1, 1, 1], [1, 1, 1], 1], {}, ["schedule_direct_3d_cuda", [1, 64, 32, 32, 32], [64, 64, 3, 3, 3], [1, 1, 1], [1, 1, 1], 1], {"i": 3619505287, "t": "", "c": null, "e": [["tile_f", "sp", [-1, 2, 2, 4]], ["tile_d", "sp", [-1, 1, 1, 4]], ["tile_y", "sp", [-1, 2, 4, 1]], ["tile_x", "sp", [-1, 1, 32, 1]], ["tile_rc", "sp", [-1, 1]], ["tile_rd", "sp", [-1, 3]], ["tile_ry", "sp", [-1, 3]], ["tile_rx", "sp", [-1, 1]], ["auto_unroll_max_step", "ot", 512], ["unroll_explicit", "ot", 1]]}], "r": [[0.00228933425, 0.00232747125], 0, 1.634716510772705, 1578525033.6322484], "v": 0.1}
{"i": ["cuda", "schedule_direct_3d_cuda", [[1, 64, 32, 32, 32], [64, 64, 3, 3, 3], [1, 1, 1], [1, 1, 1], 1], {}, ["schedule_direct_3d_cuda", [1, 64, 32, 32, 32], [64, 64, 3, 3, 3], [1, 1, 1], [1, 1, 1], 1], {"i": 4460365889, "t": "", "c": null, "e": [["tile_f", "sp", [-1, 1, 2, 16]], ["tile_d", "sp", [-1, 2, 1, 1]], ["tile_y", "sp", [-1, 1, 8, 1]], ["tile_x", "sp", [-1, 1, 32, 1]], ["tile_rc", "sp", [-1, 2]], ["tile_rd", "sp", [-1, 3]], ["tile_ry", "sp", [-1, 3]], ["tile_rx", "sp", [-1, 1]], ["auto_unroll_max_step", "ot", 1500], ["unroll_explicit", "ot", 1]]}], "r": [[0.00163492975, 0.001634231], 0, 2.054910659790039, 1578525034.4667873], "v": 0.1}
{"i": ["cuda", "schedule_direct_3d_cuda", [[1, 64, 32, 32, 32], [64, 64, 3, 3, 3], [1, 1, 1], [1, 1, 1], 1], {}, ["schedule_direct_3d_cuda", [1, 64, 32, 32, 32], [64, 64, 3, 3, 3], [1, 1, 1], [1, 1, 1], 1], {"i": 2797191342, "t": "", "c": null, "e": [["tile_f", "sp", [-1, 2, 2, 16]], ["tile_d", "sp", [-1, 1, 1, 1]], ["tile_y", "sp", [-1, 1, 8, 2]], ["tile_x", "sp", [-1, 2, 8, 2]], ["tile_rc", "sp", [-1, 1]], ["tile_rd", "sp", [-1, 3]], ["tile_ry", "sp", [-1, 3]], ["tile_rx", "sp", [-1, 1]], ["auto_unroll_max_step", "ot", 0], ["unroll_explicit", "ot", 1]]}], "r": [[0.0790936195, 0.07985682425], 0, 2.808469295501709, 1578525036.2131345], "v": 0.1}
{"i": ["cuda", "schedule_direct_3d_cuda", [[1, 64, 32, 32, 32], [64, 64, 3, 3, 3], [1, 1, 1], [1, 1, 1], 1], {}, ["schedule_direct_3d_cuda", [1, 64, 32, 32, 32], [64, 64, 3, 3, 3], [1, 1, 1], [1, 1, 1], 1], {"i": 2800009014, "t": "", "c": null, "e": [["tile_f", "sp", [-1, 1, 2, 4]], ["tile_d", "sp", [-1, 1, 1, 1]], ["tile_y", "sp", [-1, 2, 8, 1]], ["tile_x", "sp", [-1, 1, 8, 4]], ["tile_rc", "sp", [-1, 1]], ["tile_rd", "sp", [-1, 3]], ["tile_ry", "sp", [-1, 3]], ["tile_rx", "sp", [-1, 1]], ["auto_unroll_max_step", "ot", 0], ["unroll_explicit", "ot", 1]]}], "r": [[0.003330779, 0.00334328425], 0, 1.2623541355133057, 1578525036.9108424], "v": 0.1}
{"i": ["cuda", "schedule_direct_3d_cuda", [[1, 64, 32, 32, 32], [64, 64, 3, 3, 3], [1, 1, 1], [1, 1, 1], 1], {}, ["schedule_direct_3d_cuda", [1, 64, 32, 32, 32], [64, 64, 3, 3, 3], [1, 1, 1], [1, 1, 1], 1], {"i": 4445338294, "t": "", "c": null, "e": [["tile_f", "sp", [-1, 1, 2, 32]], ["tile_d", "sp", [-1, 1, 1, 2]], ["tile_y", "sp", [-1, 2, 4, 1]], ["tile_x", "sp", [-1, 2, 16, 1]], ["tile_rc", "sp", [-1, 1]], ["tile_rd", "sp", [-1, 3]], ["tile_ry", "sp", [-1, 3]], ["tile_rx", "sp", [-1, 1]], ["auto_unroll_max_step", "ot", 1500], ["unroll_explicit", "ot", 1]]}], "r": [[0.006948226, 0.006970761], 0, 3.2673325538635254, 1578525037.8809645], "v": 0.1}
{"i": ["cuda", "schedule_direct_3d_cuda", [[1, 64, 32, 32, 32], [64, 64, 3, 3, 3], [1, 1, 1], [1, 1, 1], 1], {}, ["schedule_direct_3d_cuda", [1, 64, 32, 32, 32], [64, 64, 3, 3, 3], [1, 1, 1], [1, 1, 1], 1], {"i": 4449284923, "t": "", "c": null, "e": [["tile_f", "sp", [-1, 2, 2, 4]], ["tile_d", "sp", [-1, 1, 1, 2]], ["tile_y", "sp", [-1, 1, 4, 1]], ["tile_x", "sp", [-1, 2, 8, 2]], ["tile_rc", "sp", [-1, 1]], ["tile_rd", "sp", [-1, 3]], ["tile_ry", "sp", [-1, 3]], ["tile_rx", "sp", [-1, 1]], ["auto_unroll_max_step", "ot", 1500], ["unroll_explicit", "ot", 1]]}], "r": [[0.00220874775, 0.00219823675], 0, 2.860095739364624, 1578525039.1916335], "v": 0.1}
{"i": ["cuda", "schedule_direct_3d_cuda", [[1, 64, 32, 32, 32], [64, 64, 3, 3, 3], [1, 1, 1], [1, 1, 1], 1], {}, ["schedule_direct_3d_cuda", [1, 64, 32, 32, 32], [64, 64, 3, 3, 3], [1, 1, 1], [1, 1, 1], 1], {"i": 3619506980, "t": "", "c": null, "e": [["tile_f", "sp", [-1, 1, 2, 8]], ["tile_d", "sp", [-1, 1, 1, 1]], ["tile_y", "sp", [-1, 4, 4, 1]], ["tile_x", "sp", [-1, 1, 32, 1]], ["tile_rc", "sp", [-1, 1]], ["tile_rd", "sp", [-1, 3]], ["tile_ry", "sp", [-1, 3]], ["tile_rx", "sp", [-1, 1]], ["auto_unroll_max_step", "ot", 512], ["unroll_explicit", "ot", 1]]}], "r": [[0.00181126575, 0.00180660975], 0, 1.8028240203857422, 1578525040.0346806], "v": 0.1}
{"i": ["cuda", "schedule_direct_3d_cuda", [[1, 64, 32, 32, 32], [64, 64, 3, 3, 3], [1, 1, 1], [1, 1, 1], 1], {}, ["schedule_direct_3d_cuda", [1, 64, 32, 32, 32], [64, 64, 3, 3, 3], [1, 1, 1], [1, 1, 1], 1], {"i": 4150296924, "t": "", "c": null, "e": [["tile_f", "sp", [-1, 4, 4, 4]], ["tile_d", "sp", [-1, 1, 1, 1]], ["tile_y", "sp", [-1, 1, 4, 1]], ["tile_x", "sp", [-1, 2, 16, 1]], ["tile_rc", "sp", [-1, 2]], ["tile_rd", "sp", [-1, 1]], ["tile_ry", "sp", [-1, 1]], ["tile_rx", "sp", [-1, 1]], ["auto_unroll_max_step", "ot", 1500], ["unroll_explicit", "ot", 1]]}], "r": [[0.00157229875, 0.00157084425], 0, 2.0365405082702637, 1578525040.8995407], "v": 0.1}
{"i": ["cuda", "schedule_direct_3d_cuda", [[1, 64, 32, 32, 32], [64, 64, 3, 3, 3], [1, 1, 1], [1, 1, 1], 1], {}, ["schedule_direct_3d_cuda", [1, 64, 32, 32, 32], [64, 64, 3, 3, 3], [1, 1, 1], [1, 1, 1], 1], {"i": 4238282399, "t": "", "c": null, "e": [["tile_f", "sp", [-1, 1, 4, 8]], ["tile_d", "sp", [-1, 2, 1, 2]], ["tile_y", "sp", [-1, 1, 4, 1]], ["tile_x", "sp", [-1, 4, 8, 1]], ["tile_rc", "sp", [-1, 1]], ["tile_rd", "sp", [-1, 3]], ["tile_ry", "sp", [-1, 1]], ["tile_rx", "sp", [-1, 1]], ["auto_unroll_max_step", "ot", 1500], ["unroll_explicit", "ot", 1]]}], "r": [[0.00235102275, 0.0023508415], 0, 3.0235612392425537, 1578525041.8306756], "v": 0.1}
{"i": ["cuda", "schedule_direct_3d_cuda", [[1, 64, 32, 32, 32], [64, 64, 3, 3, 3], [1, 1, 1], [1, 1, 1], 1], {}, ["schedule_direct_3d_cuda", [1, 64, 32, 32, 32], [64, 64, 3, 3, 3], [1, 1, 1], [1, 1, 1], 1], {"i": 4363679772, "t": "", "c": null, "e": [["tile_f", "sp", [-1, 4, 4, 4]], ["tile_d", "sp", [-1, 1, 1, 1]], ["tile_y", "sp", [-1, 4, 4, 1]], ["tile_x", "sp", [-1, 1, 8, 4]], ["tile_rc", "sp", [-1, 2]], ["tile_rd", "sp", [-1, 1]], ["tile_ry", "sp", [-1, 3]], ["tile_rx", "sp", [-1, 1]], ["auto_unroll_max_step", "ot", 1500], ["unroll_explicit", "ot", 1]]}], "r": [[0.00834344975, 0.008340514], 0, 2.8605360984802246, 1578525042.8050563], "v": 0.1}
{"i": ["cuda", "schedule_direct_3d_cuda", [[1, 64, 32, 32, 32], [64, 64, 3, 3, 3], [1, 1, 1], [1, 1, 1], 1], {}, ["schedule_direct_3d_cuda", [1, 64, 32, 32, 32], [64, 64, 3, 3, 3], [1, 1, 1], [1, 1, 1], 1], {"i": 329865118, "t": "", "c": null, "e": [["tile_f", "sp", [-1, 1, 4, 4]], ["tile_d", "sp", [-1, 1, 1, 2]], ["tile_y", "sp", [-1, 2, 4, 1]], ["tile_x", "sp", [-1, 1, 32, 1]], ["tile_rc", "sp", [-1, 2]], ["tile_rd", "sp", [-1, 3]], ["tile_ry", "sp", [-1, 3]], ["tile_rx", "sp", [-1, 1]], ["auto_unroll_max_step", "ot", 0], ["unroll_explicit", "ot", 0]]}], "r": [[0.00208891075, 0.002091515], 0, 1.130068302154541, 1578525274.026331], "v": 0.1}
{"i": ["cuda", "schedule_direct_3d_cuda", [[1, 64, 32, 32, 32], [64, 64, 3, 3, 3], [1, 1, 1], [1, 1, 1], 1], {}, ["schedule_direct_3d_cuda", [1, 64, 32, 32, 32], [64, 64, 3, 3, 3], [1, 1, 1], [1, 1, 1], 1], {"i": 329949790, "t": "", "c": null, "e": [["tile_f", "sp", [-1, 1, 4, 4]], ["tile_d", "sp", [-1, 1, 1, 2]], ["tile_y", "sp", [-1, 1, 4, 2]], ["tile_x", "sp", [-1, 1, 32, 1]], ["tile_rc", "sp", [-1, 2]], ["tile_rd", "sp", [-1, 3]], ["tile_ry", "sp", [-1, 3]], ["tile_rx", "sp", [-1, 1]], ["auto_unroll_max_step", "ot", 0], ["unroll_explicit", "ot", 0]]}], "r": [[0.001923986, 0.00191948625], 0, 1.0982081890106201, 1578525274.635492], "v": 0.1}
{"i": ["cuda", "schedule_direct_3d_cuda", [[1, 64, 32, 32, 32], [64, 64, 3, 3, 3], [1, 1, 1], [1, 1, 1], 1], {}, ["schedule_direct_3d_cuda", [1, 64, 32, 32, 32], [64, 64, 3, 3, 3], [1, 1, 1], [1, 1, 1], 1], {"i": 329879240, "t": "", "c": null, "e": [["tile_f", "sp", [-1, 1, 2, 8]], ["tile_d", "sp", [-1, 1, 1, 2]], ["tile_y", "sp", [-1, 1, 8, 1]], ["tile_x", "sp", [-1, 1, 32, 1]], ["tile_rc", "sp", [-1, 2]], ["tile_rd", "sp", [-1, 3]], ["tile_ry", "sp", [-1, 3]], ["tile_rx", "sp", [-1, 1]], ["auto_unroll_max_step", "ot", 0], ["unroll_explicit", "ot", 0]]}], "r": [[0.00223354975, 0.00223330175], 0, 1.161719560623169, 1578525275.308255], "v": 0.1}
{"i": ["cuda", "schedule_direct_3d_cuda", [[1, 64, 32, 32, 32], [64, 64, 3, 3, 3], [1, 1, 1], [1, 1, 1], 1], {}, ["schedule_direct_3d_cuda", [1, 64, 32, 32, 32], [64, 64, 3, 3, 3], [1, 1, 1], [1, 1, 1], 1], {"i": 2808172232, "t": "", "c": null, "e": [["tile_f", "sp", [-1, 1, 2, 8]], ["tile_d", "sp", [-1, 1, 1, 2]], ["tile_y", "sp", [-1, 1, 8, 1]], ["tile_x", "sp", [-1, 1, 32, 1]], ["tile_rc", "sp", [-1, 2]], ["tile_rd", "sp", [-1, 3]], ["tile_ry", "sp", [-1, 3]], ["tile_rx", "sp", [-1, 1]], ["auto_unroll_max_step", "ot", 0], ["unroll_explicit", "ot", 1]]}], "r": [[0.00223454, 0.00223111775], 0, 1.071153163909912, 1578525275.8776796], "v": 0.1}
{"i": ["cuda", "schedule_direct_3d_cuda", [[1, 64, 32, 32, 32], [64, 64, 3, 3, 3], [1, 1, 1], [1, 1, 1], 1], {}, ["schedule_direct_3d_cuda", [1, 64, 32, 32, 32], [64, 64, 3, 3, 3], [1, 1, 1], [1, 1, 1], 1], {"i": 1145156012, "t": "", "c": null, "e": [["tile_f", "sp", [-1, 4, 2, 4]], ["tile_d", "sp", [-1, 2, 1, 1]], ["tile_y", "sp", [-1, 1, 4, 1]], ["tile_x", "sp", [-1, 1, 16, 2]], ["tile_rc", "sp", [-1, 1]], ["tile_rd", "sp", [-1, 3]], ["tile_ry", "sp", [-1, 3]], ["tile_rx", "sp", [-1, 1]], ["auto_unroll_max_step", "ot", 512], ["unroll_explicit", "ot", 0]]}], "r": [[0.001430389, 0.001452499], 0, 1.2254302501678467, 1578525276.566557], "v": 0.1}
{"i": ["cuda", "schedule_direct_3d_cuda", [[1, 64, 32, 32, 32], [64, 64, 3, 3, 3], [1, 1, 1], [1, 1, 1], 1], {}, ["schedule_direct_3d_cuda", [1, 64, 32, 32, 32], [64, 64, 3, 3, 3], [1, 1, 1], [1, 1, 1], 1], {"i": 1141184071, "t": "", "c": null, "e": [["tile_f", "sp", [-1, 2, 2, 4]], ["tile_d", "sp", [-1, 1, 1, 4]], ["tile_y", "sp", [-1, 1, 2, 1]], ["tile_x", "sp", [-1, 1, 32, 1]], ["tile_rc", "sp", [-1, 1]], ["tile_rd", "sp", [-1, 3]], ["tile_ry", "sp", [-1, 3]], ["tile_rx", "sp", [-1, 1]], ["auto_unroll_max_step", "ot", 512], ["unroll_explicit", "ot", 0]]}], "r": [[0.00155726325, 0.001558586], 0, 1.2648773193359375, 1578525277.2635908], "v": 0.1}
{"i": ["cuda", "schedule_direct_3d_cuda", [[1, 64, 32, 32, 32], [64, 64, 3, 3, 3], [1, 1, 1], [1, 1, 1], 1], {}, ["schedule_direct_3d_cuda", [1, 64, 32, 32, 32], [64, 64, 3, 3, 3], [1, 1, 1], [1, 1, 1], 1], {"i": 2808158110, "t": "", "c": null, "e": [["tile_f", "sp", [-1, 1, 4, 4]], ["tile_d", "sp", [-1, 1, 1, 2]], ["tile_y", "sp", [-1, 2, 4, 1]], ["tile_x", "sp", [-1, 1, 32, 1]], ["tile_rc", "sp", [-1, 2]], ["tile_rd", "sp", [-1, 3]], ["tile_ry", "sp", [-1, 3]], ["tile_rx", "sp", [-1, 1]], ["auto_unroll_max_step", "ot", 0], ["unroll_explicit", "ot", 1]]}], "r": [[0.002089556, 0.00209302825], 0, 1.0885136127471924, 1578525277.8413155], "v": 0.1}
{"i": ["cuda", "schedule_direct_3d_cuda", [[1, 64, 32, 32, 32], [64, 64, 3, 3, 3], [1, 1, 1], [1, 1, 1], 1], {}, ["schedule_direct_3d_cuda", [1, 64, 32, 32, 32], [64, 64, 3, 3, 3], [1, 1, 1], [1, 1, 1], 1], {"i": 1248394713, "t": "", "c": null, "e": [["tile_f", "sp", [-1, 2, 2, 8]], ["tile_d", "sp", [-1, 2, 1, 1]], ["tile_y", "sp", [-1, 1, 2, 1]], ["tile_x", "sp", [-1, 1, 16, 2]], ["tile_rc", "sp", [-1, 1]], ["tile_rd", "sp", [-1, 1]], ["tile_ry", "sp", [-1, 1]], ["tile_rx", "sp", [-1, 3]], ["auto_unroll_max_step", "ot", 512], ["unroll_explicit", "ot", 0]]}], "r": [[0.002971108, 0.00297759575], 0, 1.326655626296997, 1578525278.5736005], "v": 0.1}
{"i": ["cuda", "schedule_direct_3d_cuda", [[1, 64, 32, 32, 32], [64, 64, 3, 3, 3], [1, 1, 1], [1, 1, 1], 1], {}, ["schedule_direct_3d_cuda", [1, 64, 32, 32, 32], [64, 64, 3, 3, 3], [1, 1, 1], [1, 1, 1], 1], {"i": 1145156011, "t": "", "c": null, "e": [["tile_f", "sp", [-1, 2, 2, 4]], ["tile_d", "sp", [-1, 2, 1, 1]], ["tile_y", "sp", [-1, 1, 4, 1]], ["tile_x", "sp", [-1, 1, 16, 2]], ["tile_rc", "sp", [-1, 1]], ["tile_rd", "sp", [-1, 3]], ["tile_ry", "sp", [-1, 3]], ["tile_rx", "sp", [-1, 1]], ["auto_unroll_max_step", "ot", 512], ["unroll_explicit", "ot", 0]]}], "r": [[0.0016604175, 0.0016580545], 0, 1.261547565460205, 1578525279.270292], "v": 0.1}
{"i": ["cuda", "schedule_direct_3d_cuda", [[1, 64, 32, 32, 32], [64, 64, 3, 3, 3], [1, 1, 1], [1, 1, 1], 1], {}, ["schedule_direct_3d_cuda", [1, 64, 32, 32, 32], [64, 64, 3, 3, 3], [1, 1, 1], [1, 1, 1], 1], {"i": 2808242782, "t": "", "c": null, "e": [["tile_f", "sp", [-1, 1, 4, 4]], ["tile_d", "sp", [-1, 1, 1, 2]], ["tile_y", "sp", [-1, 1, 4, 2]], ["tile_x", "sp", [-1, 1, 32, 1]], ["tile_rc", "sp", [-1, 2]], ["tile_rd", "sp", [-1, 3]], ["tile_ry", "sp", [-1, 3]], ["tile_rx", "sp", [-1, 1]], ["auto_unroll_max_step", "ot", 0], ["unroll_explicit", "ot", 1]]}], "r": [[0.0019237125, 0.00192259325], 0, 1.0869274139404297, 1578525279.8452585], "v": 0.1}
{"i": ["cuda", "schedule_direct_3d_cuda", [[1, 64, 32, 32, 32], [64, 64, 3, 3, 3], [1, 1, 1], [1, 1, 1], 1], {}, ["schedule_direct_3d_cuda", [1, 64, 32, 32, 32], [64, 64, 3, 3, 3], [1, 1, 1], [1, 1, 1], 1], {"i": 315086407, "t": "", "c": null, "e": [["tile_f", "sp", [-1, 2, 2, 4]], ["tile_d", "sp", [-1, 1, 1, 4]], ["tile_y", "sp", [-1, 1, 2, 1]], ["tile_x", "sp", [-1, 1, 32, 1]], ["tile_rc", "sp", [-1, 1]], ["tile_rd", "sp", [-1, 3]], ["tile_ry", "sp", [-1, 3]], ["tile_rx", "sp", [-1, 1]], ["auto_unroll_max_step", "ot", 0], ["unroll_explicit", "ot", 0]]}], "r": [[0.0015569805, 0.00155743175], 0, 1.1156868934631348, 1578525280.512615], "v": 0.1}
{"i": ["cuda", "schedule_direct_3d_cuda", [[1, 64, 32, 32, 32], [64, 64, 3, 3, 3], [1, 1, 1], [1, 1, 1], 1], {}, ["schedule_direct_3d_cuda", [1, 64, 32, 32, 32], [64, 64, 3, 3, 3], [1, 1, 1], [1, 1, 1], 1], {"i": 1145135434, "t": "", "c": null, "e": [["tile_f", "sp", [-1, 1, 4, 4]], ["tile_d", "sp", [-1, 1, 1, 4]], ["tile_y", "sp", [-1, 1, 2, 1]], ["tile_x", "sp", [-1, 1, 16, 2]], ["tile_rc", "sp", [-1, 1]], ["tile_rd", "sp", [-1, 3]], ["tile_ry", "sp", [-1, 3]], ["tile_rx", "sp", [-1, 1]], ["auto_unroll_max_step", "ot", 512], ["unroll_explicit", "ot", 0]]}], "r": [[0.0015320835, 0.00152854875], 0, 1.1385796070098877, 1578525281.2089136], "v": 0.1}
{"i": ["cuda", "schedule_direct_3d_cuda", [[1, 64, 32, 32, 32], [64, 64, 3, 3, 3], [1, 1, 1], [1, 1, 1], 1], {}, ["schedule_direct_3d_cuda", [1, 64, 32, 32, 32], [64, 64, 3, 3, 3], [1, 1, 1], [1, 1, 1], 1], {"i": 1248399333, "t": "", "c": null, "e": [["tile_f", "sp", [-1, 2, 2, 8]], ["tile_d", "sp", [-1, 1, 1, 1]], ["tile_y", "sp", [-1, 2, 2, 1]], ["tile_x", "sp", [-1, 1, 16, 2]], ["tile_rc", "sp", [-1, 1]], ["tile_rd", "sp", [-1, 1]], ["tile_ry", "sp", [-1, 1]], ["tile_rx", "sp", [-1, 3]], ["auto_unroll_max_step", "ot", 512], ["unroll_explicit", "ot", 0]]}], "r": [[0.002892696, 0.00288865425], 0, 1.193375825881958, 1578525283.483186], "v": 0.1}
{"i": ["cuda", "schedule_direct_3d_cuda", [[1, 64, 32, 32, 32], [64, 64, 3, 3, 3], [1, 1, 1], [1, 1, 1], 1], {}, ["schedule_direct_3d_cuda", [1, 64, 32, 32, 32], [64, 64, 3, 3, 3], [1, 1, 1], [1, 1, 1], 1], {"i": 1140942912, "t": "", "c": null, "e": [["tile_f", "sp", [-1, 4, 4, 4]], ["tile_d", "sp", [-1, 1, 1, 2]], ["tile_y", "sp", [-1, 1, 4, 1]], ["tile_x", "sp", [-1, 2, 16, 1]], ["tile_rc", "sp", [-1, 1]], ["tile_rd", "sp", [-1, 3]], ["tile_ry", "sp", [-1, 3]], ["tile_rx", "sp", [-1, 1]], ["auto_unroll_max_step", "ot", 512], ["unroll_explicit", "ot", 0]]}], "r": [[0.00159534875, 0.00155091075], 0, 1.144611120223999, 1578525284.7082946], "v": 0.1}
{"i": ["cuda", "schedule_direct_3d_cuda", [[1, 64, 32, 32, 32], [64, 64, 3, 3, 3], [1, 1, 1], [1, 1, 1], 1], {}, ["schedule_direct_3d_cuda", [1, 64, 32, 32, 32], [64, 64, 3, 3, 3], [1, 1, 1], [1, 1, 1], 1], {"i": 1156047454, "t": "", "c": null, "e": [["tile_f", "sp", [-1, 1, 4, 4]], ["tile_d", "sp", [-1, 1, 1, 2]], ["tile_y", "sp", [-1, 1, 4, 2]], ["tile_x", "sp", [-1, 1, 32, 1]], ["tile_rc", "sp", [-1, 2]], ["tile_rd", "sp", [-1, 3]], ["tile_ry", "sp", [-1, 3]], ["tile_rx", "sp", [-1, 1]], ["auto_unroll_max_step", "ot", 512], ["unroll_explicit", "ot", 0]]}], "r": [[0.00141685875, 0.0014172525], 0, 1.1639032363891602, 1578525285.9341638], "v": 0.1}
{"i": ["cuda", "schedule_direct_3d_cuda", [[1, 64, 32, 32, 32], [64, 64, 3, 3, 3], [1, 1, 1], [1, 1, 1], 1], {}, ["schedule_direct_3d_cuda", [1, 64, 32, 32, 32], [64, 64, 3, 3, 3], [1, 1, 1], [1, 1, 1], 1], {"i": 422301669, "t": "", "c": null, "e": [["tile_f", "sp", [-1, 2, 2, 8]], ["tile_d", "sp", [-1, 1, 1, 1]], ["tile_y", "sp", [-1, 2, 2, 1]], ["tile_x", "sp", [-1, 1, 16, 2]], ["tile_rc", "sp", [-1, 1]], ["tile_rd", "sp", [-1, 1]], ["tile_ry", "sp", [-1, 1]], ["tile_rx", "sp", [-1, 3]], ["auto_unroll_max_step", "ot", 0], ["unroll_explicit", "ot", 0]]}], "r": [[0.00288222075, 0.002851149], 0, 1.2924294471740723, 1578525286.8653018], "v": 0.1}
{"i": ["cuda", "schedule_direct_3d_cuda", [[1, 64, 32, 32, 32], [64, 64, 3, 3, 3], [1, 1, 1], [1, 1, 1], 1], {}, ["schedule_direct_3d_cuda", [1, 64, 32, 32, 32], [64, 64, 3, 3, 3], [1, 1, 1], [1, 1, 1], 1], {"i": 112510434, "t": "", "c": null, "e": [["tile_f", "sp", [-1, 2, 2, 16]], ["tile_d", "sp", [-1, 2, 1, 1]], ["tile_y", "sp", [-1, 1, 2, 1]], ["tile_x", "sp", [-1, 1, 16, 2]], ["tile_rc", "sp", [-1, 1]], ["tile_rd", "sp", [-1, 3]], ["tile_ry", "sp", [-1, 1]], ["tile_rx", "sp", [-1, 1]], ["auto_unroll_max_step", "ot", 0], ["unroll_explicit", "ot", 0]]}], "r": [[0.001837989, 0.001841341], 0, 1.196796178817749, 1578525287.515194], "v": 0.1}
{"i": ["cuda", "schedule_direct_3d_cuda", [[1, 64, 32, 32, 32], [64, 64, 3, 3, 3], [1, 1, 1], [1, 1, 1], 1], {}, ["schedule_direct_3d_cuda", [1, 64, 32, 32, 32], [64, 64, 3, 3, 3], [1, 1, 1], [1, 1, 1], 1], {"i": 1140942915, "t": "", "c": null, "e": [["tile_f", "sp", [-1, 1, 16, 4]], ["tile_d", "sp", [-1, 1, 1, 2]], ["tile_y", "sp", [-1, 1, 4, 1]], ["tile_x", "sp", [-1, 2, 16, 1]], ["tile_rc", "sp", [-1, 1]], ["tile_rd", "sp", [-1, 3]], ["tile_ry", "sp", [-1, 3]], ["tile_rx", "sp", [-1, 1]], ["auto_unroll_max_step", "ot", 512], ["unroll_explicit", "ot", 0]]}], "r": [[0.00207628025, 0.00207537725], 0, 1.1642675399780273, 1578525288.1777065], "v": 0.1}
{"i": ["cuda", "schedule_direct_3d_cuda", [[1, 64, 32, 32, 32], [64, 64, 3, 3, 3], [1, 1, 1], [1, 1, 1], 1], {}, ["schedule_direct_3d_cuda", [1, 64, 32, 32, 32], [64, 64, 3, 3, 3], [1, 1, 1], [1, 1, 1], 1], {"i": 315179235, "t": "", "c": null, "e": [["tile_f", "sp", [-1, 1, 16, 4]], ["tile_d", "sp", [-1, 1, 1, 2]], ["tile_y", "sp", [-1, 1, 2, 2]], ["tile_x", "sp", [-1, 1, 32, 1]], ["tile_rc", "sp", [-1, 1]], ["tile_rd", "sp", [-1, 3]], ["tile_ry", "sp", [-1, 3]], ["tile_rx", "sp", [-1, 1]], ["auto_unroll_max_step", "ot", 0], ["unroll_explicit", "ot", 0]]}], "r": [[0.00177750375, 0.00177625875], 0, 1.0351166725158691, 1578525288.9775698], "v": 0.1}
{"i": ["cuda", "schedule_direct_3d_cuda", [[1, 64, 32, 32, 32], [64, 64, 3, 3, 3], [1, 1, 1], [1, 1, 1], 1], {}, ["schedule_direct_3d_cuda", [1, 64, 32, 32, 32], [64, 64, 3, 3, 3], [1, 1, 1], [1, 1, 1], 1], {"i": 1141276899, "t": "", "c": null, "e": [["tile_f", "sp", [-1, 1, 16, 4]], ["tile_d", "sp", [-1, 1, 1, 2]], ["tile_y", "sp", [-1, 1, 2, 2]], ["tile_x", "sp", [-1, 1, 32, 1]], ["tile_rc", "sp", [-1, 1]], ["tile_rd", "sp", [-1, 3]], ["tile_ry", "sp", [-1, 3]], ["tile_rx", "sp", [-1, 1]], ["auto_unroll_max_step", "ot", 512], ["unroll_explicit", "ot", 0]]}], "r": [[0.0016840805, 0.0016825195], 0, 1.0709598064422607, 1578525289.6316977], "v": 0.1}
{"i": ["cuda", "schedule_direct_3d_cuda", [[1, 64, 32, 32, 32], [64, 64, 3, 3, 3], [1, 1, 1], [1, 1, 1], 1], {}, ["schedule_direct_3d_cuda", [1, 64, 32, 32, 32], [64, 64, 3, 3, 3], [1, 1, 1], [1, 1, 1], 1], {"i": 314845251, "t": "", "c": null, "e": [["tile_f", "sp", [-1, 1, 16, 4]], ["tile_d", "sp", [-1, 1, 1, 2]], ["tile_y", "sp", [-1, 1, 4, 1]], ["tile_x", "sp", [-1, 2, 16, 1]], ["tile_rc", "sp", [-1, 1]], ["tile_rd", "sp", [-1, 3]], ["tile_ry", "sp", [-1, 3]], ["tile_rx", "sp", [-1, 1]], ["auto_unroll_max_step", "ot", 0], ["unroll_explicit", "ot", 0]]}], "r": [[0.0021908915, 0.002189953], 0, 1.046553134918213, 1578525291.9519932], "v": 0.1}
{"i": ["cuda", "schedule_direct_3d_cuda", [[1, 64, 32, 32, 32], [64, 64, 3, 3, 3], [1, 1, 1], [1, 1, 1], 1], {}, ["schedule_direct_3d_cuda", [1, 64, 32, 32, 32], [64, 64, 3, 3, 3], [1, 1, 1], [1, 1, 1], 1], {"i": 211792955, "t": "", "c": null, "e": [["tile_f", "sp", [-1, 2, 4, 4]], ["tile_d", "sp", [-1, 1, 1, 1]], ["tile_y", "sp", [-1, 1, 1, 1]], ["tile_x", "sp", [-1, 1, 32, 1]], ["tile_rc", "sp", [-1, 1]], ["tile_rd", "sp", [-1, 1]], ["tile_ry", "sp", [-1, 3]], ["tile_rx", "sp", [-1, 1]], ["auto_unroll_max_step", "ot", 0], ["unroll_explicit", "ot", 0]]}], "r": [[0.00386623325, 0.003869891], 0, 1.0071899890899658, 1578525292.550467], "v": 0.1}
{"i": ["cuda", "schedule_direct_3d_cuda", [[1, 64, 32, 32, 32], [64, 64, 3, 3, 3], [1, 1, 1], [1, 1, 1], 1], {}, ["schedule_direct_3d_cuda", [1, 64, 32, 32, 32], [64, 64, 3, 3, 3], [1, 1, 1], [1, 1, 1], 1], {"i": 108532524, "t": "", "c": null, "e": [["tile_f", "sp", [-1, 2, 4, 8]], ["tile_d", "sp", [-1, 1, 1, 2]], ["tile_y", "sp", [-1, 1, 1, 1]], ["tile_x", "sp", [-1, 1, 32, 1]], ["tile_rc", "sp", [-1, 1]], ["tile_rd", "sp", [-1, 3]], ["tile_ry", "sp", [-1, 1]], ["tile_rx", "sp", [-1, 1]], ["auto_unroll_max_step", "ot", 0], ["unroll_explicit", "ot", 0]]}], "r": [[0.00148149975, 0.001477013], 0, 1.1539008617401123, 1578525293.2210548], "v": 0.1}
{"i": ["cuda", "schedule_direct_3d_cuda", [[1, 64, 32, 32, 32], [64, 64, 3, 3, 3], [1, 1, 1], [1, 1, 1], 1], {}, ["schedule_direct_3d_cuda", [1, 64, 32, 32, 32], [64, 64, 3, 3, 3], [1, 1, 1], [1, 1, 1], 1], {"i": 333816478, "t": "", "c": null, "e": [["tile_f", "sp", [-1, 1, 4, 4]], ["tile_d", "sp", [-1, 1, 1, 2]], ["tile_y", "sp", [-1, 2, 4, 1]], ["tile_x", "sp", [-1, 1, 16, 2]], ["tile_rc", "sp", [-1, 2]], ["tile_rd", "sp", [-1, 3]], ["tile_ry", "sp", [-1, 3]], ["tile_rx", "sp", [-1, 1]], ["auto_unroll_max_step", "ot", 0], ["unroll_explicit", "ot", 0]]}], "r": [[0.001481266, 0.00148000575], 0, 1.1860394477844238, 1578525293.8631625], "v": 0.1}
{"i": ["cuda", "schedule_direct_3d_cuda", [[1, 64, 32, 32, 32], [64, 64, 3, 3, 3], [1, 1, 1], [1, 1, 1], 1], {}, ["schedule_direct_3d_cuda", [1, 64, 32, 32, 32], [64, 64, 3, 3, 3], [1, 1, 1], [1, 1, 1], 1], {"i": 1037890619, "t": "", "c": null, "e": [["tile_f", "sp", [-1, 2, 4, 4]], ["tile_d", "sp", [-1, 1, 1, 1]], ["tile_y", "sp", [-1, 1, 1, 1]], ["tile_x", "sp", [-1, 1, 32, 1]], ["tile_rc", "sp", [-1, 1]], ["tile_rd", "sp", [-1, 1]], ["tile_ry", "sp", [-1, 3]], ["tile_rx", "sp", [-1, 1]], ["auto_unroll_max_step", "ot", 512], ["unroll_explicit", "ot", 0]]}], "r": [[0.003714403, 0.00371202], 0, 1.134913444519043, 1578525294.4992468], "v": 0.1}
{"i": ["cuda", "schedule_direct_3d_cuda", [[1, 64, 32, 32, 32], [64, 64, 3, 3, 3], [1, 1, 1], [1, 1, 1], 1], {}, ["schedule_direct_3d_cuda", [1, 64, 32, 32, 32], [64, 64, 3, 3, 3], [1, 1, 1], [1, 1, 1], 1], {"i": 1145135435, "t": "", "c": null, "e": [["tile_f", "sp", [-1, 2, 4, 4]], ["tile_d", "sp", [-1, 1, 1, 4]], ["tile_y", "sp", [-1, 1, 2, 1]], ["tile_x", "sp", [-1, 1, 16, 2]], ["tile_rc", "sp", [-1, 1]], ["tile_rd", "sp", [-1, 3]], ["tile_ry", "sp", [-1, 3]], ["tile_rx", "sp", [-1, 1]], ["auto_unroll_max_step", "ot", 512], ["unroll_explicit", "ot", 0]]}], "r": [[0.00131021675, 0.0013125845], 0, 1.1488728523254395, 1578525295.136958], "v": 0.1}
{"i": ["cuda", "schedule_direct_3d_cuda", [[1, 64, 32, 32, 32], [64, 64, 3, 3, 3], [1, 1, 1], [1, 1, 1], 1], {}, ["schedule_direct_3d_cuda", [1, 64, 32, 32, 32], [64, 64, 3, 3, 3], [1, 1, 1], [1, 1, 1], 1], {"i": 1967281735, "t": "", "c": null, "e": [["tile_f", "sp", [-1, 2, 2, 4]], ["tile_d", "sp", [-1, 1, 1, 4]], ["tile_y", "sp", [-1, 1, 2, 1]], ["tile_x", "sp", [-1, 1, 32, 1]], ["tile_rc", "sp", [-1, 1]], ["tile_rd", "sp", [-1, 3]], ["tile_ry", "sp", [-1, 3]], ["tile_rx", "sp", [-1, 1]], ["auto_unroll_max_step", "ot", 1500], ["unroll_explicit", "ot", 0]]}], "r": [[0.00119573625, 0.00119745575], 0, 1.431305170059204, 1578525295.89133], "v": 0.1}
{"i": ["cuda", "schedule_direct_3d_cuda", [[1, 64, 32, 32, 32], [64, 64, 3, 3, 3], [1, 1, 1], [1, 1, 1], 1], {}, ["schedule_direct_3d_cuda", [1, 64, 32, 32, 32], [64, 64, 3, 3, 3], [1, 1, 1], [1, 1, 1], 1], {"i": 314845248, "t": "", "c": null, "e": [["tile_f", "sp", [-1, 4, 4, 4]], ["tile_d", "sp", [-1, 1, 1, 2]], ["tile_y", "sp", [-1, 1, 4, 1]], ["tile_x", "sp", [-1, 2, 16, 1]], ["tile_rc", "sp", [-1, 1]], ["tile_rd", "sp", [-1, 3]], ["tile_ry", "sp", [-1, 3]], ["tile_rx", "sp", [-1, 1]], ["auto_unroll_max_step", "ot", 0], ["unroll_explicit", "ot", 0]]}], "r": [[0.00159007675, 0.00158933475], 0, 1.1615989208221436, 1578525296.5120044], "v": 0.1}
{"i": ["cuda", "schedule_direct_3d_cuda", [[1, 64, 32, 32, 32], [64, 64, 3, 3, 3], [1, 1, 1], [1, 1, 1], 1], {}, ["schedule_direct_3d_cuda", [1, 64, 32, 32, 32], [64, 64, 3, 3, 3], [1, 1, 1], [1, 1, 1], 1], {"i": 108558982, "t": "", "c": null, "e": [["tile_f", "sp", [-1, 4, 2, 8]], ["tile_d", "sp", [-1, 1, 1, 1]], ["tile_y", "sp", [-1, 1, 2, 1]], ["tile_x", "sp", [-1, 1, 32, 1]], ["tile_rc", "sp", [-1, 1]], ["tile_rd", "sp", [-1, 3]], ["tile_ry", "sp", [-1, 1]], ["tile_rx", "sp", [-1, 1]], ["auto_unroll_max_step", "ot", 0], ["unroll_explicit", "ot", 0]]}], "r": [[0.00348201675, 0.0034766], 0, 1.2167978286743164, 1578525297.2105465], "v": 0.1}
{"i": ["cuda", "schedule_direct_3d_cuda", [[1, 64, 32, 32, 32], [64, 64, 3, 3, 3], [1, 1, 1], [1, 1, 1], 1], {}, ["schedule_direct_3d_cuda", [1, 64, 32, 32, 32], [64, 64, 3, 3, 3], [1, 1, 1], [1, 1, 1], 1], {"i": 319058348, "t": "", "c": null, "e": [["tile_f", "sp", [-1, 4, 2, 4]], ["tile_d", "sp", [-1, 2, 1, 1]], ["tile_y", "sp", [-1, 1, 4, 1]], ["tile_x", "sp", [-1, 1, 16, 2]], ["tile_rc", "sp", [-1, 1]], ["tile_rd", "sp", [-1, 3]], ["tile_ry", "sp", [-1, 3]], ["tile_rx", "sp", [-1, 1]], ["auto_unroll_max_step", "ot", 0], ["unroll_explicit", "ot", 0]]}], "r": [[0.00146002, 0.00145936325], 0, 1.1752681732177734, 1578525297.8420823], "v": 0.1}
{"i": ["cuda", "schedule_direct_3d_cuda", [[1, 64, 32, 32, 32], [64, 64, 3, 3, 3], [1, 1, 1], [1, 1, 1], 1], {}, ["schedule_direct_3d_cuda", [1, 64, 32, 32, 32], [64, 64, 3, 3, 3], [1, 1, 1], [1, 1, 1], 1], {"i": 1971233098, "t": "", "c": null, "e": [["tile_f", "sp", [-1, 1, 4, 4]], ["tile_d", "sp", [-1, 1, 1, 4]], ["tile_y", "sp", [-1, 1, 2, 1]], ["tile_x", "sp", [-1, 1, 16, 2]], ["tile_rc", "sp", [-1, 1]], ["tile_rd", "sp", [-1, 3]], ["tile_ry", "sp", [-1, 3]], ["tile_rx", "sp", [-1, 1]], ["auto_unroll_max_step", "ot", 1500], ["unroll_explicit", "ot", 0]]}], "r": [[0.0013711505, 0.0013690845], 0, 1.3111472129821777, 1578525298.5833225], "v": 0.1}
{"i": ["cuda", "schedule_direct_3d_cuda", [[1, 64, 32, 32, 32], [64, 64, 3, 3, 3], [1, 1, 1], [1, 1, 1], 1], {}, ["schedule_direct_3d_cuda", [1, 64, 32, 32, 32], [64, 64, 3, 3, 3], [1, 1, 1], [1, 1, 1], 1], {"i": 1155962782, "t": "", "c": null, "e": [["tile_f", "sp", [-1, 1, 4, 4]], ["tile_d", "sp", [-1, 1, 1, 2]], ["tile_y", "sp", [-1, 2, 4, 1]], ["tile_x", "sp", [-1, 1, 32, 1]], ["tile_rc", "sp", [-1, 2]], ["tile_rd", "sp", [-1, 3]], ["tile_ry", "sp", [-1, 3]], ["tile_rx", "sp", [-1, 1]], ["auto_unroll_max_step", "ot", 512], ["unroll_explicit", "ot", 0]]}], "r": [[0.00169834775, 0.001692949], 0, 1.0997538566589355, 1578525299.2795727], "v": 0.1}
{"i": ["cuda", "schedule_direct_3d_cuda", [[1, 64, 32, 32, 32], [64, 64, 3, 3, 3], [1, 1, 1], [1, 1, 1], 1], {}, ["schedule_direct_3d_cuda", [1, 64, 32, 32, 32], [64, 64, 3, 3, 3], [1, 1, 1], [1, 1, 1], 1], {"i": 1155976904, "t": "", "c": null, "e": [["tile_f", "sp", [-1, 1, 2, 8]], ["tile_d", "sp", [-1, 1, 1, 2]], ["tile_y", "sp", [-1, 1, 8, 1]], ["tile_x", "sp", [-1, 1, 32, 1]], ["tile_rc", "sp", [-1, 2]], ["tile_rd", "sp", [-1, 3]], ["tile_ry", "sp", [-1, 3]], ["tile_rx", "sp", [-1, 1]], ["auto_unroll_max_step", "ot", 512], ["unroll_explicit", "ot", 0]]}], "r": [[0.00187289925, 0.001864847], 0, 1.4239821434020996, 1578525301.7385297], "v": 0.1}
