auto_log/((1, 192, 8, 8, 8), (192, 192, 3, 3, 3), (1, 192, 8, 8, 8), (1, 1, 1), (1, 1, 1), 1, 1, None)_bwd_inp_grad.log
{"i": ["cuda", "schedule_conv3d_transpose_nchw_cuda", [[1, 192, 8, 8, 8], [192, 192, 3, 3, 3], [1, 1, 1], [1, 1, 1], [0, 0, 0], "float32"], {}, ["schedule_conv3d_transpose_nchw_cuda", [1, 192, 8, 8, 8], [192, 192, 3, 3, 3], [1, 1, 1], [1, 1, 1], [0, 0, 0], "float32"], {"i": 1661026156, "t": "", "c": null, "e": [["tile_f", "sp", [-1, 1, 48, 1]], ["tile_d", "sp", [-1, 1, 1, 2]], ["tile_y", "sp", [-1, 1, 1, 4]], ["tile_x", "sp", [-1, 1, 2, 4]], ["tile_rc", "sp", [-1, 2]], ["tile_rd", "sp", [-1, 1]], ["tile_ry", "sp", [-1, 1]], ["tile_rx", "sp", [-1, 3]], ["auto_unroll_max_step", "ot", 1500], ["unroll_explicit", "ot", 1]]}], "r": [[0.00112384375, 0.00112318775], 0, 1.5426580905914307, 1578562720.8930712], "v": 0.1}
{"i": ["cuda", "schedule_conv3d_transpose_nchw_cuda", [[1, 192, 8, 8, 8], [192, 192, 3, 3, 3], [1, 1, 1], [1, 1, 1], [0, 0, 0], "float32"], {}, ["schedule_conv3d_transpose_nchw_cuda", [1, 192, 8, 8, 8], [192, 192, 3, 3, 3], [1, 1, 1], [1, 1, 1], [0, 0, 0], "float32"], {"i": 728612668, "t": "", "c": null, "e": [["tile_f", "sp", [-1, 4, 3, 1]], ["tile_d", "sp", [-1, 1, 1, 2]], ["tile_y", "sp", [-1, 1, 2, 1]], ["tile_x", "sp", [-1, 2, 1, 1]], ["tile_rc", "sp", [-1, 8]], ["tile_rd", "sp", [-1, 3]], ["tile_ry", "sp", [-1, 3]], ["tile_rx", "sp", [-1, 1]], ["auto_unroll_max_step", "ot", 1500], ["unroll_explicit", "ot", 0]]}], "r": [[0.00865537075, 0.00866678475], 0, 2.704894781112671, 1578562722.2800717], "v": 0.1}
{"i": ["cuda", "schedule_conv3d_transpose_nchw_cuda", [[1, 192, 8, 8, 8], [192, 192, 3, 3, 3], [1, 1, 1], [1, 1, 1], [0, 0, 0], "float32"], {}, ["schedule_conv3d_transpose_nchw_cuda", [1, 192, 8, 8, 8], [192, 192, 3, 3, 3], [1, 1, 1], [1, 1, 1], [0, 0, 0], "float32"], {"i": 953608543, "t": "", "c": null, "e": [["tile_f", "sp", [-1, 8, 1, 6]], ["tile_d", "sp", [-1, 1, 1, 1]], ["tile_y", "sp", [-1, 4, 2, 1]], ["tile_x", "sp", [-1, 1, 4, 2]], ["tile_rc", "sp", [-1, 6]], ["tile_rd", "sp", [-1, 3]], ["tile_ry", "sp", [-1, 1]], ["tile_rx", "sp", [-1, 1]], ["auto_unroll_max_step", "ot", 0], ["unroll_explicit", "ot", 1]]}], "r": [[0.05097809175, 0.04580812325], 0, 2.0079264640808105, 1578562723.3704479], "v": 0.1}
{"i": ["cuda", "schedule_conv3d_transpose_nchw_cuda", [[1, 192, 8, 8, 8], [192, 192, 3, 3, 3], [1, 1, 1], [1, 1, 1], [0, 0, 0], "float32"], {}, ["schedule_conv3d_transpose_nchw_cuda", [1, 192, 8, 8, 8], [192, 192, 3, 3, 3], [1, 1, 1], [1, 1, 1], [0, 0, 0], "float32"], {"i": 303858979, "t": "", "c": null, "e": [["tile_f", "sp", [-1, 12, 16, 1]], ["tile_d", "sp", [-1, 4, 1, 1]], ["tile_y", "sp", [-1, 2, 1, 4]], ["tile_x", "sp", [-1, 1, 1, 1]], ["tile_rc", "sp", [-1, 2]], ["tile_rd", "sp", [-1, 1]], ["tile_ry", "sp", [-1, 1]], ["tile_rx", "sp", [-1, 1]], ["auto_unroll_max_step", "ot", 512], ["unroll_explicit", "ot", 0]]}], "r": [[0.04109578925, 0.04112498], 0, 2.614055633544922, 1578562724.863691], "v": 0.1}
{"i": ["cuda", "schedule_conv3d_transpose_nchw_cuda", [[1, 192, 8, 8, 8], [192, 192, 3, 3, 3], [1, 1, 1], [1, 1, 1], [0, 0, 0], "float32"], {}, ["schedule_conv3d_transpose_nchw_cuda", [1, 192, 8, 8, 8], [192, 192, 3, 3, 3], [1, 1, 1], [1, 1, 1], [0, 0, 0], "float32"], {"i": 1618861302, "t": "", "c": null, "e": [["tile_f", "sp", [-1, 1, 4, 4]], ["tile_d", "sp", [-1, 1, 1, 8]], ["tile_y", "sp", [-1, 2, 1, 1]], ["tile_x", "sp", [-1, 2, 2, 1]], ["tile_rc", "sp", [-1, 1]], ["tile_rd", "sp", [-1, 3]], ["tile_ry", "sp", [-1, 3]], ["tile_rx", "sp", [-1, 1]], ["auto_unroll_max_step", "ot", 1500], ["unroll_explicit", "ot", 1]]}], "r": [[0.00184767025, 0.0019658685], 0, 2.5421388149261475, 1578562725.6237726], "v": 0.1}
{"i": ["cuda", "schedule_conv3d_transpose_nchw_cuda", [[1, 192, 8, 8, 8], [192, 192, 3, 3, 3], [1, 1, 1], [1, 1, 1], [0, 0, 0], "float32"], {}, ["schedule_conv3d_transpose_nchw_cuda", [1, 192, 8, 8, 8], [192, 192, 3, 3, 3], [1, 1, 1], [1, 1, 1], [0, 0, 0], "float32"], {"i": 840380067, "t": "", "c": null, "e": [["tile_f", "sp", [-1, 3, 8, 1]], ["tile_d", "sp", [-1, 2, 1, 2]], ["tile_y", "sp", [-1, 1, 1, 4]], ["tile_x", "sp", [-1, 4, 1, 2]], ["tile_rc", "sp", [-1, 6]], ["tile_rd", "sp", [-1, 1]], ["tile_ry", "sp", [-1, 3]], ["tile_rx", "sp", [-1, 3]], ["auto_unroll_max_step", "ot", 1500], ["unroll_explicit", "ot", 0]]}], "r": [[0.01152710525, 0.011532796], 0, 3.637721538543701, 1578562727.724764], "v": 0.1}
{"i": ["cuda", "schedule_conv3d_transpose_nchw_cuda", [[1, 192, 8, 8, 8], [192, 192, 3, 3, 3], [1, 1, 1], [1, 1, 1], [0, 0, 0], "float32"], {}, ["schedule_conv3d_transpose_nchw_cuda", [1, 192, 8, 8, 8], [192, 192, 3, 3, 3], [1, 1, 1], [1, 1, 1], [0, 0, 0], "float32"], {"i": 1141491571, "t": "", "c": null, "e": [["tile_f", "sp", [-1, 4, 4, 2]], ["tile_d", "sp", [-1, 1, 1, 4]], ["tile_y", "sp", [-1, 1, 2, 1]], ["tile_x", "sp", [-1, 1, 2, 2]], ["tile_rc", "sp", [-1, 6]], ["tile_rd", "sp", [-1, 1]], ["tile_ry", "sp", [-1, 3]], ["tile_rx", "sp", [-1, 3]], ["auto_unroll_max_step", "ot", 0], ["unroll_explicit", "ot", 1]]}], "r": [[0.00095264675, 0.00095236975], 0, 1.1966543197631836, 1578562728.3944392], "v": 0.1}
{"i": ["cuda", "schedule_conv3d_transpose_nchw_cuda", [[1, 192, 8, 8, 8], [192, 192, 3, 3, 3], [1, 1, 1], [1, 1, 1], [0, 0, 0], "float32"], {}, ["schedule_conv3d_transpose_nchw_cuda", [1, 192, 8, 8, 8], [192, 192, 3, 3, 3], [1, 1, 1], [1, 1, 1], [0, 0, 0], "float32"], {"i": 342336010, "t": "", "c": null, "e": [["tile_f", "sp", [-1, 2, 12, 1]], ["tile_d", "sp", [-1, 2, 1, 4]], ["tile_y", "sp", [-1, 4, 1, 1]], ["tile_x", "sp", [-1, 1, 4, 1]], ["tile_rc", "sp", [-1, 2]], ["tile_rd", "sp", [-1, 3]], ["tile_ry", "sp", [-1, 1]], ["tile_rx", "sp", [-1, 1]], ["auto_unroll_max_step", "ot", 512], ["unroll_explicit", "ot", 0]]}], "r": [[0.0019171725, 0.00191845025], 0, 1.300769567489624, 1578562729.0956707], "v": 0.1}
{"i": ["cuda", "schedule_conv3d_transpose_nchw_cuda", [[1, 192, 8, 8, 8], [192, 192, 3, 3, 3], [1, 1, 1], [1, 1, 1], [0, 0, 0], "float32"], {}, ["schedule_conv3d_transpose_nchw_cuda", [1, 192, 8, 8, 8], [192, 192, 3, 3, 3], [1, 1, 1], [1, 1, 1], [0, 0, 0], "float32"], {"i": 686200550, "t": "", "c": null, "e": [["tile_f", "sp", [-1, 16, 1, 4]], ["tile_d", "sp", [-1, 8, 1, 1]], ["tile_y", "sp", [-1, 1, 2, 2]], ["tile_x", "sp", [-1, 2, 2, 1]], ["tile_rc", "sp", [-1, 4]], ["tile_rd", "sp", [-1, 1]], ["tile_ry", "sp", [-1, 3]], ["tile_rx", "sp", [-1, 1]], ["auto_unroll_max_step", "ot", 1500], ["unroll_explicit", "ot", 0]]}], "r": [[0.16707818475, 0.1670685835], 0, 6.861430406570435, 1578562743.7621632], "v": 0.1}
{"i": ["cuda", "schedule_conv3d_transpose_nchw_cuda", [[1, 192, 8, 8, 8], [192, 192, 3, 3, 3], [1, 1, 1], [1, 1, 1], [0, 0, 0], "float32"], {}, ["schedule_conv3d_transpose_nchw_cuda", [1, 192, 8, 8, 8], [192, 192, 3, 3, 3], [1, 1, 1], [1, 1, 1], [0, 0, 0], "float32"], {"i": 1379528650, "t": "", "c": null, "e": [["tile_f", "sp", [-1, 48, 1, 1]], ["tile_d", "sp", [-1, 1, 1, 1]], ["tile_y", "sp", [-1, 1, 4, 1]], ["tile_x", "sp", [-1, 1, 2, 1]], ["tile_rc", "sp", [-1, 32]], ["tile_rd", "sp", [-1, 1]], ["tile_ry", "sp", [-1, 1]], ["tile_rx", "sp", [-1, 3]], ["auto_unroll_max_step", "ot", 512], ["unroll_explicit", "ot", 1]]}], "r": [[0.00956977325, 0.00957177175], 0, 1.4227643013000488, 1578562748.084524], "v": 0.1}
{"i": ["cuda", "schedule_conv3d_transpose_nchw_cuda", [[1, 192, 8, 8, 8], [192, 192, 3, 3, 3], [1, 1, 1], [1, 1, 1], [0, 0, 0], "float32"], {}, ["schedule_conv3d_transpose_nchw_cuda", [1, 192, 8, 8, 8], [192, 192, 3, 3, 3], [1, 1, 1], [1, 1, 1], [0, 0, 0], "float32"], {"i": 1029495989, "t": "", "c": null, "e": [["tile_f", "sp", [-1, 6, 8, 1]], ["tile_d", "sp", [-1, 1, 1, 4]], ["tile_y", "sp", [-1, 1, 2, 4]], ["tile_x", "sp", [-1, 1, 1, 8]], ["tile_rc", "sp", [-1, 6]], ["tile_rd", "sp", [-1, 3]], ["tile_ry", "sp", [-1, 3]], ["tile_rx", "sp", [-1, 1]], ["auto_unroll_max_step", "ot", 0], ["unroll_explicit", "ot", 1]]}], "r": [[0.0631773175, 0.06318071775], 0, 2.218010425567627, 1578562750.148838], "v": 0.1}
{"i": ["cuda", "schedule_conv3d_transpose_nchw_cuda", [[1, 192, 8, 8, 8], [192, 192, 3, 3, 3], [1, 1, 1], [1, 1, 1], [0, 0, 0], "float32"], {}, ["schedule_conv3d_transpose_nchw_cuda", [1, 192, 8, 8, 8], [192, 192, 3, 3, 3], [1, 1, 1], [1, 1, 1], [0, 0, 0], "float32"], {"i": 724234887, "t": "", "c": null, "e": [["tile_f", "sp", [-1, 2, 2, 48]], ["tile_d", "sp", [-1, 1, 1, 1]], ["tile_y", "sp", [-1, 1, 2, 2]], ["tile_x", "sp", [-1, 2, 4, 1]], ["tile_rc", "sp", [-1, 4]], ["tile_rd", "sp", [-1, 3]], ["tile_ry", "sp", [-1, 3]], ["tile_rx", "sp", [-1, 1]], ["auto_unroll_max_step", "ot", 1500], ["unroll_explicit", "ot", 0]]}], "r": [[0.01944148925, 0.01943549975], 0, 3.6845924854278564, 1578562752.1825633], "v": 0.1}
{"i": ["cuda", "schedule_conv3d_transpose_nchw_cuda", [[1, 192, 8, 8, 8], [192, 192, 3, 3, 3], [1, 1, 1], [1, 1, 1], [0, 0, 0], "float32"], {}, ["schedule_conv3d_transpose_nchw_cuda", [1, 192, 8, 8, 8], [192, 192, 3, 3, 3], [1, 1, 1], [1, 1, 1], [0, 0, 0], "float32"], {"i": 1101378587, "t": "", "c": null, "e": [["tile_f", "sp", [-1, 2, 2, 3]], ["tile_d", "sp", [-1, 4, 1, 2]], ["tile_y", "sp", [-1, 1, 4, 2]], ["tile_x", "sp", [-1, 2, 2, 2]], ["tile_rc", "sp", [-1, 4]], ["tile_rd", "sp", [-1, 3]], ["tile_ry", "sp", [-1, 1]], ["tile_rx", "sp", [-1, 3]], ["auto_unroll_max_step", "ot", 0], ["unroll_explicit", "ot", 1]]}], "r": [[0.01590080675, 0.015903016], 0, 1.6862456798553467, 1578562773.5006173], "v": 0.1}
{"i": ["cuda", "schedule_conv3d_transpose_nchw_cuda", [[1, 192, 8, 8, 8], [192, 192, 3, 3, 3], [1, 1, 1], [1, 1, 1], [0, 0, 0], "float32"], {}, ["schedule_conv3d_transpose_nchw_cuda", [1, 192, 8, 8, 8], [192, 192, 3, 3, 3], [1, 1, 1], [1, 1, 1], [0, 0, 0], "float32"], {"i": 1208295211, "t": "", "c": null, "e": [["tile_f", "sp", [-1, 1, 8, 6]], ["tile_d", "sp", [-1, 1, 1, 4]], ["tile_y", "sp", [-1, 2, 2, 1]], ["tile_x", "sp", [-1, 1, 1, 2]], ["tile_rc", "sp", [-1, 2]], ["tile_rd", "sp", [-1, 1]], ["tile_ry", "sp", [-1, 1]], ["tile_rx", "sp", [-1, 1]], ["auto_unroll_max_step", "ot", 512], ["unroll_explicit", "ot", 1]]}], "r": [[0.001741412, 0.00174067875], 0, 1.2583582401275635, 1578562774.633013], "v": 0.1}
{"i": ["cuda", "schedule_conv3d_transpose_nchw_cuda", [[1, 192, 8, 8, 8], [192, 192, 3, 3, 3], [1, 1, 1], [1, 1, 1], [0, 0, 0], "float32"], {}, ["schedule_conv3d_transpose_nchw_cuda", [1, 192, 8, 8, 8], [192, 192, 3, 3, 3], [1, 1, 1], [1, 1, 1], [0, 0, 0], "float32"], {"i": 1062627127, "t": "", "c": null, "e": [["tile_f", "sp", [-1, 12, 1, 8]], ["tile_d", "sp", [-1, 1, 1, 1]], ["tile_y", "sp", [-1, 1, 8, 1]], ["tile_x", "sp", [-1, 4, 2, 1]], ["tile_rc", "sp", [-1, 4]], ["tile_rd", "sp", [-1, 1]], ["tile_ry", "sp", [-1, 1]], ["tile_rx", "sp", [-1, 3]], ["auto_unroll_max_step", "ot", 0], ["unroll_explicit", "ot", 1]]}], "r": [[0.0439367785, 0.04377090375], 0, 1.598886251449585, 1578562775.7115648], "v": 0.1}
{"i": ["cuda", "schedule_conv3d_transpose_nchw_cuda", [[1, 192, 8, 8, 8], [192, 192, 3, 3, 3], [1, 1, 1], [1, 1, 1], [0, 0, 0], "float32"], {}, ["schedule_conv3d_transpose_nchw_cuda", [1, 192, 8, 8, 8], [192, 192, 3, 3, 3], [1, 1, 1], [1, 1, 1], [0, 0, 0], "float32"], {"i": 1623747126, "t": "", "c": null, "e": [["tile_f", "sp", [-1, 8, 1, 8]], ["tile_d", "sp", [-1, 1, 1, 1]], ["tile_y", "sp", [-1, 1, 8, 1]], ["tile_x", "sp", [-1, 2, 1, 1]], ["tile_rc", "sp", [-1, 3]], ["tile_rd", "sp", [-1, 3]], ["tile_ry", "sp", [-1, 3]], ["tile_rx", "sp", [-1, 1]], ["auto_unroll_max_step", "ot", 1500], ["unroll_explicit", "ot", 1]]}], "r": [[0.0110262835, 0.01079973575], 0, 4.395077466964722, 1578562792.2963936], "v": 0.1}
{"i": ["cuda", "schedule_conv3d_transpose_nchw_cuda", [[1, 192, 8, 8, 8], [192, 192, 3, 3, 3], [1, 1, 1], [1, 1, 1], [0, 0, 0], "float32"], {}, ["schedule_conv3d_transpose_nchw_cuda", [1, 192, 8, 8, 8], [192, 192, 3, 3, 3], [1, 1, 1], [1, 1, 1], [0, 0, 0], "float32"], {"i": 54740357, "t": "", "c": null, "e": [["tile_f", "sp", [-1, 6, 1, 8]], ["tile_d", "sp", [-1, 2, 1, 4]], ["tile_y", "sp", [-1, 2, 2, 1]], ["tile_x", "sp", [-1, 1, 4, 1]], ["tile_rc", "sp", [-1, 12]], ["tile_rd", "sp", [-1, 3]], ["tile_ry", "sp", [-1, 1]], ["tile_rx", "sp", [-1, 1]], ["auto_unroll_max_step", "ot", 0], ["unroll_explicit", "ot", 0]]}], "r": [[0.0838788145, 0.08410122475], 0, 1.9305872917175293, 1578562801.4820383], "v": 0.1}
{"i": ["cuda", "schedule_conv3d_transpose_nchw_cuda", [[1, 192, 8, 8, 8], [192, 192, 3, 3, 3], [1, 1, 1], [1, 1, 1], [0, 0, 0], "float32"], {}, ["schedule_conv3d_transpose_nchw_cuda", [1, 192, 8, 8, 8], [192, 192, 3, 3, 3], [1, 1, 1], [1, 1, 1], [0, 0, 0], "float32"], {"i": 356664826, "t": "", "c": null, "e": [["tile_f", "sp", [-1, 1, 2, 3]], ["tile_d", "sp", [-1, 4, 1, 1]], ["tile_y", "sp", [-1, 1, 4, 2]], ["tile_x", "sp", [-1, 1, 2, 2]], ["tile_rc", "sp", [-1, 12]], ["tile_rd", "sp", [-1, 3]], ["tile_ry", "sp", [-1, 1]], ["tile_rx", "sp", [-1, 1]], ["auto_unroll_max_step", "ot", 512], ["unroll_explicit", "ot", 0]]}], "r": [[0.00244441725, 0.00241329725], 0, 2.1886024475097656, 1578562803.0463164], "v": 0.1}
{"i": ["cuda", "schedule_conv3d_transpose_nchw_cuda", [[1, 192, 8, 8, 8], [192, 192, 3, 3, 3], [1, 1, 1], [1, 1, 1], [0, 0, 0], "float32"], {}, ["schedule_conv3d_transpose_nchw_cuda", [1, 192, 8, 8, 8], [192, 192, 3, 3, 3], [1, 1, 1], [1, 1, 1], [0, 0, 0], "float32"], {"i": 1016726081, "t": "", "c": null, "e": [["tile_f", "sp", [-1, 2, 4, 3]], ["tile_d", "sp", [-1, 1, 1, 2]], ["tile_y", "sp", [-1, 1, 2, 4]], ["tile_x", "sp", [-1, 1, 2, 1]], ["tile_rc", "sp", [-1, 1]], ["tile_rd", "sp", [-1, 3]], ["tile_ry", "sp", [-1, 3]], ["tile_rx", "sp", [-1, 1]], ["auto_unroll_max_step", "ot", 0], ["unroll_explicit", "ot", 1]]}], "r": [[0.0030179215, 0.003019738], 0, 1.0567941665649414, 1578563059.5835996], "v": 0.1}
{"i": ["cuda", "schedule_conv3d_transpose_nchw_cuda", [[1, 192, 8, 8, 8], [192, 192, 3, 3, 3], [1, 1, 1], [1, 1, 1], [0, 0, 0], "float32"], {}, ["schedule_conv3d_transpose_nchw_cuda", [1, 192, 8, 8, 8], [192, 192, 3, 3, 3], [1, 1, 1], [1, 1, 1], [0, 0, 0], "float32"], {"i": 1618838081, "t": "", "c": null, "e": [["tile_f", "sp", [-1, 2, 4, 3]], ["tile_d", "sp", [-1, 1, 1, 2]], ["tile_y", "sp", [-1, 1, 2, 4]], ["tile_x", "sp", [-1, 1, 2, 1]], ["tile_rc", "sp", [-1, 1]], ["tile_rd", "sp", [-1, 3]], ["tile_ry", "sp", [-1, 3]], ["tile_rx", "sp", [-1, 1]], ["auto_unroll_max_step", "ot", 1500], ["unroll_explicit", "ot", 1]]}], "r": [[0.00088930375, 0.000888937], 0, 2.85270094871521, 1578563060.313243], "v": 0.1}
{"i": ["cuda", "schedule_conv3d_transpose_nchw_cuda", [[1, 192, 8, 8, 8], [192, 192, 3, 3, 3], [1, 1, 1], [1, 1, 1], [0, 0, 0], "float32"], {}, ["schedule_conv3d_transpose_nchw_cuda", [1, 192, 8, 8, 8], [192, 192, 3, 3, 3], [1, 1, 1], [1, 1, 1], [0, 0, 0], "float32"], {"i": 1317782081, "t": "", "c": null, "e": [["tile_f", "sp", [-1, 2, 4, 3]], ["tile_d", "sp", [-1, 1, 1, 2]], ["tile_y", "sp", [-1, 1, 2, 4]], ["tile_x", "sp", [-1, 1, 2, 1]], ["tile_rc", "sp", [-1, 1]], ["tile_rd", "sp", [-1, 3]], ["tile_ry", "sp", [-1, 3]], ["tile_rx", "sp", [-1, 1]], ["auto_unroll_max_step", "ot", 512], ["unroll_explicit", "ot", 1]]}], "r": [[0.0012907245, 0.00129051925], 0, 1.6195752620697021, 1578563060.998106], "v": 0.1}
{"i": ["cuda", "schedule_conv3d_transpose_nchw_cuda", [[1, 192, 8, 8, 8], [192, 192, 3, 3, 3], [1, 1, 1], [1, 1, 1], [0, 0, 0], "float32"], {}, ["schedule_conv3d_transpose_nchw_cuda", [1, 192, 8, 8, 8], [192, 192, 3, 3, 3], [1, 1, 1], [1, 1, 1], [0, 0, 0], "float32"], {"i": 1017908754, "t": "", "c": null, "e": [["tile_f", "sp", [-1, 3, 4, 2]], ["tile_d", "sp", [-1, 1, 1, 2]], ["tile_y", "sp", [-1, 2, 2, 2]], ["tile_x", "sp", [-1, 1, 2, 2]], ["tile_rc", "sp", [-1, 1]], ["tile_rd", "sp", [-1, 3]], ["tile_ry", "sp", [-1, 3]], ["tile_rx", "sp", [-1, 1]], ["auto_unroll_max_step", "ot", 0], ["unroll_explicit", "ot", 1]]}], "r": [[0.003904044, 0.0036802565], 0, 1.2363159656524658, 1578563061.6443007], "v": 0.1}
{"i": ["cuda", "schedule_conv3d_transpose_nchw_cuda", [[1, 192, 8, 8, 8], [192, 192, 3, 3, 3], [1, 1, 1], [1, 1, 1], [0, 0, 0], "float32"], {}, ["schedule_conv3d_transpose_nchw_cuda", [1, 192, 8, 8, 8], [192, 192, 3, 3, 3], [1, 1, 1], [1, 1, 1], [0, 0, 0], "float32"], {"i": 1318964754, "t": "", "c": null, "e": [["tile_f", "sp", [-1, 3, 4, 2]], ["tile_d", "sp", [-1, 1, 1, 2]], ["tile_y", "sp", [-1, 2, 2, 2]], ["tile_x", "sp", [-1, 1, 2, 2]], ["tile_rc", "sp", [-1, 1]], ["tile_rd", "sp", [-1, 3]], ["tile_ry", "sp", [-1, 3]], ["tile_rx", "sp", [-1, 1]], ["auto_unroll_max_step", "ot", 512], ["unroll_explicit", "ot", 1]]}], "r": [[0.001598104, 0.0015968875], 0, 1.598496675491333, 1578563062.284178], "v": 0.1}
{"i": ["cuda", "schedule_conv3d_transpose_nchw_cuda", [[1, 192, 8, 8, 8], [192, 192, 3, 3, 3], [1, 1, 1], [1, 1, 1], [0, 0, 0], "float32"], {}, ["schedule_conv3d_transpose_nchw_cuda", [1, 192, 8, 8, 8], [192, 192, 3, 3, 3], [1, 1, 1], [1, 1, 1], [0, 0, 0], "float32"], {"i": 1618753697, "t": "", "c": null, "e": [["tile_f", "sp", [-1, 2, 4, 2]], ["tile_d", "sp", [-1, 1, 1, 8]], ["tile_y", "sp", [-1, 2, 2, 1]], ["tile_x", "sp", [-1, 1, 2, 1]], ["tile_rc", "sp", [-1, 1]], ["tile_rd", "sp", [-1, 3]], ["tile_ry", "sp", [-1, 3]], ["tile_rx", "sp", [-1, 1]], ["auto_unroll_max_step", "ot", 1500], ["unroll_explicit", "ot", 1]]}], "r": [[0.001931341, 0.0019297535], 0, 1.9526393413543701, 1578563063.0126762], "v": 0.1}
{"i": ["cuda", "schedule_conv3d_transpose_nchw_cuda", [[1, 192, 8, 8, 8], [192, 192, 3, 3, 3], [1, 1, 1], [1, 1, 1], [0, 0, 0], "float32"], {}, ["schedule_conv3d_transpose_nchw_cuda", [1, 192, 8, 8, 8], [192, 192, 3, 3, 3], [1, 1, 1], [1, 1, 1], [0, 0, 0], "float32"], {"i": 1317697697, "t": "", "c": null, "e": [["tile_f", "sp", [-1, 2, 4, 2]], ["tile_d", "sp", [-1, 1, 1, 8]], ["tile_y", "sp", [-1, 2, 2, 1]], ["tile_x", "sp", [-1, 1, 2, 1]], ["tile_rc", "sp", [-1, 1]], ["tile_rd", "sp", [-1, 3]], ["tile_ry", "sp", [-1, 3]], ["tile_rx", "sp", [-1, 1]], ["auto_unroll_max_step", "ot", 512], ["unroll_explicit", "ot", 1]]}], "r": [[0.0015214065, 0.00152012], 0, 1.452369213104248, 1578563063.6227725], "v": 0.1}
{"i": ["cuda", "schedule_conv3d_transpose_nchw_cuda", [[1, 192, 8, 8, 8], [192, 192, 3, 3, 3], [1, 1, 1], [1, 1, 1], [0, 0, 0], "float32"], {}, ["schedule_conv3d_transpose_nchw_cuda", [1, 192, 8, 8, 8], [192, 192, 3, 3, 3], [1, 1, 1], [1, 1, 1], [0, 0, 0], "float32"], {"i": 1620689435, "t": "", "c": null, "e": [["tile_f", "sp", [-1, 2, 2, 3]], ["tile_d", "sp", [-1, 1, 1, 1]], ["tile_y", "sp", [-1, 2, 2, 2]], ["tile_x", "sp", [-1, 1, 2, 4]], ["tile_rc", "sp", [-1, 1]], ["tile_rd", "sp", [-1, 3]], ["tile_ry", "sp", [-1, 3]], ["tile_rx", "sp", [-1, 1]], ["auto_unroll_max_step", "ot", 1500], ["unroll_explicit", "ot", 1]]}], "r": [[0.00544191575, 0.0054412935], 0, 2.675849199295044, 1578563064.6140497], "v": 0.1}
{"i": ["cuda", "schedule_conv3d_transpose_nchw_cuda", [[1, 192, 8, 8, 8], [192, 192, 3, 3, 3], [1, 1, 1], [1, 1, 1], [0, 0, 0], "float32"], {}, ["schedule_conv3d_transpose_nchw_cuda", [1, 192, 8, 8, 8], [192, 192, 3, 3, 3], [1, 1, 1], [1, 1, 1], [0, 0, 0], "float32"], {"i": 1017850337, "t": "", "c": null, "e": [["tile_f", "sp", [-1, 2, 4, 3]], ["tile_d", "sp", [-1, 1, 1, 4]], ["tile_y", "sp", [-1, 2, 2, 1]], ["tile_x", "sp", [-1, 1, 2, 2]], ["tile_rc", "sp", [-1, 1]], ["tile_rd", "sp", [-1, 3]], ["tile_ry", "sp", [-1, 3]], ["tile_rx", "sp", [-1, 1]], ["auto_unroll_max_step", "ot", 0], ["unroll_explicit", "ot", 1]]}], "r": [[0.00396341525, 0.0037858545], 0, 1.211181402206421, 1578563065.236355], "v": 0.1}
{"i": ["cuda", "schedule_conv3d_transpose_nchw_cuda", [[1, 192, 8, 8, 8], [192, 192, 3, 3, 3], [1, 1, 1], [1, 1, 1], [0, 0, 0], "float32"], {}, ["schedule_conv3d_transpose_nchw_cuda", [1, 192, 8, 8, 8], [192, 192, 3, 3, 3], [1, 1, 1], [1, 1, 1], [0, 0, 0], "float32"], {"i": 1016726369, "t": "", "c": null, "e": [["tile_f", "sp", [-1, 2, 4, 2]], ["tile_d", "sp", [-1, 2, 1, 2]], ["tile_y", "sp", [-1, 1, 2, 4]], ["tile_x", "sp", [-1, 1, 2, 1]], ["tile_rc", "sp", [-1, 1]], ["tile_rd", "sp", [-1, 3]], ["tile_ry", "sp", [-1, 3]], ["tile_rx", "sp", [-1, 1]], ["auto_unroll_max_step", "ot", 0], ["unroll_explicit", "ot", 1]]}], "r": [[0.001871453, 0.001820864], 0, 1.2222044467926025, 1578563065.8358128], "v": 0.1}
{"i": ["cuda", "schedule_conv3d_transpose_nchw_cuda", [[1, 192, 8, 8, 8], [192, 192, 3, 3, 3], [1, 1, 1], [1, 1, 1], [0, 0, 0], "float32"], {}, ["schedule_conv3d_transpose_nchw_cuda", [1, 192, 8, 8, 8], [192, 192, 3, 3, 3], [1, 1, 1], [1, 1, 1], [0, 0, 0], "float32"], {"i": 1317782369, "t": "", "c": null, "e": [["tile_f", "sp", [-1, 2, 4, 2]], ["tile_d", "sp", [-1, 2, 1, 2]], ["tile_y", "sp", [-1, 1, 2, 4]], ["tile_x", "sp", [-1, 1, 2, 1]], ["tile_rc", "sp", [-1, 1]], ["tile_rd", "sp", [-1, 3]], ["tile_ry", "sp", [-1, 3]], ["tile_rx", "sp", [-1, 1]], ["auto_unroll_max_step", "ot", 512], ["unroll_explicit", "ot", 1]]}], "r": [[0.001459762, 0.0015523245], 0, 1.3507003784179688, 1578563066.4180167], "v": 0.1}
{"i": ["cuda", "schedule_conv3d_transpose_nchw_cuda", [[1, 192, 8, 8, 8], [192, 192, 3, 3, 3], [1, 1, 1], [1, 1, 1], [0, 0, 0], "float32"], {}, ["schedule_conv3d_transpose_nchw_cuda", [1, 192, 8, 8, 8], [192, 192, 3, 3, 3], [1, 1, 1], [1, 1, 1], [0, 0, 0], "float32"], {"i": 1618838369, "t": "", "c": null, "e": [["tile_f", "sp", [-1, 2, 4, 2]], ["tile_d", "sp", [-1, 2, 1, 2]], ["tile_y", "sp", [-1, 1, 2, 4]], ["tile_x", "sp", [-1, 1, 2, 1]], ["tile_rc", "sp", [-1, 1]], ["tile_rd", "sp", [-1, 3]], ["tile_ry", "sp", [-1, 3]], ["tile_rx", "sp", [-1, 1]], ["auto_unroll_max_step", "ot", 1500], ["unroll_explicit", "ot", 1]]}], "r": [[0.0018811885, 0.00188035325], 0, 1.7529754638671875, 1578563067.1414108], "v": 0.1}
{"i": ["cuda", "schedule_conv3d_transpose_nchw_cuda", [[1, 192, 8, 8, 8], [192, 192, 3, 3, 3], [1, 1, 1], [1, 1, 1], [0, 0, 0], "float32"], {}, ["schedule_conv3d_transpose_nchw_cuda", [1, 192, 8, 8, 8], [192, 192, 3, 3, 3], [1, 1, 1], [1, 1, 1], [0, 0, 0], "float32"], {"i": 1317697691, "t": "", "c": null, "e": [["tile_f", "sp", [-1, 2, 3, 2]], ["tile_d", "sp", [-1, 1, 1, 8]], ["tile_y", "sp", [-1, 2, 2, 1]], ["tile_x", "sp", [-1, 1, 2, 1]], ["tile_rc", "sp", [-1, 1]], ["tile_rd", "sp", [-1, 3]], ["tile_ry", "sp", [-1, 3]], ["tile_rx", "sp", [-1, 1]], ["auto_unroll_max_step", "ot", 512], ["unroll_explicit", "ot", 1]]}], "r": [[0.00085875725, 0.00085670675], 0, 1.2696380615234375, 1578563070.5215902], "v": 0.1}
{"i": ["cuda", "schedule_conv3d_transpose_nchw_cuda", [[1, 192, 8, 8, 8], [192, 192, 3, 3, 3], [1, 1, 1], [1, 1, 1], [0, 0, 0], "float32"], {}, ["schedule_conv3d_transpose_nchw_cuda", [1, 192, 8, 8, 8], [192, 192, 3, 3, 3], [1, 1, 1], [1, 1, 1], [0, 0, 0], "float32"], {"i": 1320385697, "t": "", "c": null, "e": [["tile_f", "sp", [-1, 2, 4, 2]], ["tile_d", "sp", [-1, 1, 1, 8]], ["tile_y", "sp", [-1, 2, 2, 1]], ["tile_x", "sp", [-1, 1, 2, 1]], ["tile_rc", "sp", [-1, 2]], ["tile_rd", "sp", [-1, 3]], ["tile_ry", "sp", [-1, 3]], ["tile_rx", "sp", [-1, 1]], ["auto_unroll_max_step", "ot", 512], ["unroll_explicit", "ot", 1]]}], "r": [[0.00144097575, 0.0014357675], 0, 1.56683349609375, 1578563071.160815], "v": 0.1}
{"i": ["cuda", "schedule_conv3d_transpose_nchw_cuda", [[1, 192, 8, 8, 8], [192, 192, 3, 3, 3], [1, 1, 1], [1, 1, 1], [0, 0, 0], "float32"], {}, ["schedule_conv3d_transpose_nchw_cuda", [1, 192, 8, 8, 8], [192, 192, 3, 3, 3], [1, 1, 1], [1, 1, 1], [0, 0, 0], "float32"], {"i": 1095854027, "t": "", "c": null, "e": [["tile_f", "sp", [-1, 2, 3, 2]], ["tile_d", "sp", [-1, 1, 1, 2]], ["tile_y", "sp", [-1, 1, 2, 2]], ["tile_x", "sp", [-1, 1, 2, 2]], ["tile_rc", "sp", [-1, 2]], ["tile_rd", "sp", [-1, 3]], ["tile_ry", "sp", [-1, 1]], ["tile_rx", "sp", [-1, 3]], ["auto_unroll_max_step", "ot", 0], ["unroll_explicit", "ot", 1]]}], "r": [[0.00195935975, 0.00195463575], 0, 0.9967684745788574, 1578563071.757078], "v": 0.1}
{"i": ["cuda", "schedule_conv3d_transpose_nchw_cuda", [[1, 192, 8, 8, 8], [192, 192, 3, 3, 3], [1, 1, 1], [1, 1, 1], [0, 0, 0], "float32"], {}, ["schedule_conv3d_transpose_nchw_cuda", [1, 192, 8, 8, 8], [192, 192, 3, 3, 3], [1, 1, 1], [1, 1, 1], [0, 0, 0], "float32"], {"i": 1396910027, "t": "", "c": null, "e": [["tile_f", "sp", [-1, 2, 3, 2]], ["tile_d", "sp", [-1, 1, 1, 2]], ["tile_y", "sp", [-1, 1, 2, 2]], ["tile_x", "sp", [-1, 1, 2, 2]], ["tile_rc", "sp", [-1, 2]], ["tile_rd", "sp", [-1, 3]], ["tile_ry", "sp", [-1, 1]], ["tile_rx", "sp", [-1, 3]], ["auto_unroll_max_step", "ot", 512], ["unroll_explicit", "ot", 1]]}], "r": [[0.001304741, 0.00129373375], 0, 1.6610143184661865, 1578563072.4138794], "v": 0.1}
{"i": ["cuda", "schedule_conv3d_transpose_nchw_cuda", [[1, 192, 8, 8, 8], [192, 192, 3, 3, 3], [1, 1, 1], [1, 1, 1], [0, 0, 0], "float32"], {}, ["schedule_conv3d_transpose_nchw_cuda", [1, 192, 8, 8, 8], [192, 192, 3, 3, 3], [1, 1, 1], [1, 1, 1], [0, 0, 0], "float32"], {"i": 1697966027, "t": "", "c": null, "e": [["tile_f", "sp", [-1, 2, 3, 2]], ["tile_d", "sp", [-1, 1, 1, 2]], ["tile_y", "sp", [-1, 1, 2, 2]], ["tile_x", "sp", [-1, 1, 2, 2]], ["tile_rc", "sp", [-1, 2]], ["tile_rd", "sp", [-1, 3]], ["tile_ry", "sp", [-1, 1]], ["tile_rx", "sp", [-1, 3]], ["auto_unroll_max_step", "ot", 1500], ["unroll_explicit", "ot", 1]]}], "r": [[0.002106818, 0.002105728], 0, 2.008312225341797, 1578563073.2013133], "v": 0.1}
{"i": ["cuda", "schedule_conv3d_transpose_nchw_cuda", [[1, 192, 8, 8, 8], [192, 192, 3, 3, 3], [1, 1, 1], [1, 1, 1], [0, 0, 0], "float32"], {}, ["schedule_conv3d_transpose_nchw_cuda", [1, 192, 8, 8, 8], [192, 192, 3, 3, 3], [1, 1, 1], [1, 1, 1], [0, 0, 0], "float32"], {"i": 1621506251, "t": "", "c": null, "e": [["tile_f", "sp", [-1, 2, 2, 3]], ["tile_d", "sp", [-1, 2, 1, 2]], ["tile_y", "sp", [-1, 1, 4, 2]], ["tile_x", "sp", [-1, 1, 2, 1]], ["tile_rc", "sp", [-1, 2]], ["tile_rd", "sp", [-1, 3]], ["tile_ry", "sp", [-1, 3]], ["tile_rx", "sp", [-1, 1]], ["auto_unroll_max_step", "ot", 1500], ["unroll_explicit", "ot", 1]]}], "r": [[0.00258003425, 0.0025778445], 0, 2.313225507736206, 1578563074.0178068], "v": 0.1}
{"i": ["cuda", "schedule_conv3d_transpose_nchw_cuda", [[1, 192, 8, 8, 8], [192, 192, 3, 3, 3], [1, 1, 1], [1, 1, 1], [0, 0, 0], "float32"], {}, ["schedule_conv3d_transpose_nchw_cuda", [1, 192, 8, 8, 8], [192, 192, 3, 3, 3], [1, 1, 1], [1, 1, 1], [0, 0, 0], "float32"], {"i": 1620044321, "t": "", "c": null, "e": [["tile_f", "sp", [-1, 2, 4, 3]], ["tile_d", "sp", [-1, 1, 1, 1]], ["tile_y", "sp", [-1, 1, 2, 4]], ["tile_x", "sp", [-1, 1, 2, 2]], ["tile_rc", "sp", [-1, 1]], ["tile_rd", "sp", [-1, 3]], ["tile_ry", "sp", [-1, 3]], ["tile_rx", "sp", [-1, 1]], ["auto_unroll_max_step", "ot", 1500], ["unroll_explicit", "ot", 1]]}], "r": [[0.00102792225, 0.00102773325], 0, 2.997236967086792, 1578563074.775415], "v": 0.1}
{"i": ["cuda", "schedule_conv3d_transpose_nchw_cuda", [[1, 192, 8, 8, 8], [192, 192, 3, 3, 3], [1, 1, 1], [1, 1, 1], [0, 0, 0], "float32"], {}, ["schedule_conv3d_transpose_nchw_cuda", [1, 192, 8, 8, 8], [192, 192, 3, 3, 3], [1, 1, 1], [1, 1, 1], [0, 0, 0], "float32"], {"i": 1017932321, "t": "", "c": null, "e": [["tile_f", "sp", [-1, 2, 4, 3]], ["tile_d", "sp", [-1, 1, 1, 1]], ["tile_y", "sp", [-1, 1, 2, 4]], ["tile_x", "sp", [-1, 1, 2, 2]], ["tile_rc", "sp", [-1, 1]], ["tile_rd", "sp", [-1, 3]], ["tile_ry", "sp", [-1, 3]], ["tile_rx", "sp", [-1, 1]], ["auto_unroll_max_step", "ot", 0], ["unroll_explicit", "ot", 1]]}], "r": [[0.003974525, 0.0039563755], 0, 1.0431618690490723, 1578563075.3711915], "v": 0.1}
{"i": ["cuda", "schedule_conv3d_transpose_nchw_cuda", [[1, 192, 8, 8, 8], [192, 192, 3, 3, 3], [1, 1, 1], [1, 1, 1], [0, 0, 0], "float32"], {}, ["schedule_conv3d_transpose_nchw_cuda", [1, 192, 8, 8, 8], [192, 192, 3, 3, 3], [1, 1, 1], [1, 1, 1], [0, 0, 0], "float32"], {"i": 1318988321, "t": "", "c": null, "e": [["tile_f", "sp", [-1, 2, 4, 3]], ["tile_d", "sp", [-1, 1, 1, 1]], ["tile_y", "sp", [-1, 1, 2, 4]], ["tile_x", "sp", [-1, 1, 2, 2]], ["tile_rc", "sp", [-1, 1]], ["tile_rd", "sp", [-1, 3]], ["tile_ry", "sp", [-1, 3]], ["tile_rx", "sp", [-1, 1]], ["auto_unroll_max_step", "ot", 512], ["unroll_explicit", "ot", 1]]}], "r": [[0.00149583725, 0.00149474575], 0, 1.6034891605377197, 1578563076.0756764], "v": 0.1}
{"i": ["cuda", "schedule_conv3d_transpose_nchw_cuda", [[1, 192, 8, 8, 8], [192, 192, 3, 3, 3], [1, 1, 1], [1, 1, 1], [0, 0, 0], "float32"], {}, ["schedule_conv3d_transpose_nchw_cuda", [1, 192, 8, 8, 8], [192, 192, 3, 3, 3], [1, 1, 1], [1, 1, 1], [0, 0, 0], "float32"], {"i": 1320470028, "t": "", "c": null, "e": [["tile_f", "sp", [-1, 4, 3, 2]], ["tile_d", "sp", [-1, 1, 1, 2]], ["tile_y", "sp", [-1, 1, 2, 4]], ["tile_x", "sp", [-1, 1, 2, 1]], ["tile_rc", "sp", [-1, 2]], ["tile_rd", "sp", [-1, 3]], ["tile_ry", "sp", [-1, 3]], ["tile_rx", "sp", [-1, 1]], ["auto_unroll_max_step", "ot", 512], ["unroll_explicit", "ot", 1]]}], "r": [[0.00151271725, 0.00151079325], 0, 1.5706336498260498, 1578563076.769696], "v": 0.1}
{"i": ["cuda", "schedule_conv3d_transpose_nchw_cuda", [[1, 192, 8, 8, 8], [192, 192, 3, 3, 3], [1, 1, 1], [1, 1, 1], [0, 0, 0], "float32"], {}, ["schedule_conv3d_transpose_nchw_cuda", [1, 192, 8, 8, 8], [192, 192, 3, 3, 3], [1, 1, 1], [1, 1, 1], [0, 0, 0], "float32"], {"i": 1621526028, "t": "", "c": null, "e": [["tile_f", "sp", [-1, 4, 3, 2]], ["tile_d", "sp", [-1, 1, 1, 2]], ["tile_y", "sp", [-1, 1, 2, 4]], ["tile_x", "sp", [-1, 1, 2, 1]], ["tile_rc", "sp", [-1, 2]], ["tile_rd", "sp", [-1, 3]], ["tile_ry", "sp", [-1, 3]], ["tile_rx", "sp", [-1, 1]], ["auto_unroll_max_step", "ot", 1500], ["unroll_explicit", "ot", 1]]}], "r": [[0.003046625, 0.00304653225], 0, 2.7916483879089355, 1578563077.7164857], "v": 0.1}
{"i": ["cuda", "schedule_conv3d_transpose_nchw_cuda", [[1, 192, 8, 8, 8], [192, 192, 3, 3, 3], [1, 1, 1], [1, 1, 1], [0, 0, 0], "float32"], {}, ["schedule_conv3d_transpose_nchw_cuda", [1, 192, 8, 8, 8], [192, 192, 3, 3, 3], [1, 1, 1], [1, 1, 1], [0, 0, 0], "float32"], {"i": 1019393859, "t": "", "c": null, "e": [["tile_f", "sp", [-1, 4, 2, 2]], ["tile_d", "sp", [-1, 1, 1, 2]], ["tile_y", "sp", [-1, 1, 4, 2]], ["tile_x", "sp", [-1, 1, 2, 1]], ["tile_rc", "sp", [-1, 2]], ["tile_rd", "sp", [-1, 3]], ["tile_ry", "sp", [-1, 3]], ["tile_rx", "sp", [-1, 1]], ["auto_unroll_max_step", "ot", 0], ["unroll_explicit", "ot", 1]]}], "r": [[0.00065045375, 0.000650297], 0, 1.125633716583252, 1578563078.364996], "v": 0.1}
{"i": ["cuda", "schedule_conv3d_transpose_nchw_cuda", [[1, 192, 8, 8, 8], [192, 192, 3, 3, 3], [1, 1, 1], [1, 1, 1], [0, 0, 0], "float32"], {}, ["schedule_conv3d_transpose_nchw_cuda", [1, 192, 8, 8, 8], [192, 192, 3, 3, 3], [1, 1, 1], [1, 1, 1], [0, 0, 0], "float32"], {"i": 1394877246, "t": "", "c": null, "e": [["tile_f", "sp", [-1, 2, 8, 2]], ["tile_d", "sp", [-1, 1, 1, 1]], ["tile_y", "sp", [-1, 2, 1, 2]], ["tile_x", "sp", [-1, 1, 2, 4]], ["tile_rc", "sp", [-1, 1]], ["tile_rd", "sp", [-1, 3]], ["tile_ry", "sp", [-1, 1]], ["tile_rx", "sp", [-1, 3]], ["auto_unroll_max_step", "ot", 512], ["unroll_explicit", "ot", 1]]}], "r": [[0.00134977625, 0.00135156025], 0, 1.3353934288024902, 1578563081.5389314], "v": 0.1}
{"i": ["cuda", "schedule_conv3d_transpose_nchw_cuda", [[1, 192, 8, 8, 8], [192, 192, 3, 3, 3], [1, 1, 1], [1, 1, 1], [0, 0, 0], "float32"], {}, ["schedule_conv3d_transpose_nchw_cuda", [1, 192, 8, 8, 8], [192, 192, 3, 3, 3], [1, 1, 1], [1, 1, 1], [0, 0, 0], "float32"], {"i": 1093821246, "t": "", "c": null, "e": [["tile_f", "sp", [-1, 2, 8, 2]], ["tile_d", "sp", [-1, 1, 1, 1]], ["tile_y", "sp", [-1, 2, 1, 2]], ["tile_x", "sp", [-1, 1, 2, 4]], ["tile_rc", "sp", [-1, 1]], ["tile_rd", "sp", [-1, 3]], ["tile_ry", "sp", [-1, 1]], ["tile_rx", "sp", [-1, 3]], ["auto_unroll_max_step", "ot", 0], ["unroll_explicit", "ot", 1]]}], "r": [[0.00159019525, 0.0015897925], 0, 1.0457956790924072, 1578563082.1345515], "v": 0.1}
{"i": ["cuda", "schedule_conv3d_transpose_nchw_cuda", [[1, 192, 8, 8, 8], [192, 192, 3, 3, 3], [1, 1, 1], [1, 1, 1], [0, 0, 0], "float32"], {}, ["schedule_conv3d_transpose_nchw_cuda", [1, 192, 8, 8, 8], [192, 192, 3, 3, 3], [1, 1, 1], [1, 1, 1], [0, 0, 0], "float32"], {"i": 1695933246, "t": "", "c": null, "e": [["tile_f", "sp", [-1, 2, 8, 2]], ["tile_d", "sp", [-1, 1, 1, 1]], ["tile_y", "sp", [-1, 2, 1, 2]], ["tile_x", "sp", [-1, 1, 2, 4]], ["tile_rc", "sp", [-1, 1]], ["tile_rd", "sp", [-1, 3]], ["tile_ry", "sp", [-1, 1]], ["tile_rx", "sp", [-1, 3]], ["auto_unroll_max_step", "ot", 1500], ["unroll_explicit", "ot", 1]]}], "r": [[0.00182131, 0.00182063075], 0, 1.6867997646331787, 1578563082.862993], "v": 0.1}
{"i": ["cuda", "schedule_conv3d_transpose_nchw_cuda", [[1, 192, 8, 8, 8], [192, 192, 3, 3, 3], [1, 1, 1], [1, 1, 1], [0, 0, 0], "float32"], {}, ["schedule_conv3d_transpose_nchw_cuda", [1, 192, 8, 8, 8], [192, 192, 3, 3, 3], [1, 1, 1], [1, 1, 1], [0, 0, 0], "float32"], {"i": 1393358171, "t": "", "c": null, "e": [["tile_f", "sp", [-1, 2, 3, 2]], ["tile_d", "sp", [-1, 1, 1, 8]], ["tile_y", "sp", [-1, 1, 2, 1]], ["tile_x", "sp", [-1, 1, 4, 1]], ["tile_rc", "sp", [-1, 1]], ["tile_rd", "sp", [-1, 3]], ["tile_ry", "sp", [-1, 1]], ["tile_rx", "sp", [-1, 3]], ["auto_unroll_max_step", "ot", 512], ["unroll_explicit", "ot", 1]]}], "r": [[0.00123038225, 0.0012236295], 0, 1.3836283683776855, 1578563083.483532], "v": 0.1}
{"i": ["cuda", "schedule_conv3d_transpose_nchw_cuda", [[1, 192, 8, 8, 8], [192, 192, 3, 3, 3], [1, 1, 1], [1, 1, 1], [0, 0, 0], "float32"], {}, ["schedule_conv3d_transpose_nchw_cuda", [1, 192, 8, 8, 8], [192, 192, 3, 3, 3], [1, 1, 1], [1, 1, 1], [0, 0, 0], "float32"], {"i": 1092302171, "t": "", "c": null, "e": [["tile_f", "sp", [-1, 2, 3, 2]], ["tile_d", "sp", [-1, 1, 1, 8]], ["tile_y", "sp", [-1, 1, 2, 1]], ["tile_x", "sp", [-1, 1, 4, 1]], ["tile_rc", "sp", [-1, 1]], ["tile_rd", "sp", [-1, 3]], ["tile_ry", "sp", [-1, 1]], ["tile_rx", "sp", [-1, 3]], ["auto_unroll_max_step", "ot", 0], ["unroll_explicit", "ot", 1]]}], "r": [[0.0013852355, 0.00138549125], 0, 1.0446743965148926, 1578563084.0820951], "v": 0.1}
{"i": ["cuda", "schedule_conv3d_transpose_nchw_cuda", [[1, 192, 8, 8, 8], [192, 192, 3, 3, 3], [1, 1, 1], [1, 1, 1], [0, 0, 0], "float32"], {}, ["schedule_conv3d_transpose_nchw_cuda", [1, 192, 8, 8, 8], [192, 192, 3, 3, 3], [1, 1, 1], [1, 1, 1], [0, 0, 0], "float32"], {"i": 1694414171, "t": "", "c": null, "e": [["tile_f", "sp", [-1, 2, 3, 2]], ["tile_d", "sp", [-1, 1, 1, 8]], ["tile_y", "sp", [-1, 1, 2, 1]], ["tile_x", "sp", [-1, 1, 4, 1]], ["tile_rc", "sp", [-1, 1]], ["tile_rd", "sp", [-1, 3]], ["tile_ry", "sp", [-1, 1]], ["tile_rx", "sp", [-1, 3]], ["auto_unroll_max_step", "ot", 1500], ["unroll_explicit", "ot", 1]]}], "r": [[0.0006327575, 0.000631814], 0, 1.9174015522003174, 1578563084.7532675], "v": 0.1}
{"i": ["cuda", "schedule_conv3d_transpose_nchw_cuda", [[1, 192, 8, 8, 8], [192, 192, 3, 3, 3], [1, 1, 1], [1, 1, 1], [0, 0, 0], "float32"], {}, ["schedule_conv3d_transpose_nchw_cuda", [1, 192, 8, 8, 8], [192, 192, 3, 3, 3], [1, 1, 1], [1, 1, 1], [0, 0, 0], "float32"], {"i": 1095854028, "t": "", "c": null, "e": [["tile_f", "sp", [-1, 4, 3, 2]], ["tile_d", "sp", [-1, 1, 1, 2]], ["tile_y", "sp", [-1, 1, 2, 2]], ["tile_x", "sp", [-1, 1, 2, 2]], ["tile_rc", "sp", [-1, 2]], ["tile_rd", "sp", [-1, 3]], ["tile_ry", "sp", [-1, 1]], ["tile_rx", "sp", [-1, 3]], ["auto_unroll_max_step", "ot", 0], ["unroll_explicit", "ot", 1]]}], "r": [[0.00215830875, 0.00215111875], 0, 1.1711394786834717, 1578563085.3780737], "v": 0.1}
{"i": ["cuda", "schedule_conv3d_transpose_nchw_cuda", [[1, 192, 8, 8, 8], [192, 192, 3, 3, 3], [1, 1, 1], [1, 1, 1], [0, 0, 0], "float32"], {}, ["schedule_conv3d_transpose_nchw_cuda", [1, 192, 8, 8, 8], [192, 192, 3, 3, 3], [1, 1, 1], [1, 1, 1], [0, 0, 0], "float32"], {"i": 1396910028, "t": "", "c": null, "e": [["tile_f", "sp", [-1, 4, 3, 2]], ["tile_d", "sp", [-1, 1, 1, 2]], ["tile_y", "sp", [-1, 1, 2, 2]], ["tile_x", "sp", [-1, 1, 2, 2]], ["tile_rc", "sp", [-1, 2]], ["tile_rd", "sp", [-1, 3]], ["tile_ry", "sp", [-1, 1]], ["tile_rx", "sp", [-1, 3]], ["auto_unroll_max_step", "ot", 512], ["unroll_explicit", "ot", 1]]}], "r": [[0.00157226225, 0.00157972975], 0, 1.6856706142425537, 1578563086.0594597], "v": 0.1}
{"i": ["cuda", "schedule_conv3d_transpose_nchw_cuda", [[1, 192, 8, 8, 8], [192, 192, 3, 3, 3], [1, 1, 1], [1, 1, 1], [0, 0, 0], "float32"], {}, ["schedule_conv3d_transpose_nchw_cuda", [1, 192, 8, 8, 8], [192, 192, 3, 3, 3], [1, 1, 1], [1, 1, 1], [0, 0, 0], "float32"], {"i": 1697966028, "t": "", "c": null, "e": [["tile_f", "sp", [-1, 4, 3, 2]], ["tile_d", "sp", [-1, 1, 1, 2]], ["tile_y", "sp", [-1, 1, 2, 2]], ["tile_x", "sp", [-1, 1, 2, 2]], ["tile_rc", "sp", [-1, 2]], ["tile_rd", "sp", [-1, 3]], ["tile_ry", "sp", [-1, 1]], ["tile_rx", "sp", [-1, 3]], ["auto_unroll_max_step", "ot", 1500], ["unroll_explicit", "ot", 1]]}], "r": [[0.00319228325, 0.003192622], 0, 2.8727476596832275, 1578563087.050472], "v": 0.1}
{"i": ["cuda", "schedule_conv3d_transpose_nchw_cuda", [[1, 192, 8, 8, 8], [192, 192, 3, 3, 3], [1, 1, 1], [1, 1, 1], [0, 0, 0], "float32"], {}, ["schedule_conv3d_transpose_nchw_cuda", [1, 192, 8, 8, 8], [192, 192, 3, 3, 3], [1, 1, 1], [1, 1, 1], [0, 0, 0], "float32"], {"i": 1317697744, "t": "", "c": null, "e": [["tile_f", "sp", [-1, 1, 4, 3]], ["tile_d", "sp", [-1, 1, 1, 8]], ["tile_y", "sp", [-1, 2, 2, 1]], ["tile_x", "sp", [-1, 1, 2, 1]], ["tile_rc", "sp", [-1, 1]], ["tile_rd", "sp", [-1, 3]], ["tile_ry", "sp", [-1, 3]], ["tile_rx", "sp", [-1, 1]], ["auto_unroll_max_step", "ot", 512], ["unroll_explicit", "ot", 1]]}], "r": [[0.00161883375, 0.00161788275], 0, 1.5077214241027832, 1578563087.7276254], "v": 0.1}
{"i": ["cuda", "schedule_conv3d_transpose_nchw_cuda", [[1, 192, 8, 8, 8], [192, 192, 3, 3, 3], [1, 1, 1], [1, 1, 1], [0, 0, 0], "float32"], {}, ["schedule_conv3d_transpose_nchw_cuda", [1, 192, 8, 8, 8], [192, 192, 3, 3, 3], [1, 1, 1], [1, 1, 1], [0, 0, 0], "float32"], {"i": 1619241233, "t": "", "c": null, "e": [["tile_f", "sp", [-1, 2, 4, 2]], ["tile_d", "sp", [-1, 1, 1, 2]], ["tile_y", "sp", [-1, 1, 2, 4]], ["tile_x", "sp", [-1, 1, 4, 1]], ["tile_rc", "sp", [-1, 1]], ["tile_rd", "sp", [-1, 3]], ["tile_ry", "sp", [-1, 3]], ["tile_rx", "sp", [-1, 1]], ["auto_unroll_max_step", "ot", 1500], ["unroll_explicit", "ot", 1]]}], "r": [[0.00068710875, 0.000684745], 0, 1.7659285068511963, 1578563088.3946726], "v": 0.1}
{"i": ["cuda", "schedule_conv3d_transpose_nchw_cuda", [[1, 192, 8, 8, 8], [192, 192, 3, 3, 3], [1, 1, 1], [1, 1, 1], [0, 0, 0], "float32"], {}, ["schedule_conv3d_transpose_nchw_cuda", [1, 192, 8, 8, 8], [192, 192, 3, 3, 3], [1, 1, 1], [1, 1, 1], [0, 0, 0], "float32"], {"i": 1096472267, "t": "", "c": null, "e": [["tile_f", "sp", [-1, 2, 3, 2]], ["tile_d", "sp", [-1, 1, 1, 2]], ["tile_y", "sp", [-1, 2, 2, 1]], ["tile_x", "sp", [-1, 1, 2, 4]], ["tile_rc", "sp", [-1, 2]], ["tile_rd", "sp", [-1, 3]], ["tile_ry", "sp", [-1, 1]], ["tile_rx", "sp", [-1, 3]], ["auto_unroll_max_step", "ot", 0], ["unroll_explicit", "ot", 1]]}], "r": [[0.0034098215, 0.00338676125], 0, 1.0853776931762695, 1578563089.028929], "v": 0.1}
{"i": ["cuda", "schedule_conv3d_transpose_nchw_cuda", [[1, 192, 8, 8, 8], [192, 192, 3, 3, 3], [1, 1, 1], [1, 1, 1], [0, 0, 0], "float32"], {}, ["schedule_conv3d_transpose_nchw_cuda", [1, 192, 8, 8, 8], [192, 192, 3, 3, 3], [1, 1, 1], [1, 1, 1], [0, 0, 0], "float32"], {"i": 1397528267, "t": "", "c": null, "e": [["tile_f", "sp", [-1, 2, 3, 2]], ["tile_d", "sp", [-1, 1, 1, 2]], ["tile_y", "sp", [-1, 2, 2, 1]], ["tile_x", "sp", [-1, 1, 2, 4]], ["tile_rc", "sp", [-1, 2]], ["tile_rd", "sp", [-1, 3]], ["tile_ry", "sp", [-1, 1]], ["tile_rx", "sp", [-1, 3]], ["auto_unroll_max_step", "ot", 512], ["unroll_explicit", "ot", 1]]}], "r": [[0.001647525, 0.001660057], 0, 2.2193732261657715, 1578563092.3926232], "v": 0.1}
{"i": ["cuda", "schedule_conv3d_transpose_nchw_cuda", [[1, 192, 8, 8, 8], [192, 192, 3, 3, 3], [1, 1, 1], [1, 1, 1], [0, 0, 0], "float32"], {}, ["schedule_conv3d_transpose_nchw_cuda", [1, 192, 8, 8, 8], [192, 192, 3, 3, 3], [1, 1, 1], [1, 1, 1], [0, 0, 0], "float32"], {"i": 1621502891, "t": "", "c": null, "e": [["tile_f", "sp", [-1, 2, 2, 3]], ["tile_d", "sp", [-1, 2, 1, 1]], ["tile_y", "sp", [-1, 1, 4, 2]], ["tile_x", "sp", [-1, 1, 2, 1]], ["tile_rc", "sp", [-1, 2]], ["tile_rd", "sp", [-1, 3]], ["tile_ry", "sp", [-1, 3]], ["tile_rx", "sp", [-1, 1]], ["auto_unroll_max_step", "ot", 1500], ["unroll_explicit", "ot", 1]]}], "r": [[0.00055032575, 0.00054889075], 0, 2.7252085208892822, 1578563093.123283], "v": 0.1}
{"i": ["cuda", "schedule_conv3d_transpose_nchw_cuda", [[1, 192, 8, 8, 8], [192, 192, 3, 3, 3], [1, 1, 1], [1, 1, 1], [0, 0, 0], "float32"], {}, ["schedule_conv3d_transpose_nchw_cuda", [1, 192, 8, 8, 8], [192, 192, 3, 3, 3], [1, 1, 1], [1, 1, 1], [0, 0, 0], "float32"], {"i": 1620689378, "t": "", "c": null, "e": [["tile_f", "sp", [-1, 3, 2, 2]], ["tile_d", "sp", [-1, 1, 1, 1]], ["tile_y", "sp", [-1, 2, 2, 2]], ["tile_x", "sp", [-1, 1, 2, 4]], ["tile_rc", "sp", [-1, 1]], ["tile_rd", "sp", [-1, 3]], ["tile_ry", "sp", [-1, 3]], ["tile_rx", "sp", [-1, 1]], ["auto_unroll_max_step", "ot", 1500], ["unroll_explicit", "ot", 1]]}], "r": [[0.005361416, 0.00536285075], 0, 2.76208758354187, 1578563094.1448178], "v": 0.1}
{"i": ["cuda", "schedule_conv3d_transpose_nchw_cuda", [[1, 192, 8, 8, 8], [192, 192, 3, 3, 3], [1, 1, 1], [1, 1, 1], [0, 0, 0], "float32"], {}, ["schedule_conv3d_transpose_nchw_cuda", [1, 192, 8, 8, 8], [192, 192, 3, 3, 3], [1, 1, 1], [1, 1, 1], [0, 0, 0], "float32"], {"i": 1620027467, "t": "", "c": null, "e": [["tile_f", "sp", [-1, 2, 3, 2]], ["tile_d", "sp", [-1, 1, 1, 2]], ["tile_y", "sp", [-1, 1, 4, 2]], ["tile_x", "sp", [-1, 1, 2, 2]], ["tile_rc", "sp", [-1, 1]], ["tile_rd", "sp", [-1, 3]], ["tile_ry", "sp", [-1, 3]], ["tile_rx", "sp", [-1, 1]], ["auto_unroll_max_step", "ot", 1500], ["unroll_explicit", "ot", 1]]}], "r": [[0.000919022, 0.00091763575], 0, 2.140547513961792, 1578563094.8089828], "v": 0.1}
{"i": ["cuda", "schedule_conv3d_transpose_nchw_cuda", [[1, 192, 8, 8, 8], [192, 192, 3, 3, 3], [1, 1, 1], [1, 1, 1], [0, 0, 0], "float32"], {}, ["schedule_conv3d_transpose_nchw_cuda", [1, 192, 8, 8, 8], [192, 192, 3, 3, 3], [1, 1, 1], [1, 1, 1], [0, 0, 0], "float32"], {"i": 1017915467, "t": "", "c": null, "e": [["tile_f", "sp", [-1, 2, 3, 2]], ["tile_d", "sp", [-1, 1, 1, 2]], ["tile_y", "sp", [-1, 1, 4, 2]], ["tile_x", "sp", [-1, 1, 2, 2]], ["tile_rc", "sp", [-1, 1]], ["tile_rd", "sp", [-1, 3]], ["tile_ry", "sp", [-1, 3]], ["tile_rx", "sp", [-1, 1]], ["auto_unroll_max_step", "ot", 0], ["unroll_explicit", "ot", 1]]}], "r": [[0.001478595, 0.001478016], 0, 1.1261096000671387, 1578563095.4383752], "v": 0.1}
{"i": ["cuda", "schedule_conv3d_transpose_nchw_cuda", [[1, 192, 8, 8, 8], [192, 192, 3, 3, 3], [1, 1, 1], [1, 1, 1], [0, 0, 0], "float32"], {}, ["schedule_conv3d_transpose_nchw_cuda", [1, 192, 8, 8, 8], [192, 192, 3, 3, 3], [1, 1, 1], [1, 1, 1], [0, 0, 0], "float32"], {"i": 1318958034, "t": "", "c": null, "e": [["tile_f", "sp", [-1, 3, 4, 2]], ["tile_d", "sp", [-1, 1, 1, 2]], ["tile_y", "sp", [-1, 1, 2, 2]], ["tile_x", "sp", [-1, 1, 2, 2]], ["tile_rc", "sp", [-1, 1]], ["tile_rd", "sp", [-1, 3]], ["tile_ry", "sp", [-1, 3]], ["tile_rx", "sp", [-1, 1]], ["auto_unroll_max_step", "ot", 512], ["unroll_explicit", "ot", 1]]}], "r": [[0.0012193145, 0.0012184285], 0, 1.6027765274047852, 1578563096.1193883], "v": 0.1}
{"i": ["cuda", "schedule_conv3d_transpose_nchw_cuda", [[1, 192, 8, 8, 8], [192, 192, 3, 3, 3], [1, 1, 1], [1, 1, 1], [0, 0, 0], "float32"], {}, ["schedule_conv3d_transpose_nchw_cuda", [1, 192, 8, 8, 8], [192, 192, 3, 3, 3], [1, 1, 1], [1, 1, 1], [0, 0, 0], "float32"], {"i": 1317782028, "t": "", "c": null, "e": [["tile_f", "sp", [-1, 4, 3, 2]], ["tile_d", "sp", [-1, 1, 1, 2]], ["tile_y", "sp", [-1, 1, 2, 4]], ["tile_x", "sp", [-1, 1, 2, 1]], ["tile_rc", "sp", [-1, 1]], ["tile_rd", "sp", [-1, 3]], ["tile_ry", "sp", [-1, 3]], ["tile_rx", "sp", [-1, 1]], ["auto_unroll_max_step", "ot", 512], ["unroll_explicit", "ot", 1]]}], "r": [[0.0014496265, 0.001469962], 0, 1.4242358207702637, 1578563096.7214665], "v": 0.1}
{"i": ["cuda", "schedule_conv3d_transpose_nchw_cuda", [[1, 192, 8, 8, 8], [192, 192, 3, 3, 3], [1, 1, 1], [1, 1, 1], [0, 0, 0], "float32"], {}, ["schedule_conv3d_transpose_nchw_cuda", [1, 192, 8, 8, 8], [192, 192, 3, 3, 3], [1, 1, 1], [1, 1, 1], [0, 0, 0], "float32"], {"i": 1697905547, "t": "", "c": null, "e": [["tile_f", "sp", [-1, 2, 3, 2]], ["tile_d", "sp", [-1, 1, 1, 2]], ["tile_y", "sp", [-1, 1, 2, 1]], ["tile_x", "sp", [-1, 1, 2, 2]], ["tile_rc", "sp", [-1, 2]], ["tile_rd", "sp", [-1, 3]], ["tile_ry", "sp", [-1, 1]], ["tile_rx", "sp", [-1, 3]], ["auto_unroll_max_step", "ot", 1500], ["unroll_explicit", "ot", 1]]}], "r": [[0.00091617775, 0.00091408225], 0, 2.1927409172058105, 1578563097.4145682], "v": 0.1}
{"i": ["cuda", "schedule_conv3d_transpose_nchw_cuda", [[1, 192, 8, 8, 8], [192, 192, 3, 3, 3], [1, 1, 1], [1, 1, 1], [0, 0, 0], "float32"], {}, ["schedule_conv3d_transpose_nchw_cuda", [1, 192, 8, 8, 8], [192, 192, 3, 3, 3], [1, 1, 1], [1, 1, 1], [0, 0, 0], "float32"], {"i": 1095793547, "t": "", "c": null, "e": [["tile_f", "sp", [-1, 2, 3, 2]], ["tile_d", "sp", [-1, 1, 1, 2]], ["tile_y", "sp", [-1, 1, 2, 1]], ["tile_x", "sp", [-1, 1, 2, 2]], ["tile_rc", "sp", [-1, 2]], ["tile_rd", "sp", [-1, 3]], ["tile_ry", "sp", [-1, 1]], ["tile_rx", "sp", [-1, 3]], ["auto_unroll_max_step", "ot", 0], ["unroll_explicit", "ot", 1]]}], "r": [[0.0015418165, 0.00152802], 0, 1.1836235523223877, 1578563098.0950708], "v": 0.1}
{"i": ["cuda", "schedule_conv3d_transpose_nchw_cuda", [[1, 192, 8, 8, 8], [192, 192, 3, 3, 3], [1, 1, 1], [1, 1, 1], [0, 0, 0], "float32"], {}, ["schedule_conv3d_transpose_nchw_cuda", [1, 192, 8, 8, 8], [192, 192, 3, 3, 3], [1, 1, 1], [1, 1, 1], [0, 0, 0], "float32"], {"i": 1394833553, "t": "", "c": null, "e": [["tile_f", "sp", [-1, 2, 4, 2]], ["tile_d", "sp", [-1, 1, 1, 2]], ["tile_y", "sp", [-1, 1, 2, 1]], ["tile_x", "sp", [-1, 1, 2, 4]], ["tile_rc", "sp", [-1, 1]], ["tile_rd", "sp", [-1, 3]], ["tile_ry", "sp", [-1, 1]], ["tile_rx", "sp", [-1, 3]], ["auto_unroll_max_step", "ot", 512], ["unroll_explicit", "ot", 1]]}], "r": [[0.00061853675, 0.000617606], 0, 1.2377164363861084, 1578563098.6952524], "v": 0.1}
{"i": ["cuda", "schedule_conv3d_transpose_nchw_cuda", [[1, 192, 8, 8, 8], [192, 192, 3, 3, 3], [1, 1, 1], [1, 1, 1], [0, 0, 0], "float32"], {}, ["schedule_conv3d_transpose_nchw_cuda", [1, 192, 8, 8, 8], [192, 192, 3, 3, 3], [1, 1, 1], [1, 1, 1], [0, 0, 0], "float32"], {"i": 715670081, "t": "", "c": null, "e": [["tile_f", "sp", [-1, 2, 4, 3]], ["tile_d", "sp", [-1, 1, 1, 2]], ["tile_y", "sp", [-1, 1, 2, 4]], ["tile_x", "sp", [-1, 1, 2, 1]], ["tile_rc", "sp", [-1, 1]], ["tile_rd", "sp", [-1, 3]], ["tile_ry", "sp", [-1, 3]], ["tile_rx", "sp", [-1, 1]], ["auto_unroll_max_step", "ot", 1500], ["unroll_explicit", "ot", 0]]}], "r": [[0.0022607845, 0.0022604195], 0, 1.497997522354126, 1578563099.5204673], "v": 0.1}
{"i": ["cuda", "schedule_conv3d_transpose_nchw_cuda", [[1, 192, 8, 8, 8], [192, 192, 3, 3, 3], [1, 1, 1], [1, 1, 1], [0, 0, 0], "float32"], {}, ["schedule_conv3d_transpose_nchw_cuda", [1, 192, 8, 8, 8], [192, 192, 3, 3, 3], [1, 1, 1], [1, 1, 1], [0, 0, 0], "float32"], {"i": 414614081, "t": "", "c": null, "e": [["tile_f", "sp", [-1, 2, 4, 3]], ["tile_d", "sp", [-1, 1, 1, 2]], ["tile_y", "sp", [-1, 1, 2, 4]], ["tile_x", "sp", [-1, 1, 2, 1]], ["tile_rc", "sp", [-1, 1]], ["tile_rd", "sp", [-1, 3]], ["tile_ry", "sp", [-1, 3]], ["tile_rx", "sp", [-1, 1]], ["auto_unroll_max_step", "ot", 512], ["unroll_explicit", "ot", 0]]}], "r": [[0.00271339125, 0.00253293725], 0, 1.2901256084442139, 1578563100.2465544], "v": 0.1}
{"i": ["cuda", "schedule_conv3d_transpose_nchw_cuda", [[1, 192, 8, 8, 8], [192, 192, 3, 3, 3], [1, 1, 1], [1, 1, 1], [0, 0, 0], "float32"], {}, ["schedule_conv3d_transpose_nchw_cuda", [1, 192, 8, 8, 8], [192, 192, 3, 3, 3], [1, 1, 1], [1, 1, 1], [0, 0, 0], "float32"], {"i": 113558081, "t": "", "c": null, "e": [["tile_f", "sp", [-1, 2, 4, 3]], ["tile_d", "sp", [-1, 1, 1, 2]], ["tile_y", "sp", [-1, 1, 2, 4]], ["tile_x", "sp", [-1, 1, 2, 1]], ["tile_rc", "sp", [-1, 1]], ["tile_rd", "sp", [-1, 3]], ["tile_ry", "sp", [-1, 3]], ["tile_rx", "sp", [-1, 1]], ["auto_unroll_max_step", "ot", 0], ["unroll_explicit", "ot", 0]]}], "r": [[0.0030196495, 0.003020943], 0, 1.05318021774292, 1578563102.913826], "v": 0.1}
{"i": ["cuda", "schedule_conv3d_transpose_nchw_cuda", [[1, 192, 8, 8, 8], [192, 192, 3, 3, 3], [1, 1, 1], [1, 1, 1], [0, 0, 0], "float32"], {}, ["schedule_conv3d_transpose_nchw_cuda", [1, 192, 8, 8, 8], [192, 192, 3, 3, 3], [1, 1, 1], [1, 1, 1], [0, 0, 0], "float32"], {"i": 1016728097, "t": "", "c": null, "e": [["tile_f", "sp", [-1, 2, 4, 3]], ["tile_d", "sp", [-1, 1, 1, 4]], ["tile_y", "sp", [-1, 1, 2, 4]], ["tile_x", "sp", [-1, 1, 2, 1]], ["tile_rc", "sp", [-1, 1]], ["tile_rd", "sp", [-1, 3]], ["tile_ry", "sp", [-1, 3]], ["tile_rx", "sp", [-1, 1]], ["auto_unroll_max_step", "ot", 0], ["unroll_explicit", "ot", 1]]}], "r": [[0.00415429875, 0.004140599], 0, 1.1703221797943115, 1578563103.555202], "v": 0.1}
{"i": ["cuda", "schedule_conv3d_transpose_nchw_cuda", [[1, 192, 8, 8, 8], [192, 192, 3, 3, 3], [1, 1, 1], [1, 1, 1], [0, 0, 0], "float32"], {}, ["schedule_conv3d_transpose_nchw_cuda", [1, 192, 8, 8, 8], [192, 192, 3, 3, 3], [1, 1, 1], [1, 1, 1], [0, 0, 0], "float32"], {"i": 1093166028, "t": "", "c": null, "e": [["tile_f", "sp", [-1, 4, 3, 2]], ["tile_d", "sp", [-1, 1, 1, 2]], ["tile_y", "sp", [-1, 1, 2, 2]], ["tile_x", "sp", [-1, 1, 2, 2]], ["tile_rc", "sp", [-1, 1]], ["tile_rd", "sp", [-1, 3]], ["tile_ry", "sp", [-1, 1]], ["tile_rx", "sp", [-1, 3]], ["auto_unroll_max_step", "ot", 0], ["unroll_explicit", "ot", 1]]}], "r": [[0.001006699, 0.001005714], 0, 1.0982301235198975, 1578563104.136525], "v": 0.1}
{"i": ["cuda", "schedule_conv3d_transpose_nchw_cuda", [[1, 192, 8, 8, 8], [192, 192, 3, 3, 3], [1, 1, 1], [1, 1, 1], [0, 0, 0], "float32"], {}, ["schedule_conv3d_transpose_nchw_cuda", [1, 192, 8, 8, 8], [192, 192, 3, 3, 3], [1, 1, 1], [1, 1, 1], [0, 0, 0], "float32"], {"i": 1394222028, "t": "", "c": null, "e": [["tile_f", "sp", [-1, 4, 3, 2]], ["tile_d", "sp", [-1, 1, 1, 2]], ["tile_y", "sp", [-1, 1, 2, 2]], ["tile_x", "sp", [-1, 1, 2, 2]], ["tile_rc", "sp", [-1, 1]], ["tile_rd", "sp", [-1, 3]], ["tile_ry", "sp", [-1, 1]], ["tile_rx", "sp", [-1, 3]], ["auto_unroll_max_step", "ot", 512], ["unroll_explicit", "ot", 1]]}], "r": [[0.0016543585, 0.00165345575], 0, 1.4337451457977295, 1578563104.7469828], "v": 0.1}
{"i": ["cuda", "schedule_conv3d_transpose_nchw_cuda", [[1, 192, 8, 8, 8], [192, 192, 3, 3, 3], [1, 1, 1], [1, 1, 1], [0, 0, 0], "float32"], {}, ["schedule_conv3d_transpose_nchw_cuda", [1, 192, 8, 8, 8], [192, 192, 3, 3, 3], [1, 1, 1], [1, 1, 1], [0, 0, 0], "float32"], {"i": 1695278028, "t": "", "c": null, "e": [["tile_f", "sp", [-1, 4, 3, 2]], ["tile_d", "sp", [-1, 1, 1, 2]], ["tile_y", "sp", [-1, 1, 2, 2]], ["tile_x", "sp", [-1, 1, 2, 2]], ["tile_rc", "sp", [-1, 1]], ["tile_rd", "sp", [-1, 3]], ["tile_ry", "sp", [-1, 1]], ["tile_rx", "sp", [-1, 3]], ["auto_unroll_max_step", "ot", 1500], ["unroll_explicit", "ot", 1]]}], "r": [[0.00189127925, 0.00189083025], 0, 1.9407293796539307, 1578563105.4763992], "v": 0.1}
{"i": ["cuda", "schedule_conv3d_transpose_nchw_cuda", [[1, 192, 8, 8, 8], [192, 192, 3, 3, 3], [1, 1, 1], [1, 1, 1], [0, 0, 0], "float32"], {}, ["schedule_conv3d_transpose_nchw_cuda", [1, 192, 8, 8, 8], [192, 192, 3, 3, 3], [1, 1, 1], [1, 1, 1], [0, 0, 0], "float32"], {"i": 1319122721, "t": "", "c": null, "e": [["tile_f", "sp", [-1, 2, 4, 3]], ["tile_d", "sp", [-1, 1, 1, 1]], ["tile_y", "sp", [-1, 1, 2, 4]], ["tile_x", "sp", [-1, 2, 2, 2]], ["tile_rc", "sp", [-1, 1]], ["tile_rd", "sp", [-1, 3]], ["tile_ry", "sp", [-1, 3]], ["tile_rx", "sp", [-1, 1]], ["auto_unroll_max_step", "ot", 512], ["unroll_explicit", "ot", 1]]}], "r": [[0.00149327525, 0.001493536], 0, 1.6220703125, 1578563106.128264], "v": 0.1}
{"i": ["cuda", "schedule_conv3d_transpose_nchw_cuda", [[1, 192, 8, 8, 8], [192, 192, 3, 3, 3], [1, 1, 1], [1, 1, 1], [0, 0, 0], "float32"], {}, ["schedule_conv3d_transpose_nchw_cuda", [1, 192, 8, 8, 8], [192, 192, 3, 3, 3], [1, 1, 1], [1, 1, 1], [0, 0, 0], "float32"], {"i": 1620178721, "t": "", "c": null, "e": [["tile_f", "sp", [-1, 2, 4, 3]], ["tile_d", "sp", [-1, 1, 1, 1]], ["tile_y", "sp", [-1, 1, 2, 4]], ["tile_x", "sp", [-1, 2, 2, 2]], ["tile_rc", "sp", [-1, 1]], ["tile_rd", "sp", [-1, 3]], ["tile_ry", "sp", [-1, 3]], ["tile_rx", "sp", [-1, 1]], ["auto_unroll_max_step", "ot", 1500], ["unroll_explicit", "ot", 1]]}], "r": [[0.00453560925, 0.00453677575], 0, 2.455052375793457, 1578563107.0492067], "v": 0.1}
{"i": ["cuda", "schedule_conv3d_transpose_nchw_cuda", [[1, 192, 8, 8, 8], [192, 192, 3, 3, 3], [1, 1, 1], [1, 1, 1], [0, 0, 0], "float32"], {}, ["schedule_conv3d_transpose_nchw_cuda", [1, 192, 8, 8, 8], [192, 192, 3, 3, 3], [1, 1, 1], [1, 1, 1], [0, 0, 0], "float32"], {"i": 1018066721, "t": "", "c": null, "e": [["tile_f", "sp", [-1, 2, 4, 3]], ["tile_d", "sp", [-1, 1, 1, 1]], ["tile_y", "sp", [-1, 1, 2, 4]], ["tile_x", "sp", [-1, 2, 2, 2]], ["tile_rc", "sp", [-1, 1]], ["tile_rd", "sp", [-1, 3]], ["tile_ry", "sp", [-1, 3]], ["tile_rx", "sp", [-1, 1]], ["auto_unroll_max_step", "ot", 0], ["unroll_explicit", "ot", 1]]}], "r": [[0.00458006825, 0.00457840775], 0, 1.1233210563659668, 1578563107.6700072], "v": 0.1}
{"i": ["cuda", "schedule_conv3d_transpose_nchw_cuda", [[1, 192, 8, 8, 8], [192, 192, 3, 3, 3], [1, 1, 1], [1, 1, 1], [0, 0, 0], "float32"], {}, ["schedule_conv3d_transpose_nchw_cuda", [1, 192, 8, 8, 8], [192, 192, 3, 3, 3], [1, 1, 1], [1, 1, 1], [0, 0, 0], "float32"], {"i": 1694077547, "t": "", "c": null, "e": [["tile_f", "sp", [-1, 2, 2, 3]], ["tile_d", "sp", [-1, 2, 1, 4]], ["tile_y", "sp", [-1, 2, 2, 2]], ["tile_x", "sp", [-1, 1, 2, 1]], ["tile_rc", "sp", [-1, 1]], ["tile_rd", "sp", [-1, 3]], ["tile_ry", "sp", [-1, 1]], ["tile_rx", "sp", [-1, 3]], ["auto_unroll_max_step", "ot", 1500], ["unroll_explicit", "ot", 1]]}], "r": [[0.0061113085, 0.006111924], 0, 2.337217330932617, 1578563108.5123491], "v": 0.1}
{"i": ["cuda", "schedule_conv3d_transpose_nchw_cuda", [[1, 192, 8, 8, 8], [192, 192, 3, 3, 3], [1, 1, 1], [1, 1, 1], [0, 0, 0], "float32"], {}, ["schedule_conv3d_transpose_nchw_cuda", [1, 192, 8, 8, 8], [192, 192, 3, 3, 3], [1, 1, 1], [1, 1, 1], [0, 0, 0], "float32"], {"i": 1393021547, "t": "", "c": null, "e": [["tile_f", "sp", [-1, 2, 2, 3]], ["tile_d", "sp", [-1, 2, 1, 4]], ["tile_y", "sp", [-1, 2, 2, 2]], ["tile_x", "sp", [-1, 1, 2, 1]], ["tile_rc", "sp", [-1, 1]], ["tile_rd", "sp", [-1, 3]], ["tile_ry", "sp", [-1, 1]], ["tile_rx", "sp", [-1, 3]], ["auto_unroll_max_step", "ot", 512], ["unroll_explicit", "ot", 1]]}], "r": [[0.006070219, 0.00607057475], 0, 1.897477388381958, 1578563109.2880883], "v": 0.1}
{"i": ["cuda", "schedule_conv3d_transpose_nchw_cuda", [[1, 192, 8, 8, 8], [192, 192, 3, 3, 3], [1, 1, 1], [1, 1, 1], [0, 0, 0], "float32"], {}, ["schedule_conv3d_transpose_nchw_cuda", [1, 192, 8, 8, 8], [192, 192, 3, 3, 3], [1, 1, 1], [1, 1, 1], [0, 0, 0], "float32"], {"i": 1091965547, "t": "", "c": null, "e": [["tile_f", "sp", [-1, 2, 2, 3]], ["tile_d", "sp", [-1, 2, 1, 4]], ["tile_y", "sp", [-1, 2, 2, 2]], ["tile_x", "sp", [-1, 1, 2, 1]], ["tile_rc", "sp", [-1, 1]], ["tile_rd", "sp", [-1, 3]], ["tile_ry", "sp", [-1, 1]], ["tile_rx", "sp", [-1, 3]], ["auto_unroll_max_step", "ot", 0], ["unroll_explicit", "ot", 1]]}], "r": [[0.00804284575, 0.00804133], 0, 1.4024901390075684, 1578563110.0373483], "v": 0.1}
{"i": ["cuda", "schedule_conv3d_transpose_nchw_cuda", [[1, 192, 8, 8, 8], [192, 192, 3, 3, 3], [1, 1, 1], [1, 1, 1], [0, 0, 0], "float32"], {}, ["schedule_conv3d_transpose_nchw_cuda", [1, 192, 8, 8, 8], [192, 192, 3, 3, 3], [1, 1, 1], [1, 1, 1], [0, 0, 0], "float32"], {"i": 114740754, "t": "", "c": null, "e": [["tile_f", "sp", [-1, 3, 4, 2]], ["tile_d", "sp", [-1, 1, 1, 2]], ["tile_y", "sp", [-1, 2, 2, 2]], ["tile_x", "sp", [-1, 1, 2, 2]], ["tile_rc", "sp", [-1, 1]], ["tile_rd", "sp", [-1, 3]], ["tile_ry", "sp", [-1, 3]], ["tile_rx", "sp", [-1, 1]], ["auto_unroll_max_step", "ot", 0], ["unroll_explicit", "ot", 0]]}], "r": [[0.00336641625, 0.003366911], 0, 1.0856349468231201, 1578563110.5796752], "v": 0.1}
{"i": ["cuda", "schedule_conv3d_transpose_nchw_cuda", [[1, 192, 8, 8, 8], [192, 192, 3, 3, 3], [1, 1, 1], [1, 1, 1], [0, 0, 0], "float32"], {}, ["schedule_conv3d_transpose_nchw_cuda", [1, 192, 8, 8, 8], [192, 192, 3, 3, 3], [1, 1, 1], [1, 1, 1], [0, 0, 0], "float32"], {"i": 1431768626, "t": "", "c": null, "e": [["tile_f", "sp", [-1, 2, 8, 1]], ["tile_d", "sp", [-1, 1, 1, 4]], ["tile_y", "sp", [-1, 1, 1, 1]], ["tile_x", "sp", [-1, 1, 2, 2]], ["tile_rc", "sp", [-1, 1]], ["tile_rd", "sp", [-1, 1]], ["tile_ry", "sp", [-1, 3]], ["tile_rx", "sp", [-1, 3]], ["auto_unroll_max_step", "ot", 512], ["unroll_explicit", "ot", 1]]}], "r": [[0.000722513, 0.0007223785], 0, 1.4993774890899658, 1578563342.8557851], "v": 0.1}
{"i": ["cuda", "schedule_conv3d_transpose_nchw_cuda", [[1, 192, 8, 8, 8], [192, 192, 3, 3, 3], [1, 1, 1], [1, 1, 1], [0, 0, 0], "float32"], {}, ["schedule_conv3d_transpose_nchw_cuda", [1, 192, 8, 8, 8], [192, 192, 3, 3, 3], [1, 1, 1], [1, 1, 1], [0, 0, 0], "float32"], {"i": 1431835826, "t": "", "c": null, "e": [["tile_f", "sp", [-1, 2, 8, 1]], ["tile_d", "sp", [-1, 1, 1, 4]], ["tile_y", "sp", [-1, 1, 1, 2]], ["tile_x", "sp", [-1, 1, 2, 2]], ["tile_rc", "sp", [-1, 1]], ["tile_rd", "sp", [-1, 1]], ["tile_ry", "sp", [-1, 3]], ["tile_rx", "sp", [-1, 3]], ["auto_unroll_max_step", "ot", 512], ["unroll_explicit", "ot", 1]]}], "r": [[0.00069968125, 0.0006976345], 0, 1.2838528156280518, 1578563343.3946097], "v": 0.1}
{"i": ["cuda", "schedule_conv3d_transpose_nchw_cuda", [[1, 192, 8, 8, 8], [192, 192, 3, 3, 3], [1, 1, 1], [1, 1, 1], [0, 0, 0], "float32"], {}, ["schedule_conv3d_transpose_nchw_cuda", [1, 192, 8, 8, 8], [192, 192, 3, 3, 3], [1, 1, 1], [1, 1, 1], [0, 0, 0], "float32"], {"i": 1732824626, "t": "", "c": null, "e": [["tile_f", "sp", [-1, 2, 8, 1]], ["tile_d", "sp", [-1, 1, 1, 4]], ["tile_y", "sp", [-1, 1, 1, 1]], ["tile_x", "sp", [-1, 1, 2, 2]], ["tile_rc", "sp", [-1, 1]], ["tile_rd", "sp", [-1, 1]], ["tile_ry", "sp", [-1, 3]], ["tile_rx", "sp", [-1, 3]], ["auto_unroll_max_step", "ot", 1500], ["unroll_explicit", "ot", 1]]}], "r": [[0.0007229425, 0.0007247265], 0, 1.394538402557373, 1578563343.9020743], "v": 0.1}
{"i": ["cuda", "schedule_conv3d_transpose_nchw_cuda", [[1, 192, 8, 8, 8], [192, 192, 3, 3, 3], [1, 1, 1], [1, 1, 1], [0, 0, 0], "float32"], {}, ["schedule_conv3d_transpose_nchw_cuda", [1, 192, 8, 8, 8], [192, 192, 3, 3, 3], [1, 1, 1], [1, 1, 1], [0, 0, 0], "float32"], {"i": 1432218866, "t": "", "c": null, "e": [["tile_f", "sp", [-1, 2, 8, 1]], ["tile_d", "sp", [-1, 1, 1, 4]], ["tile_y", "sp", [-1, 1, 4, 1]], ["tile_x", "sp", [-1, 1, 1, 4]], ["tile_rc", "sp", [-1, 1]], ["tile_rd", "sp", [-1, 1]], ["tile_ry", "sp", [-1, 3]], ["tile_rx", "sp", [-1, 3]], ["auto_unroll_max_step", "ot", 512], ["unroll_explicit", "ot", 1]]}], "r": [[0.00105415425, 0.0010540595], 0, 1.3733298778533936, 1578563344.5083992], "v": 0.1}
{"i": ["cuda", "schedule_conv3d_transpose_nchw_cuda", [[1, 192, 8, 8, 8], [192, 192, 3, 3, 3], [1, 1, 1], [1, 1, 1], [0, 0, 0], "float32"], {}, ["schedule_conv3d_transpose_nchw_cuda", [1, 192, 8, 8, 8], [192, 192, 3, 3, 3], [1, 1, 1], [1, 1, 1], [0, 0, 0], "float32"], {"i": 1394136626, "t": "", "c": null, "e": [["tile_f", "sp", [-1, 2, 8, 1]], ["tile_d", "sp", [-1, 1, 1, 4]], ["tile_y", "sp", [-1, 1, 1, 1]], ["tile_x", "sp", [-1, 1, 2, 2]], ["tile_rc", "sp", [-1, 1]], ["tile_rd", "sp", [-1, 3]], ["tile_ry", "sp", [-1, 1]], ["tile_rx", "sp", [-1, 3]], ["auto_unroll_max_step", "ot", 512], ["unroll_explicit", "ot", 1]]}], "r": [[0.00066177625, 0.00066083575], 0, 1.3980581760406494, 1578563345.0680566], "v": 0.1}
{"i": ["cuda", "schedule_conv3d_transpose_nchw_cuda", [[1, 192, 8, 8, 8], [192, 192, 3, 3, 3], [1, 1, 1], [1, 1, 1], [0, 0, 0], "float32"], {}, ["schedule_conv3d_transpose_nchw_cuda", [1, 192, 8, 8, 8], [192, 192, 3, 3, 3], [1, 1, 1], [1, 1, 1], [0, 0, 0], "float32"], {"i": 1431768701, "t": "", "c": null, "e": [["tile_f", "sp", [-1, 1, 8, 2]], ["tile_d", "sp", [-1, 1, 1, 4]], ["tile_y", "sp", [-1, 1, 1, 1]], ["tile_x", "sp", [-1, 1, 2, 2]], ["tile_rc", "sp", [-1, 1]], ["tile_rd", "sp", [-1, 1]], ["tile_ry", "sp", [-1, 3]], ["tile_rx", "sp", [-1, 3]], ["auto_unroll_max_step", "ot", 512], ["unroll_explicit", "ot", 1]]}], "r": [[0.00058788775, 0.00058659325], 0, 1.4347856044769287, 1578563345.6508853], "v": 0.1}
{"i": ["cuda", "schedule_conv3d_transpose_nchw_cuda", [[1, 192, 8, 8, 8], [192, 192, 3, 3, 3], [1, 1, 1], [1, 1, 1], [0, 0, 0], "float32"], {}, ["schedule_conv3d_transpose_nchw_cuda", [1, 192, 8, 8, 8], [192, 192, 3, 3, 3], [1, 1, 1], [1, 1, 1], [0, 0, 0], "float32"], {"i": 1431795581, "t": "", "c": null, "e": [["tile_f", "sp", [-1, 1, 8, 2]], ["tile_d", "sp", [-1, 1, 1, 4]], ["tile_y", "sp", [-1, 1, 2, 1]], ["tile_x", "sp", [-1, 1, 2, 2]], ["tile_rc", "sp", [-1, 1]], ["tile_rd", "sp", [-1, 1]], ["tile_ry", "sp", [-1, 3]], ["tile_rx", "sp", [-1, 3]], ["auto_unroll_max_step", "ot", 512], ["unroll_explicit", "ot", 1]]}], "r": [[0.00043314625, 0.00043338475], 0, 1.453719139099121, 1578563346.2197077], "v": 0.1}
{"i": ["cuda", "schedule_conv3d_transpose_nchw_cuda", [[1, 192, 8, 8, 8], [192, 192, 3, 3, 3], [1, 1, 1], [1, 1, 1], [0, 0, 0], "float32"], {}, ["schedule_conv3d_transpose_nchw_cuda", [1, 192, 8, 8, 8], [192, 192, 3, 3, 3], [1, 1, 1], [1, 1, 1], [0, 0, 0], "float32"], {"i": 1431412541, "t": "", "c": null, "e": [["tile_f", "sp", [-1, 1, 8, 2]], ["tile_d", "sp", [-1, 1, 1, 4]], ["tile_y", "sp", [-1, 1, 4, 1]], ["tile_x", "sp", [-1, 1, 1, 2]], ["tile_rc", "sp", [-1, 1]], ["tile_rd", "sp", [-1, 1]], ["tile_ry", "sp", [-1, 3]], ["tile_rx", "sp", [-1, 3]], ["auto_unroll_max_step", "ot", 512], ["unroll_explicit", "ot", 1]]}], "r": [[0.00037757, 0.000375485], 0, 1.4121544361114502, 1578563346.8024879], "v": 0.1}
{"i": ["cuda", "schedule_conv3d_transpose_nchw_cuda", [[1, 192, 8, 8, 8], [192, 192, 3, 3, 3], [1, 1, 1], [1, 1, 1], [0, 0, 0], "float32"], {}, ["schedule_conv3d_transpose_nchw_cuda", [1, 192, 8, 8, 8], [192, 192, 3, 3, 3], [1, 1, 1], [1, 1, 1], [0, 0, 0], "float32"], {"i": 1393780529, "t": "", "c": null, "e": [["tile_f", "sp", [-1, 2, 4, 2]], ["tile_d", "sp", [-1, 1, 1, 4]], ["tile_y", "sp", [-1, 1, 4, 1]], ["tile_x", "sp", [-1, 1, 1, 2]], ["tile_rc", "sp", [-1, 1]], ["tile_rd", "sp", [-1, 3]], ["tile_ry", "sp", [-1, 1]], ["tile_rx", "sp", [-1, 3]], ["auto_unroll_max_step", "ot", 512], ["unroll_explicit", "ot", 1]]}], "r": [[0.001248734, 0.001247076], 0, 1.3372018337249756, 1578563347.390293], "v": 0.1}
{"i": ["cuda", "schedule_conv3d_transpose_nchw_cuda", [[1, 192, 8, 8, 8], [192, 192, 3, 3, 3], [1, 1, 1], [1, 1, 1], [0, 0, 0], "float32"], {}, ["schedule_conv3d_transpose_nchw_cuda", [1, 192, 8, 8, 8], [192, 192, 3, 3, 3], [1, 1, 1], [1, 1, 1], [0, 0, 0], "float32"], {"i": 1431768697, "t": "", "c": null, "e": [["tile_f", "sp", [-1, 2, 6, 2]], ["tile_d", "sp", [-1, 1, 1, 4]], ["tile_y", "sp", [-1, 1, 1, 1]], ["tile_x", "sp", [-1, 1, 2, 2]], ["tile_rc", "sp", [-1, 1]], ["tile_rd", "sp", [-1, 1]], ["tile_ry", "sp", [-1, 3]], ["tile_rx", "sp", [-1, 3]], ["auto_unroll_max_step", "ot", 512], ["unroll_explicit", "ot", 1]]}], "r": [[0.00079952625, 0.0007978215], 0, 1.3359622955322266, 1578563347.9599557], "v": 0.1}
{"i": ["cuda", "schedule_conv3d_transpose_nchw_cuda", [[1, 192, 8, 8, 8], [192, 192, 3, 3, 3], [1, 1, 1], [1, 1, 1], [0, 0, 0], "float32"], {}, ["schedule_conv3d_transpose_nchw_cuda", [1, 192, 8, 8, 8], [192, 192, 3, 3, 3], [1, 1, 1], [1, 1, 1], [0, 0, 0], "float32"], {"i": 528600626, "t": "", "c": null, "e": [["tile_f", "sp", [-1, 2, 8, 1]], ["tile_d", "sp", [-1, 1, 1, 4]], ["tile_y", "sp", [-1, 1, 1, 1]], ["tile_x", "sp", [-1, 1, 2, 2]], ["tile_rc", "sp", [-1, 1]], ["tile_rd", "sp", [-1, 1]], ["tile_ry", "sp", [-1, 3]], ["tile_rx", "sp", [-1, 3]], ["auto_unroll_max_step", "ot", 512], ["unroll_explicit", "ot", 0]]}], "r": [[0.000969427, 0.00097022725], 0, 1.1251258850097656, 1578563348.5617354], "v": 0.1}
