auto_log/((1, 1, 64, 128, 128), (24, 1, 1, 5, 5), (1, 24, 64, 64, 64), (1, 2, 2), (0, 2, 2), 1, 1, None)_fwd.log
{"i": ["cuda", "schedule_direct_3d_cuda", [[1, 1, 64, 128, 128], [24, 1, 1, 5, 5], [1, 2, 2], [0, 2, 2], 1], {}, ["schedule_direct_3d_cuda", [1, 1, 64, 128, 128], [24, 1, 1, 5, 5], [1, 2, 2], [0, 2, 2], 1], {"i": 674498251, "t": "", "c": null, "e": [["tile_f", "sp", [-1, 4, 2, 1]], ["tile_d", "sp", [-1, 1, 1, 8]], ["tile_y", "sp", [-1, 2, 1, 16]], ["tile_x", "sp", [-1, 1, 8, 1]], ["tile_rc", "sp", [-1, 1]], ["tile_rd", "sp", [-1, 1]], ["tile_ry", "sp", [-1, 1]], ["tile_rx", "sp", [-1, 5]], ["auto_unroll_max_step", "ot", 0], ["unroll_explicit", "ot", 1]]}], "r": [[0.01211285775, 0.0121066325], 0, 1.6346254348754883, 1578489124.2014427], "v": 0.1}
{"i": ["cuda", "schedule_direct_3d_cuda", [[1, 1, 64, 128, 128], [24, 1, 1, 5, 5], [1, 2, 2], [0, 2, 2], 1], {}, ["schedule_direct_3d_cuda", [1, 1, 64, 128, 128], [24, 1, 1, 5, 5], [1, 2, 2], [0, 2, 2], 1], {"i": 1015163528, "t": "", "c": null, "e": [["tile_f", "sp", [-1, 1, 2, 1]], ["tile_d", "sp", [-1, 1, 1, 1]], ["tile_y", "sp", [-1, 1, 2, 2]], ["tile_x", "sp", [-1, 1, 2, 2]], ["tile_rc", "sp", [-1, 1]], ["tile_rd", "sp", [-1, 1]], ["tile_ry", "sp", [-1, 5]], ["tile_rx", "sp", [-1, 1]], ["auto_unroll_max_step", "ot", 1500], ["unroll_explicit", "ot", 1]]}], "r": [[0.00391103325, 0.00391005175], 0, 1.084402084350586, 1578489124.8890548], "v": 0.1}
{"i": ["cuda", "schedule_direct_3d_cuda", [[1, 1, 64, 128, 128], [24, 1, 1, 5, 5], [1, 2, 2], [0, 2, 2], 1], {}, ["schedule_direct_3d_cuda", [1, 1, 64, 128, 128], [24, 1, 1, 5, 5], [1, 2, 2], [0, 2, 2], 1], {"i": 807601322, "t": "", "c": null, "e": [["tile_f", "sp", [-1, 4, 3, 2]], ["tile_d", "sp", [-1, 1, 1, 8]], ["tile_y", "sp", [-1, 1, 4, 4]], ["tile_x", "sp", [-1, 4, 1, 1]], ["tile_rc", "sp", [-1, 1]], ["tile_rd", "sp", [-1, 1]], ["tile_ry", "sp", [-1, 5]], ["tile_rx", "sp", [-1, 1]], ["auto_unroll_max_step", "ot", 512], ["unroll_explicit", "ot", 1]]}], "r": [[0.00932140475, 0.00917371025], 0, 7.5027172565460205, 1578489132.985339], "v": 0.1}
{"i": ["cuda", "schedule_direct_3d_cuda", [[1, 1, 64, 128, 128], [24, 1, 1, 5, 5], [1, 2, 2], [0, 2, 2], 1], {}, ["schedule_direct_3d_cuda", [1, 1, 64, 128, 128], [24, 1, 1, 5, 5], [1, 2, 2], [0, 2, 2], 1], {"i": 300545329, "t": "", "c": null, "e": [["tile_f", "sp", [-1, 2, 1, 3]], ["tile_d", "sp", [-1, 1, 1, 1]], ["tile_y", "sp", [-1, 4, 2, 2]], ["tile_x", "sp", [-1, 1, 1, 2]], ["tile_rc", "sp", [-1, 1]], ["tile_rd", "sp", [-1, 1]], ["tile_ry", "sp", [-1, 1]], ["tile_rx", "sp", [-1, 5]], ["auto_unroll_max_step", "ot", 512], ["unroll_explicit", "ot", 0]]}], "r": [[0.047228926, 0.044462715], 0, 2.4470715522766113, 1578489135.717523], "v": 0.1}
{"i": ["cuda", "schedule_direct_3d_cuda", [[1, 1, 64, 128, 128], [24, 1, 1, 5, 5], [1, 2, 2], [0, 2, 2], 1], {}, ["schedule_direct_3d_cuda", [1, 1, 64, 128, 128], [24, 1, 1, 5, 5], [1, 2, 2], [0, 2, 2], 1], {"i": 855200449, "t": "", "c": null, "e": [["tile_f", "sp", [-1, 2, 1, 3]], ["tile_d", "sp", [-1, 2, 1, 32]], ["tile_y", "sp", [-1, 2, 1, 1]], ["tile_x", "sp", [-1, 8, 1, 1]], ["tile_rc", "sp", [-1, 1]], ["tile_rd", "sp", [-1, 1]], ["tile_ry", "sp", [-1, 1]], ["tile_rx", "sp", [-1, 5]], ["auto_unroll_max_step", "ot", 512], ["unroll_explicit", "ot", 1]]}], "r": [[0.1837407485, 0.184006124], 0, 2.8836610317230225, 1578489138.0993497], "v": 0.1}
{"i": ["cuda", "schedule_direct_3d_cuda", [[1, 1, 64, 128, 128], [24, 1, 1, 5, 5], [1, 2, 2], [0, 2, 2], 1], {}, ["schedule_direct_3d_cuda", [1, 1, 64, 128, 128], [24, 1, 1, 5, 5], [1, 2, 2], [0, 2, 2], 1], {"i": 692392623, "t": "", "c": null, "e": [["tile_f", "sp", [-1, 3, 2, 4]], ["tile_d", "sp", [-1, 4, 1, 4]], ["tile_y", "sp", [-1, 2, 1, 4]], ["tile_x", "sp", [-1, 2, 1, 4]], ["tile_rc", "sp", [-1, 1]], ["tile_rd", "sp", [-1, 1]], ["tile_ry", "sp", [-1, 1]], ["tile_rx", "sp", [-1, 5]], ["auto_unroll_max_step", "ot", 0], ["unroll_explicit", "ot", 1]]}], "r": [[0.056819523, 0.05566795325], 0, 2.0378992557525635, 1578489140.7970428], "v": 0.1}
{"i": ["cuda", "schedule_direct_3d_cuda", [[1, 1, 64, 128, 128], [24, 1, 1, 5, 5], [1, 2, 2], [0, 2, 2], 1], {}, ["schedule_direct_3d_cuda", [1, 1, 64, 128, 128], [24, 1, 1, 5, 5], [1, 2, 2], [0, 2, 2], 1], {"i": 180078164, "t": "", "c": null, "e": [["tile_f", "sp", [-1, 6, 1, 1]], ["tile_d", "sp", [-1, 2, 1, 2]], ["tile_y", "sp", [-1, 2, 1, 1]], ["tile_x", "sp", [-1, 8, 1, 8]], ["tile_rc", "sp", [-1, 1]], ["tile_rd", "sp", [-1, 1]], ["tile_ry", "sp", [-1, 5]], ["tile_rx", "sp", [-1, 5]], ["auto_unroll_max_step", "ot", 0], ["unroll_explicit", "ot", 0]]}], "r": [[0.174914115, 0.17496892225], 0, 3.5021862983703613, 1578489144.5945306], "v": 0.1}
{"i": ["cuda", "schedule_direct_3d_cuda", [[1, 1, 64, 128, 128], [24, 1, 1, 5, 5], [1, 2, 2], [0, 2, 2], 1], {}, ["schedule_direct_3d_cuda", [1, 1, 64, 128, 128], [24, 1, 1, 5, 5], [1, 2, 2], [0, 2, 2], 1], {"i": 102537717, "t": "", "c": null, "e": [["tile_f", "sp", [-1, 2, 2, 2]], ["tile_d", "sp", [-1, 1, 1, 4]], ["tile_y", "sp", [-1, 1, 2, 4]], ["tile_x", "sp", [-1, 1, 4, 1]], ["tile_rc", "sp", [-1, 1]], ["tile_rd", "sp", [-1, 1]], ["tile_ry", "sp", [-1, 1]], ["tile_rx", "sp", [-1, 5]], ["auto_unroll_max_step", "ot", 0], ["unroll_explicit", "ot", 0]]}], "r": [[0.001296278, 0.00129501075], 0, 1.0275654792785645, 1578489317.6327527], "v": 0.1}
{"i": ["cuda", "schedule_direct_3d_cuda", [[1, 1, 64, 128, 128], [24, 1, 1, 5, 5], [1, 2, 2], [0, 2, 2], 1], {}, ["schedule_direct_3d_cuda", [1, 1, 64, 128, 128], [24, 1, 1, 5, 5], [1, 2, 2], [0, 2, 2], 1], {"i": 123672095, "t": "", "c": null, "e": [["tile_f", "sp", [-1, 2, 3, 1]], ["tile_d", "sp", [-1, 1, 1, 4]], ["tile_y", "sp", [-1, 1, 2, 1]], ["tile_x", "sp", [-1, 4, 1, 4]], ["tile_rc", "sp", [-1, 1]], ["tile_rd", "sp", [-1, 1]], ["tile_ry", "sp", [-1, 1]], ["tile_rx", "sp", [-1, 5]], ["auto_unroll_max_step", "ot", 0], ["unroll_explicit", "ot", 0]]}], "r": [[0.00229483525, 0.00229430825], 0, 1.1665475368499756, 1578489318.2327852], "v": 0.1}
{"i": ["cuda", "schedule_direct_3d_cuda", [[1, 1, 64, 128, 128], [24, 1, 1, 5, 5], [1, 2, 2], [0, 2, 2], 1], {}, ["schedule_direct_3d_cuda", [1, 1, 64, 128, 128], [24, 1, 1, 5, 5], [1, 2, 2], [0, 2, 2], 1], {"i": 103073640, "t": "", "c": null, "e": [["tile_f", "sp", [-1, 1, 3, 2]], ["tile_d", "sp", [-1, 1, 1, 2]], ["tile_y", "sp", [-1, 2, 1, 4]], ["tile_x", "sp", [-1, 2, 4, 1]], ["tile_rc", "sp", [-1, 1]], ["tile_rd", "sp", [-1, 1]], ["tile_ry", "sp", [-1, 1]], ["tile_rx", "sp", [-1, 5]], ["auto_unroll_max_step", "ot", 0], ["unroll_explicit", "ot", 0]]}], "r": [[0.00153158925, 0.0015311695], 0, 1.0487029552459717, 1578489318.7894504], "v": 0.1}
{"i": ["cuda", "schedule_direct_3d_cuda", [[1, 1, 64, 128, 128], [24, 1, 1, 5, 5], [1, 2, 2], [0, 2, 2], 1], {}, ["schedule_direct_3d_cuda", [1, 1, 64, 128, 128], [24, 1, 1, 5, 5], [1, 2, 2], [0, 2, 2], 1], {"i": 292738920, "t": "", "c": null, "e": [["tile_f", "sp", [-1, 1, 3, 2]], ["tile_d", "sp", [-1, 1, 1, 2]], ["tile_y", "sp", [-1, 2, 1, 4]], ["tile_x", "sp", [-1, 2, 4, 1]], ["tile_rc", "sp", [-1, 1]], ["tile_rd", "sp", [-1, 1]], ["tile_ry", "sp", [-1, 1]], ["tile_rx", "sp", [-1, 5]], ["auto_unroll_max_step", "ot", 512], ["unroll_explicit", "ot", 0]]}], "r": [[0.004236159, 0.00422638225], 0, 2.015634536743164, 1578489319.6719718], "v": 0.1}
{"i": ["cuda", "schedule_direct_3d_cuda", [[1, 1, 64, 128, 128], [24, 1, 1, 5, 5], [1, 2, 2], [0, 2, 2], 1], {}, ["schedule_direct_3d_cuda", [1, 1, 64, 128, 128], [24, 1, 1, 5, 5], [1, 2, 2], [0, 2, 2], 1], {"i": 481864452, "t": "", "c": null, "e": [["tile_f", "sp", [-1, 1, 2, 3]], ["tile_d", "sp", [-1, 2, 1, 1]], ["tile_y", "sp", [-1, 1, 2, 4]], ["tile_x", "sp", [-1, 1, 4, 1]], ["tile_rc", "sp", [-1, 1]], ["tile_rd", "sp", [-1, 1]], ["tile_ry", "sp", [-1, 1]], ["tile_rx", "sp", [-1, 5]], ["auto_unroll_max_step", "ot", 1500], ["unroll_explicit", "ot", 0]]}], "r": [[0.00159205675, 0.0015939145], 0, 2.125593900680542, 1578489320.7078128], "v": 0.1}
{"i": ["cuda", "schedule_direct_3d_cuda", [[1, 1, 64, 128, 128], [24, 1, 1, 5, 5], [1, 2, 2], [0, 2, 2], 1], {}, ["schedule_direct_3d_cuda", [1, 1, 64, 128, 128], [24, 1, 1, 5, 5], [1, 2, 2], [0, 2, 2], 1], {"i": 131581535, "t": "", "c": null, "e": [["tile_f", "sp", [-1, 2, 3, 1]], ["tile_d", "sp", [-1, 1, 1, 4]], ["tile_y", "sp", [-1, 2, 2, 1]], ["tile_x", "sp", [-1, 2, 1, 8]], ["tile_rc", "sp", [-1, 1]], ["tile_rd", "sp", [-1, 1]], ["tile_ry", "sp", [-1, 1]], ["tile_rx", "sp", [-1, 5]], ["auto_unroll_max_step", "ot", 0], ["unroll_explicit", "ot", 0]]}], "r": [[0.00778346, 0.007783418], 0, 1.484137773513794, 1578489321.3966672], "v": 0.1}
{"i": ["cuda", "schedule_direct_3d_cuda", [[1, 1, 64, 128, 128], [24, 1, 1, 5, 5], [1, 2, 2], [0, 2, 2], 1], {}, ["schedule_direct_3d_cuda", [1, 1, 64, 128, 128], [24, 1, 1, 5, 5], [1, 2, 2], [0, 2, 2], 1], {"i": 122551851, "t": "", "c": null, "e": [["tile_f", "sp", [-1, 4, 2, 1]], ["tile_d", "sp", [-1, 1, 1, 16]], ["tile_y", "sp", [-1, 2, 2, 1]], ["tile_x", "sp", [-1, 1, 1, 4]], ["tile_rc", "sp", [-1, 1]], ["tile_rd", "sp", [-1, 1]], ["tile_ry", "sp", [-1, 1]], ["tile_rx", "sp", [-1, 5]], ["auto_unroll_max_step", "ot", 0], ["unroll_explicit", "ot", 0]]}], "r": [[0.0195482925, 0.0195226195], 0, 1.601585865020752, 1578489322.155404], "v": 0.1}
{"i": ["cuda", "schedule_direct_3d_cuda", [[1, 1, 64, 128, 128], [24, 1, 1, 5, 5], [1, 2, 2], [0, 2, 2], 1], {}, ["schedule_direct_3d_cuda", [1, 1, 64, 128, 128], [24, 1, 1, 5, 5], [1, 2, 2], [0, 2, 2], 1], {"i": 309103779, "t": "", "c": null, "e": [["tile_f", "sp", [-1, 2, 4, 1]], ["tile_d", "sp", [-1, 1, 1, 4]], ["tile_y", "sp", [-1, 1, 1, 4]], ["tile_x", "sp", [-1, 1, 8, 2]], ["tile_rc", "sp", [-1, 1]], ["tile_rd", "sp", [-1, 1]], ["tile_ry", "sp", [-1, 1]], ["tile_rx", "sp", [-1, 5]], ["auto_unroll_max_step", "ot", 512], ["unroll_explicit", "ot", 0]]}], "r": [[0.0007486555, 0.00075043825], 0, 1.456751823425293, 1578489322.8634553], "v": 0.1}
{"i": ["cuda", "schedule_direct_3d_cuda", [[1, 1, 64, 128, 128], [24, 1, 1, 5, 5], [1, 2, 2], [0, 2, 2], 1], {}, ["schedule_direct_3d_cuda", [1, 1, 64, 128, 128], [24, 1, 1, 5, 5], [1, 2, 2], [0, 2, 2], 1], {"i": 479178650, "t": "", "c": null, "e": [["tile_f", "sp", [-1, 3, 2, 1]], ["tile_d", "sp", [-1, 2, 1, 2]], ["tile_y", "sp", [-1, 1, 1, 16]], ["tile_x", "sp", [-1, 2, 2, 1]], ["tile_rc", "sp", [-1, 1]], ["tile_rd", "sp", [-1, 1]], ["tile_ry", "sp", [-1, 1]], ["tile_rx", "sp", [-1, 5]], ["auto_unroll_max_step", "ot", 1500], ["unroll_explicit", "ot", 0]]}], "r": [[0.01725235825, 0.01725613125], 0, 4.884599924087524, 1578489325.6826673], "v": 0.1}
{"i": ["cuda", "schedule_direct_3d_cuda", [[1, 1, 64, 128, 128], [24, 1, 1, 5, 5], [1, 2, 2], [0, 2, 2], 1], {}, ["schedule_direct_3d_cuda", [1, 1, 64, 128, 128], [24, 1, 1, 5, 5], [1, 2, 2], [0, 2, 2], 1], {"i": 485385652, "t": "", "c": null, "e": [["tile_f", "sp", [-1, 1, 2, 3]], ["tile_d", "sp", [-1, 1, 1, 1]], ["tile_y", "sp", [-1, 1, 1, 16]], ["tile_x", "sp", [-1, 2, 8, 1]], ["tile_rc", "sp", [-1, 1]], ["tile_rd", "sp", [-1, 1]], ["tile_ry", "sp", [-1, 1]], ["tile_rx", "sp", [-1, 5]], ["auto_unroll_max_step", "ot", 1500], ["unroll_explicit", "ot", 0]]}], "r": [[0.00255067, 0.00255620675], 0, 1.921651840209961, 1578489326.612706], "v": 0.1}
{"i": ["cuda", "schedule_direct_3d_cuda", [[1, 1, 64, 128, 128], [24, 1, 1, 5, 5], [1, 2, 2], [0, 2, 2], 1], {}, ["schedule_direct_3d_cuda", [1, 1, 64, 128, 128], [24, 1, 1, 5, 5], [1, 2, 2], [0, 2, 2], 1], {"i": 671529742, "t": "", "c": null, "e": [["tile_f", "sp", [-1, 1, 2, 4]], ["tile_d", "sp", [-1, 2, 1, 1]], ["tile_y", "sp", [-1, 1, 2, 4]], ["tile_x", "sp", [-1, 1, 4, 1]], ["tile_rc", "sp", [-1, 1]], ["tile_rd", "sp", [-1, 1]], ["tile_ry", "sp", [-1, 1]], ["tile_rx", "sp", [-1, 5]], ["auto_unroll_max_step", "ot", 0], ["unroll_explicit", "ot", 1]]}], "r": [[0.00101850275, 0.001017282], 0, 0.9804489612579346, 1578489327.1565332], "v": 0.1}
{"i": ["cuda", "schedule_direct_3d_cuda", [[1, 1, 64, 128, 128], [24, 1, 1, 5, 5], [1, 2, 2], [0, 2, 2], 1], {}, ["schedule_direct_3d_cuda", [1, 1, 64, 128, 128], [24, 1, 1, 5, 5], [1, 2, 2], [0, 2, 2], 1], {"i": 289551483, "t": "", "c": null, "e": [["tile_f", "sp", [-1, 1, 4, 2]], ["tile_d", "sp", [-1, 2, 1, 1]], ["tile_y", "sp", [-1, 1, 1, 32]], ["tile_x", "sp", [-1, 2, 2, 1]], ["tile_rc", "sp", [-1, 1]], ["tile_rd", "sp", [-1, 1]], ["tile_ry", "sp", [-1, 1]], ["tile_rx", "sp", [-1, 5]], ["auto_unroll_max_step", "ot", 512], ["unroll_explicit", "ot", 0]]}], "r": [[0.01379366375, 0.01345374775], 0, 8.14696478843689, 1578489331.0830274], "v": 0.1}
{"i": ["cuda", "schedule_direct_3d_cuda", [[1, 1, 64, 128, 128], [24, 1, 1, 5, 5], [1, 2, 2], [0, 2, 2], 1], {}, ["schedule_direct_3d_cuda", [1, 1, 64, 128, 128], [24, 1, 1, 5, 5], [1, 2, 2], [0, 2, 2], 1], {"i": 292202997, "t": "", "c": null, "e": [["tile_f", "sp", [-1, 2, 2, 2]], ["tile_d", "sp", [-1, 1, 1, 4]], ["tile_y", "sp", [-1, 1, 2, 4]], ["tile_x", "sp", [-1, 1, 4, 1]], ["tile_rc", "sp", [-1, 1]], ["tile_rd", "sp", [-1, 1]], ["tile_ry", "sp", [-1, 1]], ["tile_rx", "sp", [-1, 5]], ["auto_unroll_max_step", "ot", 512], ["unroll_explicit", "ot", 0]]}], "r": [[0.00153107325, 0.0015379705], 0, 1.644871473312378, 1578489336.5423243], "v": 0.1}
{"i": ["cuda", "schedule_direct_3d_cuda", [[1, 1, 64, 128, 128], [24, 1, 1, 5, 5], [1, 2, 2], [0, 2, 2], 1], {}, ["schedule_direct_3d_cuda", [1, 1, 64, 128, 128], [24, 1, 1, 5, 5], [1, 2, 2], [0, 2, 2], 1], {"i": 131853295, "t": "", "c": null, "e": [["tile_f", "sp", [-1, 2, 3, 1]], ["tile_d", "sp", [-1, 4, 1, 1]], ["tile_y", "sp", [-1, 1, 1, 4]], ["tile_x", "sp", [-1, 2, 1, 8]], ["tile_rc", "sp", [-1, 1]], ["tile_rd", "sp", [-1, 1]], ["tile_ry", "sp", [-1, 1]], ["tile_rx", "sp", [-1, 5]], ["auto_unroll_max_step", "ot", 0], ["unroll_explicit", "ot", 0]]}], "r": [[0.0158688035, 0.01588118825], 0, 1.8626360893249512, 1578489337.3404775], "v": 0.1}
{"i": ["cuda", "schedule_direct_3d_cuda", [[1, 1, 64, 128, 128], [24, 1, 1, 5, 5], [1, 2, 2], [0, 2, 2], 1], {}, ["schedule_direct_3d_cuda", [1, 1, 64, 128, 128], [24, 1, 1, 5, 5], [1, 2, 2], [0, 2, 2], 1], {"i": 133546735, "t": "", "c": null, "e": [["tile_f", "sp", [-1, 2, 3, 1]], ["tile_d", "sp", [-1, 4, 1, 1]], ["tile_y", "sp", [-1, 1, 1, 4]], ["tile_x", "sp", [-1, 1, 2, 8]], ["tile_rc", "sp", [-1, 1]], ["tile_rd", "sp", [-1, 1]], ["tile_ry", "sp", [-1, 1]], ["tile_rx", "sp", [-1, 5]], ["auto_unroll_max_step", "ot", 0], ["unroll_explicit", "ot", 0]]}], "r": [[0.00621346025, 0.00621310775], 0, 1.4621973037719727, 1578489338.024705], "v": 0.1}
{"i": ["cuda", "schedule_direct_3d_cuda", [[1, 1, 64, 128, 128], [24, 1, 1, 5, 5], [1, 2, 2], [0, 2, 2], 1], {}, ["schedule_direct_3d_cuda", [1, 1, 64, 128, 128], [24, 1, 1, 5, 5], [1, 2, 2], [0, 2, 2], 1], {"i": 319260600, "t": "", "c": null, "e": [["tile_f", "sp", [-1, 1, 3, 2]], ["tile_d", "sp", [-1, 2, 1, 1]], ["tile_y", "sp", [-1, 1, 1, 4]], ["tile_x", "sp", [-1, 1, 8, 4]], ["tile_rc", "sp", [-1, 1]], ["tile_rd", "sp", [-1, 1]], ["tile_ry", "sp", [-1, 1]], ["tile_rx", "sp", [-1, 5]], ["auto_unroll_max_step", "ot", 512], ["unroll_explicit", "ot", 0]]}], "r": [[0.00095372525, 0.00095229025], 0, 1.700052261352539, 1578489338.8017774], "v": 0.1}
{"i": ["cuda", "schedule_direct_3d_cuda", [[1, 1, 64, 128, 128], [24, 1, 1, 5, 5], [1, 2, 2], [0, 2, 2], 1], {}, ["schedule_direct_3d_cuda", [1, 1, 64, 128, 128], [24, 1, 1, 5, 5], [1, 2, 2], [0, 2, 2], 1], {"i": 512877295, "t": "", "c": null, "e": [["tile_f", "sp", [-1, 2, 3, 1]], ["tile_d", "sp", [-1, 4, 1, 1]], ["tile_y", "sp", [-1, 1, 1, 4]], ["tile_x", "sp", [-1, 1, 2, 8]], ["tile_rc", "sp", [-1, 1]], ["tile_rd", "sp", [-1, 1]], ["tile_ry", "sp", [-1, 1]], ["tile_rx", "sp", [-1, 5]], ["auto_unroll_max_step", "ot", 1500], ["unroll_explicit", "ot", 0]]}], "r": [[0.01727981275, 0.01728780275], 0, 7.885828733444214, 1578489342.3494177], "v": 0.1}
{"i": ["cuda", "schedule_direct_3d_cuda", [[1, 1, 64, 128, 128], [24, 1, 1, 5, 5], [1, 2, 2], [0, 2, 2], 1], {}, ["schedule_direct_3d_cuda", [1, 1, 64, 128, 128], [24, 1, 1, 5, 5], [1, 2, 2], [0, 2, 2], 1], {"i": 509160997, "t": "", "c": null, "e": [["tile_f", "sp", [-1, 2, 2, 2]], ["tile_d", "sp", [-1, 1, 1, 1]], ["tile_y", "sp", [-1, 1, 1, 1]], ["tile_x", "sp", [-1, 2, 8, 4]], ["tile_rc", "sp", [-1, 1]], ["tile_rd", "sp", [-1, 1]], ["tile_ry", "sp", [-1, 1]], ["tile_rx", "sp", [-1, 5]], ["auto_unroll_max_step", "ot", 1500], ["unroll_explicit", "ot", 0]]}], "r": [[0.000347047, 0.00034606025], 0, 1.3001713752746582, 1578489343.0131009], "v": 0.1}
{"i": ["cuda", "schedule_direct_3d_cuda", [[1, 1, 64, 128, 128], [24, 1, 1, 5, 5], [1, 2, 2], [0, 2, 2], 1], {}, ["schedule_direct_3d_cuda", [1, 1, 64, 128, 128], [24, 1, 1, 5, 5], [1, 2, 2], [0, 2, 2], 1], {"i": 861198837, "t": "", "c": null, "e": [["tile_f", "sp", [-1, 2, 2, 2]], ["tile_d", "sp", [-1, 1, 1, 4]], ["tile_y", "sp", [-1, 1, 2, 4]], ["tile_x", "sp", [-1, 1, 4, 1]], ["tile_rc", "sp", [-1, 1]], ["tile_rd", "sp", [-1, 1]], ["tile_ry", "sp", [-1, 1]], ["tile_rx", "sp", [-1, 5]], ["auto_unroll_max_step", "ot", 512], ["unroll_explicit", "ot", 1]]}], "r": [[0.000578559, 0.00057704075], 0, 1.6967313289642334, 1578489343.7124076], "v": 0.1}
{"i": ["cuda", "schedule_direct_3d_cuda", [[1, 1, 64, 128, 128], [24, 1, 1, 5, 5], [1, 2, 2], [0, 2, 2], 1], {}, ["schedule_direct_3d_cuda", [1, 1, 64, 128, 128], [24, 1, 1, 5, 5], [1, 2, 2], [0, 2, 2], 1], {"i": 503150499, "t": "", "c": null, "e": [["tile_f", "sp", [-1, 2, 4, 1]], ["tile_d", "sp", [-1, 1, 1, 4]], ["tile_y", "sp", [-1, 2, 1, 2]], ["tile_x", "sp", [-1, 4, 1, 4]], ["tile_rc", "sp", [-1, 1]], ["tile_rd", "sp", [-1, 1]], ["tile_ry", "sp", [-1, 1]], ["tile_rx", "sp", [-1, 5]], ["auto_unroll_max_step", "ot", 1500], ["unroll_explicit", "ot", 0]]}], "r": [[0.01647432425, 0.016499377], 0, 4.268783807754517, 1578489346.05146], "v": 0.1}
{"i": ["cuda", "schedule_direct_3d_cuda", [[1, 1, 64, 128, 128], [24, 1, 1, 5, 5], [1, 2, 2], [0, 2, 2], 1], {}, ["schedule_direct_3d_cuda", [1, 1, 64, 128, 128], [24, 1, 1, 5, 5], [1, 2, 2], [0, 2, 2], 1], {"i": 861195012, "t": "", "c": null, "e": [["tile_f", "sp", [-1, 1, 2, 3]], ["tile_d", "sp", [-1, 2, 1, 1]], ["tile_y", "sp", [-1, 1, 2, 4]], ["tile_x", "sp", [-1, 1, 4, 1]], ["tile_rc", "sp", [-1, 1]], ["tile_rd", "sp", [-1, 1]], ["tile_ry", "sp", [-1, 1]], ["tile_rx", "sp", [-1, 5]], ["auto_unroll_max_step", "ot", 512], ["unroll_explicit", "ot", 1]]}], "r": [[0.00042479725, 0.00042716425], 0, 1.2854604721069336, 1578489346.6097803], "v": 0.1}
{"i": ["cuda", "schedule_direct_3d_cuda", [[1, 1, 64, 128, 128], [24, 1, 1, 5, 5], [1, 2, 2], [0, 2, 2], 1], {}, ["schedule_direct_3d_cuda", [1, 1, 64, 128, 128], [24, 1, 1, 5, 5], [1, 2, 2], [0, 2, 2], 1], {"i": 683518171, "t": "", "c": null, "e": [["tile_f", "sp", [-1, 4, 2, 1]], ["tile_d", "sp", [-1, 2, 1, 1]], ["tile_y", "sp", [-1, 1, 1, 16]], ["tile_x", "sp", [-1, 1, 2, 2]], ["tile_rc", "sp", [-1, 1]], ["tile_rd", "sp", [-1, 1]], ["tile_ry", "sp", [-1, 1]], ["tile_rx", "sp", [-1, 5]], ["auto_unroll_max_step", "ot", 0], ["unroll_explicit", "ot", 1]]}], "r": [[0.00829294325, 0.00829851925], 0, 1.466935157775879, 1578489347.304224], "v": 0.1}
{"i": ["cuda", "schedule_direct_3d_cuda", [[1, 1, 64, 128, 128], [24, 1, 1, 5, 5], [1, 2, 2], [0, 2, 2], 1], {}, ["schedule_direct_3d_cuda", [1, 1, 64, 128, 128], [24, 1, 1, 5, 5], [1, 2, 2], [0, 2, 2], 1], {"i": 684341855, "t": "", "c": null, "e": [["tile_f", "sp", [-1, 2, 3, 1]], ["tile_d", "sp", [-1, 1, 1, 4]], ["tile_y", "sp", [-1, 1, 1, 2]], ["tile_x", "sp", [-1, 4, 2, 2]], ["tile_rc", "sp", [-1, 1]], ["tile_rd", "sp", [-1, 1]], ["tile_ry", "sp", [-1, 1]], ["tile_rx", "sp", [-1, 5]], ["auto_unroll_max_step", "ot", 0], ["unroll_explicit", "ot", 1]]}], "r": [[0.00178104575, 0.00177953], 0, 1.0989840030670166, 1578489347.876416], "v": 0.1}
{"i": ["cuda", "schedule_direct_3d_cuda", [[1, 1, 64, 128, 128], [24, 1, 1, 5, 5], [1, 2, 2], [0, 2, 2], 1], {}, ["schedule_direct_3d_cuda", [1, 1, 64, 128, 128], [24, 1, 1, 5, 5], [1, 2, 2], [0, 2, 2], 1], {"i": 292199172, "t": "", "c": null, "e": [["tile_f", "sp", [-1, 1, 2, 3]], ["tile_d", "sp", [-1, 2, 1, 1]], ["tile_y", "sp", [-1, 1, 2, 4]], ["tile_x", "sp", [-1, 1, 4, 1]], ["tile_rc", "sp", [-1, 1]], ["tile_rd", "sp", [-1, 1]], ["tile_ry", "sp", [-1, 1]], ["tile_rx", "sp", [-1, 5]], ["auto_unroll_max_step", "ot", 512], ["unroll_explicit", "ot", 0]]}], "r": [[0.00116855075, 0.001167876], 0, 1.2872190475463867, 1578489348.5128658], "v": 0.1}
{"i": ["cuda", "schedule_direct_3d_cuda", [[1, 1, 64, 128, 128], [24, 1, 1, 5, 5], [1, 2, 2], [0, 2, 2], 1], {}, ["schedule_direct_3d_cuda", [1, 1, 64, 128, 128], [24, 1, 1, 5, 5], [1, 2, 2], [0, 2, 2], 1], {"i": 319495717, "t": "", "c": null, "e": [["tile_f", "sp", [-1, 2, 2, 2]], ["tile_d", "sp", [-1, 1, 1, 1]], ["tile_y", "sp", [-1, 1, 1, 1]], ["tile_x", "sp", [-1, 2, 8, 4]], ["tile_rc", "sp", [-1, 1]], ["tile_rd", "sp", [-1, 1]], ["tile_ry", "sp", [-1, 1]], ["tile_rx", "sp", [-1, 5]], ["auto_unroll_max_step", "ot", 512], ["unroll_explicit", "ot", 0]]}], "r": [[0.0002811565, 0.000281024], 0, 0.9560790061950684, 1578489359.3537743], "v": 0.1}
{"i": ["cuda", "schedule_direct_3d_cuda", [[1, 1, 64, 128, 128], [24, 1, 1, 5, 5], [1, 2, 2], [0, 2, 2], 1], {}, ["schedule_direct_3d_cuda", [1, 1, 64, 128, 128], [24, 1, 1, 5, 5], [1, 2, 2], [0, 2, 2], 1], {"i": 891925610, "t": "", "c": null, "e": [["tile_f", "sp", [-1, 3, 2, 1]], ["tile_d", "sp", [-1, 4, 1, 1]], ["tile_y", "sp", [-1, 1, 2, 1]], ["tile_x", "sp", [-1, 1, 2, 8]], ["tile_rc", "sp", [-1, 1]], ["tile_rd", "sp", [-1, 1]], ["tile_ry", "sp", [-1, 1]], ["tile_rx", "sp", [-1, 5]], ["auto_unroll_max_step", "ot", 512], ["unroll_explicit", "ot", 1]]}], "r": [[0.0010166155, 0.00101408275], 0, 2.025799512863159, 1578489360.1393917], "v": 0.1}
{"i": ["cuda", "schedule_direct_3d_cuda", [[1, 1, 64, 128, 128], [24, 1, 1, 5, 5], [1, 2, 2], [0, 2, 2], 1], {}, ["schedule_direct_3d_cuda", [1, 1, 64, 128, 128], [24, 1, 1, 5, 5], [1, 2, 2], [0, 2, 2], 1], {"i": 672069480, "t": "", "c": null, "e": [["tile_f", "sp", [-1, 1, 3, 2]], ["tile_d", "sp", [-1, 1, 1, 2]], ["tile_y", "sp", [-1, 2, 1, 4]], ["tile_x", "sp", [-1, 2, 4, 1]], ["tile_rc", "sp", [-1, 1]], ["tile_rd", "sp", [-1, 1]], ["tile_ry", "sp", [-1, 1]], ["tile_rx", "sp", [-1, 5]], ["auto_unroll_max_step", "ot", 0], ["unroll_explicit", "ot", 1]]}], "r": [[0.001241725, 0.00124249875], 0, 0.9783420562744141, 1578489360.6461313], "v": 0.1}
{"i": ["cuda", "schedule_direct_3d_cuda", [[1, 1, 64, 128, 128], [24, 1, 1, 5, 5], [1, 2, 2], [0, 2, 2], 1], {}, ["schedule_direct_3d_cuda", [1, 1, 64, 128, 128], [24, 1, 1, 5, 5], [1, 2, 2], [0, 2, 2], 1], {"i": 512751695, "t": "", "c": null, "e": [["tile_f", "sp", [-1, 2, 3, 1]], ["tile_d", "sp", [-1, 1, 1, 2]], ["tile_y", "sp", [-1, 4, 1, 2]], ["tile_x", "sp", [-1, 1, 2, 8]], ["tile_rc", "sp", [-1, 1]], ["tile_rd", "sp", [-1, 1]], ["tile_ry", "sp", [-1, 1]], ["tile_rx", "sp", [-1, 5]], ["auto_unroll_max_step", "ot", 1500], ["unroll_explicit", "ot", 0]]}], "r": [[0.002504564, 0.0024967645], 0, 3.1123714447021484, 1578489362.090454], "v": 0.1}
{"i": ["cuda", "schedule_direct_3d_cuda", [[1, 1, 64, 128, 128], [24, 1, 1, 5, 5], [1, 2, 2], [0, 2, 2], 1], {}, ["schedule_direct_3d_cuda", [1, 1, 64, 128, 128], [24, 1, 1, 5, 5], [1, 2, 2], [0, 2, 2], 1], {"i": 691965129, "t": "", "c": null, "e": [["tile_f", "sp", [-1, 2, 2, 1]], ["tile_d", "sp", [-1, 1, 1, 1]], ["tile_y", "sp", [-1, 1, 4, 8]], ["tile_x", "sp", [-1, 1, 1, 4]], ["tile_rc", "sp", [-1, 1]], ["tile_rd", "sp", [-1, 1]], ["tile_ry", "sp", [-1, 1]], ["tile_rx", "sp", [-1, 5]], ["auto_unroll_max_step", "ot", 0], ["unroll_explicit", "ot", 1]]}], "r": [[0.002964366, 0.00296470075], 0, 1.055837869644165, 1578489362.6362455], "v": 0.1}
{"i": ["cuda", "schedule_direct_3d_cuda", [[1, 1, 64, 128, 128], [24, 1, 1, 5, 5], [1, 2, 2], [0, 2, 2], 1], {}, ["schedule_direct_3d_cuda", [1, 1, 64, 128, 128], [24, 1, 1, 5, 5], [1, 2, 2], [0, 2, 2], 1], {"i": 501882411, "t": "", "c": null, "e": [["tile_f", "sp", [-1, 4, 2, 1]], ["tile_d", "sp", [-1, 1, 1, 16]], ["tile_y", "sp", [-1, 2, 2, 1]], ["tile_x", "sp", [-1, 1, 1, 4]], ["tile_rc", "sp", [-1, 1]], ["tile_rd", "sp", [-1, 1]], ["tile_ry", "sp", [-1, 1]], ["tile_rx", "sp", [-1, 5]], ["auto_unroll_max_step", "ot", 1500], ["unroll_explicit", "ot", 0]]}], "r": [[0.0189057905, 0.01893922], 0, 5.961262464523315, 1578489366.3222232], "v": 0.1}
{"i": ["cuda", "schedule_direct_3d_cuda", [[1, 1, 64, 128, 128], [24, 1, 1, 5, 5], [1, 2, 2], [0, 2, 2], 1], {}, ["schedule_direct_3d_cuda", [1, 1, 64, 128, 128], [24, 1, 1, 5, 5], [1, 2, 2], [0, 2, 2], 1], {"i": 700533131, "t": "", "c": null, "e": [["tile_f", "sp", [-1, 4, 2, 1]], ["tile_d", "sp", [-1, 1, 1, 1]], ["tile_y", "sp", [-1, 4, 1, 1]], ["tile_x", "sp", [-1, 2, 1, 8]], ["tile_rc", "sp", [-1, 1]], ["tile_rd", "sp", [-1, 1]], ["tile_ry", "sp", [-1, 1]], ["tile_rx", "sp", [-1, 5]], ["auto_unroll_max_step", "ot", 0], ["unroll_explicit", "ot", 1]]}], "r": [[0.00904429275, 0.0090472195], 0, 1.5298173427581787, 1578489367.0972257], "v": 0.1}
{"i": ["cuda", "schedule_direct_3d_cuda", [[1, 1, 64, 128, 128], [24, 1, 1, 5, 5], [1, 2, 2], [0, 2, 2], 1], {}, ["schedule_direct_3d_cuda", [1, 1, 64, 128, 128], [24, 1, 1, 5, 5], [1, 2, 2], [0, 2, 2], 1], {"i": 695488651, "t": "", "c": null, "e": [["tile_f", "sp", [-1, 4, 2, 1]], ["tile_d", "sp", [-1, 1, 1, 2]], ["tile_y", "sp", [-1, 1, 2, 1]], ["tile_x", "sp", [-1, 4, 2, 4]], ["tile_rc", "sp", [-1, 1]], ["tile_rd", "sp", [-1, 1]], ["tile_ry", "sp", [-1, 1]], ["tile_rx", "sp", [-1, 5]], ["auto_unroll_max_step", "ot", 0], ["unroll_explicit", "ot", 1]]}], "r": [[0.00171352025, 0.00171127225], 0, 1.1937291622161865, 1578489367.6605437], "v": 0.1}
{"i": ["cuda", "schedule_direct_3d_cuda", [[1, 1, 64, 128, 128], [24, 1, 1, 5, 5], [1, 2, 2], [0, 2, 2], 1], {}, ["schedule_direct_3d_cuda", [1, 1, 64, 128, 128], [24, 1, 1, 5, 5], [1, 2, 2], [0, 2, 2], 1], {"i": 1070881412, "t": "", "c": null, "e": [["tile_f", "sp", [-1, 1, 2, 3]], ["tile_d", "sp", [-1, 2, 1, 2]], ["tile_y", "sp", [-1, 4, 2, 1]], ["tile_x", "sp", [-1, 1, 1, 4]], ["tile_rc", "sp", [-1, 1]], ["tile_rd", "sp", [-1, 1]], ["tile_ry", "sp", [-1, 1]], ["tile_rx", "sp", [-1, 5]], ["auto_unroll_max_step", "ot", 1500], ["unroll_explicit", "ot", 1]]}], "r": [[0.000945417, 0.00094525725], 0, 2.8266355991363525, 1578489368.4938128], "v": 0.1}
{"i": ["cuda", "schedule_direct_3d_cuda", [[1, 1, 64, 128, 128], [24, 1, 1, 5, 5], [1, 2, 2], [0, 2, 2], 1], {}, ["schedule_direct_3d_cuda", [1, 1, 64, 128, 128], [24, 1, 1, 5, 5], [1, 2, 2], [0, 2, 2], 1], {"i": 691547691, "t": "", "c": null, "e": [["tile_f", "sp", [-1, 4, 2, 1]], ["tile_d", "sp", [-1, 1, 1, 16]], ["tile_y", "sp", [-1, 2, 2, 1]], ["tile_x", "sp", [-1, 1, 1, 4]], ["tile_rc", "sp", [-1, 1]], ["tile_rd", "sp", [-1, 1]], ["tile_ry", "sp", [-1, 1]], ["tile_rx", "sp", [-1, 5]], ["auto_unroll_max_step", "ot", 0], ["unroll_explicit", "ot", 1]]}], "r": [[0.01999875625, 0.020009234], 0, 1.4104654788970947, 1578489369.1804173], "v": 0.1}
{"i": ["cuda", "schedule_direct_3d_cuda", [[1, 1, 64, 128, 128], [24, 1, 1, 5, 5], [1, 2, 2], [0, 2, 2], 1], {}, ["schedule_direct_3d_cuda", [1, 1, 64, 128, 128], [24, 1, 1, 5, 5], [1, 2, 2], [0, 2, 2], 1], {"i": 692811960, "t": "", "c": null, "e": [["tile_f", "sp", [-1, 1, 3, 2]], ["tile_d", "sp", [-1, 2, 1, 1]], ["tile_y", "sp", [-1, 2, 1, 2]], ["tile_x", "sp", [-1, 4, 1, 4]], ["tile_rc", "sp", [-1, 1]], ["tile_rd", "sp", [-1, 1]], ["tile_ry", "sp", [-1, 1]], ["tile_rx", "sp", [-1, 5]], ["auto_unroll_max_step", "ot", 0], ["unroll_explicit", "ot", 1]]}], "r": [[0.01425828225, 0.01402484325], 0, 2.064023971557617, 1578489370.2257047], "v": 0.1}
{"i": ["cuda", "schedule_direct_3d_cuda", [[1, 1, 64, 128, 128], [24, 1, 1, 5, 5], [1, 2, 2], [0, 2, 2], 1], {}, ["schedule_direct_3d_cuda", [1, 1, 64, 128, 128], [24, 1, 1, 5, 5], [1, 2, 2], [0, 2, 2], 1], {"i": 1070878251, "t": "", "c": null, "e": [["tile_f", "sp", [-1, 4, 2, 1]], ["tile_d", "sp", [-1, 1, 1, 16]], ["tile_y", "sp", [-1, 2, 2, 1]], ["tile_x", "sp", [-1, 1, 1, 4]], ["tile_rc", "sp", [-1, 1]], ["tile_rd", "sp", [-1, 1]], ["tile_ry", "sp", [-1, 1]], ["tile_rx", "sp", [-1, 5]], ["auto_unroll_max_step", "ot", 1500], ["unroll_explicit", "ot", 1]]}], "r": [[0.0144117965, 0.01444458425], 0, 4.392315626144409, 1578489376.330348], "v": 0.1}
{"i": ["cuda", "schedule_direct_3d_cuda", [[1, 1, 64, 128, 128], [24, 1, 1, 5, 5], [1, 2, 2], [0, 2, 2], 1], {}, ["schedule_direct_3d_cuda", [1, 1, 64, 128, 128], [24, 1, 1, 5, 5], [1, 2, 2], [0, 2, 2], 1], {"i": 1071775077, "t": "", "c": null, "e": [["tile_f", "sp", [-1, 2, 2, 2]], ["tile_d", "sp", [-1, 1, 1, 2]], ["tile_y", "sp", [-1, 1, 4, 4]], ["tile_x", "sp", [-1, 2, 1, 4]], ["tile_rc", "sp", [-1, 1]], ["tile_rd", "sp", [-1, 1]], ["tile_ry", "sp", [-1, 1]], ["tile_rx", "sp", [-1, 5]], ["auto_unroll_max_step", "ot", 1500], ["unroll_explicit", "ot", 1]]}], "r": [[0.00474671875, 0.004747245], 0, 5.087855100631714, 1578489377.9474702], "v": 0.1}
{"i": ["cuda", "schedule_direct_3d_cuda", [[1, 1, 64, 128, 128], [24, 1, 1, 5, 5], [1, 2, 2], [0, 2, 2], 1], {}, ["schedule_direct_3d_cuda", [1, 1, 64, 128, 128], [24, 1, 1, 5, 5], [1, 2, 2], [0, 2, 2], 1], {"i": 888491557, "t": "", "c": null, "e": [["tile_f", "sp", [-1, 2, 2, 2]], ["tile_d", "sp", [-1, 1, 1, 1]], ["tile_y", "sp", [-1, 1, 1, 1]], ["tile_x", "sp", [-1, 2, 8, 4]], ["tile_rc", "sp", [-1, 1]], ["tile_rd", "sp", [-1, 1]], ["tile_ry", "sp", [-1, 1]], ["tile_rx", "sp", [-1, 5]], ["auto_unroll_max_step", "ot", 512], ["unroll_explicit", "ot", 1]]}], "r": [[0.0002769475, 0.00027666125], 0, 1.057180404663086, 1578489378.4524236], "v": 0.1}
{"i": ["cuda", "schedule_direct_3d_cuda", [[1, 1, 64, 128, 128], [24, 1, 1, 5, 5], [1, 2, 2], [0, 2, 2], 1], {}, ["schedule_direct_3d_cuda", [1, 1, 64, 128, 128], [24, 1, 1, 5, 5], [1, 2, 2], [0, 2, 2], 1], {"i": 683385938, "t": "", "c": null, "e": [["tile_f", "sp", [-1, 1, 4, 1]], ["tile_d", "sp", [-1, 1, 1, 2]], ["tile_y", "sp", [-1, 1, 2, 4]], ["tile_x", "sp", [-1, 1, 2, 2]], ["tile_rc", "sp", [-1, 1]], ["tile_rd", "sp", [-1, 1]], ["tile_ry", "sp", [-1, 1]], ["tile_rx", "sp", [-1, 5]], ["auto_unroll_max_step", "ot", 0], ["unroll_explicit", "ot", 1]]}], "r": [[0.00141432275, 0.00141457525], 0, 0.932422399520874, 1578489378.9828484], "v": 0.1}
{"i": ["cuda", "schedule_direct_3d_cuda", [[1, 1, 64, 128, 128], [24, 1, 1, 5, 5], [1, 2, 2], [0, 2, 2], 1], {}, ["schedule_direct_3d_cuda", [1, 1, 64, 128, 128], [24, 1, 1, 5, 5], [1, 2, 2], [0, 2, 2], 1], {"i": 1050860302, "t": "", "c": null, "e": [["tile_f", "sp", [-1, 1, 2, 4]], ["tile_d", "sp", [-1, 2, 1, 1]], ["tile_y", "sp", [-1, 1, 2, 4]], ["tile_x", "sp", [-1, 1, 4, 1]], ["tile_rc", "sp", [-1, 1]], ["tile_rd", "sp", [-1, 1]], ["tile_ry", "sp", [-1, 1]], ["tile_rx", "sp", [-1, 5]], ["auto_unroll_max_step", "ot", 1500], ["unroll_explicit", "ot", 1]]}], "r": [[0.001196625, 0.00119690125], 0, 3.16463565826416, 1578489379.8985562], "v": 0.1}
{"i": ["cuda", "schedule_direct_3d_cuda", [[1, 1, 64, 128, 128], [24, 1, 1, 5, 5], [1, 2, 2], [0, 2, 2], 1], {}, ["schedule_direct_3d_cuda", [1, 1, 64, 128, 128], [24, 1, 1, 5, 5], [1, 2, 2], [0, 2, 2], 1], {"i": 1083573130, "t": "", "c": null, "e": [["tile_f", "sp", [-1, 3, 2, 1]], ["tile_d", "sp", [-1, 1, 1, 1]], ["tile_y", "sp", [-1, 2, 1, 4]], ["tile_x", "sp", [-1, 1, 4, 8]], ["tile_rc", "sp", [-1, 1]], ["tile_rd", "sp", [-1, 1]], ["tile_ry", "sp", [-1, 1]], ["tile_rx", "sp", [-1, 5]], ["auto_unroll_max_step", "ot", 1500], ["unroll_explicit", "ot", 1]]}], "r": [[0.00579887125, 0.005800277], 0, 4.307760715484619, 1578489381.2120183], "v": 0.1}
{"i": ["cuda", "schedule_direct_3d_cuda", [[1, 1, 64, 128, 128], [24, 1, 1, 5, 5], [1, 2, 2], [0, 2, 2], 1], {}, ["schedule_direct_3d_cuda", [1, 1, 64, 128, 128], [24, 1, 1, 5, 5], [1, 2, 2], [0, 2, 2], 1], {"i": 1060631059, "t": "", "c": null, "e": [["tile_f", "sp", [-1, 2, 4, 1]], ["tile_d", "sp", [-1, 1, 1, 1]], ["tile_y", "sp", [-1, 1, 1, 32]], ["tile_x", "sp", [-1, 4, 1, 2]], ["tile_rc", "sp", [-1, 1]], ["tile_rd", "sp", [-1, 1]], ["tile_ry", "sp", [-1, 1]], ["tile_rx", "sp", [-1, 5]], ["auto_unroll_max_step", "ot", 1500], ["unroll_explicit", "ot", 1]]}], "r": [[0.01665236375, 0.01662823875], 0, 7.967766284942627, 1578489384.5942087], "v": 0.1}
{"i": ["cuda", "schedule_direct_3d_cuda", [[1, 1, 64, 128, 128], [24, 1, 1, 5, 5], [1, 2, 2], [0, 2, 2], 1], {}, ["schedule_direct_3d_cuda", [1, 1, 64, 128, 128], [24, 1, 1, 5, 5], [1, 2, 2], [0, 2, 2], 1], {"i": 861195022, "t": "", "c": null, "e": [["tile_f", "sp", [-1, 1, 2, 4]], ["tile_d", "sp", [-1, 2, 1, 1]], ["tile_y", "sp", [-1, 1, 2, 4]], ["tile_x", "sp", [-1, 1, 4, 1]], ["tile_rc", "sp", [-1, 1]], ["tile_rd", "sp", [-1, 1]], ["tile_ry", "sp", [-1, 1]], ["tile_rx", "sp", [-1, 5]], ["auto_unroll_max_step", "ot", 512], ["unroll_explicit", "ot", 1]]}], "r": [[0.00036763925, 0.0003662805], 0, 1.4340498447418213, 1578489385.1571002], "v": 0.1}
{"i": ["cuda", "schedule_direct_3d_cuda", [[1, 1, 64, 128, 128], [24, 1, 1, 5, 5], [1, 2, 2], [0, 2, 2], 1], {}, ["schedule_direct_3d_cuda", [1, 1, 64, 128, 128], [24, 1, 1, 5, 5], [1, 2, 2], [0, 2, 2], 1], {"i": 1050860292, "t": "", "c": null, "e": [["tile_f", "sp", [-1, 1, 2, 3]], ["tile_d", "sp", [-1, 2, 1, 1]], ["tile_y", "sp", [-1, 1, 2, 4]], ["tile_x", "sp", [-1, 1, 4, 1]], ["tile_rc", "sp", [-1, 1]], ["tile_rd", "sp", [-1, 1]], ["tile_ry", "sp", [-1, 1]], ["tile_rx", "sp", [-1, 5]], ["auto_unroll_max_step", "ot", 1500], ["unroll_explicit", "ot", 1]]}], "r": [[0.000916795, 0.000915685], 0, 2.747382164001465, 1578489386.0099974], "v": 0.1}
{"i": ["cuda", "schedule_direct_3d_cuda", [[1, 1, 64, 128, 128], [24, 1, 1, 5, 5], [1, 2, 2], [0, 2, 2], 1], {}, ["schedule_direct_3d_cuda", [1, 1, 64, 128, 128], [24, 1, 1, 5, 5], [1, 2, 2], [0, 2, 2], 1], {"i": 1070842651, "t": "", "c": null, "e": [["tile_f", "sp", [-1, 4, 2, 1]], ["tile_d", "sp", [-1, 1, 1, 4]], ["tile_y", "sp", [-1, 8, 1, 1]], ["tile_x", "sp", [-1, 1, 1, 4]], ["tile_rc", "sp", [-1, 1]], ["tile_rd", "sp", [-1, 1]], ["tile_ry", "sp", [-1, 1]], ["tile_rx", "sp", [-1, 5]], ["auto_unroll_max_step", "ot", 1500], ["unroll_explicit", "ot", 1]]}], "r": [[0.01295232075, 0.01293535575], 0, 4.292001724243164, 1578489387.511101], "v": 0.1}
{"i": ["cuda", "schedule_direct_3d_cuda", [[1, 1, 64, 128, 128], [24, 1, 1, 5, 5], [1, 2, 2], [0, 2, 2], 1], {}, ["schedule_direct_3d_cuda", [1, 1, 64, 128, 128], [24, 1, 1, 5, 5], [1, 2, 2], [0, 2, 2], 1], {"i": 1074819211, "t": "", "c": null, "e": [["tile_f", "sp", [-1, 4, 2, 1]], ["tile_d", "sp", [-1, 1, 1, 2]], ["tile_y", "sp", [-1, 1, 2, 1]], ["tile_x", "sp", [-1, 4, 2, 4]], ["tile_rc", "sp", [-1, 1]], ["tile_rd", "sp", [-1, 1]], ["tile_ry", "sp", [-1, 1]], ["tile_rx", "sp", [-1, 5]], ["auto_unroll_max_step", "ot", 1500], ["unroll_explicit", "ot", 1]]}], "r": [[0.00080624575, 0.000801759], 0, 2.7519123554229736, 1578489388.324541], "v": 0.1}
{"i": ["cuda", "schedule_direct_3d_cuda", [[1, 1, 64, 128, 128], [24, 1, 1, 5, 5], [1, 2, 2], [0, 2, 2], 1], {}, ["schedule_direct_3d_cuda", [1, 1, 64, 128, 128], [24, 1, 1, 5, 5], [1, 2, 2], [0, 2, 2], 1], {"i": 881212171, "t": "", "c": null, "e": [["tile_f", "sp", [-1, 4, 2, 1]], ["tile_d", "sp", [-1, 1, 1, 8]], ["tile_y", "sp", [-1, 2, 2, 1]], ["tile_x", "sp", [-1, 1, 1, 4]], ["tile_rc", "sp", [-1, 1]], ["tile_rd", "sp", [-1, 1]], ["tile_ry", "sp", [-1, 1]], ["tile_rx", "sp", [-1, 5]], ["auto_unroll_max_step", "ot", 512], ["unroll_explicit", "ot", 1]]}], "r": [[0.001877885, 0.00187085775], 0, 2.216653347015381, 1578489389.0048006], "v": 0.1}
{"i": ["cuda", "schedule_direct_3d_cuda", [[1, 1, 64, 128, 128], [24, 1, 1, 5, 5], [1, 2, 2], [0, 2, 2], 1], {}, ["schedule_direct_3d_cuda", [1, 1, 64, 128, 128], [24, 1, 1, 5, 5], [1, 2, 2], [0, 2, 2], 1], {"i": 312779611, "t": "", "c": null, "e": [["tile_f", "sp", [-1, 4, 2, 1]], ["tile_d", "sp", [-1, 1, 1, 4]], ["tile_y", "sp", [-1, 2, 2, 1]], ["tile_x", "sp", [-1, 2, 1, 4]], ["tile_rc", "sp", [-1, 1]], ["tile_rd", "sp", [-1, 1]], ["tile_ry", "sp", [-1, 1]], ["tile_rx", "sp", [-1, 5]], ["auto_unroll_max_step", "ot", 512], ["unroll_explicit", "ot", 0]]}], "r": [[0.0025582615, 0.0025608135], 0, 2.485642910003662, 1578489395.638263], "v": 0.1}
{"i": ["cuda", "schedule_direct_3d_cuda", [[1, 1, 64, 128, 128], [24, 1, 1, 5, 5], [1, 2, 2], [0, 2, 2], 1], {}, ["schedule_direct_3d_cuda", [1, 1, 64, 128, 128], [24, 1, 1, 5, 5], [1, 2, 2], [0, 2, 2], 1], {"i": 672628932, "t": "", "c": null, "e": [["tile_f", "sp", [-1, 1, 2, 3]], ["tile_d", "sp", [-1, 1, 1, 4]], ["tile_y", "sp", [-1, 1, 1, 4]], ["tile_x", "sp", [-1, 4, 4, 1]], ["tile_rc", "sp", [-1, 1]], ["tile_rd", "sp", [-1, 1]], ["tile_ry", "sp", [-1, 1]], ["tile_rx", "sp", [-1, 5]], ["auto_unroll_max_step", "ot", 0], ["unroll_explicit", "ot", 1]]}], "r": [[0.00408000875, 0.0040863055], 0, 1.2756414413452148, 1578489396.2589533], "v": 0.1}
{"i": ["cuda", "schedule_direct_3d_cuda", [[1, 1, 64, 128, 128], [24, 1, 1, 5, 5], [1, 2, 2], [0, 2, 2], 1], {}, ["schedule_direct_3d_cuda", [1, 1, 64, 128, 128], [24, 1, 1, 5, 5], [1, 2, 2], [0, 2, 2], 1], {"i": 882477240, "t": "", "c": null, "e": [["tile_f", "sp", [-1, 1, 3, 2]], ["tile_d", "sp", [-1, 2, 1, 1]], ["tile_y", "sp", [-1, 2, 1, 2]], ["tile_x", "sp", [-1, 4, 1, 4]], ["tile_rc", "sp", [-1, 1]], ["tile_rd", "sp", [-1, 1]], ["tile_ry", "sp", [-1, 1]], ["tile_rx", "sp", [-1, 5]], ["auto_unroll_max_step", "ot", 512], ["unroll_explicit", "ot", 1]]}], "r": [[0.01326672525, 0.013264248], 0, 5.358429193496704, 1578489398.2060332], "v": 0.1}
{"i": ["cuda", "schedule_direct_3d_cuda", [[1, 1, 64, 128, 128], [24, 1, 1, 5, 5], [1, 2, 2], [0, 2, 2], 1], {}, ["schedule_direct_3d_cuda", [1, 1, 64, 128, 128], [24, 1, 1, 5, 5], [1, 2, 2], [0, 2, 2], 1], {"i": 1079939858, "t": "", "c": null, "e": [["tile_f", "sp", [-1, 1, 4, 1]], ["tile_d", "sp", [-1, 1, 1, 2]], ["tile_y", "sp", [-1, 1, 4, 1]], ["tile_x", "sp", [-1, 2, 1, 8]], ["tile_rc", "sp", [-1, 1]], ["tile_rd", "sp", [-1, 1]], ["tile_ry", "sp", [-1, 1]], ["tile_rx", "sp", [-1, 5]], ["auto_unroll_max_step", "ot", 1500], ["unroll_explicit", "ot", 1]]}], "r": [[0.001936687, 0.00193656225], 0, 3.6484038829803467, 1578489399.4465432], "v": 0.1}
{"i": ["cuda", "schedule_direct_3d_cuda", [[1, 1, 64, 128, 128], [24, 1, 1, 5, 5], [1, 2, 2], [0, 2, 2], 1], {}, ["schedule_direct_3d_cuda", [1, 1, 64, 128, 128], [24, 1, 1, 5, 5], [1, 2, 2], [0, 2, 2], 1], {"i": 1071440731, "t": "", "c": null, "e": [["tile_f", "sp", [-1, 4, 2, 1]], ["tile_d", "sp", [-1, 1, 1, 4]], ["tile_y", "sp", [-1, 2, 2, 1]], ["tile_x", "sp", [-1, 2, 1, 4]], ["tile_rc", "sp", [-1, 1]], ["tile_rd", "sp", [-1, 1]], ["tile_ry", "sp", [-1, 1]], ["tile_rx", "sp", [-1, 5]], ["auto_unroll_max_step", "ot", 1500], ["unroll_explicit", "ot", 1]]}], "r": [[0.0010880715, 0.0010856205], 0, 3.8147339820861816, 1578489400.272269], "v": 0.1}
{"i": ["cuda", "schedule_direct_3d_cuda", [[1, 1, 64, 128, 128], [24, 1, 1, 5, 5], [1, 2, 2], [0, 2, 2], 1], {}, ["schedule_direct_3d_cuda", [1, 1, 64, 128, 128], [24, 1, 1, 5, 5], [1, 2, 2], [0, 2, 2], 1], {"i": 1081747535, "t": "", "c": null, "e": [["tile_f", "sp", [-1, 2, 3, 1]], ["tile_d", "sp", [-1, 1, 1, 2]], ["tile_y", "sp", [-1, 4, 1, 2]], ["tile_x", "sp", [-1, 1, 2, 8]], ["tile_rc", "sp", [-1, 1]], ["tile_rd", "sp", [-1, 1]], ["tile_ry", "sp", [-1, 1]], ["tile_rx", "sp", [-1, 5]], ["auto_unroll_max_step", "ot", 1500], ["unroll_explicit", "ot", 1]]}], "r": [[0.00090183025, 0.0009030105], 0, 4.390892267227173, 1578489401.209974], "v": 0.1}
{"i": ["cuda", "schedule_direct_3d_cuda", [[1, 1, 64, 128, 128], [24, 1, 1, 5, 5], [1, 2, 2], [0, 2, 2], 1], {}, ["schedule_direct_3d_cuda", [1, 1, 64, 128, 128], [24, 1, 1, 5, 5], [1, 2, 2], [0, 2, 2], 1], {"i": 874007135, "t": "", "c": null, "e": [["tile_f", "sp", [-1, 2, 3, 1]], ["tile_d", "sp", [-1, 1, 1, 4]], ["tile_y", "sp", [-1, 1, 1, 2]], ["tile_x", "sp", [-1, 4, 2, 2]], ["tile_rc", "sp", [-1, 1]], ["tile_rd", "sp", [-1, 1]], ["tile_ry", "sp", [-1, 1]], ["tile_rx", "sp", [-1, 5]], ["auto_unroll_max_step", "ot", 512], ["unroll_explicit", "ot", 1]]}], "r": [[0.00047238725, 0.00047343], 0, 1.7579917907714844, 1578489401.7925594], "v": 0.1}
{"i": ["cuda", "schedule_direct_3d_cuda", [[1, 1, 64, 128, 128], [24, 1, 1, 5, 5], [1, 2, 2], [0, 2, 2], 1], {}, ["schedule_direct_3d_cuda", [1, 1, 64, 128, 128], [24, 1, 1, 5, 5], [1, 2, 2], [0, 2, 2], 1], {"i": 1072146339, "t": "", "c": null, "e": [["tile_f", "sp", [-1, 2, 4, 1]], ["tile_d", "sp", [-1, 1, 1, 4]], ["tile_y", "sp", [-1, 2, 1, 2]], ["tile_x", "sp", [-1, 4, 1, 4]], ["tile_rc", "sp", [-1, 1]], ["tile_rd", "sp", [-1, 1]], ["tile_ry", "sp", [-1, 1]], ["tile_rx", "sp", [-1, 5]], ["auto_unroll_max_step", "ot", 1500], ["unroll_explicit", "ot", 1]]}], "r": [[0.01451219275, 0.01457109325], 0, 4.673683166503906, 1578489403.5300324], "v": 0.1}
{"i": ["cuda", "schedule_direct_3d_cuda", [[1, 1, 64, 128, 128], [24, 1, 1, 5, 5], [1, 2, 2], [0, 2, 2], 1], {}, ["schedule_direct_3d_cuda", [1, 1, 64, 128, 128], [24, 1, 1, 5, 5], [1, 2, 2], [0, 2, 2], 1], {"i": 881216132, "t": "", "c": null, "e": [["tile_f", "sp", [-1, 1, 2, 3]], ["tile_d", "sp", [-1, 2, 1, 2]], ["tile_y", "sp", [-1, 4, 2, 1]], ["tile_x", "sp", [-1, 1, 1, 4]], ["tile_rc", "sp", [-1, 1]], ["tile_rd", "sp", [-1, 1]], ["tile_ry", "sp", [-1, 1]], ["tile_rx", "sp", [-1, 5]], ["auto_unroll_max_step", "ot", 512], ["unroll_explicit", "ot", 1]]}], "r": [[0.00095460875, 0.000954066], 0, 1.9373929500579834, 1578489404.17636], "v": 0.1}
{"i": ["cuda", "schedule_direct_3d_cuda", [[1, 1, 64, 128, 128], [24, 1, 1, 5, 5], [1, 2, 2], [0, 2, 2], 1], {}, ["schedule_direct_3d_cuda", [1, 1, 64, 128, 128], [24, 1, 1, 5, 5], [1, 2, 2], [0, 2, 2], 1], {"i": 1072142520, "t": "", "c": null, "e": [["tile_f", "sp", [-1, 1, 3, 2]], ["tile_d", "sp", [-1, 2, 1, 1]], ["tile_y", "sp", [-1, 2, 1, 2]], ["tile_x", "sp", [-1, 4, 1, 4]], ["tile_rc", "sp", [-1, 1]], ["tile_rd", "sp", [-1, 1]], ["tile_ry", "sp", [-1, 1]], ["tile_rx", "sp", [-1, 5]], ["auto_unroll_max_step", "ot", 1500], ["unroll_explicit", "ot", 1]]}], "r": [[0.013306536, 0.0133170945], 0, 6.999616622924805, 1578489406.2771406], "v": 0.1}
{"i": ["cuda", "schedule_direct_3d_cuda", [[1, 1, 64, 128, 128], [24, 1, 1, 5, 5], [1, 2, 2], [0, 2, 2], 1], {}, ["schedule_direct_3d_cuda", [1, 1, 64, 128, 128], [24, 1, 1, 5, 5], [1, 2, 2], [0, 2, 2], 1], {"i": 1060325859, "t": "", "c": null, "e": [["tile_f", "sp", [-1, 2, 4, 1]], ["tile_d", "sp", [-1, 1, 1, 4]], ["tile_y", "sp", [-1, 1, 2, 2]], ["tile_x", "sp", [-1, 4, 1, 2]], ["tile_rc", "sp", [-1, 1]], ["tile_rd", "sp", [-1, 1]], ["tile_ry", "sp", [-1, 1]], ["tile_rx", "sp", [-1, 5]], ["auto_unroll_max_step", "ot", 1500], ["unroll_explicit", "ot", 1]]}], "r": [[0.00099669375, 0.00099629075], 0, 2.6152806282043457, 1578489407.1249669], "v": 0.1}
{"i": ["cuda", "schedule_direct_3d_cuda", [[1, 1, 64, 128, 128], [24, 1, 1, 5, 5], [1, 2, 2], [0, 2, 2], 1], {}, ["schedule_direct_3d_cuda", [1, 1, 64, 128, 128], [24, 1, 1, 5, 5], [1, 2, 2], [0, 2, 2], 1], {"i": 700849135, "t": "", "c": null, "e": [["tile_f", "sp", [-1, 2, 3, 1]], ["tile_d", "sp", [-1, 4, 1, 1]], ["tile_y", "sp", [-1, 1, 1, 4]], ["tile_x", "sp", [-1, 2, 1, 8]], ["tile_rc", "sp", [-1, 1]], ["tile_rd", "sp", [-1, 1]], ["tile_ry", "sp", [-1, 1]], ["tile_rx", "sp", [-1, 5]], ["auto_unroll_max_step", "ot", 0], ["unroll_explicit", "ot", 1]]}], "r": [[0.01546802875, 0.01560787725], 0, 1.857846736907959, 1578489407.7749453], "v": 0.1}
{"i": ["cuda", "schedule_direct_3d_cuda", [[1, 1, 64, 128, 128], [24, 1, 1, 5, 5], [1, 2, 2], [0, 2, 2], 1], {}, ["schedule_direct_3d_cuda", [1, 1, 64, 128, 128], [24, 1, 1, 5, 5], [1, 2, 2], [0, 2, 2], 1], {"i": 876081972, "t": "", "c": null, "e": [["tile_f", "sp", [-1, 1, 2, 3]], ["tile_d", "sp", [-1, 1, 1, 2]], ["tile_y", "sp", [-1, 2, 1, 1]], ["tile_x", "sp", [-1, 2, 4, 2]], ["tile_rc", "sp", [-1, 1]], ["tile_rd", "sp", [-1, 1]], ["tile_ry", "sp", [-1, 1]], ["tile_rx", "sp", [-1, 5]], ["auto_unroll_max_step", "ot", 512], ["unroll_explicit", "ot", 1]]}], "r": [[0.0008471665, 0.000840439], 0, 1.5317668914794922, 1578489610.3382626], "v": 0.1}
{"i": ["cuda", "schedule_direct_3d_cuda", [[1, 1, 64, 128, 128], [24, 1, 1, 5, 5], [1, 2, 2], [0, 2, 2], 1], {}, ["schedule_direct_3d_cuda", [1, 1, 64, 128, 128], [24, 1, 1, 5, 5], [1, 2, 2], [0, 2, 2], 1], {"i": 878097931, "t": "", "c": null, "e": [["tile_f", "sp", [-1, 4, 2, 1]], ["tile_d", "sp", [-1, 1, 1, 2]], ["tile_y", "sp", [-1, 1, 1, 4]], ["tile_x", "sp", [-1, 1, 8, 2]], ["tile_rc", "sp", [-1, 1]], ["tile_rd", "sp", [-1, 1]], ["tile_ry", "sp", [-1, 1]], ["tile_rx", "sp", [-1, 5]], ["auto_unroll_max_step", "ot", 512], ["unroll_explicit", "ot", 1]]}], "r": [[0.00067191925, 0.00073350075], 0, 1.6976521015167236, 1578489611.0252693], "v": 0.1}
{"i": ["cuda", "schedule_direct_3d_cuda", [[1, 1, 64, 128, 128], [24, 1, 1, 5, 5], [1, 2, 2], [0, 2, 2], 1], {}, ["schedule_direct_3d_cuda", [1, 1, 64, 128, 128], [24, 1, 1, 5, 5], [1, 2, 2], [0, 2, 2], 1], {"i": 877775397, "t": "", "c": null, "e": [["tile_f", "sp", [-1, 2, 2, 2]], ["tile_d", "sp", [-1, 1, 1, 2]], ["tile_y", "sp", [-1, 2, 1, 1]], ["tile_x", "sp", [-1, 1, 8, 2]], ["tile_rc", "sp", [-1, 1]], ["tile_rd", "sp", [-1, 1]], ["tile_ry", "sp", [-1, 1]], ["tile_rx", "sp", [-1, 5]], ["auto_unroll_max_step", "ot", 512], ["unroll_explicit", "ot", 1]]}], "r": [[0.000422664, 0.0004216155], 0, 1.3076224327087402, 1578489611.613339], "v": 0.1}
{"i": ["cuda", "schedule_direct_3d_cuda", [[1, 1, 64, 128, 128], [24, 1, 1, 5, 5], [1, 2, 2], [0, 2, 2], 1], {}, ["schedule_direct_3d_cuda", [1, 1, 64, 128, 128], [24, 1, 1, 5, 5], [1, 2, 2], [0, 2, 2], 1], {"i": 887933797, "t": "", "c": null, "e": [["tile_f", "sp", [-1, 2, 2, 2]], ["tile_d", "sp", [-1, 1, 1, 1]], ["tile_y", "sp", [-1, 2, 1, 1]], ["tile_x", "sp", [-1, 1, 8, 4]], ["tile_rc", "sp", [-1, 1]], ["tile_rd", "sp", [-1, 1]], ["tile_ry", "sp", [-1, 1]], ["tile_rx", "sp", [-1, 5]], ["auto_unroll_max_step", "ot", 512], ["unroll_explicit", "ot", 1]]}], "r": [[0.00040576275, 0.00040554775], 0, 1.28129243850708, 1578489612.197281], "v": 0.1}
{"i": ["cuda", "schedule_direct_3d_cuda", [[1, 1, 64, 128, 128], [24, 1, 1, 5, 5], [1, 2, 2], [0, 2, 2], 1], {}, ["schedule_direct_3d_cuda", [1, 1, 64, 128, 128], [24, 1, 1, 5, 5], [1, 2, 2], [0, 2, 2], 1], {"i": 888493797, "t": "", "c": null, "e": [["tile_f", "sp", [-1, 2, 2, 2]], ["tile_d", "sp", [-1, 1, 1, 2]], ["tile_y", "sp", [-1, 1, 1, 1]], ["tile_x", "sp", [-1, 2, 8, 4]], ["tile_rc", "sp", [-1, 1]], ["tile_rd", "sp", [-1, 1]], ["tile_ry", "sp", [-1, 1]], ["tile_rx", "sp", [-1, 5]], ["auto_unroll_max_step", "ot", 512], ["unroll_explicit", "ot", 1]]}], "r": [[0.00030422375, 0.000340264], 0, 1.5288541316986084, 1578489612.8403814], "v": 0.1}
{"i": ["cuda", "schedule_direct_3d_cuda", [[1, 1, 64, 128, 128], [24, 1, 1, 5, 5], [1, 2, 2], [0, 2, 2], 1], {}, ["schedule_direct_3d_cuda", [1, 1, 64, 128, 128], [24, 1, 1, 5, 5], [1, 2, 2], [0, 2, 2], 1], {"i": 878097958, "t": "", "c": null, "e": [["tile_f", "sp", [-1, 3, 2, 2]], ["tile_d", "sp", [-1, 1, 1, 2]], ["tile_y", "sp", [-1, 1, 1, 4]], ["tile_x", "sp", [-1, 1, 8, 2]], ["tile_rc", "sp", [-1, 1]], ["tile_rd", "sp", [-1, 1]], ["tile_ry", "sp", [-1, 1]], ["tile_rx", "sp", [-1, 5]], ["auto_unroll_max_step", "ot", 512], ["unroll_explicit", "ot", 1]]}], "r": [[0.0004041095, 0.000506868], 0, 1.9497108459472656, 1578489613.5748658], "v": 0.1}
{"i": ["cuda", "schedule_direct_3d_cuda", [[1, 1, 64, 128, 128], [24, 1, 1, 5, 5], [1, 2, 2], [0, 2, 2], 1], {}, ["schedule_direct_3d_cuda", [1, 1, 64, 128, 128], [24, 1, 1, 5, 5], [1, 2, 2], [0, 2, 2], 1], {"i": 1065747252, "t": "", "c": null, "e": [["tile_f", "sp", [-1, 1, 2, 3]], ["tile_d", "sp", [-1, 1, 1, 2]], ["tile_y", "sp", [-1, 2, 1, 1]], ["tile_x", "sp", [-1, 2, 4, 2]], ["tile_rc", "sp", [-1, 1]], ["tile_rd", "sp", [-1, 1]], ["tile_ry", "sp", [-1, 1]], ["tile_rx", "sp", [-1, 5]], ["auto_unroll_max_step", "ot", 1500], ["unroll_explicit", "ot", 1]]}], "r": [[0.00227355525, 0.0022744685], 0, 3.6830482482910156, 1578489614.7672915], "v": 0.1}
{"i": ["cuda", "schedule_direct_3d_cuda", [[1, 1, 64, 128, 128], [24, 1, 1, 5, 5], [1, 2, 2], [0, 2, 2], 1], {}, ["schedule_direct_3d_cuda", [1, 1, 64, 128, 128], [24, 1, 1, 5, 5], [1, 2, 2], [0, 2, 2], 1], {"i": 887933798, "t": "", "c": null, "e": [["tile_f", "sp", [-1, 3, 2, 2]], ["tile_d", "sp", [-1, 1, 1, 1]], ["tile_y", "sp", [-1, 2, 1, 1]], ["tile_x", "sp", [-1, 1, 8, 4]], ["tile_rc", "sp", [-1, 1]], ["tile_rd", "sp", [-1, 1]], ["tile_ry", "sp", [-1, 1]], ["tile_rx", "sp", [-1, 5]], ["auto_unroll_max_step", "ot", 512], ["unroll_explicit", "ot", 1]]}], "r": [[0.00038308675, 0.00038180525], 0, 1.4575369358062744, 1578489615.3878047], "v": 0.1}
{"i": ["cuda", "schedule_direct_3d_cuda", [[1, 1, 64, 128, 128], [24, 1, 1, 5, 5], [1, 2, 2], [0, 2, 2], 1], {}, ["schedule_direct_3d_cuda", [1, 1, 64, 128, 128], [24, 1, 1, 5, 5], [1, 2, 2], [0, 2, 2], 1], {"i": 877775398, "t": "", "c": null, "e": [["tile_f", "sp", [-1, 3, 2, 2]], ["tile_d", "sp", [-1, 1, 1, 2]], ["tile_y", "sp", [-1, 2, 1, 1]], ["tile_x", "sp", [-1, 1, 8, 2]], ["tile_rc", "sp", [-1, 1]], ["tile_rd", "sp", [-1, 1]], ["tile_ry", "sp", [-1, 1]], ["tile_rx", "sp", [-1, 5]], ["auto_unroll_max_step", "ot", 512], ["unroll_explicit", "ot", 1]]}], "r": [[0.000379192, 0.0004324905], 0, 1.4982450008392334, 1578489616.0064442], "v": 0.1}
{"i": ["cuda", "schedule_direct_3d_cuda", [[1, 1, 64, 128, 128], [24, 1, 1, 5, 5], [1, 2, 2], [0, 2, 2], 1], {}, ["schedule_direct_3d_cuda", [1, 1, 64, 128, 128], [24, 1, 1, 5, 5], [1, 2, 2], [0, 2, 2], 1], {"i": 875524213, "t": "", "c": null, "e": [["tile_f", "sp", [-1, 2, 2, 3]], ["tile_d", "sp", [-1, 1, 1, 2]], ["tile_y", "sp", [-1, 4, 1, 1]], ["tile_x", "sp", [-1, 1, 4, 2]], ["tile_rc", "sp", [-1, 1]], ["tile_rd", "sp", [-1, 1]], ["tile_ry", "sp", [-1, 1]], ["tile_rx", "sp", [-1, 5]], ["auto_unroll_max_step", "ot", 512], ["unroll_explicit", "ot", 1]]}], "r": [[0.0008518765, 0.000851159], 0, 1.8802449703216553, 1578489616.7543101], "v": 0.1}
{"i": ["cuda", "schedule_direct_3d_cuda", [[1, 1, 64, 128, 128], [24, 1, 1, 5, 5], [1, 2, 2], [0, 2, 2], 1], {}, ["schedule_direct_3d_cuda", [1, 1, 64, 128, 128], [24, 1, 1, 5, 5], [1, 2, 2], [0, 2, 2], 1], {"i": 878097930, "t": "", "c": null, "e": [["tile_f", "sp", [-1, 3, 2, 1]], ["tile_d", "sp", [-1, 1, 1, 2]], ["tile_y", "sp", [-1, 1, 1, 4]], ["tile_x", "sp", [-1, 1, 8, 2]], ["tile_rc", "sp", [-1, 1]], ["tile_rd", "sp", [-1, 1]], ["tile_ry", "sp", [-1, 1]], ["tile_rx", "sp", [-1, 5]], ["auto_unroll_max_step", "ot", 512], ["unroll_explicit", "ot", 1]]}], "r": [[0.00049538025, 0.00049494275], 0, 1.5027236938476562, 1578489617.4328706], "v": 0.1}
{"i": ["cuda", "schedule_direct_3d_cuda", [[1, 1, 64, 128, 128], [24, 1, 1, 5, 5], [1, 2, 2], [0, 2, 2], 1], {}, ["schedule_direct_3d_cuda", [1, 1, 64, 128, 128], [24, 1, 1, 5, 5], [1, 2, 2], [0, 2, 2], 1], {"i": 886242580, "t": "", "c": null, "e": [["tile_f", "sp", [-1, 3, 4, 1]], ["tile_d", "sp", [-1, 1, 1, 2]], ["tile_y", "sp", [-1, 2, 1, 1]], ["tile_x", "sp", [-1, 1, 4, 4]], ["tile_rc", "sp", [-1, 1]], ["tile_rd", "sp", [-1, 1]], ["tile_ry", "sp", [-1, 1]], ["tile_rx", "sp", [-1, 5]], ["auto_unroll_max_step", "ot", 512], ["unroll_explicit", "ot", 1]]}], "r": [[0.000415518, 0.000414208], 0, 1.4456470012664795, 1578489618.085152], "v": 0.1}
{"i": ["cuda", "schedule_direct_3d_cuda", [[1, 1, 64, 128, 128], [24, 1, 1, 5, 5], [1, 2, 2], [0, 2, 2], 1], {}, ["schedule_direct_3d_cuda", [1, 1, 64, 128, 128], [24, 1, 1, 5, 5], [1, 2, 2], [0, 2, 2], 1], {"i": 876081957, "t": "", "c": null, "e": [["tile_f", "sp", [-1, 2, 2, 2]], ["tile_d", "sp", [-1, 1, 1, 2]], ["tile_y", "sp", [-1, 2, 1, 1]], ["tile_x", "sp", [-1, 2, 4, 2]], ["tile_rc", "sp", [-1, 1]], ["tile_rd", "sp", [-1, 1]], ["tile_ry", "sp", [-1, 1]], ["tile_rx", "sp", [-1, 5]], ["auto_unroll_max_step", "ot", 512], ["unroll_explicit", "ot", 1]]}], "r": [[0.000643169, 0.000640581], 0, 1.5573327541351318, 1578489620.602178], "v": 0.1}
{"i": ["cuda", "schedule_direct_3d_cuda", [[1, 1, 64, 128, 128], [24, 1, 1, 5, 5], [1, 2, 2], [0, 2, 2], 1], {}, ["schedule_direct_3d_cuda", [1, 1, 64, 128, 128], [24, 1, 1, 5, 5], [1, 2, 2], [0, 2, 2], 1], {"i": 1067763211, "t": "", "c": null, "e": [["tile_f", "sp", [-1, 4, 2, 1]], ["tile_d", "sp", [-1, 1, 1, 2]], ["tile_y", "sp", [-1, 1, 1, 4]], ["tile_x", "sp", [-1, 1, 8, 2]], ["tile_rc", "sp", [-1, 1]], ["tile_rd", "sp", [-1, 1]], ["tile_ry", "sp", [-1, 1]], ["tile_rx", "sp", [-1, 5]], ["auto_unroll_max_step", "ot", 1500], ["unroll_explicit", "ot", 1]]}], "r": [[0.00067300575, 0.00065192], 0, 1.6327354907989502, 1578489621.1574907], "v": 0.1}
{"i": ["cuda", "schedule_direct_3d_cuda", [[1, 1, 64, 128, 128], [24, 1, 1, 5, 5], [1, 2, 2], [0, 2, 2], 1], {}, ["schedule_direct_3d_cuda", [1, 1, 64, 128, 128], [24, 1, 1, 5, 5], [1, 2, 2], [0, 2, 2], 1], {"i": 886565140, "t": "", "c": null, "e": [["tile_f", "sp", [-1, 3, 4, 1]], ["tile_d", "sp", [-1, 1, 1, 2]], ["tile_y", "sp", [-1, 1, 1, 4]], ["tile_x", "sp", [-1, 1, 4, 4]], ["tile_rc", "sp", [-1, 1]], ["tile_rd", "sp", [-1, 1]], ["tile_ry", "sp", [-1, 1]], ["tile_rx", "sp", [-1, 5]], ["auto_unroll_max_step", "ot", 512], ["unroll_explicit", "ot", 1]]}], "r": [[0.0004787835, 0.00049263375], 0, 2.209728240966797, 1578489621.9459567], "v": 0.1}
{"i": ["cuda", "schedule_direct_3d_cuda", [[1, 1, 64, 128, 128], [24, 1, 1, 5, 5], [1, 2, 2], [0, 2, 2], 1], {}, ["schedule_direct_3d_cuda", [1, 1, 64, 128, 128], [24, 1, 1, 5, 5], [1, 2, 2], [0, 2, 2], 1], {"i": 876081973, "t": "", "c": null, "e": [["tile_f", "sp", [-1, 2, 2, 3]], ["tile_d", "sp", [-1, 1, 1, 2]], ["tile_y", "sp", [-1, 2, 1, 1]], ["tile_x", "sp", [-1, 2, 4, 2]], ["tile_rc", "sp", [-1, 1]], ["tile_rd", "sp", [-1, 1]], ["tile_ry", "sp", [-1, 1]], ["tile_rx", "sp", [-1, 5]], ["auto_unroll_max_step", "ot", 512], ["unroll_explicit", "ot", 1]]}], "r": [[0.00071445175, 0.0007822835], 0, 2.021458148956299, 1578489622.6748672], "v": 0.1}
{"i": ["cuda", "schedule_direct_3d_cuda", [[1, 1, 64, 128, 128], [24, 1, 1, 5, 5], [1, 2, 2], [0, 2, 2], 1], {}, ["schedule_direct_3d_cuda", [1, 1, 64, 128, 128], [24, 1, 1, 5, 5], [1, 2, 2], [0, 2, 2], 1], {"i": 309102091, "t": "", "c": null, "e": [["tile_f", "sp", [-1, 4, 2, 1]], ["tile_d", "sp", [-1, 1, 1, 2]], ["tile_y", "sp", [-1, 1, 1, 4]], ["tile_x", "sp", [-1, 1, 8, 2]], ["tile_rc", "sp", [-1, 1]], ["tile_rd", "sp", [-1, 1]], ["tile_ry", "sp", [-1, 1]], ["tile_rx", "sp", [-1, 5]], ["auto_unroll_max_step", "ot", 512], ["unroll_explicit", "ot", 0]]}], "r": [[0.00128621475, 0.0012822235], 0, 1.5624983310699463, 1578489623.4449701], "v": 0.1}
{"i": ["cuda", "schedule_direct_3d_cuda", [[1, 1, 64, 128, 128], [24, 1, 1, 5, 5], [1, 2, 2], [0, 2, 2], 1], {}, ["schedule_direct_3d_cuda", [1, 1, 64, 128, 128], [24, 1, 1, 5, 5], [1, 2, 2], [0, 2, 2], 1], {"i": 877775400, "t": "", "c": null, "e": [["tile_f", "sp", [-1, 1, 3, 2]], ["tile_d", "sp", [-1, 1, 1, 2]], ["tile_y", "sp", [-1, 2, 1, 1]], ["tile_x", "sp", [-1, 1, 8, 2]], ["tile_rc", "sp", [-1, 1]], ["tile_rd", "sp", [-1, 1]], ["tile_ry", "sp", [-1, 1]], ["tile_rx", "sp", [-1, 5]], ["auto_unroll_max_step", "ot", 512], ["unroll_explicit", "ot", 1]]}], "r": [[0.00054054575, 0.000581966], 0, 1.8156561851501465, 1578489624.1765912], "v": 0.1}
{"i": ["cuda", "schedule_direct_3d_cuda", [[1, 1, 64, 128, 128], [24, 1, 1, 5, 5], [1, 2, 2], [0, 2, 2], 1], {}, ["schedule_direct_3d_cuda", [1, 1, 64, 128, 128], [24, 1, 1, 5, 5], [1, 2, 2], [0, 2, 2], 1], {"i": 688432651, "t": "", "c": null, "e": [["tile_f", "sp", [-1, 4, 2, 1]], ["tile_d", "sp", [-1, 1, 1, 2]], ["tile_y", "sp", [-1, 1, 1, 4]], ["tile_x", "sp", [-1, 1, 8, 2]], ["tile_rc", "sp", [-1, 1]], ["tile_rd", "sp", [-1, 1]], ["tile_ry", "sp", [-1, 1]], ["tile_rx", "sp", [-1, 5]], ["auto_unroll_max_step", "ot", 0], ["unroll_explicit", "ot", 1]]}], "r": [[0.0008438305, 0.000843388], 0, 1.1189587116241455, 1578489624.7407382], "v": 0.1}
{"i": ["cuda", "schedule_direct_3d_cuda", [[1, 1, 64, 128, 128], [24, 1, 1, 5, 5], [1, 2, 2], [0, 2, 2], 1], {}, ["schedule_direct_3d_cuda", [1, 1, 64, 128, 128], [24, 1, 1, 5, 5], [1, 2, 2], [0, 2, 2], 1], {"i": 888493798, "t": "", "c": null, "e": [["tile_f", "sp", [-1, 3, 2, 2]], ["tile_d", "sp", [-1, 1, 1, 2]], ["tile_y", "sp", [-1, 1, 1, 1]], ["tile_x", "sp", [-1, 2, 8, 4]], ["tile_rc", "sp", [-1, 1]], ["tile_rd", "sp", [-1, 1]], ["tile_ry", "sp", [-1, 1]], ["tile_rx", "sp", [-1, 5]], ["auto_unroll_max_step", "ot", 512], ["unroll_explicit", "ot", 1]]}], "r": [[0.00026507125, 0.00026407225], 0, 1.7272827625274658, 1578489625.3696518], "v": 0.1}
{"i": ["cuda", "schedule_direct_3d_cuda", [[1, 1, 64, 128, 128], [24, 1, 1, 5, 5], [1, 2, 2], [0, 2, 2], 1], {}, ["schedule_direct_3d_cuda", [1, 1, 64, 128, 128], [24, 1, 1, 5, 5], [1, 2, 2], [0, 2, 2], 1], {"i": 877956819, "t": "", "c": null, "e": [["tile_f", "sp", [-1, 2, 4, 1]], ["tile_d", "sp", [-1, 1, 1, 2]], ["tile_y", "sp", [-1, 1, 1, 2]], ["tile_x", "sp", [-1, 1, 8, 2]], ["tile_rc", "sp", [-1, 1]], ["tile_rd", "sp", [-1, 1]], ["tile_ry", "sp", [-1, 1]], ["tile_rx", "sp", [-1, 5]], ["auto_unroll_max_step", "ot", 512], ["unroll_explicit", "ot", 1]]}], "r": [[0.00034768375, 0.000345009], 0, 1.6660773754119873, 1578489626.1084588], "v": 0.1}
{"i": ["cuda", "schedule_direct_3d_cuda", [[1, 1, 64, 128, 128], [24, 1, 1, 5, 5], [1, 2, 2], [0, 2, 2], 1], {}, ["schedule_direct_3d_cuda", [1, 1, 64, 128, 128], [24, 1, 1, 5, 5], [1, 2, 2], [0, 2, 2], 1], {"i": 886242570, "t": "", "c": null, "e": [["tile_f", "sp", [-1, 3, 2, 1]], ["tile_d", "sp", [-1, 1, 1, 2]], ["tile_y", "sp", [-1, 2, 1, 1]], ["tile_x", "sp", [-1, 1, 4, 4]], ["tile_rc", "sp", [-1, 1]], ["tile_rd", "sp", [-1, 1]], ["tile_ry", "sp", [-1, 1]], ["tile_rx", "sp", [-1, 5]], ["auto_unroll_max_step", "ot", 512], ["unroll_explicit", "ot", 1]]}], "r": [[0.0008620835, 0.0008607115], 0, 1.609539270401001, 1578489626.7552197], "v": 0.1}
{"i": ["cuda", "schedule_direct_3d_cuda", [[1, 1, 64, 128, 128], [24, 1, 1, 5, 5], [1, 2, 2], [0, 2, 2], 1], {}, ["schedule_direct_3d_cuda", [1, 1, 64, 128, 128], [24, 1, 1, 5, 5], [1, 2, 2], [0, 2, 2], 1], {"i": 876641412, "t": "", "c": null, "e": [["tile_f", "sp", [-1, 1, 2, 3]], ["tile_d", "sp", [-1, 1, 1, 4]], ["tile_y", "sp", [-1, 1, 1, 1]], ["tile_x", "sp", [-1, 4, 4, 2]], ["tile_rc", "sp", [-1, 1]], ["tile_rd", "sp", [-1, 1]], ["tile_ry", "sp", [-1, 1]], ["tile_rx", "sp", [-1, 5]], ["auto_unroll_max_step", "ot", 512], ["unroll_explicit", "ot", 1]]}], "r": [[0.00154176875, 0.0017167815], 0, 1.8759534358978271, 1578489627.4978013], "v": 0.1}
{"i": ["cuda", "schedule_direct_3d_cuda", [[1, 1, 64, 128, 128], [24, 1, 1, 5, 5], [1, 2, 2], [0, 2, 2], 1], {}, ["schedule_direct_3d_cuda", [1, 1, 64, 128, 128], [24, 1, 1, 5, 5], [1, 2, 2], [0, 2, 2], 1], {"i": 888493812, "t": "", "c": null, "e": [["tile_f", "sp", [-1, 1, 2, 3]], ["tile_d", "sp", [-1, 1, 1, 2]], ["tile_y", "sp", [-1, 1, 1, 1]], ["tile_x", "sp", [-1, 2, 8, 4]], ["tile_rc", "sp", [-1, 1]], ["tile_rd", "sp", [-1, 1]], ["tile_ry", "sp", [-1, 1]], ["tile_rx", "sp", [-1, 5]], ["auto_unroll_max_step", "ot", 512], ["unroll_explicit", "ot", 1]]}], "r": [[0.000313606, 0.0003096925], 0, 1.248077154159546, 1578489628.0847855], "v": 0.1}
{"i": ["cuda", "schedule_direct_3d_cuda", [[1, 1, 64, 128, 128], [24, 1, 1, 5, 5], [1, 2, 2], [0, 2, 2], 1], {}, ["schedule_direct_3d_cuda", [1, 1, 64, 128, 128], [24, 1, 1, 5, 5], [1, 2, 2], [0, 2, 2], 1], {"i": 877956815, "t": "", "c": null, "e": [["tile_f", "sp", [-1, 2, 3, 1]], ["tile_d", "sp", [-1, 1, 1, 2]], ["tile_y", "sp", [-1, 1, 1, 2]], ["tile_x", "sp", [-1, 1, 8, 2]], ["tile_rc", "sp", [-1, 1]], ["tile_rd", "sp", [-1, 1]], ["tile_ry", "sp", [-1, 1]], ["tile_rx", "sp", [-1, 5]], ["auto_unroll_max_step", "ot", 512], ["unroll_explicit", "ot", 1]]}], "r": [[0.00047258725, 0.00047187825], 0, 1.7620270252227783, 1578489631.5446756], "v": 0.1}
{"i": ["cuda", "schedule_direct_3d_cuda", [[1, 1, 64, 128, 128], [24, 1, 1, 5, 5], [1, 2, 2], [0, 2, 2], 1], {}, ["schedule_direct_3d_cuda", [1, 1, 64, 128, 128], [24, 1, 1, 5, 5], [1, 2, 2], [0, 2, 2], 1], {"i": 878097973, "t": "", "c": null, "e": [["tile_f", "sp", [-1, 2, 2, 3]], ["tile_d", "sp", [-1, 1, 1, 2]], ["tile_y", "sp", [-1, 1, 1, 4]], ["tile_x", "sp", [-1, 1, 8, 2]], ["tile_rc", "sp", [-1, 1]], ["tile_rd", "sp", [-1, 1]], ["tile_ry", "sp", [-1, 1]], ["tile_rx", "sp", [-1, 5]], ["auto_unroll_max_step", "ot", 512], ["unroll_explicit", "ot", 1]]}], "r": [[0.000408986, 0.00054621725], 0, 2.033888816833496, 1578489632.2949183], "v": 0.1}
{"i": ["cuda", "schedule_direct_3d_cuda", [[1, 1, 64, 128, 128], [24, 1, 1, 5, 5], [1, 2, 2], [0, 2, 2], 1], {}, ["schedule_direct_3d_cuda", [1, 1, 64, 128, 128], [24, 1, 1, 5, 5], [1, 2, 2], [0, 2, 2], 1], {"i": 887974117, "t": "", "c": null, "e": [["tile_f", "sp", [-1, 2, 2, 2]], ["tile_d", "sp", [-1, 1, 1, 1]], ["tile_y", "sp", [-1, 1, 2, 1]], ["tile_x", "sp", [-1, 1, 8, 4]], ["tile_rc", "sp", [-1, 1]], ["tile_rd", "sp", [-1, 1]], ["tile_ry", "sp", [-1, 1]], ["tile_rx", "sp", [-1, 5]], ["auto_unroll_max_step", "ot", 512], ["unroll_explicit", "ot", 1]]}], "r": [[0.00034339875, 0.00036810375], 0, 1.7610461711883545, 1578489632.975191], "v": 0.1}
{"i": ["cuda", "schedule_direct_3d_cuda", [[1, 1, 64, 128, 128], [24, 1, 1, 5, 5], [1, 2, 2], [0, 2, 2], 1], {}, ["schedule_direct_3d_cuda", [1, 1, 64, 128, 128], [24, 1, 1, 5, 5], [1, 2, 2], [0, 2, 2], 1], {"i": 877956843, "t": "", "c": null, "e": [["tile_f", "sp", [-1, 1, 4, 2]], ["tile_d", "sp", [-1, 1, 1, 2]], ["tile_y", "sp", [-1, 1, 1, 2]], ["tile_x", "sp", [-1, 1, 8, 2]], ["tile_rc", "sp", [-1, 1]], ["tile_rd", "sp", [-1, 1]], ["tile_ry", "sp", [-1, 1]], ["tile_rx", "sp", [-1, 5]], ["auto_unroll_max_step", "ot", 512], ["unroll_explicit", "ot", 1]]}], "r": [[0.00034663275, 0.00034572975], 0, 1.8382909297943115, 1578489633.7656033], "v": 0.1}
{"i": ["cuda", "schedule_direct_3d_cuda", [[1, 1, 64, 128, 128], [24, 1, 1, 5, 5], [1, 2, 2], [0, 2, 2], 1], {}, ["schedule_direct_3d_cuda", [1, 1, 64, 128, 128], [24, 1, 1, 5, 5], [1, 2, 2], [0, 2, 2], 1], {"i": 1078159077, "t": "", "c": null, "e": [["tile_f", "sp", [-1, 2, 2, 2]], ["tile_d", "sp", [-1, 1, 1, 2]], ["tile_y", "sp", [-1, 1, 1, 1]], ["tile_x", "sp", [-1, 2, 8, 4]], ["tile_rc", "sp", [-1, 1]], ["tile_rd", "sp", [-1, 1]], ["tile_ry", "sp", [-1, 1]], ["tile_rx", "sp", [-1, 5]], ["auto_unroll_max_step", "ot", 1500], ["unroll_explicit", "ot", 1]]}], "r": [[0.00030307375, 0.00036266525], 0, 1.3815522193908691, 1578489634.2925465], "v": 0.1}
{"i": ["cuda", "schedule_direct_3d_cuda", [[1, 1, 64, 128, 128], [24, 1, 1, 5, 5], [1, 2, 2], [0, 2, 2], 1], {}, ["schedule_direct_3d_cuda", [1, 1, 64, 128, 128], [24, 1, 1, 5, 5], [1, 2, 2], [0, 2, 2], 1], {"i": 1076230420, "t": "", "c": null, "e": [["tile_f", "sp", [-1, 3, 4, 1]], ["tile_d", "sp", [-1, 1, 1, 2]], ["tile_y", "sp", [-1, 1, 1, 4]], ["tile_x", "sp", [-1, 1, 4, 4]], ["tile_rc", "sp", [-1, 1]], ["tile_rd", "sp", [-1, 1]], ["tile_ry", "sp", [-1, 1]], ["tile_rx", "sp", [-1, 5]], ["auto_unroll_max_step", "ot", 1500], ["unroll_explicit", "ot", 1]]}], "r": [[0.00044986025, 0.00044957175], 0, 2.4164717197418213, 1578489635.4072335], "v": 0.1}
{"i": ["cuda", "schedule_direct_3d_cuda", [[1, 1, 64, 128, 128], [24, 1, 1, 5, 5], [1, 2, 2], [0, 2, 2], 1], {}, ["schedule_direct_3d_cuda", [1, 1, 64, 128, 128], [24, 1, 1, 5, 5], [1, 2, 2], [0, 2, 2], 1], {"i": 1075907860, "t": "", "c": null, "e": [["tile_f", "sp", [-1, 3, 4, 1]], ["tile_d", "sp", [-1, 1, 1, 2]], ["tile_y", "sp", [-1, 2, 1, 1]], ["tile_x", "sp", [-1, 1, 4, 4]], ["tile_rc", "sp", [-1, 1]], ["tile_rd", "sp", [-1, 1]], ["tile_ry", "sp", [-1, 1]], ["tile_rx", "sp", [-1, 5]], ["auto_unroll_max_step", "ot", 1500], ["unroll_explicit", "ot", 1]]}], "r": [[0.000830831, 0.00083113375], 0, 3.139773368835449, 1578489636.3853064], "v": 0.1}
