auto_log/best.log
{"i": ["cuda", "schedule_conv3d_transpose_nchw_cuda", [[1, 12, 64, 128, 128], [12, 32, 1, 1, 1], [1, 1, 1], [0, 0, 0], [0, 0, 0], "float32"], {}, ["schedule_conv3d_transpose_nchw_cuda", [1, 12, 64, 128, 128], [12, 32, 1, 1, 1], [1, 1, 1], [0, 0, 0], [0, 0, 0], "float32"], {"i": 2251748403, "t": "", "c": null, "e": [["tile_f", "sp", [-1, 1, 4, 8]], ["tile_d", "sp", [-1, 1, 1, 1]], ["tile_y", "sp", [-1, 1, 2, 1]], ["tile_x", "sp", [-1, 8, 16, 1]], ["tile_rc", "sp", [-1, 4]], ["tile_rd", "sp", [-1, 1]], ["tile_ry", "sp", [-1, 1]], ["tile_rx", "sp", [-1, 1]], ["auto_unroll_max_step", "ot", 1500], ["unroll_explicit", "ot", 1]]}], "r": [[0.00049292375, 0.0004919055], 0, 1.9651155471801758, 1578511430.5513945], "v": 0.1}
{"i": ["cuda", "schedule_conv3d_nchw_cuda", [[24, 1, 64, 64, 64], [24, 1, 64, 64, 64], 1, [1, 1, 1], [1, 1, 1], 1], {}, ["schedule_conv3d_nchw_cuda", [24, 1, 64, 64, 64], [24, 1, 64, 64, 64], 1, [1, 1, 1], [1, 1, 1], 1], {"i": 1170190960, "t": "", "c": null, "e": [["tile_n", "sp", [-1, 1, 1, 1]], ["tile_f", "sp", [-1, 1, 12, 1]], ["tile_d", "sp", [-1, 1, 3, 1]], ["tile_y", "sp", [-1, 1, 3, 1]], ["tile_x", "sp", [-1, 1, 1, 3]], ["tile_rc", "sp", [-1, 1]], ["tile_rd", "sp", [-1, 1]], ["tile_ry", "sp", [-1, 4]], ["tile_rx", "sp", [-1, 4]], ["auto_unroll_max_step", "ot", 1500], ["unroll_explicit", "ot", 0], ["fuse_yx", "ot", 1]]}], "r": [[0.005510184, 0.00551289175], 0, 1.6235418319702148, 1578524029.5792468], "v": 0.1}
{"i": ["cuda", "schedule_conv3d_nchw_cuda", [[192, 1, 8, 8, 8], [192, 1, 8, 8, 8], 1, [1, 1, 1], [1, 1, 1], 1], {}, ["schedule_conv3d_nchw_cuda", [192, 1, 8, 8, 8], [192, 1, 8, 8, 8], 1, [1, 1, 1], [1, 1, 1], 1], {"i": 642195569, "t": "", "c": null, "e": [["tile_n", "sp", [-1, 2, 4, 2]], ["tile_f", "sp", [-1, 4, 8, 2]], ["tile_d", "sp", [-1, 1, 1, 1]], ["tile_y", "sp", [-1, 1, 3, 1]], ["tile_x", "sp", [-1, 1, 1, 3]], ["tile_rc", "sp", [-1, 1]], ["tile_rd", "sp", [-1, 1]], ["tile_ry", "sp", [-1, 4]], ["tile_rx", "sp", [-1, 2]], ["auto_unroll_max_step", "ot", 512], ["unroll_explicit", "ot", 0], ["fuse_yx", "ot", 0]]}], "r": [[0.00020025025, 0.0001981825], 0, 1.2799270153045654, 1578568872.1165655], "v": 0.1}
{"i": ["cuda", "schedule_direct_3d_cuda", [[1, 192, 16, 16, 16], [192, 192, 3, 3, 3], [1, 1, 1], [1, 1, 1], 1], {}, ["schedule_direct_3d_cuda", [1, 192, 16, 16, 16], [192, 192, 3, 3, 3], [1, 1, 1], [1, 1, 1], 1], {"i": 1236740479, "t": "", "c": null, "e": [["tile_f", "sp", [-1, 1, 64, 1]], ["tile_d", "sp", [-1, 1, 1, 1]], ["tile_y", "sp", [-1, 1, 1, 4]], ["tile_x", "sp", [-1, 2, 2, 4]], ["tile_rc", "sp", [-1, 2]], ["tile_rd", "sp", [-1, 1]], ["tile_ry", "sp", [-1, 3]], ["tile_rx", "sp", [-1, 3]], ["auto_unroll_max_step", "ot", 0], ["unroll_explicit", "ot", 0]]}], "r": [[0.0011272855, 0.001123137], 0, 1.1272389888763428, 1578542065.4480608], "v": 0.1}
{"i": ["cuda", "schedule_conv3d_nchw_cuda", [[1, 1, 64, 128, 128], [24, 1, 64, 64, 64], 1, [0, 2, 2], [1, 2, 2], 1], {}, ["schedule_conv3d_nchw_cuda", [1, 1, 64, 128, 128], [24, 1, 64, 64, 64], 1, [0, 2, 2], [1, 2, 2], 1], {"i": 83732982, "t": "", "c": null, "e": [["tile_n", "sp", [-1, 1, 1, 1]], ["tile_f", "sp", [-1, 1, 6, 1]], ["tile_d", "sp", [-1, 1, 1, 1]], ["tile_y", "sp", [-1, 1, 3, 1]], ["tile_x", "sp", [-1, 1, 6, 1]], ["tile_rc", "sp", [-1, 1]], ["tile_rd", "sp", [-1, 1]], ["tile_ry", "sp", [-1, 8]], ["tile_rx", "sp", [-1, 64]], ["auto_unroll_max_step", "ot", 1500], ["unroll_explicit", "ot", 1], ["fuse_yx", "ot", 1]]}], "r": [[0.0025339515, 0.002532179], 0, 2.8821487426757812, 1578496566.9379299], "v": 0.1}
{"i": ["cuda", "schedule_conv3d_transpose_nchw_cuda", [[1, 192, 16, 16, 16], [192, 192, 3, 3, 3], [1, 1, 1], [1, 1, 1], [0, 0, 0], "float32"], {}, ["schedule_conv3d_transpose_nchw_cuda", [1, 192, 16, 16, 16], [192, 192, 3, 3, 3], [1, 1, 1], [1, 1, 1], [0, 0, 0], "float32"], {"i": 8476507367, "t": "", "c": null, "e": [["tile_f", "sp", [-1, 4, 8, 3]], ["tile_d", "sp", [-1, 1, 1, 2]], ["tile_y", "sp", [-1, 2, 1, 1]], ["tile_x", "sp", [-1, 1, 16, 1]], ["tile_rc", "sp", [-1, 1]], ["tile_rd", "sp", [-1, 1]], ["tile_ry", "sp", [-1, 3]], ["tile_rx", "sp", [-1, 1]], ["auto_unroll_max_step", "ot", 1500], ["unroll_explicit", "ot", 1]]}], "r": [[0.0014508065, 0.00144564225], 0, 2.5493109226226807, 1578546180.8013802], "v": 0.1}
{"i": ["cuda", "schedule_conv3d_nchw_cuda", [[24, 1, 64, 128, 128], [12, 1, 64, 128, 128], 1, [0, 0, 0], [1, 1, 1], 1], {}, ["schedule_conv3d_nchw_cuda", [24, 1, 64, 128, 128], [12, 1, 64, 128, 128], 1, [0, 0, 0], [1, 1, 1], 1], {"i": 11882665, "t": "", "c": null, "e": [["tile_n", "sp", [-1, 1, 8, 1]], ["tile_f", "sp", [-1, 1, 4, 1]], ["tile_d", "sp", [-1, 1, 1, 1]], ["tile_y", "sp", [-1, 1, 1, 1]], ["tile_x", "sp", [-1, 1, 1, 1]], ["tile_rc", "sp", [-1, 1]], ["tile_rd", "sp", [-1, 8]], ["tile_ry", "sp", [-1, 4]], ["tile_rx", "sp", [-1, 4]], ["auto_unroll_max_step", "ot", 1500], ["unroll_explicit", "ot", 0], ["fuse_yx", "ot", 1]]}], "r": [[0.0136167625, 0.0136173865], 0, 1.3657805919647217, 1578505145.5845602], "v": 0.1}
{"i": ["cuda", "schedule_conv3d_transpose_nchw_cuda", [[1, 24, 64, 64, 64], [24, 1, 1, 5, 5], [1, 2, 2], [0, 2, 2], [0, 1, 1], "float32"], {}, ["schedule_conv3d_transpose_nchw_cuda", [1, 24, 64, 64, 64], [24, 1, 1, 5, 5], [1, 2, 2], [0, 2, 2], [0, 1, 1], "float32"], {"i": 374314416, "t": "", "c": null, "e": [["tile_f", "sp", [-1, 1, 1, 1]], ["tile_d", "sp", [-1, 1, 1, 1]], ["tile_y", "sp", [-1, 2, 2, 2]], ["tile_x", "sp", [-1, 1, 8, 2]], ["tile_rc", "sp", [-1, 8]], ["tile_rd", "sp", [-1, 1]], ["tile_ry", "sp", [-1, 5]], ["tile_rx", "sp", [-1, 5]], ["auto_unroll_max_step", "ot", 512], ["unroll_explicit", "ot", 1]]}], "r": [[0.00024033825, 0.0002399895], 0, 1.1320810317993164, 1578494061.2779198], "v": 0.1}
{"i": ["cuda", "schedule_direct_3d_cuda", [[1, 64, 32, 32, 32], [64, 64, 3, 3, 3], [1, 1, 1], [1, 1, 1], 1], {}, ["schedule_direct_3d_cuda", [1, 64, 32, 32, 32], [64, 64, 3, 3, 3], [1, 1, 1], [1, 1, 1], 1], {"i": 4445647036, "t": "", "c": null, "e": [["tile_f", "sp", [-1, 2, 4, 2]], ["tile_d", "sp", [-1, 2, 1, 1]], ["tile_y", "sp", [-1, 2, 1, 2]], ["tile_x", "sp", [-1, 1, 32, 1]], ["tile_rc", "sp", [-1, 1]], ["tile_rd", "sp", [-1, 3]], ["tile_ry", "sp", [-1, 3]], ["tile_rx", "sp", [-1, 1]], ["auto_unroll_max_step", "ot", 1500], ["unroll_explicit", "ot", 1]]}], "r": [[0.00101574875, 0.00101207725], 0, 1.8822548389434814, 1578526829.0382602], "v": 0.1}
{"i": ["cuda", "schedule_conv3d_transpose_nchw_cuda", [[1, 192, 8, 8, 8], [192, 192, 3, 3, 3], [1, 1, 1], [1, 1, 1], [0, 0, 0], "float32"], {}, ["schedule_conv3d_transpose_nchw_cuda", [1, 192, 8, 8, 8], [192, 192, 3, 3, 3], [1, 1, 1], [1, 1, 1], [0, 0, 0], "float32"], {"i": 1619207632, "t": "", "c": null, "e": [["tile_f", "sp", [-1, 1, 4, 2]], ["tile_d", "sp", [-1, 1, 1, 2]], ["tile_y", "sp", [-1, 1, 2, 2]], ["tile_x", "sp", [-1, 1, 4, 1]], ["tile_rc", "sp", [-1, 1]], ["tile_rd", "sp", [-1, 3]], ["tile_ry", "sp", [-1, 3]], ["tile_rx", "sp", [-1, 1]], ["auto_unroll_max_step", "ot", 1500], ["unroll_explicit", "ot", 1]]}], "r": [[0.000298286, 0.00029764925], 0, 1.177319049835205, 1578565883.512425], "v": 0.1}
{"i": ["cuda", "schedule_direct_3d_cuda", [[1, 24, 64, 128, 128], [12, 24, 1, 1, 1], [1, 1, 1], [0, 0, 0], 1], {}, ["schedule_direct_3d_cuda", [1, 24, 64, 128, 128], [12, 24, 1, 1, 1], [1, 1, 1], [0, 0, 0], 1], {"i": 1948716029, "t": "", "c": null, "e": [["tile_f", "sp", [-1, 4, 1, 3]], ["tile_d", "sp", [-1, 1, 1, 1]], ["tile_y", "sp", [-1, 1, 4, 1]], ["tile_x", "sp", [-1, 1, 64, 1]], ["tile_rc", "sp", [-1, 1]], ["tile_rd", "sp", [-1, 1]], ["tile_ry", "sp", [-1, 1]], ["tile_rx", "sp", [-1, 1]], ["auto_unroll_max_step", "ot", 1500], ["unroll_explicit", "ot", 1]]}], "r": [[0.00040082825, 0.000399404], 0, 1.3756818771362305, 1578500171.7983813], "v": 0.1}
{"i": ["cuda", "schedule_conv3d_nchw_cuda", [[64, 1, 32, 32, 32], [64, 1, 32, 32, 32], 1, [1, 1, 1], [1, 1, 1], 1], {}, ["schedule_conv3d_nchw_cuda", [64, 1, 32, 32, 32], [64, 1, 32, 32, 32], 1, [1, 1, 1], [1, 1, 1], 1], {"i": 596206738, "t": "", "c": null, "e": [["tile_n", "sp", [-1, 1, 16, 1]], ["tile_f", "sp", [-1, 2, 2, 2]], ["tile_d", "sp", [-1, 1, 1, 1]], ["tile_y", "sp", [-1, 1, 1, 1]], ["tile_x", "sp", [-1, 3, 1, 1]], ["tile_rc", "sp", [-1, 1]], ["tile_rd", "sp", [-1, 1]], ["tile_ry", "sp", [-1, 16]], ["tile_rx", "sp", [-1, 1]], ["auto_unroll_max_step", "ot", 0], ["unroll_explicit", "ot", 0], ["fuse_yx", "ot", 1]]}], "r": [[0.0020324255, 0.002030637], 0, 1.1773717403411865, 1578532051.3959756], "v": 0.1}
{"i": ["cuda", "schedule_direct_3d_cuda", [[1, 1, 64, 128, 128], [24, 1, 1, 5, 5], [1, 2, 2], [0, 2, 2], 1], {}, ["schedule_direct_3d_cuda", [1, 1, 64, 128, 128], [24, 1, 1, 5, 5], [1, 2, 2], [0, 2, 2], 1], {"i": 867041426, "t": "", "c": null, "e": [["tile_f", "sp", [-1, 1, 6, 4]], ["tile_d", "sp", [-1, 2, 1, 1]], ["tile_y", "sp", [-1, 1, 1, 1]], ["tile_x", "sp", [-1, 4, 16, 1]], ["tile_rc", "sp", [-1, 1]], ["tile_rd", "sp", [-1, 1]], ["tile_ry", "sp", [-1, 1]], ["tile_rx", "sp", [-1, 5]], ["auto_unroll_max_step", "ot", 512], ["unroll_explicit", "ot", 1]]}], "r": [[0.00012230225, 0.00012133125], 0, 1.1517632007598877, 1578492054.7026224], "v": 0.1}
{"i": ["cuda", "schedule_direct_3d_cuda", [[1, 192, 8, 8, 8], [192, 192, 3, 3, 3], [1, 1, 1], [1, 1, 1], 1], {}, ["schedule_direct_3d_cuda", [1, 192, 8, 8, 8], [192, 192, 3, 3, 3], [1, 1, 1], [1, 1, 1], 1], {"i": 1622161346, "t": "", "c": null, "e": [["tile_f", "sp", [-1, 2, 8, 1]], ["tile_d", "sp", [-1, 2, 1, 1]], ["tile_y", "sp", [-1, 1, 2, 2]], ["tile_x", "sp", [-1, 1, 8, 1]], ["tile_rc", "sp", [-1, 2]], ["tile_rd", "sp", [-1, 3]], ["tile_ry", "sp", [-1, 3]], ["tile_rx", "sp", [-1, 1]], ["auto_unroll_max_step", "ot", 1500], ["unroll_explicit", "ot", 1]]}], "r": [[0.0002316635, 0.00023118125], 0, 1.3135547637939453, 1578561422.131954], "v": 0.1}
{"i": ["cuda", "schedule_conv3d_nchw_cuda", [[32, 1, 64, 128, 128], [12, 1, 64, 128, 128], 1, [0, 0, 0], [1, 1, 1], 1], {}, ["schedule_conv3d_nchw_cuda", [32, 1, 64, 128, 128], [12, 1, 64, 128, 128], 1, [0, 0, 0], [1, 1, 1], 1], {"i": 10188366, "t": "", "c": null, "e": [["tile_n", "sp", [-1, 1, 2, 1]], ["tile_f", "sp", [-1, 1, 6, 1]], ["tile_d", "sp", [-1, 1, 1, 1]], ["tile_y", "sp", [-1, 1, 1, 1]], ["tile_x", "sp", [-1, 1, 1, 1]], ["tile_rc", "sp", [-1, 1]], ["tile_rd", "sp", [-1, 32]], ["tile_ry", "sp", [-1, 2]], ["tile_rx", "sp", [-1, 2]], ["auto_unroll_max_step", "ot", 512], ["unroll_explicit", "ot", 1], ["fuse_yx", "ot", 1]]}], "r": [[0.0133165345, 0.01331005225], 0, 1.6963634490966797, 1578513377.5791142], "v": 0.1}
{"i": ["cuda", "schedule_conv3d_nchw_cuda", [[192, 1, 16, 16, 16], [192, 1, 16, 16, 16], 1, [1, 1, 1], [1, 1, 1], 1], {}, ["schedule_conv3d_nchw_cuda", [192, 1, 16, 16, 16], [192, 1, 16, 16, 16], 1, [1, 1, 1], [1, 1, 1], 1], {"i": 7452515478, "t": "", "c": null, "e": [["tile_n", "sp", [-1, 1, 4, 4]], ["tile_f", "sp", [-1, 2, 32, 1]], ["tile_d", "sp", [-1, 1, 1, 1]], ["tile_y", "sp", [-1, 1, 1, 3]], ["tile_x", "sp", [-1, 3, 1, 1]], ["tile_rc", "sp", [-1, 1]], ["tile_rd", "sp", [-1, 2]], ["tile_ry", "sp", [-1, 2]], ["tile_rx", "sp", [-1, 2]], ["auto_unroll_max_step", "ot", 1500], ["unroll_explicit", "ot", 0], ["fuse_yx", "ot", 1]]}], "r": [[0.00109997275, 0.00109832525], 0, 1.274587869644165, 1578549080.5202692], "v": 0.1}
{"i": ["cuda", "schedule_direct_3d_cuda", [[1, 32, 64, 128, 128], [12, 32, 1, 1, 1], [1, 1, 1], [0, 0, 0], 1], {}, ["schedule_direct_3d_cuda", [1, 32, 64, 128, 128], [12, 32, 1, 1, 1], [1, 1, 1], [0, 0, 0], 1], {"i": 1559174431, "t": "", "c": null, "e": [["tile_f", "sp", [-1, 2, 2, 3]], ["tile_d", "sp", [-1, 1, 1, 1]], ["tile_y", "sp", [-1, 1, 1, 1]], ["tile_x", "sp", [-1, 2, 16, 1]], ["tile_rc", "sp", [-1, 4]], ["tile_rd", "sp", [-1, 1]], ["tile_ry", "sp", [-1, 1]], ["tile_rx", "sp", [-1, 1]], ["auto_unroll_max_step", "ot", 1500], ["unroll_explicit", "ot", 1]]}], "r": [[0.00048685775, 0.00048593275], 0, 1.5035810470581055, 1578508735.8501234], "v": 0.1}
{"i": ["cuda", "schedule_conv3d_transpose_nchw_cuda", [[1, 12, 64, 128, 128], [12, 24, 1, 1, 1], [1, 1, 1], [0, 0, 0], [0, 0, 0], "float32"], {}, ["schedule_conv3d_transpose_nchw_cuda", [1, 12, 64, 128, 128], [12, 24, 1, 1, 1], [1, 1, 1], [0, 0, 0], [0, 0, 0], "float32"], {"i": 1480174143, "t": "", "c": null, "e": [["tile_f", "sp", [-1, 3, 2, 4]], ["tile_d", "sp", [-1, 1, 1, 1]], ["tile_y", "sp", [-1, 1, 1, 4]], ["tile_x", "sp", [-1, 1, 128, 1]], ["tile_rc", "sp", [-1, 4]], ["tile_rd", "sp", [-1, 1]], ["tile_ry", "sp", [-1, 1]], ["tile_rx", "sp", [-1, 1]], ["auto_unroll_max_step", "ot", 1500], ["unroll_explicit", "ot", 0]]}], "r": [[0.00040384275, 0.00040281275], 0, 1.1766629219055176, 1578502931.004669], "v": 0.1}
{"i": ["cuda", "schedule_conv3d_transpose_nchw_cuda", [[1, 64, 32, 32, 32], [64, 64, 3, 3, 3], [1, 1, 1], [1, 1, 1], [0, 0, 0], "float32"], {}, ["schedule_conv3d_transpose_nchw_cuda", [1, 64, 32, 32, 32], [64, 64, 3, 3, 3], [1, 1, 1], [1, 1, 1], [0, 0, 0], "float32"], {"i": 4876102332, "t": "", "c": null, "e": [["tile_f", "sp", [-1, 4, 16, 1]], ["tile_d", "sp", [-1, 1, 1, 2]], ["tile_y", "sp", [-1, 1, 2, 2]], ["tile_x", "sp", [-1, 1, 4, 2]], ["tile_rc", "sp", [-1, 2]], ["tile_rd", "sp", [-1, 3]], ["tile_ry", "sp", [-1, 3]], ["tile_rx", "sp", [-1, 3]], ["auto_unroll_max_step", "ot", 1500], ["unroll_explicit", "ot", 1]]}], "r": [[0.00096008875, 0.0009558405], 0, 2.3644511699676514, 1578530452.650149], "v": 0.1}
{"i": ["cuda", "schedule_conv3d_transpose_nchw_cuda", [[1, 24, 64, 64, 64], [24, 24, 3, 3, 3], [1, 1, 1], [1, 1, 1], [0, 0, 0], "float32"], {}, ["schedule_conv3d_transpose_nchw_cuda", [1, 24, 64, 64, 64], [24, 24, 3, 3, 3], [1, 1, 1], [1, 1, 1], [0, 0, 0], "float32"], {"i": 14818171327, "t": "", "c": null, "e": [["tile_f", "sp", [-1, 1, 12, 2]], ["tile_d", "sp", [-1, 2, 1, 1]], ["tile_y", "sp", [-1, 2, 1, 1]], ["tile_x", "sp", [-1, 1, 8, 2]], ["tile_rc", "sp", [-1, 1]], ["tile_rd", "sp", [-1, 3]], ["tile_ry", "sp", [-1, 3]], ["tile_rx", "sp", [-1, 3]], ["auto_unroll_max_step", "ot", 512], ["unroll_explicit", "ot", 1]]}], "r": [[0.0010878755, 0.0010878375], 0, 1.6013643741607666, 1578520483.7734694], "v": 0.1}
{"i": ["cuda", "schedule_direct_3d_cuda", [[1, 24, 64, 64, 64], [24, 24, 3, 3, 3], [1, 1, 1], [1, 1, 1], 1], {}, ["schedule_direct_3d_cuda", [1, 24, 64, 64, 64], [24, 24, 3, 3, 3], [1, 1, 1], [1, 1, 1], 1], {"i": 14484187407, "t": "", "c": null, "e": [["tile_f", "sp", [-1, 1, 12, 2]], ["tile_d", "sp", [-1, 4, 1, 1]], ["tile_y", "sp", [-1, 2, 1, 2]], ["tile_x", "sp", [-1, 1, 4, 2]], ["tile_rc", "sp", [-1, 2]], ["tile_rd", "sp", [-1, 1]], ["tile_ry", "sp", [-1, 3]], ["tile_rx", "sp", [-1, 3]], ["auto_unroll_max_step", "ot", 512], ["unroll_explicit", "ot", 1]]}], "r": [[0.00140448975, 0.001401343], 0, 1.3921186923980713, 1578517676.6481943], "v": 0.1}
